Player,Offense,Defense,GP,Name,Squad,Viable
"Dr Pepper",,,449592,HansMF,"Home One, Han's MF, Rebel Y-wing, Bistan's U-wing, Phantom Ghost Cassian's U-wing, Wedge X-wing",1
"Dr Pepper",1,1,139232,JTR,"zzzJTR zzR2-D2 zzBB-8 zRH Finn, zRH Poe",1
"Dr Pepper",0,1,106457,Geonosians,"zzGBA Sun Fac, Geo Soldier, Geo Spy, Poggle",1
"Dr Pepper",0,1,129381,Grievous,"zzGG zB2 zB1 zMagnaGuard zNute",1
"Dr Pepper",1,0,118822,Traya,"zzTraya zDN zSion zzEP Sith Empire Trooper",1
"Dr Pepper",,,110726,Mon Mothma,"zzMon Mothma, Hoth Rebel Scout, zCara Dune, zPao Wedge",1
"Dr Pepper",1,0,123884,Troopers,"zVeers zzPiett zzGideon zDark Trooper, Range Trooper",1
"Dr Pepper",,,130120,Disintegration,"zAurra zzGreef zBoba zzBossk zThe Mandalorian",1
"Dr Pepper",1,1,85657,Ewoks,"zChirpa Elder Paploo Wicket Logray",1
"Dr Pepper",0,1,132849,BH,"zzJango Cad zDengar zIG-88 zNest",1
"Dr Pepper",1,0,134852,501st,"zRex zARC Trooper, zEcho (501st), zzFives zAhsoka",1
"Dr Pepper",,,89687,Iden Troopers,"zIden Versio, Shoretrooper Snowtrooper Magma DT",1
"Dr Pepper",0,1,90415,Phoenix,"Hera zEzra zSabine Zeb zKanan G9",1
"Dr Pepper",1,1,94142,Rogue1,"zJyn Chirrut Baze zCassian zK-2SO",1
"Dr Pepper",1,0,122051,zMaul,"zDarth Maul, zDooku zSidious Savage Sith Marauder",1
"Dr Pepper",,,97116,Bad Batch,"zHunter zEcho Omega G9, zTech zWrecker",0
"Dr Pepper",1,0,71650,Jawas,"Nebit G8, Jawa Engineer, Jawa Scavenger G7, Jawa G9, Dathcha G9",0
