Player,Offense,Defense,GP,Name,Squad,Viable
"QuilaCaz",0,1,74128,Geonosians,"zGBA Sun Fac G9, Geo Soldier, Geo Spy G9, Poggle",1
"QuilaCaz",1,1,115574,zEP,"zzEP zzzVader Tarkin DT Krennic",1
"QuilaCaz",0,1,73438,Phoenix,"Hera Ezra Zeb G8, Kanan G8, Chopper G9",1
"QuilaCaz",,,39708,Phasma,"Phasma G8, FOE 5* G9, FOO 5* G8, KRU 5* G8, Kylo 6* G8",0
"QuilaCaz",1,1,43905,NS_Alt,"MT 5* G8, AV G8, Talia 5* G8, Spirit 6* G8, Daka G9",0
"QuilaCaz",1,0,91368,Troopers,"zVeers zStarck zzPiett zIden Versio 4*, Gideon G9",0
"QuilaCaz",1,0,51268,501st,"Rex G8, Clone Sergeant 5* G8, Echo (501st) G8, Fives G8, Ahsoka G9",0
"QuilaCaz",1,0,48551,Wiggs,"Wedge 5* G8, Biggs G8, Han G9, Fulcrum G4, Leia G8",0
"QuilaCaz",1,1,40690,Rogue1,"Jyn G8, Chirrut 5* G8, Baze 5* G8, Cassian 5* G8, K-2SO G8",0
"QuilaCaz",0,1,64517,BS,"BS G9, GMY G9, Old Ben 5* G9, GK 6* G7, JKA",0
"Savage frenzy",1,0,108358,CLS,"zzCLS zHan zChewbacca R2-D2 G8, zChewpio",1
"Savage frenzy",0,1,95211,Geonosians,"zzGBA Sun Fac, Geo Soldier, Geo Spy, Poggle",1
"Savage frenzy",,,91559,Disintegration,"Aurra G9, zGreef Boba zBossk The Mandalorian G8",1
"Savage frenzy",0,1,114197,FO,"zzKRU zKylo FOE FOO zHux",1
"Savage frenzy",1,1,107021,zEP,"zzEP zzVader Tarkin zSith Trooper, Mara Jade, The Emperor's Hand 4* G9",0
"Savage frenzy",0,1,62295,Phoenix,"Hera G8, Ezra Zeb G8, Kanan G9, Chopper",0
"Kaze no Hi",,,126090,Phasma,"zPhasma zFOTP zSith Trooper, zzKRU zKylo",1
"Kaze no Hi",0,1,97461,Geonosians,"zzGBA Sun Fac, Geo Soldier, Geo Spy, Poggle",1
"Kaze no Hi",0,1,68449,Phoenix,"Hera G8, Ezra Zeb G8, Kanan G8, Chopper G9",1
"Kaze no Hi",1,1,94502,zEP,"zzEP zVader Tarkin Dooku DT",1
"Kaze no Hi",0,1,92669,padme,"zzPadme zGK zJKA zAhsoka Fives G8",1
"Kaze no Hi",1,0,45816,Traya,"Traya G7, DN 6* G8, Sion 5* G7, BSF 2* G7, Thrawn 6* G8",0
"Kaze no Hi",,,51887,Mon Mothma,"Mon Mothma 4* G8, Hoth Rebel Scout G8, Pao G7, Biggs G8, K-2SO G8",0
"Kaze no Hi",1,1,51138,NS_Alt,"MT 6* G8, AV G8, Talia 6* G8, Spirit G8, Daka G8",0
"Kaze no Hi",0,1,73192,BH,"Bossk 4* Cad G8, Greedo G8, Jango Boba G8",0
"Kaze no Hi",1,0,71861,Troopers,"Veers 6* Starck G8, Snowtrooper Magma G9, Iden Versio 6*",0
"Kaze no Hi",,,43703,Bad Batch,"Hunter 5* G9, Echo 4* G9, Omega 5* G8, Tech 4* G8, Wrecker 4* G7",0
"Shepard",0,1,99059,Geonosians,"zzGBA Sun Fac, Geo Soldier, Geo Spy, Poggle",1
"Shepard",1,0,124857,ShaakClones,"zzShaak Ti, zRex Echo (501st), zzFives Clone Sergeant",1
"Shepard",0,1,68615,Phoenix,"Hera Ezra G9, Zeb G9, Kanan G9, Chopper G9",1
"Shepard",0,1,93768,FO,"zzKRU Kylo Phasma zFOTP FOSFTP",1
"Shepard",1,0,105468,QGJ,"zQGJ Aayla JKA zGK Ahsoka",1
"StormBless",0,1,101559,padme,"zPadme GK G9, zJKA Ahsoka zC-3PO",1
"StormBless",0,1,89068,Geonosians,"zGBA Sun Fac, Geo Soldier, Geo Spy, Poggle",1
"StormBless",,,98906,Disintegration,"zAurra zGreef Boba zBossk The Mandalorian G8",1
"StormBless",1,1,84581,Ewoks,"zChirpa Elder Paploo Wicket Logray",1
"StormBless",1,1,119065,zEP,"zEP zzVader Tarkin TFP zTraya",1
"StormBless",1,0,81462,Troopers,"zVeers Starck zPiett Dark Trooper, Snowtrooper",1
"StormBless",0,1,66626,Phoenix,"Hera Ezra G9, Zeb G8, Kanan G8, Chopper G8",1
"StormBless",,,37526,Phasma,"Phasma 5* G8, FOE 5* G8, FOO 5* G8, KRU G8, Kylo 5* G8",0
"StormBless",1,0,95294,CLS,"zzCLS zHan zChewbacca R2-D2 G7, Chewpio 5*",0
"StormBless",,,272904,HansMF,"Home One 6*, Han's MF 6*, HT 6* Ghost 6* Phantom 6* Biggs X-wing, Cassian's U-wing, Wedge X-wing",0
"StormBless",1,1,41161,NS_Alt,"MT 5* G8, AV Talia 5* G8, Spirit 5* G8, Daka 5* G8",0
"StormBless",1,0,44428,Clones,"Cody 5* G8, Rex G8, Echo (501st) G8, Fives G8, Clone Sergeant 5* G8",0
"StormBless",0,1,71368,BH,"Jango Cad G8, zZam Greedo 6* G8, IG-88 G9",0
"StormBless",1,1,43561,Rogue1,"Jyn G8, Chirrut 5* G8, Baze 5* G8, Cassian G8, K-2SO G8",0
"ARCNiNjai",0,1,119612,padme,"zzPadme zGK JKA zAhsoka zC-3PO",1
"ARCNiNjai",0,1,114398,Grievous,"zzGG zB2 zB1 zDroideka MagnaGuard",1
"ARCNiNjai",1,0,87651,Traya,"zzTraya DN zSion Dooku G8, EP",1
"ARCNiNjai",,,80444,Disintegration,"Aurra Greef Boba G8, Bossk The Mandalorian G8",1
"ARCNiNjai",1,1,107694,GAS,"zzzzGAS zRex Echo (501st), zFives ARC Trooper",1
"ARCNiNjai",1,1,92129,Revan Offense,"zzJKR GMY BS zJolee G8, Ezra",1
"ARCNiNjai",1,1,82823,Ewoks,"zChirpa Elder Paploo Wicket Logray",1
"ARCNiNjai",,,81574,Iden Troopers,"zIden Versio, Stormtrooper Snowtrooper Magma DT",1
"ARCNiNjai",0,1,67635,FO,"zKRU Kylo G8, Phasma G8, FOO G8, FOTP",1
"ARCNiNjai",0,1,80492,Geonosians,"zGBA Sun Fac, Geo Soldier, Geo Spy, Poggle G8",0
"ARCNiNjai",1,1,72882,NS,"MT 6* G8, zzAV Daka G8, Zombie 5* Spirit G8",0
"ARCNiNjai",0,1,57929,BH,"Jango G8, Cad G8, Zam G8, Greedo G8, IG-88 G8",0
"ARCNiNjai",0,1,49364,Phoenix,"Hera G8, Sabine 5* G8, Zeb G8, Kanan G8, Chopper G8",0
"ARCNiNjai",1,1,47393,Rogue1,"Jyn G8, Chirrut G8, Baze 6* G8, Cassian G8, K-2SO G8",0
"ARCNiNjai",1,0,8469,NestSolo (Counter),"Nest 6* G4",0
"Drink Some Tea",0,1,91818,Geonosians,"zzGBA Sun Fac, Geo Soldier, Geo Spy, Poggle",1
"Drink Some Tea",0,1,68385,Phoenix,"Hera G9, Ezra Zeb G8, Kanan G8, Chopper G9",1
"Drink Some Tea",,,60180,Phasma,"Phasma G8, FOE FOO G8, KRU G9, Kylo G9",0
"Drink Some Tea",1,1,33161,NS_Alt,"MT 5* G8, AV 5* G8, Talia 5* G8, Spirit 5* G8, Daka 5* G8",0
"Drink Some Tea",1,1,72800,zEP,"EP zVader Tarkin G8, DT 6* G8, Mara Jade, The Emperor's Hand",0
"Drink Some Tea",1,0,38323,501st,"Rex 5* G8, Clone Sergeant 5* G8, Echo (501st) 5* G8, Fives 5* G8, Ahsoka",0
"Drink Some Tea",1,0,39719,Wiggs,"Wedge 5* G8, Biggs 5* G8, Leia G9, Chirrut 5* G8, Baze 5* G8",0
"Drink Some Tea",0,1,77874,BS,"BS GMY Jolee Old Ben G9, JKA G8",0
"Slartibartfast alt",0,1,92339,Geonosians,"zGBA Sun Fac, Geo Soldier, Geo Spy, Poggle",1
"Slartibartfast alt",1,0,86263,501st,"Rex ARC Trooper, Echo (501st), zFives Ahsoka",1
"Slartibartfast alt",1,0,96023,Troopers,"zVeers Starck zzPiett Dark Trooper, Range Trooper",1
"Slartibartfast alt",1,1,65337,Ewoks,"zChirpa G8, Elder Paploo Wicket 6* Logray 5* G8",0
"Slartibartfast alt",1,1,50811,zEP,"EP 6* G9, Vader G7, Tarkin G8, Dooku G7, DT 4* G8",0
"Slartibartfast alt",,,101876,Bad Batch,"zHunter zEcho zzOmega G9, zTech zWrecker",0
"Tommithan",1,1,163639,GL Rey,"zzzzzzRey zzzJTR zzBB-8 zRH Poe, zRH Finn",1
"Tommithan",0,1,78472,Phoenix,"Hera zEzra Sabine G9, Kanan Chopper G9",1
"Tommithan",,,63372,Phasma,"Phasma G7, FOTP G7, FOSFTP G9, FOST 4* G7, zKylo",0
"Tommithan",,,360246,Raddus,"Raddus 5* Sun Fac SF 2*, Rey's Millennium Falcon, Poe Dameron's X-wing, Resistance X-wing, Biggs X-wing 6*, Wedge X-wing 6*, Phantom Ghost 6*",0
"Tommithan",0,1,97530,BH,"Bossk 2* Jango zzGreef Boba zzThe Mandalorian",0
"Tommithan",1,1,90650,zEP,"EP G9, zzVader Tarkin G8, zDooku Sith Trooper",0
"DDC",0,1,92152,Geonosians,"zzGBA Sun Fac, Geo Soldier, Geo Spy, Poggle",1
"DDC",1,0,90091,ShaakClones,"zzShaak Ti G9, Rex Echo (501st), zFives ARC Trooper",1
"DDC",0,1,79422,BH,"zBossk Cad G8, Greedo G8, Jango Boba",1
"DDC",0,1,134839,FO,"zzKRU zKylo FOE zHux zFOST",1
"DDC",0,1,65574,Phoenix,"Hera G8, Ezra Zeb G8, Kanan G8, Chopper G8",1
"DDC",1,0,72975,CLS,"CLS Han Chewbacca R2-D2 G7, Chewpio 3* G8",0
"DDC",,,253225,HansMF,"Home One 6*, Han's MF 5*, HT Ghost 6* Phantom 6* Biggs X-wing, Cassian's U-wing, Wedge X-wing",0
"DDC",0,1,48331,Grievous,"GG 6* G9, B2 G7, Droideka G7, MagnaGuard G8, IG-88 6* G8",0
"DDC",1,0,60666,Traya,"Traya 6* G8, DN 5* G8, Sion G6, EP Thrawn G7",0
"DDC",1,1,44282,NS_Alt,"MT 6* G8, AV 5* G8, Talia 6* G9, Spirit 6* G8, Daka",0
"DDC",1,1,59069,Ewoks,"Chirpa 4* G9, Elder G8, Paploo G9, Wicket 4* G8, Logray G9",0
"DDC",1,0,43409,Wiggs,"Wedge 5* G8, Biggs G8, Leia G8, Chirrut 5* G8, Baze 5* G8",0
"DDC",0,1,56940,BS,"BS 5* G8, GMY JKA 5* G8, GK G7, Ahsoka G9",0
"NNMSdabber",1,1,127834,JTR,"zJTR R2-D2 zBB-8 zRH Finn, zRH Poe",1
"NNMSdabber",0,1,60393,Phoenix,"Hera G8, Ezra G8, Zeb G8, Kanan G9, Chopper G8",1
"NNMSdabber",,,53742,Phasma,"Phasma G8, FOE G9, FOO G9, KRU G8, Kylo G9",0
"NNMSdabber",0,1,75851,Geonosians,"zGBA Sun Fac G7, Geo Soldier, Geo Spy, Poggle G8",0
"NNMSdabber",0,1,70421,BS,"BS GMY JKA 3* G9, GK G8, Ahsoka",0
"Geekytiger",0,1,91536,Geonosians,"zzGBA Sun Fac, Geo Soldier, Geo Spy, Poggle",1
"Geekytiger",0,1,119999,FO,"zzKRU zKylo FOE FOO FOST",1
"Geekytiger",0,1,69394,Phoenix,"Hera Ezra G9, Zeb G9, Kanan G8, Chopper G9",1
"Geekytiger",1,0,17842,SionSolo (Counter),"Sion",1
"Geekytiger",1,1,39804,NS_Alt,"MT 5* G8, AV G8, Talia 5* G8, Spirit 5* G8, Daka G8",0
"Geekytiger",1,1,78138,zEP,"EP zVader Tarkin TFP G8, Sith Trooper",0
"Geekytiger",0,1,81594,BH,"Bossk Cad G9, Greedo G8, Jango G8, Boba",0
"Geekytiger",1,0,49076,501st,"Rex G8, Clone Sergeant 5* G8, Echo (501st) G8, Fives G8, Ahsoka G8",0
"Geekytiger",1,0,52330,Wiggs,"Wedge 6* G8, Biggs G8, CLS G3, Han G7, Leia G8",0
"Geekytiger",1,1,40202,Rogue1,"Jyn 5* G8, Chirrut 5* G8, Baze 5* G8, Cassian G8, K-2SO G8",0
"loypop13",,,176168,JMK,"zzzzzzJMK zAhsoka zzzCAT zzzzGAS zGK",1
"loypop13",,,170406,LV,"zzzzzzLord Vader, zzPiett zzzMaul zRG zzzVader",1
"loypop13",,,163340,SEE,"zzzzzzSEE zBSF zzMalak zzzDR zDooku",1
"loypop13",1,1,106431,NS,"zzMT zzAV zDaka Zombie Spirit",1
"loypop13",,,593162,Executor,"Executor HT RC Xanadu Blood, Slave I, IG-2000 Imperial TIE Fighter, Tie Adv",1
"loypop13",1,0,143865,CLS,"zzzCLS zHan zzChewbacca zzC-3PO zChewpio",1
"loypop13",,,516109,Negotiator,"Negotiator BTL-B Y-wing, Anakin's Eta-2, Rex's ARC-170, Umbaran SF, Ahsoka's SF, Plo's SF, Clone Sergeant's ARC-170",1
"loypop13",,,307898,Malevolence,"Malevolence Hyena Bomber, Vulture Droid, Sun Fac SF, Soldier SF, Spy SF",1
"loypop13",,,139995,JKL,"zzJKL zzzJKR zzHYoda zOld Ben, Aayla",1
"loypop13",,,427313,HansMF,"Home One, Han's MF, Rebel Y-wing, Bistan's U-wing, Phantom Biggs X-wing, Cassian's U-wing, Wedge X-wing",1
"loypop13",0,1,96788,Geonosians,"zzGBA Sun Fac, Geo Soldier, Geo Spy, Poggle",1
"loypop13",0,1,137478,Grievous,"zzGG zB2 zB1 MagnaGuard zNute",1
"loypop13",1,0,116548,Traya,"zzTraya zDN zSion Sith Empire Trooper, zzThrawn",1
"loypop13",1,1,120963,JTR,"zzzJTR Scav Rey, zBB-8 zzR2-D2 RT",1
"loypop13",,,106745,Mon Mothma,"zzMon Mothma, Baze Chirrut Biggs Wedge",1
"loypop13",1,1,80499,Ewoks,"zChirpa G9, Elder Paploo Wicket Logray G9",1
"loypop13",1,0,150568,ShaakClones,"zzShaak Ti, zRex zEcho (501st), zzFives zARC Trooper",1
"loypop13",0,1,151583,BH,"zzBossk zZam Dengar zzJango zBoba",1
"loypop13",1,1,93545,Carth,"zCarth Onasi, zMission zZaalbar Juhani G9, zCanderous",1
"loypop13",1,0,113127,Troopers,"zVeers zStarck zDark Trooper, DT zzGideon",1
"loypop13",0,1,90213,FO,"zKRU Kylo FOE FOO zHux",1
"loypop13",0,1,73866,Phoenix,"Hera Ezra Sabine Zeb G8, Kanan G8",1
"loypop13",1,0,120883,EP (Counter, Rebel),"zzEP Shoretrooper Krennic zzWampa zNest",1
"loypop13",1,0,60676,Jawas,"Nebit G8, Jawa Engineer G9, Jawa Scavenger G9, Jawa G8, Dathcha G8",1
"loypop13",,,70849,Admiral Raddus,"Admiral Raddus 3* G9, Cassian Jyn K-2SO G8, Bistan G9",0
"Silent",,,123076,Phasma,"zPhasma zFOTP FOSFTP zFOST zKylo",1
"Silent",1,1,147306,SL Kylo,"zzzzzzSL Kylo, zSith Trooper, zHux zzKRU Thrawn",1
"Silent",0,1,122718,padme,"zzPadme zGK zJKA zAhsoka zzC-3PO",1
"Silent",0,1,118635,DRMalak,"zzzDR zzHK-47 zBSF zzMalak Sith Empire Trooper",1
"Silent",0,1,97849,Geonosians,"zzGBA Sun Fac, Geo Soldier, Geo Spy, Poggle",1
"Silent",,,355936,HansMF,"Home One, Han's MF, HT Ghost Phantom Biggs X-wing, Cassian's U-wing, Wedge X-wing",1
"Silent",0,1,115856,Grievous,"zGG G9, zB2 zB1 zDroideka zMagnaGuard",1
"Silent",1,1,77055,JTR,"zJTR Scav Rey G9, BB-8 G9, R2-D2 G8, Finn G9",1
"Silent",1,1,118260,GAS,"zzzzGAS zRex zEcho (501st), zzFives zARC Trooper",1
"Silent",1,1,122650,Revan Offense,"zzzJKR zzGMY zBS zJolee Ezra",1
"Silent",1,1,88896,Ewoks,"zChirpa Elder Paploo zWicket Logray",1
"Silent",0,1,118091,BH,"zzBossk zDengar Jango zBoba zThe Mandalorian",1
"Silent",1,1,93201,Carth,"zCarth Onasi, zMission Zaalbar Juhani zCanderous",1
"Silent",1,1,118554,zEP,"zzEP zzzVader Tarkin TFP zMara Jade, The Emperor's Hand",1
"Silent",0,1,66063,Phoenix,"Hera G8, Sabine G8, Zeb G8, Kanan G8, Chopper G9",1
"Silent",1,0,15207,SionSolo (Counter),"Sion G9",1
"Silent",1,1,81436,NS,"MT G8, zzAV Daka Zombie Spirit G8",0
"Silent",1,0,74027,Troopers,"Veers G9, zzPiett Gideon G8, Dark Trooper G7, Range Trooper G7",0
"Silent",1,0,61618,zMaul,"Darth Maul G8, Sidious G8, Dooku G9, Sith Marauder G8, Nest G7",0
"Silent",1,0,86264,Wiggs,"Wedge G8, Biggs G8, zzzCLS zHan Chewbacca G9",0
"Silent",,,61944,Iden Troopers,"zIden Versio 6* G9, Stormtrooper G8, Snowtrooper G8, Magma G7, DT G8",0
"Silent",1,1,67142,Rogue1,"Jyn G9, Chirrut G8, Baze 6* G8, Cassian G8, K-2SO G9",0
"Silent",1,0,48753,Jawas,"Nebit G6, Jawa Engineer G7, Jawa Scavenger G5, Jawa 6* G5, Dathcha G7",0
"BenBen",0,1,93840,Geonosians,"zzGBA Sun Fac, Geo Soldier, Geo Spy, Poggle",1
"BenBen",0,1,101835,FO,"zKRU Kylo FOE FOO zHux",1
"BenBen",0,1,68518,Phoenix,"Hera Ezra Zeb G9, Kanan G9, Chopper G9",1
"BenBen",0,1,84710,BS,"zBS GMY G9, zJolee GK G9, Ahsoka",1
"BenBen",1,1,75133,zEP,"EP zVader Tarkin G7, Sith Trooper, Mara Jade, The Emperor's Hand 5*",0
"Darth1 Daddy",1,1,154950,SL Kylo,"zzzzzzSL Kylo, zSith Trooper, zHux zzKRU zThrawn",1
"Darth1 Daddy",,,248316,HansMF,"Home One, Han's MF 5*, Rebel Y-wing, Ghost Phantom Biggs X-wing, Cassian's U-wing, Wedge X-wing",1
"Darth1 Daddy",1,1,141102,JTR,"zzzJTR zzR2-D2 zzBB-8 zRH Finn, zRH Poe",1
"Darth1 Daddy",1,1,97206,Revan,"zzzJKR BS G8, zGMY zJolee GK",1
"Darth1 Daddy",1,1,128901,zEP,"zzEP zzzVader zTarkin Krennic TFP",1
"Darth1 Daddy",0,1,66556,Phoenix,"Hera G8, Ezra G9, Zeb G8, Kanan G8, Chopper G9",1
"Darth1 Daddy",,,116313,Phasma,"Phasma FOTP FOSFTP zFOST zKylo",0
"Darth1 Daddy",0,1,80783,Geonosians,"zzGBA Sun Fac G8, Geo Soldier, Geo Spy, Poggle G9",0
"Darth1 Daddy",,,72650,Nute-OR,"Nute G7, zDooku Jango G8, Zaalbar G9, Mission G8",0
"Darth1 Daddy",0,1,69586,BH,"Bossk Cad G8, Greedo G8, Dengar G9, Boba G9",0
"Darth1 Daddy",1,0,98617,Troopers,"zVeers zStarck zzPiett zDark Trooper G9, Range Trooper G1",0
"Darth1 Daddy",1,0,8476,NestSolo (Counter),"Nest 6* G6",0
"Dimitris",0,1,85754,Geonosians,"zGBA Sun Fac, Geo Soldier, Geo Spy, Poggle",1
"Dimitris",,,57019,Phasma,"Phasma G8, FOE 5* FOO KRU 6* Kylo 6* G8",0
"Dimitris",1,1,35516,NS_Alt,"MT 5* G9, AV 5* G8, Talia 5* G8, Spirit 5* G8, Daka 5*",0
"Dimitris",1,1,92707,zEP,"zEP zzzVader Tarkin DN 5* G8, Mara Jade, The Emperor's Hand 4* G9",0
"Dimitris",1,0,42920,501st,"Rex 5* G8, Clone Sergeant 5* G8, Echo (501st) 5* G8, Fives 5* G8, Ahsoka",0
"Dimitris",1,0,38913,Wiggs,"Wedge 5* G8, Biggs 5* G8, Leia G8, Chirrut 5* G8, Baze 5* G8",0
"Dimitris",0,1,32925,Phoenix,"Hera 5* G8, Sabine 5* G8, Zeb 5* G8, Kanan 5* G8, Chopper 5* G8",0
"Dimitris",0,1,58301,BS,"BS 6* GMY 6* JKA 5* G8, Old Ben, Ezra 5* G8",0
"TyTy19石头",,,167754,JMK,"zzzzzzJMK zJKA zGMY zzShaak Ti, zGK",1
"TyTy19石头",,,473272,Negotiator,"Negotiator HT Anakin's Eta-2, Umbaran SF, Ahsoka's SF, Clone Sergeant's ARC-170, Plo's SF, Rex's ARC-170",1
"TyTy19石头",0,1,120521,DR,"zzDR HK-47 zBSF Sith Marauder, Thrawn",1
"TyTy19石头",0,1,90135,Geonosians,"zzGBA Sun Fac, Geo Soldier, Geo Spy, Poggle",1
"TyTy19石头",0,1,117011,Grievous,"zzGG zB2 Droideka MagnaGuard Dooku",1
"TyTy19石头",1,1,93697,Ewoks,"zChirpa Elder zPaploo Teebo zLogray",1
"TyTy19石头",0,1,134891,BH,"zBossk Dengar Jango IG-88 Boba",1
"TyTy19石头",1,1,131748,zEP,"zzEP zzVader Tarkin Krennic TFP",1
"TyTy19石头",1,0,135803,Troopers,"zVeers Starck zzPiett zDark Trooper, Gideon",1
"TyTy19石头",0,1,63052,Phoenix,"Hera G8, Ezra Zeb G8, Kanan G8, Chopper G9",1
"TyTy19石头",1,0,18763,NestSolo (Counter),"zNest",1
"TyTy19石头",,,41776,Phasma,"Phasma G8, FOE 5* G8, FOO G8, KRU 5* G8, Kylo 5* G8",0
"TyTy19石头",1,0,94629,CLS,"zzCLS zHan zChewbacca zC-3PO G8, Chewpio 6* G8",0
"TyTy19石头",,,265094,Malevolence,"Malevolence Hyena Bomber 4*, Vulture Droid 5*, Sun Fac SF 5*, Soldier SF, Spy SF",0
"TyTy19石头",,,263758,HansMF,"Home One, Han's MF, Rebel Y-wing 4*, Bistan's U-wing 5*, Phantom Ghost Cassian's U-wing, Biggs X-wing",0
"TyTy19石头",1,1,63217,NS,"MT G8, AV Daka G9, Zombie 6* Spirit G8",0
"TyTy19石头",,,62392,Mon Mothma,"zMon Mothma 5* G8, Baze G8, Hoth Rebel Scout G8, Cara Dune G9, Biggs G8",0
"TyTy19石头",1,1,61332,Carth,"Carth Onasi G9, Mission G8, Zaalbar G7, Juhani G7, Canderous G7",0
"TyTy19石头",1,0,99074,501st,"zRex Clone Sergeant, Echo (501st) G8, Fives G8, zAhsoka",0
"TyTy19石头",1,0,45889,Jawas,"Nebit 6* G6, Jawa Engineer 6* G7, Jawa Scavenger G8, Jawa 6* G6, Dathcha G7",0
"markyjseph",1,1,133333,SL Kylo,"zzzzzSL Kylo, zSith Trooper, zHux zzKRU Thrawn",1
"markyjseph",0,1,91568,Geonosians,"zzGBA Sun Fac, Geo Soldier, Geo Spy, Poggle",1
"markyjseph",1,1,97356,Revan Offense,"zzJKR zGMY BS zJolee Ezra",1
"markyjseph",0,1,97574,BH,"zBossk Cad IG-88 Boba The Mandalorian",1
"markyjseph",,,119622,Phasma,"Phasma zFOTP FOSFTP zFOST zKylo",0
"markyjseph",,,280599,HansMF,"Home One, Han's MF 5*, HT Ghost Phantom Biggs X-wing, Cassian's U-wing, Wedge X-wing",0
"markyjseph",,,53188,Nute-OR,"Nute G4, Dooku 5* G8, Jango G9, Zaalbar G7, Mission G6",0
"markyjseph",1,1,33161,NS_Alt,"MT 5* G8, AV 5* G8, Talia 5* G8, Spirit 5* G8, Daka 5* G8",0
"markyjseph",1,1,103015,zEP,"zzEP zzzVader Tarkin DN 5* G8, zMara Jade, The Emperor's Hand G9",0
"markyjseph",1,0,39155,501st,"Rex 5* G8, Clone Sergeant 5* G8, Echo (501st) 5* G8, Fives 5* G8, Ahsoka G8",0
"markyjseph",0,1,64795,Phoenix,"Hera Sabine 5* G9, Zeb G8, Kanan G8, Chopper G8",0
"markyjseph",1,0,45640,Wiggs,"Wedge 5* G8, Biggs Leia G8, Chirrut 5* G8, Baze 5* G8",0
"Stryker",1,0,113960,CLS,"zzzCLS zHan zzChewbacca zzC-3PO zChewpio",1
"Stryker",0,1,106341,Geonosians,"zzGBA Sun Fac, Geo Soldier, Geo Spy, Poggle",1
"Stryker",,,102749,Disintegration,"zzAurra zGreef Boba zzBossk The Mandalorian",1
"Stryker",1,1,120765,Revan,"zzzJKR BS zGMY zJolee zGK",1
"Stryker",1,1,88886,Ewoks,"zChirpa Elder Paploo zWicket Logray",1
"Stryker",1,1,104515,zEP,"zzEP zzVader Tarkin TFP zMara Jade, The Emperor's Hand 5*",1
"Stryker",0,1,122474,FO,"zzKRU zKylo FOE zHux zFOST",1
"Stryker",0,1,77417,Phoenix,"Hera G9, Ezra Zeb Kanan Chopper",1
"Stryker",1,0,72111,Traya,"zTraya G8, DN 5* G8, Sion G7, BSF zThrawn",0
"Stryker",0,1,49964,Grievous,"GG G7, B2 G7, Droideka G8, MagnaGuard G7, T3-M4 G7",0
"Stryker",1,1,54899,Carth,"Carth Onasi G8, Mission G8, Zaalbar G9, Juhani 3* G7, Canderous G8",0
"Stryker",1,0,77755,ShaakClones,"Shaak Ti G9, zRex Echo (501st) G9, zzFives ARC Trooper",0
"Alastor",,,184647,JMK,"zzzzzzJMK zAhsoka zzzCAT zzzzGAS zGK",1
"Alastor",,,188257,LV,"zzzzzzLord Vader, zzPiett zzzMaul zRG zzzVader",1
"Alastor",,,425341,Profundity,"Profundity Han's MF, Outrider Rebel Y-wing, Cassian's U-wing, Biggs X-wing",1
"Alastor",,,168739,SEE,"zzzzzzSEE zBSF zzMalak zzzDR zDooku",1
"Alastor",0,1,117990,Qira,"zQira zL3-37 zVandor Chewbacca, zMission zZaalbar",1
"Alastor",1,1,163199,GL Rey,"zzzzzzRey zzzJTR zzBB-8 zHoldo zRH Finn",1
"Alastor",,,148379,SK,"zzEP zzMara Jade, The Emperor's Hand, zzStarkiller zzOld Ben, zVisas",1
"Alastor",1,1,109337,NS,"zzMT zzAV zDaka Zombie Spirit",1
"Alastor",,,608934,Executor,"Executor HT RC Xanadu Blood, Slave I, IG-2000 Imperial TIE Fighter, Tie Adv",1
"Alastor",,,158420,JMLS,"zBS zzzzzzJMLS zWat Tambor, zzJKL zJolee",1
"Alastor",1,0,144183,CLS,"zzzCLS zHan zzChewbacca zzC-3PO zChewpio",1
"Alastor",,,528288,Negotiator,"Negotiator BTL-B Y-wing, Anakin's Eta-2, Rex's ARC-170, Umbaran SF, Ahsoka's SF, Plo's SF, Clone Sergeant's ARC-170",1
"Alastor",,,307904,Malevolence,"Malevolence Hyena Bomber, Vulture Droid, Sun Fac SF, Soldier SF, Spy SF",1
"Alastor",0,1,96988,Geonosians,"zzGBA Sun Fac, Geo Soldier, Geo Spy, Poggle",1
"Alastor",0,1,132922,Grievous,"zzGG zB2 zB1 zMagnaGuard zNute",1
"Alastor",1,0,127876,Traya,"zzTraya zzDN zSion Sith Empire Trooper, zzThrawn",1
"Alastor",,,120027,Mon Mothma,"zzMon Mothma, Scarif Hoth Rebel Scout, zCara Dune, zPao",1
"Alastor",1,1,80706,Ewoks,"zChirpa G9, Elder Paploo Wicket Logray",1
"Alastor",1,0,151637,ShaakClones,"zzShaak Ti, zRex zEcho (501st), zzFives zARC Trooper",1
"Alastor",0,1,154183,BH,"zzBossk zZam zDengar zJango zBoba",1
"Alastor",1,0,121931,Troopers,"zVeers zStarck zDark Trooper, zIden Versio, zGideon",1
"Alastor",0,1,108176,FO,"zzKRU zKylo FOE zHux zFOST",1
"Alastor",0,1,76078,Phoenix,"Hera Ezra G8, Sabine G8, Zeb G8, Kanan G8",1
"Alastor",1,1,102902,Rogue1,"zJyn Chirrut G8, Baze G8, zCassian K-2SO",1
"Alastor",,,128225,Mando,"zzThe Mandalorian (Beskar Armor), zDash Rendar, zNest zIG-11 zKuiil",1
"Economist",0,1,88699,Geonosians,"zGBA Sun Fac, Geo Soldier, Geo Spy, Poggle",1
"Economist",0,1,91305,BH,"zBossk Cad Dengar G9, Jango Boba",1
"Economist",1,1,91558,zEP,"zEP zzVader Tarkin DT G8, zSith Trooper",1
"Economist",0,1,95616,FO,"zzKRU Kylo FOE G9, FOO FOST",1
"Economist",0,1,63963,Phoenix,"Hera G8, Ezra Zeb G8, Kanan G8, Chopper G8",1
"Economist",1,0,83932,CLS,"zzCLS zHan zChewbacca 6* R2-D2 G8, Chewpio 5* G8",0
"Economist",1,1,33161,NS_Alt,"MT 5* G8, AV 5* G8, Talia 5* G8, Spirit 5* G8, Daka 5* G8",0
"Economist",1,0,38894,501st,"Rex 5* G8, Clone Sergeant 5* G8, Echo (501st) 5* G8, Fives 5* G8, Ahsoka G8",0
"Economist",1,0,38918,Wiggs,"Wedge 5* G8, Biggs 5* G8, Leia G8, Chirrut 5* G8, Baze 5* G8",0
"Wiz Kalifa",,,123702,Phasma,"zPhasma zFOTP FOSFTP zFOST zKylo",1
"Wiz Kalifa",0,1,87750,Geonosians,"zzGBA Sun Fac G9, Geo Soldier, Geo Spy, Poggle",1
"Wiz Kalifa",1,1,117765,zEP,"zzEP zzzVader Tarkin G9, TFP G9, zSith Trooper",1
"Wiz Kalifa",1,0,73662,Troopers,"zVeers 6* zzPiett 4* Gideon Dark Trooper 5* G9, Range Trooper 4* G8",0
"Wiz Kalifa",,,53670,Nute-OR,"Nute G5, Dooku 5* G8, Jango G9, Zaalbar 4* Mission 4*",0
"Wiz Kalifa",,,41676,Mon Mothma,"Mon Mothma 5* G7, Baze 6* G8, Hoth Rebel Scout G8, Chirrut 5* G8, Jyn 5* G8",0
"Wiz Kalifa",1,1,36931,NS_Alt,"MT 6* G8, AV 6* G8, Talia 5* G8, Spirit 5* G8, Daka 5* G8",0
"Wiz Kalifa",0,1,67845,BH,"Bossk 5* Greedo G8, Greef 4* Boba Fennec Shand 4* G9",0
"Wiz Kalifa",1,0,53503,501st,"Rex G9, Clone Sergeant 6* G8, Echo (501st) 5* G8, Fives G8, Ahsoka",0
"Wiz Kalifa",1,0,66880,Wiggs,"Wedge 5* G8, Biggs 5* G8, zzCLS Han Leia G9",0
"Wiz Kalifa",0,1,66052,BS,"zBS 5* GMY 6* Jolee 2* GK G8, JKA 5* G8",0
"Wiz Kalifa",0,1,32885,Phoenix,"Hera 5* G8, Ezra 5* G8, Sabine 5* G8, Kanan 5* G8, Chopper 5* G8",0
"CT 2905",0,1,77294,Geonosians,"GBA Sun Fac G9, Geo Soldier, Geo Spy, Poggle",1
"CT 2905",0,1,68436,Phoenix,"Hera G9, Ezra G9, Sabine Kanan G8, Chopper G8",1
"CT 2905",0,1,113443,padme,"zzPadme zGK 6* zJKA zAhsoka Barriss",0
"CT 2905",1,0,60618,CLS,"zCLS Han G5, Chewbacca 5* G9, R2-D2 G7, Chewpio 5* G7",0
"CT 2905",0,1,63798,Grievous,"GG 6* G8, B2 B1 3* G4, zMagnaGuard Nute G9",0
"CT 2905",1,0,92966,ShaakClones,"zShaak Ti 5* G9, zRex Echo (501st) G9, zFives ARC Trooper",0
"CT 2905",1,1,64420,Ewoks,"Chirpa 6* G7, Elder Paploo G9, Teebo G5, Wicket 4*",0
"CT 2905",0,1,71965,BH,"Bossk 4* G9, Zam G6, Jango Boba The Mandalorian G8",0
"CT 2905",1,1,62989,zEP,"EP G8, zVader Tarkin G7, BSF 4* G9, Mara Jade, The Emperor's Hand 5* G9",0
"CT 2905",,,123550,Bad Batch,"zHunter zEcho zzOmega G9, zTech zWrecker",0
"Hizashi Hyuga",0,1,89620,Geonosians,"zGBA Sun Fac, Geo Soldier, Geo Spy, Poggle",1
"Hizashi Hyuga",,,84837,Disintegration,"Aurra Greef Boba G8, zzBossk The Mandalorian G9",1
"Hizashi Hyuga",1,0,104039,CLS,"zzCLS zHan zzChewbacca R2-D2 G7, Chewpio",0
"Hizashi Hyuga",0,1,80619,BS,"BS G9, GMY Jolee G8, GK 6* zAhsoka",0
"Darkwizard126",1,1,141935,SL Kylo,"zzzzzzSL Kylo, Sith Trooper, zHux zzKRU Thrawn",1
"Darkwizard126",0,1,93464,Geonosians,"zzGBA Sun Fac, Geo Soldier, Geo Spy, Poggle",1
"Darkwizard126",1,1,94316,Revan Offense,"zzzJKR GMY BS Jolee Ezra",1
"Darkwizard126",0,1,89824,BH,"zBossk zZam Greef Boba zThe Mandalorian",1
"Darkwizard126",1,0,12994,SionSolo (Counter),"Sion G8",1
"Darkwizard126",,,122271,Phasma,"zPhasma zFOTP FOSFTP zFOST zKylo",0
"Darkwizard126",1,0,78548,CLS,"zCLS zHan zChewbacca R2-D2 G7, Chewpio 4* G8",0
"Darkwizard126",,,229849,HansMF,"Home One 5*, Han's MF, HT Ghost 5* Phantom 5* Biggs X-wing 5*, Cassian's U-wing, Wedge X-wing 5*",0
"Darkwizard126",1,0,60925,Troopers,"Veers 6* zPiett 5* G9, Gideon 5* G9, Dark Trooper 5* G9, Range Trooper 4* G9",0
"Darkwizard126",1,1,35030,NS_Alt,"MT 5* G8, AV 5* G8, Talia 5* G8, Spirit 5* G8, Daka 6* G9",0
"Darkwizard126",1,0,37936,ShaakClones,"Shaak Ti 6* G8, Rex 5* G8, Echo (501st) 5* G8, Fives 5* G8, Clone Sergeant 5* G8",0
"Darkwizard126",1,1,108973,zEP,"EP zzVader Tarkin G9, zzTraya DN",0
"Darkwizard126",0,1,55690,Phoenix,"Hera G8, Sabine 5* G8, Zeb G8, Kanan G8, Chopper G8",0
"Darkwizard126",1,0,38098,Wiggs,"Wedge 5* G8, Biggs 5* G8, Leia G8, Chirrut 5* G8, Baze 5* G8",0
"BD 1",0,1,103118,Geonosians,"zzGBA Sun Fac, Geo Soldier, Geo Spy, Poggle",1
"BD 1",1,0,81121,501st,"Rex ARC Trooper, Echo (501st), Fives Ahsoka",1
"BD 1",0,1,80519,Phoenix,"Hera Ezra Zeb Kanan Chopper",1
"BD 1",1,1,75578,zEP,"EP zzVader Tarkin G9, DN 5* G8, Mara Jade, The Emperor's Hand 5*",0
"BD 1",0,1,79597,BS,"zBS GMY HYoda G9, GK 6* JKA 6*",0
"IMAC1780",1,1,144934,SL Kylo,"zzzzzzSL Kylo, zSith Trooper, zHux zzKRU Thrawn",1
"IMAC1780",0,1,93311,Geonosians,"zzGBA Sun Fac, Geo Soldier, Geo Spy, Poggle",1
"IMAC1780",1,0,96364,Traya,"zzTraya DN Sion Dooku G8, EP",1
"IMAC1780",1,1,87294,Ewoks,"zChirpa Elder Paploo Wicket Logray",1
"IMAC1780",0,1,86402,BH,"zBossk Cad Dengar G9, Jango G9, Boba",1
"IMAC1780",0,1,68788,Phoenix,"Hera Ezra G9, Zeb G8, Kanan G8, Chopper G8",1
"IMAC1780",,,123358,Phasma,"zPhasma zFOTP FOSFTP zFOST zKylo",0
"IMAC1780",1,0,98084,CLS,"zCLS zHan zChewbacca C-3PO Chewpio",0
"IMAC1780",,,288819,HansMF,"Home One, Han's MF 5*, HT Ghost Phantom Biggs X-wing, Cassian's U-wing, Wedge X-wing",0
"IMAC1780",1,1,78604,NS,"MT G8, AV G8, zDaka Zombie Spirit G8",0
"IMAC1780",0,1,81737,Grievous,"zGG B2 Droideka G9, MagnaGuard T3-M4 G9",0
"IMAC1780",1,1,56190,JTR,"JTR G7, Scav Rey G8, BB-8 G8, R2-D2 G8, Finn G8",0
"IMAC1780",1,0,87008,ShaakClones,"Shaak Ti, Rex Echo (501st), Fives ARC Trooper",0
"IMAC1780",1,0,57555,Troopers,"Veers 5* G8, Starck G7, Stormtrooper G8, DT G8, Gideon G9",0
