Player,Offense,Defense,GP,Name,Squad,Viable
"IMAC1780",1,1,42263,Rogue1,"Jyn 6* G8, Chirrut 5* G8, Baze 6* G8, Cassian G8, K-2SO G8",0
"IMAC1780",0,1,71408,BS,"BS GMY Jolee 5* G9, GK G7, Ahsoka G8",0
"Jeager",1,0,97573,CLS,"zzCLS zHan zChewbacca R2-D2 G9, zChewpio",1
"Jeager",0,1,94189,DR,"zzzDR HK-47 BSF Sith Marauder, Thrawn G9",1
"Jeager",,,112744,Disintegration,"Aurra zGreef Boba zzBossk The Mandalorian",1
"Jeager",0,1,76655,FO,"zzKRU Kylo G9, Phasma G9, FOE G9, FOO G8",1
"Jeager",0,1,60791,Phoenix,"Hera G9, Ezra G9, Zeb G8, Kanan G8, Chopper G9",1
"Jeager",,,202066,HansMF,"Home One 6*, Han's MF 6*, Rebel Y-wing 4*, Ghost 5* Phantom 5* Biggs X-wing 5*, Cassian's U-wing, Wedge X-wing 5*",0
"Jeager",1,0,100187,Troopers,"zVeers zzPiett zGideon Dark Trooper, Range Trooper 6* G9",0
"Jeager",1,1,33354,NS_Alt,"MT 5* G8, AV 5* G8, Talia 5* G8, Spirit 5* G8, Daka 5* G8",0
"Jeager",1,0,47915,ShaakClones,"Shaak Ti 4* G7, Rex G8, Echo (501st) G8, Fives G8, Clone Sergeant 5* G8",0
"Jeager",1,1,105629,zEP,"zEP zzVader Tarkin TFP zMara Jade, The Emperor's Hand 5*",0
"Jeager",,,72182,Iden Troopers,"zIden Versio 4*, Stormtrooper G8, Snowtrooper G9, Magma G9, DT",0
"Jeager",0,1,99794,BH,"Jango G9, Cad zZam Dengar IG-88",0
"Jeager",1,0,38746,Wiggs,"Wedge 5* G8, Biggs 5* G8, Leia G9, Chirrut 5* G8, Baze 5* G8",0
"Jeager",0,1,87637,BS,"BS G9, zzGMY JKA zGK 6* zAhsoka",0
"Merc",0,1,88947,Geonosians,"zGBA Sun Fac, Geo Soldier, Geo Spy, Poggle",1
"Merc",1,1,92260,Revan,"zzzJKR BS GMY zJolee GK",1
"Merc",1,1,111892,zEP,"zEP zzzVader Tarkin DT TFP",1
"Merc",0,1,63944,Phoenix,"Hera G9, Ezra G9, Zeb G9, Kanan G9, Chopper G8",1
"Merc",1,0,76364,CLS,"CLS zHan Chewbacca 5* R2-D2 G8, Chewpio 4*",0
"Merc",1,0,86041,Troopers,"zVeers zPiett Gideon Dark Trooper 4* G9, Range Trooper 4*",0
"Merc",,,56325,Disintegration,"Aurra 5* G9, Greef 5* G8, Boba G8, Bossk 4* The Mandalorian 5* G8",0
"Merc",1,1,41310,Ewoks,"Chirpa 3* G8, Elder G8, Paploo G7, Teebo G6, Scout G6",0
"Merc",1,0,45001,501st,"Rex G6, Clone Sergeant G6, Echo (501st) G7, Fives G8, Ahsoka G8",0
"Merc",0,1,65181,BH,"Jango 6* Cad G9, zZam G9, IG-88 G8, Fennec Shand 3* G8",0
"PirateFTW",,,128180,Phasma,"zPhasma zFOTP FOSFTP zFOST zKylo",1
"PirateFTW",1,1,142544,SL Kylo,"zzzzzzSL Kylo, zSith Trooper, zHux zzKRU Thrawn G9",1
"PirateFTW",0,1,103764,DR,"zzzDR zzHK-47 zBSF Sith Empire Trooper, Sith Assassin",1
"PirateFTW",0,1,82671,Geonosians,"zGBA Sun Fac G9, Geo Soldier, Geo Spy G9, Poggle",1
"PirateFTW",,,314541,HansMF,"Home One, Han's MF, HT Ghost Phantom Biggs X-wing, Cassian's U-wing, Wedge X-wing",1
"PirateFTW",1,1,105906,Revan Offense,"zzzJKR zGMY zBS zJolee JKA",1
"PirateFTW",1,1,101986,Carth,"zCarth Onasi, zMission zZaalbar zJuhani zCanderous",1
"PirateFTW",1,1,103444,zEP,"zEP zzzVader Tarkin TFP G9, DN",1
"PirateFTW",1,0,83734,Troopers,"zVeers Starck zPiett DT Gideon",1
"PirateFTW",1,0,16465,NestSolo (Counter),"Nest",1
"PirateFTW",1,0,18634,SionSolo (Counter),"zSion",1
"PirateFTW",1,0,80385,CLS,"zzCLS Han Chewbacca G9, R2-D2 G8, Chewpio",0
"PirateFTW",1,1,76734,NS,"MT 6* G8, AV G9, zDaka Zombie Spirit G8",0
"PirateFTW",,,80243,Disintegration,"Aurra 4* G8, Greef Boba Bossk The Mandalorian",0
"PirateFTW",1,1,61257,Ewoks,"Chirpa 6* G9, Elder G8, Paploo G9, Wicket 6* Logray G9",0
"PirateFTW",1,0,62258,Wiggs,"Wedge G8, Biggs G8, Ezra C-3PO 5* G8, Leia G8",0
"PirateFTW",0,1,72356,BH,"Jango G8, Cad IG-88 G8, Fennec Shand G9, Embo 5* G8",0
"PirateFTW",0,1,55793,Phoenix,"Hera G8, Sabine 5* G8, Zeb G7, Kanan G8, Chopper G8",0
"PirateFTW",,,65258,Bad Batch,"zHunter 5* zEcho 4* G9, Omega 5* G8, zTech 4* zWrecker 4* G8",0
"PirateFTW",1,0,53416,Jawas,"Nebit G7, Jawa Engineer G8, Jawa Scavenger G7, Jawa 6* G8, Dathcha G8",0
"Dash Riprock",,,123011,Phasma,"zPhasma zFOTP FOSFTP zFOST zKylo",1
"Dash Riprock",1,1,152335,SL Kylo,"zzzzzzSL Kylo, zSith Trooper, zHux zzKRU zThrawn",1
"Dash Riprock",,,568697,Executor,"Executor HT RC Xanadu Blood, Slave I, IG-2000 Imperial TIE Fighter, Tie Adv",1
"Dash Riprock",0,1,153957,padme,"zzPadme zGK zJKA zAhsoka zzzCAT",1
"Dash Riprock",,,170230,JMLS,"zzzJKR zzJKL zzzzzzJMLS zWat Tambor, zzzzGAS",1
"Dash Riprock",1,0,146155,CLS,"zzzCLS zHan zzChewbacca zzC-3PO zChewpio",1
"Dash Riprock",0,1,127778,DRMalak,"zzzDR zzHK-47 BSF zzMalak Sith Empire Trooper",1
"Dash Riprock",1,1,108029,NestSisters,"zzAV zzMT zDaka Zombie zNest",1
"Dash Riprock",,,507787,Negotiator,"Negotiator BTL-B Y-wing, Anakin's Eta-2, Rex's ARC-170, Umbaran SF, Ahsoka's SF, Plo's SF, Clone Sergeant's ARC-170",1
"Dash Riprock",,,300211,Malevolence,"Malevolence Hyena Bomber, Vulture Droid, Sun Fac SF, Soldier SF, Spy SF",1
"Dash Riprock",1,1,148271,JTR,"zzJTR zzR2-D2 zzBB-8 zRH Finn, zRH Poe",1
"Dash Riprock",0,1,96414,Geonosians,"zzGBA Sun Fac, Geo Soldier, Geo Spy, Poggle",1
"Dash Riprock",0,1,112783,Grievous,"zzGG zB2 zB1 MagnaGuard zNute",1
"Dash Riprock",1,0,132729,Traya,"zzTraya DN zSion zDooku zzEP",1
"Dash Riprock",1,0,120721,Troopers,"zVeers zzPiett zzGideon zDark Trooper, Range Trooper",1
"Dash Riprock",1,0,138102,ShaakClones,"zzShaak Ti, zRex zEcho (501st), zzFives zARC Trooper",1
"Dash Riprock",1,1,99112,Carth,"zCarth Onasi, zMission Zaalbar zVandor Chewbacca, Canderous",1
"Dash Riprock",0,1,135023,BH,"zzBossk Dengar zJango IG-88 zBoba",1
"Dash Riprock",0,1,89539,Phoenix,"Hera Ezra Sabine Zeb zKanan",1
"Dash Riprock",0,1,129717,BS,"zBS zGMY zJolee zOld Ben, zHYoda",1
"Dash Riprock",,,358822,HansMF,"Home One, Han's MF, Rebel Y-wing, Bistan's U-wing, Phantom Ghost Cassian's U-wing, Wedge X-wing",0
"Dash Riprock",,,113668,Mon Mothma,"zzMon Mothma, zKyle Katarn, Lando Biggs Wedge",0
"Dash Riprock",,,84759,Iden Troopers,"zIden Versio, Shoretrooper 6* G9, Snowtrooper Magma G9, DT",0
"Lil Gap",1,0,115788,CLS,"zzCLS zHan zChewbacca C-3PO zChewpio",1
"Lil Gap",0,1,90996,Geonosians,"zzGBA Sun Fac, Geo Soldier, Geo Spy, Poggle",1
"Lil Gap",1,1,85913,Ewoks,"zChirpa Elder Paploo zWicket Logray",1
"Lil Gap",0,1,82064,BH,"zBossk Cad G9, Greedo G8, Jango Boba G8",1
"Lil Gap",0,1,64514,Phoenix,"Hera G8, Ezra Zeb G8, Kanan G8, Chopper G8",1
"Lil Gap",,,40856,Phasma,"Phasma G8, FOE 5* G8, FOO 6* G8, KRU 5* G8, Kylo 6* G8",0
"Lil Gap",0,1,79530,padme,"zPadme GK G8, zJKA 6* G9, zAhsoka Barriss",0
"Lil Gap",,,281047,HansMF,"Home One, Han's MF 6*, Rebel Y-wing 5*, Bistan's U-wing 3*, Phantom Ghost Cassian's U-wing 6*, Wedge X-wing",0
"Lil Gap",,,85907,Mon Mothma,"zzMon Mothma G9, Kyle Katarn G9, Cara Dune, Lando Wedge",0
"Lil Gap",1,1,36296,NS_Alt,"MT 5* G8, AV G8, Talia 5* G8, Spirit 5* G8, Daka 5* G8",0
"Lil Gap",1,1,74084,zEP,"EP zzVader Tarkin G9, Dooku 5* G8, Mara Jade, The Emperor's Hand 4*",0
"Lil Gap",1,0,65227,Rex (Counter),"Rex G8, zWampa Chirrut 5* G8, Baze 5* G8, R2-D2",0
"Lil Gap",1,0,43881,Troopers,"Veers 5* G8, Starck G7, Stormtrooper G8, Snowtrooper G8, Magma G8",0
"Lil Gap",0,1,80634,BS,"BS GMY zJolee 4* Old Ben, HYoda 6*",0
"BAI",,,174793,JMK,"zzzzzzJMK zAhsoka zzzCAT zzzzGAS zGK",1
"BAI",,,165598,SEE,"zzzzzzSEE zBSF zzMalak zzzDR zzzVader",1
"BAI",1,1,129278,NS,"zzMT zzAV zDaka Zombie Spirit",1
"BAI",,,577706,Executor,"Executor HT RC Xanadu Blood, Slave I, IG-2000 Imperial TIE Fighter, Tie Adv",1
"BAI",1,0,140001,CLS,"zzzCLS zHan zzChewbacca zC-3PO zChewpio",1
"BAI",,,510138,Negotiator,"Negotiator BTL-B Y-wing, Anakin's Eta-2, Rex's ARC-170, Umbaran SF, Ahsoka's SF, Plo's SF, Clone Sergeant's ARC-170",1
"BAI",,,385995,HansMF,"Home One, Han's MF, Rebel Y-wing, Bistan's U-wing, Phantom Biggs X-wing, Cassian's U-wing, Wedge X-wing",1
"BAI",0,1,92539,Geonosians,"zzGBA Sun Fac, Geo Soldier, Geo Spy, Poggle",1
"BAI",0,1,129308,Grievous,"zzGG zB2 zB1 zMagnaGuard zNute",1
"BAI",1,1,146255,Revan Offense,"zzzJKR zGMY zHYoda zJolee zJKA",1
"BAI",1,1,83112,Ewoks,"zChirpa Elder Paploo zWicket Logray",1
"BAI",1,0,149583,ShaakClones,"zzShaak Ti, zRex zEcho (501st), zzFives zARC Trooper",1
"BAI",0,1,147690,BH,"zzBossk Dengar zzJango zzGreef Boba",1
"BAI",1,0,123736,Troopers,"zVeers zStarck zzPiett zDark Trooper, zGideon",1
"BAI",0,1,67102,FO,"zKRU Kylo G9, Phasma G9, FOE G8, FOO G8",1
"BAI",0,1,70347,Phoenix,"Hera Ezra Zeb Kanan Chopper",1
"BAI",1,0,102696,EP (Counter, Rebel),"zzEP Shoretrooper G8, Krennic DT G8, zNest",1
"BAI",1,0,11923,SionSolo (Counter),"Sion G8",1
"BAI",,,299048,Malevolence,"Malevolence Hyena Bomber 6*, Vulture Droid 6*, Sun Fac SF, Soldier SF, Spy SF",0
"BAI",,,87291,Mon Mothma,"zzMon Mothma 5* G8, Hoth Rebel Scout G8, zPao G8, Biggs Wedge",0
"BAI",1,1,74556,Carth,"Carth Onasi, Mission Zaalbar Juhani G7, Canderous",0
"BAI",1,1,51317,Rogue1,"Jyn G8, Chirrut 6* G8, Baze G8, Cassian G8, K-2SO G9",0
"BAI",1,0,128491,zMaul,"Darth Maul, zDooku zSidious zSavage Sith Marauder",0
"Zeta Sigma 74",,,122096,Phasma,"zPhasma zFOTP FOSFTP zFOST zKylo",1
"Zeta Sigma 74",1,1,139095,SL Kylo,"zzzzzSL Kylo, zSith Trooper, zHux zzKRU Thrawn G8",1
"Zeta Sigma 74",1,0,141851,CLS,"zzzCLS zHan zzChewbacca zC-3PO zChewpio",1
"Zeta Sigma 74",,,439552,Negotiator,"Negotiator 6* HT Anakin's Eta-2, Umbaran SF, Ahsoka's SF, BTL-B Y-wing 6*, Clone Sergeant's ARC-170, Plo's SF",1
"Zeta Sigma 74",0,1,95992,Geonosians,"zzGBA Sun Fac, Geo Soldier, Geo Spy, Poggle",1
"Zeta Sigma 74",0,1,110093,Grievous,"zzGG zB2 zB1 zDroideka MagnaGuard",1
"Zeta Sigma 74",1,0,109127,Troopers,"zVeers zzPiett zGideon zDark Trooper, Range Trooper",1
"Zeta Sigma 74",1,1,116778,Revan,"zzzJKR BS zGMY zJolee zGK",1
"Zeta Sigma 74",1,1,85544,Ewoks,"zChirpa Elder zPaploo Wicket Logray",1
"Zeta Sigma 74",0,1,129991,BH,"zzBossk Cad Dengar zIG-88 zBoba",1
"Zeta Sigma 74",1,1,124449,zEP,"zzEP zzzVader Tarkin TFP zMara Jade, The Emperor's Hand",1
"Zeta Sigma 74",1,0,104853,501st,"zRex zARC Trooper, Echo (501st), zzFives zAhsoka",1
"Zeta Sigma 74",0,1,66549,Phoenix,"Hera G8, Ezra G8, Zeb G9, Kanan G8, Chopper",1
"Zeta Sigma 74",1,1,62442,Rogue1,"Jyn G8, Chirrut G8, Baze G8, Cassian G8, K-2SO G8",1
"Zeta Sigma 74",1,0,12561,SionSolo (Counter),"Sion G8",1
"Zeta Sigma 74",,,324705,HansMF,"Home One, Han's MF, Rebel Y-wing, Bistan's U-wing 5*, Phantom Ghost Cassian's U-wing, Wedge X-wing",0
"Zeta Sigma 74",1,1,84861,NS,"MT G9, AV zDaka Zombie Spirit G8",0
"Zeta Sigma 74",,,72529,Nute-Wat,"Nute Dooku zWat Tambor 6* G8, Jango Nest G1",0
"Zeta Sigma 74",1,1,83574,Carth,"Carth Onasi, zMission zZaalbar Juhani G7, Canderous",0
"Zeta Sigma 74",,,49959,Iden Troopers,"Iden Versio 6* G8, Shoretrooper G8, Snowtrooper G8, Magma G6, DT G8",0
"Grig",,,182459,JMK,"zzzzzzJMK zAhsoka zzzCAT zzzzGAS zGK",1
"Grig",,,125376,Phasma,"zPhasma zFOTP FOSFTP zFOST zKylo",1
"Grig",,,131846,Admiral Raddus,"zzAdmiral Raddus, Cassian Jyn Scarif Bistan",1
"Grig",,,139686,SK,"zzEP zzMara Jade, The Emperor's Hand, zzStarkiller zJuhani zVisas",1
"Grig",1,1,153628,SL Kylo,"zzzzzzSL Kylo, zSith Trooper, zHux zzKRU zThrawn",1
"Grig",1,1,168170,GL Rey,"zzzzzzRey zzzJTR zzR2-D2 zHoldo zRH Finn",1
"Grig",,,614340,Executor,"Executor HT RC Xanadu Blood, Slave I, IG-2000 Imperial TIE Fighter, Tie Adv",1
"Grig",,,162329,JMLS,"zBS zzzzzzJMLS zWat Tambor, zzJKL zJolee",1
"Grig",1,0,146479,CLS,"zzzCLS zHan zzChewbacca zzC-3PO zChewpio",1
"Grig",,,542554,Negotiator,"Negotiator BTL-B Y-wing, Anakin's Eta-2, Rex's ARC-170, Umbaran SF, Ahsoka's SF, Plo's SF, Clone Sergeant's ARC-170",1
"Grig",,,350325,Malevolence,"Malevolence Hyena Bomber, Vulture Droid, Sun Fac SF, Soldier SF, Spy SF",1
"Grig",,,497325,HansMF,"Home One, Han's MF, Rebel Y-wing, Bistan's U-wing, Phantom Biggs X-wing, Cassian's U-wing, Wedge X-wing",1
"Grig",0,1,109712,Geonosians,"zGBA Sun Fac, Geo Soldier, Geo Spy, Poggle",1
"Grig",0,1,134043,Grievous,"zzGG zB2 zB1 MagnaGuard zNute",1
"Grig",,,125946,Mon Mothma,"zzMon Mothma, Hoth Rebel Scout, zCara Dune, zPao Biggs",1
"Grig",1,1,83418,Ewoks,"zChirpa Elder Paploo Wicket Logray",1
"Grig",1,0,152998,ShaakClones,"zzShaak Ti, zRex zEcho (501st), zzFives zARC Trooper",1
"Grig",1,1,117615,Carth,"Carth Onasi, zMission zZaalbar zVandor Chewbacca, Canderous",1
"Grig",0,1,148098,BH,"zzBossk Dengar zJango zIG-88 zBoba",1
"Grig",0,1,85976,Phoenix,"Hera Ezra Sabine G8, Zeb G8, Kanan G8",1
"Grig",1,0,63141,Jawas,"Nebit G8, Jawa Engineer G8, Jawa Scavenger G8, Jawa G8, Dathcha G8",1
"Grig",1,0,13822,SionSolo (Counter),"Sion G8",1
"Grig",0,1,117448,DRMalak,"zzzDR HK-47 G1, zBSF zzMalak Sith Marauder",0
"Grig",1,1,76355,NS,"MT G8, zAV Daka Zombie Spirit G8",0
"Grig",1,0,98876,Troopers,"zVeers Starck zzPiett Dark Trooper G8, DT G8",0
"Grig",1,0,68927,zMaul,"Darth Maul, Sidious zDooku Sith Empire Trooper G1, Nest G1",0
"Danikan Skysaucer",,,123652,Phasma,"zPhasma zFOTP FOSFTP zFOST zKylo",1
"Danikan Skysaucer",1,1,153246,SL Kylo,"zzzzzzSL Kylo, zSith Trooper, zHux zzKRU zThrawn",1
"Danikan Skysaucer",1,0,96459,CLS,"zzCLS zHan zChewbacca R2-D2 G8, zChewpio",1
"Danikan Skysaucer",0,1,102750,Geonosians,"zzGBA Sun Fac, Geo Soldier, Geo Spy, Poggle",1
"Danikan Skysaucer",0,1,97271,BH,"zzBossk Cad Zam G8, Jango Boba",1
"Danikan Skysaucer",1,1,115914,zEP,"zEP zzVader Tarkin TFP G8, zzTraya",1
"Danikan Skysaucer",0,1,57460,Phoenix,"Hera G8, Ezra G8, Zeb G8, Kanan G8, Chopper G8",1
"Danikan Skysaucer",1,0,15247,SionSolo (Counter),"Sion G9",1
"Danikan Skysaucer",,,57015,Admiral Raddus,"Admiral Raddus 4* G9, Cassian Jyn G9, Baze 6* Chirrut 5* G8",0
"Danikan Skysaucer",,,287927,HansMF,"Home One 6*, Han's MF 5*, HT Bistan's U-wing 4*, Phantom Ghost Cassian's U-wing, Biggs X-wing 6*",0
"Danikan Skysaucer",1,1,82132,NS,"MT G8, AV G8, zDaka Zombie Spirit 6* G8",0
"Danikan Skysaucer",1,0,50956,501st,"Rex G8, Clone Sergeant G8, Echo (501st) G8, Fives G8, Ahsoka G9",0
"Danikan Skysaucer",1,0,48838,Troopers,"Veers 6* G8, Starck G7, Stormtrooper G8, DT 5* G8, Snowtrooper G8",0
"Danikan Skysaucer",,,63056,Bad Batch,"Hunter 5* G9, Echo 5* G9, Omega G9, Tech 5* G9, Wrecker 5*",0
"Danikan Skysaucer",0,1,74652,BS,"BS 6* G8, GMY Old Ben G9, GK JKA",0
"Dash Riprock alt",0,1,103931,Geonosians,"zzGBA Sun Fac, Geo Soldier, Geo Spy, Poggle",1
"Dash Riprock alt",0,1,103290,Grievous,"zzGG zB2 zDroideka zMagnaGuard L3-37",1
"Dash Riprock alt",1,1,104328,Revan,"zzzJKR BS zGMY zJolee GK",1
"Dash Riprock alt",0,1,100961,BH,"zzBossk Cad Dengar zJango Boba",1
"Dash Riprock alt",1,1,92487,zEP,"zEP zzVader Tarkin G8, TFP zzTraya",1
"Dash Riprock alt",0,1,73491,Phoenix,"Hera Ezra Zeb G8, Kanan G8, Chopper",1
"Dash Riprock alt",1,0,20886,SionSolo (Counter),"zSion",1
"Dash Riprock alt",,,48557,Phasma,"Phasma G8, FOE 5* G8, FOO 5* G8, KRU Kylo G8",0
"Dash Riprock alt",1,1,93808,NS,"zzMT zAV zDaka Zombie 6* Spirit",0
"Dash Riprock alt",1,0,39277,501st,"Rex 5* G8, Clone Sergeant 5* G8, Echo (501st) 5* G8, Fives 5* G8, Ahsoka",0
"Dash Riprock alt",1,0,81956,Wiggs,"Wedge 5* G8, Biggs G8, zCLS zHan zzChewbacca",0
"Dash Riprock alt",1,1,33713,Rogue1,"Jyn 5* G8, Chirrut 5* G8, Baze 5* G8, Cassian 5* G8, K-2SO 5* G8",0
"SonofGrisha",,,174525,JMK,"zzzzzzJMK zAhsoka zzzCAT zzzzGAS zGK",1
"SonofGrisha",,,123084,Phasma,"zPhasma zFOTP FOSFTP zFOST zKylo",1
"SonofGrisha",1,1,158990,SL Kylo,"zzzzzzSL Kylo, zSith Trooper, zHux zzKRU zzThrawn",1
"SonofGrisha",,,163730,SEE,"zzzzzzSEE zBSF zzMalak zzzDR zDooku",1
"SonofGrisha",1,1,158737,GL Rey,"zzzzzzRey zzJTR zzR2-D2 zHoldo zRH Finn",1
"SonofGrisha",,,592034,Executor,"Executor HT RC Xanadu Blood, Slave I, IG-2000 Imperial TIE Fighter, Tie Adv",1
"SonofGrisha",1,0,143851,CLS,"zzzCLS zHan zzChewbacca zzC-3PO zChewpio",1
"SonofGrisha",1,1,120867,NestSisters,"zzAV zzMT zDaka Zombie zNest",1
"SonofGrisha",,,514515,Negotiator,"Negotiator BTL-B Y-wing, Anakin's Eta-2, Rex's ARC-170, Umbaran SF, Ahsoka's SF, Plo's SF, Clone Sergeant's ARC-170",1
"SonofGrisha",,,324383,Malevolence,"Malevolence Hyena Bomber, Vulture Droid, Sun Fac SF, Soldier SF, Spy SF",1
"SonofGrisha",,,140319,JKL,"zzJKL zzzJKR zzHYoda zOld Ben, Aayla",1
"SonofGrisha",,,433870,HansMF,"Home One, Han's MF, Rebel Y-wing, Bistan's U-wing, Phantom Biggs X-wing, Cassian's U-wing, Wedge X-wing",1
"SonofGrisha",0,1,107017,Geonosians,"zzGBA Sun Fac, Geo Soldier, Geo Spy, Poggle",1
"SonofGrisha",0,1,136968,Grievous,"zzGG zB2 zB1 zMagnaGuard zNute",1
"SonofGrisha",1,0,120398,Traya,"zzTraya zDN zSion zzEP Sith Empire Trooper",1
"SonofGrisha",,,111890,Mon Mothma,"zzMon Mothma, Hoth Rebel Scout, zCara Dune, zPao Wedge",1
"SonofGrisha",1,1,86148,Ewoks,"zChirpa Elder Paploo Wicket Logray",1
"SonofGrisha",1,0,151221,ShaakClones,"zzShaak Ti, zRex zEcho (501st), zzFives zARC Trooper",1
"SonofGrisha",0,1,146367,BH,"zzBossk Dengar zzJango zIG-88 zBoba",1
"SonofGrisha",1,0,128852,Troopers,"zVeers zStarck zzPiett DT zzGideon",1
"SonofGrisha",0,1,75981,Phoenix,"Hera Ezra Sabine Zeb G8, Kanan G8",1
"SonofGrisha",1,1,85857,Rogue1,"zzJyn Chirrut Baze Cassian K-2SO G8",1
"SonofGrisha",1,1,86702,Carth,"zCarth Onasi, zMission zZaalbar Juhani G7, zCanderous",0
"SonofGrisha",1,0,54417,Jawas,"Nebit G8, Jawa Engineer G8, Jawa Scavenger G8, Jawa G8, Dathcha G8",0
"Dark Killer",0,1,102017,Geonosians,"zzGBA Sun Fac, Geo Soldier, Geo Spy, Poggle",1
"Dark Killer",0,1,114009,FO,"zzKRU zKylo FOE FOO zFOST",1
"Dark Killer",1,1,74894,NS,"zzMT zAV Daka Zombie 4* Spirit G9",0
"Dark Killer",,,249754,Negotiator,"Negotiator 5* HT 4* Anakin's Eta-2 5*, Umbaran SF, Ahsoka's SF, BTL-B Y-wing 4*, Clone Sergeant's ARC-170, Jedi Consular's Starfighter 6*",0
"Dark Killer",,,229381,Malevolence,"Malevolence 5* Hyena Bomber 4*, Vulture Droid 5*, Sun Fac SF 6*, Soldier SF, Spy SF",0
"Dark Killer",,,49512,Nute-OR,"Nute G8, Dooku 5* G8, Jango 6* Zaalbar 4* G9, Mission 4* G7",0
"Dark Killer",1,0,75781,ShaakClones,"Shaak Ti 3* G8, Rex Echo (501st), zFives Clone Sergeant G9",0
"Dark Killer",1,1,52237,Ewoks,"zChirpa 5* Elder 5* Paploo 5* G7, Teebo 6* G7, Logray 4*",0
"Dark Killer",1,1,97897,zEP,"zzEP zzzVader Tarkin TFP 6* G8, zSith Trooper 4*",0
"Dark Killer",0,1,77033,BH,"zzBossk 6* Cad G8, Greedo G8, Greef 3* G8, zBoba",0
"Dark Killer",1,0,76869,Wiggs,"Wedge 5* G8, Biggs G8, zzzCLS zHan Ezra G8",0
"Dark Killer",1,0,38818,Troopers,"Veers 5* G8, Starck G4, Stormtrooper G8, DT 5* G8, Snowtrooper 6* G8",0
"Dark Killer",0,1,48891,Phoenix,"Hera 6* G8, Sabine 5* G8, Zeb G8, Kanan G8, Chopper G8",0
"Dark Killer",1,1,44468,Rogue1,"Jyn 5* G8, Chirrut 5* G8, Baze 5* G8, Cassian 6* G8, K-2SO G8",0
"Dark Killer",0,1,65818,BS,"BS 6* GMY HYoda G9, GK 6* G8, Ahsoka",0
"Dark Force User",,,176027,SEE,"zzzzzzSEE zBSF zzMalak zzzDR zzzVader",1
"Dark Force User",1,0,138759,CLS,"zzzCLS zHan zzChewbacca zzC-3PO zChewpio",1
"Dark Force User",,,479357,Negotiator,"Negotiator HT Anakin's Eta-2, Umbaran SF, Ahsoka's SF, BTL-B Y-wing, Clone Sergeant's ARC-170, Plo's SF",1
"Dark Force User",,,320259,Malevolence,"Malevolence Hyena Bomber, Vulture Droid, Sun Fac SF, Soldier SF, Spy SF",1
"Dark Force User",0,1,102068,Geonosians,"zzGBA Sun Fac, Geo Soldier, Geo Spy, Poggle",1
"Dark Force User",0,1,126822,Grievous,"zzGG zB2 zB1 zMagnaGuard zNute",1
"Dark Force User",1,0,114764,Traya,"zzTraya zzDN zSion Sith Empire Trooper, zThrawn",1
"Dark Force User",1,0,122259,Troopers,"zVeers zzPiett zGideon zDark Trooper, Range Trooper",1
"Dark Force User",1,1,143930,GAS,"zzzzGAS zRex zEcho (501st), zzFives zARC Trooper",1
"Dark Force User",1,1,145085,Revan,"zzzJKR zBS zGMY zJolee zGK",1
"Dark Force User",1,1,81613,Ewoks,"zChirpa Elder Paploo zWicket zLogray",1
"Dark Force User",0,1,107126,BH,"zzBossk zZam Dengar Boba Embo",1
"Dark Force User",1,0,130027,zMaul,"zDarth Maul, zSidious zDooku Sith Marauder, zNest",1
"Dark Force User",0,1,87428,FO,"zzKRU Kylo Phasma FOE FOO",1
"Dark Force User",0,1,65286,Phoenix,"Hera G8, zEzra Zeb G8, Kanan G8, Chopper G8",1
"Dark Force User",1,0,117909,EP (Counter, Rebel),"zzEP Krennic zzWampa Stormtrooper G8, zStarck",1
"Dark Force User",,,345986,HansMF,"Home One, Han's MF, Rebel Y-wing, Bistan's U-wing, Phantom Ghost Cassian's U-wing, Wedge X-wing",0
"Dark Force User",1,1,66120,NS,"MT G8, zAV Daka Zombie G8, Spirit G6",0
"Dark Force User",1,1,65516,JTR,"JTR G1, Scav Rey G8, zBB-8 G9, R2-D2 G8, Finn G9",0
"Dark Force User",1,1,79587,Carth,"zCarth Onasi, zMission zZaalbar Juhani Canderous G7",0
"Dark Force User",0,1,74566,BH,"Jango Cad Greedo IG-88 G8, The Mandalorian G8",0
"Dark Force User",,,94673,Bad Batch,"zHunter zEcho zzOmega G9, Tech Wrecker",0
"Dobbz",0,1,129746,padme,"zzPadme zGK zJKA zAhsoka C-3PO",1
"Dobbz",0,1,92307,Geonosians,"zzGBA Sun Fac, Geo Soldier, Geo Spy, Poggle",1
"Dobbz",1,1,99776,Revan Offense,"zzzJKR GMY BS zJolee HYoda",1
"Dobbz",1,1,83059,Ewoks,"zChirpa Elder Paploo Wicket Logray",1
"Dobbz",0,1,104383,BH,"zzBossk zZam Jango zGreef Boba",1
"Dobbz",1,1,112193,zEP,"zEP zzVader Tarkin TFP G8, zBSF",1
"Dobbz",1,0,83249,Troopers,"zVeers Starck zzPiett Dark Trooper, Range Trooper",1
"Dobbz",0,1,54964,Phoenix,"Hera G8, Ezra G8, Zeb G8, Kanan G8, Chopper G8",1
"Dobbz",1,0,16671,SionSolo (Counter),"Sion",1
"Dobbz",,,61209,Phasma,"Phasma G8, FOE 5* FOO G8, KRU G8, Kylo G8",0
"Dobbz",1,0,79952,CLS,"CLS Han Chewbacca R2-D2 G7, Chewpio",0
"Dobbz",,,280837,HansMF,"Home One, Han's MF, HT Bistan's U-wing, Phantom Ghost Cassian's U-wing, Biggs X-wing",0
"Dobbz",1,1,39622,NS_Alt,"MT 6* G8, AV 5* G8, Talia 5* G8, Spirit 5* G8, Daka G8",0
"Dobbz",1,1,70541,Carth,"zCarth Onasi, Mission Zaalbar G7, Juhani 6* Canderous",0
"Dobbz",1,0,57897,ShaakClones,"Shaak Ti, Rex G8, Echo (501st) G8, Fives G8, Clone Sergeant G9",0
"Dobbz",1,1,43654,Rogue1,"Jyn 6* G8, Chirrut 6* G8, Baze 6* G8, Cassian G8, K-2SO 6* G8",0
"gabou2506",0,1,92124,BH,"zBossk Jango G9, Greef Boba zThe Mandalorian",1
"gabou2506",1,1,95594,zEP,"zzEP zzVader Tarkin G8, TFP G9, Sith Trooper",1
"gabou2506",0,1,108165,FO,"zzKRU zKylo FOE FOO zHux",1
"gabou2506",0,1,69771,Phoenix,"Hera G8, Ezra G9, Zeb G8, Kanan Chopper G8",1
"gabou2506",1,0,15391,SionSolo (Counter),"Sion",1
"gabou2506",1,0,72362,CLS,"CLS G8, zHan Chewbacca G9, R2-D2 G8, Chewpio 5*",0
"gabou2506",,,266903,HansMF,"Home One, Han's MF 5*, HT Bistan's U-wing 5*, Phantom Ghost Cassian's U-wing, Biggs X-wing",0
"gabou2506",0,1,75167,Geonosians,"zGBA 5* G9, Sun Fac G8, Geo Soldier, Geo Spy, Poggle",0
"gabou2506",1,0,82776,Troopers,"zVeers zPiett Gideon Dark Trooper 6* G9, Range Trooper",0
"gabou2506",1,1,37864,NS_Alt,"MT 5* G9, AV 6* G8, Talia 5* G8, Spirit 5* G8, Daka 5* G9",0
"gabou2506",1,0,92696,ShaakClones,"zzShaak Ti 6*, zRex Echo (501st) G9, zzFives ARC Trooper G9",0
"gabou2506",1,1,40889,Rogue1,"Jyn 5* G8, Chirrut 5* G8, Baze 5* G8, Cassian 6* G8, K-2SO G8",0
"gabou2506",0,1,78689,BS,"BS GMY G9, JKA GK G8, Ahsoka",0
"Skippykgt",,,558930,Executor,"Executor HT RC Xanadu Blood, Slave I, IG-2000 Imperial TIE Fighter, Tie Adv",1
"Skippykgt",0,1,89636,Geonosians,"zzGBA Sun Fac, Geo Soldier, Geo Spy, Poggle",1
"Skippykgt",1,0,97211,CLS,"zzzCLS zHan zChewbacca Thrawn C-3PO",1
"Skippykgt",1,1,87571,Ewoks,"zChirpa Elder zPaploo Wicket zLogray",1
"Skippykgt",0,1,132398,BH,"zBossk Cad Dengar IG-88 zBoba",1
"Skippykgt",0,1,61384,Phoenix,"Hera G8, Ezra Zeb G8, Kanan G8, Chopper G8",1
"Skippykgt",1,1,93609,zEP,"EP G9, zzVader Tarkin TFP Traya G8",0
"Skippykgt",,,36728,Bad Batch,"Hunter 5* G8, Echo 5* G8, Omega 5* G7, Tech 5* G8, Wrecker 6* G7",0
"JediLukeSkywalker Alt",0,1,103697,padme,"zzPadme zGK zJKA zAhsoka C-3PO",1
"JediLukeSkywalker Alt",0,1,100119,Geonosians,"zzGBA Sun Fac, Geo Soldier, Geo Spy, Poggle",1
"JediLukeSkywalker Alt",1,1,87977,Ewoks,"zChirpa Elder Paploo Wicket zLogray",1
"Slartibartfast",0,1,93695,Geonosians,"zGBA Sun Fac, Geo Soldier, Geo Spy, Poggle",1
"Slartibartfast",,,102642,Mon Mothma,"zzMon Mothma, Bistan Hoth Rebel Scout, zCara Dune, zPao",1
"Slartibartfast",0,1,79348,BH,"zzBossk Cad G8, Dengar G9, Jango G8, Boba G9",1
"Slartibartfast",0,1,71356,Phoenix,"Hera Ezra Zeb G8, Kanan G8, Chopper",1
"Slartibartfast",,,105015,SK,"zzEP Mara Jade, The Emperor's Hand, zzStarkiller Old Ben, Visas 6*",0
"Slartibartfast",1,0,78787,CLS,"zzCLS zHan Chewbacca 5* G9, R2-D2 Chewpio 6* G8",0
"Slartibartfast",,,342836,HansMF,"Home One 6*, Han's MF 5*, Rebel Y-wing 6*, Bistan's U-wing 6*, Phantom Ghost Cassian's U-wing, Wedge X-wing",0
"Slartibartfast",1,1,53175,Ewoks,"zChirpa G9, Elder G8, Paploo G7, Teebo G5, Logray G8",0
"Slartibartfast",1,0,52024,Troopers,"Veers 6* G8, Starck G9, Snowtrooper G7, Iden Versio 4* G8, Gideon 6* G9",0
"Slartibartfast",0,1,61701,BS,"zBS 6* GMY zJolee 5* G8, GK G7, HYoda 5* G8",0
"Slartibartfast",1,0,9349,SionSolo (Counter),"Sion 4*",0
"SPETSNAZBH05",0,1,92707,Geonosians,"zzGBA Sun Fac, Geo Soldier, Geo Spy, Poggle",1
"SPETSNAZBH05",1,1,77937,Ewoks,"zChirpa Elder Paploo Wicket Logray",1
"SPETSNAZBH05",1,0,99180,ShaakClones,"zzShaak Ti, zRex Echo (501st), zzFives ARC Trooper",1
"SPETSNAZBH05",0,1,82870,BH,"zzBossk Cad G9, Jango Boba G8, The Mandalorian G9",1
"SPETSNAZBH05",0,1,64613,Phoenix,"Hera G8, Ezra G8, Zeb G8, Kanan G8, Chopper G8",1
"SPETSNAZBH05",1,0,16671,NestSolo (Counter),"Nest",1
"SPETSNAZBH05",0,1,97335,padme,"zzPadme zGK zJKA zAhsoka C-3PO G7",0
"SPETSNAZBH05",0,1,84389,Grievous,"GG B2 B1 MagnaGuard zNute",0
"SPETSNAZBH05",1,0,83965,Troopers,"zVeers zPiett G9, Gideon Dark Trooper, Range Trooper G9",0
"SPETSNAZBH05",,,72441,Iden Troopers,"zIden Versio 4* G9, Stormtrooper Snowtrooper Magma DT",0
"Dr Pepper",,,175841,JMK,"zzzzzzJMK zJKA zzGMY zzShaak Ti, zGK",1
"Dr Pepper",,,123211,Phasma,"zPhasma zFOTP FOSFTP zFOST zKylo",1
"Dr Pepper",1,1,160767,SL Kylo,"zzzzzzSL Kylo, zSith Trooper, zHux zzKRU zzThrawn",1
"Dr Pepper",,,169566,SEE,"zzzzzzSEE zBSF zzMalak zzzDR zzzVader",1
"Dr Pepper",0,1,95211,Qira,"zQira L3-37 zVandor Chewbacca, zMission zZaalbar",1
"Dr Pepper",1,1,117150,NS,"zzMT zzAV zDaka Zombie Spirit",1
"Dr Pepper",,,564392,Executor,"Executor 5* HT RC Xanadu Blood, Slave I, IG-2000 Imperial TIE Fighter, Tie Adv",1
"Dr Pepper",,,180006,JMLS,"zzzJKR zzJKL zzzzzzJMLS zWat Tambor, zzzzGAS",1
"Dr Pepper",1,0,145898,CLS,"zzzCLS zHan zzChewbacca zzC-3PO zChewpio",1
"Dr Pepper",,,510400,Negotiator,"Negotiator BTL-B Y-wing, Anakin's Eta-2, Rex's ARC-170, Umbaran SF, Ahsoka's SF, Plo's SF, Clone Sergeant's ARC-170",1
"Dr Pepper",,,326625,Malevolence,"Malevolence Hyena Bomber, Vulture Droid, Sun Fac SF, Soldier SF, Spy SF",1
