Player,Offense,Defense,GP,Name,Squad,Viable
"Ashla Bogan",,,499710,Executrix,"Executrix Tie Adv, Emperor's Shuttle, TIE Reaper 6*, Imperial TIE Fighter, Gauntlet Starfighter, FOSF TIE Fighter, FO TIE Fighter",0
"Ashla Bogan",,,79732,Iden Troopers,"zIden Versio 4* G8, zStormtrooper Snowtrooper G9, Magma G8, zDT",0
"Ashla Bogan",,,99952,Mando,"zzThe Mandalorian (Beskar Armor), zDash Rendar G9, Nest G7, zIG-11 zKuiil",0
"MeMeItsMe",,,177214,JMK,"zzzzzzJMK zJKA zzGMY zzShaak Ti, zGK",1
"MeMeItsMe",1,1,173835,GL Rey,"zzzzzzRey zzzJTR zzBB-8 zRH Poe, zRH Finn",1
"MeMeItsMe",,,539380,Executor,"Executor 5* HT RC Xanadu Blood, Slave I, IG-2000 Imperial TIE Fighter, Tie Adv",1
"MeMeItsMe",,,127167,Grievous Omicron,"zzGG zB2 zB1 zMagnaGuard zDroideka",1
"MeMeItsMe",1,1,105846,NS_Alt,"zzMT zzAV Zombie Talia zDaka",1
"MeMeItsMe",0,1,108052,DR,"zzzDR zzHK-47 zBSF Sith Marauder, Sith Empire Trooper G8",1
"MeMeItsMe",,,401205,HansMF,"Home One, Han's MF, Rebel Y-wing, Bistan's U-wing, Phantom Ghost Cassian's U-wing, Wedge X-wing",1
"MeMeItsMe",1,0,135860,CLS,"zzzCLS zHan zzChewbacca zzR2-D2 zzC-3PO",1
"MeMeItsMe",1,1,128413,GAS,"zzzzGAS zRex zEcho (501st), zzFives zARC Trooper",1
"MeMeItsMe",1,1,96495,Ewoks,"zChirpa Elder zPaploo zWicket zLogray",1
"MeMeItsMe",0,1,146319,BH,"zzBossk zIG-88 zDengar zJango zBoba",1
"MeMeItsMe",1,1,86102,Carth,"zCarth Onasi, zMission Zaalbar G8, zJuhani Canderous G8",1
"MeMeItsMe",1,1,131774,zEP,"zzEP zzzVader zzTarkin IPD G8, TFP",1
"MeMeItsMe",1,0,122194,Troopers,"zVeers zStarck zDT zzPiett Magma",1
"MeMeItsMe",0,1,89738,FO,"zzKRU zKylo FOO FOE zFOST",1
"MeMeItsMe",0,1,84535,Phoenix,"zHera Zeb Sabine G8, zEzra zKanan",1
"MeMeItsMe",1,1,72956,Rogue1,"zJyn G9, Chirrut G8, Baze G8, K-2SO G8, Cassian G8",1
"MeMeItsMe",1,0,71006,Jawas,"Nebit G8, Jawa Engineer G9, Jawa Scavenger G8, Jawa G9, Dathcha",1
"MeMeItsMe",1,0,24397,SionSolo (Counter),"zSion",1
"MeMeItsMe",,,468573,Negotiator,"Negotiator BTL-B Y-wing 5*, Anakin's Eta-2, Rex's ARC-170, Umbaran SF, Ahsoka's SF, Plo's SF, Clone Sergeant's ARC-170",0
"MeMeItsMe",,,277365,Malevolence,"Malevolence Hyena Bomber 4*, Vulture Droid 3*, Sun Fac SF, Soldier SF, Spy SF",0
"MeMeItsMe",0,1,93961,Geonosians Omicron,"zzGBA Sun Fac, Geo Soldier, Geo Spy, Poggle",0
"MeMeItsMe",,,117104,JKL,"JKL zzzJKR zzHYoda zOld Ben, Aayla",0
"MeMeItsMe",,,84306,Mon Mothma,"Mon Mothma 6* G8, zCara Dune G9, Biggs Wedge Lando",0
"MeMeItsMe",,,81296,Bad Batch,"zHunter zEcho 6* Omega G7, zTech 6* zWrecker G9",0
"MeMeItsMe",,,67689,Mando,"The Mandalorian (Beskar Armor) G9, Dash Rendar 5* G7, Nest G7, IG-11 Kuiil G9",0
"Gundy",,,124320,Phasma,"zPhasma zFOTP FOSFTP zFOST zKylo",1
"Gundy",1,1,146111,SL Kylo,"zzzzzzSL Kylo, zSith Trooper, zHux zzKRU zThrawn",1
"Gundy",1,1,98712,NS,"zzMT zAV zDaka Zombie Spirit",1
"Gundy",1,0,149583,CLS,"zzzCLS zHan zzChewbacca zzC-3PO zChewpio",1
"Gundy",0,1,142950,DRMalak,"zzzDR zzHK-47 zBSF zzMalak Sith Empire Trooper",1
"Gundy",0,1,123967,padme,"zzPadme zGK zJKA zAhsoka zBarriss",1
"Gundy",,,361277,HansMF,"Home One, Han's MF, Rebel Y-wing 6*, Bistan's U-wing, Phantom Biggs X-wing, Cassian's U-wing, Wedge X-wing",1
"Gundy",1,1,143716,JTR,"zzzJTR zzR2-D2 zzBB-8 zRH Finn, zRH Poe",1
"Gundy",,,463575,Negotiator,"Negotiator HT Anakin's Eta-2, Umbaran SF, Ahsoka's SF, Clone Sergeant's ARC-170, Jedi Consular's Starfighter, Rex's ARC-170",1
"Gundy",0,1,123732,Grievous,"zzGG zB2 zB1 zMagnaGuard zNute",1
"Gundy",1,0,117974,Traya,"zzTraya zDN zSion zDooku zzEP",1
"Gundy",,,109565,Mon Mothma,"zzMon Mothma, Cara Dune, Biggs Wedge Lando",1
"Gundy",1,1,140646,GAS,"zzzzGAS zRex zEcho (501st), zzFives zARC Trooper",1
"Gundy",1,1,135278,Revan Offense,"zzzJKR zGMY zBS zJolee zzHYoda",1
"Gundy",1,1,85519,Ewoks,"zChirpa Elder Paploo Wicket Logray",1
"Gundy",0,1,112587,BH,"zzBossk zDengar zzGreef zJango zBoba",1
"Gundy",1,1,93817,Carth,"zCarth Onasi, zMission zZaalbar Juhani G8, zCanderous",1
"Gundy",0,1,82408,Phoenix,"Hera Zeb zEzra Chopper Kanan G9",1
"Gundy",1,0,20478,NestSolo (Counter),"zNest",1
"Gundy",0,1,93646,Geonosians Omicron,"zzGBA Sun Fac, Geo Soldier, Geo Spy, Poggle",0
