Player,Offense,Defense,GP,Name,Squad,Viable
"Mandigo Duco",0,1,113983,padme,"zzPadme zGK zJKA zAhsoka CW Chewbacca G9",1
"Mandigo Duco",,,414746,HansMF,"Home One, Han's MF, Rebel Y-wing, Bistan's U-wing, Phantom Biggs X-wing, Cassian's U-wing, Wedge X-wing",1
"Mandigo Duco",,,436113,Negotiator,"Negotiator HT Anakin's Eta-2, Umbaran SF, Ahsoka's SF, Clone Sergeant's ARC-170, Plo's SF, Rex's ARC-170",1
"Mandigo Duco",0,1,108429,Grievous-Wat,"zzGG zB2 zB1 zMagnaGuard zWat Tambor",1
"Mandigo Duco",1,1,130456,JTR,"zzzJTR zScav Rey, zzBB-8 zzR2-D2 Finn",1
"Mandigo Duco",1,1,96827,Ewoks,"zChirpa Elder zPaploo zWicket zLogray",1
"Mandigo Duco",1,0,104242,ShaakClones,"zzShaak Ti, zRex zEcho (501st), zzFives zARC Trooper G8",1
"Mandigo Duco",0,1,122493,BH,"zzBossk zDengar zzGreef zzJango zBoba",1
"Mandigo Duco",1,1,142847,zEP,"zzEP zzzVader zzTarkin zzTraya zzMara Jade, The Emperor's Hand",1
"Mandigo Duco",1,0,106281,Wiggs,"Wedge Biggs zFulcrum zEzra zLeia",1
"Mandigo Duco",,,74753,Phasma,"zPhasma FOTP FOSFTP G9, FOST G8, Kylo",0
"Mandigo Duco",,,319300,Malevolence,"Malevolence Hyena Bomber 5*, Vulture Droid 5*, Sun Fac SF, Soldier SF, Spy SF",0
"Mandigo Duco",0,1,119650,Geonosians Omicron,"zzGBA Sun Fac, Geo Soldier, Geo Spy, Poggle",0
"Mandigo Duco",1,1,81737,NS,"zzMT G7, zzAV zDaka G8, Zombie G8, Spirit G7",0
"Mandigo Duco",,,107248,Mon Mothma,"zzMon Mothma, zKyle Katarn, Chirrut G8, Baze G8, Lando",0
"Mandigo Duco",1,1,89448,Carth,"zCarth Onasi, Mission Zaalbar G4, zJuhani zCanderous",0
"Mandigo Duco",1,0,62554,Troopers,"Veers G7, Starck G7, Iden Versio, Snowtrooper G8, Stormtrooper G6",0
"Mandigo Duco",0,1,79513,Phoenix,"zHera Zeb G8, zSabine Chopper G7, Kanan G8",0
"Mandigo Duco",1,0,68503,Jawas,"Nebit G8, Jawa Engineer G7, Jawa Scavenger G7, Jawa G9, Dathcha",0
"Chaarisma",,,185712,JMK,"zzzzzzJMK zAhsoka zzzCAT zzzzGAS zGK",1
"Chaarisma",,,186348,LV,"zzzzzzLord Vader, zzPiett zzzVader zRG zNinth Sister",1
"Chaarisma",,,123339,Phasma,"zPhasma zFOTP FOSFTP zFOST zKylo",1
"Chaarisma",1,1,170321,SL Kylo,"zzzzzzSL Kylo, zSith Trooper, zHux zzKRU zzThrawn",1
"Chaarisma",,,175753,SEE,"zzzzzzSEE zBSF zzMalak zzzDR zDooku",1
"Chaarisma",1,1,171625,GL Rey,"zzzzzzRey zzzJTR zzR2-D2 zRH Poe, zRH Finn",1
"Chaarisma",,,167072,Jabba,"zzzzzzJabba zBoushh (Leia Organa), zSkiff Guard (Lando Calrissian), Krrsantan zBoba",1
"Chaarisma",0,1,93299,Qira,"Qira L3-37 zVandor Chewbacca, zMission zZaalbar",1
"Chaarisma",1,1,148776,NS,"zzMT zzAV zDaka Zombie Spirit",1
"Chaarisma",,,604795,Executor,"Executor HT RC Xanadu Blood, Slave I, IG-2000 Imperial TIE Fighter, Tie Adv",1
"Chaarisma",,,169168,JMLS,"zBS zzzzzzJMLS zWat Tambor, zzJKL zJolee",1
"Chaarisma",1,0,159321,CLS,"zzzCLS zHan zzChewbacca zzC-3PO zChewpio",1
"Chaarisma",,,523250,Negotiator,"Negotiator BTL-B Y-wing, Anakin's Eta-2, Rex's ARC-170, Umbaran SF, Ahsoka's SF, Plo's SF, Clone Sergeant's ARC-170",1
"Chaarisma",,,329310,Malevolence,"Malevolence Hyena Bomber, Vulture Droid, Sun Fac SF, Soldier SF, Spy SF",1
"Chaarisma",,,460955,HansMF,"Home One, Han's MF, Rebel Y-wing, Bistan's U-wing, Phantom Ghost Cassian's U-wing, Wedge X-wing",1
"Chaarisma",0,1,135728,Grievous,"zzGG zB2 zB1 MagnaGuard zNute",1
"Chaarisma",1,0,124357,Traya,"zzTraya zDN zSion zzEP Sith Empire Trooper",1
"Chaarisma",,,110613,Mon Mothma,"zzMon Mothma, zCara Dune, zPao Hoth Rebel Scout, Wedge",1
"Chaarisma",1,1,87297,Ewoks,"zChirpa Elder zPaploo Wicket Logray",1
"Chaarisma",1,0,156113,ShaakClones,"zzShaak Ti, zRex zEcho (501st), zzFives zARC Trooper",1
"Chaarisma",0,1,152780,BH,"zzBossk zZam Dengar zBoba Fett, Scion of Jango, zzJango",1
"Chaarisma",1,0,118898,Troopers,"zVeers zStarck zGideon zIden Versio, zDark Trooper",1
"Chaarisma",0,1,91757,Phoenix,"Hera Zeb Sabine zEzra Kanan",1
"Chaarisma",1,1,92856,Rogue1,"zJyn Chirrut Baze K-2SO Cassian",1
"Chaarisma",,,130876,Bad Batch,"zHunter zEcho zzOmega zTech zWrecker",1
"Chaarisma",,,124471,Mando,"zzThe Mandalorian (Beskar Armor), zDash Rendar, zNest zIG-11 zKuiil",1
"Chaarisma",1,0,84873,Jawas,"Nebit Jawa Engineer G9, Jawa Scavenger, Jawa Dathcha",1
"Chaarisma",0,1,106572,Geonosians Omicron,"zzGBA Sun Fac, Geo Soldier, Geo Spy, Poggle",0
"QuarterwayHook",0,1,121516,DRMalak,"zzzDR HK-47 zBSF zzMalak Sith Empire Trooper",1
"QuarterwayHook",0,1,132863,padme,"zzPadme zGK zJKA zAhsoka zzC-3PO",1
"QuarterwayHook",1,0,123384,CLS,"zzzCLS zHan zzChewbacca zzR2-D2 zChewpio",1
"QuarterwayHook",,,465453,Negotiator,"Negotiator HT Anakin's Eta-2, Umbaran SF, Ahsoka's SF, BTL-B Y-wing, Clone Sergeant's ARC-170, Plo's SF",1
"QuarterwayHook",,,314204,Malevolence,"Malevolence Hyena Bomber, Vulture Droid, Sun Fac SF, Soldier SF, Spy SF",1
"QuarterwayHook",0,1,113448,Grievous,"zzGG zB2 zB1 MagnaGuard zNute",1
"QuarterwayHook",1,0,121460,Traya,"zzTraya zDN zSion zzEP Thrawn G8",1
"QuarterwayHook",,,103327,Disintegration,"Aurra zGreef Boba zzBossk The Mandalorian",1
"QuarterwayHook",1,1,132274,Revan Offense,"zzzJKR zzGMY zBS zJolee zHYoda",1
"QuarterwayHook",1,1,87241,Ewoks,"zChirpa Elder Paploo Teebo zWicket",1
"QuarterwayHook",1,1,83514,Carth,"zCarth Onasi, Mission Zaalbar Juhani G8, zCanderous",1
"QuarterwayHook",1,0,20053,NestSolo (Counter),"zNest",1
"QuarterwayHook",,,67232,Phasma,"Phasma G8, FOTP 6* FOSFTP G9, FOST 4* zKylo",0
"QuarterwayHook",0,1,101322,Geonosians Omicron,"zzGBA Sun Fac, Geo Soldier, Geo Spy, Poggle",0
"QuarterwayHook",,,310827,HansMF,"Home One, Han's MF, Rebel Y-wing, Bistan's U-wing, Phantom Ghost Cassian's U-wing, Biggs X-wing",0
"QuarterwayHook",1,1,68709,NS_Alt,"MT G7, zAV Zombie G6, Talia G5, Daka G9",0
"QuarterwayHook",1,1,109582,GAS,"zzzzGAS Rex Echo (501st) G7, zzFives zARC Trooper",0
"QuarterwayHook",,,78686,Mon Mothma,"zMon Mothma 5* G9, zKyle Katarn, Biggs Wedge G8, Lando",0
"QuarterwayHook",1,0,74461,Troopers,"zVeers G7, Starck G7, zzPiett Dark Trooper G8, Range Trooper G7",0
"QuarterwayHook",0,1,71461,Phoenix,"Hera Zeb G7, Ezra Chopper G8, Kanan G9",0
"Talin Vandor",,,131219,Phasma,"zPhasma zFOTP FOSFTP zFOST zKylo",1
"Talin Vandor",1,1,166297,SL Kylo,"zzzzzzSL Kylo, zSith Trooper, zHux zzKRU zzThrawn",1
"Talin Vandor",,,173698,SEE,"zzzzzzSEE zBSF zzMalak zzzDR zzzVader",1
"Talin Vandor",0,1,101314,Qira,"zQira zL3-37 Vandor Chewbacca, zMission zZaalbar",1
"Talin Vandor",0,1,144594,padme,"zzPadme zGK zJKA zAhsoka zzC-3PO",1
"Talin Vandor",,,490316,Negotiator,"Negotiator HT Anakin's Eta-2, Umbaran SF, Ahsoka's SF, BTL-B Y-wing, Clone Sergeant's ARC-170, Plo's SF",1
"Talin Vandor",,,286661,Malevolence,"Malevolence Hyena Bomber, Vulture Droid, Sun Fac SF, Soldier SF, Spy SF",1
"Talin Vandor",1,1,109811,NS_Alt,"zzMT zzAV Zombie Talia zDaka",1
"Talin Vandor",,,431101,HansMF,"Home One, Han's MF, Rebel Y-wing, Bistan's U-wing, Phantom Ghost Cassian's U-wing, Wedge X-wing",1
"Talin Vandor",1,1,128580,JTR,"zzzJTR zzR2-D2 zzBB-8 RH Finn G9, zRH Poe",1
"Talin Vandor",0,1,114401,Grievous,"zzGG zB2 zB1 zMagnaGuard zNute",1
"Talin Vandor",1,0,116305,Traya,"zzTraya zzDN zSion zzEP Sith Empire Trooper",1
"Talin Vandor",,,96057,Mon Mothma,"zzMon Mothma, zCara Dune, Hoth Rebel Scout, Wedge Chirrut",1
"Talin Vandor",,,531397,Executrix,"Executrix Tie Adv, Emperor's Shuttle, TIE Reaper, Imperial TIE Fighter, Gauntlet Starfighter, FOSF TIE Fighter, FO TIE Fighter",1
"Talin Vandor",,,128462,Disintegration,"Aurra zzGreef zBoba zzBossk zzThe Mandalorian",1
"Talin Vandor",1,1,155158,Revan Offense,"zzzJKR zzGMY zBS zJolee zzHYoda",1
"Talin Vandor",1,1,96673,Ewoks,"zChirpa Elder zPaploo zWicket zLogray",1
"Talin Vandor",1,0,111996,ShaakClones,"zzShaak Ti, zRex zEcho (501st), zzFives zARC Trooper",1
"Talin Vandor",0,1,126480,BH,"zzJango zzEmbo zIG-88 zDengar Cad",1
"Talin Vandor",1,0,128965,Troopers,"zVeers zStarck zDT zzPiett zzGideon",1
"Talin Vandor",1,0,131349,CLS,"zzzCLS zHan zLeia zzOld Ben, zzChewbacca",1
"Talin Vandor",0,1,84247,Phoenix,"zHera Zeb G8, Sabine zEzra Kanan G8",1
"Talin Vandor",1,0,119910,zMaul,"zDarth Maul, zDooku zSidious Sith Assassin, zSavage",1
"Talin Vandor",1,0,82268,Jawas,"Nebit G8, Jawa Engineer, Jawa Scavenger, Jawa Dathcha",1
"Talin Vandor",1,0,14886,NestSolo (Counter),"Nest G9",1
"Talin Vandor",,,98127,Admiral Raddus,"zzAdmiral Raddus, zCassian zzJyn zK-2SO Bistan G8",0
"Talin Vandor",0,1,93996,Geonosians Omicron,"zzGBA Sun Fac, Geo Soldier, Geo Spy, Poggle",0
"Talin Vandor",,,69143,Bad Batch,"Hunter G9, Echo 5* G8, Omega G9, Tech G9, Wrecker G8",0
"Jadenhawke",0,1,118896,DRMalak,"zzzDR zzHK-47 zBSF zzMalak Sith Assassin",1
"Jadenhawke",0,1,111027,padme,"zzPadme zGK zJKA zAhsoka zBarriss",1
"Jadenhawke",,,412587,Negotiator,"Negotiator HT Anakin's Eta-2, Umbaran SF, Ahsoka's SF, BTL-B Y-wing, Clone Sergeant's ARC-170, Plo's SF",1
"Jadenhawke",,,294102,Malevolence,"Malevolence Hyena Bomber, Vulture Droid, Sun Fac SF, Soldier SF, Spy SF",1
"Jadenhawke",,,380784,HansMF,"Home One, Han's MF, Rebel Y-wing, Bistan's U-wing, Phantom Ghost Cassian's U-wing, Wedge X-wing",1
"Jadenhawke",1,0,103592,Traya,"zzTraya zzDN zSion Sith Empire Trooper G9, zzThrawn",1
"Jadenhawke",0,1,104042,Grievous,"zzGG zB2 zB1 zDroideka zDooku",1
"Jadenhawke",,,386430,Executrix,"Executrix Tie Adv, Emperor's Shuttle, TIE Reaper, Imperial TIE Fighter, Gauntlet Starfighter, FOSF TIE Fighter, FO TIE Fighter",1
"Jadenhawke",1,1,145964,Revan Offense,"zzzJKR zzGMY zBS zJolee zzHYoda",1
"Jadenhawke",1,1,102950,Ewoks,"zChirpa Elder zPaploo zWicket zLogray",1
"Jadenhawke",0,1,129640,BH,"zzBossk zzThe Mandalorian, zDengar zzJango zBoba",1
"Jadenhawke",1,1,101904,Carth,"zCarth Onasi, zMission zZaalbar zJuhani zCanderous",1
"Jadenhawke",1,1,112289,zEP,"zzEP zzzVader zzTarkin IPD G8, zzMara Jade, The Emperor's Hand",1
"Jadenhawke",0,1,91672,Phoenix,"zHera zZeb G9, zSabine zEzra zKanan G9",1
"Jadenhawke",1,0,20290,NestSolo (Counter),"zNest",1
"Jadenhawke",,,64486,Phasma,"Phasma G7, FOTP G9, FOSFTP G7, FOST G8, Kylo G7",0
"Jadenhawke",,,71582,Admiral Raddus,"zzAdmiral Raddus, Cassian G6, Jyn G7, Baze G7, Bistan G7",0
"Jadenhawke",1,0,119727,CLS,"zzzCLS zHan zzChewbacca zzC-3PO 6* zChewpio",0
"Jadenhawke",0,1,102559,Geonosians Omicron,"zzGBA Sun Fac, Geo Soldier, Geo Spy, Poggle",0
"Jadenhawke",1,1,85787,JTR,"zzzJTR R2-D2 G7, zzBB-8 RH Finn G8, RH Poe G7",0
"Jadenhawke",1,1,78907,NS,"MT G7, zzAV Daka G8, Zombie Spirit G6",0
"Jadenhawke",1,0,81322,Troopers,"zVeers zzPiett Gideon G7, zDark Trooper G9, Range Trooper G6",0
"Jadenhawke",,,87914,Mon Mothma,"zzMon Mothma G9, zCara Dune, zKyle Katarn, Chirrut G7, Lando",0
"Jadenhawke",1,0,90805,ShaakClones,"zzShaak Ti, zRex Echo (501st) G8, zzFives Clone Sergeant G7",0
"Jadenhawke",,,70146,Iden Troopers,"zIden Versio, Shoretrooper G9, Snowtrooper G7, Magma G6, DT G7",0
"Jadenhawke",,,92591,Bad Batch,"zHunter zEcho zzOmega G9, zTech zWrecker G8",0
"Jadenhawke",1,0,70610,Jawas,"Nebit G9, Jawa Engineer, Jawa Scavenger G9, Jawa G6, Dathcha G8",0
"CT5555",,,122536,Phasma,"zPhasma zFOTP FOSFTP zFOST zKylo",1
"CT5555",1,1,151215,SL Kylo,"zzzzzzSL Kylo, zSith Trooper, zHux zzKRU Thrawn",1
"CT5555",0,1,133885,padme,"zzPadme zGK zJKA zAhsoka zzC-3PO",1
"CT5555",,,459199,Negotiator,"Negotiator 6* HT Anakin's Eta-2, Umbaran SF, Ahsoka's SF, BTL-B Y-wing 6*, Plo's SF, Rex's ARC-170",1
"CT5555",,,87359,Disintegration,"Aurra Greef Boba Bossk The Mandalorian",1
"CT5555",1,1,137087,GAS,"zzzzGAS zRex zEcho (501st), zzFives zARC Trooper",1
"CT5555",1,1,88755,Ewoks,"zChirpa Elder Paploo zWicket Logray",1
"CT5555",1,1,99319,zEP,"zzEP zzVader Tarkin G9, TFP G9, zMara Jade, The Emperor's Hand 5*",1
"CT5555",,,97052,Nute-Sep,"zNute Dooku Jango zNest zDroideka",1
"CT5555",0,1,67884,Phoenix,"Hera G9, Zeb G8, Sabine G8, Chopper G8, Kanan G8",1
"CT5555",1,0,13488,SionSolo (Counter),"Sion G8",1
"CT5555",0,1,71295,Qira,"Qira G7, L3-37 zVandor Chewbacca 4*, Mission G8, Zaalbar G8",0
"CT5555",1,0,67104,CLS,"zCLS G9, Han G8, Chewbacca G9, R2-D2 G8, Chewpio 4* G8",0
"CT5555",0,1,90776,Geonosians Omicron,"zzGBA Sun Fac, Geo Soldier, Geo Spy, Poggle",0
"CT5555",0,1,100491,Grievous,"GG zB2 zB1 zMagnaGuard T3-M4",0
"CT5555",1,1,65061,NS,"MT G8, zAV Daka G9, Zombie G7, Spirit G7",0
"CT5555",,,355288,Executrix,"Executrix Tie Adv, Emperor's Shuttle 4*, TIE Reaper 4*, Imperial TIE Fighter, Gauntlet Starfighter 6*, FOSF TIE Fighter, FO TIE Fighter",0
"CT5555",1,0,89716,Troopers,"Veers zPiett Gideon 6* G9, zDark Trooper, Range Trooper",0
"CT5555",1,1,91282,Revan Offense,"zzJKR zGMY BS G9, zJolee G9, Ezra G7",0
"CT5555",,,58951,Mon Mothma,"zMon Mothma 5* G9, Kyle Katarn 6* G9, Biggs G8, Pao G8, Wedge G8",0
"CT5555",,,64042,Iden Troopers,"Iden Versio 4*, Shoretrooper G8, Snowtrooper G8, Magma G7, DT G8",0
"CT5555",,,70628,Bad Batch,"zHunter 5* Echo 5* zOmega 5* G8, Tech 5* zWrecker 6* G9",0
"CT5555",1,0,51453,Jawas,"Nebit 5* G7, Jawa Engineer 4* G9, Jawa Scavenger G7, Jawa 5* G7, Dathcha G7",0
"микаким",1,1,162841,SL Kylo,"zzzzzzSL Kylo, zSith Trooper, zHux zzKRU zzThrawn",1
"микаким",1,1,117867,NS,"zzMT zzAV zDaka Zombie Spirit",1
"микаким",0,1,138618,DRMalak,"zzzDR zzHK-47 zBSF zzMalak Sith Empire Trooper",1
"микаким",0,1,134349,padme,"zzPadme zGK zJKA zAhsoka zzC-3PO",1
"микаким",,,375087,HansMF,"Home One, Han's MF, Rebel Y-wing, Bistan's U-wing, Phantom Ghost Cassian's U-wing, Wedge X-wing",1
"микаким",,,453905,Negotiator,"Negotiator HT Anakin's Eta-2, Umbaran SF, Ahsoka's SF, Clone Sergeant's ARC-170, Plo's SF, Rex's ARC-170",1
"микаким",0,1,116812,Grievous-Wat,"zzGG zB2 zB1 zMagnaGuard zWat Tambor",1
"микаким",1,1,114855,JTR,"zzzJTR zScav Rey, zzBB-8 zzR2-D2 zFinn",1
"микаким",1,0,137274,Traya,"zzTraya zzDN zSion zDooku zzEP",1
"микаким",,,104501,Disintegration,"Aurra Greef zBoba zzBossk zzThe Mandalorian",1
"микаким",1,1,135308,Revan Offense,"zzzJKR zzGMY zBS zJolee zzHYoda",1
"микаким",1,1,90388,Ewoks,"zChirpa Elder Paploo zWicket zLogray",1
"микаким",1,0,105357,ShaakClones,"zzShaak Ti, zRex zEcho (501st), zzFives Clone Sergeant",1
"микаким",1,1,97552,Carth,"zCarth Onasi, zMission zZaalbar zJuhani zCanderous",1
"микаким",0,1,97408,BH,"zzJango IG-88 Dengar G9, Cad zGreedo",1
"микаким",1,0,110948,CLS,"zzzCLS zHan Wedge Biggs zzChewbacca",1
"микаким",0,1,71281,Phoenix,"Hera G8, Zeb G8, Sabine G8, Ezra Kanan",1
"микаким",1,1,71927,Rogue1,"Jyn G8, Chirrut Baze K-2SO G8, Cassian G8",1
"микаким",1,0,84883,Jawas,"Nebit Jawa Engineer, Jawa Scavenger, Jawa Dathcha",1
"микаким",1,0,18540,NestSolo (Counter),"zNest",1
"микаким",,,123004,Phasma,"zPhasma zFOTP FOSFTP zFOST zKylo",0
"микаким",,,273744,Malevolence,"Malevolence Hyena Bomber 4*, Vulture Droid 3*, Sun Fac SF, Soldier SF, Spy SF",0
"микаким",0,1,94060,Geonosians Omicron,"zzGBA Sun Fac, Geo Soldier, Geo Spy, Poggle",0
"микаким",,,453368,Executrix,"Executrix Tie Adv, Emperor's Shuttle 6*, TIE Reaper, Imperial TIE Fighter, Gauntlet Starfighter, FOSF TIE Fighter, FO TIE Fighter",0
"микаким",,,77712,Mon Mothma,"zzMon Mothma, Cara Dune G9, Scarif G8, Bodhi Rook G8, Lando",0
"микаким",1,0,105382,Troopers,"zVeers zStarck zDT zzPiett Shoretrooper G8",0
"Rhînò",0,1,109350,padme,"zzPadme G8, zGK zJKA zAhsoka zzC-3PO",1
"Rhînò",,,319276,HansMF,"Home One, Han's MF 5*, Rebel Y-wing 6*, Ghost Phantom Biggs X-wing, Cassian's U-wing, Wedge X-wing",1
"Rhînò",1,0,117271,Traya,"zzTraya zzDN zSion zzEP zzThrawn",1
"Rhînò",1,1,92631,JTR,"zzzJTR Scav Rey, BB-8 G9, zzR2-D2 Finn G8",1
"Rhînò",1,1,129906,Revan Offense,"zzzJKR zzGMY zBS zJolee zzHYoda",1
"Rhînò",1,0,105376,ShaakClones,"zzShaak Ti, zRex zEcho (501st), zzFives zARC Trooper",1
"Rhînò",1,1,87392,Ewoks,"zChirpa Elder zPaploo G9, Teebo G9, zWicket",1
"Rhînò",0,1,120973,BH,"zzBossk IG-88 zzGreef zzJango zBoba",1
"Rhînò",0,1,82828,FO,"zzKRU Kylo G8, FOO FOE Phasma G9",1
"Rhînò",0,1,73305,Phoenix,"Hera G8, Zeb G9, Sabine G8, zEzra zKanan G8",1
"Rhînò",1,0,15594,NestSolo (Counter),"zNest G8",1
"Rhînò",1,1,89846,NS,"zzMT zzAV zDaka G9, Zombie Spirit G8",0
"Rhînò",,,281718,Malevolence,"Malevolence Hyena Bomber 4*, Vulture Droid 5*, Sun Fac SF, Soldier SF, Spy SF",0
"Rhînò",0,1,116666,Geonosians Omicron,"zzGBA Sun Fac, Geo Soldier, Geo Spy, Poggle",0
"Rhînò",,,361202,Negotiator,"Negotiator HT Anakin's Eta-2 6*, Umbaran SF 6*, Ahsoka's SF, Clone Sergeant's ARC-170, Jedi Consular's Starfighter, Plo's SF",0
"Rhînò",1,0,90450,Troopers,"zVeers zStarck DT zzGideon G9, Shoretrooper",0
"Rhînò",1,0,100435,CLS,"zzzCLS zHan Wedge G8, Biggs zzChewbacca",0
"Rhînò",1,1,55887,Rogue1,"Jyn G8, Chirrut G8, Baze 6* G8, K-2SO G8, Cassian G8",0
"sharks198",0,1,133220,padme,"zzPadme zGK zJKA zAhsoka zzC-3PO",1
"sharks198",,,128234,Grievous Omicron,"zzGG zB2 zB1 zMagnaGuard zDroideka",1
"sharks198",1,0,122192,CLS,"zzzCLS zHan zzChewbacca zzR2-D2 zChewpio",1
"sharks198",,,487849,Negotiator,"Negotiator HT Anakin's Eta-2, Umbaran SF, Ahsoka's SF, Clone Sergeant's ARC-170, Plo's SF, Rex's ARC-170",1
"sharks198",,,356279,HansMF,"Home One, Han's MF, Biggs X-wing, Bistan's U-wing, Phantom Ghost Cassian's U-wing, Wedge X-wing",1
"sharks198",1,1,148826,Revan Offense,"zzzJKR zzGMY zBS zJolee zzHYoda",1
"sharks198",1,1,100200,Ewoks,"zChirpa Elder zPaploo zWicket zLogray",1
"sharks198",0,1,117833,BH,"zzBossk Dengar zzJango zBoba Cad",1
"sharks198",1,1,101584,Carth,"zCarth Onasi, zMission zZaalbar zJuhani zCanderous",1
"sharks198",1,1,113206,zEP,"zzEP zzzVader zTarkin TFP zBSF",1
"sharks198",0,1,84809,Phoenix,"zHera Zeb Ezra Chopper Kanan",1
"sharks198",0,1,78969,FO,"zzKRU zKylo G8, FOE G8, FOTP G8, Phasma G8",1
"sharks198",0,1,91832,Geonosians Omicron,"zzGBA Sun Fac, Geo Soldier, Geo Spy, Poggle",0
"sharks198",1,1,84156,NS,"zzMT zzAV Daka G9, Zombie G8, Spirit G7",0
"sharks198",1,0,68923,Traya,"Traya G7, DN G8, Sion 4* G8, Nest G6, zzThrawn",0
"sharks198",,,84570,Mon Mothma,"zMon Mothma, Biggs Wedge Chirrut G7, Lando",0
"sharks198",1,1,102918,GAS,"zzzGAS G8, zRex zEcho (501st) G9, zzFives zARC Trooper G9",0
"sharks198",1,0,64205,Troopers,"Veers G7, Starck G5, zzGideon G7, Snowtrooper G8, Stormtrooper G8",0
"sharks198",1,0,61905,Jawas,"Nebit G6, Jawa Engineer G7, Jawa Scavenger G5, Jawa G8, Dathcha G6",0
"GhostGhostGG",,,177665,JMK,"zzzzzzJMK zJKA zzGMY zzShaak Ti, zGK",1
"GhostGhostGG",,,126616,Phasma,"zPhasma zFOTP FOSFTP zFOST zKylo",1
"GhostGhostGG",,,505548,Negotiator,"Negotiator HT Anakin's Eta-2, Umbaran SF, Ahsoka's SF, BTL-B Y-wing, Clone Sergeant's ARC-170, Plo's SF",1
"GhostGhostGG",,,321911,HansMF,"Home One, Han's MF, Rebel Y-wing 6*, Bistan's U-wing, Phantom Ghost Cassian's U-wing, Wedge X-wing",1
"GhostGhostGG",0,1,128402,Grievous-Wat,"zzGG zB2 zB1 MagnaGuard zWat Tambor",1
"GhostGhostGG",1,0,116370,CLS,"zzzCLS zHan zzChewbacca R2-D2 zC-3PO",1
"GhostGhostGG",1,1,88153,Ewoks,"zChirpa Elder Paploo Wicket Logray",1
"GhostGhostGG",0,1,130992,BH,"zzBossk Dengar G8, zzJango zBoba Cad",1
"GhostGhostGG",1,1,85305,Carth,"Carth Onasi, Mission Zaalbar Juhani Canderous",1
"GhostGhostGG",1,1,131205,zEP,"zzEP zzzVader zTarkin TFP G9, zSith Trooper",1
"GhostGhostGG",1,0,115222,501st,"zRex zARC Trooper, zEcho (501st), zzFives zAhsoka",1
"GhostGhostGG",1,0,109237,zMaul,"zDarth Maul, zDooku zzDN zzzDR Savage",1
"GhostGhostGG",1,0,18838,SionSolo (Counter),"Sion",1
"GhostGhostGG",,,250335,Malevolence,"Malevolence Hyena Bomber 4*, Vulture Droid 4*, Sun Fac SF, Soldier SF, Spy SF",0
"GhostGhostGG",0,1,79063,Geonosians Omicron,"zGBA Sun Fac G7, Geo Soldier, Geo Spy G9, Poggle G9",0
"GhostGhostGG",1,1,75246,NS,"MT G8, zzAV Daka G8, Zombie G9, Spirit G7",0
"GhostGhostGG",1,0,80522,Troopers,"zVeers zzPiett Gideon 4* G7, zDark Trooper G9, Range Trooper G8",0
"GhostGhostGG",,,64529,Mon Mothma,"Mon Mothma 5* G7, Cara Dune, K-2SO G8, Wedge G8, Chirrut G8",0
"GhostGhostGG",,,51530,Iden Troopers,"Iden Versio 4* G7, Stormtrooper G9, Snowtrooper G7, Magma G7, DT 6* G5",0
"GhostGhostGG",0,1,61461,Phoenix,"Hera G8, Zeb G8, Ezra G8, Chopper G7, Kanan G9",0
"GhostGhostGG",,,90511,Bad Batch,"zHunter zEcho Omega 5* G9, zTech zWrecker",0
"GhostGhostGG",,,76484,Mando,"The Mandalorian (Beskar Armor), Dash Rendar G8, Nest 6* G7, IG-11 Kuiil",0
"GhostGhostGG",1,0,48083,Jawas,"Nebit G7, Jawa Engineer 5* G5, Jawa Scavenger G6, Jawa 6* G7, Dathcha G7",0
"LukebinSolo",1,1,163863,GL Rey,"zzzzzzRey zzzJTR zzBB-8 zRH Poe, zRH Finn",1
"LukebinSolo",0,1,124157,DRMalak,"zzzDR zzHK-47 zBSF zzMalak Sith Empire Trooper",1
"LukebinSolo",0,1,123012,padme,"zzPadme zGK zJKA zAhsoka zzC-3PO",1
"LukebinSolo",1,1,105003,NestSisters,"zzAV zzMT zDaka Zombie zNest",1
"LukebinSolo",,,415011,Negotiator,"Negotiator HT Anakin's Eta-2, Umbaran SF, Ahsoka's SF, Clone Sergeant's ARC-170, Jedi Consular's Starfighter, Plo's SF",1
"LukebinSolo",,,387389,HansMF,"Home One, Han's MF 5*, Biggs X-wing, Bistan's U-wing, Phantom Ghost Cassian's U-wing, Wedge X-wing",1
"LukebinSolo",0,1,117390,Grievous,"zzGG zB2 zB1 zMagnaGuard zNute",1
"LukebinSolo",1,0,122931,Traya,"zzTraya zzDN zSion zzEP zzThrawn",1
"LukebinSolo",1,1,117473,GAS,"zzzzGAS zRex zEcho (501st), zzFives zARC Trooper",1
"LukebinSolo",1,1,124757,Revan Offense,"zzzJKR zzGMY zBS zJolee zzHYoda",1
"LukebinSolo",1,1,96512,Ewoks,"zChirpa Elder zPaploo zWicket zLogray",1
"LukebinSolo",0,1,124452,BH,"zzBossk zzEmbo zDengar zzJango zBoba",1
"LukebinSolo",1,1,91135,Carth,"zCarth Onasi, zMission zZaalbar Juhani G8, zCanderous",1
"LukebinSolo",0,1,127597,FO,"zzKRU zKylo zHux FOE zFOST",1
"LukebinSolo",1,0,96998,Troopers,"zVeers zStarck zzGideon Snowtrooper zStormtrooper",1
"LukebinSolo",1,0,118735,CLS,"zzzCLS zHan Wedge Biggs zzChewbacca",1
"LukebinSolo",0,1,85021,Phoenix,"zHera Zeb G8, zSabine zEzra zKanan G8",1
"LukebinSolo",1,1,71943,Rogue1,"Jyn G8, Chirrut Baze K-2SO G8, Cassian",1
"LukebinSolo",1,0,115563,Jawas,"Nebit Jawa Engineer, Jawa Scavenger, Jawa Dathcha",1
"LukebinSolo",0,1,92342,Geonosians Omicron,"zzGBA Sun Fac, Geo Soldier, Geo Spy, Poggle",0
"LukebinSolo",,,69666,Mon Mothma,"Mon Mothma G7, Cara Dune G9, Scarif G8, Pao G8, Lando",0
"LukebinSolo",,,50292,Bad Batch,"Hunter 6* G6, Echo 5* G5, Omega G3, zTech 6* G9, Wrecker 5* G6",0
"T B3AR 14",,,161921,SEE,"zzzzzzSEE zBSF zzMalak zzzDR zzzVader",1
"T B3AR 14",1,1,96014,NS,"zzMT zAV zDaka Zombie Spirit",1
"T B3AR 14",,,167367,JMLS,"zzzJKR zzJKL zzzzzzJMLS zWat Tambor, zzzzGAS",1
"T B3AR 14",1,0,141423,CLS,"zzzCLS zHan zzChewbacca zC-3PO zChewpio",1
"T B3AR 14",0,1,120602,padme,"zzPadme zGK zJKA zAhsoka zBarriss",1
"T B3AR 14",,,287938,Malevolence,"Malevolence Hyena Bomber, Vulture Droid, Sun Fac SF, Soldier SF, Spy SF",1
"T B3AR 14",,,505464,Negotiator,"Negotiator HT Anakin's Eta-2, Umbaran SF, Ahsoka's SF, Clone Sergeant's ARC-170, Plo's SF, Rex's ARC-170",1
"T B3AR 14",1,1,123395,JTR,"zzzJTR zzR2-D2 zBB-8 zRH Finn, zRH Poe",1
"T B3AR 14",0,1,115500,Grievous,"zzGG zB2 zB1 MagnaGuard zNute",1
"T B3AR 14",1,0,108707,Traya,"zzTraya zDN zSion Sith Empire Trooper, zThrawn",1
"T B3AR 14",,,112161,Mon Mothma,"zzMon Mothma, zCara Dune, Biggs Wedge Lando",1
"T B3AR 14",1,1,74267,Ewoks,"zChirpa G9, Elder G9, Paploo G9, Wicket G9, Logray G9",1
"T B3AR 14",1,0,138613,ShaakClones,"zzShaak Ti, zRex zEcho (501st), zzFives zARC Trooper",1
"T B3AR 14",0,1,136499,BH,"zzBossk zIG-88 Dengar zJango zBoba",1
"T B3AR 14",1,1,86058,Carth,"Carth Onasi, zMission Zaalbar Juhani G8, Canderous",1
"T B3AR 14",1,0,121637,Troopers,"zVeers zStarck zzPiett Range Trooper, zStormtrooper",1
"T B3AR 14",0,1,78057,Phoenix,"Hera G8, Zeb G8, zEzra Chopper Kanan G9",1
"T B3AR 14",0,1,136588,BS,"zBS zGMY zJolee zzOld Ben, zzHYoda",1
"T B3AR 14",1,0,115101,EP (Counter, Rebel),"zzEP Krennic DT G9, zzWampa zNest",1
"T B3AR 14",0,1,91271,Geonosians Omicron,"zGBA Sun Fac, Geo Soldier, Geo Spy, Poggle",0
"T B3AR 14",1,0,122863,zMaul,"Darth Maul, zDooku zSidious zSavage Sith Marauder",0
"T B3AR 14",0,1,63115,FO,"KRU G8, Kylo G8, FOO FOTP G9, zSith Trooper G9",0
"Ashla Bogan",0,1,143177,padme,"zzPadme zGK zJKA zAhsoka zzzCAT",1
"Ashla Bogan",,,507268,Negotiator,"Negotiator HT Anakin's Eta-2, Umbaran SF, Ahsoka's SF, BTL-B Y-wing, Clone Sergeant's ARC-170, Plo's SF",1
"Ashla Bogan",0,1,133918,DR,"zzzDR zzHK-47 zBSF Sith Empire Trooper G8, Sith Assassin",1
"Ashla Bogan",1,1,148139,NS_Alt,"zzMT zzAV Zombie Talia zDaka",1
"Ashla Bogan",,,153700,JKL,"zzJKL zzzJKR zzHYoda zzOld Ben, zEzra",1
"Ashla Bogan",,,579112,HansMF,"Home One, Han's MF, Rebel Y-wing, Bistan's U-wing, Phantom Ghost Cassian's U-wing, Wedge X-wing",1
"Ashla Bogan",0,1,101372,Grievous,"zzGG zB2 G8, B1 G9, zMagnaGuard G9, zIG-88",1
"Ashla Bogan",1,0,165120,CLS,"zzzCLS zHan zzChewbacca zzR2-D2 zzC-3PO",1
"Ashla Bogan",,,139716,Disintegration,"zzAurra zzGreef zBoba zzBossk zzThe Mandalorian",1
"Ashla Bogan",1,1,107618,Ewoks,"zChirpa Elder zPaploo zWicket Logray",1
"Ashla Bogan",1,0,134646,ShaakClones,"zzShaak Ti, zRex zEcho (501st), zzFives zARC Trooper",1
"Ashla Bogan",1,1,138780,Carth,"zCarth Onasi, zMission zZaalbar zJuhani zCanderous",1
"Ashla Bogan",1,1,140626,zEP,"zzEP zzzVader zzTarkin TFP zzMara Jade, The Emperor's Hand 6*",1
"Ashla Bogan",0,1,114772,BH,"zzJango zZam zDengar Cad zGreedo",1
"Ashla Bogan",0,1,137905,Phoenix,"zHera zZeb zSabine Chopper zKanan",1
"Ashla Bogan",0,1,100190,FO,"zzKRU zKylo G9, zHux FOO zPhasma",1
"Ashla Bogan",1,1,144884,Rogue1,"zzJyn Chirrut Baze zK-2SO zCassian",1
"Ashla Bogan",,,110400,Bad Batch,"zHunter zEcho zzOmega zTech zWrecker",1
"Ashla Bogan",1,0,111456,zMaul,"zDarth Maul, zDooku zzDN zSidious zSavage",1
"Ashla Bogan",1,0,87895,Jawas,"Nebit Jawa Engineer, Jawa Scavenger, Jawa Dathcha",1
"Ashla Bogan",1,0,14635,SionSolo (Counter),"Sion G8",1
"Ashla Bogan",,,288269,Malevolence,"Malevolence Hyena Bomber, Vulture Droid 6*, Sun Fac SF, Soldier SF, Spy SF",0
"Ashla Bogan",0,1,101518,Geonosians Omicron,"zzGBA Sun Fac, Geo Soldier, Geo Spy, Poggle",0
"Ashla Bogan",,,100725,Mon Mothma,"Mon Mothma 6* G8, zCara Dune, Biggs Hoth Rebel Scout, Wedge",0
"Ashla Bogan",1,0,68574,Troopers,"zVeers zzPiett 5* Gideon 4* G7, Dark Trooper 6* G7, Range Trooper 6* G7",0
