Player,Offense,Defense,GP,Name,Squad,Viable
"Rui Vuusen",1,1,122214,zEP,"zzEP zzzVader zzTarkin Dooku Krennic",1
"Rui Vuusen",0,1,84025,BS,"zBS GMY Jolee G8, GK G8, zJKA",1
"Rui Vuusen",,,58153,Phasma,"Phasma G7, FOTP G7, FOO G7, zzKRU Kylo G9",0
"Rui Vuusen",1,0,60689,CLS,"CLS G8, Han Chewbacca G9, R2-D2 G8, Chewpio 5* G8",0
"Rui Vuusen",0,1,88919,Geonosians Omicron,"zzGBA Sun Fac, Geo Soldier, Geo Spy, Poggle",0
"Rui Vuusen",,,280854,HansMF,"Home One, Han's MF, HT Bistan's U-wing, Phantom Ghost Cassian's U-wing, Biggs X-wing",0
"Rui Vuusen",0,1,47666,Grievous,"GG G8, B2 G6, MagnaGuard G7, IG-88 G8, T3-M4 G7",0
"Rui Vuusen",1,0,44714,ShaakClones,"Shaak Ti G8, Rex G7, Echo (501st) G6, Fives G9, Clone Sergeant G8",0
"Rui Vuusen",1,0,76949,Troopers,"zVeers Starck zPiett Dark Trooper 3* G9, Snowtrooper G5",0
"Rui Vuusen",1,0,50612,Wiggs,"Wedge G6, Biggs G8, Fulcrum G7, C-3PO G9, Leia G8",0
"Darthobiwan84",,,165076,JMLS,"zzzJKR zzJKL zzzzzzJMLS zWat Tambor, zzzzGAS",1
"Darthobiwan84",1,0,145628,CLS,"zzzCLS zHan zzChewbacca zzC-3PO zChewpio",1
"Darthobiwan84",0,1,126157,DRMalak,"zzzDR zHK-47 zBSF zzMalak Sith Empire Trooper",1
"Darthobiwan84",,,377847,HansMF,"Home One, Han's MF, Rebel Y-wing 6*, Ghost Phantom Biggs X-wing, Cassian's U-wing, Wedge X-wing",1
"Darthobiwan84",0,1,121424,Grievous,"zzGG zB2 zB1 zDroideka Dooku",1
"Darthobiwan84",1,1,82175,Ewoks,"zChirpa Elder Paploo zWicket Logray",1
"Darthobiwan84",0,1,99145,BH,"zzBossk zGreef The Mandalorian, Jango Boba",1
"Darthobiwan84",1,1,114505,zEP,"zzEP zzzVader Tarkin G8, TFP G8, zzMara Jade, The Emperor's Hand",1
"Darthobiwan84",0,1,72076,Phoenix,"Hera G9, Kanan G8, Ezra Zeb Chopper",1
"Darthobiwan84",0,1,114225,padme,"zzPadme zGK zJKA zAhsoka Fives G9",1
"Darthobiwan84",0,1,125961,BS,"zBS zGMY zJolee zzOld Ben, zzHYoda",1
"Darthobiwan84",,,56959,Phasma,"Phasma G8, FOE 5* G8, FOO G8, KRU G8, Kylo G8",0
"Darthobiwan84",,,44506,Admiral Raddus,"Admiral Raddus 3* G8, Cassian 6* G8, Jyn 6* G8, Baze 6* G8, Chirrut 5* G8",0
"Darthobiwan84",0,1,91921,Geonosians Omicron,"zzGBA Sun Fac, Geo Soldier, Geo Spy, Poggle",0
"Darthobiwan84",,,356861,Negotiator,"Negotiator HT Anakin's Eta-2, Umbaran SF, Ahsoka's SF, Clone Sergeant's ARC-170, Jedi Consular's Starfighter, Plo's SF 6*",0
"Darthobiwan84",1,1,99461,JTR,"JTR Scav Rey, BB-8 G9, R2-D2 Finn G9",0
"Darthobiwan84",1,1,59387,NS,"MT G8, AV Daka G8, Zombie 6* G8, Spirit G8",0
"Darthobiwan84",,,117690,Mon Mothma,"zzMon Mothma, zKyle Katarn, Biggs Lando Wedge",0
"Darthobiwan84",1,1,83648,Carth,"Carth Onasi, Mission Zaalbar Juhani G7, zCanderous",0
"Dannycool1987",,,186297,SEE,"zzzzzzSEE zBSF zzMalak zzzDR zzzVader",1
"Dannycool1987",1,1,133495,JTR,"zzzJTR zR2-D2 zzBB-8 zRH Finn, zRH Poe",1
"Dannycool1987",0,1,102673,Grievous,"zzGG zB2 G9, zDroideka MagnaGuard G9, zDooku",1
"Dannycool1987",1,1,127711,Revan,"zzzJKR zBS zzGMY zJolee GK G8",1
"Dannycool1987",1,1,87381,Carth,"zCarth Onasi, Mission G8, zZaalbar zJuhani Canderous",1
"Dannycool1987",1,0,114136,Troopers,"zVeers zStarck zzGideon zStormtrooper zzPiett",1
"Dannycool1987",0,1,71538,Phoenix,"Hera G8, Kanan G9, Ezra G8, Zeb G8, Chopper",1
"Dannycool1987",1,0,120103,zMaul,"zDarth Maul, zzDN zSidious Sith Empire Trooper, Sith Marauder",1
"Dannycool1987",1,0,16647,SionSolo (Counter),"Sion",1
"Dannycool1987",,,74082,Phasma,"Phasma G8, FOTP FOO G8, KRU Kylo G8",0
"Dannycool1987",0,1,77436,Geonosians Omicron,"zzGBA 5* G9, Sun Fac, Geo Soldier, Geo Spy G9, Poggle",0
"Dannycool1987",1,1,74529,NS,"MT G9, AV Daka G9, Zombie G8, Spirit G9",0
"Dannycool1987",1,0,73901,501st,"Rex G8, ARC Trooper G8, Echo (501st) G9, Fives G9, Ahsoka",0
"Dannycool1987",1,0,53579,Wiggs,"Wedge 6* G9, Biggs G8, CLS G4, Han G8, Leia G9",0
"Dannycool1987",0,1,72795,BH,"Jango 5* G9, Cad G8, IG-88 G9, Greedo G8, Boba",0
"Dannycool1987",1,1,54271,Rogue1,"Jyn 5* G8, Chirrut 5* G8, Baze 6* G8, K-2SO G8, Cassian 5* G8",0
"San Holo",1,0,136503,CLS,"zzzCLS zHan zzChewbacca zzC-3PO zChewpio",1
"San Holo",0,1,121241,padme,"zzPadme zGK zJKA zAhsoka zBarriss",1
"San Holo",,,400421,Negotiator,"Negotiator HT Anakin's Eta-2, Umbaran SF, Ahsoka's SF, Clone Sergeant's ARC-170, Jedi Consular's Starfighter, Plo's SF",1
"San Holo",0,1,121953,Grievous-Wat,"zzGG zB2 zB1 zMagnaGuard zWat Tambor 6*",1
"San Holo",1,0,94145,Traya,"zzTraya DN G8, Sion G8, zzEP zzThrawn",1
"San Holo",1,0,111781,Troopers,"zVeers zzPiett zzGideon zDark Trooper, Range Trooper",1
"San Holo",,,91888,Disintegration,"Aurra Greef Boba zzBossk The Mandalorian",1
"San Holo",1,1,104671,GAS,"zzzzGAS Rex zEcho (501st), zFives ARC Trooper",1
"San Holo",1,1,123853,Revan Offense,"zzzJKR zzGMY BS zJolee zHYoda",1
"San Holo",1,1,87378,Ewoks,"zChirpa Elder zPaploo zWicket Logray",1
"San Holo",0,1,68385,Phoenix,"Hera G8, Kanan G8, Ezra G8, Zeb G8, Chopper G9",1
"San Holo",1,0,16626,NestSolo (Counter),"zNest G9",1
"San Holo",,,75861,Phasma,"zPhasma FOE G7, FOO G9, KRU zKylo G9",0
"San Holo",0,1,97635,Geonosians Omicron,"zzGBA Sun Fac, Geo Soldier, Geo Spy, Poggle",0
"San Holo",,,344546,HansMF,"Home One, Han's MF, Rebel Y-wing 6*, Bistan's U-wing, Phantom Biggs X-wing, Cassian's U-wing, Wedge X-wing",0
"San Holo",1,1,79360,JTR,"JTR Scav Rey, BB-8 G9, R2-D2 Finn",0
"San Holo",1,1,69461,NS_Alt,"zMT G8, zzAV Zombie G8, Talia G7, Daka G7",0
"San Holo",,,88686,Mon Mothma,"Mon Mothma G9, Biggs zCara Dune, Lando Wedge",0
"San Holo",,,86484,Nute-OR,"Nute zDooku zJango Zaalbar G7, Mission G8",0
"San Holo",1,1,66125,Rogue1,"Jyn G9, Chirrut G8, Baze G9, K-2SO G8, Bistan G5",0
"cjedimommy",,,124724,Phasma,"zPhasma zFOTP FOSFTP zFOST zKylo",1
"cjedimommy",1,1,150089,SL Kylo,"zzzzzzSL Kylo, zSith Trooper, zHux zzKRU Thrawn G8",1
"cjedimommy",,,582683,Executor,"Executor HT RC Xanadu Blood, Slave I, IG-2000 Imperial TIE Fighter, Tie Adv",1
"cjedimommy",,,173154,JMLS,"zzzJKR zzJKL zzzzzzJMLS zWat Tambor, zzzzGAS",1
"cjedimommy",1,0,143664,CLS,"zzzCLS zHan zzChewbacca zC-3PO zChewpio",1
"cjedimommy",0,1,112105,padme,"zzPadme zGK zJKA zAhsoka zCW Chewbacca",1
"cjedimommy",,,443933,Negotiator,"Negotiator BTL-B Y-wing, Anakin's Eta-2, Rex's ARC-170, Umbaran SF, Ahsoka's SF, Plo's SF, Clone Sergeant's ARC-170",1
"cjedimommy",1,1,109463,NS_Alt,"zzMT zzAV Zombie Talia zDaka",1
"cjedimommy",,,394009,HansMF,"Home One, Han's MF, Rebel Y-wing 6*, Bistan's U-wing, Phantom Biggs X-wing, Cassian's U-wing, Wedge X-wing",1
"cjedimommy",0,1,115494,Grievous,"zzGG zB2 zB1 zMagnaGuard zNute",1
"cjedimommy",1,1,113002,JTR,"zzzJTR Scav Rey G8, zBB-8 zzR2-D2 Finn G9",1
"cjedimommy",1,0,120927,Troopers,"zVeers zzPiett zGideon zDark Trooper, Range Trooper",1
"cjedimommy",1,1,87860,Ewoks,"zChirpa Elder zPaploo zWicket zLogray G9",1
"cjedimommy",1,0,117980,ShaakClones,"zzShaak Ti, zRex zEcho (501st), zzFives zARC Trooper",1
"cjedimommy",0,1,138736,BH,"zzBossk Cad zIG-88 zBoba zDengar",1
"cjedimommy",1,1,91444,Carth,"zCarth Onasi, zMission zZaalbar Juhani zCanderous",1
"cjedimommy",1,1,130176,zEP,"zzEP zzzVader Tarkin TFP zBSF",1
"cjedimommy",0,1,72335,Phoenix,"zHera G8, Kanan G8, Ezra G8, Zeb G8, Chopper",1
"cjedimommy",0,1,134041,BS,"zBS zzGMY zJolee zzOld Ben, zzHYoda",1
"cjedimommy",,,273353,Malevolence,"Malevolence Hyena Bomber 4*, Vulture Droid 4*, Sun Fac SF, Soldier SF, Spy SF",0
"cjedimommy",0,1,98851,Geonosians Omicron,"zzGBA Sun Fac, Geo Soldier, Geo Spy, Poggle",0
"cjedimommy",,,109912,Mon Mothma,"zzMon Mothma, Biggs Lando zJyn G8, Wedge",0
"cjedimommy",0,1,90141,BH,"zzJango Greef G8, Zam G8, zzThe Mandalorian, Greedo G7",0
"cjedimommy",,,58019,Iden Troopers,"Iden Versio 6*, Shoretrooper Snowtrooper G5, Magma G8, DT G1",0
"cjedimommy",,,87391,Bad Batch,"zHunter Echo Omega G9, Tech zWrecker",0
"cjedimommy",,,88387,Mando,"zzThe Mandalorian (Beskar Armor), Dash Rendar, Nest G2, IG-11 G9, Kuiil G9",0
"TK 79347",0,1,110673,padme,"zzPadme GK JKA zAhsoka zzC-3PO",1
"TK 79347",,,377299,HansMF,"Home One, Han's MF, Rebel Y-wing, Bistan's U-wing, Phantom Ghost Cassian's U-wing, Biggs X-wing",1
"TK 79347",1,1,107619,Revan Offense,"zzzJKR zzGMY zHYoda Jolee Ezra",1
"TK 79347",1,1,103665,Ewoks,"zChirpa Elder zPaploo zWicket zLogray",1
"TK 79347",0,1,123432,BH,"zzBossk zzThe Mandalorian, zIG-88 zBoba zDengar",1
"TK 79347",1,1,90465,Carth,"zCarth Onasi, Mission Zaalbar G9, zJuhani zCanderous",1
"TK 79347",1,1,132796,zEP,"zzEP zzzVader zzTarkin TFP G8, zBSF",1
"TK 79347",1,0,89510,Clones,"zCody zRex Echo (501st), Fives ARC Trooper G8",1
"TK 79347",1,0,111826,CLS,"zzzCLS Han Leia Old Ben, zzChewbacca",1
"TK 79347",0,1,82157,Phoenix,"zHera Kanan G8, Sabine Zeb G9, Chopper",1
"TK 79347",,,74573,Phasma,"Phasma G8, FOTP G9, FOO KRU Kylo",0
"TK 79347",0,1,96474,Geonosians Omicron,"zzGBA Sun Fac, Geo Soldier, Geo Spy, Poggle",0
"TK 79347",1,1,87445,JTR,"JTR Scav Rey, BB-8 zR2-D2 Finn G9",0
"TK 79347",0,1,93030,Grievous,"GG zB2 MagnaGuard G9, zDooku zT3-M4",0
"TK 79347",1,1,71868,NS,"MT G8, AV Daka Zombie G8, Spirit G9",0
"TK 79347",1,0,65435,Troopers,"Veers Starck G7, Stormtrooper G9, Snowtrooper G9, DT 6* G9",0
"TK 79347",0,1,87288,BH,"Jango Greef Aurra G8, Cad Zam",0
"Kryshoff",0,1,90247,Grievous,"zzGG B2 G8, B1 Dooku zT3-M4",1
"Kryshoff",1,1,144450,Revan,"zzzJKR zBS zzGMY zJolee zGK",1
"Kryshoff",1,1,98403,Ewoks,"zChirpa Elder zPaploo zWicket zLogray",1
"Kryshoff",1,1,96171,Carth,"zCarth Onasi, Mission G9, zZaalbar zJuhani zCanderous",1
"Kryshoff",1,1,120996,zEP,"zzEP zVader Tarkin zBSF zzMara Jade, The Emperor's Hand",1
"Kryshoff",0,1,109312,BH,"zzJango Greef zzThe Mandalorian, Boba zBossk",1
"Kryshoff",0,1,77191,Phoenix,"Hera Kanan Ezra G8, Zeb G8, Chopper",1
"Kryshoff",1,0,13380,SionSolo (Counter),"Sion G8",1
"Kryshoff",,,63379,Phasma,"Phasma G8, FOTP G8, FOSFTP G7, FOST G8, Kylo",0
"Kryshoff",1,0,78946,CLS,"zCLS Han G8, Chewbacca G8, R2-D2 Chewpio G8",0
"Kryshoff",0,1,94367,Geonosians Omicron,"zzGBA Sun Fac, Geo Soldier, Geo Spy, Poggle",0
"Kryshoff",1,1,70665,NestSisters,"zAV MT Daka Zombie G8, Nest 6* G6",0
"Kryshoff",,,77641,Mon Mothma,"Mon Mothma 5* G7, zKyle Katarn, Hoth Rebel Soldier, Cara Dune, Lando",0
"Kryshoff",1,0,92466,ShaakClones,"Shaak Ti G7, zRex zEcho (501st), zzFives Clone Sergeant G9",0
"Kryshoff",1,0,69717,Wiggs,"Wedge G7, Biggs G8, Fulcrum G8, C-3PO G9, Leia",0
"Kryshoff",1,0,58209,Troopers,"Veers Starck G6, Stormtrooper G8, Snowtrooper G8, DT G7",0
"Kryshoff",1,1,57936,Rogue1,"Jyn G8, Chirrut G7, Baze 5* G6, K-2SO G9, Cassian G8",0
"Kryshoff",1,0,71052,QGJ,"QGJ Aayla G6, JKA Old Ben, Ahsoka G8",0
"Kryshoff",1,0,55526,Jawas,"Nebit G6, Jawa Engineer G7, Jawa Scavenger G7, Jawa 6* G7, Dathcha G9",0
"Skinwalker",,,162643,JMLS,"zBS zzzzzzJMLS zzHYoda zzJKL zJolee",1
"Skinwalker",1,0,150332,CLS,"zzzCLS zHan zzChewbacca zzC-3PO zChewpio",1
"Skinwalker",0,1,107574,Geonosians Omicron,"zzGBA Sun Fac, Geo Soldier, Geo Spy, Poggle",1
"Skinwalker",,,426020,HansMF,"Home One, Han's MF, Rebel Y-wing, Bistan's U-wing, Phantom Ghost Cassian's U-wing, Wedge X-wing",1
"Skinwalker",1,1,113054,JTR,"zzzJTR Scav Rey, BB-8 G9, zzR2-D2 Finn",1
"Skinwalker",,,105460,Mon Mothma,"zzMon Mothma, Chirrut Baze Biggs Wedge",1
"Skinwalker",1,1,95360,Ewoks,"zChirpa Elder zPaploo zWicket zLogray",1
"Skinwalker",1,0,119917,ShaakClones,"zzShaak Ti, zRex zEcho (501st), zzFives zARC Trooper",1
"Skinwalker",0,1,118875,BH,"zzBossk zzThe Mandalorian, zzJango zBoba Dengar G9",1
"Skinwalker",1,1,102247,Carth,"zCarth Onasi, zMission zZaalbar zJuhani Canderous G8",1
"Skinwalker",1,1,118519,zEP,"zzEP zzzVader Tarkin TFP zzMara Jade, The Emperor's Hand",1
"Skinwalker",0,1,95412,Phoenix,"zHera zKanan zEzra Sabine zZeb",1
"Skinwalker",,,124752,Bad Batch,"zHunter zEcho zzOmega zTech zWrecker",1
"Skinwalker",1,0,14890,NestSolo (Counter),"Nest",1
"Skinwalker",1,0,14665,SionSolo (Counter),"Sion G9",1
"Skinwalker",,,64813,Phasma,"Phasma G9, FOTP FOSFTP G9, FOST 5* G9, Kylo G9",0
"Skinwalker",0,1,119247,padme,"zzPadme zGK zJKA zAhsoka Barriss G8",0
"Skinwalker",,,90319,Grievous Omicron,"GG B2 B1 MagnaGuard Droideka",0
"Skinwalker",1,1,82847,NS,"MT zzAV Daka Zombie Spirit G8",0
"Skinwalker",0,1,113819,DR,"zzzDR zzHK-47 zBSF Sith Assassin G7, zzThrawn",0
"Skinwalker",,,72584,Iden Troopers,"Iden Versio G8, zStormtrooper Snowtrooper G8, Magma G7, DT G9",0
"Skinwalker",1,0,53346,Troopers,"Veers G9, Starck G1, Gideon 6* G6, Shoretrooper G8, Piett G7",0
"Skinwalker",1,0,65687,Jawas,"Nebit G7, Jawa Engineer G9, Jawa Scavenger G8, Jawa G9, Dathcha G9",0
"Gobo",,,122916,Phasma,"zPhasma zFOTP FOSFTP zFOST zKylo",1
"Gobo",1,1,146406,SL Kylo,"zzzzzzSL Kylo, zSith Trooper, zHux zzKRU zThrawn",1
"Gobo",0,1,100079,Grievous,"zzGG zB2 zB1 MagnaGuard zNute",1
"Gobo",1,1,84200,Ewoks,"zChirpa Elder Paploo zWicket Logray",1
"Gobo",0,1,103083,BH,"zzBossk Greedo zJango zBoba Dengar",1
"Gobo",1,1,99269,zEP,"zzEP zzVader Tarkin Dooku G8, TFP",1
"Gobo",0,1,66629,Phoenix,"Hera G8, Kanan G8, Ezra G9, Zeb G8, Chopper G9",1
"Gobo",1,0,55435,Jawas,"Nebit G8, Jawa Engineer, Jawa Scavenger G8, Jawa G9, Dathcha G9",1
"Gobo",1,0,14862,NestSolo (Counter),"Nest G9",1
"Gobo",1,0,87813,CLS,"zzCLS zHan zChewbacca G9, C-3PO G8, Chewpio 6*",0
"Gobo",0,1,97541,Geonosians Omicron,"zzGBA Sun Fac, Geo Soldier, Geo Spy, Poggle",0
"Gobo",1,1,56997,Revan,"JKR G7, BS G8, GMY G7, zJolee G8, GK G6",0
"MiscountedStitch",,,132732,Phasma,"zPhasma FOE FOO zzKRU zKylo",1
"MiscountedStitch",0,1,83852,Geonosians Omicron,"GBA 5* Sun Fac, Geo Soldier, Geo Spy, Poggle",0
"MiscountedStitch",1,1,103986,JTR,"zzzJTR R2-D2 G7, zzBB-8 RH Finn 6*, RH Poe 4*",0
"MiscountedStitch",1,1,54462,NS_Alt,"MT 6* G8, AV Spirit 6* G8, Talia 6* G9, Daka G9",0
"MiscountedStitch",1,1,70236,zEP,"EP zVader Tarkin DT 5* G8, Sith Trooper 6*",0
"MiscountedStitch",0,1,85992,BH,"zBossk 3* Cad G9, IG-88 Greedo G9, zBoba",0
"MiscountedStitch",1,0,66288,501st,"Rex Clone Sergeant 6* G8, Echo (501st) G8, Fives Ahsoka G9",0
"MiscountedStitch",1,0,49886,Wiggs,"Wedge 5* G9, Biggs G8, Han G7, Ezra G9, Leia G8",0
"MiscountedStitch",1,1,51206,Rogue1,"Jyn 5* G8, Chirrut 6* G8, Baze 6* G8, K-2SO Cassian G8",0
"MiscountedStitch",0,1,56686,Phoenix,"Hera 5* Kanan G8, Sabine 5* G9, Zeb G8, Chopper 6*",0
"Zimphire",1,1,101178,NS,"zzMT zzAV zDaka Zombie Spirit",1
"Zimphire",1,0,152720,CLS,"zzzCLS zHan zzChewbacca zzC-3PO zChewpio",1
"Zimphire",0,1,159714,DRMalak,"zzzDR zzHK-47 zBSF zzMalak Sith Empire Trooper",1
"Zimphire",,,128024,Grievous Omicron,"zzGG zB2 zB1 zMagnaGuard zDroideka",1
"Zimphire",0,1,125094,padme,"zzPadme zGK zJKA zAhsoka CW Chewbacca G9",1
"Zimphire",0,1,133393,Geonosians Omicron,"zzGBA Sun Fac, Geo Soldier, Geo Spy, Poggle",1
"Zimphire",,,445259,HansMF,"Home One, Han's MF, HT Bistan's U-wing, Phantom Ghost Cassian's U-wing, Biggs X-wing",1
"Zimphire",1,0,142628,Traya,"zzTraya zzDN zSion zzEP zzThrawn",1
"Zimphire",,,99712,Nute-Wat,"zNute zDooku zWat Tambor 5*, zJango zNest",1
"Zimphire",1,1,142539,Revan Offense,"zzzJKR zzGMY zBS zJolee Ezra",1
"Zimphire",1,1,90707,Ewoks,"zChirpa Elder zPaploo Wicket zLogray",1
"Zimphire",1,0,111464,ShaakClones,"zzShaak Ti, zRex zEcho (501st), zzFives zARC Trooper",1
"Zimphire",0,1,121842,BH,"zzBossk zzGreef zzThe Mandalorian, zBoba Dengar",1
"Zimphire",1,1,99914,Carth,"zCarth Onasi, zMission zZaalbar zJuhani zCanderous",1
"Zimphire",0,1,83748,Phoenix,"Hera Kanan Sabine Zeb Chopper",1
"Zimphire",1,0,90891,zMaul,"zDarth Maul, Sidious Sith Assassin, zSavage Sith Marauder",1
"Zimphire",1,0,81813,Jawas,"Nebit Jawa Engineer, Jawa Scavenger, Jawa Dathcha",1
"Zimphire",,,61602,Phasma,"Phasma FOTP G8, FOSFTP 6* G6, FOST 5* G8, Kylo",0
"Zimphire",1,1,78158,JTR,"JTR G8, Scav Rey, BB-8 G9, R2-D2 Finn G9",0
"Zimphire",1,0,77109,Troopers,"Veers G9, Piett G8, Gideon Dark Trooper, Range Trooper G8",0
"Zimphire",,,70385,Mon Mothma,"Mon Mothma 5* G7, Kyle Katarn, Biggs Cara Dune, Lando G8",0
"Zimphire",1,1,62094,Rogue1,"Jyn 6* G8, Chirrut 5* G8, Baze G8, K-2SO G8, Cassian G8",0
"Zimphire",,,50199,Bad Batch,"Hunter 5* G8, Echo 4* G8, Omega 5* G8, Tech 5* G8, Wrecker 5* G8",0
"Loinky",,,122433,Phasma,"zPhasma zFOTP FOSFTP zFOST zKylo",1
"Loinky",1,1,143240,SL Kylo,"zzzzzzSL Kylo, zSith Trooper, zHux zzKRU Thrawn",1
"Loinky",1,1,91185,Revan,"zzJKR BS GMY zJolee GK",1
"Loinky",0,1,88414,BH,"zBossk Cad G9, zThe Mandalorian, Jango Boba",1
"Loinky",1,0,81006,Troopers,"zVeers Starck Magma zDark Trooper, Snowtrooper",1
"Loinky",0,1,65426,Phoenix,"Hera G8, Kanan G8, Ezra Zeb G8, Chopper G8",1
"Loinky",1,0,89818,CLS,"zzzCLS zHan zChewbacca R2-D2 G8, zChewpio 4*",0
"Loinky",0,1,75832,Geonosians Omicron,"zGBA Sun Fac G9, Geo Soldier G9, Geo Spy, Poggle",0
"Loinky",1,1,65676,Ewoks,"Chirpa Elder Paploo 6* Wicket 5* Logray 5*",0
"Loinky",1,1,94969,zEP,"zEP zzVader Tarkin DT 4* Mara Jade, The Emperor's Hand 4* G9",0
"Bintbelas",,,124088,Phasma,"zPhasma zFOTP FOSFTP zFOST zKylo",1
"Bintbelas",1,1,159868,SL Kylo,"zzzzzzSL Kylo, zSith Trooper, zHux zzKRU Thrawn",1
"Bintbelas",0,1,111936,padme,"zzPadme zGK zJKA zAhsoka C-3PO",1
"Bintbelas",0,1,118052,DRMalak,"zzzDR HK-47 zBSF zzMalak 6* Sith Marauder",1
"Bintbelas",,,289389,Malevolence,"Malevolence 6* Hyena Bomber, Vulture Droid, Sun Fac SF, Soldier SF, Spy SF",1
"Bintbelas",,,311758,HansMF,"Home One, Han's MF, HT Ghost Phantom Biggs X-wing, Cassian's U-wing, Wedge X-wing",1
"Bintbelas",0,1,95583,Grievous,"zzGG B2 G9, Droideka G8, MagnaGuard zDooku",1
"Bintbelas",1,1,71156,JTR,"zJTR G8, Scav Rey G8, BB-8 G9, R2-D2 G8, Finn G9",1
"Bintbelas",1,1,108332,Revan Offense,"zzzJKR zGMY zBS zJolee Ezra G9",1
"Bintbelas",1,1,76563,Ewoks,"zChirpa Elder Paploo Wicket Logray",1
"Bintbelas",1,1,81310,Carth,"zCarth Onasi, zMission zZaalbar Juhani G8, zCanderous",1
"Bintbelas",0,1,96028,BH,"zBossk Cad IG-88 Jango Boba",1
"Bintbelas",1,1,125267,zEP,"zzEP zzzVader Tarkin TFP zzTraya",1
"Bintbelas",1,0,17574,SionSolo (Counter),"Sion",1
"Bintbelas",0,1,96464,Geonosians Omicron,"zzGBA Sun Fac, Geo Soldier, Geo Spy, Poggle",0
"Bintbelas",1,1,52904,NS_Alt,"AV Spirit G7, Zombie G8, Talia G6, Daka G8",0
"Bintbelas",1,0,79202,ShaakClones,"Shaak Ti 6* G9, Rex Echo (501st), zFives Clone Sergeant",0
"Bintbelas",1,0,92714,Troopers,"zVeers Starck Iden Versio G8, zPiett Dark Trooper 5* G9",0
"Bintbelas",1,0,88926,CLS,"zzCLS zHan Leia G8, Old Ben G9, zChewbacca",0
"Bintbelas",0,1,64341,Phoenix,"Hera G8, Kanan G8, Sabine G7, Zeb G8, Chopper G8",0
"Mr Nuggins",1,1,97750,Ewoks,"zChirpa Elder zPaploo zWicket zLogray",1
"Mr Nuggins",0,1,76615,Phoenix,"Hera Kanan Ezra Zeb Chopper",1
"Mr Nuggins",,,158740,Negotiator,"Negotiator BTL-B Y-wing 4*, Anakin's Eta-2 3*, Rex's ARC-170 4*, Umbaran SF 4*, Ahsoka's SF, Plo's SF, Clone Sergeant's ARC-170",0
"Mr Nuggins",0,1,97361,Geonosians Omicron,"zzGBA Sun Fac, Geo Soldier, Geo Spy, Poggle",0
"Mr Nuggins",1,0,58887,Wiggs,"Wedge G7, Biggs G5, CLS G8, Han G7, Leia",0
"Mr Nuggins",1,0,60074,Wampa (Counter),"Rex G5, zzWampa HYoda G4, Jyn G6, FOO G8",0
"Mr Nuggins",1,0,50730,Troopers,"Veers G6, zStarck G8, Range Trooper G6, Piett G6, Snowtrooper G5",0
"Mr Nuggins",1,0,34301,Jawas,"Nebit G2, Jawa Engineer G1, Jawa Scavenger G1, Jawa G3, Dathcha G3",0
"Micah",,,34379,Phasma,"Phasma 5* G8, FOE 5* G8, FOO 5* G8, KRU 5* G8, Kylo 5* G8",0
"Micah",1,1,33161,NS_Alt,"MT 5* G8, AV 5* G8, Spirit 5* G8, Talia 5* G8, Daka 5* G8",0
"Micah",1,0,36296,501st,"Rex 5* G8, Clone Sergeant 5* G8, Echo (501st) 5* G8, Fives 5* G8, Ahsoka G8",0
"Micah",1,0,33161,Wiggs,"Wedge 5* G8, Biggs 5* G8, Leia 5* G8, Chirrut 5* G8, Baze 5* G8",0
"Micah",0,1,32885,Phoenix,"Hera 5* G8, Ezra 5* G8, Sabine 5* G8, Zeb 5* G8, Chopper 5* G8",0
