Player,Offense,Defense,GP,Name,Squad,Viable
"Zeno",0,1,66600,BH,"Bossk 5* Fennec Shand 3* G8, Cad G8, Jango G8, Boba G9",0
"Zeno",1,0,55206,501st,"Rex G8, Clone Sergeant 5* G8, Echo (501st) G8, Fives G8, Ahsoka",0
"Zeno",,,51550,Iden Troopers,"Iden Versio 4* G8, Stormtrooper G8, Snowtrooper 6* G8, Magma G7, DT 5* G8",0
"Zeno",1,0,36296,Wiggs,"Wedge 5* G8, Biggs 5* G8, Leia G8, Chirrut 5* G8, Baze 5* G8",0
"Zeno",0,1,68810,BS,"BS GMY Jolee 3* GK 6* G7, JKA 5* G8",0
"Jeff29",,,127184,Phasma,"zPhasma zFOTP FOSFTP zFOST zKylo",1
"Jeff29",1,1,168184,SL Kylo,"zzzzzzSL Kylo, zSith Trooper, zHux zzKRU zzThrawn",1
"Jeff29",0,1,143403,padme,"zzPadme zGK zJKA zAhsoka zzzCAT",1
"Jeff29",,,187260,JMLS,"zzzJKR zzJKL zzzzzzJMLS zzHYoda zzzzGAS",1
"Jeff29",1,0,146021,CLS,"zzzCLS zHan zzChewbacca zzC-3PO zChewpio",1
"Jeff29",1,1,121809,JTR,"zzzJTR zScav Rey, BB-8 G9, zzR2-D2 zFinn",1
"Jeff29",1,0,134857,Traya,"zzTraya zzDN zSion zDooku zzEP",1
"Jeff29",,,99348,Nute-Wat,"zNute zB1 zB2 zMagnaGuard zWat Tambor 5*",1
"Jeff29",,,108189,Mon Mothma,"zzMon Mothma, K-2SO Biggs Lando Wedge",1
"Jeff29",1,1,85416,Ewoks,"zChirpa Elder Paploo zWicket Logray",1
"Jeff29",1,1,84476,Carth,"zCarth Onasi, Mission G8, Zaalbar G8, zJuhani zCanderous",1
"Jeff29",0,1,95612,BH,"zzBossk Cad G9, IG-88 G9, zJango zBoba",1
"Jeff29",0,1,74578,Phoenix,"zHera Kanan G8, zEzra G9, Zeb G8, Chopper G9",1
"Jeff29",0,1,58018,Geonosians Omicron,"GBA 6* G9, Sun Fac G6, Geo Soldier G8, Geo Spy G3, Poggle G6",0
"Jeff29",,,395985,HansMF,"Home One, Han's MF, Rebel Y-wing 6*, Ghost Phantom Biggs X-wing, Cassian's U-wing 5*, Wedge X-wing",0
"Jeff29",,,379556,Negotiator,"Negotiator 6* HT Anakin's Eta-2, Umbaran SF, Ahsoka's SF, Clone Sergeant's ARC-170, Jedi Consular's Starfighter 3*, Plo's SF 3*",0
"Jeff29",1,1,74058,NS,"MT G8, zzAV Daka G9, Zombie G8, Spirit G8",0
"Jeff29",1,0,74633,ShaakClones,"zzShaak Ti, Rex G8, Echo (501st) G8, Fives G9, Clone Sergeant",0
"Jeff29",1,0,102025,Troopers,"Veers Starck zStormtrooper zzPiett zDark Trooper 5* G7",0
"Jeff29",,,50287,Iden Troopers,"zIden Versio 3* G8, Shoretrooper 6* G8, Snowtrooper G8, Magma G1, DT 6* G8",0
"Jeff29",1,0,137241,zMaul,"Darth Maul, zBSF zzzDR zSidious Sith Marauder",0
"victorim",0,1,122051,Geonosians Omicron,"zzGBA Sun Fac, Geo Soldier, Geo Spy, Poggle",1
"victorim",1,1,137232,Revan,"zzzJKR zBS zGMY zJolee zGK",1
"victorim",0,1,71151,FO,"zKRU Kylo G8, FOE Phasma G8, FOO G8",1
"victorim",,,299422,Negotiator,"Negotiator 5* BTL-B Y-wing 2*, Anakin's Eta-2, Rex's ARC-170 5*, Umbaran SF, Ahsoka's SF, Plo's SF, Clone Sergeant's ARC-170",0
"victorim",1,1,51566,NS_Alt,"MT 5* G8, AV G8, Spirit 6* G8, Talia 6* G9, Daka G9",0
"victorim",1,0,84468,ShaakClones,"zzShaak Ti 6*, Rex Echo (501st), Fives Clone Sergeant G8",0
"victorim",1,1,56541,zEP,"EP 6* G8, Vader G8, Tarkin G8, Dooku 6* G8, Traya 6* G7",0
"victorim",0,1,60407,Phoenix,"Hera 5* G8, Kanan G9, Ezra G8, Zeb G8, Chopper G8",0
"victorim",1,1,37988,Rogue1,"Jyn 5* G8, Chirrut 5* G8, Baze 5* G8, K-2SO G8, Cassian 6* G8",0
"victorim",,,60639,Bad Batch,"Hunter 5* zEcho 5* Omega 3* G9, Tech 5* G9, Wrecker 5* G8",0
"MINIGoody",0,1,104719,padme,"zzPadme GK G9, JKA G9, zAhsoka zzC-3PO",1
"MINIGoody",1,1,93652,NS_Alt,"zzMT zAV Zombie Talia zDaka",1
"MINIGoody",0,1,106914,DR,"zzzDR zzHK-47 zBSF Sith Assassin G9, Thrawn G9",1
"MINIGoody",,,404190,HansMF,"Home One, Han's MF 5*, HT 6* Ghost Phantom Biggs X-wing, Cassian's U-wing, Wedge X-wing",1
"MINIGoody",1,0,108121,Traya,"zzTraya DN G9, zSion zDooku zzEP",1
"MINIGoody",1,1,108536,Revan Offense,"zzzJKR zGMY BS zJolee Ezra",1
"MINIGoody",1,1,97612,Ewoks,"zChirpa Elder Paploo Teebo zWicket",1
"MINIGoody",1,0,106822,ShaakClones,"zzShaak Ti, zRex Echo (501st), zzFives ARC Trooper",1
"MINIGoody",1,1,106253,Carth,"zCarth Onasi, zMission Zaalbar zJuhani zCanderous",1
"MINIGoody",0,1,133586,BH,"zzBossk Cad zZam zzJango zBoba",1
"MINIGoody",1,0,130929,CLS,"zzzCLS zHan Leia Old Ben, zzChewbacca",1
"MINIGoody",1,0,77370,IG88,"IG-88 zGG G9, BB-8 G8, T3-M4 G8, L3-37 G8",1
"MINIGoody",,,69707,Phasma,"Phasma G8, FOTP G9, FOO G8, KRU G9, Kylo G9",0
"MINIGoody",0,1,113464,Geonosians Omicron,"zzGBA Sun Fac, Geo Soldier, Geo Spy, Poggle",0
"MINIGoody",,,265411,Malevolence,"Malevolence 5* Hyena Bomber 4*, Vulture Droid 5*, Sun Fac SF, Soldier SF, Spy SF",0
"MINIGoody",,,72903,Nute-Wat,"Nute G8, zB1 zB2 MagnaGuard G7, Wat Tambor 5* G6",0
"MINIGoody",1,0,47465,Troopers,"Veers G9, Piett 5* G7, Gideon 5* G5, Dark Trooper 5* G8, Range Trooper 6* G6",0
"MINIGoody",,,63330,Mon Mothma,"Mon Mothma 5* G7, K-2SO G9, Biggs Cara Dune G8, Wedge G8",0
"MINIGoody",1,0,58103,zMaul,"Darth Maul, Sidious Sith Empire Trooper 6* G6, Sith Marauder 6* G6, Nest 6* G9",0
"MINIGoody",0,1,73022,Phoenix,"Hera Kanan G8, Sabine 6* G8, Zeb G8, Chopper",0
"MINIGoody",1,1,57009,Rogue1,"Jyn 6* G8, Chirrut 6* G8, Baze G8, Bodhi Rook G8, Cassian G8",0
"Ghent Sinite",,,108921,Phasma,"zPhasma FOE FOO zzKRU zKylo",1
"Ghent Sinite",,,171237,SEE,"zzzzzzSEE zBSF zzMalak zzzDR zzzVader",1
"Ghent Sinite",1,1,105365,NS,"zzMT zzAV zDaka Zombie Spirit",1
"Ghent Sinite",1,0,145797,CLS,"zzzCLS zHan zzChewbacca zzC-3PO zChewpio",1
"Ghent Sinite",0,1,135383,padme,"zzPadme zGK zJKA zAhsoka zBarriss",1
"Ghent Sinite",,,510155,Negotiator,"Negotiator HT Anakin's Eta-2, Umbaran SF, Ahsoka's SF, BTL-B Y-wing, Clone Sergeant's ARC-170, Plo's SF",1
"Ghent Sinite",,,333642,Malevolence,"Malevolence Hyena Bomber, Vulture Droid, Sun Fac SF, Soldier SF, Spy SF",1
"Ghent Sinite",0,1,112756,Geonosians Omicron,"zzGBA Sun Fac, Geo Soldier, Geo Spy, Poggle",1
"Ghent Sinite",,,131260,JKL,"zzJKL zzzJKR zzHYoda zzOld Ben, Aayla",1
"Ghent Sinite",,,446122,HansMF,"Home One, Han's MF, Rebel Y-wing, Bistan's U-wing, Phantom Ghost Cassian's U-wing, Biggs X-wing",1
"Ghent Sinite",0,1,126612,Grievous,"zzGG zB2 zB1 zMagnaGuard zNute",1
"Ghent Sinite",1,0,112720,Traya,"zzTraya zDN zSion Sith Empire Trooper G9, zzThrawn",1
"Ghent Sinite",1,1,106970,JTR,"zzzJTR Scav Rey, zzBB-8 zzR2-D2 Finn",1
"Ghent Sinite",,,124298,Disintegration,"Aurra zzGreef zBoba zzBossk zzThe Mandalorian",1
"Ghent Sinite",1,1,140436,GAS,"zzzzGAS zRex zEcho (501st), zzFives zARC Trooper",1
"Ghent Sinite",1,1,99576,Ewoks,"zChirpa Elder zPaploo zWicket zLogray",1
"Ghent Sinite",1,1,103219,Carth,"zCarth Onasi, zMission zZaalbar zJuhani zCanderous",1
"Ghent Sinite",0,1,133957,BH,"zzJango Cad zzEmbo zIG-88 zDengar",1
"Ghent Sinite",1,0,123212,Troopers,"zVeers zStarck zIden Versio, zGideon zzPiett",1
"Ghent Sinite",1,0,127839,zMaul,"zDarth Maul, zSidious zDooku Sith Marauder, zNest",1
"Ghent Sinite",0,1,96656,Phoenix,"zHera zKanan zEzra zSabine Zeb G8",1
"Ghent Sinite",1,0,118299,EP (Counter, Rebel),"zzEP Shoretrooper Krennic zDT zzWampa",1
"Ghent Sinite",1,0,84101,Jawas,"Nebit Jawa Engineer, Jawa Scavenger, Jawa Dathcha",1
"Ghent Sinite",,,85470,Admiral Raddus,"Admiral Raddus 4* G9, zCassian zzJyn zK-2SO G8, Bistan",0
"Ghent Sinite",,,462998,Executrix,"Executrix Tie Adv, Emperor's Shuttle, TIE Reaper 6*, Imperial TIE Fighter, Gauntlet Starfighter, FOSF TIE Fighter, FO TIE Fighter",0
"Ghent Sinite",,,85748,Mon Mothma,"Mon Mothma G8, Biggs zCara Dune, Lando Wedge",0
"Shaun",0,1,95000,padme,"zzPadme zGK G9, zJKA zAhsoka C-3PO",1
"Shaun",0,1,104475,DRMalak,"zzzDR zzHK-47 zBSF zzMalak Sith Empire Trooper G8",1
"Shaun",,,366135,Negotiator,"Negotiator 5* HT Anakin's Eta-2, Umbaran SF, Ahsoka's SF, Clone Sergeant's ARC-170, Plo's SF, Rex's ARC-170",1
"Shaun",1,1,119877,Revan Offense,"zzzJKR zGMY zBS zJolee zEzra",1
"Shaun",1,1,91328,Ewoks,"zChirpa Elder zPaploo zWicket zLogray",1
"Shaun",0,1,129091,BH,"zzBossk zIG-88 Greedo zBoba zDengar",1
"Shaun",1,1,102075,Carth,"zCarth Onasi, zMission zZaalbar zJuhani zCanderous",1
"Shaun",1,1,137222,zEP,"zzEP zzzVader zzTarkin TFP zzMara Jade, The Emperor's Hand",1
"Shaun",1,0,79614,Clones,"zCody zRex Echo (501st), Fives ARC Trooper G8",1
"Shaun",0,1,94280,Phoenix,"zHera zKanan zSabine zZeb Chopper",1
"Shaun",,,72027,Phasma,"Phasma G8, Sith Trooper G8, FOO zzKRU G8, Kylo G8",0
"Shaun",,,60957,Grievous Omicron,"GG G8, B2 G8, B1 G9, MagnaGuard G7, Droideka G8",0
"Shaun",0,1,102029,Geonosians Omicron,"zzGBA Sun Fac, Geo Soldier, Geo Spy, Poggle",0
"Shaun",1,1,76819,NS,"zMT AV Daka Zombie Spirit G9",0
"Shaun",,,337732,HansMF,"Home One, Han's MF, Biggs X-wing, Bistan's U-wing 5*, Phantom Ghost Cassian's U-wing, Wedge X-wing",0
"Shaun",1,1,71574,JTR,"JTR G8, Scav Rey, BB-8 G9, R2-D2 Finn G9",0
"Shaun",1,0,84635,CLS,"zzzCLS Han Wedge Biggs G8, Chewbacca",0
"Shaun",1,0,82895,Troopers,"Veers 6* Starck G8, Shoretrooper G9, zzPiett DT",0
"Shaun",0,1,90921,BH,"zJango zzGreef Boushh (Leia Organa) 3* G8, Cad zzThe Mandalorian",0
"Shaun",1,1,57540,Rogue1,"Jyn G7, Chirrut G8, Baze 5* G7, K-2SO G7, Cassian G8",0
"Shaun",,,42881,Bad Batch,"Hunter 5* G8, Echo 3* G8, Omega G8, Tech 5* G8, Wrecker 4* G8",0
"Shaun",1,0,48179,Jawas,"Nebit G4, Jawa Engineer G4, Jawa Scavenger G4, Jawa G4, Dathcha G4",0
"DarthCicatrices",1,0,148991,CLS,"zzzCLS zHan zzChewbacca zzC-3PO zChewpio",1
"DarthCicatrices",,,111325,Mon Mothma,"zzMon Mothma, Biggs zCara Dune, Lando Wedge",1
"DarthCicatrices",1,1,108210,Ewoks,"zChirpa Elder zPaploo Teebo zWicket",1
"DarthCicatrices",0,1,117627,BH,"zzBossk zzThe Mandalorian, zzJango zBoba Dengar",1
"DarthCicatrices",,,153318,JMLS,"zzzzzzJMLS zzJKL zzHYoda zzOld Ben, Ezra 5* G8",0
"DarthCicatrices",0,1,55313,padme,"Padme 6* G7, GK G2, zJKA Ahsoka G7, CW Chewbacca G8",0
"DarthCicatrices",0,1,78560,Geonosians Omicron,"zzGBA 5* Sun Fac G8, Geo Soldier, Geo Spy, Poggle",0
"DarthCicatrices",,,366744,HansMF,"Home One, Han's MF, Rebel Y-wing 6*, Bistan's U-wing 4*, Phantom 5* Biggs X-wing, Cassian's U-wing, Wedge X-wing",0
"DarthCicatrices",1,1,109882,JTR,"zzzJTR Scav Rey, BB-8 G6, zzR2-D2 zFinn",0
"DarthCicatrices",0,1,72840,Grievous,"GG B2 G2, Droideka G8, zDooku IG-88",0
"DarthCicatrices",1,1,67127,NS,"MT G7, AV G9, zDaka Zombie G7, Spirit G8",0
"DarthCicatrices",1,1,95535,zEP,"EP G6, zzzVader Tarkin TFP zBSF",0
"DarthCicatrices",1,0,79255,Wampa (Counter),"Rex zzWampa DT G6, Jyn G9, FOO G6",0
"Agent 47",,,128135,Phasma,"zPhasma zFOTP FOSFTP zFOST zKylo",1
"Agent 47",1,1,171370,SL Kylo,"zzzzzzSL Kylo, zSith Trooper, zHux zzKRU zzThrawn",1
"Agent 47",0,1,99618,padme,"zPadme zGK zJKA zAhsoka C-3PO",1
"Agent 47",1,1,94046,NS_Alt,"zMT zzAV Zombie Talia zDaka",1
"Agent 47",,,442433,HansMF,"Home One, Han's MF, HT Bistan's U-wing, Phantom Ghost Cassian's U-wing, Wedge X-wing",1
"Agent 47",1,1,112064,JTR,"zzzJTR zScav Rey, zzBB-8 zzR2-D2 zFinn",1
"Agent 47",1,0,110016,Troopers,"zVeers zzPiett zGideon zDark Trooper, Range Trooper",1
"Agent 47",,,95707,Nute-OR,"zNute zDooku Jango zZaalbar zMission",1
"Agent 47",1,1,115471,Revan Offense,"zzzJKR GMY zBS zJolee zEzra",1
"Agent 47",1,1,93175,Ewoks,"zChirpa Elder zPaploo zWicket zLogray",1
"Agent 47",0,1,139350,BH,"zzBossk zzThe Mandalorian, zIG-88 zBoba zDengar",1
"Agent 47",1,1,140652,zEP,"zzEP zzzVader zzTarkin TFP zzMara Jade, The Emperor's Hand",1
"Agent 47",,,106754,Iden Troopers,"zIden Versio, zStormtrooper Snowtrooper Magma zDT",1
"Agent 47",1,0,98171,Clones,"zCody zRex zEcho (501st), zzFives ARC Trooper",1
"Agent 47",1,0,105818,Wiggs,"Wedge Biggs zzzCLS zHan Chewbacca",1
"Agent 47",0,1,98674,Phoenix,"zHera zKanan zSabine zZeb Chopper",1
"Agent 47",1,1,82344,Rogue1,"Jyn Chirrut Baze G8, K-2SO Cassian",1
"Agent 47",1,0,14229,NestSolo (Counter),"Nest G9",1
"Agent 47",,,63477,Grievous Omicron,"GG 6* G8, B2 G9, B1 G8, MagnaGuard G8, Droideka G9",0
"Agent 47",0,1,90560,Geonosians Omicron,"zzGBA Sun Fac, Geo Soldier, Geo Spy, Poggle",0
"Agent 47",0,1,97653,DRMalak,"zzzDR HK-47 zBSF Malak 5* G8, Sith Assassin G8",0
"Agent 47",,,82552,Mon Mothma,"Mon Mothma 6* G7, zKyle Katarn, Bistan G7, Cara Dune, Lando G9",0
"Agent 47",,,43029,Bad Batch,"Hunter 5* G9, Echo 4* G9, Omega 5* G7, Tech 5* G8, Wrecker 5* G8",0
"Agent 47",1,0,12319,SionSolo (Counter),"Sion G7",0
"Cranjis McBasketball",1,0,90549,ShaakClones,"zzShaak Ti G9, Rex Echo (501st), zFives ARC Trooper",1
"Cranjis McBasketball",0,1,136599,BH,"zzBossk Cad zIG-88 zBoba Dengar",1
"Cranjis McBasketball",1,1,122746,zEP,"zzEP zzzVader Tarkin DT TFP",1
"Cranjis McBasketball",0,1,61706,Phoenix,"Hera G8, Kanan G8, Ezra G9, Zeb G8, Chopper G8",1
"Cranjis McBasketball",,,32609,Phasma,"Phasma 5* G8, FOE 5* G8, FOO 5* G8, KRU 5* G8, Kylo 5* G8",0
"Cranjis McBasketball",1,0,91588,CLS,"zzCLS zHan zChewbacca R2-D2 Chewpio 4*",0
"Cranjis McBasketball",0,1,92582,Geonosians Omicron,"zzGBA Sun Fac, Geo Soldier, Geo Spy, Poggle",0
"Cranjis McBasketball",,,339116,HansMF,"Home One, Han's MF, HT Ghost Phantom Biggs X-wing, Cassian's U-wing, Wedge X-wing",0
"Cranjis McBasketball",1,1,46775,NS,"MT AV 5* G8, Daka G9, Zombie 5* G8, Spirit G8",0
"Cranjis McBasketball",1,1,77006,Ewoks,"zChirpa Elder Paploo Wicket 3* Logray",0
"Cranjis McBasketball",1,0,101973,Troopers,"Veers Starck Stormtrooper zzPiett Snowtrooper",0
"Cranjis McBasketball",1,0,53554,Wiggs,"Wedge G8, Biggs G9, Leia G9, Chirrut 5* G8, Baze 5* G8",0
"Cranjis McBasketball",0,1,42928,BS,"BS 5* G8, GMY G9, JKA 5* G9, GK G7, Ahsoka",0
"BenHanSolo",,,122543,Phasma,"zPhasma zFOTP FOSFTP zFOST zKylo",1
"BenHanSolo",1,1,156110,SL Kylo,"zzzzzzSL Kylo, zSith Trooper, zHux zzKRU Thrawn",1
"BenHanSolo",1,0,128673,CLS,"zzCLS zHan zChewbacca zzC-3PO zChewpio",1
"BenHanSolo",0,1,115639,DRMalak,"zzzDR HK-47 BSF zzMalak Sith Empire Trooper",1
"BenHanSolo",,,445865,Negotiator,"Negotiator HT Anakin's Eta-2, Umbaran SF, Ahsoka's SF, BTL-B Y-wing, Clone Sergeant's ARC-170, Plo's SF",1
"BenHanSolo",,,329400,HansMF,"Home One, Han's MF, Rebel Y-wing 6*, Ghost Phantom Biggs X-wing, Cassian's U-wing, Wedge X-wing",1
"BenHanSolo",0,1,126153,Grievous,"zzGG zB2 zB1 zDroideka IG-88",1
"BenHanSolo",1,1,81801,JTR,"zzzJTR Scav Rey G8, BB-8 G8, R2-D2 G8, Finn G9",1
"BenHanSolo",1,0,121243,Troopers,"zVeers zzPiett zGideon zDark Trooper, Range Trooper",1
"BenHanSolo",,,113922,Disintegration,"zAurra zGreef Boba zzBossk zThe Mandalorian G8",1
"BenHanSolo",1,1,128164,GAS,"zzzzGAS zRex Echo (501st), zzFives ARC Trooper",1
"BenHanSolo",1,1,127802,Revan,"zzzJKR BS zGMY zJolee zGK",1
"BenHanSolo",1,1,75421,Ewoks,"zChirpa G9, Elder Paploo Wicket Logray",1
"BenHanSolo",1,1,89026,Carth,"zCarth Onasi, Mission Zaalbar zVandor Chewbacca, Canderous",1
"BenHanSolo",1,1,123239,zEP,"zEP zzVader Tarkin TFP zMara Jade, The Emperor's Hand",1
"BenHanSolo",0,1,62783,Phoenix,"Hera G8, Kanan G8, Ezra G8, Sabine G8, Zeb G8",1
"BenHanSolo",1,1,61492,Rogue1,"Jyn G8, Chirrut G8, Baze G8, K-2SO G8, Cassian G8",1
"BenHanSolo",1,0,14185,SionSolo (Counter),"Sion G8",1
"BenHanSolo",,,274910,Malevolence,"Malevolence 5* Hyena Bomber 6*, Vulture Droid, Sun Fac SF, Soldier SF, Spy SF",0
"BenHanSolo",0,1,95715,Geonosians Omicron,"zzGBA Sun Fac, Geo Soldier, Geo Spy, Poggle",0
"BenHanSolo",1,1,82561,NS,"MT G8, zAV zDaka Zombie Spirit G8",0
"BenHanSolo",,,99561,Mon Mothma,"zzMon Mothma G9, zKyle Katarn, zPao Hoth Rebel Scout, zCara Dune",0
"BenHanSolo",,,69648,Nute-Wat,"Nute Dooku G9, zWat Tambor 5* G9, Jango Nest G1",0
"BattleSchlong",,,122235,Phasma,"zPhasma zFOTP FOSFTP zFOST zKylo",1
"BattleSchlong",1,0,106783,ShaakClones,"zzShaak Ti, zRex zEcho (501st), zzFives zARC Trooper",1
"BattleSchlong",1,0,19234,SionSolo (Counter),"zSion",1
"BattleSchlong",1,0,108759,CLS,"zzzCLS zHan zzChewbacca 6* G9, R2-D2 G8, zChewpio",0
"BattleSchlong",0,1,130315,Geonosians Omicron,"zzGBA Sun Fac, Geo Soldier, Geo Spy, Poggle",0
"BattleSchlong",,,301993,Negotiator,"Negotiator 6* HT Anakin's Eta-2, Umbaran SF 5*, Ahsoka's SF, Clone Sergeant's ARC-170, Jedi Consular's Starfighter, Plo's SF",0
"BattleSchlong",1,1,111915,zEP,"zzEP zzVader Tarkin G7, zSith Trooper, zzMara Jade, The Emperor's Hand 5*",0
"BattleSchlong",0,1,88876,BH,"Bossk 5* Cad Jango zBoba Dengar G9",0
"BattleSchlong",1,0,76218,Troopers,"zVeers Starck G7, zzGideon Stormtrooper G9, Snowtrooper G8",0
"BattleSchlong",0,1,57568,Phoenix,"Hera G7, Kanan G6, Ezra G7, Zeb G7, Chopper G7",0
"Nerf",,,121718,Phasma,"zPhasma zFOTP FOSFTP zFOST zKylo",1
"Nerf",1,1,97710,Revan Offense,"zzJKR GMY G9, BS zJolee Ezra G8",1
"Nerf",1,1,88072,Carth,"zCarth Onasi, zMission Zaalbar Juhani Canderous",1
"Nerf",0,1,78845,BH,"zBossk G9, Greef G8, The Mandalorian, Jango Boba G9",1
"Nerf",1,1,145627,SL Kylo,"zzzzzzSL Kylo, zSith Trooper, zHux zzKRU Thrawn 6* G8",0
"Nerf",0,1,89951,Geonosians Omicron,"zGBA Sun Fac, Geo Soldier, Geo Spy, Poggle",0
"Nerf",,,58735,Grievous Omicron,"zGG G9, B2 5* G8, B1 3* G8, MagnaGuard 6* Droideka 6* G9",0
"Nerf",0,1,87102,DRMalak,"zzDR HK-47 BSF zMalak 6* Sith Marauder 4* G9",0
"Nerf",1,1,63653,JTR,"JTR R2-D2 G8, zBB-8 G9, RH Finn 3* G7, RH Poe 5* G9",0
"Nerf",1,1,33172,NS_Alt,"MT 5* G8, AV 5* G8, Spirit 5* G8, Talia 5* G8, Daka 5* G8",0
"Nerf",1,1,69495,zEP,"EP Vader G8, Tarkin G8, Traya G8, DN 5* G8",0
"Nerf",1,0,53437,501st,"Rex G8, Clone Sergeant 5* G8, Echo (501st) G8, Fives G9, Ahsoka G9",0
"Nerf",1,0,58390,Wiggs,"Wedge 5* G8, Biggs 5* G8, CLS G9, zHan Leia G9",0
"Nerf",1,0,51171,Troopers,"Veers 6* G9, Starck 5* G5, Range Trooper 5* G9, Shoretrooper 6* G8, zPiett 5* G8",0
"Nerf",0,1,56313,Phoenix,"Hera G8, Kanan G8, Sabine 5* G8, Zeb G8, Chopper G8",0
"Nerf",1,1,35787,Rogue1,"Jyn 5* G8, Chirrut 5* G8, Baze 5* G8, K-2SO 5* G8, Cassian 5* G8",0
"predator159",0,1,124337,DRMalak,"zzzDR zzHK-47 zBSF zzMalak Sith Assassin G8",1
"predator159",0,1,123902,padme,"zzPadme zGK zJKA zAhsoka zC-3PO",1
"predator159",1,0,101612,CLS,"zzzCLS zHan zzChewbacca R2-D2 G8, zChewpio",1
"predator159",0,1,96817,Geonosians Omicron,"zzGBA Sun Fac, Geo Soldier, Geo Spy, Poggle",1
"predator159",,,452143,Negotiator,"Negotiator HT Anakin's Eta-2, Umbaran SF, Ahsoka's SF, Clone Sergeant's ARC-170, Plo's SF, Rex's ARC-170",1
"predator159",1,1,126165,Revan Offense,"zzzJKR zzGMY zBS zJolee zzHYoda",1
"predator159",1,1,82621,Ewoks,"zChirpa Elder Paploo zWicket Logray",1
"predator159",1,0,105380,ShaakClones,"zzShaak Ti, zRex zEcho (501st), zzFives zARC Trooper",1
"predator159",1,1,92815,Carth,"zCarth Onasi, Mission Zaalbar zJuhani zCanderous",1
"predator159",0,1,89303,BH,"zzBossk Greef G9, The Mandalorian, Jango G9, zBoba",1
"predator159",1,1,112591,zEP,"zzEP zzzVader Tarkin TFP G8, zzMara Jade, The Emperor's Hand",1
"predator159",0,1,121452,FO,"zzKRU zKylo zHux FOE FOO",1
"predator159",0,1,63111,Phoenix,"Hera G8, Kanan G8, Ezra G8, Zeb G8, Chopper G8",1
"predator159",1,0,20028,NestSolo (Counter),"zNest",1
"predator159",1,0,11344,SionSolo (Counter),"Sion G8",1
"predator159",,,66297,Grievous Omicron,"GG G8, B2 G8, B1 MagnaGuard G9, Droideka G8",0
"predator159",,,269765,HansMF,"Home One, Han's MF 5*, Rebel Y-wing 4*, Bistan's U-wing 4*, Phantom Ghost Cassian's U-wing, Wedge X-wing",0
"predator159",1,1,80034,NS,"MT G8, zzAV Daka G8, Zombie Spirit G8",0
"predator159",1,0,78457,Troopers,"zVeers zPiett Gideon G9, Dark Trooper 6* G9, Range Trooper G8",0
"predator159",,,63238,Mon Mothma,"Mon Mothma 5* G8, Kyle Katarn G7, Baze G8, K-2SO G8, Cassian G8",0
"predator159",,,71416,Iden Troopers,"zIden Versio G9, Stormtrooper G8, Snowtrooper G8, Magma G9, DT",0
"predator159",,,46925,Bad Batch,"Hunter 5* G8, Echo 4* G8, Omega G8, Tech 4* G8, Wrecker 4* G7",0
"Cyprien Saint",1,0,130064,CLS,"zzzCLS zHan zChewbacca zzC-3PO zChewpio",1
"Cyprien Saint",,,109544,Disintegration,"Aurra zGreef Boba zBossk zThe Mandalorian",1
"Cyprien Saint",1,1,78197,Ewoks,"zChirpa Elder Paploo G9, Wicket Logray",1
"Cyprien Saint",0,1,91570,FO,"zzKRU zKylo FOST G9, zHux FOO",1
"Cyprien Saint",0,1,63568,Phoenix,"Hera G8, Kanan G8, Ezra G8, Zeb G8, Chopper G8",1
"Cyprien Saint",1,0,17553,SionSolo (Counter),"Sion",1
"Cyprien Saint",1,0,15691,NestSolo (Counter),"Nest",1
"Cyprien Saint",,,248001,Malevolence,"Malevolence 5* Hyena Bomber 5*, Vulture Droid, Sun Fac SF, Soldier SF, Spy SF",0
"Cyprien Saint",0,1,91612,Geonosians Omicron,"zGBA Sun Fac, Geo Soldier, Geo Spy, Poggle",0
"Cyprien Saint",,,305927,HansMF,"Home One, Han's MF, Biggs X-wing, Bistan's U-wing 5*, Phantom Ghost Cassian's U-wing, Wedge X-wing",0
"Cyprien Saint",1,1,47570,NS_Alt,"MT G9, AV G8, Spirit 6* G8, Talia G8, Daka G8",0
"Cyprien Saint",1,0,47032,ShaakClones,"Shaak Ti 6* G8, Rex G8, Echo (501st) G8, Fives G8, Clone Sergeant G8",0
"Cyprien Saint",1,1,105021,zEP,"EP zzzVader Tarkin TFP DN",0
"Cyprien Saint",1,0,60107,Troopers,"Veers G9, Starck G8, Stormtrooper G8, Piett Snowtrooper G8",0
"Cyprien Saint",0,1,99865,BH,"Jango Cad zZam IG-88 Dengar",0
"Cyprien Saint",1,1,52168,Rogue1,"Jyn 6* G8, Chirrut G8, Baze 5* K-2SO G8, Cassian G8",0
"Cyprien Saint",0,1,56272,BS,"BS 5* G8, GMY HYoda GK G8, Ahsoka G8",0
"Barfolomew",0,1,97385,DR,"zzzDR zzHK-47 zBSF Sith Empire Trooper G8, Thrawn G8",1
"Barfolomew",,,336014,HansMF,"Home One, Han's MF, HT Bistan's U-wing, Phantom Ghost Cassian's U-wing, Wedge X-wing",1
"Barfolomew",,,113634,Disintegration,"zAurra Greef G9, zBoba zzBossk zzThe Mandalorian",1
"Barfolomew",1,1,125310,Revan,"zzzJKR zBS zzGMY zJolee zGK",1
"Barfolomew",1,1,95880,Ewoks,"zChirpa Elder zPaploo Scout zWicket G8",1
"Barfolomew",1,1,102316,Carth,"zCarth Onasi, zMission zZaalbar Juhani zCanderous",1
"Barfolomew",0,1,72315,FO,"zzKRU Kylo G8, FOE G9, Phasma G8, FOO G8",1
"Barfolomew",0,1,73556,Phoenix,"Hera G8, Kanan G8, Ezra Zeb G8, Chopper",1
"Barfolomew",1,0,81418,EP (Counter, Rebel),"EP G9, DT G8, zzWampa Stormtrooper G8, Starck",1
"Barfolomew",1,0,77331,IG88,"zIG-88 GG G8, BB-8 G9, T3-M4 L3-37 G8",1
"Barfolomew",,,53271,Admiral Raddus,"Admiral Raddus 3* G8, Cassian G8, Jyn G7, K-2SO G7, Chirrut G7",0
"Barfolomew",1,0,104609,CLS,"zzzCLS Han G9, zChewbacca zzC-3PO Chewpio 4* G7",0
"Barfolomew",0,1,83818,Geonosians Omicron,"zzGBA Sun Fac G9, Geo Soldier, Geo Spy G9, Poggle",0
"Barfolomew",1,0,55750,Traya,"Traya 6* G9, DN 5* Sion 5* G8, Dooku G8, Nest 5* G7",0
"Barfolomew",1,1,55674,NS_Alt,"AV G8, Spirit 6* G8, Zombie G9, Talia G9, Daka G9",0
"Barfolomew",1,0,60569,ShaakClones,"Shaak Ti 6* G8, Rex G8, Echo (501st) G7, Fives G9, ARC Trooper G8",0
"Barfolomew",0,1,80159,BH,"Jango G8, Cad Zam G8, Krrsantan G7, Greedo",0
"Barfolomew",,,61500,Bad Batch,"zHunter 5* G9, Echo 4* Omega G9, Tech 5* G9, Wrecker 4* G8",0
"O iTz LuCaS x",,,123256,Phasma,"zPhasma zFOTP FOSFTP zFOST zKylo",1
"O iTz LuCaS x",,,180362,JMLS,"zzzJKR zzJKL zzzzzzJMLS zzHYoda zzzzGAS",1
"O iTz LuCaS x",1,0,144362,CLS,"zzzCLS zHan zzChewbacca zzC-3PO zChewpio",1
"O iTz LuCaS x",,,127611,Grievous Omicron,"zzGG zB2 zB1 zMagnaGuard zDroideka",1
"O iTz LuCaS x",0,1,102898,Geonosians Omicron,"zzGBA Sun Fac, Geo Soldier, Geo Spy, Poggle",1
"O iTz LuCaS x",,,427733,HansMF,"Home One, Han's MF, Rebel Y-wing, Bistan's U-wing, Phantom Ghost Cassian's U-wing, Wedge X-wing",1
"O iTz LuCaS x",,,497834,Negotiator,"Negotiator HT Anakin's Eta-2, Umbaran SF, Ahsoka's SF, Clone Sergeant's ARC-170, Plo's SF, Rex's ARC-170",1
"O iTz LuCaS x",1,1,112942,JTR,"zzzJTR Scav Rey, BB-8 zzR2-D2 Finn G9",1
"O iTz LuCaS x",,,109151,Mon Mothma,"zzMon Mothma, Bistan Biggs Lando Wedge",1
"O iTz LuCaS x",1,0,129771,ShaakClones,"zzShaak Ti, zRex zEcho (501st), zzFives zARC Trooper",1
"O iTz LuCaS x",1,1,89189,Ewoks,"zChirpa Elder Paploo Teebo zWicket",1
"O iTz LuCaS x",0,1,137643,BH,"zzBossk zIG-88 zJango zBoba zDengar",1
"O iTz LuCaS x",1,1,134407,zEP,"zzEP zzzVader Tarkin TFP zSith Trooper",1
"O iTz LuCaS x",0,1,83128,Phoenix,"zHera Kanan Ezra Zeb Chopper",1
"O iTz LuCaS x",1,1,72418,Rogue1,"zJyn Chirrut G8, Baze G8, K-2SO G8, Cassian",1
"O iTz LuCaS x",0,1,119861,padme,"zzPadme zGK zJKA zAhsoka CW Chewbacca G7",0
"O iTz LuCaS x",,,276571,Malevolence,"Malevolence 5* Hyena Bomber 4*, Vulture Droid 6*, Sun Fac SF, Soldier SF, Spy SF",0
"O iTz LuCaS x",1,1,77473,NS,"MT G8, zzAV Daka G9, Zombie G9, Spirit G9",0
"O iTz LuCaS x",1,0,79395,Traya,"Traya G7, DN G8, Sion G7, zDooku zThrawn",0
"O iTz LuCaS x",1,1,48120,Carth,"Carth Onasi 6* G7, Mission G8, Zaalbar G8, Juhani 3* G6, Canderous 4* G7",0
"O iTz LuCaS x",1,0,96015,Troopers,"Veers Starck Iden Versio, Shoretrooper G8, zzPiett",0
"O iTz LuCaS x",,,66647,Mando,"zThe Mandalorian (Beskar Armor), Dash Rendar 4*, Nest 5* G4, IG-11 G9, Kuiil G9",0
"O iTz LuCaS x",,,53013,Bad Batch,"Hunter 5* Echo 4* G8, Omega 5* G8, Tech 4* G9, Wrecker G8",0
"O iTz LuCaS x",1,0,62132,Jawas,"Nebit G9, Jawa Engineer G7, Jawa Scavenger G7, Jawa Dathcha G8",0
"Sephera Saint",0,1,104895,DR,"zzzDR HK-47 zBSF Sith Marauder, Sith Empire Trooper",1
"Sephera Saint",,,90005,Disintegration,"Aurra Greef Boba zBossk The Mandalorian",1
"Sephera Saint",1,1,107111,Revan,"zzJKR BS GMY zJolee zGK",1
"Sephera Saint",1,1,74783,Ewoks,"zChirpa Elder Paploo G9, Wicket Logray G9",1
"Sephera Saint",1,0,15919,SionSolo (Counter),"Sion",1
"Sephera Saint",,,33095,Phasma,"Phasma 5* G8, FOE 5* G8, FOO 5* G8, KRU 5* G8, Kylo 5* G8",0
"Sephera Saint",1,0,103809,CLS,"zCLS zHan zChewbacca R2-D2 G9, zChewpio",0
"Sephera Saint",,,393240,Negotiator,"Negotiator 5* HT Anakin's Eta-2, Umbaran SF, Ahsoka's SF, BTL-B Y-wing 6*, Clone Sergeant's ARC-170 5*, Plo's SF",0
"Sephera Saint",0,1,89221,Geonosians Omicron,"zGBA Sun Fac, Geo Soldier, Geo Spy, Poggle",0
"Sephera Saint",,,73231,Nute-OR,"Nute G8, Dooku 6* G8, Jango zZaalbar zMission",0
"Sephera Saint",1,1,39874,NS_Alt,"MT G8, AV G8, Spirit 5* G8, Talia 5* G8, Daka 5* G8",0
"Sephera Saint",1,0,71200,ShaakClones,"Shaak Ti, Rex G8, Echo (501st) G9, Fives ARC Trooper G8",0
"Sephera Saint",1,1,86467,zEP,"EP zVader Tarkin G9, zTraya 6* DN",0
"Sephera Saint",1,0,78701,Troopers,"Veers Starck Gideon Piett G9, Dark Trooper",0
"Sephera Saint",1,0,41441,Wiggs,"Wedge 5* G8, Biggs 5* G8, Ezra 5* G8, C-3PO 5* G7, Leia G8",0
"Sephera Saint",1,1,34376,Rogue1,"Jyn 5* G8, Chirrut 5* G8, Baze 5* G8, K-2SO 5* G8, Cassian 5* G8",0
"Sephera Saint",0,1,34451,Phoenix,"Hera 5* G8, Kanan 6* G8, Sabine 5* G8, Zeb 5* G8, Chopper 5* G8",0
"Rui Vuusen",1,1,88513,Ewoks,"zChirpa Elder Paploo zWicket Logray",1
"Rui Vuusen",0,1,98320,BH,"zzBossk The Mandalorian, zJango Boba Dengar G9",1
"Rui Vuusen",0,1,79434,Phoenix,"zHera Kanan Ezra Zeb Chopper G9",1
