Player,Offense,Defense,GP,Name,Squad,Viable
"NotFromEarth",0,1,77226,Phoenix,"Hera Ezra Sabine G8, Zeb G8, Kanan G8",1
"NotFromEarth",1,0,126171,zMaul,"zDarth Maul, Dooku zSidious Sith Assassin, zSavage",1
"NotFromEarth",1,1,103625,Rogue1,"zJyn Chirrut G8, Baze G8, zzAdmiral Raddus, K-2SO G8",1
"NotFromEarth",,,441228,Negotiator,"Negotiator BTL-B Y-wing 2*, Anakin's Eta-2, Rex's ARC-170, Umbaran SF, Ahsoka's SF, Plo's SF, Clone Sergeant's ARC-170",0
"NotFromEarth",,,278111,Malevolence,"Malevolence Hyena Bomber 6*, Vulture Droid 6*, Sun Fac SF, Soldier SF, Spy SF",0
"NotFromEarth",1,1,80800,JTR,"JTR Scav Rey, BB-8 G9, R2-D2 Finn G9",0
"NotFromEarth",1,1,71346,NS,"MT G8, AV Daka Zombie G8, Spirit G8",0
"NotFromEarth",1,1,84516,Carth,"zCarth Onasi, zMission Zaalbar Juhani G7, Canderous",0
"NotFromEarth",,,58762,Iden Troopers,"Iden Versio 6* G8, Shoretrooper G8, Snowtrooper G8, Magma G1, DT G8",0
"NotFromEarth",0,1,87811,BH,"Jango Greedo G8, zThe Mandalorian, Zam G8, zzGreef",0
"NotFromEarth",,,94040,Mando,"zzThe Mandalorian (Beskar Armor), zDash Rendar, Nest G1, IG-11 G8, Kuiil G8",0
"NotFromEarth",1,0,105121,QGJ,"zQGJ Aayla G1, zJKA zzHYoda zAhsoka",0
"NotFromEarth",1,0,34546,Jawas,"Nebit G1, Jawa Engineer G1, Jawa Scavenger G1, Jawa G1, Dathcha G1",0
"MINI Hazedog",1,0,135026,CLS,"zzzCLS zHan zzChewbacca zzC-3PO zChewpio",1
"MINI Hazedog",0,1,106818,DRMalak,"zzDR HK-47 zBSF zzMalak Sith Empire Trooper G8",1
"MINI Hazedog",0,1,107141,padme,"zzPadme zGK JKA zAhsoka CW Chewbacca G8",1
"MINI Hazedog",,,448694,Negotiator,"Negotiator HT Anakin's Eta-2, Umbaran SF, Ahsoka's SF, BTL-B Y-wing 6*, Clone Sergeant's ARC-170, Plo's SF",1
"MINI Hazedog",,,136465,JKL,"zzJKL zzzJKR zzHYoda zzOld Ben, Aayla",1
"MINI Hazedog",,,337194,HansMF,"Home One, Han's MF, Rebel Y-wing 6*, Bistan's U-wing, Phantom Ghost Cassian's U-wing, Wedge X-wing",1
"MINI Hazedog",0,1,98013,Geonosians,"zzGBA Sun Fac, Geo Soldier, Geo Spy, Poggle",1
"MINI Hazedog",0,1,123435,Grievous,"zzGG zB2 zB1 zMagnaGuard zNute",1
"MINI Hazedog",1,0,90334,Traya,"zzTraya DN zSion G9, EP Thrawn G9",1
"MINI Hazedog",1,1,80658,Ewoks,"zChirpa Elder Paploo G9, zWicket G9, Logray",1
"MINI Hazedog",1,1,93385,Carth,"zCarth Onasi, zMission Zaalbar zVandor Chewbacca, zCanderous",1
"MINI Hazedog",0,1,141394,BH,"zzBossk zJango Cad Dengar zBoba",1
"MINI Hazedog",0,1,67073,Phoenix,"Hera G8, Chopper G9, Ezra G9, Zeb G8, Kanan G8",1
"MINI Hazedog",1,0,14835,NestSolo (Counter),"Nest G9",1
"MINI Hazedog",,,46311,Admiral Raddus,"Admiral Raddus 3* G8, Cassian G8, Jyn 6* G7, K-2SO G8, Chirrut G7",0
"MINI Hazedog",1,1,57468,NS,"MT 5* G8, AV Daka G9, Zombie G8, Spirit G8",0
"MINI Hazedog",,,75476,Mon Mothma,"Mon Mothma G9, Pao G8, Lando Wedge G8, Cara Dune G8",0
"MINI Hazedog",1,0,94265,ShaakClones,"zShaak Ti, Rex Echo (501st) G8, Fives Clone Sergeant",0
"MINI Hazedog",1,0,72191,Troopers,"Veers G9, Starck G7, Snowtrooper G7, Gideon 6* G8, zzPiett",0
