Player,Offense,Defense,GP,Name,Squad,Viable
"Wicket87",1,1,116974,zEP,"zzEP zzzVader Tarkin G9, DT G8, TFP",1
"Wicket87",0,1,79995,Phoenix,"Hera Kanan G8, Zeb G8, Ezra Sabine G8",1
"Wicket87",1,1,100113,Rogue1,"Jyn Chirrut G8, Baze G8, K-2SO G9, zzAdmiral Raddus",1
"Wicket87",0,1,132733,BS,"zBS zGMY zJolee zGK zJKA",1
"Wicket87",,,455985,Negotiator,"Negotiator BTL-B Y-wing 5*, Anakin's Eta-2, Rex's ARC-170, Umbaran SF, Ahsoka's SF, Plo's SF, Clone Sergeant's ARC-170",0
"Wicket87",,,304557,Malevolence,"Malevolence Hyena Bomber 6*, Vulture Droid 6*, Sun Fac SF, Soldier SF, Spy SF",0
"Wicket87",1,1,65369,NS,"MT G8, zAV Daka G8, Zombie G4, Spirit G8",0
"Wicket87",1,0,63473,Traya,"Traya G8, DN G8, Sion G1, zDooku Nest G5",0
"Wicket87",1,1,81690,Carth,"zCarth Onasi, Mission Zaalbar Juhani G7, Canderous",0
"Wicket87",1,0,88634,Troopers,"zVeers Starck G7, zzPiett Snowtrooper G8, Stormtrooper G8",0
"Wicket87",0,1,76931,BH,"Jango Boba Fett, Scion of Jango G9, Greedo G8, The Mandalorian, Greef G9",0
"TritonDankwalker66",,,123861,Phasma,"zPhasma zFOTP FOSFTP zFOST zKylo",1
"TritonDankwalker66",0,1,110420,DRMalak,"zzDR HK-47 zBSF zzMalak Sith Empire Trooper G8",1
"TritonDankwalker66",0,1,93556,Geonosians,"zzGBA Sun Fac, Geo Soldier, Geo Spy, Poggle",1
"TritonDankwalker66",0,1,127628,Grievous,"zzGG zB2 zB1 zDroideka zMagnaGuard",1
"TritonDankwalker66",1,1,126486,Revan,"zzzJKR BS zzGMY zJolee zGK",1
"TritonDankwalker66",1,0,104917,ShaakClones,"zzShaak Ti, zRex Echo (501st), zzFives zARC Trooper",1
"TritonDankwalker66",1,1,88868,Carth,"zCarth Onasi, zMission zZaalbar Juhani Canderous",1
"TritonDankwalker66",0,1,96587,BH,"zBossk zThe Mandalorian, Jango Boba Cad",1
"TritonDankwalker66",1,1,106291,zEP,"zzEP zVader Tarkin TFP G8, zSith Trooper",1
"TritonDankwalker66",1,0,12645,SionSolo (Counter),"Sion G8",1
"TritonDankwalker66",1,0,69298,CLS,"CLS Han Chewbacca G9, R2-D2 G7, Chewpio 5* G8",0
"TritonDankwalker66",,,390544,Negotiator,"Negotiator HT Anakin's Eta-2 6*, Umbaran SF 6*, Ahsoka's SF, Clone Sergeant's ARC-170, Plo's SF, Rex's ARC-170 5*",0
"TritonDankwalker66",1,1,45675,NS_Alt,"MT 5* G8, AV G8, Talia 5* G8, Daka G8, Spirit 5* G8",0
"TritonDankwalker66",1,1,43025,Ewoks,"Chirpa G6, Elder G6, Paploo G6, Teebo G5, Wicket G5",0
"TritonDankwalker66",1,0,44941,Troopers,"Veers 6* G8, Starck 6* G6, Piett G7, Snowtrooper G8, Stormtrooper G8",0
"TritonDankwalker66",0,1,47512,Phoenix,"Hera 5* G8, Chopper G8, Kanan G8, Zeb G8, Sabine 5* G8",0
"TritonDankwalker66",1,0,42499,Wiggs,"Wedge 5* G8, Biggs G8, Leia G8, Chirrut 5* G8, Baze 6* G8",0
"Brooks",,,168018,SEE,"zzzzzzSEE zBSF zzMalak zzzDR zzzVader",1
"Brooks",0,1,136540,padme,"zzPadme zGK zJKA zAhsoka zzC-3PO",1
"Brooks",1,0,100484,CLS,"zzCLS zHan zzChewbacca R2-D2 G8, zChewpio",1
"Brooks",,,479133,Negotiator,"Negotiator HT Anakin's Eta-2, Umbaran SF, Ahsoka's SF, Clone Sergeant's ARC-170, Plo's SF, Rex's ARC-170",1
"Brooks",0,1,92956,Geonosians,"zzGBA Sun Fac, Geo Soldier, Geo Spy, Poggle",1
"Brooks",0,1,122384,Grievous,"zzGG zB2 zB1 zMagnaGuard zNute",1
"Brooks",1,0,112854,Troopers,"zVeers zzPiett zzGideon zDark Trooper, Range Trooper",1
"Brooks",1,1,141705,GAS,"zzzzGAS zRex zEcho (501st), zzFives zARC Trooper",1
"Brooks",1,1,118436,Revan Offense,"zzzJKR zzGMY zBS zJolee Ezra G8",1
"Brooks",1,1,83524,Ewoks,"zChirpa Elder Paploo zWicket Logray G9",1
"Brooks",1,1,87279,Carth,"zCarth Onasi, zMission zZaalbar Juhani G8, zCanderous",1
"Brooks",0,1,111232,BH,"zzBossk Jango zBoba Cad zGreef",1
"Brooks",,,84586,Iden Troopers,"zIden Versio, Shoretrooper Snowtrooper Magma DT",1
"Brooks",0,1,70338,Phoenix,"Hera G9, Chopper G9, Kanan G8, Zeb G8, Sabine G8",1
"Brooks",1,0,124441,zMaul,"zDarth Maul, zDooku zSidious zSavage Sith Empire Trooper",1
"Brooks",1,0,15106,SionSolo (Counter),"Sion G9",1
"Brooks",,,63692,Phasma,"Phasma G8, FOTP G9, FOO G9, KRU G7, Kylo G8",0
"Brooks",1,1,68330,NS_Alt,"MT G8, AV Talia G8, Daka G8, Zombie G8",0
"Brooks",,,94023,Bad Batch,"zHunter zEcho zOmega G9, zTech zWrecker 6*",0
"Brooks",1,0,112549,EP (Counter, Rebel),"zzEP Krennic zzWampa Nest G1, zStarck",0
"Sloth",,,181589,JMK,"zzzzzzJMK zAhsoka zzzCAT zzzzGAS zGK",1
"Sloth",,,176408,SEE,"zzzzzzSEE zBSF zzMalak zzzDR zzVader",1
"Sloth",,,564146,Executor,"Executor 5* HT RC Xanadu Blood, Slave I, IG-2000 Imperial TIE Fighter, Tie Adv",1
"Sloth",,,374034,HansMF,"Home One, Han's MF, Rebel Y-wing, Bistan's U-wing, Phantom Ghost Cassian's U-wing, Biggs X-wing",1
"Sloth",0,1,88632,Geonosians,"zGBA Sun Fac, Geo Soldier, Geo Spy, Poggle",1
"Sloth",1,0,123807,Traya,"zzTraya zDN zSion Sith Empire Trooper, Thrawn",1
"Sloth",0,1,118031,Grievous,"zzGG zB2 zB1 MagnaGuard zNute",1
"Sloth",1,1,132449,Revan Offense,"zzzJKR zGMY zHYoda zJolee zJKA",1
"Sloth",1,1,78366,Ewoks,"zChirpa G9, Elder Paploo G9, Wicket Logray",1
"Sloth",1,0,140433,ShaakClones,"zzShaak Ti, zRex zEcho (501st), zzFives zARC Trooper",1
"Sloth",0,1,139618,BH,"zzBossk zIG-88 Dengar Jango zBoba",1
"Sloth",1,0,129915,Troopers,"zVeers zStarck zzPiett zDark Trooper, zGideon",1
"Sloth",0,1,62412,Phoenix,"Hera G8, Kanan G9, Zeb G8, Ezra G8, Sabine G8",1
"Sloth",1,1,64049,Rogue1,"Jyn G8, Chirrut G8, Baze G8, K-2SO G8, Cassian G8",1
"Sloth",1,0,128579,zMaul,"zDarth Maul, Dooku zSidious zSavage Sith Marauder",1
"Sloth",1,0,94514,EP (Counter, Rebel),"zEP Shoretrooper Krennic DT G8, Range Trooper G9",1
"Sloth",,,44210,Phasma,"Phasma G8, FOTP G7, FOSFTP G3, FOST 5* G8, Kylo G8",0
"Sloth",1,0,97575,CLS,"zzCLS zHan zzChewbacca zC-3PO Chewpio 4* G8",0
"Sloth",,,474078,Negotiator,"Negotiator BTL-B Y-wing 2*, Anakin's Eta-2, Rex's ARC-170, Umbaran SF, Ahsoka's SF, Plo's SF, Clone Sergeant's ARC-170",0
"Sloth",,,293061,Malevolence,"Malevolence Hyena Bomber 5*, Vulture Droid 5*, Sun Fac SF, Soldier SF, Spy SF",0
"Sloth",1,1,71162,NS,"MT G8, zAV Daka G8, Zombie G8, Spirit G8",0
"Sloth",1,1,81998,Carth,"Carth Onasi, zMission Zaalbar Juhani G7, Canderous",0
"Sloth",,,88825,Mando,"zzThe Mandalorian (Beskar Armor), Dash Rendar G8, Nest G3, zIG-11 zKuiil",0
"DarthElshondo",,,160127,JMLS,"zzzJKR zzJKL zzzzzzJMLS zWat Tambor, zzzzGAS",1
"DarthElshondo",1,0,144737,CLS,"zzzCLS zHan zzChewbacca zzC-3PO zChewpio",1
"DarthElshondo",0,1,112121,DRMalak,"zzzDR zzHK-47 zBSF zzMalak Sith Empire Trooper G8",1
"DarthElshondo",,,452415,Negotiator,"Negotiator HT Anakin's Eta-2, Umbaran SF, Ahsoka's SF, BTL-B Y-wing 6*, Clone Sergeant's ARC-170, Plo's SF",1
"DarthElshondo",,,401955,HansMF,"Home One, Han's MF, Rebel Y-wing 6*, Ghost Phantom Biggs X-wing, Cassian's U-wing, Wedge X-wing",1
"DarthElshondo",1,1,151636,JTR,"zzzJTR zzR2-D2 zzBB-8 zRH Finn, zRH Poe",1
"DarthElshondo",0,1,103367,Geonosians,"zzGBA Sun Fac, Geo Soldier, Geo Spy, Poggle",1
"DarthElshondo",0,1,132099,Grievous,"zzGG zB2 zB1 zMagnaGuard zNute",1
"DarthElshondo",,,112743,Mon Mothma,"zzMon Mothma, Lando zCara Dune, Wedge Biggs",1
"DarthElshondo",1,1,89047,Ewoks,"zChirpa G9, Elder Paploo zWicket zLogray",1
"DarthElshondo",1,0,138873,ShaakClones,"zzShaak Ti, zRex zEcho (501st), zzFives zARC Trooper",1
"DarthElshondo",1,1,91663,Carth,"zCarth Onasi, zMission zZaalbar Juhani G8, zCanderous",1
"DarthElshondo",0,1,101786,BH,"zzBossk zzJango zFennec Shand, Boba G9, Cad",1
"DarthElshondo",0,1,69204,Phoenix,"Hera G8, Kanan G8, Zeb G8, Ezra Sabine G8",1
"DarthElshondo",0,1,126189,BS,"zBS zGMY zJolee zGK zzHYoda",1
"DarthElshondo",1,0,114056,QGJ,"QGJ Aayla zJKA zzOld Ben, zAhsoka",1
"DarthElshondo",1,0,81852,EP (Counter, Rebel),"EP G9, Shoretrooper G8, DT G8, zzWampa Range Trooper G9",1
"DarthElshondo",1,0,14820,SionSolo (Counter),"Sion G9",1
"DarthElshondo",,,66594,Phasma,"Phasma G8, FOE G9, FOO KRU G8, Kylo G8",0
"DarthElshondo",1,1,92020,NS,"zzMT G9, zzAV zDaka Zombie Spirit G8",0
"DarthElshondo",1,0,90889,Troopers,"zVeers Starck G8, zzPiett zDark Trooper, zGideon G9",0
"DarthElshondo",1,1,61873,Rogue1,"Jyn G8, Chirrut 5* G8, Baze 6* G8, K-2SO G8, zPao G8",0
"DarthElshondo",,,67502,Bad Batch,"Hunter G9, zEcho G8, Omega 5* G6, zTech G8, Wrecker G8",0
"bowtieZRcool",,,347679,HansMF,"Home One, Han's MF 6*, Rebel Y-wing 6*, Bistan's U-wing, Phantom Ghost Cassian's U-wing, Wedge X-wing",1
"bowtieZRcool",,,363105,Negotiator,"Negotiator 5* HT Anakin's Eta-2, Umbaran SF, Ahsoka's SF, Clone Sergeant's ARC-170, Plo's SF, Rex's ARC-170",1
"bowtieZRcool",0,1,105824,Geonosians,"zzGBA Sun Fac, Geo Soldier, Geo Spy, Poggle",1
"bowtieZRcool",,,97328,Disintegration,"Aurra Greef G8, Boba Bossk zThe Mandalorian",1
"bowtieZRcool",1,1,90508,Ewoks,"zChirpa Elder Paploo Teebo Wicket",1
"bowtieZRcool",1,1,80365,Carth,"zCarth Onasi, Mission G8, Zaalbar G8, Juhani Canderous",1
"bowtieZRcool",1,1,90395,zEP,"zEP zVader Tarkin TFP G8, BSF",1
"bowtieZRcool",1,0,79499,501st,"Rex ARC Trooper G8, Echo (501st), Fives Ahsoka",1
"bowtieZRcool",1,0,95316,CLS,"zCLS Han Leia zFulcrum Chewbacca",1
"bowtieZRcool",0,1,74934,Phoenix,"Hera Kanan G8, Zeb G8, Ezra Sabine",1
"bowtieZRcool",1,1,75174,Rogue1,"Jyn G8, Chirrut G8, Baze K-2SO G9, Cassian",1
"bowtieZRcool",1,0,79474,IG88,"IG-88 GG BB-8 G9, T3-M4 L3-37 G8",1
"bowtieZRcool",1,0,15837,SionSolo (Counter),"Sion",1
"bowtieZRcool",,,54718,Phasma,"Phasma G9, FOTP G9, FOSFTP 5* G7, FOST 3* G8, Kylo",0
"bowtieZRcool",,,76471,Nute-Wat,"Nute Dooku Wat Tambor 6* G9, Jango Nest G7",0
"bowtieZRcool",1,1,93739,Revan,"zJKR BS GMY Jolee G8, GK",0
"bowtieZRcool",,,77568,Mon Mothma,"Mon Mothma 6* G8, Lando Cara Dune, Kyle Katarn, Wedge G8",0
"bowtieZRcool",1,0,62015,Troopers,"Veers Starck G8, DT 6* G8, Gideon 6* G8, Stormtrooper G8",0
"bowtieZRcool",,,58027,Bad Batch,"Hunter 5* G8, Echo 5* Omega 6* G8, Tech 5* Wrecker 6* G8",0
"bowtieZRcool",1,0,51156,Jawas,"Nebit G7, Jawa Engineer 5* G4, Jawa Scavenger G7, Jawa G8, Dathcha G8",0
"Beast3",0,1,130890,padme,"zzPadme zGK zJKA zAhsoka zzC-3PO",1
"Beast3",1,0,109473,CLS,"zzzCLS zHan zzChewbacca R2-D2 G8, zChewpio",1
"Beast3",,,460756,Negotiator,"Negotiator HT Anakin's Eta-2, Umbaran SF, Ahsoka's SF, BTL-B Y-wing, Clone Sergeant's ARC-170, Plo's SF",1
"Beast3",,,286665,Malevolence,"Malevolence 5* Hyena Bomber, Vulture Droid, Sun Fac SF, Soldier SF, Spy SF",1
"Beast3",0,1,88890,Geonosians,"zGBA Sun Fac, Geo Soldier, Geo Spy, Poggle",1
"Beast3",0,1,113336,Grievous,"zzGG zB2 zB1 zDroideka MagnaGuard",1
"Beast3",1,1,126395,GAS,"zzzzGAS zRex zEcho (501st), zzFives zARC Trooper",1
"Beast3",1,1,84662,Ewoks,"zChirpa Elder Paploo Wicket Logray",1
"Beast3",0,1,116633,BH,"zzBossk zIG-88 zThe Mandalorian, zBoba Cad",1
"Beast3",1,1,131982,zEP,"zzEP zzzVader Tarkin Krennic zzTraya",1
"Beast3",0,1,65612,Phoenix,"Hera G8, Chopper G8, Kanan G8, Zeb G8, Ezra G8",1
"Beast3",1,0,92088,Troopers,"zVeers zzPiett Gideon G9, Dark Trooper G9, Range Trooper G8",0
"DanPal37",,,122580,Phasma,"zPhasma zFOTP FOSFTP zFOST zKylo",1
"DanPal37",1,1,143576,SL Kylo,"zzzzzzSL Kylo, zSith Trooper, zHux zzKRU Thrawn",1
"DanPal37",0,1,117531,padme,"zzPadme zGK zJKA zAhsoka C-3PO",1
"DanPal37",1,0,108973,CLS,"zzCLS zHan zChewbacca R2-D2 G8, Chewpio",1
"DanPal37",0,1,116185,DRMalak,"zzzDR HK-47 BSF zzMalak Sith Marauder",1
"DanPal37",,,414895,Negotiator,"Negotiator HT Anakin's Eta-2, Umbaran SF, Ahsoka's SF, Clone Sergeant's ARC-170, Plo's SF, Rex's ARC-170",1
"DanPal37",0,1,91609,Geonosians,"zGBA Sun Fac, Geo Soldier, Geo Spy, Poggle",1
"DanPal37",0,1,113934,Grievous,"zzGG zB2 zB1 zDroideka MagnaGuard",1
"DanPal37",1,1,109296,GAS,"zzzzGAS Rex Echo (501st), zFives ARC Trooper",1
"DanPal37",1,1,114518,Revan Offense,"zzzJKR zGMY zBS zJolee Ezra",1
"DanPal37",1,1,85191,Ewoks,"zChirpa Elder Paploo Wicket Logray",1
"DanPal37",0,1,94722,BH,"zBossk Dengar Jango Boba Cad",1
"DanPal37",1,1,87034,Carth,"Carth Onasi, zMission zZaalbar Juhani Canderous",1
"DanPal37",1,1,103928,zEP,"zEP zzVader Tarkin G9, Dooku TFP G8",1
"DanPal37",,,267628,Malevolence,"Malevolence Hyena Bomber 5*, Vulture Droid 3*, Sun Fac SF, Soldier SF, Spy SF",0
"DanPal37",,,46790,Mon Mothma,"Mon Mothma 5* G5, Cara Dune 6* G7, Kyle Katarn 5* G5, Wedge G7, Biggs",0
"DanPal37",1,0,65121,Troopers,"Veers G8, Starck G8, Piett Dark Trooper G9, Gideon G9",0
"DanPal37",0,1,62161,Phoenix,"Hera Chopper G9, Kanan G9, Zeb G8, Sabine 5* G8",0
"DanPal37",1,0,6630,SionSolo (Counter),"Sion G1",0
"Nerf Herder",0,1,144616,padme,"zzPadme zGK zJKA zAhsoka zzC-3PO",1
"Nerf Herder",1,1,107538,NS_Alt,"zMT zzAV Talia zDaka Zombie",1
"Nerf Herder",,,498322,Negotiator,"Negotiator HT Anakin's Eta-2, Umbaran SF, Ahsoka's SF, Clone Sergeant's ARC-170, Plo's SF, Rex's ARC-170",1
"Nerf Herder",,,349677,HansMF,"Home One, Han's MF 5*, Biggs X-wing, Bistan's U-wing, Phantom Ghost Cassian's U-wing, Wedge X-wing",1
"Nerf Herder",0,1,106827,Geonosians,"zzGBA Sun Fac, Geo Soldier, Geo Spy, Poggle",1
"Nerf Herder",0,1,116890,Grievous,"zzGG zB2 zB1 zMagnaGuard zNute",1
"Nerf Herder",1,1,141325,GAS,"zzzzGAS zRex zEcho (501st), zzFives zARC Trooper",1
"Nerf Herder",1,1,87099,Ewoks,"zChirpa Elder Paploo zWicket Logray",1
"Nerf Herder",0,1,98060,BH,"zzBossk IG-88 zZam Dengar G9, Boba",1
"Nerf Herder",1,1,129843,zEP,"zzEP zzzVader zTarkin Krennic TFP",1
"Nerf Herder",0,1,106449,FO,"zzKRU zKylo zFOTP FOE FOO",1
"Nerf Herder",0,1,81906,Phoenix,"Hera Chopper Kanan Zeb Ezra",1
"Nerf Herder",1,0,100496,CLS,"zzzCLS zHan zzChewbacca R2-D2 G8, Chewpio 4*",0
"Nerf Herder",1,0,84264,Traya,"zzTraya DN 6* G8, Sion 4* G8, Sith Empire Trooper G9, zThrawn",0
"Nerf Herder",1,0,90097,Troopers,"Veers zzPiett zzGideon Dark Trooper 5* G7, Range Trooper 5* G7",0
"Nerf Herder",,,76912,Mon Mothma,"Mon Mothma 5* G8, Chirrut G8, Lando G9, zzJyn zCassian G9",0
"Nerf Herder",1,0,116804,zMaul,"Darth Maul, zSidious zDooku Sith Marauder, Nest 5* G9",0
"Nerf Herder",,,60817,Iden Troopers,"Iden Versio 3* G9, Stormtrooper G8, Snowtrooper Magma G7, DT 6* G8",0
"Nerf Herder",0,1,75884,BH,"zJango Greedo G9, Cad Greef 4* G8, zEmbo 4* G8",0
"Nerf Herder",0,1,69233,BS,"BS 6* G8, zGMY Jolee 3* G8, Old Ben G9, HYoda G9",0
"Nerf Herder",1,0,64032,Jawas,"Nebit G8, Jawa Engineer G9, Jawa Scavenger G8, Jawa 5* G9, Dathcha G9",0
"Ninjastatten",0,1,132081,padme,"zzPadme zGK zJKA zAhsoka zC-3PO",1
"Ninjastatten",0,1,109255,DRMalak,"zzzDR zHK-47 zBSF zzMalak Sith Empire Trooper",1
"Ninjastatten",,,484632,Negotiator,"Negotiator HT Anakin's Eta-2, Umbaran SF, Ahsoka's SF, Clone Sergeant's ARC-170, Plo's SF, Rex's ARC-170",1
"Ninjastatten",0,1,96413,Geonosians,"zGBA Sun Fac, Geo Soldier, Geo Spy, Poggle",1
"Ninjastatten",0,1,126692,Grievous,"zzGG zB2 zB1 zDroideka MagnaGuard",1
"Ninjastatten",,,96431,Disintegration,"zAurra zGreef Boba zzBossk The Mandalorian",1
"Ninjastatten",1,1,143173,GAS,"zzzzGAS zRex zEcho (501st), zzFives zARC Trooper",1
"Ninjastatten",1,1,106464,Revan Offense,"zzzJKR zGMY BS zJolee HYoda G8",1
"Ninjastatten",1,1,80756,Ewoks,"zChirpa Elder zPaploo Wicket Logray G9",1
"Ninjastatten",1,1,82510,Carth,"zCarth Onasi, zMission zZaalbar Juhani G8, zCanderous",1
"Ninjastatten",1,0,98527,Troopers,"zVeers zStarck zzPiett zGideon Range Trooper",1
"Ninjastatten",0,1,58034,Phoenix,"Hera G8, Chopper G9, Kanan G8, Zeb G8, Ezra G8",1
"Ninjastatten",1,0,23838,NestSolo (Counter),"zNest",1
"Ninjastatten",,,43477,Phasma,"Phasma G8, FOE 5* G8, FOO G8, KRU 5* G8, Kylo G8",0
"Ninjastatten",1,1,81185,NS,"MT zAV zDaka Zombie Spirit",0
"Ninjastatten",1,0,53573,CLS,"CLS G9, Han G9, Chewbacca G8, R2-D2 G8, Chewpio G6",0
"Ninjastatten",,,209207,HansMF,"Home One, Han's MF 5*, Rebel Y-wing 5*, Bistan's U-wing 5*, Phantom Ghost Cassian's U-wing 6*, Wedge X-wing",0
"Ninjastatten",1,0,58528,Traya,"zTraya DN G8, Sion 5* G8, Dooku G8, EP G9",0
"Ninjastatten",0,1,80270,BH,"Jango IG-88 G9, zZam Dengar G9, Cad",0
"Ninjastatten",1,0,42177,Thragma (Counter),"Thrawn 6* G7, Magma G6, Tarkin G9, Stormtrooper G8, Shoretrooper 6* G8",0
"Ninjastatten",1,1,44774,Rogue1,"Jyn 6* G8, Chirrut 6* G8, Baze 6* G8, K-2SO G8, Cassian G8",0
"GrandMasterSparty",0,1,131756,DRMalak,"zzzDR HK-47 zBSF zzMalak Sith Empire Trooper",1
"GrandMasterSparty",1,0,128567,CLS,"zzzCLS zHan zChewbacca zC-3PO Chewpio",1
"GrandMasterSparty",,,454202,Negotiator,"Negotiator HT Anakin's Eta-2, Umbaran SF, Ahsoka's SF, BTL-B Y-wing, Clone Sergeant's ARC-170, Plo's SF",1
"GrandMasterSparty",0,1,107934,Grievous,"zzGG B2 zB1 Droideka MagnaGuard",1
"GrandMasterSparty",,,96418,Disintegration,"Aurra Greef Boba zzBossk The Mandalorian",1
"GrandMasterSparty",1,1,135762,Revan,"zzzJKR BS zGMY zJolee zGK",1
"GrandMasterSparty",1,1,76799,Ewoks,"zChirpa Elder Paploo Wicket Logray",1
"GrandMasterSparty",1,0,134721,ShaakClones,"zzShaak Ti, zRex zEcho (501st), zzFives zARC Trooper",1
"GrandMasterSparty",0,1,105295,FO,"zzKRU Kylo G8, zHux FOE G9, FOO",1
"GrandMasterSparty",0,1,63813,Phoenix,"Hera G9, Chopper G8, Kanan G8, Zeb G8, Ezra G9",1
"GrandMasterSparty",1,0,14215,SionSolo (Counter),"Sion G9",1
"GrandMasterSparty",,,301123,HansMF,"Home One, Han's MF, Rebel Y-wing, Ghost Phantom Biggs X-wing 6*, Cassian's U-wing, Wedge X-wing",0
"GrandMasterSparty",0,1,61581,Geonosians,"GBA G9, Sun Fac G7, Geo Soldier, Geo Spy G8, Poggle G9",0
"GrandMasterSparty",1,0,70592,Troopers,"Veers G9, Piett Gideon G8, Dark Trooper G9, Range Trooper G7",0
"GrandMasterSparty",,,85934,Nute-OR,"Nute G9, Dooku G9, Jango zZaalbar Mission",0
"GrandMasterSparty",1,1,56564,NS_Alt,"MT G8, AV Talia G8, Daka G8, Spirit G8",0
"GrandMasterSparty",1,1,88279,zEP,"EP zzVader Tarkin TFP G8, Sith Trooper",0
"GrandMasterSparty",1,0,46219,Wiggs,"Wedge G8, Biggs G8, Leia G8, Chirrut 5* G8, Baze 6* G8",0
"Elshondo",,,184304,JMK,"zzzzzzJMK zAhsoka zzzCAT zzzzGAS zGK",1
"Elshondo",,,168369,LV,"zzzzzzLord Vader, zzPiett zzzMaul RG zzzVader",1
"Elshondo",,,122273,Phasma,"zPhasma FOTP FOSFTP zFOST zKylo",1
"Elshondo",1,1,151603,SL Kylo,"zzzzzzSL Kylo, zSith Trooper, zHux zzKRU Thrawn",1
"Elshondo",,,166135,SEE,"zzzzzzSEE zBSF zzMalak zzzDR zDooku",1
"Elshondo",,,551114,Executor,"Executor HT RC Xanadu Blood, Slave I, IG-2000 Imperial TIE Fighter, Tie Adv",1
"Elshondo",1,0,154174,CLS,"zzzCLS zHan zzChewbacca zzC-3PO zChewpio",1
"Elshondo",,,142332,JKL,"zzJKL zzzJKR zzHYoda zzOld Ben, Aayla",1
"Elshondo",,,416682,HansMF,"Home One, Han's MF, Rebel Y-wing 6*, Ghost Phantom Biggs X-wing, Cassian's U-wing, Wedge X-wing",1
"Elshondo",0,1,102707,Geonosians,"zzGBA Sun Fac, Geo Soldier, Geo Spy, Poggle",1
"Elshondo",0,1,142376,Grievous,"zzGG zB2 zB1 zMagnaGuard zNute",1
"Elshondo",1,1,87823,Ewoks,"zChirpa G9, Elder Paploo zWicket zLogray",1
"Elshondo",1,0,152124,ShaakClones,"zzShaak Ti, zRex zEcho (501st), zzFives zARC Trooper",1
"Elshondo",1,1,88841,Carth,"zCarth Onasi, Mission zZaalbar zVandor Chewbacca G8, Canderous",1
"Elshondo",0,1,143444,BH,"zzBossk zZam Dengar Jango Boba",1
"Elshondo",1,0,105409,Troopers,"zVeers zStarck zDark Trooper, zGideon Range Trooper",1
"Elshondo",0,1,72721,Phoenix,"Hera Kanan G8, Zeb G8, Ezra Sabine G8",1
"Elshondo",1,0,110727,EP (Counter, Rebel),"zzEP Shoretrooper G8, Krennic DT zzWampa",1
"Elshondo",1,0,19230,NestSolo (Counter),"zNest",1
"Elshondo",1,0,18076,SionSolo (Counter),"zSion G9",1
"Elshondo",,,495581,Negotiator,"Negotiator BTL-B Y-wing, Anakin's Eta-2, Rex's ARC-170 5*, Umbaran SF, Ahsoka's SF, Plo's SF, Clone Sergeant's ARC-170",0
"Elshondo",1,1,77600,NS,"MT G8, zAV Daka G9, Zombie Spirit G8",0
"Elshondo",1,1,117129,JTR,"JTR Scav Rey, BB-8 zzR2-D2 zFinn",0
"Elshondo",,,119043,Mon Mothma,"zzMon Mothma, Lando zKyle Katarn, Wedge Biggs",0
"Elshondo",1,1,66573,Rogue1,"Jyn G8, Chirrut 6* G8, Baze G8, K-2SO G8, Cassian G8",0
"Elshondo",,,112808,Bad Batch,"zHunter zEcho Omega 5* G8, zTech zWrecker",0
"Shmeeegzz",1,1,161801,GL Rey,"zzzzzzRey zzzJTR zzR2-D2 zRH Poe, zRH Finn",1
"Shmeeegzz",1,0,147222,CLS,"zzzCLS zHan zzChewbacca zC-3PO zChewpio",1
"Shmeeegzz",,,450554,Negotiator,"Negotiator HT Anakin's Eta-2, Umbaran SF, Ahsoka's SF, Clone Sergeant's ARC-170, Plo's SF, Rex's ARC-170",1
"Shmeeegzz",,,420734,HansMF,"Home One, Han's MF, Rebel Y-wing, Ghost Phantom Biggs X-wing, Cassian's U-wing, Wedge X-wing",1
"Shmeeegzz",0,1,94565,Geonosians,"zzGBA Sun Fac, Geo Soldier, Geo Spy, Poggle",1
"Shmeeegzz",0,1,126029,Grievous,"zzGG zB2 zB1 zDroideka zMagnaGuard",1
"Shmeeegzz",,,99480,Disintegration,"zAurra Greef G8, zBoba zzBossk zThe Mandalorian",1
"Shmeeegzz",1,1,102007,GAS,"zzzzGAS zRex Echo (501st), zFives ARC Trooper",1
"Shmeeegzz",1,1,127253,Revan,"zzzJKR BS zzGMY zJolee zGK",1
"Shmeeegzz",1,1,90884,Ewoks,"zChirpa Elder Paploo zWicket zLogray",1
"Shmeeegzz",1,1,89475,Carth,"zCarth Onasi, zMission Zaalbar Juhani Canderous",1
"Shmeeegzz",1,0,103100,Wiggs,"Wedge Biggs zFulcrum zEzra Leia",1
"Shmeeegzz",0,1,64229,Phoenix,"Hera G8, Chopper G8, Kanan G8, Zeb G8, Sabine G8",1
"Shmeeegzz",1,0,75266,Jawas,"Nebit G9, Jawa Engineer, Jawa Scavenger, Jawa G9, Dathcha G9",1
"Shmeeegzz",1,0,59390,QiraNest,"Qira G8, zNest zzHYoda",1
"Shmeeegzz",,,64728,Phasma,"Phasma G7, FOTP G8, FOO G9, KRU G8, Kylo G8",0
"Shmeeegzz",0,1,103869,DRMalak,"zzDR zHK-47 zBSF zzMalak 5* G9, zThrawn",0
"Shmeeegzz",1,1,65136,NS,"MT G7, zAV Daka G7, Zombie G9, Spirit G3",0
"Shmeeegzz",1,0,67308,Traya,"Traya G9, DN 4* G8, Sion 5* G8, Dooku zEP",0
"Shmeeegzz",1,0,48714,Troopers,"Veers 6* G9, Piett G2, Gideon 5* G7, Dark Trooper 6* G7, Range Trooper 5* G8",0
"Shmeeegzz",,,99692,Mon Mothma,"zzMon Mothma, Lando Cara Dune G9, Kyle Katarn, Cassian G9",0
"Shmeeegzz",,,59115,Iden Troopers,"zIden Versio 4* G8, Stormtrooper G9, Snowtrooper G5, Magma G9, DT 6*",0
"Shmeeegzz",0,1,77034,BH,"zJango IG-88 G8, Greedo G8, Dengar G9, Cad",0
"Shmeeegzz",1,1,62036,Rogue1,"Jyn G8, Chirrut G7, Baze 5* G7, K-2SO G8, Pao G8",0
"Shmeeegzz",1,0,106232,QGJ,"zQGJ Aayla 6* G9, zJKA Old Ben, zAhsoka",0
"Jawa7778",,,122245,Phasma,"zPhasma zFOTP FOSFTP zFOST zKylo",1
"Jawa7778",1,1,157264,SL Kylo,"zzzzzzSL Kylo, zSith Trooper, zHux zzKRU zzThrawn",1
"Jawa7778",,,169388,SEE,"zzzzzzSEE zBSF zzMalak zzzDR zzzVader",1
"Jawa7778",0,1,96510,Geonosians,"zzGBA Sun Fac, Geo Soldier, Geo Spy, Poggle",1
"Jawa7778",,,309044,HansMF,"Home One, Han's MF, HT Ghost Phantom Biggs X-wing, Cassian's U-wing, Wedge X-wing",1
"Jawa7778",0,1,96972,Grievous-Wat,"zzGG zB2 G9, zB1 MagnaGuard G9, zWat Tambor",1
"Jawa7778",,,105057,Nute-OR,"zNute zDooku zJango zZaalbar zMission",1
"Jawa7778",1,1,141675,Revan Offense,"zzzJKR zGMY zzHYoda zJolee zJKA",1
"Jawa7778",0,1,96967,BH,"zzBossk zThe Mandalorian, zDengar G9, Boba zGreef",1
"Jawa7778",1,0,122862,Troopers,"zVeers zStarck zzPiett DT zIden Versio",1
"Jawa7778",0,1,64515,Phoenix,"Hera G8, Chopper G8, Kanan G8, Zeb G8, Ezra",1
"Jawa7778",1,0,124619,EP (Counter, Rebel),"zzEP Krennic zzWampa zNest Stormtrooper",1
"Jawa7778",1,0,15379,SionSolo (Counter),"Sion",1
"Jawa7778",1,0,87919,CLS,"zzzCLS zHan Chewbacca G9, zzR2-D2 Chewpio 5* G7",0
"Jawa7778",,,243664,Negotiator,"Negotiator BTL-B Y-wing 2*, Anakin's Eta-2, Rex's ARC-170 3*, Umbaran SF 5*, Ahsoka's SF, Plo's SF 4*, Clone Sergeant's ARC-170 5*",0
"Jawa7778",,,269995,Malevolence,"Malevolence Hyena Bomber 4*, Vulture Droid, Sun Fac SF, Soldier SF, Spy SF",0
"Jawa7778",1,1,75824,NS,"zMT G9, zAV Daka Zombie 6* Spirit G8",0
"Jawa7778",,,59736,Mon Mothma,"Mon Mothma 4* G6, K-2SO G8, Cara Dune, Cassian G8, Baze 6* G8",0
"Jawa7778",1,0,48913,ShaakClones,"Shaak Ti 4* G5, Rex G8, Echo (501st) 6* G8, Fives G8, Clone Sergeant G8",0
"Bel Zetafar",,,521091,HansMF,"Home One, Han's MF, HT Bistan's U-wing, Phantom Biggs X-wing, Cassian's U-wing, Wedge X-wing",1
"Bel Zetafar",0,1,104070,Geonosians,"zzGBA Sun Fac, Geo Soldier, Geo Spy, Poggle",1
"Bel Zetafar",0,1,114380,Grievous,"zzGG zB2 zB1 zMagnaGuard zNute",1
"Bel Zetafar",1,1,83537,Ewoks,"zChirpa Elder Paploo zWicket Logray",1
"Bel Zetafar",1,0,107375,ShaakClones,"zzShaak Ti, zRex zEcho (501st), zFives ARC Trooper",1
"Bel Zetafar",0,1,115209,BH,"zzBossk zDengar zJango zBoba Cad",1
"Bel Zetafar",1,1,107705,zEP,"zzEP zzVader zTarkin TFP zMara Jade, The Emperor's Hand",1
"Bel Zetafar",1,0,122666,Wiggs,"Wedge Biggs zHan zzChewbacca zLeia",1
"Bel Zetafar",0,1,67187,Phoenix,"Hera G8, Kanan G9, Zeb G8, Ezra G9, Sabine G8",1
"Bel Zetafar",1,0,62789,Jawas,"Nebit G8, Jawa Engineer G8, Jawa Scavenger G8, Jawa G8, Dathcha G8",1
"Bel Zetafar",,,66227,Phasma,"Phasma G7, FOTP G9, FOO G8, KRU G9, Kylo G9",0
"Bel Zetafar",0,1,70459,padme,"Padme G8, GK G7, JKA Ahsoka C-3PO G9",0
"Bel Zetafar",1,1,90457,NS,"zMT zAV Daka Zombie Spirit G9",0
"Bel Zetafar",1,1,66750,JTR,"JTR G5, Scav Rey G9, BB-8 R2-D2 G8, Finn G8",0
"Bel Zetafar",1,0,70513,Traya,"Traya G7, DN 6* G6, Sion 4* G5, zDooku zThrawn",0
"Bel Zetafar",1,0,67787,Troopers,"Veers G9, Piett G9, Gideon 4* G9, Dark Trooper G8, Range Trooper G7",0
"Bel Zetafar",,,109350,Mon Mothma,"Mon Mothma 5* G6, zzJyn zCassian Scarif Bistan",0
"BuoyantBanana",1,0,140957,CLS,"zzzCLS zHan zzChewbacca zC-3PO zChewpio",1
"BuoyantBanana",,,306828,Negotiator,"Negotiator 5* HT Anakin's Eta-2, Umbaran SF, Ahsoka's SF, Clone Sergeant's ARC-170, Jedi Consular's Starfighter, Plo's SF",1
"BuoyantBanana",0,1,90827,Geonosians,"zzGBA Sun Fac, Geo Soldier, Geo Spy, Poggle",1
"BuoyantBanana",,,105253,Mon Mothma,"zzMon Mothma, Cara Dune, Wedge Biggs Bistan",1
"BuoyantBanana",1,1,123348,Revan,"zzzJKR zBS zGMY zJolee GK",1
"BuoyantBanana",1,1,84252,Ewoks,"zChirpa Elder Paploo Wicket Logray",1
"BuoyantBanana",0,1,87374,BH,"zBossk The Mandalorian, Jango Boba Greef G9",1
"BuoyantBanana",0,1,77572,Phoenix,"Hera Chopper Kanan G9, Zeb G9, Ezra G9",1
"BuoyantBanana",,,406615,HansMF,"Home One, Han's MF, Rebel Y-wing, Bistan's U-wing, Phantom 5* Biggs X-wing, Cassian's U-wing, Wedge X-wing",0
"BuoyantBanana",0,1,52465,Grievous,"GG G4, B2 G7, Dooku G8, IG-88 G9, T3-M4 G8",0
"BuoyantBanana",1,0,98983,Wampa (Counter),"Rex G6, zzWampa zzHYoda zJyn FOO G7",0
"BuoyantBanana",1,0,88055,QGJ,"QGJ G8, Aayla G8, JKA zzOld Ben, Ahsoka",0
"BuoyantBanana",1,0,34248,Jawas,"Nebit G4, Jawa Engineer G6, Jawa Scavenger G5, Jawa G6, Dathcha G5",0
"BuoyantBanana",1,0,8940,NestSolo (Counter),"Nest G6",0
"Benstr8ballin",,,532989,Executor,"Executor 5* HT RC Xanadu Blood, Slave I, IG-2000 Imperial TIE Fighter, Tie Adv",1
"Benstr8ballin",1,0,128554,CLS,"zzzCLS zHan zzChewbacca zC-3PO zChewpio",1
"Benstr8ballin",0,1,118935,DRMalak,"zzzDR HK-47 zBSF zzMalak 6* Sith Marauder",1
