Player,Offense,Defense,GP,Name,Squad,Viable
"Rabbit4t2",1,0,37695,Jawas,"Nebit G2, Jawa Engineer G5, Jawa Scavenger G4, Jawa 6* G4, Dathcha G5",0
"Celestial",1,1,104161,NS,"zzMT zzAV zDaka Zombie Spirit",1
"Celestial",1,0,157080,CLS,"zzzCLS zHan zzChewbacca zzC-3PO zChewpio",1
"Celestial",,,475286,Negotiator,"Negotiator HT Anakin's Eta-2, Umbaran SF, Ahsoka's SF, BTL-B Y-wing, Clone Sergeant's ARC-170, Plo's SF",1
"Celestial",,,348497,HansMF,"Home One, Han's MF, Biggs X-wing, Bistan's U-wing, Phantom Ghost Cassian's U-wing, Wedge X-wing",1
"Celestial",0,1,103379,Geonosians,"zzGBA Sun Fac, Geo Soldier, Geo Spy, Poggle",1
"Celestial",0,1,135064,Grievous,"zzGG zB2 zB1 MagnaGuard zNute",1
"Celestial",1,1,154965,GAS,"zzzzGAS zRex zEcho (501st), zzFives zARC Trooper",1
"Celestial",1,1,122888,Revan,"zzzJKR BS zGMY zJolee zGK",1
"Celestial",1,1,95256,Ewoks,"zChirpa Elder zPaploo zWicket zLogray",1
"Celestial",0,1,130196,BH,"zzBossk zZam Jango zBoba zEmbo",1
"Celestial",1,1,127876,zEP,"zzEP zzzVader zTarkin TFP zzTraya",1
"Celestial",1,0,108217,QGJ,"zQGJ Aayla zJKA zOld Ben, zAhsoka",1
"Celestial",1,0,20268,NestSolo (Counter),"zNest",1
"Celestial",,,127513,LV,"zzzzzzLord Vader, zThrawn zzzMaul zRG Stormtrooper G1",0
"Celestial",,,65324,Mon Mothma,"Mon Mothma 5* G8, Lando G9, Wedge G8, Biggs Bistan G7",0
"Celestial",1,1,89031,Carth,"zCarth Onasi, zMission zZaalbar zJuhani G7, Canderous G8",0
"Celestial",1,0,59434,Troopers,"Veers G9, Starck G7, Snowtrooper G7, Dark Trooper 5* G9, Gideon 4* G7",0
"Celestial",,,113749,Bad Batch,"zHunter zEcho Omega 6* G8, zTech zWrecker",0
"Celestial",0,1,71024,Phoenix,"Hera G8, Chopper G9, Kanan G7, Zeb G7, zEzra G7",0
"Celestial",1,0,8109,SionSolo (Counter),"Sion 3* G7",0
