Player,Offense,Defense,GP,Name,Squad,Viable
"Benstr8ballin",0,1,99364,Geonosians,"zzGBA Sun Fac, Geo Soldier, Geo Spy, Poggle",1
"Benstr8ballin",1,1,84950,JTR,"zzJTR Scav Rey G9, BB-8 G9, R2-D2 Finn G9",1
"Benstr8ballin",1,1,127781,Revan,"zzzJKR BS zGMY zJolee zGK",1
"Benstr8ballin",1,1,82639,Ewoks,"zChirpa Elder Paploo G9, zWicket Logray",1
"Benstr8ballin",0,1,130029,BH,"zBossk IG-88 zThe Mandalorian, Dengar zBoba",1
"Benstr8ballin",1,1,87559,Carth,"zCarth Onasi, zMission Zaalbar Juhani G8, zCanderous",1
"Benstr8ballin",1,1,131888,zEP,"zzEP zzVader Tarkin Krennic TFP",1
"Benstr8ballin",0,1,70408,Phoenix,"Hera G8, Chopper Kanan G8, Zeb G8, Ezra",1
"Benstr8ballin",1,0,22887,NestSolo (Counter),"zNest",1
"Benstr8ballin",,,42667,Phasma,"Phasma G8, FOTP 5* G8, FOSFTP 5* G7, FOST 5* G8, Kylo G8",0
"Benstr8ballin",1,1,84905,NS,"zMT AV Daka Zombie Spirit G9",0
"Benstr8ballin",0,1,97052,Grievous,"GG G9, B2 zB1 MagnaGuard Nute",0
"Benstr8ballin",1,0,98646,Traya,"zTraya G9, DN G8, Sion 4* G9, zDooku zThrawn",0
"Benstr8ballin",1,0,97152,Troopers,"Veers zzPiett Gideon G9, Dark Trooper G9, Range Trooper 6* G9",0
"Benstr8ballin",,,75174,Mon Mothma,"Mon Mothma 5* G8, Lando Cara Dune G8, Kyle Katarn, Biggs",0
"Benstr8ballin",1,1,78741,GAS,"GAS 5* G7, Rex Echo (501st) G9, zFives G9, zAhsoka",0
"Benstr8ballin",0,1,89114,BH,"Jango zZam Fennec Shand G8, Cad Greef",0
"Benstr8ballin",1,1,48503,Rogue1,"Jyn 6* G8, Chirrut 5* G8, Baze G8, K-2SO G8, Cassian 6* G8",0
"Benstr8ballin",,,52755,Bad Batch,"Hunter 5* G9, Echo 4* G9, Omega 6* G8, Tech 5* G9, Wrecker 5* G8",0
"NotFromEarth",,,123566,Phasma,"zPhasma zFOTP FOSFTP zFOST zKylo",1
"NotFromEarth",1,1,154800,SL Kylo,"zzzzzzSL Kylo, zSith Trooper, zHux zzKRU Thrawn",1
"NotFromEarth",,,168975,SEE,"zzzzzzSEE zBSF zzMalak zzzDR zzzVader",1
"NotFromEarth",,,574275,Executor,"Executor 6* HT RC Xanadu Blood, Slave I, IG-2000 Imperial TIE Fighter, Tie Adv",1
"NotFromEarth",1,0,140742,CLS,"zzzCLS zHan zzChewbacca zzC-3PO zChewpio",1
"NotFromEarth",,,454463,HansMF,"Home One, Han's MF, Rebel Y-wing, Bistan's U-wing, Phantom Ghost Cassian's U-wing, Biggs X-wing",1
"NotFromEarth",0,1,94592,Geonosians,"zGBA Sun Fac, Geo Soldier, Geo Spy, Poggle",1
"NotFromEarth",0,1,110976,Grievous,"zzGG zB2 zB1 MagnaGuard zNute",1
"NotFromEarth",1,0,110586,Traya,"zzTraya DN zSion G9, zEP Sith Empire Trooper",1
"NotFromEarth",,,118721,Mon Mothma,"zzMon Mothma, zCassian Scarif Biggs Bistan",1
"NotFromEarth",1,1,143383,GAS,"zzzzGAS zRex zEcho (501st), zzFives zARC Trooper",1
"NotFromEarth",1,1,131148,Revan,"zzzJKR zBS GMY zJolee zGK",1
"NotFromEarth",1,1,84229,Ewoks,"zChirpa Elder Paploo Wicket Logray",1
"NotFromEarth",0,1,135816,BH,"zzBossk zIG-88 Dengar Boba Cad",1
"NotFromEarth",1,0,115931,Troopers,"zVeers zStarck zzPiett Gideon Range Trooper",1
"NotFromEarth",0,1,76930,Phoenix,"Hera Kanan G8, Zeb G8, Ezra Sabine G8",1
"NotFromEarth",1,0,128641,zMaul,"zDarth Maul, Dooku zSidious zSavage Sith Marauder",1
"NotFromEarth",1,1,103743,Rogue1,"zJyn Chirrut G8, Baze G8, K-2SO G8, zzAdmiral Raddus",1
"NotFromEarth",,,439315,Negotiator,"Negotiator BTL-B Y-wing 2*, Anakin's Eta-2, Rex's ARC-170, Umbaran SF, Ahsoka's SF, Plo's SF, Clone Sergeant's ARC-170",0
"NotFromEarth",,,276597,Malevolence,"Malevolence Hyena Bomber 5*, Vulture Droid 6*, Sun Fac SF, Soldier SF, Spy SF",0
"NotFromEarth",1,1,76477,JTR,"JTR G8, Scav Rey, BB-8 G9, R2-D2 Finn G9",0
"NotFromEarth",1,1,71808,NS,"MT G8, AV Daka Zombie G8, Spirit G8",0
"NotFromEarth",1,1,84786,Carth,"zCarth Onasi, zMission Zaalbar Juhani G7, Canderous",0
"NotFromEarth",,,56478,Iden Troopers,"Iden Versio 5* G8, Shoretrooper G8, Snowtrooper G8, Magma G1, DT G8",0
"NotFromEarth",0,1,87721,BH,"Jango Greedo G8, Zam G8, zThe Mandalorian, zzGreef",0
"NotFromEarth",,,92837,Mando,"zzThe Mandalorian (Beskar Armor), zDash Rendar, Nest G1, IG-11 G8, Kuiil G8",0
"NotFromEarth",1,0,103145,QGJ,"zQGJ Aayla G1, zJKA zzHYoda zAhsoka",0
"NotFromEarth",1,0,33150,Jawas,"Nebit G1, Jawa Engineer G1, Jawa Scavenger G1, Jawa G1, Dathcha G1",0
"Delara Exibil",,,123289,Phasma,"zPhasma zFOTP FOSFTP zFOST zKylo",1
"Delara Exibil",1,1,156751,SL Kylo,"zzzzzzSL Kylo, zSith Trooper, zHux zzKRU zzThrawn",1
"Delara Exibil",,,171593,SEE,"zzzzzzSEE zBSF zzMalak zzzDR zzzVader",1
"Delara Exibil",1,1,115548,NS,"zzMT zzAV zDaka Zombie Spirit",1
"Delara Exibil",,,563846,Executor,"Executor 5* HT RC Xanadu Blood, Slave I, IG-2000 Imperial TIE Fighter, Tie Adv",1
"Delara Exibil",,,167929,JMLS,"zzzJKR zzJKL zzzzzzJMLS zHYoda zzzzGAS",1
"Delara Exibil",1,0,146100,CLS,"zzzCLS zHan zzChewbacca zzC-3PO zChewpio",1
"Delara Exibil",0,1,134709,padme,"zzPadme zGK zJKA zAhsoka zBarriss",1
"Delara Exibil",,,493679,Negotiator,"Negotiator BTL-B Y-wing, Anakin's Eta-2, Rex's ARC-170, Umbaran SF, Ahsoka's SF, Plo's SF, Clone Sergeant's ARC-170",1
"Delara Exibil",,,307225,Malevolence,"Malevolence Hyena Bomber, Vulture Droid, Sun Fac SF, Soldier SF, Spy SF",1
"Delara Exibil",,,458494,HansMF,"Home One, Han's MF, Rebel Y-wing, Bistan's U-wing, Phantom Ghost Cassian's U-wing, Wedge X-wing",1
"Delara Exibil",0,1,105388,Geonosians,"zzGBA Sun Fac, Geo Soldier, Geo Spy, Poggle",1
"Delara Exibil",0,1,117924,Grievous,"zzGG zB2 zB1 MagnaGuard zNute",1
"Delara Exibil",1,0,115176,Traya,"zzTraya zzDN zSion zzEP Sith Empire Trooper",1
"Delara Exibil",1,1,126106,JTR,"zzzJTR zScav Rey, zzBB-8 zzR2-D2 Finn",1
"Delara Exibil",1,0,129806,Troopers,"zVeers zzPiett zGideon zDark Trooper, Range Trooper",1
"Delara Exibil",,,129766,Disintegration,"Aurra zzGreef zBoba zzBossk zThe Mandalorian",1
"Delara Exibil",,,101425,Mon Mothma,"zzMon Mothma, Chirrut Cara Dune, Wedge Biggs",1
"Delara Exibil",1,1,93940,Ewoks,"zChirpa Elder zPaploo zWicket zLogray",1
"Delara Exibil",1,0,135661,ShaakClones,"zzShaak Ti, zRex zEcho (501st), zzFives zARC Trooper",1
"Delara Exibil",1,1,90743,Carth,"zCarth Onasi, zMission zZaalbar Juhani Canderous",1
"Delara Exibil",0,1,96007,Phoenix,"zHera zKanan zZeb zEzra zSabine",1
"Delara Exibil",1,0,19824,NestSolo (Counter),"zNest",1
"Delara Exibil",,,79365,Iden Troopers,"zIden Versio, Shoretrooper Snowtrooper Magma G7, DT",0
"Delara Exibil",0,1,114090,BH,"zJango IG-88 Greedo zDengar Cad",0
"Delara Exibil",,,68085,Bad Batch,"Hunter Echo Omega 6* G9, Tech G9, Wrecker G8",0
"Delara Exibil",1,0,66693,Jawas,"Nebit G9, Jawa Engineer G9, Jawa Scavenger G7, Jawa G9, Dathcha",0
"The Battleooze",,,555656,Executor,"Executor HT RC Xanadu Blood, Slave I, IG-2000 Imperial TIE Fighter, Tie Adv",1
"The Battleooze",0,1,124097,padme,"zzPadme zGK zJKA zAhsoka zC-3PO",1
"The Battleooze",,,298837,Malevolence,"Malevolence Hyena Bomber, Vulture Droid, Sun Fac SF, Soldier SF, Spy SF",1
"The Battleooze",0,1,93712,Geonosians,"zzGBA Sun Fac, Geo Soldier, Geo Spy, Poggle",1
"The Battleooze",0,1,110195,Grievous,"zzGG zB2 zB1 MagnaGuard zNute",1
"The Battleooze",,,105125,Disintegration,"Aurra Greef G8, Boba zzBossk The Mandalorian G9",1
"The Battleooze",1,1,141755,GAS,"zzzzGAS zRex zEcho (501st), zzFives zARC Trooper",1
"The Battleooze",1,1,102624,Revan Offense,"zzzJKR GMY BS zJolee Ezra G9",1
"The Battleooze",1,1,80970,Ewoks,"zChirpa Elder Paploo Wicket Logray",1
"The Battleooze",1,1,85926,Carth,"zCarth Onasi, zMission zZaalbar Juhani Canderous G8",1
"The Battleooze",1,1,117071,zEP,"zzEP zzzVader Tarkin TFP zBSF",1
"The Battleooze",1,0,12543,NestSolo (Counter),"Nest G8",1
"The Battleooze",,,50036,Phasma,"Phasma G8, FOTP G8, FOO G8, KRU 6* G8, Kylo G8",0
"The Battleooze",1,0,71436,CLS,"zCLS zHan Chewbacca G9, R2-D2 G8, Chewpio G8",0
"The Battleooze",,,332509,HansMF,"Home One, Han's MF, Rebel Y-wing 6*, Bistan's U-wing, Phantom Ghost Cassian's U-wing, Biggs X-wing",0
"The Battleooze",1,0,77152,Troopers,"Veers zzPiett Gideon G9, Dark Trooper 5* G8, Range Trooper 5* G8",0
"The Battleooze",1,1,59857,NS,"MT G8, AV Daka G9, Zombie G8, Spirit G8",0
"The Battleooze",,,95975,Mon Mothma,"Mon Mothma G9, Cara Dune G8, Jyn Cassian Bistan",0
"The Battleooze",,,51270,Iden Troopers,"Iden Versio 5*, Stormtrooper G8, Snowtrooper G8, Magma G1, DT G8",0
"The Battleooze",0,1,105966,BH,"Jango IG-88 zZam G9, Dengar Cad",0
"The Battleooze",0,1,68181,Phoenix,"Hera Chopper G8, Kanan G8, Zeb G8, Sabine 5* G8",0
"The Battleooze",1,0,54669,Wiggs,"Wedge G9, Biggs G8, Fulcrum G8, Chirrut G8, Baze 6* G8",0
"Schmiticus",,,122445,Phasma,"zPhasma zFOTP FOSFTP zFOST zKylo",1
"Schmiticus",1,1,145356,SL Kylo,"zzzzzzSL Kylo, zSith Trooper, zHux zzKRU Thrawn",1
"Schmiticus",1,0,139314,CLS,"zzzCLS zHan zzChewbacca C-3PO zChewpio",1
"Schmiticus",,,483668,Negotiator,"Negotiator HT Anakin's Eta-2, Umbaran SF, Ahsoka's SF, Clone Sergeant's ARC-170, Plo's SF, Rex's ARC-170",1
"Schmiticus",,,370865,HansMF,"Home One, Han's MF, Rebel Y-wing 6*, Ghost Phantom Biggs X-wing, Cassian's U-wing, Wedge X-wing",1
"Schmiticus",0,1,100377,Geonosians,"zzGBA Sun Fac, Geo Soldier, Geo Spy, Poggle",1
"Schmiticus",0,1,118384,Grievous,"zzGG zB2 zB1 zDroideka zMagnaGuard",1
"Schmiticus",,,100728,Mon Mothma,"zzMon Mothma, zCara Dune, Wedge Pao Hoth Rebel Scout",1
"Schmiticus",1,0,114377,Troopers,"zVeers zzPiett zGideon zDark Trooper, Range Trooper",1
"Schmiticus",1,1,140018,GAS,"zzzzGAS zRex zEcho (501st), zzFives zARC Trooper",1
"Schmiticus",1,1,117555,Revan,"zzzJKR BS zGMY zJolee zGK",1
"Schmiticus",1,1,89635,Ewoks,"zChirpa Elder Paploo zWicket zLogray",1
"Schmiticus",0,1,120791,BH,"zBossk IG-88 Dengar Boba Cad",1
"Schmiticus",1,1,121990,zEP,"zzEP zzzVader Tarkin TFP BSF",1
"Schmiticus",0,1,66031,Phoenix,"Hera G8, Chopper G8, Kanan G8, Zeb G8, Ezra G8",1
"Schmiticus",1,1,74704,NS,"MT G8, zzAV Daka G9, Zombie Spirit G3",0
"Schmiticus",1,1,102757,JTR,"JTR Scav Rey G9, BB-8 zR2-D2 Finn G8",0
"Schmiticus",,,90267,Nute-OR,"Nute zDooku Jango zZaalbar zMission",0
"Schmiticus",,,64367,Iden Troopers,"zIden Versio 4* G8, Stormtrooper G9, Snowtrooper G8, Magma G7, DT G7",0
"Schmiticus",1,0,94475,QGJ,"QGJ G6, Aayla G5, zJKA zHYoda zAhsoka",0
"Schmiticus",1,0,8077,SionSolo (Counter),"Sion G4",0
"PadmesHubby",,,156224,JMK,"zzzzzzJMK JKA zGMY zShaak Ti, zGK",1
"PadmesHubby",0,1,97593,Geonosians,"zzGBA Sun Fac, Geo Soldier, Geo Spy, Poggle",1
"PadmesHubby",0,1,117227,Grievous,"zzGG zB2 zB1 zDroideka MagnaGuard",1
"PadmesHubby",1,1,133950,GAS,"zzzzGAS zRex zEcho (501st), zFives ARC Trooper",1
"PadmesHubby",1,0,104852,CLS,"zzCLS zHan zChewbacca Thrawn C-3PO",1
"PadmesHubby",1,1,84460,Ewoks,"zChirpa G9, Elder Paploo Teebo G9, zWicket",1
"PadmesHubby",1,1,111512,zEP,"zEP zzVader Tarkin G9, TFP G8, zSith Trooper",1
"PadmesHubby",0,1,100535,BH,"zJango IG-88 G8, Greedo G8, Boba Cad",1
"PadmesHubby",0,1,126947,FO,"zzKRU zKylo FOE FOO FOST",1
"PadmesHubby",0,1,69574,Phoenix,"Hera G9, Chopper Kanan G8, Zeb G8, Ezra G9",1
"PadmesHubby",,,446957,Negotiator,"Negotiator BTL-B Y-wing 2*, Anakin's Eta-2, Rex's ARC-170, Umbaran SF, Ahsoka's SF, Plo's SF 3*, Clone Sergeant's ARC-170",0
"PadmesHubby",1,0,87779,Traya,"zTraya DN Sion 2* G6, zBSF Dooku",0
"PadmesHubby",1,1,66911,NS_Alt,"MT G8, zAV Talia 6* G8, Daka G9, Spirit 5* G8",0
"PadmesHubby",,,59175,Bad Batch,"zHunter 6* Echo 2* G9, Omega 6* G8, Tech 5* G9, Wrecker 5* G8",0
"PadmesHubby",1,0,55088,Wiggs,"Wedge G8, Biggs G8, Leia G8, Chirrut 5* G8, Baze 6* G8",0
"Ur An Ugly Piece of",,,120626,Phasma,"zPhasma FOTP FOSFTP zFOST zKylo",1
"Ur An Ugly Piece of",1,1,146476,SL Kylo,"zzzzzzSL Kylo, zSith Trooper, zHux zzKRU Thrawn",1
"Ur An Ugly Piece of",0,1,131592,padme,"zzPadme zGK zJKA zAhsoka zC-3PO",1
"Ur An Ugly Piece of",0,1,118585,DRMalak,"zzzDR zzHK-47 zBSF zzMalak Sith Assassin G8",1
"Ur An Ugly Piece of",,,426543,Negotiator,"Negotiator HT Anakin's Eta-2, Umbaran SF, Ahsoka's SF, BTL-B Y-wing, Clone Sergeant's ARC-170, Plo's SF",1
"Ur An Ugly Piece of",,,305291,Malevolence,"Malevolence Hyena Bomber, Vulture Droid, Sun Fac SF, Soldier SF, Spy SF",1
"Ur An Ugly Piece of",0,1,97508,Geonosians,"zzGBA Sun Fac, Geo Soldier, Geo Spy, Poggle",1
"Ur An Ugly Piece of",0,1,133903,Grievous,"zzGG zB2 zB1 zMagnaGuard zNute",1
"Ur An Ugly Piece of",1,1,158178,GAS,"zzzzGAS zRex zEcho (501st), zzFives zARC Trooper",1
"Ur An Ugly Piece of",1,1,108564,Revan Offense,"zzzJKR zGMY BS zJolee HYoda",1
"Ur An Ugly Piece of",1,1,94379,Ewoks,"zChirpa Elder zPaploo zWicket zLogray",1
"Ur An Ugly Piece of",1,1,87028,Carth,"zCarth Onasi, Mission zZaalbar Juhani G8, Canderous",1
"Ur An Ugly Piece of",0,1,110443,BH,"zzBossk zZam zzJango Boba zEmbo",1
"Ur An Ugly Piece of",1,1,128327,zEP,"zzEP zzVader zTarkin TFP G8, zzDN",1
"Ur An Ugly Piece of",0,1,73641,Phoenix,"Hera G9, Chopper G9, Kanan G8, Zeb G8, Sabine",1
"Ur An Ugly Piece of",1,0,14079,SionSolo (Counter),"Sion G8",1
"Ur An Ugly Piece of",1,0,106872,CLS,"zzzCLS zHan Chewbacca G9, zzR2-D2 G8, zChewpio G9",0
"Ur An Ugly Piece of",1,1,78907,NS,"zMT G8, zAV Daka Zombie Spirit G8",0
"Ur An Ugly Piece of",,,306273,HansMF,"Home One, Han's MF, Rebel Y-wing, Bistan's U-wing 4*, Phantom Ghost Cassian's U-wing, Biggs X-wing",0
"Ur An Ugly Piece of",1,0,68569,Troopers,"Veers G9, Starck G7, Snowtrooper G8, DT G9, Stormtrooper G9",0
"Ur An Ugly Piece of",,,111485,Bad Batch,"zHunter zEcho Omega 5* G9, zTech zWrecker",0
"Ur An Ugly Piece of",1,0,72665,Wiggs,"Wedge G8, Biggs zLeia Chirrut 6* G8, Baze G8",0
"Kaveman",,,128507,Phasma,"zPhasma zFOTP zSith Trooper, zzKRU zKylo",1
"Kaveman",1,1,101193,NS,"zzMT zzAV zDaka Zombie Spirit",1
"Kaveman",1,0,146333,CLS,"zzzCLS zHan zzChewbacca zzC-3PO zChewpio",1
"Kaveman",0,1,126684,padme,"zzPadme zGK zJKA zAhsoka zBarriss",1
"Kaveman",0,1,109523,DRMalak,"zzzDR zzHK-47 zBSF zzMalak 6* Sith Assassin",1
"Kaveman",,,455458,Negotiator,"Negotiator HT Anakin's Eta-2, Umbaran SF, Ahsoka's SF, BTL-B Y-wing, Clone Sergeant's ARC-170, Plo's SF",1
"Kaveman",,,289217,Malevolence,"Malevolence Hyena Bomber, Vulture Droid, Sun Fac SF, Soldier SF, Spy SF",1
"Kaveman",0,1,100024,Qira,"zQira zL3-37 zVandor Chewbacca, zNest zZaalbar",1
"Kaveman",,,472650,HansMF,"Home One, Han's MF, Rebel Y-wing, Bistan's U-wing, Phantom Ghost Cassian's U-wing, Wedge X-wing",1
"Kaveman",1,1,140428,JTR,"zzzJTR zzR2-D2 zzBB-8 zRH Finn, zRH Poe",1
"Kaveman",0,1,94066,Geonosians,"zzGBA Sun Fac, Geo Soldier, Geo Spy, Poggle",1
"Kaveman",1,0,111568,Traya,"zzTraya zzDN zSion Sith Empire Trooper G8, zzThrawn",1
"Kaveman",0,1,105734,Grievous,"zzGG zB2 zB1 zMagnaGuard zNute",1
"Kaveman",,,484678,Executrix,"Executrix Tie Adv, Emperor's Shuttle, TIE Reaper, Imperial TIE Fighter, Gauntlet Starfighter, FOSF TIE Fighter, FO TIE Fighter",1
"Kaveman",,,125326,Disintegration,"zzAurra zzGreef zBoba zzBossk The Mandalorian G8",1
"Kaveman",,,94429,Mon Mothma,"zzMon Mothma, Chirrut Wedge Baze Scarif",1
"Kaveman",1,1,127160,Revan Offense,"zzzJKR zzGMY zBS zJolee zzHYoda",1
"Kaveman",1,1,96889,Ewoks,"zChirpa Elder zPaploo zWicket zLogray",1
"Kaveman",1,0,107453,ShaakClones,"zzShaak Ti, zRex zEcho (501st), zzFives ARC Trooper G8",1
"Kaveman",1,1,128007,zEP,"zzEP zzzVader zzTarkin zIPD TFP",1
"Kaveman",0,1,118936,BH,"zzJango zGreedo zZam zDengar zzEmbo",1
"Kaveman",1,0,107090,Troopers,"zVeers zStarck zzPiett zDT zzGideon",1
"Kaveman",0,1,99240,Phoenix,"zHera zKanan zZeb zEzra zSabine",1
"Kaveman",1,0,124623,zMaul,"zDarth Maul, zDooku zSidious zSavage Sith Marauder",1
"Kaveman",1,0,83828,Jawas,"Nebit G8, Jawa Engineer, Jawa Scavenger, Jawa Dathcha",1
"Kaveman",,,71699,Bad Batch,"Hunter G9, Echo G8, Omega G8, Tech G8, Wrecker G8",0
"Nodin",0,1,135921,padme,"zzPadme zGK zJKA zAhsoka zzC-3PO",1
"Nodin",0,1,107607,DRMalak,"zzzDR HK-47 BSF zzMalak Sith Empire Trooper",1
"Nodin",,,357089,HansMF,"Home One, Han's MF, HT Bistan's U-wing, Phantom Ghost Cassian's U-wing, Wedge X-wing",1
"Nodin",0,1,94666,Geonosians,"zzGBA Sun Fac, Geo Soldier, Geo Spy, Poggle",1
"Nodin",1,1,86614,JTR,"zzJTR Scav Rey G9, BB-8 G9, R2-D2 Finn G9",1
"Nodin",,,89107,Disintegration,"Aurra Greef G8, Boba zBossk The Mandalorian",1
"Nodin",1,1,116996,Revan Offense,"zzzJKR zzGMY zBS zJolee zzHYoda",1
"Nodin",1,1,85187,Ewoks,"zChirpa Elder Paploo Wicket zLogray",1
"Nodin",1,0,96783,ShaakClones,"zzShaak Ti, Rex Echo (501st), zFives ARC Trooper",1
"Nodin",1,1,85919,Carth,"zCarth Onasi, zMission Zaalbar Juhani Canderous G8",1
"Nodin",1,1,104267,zEP,"zzEP zzzVader Tarkin DT TFP G8",1
"Nodin",0,1,97171,BH,"zzJango IG-88 Dengar Cad Embo",1
"Nodin",0,1,71348,Phoenix,"Hera Kanan G8, Zeb G8, Ezra Sabine G8",1
"Nodin",0,1,83664,FO,"zzKRU Kylo FOO G8, Phasma FOST G9",1
"Nodin",1,1,69799,Rogue1,"Jyn G9, Chirrut G9, Baze G9, K-2SO G9, Cassian G9",1
"Nodin",1,0,18519,NestSolo (Counter),"zNest",1
"Nodin",1,0,11260,SionSolo (Counter),"Sion G8",1
"Nodin",,,396643,Negotiator,"Negotiator 6* BTL-B Y-wing 5*, Anakin's Eta-2, Rex's ARC-170, Umbaran SF, Ahsoka's SF, Plo's SF, Clone Sergeant's ARC-170",0
"Nodin",1,1,88333,NS,"zMT zzAV Daka Zombie G9, Spirit G8",0
"Nodin",,,263368,Malevolence,"Malevolence Hyena Bomber 6*, Vulture Droid 6*, Sun Fac SF, Soldier SF, Spy SF",0
"Nodin",0,1,104177,Grievous,"GG zB2 zB1 zMagnaGuard Nute",0
"Nodin",,,332648,Executrix,"Executrix Tie Adv, Emperor's Shuttle, TIE Reaper 5*, Imperial TIE Fighter, Gauntlet Starfighter, FOSF TIE Fighter, FO TIE Fighter",0
"Nodin",1,0,69069,Troopers,"Veers Piett G9, Gideon Dark Trooper G9, Range Trooper G8",0
"Nodin",,,71339,Mon Mothma,"Mon Mothma G8, Lando Cara Dune G8, Wedge G9, Pao G8",0
"Nodin",1,0,102243,CLS,"zzzCLS zHan Leia G9, Old Ben G9, zzChewbacca",0
"Nodin",1,0,56110,Thragma (Counter),"Thrawn G9, Magma G8, Krennic 6* G7, Stormtrooper G8, Shoretrooper G8",0
"Nodin",,,60444,Bad Batch,"Hunter G9, Echo 5* G8, Omega G8, Tech G8, Wrecker G8",0
"Nodin",1,0,50624,Jawas,"Nebit G7, Jawa Engineer G7, Jawa Scavenger G7, Jawa G7, Dathcha G8",0
"fives deserved better",,,165441,SEE,"zzzzSEE zBSF zzMalak zzzDR zzVader",1
"fives deserved better",0,1,141942,padme,"zzPadme zGK zJKA zAhsoka zC-3PO",1
"fives deserved better",1,1,100997,NS_Alt,"zzMT zAV Talia zDaka Zombie",1
"fives deserved better",,,555864,Negotiator,"Negotiator HT Anakin's Eta-2, Umbaran SF, Ahsoka's SF, Clone Sergeant's ARC-170, Plo's SF, Rex's ARC-170",1
"fives deserved better",0,1,117302,Geonosians,"zzGBA Sun Fac, Geo Soldier, Geo Spy, Poggle",1
"fives deserved better",0,1,133417,Grievous,"zzGG zB2 zB1 zMagnaGuard zNute",1
"fives deserved better",1,1,147415,Revan Offense,"zzzJKR zGMY zBS zJolee zEzra",1
"fives deserved better",1,1,90400,Ewoks,"zChirpa Elder Paploo zWicket zLogray",1
"fives deserved better",1,0,142148,ShaakClones,"zzShaak Ti, zRex zEcho (501st), zzFives zARC Trooper",1
"fives deserved better",1,1,94696,Carth,"zCarth Onasi, Mission G9, zZaalbar zJuhani zCanderous",1
"fives deserved better",0,1,132107,BH,"zzBossk zGreedo zJango Boba Cad",1
"fives deserved better",1,0,108966,Troopers,"zVeers Starck zzPiett DT Gideon",1
"fives deserved better",1,0,91296,Wiggs,"Wedge Biggs Han zzChewbacca Leia",1
"fives deserved better",0,1,82279,Phoenix,"Hera Chopper zKanan Zeb Sabine",1
"fives deserved better",,,58491,Phasma,"Phasma G8, FOTP G8, FOSFTP G7, FOST 5* G8, Kylo G8",0
"fives deserved better",,,374267,HansMF,"Home One, Han's MF, Biggs X-wing, Bistan's U-wing 5*, Phantom Ghost Cassian's U-wing, Wedge X-wing",0
"fives deserved better",1,0,97383,Thragma (Counter),"zThrawn Magma G7, Krennic Tarkin Shoretrooper G8",0
"fives deserved better",1,1,65918,Rogue1,"Jyn G8, Chirrut G8, Baze 6* G8, K-2SO G8, Cassian G8",0
"Malanchi",0,1,132906,padme,"zzPadme zGK zJKA zAhsoka zBarriss",1
"Malanchi",0,1,98563,Geonosians,"zzGBA Sun Fac, Geo Soldier, Geo Spy, Poggle",1
"Malanchi",0,1,120872,Grievous,"zzGG zB2 zB1 zDroideka zMagnaGuard",1
"Malanchi",1,1,165185,GAS,"zzzzGAS zRex zEcho (501st), zzFives zARC Trooper",1
"Malanchi",1,1,93573,Ewoks,"zChirpa Elder zPaploo zWicket zLogray",1
"Malanchi",,,36893,Phasma,"Phasma G8, FOE 5* G8, FOO 5* G8, KRU 6* G8, Kylo 5* G8",0
"Malanchi",1,1,85927,NS,"zMT zzAV zDaka Zombie Spirit 6* G8",0
"Malanchi",1,1,59187,zEP,"EP Vader Tarkin G8, DT 6* G8, DN 6* G8",0
"Malanchi",1,0,71275,Wiggs,"Wedge 5* G8, Biggs G8, Fulcrum C-3PO Leia G9",0
"Malanchi",0,1,43075,Phoenix,"Hera 5* G8, Chopper 6* G8, Zeb G8, Ezra G9, Sabine 5* G8",0
"Malanchi",1,1,37988,Rogue1,"Jyn 5* G8, Chirrut 5* G8, Baze 6* G8, K-2SO G8, Cassian 5* G8",0
"wngsprd",,,162586,SEE,"zzzzzzSEE zBSF zzMalak zzzDR zzVader",1
"wngsprd",0,1,139214,padme,"zzPadme zGK zJKA zAhsoka zzC-3PO",1
"wngsprd",,,470487,Negotiator,"Negotiator HT Anakin's Eta-2, Umbaran SF, Ahsoka's SF, Clone Sergeant's ARC-170, Plo's SF, Rex's ARC-170",1
"wngsprd",0,1,93967,Geonosians,"zzGBA Sun Fac, Geo Soldier, Geo Spy, Poggle",1
"wngsprd",0,1,111713,Grievous,"zzGG zB2 zB1 zMagnaGuard zNute",1
"wngsprd",1,1,119451,Revan Offense,"zzzJKR zGMY BS zJolee zzHYoda",1
"wngsprd",1,1,83562,Ewoks,"zChirpa Elder Paploo Wicket Logray",1
"wngsprd",1,0,126843,ShaakClones,"zzShaak Ti, zRex zEcho (501st), zzFives zARC Trooper",1
"wngsprd",0,1,127437,BH,"zBossk IG-88 Dengar zJango Boba",1
"wngsprd",1,0,123240,Troopers,"zVeers zStarck zzPiett zDark Trooper, zGideon",1
"wngsprd",0,1,67619,Phoenix,"Hera G8, Chopper G9, Kanan G8, Zeb G8, Ezra",1
"wngsprd",1,0,91105,CLS,"zzCLS zHan zChewbacca R2-D2 G8, Chewpio",0
"wngsprd",,,209355,HansMF,"Home One, Han's MF, Biggs X-wing, Bistan's U-wing 5*, Phantom Ghost Cassian's U-wing, Wedge X-wing",0
"wngsprd",1,1,79656,Carth,"zCarth Onasi, zMission Zaalbar Juhani G7, zCanderous",0
"wngsprd",1,0,124717,zMaul,"Darth Maul, Dooku zSidious Sith Empire Trooper, Sith Marauder",0
"wngsprd",0,1,59774,FO,"KRU G7, Kylo G7, FOSFTP G7, FOO G7, Phasma G7",0
"SamIAm",0,1,106173,padme,"zzPadme zGK zJKA zAhsoka zzC-3PO",1
"SamIAm",0,1,106205,DRMalak,"zzzDR zzHK-47 zBSF zzMalak Sith Empire Trooper",1
"SamIAm",0,1,93896,Geonosians,"zzGBA Sun Fac, Geo Soldier, Geo Spy, Poggle",1
"SamIAm",1,1,90296,Ewoks,"zChirpa Elder Paploo Scout zWicket",1
"SamIAm",0,1,107002,BH,"zBossk Dengar G9, zJango zBoba zGreef",1
"SamIAm",1,1,88431,Carth,"zCarth Onasi, zMission zZaalbar Juhani Canderous",1
"SamIAm",1,0,70038,Jawas,"Nebit G8, Jawa Engineer, Jawa Scavenger G8, Jawa G9, Dathcha G8",1
"SamIAm",1,0,19180,NestSolo (Counter),"zNest",1
"SamIAm",,,223808,HansMF,"Home One, Han's MF 5*, Rebel Y-wing 4*, Bistan's U-wing 6*, Phantom Ghost Cassian's U-wing, Biggs X-wing",0
"SamIAm",,,346744,Negotiator,"Negotiator HT 6* Anakin's Eta-2, Umbaran SF, Ahsoka's SF, Clone Sergeant's ARC-170, Plo's SF, Rex's ARC-170",0
"SamIAm",0,1,62176,Grievous-Wat,"GG G9, B2 G9, B1 G5, MagnaGuard G8, Wat Tambor G2",0
"SamIAm",1,1,90373,Revan Offense,"zJKR GMY BS zJolee Ezra G7",0
"SamIAm",1,0,84387,ShaakClones,"zzShaak Ti, zRex G9, Echo (501st) G9, zFives G9, ARC Trooper G9",0
"SamIAm",1,1,70099,zEP,"EP G9, zVader Tarkin TFP G7, Traya G7",0
"SamIAm",1,0,77382,Wiggs,"Wedge G6, Biggs G5, CLS zHan zChewbacca",0
"SamIAm",,,75340,Bad Batch,"zHunter 5* zEcho 4* zzOmega 5* zTech 5* zWrecker 4* G9",0
"SamIAm",0,1,52808,Phoenix,"Hera G7, Chopper G7, Kanan G7, Zeb G8, Sabine 5* G7",0
"Jacktil",,,151275,JMLS,"zBS zzzzzzJMLS zHYoda zzJKL zJolee",1
"Jacktil",1,0,145460,CLS,"zzzCLS zHan zzChewbacca zzC-3PO zChewpio",1
"Jacktil",0,1,120498,DRMalak,"zzzDR zHK-47 zBSF zzMalak Sith Empire Trooper",1
"Jacktil",,,380928,HansMF,"Home One, Han's MF, Rebel Y-wing 6*, Bistan's U-wing, Phantom Biggs X-wing, Cassian's U-wing, Wedge X-wing",1
"Jacktil",,,394506,Negotiator,"Negotiator HT Anakin's Eta-2, Umbaran SF, Ahsoka's SF, Clone Sergeant's ARC-170, Plo's SF, Rex's ARC-170",1
"Jacktil",0,1,93591,Geonosians,"zzGBA Sun Fac, Geo Soldier, Geo Spy, Poggle",1
"Jacktil",0,1,111802,Grievous,"zzGG zB2 zB1 zDroideka MagnaGuard",1
"Jacktil",1,1,94684,JTR,"zJTR Scav Rey G8, BB-8 G8, zR2-D2 Finn G8",1
"Jacktil",,,88536,Nute-OR,"zNute Dooku Jango zZaalbar zMission",1
"Jacktil",1,1,78151,Ewoks,"zChirpa G9, Elder Paploo Wicket Logray G9",1
"Jacktil",0,1,105064,BH,"zzBossk zZam zThe Mandalorian, Dengar G9, zBoba",1
"Jacktil",1,1,100164,zEP,"zzEP zzVader Tarkin TFP zTraya G9",1
"Jacktil",1,0,77852,501st,"Rex ARC Trooper G8, Echo (501st), Fives zAhsoka",1
"Jacktil",0,1,70025,Phoenix,"Hera G8, Chopper G9, Kanan G8, Zeb G8, Ezra",1
"Jacktil",,,64687,Phasma,"Phasma G8, FOE FOO G8, zKRU G8, Kylo G8",0
"Jacktil",,,265199,Malevolence,"Malevolence 5* Hyena Bomber 4*, Vulture Droid 6*, Sun Fac SF, Soldier SF, Spy SF",0
"Jacktil",1,1,67749,NS,"MT 6* G9, zAV Daka G8, Zombie G8, Spirit G9",0
"Jacktil",,,103437,Mon Mothma,"zMon Mothma, Lando Cara Dune G8, Wedge Biggs",0
"Jacktil",1,1,44800,Rogue1,"Jyn G8, Chirrut 6* G8, Baze 5* G8, K-2SO G8, Cassian G8",0
"Rabbit4t2",,,120907,Phasma,"zPhasma zFOTP FOSFTP zFOST Kylo",1
"Rabbit4t2",1,1,141300,SL Kylo,"zzzzzzSL Kylo, zSith Trooper, zHux zzKRU Thrawn G9",1
"Rabbit4t2",1,0,142820,CLS,"zzzCLS zHan zzChewbacca zzC-3PO Chewpio",1
"Rabbit4t2",,,362347,HansMF,"Home One, Han's MF, Rebel Y-wing 6*, Bistan's U-wing, Phantom Biggs X-wing, Cassian's U-wing, Wedge X-wing",1
"Rabbit4t2",,,447708,Negotiator,"Negotiator HT Anakin's Eta-2, Umbaran SF, Ahsoka's SF, Clone Sergeant's ARC-170, Plo's SF, Rex's ARC-170",1
"Rabbit4t2",0,1,100300,Geonosians,"zzGBA Sun Fac, Geo Soldier, Geo Spy, Poggle",1
"Rabbit4t2",,,103989,Mon Mothma,"Mon Mothma, Lando Cara Dune, Wedge Biggs",1
"Rabbit4t2",1,1,114319,GAS,"zzzzGAS zRex zEcho (501st), zzFives ARC Trooper",1
"Rabbit4t2",1,1,114737,Revan,"zzzJKR zBS GMY zJolee zGK",1
"Rabbit4t2",1,1,77540,Ewoks,"zChirpa G9, Elder Paploo Wicket Logray",1
"Rabbit4t2",0,1,101120,BH,"zBossk Dengar G8, Jango zBoba Cad",1
"Rabbit4t2",1,1,97621,Carth,"zCarth Onasi, Mission zZaalbar zJuhani zCanderous",1
"Rabbit4t2",1,1,109106,zEP,"zzEP zzzVader Tarkin G8, TFP G8, zBSF",1
"Rabbit4t2",0,1,71954,Phoenix,"Hera G8, Chopper Kanan G9, Zeb G8, Ezra",1
"Rabbit4t2",1,1,72097,NS,"MT G7, zzAV Daka G9, Zombie Spirit G7",0
"Rabbit4t2",0,1,98720,Grievous,"GG G9, zB2 zB1 MagnaGuard Nute",0
"Rabbit4t2",1,1,92463,JTR,"JTR Scav Rey G9, BB-8 G5, R2-D2 Finn G9",0
"Rabbit4t2",1,0,72945,Traya,"Traya DN G9, Sion G7, Dooku Nest G6",0
"Rabbit4t2",1,0,50240,Troopers,"Veers G9, Starck G5, Snowtrooper G4, Magma G4, Gideon 5* G7",0
"Rabbit4t2",1,0,94658,QGJ,"QGJ G7, Aayla G7, zJKA zzHYoda zAhsoka",0
