Player,Offense,Defense,GP,Name,Squad,Viable
"VicXav N201",1,0,15130,NestSolo (Counter),"zNest G7",0
"J Arrow",0,1,96175,Geonosians,"zzGBA Sun Fac, Geo Soldier, Geo Spy, Poggle",1
"J Arrow",1,1,82306,JTR,"zJTR Scav Rey, zBB-8 G9, zR2-D2 G8, RT",1
"J Arrow",1,1,86497,Revan,"zzzJKR G8, BS G9, zGMY Jolee G9, GK G8",1
"J Arrow",1,1,82413,Ewoks,"zChirpa Elder Paploo Wicket Logray",1
"J Arrow",0,1,71598,Phoenix,"Hera G9, Kanan G8, Zeb G8, Ezra zSabine",1
"J Arrow",1,1,62610,Rogue1,"Jyn G8, Chirrut G8, Baze G8, Cassian G8, K-2SO G9",1
"J Arrow",1,0,81105,QGJ,"zQGJ Aayla G9, JKA zHYoda Ahsoka",1
"J Arrow",1,0,80359,EP (Counter, Rebel),"EP Shoretrooper G9, DT G8, zzWampa Stormtrooper G8",1
"J Arrow",1,0,57696,Jawas,"Nebit G8, Jawa Engineer G9, Jawa Scavenger G8, Jawa G8, Dathcha G8",1
"J Arrow",,,53184,Phasma,"Phasma G8, FOTP G6, FOO G8, FOST G8, zKylo G9",0
"J Arrow",1,0,87989,CLS,"zzzCLS zHan Chewbacca 5* C-3PO G8, Chewpio 6* G8",0
"J Arrow",,,258099,HansMF,"Home One 6*, Han's MF 6*, Biggs X-wing, Bistan's U-wing 4*, Phantom 6* Ghost Cassian's U-wing, Wedge X-wing",0
"J Arrow",,,207344,Negotiator,"Negotiator 5* HT 6* Anakin's Eta-2 6*, Umbaran SF 6*, Ahsoka's SF, Clone Sergeant's ARC-170 6*, Jedi Consular's Starfighter, Plo's SF 2*",0
"J Arrow",1,0,69441,Traya,"zzTraya 5* DN zSion 5* G9, Dooku G8, Thrawn G8",0
"J Arrow",1,1,47487,NS,"MT 5* G8, AV G8, Daka G8, Zombie 6* G7, Spirit 5* G8",0
"J Arrow",0,1,79868,BH,"Bossk 4* G7, Dengar IG-88 Boba zJango",0
"J Arrow",1,0,67798,Clones,"zCody G8, Rex G8, Echo (501st) G8, Fives G9, Clone Sergeant",0
"Bjconnell",1,1,122701,NestSisters,"zzAV zzMT zDaka Zombie zNest",1
"Bjconnell",1,0,143600,CLS,"zzzCLS zHan zzChewbacca zzC-3PO zChewpio",1
"Bjconnell",0,1,123450,DRMalak,"zzzDR zzHK-47 zBSF zzMalak Sith Assassin G9",1
"Bjconnell",0,1,114987,padme,"zzPadme zGK zJKA zAhsoka CW Chewbacca G8",1
"Bjconnell",,,430418,Negotiator,"Negotiator HT Anakin's Eta-2, Umbaran SF, Ahsoka's SF, BTL-B Y-wing 6*, Clone Sergeant's ARC-170, Plo's SF",1
"Bjconnell",,,289806,Malevolence,"Malevolence 6* Hyena Bomber, Vulture Droid, Sun Fac SF, Soldier SF, Spy SF",1
"Bjconnell",,,435576,HansMF,"Home One, Han's MF, Rebel Y-wing, Bistan's U-wing, Phantom Ghost Cassian's U-wing, Wedge X-wing",1
"Bjconnell",0,1,100634,Geonosians,"zzGBA Sun Fac, Geo Soldier, Geo Spy, Poggle",1
"Bjconnell",1,1,108076,JTR,"zzzJTR zzR2-D2 zzBB-8 RH Finn G8, RH Poe G9",1
"Bjconnell",0,1,117820,Grievous,"zzGG zB2 zB1 zDroideka zMagnaGuard",1
"Bjconnell",,,93366,Mon Mothma,"zzMon Mothma, Wedge Chirrut Hoth Rebel Scout, zCara Dune",1
"Bjconnell",,,392849,Executrix,"Executrix Tie Adv, Emperor's Shuttle, TIE Reaper, Imperial TIE Fighter, Gauntlet Starfighter, FOSF TIE Fighter, FO TIE Fighter",1
"Bjconnell",,,108118,Disintegration,"Aurra zzGreef zBoba zBossk zThe Mandalorian",1
"Bjconnell",1,1,110436,GAS,"zzzzGAS zRex zEcho (501st), zzFives zARC Trooper",1
"Bjconnell",1,1,135542,Revan Offense,"zzzJKR zzGMY zBS zJolee zzHYoda",1
"Bjconnell",1,1,92945,Ewoks,"zChirpa Elder zPaploo zWicket Logray G9",1
"Bjconnell",1,1,113888,Carth,"zCarth Onasi, zMission zZaalbar zJuhani zCanderous",1
"Bjconnell",1,1,113409,zEP,"zzEP zzzVader zTarkin zIPD zMara Jade, The Emperor's Hand",1
"Bjconnell",0,1,106201,BH,"zzJango zDengar Zam IG-88 zEmbo",1
"Bjconnell",0,1,95938,FO,"zzKRU zKylo zHux FOE zFOST",1
"Bjconnell",0,1,97136,Phoenix,"zHera zKanan zZeb zEzra zSabine",1
"Bjconnell",1,0,71711,Jawas,"Nebit G8, Jawa Engineer, Jawa Scavenger G9, Jawa G9, Dathcha G9",1
"Bjconnell",1,0,15619,SionSolo (Counter),"Sion G9",1
"Bjconnell",1,0,80349,Troopers,"zVeers Piett G9, zzGideon Dark Trooper G9, Range Trooper G8",0
"Bjconnell",,,71637,Iden Troopers,"Iden Versio G8, Stormtrooper Snowtrooper G9, Magma G9, DT G8",0
"Bjconnell",,,68041,Bad Batch,"Hunter G9, Echo G9, Omega G8, Tech G8, Wrecker G8",0
"Bjconnell",1,0,84966,zMaul,"Darth Maul, zDooku DN Sidious Sith Marauder",0
"DDizell",,,125922,Phasma,"zPhasma zFOTP FOSFTP zFOST zKylo",1
"DDizell",1,1,163955,SL Kylo,"zzzzzzSL Kylo, zSith Trooper, zHux zzKRU zzThrawn",1
"DDizell",1,1,173793,GL Rey,"zzzzzzRey zzzJTR zzBB-8 zRH Poe, zRH Finn",1
"DDizell",0,1,126834,padme,"zzPadme zGK zJKA zAhsoka zzzCAT",1
"DDizell",0,1,133121,DRMalak,"zzzDR zzHK-47 zBSF zzMalak Sith Empire Trooper",1
"DDizell",,,413249,Negotiator,"Negotiator HT Anakin's Eta-2, Umbaran SF, Ahsoka's SF, BTL-B Y-wing, Clone Sergeant's ARC-170, Plo's SF",1
"DDizell",,,341980,HansMF,"Home One, Han's MF, Rebel Y-wing, Bistan's U-wing, Phantom Ghost Cassian's U-wing, Wedge X-wing",1
"DDizell",0,1,91640,Geonosians,"zzGBA Sun Fac, Geo Soldier, Geo Spy, Poggle",1
"DDizell",1,0,125145,CLS,"zzzCLS zHan zzChewbacca zzR2-D2 zzC-3PO",1
"DDizell",,,428192,Executrix,"Executrix Tie Adv, Emperor's Shuttle, TIE Reaper, Imperial TIE Fighter, Gauntlet Starfighter, FOSF TIE Fighter, FO TIE Fighter",1
"DDizell",1,1,136265,Revan Offense,"zzzJKR zzGMY zBS zJolee zEzra",1
"DDizell",1,1,88899,Ewoks,"zChirpa Elder zPaploo zWicket zLogray",1
"DDizell",0,1,103981,BH,"zzBossk zDengar zIG-88 zBoba Cad",1
"DDizell",1,1,95731,Carth,"zCarth Onasi, zMission zZaalbar zJuhani zCanderous",1
"DDizell",1,1,122170,zEP,"zzEP zzzVader zzTarkin TFP G9, zzTraya",1
"DDizell",,,208072,Malevolence,"Malevolence 6* Hyena Bomber 4*, Vulture Droid 3*, Sun Fac SF, Soldier SF, Spy SF",0
"DDizell",1,1,59880,NS,"MT G5, AV G8, Daka G7, Zombie Spirit G7",0
"DDizell",1,0,93951,Troopers,"zVeers zStarck Magma G8, zzPiett Shoretrooper G8",0
"DDizell",1,0,77350,Clones,"Cody G8, Rex Echo (501st) G8, Fives Clone Sergeant",0
"DDizell",0,1,76509,Phoenix,"zHera Chopper zKanan zZeb G9, Sabine G5",0
"DDizell",1,0,32551,Jawas,"Nebit G5, Jawa Engineer G5, Jawa Scavenger G5, Jawa G5, Dathcha G5",0
"Ragnarock",1,1,125052,NS,"zzMT zzAV zDaka Zombie Spirit",1
"Ragnarock",0,1,154020,DRMalak,"zzzDR zzHK-47 zBSF zzMalak Sith Empire Trooper",1
"Ragnarock",0,1,136311,padme,"zzPadme zGK zJKA zAhsoka zzC-3PO",1
"Ragnarock",,,387897,HansMF,"Home One, Han's MF, Rebel Y-wing, Bistan's U-wing, Phantom Ghost Cassian's U-wing, Wedge X-wing",1
"Ragnarock",,,479722,Negotiator,"Negotiator HT Anakin's Eta-2, Umbaran SF, Ahsoka's SF, Clone Sergeant's ARC-170, Plo's SF, Rex's ARC-170",1
"Ragnarock",0,1,99328,Geonosians,"zzGBA Sun Fac, Geo Soldier, Geo Spy, Poggle",1
"Ragnarock",1,0,118000,Traya,"zzTraya zzDN zSion zzEP zzThrawn",1
"Ragnarock",0,1,115629,Grievous,"zzGG zB2 zB1 zDroideka zMagnaGuard",1
"Ragnarock",1,1,111044,JTR,"zzzJTR zScav Rey, zzBB-8 zzR2-D2 zFinn",1
"Ragnarock",1,1,152663,Revan Offense,"zzzJKR zzGMY zBS zJolee zzHYoda",1
"Ragnarock",1,1,97309,Ewoks,"zChirpa Elder zPaploo zWicket zLogray",1
"Ragnarock",1,0,115320,ShaakClones,"zzShaak Ti, zRex zEcho (501st), zzFives Clone Sergeant",1
"Ragnarock",0,1,117283,BH,"zzBossk zDengar zBoba zzEmbo zzJango",1
"Ragnarock",1,1,99472,Carth,"zCarth Onasi, zMission zZaalbar zJuhani zCanderous",1
"Ragnarock",0,1,96523,FO,"zzKRU zKylo FOO FOE zFOST",1
"Ragnarock",1,0,111498,CLS,"zzzCLS zHan Leia Old Ben, zzChewbacca",1
"Ragnarock",0,1,80897,Phoenix,"zHera Kanan G9, Zeb G8, zEzra Sabine",1
"Ragnarock",1,0,73603,Jawas,"Nebit G9, Jawa Engineer, Jawa Scavenger G9, Jawa Dathcha",1
"Ragnarock",1,0,61154,Troopers,"zVeers Piett 6* G8, Gideon 4* G7, Dark Trooper 5* G9, Range Trooper 6* G7",0
"Ragnarock",,,360078,Executrix,"Executrix Tie Adv, Emperor's Shuttle, TIE Reaper 4*, Imperial TIE Fighter, Gauntlet Starfighter, FOSF TIE Fighter, FO TIE Fighter",0
"Ragnarock",,,80163,Mon Mothma,"Mon Mothma 5* G7, Lando Cassian G9, K-2SO G9, zCara Dune",0
"Ragnarock",1,0,80055,zMaul,"Darth Maul, zSidious zDooku Sith Marauder 5* G9, Nest G7",0
"Ragnarock",,,57366,Iden Troopers,"Iden Versio 3* G8, Stormtrooper G8, Snowtrooper G8, Magma G7, DT G7",0
"Ragnarock",1,0,66864,Wiggs,"Wedge G8, Biggs G8, Fulcrum G8, Chirrut G8, Baze G7",0
"JTMoney II",,,373225,Negotiator,"Negotiator HT Anakin's Eta-2, Umbaran SF, Ahsoka's SF, BTL-B Y-wing, Clone Sergeant's ARC-170, Plo's SF",1
"JTMoney II",0,1,121543,DR,"zzzDR zzHK-47 zBSF Sith Assassin, zzThrawn",1
"JTMoney II",,,427452,HansMF,"Home One, Han's MF, Rebel Y-wing, Bistan's U-wing, Phantom Ghost Cassian's U-wing, Wedge X-wing",1
"JTMoney II",1,1,111760,JTR,"zzzJTR zScav Rey, zzBB-8 zzR2-D2 Finn",1
"JTMoney II",,,407460,Executrix,"Executrix Tie Adv, Emperor's Shuttle, TIE Reaper, Imperial TIE Fighter, Gauntlet Starfighter, FOSF TIE Fighter, FO TIE Fighter",1
"JTMoney II",1,1,125546,Revan,"zzzJKR zBS zzGMY zJolee zGK",1
"JTMoney II",1,1,101509,Ewoks,"zChirpa Elder zPaploo zWicket zLogray",1
"JTMoney II",1,1,105976,Carth,"zCarth Onasi, zMission zZaalbar zJuhani zCanderous",1
"JTMoney II",0,1,116760,BH,"zzBossk zIG-88 zBoba zGreedo zzJango",1
"JTMoney II",1,1,114301,zEP,"zzEP zzzVader Tarkin TFP G9, zzDN",1
"JTMoney II",0,1,100591,FO,"zzKRU zKylo zHux FOE zFOST",1
"JTMoney II",1,0,114993,Wiggs,"Wedge Biggs zzzCLS zzChewbacca zzC-3PO",1
"JTMoney II",0,1,103020,Phoenix,"zHera zKanan zZeb zEzra zSabine",1
"JTMoney II",1,1,83660,Rogue1,"Jyn Chirrut Baze Cassian G9, K-2SO G8",1
"JTMoney II",,,101436,Bad Batch,"zHunter zEcho zzOmega zTech zWrecker",1
"JTMoney II",1,0,20842,SionSolo (Counter),"zSion",1
"JTMoney II",,,242080,Malevolence,"Malevolence Hyena Bomber 4*, Vulture Droid, Sun Fac SF, Soldier SF, Spy SF",0
"JTMoney II",0,1,73129,Geonosians,"GBA G7, Sun Fac G7, Geo Soldier, Geo Spy G9, Poggle G8",0
"JTMoney II",0,1,66569,Grievous,"GG B2 G4, B1 G5, MagnaGuard G5, Nute G5",0
"JTMoney II",1,0,71902,Troopers,"zVeers Piett G5, Gideon G5, Dark Trooper G9, Range Trooper G8",0
"JTMoney II",,,77939,Mon Mothma,"Mon Mothma G9, Lando G9, Cara Dune G9, Scarif Bistan",0
"JTMoney II",1,1,68080,NS,"MT G8, AV Daka G8, Zombie G5, Spirit G3",0
"JTMoney II",1,0,70653,ShaakClones,"Shaak Ti G5, Rex Echo (501st) G5, Fives G7, Clone Sergeant",0
"JTMoney II",,,73409,Iden Troopers,"Iden Versio G8, Shoretrooper Snowtrooper G5, Magma G8, DT",0
"JTMoney II",1,0,72849,zMaul,"zDarth Maul, Sidious G5, Dooku G7, Sith Marauder G9, Nest G5",0
"JTMoney II",1,0,70847,QGJ,"QGJ G4, Aayla G3, JKA Old Ben G9, Ahsoka G8",0
"JTMoney II",1,0,66566,Jawas,"Nebit G7, Jawa Engineer G7, Jawa Scavenger G7, Jawa G7, Dathcha G8",0
"Staatz",,,128304,Phasma,"zPhasma zFOTP FOSFTP zFOST zKylo",1
"Staatz",0,1,106690,Qira,"zQira zL3-37 zVandor Chewbacca, zMission Zaalbar",1
"Staatz",1,1,168937,GL Rey,"zzzzzzRey zzzJTR zzBB-8 zRH Poe, zRH Finn",1
"Staatz",1,1,109778,NS,"zzMT zzAV zDaka Zombie Spirit",1
"Staatz",,,177186,JMLS,"zzzJKR zzJKL zzzzzzJMLS zzHYoda zzzzGAS",1
"Staatz",1,0,163099,CLS,"zzzCLS zHan zzChewbacca zzC-3PO zChewpio",1
"Staatz",0,1,145408,padme,"zzPadme zGK zJKA zAhsoka zBarriss",1
"Staatz",,,510475,Negotiator,"Negotiator HT Anakin's Eta-2, Umbaran SF, Ahsoka's SF, BTL-B Y-wing 6*, Clone Sergeant's ARC-170, Plo's SF",1
"Staatz",,,501704,HansMF,"Home One, Han's MF, Rebel Y-wing, Bistan's U-wing, Phantom Biggs X-wing, Cassian's U-wing, Wedge X-wing",1
"Staatz",0,1,104775,Geonosians,"zzGBA Sun Fac, Geo Soldier, Geo Spy, Poggle",1
"Staatz",0,1,133597,Grievous,"zzGG zB2 zB1 zMagnaGuard zNute",1
"Staatz",,,117534,Mon Mothma,"zzMon Mothma, Biggs zCara Dune, Scarif Pao",1
"Staatz",1,0,112414,Troopers,"zVeers zzPiett zzGideon zDark Trooper, Range Trooper",1
"Staatz",,,507945,Executrix,"Executrix Tie Adv, Emperor's Shuttle, TIE Reaper, Imperial TIE Fighter, Gauntlet Starfighter, FOSF TIE Fighter, FO TIE Fighter",1
"Staatz",1,0,135583,ShaakClones,"zzShaak Ti, zRex zEcho (501st), zzFives zARC Trooper",1
"Staatz",0,1,121648,BH,"zzBossk zDengar zBoba zzAurra zzJango",1
"Staatz",1,1,129662,zEP,"zzEP zzzVader zzTarkin zIPD zMara Jade, The Emperor's Hand 5*",1
"Staatz",0,1,87523,Phoenix,"Hera G8, Kanan G8, Zeb G8, zEzra zSabine",1
"Staatz",1,0,107904,Thragma (Counter),"zzThrawn Magma zDT Krennic Shoretrooper",1
"Staatz",1,1,106185,Rogue1,"zzJyn Chirrut Baze zCassian zK-2SO",1
"Staatz",1,0,127943,zMaul,"zDarth Maul, zDooku zSidious zSavage Sith Marauder",1
"Staatz",1,0,118476,Jawas,"Nebit Jawa Engineer, Jawa Scavenger, Jawa Dathcha",1
"Staatz",1,0,16368,NestSolo (Counter),"zNest G8",1
"Staatz",0,1,89341,DR,"DR zzHK-47 zBSF Sith Empire Trooper G8, Sith Assassin G8",0
"Staatz",1,1,86579,Ewoks,"zChirpa Elder Paploo G7, zWicket zLogray G9",0
"Staatz",,,78419,Bad Batch,"zHunter 6* G9, zEcho G9, zOmega 6* G9, zTech 6* zWrecker 6* G8",0
"Staatz",1,0,13506,SionSolo (Counter),"Sion 6* G9",0
"Palo Rex",0,1,151528,padme,"zzPadme zGK zJKA zAhsoka zzzCAT",1
"Palo Rex",1,0,160090,CLS,"zzzCLS zHan zzChewbacca zzC-3PO zChewpio",1
"Palo Rex",1,1,110651,NestSisters,"zzAV zzMT zDaka Zombie zNest",1
"Palo Rex",0,1,95714,DR,"zzzDR HK-47 zBSF Sith Empire Trooper, Sith Assassin G8",1
"Palo Rex",,,505638,Negotiator,"Negotiator HT Anakin's Eta-2, Umbaran SF, Ahsoka's SF, Clone Sergeant's ARC-170, Plo's SF, Rex's ARC-170",1
"Palo Rex",0,1,108157,Geonosians,"zzGBA Sun Fac, Geo Soldier, Geo Spy, Poggle",1
"Palo Rex",0,1,110168,Grievous,"zzGG zB2 zB1 zMagnaGuard zNute",1
"Palo Rex",1,0,122951,Traya,"zzTraya zDN zSion zzEP zzThrawn",1
"Palo Rex",1,1,122534,JTR,"zzzJTR zScav Rey, zzBB-8 zzR2-D2 RT",1
"Palo Rex",,,95415,Mon Mothma,"zzMon Mothma, Chirrut Hoth Rebel Scout, Cara Dune, zPao",1
"Palo Rex",1,1,123768,GAS,"zzzzGAS zRex zEcho (501st), zzFives zARC Trooper",1
"Palo Rex",1,1,142176,Revan Offense,"zzzJKR zzGMY zBS zJolee zzHYoda",1
"Palo Rex",1,1,89551,Ewoks,"zChirpa Elder Paploo Wicket zLogray",1
"Palo Rex",0,1,128680,BH,"zzBossk Dengar zZam zBoba zzJango",1
"Palo Rex",1,1,93074,Carth,"zCarth Onasi, zMission zZaalbar Juhani Canderous",1
"Palo Rex",,,101163,Iden Troopers,"zIden Versio, Shoretrooper Snowtrooper Magma DT",1
"Palo Rex",0,1,94861,FO,"zzKRU zKylo FOO FOE Phasma",1
"Palo Rex",0,1,88910,Phoenix,"zHera zKanan Zeb zEzra Sabine",1
"Palo Rex",,,97863,Bad Batch,"zHunter zEcho zzOmega zTech zWrecker",1
"Palo Rex",,,413713,HansMF,"Home One, Han's MF, Rebel Y-wing 5*, Bistan's U-wing 6*, Phantom Ghost Cassian's U-wing, Wedge X-wing",0
"Palo Rex",1,0,79047,Troopers,"Veers Piett 5* G8, zGideon Dark Trooper 6*, Range Trooper",0
"AndrewtheHutt",,,180352,JMK,"zzzzzzJMK zAhsoka zzzCAT zzzzGAS zGK",1
"AndrewtheHutt",0,1,158877,DRMalak,"zzzDR zzHK-47 zBSF zzMalak Sith Empire Trooper",1
"AndrewtheHutt",1,0,132484,CLS,"zzzCLS zHan zzChewbacca zzC-3PO zChewpio",1
"AndrewtheHutt",1,1,108418,NestSisters,"zzAV zzMT zDaka Zombie zNest",1
"AndrewtheHutt",,,544183,Negotiator,"Negotiator HT Anakin's Eta-2, Umbaran SF, Ahsoka's SF, BTL-B Y-wing, Clone Sergeant's ARC-170, Plo's SF",1
"AndrewtheHutt",,,397707,HansMF,"Home One, Han's MF, Rebel Y-wing, Ghost Phantom Biggs X-wing, Cassian's U-wing, Wedge X-wing",1
"AndrewtheHutt",0,1,104507,Geonosians,"zzGBA Sun Fac, Geo Soldier, Geo Spy, Poggle",1
"AndrewtheHutt",0,1,140671,Grievous,"zzGG zB2 zB1 zMagnaGuard zNute",1
"AndrewtheHutt",1,0,122359,Traya,"zzTraya zzDN zSion zDooku zzThrawn",1
"AndrewtheHutt",,,91297,Mon Mothma,"zzMon Mothma, Lando Biggs Wedge Chirrut",1
"AndrewtheHutt",1,1,161476,Revan Offense,"zzzJKR zzGMY zBS zJolee zEzra",1
"AndrewtheHutt",1,0,139568,ShaakClones,"zzShaak Ti, zRex zEcho (501st), zzFives zARC Trooper",1
"AndrewtheHutt",1,1,88343,Ewoks,"zChirpa Elder zPaploo Teebo G9, zWicket",1
"AndrewtheHutt",1,1,99086,Carth,"zCarth Onasi, zMission zZaalbar zJuhani zCanderous",1
"AndrewtheHutt",0,1,141258,BH,"zzBossk zBoba zThe Mandalorian, Cad zzJango",1
"AndrewtheHutt",,,66307,Phasma,"Phasma G8, FOE 5* G8, FOO G9, zzKRU Kylo G8",0
"AndrewtheHutt",,,314280,Malevolence,"Malevolence Hyena Bomber 5*, Vulture Droid, Sun Fac SF, Soldier SF, Spy SF",0
"AndrewtheHutt",1,1,117916,zEP,"zzEP zzzVader zTarkin zDT 6* TFP",0
"AndrewtheHutt",0,1,64798,Phoenix,"Hera Chopper Kanan G8, Zeb G8, Sabine 6* G8",0
"AndrewtheHutt",1,0,45384,Jawas,"Nebit G7, Jawa Engineer 4* G7, Jawa Scavenger G7, Jawa 3* G7, Dathcha G7",0
"Cweneldic",,,168174,SEE,"zzzzzzSEE zBSF zzMalak zzzDR zzzVader",1
"Cweneldic",0,1,139485,padme,"zzPadme zGK zJKA zAhsoka zzC-3PO",1
"Cweneldic",,,434838,Negotiator,"Negotiator 5* BTL-B Y-wing, Anakin's Eta-2, Rex's ARC-170, Umbaran SF, Ahsoka's SF, Plo's SF, Clone Sergeant's ARC-170",1
"Cweneldic",,,306884,Malevolence,"Malevolence 6* Hyena Bomber, Vulture Droid, Sun Fac SF, Soldier SF, Spy SF",1
"Cweneldic",1,1,109088,NS_Alt,"zzMT zzAV Zombie Talia zDaka",1
"Cweneldic",,,327834,HansMF,"Home One, Han's MF, Rebel Y-wing, Ghost Phantom Biggs X-wing, Cassian's U-wing, Wedge X-wing",1
"Cweneldic",0,1,102115,Geonosians,"zzGBA Sun Fac, Geo Soldier, Geo Spy, Poggle",1
"Cweneldic",1,0,127849,Traya,"zzTraya zzDN zSion Sith Empire Trooper, zThrawn",1
"Cweneldic",0,1,117639,Grievous,"zzGG zB2 zB1 zDroideka MagnaGuard",1
"Cweneldic",1,1,148193,GAS,"zzzzGAS zRex zEcho (501st), zzFives zARC Trooper",1
"Cweneldic",1,1,107037,Revan Offense,"zzzJKR zGMY zBS zJolee zHYoda",1
"Cweneldic",1,1,84234,Ewoks,"zChirpa Elder Paploo Wicket Logray",1
"Cweneldic",0,1,97895,BH,"zBossk Dengar Boba Embo zJango",1
"Cweneldic",1,1,93452,Carth,"zCarth Onasi, zMission zZaalbar Juhani Canderous",1
"Cweneldic",1,0,107315,Troopers,"zVeers zStarck zzPiett Range Trooper, Snowtrooper",1
"Cweneldic",0,1,76529,Phoenix,"Hera Chopper Kanan Zeb G9, Ezra",1
"Cweneldic",1,1,51603,Rogue1,"Jyn G8, Chirrut G8, Baze G8, Cassian G8, K-2SO G8",1
"Cweneldic",,,113359,Bad Batch,"zHunter zEcho zzOmega zTech zWrecker",1
"Cweneldic",1,0,106863,EP (Counter, Rebel),"zzEP Krennic zzWampa Nest G9, Stormtrooper G8",1
"Cweneldic",,,47909,Phasma,"Phasma G8, FOTP G8, FOSFTP G6, FOST 5* G8, Kylo G8",0
"Cweneldic",1,0,93611,CLS,"zzzCLS zHan zzChewbacca R2-D2 G9, zChewpio 3* G8",0
"Cweneldic",,,59503,Mon Mothma,"Mon Mothma 4* G8, Lando G9, Biggs G8, Wedge G8, Cara Dune",0
"Cweneldic",1,0,47176,Jawas,"Nebit G8, Jawa Engineer G1, Jawa Scavenger G7, Jawa 5* G7, Dathcha G8",0
"Hevy",0,1,118923,DRMalak,"zzzDR HK-47 zBSF zzMalak Sith Empire Trooper",1
"Hevy",1,0,125891,CLS,"zzzCLS zHan zChewbacca zC-3PO zChewpio",1
"Hevy",,,469751,Negotiator,"Negotiator HT Anakin's Eta-2, Umbaran SF, Ahsoka's SF, BTL-B Y-wing, Clone Sergeant's ARC-170, Plo's SF",1
"Hevy",,,316528,Malevolence,"Malevolence Hyena Bomber, Vulture Droid, Sun Fac SF, Soldier SF, Spy SF",1
"Hevy",,,352216,HansMF,"Home One, Han's MF, Rebel Y-wing, Bistan's U-wing, Phantom Ghost Cassian's U-wing, Biggs X-wing",1
"Hevy",0,1,96445,Geonosians,"zGBA Sun Fac, Geo Soldier, Geo Spy, Poggle",1
"Hevy",0,1,119946,Grievous,"zzGG zB2 zB1 zDroideka MagnaGuard",1
"Hevy",1,1,138237,GAS,"zzzGAS Rex zEcho (501st), zzFives ARC Trooper",1
"Hevy",1,1,129688,Revan,"zzzJKR BS zGMY zJolee zGK",1
"Hevy",1,1,76588,Ewoks,"zChirpa G8, Elder zPaploo G9, zWicket G9, Logray G8",1
"Hevy",0,1,107670,BH,"zzBossk Boba G9, zGreef G8, zThe Mandalorian, zJango",1
"Hevy",1,0,107073,Troopers,"zVeers zStarck zPiett Dark Trooper, Range Trooper",1
"Hevy",0,1,69454,Phoenix,"Hera Chopper G8, Kanan G8, Zeb G8, Sabine G8",1
"Hevy",,,108864,Mando,"zzThe Mandalorian (Beskar Armor), Dash Rendar, Nest IG-11 zKuiil",1
"Hevy",,,32609,Phasma,"Phasma 5* G8, FOE 5* G8, FOO 5* G8, KRU 5* G8, Kylo 5* G8",0
"Hevy",1,1,52913,NS,"MT G8, AV Daka 6* G8, Zombie G5, Spirit G8",0
"Hevy",,,68691,Mon Mothma,"Mon Mothma 5* G8, Cassian G9, Kyle Katarn G9, Jyn G8, Bistan",0
"Hevy",1,1,87587,zEP,"zzEP zzVader Tarkin 5* G8, TFP G8, zMara Jade, The Emperor's Hand 6*",0
"Hevy",1,0,51628,Wiggs,"Wedge G8, Biggs G8, Leia G8, Chirrut 5* G8, Baze 6* G8",0
"Hevy",1,0,102900,QGJ,"zQGJ Aayla zJKA Old Ben G8, zAhsoka",0
"ozman",0,1,128235,padme,"zzPadme zGK zJKA zAhsoka zzC-3PO",1
"ozman",0,1,144622,DRMalak,"zzzDR zzHK-47 zBSF zzMalak zzThrawn",1
"ozman",,,436230,Negotiator,"Negotiator 6* HT Anakin's Eta-2, Umbaran SF, Ahsoka's SF, Clone Sergeant's ARC-170, Jedi Consular's Starfighter, Plo's SF",1
"ozman",0,1,85809,Geonosians,"zzGBA Sun Fac G9, Geo Soldier, Geo Spy G9, Poggle",1
"ozman",1,1,107991,JTR,"zzzJTR zScav Rey, zzBB-8 zzR2-D2 G9, Finn G8",1
"ozman",1,0,128936,Traya,"zzTraya zzDN zSion zDooku zzEP",1
"ozman",,,379580,Raddus,"Raddus Sun Fac SF, Rey's Millennium Falcon, Poe Dameron's X-wing, Resistance X-wing, Biggs X-wing, Wedge X-wing, Phantom Ghost",1
"ozman",1,1,140361,Revan Offense,"zzzJKR zzGMY zBS zJolee zzHYoda G9",1
"ozman",1,1,91509,Ewoks,"zChirpa G9, Elder zPaploo G9, zWicket zLogray",1
"ozman",0,1,133566,BH,"zzBossk zDengar zBoba zzAurra zzJango",1
"ozman",1,1,102113,Carth,"zCarth Onasi, zMission zZaalbar zJuhani zCanderous",1
"ozman",0,1,73929,Phoenix,"zHera G8, Kanan G8, Zeb G8, Ezra G8, zSabine G8",1
"ozman",0,1,92357,FO,"zzKRU zKylo FOE Phasma G8, zSith Trooper G9",1
"ozman",1,1,78305,Rogue1,"Jyn G8, Chirrut Baze Cassian G8, K-2SO G8",1
"ozman",1,1,101975,NS,"zzMT zzAV zDaka Zombie Spirit G5",0
"ozman",0,1,92566,Grievous,"zzGG B2 G7, Droideka G9, zIG-88 zzT3-M4",0
"ozman",,,368784,Executrix,"Executrix Tie Adv, Emperor's Shuttle, TIE Reaper 4*, Imperial TIE Fighter, Gauntlet Starfighter, FOSF TIE Fighter 6*, FO TIE Fighter",0
"ozman",1,0,49455,Troopers,"Veers G9, Piett 3* G4, Gideon G8, Dark Trooper 4* G7, Range Trooper 5* G6",0
"ozman",,,68335,Mon Mothma,"Mon Mothma 4* G7, Lando Biggs Wedge G8, Bistan G8",0
"ozman",1,0,81981,ShaakClones,"zzShaak Ti, Rex G7, Echo (501st) G7, zzFives Clone Sergeant G9",0
"ozman",1,0,81311,zMaul,"zDarth Maul, zSidious Sith Empire Trooper G7, Sith Marauder, Nest G7",0
"ozman",,,57483,Iden Troopers,"Iden Versio 3* G4, Shoretrooper G5, Snowtrooper G8, Magma G8, zDT G7",0
"ozman",1,0,108492,CLS,"zzzCLS zHan G9, zLeia G9, zzOld Ben, zzChewbacca 6* G9",0
"ozman",,,69690,Bad Batch,"zHunter G8, zEcho G8, Omega G9, Tech 5* G5, zWrecker G7",0
"ozman",1,0,57021,Jawas,"Nebit G8, Jawa Engineer G7, Jawa Scavenger G7, Jawa 6* G7, Dathcha G7",0
"Darthalemew",0,1,114716,padme,"zzPadme zGK zJKA zAhsoka zzC-3PO",1
"Darthalemew",0,1,98614,DR,"zzzDR HK-47 zBSF Sith Assassin G8, zzThrawn",1
"Darthalemew",,,393397,HansMF,"Home One, Han's MF 6*, Biggs X-wing, Bistan's U-wing, Phantom Ghost Cassian's U-wing, Wedge X-wing",1
"Darthalemew",,,389062,Negotiator,"Negotiator 5* HT Anakin's Eta-2, Umbaran SF, Ahsoka's SF, Clone Sergeant's ARC-170, Plo's SF, Rex's ARC-170",1
"Darthalemew",0,1,90048,Geonosians,"zzGBA Sun Fac, Geo Soldier, Geo Spy, Poggle",1
"Darthalemew",0,1,88508,Grievous,"zzGG zB2 zB1 Droideka MagnaGuard G9",1
"Darthalemew",1,1,108827,JTR,"zzzJTR Scav Rey, zBB-8 zzR2-D2 zFinn",1
"Darthalemew",1,1,132448,Revan Offense,"zzzJKR zzGMY zBS zJolee zEzra",1
"Darthalemew",1,1,85337,Ewoks,"zChirpa Elder zPaploo Wicket Logray",1
"Darthalemew",0,1,103516,BH,"zBossk zDengar G9, zIG-88 zBoba zGreedo",1
"Darthalemew",1,1,85010,Carth,"zCarth Onasi, Mission Zaalbar G9, Juhani Canderous",1
"Darthalemew",1,1,110237,zEP,"zzEP zzzVader zTarkin TFP zSion",1
"Darthalemew",0,1,131666,FO,"zzKRU zKylo FOO FOE zFOST",1
"Darthalemew",1,0,109523,Wiggs,"Wedge Biggs zzzCLS zHan zzChewbacca",1
"Darthalemew",1,1,70571,Rogue1,"Jyn G8, Chirrut G8, Baze G8, Cassian G9, K-2SO G8",1
"Darthalemew",1,0,67972,Jawas,"Nebit G8, Jawa Engineer G9, Jawa Scavenger G8, Jawa G9, Dathcha G8",1
"Darthalemew",1,1,94853,NS,"zzMT zzAV zDaka Zombie Spirit G8",0
"Darthalemew",,,361786,Executrix,"Executrix Tie Adv, Emperor's Shuttle 4*, TIE Reaper 5*, Imperial TIE Fighter, Gauntlet Starfighter, FOSF TIE Fighter, FO TIE Fighter",0
"Darthalemew",,,73842,Nute-Wat,"zNute zDooku Wat Tambor 5* G8, Jango G8, Nest 5* G8",0
"Darthalemew",1,0,90534,ShaakClones,"zzShaak Ti, Rex Echo (501st) G9, zzFives Clone Sergeant",0
"Darthalemew",1,0,69934,Troopers,"zVeers Starck G8, Magma G9, Stormtrooper G8, Snowtrooper G8",0
"Darthalemew",0,1,80855,Phoenix,"zHera Chopper G9, zKanan zZeb G8, Sabine 6* G8",0
"EchoTK3117",,,163925,SEE,"zzzzzzSEE zBSF zzMalak zzzDR zzzVader",1
"EchoTK3117",1,1,111009,Revan,"zzzJKR zBS zGMY zJolee GK",1
"EchoTK3117",1,1,86007,Ewoks,"zChirpa Elder zPaploo Wicket Logray",1
"EchoTK3117",1,1,88053,Carth,"zCarth Onasi, zMission Zaalbar Juhani Canderous",1
"EchoTK3117",1,0,131288,Troopers,"zVeers zStarck zzPiett zDark Trooper, zGideon",1
"EchoTK3117",0,1,76683,FO,"zzKRU Kylo G9, FOO G8, FOE G9, Phasma G8",1
"EchoTK3117",0,1,68372,Phoenix,"Hera G8, Kanan G8, Zeb G8, Ezra G8, Sabine G8",1
"EchoTK3117",1,0,131481,zMaul,"zDarth Maul, zDooku zzDN zSidious Sith Marauder",1
"EchoTK3117",1,0,103109,EP (Counter, Rebel),"zzEP Shoretrooper G9, Krennic DT Stormtrooper",1
"EchoTK3117",1,1,83554,JTR,"JTR Scav Rey G9, BB-8 G9, zzR2-D2 Finn G9",0
"EchoTK3117",,,363001,Executrix,"Executrix Tie Adv, Emperor's Shuttle, TIE Reaper 5*, Imperial TIE Fighter, Gauntlet Starfighter, FOSF TIE Fighter 3*, FO TIE Fighter",0
"EchoTK3117",1,0,101472,CLS,"zCLS zHan zChewbacca G9, zThrawn C-3PO G7",0
"EchoTK3117",0,1,84778,BH,"Bossk G8, Dengar G9, zBoba Greedo G9, The Mandalorian",0
"EchoTK3117",1,0,71566,501st,"Rex Clone Sergeant G8, Echo (501st) G7, Fives Ahsoka G8",0
"EchoTK3117",1,0,11737,SionSolo (Counter),"Sion 5* G9",0
"Jbird",0,1,107545,DRMalak,"zzzDR HK-47 zBSF zzMalak Sith Empire Trooper G8",1
"Jbird",,,334265,Negotiator,"Negotiator HT Anakin's Eta-2, Umbaran SF, Ahsoka's SF, Clone Sergeant's ARC-170, Jedi Consular's Starfighter, Plo's SF",1
"Jbird",,,98319,Nute-OR,"zNute zDooku Jango zZaalbar zMission",1
"Jbird",1,1,125518,Revan,"zzzJKR zBS zzGMY zJolee zGK",1
"Jbird",1,1,90048,Ewoks,"zChirpa Elder zPaploo zWicket zLogray",1
"Jbird",0,1,108076,BH,"zzBossk zDengar IG-88 zBoba zGreedo",1
"Jbird",1,1,112719,zEP,"zzEP zzzVader Tarkin TFP zzTraya",1
"Jbird",0,1,89936,Phoenix,"zHera Kanan Zeb Ezra Sabine",1
"Jbird",1,0,16932,SionSolo (Counter),"Sion",1
"Jbird",,,84820,Phasma,"Phasma FOE FOO KRU Kylo",0
"Jbird",,,296531,HansMF,"Home One, Han's MF 6*, Biggs X-wing, Bistan's U-wing, Phantom Ghost Cassian's U-wing, Wedge X-wing",0
"Jbird",0,1,86325,Geonosians,"zzGBA Sun Fac G8, Geo Soldier, Geo Spy, Poggle",0
"Jbird",1,1,71911,JTR,"JTR G7, Scav Rey, BB-8 G9, R2-D2 G9, Finn G9",0
"Jbird",0,1,86345,Grievous,"zGG zB2 MagnaGuard T3-M4 L3-37 G8",0
"Jbird",1,1,61242,NS,"MT G8, AV Daka G8, Zombie G4, Spirit G6",0
"Jbird",1,0,95345,CLS,"zzzCLS Han G9, Chewbacca Thrawn C-3PO",0
"Jbird",1,0,56636,ShaakClones,"Shaak Ti G9, Rex G6, Echo (501st) G6, Fives G9, Clone Sergeant G6",0
"Jbird",1,0,45264,Troopers,"Veers G8, Starck G8, Stormtrooper G7, Snowtrooper G6, Gideon G2",0
