Player,Offense,Defense,GP,Name,Squad,Viable
"Jbird",1,0,65563,QGJ,"QGJ G8, Aayla G5, JKA Old Ben, Ahsoka",0
"Jbird",1,0,35563,Jawas,"Nebit G4, Jawa Engineer G5, Jawa Scavenger G7, Jawa G4, Dathcha G4",0
"Newt Ribs",,,125133,Phasma,"zPhasma zFOTP FOSFTP zFOST zKylo",1
"Newt Ribs",1,1,143177,SL Kylo,"zzzzzSL Kylo, zSith Trooper, zHux zzKRU zThrawn G9",1
"Newt Ribs",1,0,138247,CLS,"zzzCLS zHan zzChewbacca zC-3PO Chewpio",1
"Newt Ribs",,,298404,Malevolence,"Malevolence 6* Hyena Bomber, Vulture Droid, Sun Fac SF, Soldier SF, Spy SF",1
"Newt Ribs",,,328481,HansMF,"Home One, Han's MF, Rebel Y-wing, Bistan's U-wing, Phantom Ghost Cassian's U-wing, Biggs X-wing",1
"Newt Ribs",,,496185,Negotiator,"Negotiator HT Anakin's Eta-2, Umbaran SF, Ahsoka's SF, Clone Sergeant's ARC-170, Plo's SF, Rex's ARC-170",1
"Newt Ribs",0,1,89852,Geonosians,"zGBA Sun Fac, Geo Soldier, Geo Spy, Poggle",1
"Newt Ribs",0,1,115766,Grievous,"zzGG zB2 zB1 zDroideka MagnaGuard",1
"Newt Ribs",,,106304,Disintegration,"Aurra G9, zGreef Boba zzBossk zThe Mandalorian",1
"Newt Ribs",,,74957,Nute-Wat,"zNute Dooku G8, zWat Tambor 6* G9, Jango Nest G9",1
"Newt Ribs",1,1,143875,GAS,"zzzzGAS zRex zEcho (501st), zzFives zARC Trooper",1
"Newt Ribs",1,1,107394,Revan,"zzJKR BS GMY zJolee zGK",1
"Newt Ribs",1,1,71492,Ewoks,"zChirpa G8, Elder Paploo G9, Wicket Logray G8",1
"Newt Ribs",1,1,114401,zEP,"zEP zzVader Tarkin TFP BSF",1
"Newt Ribs",0,1,68248,Phoenix,"Hera G9, Chopper G8, Kanan G8, Zeb G8, Ezra G9",1
"Newt Ribs",1,0,14616,SionSolo (Counter),"Sion G9",1
"Newt Ribs",1,0,77073,Troopers,"Veers zPiett Gideon G9, Dark Trooper G9, Range Trooper 6* G7",0
"Newt Ribs",1,1,63936,NS,"MT G8, AV Daka G9, Zombie G8, Spirit G8",0
"Newt Ribs",1,1,57311,Carth,"Carth Onasi G9, Mission G7, Zaalbar G7, Juhani G9, Canderous G8",0
"Newt Ribs",1,1,51314,Rogue1,"Jyn G8, Chirrut 5* G8, Baze 6* G8, Cassian G8, K-2SO G8",0
"Newt Ribs",,,40063,Bad Batch,"Hunter 4* G8, Echo 2* G8, Omega G8, Tech 4* G8, Wrecker G7",0
"FateleyMan",1,1,170407,GL Rey,"zzzzzzRey zzzJTR zzBB-8 zRH Poe, zRH Finn",1
"FateleyMan",0,1,134423,DRMalak,"zzzDR zzHK-47 zBSF zzMalak Sith Empire Trooper",1
"FateleyMan",0,1,139069,padme,"zzPadme zGK zJKA zAhsoka zzC-3PO",1
"FateleyMan",1,1,117955,NS_Alt,"zzMT zzAV Zombie Talia zDaka",1
"FateleyMan",0,1,93817,Geonosians,"zzGBA Sun Fac, Geo Soldier, Geo Spy, Poggle",1
"FateleyMan",1,0,128157,Traya,"zzTraya zzDN zSion zzEP zzThrawn",1
"FateleyMan",0,1,103925,Grievous,"zzGG zB2 zB1 zDroideka zMagnaGuard",1
"FateleyMan",1,1,136375,Revan Offense,"zzzJKR zzGMY zBS zJolee zzHYoda",1
"FateleyMan",1,1,95588,Ewoks,"zChirpa Elder zPaploo zWicket zLogray",1
"FateleyMan",1,0,109372,ShaakClones,"zzShaak Ti, zRex zEcho (501st), zzFives zARC Trooper",1
"FateleyMan",0,1,108220,BH,"zzBossk zBoba zzThe Mandalorian G9, Cad zzJango",1
"FateleyMan",1,0,118586,CLS,"zzzCLS zHan zLeia zzOld Ben, zzChewbacca",1
"FateleyMan",0,1,98310,FO,"zzKRU zKylo FOO FOE zPhasma",1
"FateleyMan",0,1,91889,Phoenix,"zHera zKanan G8, zZeb zEzra zSabine G8",1
"FateleyMan",0,1,60705,Qira,"Qira 4* G6, L3-37 5* G2, Vandor Chewbacca 3* G5, zMission zZaalbar",0
"FateleyMan",,,428850,Negotiator,"Negotiator 5* HT 5* Anakin's Eta-2, Umbaran SF, Ahsoka's SF, Clone Sergeant's ARC-170, Plo's SF, Rex's ARC-170",0
"FateleyMan",,,468656,Raddus,"Raddus 5* Sun Fac SF, Rey's Millennium Falcon 4*, Poe Dameron's X-wing 5*, Resistance X-wing, Biggs X-wing, Wedge X-wing, Phantom Ghost",0
"FateleyMan",1,0,68228,zMaul,"zDarth Maul, Sidious Dooku Sith Marauder G6, Nest 4* G7",0
"FateleyMan",1,1,86955,Rogue1,"zzJyn G8, Chirrut Baze zCassian G7, zK-2SO G9",0
"FateleyMan",1,0,66413,Jawas,"Nebit G8, Jawa Engineer G9, Jawa Scavenger G7, Jawa 5* G8, Dathcha G8",0
"J Conn 79",0,1,108157,padme,"zzPadme G8, zGK zJKA G8, zAhsoka zzC-3PO G8",1
"J Conn 79",1,1,124787,NS_Alt,"zzMT zzAV Zombie Talia zDaka",1
"J Conn 79",0,1,101676,Geonosians,"zzGBA Sun Fac, Geo Soldier, Geo Spy, Poggle",1
"J Conn 79",,,130445,Disintegration,"zzAurra zzGreef zBoba zzBossk zzThe Mandalorian",1
"J Conn 79",1,1,92850,Ewoks,"zChirpa Elder zPaploo Scout zWicket",1
"J Conn 79",1,1,90699,Carth,"zCarth Onasi, zMission G9, zZaalbar G8, zJuhani zCanderous",1
"J Conn 79",1,1,114140,zEP,"zzEP zzzVader zzTarkin zBSF DN G9",1
"J Conn 79",0,1,121873,Phoenix,"zHera zKanan zZeb zEzra zSabine",1
"J Conn 79",,,63170,Phasma,"Phasma G7, FOTP G7, FOSFTP G7, FOST 4* G6, zKylo",0
"J Conn 79",,,414099,Negotiator,"Negotiator HT 6* Anakin's Eta-2 4*, Umbaran SF, Ahsoka's SF, Clone Sergeant's ARC-170, Plo's SF, Rex's ARC-170",0
"J Conn 79",1,1,74009,JTR,"JTR G1, Scav Rey G9, BB-8 G9, zzR2-D2 Finn",0
"J Conn 79",0,1,84919,Grievous,"zGG G8, B2 G7, zDooku IG-88 G8, zzT3-M4 G9",0
"J Conn 79",,,64350,Mon Mothma,"Mon Mothma 5* G4, Lando G8, K-2SO G8, Hoth Rebel Soldier G8, zCara Dune",0
"J Conn 79",1,1,78896,Revan Offense,"zzzJKR G9, GMY G8, zBS G9, zJolee G7, HYoda G4",0
"J Conn 79",0,1,87442,BH,"zzJango Dengar G5, zEmbo 5* G9, Greedo G8, Cad G9",0
"J Conn 79",1,0,94986,Clones,"Cody G9, zRex zEcho (501st), zzFives zARC Trooper",0
"J Conn 79",1,0,91737,Wiggs,"Wedge 6* G8, Biggs G6, zzzCLS zHan zzChewbacca G9",0
"J Conn 79",1,0,53959,Troopers,"zVeers 6* G7, Starck G5, Magma G4, Stormtrooper G5, Snowtrooper G7",0
"J Conn 79",1,0,12627,SionSolo (Counter),"Sion 6* G8",0
"SpideyCoug",,,276155,Malevolence,"Malevolence 5* Hyena Bomber, Vulture Droid, Sun Fac SF, Soldier SF, Spy SF",1
"SpideyCoug",0,1,95757,Geonosians,"zGBA Sun Fac, Geo Soldier, Geo Spy, Poggle",1
"SpideyCoug",1,0,103886,Troopers,"zVeers zPiett Gideon Dark Trooper, Range Trooper",1
"SpideyCoug",1,1,79649,zEP,"zEP zzVader Tarkin G8, Dooku G8, TFP G8",1
"SpideyCoug",0,1,61529,Phoenix,"Hera G8, Chopper G8, Kanan G8, Zeb G8, Ezra G8",1
"SpideyCoug",1,0,18544,NestSolo (Counter),"zNest",1
"SpideyCoug",,,104479,Phasma,"Phasma FOE G9, FOO KRU Kylo",0
"SpideyCoug",,,305966,Negotiator,"Negotiator 5* HT 6* Anakin's Eta-2, Umbaran SF, Ahsoka's SF, Clone Sergeant's ARC-170 5*, Jedi Consular's Starfighter, Plo's SF",0
"SpideyCoug",,,62135,Mon Mothma,"zMon Mothma 5* G8, Cassian G8, Biggs Wedge G8, Hoth Rebel Scout G8",0
"SpideyCoug",1,1,44777,NS_Alt,"MT 6* G8, AV 6* G8, Talia 6* G8, Spirit 6* G8, Daka G8",0
"SpideyCoug",1,0,76301,ShaakClones,"Shaak Ti G8, Rex G9, Echo (501st) G8, zFives ARC Trooper G8",0
"SpideyCoug",0,1,76601,BH,"Bossk Boba G9, Greef G9, Cad Jango G8",0
"SpideyCoug",0,1,91015,BS,"BS 5* G8, GMY zJKA zGK 6* Ahsoka",0
"Rocky94",,,173287,LV,"zzzzzzLord Vader, zzPiett zzzMaul zRG zzzVader",1
"Rocky94",,,124758,Phasma,"zPhasma zFOTP FOSFTP zFOST zKylo",1
"Rocky94",1,1,162789,SL Kylo,"zzzzzzSL Kylo, zSith Trooper, zHux zzKRU zzThrawn",1
"Rocky94",,,597827,Executor,"Executor HT RC Xanadu Blood, Slave I, IG-2000 Imperial TIE Fighter, Tie Adv",1
"Rocky94",0,1,147283,padme,"zzPadme zGK zJKA zAhsoka zzzCAT",1
"Rocky94",0,1,136161,DRMalak,"zzzDR zzHK-47 zBSF zzMalak Sith Empire Trooper",1
"Rocky94",,,472393,Negotiator,"Negotiator BTL-B Y-wing, Anakin's Eta-2, Rex's ARC-170, Umbaran SF, Ahsoka's SF, Plo's SF, Clone Sergeant's ARC-170",1
"Rocky94",,,283301,Malevolence,"Malevolence 6* Hyena Bomber, Vulture Droid, Sun Fac SF, Soldier SF, Spy SF",1
"Rocky94",,,408150,HansMF,"Home One, Han's MF, Rebel Y-wing, Bistan's U-wing, Phantom Ghost Cassian's U-wing, Biggs X-wing",1
"Rocky94",0,1,99197,Geonosians,"zzGBA Sun Fac, Geo Soldier, Geo Spy, Poggle",1
"Rocky94",0,1,120516,Grievous,"zzGG zB2 zB1 zMagnaGuard zNute",1
"Rocky94",1,0,138591,Traya,"zzTraya zDN zSion zDooku zzEP",1
"Rocky94",1,0,110344,CLS,"zzzCLS zHan zzChewbacca R2-D2 zC-3PO",1
"Rocky94",1,1,154607,GAS,"zzzzGAS zRex zEcho (501st), zzFives zARC Trooper",1
"Rocky94",1,1,133839,Revan Offense,"zzzJKR zzGMY zBS zJolee zEzra",1
"Rocky94",1,1,74998,Ewoks,"zChirpa G9, Elder Paploo Wicket G9, Logray G9",1
"Rocky94",0,1,148386,BH,"zzBossk zDengar zZam zIG-88 zBoba",1
"Rocky94",0,1,81115,Phoenix,"zHera Chopper zKanan zZeb Sabine G8",1
"Rocky94",1,1,102279,Rogue1,"zJyn Chirrut G8, Baze G8, zCassian zK-2SO",1
"Rocky94",,,131182,Bad Batch,"zHunter zEcho zzOmega zTech zWrecker",1
"Rocky94",1,1,89223,NS,"zzMT G9, zzAV zDaka Zombie Spirit G8",0
"Rocky94",,,86652,Mon Mothma,"zzMon Mothma, Hoth Rebel Scout G8, Cara Dune G7, Bistan zPao G8",0
"Rocky94",1,1,86328,Carth,"zCarth Onasi, zMission zZaalbar Juhani Canderous G7",0
"Rocky94",1,0,66392,Troopers,"Veers Starck Range Trooper G9, Snowtrooper G8, DT G8",0
"Rocky94",0,1,92163,BH,"Jango G5, zEmbo Greef G8, The Mandalorian, Cad",0
"Rocky94",,,81684,Mando,"zzThe Mandalorian (Beskar Armor), Dash Rendar, Nest G2, IG-11 Kuiil G8",0
"Rocky94",1,0,51824,Jawas,"Nebit G7, Jawa Engineer G8, Jawa Scavenger G8, Jawa G8, Dathcha G8",0
"Galaxy",0,1,92696,Geonosians,"zzGBA Sun Fac, Geo Soldier, Geo Spy, Poggle",1
"Galaxy",0,1,92668,DR,"zzzDR zHK-47 zBSF Sith Marauder G8, Thrawn G9",1
"Galaxy",1,1,113685,Revan,"zzzJKR BS zGMY zJolee GK",1
"Galaxy",0,1,88368,BH,"zBossk Dengar G9, Boba The Mandalorian, Jango",1
"Galaxy",1,1,84168,Carth,"zCarth Onasi, Mission Zaalbar Juhani G8, Canderous",1
"Galaxy",1,1,108810,zEP,"zzEP zzVader Tarkin G9, TFP Sith Trooper",1
"Galaxy",0,1,104800,FO,"zzKRU Kylo FOO FOE FOST",1
"Galaxy",0,1,67130,Phoenix,"Hera G9, Kanan G8, Zeb Ezra G8, Sabine G8",1
"Galaxy",1,0,54969,Traya,"Traya 6* G7, DN G8, Sion 6* G7, Dooku Sith Empire Trooper G7",0
"Galaxy",1,1,46918,NS,"MT G8, AV G8, Daka G8, Zombie G7, Spirit G8",0
"Galaxy",1,0,71765,ShaakClones,"Shaak Ti G9, Rex Echo (501st) G9, Fives G8, ARC Trooper G7",0
"Galaxy",1,1,41673,Ewoks,"Chirpa 5* G7, Elder G8, Paploo 6* G7, Scout G6, Logray 5* G5",0
"Galaxy",1,0,54153,Wiggs,"Wedge 5* G8, Biggs G8, CLS G8, Han G7, Leia G9",0
"Galaxy",1,1,41176,Rogue1,"Jyn 6* G8, Chirrut 5* G8, Baze 5* G8, Cassian G8, K-2SO G8",0
"Glorfindel",,,165293,SEE,"zzzzzzSEE zBSF zzMalak zzzDR zzzVader",1
"Glorfindel",1,1,161597,GL Rey,"zzzzzzRey zzzJTR zzBB-8 zRH Poe, zRH Finn",1
"Glorfindel",,,173523,JMLS,"zzzJKR zzJKL zzzzzzJMLS zzHYoda zzzzGAS",1
"Glorfindel",1,0,145442,CLS,"zzzCLS zHan zzChewbacca zzC-3PO zChewpio",1
"Glorfindel",1,1,110023,NestSisters,"zzAV zzMT zDaka Zombie zNest",1
"Glorfindel",,,440194,HansMF,"Home One, Han's MF, Rebel Y-wing, Bistan's U-wing, Phantom Ghost Cassian's U-wing, Wedge X-wing",1
"Glorfindel",,,489030,Negotiator,"Negotiator HT Anakin's Eta-2, Umbaran SF, Ahsoka's SF, Clone Sergeant's ARC-170, Plo's SF, Rex's ARC-170",1
"Glorfindel",0,1,98104,Geonosians,"zzGBA Sun Fac, Geo Soldier, Geo Spy, Poggle",1
"Glorfindel",1,0,134501,Traya,"zzTraya zDN zSion Sith Empire Trooper, zzThrawn",1
"Glorfindel",0,1,117289,Grievous,"zzGG zB2 zB1 zMagnaGuard zNute",1
"Glorfindel",,,103610,Mon Mothma,"zzMon Mothma, Wedge Hoth Rebel Scout, Cara Dune, zPao",1
"Glorfindel",1,1,91103,Ewoks,"zChirpa Elder zPaploo zWicket Logray G8",1
"Glorfindel",1,0,125244,ShaakClones,"zzShaak Ti, zRex zEcho (501st), zzFives Clone Sergeant",1
"Glorfindel",0,1,121794,BH,"zzBossk zDengar zBoba zzGreef zzJango",1
"Glorfindel",1,1,93450,Carth,"zCarth Onasi, zMission zZaalbar Juhani zCanderous",1
"Glorfindel",0,1,96910,FO,"zzKRU zKylo FOO FOE zFOST",1
"Glorfindel",0,1,96456,Phoenix,"zHera zKanan zZeb zEzra zSabine G8",1
"Glorfindel",1,0,118320,zMaul,"zDarth Maul, zDooku zSidious Sith Assassin, zSavage",1
"Glorfindel",0,1,138721,BS,"zBS zzGMY zJolee zGK zJKA",1
"Glorfindel",1,0,121483,EP (Counter, Rebel),"zzEP zKrennic zzWampa Stormtrooper G9, zStarck",1
"Glorfindel",1,0,86635,Jawas,"Nebit Jawa Engineer, Jawa Scavenger, Jawa Dathcha",1
"Glorfindel",1,0,79381,Troopers,"zVeers zzPiett Gideon 4* G4, Dark Trooper 5* G3, Range Trooper G8",0
"Glorfindel",,,50386,Iden Troopers,"Iden Versio 3* G2, Shoretrooper 6* G5, Snowtrooper G8, Magma G8, DT 6* G5",0
"Glorfindel",1,1,71169,Rogue1,"zJyn G8, Chirrut 6* G8, Baze 6* G7, zK-2SO G9, Bistan G8",0
"Glorfindel",,,39964,Bad Batch,"Hunter 5* G4, Echo 4* G5, Omega 6* G5, Tech 4* G4, Wrecker 4* G5",0
"FruutSnak",0,1,140634,padme,"zzPadme zGK zJKA zAhsoka zzzCAT",1
"FruutSnak",1,0,137998,CLS,"zzCLS zHan zChewbacca zzC-3PO zChewpio",1
"FruutSnak",,,460651,Negotiator,"Negotiator BTL-B Y-wing, Anakin's Eta-2, Rex's ARC-170, Umbaran SF, Ahsoka's SF, Plo's SF, Clone Sergeant's ARC-170",1
"FruutSnak",0,1,126335,DR,"zzzDR zzHK-47 zBSF Sith Empire Trooper, Thrawn G9",1
"FruutSnak",0,1,98938,Geonosians,"zzGBA Sun Fac, Geo Soldier, Geo Spy, Poggle",1
"FruutSnak",0,1,124748,Grievous,"zzGG zB2 zB1 zDroideka MagnaGuard",1
"FruutSnak",1,1,130244,GAS,"zzzzGAS zRex zEcho (501st), zzFives ARC Trooper",1
"FruutSnak",1,1,109341,Revan Offense,"zzJKR zGMY BS zJolee Ezra G9",1
"FruutSnak",1,1,79663,Ewoks,"zChirpa G9, Elder Paploo G9, Wicket Logray",1
"FruutSnak",0,1,90580,BH,"zBossk Dengar G9, IG-88 Boba Jango",1
"FruutSnak",,,36884,Phasma,"Phasma G8, FOE 5* G8, FOO 6* G8, KRU 5* G8, Kylo 5* G8",0
"FruutSnak",,,348349,HansMF,"Home One, Han's MF 5*, HT 6* Ghost 6* Phantom 6* Biggs X-wing, Cassian's U-wing, Wedge X-wing",0
"FruutSnak",1,1,47422,NS_Alt,"MT 6* G8, AV Talia 6* G8, Spirit 5* G8, Daka 6* G8",0
"FruutSnak",1,1,63349,Carth,"Carth Onasi G9, Mission G8, Zaalbar G7, Juhani G9, Canderous G7",0
"FruutSnak",1,1,84826,zEP,"EP zzVader Tarkin TFP G8, Mara Jade, The Emperor's Hand 4*",0
"FruutSnak",1,0,48534,Troopers,"Veers 6* G9, Starck G1, Stormtrooper G8, Snowtrooper G8, Gideon G8",0
"FruutSnak",0,1,58804,Phoenix,"Hera G8, Chopper G9, Kanan G8, Zeb G8, Sabine 5* G8",0
"FruutSnak",1,1,59308,Rogue1,"Jyn 5* G8, Chirrut G8, Baze 6* G8, Cassian G9, K-2SO G8",0
"Xanlythe",,,350907,HansMF,"Home One, Han's MF 6*, Biggs X-wing, Bistan's U-wing, Phantom Ghost Cassian's U-wing, Wedge X-wing",1
"Xanlythe",0,1,105920,Geonosians,"zzGBA Sun Fac, Geo Soldier, Geo Spy, Poggle",1
"Xanlythe",1,1,94209,Carth,"zCarth Onasi, zMission G9, zZaalbar G9, zJuhani zCanderous",1
"Xanlythe",1,1,116061,zEP,"zEP zzzVader zTarkin TFP zBSF",1
"Xanlythe",0,1,102220,Phoenix,"zHera Kanan Zeb Ezra Sabine",1
"Xanlythe",0,1,96621,BS,"zBS GMY Jolee zGK Ahsoka",1
"Xanlythe",,,59094,Phasma,"Phasma FOTP G6, FOSFTP G9, FOST 5* G8, Kylo G9",0
"Xanlythe",,,265702,Negotiator,"Negotiator 6* HT 6* Anakin's Eta-2 2*, Umbaran SF, Ahsoka's SF, BTL-B Y-wing 2*, Clone Sergeant's ARC-170, Plo's SF",0
"Xanlythe",1,1,72929,JTR,"JTR G6, Scav Rey, BB-8 R2-D2 Finn",0
"Xanlythe",1,1,66836,NS,"MT 6* G8, zzAV Daka G9, Zombie 6* G8, Spirit G8",0
"Xanlythe",0,1,83706,Grievous,"zzGG B2 G7, MagnaGuard zDooku IG-88",0
"Xanlythe",,,75772,Mon Mothma,"Mon Mothma 5* G9, Wedge Cara Dune, zJyn Bistan",0
"Xanlythe",1,1,66132,Ewoks,"Chirpa Elder G9, Paploo G9, Teebo G8, Wicket G8",0
"Xanlythe",1,0,57313,ShaakClones,"Shaak Ti 4* G8, Rex G8, Echo (501st) G8, Fives G8, Clone Sergeant",0
"Xanlythe",0,1,86742,BH,"Bossk 4* Boba Greef Cad Jango",0
"Xanlythe",1,0,67823,Troopers,"Veers Starck G6, Piett 5* Snowtrooper G9, zGideon",0
"Xanlythe",1,0,62974,Thragma (Counter),"zzThrawn Magma G6, DT G8, Stormtrooper G8, Shoretrooper 6* G8",0
"Snoova",,,124924,Phasma,"zPhasma zFOTP FOSFTP zFOST zKylo",1
"Snoova",0,1,97965,Geonosians,"zzGBA Sun Fac, Geo Soldier, Geo Spy, Poggle",1
"Snoova",,,364153,HansMF,"Home One, Han's MF 5*, HT 6* Ghost Phantom Biggs X-wing, Cassian's U-wing, Wedge X-wing",1
"Snoova",0,1,128335,BH,"zzBossk zDengar G9, zBoba zzThe Mandalorian, zzJango",1
"Snoova",1,1,125788,zEP,"zzEP zzzVader zzTarkin TFP G9, zSith Trooper",1
"Snoova",0,1,99192,Phoenix,"zHera Chopper zKanan zZeb G9, zEzra",1
"Snoova",0,1,102183,BS,"zBS zzGMY zJolee zGK Ahsoka",1
"Snoova",1,1,81122,NS,"zzMT G9, zzAV zDaka Zombie G7, Spirit G6",0
"Snoova",0,1,40663,Grievous,"GG G5, B2 G3, zB1 4* G8, MagnaGuard G6, Nute G5",0
"Snoova",1,1,81543,Carth,"zCarth Onasi, zMission zZaalbar Juhani 6* G6, Canderous 4*",0
"Snoova",1,0,61086,ShaakClones,"Shaak Ti 5* G7, Rex G9, Echo (501st) G8, Fives G8, Clone Sergeant G8",0
"Snoova",1,0,87253,CLS,"CLS G6, zHan Leia G9, zzOld Ben, zzChewbacca",0
"Snoova",1,0,60392,Troopers,"Veers 6* G7, Starck G6, zStormtrooper G9, zDark Trooper 5*, Snowtrooper G7",0
"Snoova",1,0,53528,Jawas,"Nebit G7, Jawa Engineer 6* G7, Jawa Scavenger G7, Jawa G7, Dathcha G6",0
"Shrub R E",1,1,163280,GL Rey,"zzzzzzRey zGK zzzJTR zHoldo zRH Finn",1
"Shrub R E",,,455039,Negotiator,"Negotiator BTL-B Y-wing, Anakin's Eta-2, Rex's ARC-170, Umbaran SF, Ahsoka's SF, Plo's SF, Clone Sergeant's ARC-170",1
"Shrub R E",0,1,91121,DR,"zzzDR zHK-47 BSF Sith Empire Trooper G8, Thrawn",1
"Shrub R E",,,311213,HansMF,"Home One, Han's MF, Rebel Y-wing, Bistan's U-wing, Phantom Ghost Cassian's U-wing, Biggs X-wing",1
"Shrub R E",0,1,121344,Geonosians,"zzGBA Sun Fac, Geo Soldier, Geo Spy, Poggle",1
"Shrub R E",1,0,118594,CLS,"zzzCLS Han zzChewbacca zzR2-D2 zzC-3PO",1
"Shrub R E",,,100827,Nute-Wat,"zNute G9, zB1 zB2 zMagnaGuard zWat Tambor 4* G9",1
"Shrub R E",,,96620,Disintegration,"zzAurra Greef Boba zBossk zThe Mandalorian G8",1
"Shrub R E",1,1,138560,GAS,"zzzzGAS zRex zEcho (501st), zzFives zARC Trooper",1
"Shrub R E",1,1,127837,Revan Offense,"zzzJKR zGMY zBS zJolee zHYoda",1
"Shrub R E",1,1,87846,Ewoks,"zChirpa Elder Paploo zWicket Logray",1
"Shrub R E",1,1,88028,Carth,"zCarth Onasi, Mission zZaalbar Juhani G8, zCanderous",1
"Shrub R E",1,1,97306,zEP,"zEP zzVader Tarkin TFP zzMara Jade, The Emperor's Hand",1
"Shrub R E",0,1,68713,Phoenix,"Hera G9, Chopper G8, Kanan G8, Zeb G8, Ezra",1
"Shrub R E",1,0,97528,QGJ,"QGJ Aayla JKA Old Ben, zAhsoka",1
"Shrub R E",1,0,18541,NestSolo (Counter),"zNest",1
"Shrub R E",1,0,12288,SionSolo (Counter),"Sion G8",1
"Shrub R E",,,58301,Phasma,"Phasma G7, FOTP FOSFTP G7, FOST G8, Kylo G8",0
"Shrub R E",,,272961,Malevolence,"Malevolence 5* Hyena Bomber 4*, Vulture Droid 3*, Sun Fac SF, Soldier SF, Spy SF",0
"Shrub R E",1,1,86437,NS_Alt,"zMT G8, zzAV Zombie G8, Talia G8, Daka G9",0
"Shrub R E",,,78681,Mon Mothma,"Mon Mothma 4* G8, Cassian G8, Biggs G8, zCara Dune G8, zKyle Katarn",0
"Shrub R E",1,0,71224,Troopers,"Veers G8, Starck G8, Stormtrooper G8, zIden Versio 3* G8, zzGideon 6* G8",0
"Shrub R E",0,1,89914,BH,"Jango zDengar IG-88 G8, Embo Cad",0
"Shrub R E",,,68556,Bad Batch,"Hunter G8, Echo G7, Omega G8, Tech G8, Wrecker G7",0
"Someguyinalabcoat",,,176118,LV,"zzzzzzLord Vader, zzPiett zzzMaul zRG zzzVader",1
"Someguyinalabcoat",1,1,160578,SL Kylo,"zzzzzzSL Kylo, zSith Trooper, zHux zzKRU zzThrawn",1
"Someguyinalabcoat",,,173714,SEE,"zzzzzzSEE zBSF zzMalak zzzDR zDooku",1
"Someguyinalabcoat",1,1,164589,GL Rey,"zzzzzzRey zGK zzzJTR zHoldo zRH Finn",1
"Someguyinalabcoat",,,568627,Executor,"Executor 6* HT RC Xanadu Blood, Slave I, IG-2000 Imperial TIE Fighter, Tie Adv",1
"Someguyinalabcoat",,,169371,JMLS,"zzzJKR zzJKL zzzzzzJMLS zWat Tambor, zzzzGAS",1
"Someguyinalabcoat",1,0,146084,CLS,"zzzCLS zHan zzChewbacca zzC-3PO zChewpio",1
"Someguyinalabcoat",1,1,121029,NestSisters,"zzAV zzMT zDaka Zombie zNest",1
"Someguyinalabcoat",,,489223,Negotiator,"Negotiator BTL-B Y-wing, Anakin's Eta-2, Rex's ARC-170, Umbaran SF, Ahsoka's SF, Plo's SF, Clone Sergeant's ARC-170",1
"Someguyinalabcoat",,,435082,HansMF,"Home One, Han's MF, Rebel Y-wing, Bistan's U-wing, Phantom Biggs X-wing, Cassian's U-wing, Wedge X-wing",1
"Someguyinalabcoat",0,1,102113,Geonosians,"zzGBA Sun Fac, Geo Soldier, Geo Spy, Poggle",1
"Someguyinalabcoat",0,1,138154,Grievous,"zzGG zB2 zB1 zMagnaGuard zNute",1
"Someguyinalabcoat",1,0,121701,Traya,"zzTraya zzDN zSion zzEP Sith Empire Trooper",1
"Someguyinalabcoat",,,109610,Mon Mothma,"zzMon Mothma, Biggs Wedge zCara Dune, Baze",1
"Someguyinalabcoat",1,0,147024,ShaakClones,"zzShaak Ti, zRex zEcho (501st), zzFives zARC Trooper",1
"Someguyinalabcoat",1,1,92673,Ewoks,"zChirpa Elder zPaploo Scout zWicket",1
"Someguyinalabcoat",0,1,149040,BH,"zzBossk zDengar zZam zBoba zzEmbo",1
"Someguyinalabcoat",1,1,93541,Carth,"zCarth Onasi, zMission zZaalbar Juhani G8, zCanderous",1
"Someguyinalabcoat",0,1,87577,Phoenix,"zHera G8, Kanan G8, zZeb G8, zEzra zSabine G8",1
"Someguyinalabcoat",,,125559,Bad Batch,"zHunter zEcho zzOmega zTech zWrecker",1
"Someguyinalabcoat",0,1,132653,BS,"zBS zGMY zJolee zzOld Ben, zzHYoda",1
"Someguyinalabcoat",,,123445,Phasma,"zPhasma zFOTP FOSFTP zFOST zKylo",0
"Someguyinalabcoat",,,295983,Malevolence,"Malevolence Hyena Bomber 4*, Vulture Droid 5*, Sun Fac SF, Soldier SF, Spy SF",0
"Someguyinalabcoat",1,0,88795,Troopers,"zVeers zStarck zStormtrooper G8, Shoretrooper G9, zIden Versio 3* G8",0
"Someguyinalabcoat",0,1,115212,BH,"zJango zIG-88 zGreedo zThe Mandalorian, Cad",0
"BigJReed",0,1,107719,padme,"zzPadme zGK zJKA zAhsoka zBarriss G9",1
"BigJReed",0,1,93914,Geonosians,"zzGBA Sun Fac, Geo Soldier, Geo Spy, Poggle",1
"BigJReed",1,1,126242,Revan Offense,"zzzJKR zzGMY zBS zJolee zzHYoda",1
"BigJReed",1,1,84400,Carth,"zCarth Onasi G9, Mission Zaalbar G9, zJuhani Canderous",1
"BigJReed",1,1,113811,zEP,"zzEP zzzVader zTarkin TFP zBSF",1
"BigJReed",1,0,102358,Wiggs,"Wedge Biggs zzzCLS zHan zEzra",1
"BigJReed",,,88636,Phasma,"Phasma G7, FOE FOO G9, zzKRU zKylo",0
"BigJReed",1,1,90320,JTR,"zzzJTR zScav Rey, BB-8 G7, zzR2-D2 Finn G9",0
"BigJReed",0,1,74814,Grievous,"GG B2 G6, MagnaGuard G8, zDooku IG-88 G8",0
"BigJReed",1,0,72125,ShaakClones,"zShaak Ti G8, Rex G9, Echo (501st) G7, zFives Clone Sergeant G6",0
"BigJReed",1,1,61884,Ewoks,"Chirpa G7, Elder G8, Paploo G7, Wicket G7, Logray G7",0
"BigJReed",0,1,75735,BH,"Bossk 4* G5, Zam G8, zBoba Cad G9, Jango",0
"BigJReed",1,0,48651,Troopers,"Veers 5* G7, Starck G6, Magma G6, Stormtrooper G7, Snowtrooper G6",0
"BigJReed",0,1,63367,Phoenix,"Hera G9, Chopper G7, Kanan Zeb G8, Sabine 4* G6",0
"BigJReed",1,0,8664,SionSolo (Counter),"Sion 5* G8",0
"Atreus Klahan",1,1,153912,SL Kylo,"zzzzzzSL Kylo, zSith Trooper, zHux zzKRU zThrawn",1
"Atreus Klahan",,,162042,SEE,"zzzzzzSEE zBSF zzMalak zzzDR zzzVader",1
"Atreus Klahan",,,177973,JMLS,"zzzJKR zzJKL zzzzzzJMLS zzHYoda zzzzGAS",1
"Atreus Klahan",1,0,141242,CLS,"zzzCLS zHan zzChewbacca zzC-3PO Chewpio",1
"Atreus Klahan",1,1,103247,NS_Alt,"zzMT zzAV Zombie Talia Daka",1
"Atreus Klahan",,,401434,HansMF,"Home One, Han's MF, Rebel Y-wing, Bistan's U-wing, Phantom Biggs X-wing, Cassian's U-wing, Wedge X-wing",1
"Atreus Klahan",0,1,123509,Grievous,"zzGG zB2 zB1 zDroideka zMagnaGuard",1
"Atreus Klahan",1,1,88418,Ewoks,"zChirpa Elder Paploo Teebo Wicket",1
"Atreus Klahan",0,1,98985,BH,"zzBossk Dengar Boba Greedo Greef",1
"Atreus Klahan",1,1,90584,Carth,"zCarth Onasi, zMission zZaalbar zJuhani Canderous",1
"Atreus Klahan",0,1,78605,Phoenix,"Hera Kanan Zeb Ezra Sabine",1
"Atreus Klahan",0,1,125618,padme,"zzPadme zGK zJKA zAhsoka Fives G9",1
"Atreus Klahan",1,0,14851,SionSolo (Counter),"Sion G9",1
"Atreus Klahan",,,115531,Phasma,"Phasma FOTP FOSFTP FOST zKylo",0
"Atreus Klahan",1,1,92215,JTR,"JTR zzR2-D2 BB-8 G8, RH Finn 6* G2, RH Poe G2",0
"Atreus Klahan",0,1,75812,Geonosians,"GBA G7, Sun Fac G9, Geo Soldier, Geo Spy, Poggle",0
"Atreus Klahan",,,418308,Executrix,"Executrix Tie Adv, Emperor's Shuttle 5*, TIE Reaper 5*, Imperial TIE Fighter, Gauntlet Starfighter, FOSF TIE Fighter, FO TIE Fighter",0
"Atreus Klahan",1,0,67514,Troopers,"Veers Piett Gideon G1, Dark Trooper G3, Range Trooper G2",0
"Atreus Klahan",,,102785,Mon Mothma,"Mon Mothma, Lando Biggs Wedge Baze G8",0
"Atreus Klahan",1,0,94740,Wampa (Counter),"Rex zzWampa Krennic Jyn G4, FOO",0
"Atreus Klahan",,,53779,Iden Troopers,"Iden Versio G6, Stormtrooper G5, Snowtrooper G6, Magma G7, DT G2",0
"Atreus Klahan",0,1,73939,BH,"Jango G9, Zam G7, IG-88 G8, The Mandalorian, Cad G8",0
"Atreus Klahan",1,0,125567,zMaul,"Darth Maul, Dooku zSidious Sith Empire Trooper, Sith Marauder",0
"Atreus Klahan",,,59023,Bad Batch,"Hunter Echo 5* G8, Omega G1, Tech G9, Wrecker",0
"Atreus Klahan",1,0,65992,Jawas,"Nebit G7, Jawa Engineer G8, Jawa Scavenger G7, Jawa G9, Dathcha G8",0
"MINAbraham",0,1,138825,padme,"zzPadme zGK zJKA zAhsoka zC-3PO",1
"MINAbraham",,,479160,Negotiator,"Negotiator BTL-B Y-wing, Anakin's Eta-2, Rex's ARC-170, Umbaran SF, Ahsoka's SF, Plo's SF, Clone Sergeant's ARC-170",1
"MINAbraham",0,1,121452,Grievous,"zzGG zB2 zB1 zDroideka MagnaGuard",1
"MINAbraham",1,1,152825,GAS,"zzzzGAS zRex zEcho (501st), zzFives zARC Trooper",1
"MINAbraham",1,1,116739,Revan Offense,"zzzJKR zGMY BS zJolee zHYoda",1
"MINAbraham",1,1,82772,Ewoks,"zChirpa G9, Elder Paploo Wicket Logray G9",1
"MINAbraham",0,1,107611,BH,"zzBossk Boba zGreef zzThe Mandalorian, zJango",1
"MINAbraham",1,1,106811,zEP,"zzEP zzzVader Tarkin TFP G8, zBSF",1
"MINAbraham",0,1,77608,Phoenix,"Hera Chopper Kanan G8, Zeb G8, Ezra",1
"MINAbraham",,,44069,Phasma,"Phasma G6, FOTP G6, FOSFTP G1, FOST G6, Kylo G6",0
"MINAbraham",1,1,72128,Carth,"Carth Onasi, Mission Zaalbar G8, Juhani G8, Canderous G7",0
"MINAbraham",,,111857,Bad Batch,"zHunter zEcho Omega G9, zTech zWrecker",0
