Player,Offense,Defense,GP,Name,Squad,Viable
"Rick Sher Wood",,,488079,Negotiator,"Negotiator BTL-B Y-wing, Anakin's Eta-2, Rex's ARC-170, Umbaran SF, Ahsoka's SF, Plo's SF, Clone Sergeant's ARC-170",1
"Rick Sher Wood",,,430271,HansMF,"Home One, Han's MF, Rebel Y-wing, Bistan's U-wing, Phantom Biggs X-wing, Cassian's U-wing, Wedge X-wing",1
"Rick Sher Wood",1,1,119442,JTR,"zzzJTR zzR2-D2 zzBB-8 RH Finn G8, RH Poe G9",1
"Rick Sher Wood",0,1,139152,Grievous,"zzGG zB2 zB1 zMagnaGuard zNute",1
"Rick Sher Wood",1,0,141656,Traya,"zzTraya zzDN zSion zDooku zzThrawn",1
"Rick Sher Wood",,,112218,Mon Mothma,"zzMon Mothma, Wedge Biggs Chirrut Lando",1
"Rick Sher Wood",1,1,146816,Revan Offense,"zzzJKR zzGMY zzHYoda zJolee zJKA",1
"Rick Sher Wood",1,1,91816,Ewoks,"zChirpa Elder Paploo Wicket zLogray",1
"Rick Sher Wood",1,0,142161,ShaakClones,"zzShaak Ti, zRex zEcho (501st), zzFives zARC Trooper",1
"Rick Sher Wood",1,1,90274,Carth,"zCarth Onasi, zMission zZaalbar zVandor Chewbacca G9, Canderous G8",1
"Rick Sher Wood",0,1,150822,BH,"zzBossk zzJango zFennec Shand, zDengar zZam",1
"Rick Sher Wood",0,1,103987,FO,"zzKRU zKylo zHux FOE FOO",1
"Rick Sher Wood",0,1,76061,Phoenix,"Hera G8, Zeb G8, Sabine G8, zEzra Kanan G8",1
"Rick Sher Wood",1,0,79685,Jawas,"Nebit G8, Jawa Engineer G8, Jawa Scavenger, Jawa Dathcha",1
"Rick Sher Wood",,,71946,Admiral Raddus,"Admiral Raddus G8, Cassian G9, Jyn G8, Baze G8, Bistan G8",0
"Rick Sher Wood",,,148049,JMLS,"zBS zzzzzzJMLS zWat Tambor, zzJKL Barriss G8",0
"Rick Sher Wood",,,321002,Malevolence,"Malevolence Hyena Bomber 5*, Vulture Droid, Sun Fac SF, Soldier SF, Spy SF",0
"Rick Sher Wood",0,1,110833,Geonosians Omicron,"zzGBA Sun Fac, Geo Soldier, Geo Spy, Poggle",0
"Rick Sher Wood",1,0,99769,Troopers,"zVeers zStarck Iden Versio G9, zzGideon Dark Trooper G9",0
"Rick Sher Wood",,,110320,Bad Batch,"zHunter zEcho Omega 5* G4, zTech zWrecker",0
"Beats4dayz",,,192135,JMK,"zzzzzzJMK zAhsoka zzzCAT zzzzGAS zGK",1
"Beats4dayz",1,1,114924,NS,"zzMT zzAV zDaka Zombie Spirit",1
"Beats4dayz",,,163387,JMLS,"zBS zzzzzzJMLS zWat Tambor, zzJKL zJolee",1
"Beats4dayz",1,0,152013,CLS,"zzzCLS zHan zzChewbacca zzC-3PO zChewpio",1
"Beats4dayz",0,1,147688,DRMalak,"zzzDR zzHK-47 zBSF zzMalak Sith Empire Trooper",1
"Beats4dayz",,,431304,HansMF,"Home One, Han's MF, Rebel Y-wing 6*, Bistan's U-wing, Phantom Biggs X-wing, Cassian's U-wing, Wedge X-wing",1
"Beats4dayz",,,521023,Negotiator,"Negotiator 6* HT Anakin's Eta-2, Umbaran SF, Ahsoka's SF, Clone Sergeant's ARC-170, Plo's SF, Rex's ARC-170",1
"Beats4dayz",0,1,131365,Grievous,"zzGG zB2 zB1 zMagnaGuard zNute",1
"Beats4dayz",1,0,124221,Traya,"zzTraya zzDN zSion zDooku zzThrawn",1
"Beats4dayz",1,1,125384,JTR,"zzzJTR zScav Rey, zzBB-8 zzR2-D2 RT",1
"Beats4dayz",,,109809,Mon Mothma,"zzMon Mothma, Wedge zCara Dune, zPao Biggs",1
"Beats4dayz",1,0,101776,Troopers,"zVeers zzPiett zGideon zDark Trooper, Range Trooper",1
"Beats4dayz",,,131413,Disintegration,"zzAurra zzGreef zBoba zzBossk zzThe Mandalorian",1
"Beats4dayz",1,1,97472,Ewoks,"zChirpa Elder zPaploo zWicket zLogray",1
"Beats4dayz",1,0,122709,ShaakClones,"zzShaak Ti, zRex zEcho (501st), zzFives zARC Trooper",1
"Beats4dayz",1,1,106298,Carth,"zCarth Onasi, zMission zZaalbar zJuhani zCanderous",1
"Beats4dayz",0,1,143498,BH,"zzJango zFennec Shand, zDengar Krrsantan zGreedo",1
"Beats4dayz",1,1,114396,zEP,"zzEP zzzVader zzTarkin zDT zIPD G9",1
"Beats4dayz",0,1,106943,FO,"zzKRU zKylo zHux FOE FOO",1
"Beats4dayz",0,1,84126,Phoenix,"zHera Zeb G8, Sabine G8, zEzra zKanan G8",1
"Beats4dayz",1,1,79800,Rogue1,"Jyn G9, Chirrut Baze G8, Cassian G8, zK-2SO",1
"Beats4dayz",1,0,84568,Jawas,"Nebit G9, Jawa Engineer, Jawa Scavenger, Jawa Dathcha",1
"Beats4dayz",1,0,70445,QiraNest,"zQira zNest zzHYoda",1
"Beats4dayz",0,1,112351,Geonosians Omicron,"zzGBA Sun Fac, Geo Soldier, Geo Spy, Poggle",0
"Beats4dayz",,,44081,Bad Batch,"Hunter 5* G7, Echo 4* G8, Omega 4* G8, Tech 5* G9, Wrecker 4* G8",0
"Ryzilio",,,123652,Phasma,"zPhasma zFOTP FOSFTP zFOST zKylo",1
"Ryzilio",1,1,155032,SL Kylo,"zzzzzzSL Kylo, zSith Trooper, zHux zzKRU zThrawn",1
"Ryzilio",1,1,168450,GL Rey,"zzzzzzRey zzzJTR zzBB-8 zHoldo zRH Finn",1
"Ryzilio",0,1,133828,DRMalak,"zzzDR zzHK-47 zBSF zzMalak Sith Empire Trooper",1
"Ryzilio",0,1,137516,padme,"zzPadme zGK zJKA zAhsoka zzC-3PO",1
"Ryzilio",0,1,91379,Geonosians Omicron,"zzGBA Sun Fac, Geo Soldier, Geo Spy, Poggle",1
"Ryzilio",,,437201,Negotiator,"Negotiator HT Anakin's Eta-2, Umbaran SF, Ahsoka's SF, Clone Sergeant's ARC-170, Jedi Consular's Starfighter, Plo's SF",1
"Ryzilio",,,467646,Raddus,"Raddus Sun Fac SF, Rey's Millennium Falcon, Poe Dameron's X-wing, Resistance X-wing, Biggs X-wing, Wedge X-wing, Phantom Ghost",1
"Ryzilio",1,1,118677,Revan Offense,"zzzJKR zGMY BS zJolee HYoda G9",1
"Ryzilio",1,1,83587,Ewoks,"zChirpa Elder Paploo Wicket zLogray",1
"Ryzilio",1,0,135669,ShaakClones,"zzShaak Ti, zRex zEcho (501st), zzFives zARC Trooper",1
"Ryzilio",0,1,106988,BH,"zzBossk zDengar Cad zzGreef zBoba",1
"Ryzilio",1,1,89116,Carth,"zCarth Onasi, Mission Zaalbar Juhani Canderous",1
"Ryzilio",0,1,78936,Phoenix,"Hera Zeb Sabine G8, Ezra Kanan",1
"Ryzilio",1,0,86666,CLS,"zzCLS zHan Leia Old Ben, Chewbacca",1
"Ryzilio",1,1,110918,zEP,"zzEP zzzVader Tarkin zDooku TFP",1
"Ryzilio",,,101992,Grievous Omicron,"zGG zB2 zB1 MagnaGuard zDroideka",0
"Ryzilio",1,0,58124,Troopers,"Veers Piett G8, Gideon 5* G9, Dark Trooper 5* G7, Range Trooper 5* G2",0
"Ryzilio",0,1,77416,BH,"Jango G7, Greedo G9, zzThe Mandalorian, Embo 5* G7, IG-88",0
"Drakorhuin",1,0,140751,CLS,"zzzCLS zHan zzChewbacca zC-3PO zChewpio",1
"Drakorhuin",,,489833,Negotiator,"Negotiator BTL-B Y-wing, Anakin's Eta-2, Rex's ARC-170, Umbaran SF, Ahsoka's SF, Plo's SF, Clone Sergeant's ARC-170",1
"Drakorhuin",,,343689,Malevolence,"Malevolence Hyena Bomber, Vulture Droid, Sun Fac SF, Soldier SF, Spy SF",1
"Drakorhuin",1,1,97203,NS_Alt,"zzMT zAV Talia zDaka Zombie",1
"Drakorhuin",0,1,124522,Geonosians Omicron,"zzGBA Sun Fac, Geo Soldier, Geo Spy, Poggle",1
"Drakorhuin",,,368187,HansMF,"Home One, Han's MF, Rebel Y-wing, Bistan's U-wing, Phantom Ghost Cassian's U-wing, Wedge X-wing",1
"Drakorhuin",0,1,128389,Grievous-Wat,"zzGG zB2 zB1 zMagnaGuard zWat Tambor",1
"Drakorhuin",1,1,161478,GAS,"zzzzGAS zRex zEcho (501st), zzFives zARC Trooper",1
"Drakorhuin",1,1,89368,Ewoks,"zChirpa Elder Paploo zWicket Logray",1
"Drakorhuin",0,1,136303,BH,"zzBossk zJango zDengar Boba zZam",1
"Drakorhuin",1,1,122712,zEP,"zzEP zzzVader Tarkin Krennic TFP G8",1
"Drakorhuin",1,0,128706,Troopers,"zVeers zStarck Range Trooper, zGideon zzPiett",1
"Drakorhuin",0,1,84572,Phoenix,"Hera Zeb G8, Chopper zEzra Kanan",1
"Drakorhuin",1,1,60837,Rogue1,"Jyn G8, Chirrut G8, Baze G8, Cassian G8, K-2SO G8",1
"Drakorhuin",0,1,110687,BS,"zBS GMY Jolee zGK zJKA",1
"Drakorhuin",1,0,16254,NestSolo (Counter),"Nest",1
"Drakorhuin",,,55241,Phasma,"Phasma G8, FOTP G7, FOSFTP G7, FOST 6* G8, Kylo G8",0
"Drakorhuin",1,1,68815,JTR,"JTR G8, Scav Rey, BB-8 G8, R2-D2 G8, Finn G9",0
"Drakorhuin",1,0,91232,Traya,"Traya G8, DN G8, Sion 6* G7, zDooku zThrawn",0
"Drakorhuin",,,375907,Executrix,"Executrix Tie Adv, Emperor's Shuttle, TIE Reaper 4*, Imperial TIE Fighter, Gauntlet Starfighter, FOSF TIE Fighter, FO TIE Fighter",0
"Drakorhuin",,,57696,Mon Mothma,"Mon Mothma 5* G8, Hoth Rebel Soldier G8, Wedge G8, Cara Dune G8, Biggs G8",0
"Drakorhuin",1,1,70223,Carth,"zCarth Onasi, Mission G7, Zaalbar 6* G7, zJuhani 6* G7, Canderous G8",0
"Drakorhuin",,,73120,Iden Troopers,"zIden Versio, Shoretrooper G9, Snowtrooper G8, Magma G7, DT G9",0
"Gorgatron",,,186129,JMK,"zzzzzzJMK zAhsoka zzzCAT zzzzGAS zGK",1
"Gorgatron",,,177087,LV,"zzzzzzLord Vader, zzPiett zzzVader zRG zNinth Sister",1
"Gorgatron",,,127768,Phasma,"zPhasma zFOTP FOSFTP zFOST zKylo",1
"Gorgatron",,,143475,Admiral Raddus,"zzAdmiral Raddus, zCassian zJyn zK-2SO Bistan",1
"Gorgatron",,,446450,Profundity,"Profundity Han's MF, Outrider Rebel Y-wing, Cassian's U-wing, Ghost",1
"Gorgatron",1,1,167278,SL Kylo,"zzzzzzSL Kylo, zSith Trooper, zHux zzKRU zThrawn",1
"Gorgatron",,,169572,SEE,"zzzzzzSEE zBSF zzMalak zzzDR zDooku",1
"Gorgatron",0,1,105288,Qira,"Qira zL3-37 zVandor Chewbacca, zMission zZaalbar",1
"Gorgatron",1,1,168729,GL Rey,"zzzzzzRey zzzJTR zzR2-D2 zRH Poe, zRH Finn",1
"Gorgatron",,,144850,SK,"zzEP zzMara Jade, The Emperor's Hand, zzStarkiller zzOld Ben, Visas",1
"Gorgatron",1,1,130207,NS,"zzMT zzAV zDaka Zombie Spirit",1
"Gorgatron",,,607691,Executor,"Executor HT RC Xanadu Blood, Slave I, IG-2000 Imperial TIE Fighter, Tie Adv",1
"Gorgatron",,,163561,JMLS,"zBS zzzzzzJMLS zWat Tambor, zzJKL zJolee",1
"Gorgatron",1,0,153132,CLS,"zzzCLS zHan zzChewbacca zzC-3PO zChewpio",1
"Gorgatron",,,131832,Grievous Omicron,"zzGG zB2 zB1 zMagnaGuard zDroideka",1
"Gorgatron",,,524646,Negotiator,"Negotiator BTL-B Y-wing, Anakin's Eta-2, Rex's ARC-170, Umbaran SF, Ahsoka's SF, Plo's SF, Clone Sergeant's ARC-170",1
"Gorgatron",,,320900,Malevolence,"Malevolence Hyena Bomber, Vulture Droid, Sun Fac SF, Soldier SF, Spy SF",1
"Gorgatron",0,1,105933,Geonosians Omicron,"zzGBA Sun Fac, Geo Soldier, Geo Spy, Poggle",1
"Gorgatron",,,118422,Mon Mothma,"zzMon Mothma, Wedge zCara Dune, zPao Hoth Rebel Scout",1
"Gorgatron",,,141353,Disintegration,"zAurra zzGreef zBoba zzBossk zThe Mandalorian",1
"Gorgatron",1,1,110472,Ewoks,"zChirpa Elder zPaploo zWicket zLogray",1
"Gorgatron",1,0,152546,ShaakClones,"zzShaak Ti, zRex zEcho (501st), zzFives zARC Trooper",1
"Gorgatron",0,1,148911,BH,"zzJango zFennec Shand, zDengar Cad zZam",1
"Gorgatron",1,0,130165,Troopers,"zVeers zStarck zIden Versio, zzGideon zDark Trooper",1
"Gorgatron",0,1,87238,Phoenix,"Hera Zeb Sabine Ezra Kanan G8",1
"Gorgatron",,,125071,Bad Batch,"zHunter zEcho zzOmega zTech zWrecker",1
"Gorgatron",,,136404,Mando,"zzThe Mandalorian (Beskar Armor), zDash Rendar, zNest zIG-11 zKuiil",1
"Gorgatron",1,0,88684,Jawas,"Nebit Jawa Engineer, Jawa Scavenger, Jawa Dathcha",1
"Gorgatron",1,0,21369,SionSolo (Counter),"zSion",1
"Gorgatron",1,0,122880,zMaul,"Darth Maul, zDN zSidious zSavage Sith Marauder",0
"Fosachi Walker",1,1,115121,NS,"zzMT zzAV zDaka Zombie Spirit",1
"Fosachi Walker",0,1,130316,DRMalak,"zzzDR zzHK-47 zBSF zzMalak Sith Empire Trooper",1
"Fosachi Walker",0,1,144091,padme,"zzPadme zGK zJKA zAhsoka zzC-3PO",1
"Fosachi Walker",,,405442,HansMF,"Home One, Han's MF, Rebel Y-wing, Bistan's U-wing, Phantom Ghost Cassian's U-wing, Wedge X-wing",1
"Fosachi Walker",,,500495,Negotiator,"Negotiator HT Anakin's Eta-2, Umbaran SF, Ahsoka's SF, Clone Sergeant's ARC-170, Plo's SF, Rex's ARC-170",1
"Fosachi Walker",0,1,116824,Grievous,"zzGG zB2 zB1 zMagnaGuard zNute",1
"Fosachi Walker",1,0,131603,Traya,"zzTraya zzDN zSion zzEP zzThrawn",1
"Fosachi Walker",1,1,114084,JTR,"zzzJTR zScav Rey, zzBB-8 zzR2-D2 zFinn",1
"Fosachi Walker",1,1,135148,GAS,"zzzzGAS zRex zEcho (501st), zzFives zARC Trooper",1
"Fosachi Walker",1,1,143789,Revan Offense,"zzzJKR zzGMY zBS zJolee zzHYoda",1
"Fosachi Walker",1,1,100072,Ewoks,"zChirpa Elder zPaploo zWicket zLogray",1
"Fosachi Walker",0,1,113366,BH,"zzBossk zzJango Dengar G8, zzThe Mandalorian, zBoba",1
"Fosachi Walker",1,1,99480,Carth,"zCarth Onasi, zMission zZaalbar zJuhani zCanderous",1
"Fosachi Walker",1,0,123066,CLS,"zzzCLS zHan zLeia zFulcrum zzChewbacca",1
"Fosachi Walker",0,1,88799,Phoenix,"zHera Zeb G8, zSabine zEzra Kanan",1
"Fosachi Walker",1,0,104586,zMaul,"zDarth Maul, zDooku zSidious Sith Assassin, zSavage",1
"Fosachi Walker",1,0,83805,Jawas,"Nebit Jawa Engineer, Jawa Scavenger, Jawa Dathcha",1
"Fosachi Walker",1,0,18625,NestSolo (Counter),"zNest",1
"Fosachi Walker",,,83638,Phasma,"zPhasma G9, zFOTP FOSFTP G7, zFOST G9, zKylo",0
"Fosachi Walker",0,1,93169,Geonosians Omicron,"zzGBA Sun Fac, Geo Soldier, Geo Spy, Poggle",0
"Fosachi Walker",,,390820,Executrix,"Executrix Tie Adv, Emperor's Shuttle 4*, TIE Reaper 5*, Imperial TIE Fighter, Gauntlet Starfighter, FOSF TIE Fighter, FO TIE Fighter",0
"Fosachi Walker",,,76888,Mon Mothma,"Mon Mothma 5* G6, Wedge Biggs Lando Hoth Rebel Scout",0
"Fosachi Walker",1,0,88681,Troopers,"zVeers zStarck Shoretrooper G9, Snowtrooper G8, zzPiett",0
"Fosachi Walker",,,58507,Bad Batch,"Hunter 6* G9, Echo 2* G8, Omega G9, Tech 4* G9, Wrecker 6* G8",0
"Tag1turn2",,,183364,JMK,"zzzzzzJMK zAhsoka zzzCAT zzzzGAS zGK",1
"Tag1turn2",,,122948,Phasma,"zPhasma zFOTP FOSFTP zFOST zKylo",1
"Tag1turn2",1,1,162478,SL Kylo,"zzzzzzSL Kylo, zSith Trooper, zHux zzKRU zThrawn",1
"Tag1turn2",,,184048,SEE,"zzzzzzSEE zBSF zzMalak zzzDR zzzVader",1
"Tag1turn2",1,1,168884,GL Rey,"zzzzzzRey zzzJTR zzBB-8 zHoldo zRH Finn",1
"Tag1turn2",1,1,104923,NS,"zzMT zzAV zDaka Zombie Spirit",1
"Tag1turn2",,,575920,Executor,"Executor 5* HT RC Xanadu Blood, Slave I, IG-2000 Imperial TIE Fighter, Tie Adv",1
"Tag1turn2",1,0,153544,CLS,"zzzCLS zHan zzChewbacca zzC-3PO zChewpio",1
"Tag1turn2",,,505923,Negotiator,"Negotiator BTL-B Y-wing, Anakin's Eta-2, Rex's ARC-170, Umbaran SF, Ahsoka's SF, Plo's SF, Clone Sergeant's ARC-170",1
"Tag1turn2",,,308123,Malevolence,"Malevolence Hyena Bomber, Vulture Droid, Sun Fac SF, Soldier SF, Spy SF",1
"Tag1turn2",,,142875,JKL,"zzJKL zzzJKR zzHYoda zzOld Ben, Aayla",1
"Tag1turn2",,,466087,HansMF,"Home One, Han's MF, Rebel Y-wing, Bistan's U-wing, Phantom Ghost Cassian's U-wing, Wedge X-wing",1
"Tag1turn2",0,1,130255,Grievous,"zzGG zB2 zB1 zMagnaGuard zNute",1
"Tag1turn2",1,0,115173,Traya,"zzTraya zDN zSion zzEP Sith Empire Trooper",1
"Tag1turn2",,,107397,Mon Mothma,"zzMon Mothma, Bistan Wedge zCara Dune, Pao",1
"Tag1turn2",,,141865,Disintegration,"zzAurra zzGreef zBoba zzBossk zzThe Mandalorian",1
"Tag1turn2",1,1,88407,Ewoks,"zChirpa Elder Paploo Wicket zLogray",1
"Tag1turn2",1,0,138429,ShaakClones,"zzShaak Ti, zRex zEcho (501st), zzFives zARC Trooper",1
"Tag1turn2",1,1,98725,Carth,"zCarth Onasi, zMission zZaalbar zVandor Chewbacca, Canderous",1
"Tag1turn2",0,1,147017,BH,"zzJango zFennec Shand, zDengar zGreedo Boba Fett, Scion of Jango",1
"Tag1turn2",1,0,119691,Troopers,"zVeers Starck zIden Versio, DT zzPiett",1
"Tag1turn2",0,1,87677,Phoenix,"zHera Zeb Sabine G8, Ezra Kanan",1
"Tag1turn2",1,1,100985,Rogue1,"zzJyn Chirrut G9, Baze G8, zCassian K-2SO G9",1
"Tag1turn2",,,123719,Mando,"zzThe Mandalorian (Beskar Armor), zDash Rendar, zNest zIG-11 zKuiil",1
"Tag1turn2",1,0,70995,Jawas,"Nebit G8, Jawa Engineer G8, Jawa Scavenger G8, Jawa Dathcha G9",1
"Tag1turn2",0,1,97475,Geonosians Omicron,"zzGBA Sun Fac, Geo Soldier, Geo Spy, Poggle",0
"Tag1turn2",,,43864,Bad Batch,"Hunter 5* G9, Echo 4* G8, Omega 5* G9, Tech 5* G8, Wrecker 5* G8",0
"serChetnik",,,183571,JMK,"zzzzzzJMK zAhsoka zzzCAT zzzzGAS zGK",1
"serChetnik",,,116836,Phasma,"zPhasma zFOTP FOSFTP zFOST zKylo",1
"serChetnik",,,429446,Profundity,"Profundity 5* Han's MF, Outrider Rebel Y-wing, Cassian's U-wing, Ghost",1
"serChetnik",,,171791,SEE,"zzzzzzSEE zBSF zzMalak zzzDR zzzVader",1
"serChetnik",,,569064,Executor,"Executor 5* HT RC Xanadu Blood, Slave I, IG-2000 Imperial TIE Fighter, Tie Adv",1
"serChetnik",1,0,145806,CLS,"zzzCLS zHan zzChewbacca zzC-3PO zChewpio",1
"serChetnik",,,515929,Negotiator,"Negotiator BTL-B Y-wing, Anakin's Eta-2, Rex's ARC-170, Umbaran SF, Ahsoka's SF, Plo's SF, Clone Sergeant's ARC-170",1
"serChetnik",,,348814,Malevolence,"Malevolence Hyena Bomber, Vulture Droid, Sun Fac SF, Soldier SF, Spy SF",1
"serChetnik",,,141961,JKL,"zzJKL zzzJKR zzHYoda zzOld Ben, Aayla",1
"serChetnik",0,1,137003,Grievous,"zzGG zB2 zB1 zMagnaGuard zNute",1
"serChetnik",1,0,122584,Traya,"zzTraya zzDN zSion Sith Empire Trooper, zzThrawn",1
"serChetnik",1,1,129948,JTR,"zzzJTR zScav Rey, zzBB-8 zzR2-D2 zFinn",1
"serChetnik",,,109020,Mon Mothma,"zzMon Mothma, Bistan Wedge zCara Dune, Scarif",1
"serChetnik",1,1,97144,Ewoks,"zChirpa Elder zPaploo zWicket zLogray",1
"serChetnik",1,0,138557,ShaakClones,"zzShaak Ti, zRex zEcho (501st), zzFives zARC Trooper",1
"serChetnik",0,1,149773,BH,"zzBossk zzJango zDengar zBoba zIG-88",1
"serChetnik",1,1,98737,Carth,"zCarth Onasi, zMission zZaalbar zJuhani zCanderous",1
"serChetnik",1,0,119198,Troopers,"zVeers zStarck zDT Shoretrooper zzPiett",1
"serChetnik",1,0,127831,zMaul,"zDarth Maul, zSidious zDooku Sith Marauder, zNest",1
"serChetnik",0,1,105216,Phoenix,"zHera zZeb zSabine zEzra zKanan",1
"serChetnik",1,0,114057,EP (Counter, Rebel),"zzEP zKrennic zzWampa Range Trooper, Stormtrooper G8",1
"serChetnik",,,125505,Admiral Raddus,"zzAdmiral Raddus, zCassian zzJyn zK-2SO Chirrut G4",0
"serChetnik",1,1,97742,NS,"zzMT zzAV zDaka Zombie Spirit",0
"serChetnik",0,1,116735,Geonosians Omicron,"zzGBA Sun Fac, Geo Soldier, Geo Spy, Poggle",0
"serChetnik",1,0,71379,Jawas,"Nebit G8, Jawa Engineer, Jawa Scavenger G9, Jawa 6* Dathcha",0
"ST2618",,,171944,JMK,"zzzzzzJMK zAhsoka zzzCAT zzzzGAS zGK",1
"ST2618",,,587441,Executor,"Executor HT RC Xanadu Blood, Slave I, IG-2000 Imperial TIE Fighter, Tie Adv",1
"ST2618",1,0,145091,CLS,"zzzCLS zHan zzChewbacca zzC-3PO zChewpio",1
"ST2618",1,1,95025,NestSisters,"zzAV zMT Daka Zombie zNest",1
"ST2618",,,500244,Negotiator,"Negotiator BTL-B Y-wing, Anakin's Eta-2, Rex's ARC-170, Umbaran SF, Ahsoka's SF, Plo's SF, Clone Sergeant's ARC-170",1
"ST2618",,,310330,Malevolence,"Malevolence Hyena Bomber, Vulture Droid, Sun Fac SF, Soldier SF, Spy SF",1
"ST2618",,,130503,JKL,"zzJKL zzzJKR zHYoda Old Ben, Aayla",1
"ST2618",0,1,128060,Grievous,"zzGG zB2 zB1 zMagnaGuard zNute",1
"ST2618",1,0,95693,Traya,"zzTraya zDN Sion G9, zzEP zThrawn",1
"ST2618",1,1,120445,JTR,"zzJTR Scav Rey, zBB-8 zzR2-D2 zFinn",1
"ST2618",1,0,123568,Troopers,"zVeers zzPiett zGideon zDark Trooper, Range Trooper",1
"ST2618",,,98330,Mon Mothma,"Mon Mothma, Baze Wedge Biggs Lando",1
"ST2618",1,0,140210,ShaakClones,"zzShaak Ti, zRex zEcho (501st), zzFives zARC Trooper",1
"ST2618",1,1,81321,Ewoks,"zChirpa Elder Paploo Scout Logray",1
"ST2618",0,1,141295,BH,"zzBossk Jango Dengar zBoba zIG-88",1
"ST2618",0,1,75163,Phoenix,"Hera Zeb G8, Sabine Ezra Kanan G8",1
"ST2618",,,64425,Bad Batch,"Hunter Echo Omega Tech Wrecker",1
"ST2618",0,1,99132,Geonosians Omicron,"zzGBA Sun Fac, Geo Soldier, Geo Spy, Poggle",0
"ST2618",,,412738,HansMF,"Home One, Han's MF, Rebel Y-wing, Ghost Phantom Biggs X-wing, Cassian's U-wing, Wedge X-wing",0
"ST2618",0,1,72686,FO,"zKRU Kylo G9, FOE FOSFTP G7, FOO G9",0
"Ahhhchhoooo",,,405668,Profundity,"Profundity 5* Han's MF, Outrider Rebel Y-wing, Cassian's U-wing, Ghost",1
"Ahhhchhoooo",,,173763,Jabba,"zzzzzzJabba zBoushh (Leia Organa), zSkiff Guard (Lando Calrissian), zKrrsantan Boba",1
"Ahhhchhoooo",1,1,168888,GL Rey,"zzzzzzRey zGK zzzJTR zRH Poe, zRH Finn",1
"Ahhhchhoooo",,,527149,Executor,"Executor 6* HT RC Xanadu Blood, Slave I, IG-2000 Imperial TIE Fighter, Tie Adv",1
"Ahhhchhoooo",,,175040,JMLS,"zzzJKR zzJKL zzzzzzJMLS HYoda zzzzGAS",1
"Ahhhchhoooo",1,0,149030,CLS,"zzzCLS zHan zChewbacca zC-3PO zChewpio",1
"Ahhhchhoooo",0,1,137250,DRMalak,"zzzDR zHK-47 zBSF zzMalak Sith Marauder",1
"Ahhhchhoooo",,,283955,Malevolence,"Malevolence Hyena Bomber, Vulture Droid, Sun Fac SF, Soldier SF, Spy SF",1
"Ahhhchhoooo",0,1,114345,Grievous,"zzGG zB2 zB1 MagnaGuard IG-88",1
"Ahhhchhoooo",1,0,134845,Troopers,"zVeers zzPiett zGideon zDark Trooper, Range Trooper",1
"Ahhhchhoooo",,,107771,Mon Mothma,"zzMon Mothma, Bistan Wedge zCara Dune, Biggs",1
"Ahhhchhoooo",1,1,83376,Ewoks,"zChirpa Elder Paploo zWicket zLogray G9",1
"Ahhhchhoooo",1,0,133420,ShaakClones,"zShaak Ti, zRex zEcho (501st), zzFives zARC Trooper",1
"Ahhhchhoooo",0,1,129472,BH,"zBossk Fennec Shand, Aurra Dengar Greedo",1
"Ahhhchhoooo",1,1,122304,zEP,"zEP zzzVader Tarkin G8, TFP zMara Jade, The Emperor's Hand",1
"Ahhhchhoooo",0,1,75002,Phoenix,"Hera Zeb G8, Chopper G8, Ezra G8, Kanan G8",1
"Ahhhchhoooo",0,1,120294,BS,"zBS zGMY zJolee Old Ben, zJKA",1
"Ahhhchhoooo",,,66440,Phasma,"Phasma G7, FOTP G8, FOO G8, KRU Kylo G9",0
"Ahhhchhoooo",,,430289,Negotiator,"Negotiator BTL-B Y-wing, Anakin's Eta-2, Rex's ARC-170, Umbaran SF, Ahsoka's SF, Plo's SF, Clone Sergeant's ARC-170",0
"Ahhhchhoooo",0,1,91984,Geonosians Omicron,"zzGBA Sun Fac, Geo Soldier, Geo Spy, Poggle",0
"Ahhhchhoooo",,,86914,Nute-OR,"Nute Dooku Jango zZaalbar zMission",0
"Ahhhchhoooo",1,0,67840,Jawas,"Nebit G7, Jawa Engineer G7, Jawa Scavenger G7, Jawa Dathcha G7",0
"AndyJediDude",,,123415,Phasma,"zPhasma zFOTP FOSFTP zFOST zKylo",1
"AndyJediDude",1,1,165258,SL Kylo,"zzzzzzSL Kylo, zSith Trooper, zHux zzKRU zzThrawn",1
"AndyJediDude",1,1,169223,GL Rey,"zzzzzzRey zGK zzzJTR zRH Poe, zRH Finn",1
"AndyJediDude",,,165157,Jabba,"zzzzzzJabba zBoushh (Leia Organa), zSkiff Guard (Lando Calrissian), Krrsantan zBoba",1
"AndyJediDude",,,571582,Executor,"Executor 5* HT RC Xanadu Blood, Slave I, IG-2000 Imperial TIE Fighter, Tie Adv",1
"AndyJediDude",,,172462,JMLS,"zzzJKR zzJKL zzzzzzJMLS zWat Tambor, zzzzGAS",1
"AndyJediDude",1,0,152680,CLS,"zzzCLS zHan zzChewbacca zzC-3PO zChewpio",1
"AndyJediDude",0,1,140476,DRMalak,"zzzDR zzHK-47 zBSF zzMalak Sith Empire Trooper",1
"AndyJediDude",,,135448,Grievous Omicron,"zzGG zB2 zB1 zMagnaGuard zDroideka",1
"AndyJediDude",1,1,108716,NestSisters,"zzAV zzMT zDaka Zombie zNest",1
"AndyJediDude",,,486378,Negotiator,"Negotiator BTL-B Y-wing, Anakin's Eta-2, Rex's ARC-170, Umbaran SF, Ahsoka's SF, Plo's SF, Clone Sergeant's ARC-170",1
"AndyJediDude",,,309015,Malevolence,"Malevolence Hyena Bomber, Vulture Droid, Sun Fac SF, Soldier SF, Spy SF",1
"AndyJediDude",,,486954,HansMF,"Home One, Han's MF, Rebel Y-wing, Bistan's U-wing, Phantom Ghost Cassian's U-wing, Wedge X-wing",1
"AndyJediDude",1,0,127111,Traya,"zzTraya DN zSion zDooku zzEP",1
"AndyJediDude",,,103668,Mon Mothma,"zzMon Mothma, Bistan zCara Dune, Pao Hoth Rebel Scout",1
"AndyJediDude",1,0,136901,Troopers,"zVeers zzPiett zzGideon zDark Trooper, Range Trooper",1
"AndyJediDude",1,1,88251,Ewoks,"zChirpa Elder Paploo Wicket Logray",1
"AndyJediDude",1,0,138798,ShaakClones,"zzShaak Ti, zRex zEcho (501st), zzFives zARC Trooper",1
"AndyJediDude",1,1,103820,Carth,"zCarth Onasi, zMission zZaalbar zJuhani zCanderous",1
"AndyJediDude",0,1,150477,BH,"zzBossk zzJango zFennec Shand, zzAurra zDengar",1
"AndyJediDude",0,1,91402,Phoenix,"zHera Zeb Sabine G8, Ezra Kanan",1
"AndyJediDude",0,1,144520,BS,"zBS zzGMY zJolee zzOld Ben, zzHYoda",1
"AndyJediDude",1,0,90268,Jawas,"Nebit Jawa Engineer, Jawa Scavenger, Jawa Dathcha",1
"AndyJediDude",,,127706,Admiral Raddus,"zzAdmiral Raddus, zCassian zzJyn K-2SO Chirrut G7",0
"AndyJediDude",0,1,98375,Geonosians Omicron,"zzGBA Sun Fac, Geo Soldier, Geo Spy, Poggle",0
"AndyJediDude",,,78980,Iden Troopers,"zIden Versio, Shoretrooper G8, Snowtrooper Magma G9, DT",0
"AndyJediDude",,,75253,Bad Batch,"Hunter G9, Echo G9, zOmega G9, Tech G9, Wrecker G8",0
"Tryptamine",,,179451,JMK,"zzzzzzJMK zAhsoka zzzCAT zzzzGAS zGK",1
"Tryptamine",,,119947,Phasma,"zPhasma zFOTP FOSFTP FOST zKylo",1
"Tryptamine",,,422561,Profundity,"Profundity 6* Han's MF, Outrider Rebel Y-wing, Cassian's U-wing, Ghost",1
"Tryptamine",1,1,161422,SL Kylo,"zzzzzzSL Kylo, zSith Trooper, zHux zzKRU zThrawn",1
"Tryptamine",,,179520,SEE,"zzzzzzSEE zBSF zzMalak zzzDR zzVader",1
"Tryptamine",,,567775,Executor,"Executor HT RC Xanadu Blood, Slave I, IG-2000 Imperial TIE Fighter, Tie Adv",1
"Tryptamine",1,0,152507,CLS,"zzzCLS zHan zzChewbacca zC-3PO zChewpio",1
"Tryptamine",,,513569,Negotiator,"Negotiator BTL-B Y-wing, Anakin's Eta-2, Rex's ARC-170, Umbaran SF, Ahsoka's SF, Plo's SF, Clone Sergeant's ARC-170",1
"Tryptamine",,,306140,Malevolence,"Malevolence Hyena Bomber, Vulture Droid, Sun Fac SF, Soldier SF, Spy SF",1
"Tryptamine",,,136258,JKL,"zzJKL zzzJKR zHYoda zOld Ben, Aayla",1
"Tryptamine",0,1,125838,Grievous,"zzGG zB2 zB1 MagnaGuard zNute",1
"Tryptamine",,,130651,Disintegration,"Aurra zGreef zBoba zzBossk zThe Mandalorian",1
"Tryptamine",,,124116,Mon Mothma,"zzMon Mothma, Bistan Wedge Biggs zCassian",1
"Tryptamine",1,1,78923,Ewoks,"zChirpa G9, Elder Paploo G9, Wicket Logray G9",1
"Tryptamine",1,0,152444,ShaakClones,"zzShaak Ti, zRex zEcho (501st), zzFives zARC Trooper",1
"Tryptamine",0,1,133961,BH,"zJango Fennec Shand, Dengar Krrsantan Greedo",1
"Tryptamine",1,0,121314,Troopers,"zVeers zStarck Range Trooper, zGideon zzPiett",1
"Tryptamine",0,1,85474,Phoenix,"Hera Zeb Sabine Ezra Kanan",1
"Tryptamine",0,1,96653,Geonosians Omicron,"zzGBA Sun Fac, Geo Soldier, Geo Spy, Poggle",0
"Tryptamine",1,1,98809,JTR,"JTR Scav Rey G9, BB-8 G9, zR2-D2 Finn",0
"Tryptamine",1,1,43930,NS_Alt,"MT 5* G8, AV Talia 5* G8, Daka 5* G8, Spirit 5* G8",0
"Tryptamine",1,1,84503,Carth,"zCarth Onasi, zMission zZaalbar Juhani G6, Canderous",0
"Tryptamine",1,0,124804,zMaul,"Darth Maul, zDooku zSidious Sith Empire Trooper, Sith Marauder",0
"Tryptamine",1,1,90630,Rogue1,"zJyn Chirrut 5* G8, Baze 5* G8, K-2SO G9, zzAdmiral Raddus",0
"Tryptamine",1,0,89427,EP (Counter, Rebel),"zzEP Shoretrooper 5* G8, Krennic DT 5* G8, zzWampa",0
"Tharius Dawnbreaker",,,126885,Phasma,"zPhasma zFOTP FOSFTP zFOST zKylo",1
"Tharius Dawnbreaker",1,1,162546,SL Kylo,"zzzzzzSL Kylo, zSith Trooper, zHux zzKRU zzThrawn",1
"Tharius Dawnbreaker",,,140630,SK,"zzEP zzMara Jade, The Emperor's Hand, zzStarkiller zOld Ben, zVisas",1
"Tharius Dawnbreaker",,,568689,Executor,"Executor HT RC Xanadu Blood, Slave I, IG-2000 Imperial TIE Fighter, Tie Adv",1
"Tharius Dawnbreaker",0,1,141196,padme,"zzPadme zGK zJKA zAhsoka zzzCAT",1
"Tharius Dawnbreaker",,,178180,JMLS,"zzzJKR zzJKL zzzzzzJMLS zWat Tambor, zzzzGAS",1
"Tharius Dawnbreaker",1,0,159198,CLS,"zzzCLS zHan zzChewbacca zzC-3PO zChewpio",1
"Tharius Dawnbreaker",0,1,133105,DRMalak,"zzzDR zzHK-47 zBSF zzMalak Sith Empire Trooper",1
"Tharius Dawnbreaker",1,1,105939,NS_Alt,"zzMT zzAV Talia zDaka Zombie",1
"Tharius Dawnbreaker",,,462681,HansMF,"Home One, Han's MF, Rebel Y-wing, Bistan's U-wing, Phantom Biggs X-wing, Cassian's U-wing, Wedge X-wing",1
"Tharius Dawnbreaker",1,1,130252,JTR,"zzzJTR Scav Rey, zzBB-8 zzR2-D2 zFinn",1
"Tharius Dawnbreaker",0,1,113362,Grievous,"zzGG zB2 zB1 zDroideka zDooku",1
"Tharius Dawnbreaker",1,0,89418,Traya,"zzTraya zDN zSion Sith Assassin, Nest G9",1
"Tharius Dawnbreaker",1,0,112817,Troopers,"zVeers zzPiett zGideon zDark Trooper, Range Trooper",1
