Player,Offense,Defense,GP,Name,Squad,Viable
"Whitezilla",1,1,129667,NS,"zzMT zzAV zDaka Zombie Spirit",1
"Whitezilla",1,0,152544,CLS,"zzzCLS zHan zzChewbacca zzC-3PO zChewpio",1
"Whitezilla",0,1,141388,DRMalak,"zzzDR zzHK-47 zBSF zzMalak Sith Empire Trooper",1
"Whitezilla",,,138580,Grievous Omicron,"zzGG zB2 zB1 zMagnaGuard zDroideka",1
"Whitezilla",,,530651,Negotiator,"Negotiator HT Anakin's Eta-2, Umbaran SF, Ahsoka's SF, BTL-B Y-wing, Clone Sergeant's ARC-170, Plo's SF",1
"Whitezilla",,,145422,JKL,"zzJKL zzzJKR zzHYoda zzOld Ben, Aayla",1
"Whitezilla",,,441173,HansMF,"Home One, Han's MF, Rebel Y-wing, Bistan's U-wing, Phantom Ghost Cassian's U-wing, Wedge X-wing",1
"Whitezilla",1,1,112492,JTR,"zzzJTR zzR2-D2 zzBB-8 RH Finn G9, RH Poe G9",1
"Whitezilla",1,0,150003,Traya,"zzTraya zzDN zSion zDooku zzEP",1
"Whitezilla",,,96463,Mon Mothma,"zzMon Mothma, Wedge zCara Dune, Biggs Hoth Rebel Scout",1
"Whitezilla",1,1,93857,Ewoks,"zChirpa Elder zPaploo zWicket zLogray",1
"Whitezilla",1,0,149520,ShaakClones,"zzShaak Ti, zRex zEcho (501st), zzFives zARC Trooper",1
"Whitezilla",1,1,99249,Carth,"zCarth Onasi, zMission zZaalbar zVandor Chewbacca, zCanderous",1
"Whitezilla",0,1,142568,BH,"zzBossk zZam zDengar zBoba zzJango",1
"Whitezilla",1,0,118242,Troopers,"zVeers zStarck zzPiett zDT zStormtrooper",1
"Whitezilla",0,1,104109,Phoenix,"zHera zEzra zKanan zZeb zSabine",1
"Whitezilla",0,1,99196,FO,"zzKRU zKylo zHux FOO zPhasma",1
"Whitezilla",1,1,70539,Rogue1,"Jyn G8, Chirrut Baze G8, K-2SO G8, Cassian G9",1
"Whitezilla",,,129999,Bad Batch,"zHunter zEcho zzOmega zTech zWrecker",1
"Whitezilla",1,0,120795,zMaul,"zDarth Maul, zSidious Sith Assassin, zSavage Sith Marauder",1
"Whitezilla",1,0,115581,Jawas,"Nebit Jawa Engineer, Jawa Scavenger, Jawa Dathcha",1
"Whitezilla",1,0,20268,NestSolo (Counter),"zNest",1
"Whitezilla",,,280804,Malevolence,"Malevolence Hyena Bomber 4*, Vulture Droid 4*, Sun Fac SF, Soldier SF, Spy SF",0
"Whitezilla",0,1,95440,Geonosians Omicron,"zzGBA Sun Fac, Geo Soldier, Geo Spy, Poggle",0
"Whitezilla",,,458497,Executrix,"Executrix Tie Adv, Emperor's Shuttle, TIE Reaper 4*, Imperial TIE Fighter, Gauntlet Starfighter, FOSF TIE Fighter 5*, FO TIE Fighter",0
"YodaRoy",,,180035,JMK,"zzzzzzJMK zAhsoka zzzCAT zzzzGAS zGK",1
"YodaRoy",,,379326,Profundity,"Profundity 5* Han's MF, Outrider Rebel Y-wing, Cassian's U-wing, Ghost",1
"YodaRoy",1,1,102154,NS,"zzMT zAV zDaka Zombie Spirit",1
"YodaRoy",,,539388,Executor,"Executor 5* HT RC Xanadu Blood, Slave I, IG-2000 Imperial TIE Fighter, Tie Adv",1
"YodaRoy",0,1,140871,DRMalak,"zzzDR zzHK-47 zBSF zzMalak Sith Empire Trooper",1
"YodaRoy",,,121086,Grievous Omicron,"zzGG zB2 zB1 MagnaGuard zDroideka",1
"YodaRoy",,,505449,Negotiator,"Negotiator BTL-B Y-wing, Anakin's Eta-2, Rex's ARC-170, Umbaran SF, Ahsoka's SF, Plo's SF, Clone Sergeant's ARC-170",1
"YodaRoy",,,345929,Malevolence,"Malevolence Hyena Bomber, Vulture Droid, Sun Fac SF, Soldier SF, Spy SF",1
"YodaRoy",0,1,107605,Geonosians Omicron,"zGBA Sun Fac, Geo Soldier, Geo Spy, Poggle",1
"YodaRoy",,,144296,Nute-Wat,"zNute zDooku zWat Tambor, Jango zNest",1
"YodaRoy",,,117524,Mon Mothma,"Mon Mothma, K-2SO zJyn Bistan Cassian",1
"YodaRoy",1,0,108036,CLS,"zzCLS zHan zzChewbacca Thrawn C-3PO",1
"YodaRoy",1,1,131649,Revan Offense,"zzzJKR zGMY BS zJolee zJKA",1
"YodaRoy",1,1,78134,Ewoks,"zChirpa Elder Paploo Wicket Logray",1
"YodaRoy",1,0,151326,ShaakClones,"zzShaak Ti, zRex zEcho (501st), zzFives zARC Trooper",1
"YodaRoy",0,1,142118,BH,"zzBossk zZam Dengar Boba Cad",1
"YodaRoy",1,1,84947,Carth,"zCarth Onasi, zMission Zaalbar Juhani G8, Canderous",1
"YodaRoy",1,1,121753,zEP,"zzEP zzVader Tarkin TFP zMara Jade, The Emperor's Hand 6*",1
"YodaRoy",0,1,75934,Phoenix,"Hera Chopper G8, Ezra Kanan G8, Zeb G8",1
"YodaRoy",1,0,91445,Troopers,"zVeers zPiett Gideon 5* G9, Dark Trooper, Range Trooper 5*",0
"YodaRoy",,,67834,Iden Troopers,"zIden Versio 6* G8, Shoretrooper 6* Snowtrooper Magma G9, DT 6*",0
"YodaRoy",,,115926,Bad Batch,"zHunter zEcho Omega G9, zTech zWrecker",0
"The Hawk 28",0,1,132690,padme,"zzPadme zGK zJKA zAhsoka zzC-3PO",1
"The Hawk 28",0,1,119867,DR,"zzzDR zzHK-47 zBSF Sith Assassin G8, zzThrawn",1
"The Hawk 28",,,410599,HansMF,"Home One, Han's MF, HT Bistan's U-wing, Phantom Ghost Cassian's U-wing, Wedge X-wing",1
"The Hawk 28",0,1,122793,Grievous,"zzGG zB2 zDroideka zMagnaGuard zzT3-M4",1
"The Hawk 28",1,0,104106,Traya,"zzTraya DN G9, zSion zDooku zzEP",1
"The Hawk 28",1,1,133384,Revan Offense,"zzzJKR zzGMY zBS zJolee zzHYoda",1
"The Hawk 28",1,1,97040,Ewoks,"zChirpa Elder zPaploo zWicket zLogray",1
"The Hawk 28",1,0,104099,ShaakClones,"zzShaak Ti, Rex Echo (501st), zzFives zARC Trooper G8",1
"The Hawk 28",1,1,126650,Carth,"zCarth Onasi, zMission zZaalbar zJuhani zCanderous",1
"The Hawk 28",0,1,129566,BH,"zzBossk zzEmbo Dengar G9, zBoba zzThe Mandalorian",1
"The Hawk 28",0,1,100517,BH,"zzJango Zam G9, zGreedo IG-88 Cad",1
"The Hawk 28",0,1,95551,FO,"zzKRU zKylo FOO FOTP FOE",1
"The Hawk 28",0,1,84871,Phoenix,"zHera zEzra Kanan G9, Zeb G8, zSabine",1
"The Hawk 28",1,1,66732,Rogue1,"Jyn G8, Chirrut G8, Baze G8, K-2SO G8, Cassian G8",1
"The Hawk 28",1,0,70133,Jawas,"Nebit Jawa Engineer, Jawa Scavenger G8, Jawa Dathcha G9",1
"The Hawk 28",,,424254,Negotiator,"Negotiator 6* BTL-B Y-wing 5*, Anakin's Eta-2, Rex's ARC-170, Umbaran SF, Ahsoka's SF, Plo's SF, Clone Sergeant's ARC-170",0
"The Hawk 28",1,0,100007,CLS,"zzzCLS Han zzChewbacca R2-D2 G9, Chewpio 5* G8",0
"The Hawk 28",,,247496,Malevolence,"Malevolence 6* Hyena Bomber 4*, Vulture Droid 5*, Sun Fac SF, Soldier SF, Spy SF",0
"The Hawk 28",0,1,87832,Geonosians Omicron,"zzGBA Sun Fac G9, Geo Soldier, Geo Spy G9, Poggle",0
"The Hawk 28",1,1,93342,NS,"zzMT G9, zzAV zDaka Zombie Spirit G8",0
"The Hawk 28",,,365331,Executrix,"Executrix Tie Adv, Emperor's Shuttle, TIE Reaper 4*, Imperial TIE Fighter, Gauntlet Starfighter, FOSF TIE Fighter, FO TIE Fighter",0
"The Hawk 28",1,0,58653,Troopers,"Veers G9, Piett 5* G7, Gideon G9, Dark Trooper 5* G8, Range Trooper 6* G7",0
"The Hawk 28",,,85807,Mon Mothma,"Mon Mothma 5* G8, zKyle Katarn, Cara Dune G8, Lando Hoth Rebel Scout",0
"The Hawk 28",,,66350,Iden Troopers,"Iden Versio 4* G8, zStormtrooper Snowtrooper Magma G7, DT G8",0
"The Hawk 28",1,0,74498,zMaul,"zDarth Maul, Sidious Sith Empire Trooper G7, Sith Marauder 6* G8, Nest G7",0
"The Hawk 28",,,63746,Bad Batch,"Hunter 6* G9, Echo 6* G9, Omega G9, Tech 6* G9, Wrecker G8",0
"LetTheWookieWin",,,172327,LV,"zzzzzzLord Vader, zzPiett zzVader zRG zTarkin",1
"LetTheWookieWin",,,415898,Profundity,"Profundity 6* Han's MF, Outrider Rebel Y-wing, Cassian's U-wing, Ghost",1
"LetTheWookieWin",,,572663,Executor,"Executor HT RC Xanadu Blood, Slave I, IG-2000 Imperial TIE Fighter, Tie Adv",1
"LetTheWookieWin",1,0,142391,CLS,"zzzCLS zHan zzChewbacca zzC-3PO zChewpio",1
"LetTheWookieWin",,,129396,Grievous Omicron,"zzGG zB2 zB1 MagnaGuard zDroideka",1
"LetTheWookieWin",,,480428,Negotiator,"Negotiator BTL-B Y-wing, Anakin's Eta-2, Rex's ARC-170, Umbaran SF, Ahsoka's SF, Plo's SF, Clone Sergeant's ARC-170",1
"LetTheWookieWin",,,339625,Malevolence,"Malevolence Hyena Bomber, Vulture Droid, Sun Fac SF, Soldier SF, Spy SF",1
"LetTheWookieWin",1,0,123110,Traya,"zzTraya DN zSion zDooku Thrawn",1
"LetTheWookieWin",1,1,159033,GAS,"zzzzGAS zRex zEcho (501st), zzFives zARC Trooper",1
"LetTheWookieWin",,,125511,Mon Mothma,"Mon Mothma, zK-2SO zJyn Bistan zCassian",1
"LetTheWookieWin",1,1,81618,Ewoks,"zChirpa Elder Paploo Wicket Logray",1
"LetTheWookieWin",0,1,139286,BH,"zzBossk zZam Dengar Boba Cad",1
"LetTheWookieWin",0,1,78749,Phoenix,"Hera Chopper G9, Ezra G9, Kanan G8, Zeb G8",1
"LetTheWookieWin",1,0,121756,QGJ,"zQGJ Aayla zJKA zGK zAhsoka",1
"LetTheWookieWin",0,1,110208,Geonosians Omicron,"zzGBA Sun Fac, Geo Soldier, Geo Spy, Poggle",0
"LetTheWookieWin",1,1,68866,NS,"MT G6, AV Daka G7, Zombie Spirit G7",0
"LetTheWookieWin",1,1,71692,Carth,"Carth Onasi, Mission G7, Zaalbar G7, Juhani Canderous",0
"LetTheWookieWin",1,0,87251,Troopers,"Veers Starck Gideon G9, Snowtrooper G8, zIden Versio G6",0
"LetTheWookieWin",0,1,102133,BH,"Jango Embo IG-88 Greef G9, The Mandalorian G9",0
"LetTheWookieWin",,,111267,Bad Batch,"zHunter zEcho Omega 6* G6, zTech zWrecker",0
"LetTheWookieWin",,,100846,Mando,"zzThe Mandalorian (Beskar Armor), zDash Rendar, Nest G7, IG-11 G9, Kuiil G9",0
"Drakorhuin",1,0,140751,CLS,"zzzCLS zHan zzChewbacca zC-3PO zChewpio",1
"Drakorhuin",,,489833,Negotiator,"Negotiator BTL-B Y-wing, Anakin's Eta-2, Rex's ARC-170, Umbaran SF, Ahsoka's SF, Plo's SF, Clone Sergeant's ARC-170",1
"Drakorhuin",,,342232,Malevolence,"Malevolence Hyena Bomber, Vulture Droid, Sun Fac SF, Soldier SF, Spy SF",1
"Drakorhuin",,,366405,HansMF,"Home One, Han's MF, Rebel Y-wing, Bistan's U-wing, Phantom Ghost Cassian's U-wing, Wedge X-wing",1
"Drakorhuin",0,1,127432,Grievous-Wat,"zzGG zB2 zB1 zMagnaGuard zWat Tambor",1
"Drakorhuin",1,1,161478,GAS,"zzzzGAS zRex zEcho (501st), zzFives zARC Trooper",1
"Drakorhuin",1,1,89368,Ewoks,"zChirpa Elder Paploo zWicket Logray",1
"Drakorhuin",0,1,136303,BH,"zzBossk zZam zDengar Boba zJango",1
"Drakorhuin",1,1,122712,zEP,"zzEP zzzVader Tarkin Krennic TFP G8",1
"Drakorhuin",1,0,128706,Troopers,"zVeers zStarck zGideon Range Trooper, zzPiett",1
"Drakorhuin",0,1,84572,Phoenix,"Hera Chopper zEzra Kanan Zeb G8",1
"Drakorhuin",1,1,60837,Rogue1,"Jyn G8, Chirrut G8, Baze G8, K-2SO G8, Cassian G8",1
"Drakorhuin",1,0,16254,NestSolo (Counter),"Nest",1
"Drakorhuin",,,55241,Phasma,"Phasma G8, FOTP G7, FOSFTP G7, FOST 6* G8, Kylo G8",0
"Drakorhuin",1,1,95048,NS,"zzMT zAV zDaka Zombie Spirit G8",0
"Drakorhuin",0,1,124072,Geonosians Omicron,"zzGBA Sun Fac, Geo Soldier, Geo Spy, Poggle",0
"Drakorhuin",1,0,90092,Traya,"Traya G8, DN G8, Sion 5* G7, zDooku zThrawn",0
"Drakorhuin",,,375730,Executrix,"Executrix Tie Adv, Emperor's Shuttle, TIE Reaper 4*, Imperial TIE Fighter, Gauntlet Starfighter, FOSF TIE Fighter, FO TIE Fighter",0
"Drakorhuin",,,54717,Mon Mothma,"Mon Mothma 5* G8, Wedge G8, Cara Dune 6* G8, Biggs G8, Hoth Rebel Scout G8",0
"Drakorhuin",1,1,54967,Carth,"Carth Onasi 6*, Mission G7, Zaalbar 5* G7, Juhani 5* G7, Canderous G7",0
"Drakorhuin",,,73120,Iden Troopers,"zIden Versio, Shoretrooper G9, Snowtrooper G8, Magma G7, DT G9",0
"Drakorhuin",0,1,107441,BS,"BS GMY Jolee zGK zJKA",0
"Bradshoe02",,,122967,Phasma,"zPhasma zFOTP FOSFTP zFOST zKylo",1
"Bradshoe02",1,1,163977,SL Kylo,"zzzzzzSL Kylo, zSith Trooper, zHux zzKRU zThrawn",1
"Bradshoe02",,,155339,SEE,"zzzzzzSEE zBSF zzMalak G9, zzzDR zzzVader",1
"Bradshoe02",0,1,138774,padme,"zzPadme zGK zJKA zAhsoka zzzCAT",1
"Bradshoe02",,,176948,JMLS,"zzzJKR zzJKL zzzzzzJMLS zzHYoda zzzzGAS",1
"Bradshoe02",1,0,145799,CLS,"zzzCLS zHan zzChewbacca zzC-3PO zChewpio",1
"Bradshoe02",,,123495,Grievous Omicron,"zzGG zB2 zB1 MagnaGuard zDroideka",1
"Bradshoe02",,,475786,Negotiator,"Negotiator HT Anakin's Eta-2, Umbaran SF, Ahsoka's SF, Clone Sergeant's ARC-170, Plo's SF, Rex's ARC-170",1
"Bradshoe02",1,0,109675,Traya,"zzTraya zDN zSion zzEP Sith Empire Trooper",1
"Bradshoe02",1,1,123237,JTR,"zzzJTR Scav Rey G8, BB-8 zR2-D2 zFinn",1
"Bradshoe02",,,110452,Mon Mothma,"zzMon Mothma, Wedge Cara Dune, Biggs Lando",1
"Bradshoe02",1,0,124711,ShaakClones,"zzShaak Ti, zRex zEcho (501st), zzFives zARC Trooper",1
"Bradshoe02",1,1,84174,Ewoks,"zChirpa Elder Paploo Scout Logray",1
"Bradshoe02",0,1,129947,BH,"zzBossk Dengar IG-88 zBoba zzGreef",1
"Bradshoe02",1,1,87220,Carth,"Carth Onasi, Mission Zaalbar Juhani Canderous",1
"Bradshoe02",1,0,126831,Troopers,"zVeers zStarck Range Trooper, zDark Trooper, zzPiett",1
"Bradshoe02",0,1,80025,Phoenix,"Hera G9, Chopper G9, zEzra zKanan Zeb G9",1
"Bradshoe02",0,1,93458,Geonosians Omicron,"zzGBA Sun Fac, Geo Soldier, Geo Spy, Poggle",0
"Bradshoe02",,,351922,HansMF,"Home One, Han's MF, Rebel Y-wing, Bistan's U-wing 5*, Phantom Biggs X-wing, Cassian's U-wing, Wedge X-wing",0
"Bradshoe02",1,1,60282,NS_Alt,"AV Daka G9, Talia G8, Zombie G8, Spirit G8",0
"Bradshoe02",1,0,111796,zMaul,"Darth Maul, zSidious zDooku Sith Marauder, Nest G1",0
"KLUTCHxPLAGUEIS",,,186260,SEE,"zzzzzzSEE zBSF zzMalak zzzDR zzzVader",1
"KLUTCHxPLAGUEIS",,,597272,Executor,"Executor HT RC Xanadu Blood, Slave I, IG-2000 Imperial TIE Fighter, Tie Adv",1
"KLUTCHxPLAGUEIS",,,132908,Grievous Omicron,"zzGG zB2 zB1 zMagnaGuard zDroideka",1
"KLUTCHxPLAGUEIS",0,1,125239,padme,"zzPadme zGK JKA zAhsoka zC-3PO",1
"KLUTCHxPLAGUEIS",,,342858,Malevolence,"Malevolence Hyena Bomber, Vulture Droid, Sun Fac SF, Soldier SF, Spy SF",1
"KLUTCHxPLAGUEIS",1,0,112545,Traya,"zzTraya DN G9, Sion G9, Sith Empire Trooper, zzThrawn",1
"KLUTCHxPLAGUEIS",,,148533,Disintegration,"zzAurra zzGreef zBoba zzBossk zzThe Mandalorian",1
"KLUTCHxPLAGUEIS",1,1,158253,GAS,"zzzzGAS zRex zEcho (501st), zzFives zARC Trooper",1
"KLUTCHxPLAGUEIS",1,1,103033,Revan Offense,"zzzJKR GMY BS zJolee zzHYoda G8",1
"KLUTCHxPLAGUEIS",1,1,81390,Ewoks,"zChirpa Elder Paploo Wicket Logray",1
"KLUTCHxPLAGUEIS",1,1,93942,Carth,"Carth Onasi, zMission Zaalbar Juhani zCanderous",1
"KLUTCHxPLAGUEIS",1,0,137261,Troopers,"zVeers zStarck zzGideon zDark Trooper, zzPiett",1
"KLUTCHxPLAGUEIS",0,1,59176,Phoenix,"Hera G8, Ezra G8, Kanan G8, Zeb G8, Sabine G8",1
"KLUTCHxPLAGUEIS",1,0,122451,zMaul,"zDarth Maul, zDooku zSidious Sith Assassin, zSavage",1
"KLUTCHxPLAGUEIS",1,1,59279,Rogue1,"Jyn G8, Chirrut G8, Baze G8, K-2SO G8, Cassian G8",1
"KLUTCHxPLAGUEIS",1,0,106572,EP (Counter, Rebel),"zzEP Shoretrooper G8, Krennic DT G8, zzWampa",1
"KLUTCHxPLAGUEIS",1,0,13284,NestSolo (Counter),"Nest G8",1
"KLUTCHxPLAGUEIS",,,63683,Phasma,"Phasma G8, FOTP G9, FOSFTP G7, FOST G8, Kylo G8",0
"KLUTCHxPLAGUEIS",,,451175,Negotiator,"Negotiator 6* BTL-B Y-wing 5*, Anakin's Eta-2, Rex's ARC-170, Umbaran SF, Ahsoka's SF, Plo's SF, Clone Sergeant's ARC-170",0
"KLUTCHxPLAGUEIS",0,1,113793,Geonosians Omicron,"zzGBA Sun Fac, Geo Soldier, Geo Spy, Poggle",0
"KLUTCHxPLAGUEIS",,,262606,HansMF,"Home One, Han's MF, Biggs X-wing, Bistan's U-wing 5*, Phantom Ghost Cassian's U-wing, Wedge X-wing",0
"KLUTCHxPLAGUEIS",1,1,66974,NS,"MT G8, AV Daka Zombie G7, Spirit G8",0
"KLUTCHxPLAGUEIS",1,0,62376,Wiggs,"Wedge G8, Biggs G8, Han G9, Chewbacca G6, Leia G8",0
"KLUTCHxPLAGUEIS",0,1,132092,BH,"zJango zZam Dengar zIG-88 Cad",0
"JAXDEN",,,190766,JMK,"zzzzzzJMK zAhsoka zzzCAT zzzzGAS zGK",1
"JAXDEN",,,182527,LV,"zzzzzzLord Vader, zzPiett zzzMaul zRG zzzVader",1
"JAXDEN",,,125687,Phasma,"zPhasma FOTP FOSFTP zFOST zKylo",1
"JAXDEN",1,1,171202,SL Kylo,"zzzzzzSL Kylo, zSith Trooper, zHux zzKRU zzThrawn",1
"JAXDEN",,,182390,SEE,"zzzzzzSEE zBSF zzMalak zzzDR zDooku",1
"JAXDEN",1,1,171813,GL Rey,"zzzzzzRey zzzJTR zzBB-8 zRH Poe, zRH Finn",1
"JAXDEN",1,1,106251,NS,"zzMT zzAV zDaka Zombie Spirit",1
"JAXDEN",,,575123,Executor,"Executor 5* HT RC Xanadu Blood, Slave I, IG-2000 Imperial TIE Fighter, Tie Adv",1
"JAXDEN",,,169895,JMLS,"zBS zzzzzzJMLS zWat Tambor, zzJKL zJolee",1
"JAXDEN",1,0,148912,CLS,"zzzCLS zHan zzChewbacca zzC-3PO zChewpio",1
"JAXDEN",,,528678,Negotiator,"Negotiator BTL-B Y-wing, Anakin's Eta-2, Rex's ARC-170, Umbaran SF, Ahsoka's SF, Plo's SF, Clone Sergeant's ARC-170",1
"JAXDEN",,,398462,HansMF,"Home One, Han's MF, Rebel Y-wing, Bistan's U-wing, Phantom Biggs X-wing, Cassian's U-wing, Wedge X-wing",1
"JAXDEN",0,1,142153,Grievous,"zzGG zB2 zB1 zMagnaGuard zNute",1
"JAXDEN",1,0,127504,Traya,"zzTraya zDN zSion zzEP Sith Empire Trooper",1
"JAXDEN",,,109730,Mon Mothma,"zzMon Mothma, Pao Wedge Biggs Lando",1
"JAXDEN",1,1,88722,Ewoks,"zChirpa Elder Paploo Wicket Logray",1
"JAXDEN",1,0,154736,ShaakClones,"zzShaak Ti, zRex zEcho (501st), zzFives zARC Trooper",1
"JAXDEN",0,1,153243,BH,"zzBossk zZam zDengar zBoba zzJango",1
"JAXDEN",1,1,102996,Carth,"zCarth Onasi, zMission Zaalbar zJuhani Canderous",1
"JAXDEN",0,1,84238,Phoenix,"Hera G9, zEzra Kanan Zeb G8, Sabine",1
"JAXDEN",1,0,23658,NestSolo (Counter),"zNest",1
"JAXDEN",0,1,98291,Geonosians Omicron,"zzGBA Sun Fac, Geo Soldier, Geo Spy, Poggle",0
"JAXDEN",1,0,88582,Troopers,"Veers Starck zDark Trooper 5* G9, DT Stormtrooper",0
"JAXDEN",,,122177,Bad Batch,"zHunter zEcho zzOmega G9, zTech zWrecker",0
"JAXDEN",1,1,52870,Rogue1,"Jyn G6, Chirrut G1, Baze G7, Cassian G3, Bodhi Rook G7",0
"JAXDEN",1,0,67325,Jawas,"Nebit G8, Jawa Engineer G8, Jawa Scavenger G7, Jawa Dathcha G7",0
"FrogMan",1,1,164614,SL Kylo,"zzzzzzSL Kylo, zSith Trooper, zHux zzKRU zzThrawn",1
"FrogMan",0,1,129317,padme,"zzPadme zGK zJKA zAhsoka zzC-3PO",1
"FrogMan",0,1,123400,DRMalak,"zzzDR zzHK-47 zBSF zzMalak Sith Empire Trooper G8",1
"FrogMan",1,1,97552,NS_Alt,"zzMT zzAV zDaka Talia Zombie",1
"FrogMan",0,1,126872,Grievous-Wat,"zzGG zB2 zB1 zMagnaGuard zWat Tambor",1
"FrogMan",1,1,111966,JTR,"zzzJTR zScav Rey, zzBB-8 zzR2-D2 zFinn",1
"FrogMan",,,112173,Nute-OR,"zNute zDooku zzJango zZaalbar zMission",1
"FrogMan",1,1,137234,Revan Offense,"zzzJKR zzGMY zBS zJolee zzHYoda",1
"FrogMan",1,1,91383,Ewoks,"zChirpa Elder zPaploo zWicket zLogray",1
"FrogMan",1,0,138111,ShaakClones,"zzShaak Ti, zRex zEcho (501st), zzFives zARC Trooper",1
"FrogMan",0,1,114991,BH,"zzBossk zDengar zBoba Cad zzThe Mandalorian",1
"FrogMan",1,1,118634,zEP,"zzEP zzzVader zzTarkin TFP G9, zzTraya",1
"FrogMan",1,0,118942,CLS,"zzzCLS zHan zLeia zzOld Ben, zzChewbacca",1
"FrogMan",0,1,83958,Phoenix,"zHera Ezra zKanan zZeb Sabine",1
"FrogMan",1,1,72303,Rogue1,"zJyn G8, Chirrut G8, Baze G8, K-2SO G8, Cassian G9",1
"FrogMan",1,0,66502,Jawas,"Nebit G8, Jawa Engineer G9, Jawa Scavenger G8, Jawa G9, Dathcha G9",1
"FrogMan",,,123234,Phasma,"zPhasma zFOTP FOSFTP zFOST zKylo",0
"FrogMan",,,433687,Negotiator,"Negotiator BTL-B Y-wing 2*, Anakin's Eta-2 3*, Rex's ARC-170, Umbaran SF, Ahsoka's SF, Plo's SF, Clone Sergeant's ARC-170",0
"FrogMan",0,1,95693,Geonosians Omicron,"zzGBA Sun Fac, Geo Soldier, Geo Spy, Poggle",0
"FrogMan",,,84521,Mon Mothma,"zzMon Mothma 5*, Wedge G9, zCara Dune 6*, Biggs Lando",0
"FrogMan",,,50151,Iden Troopers,"Iden Versio 3* G6, Stormtrooper G8, Snowtrooper G9, Magma G7, DT 5* G7",0
"FrogMan",1,0,68031,Troopers,"Veers G9, Starck G7, zzGideon 6* Range Trooper 6* G9, Shoretrooper 6* G8",0
"FrogMan",1,0,13756,SionSolo (Counter),"Sion G7",0
"FrogMan",1,0,8137,NestSolo (Counter),"Nest 4* G7",0
"Tryptamine",,,179401,JMK,"zzzzzzJMK zAhsoka zzzCAT zzzzGAS zGK",1
"Tryptamine",,,120218,Phasma,"zPhasma zFOTP FOSFTP FOST zKylo",1
"Tryptamine",,,422806,Profundity,"Profundity 6* Han's MF, Outrider Rebel Y-wing, Cassian's U-wing, Ghost",1
"Tryptamine",1,1,161422,SL Kylo,"zzzzzzSL Kylo, zSith Trooper, zHux zzKRU zThrawn",1
"Tryptamine",,,179520,SEE,"zzzzzzSEE zBSF zzMalak zzzDR zzVader",1
"Tryptamine",,,567775,Executor,"Executor HT RC Xanadu Blood, Slave I, IG-2000 Imperial TIE Fighter, Tie Adv",1
"Tryptamine",1,0,149092,CLS,"zzzCLS zHan zzChewbacca zC-3PO zChewpio",1
"Tryptamine",,,513569,Negotiator,"Negotiator BTL-B Y-wing, Anakin's Eta-2, Rex's ARC-170, Umbaran SF, Ahsoka's SF, Plo's SF, Clone Sergeant's ARC-170",1
"Tryptamine",,,306140,Malevolence,"Malevolence Hyena Bomber, Vulture Droid, Sun Fac SF, Soldier SF, Spy SF",1
"Tryptamine",,,136258,JKL,"zzJKL zzzJKR zHYoda zOld Ben, Aayla",1
"Tryptamine",0,1,125838,Grievous,"zzGG zB2 zB1 MagnaGuard zNute",1
"Tryptamine",,,129930,Disintegration,"Aurra zGreef zBoba zzBossk zThe Mandalorian",1
"Tryptamine",,,124116,Mon Mothma,"zzMon Mothma, Wedge Bistan zCassian Biggs",1
"Tryptamine",1,1,78923,Ewoks,"zChirpa G9, Elder Paploo G9, Wicket Logray G9",1
"Tryptamine",1,0,152444,ShaakClones,"zzShaak Ti, zRex zEcho (501st), zzFives zARC Trooper",1
"Tryptamine",0,1,127675,BH,"zJango Dengar Greedo Fennec Shand, Cad",1
"Tryptamine",1,0,121314,Troopers,"zVeers zStarck zGideon Range Trooper, zzPiett",1
"Tryptamine",0,1,85746,Phoenix,"Hera Ezra Kanan Zeb Sabine",1
"Tryptamine",0,1,96653,Geonosians Omicron,"zzGBA Sun Fac, Geo Soldier, Geo Spy, Poggle",0
"Tryptamine",1,1,98809,JTR,"JTR Scav Rey G9, BB-8 G9, zR2-D2 Finn",0
"Tryptamine",1,1,43930,NS_Alt,"MT 5* G8, AV Daka 5* G8, Talia 5* G8, Spirit 5* G8",0
"Tryptamine",1,1,84503,Carth,"zCarth Onasi, zMission zZaalbar Juhani G6, Canderous",0
"Tryptamine",1,0,124804,zMaul,"Darth Maul, zDooku zSidious Sith Empire Trooper, Sith Marauder",0
"Tryptamine",1,1,90630,Rogue1,"zJyn Chirrut 5* G8, Baze 5* G8, K-2SO G9, zzAdmiral Raddus",0
"Tryptamine",1,0,89427,EP (Counter, Rebel),"zzEP Krennic DT 5* G8, zzWampa Stormtrooper 5* G8",0
"Beats4dayz",,,192135,JMK,"zzzzzzJMK zAhsoka zzzCAT zzzzGAS zGK",1
"Beats4dayz",1,1,114924,NS,"zzMT zzAV zDaka Zombie Spirit",1
"Beats4dayz",,,163387,JMLS,"zBS zzzzzzJMLS zWat Tambor, zzJKL zJolee",1
"Beats4dayz",1,0,152013,CLS,"zzzCLS zHan zzChewbacca zzC-3PO zChewpio",1
"Beats4dayz",0,1,147688,DRMalak,"zzzDR zzHK-47 zBSF zzMalak Sith Empire Trooper",1
"Beats4dayz",,,430917,HansMF,"Home One, Han's MF, Rebel Y-wing 6*, Bistan's U-wing, Phantom Biggs X-wing, Cassian's U-wing, Wedge X-wing",1
"Beats4dayz",,,521023,Negotiator,"Negotiator 6* HT Anakin's Eta-2, Umbaran SF, Ahsoka's SF, Clone Sergeant's ARC-170, Plo's SF, Rex's ARC-170",1
"Beats4dayz",0,1,131365,Grievous,"zzGG zB2 zB1 zMagnaGuard zNute",1
"Beats4dayz",1,0,124221,Traya,"zzTraya zzDN zSion zDooku zzThrawn",1
"Beats4dayz",1,1,125384,JTR,"zzzJTR zScav Rey, zzBB-8 zzR2-D2 RT",1
"Beats4dayz",,,109809,Mon Mothma,"zzMon Mothma, zPao Wedge zCara Dune, Biggs",1
"Beats4dayz",1,0,101776,Troopers,"zVeers zzPiett zGideon zDark Trooper, Range Trooper",1
"Beats4dayz",1,1,97472,Ewoks,"zChirpa Elder zPaploo zWicket zLogray",1
"Beats4dayz",1,0,122709,ShaakClones,"zzShaak Ti, zRex zEcho (501st), zzFives zARC Trooper",1
"Beats4dayz",0,1,145701,BH,"zzBossk zDengar zFennec Shand, zBoba zzJango",1
"Beats4dayz",1,1,106343,Carth,"zCarth Onasi, zMission zZaalbar zJuhani zCanderous",1
"Beats4dayz",1,1,111156,zEP,"zzEP zzzVader zzTarkin zDT IPD G8",1
"Beats4dayz",0,1,104228,FO,"zzKRU zKylo zHux FOO FOE",1
"Beats4dayz",0,1,86079,Phoenix,"zHera Chopper zEzra zKanan G8, Zeb G8",1
"Beats4dayz",1,1,79800,Rogue1,"Jyn G9, Chirrut Baze G8, zK-2SO Cassian G8",1
"Beats4dayz",1,0,84568,Jawas,"Nebit G9, Jawa Engineer, Jawa Scavenger, Jawa Dathcha",1
"Beats4dayz",1,0,70049,QiraNest,"zQira zNest zzHYoda",1
"Beats4dayz",0,1,112351,Geonosians Omicron,"zzGBA Sun Fac, Geo Soldier, Geo Spy, Poggle",0
"Raiders",,,184314,JMK,"zzzzzzJMK zAhsoka zzzCAT zzzzGAS zGK",1
"Raiders",,,171550,LV,"zzzzzzLord Vader, zzPiett zzzVader zRG zzTarkin",1
"Raiders",,,123211,Phasma,"zPhasma zFOTP FOSFTP zFOST zKylo",1
"Raiders",1,1,167310,SL Kylo,"zzzzzzSL Kylo, zSith Trooper, zHux zzKRU zzThrawn",1
"Raiders",,,173886,SEE,"zzzzzzSEE zBSF zzMalak zzzDR zDooku",1
"Raiders",1,1,128865,NS,"zzMT zzAV zDaka Zombie Spirit",1
"Raiders",,,583726,Executor,"Executor 5* HT RC Xanadu Blood, Slave I, IG-2000 Imperial TIE Fighter, Tie Adv",1
"Raiders",,,163487,JMLS,"zBS zzzzzzJMLS zWat Tambor, zzJKL zJolee",1
"Raiders",1,0,147599,CLS,"zzzCLS zHan zzChewbacca zzC-3PO zChewpio",1
"Raiders",,,498493,Negotiator,"Negotiator BTL-B Y-wing, Anakin's Eta-2, Rex's ARC-170, Umbaran SF, Ahsoka's SF, Plo's SF, Clone Sergeant's ARC-170",1
"Raiders",,,315215,Malevolence,"Malevolence Hyena Bomber, Vulture Droid, Sun Fac SF, Soldier SF, Spy SF",1
"Raiders",0,1,139869,Grievous,"zzGG zB2 zB1 zMagnaGuard zNute",1
"Raiders",1,0,139821,Traya,"zzTraya zzDN zSion zzEP Sith Empire Trooper",1
"Raiders",1,1,134126,JTR,"zzzJTR zScav Rey, zzBB-8 zzR2-D2 RT",1
"Raiders",,,111353,Mon Mothma,"zzMon Mothma, zPao Wedge Biggs Lando",1
"Raiders",1,1,98779,Ewoks,"zChirpa Elder zPaploo zWicket zLogray",1
"Raiders",1,0,153885,ShaakClones,"zzShaak Ti, zRex zEcho (501st), zzFives zARC Trooper",1
"Raiders",0,1,159520,BH,"zzBossk zZam zDengar zBoba zzJango",1
"Raiders",1,1,102435,Carth,"zCarth Onasi, zMission zZaalbar zJuhani zCanderous",1
"Raiders",1,0,128643,Troopers,"zVeers zStarck zzGideon zDark Trooper, zDT",1
"Raiders",0,1,77721,Phoenix,"Hera Ezra Kanan G8, Zeb Sabine G9",1
"Raiders",1,0,73577,QiraNest,"zQira zNest zzHYoda",1
"Raiders",0,1,103391,Geonosians Omicron,"zzGBA Sun Fac, Geo Soldier, Geo Spy, Poggle",0
"Raiders",,,399520,HansMF,"Home One, Han's MF, Rebel Y-wing 6*, Bistan's U-wing, Phantom Biggs X-wing, Cassian's U-wing, Wedge X-wing",0
"Raiders",,,120850,Bad Batch,"zHunter zEcho zzOmega G9, zTech zWrecker",0
"TheyCallMeMrB",0,1,140415,padme,"zzPadme zGK zJKA zAhsoka zzC-3PO",1
"TheyCallMeMrB",,,386121,Negotiator,"Negotiator HT Anakin's Eta-2, Umbaran SF, Ahsoka's SF, Clone Sergeant's ARC-170, Jedi Consular's Starfighter, Plo's SF",1
"TheyCallMeMrB",,,330151,HansMF,"Home One, Han's MF, Biggs X-wing, Bistan's U-wing, Phantom Ghost Cassian's U-wing, Wedge X-wing",1
"TheyCallMeMrB",0,1,99749,DR,"zzzDR zzHK-47 zBSF Sith Marauder G9, Thrawn G8",1
"TheyCallMeMrB",0,1,104718,Grievous,"zzGG B2 B1 Droideka zIG-88",1
"TheyCallMeMrB",1,1,109679,Ewoks,"zChirpa Elder zPaploo zWicket zLogray",1
"TheyCallMeMrB",0,1,134471,BH,"zzBossk zDengar zBoba Greef Cad",1
"TheyCallMeMrB",1,1,104955,Carth,"zCarth Onasi, zMission zZaalbar zJuhani zCanderous",1
"TheyCallMeMrB",1,1,135732,zEP,"zzEP zzzVader Tarkin TFP zzMara Jade, The Emperor's Hand",1
"TheyCallMeMrB",0,1,112912,FO,"zzKRU zKylo FOO Phasma FOE",1
"TheyCallMeMrB",0,1,101337,Phoenix,"zHera Chopper zEzra Kanan Zeb",1
"TheyCallMeMrB",0,1,139693,Geonosians Omicron,"zzGBA Sun Fac, Geo Soldier, Geo Spy, Poggle",0
"TheyCallMeMrB",,,73140,Nute-Wat,"Nute G3, Dooku Wat Tambor G8, zzJango Nest G7",0
"TheyCallMeMrB",1,1,50306,NS,"MT G8, AV G9, Daka G2, Zombie G2, Spirit G4",0
"TheyCallMeMrB",1,1,100022,Revan Offense,"zzzJKR GMY G7, zBS zJolee HYoda G7",0
"TheyCallMeMrB",1,0,38470,ShaakClones,"Shaak Ti G1, Rex G1, Echo (501st) G1, Fives G1, Clone Sergeant G9",0
"TheyCallMeMrB",1,0,91784,CLS,"zzzCLS zHan Wedge Biggs G6, Chewbacca",0
"TheyCallMeMrB",1,0,76855,Troopers,"Veers G7, Starck G7, Gideon G7, Snowtrooper G7, zzPiett",0
"Enterthez",1,1,168761,GL Rey,"zzzzzzRey zGK zzzJTR zRH Poe, zRH Finn",1
"Enterthez",,,170172,JMLS,"zzzJKR zzJKL zzzzzzJMLS zWat Tambor, zzzzGAS",1
"Enterthez",1,0,144263,CLS,"zzzCLS zHan zzChewbacca zzC-3PO zChewpio",1
