Player,Offense,Defense,GP,Name,Squad,Viable
"DaveSkywalker",1,1,119749,JTR,"zzzJTR Scav Rey, zBB-8 zzR2-D2 zFinn",1
"DaveSkywalker",,,104782,Mon Mothma,"zzMon Mothma, Wedge Cara Dune, Pao Biggs",1
"DaveSkywalker",1,0,140125,ShaakClones,"zzShaak Ti, zRex zEcho (501st), zzFives zARC Trooper",1
"DaveSkywalker",0,1,121378,BH,"zzBossk Jango Dengar G9, Cad zBoba",1
"DaveSkywalker",1,1,90910,Carth,"Carth Onasi, Mission Zaalbar Juhani Canderous",1
"DaveSkywalker",1,1,87535,Ewoks,"zChirpa Elder zPaploo Teebo Scout",1
"DaveSkywalker",0,1,68075,Phoenix,"Hera G8, Zeb G8, Chopper G8, Ezra Kanan G8",1
"DaveSkywalker",,,61049,Phasma,"Phasma G7, FOTP G9, FOO G8, KRU G8, Kylo G7",0
"DaveSkywalker",1,1,66764,NS,"MT G7, zzAV Daka G3, Zombie G8, Spirit G2",0
"DaveSkywalker",1,0,93665,Troopers,"zVeers zStarck Magma G6, Stormtrooper G7, Piett",0
"DaveSkywalker",1,0,97765,EP (Counter, Rebel),"zzEP Shoretrooper 6* G2, Krennic DT 6* G5, zWampa",0
"shausrath",,,123701,Phasma,"zPhasma zFOTP FOSFTP zFOST zKylo",1
"shausrath",1,1,167106,SL Kylo,"zzzzzzSL Kylo, zSith Trooper, zHux zzKRU zzThrawn",1
"shausrath",,,421737,Negotiator,"Negotiator 5* BTL-B Y-wing, Anakin's Eta-2, Rex's ARC-170, Umbaran SF, Ahsoka's SF, Plo's SF, Clone Sergeant's ARC-170",1
"shausrath",0,1,95692,Geonosians Omicron,"zzGBA Sun Fac, Geo Soldier, Geo Spy, Poggle",1
"shausrath",,,304248,HansMF,"Home One, Han's MF 5*, Rebel Y-wing, Bistan's U-wing, Phantom Ghost Cassian's U-wing, Biggs X-wing",1
"shausrath",1,1,113167,JTR,"zzzJTR R2-D2 zzBB-8 zRH Finn, RH Poe",1
"shausrath",1,1,99693,Ewoks,"zChirpa Elder zPaploo zWicket zLogray",1
"shausrath",1,0,134449,ShaakClones,"zzShaak Ti, zRex zEcho (501st), zzFives zARC Trooper",1
"shausrath",0,1,87443,BH,"zzBossk Dengar G8, Cad Greef Boba G9",1
"shausrath",1,1,135753,zEP,"zzEP zzzVader zzTarkin zKrennic TFP",1
"shausrath",0,1,76520,Phoenix,"Hera Zeb G8, Chopper Ezra Kanan G8",1
"shausrath",1,0,14320,SionSolo (Counter),"Sion G9",1
"shausrath",0,1,101431,padme,"Padme G7, zGK zJKA zAhsoka C-3PO",0
"shausrath",0,1,86969,Grievous,"GG B2 G8, zDooku T3-M4 L3-37",0
"shausrath",1,1,65699,NS,"MT G8, zAV Daka Zombie G8, Spirit G8",0
"shausrath",,,423445,Executrix,"Executrix Tie Adv, Emperor's Shuttle 6*, TIE Reaper 3*, Imperial TIE Fighter, Gauntlet Starfighter, FOSF TIE Fighter, FO TIE Fighter",0
"shausrath",1,1,71112,Revan Offense,"JKR G7, GMY G9, BS Jolee HYoda G7",0
"shausrath",1,0,100318,Troopers,"zVeers zStarck Iden Versio G8, Dark Trooper 6* G7, zzPiett",0
"shausrath",1,0,56000,Wiggs,"Wedge G8, Biggs G9, Han Fulcrum G5, Leia G5",0
"shausrath",0,1,65976,BH,"Jango G8, Greedo G7, The Mandalorian, Zam G7, IG-88 G8",0
"LegistheBEAST",,,176208,JMK,"zzzzzzJMK zAhsoka zzzCAT zzzzGAS zGK",1
"LegistheBEAST",,,147561,SK,"zzEP zzMara Jade, The Emperor's Hand, zzStarkiller zJuhani zVisas",1
"LegistheBEAST",1,1,162729,SL Kylo,"zzzzzzSL Kylo, zSith Trooper, zHux zzKRU zThrawn",1
"LegistheBEAST",1,1,91058,NS,"zzMT zAV Daka Zombie Spirit",1
"LegistheBEAST",1,0,144522,CLS,"zzzCLS zHan zzChewbacca zC-3PO zChewpio",1
"LegistheBEAST",0,1,122789,DRMalak,"zzzDR zzHK-47 zBSF zzMalak 6* Sith Empire Trooper",1
"LegistheBEAST",,,507679,Negotiator,"Negotiator HT Anakin's Eta-2, Umbaran SF, Ahsoka's SF, BTL-B Y-wing 6*, Clone Sergeant's ARC-170, Plo's SF",1
"LegistheBEAST",,,144646,JKL,"zzJKL zzzJKR zzHYoda zzOld Ben, zBarriss",1
"LegistheBEAST",,,390273,HansMF,"Home One, Han's MF, Rebel Y-wing, Bistan's U-wing, Phantom Biggs X-wing, Cassian's U-wing, Wedge X-wing",1
"LegistheBEAST",0,1,133849,Grievous-Wat,"zzGG zB2 zB1 zMagnaGuard zWat Tambor",1
"LegistheBEAST",1,1,113972,JTR,"zzzJTR Scav Rey, zBB-8 G9, zzR2-D2 Finn G9",1
"LegistheBEAST",1,0,120532,Traya,"zzTraya zDN zSion zDooku Nest",1
"LegistheBEAST",1,0,128088,Troopers,"zVeers zzPiett zGideon zDark Trooper, Range Trooper",1
"LegistheBEAST",,,107281,Mon Mothma,"zzMon Mothma, Wedge zPao Biggs Hoth Rebel Scout",1
"LegistheBEAST",,,121292,Disintegration,"Aurra zGreef zBoba zzBossk zThe Mandalorian",1
"LegistheBEAST",1,1,73405,Ewoks,"zChirpa G9, Elder Paploo Wicket Logray G9",1
"LegistheBEAST",1,0,138347,ShaakClones,"zzShaak Ti, zRex zEcho (501st), zzFives zARC Trooper",1
"LegistheBEAST",1,1,92570,Carth,"zCarth Onasi, Mission zZaalbar zVandor Chewbacca, Canderous",1
"LegistheBEAST",0,1,128451,BH,"zzJango zDengar Cad Zam zIG-88",1
"LegistheBEAST",,,95478,Iden Troopers,"zIden Versio, zStormtrooper Snowtrooper Magma DT",1
"LegistheBEAST",0,1,64766,Phoenix,"Hera G8, Sabine G8, Chopper Ezra G8, Kanan G8",1
"LegistheBEAST",,,132104,Bad Batch,"zHunter zEcho zzOmega zTech zWrecker",1
"LegistheBEAST",,,120953,Phasma,"Phasma zFOTP FOSFTP zFOST zKylo",0
"LegistheBEAST",,,47048,Admiral Raddus,"Admiral Raddus 6* G8, Cassian G6, Jyn G6, K-2SO G7, Bistan G6",0
"LegistheBEAST",,,269314,Malevolence,"Malevolence 5* Hyena Bomber 4*, Vulture Droid 6*, Sun Fac SF, Soldier SF, Spy SF",0
"LegistheBEAST",0,1,81420,Geonosians Omicron,"GBA 5* Sun Fac, Geo Soldier, Geo Spy, Poggle",0
"LegistheBEAST",,,438905,Executrix,"Executrix Tie Adv, Emperor's Shuttle 4*, TIE Reaper 3*, Imperial TIE Fighter, Gauntlet Starfighter, FOSF TIE Fighter, FO TIE Fighter",0
"LegistheBEAST",1,0,52787,Jawas,"Nebit G5, Jawa Engineer G2, Jawa Scavenger G7, Jawa G7, Dathcha G7",0
"Tau Beta",,,167578,JMK,"zzzzzzJMK zAhsoka zzzCAT zJKA zGK",1
"Tau Beta",,,123480,Phasma,"zPhasma zFOTP FOSFTP zFOST zKylo",1
"Tau Beta",1,1,165066,SL Kylo,"zzzzzzSL Kylo, zSith Trooper, zHux zzKRU zzThrawn",1
"Tau Beta",,,174975,SEE,"zzzzzzSEE zBSF zzMalak zzzDR zzzVader",1
"Tau Beta",,,166924,Jabba,"zzzzzzJabba zBoushh (Leia Organa), zSkiff Guard (Lando Calrissian), zKrrsantan zBoba",1
"Tau Beta",1,1,104484,NS,"zzMT zzAV Daka Zombie Spirit",1
"Tau Beta",,,584655,Executor,"Executor HT RC Xanadu Blood, Slave I, IG-2000 Imperial TIE Fighter, Tie Adv",1
"Tau Beta",1,0,145935,CLS,"zzzCLS zHan zzChewbacca zzC-3PO zChewpio",1
"Tau Beta",,,309175,Malevolence,"Malevolence Hyena Bomber, Vulture Droid, Sun Fac SF, Soldier SF, Spy SF",1
"Tau Beta",,,133127,JKL,"zzJKL zzzJKR zzHYoda zzOld Ben, Aayla",1
"Tau Beta",,,479939,HansMF,"Home One, Han's MF, Rebel Y-wing, Bistan's U-wing, Phantom Ghost Cassian's U-wing, Wedge X-wing",1
"Tau Beta",0,1,125535,Grievous,"zzGG zB2 zB1 zMagnaGuard zNute",1
"Tau Beta",1,0,124688,Traya,"zzTraya zzDN zSion zzEP Sith Empire Trooper",1
"Tau Beta",1,1,109139,JTR,"zzzJTR zScav Rey, zBB-8 zzR2-D2 zFinn",1
"Tau Beta",,,104734,Mon Mothma,"zzMon Mothma, Bistan Wedge Scarif Chirrut",1
"Tau Beta",1,1,90271,Ewoks,"zChirpa Elder Paploo Wicket zLogray",1
"Tau Beta",1,0,110062,ShaakClones,"zzShaak Ti, Rex Echo (501st), zFives Clone Sergeant",1
"Tau Beta",1,1,96530,Carth,"zCarth Onasi, Mission zZaalbar zJuhani zCanderous",1
"Tau Beta",0,1,143578,BH,"zzBossk zzJango Fennec Shand, zDengar Greedo",1
"Tau Beta",1,0,113478,Troopers,"zVeers zStarck DT Dark Trooper, zzPiett",1
"Tau Beta",1,0,128085,zMaul,"zDarth Maul, zSidious zDooku Sith Marauder, zNest",1
"Tau Beta",0,1,100282,Phoenix,"zHera zZeb G8, zSabine zEzra zKanan",1
"Tau Beta",1,0,80708,Jawas,"Nebit G8, Jawa Engineer, Jawa Scavenger, Jawa Dathcha G9",1
"Tau Beta",,,458117,Negotiator,"Negotiator BTL-B Y-wing 5*, Anakin's Eta-2, Rex's ARC-170, Umbaran SF, Ahsoka's SF, Plo's SF, Clone Sergeant's ARC-170",0
"Tau Beta",0,1,97445,Geonosians Omicron,"zzGBA Sun Fac, Geo Soldier, Geo Spy, Poggle",0
"Tau Beta",,,85130,Bad Batch,"zHunter Echo Omega G9, zTech Wrecker",0
"Bradshoe02",,,122967,Phasma,"zPhasma zFOTP FOSFTP zFOST zKylo",1
"Bradshoe02",1,1,164308,SL Kylo,"zzzzzzSL Kylo, zSith Trooper, zHux zzKRU zThrawn",1
"Bradshoe02",,,173663,SEE,"zzzzzzSEE zBSF zzMalak zzzDR zzzVader",1
"Bradshoe02",0,1,138840,padme,"zzPadme zGK zJKA zAhsoka zzzCAT",1
"Bradshoe02",,,176948,JMLS,"zzzJKR zzJKL zzzzzzJMLS zzHYoda zzzzGAS",1
"Bradshoe02",1,0,145799,CLS,"zzzCLS zHan zzChewbacca zzC-3PO zChewpio",1
"Bradshoe02",,,123594,Grievous Omicron,"zzGG zB2 zB1 MagnaGuard zDroideka",1
"Bradshoe02",,,475935,Negotiator,"Negotiator HT Anakin's Eta-2, Umbaran SF, Ahsoka's SF, Clone Sergeant's ARC-170, Plo's SF, Rex's ARC-170",1
"Bradshoe02",1,0,114394,Traya,"zzTraya zDN zSion zzEP Sith Empire Trooper",1
"Bradshoe02",1,1,125580,JTR,"zzzJTR Scav Rey G8, BB-8 zzR2-D2 zFinn",1
"Bradshoe02",,,110452,Mon Mothma,"zzMon Mothma, Wedge Cara Dune, Biggs Lando",1
"Bradshoe02",1,0,124711,ShaakClones,"zzShaak Ti, zRex zEcho (501st), zzFives zARC Trooper",1
"Bradshoe02",1,1,84174,Ewoks,"zChirpa Elder Paploo Scout Logray",1
"Bradshoe02",0,1,135710,BH,"zzBossk Dengar Cad zBoba IG-88",1
"Bradshoe02",1,1,87220,Carth,"Carth Onasi, Mission Zaalbar Juhani Canderous",1
"Bradshoe02",1,0,126930,Troopers,"zVeers zStarck Range Trooper, zDark Trooper, zzPiett",1
"Bradshoe02",0,1,80025,Phoenix,"Hera G9, Zeb G9, Chopper G9, zEzra zKanan",1
"Bradshoe02",0,1,93458,Geonosians Omicron,"zzGBA Sun Fac, Geo Soldier, Geo Spy, Poggle",0
"Bradshoe02",,,356837,HansMF,"Home One, Han's MF, Rebel Y-wing, Bistan's U-wing 6*, Phantom Biggs X-wing, Cassian's U-wing, Wedge X-wing",0
"Bradshoe02",,,85016,Nute-Wat,"Nute zDooku zWat Tambor G9, Jango Nest G1",0
"Bradshoe02",1,1,60282,NS_Alt,"AV Talia G8, Daka G9, Zombie G8, Spirit G8",0
"Bradshoe02",1,0,48442,Jawas,"Nebit G7, Jawa Engineer 5* G4, Jawa Scavenger 5* G7, Jawa G7, Dathcha G7",0
"Dawnbreaker",,,122751,Phasma,"zPhasma zFOTP FOSFTP zFOST zKylo",1
"Dawnbreaker",1,1,165069,SL Kylo,"zzzzzzSL Kylo, zSith Trooper, zHux zzKRU zzThrawn",1
"Dawnbreaker",,,579834,Executor,"Executor HT RC Xanadu Blood, Slave I, IG-2000 Imperial TIE Fighter, Tie Adv",1
"Dawnbreaker",0,1,143599,padme,"zzPadme zGK zJKA zAhsoka zzzCAT",1
"Dawnbreaker",1,0,149889,CLS,"zzzCLS zHan zzChewbacca zzC-3PO zChewpio",1
"Dawnbreaker",,,120675,Grievous Omicron,"zzGG zB2 zB1 MagnaGuard zDroideka",1
"Dawnbreaker",1,1,101842,NS_Alt,"zzMT zAV Talia zDaka Zombie",1
"Dawnbreaker",1,1,108197,JTR,"zzzJTR Scav Rey, zzBB-8 zzR2-D2 zFinn",1
"Dawnbreaker",1,0,106727,Troopers,"zVeers zzPiett Gideon zDark Trooper, Range Trooper",1
"Dawnbreaker",1,1,150390,GAS,"zzzzGAS zRex zEcho (501st), zzFives zARC Trooper",1
"Dawnbreaker",1,1,119686,Revan Offense,"zzzJKR zGMY BS zJolee HYoda",1
"Dawnbreaker",1,1,85976,Ewoks,"zChirpa Elder Paploo zWicket Logray",1
"Dawnbreaker",0,1,143442,BH,"zzBossk zJango Dengar zBoba zIG-88",1
"Dawnbreaker",1,1,83134,Carth,"zCarth Onasi, Mission Zaalbar Juhani Canderous",1
"Dawnbreaker",1,1,119823,zEP,"zzEP zzzVader Tarkin G9, TFP zMara Jade, The Emperor's Hand",1
"Dawnbreaker",,,80570,Iden Troopers,"zIden Versio, Stormtrooper Snowtrooper Magma DT",1
"Dawnbreaker",0,1,79547,Phoenix,"Hera Zeb Chopper Ezra Kanan G8",1
"Dawnbreaker",,,109387,Admiral Raddus,"zzAdmiral Raddus 5*, zCassian zzJyn K-2SO G6, Bistan",0
"Dawnbreaker",,,480091,Negotiator,"Negotiator BTL-B Y-wing 2*, Anakin's Eta-2, Rex's ARC-170, Umbaran SF, Ahsoka's SF, Plo's SF, Clone Sergeant's ARC-170",0
"Dawnbreaker",,,271990,Malevolence,"Malevolence Hyena Bomber 4*, Vulture Droid 3*, Sun Fac SF, Soldier SF, Spy SF",0
"Dawnbreaker",0,1,93339,Geonosians Omicron,"zzGBA Sun Fac, Geo Soldier, Geo Spy, Poggle",0
"Dawnbreaker",0,1,98068,DR,"zzzDR HK-47 zBSF Sith Empire Trooper G8, Sith Assassin G3",0
"Dawnbreaker",,,406343,HansMF,"Home One, Han's MF, Rebel Y-wing 5*, Bistan's U-wing 5*, Phantom Ghost Cassian's U-wing, Wedge X-wing",0
"Dawnbreaker",,,89758,Mon Mothma,"zzMon Mothma, Wedge G8, Cara Dune G9, Biggs G8, zKyle Katarn",0
"Dawnbreaker",1,0,54256,Jawas,"Nebit G8, Jawa Engineer G7, Jawa Scavenger G8, Jawa 5* Dathcha G7",0
"Dawnbreaker",1,0,12418,SionSolo (Counter),"Sion G7",0
"RevNon",,,188670,JMK,"zzzzzzJMK zAhsoka zzzCAT zzzzGAS zGK",1
"RevNon",,,184998,SEE,"zzzzzzSEE zBSF zzMalak zzzDR zzzVader",1
"RevNon",1,0,142294,CLS,"zzzCLS zHan zzChewbacca zzC-3PO zChewpio",1
"RevNon",1,1,106120,NS_Alt,"zzMT zAV Talia zDaka Zombie",1
"RevNon",,,551015,Negotiator,"Negotiator HT Anakin's Eta-2, Umbaran SF, Ahsoka's SF, Clone Sergeant's ARC-170, Plo's SF, Rex's ARC-170",1
"RevNon",,,404398,HansMF,"Home One, Han's MF, Biggs X-wing, Bistan's U-wing, Phantom Ghost Cassian's U-wing, Wedge X-wing",1
"RevNon",0,1,130463,Grievous,"zzGG zB2 zB1 MagnaGuard zNute",1
"RevNon",1,0,134620,Traya,"zzTraya zDN zSion Sith Empire Trooper, zzThrawn",1
"RevNon",1,1,152701,Revan Offense,"zzzJKR zGMY zzHYoda zJolee zJKA",1
"RevNon",1,1,102110,Ewoks,"zChirpa Elder zPaploo zWicket zLogray",1
"RevNon",1,0,140694,ShaakClones,"zzShaak Ti, zRex zEcho (501st), zzFives zARC Trooper",1
"RevNon",0,1,144455,BH,"zzBossk zJango Dengar zBoba zIG-88",1
"RevNon",1,1,97704,Carth,"zCarth Onasi, zMission zZaalbar Juhani zCanderous",1
"RevNon",1,0,118605,Troopers,"zVeers zStarck DT zDark Trooper, zzPiett",1
"RevNon",0,1,108766,Phoenix,"zHera zZeb zSabine zEzra zKanan",1
"RevNon",1,1,52808,Rogue1,"Jyn G8, Chirrut G8, Baze G8, Cassian G8, K-2SO G8",1
"RevNon",1,0,124149,EP (Counter, Rebel),"zzEP Krennic zzWampa zNest Stormtrooper",1
"RevNon",1,0,79618,Jawas,"Nebit G9, Jawa Engineer, Jawa Scavenger G9, Jawa Dathcha",1
"RevNon",,,69954,Phasma,"zPhasma FOTP G6, FOSFTP G7, FOST 5* G8, zKylo",0
"RevNon",0,1,99236,Geonosians Omicron,"zzGBA Sun Fac, Geo Soldier, Geo Spy, Poggle",0
"RevNon",1,0,131090,zMaul,"Darth Maul, zDooku zSidious zSavage Sith Marauder",0
"RevNon",,,36723,Bad Batch,"Hunter 5* G6, Echo 4* G3, Omega 5* G4, Tech 5* G8, Wrecker 4* G6",0
"Easy E",1,0,144080,CLS,"zzzCLS zHan zzChewbacca zzC-3PO zChewpio",1
"Easy E",0,1,123434,DRMalak,"zzzDR zzHK-47 zBSF zzMalak Sith Empire Trooper",1
"Easy E",0,1,135083,padme,"zzPadme zGK zJKA zAhsoka zBarriss",1
"Easy E",,,486253,Negotiator,"Negotiator BTL-B Y-wing, Anakin's Eta-2, Rex's ARC-170, Umbaran SF, Ahsoka's SF, Plo's SF, Clone Sergeant's ARC-170",1
"Easy E",,,437152,HansMF,"Home One, Han's MF, Rebel Y-wing, Bistan's U-wing, Phantom Ghost Cassian's U-wing, Wedge X-wing",1
"Easy E",1,1,145259,JTR,"zzzJTR zzR2-D2 zzBB-8 zRH Finn, zRH Poe",1
"Easy E",0,1,113131,Grievous,"zzGG zB2 zB1 zMagnaGuard zNute",1
"Easy E",1,0,113458,Traya,"zzTraya zzDN G9, zSion zzEP zzThrawn",1
"Easy E",,,402078,Executrix,"Executrix Tie Adv, Emperor's Shuttle, TIE Reaper, Imperial TIE Fighter, Gauntlet Starfighter, FOSF TIE Fighter, FO TIE Fighter",1
"Easy E",,,106266,Disintegration,"Aurra G9, Greef zBoba zzBossk zzThe Mandalorian",1
"Easy E",1,1,139872,GAS,"zzzzGAS zRex zEcho (501st), zzFives zARC Trooper",1
"Easy E",,,96217,Mon Mothma,"Mon Mothma, Wedge zzJyn Biggs Lando",1
"Easy E",1,1,139386,Revan Offense,"zzzJKR zzGMY zBS zJolee zzHYoda",1
"Easy E",1,1,98762,Ewoks,"zChirpa Elder zPaploo zWicket zLogray",1
"Easy E",1,1,109995,Carth,"zCarth Onasi, zMission zZaalbar zJuhani zCanderous",1
"Easy E",0,1,111761,BH,"zzJango zDengar zGreedo zZam zNest",1
"Easy E",0,1,95383,FO,"zzKRU zKylo zHux FOE G8, FOO",1
"Easy E",0,1,93595,Phoenix,"zHera Zeb G9, zSabine zEzra zKanan",1
"Easy E",,,279399,Malevolence,"Malevolence Hyena Bomber 4*, Vulture Droid, Sun Fac SF, Soldier SF, Spy SF",0
"Easy E",0,1,95334,Geonosians Omicron,"zzGBA Sun Fac, Geo Soldier, Geo Spy, Poggle",0
"Easy E",1,1,94862,NS,"zzMT zzAV zDaka Zombie G9, Spirit G9",0
"Easy E",1,0,77638,Troopers,"Veers G9, zzPiett Gideon G9, Dark Trooper G7, Range Trooper 6* G8",0
"Easy E",,,72014,Iden Troopers,"zIden Versio G5, Shoretrooper G9, Snowtrooper G5, Magma G7, zDT",0
"Easy E",,,85586,Bad Batch,"zHunter Echo G8, zzOmega zTech G9, Wrecker G9",0
"Easy E",1,0,71282,Jawas,"Nebit Jawa Engineer, Jawa Scavenger G7, Jawa G7, Dathcha G7",0
"LetTheWookieWin",,,172327,LV,"zzzzzzLord Vader, zzPiett zzVader zRG zTarkin",1
"LetTheWookieWin",,,425045,Profundity,"Profundity Han's MF, Outrider Rebel Y-wing, Cassian's U-wing, Ghost",1
"LetTheWookieWin",,,572663,Executor,"Executor HT RC Xanadu Blood, Slave I, IG-2000 Imperial TIE Fighter, Tie Adv",1
"LetTheWookieWin",1,0,142391,CLS,"zzzCLS zHan zzChewbacca zzC-3PO zChewpio",1
"LetTheWookieWin",,,132811,Grievous Omicron,"zzGG zB2 zB1 MagnaGuard zDroideka",1
"LetTheWookieWin",,,493510,Negotiator,"Negotiator BTL-B Y-wing, Anakin's Eta-2, Rex's ARC-170, Umbaran SF, Ahsoka's SF, Plo's SF, Clone Sergeant's ARC-170",1
"LetTheWookieWin",,,347309,Malevolence,"Malevolence Hyena Bomber, Vulture Droid, Sun Fac SF, Soldier SF, Spy SF",1
"LetTheWookieWin",1,0,123110,Traya,"zzTraya DN zSion zDooku Thrawn",1
"LetTheWookieWin",1,1,159033,GAS,"zzzzGAS zRex zEcho (501st), zzFives zARC Trooper",1
"LetTheWookieWin",,,125511,Mon Mothma,"Mon Mothma, Bistan zJyn zCassian zK-2SO",1
"LetTheWookieWin",1,1,81618,Ewoks,"zChirpa Elder Paploo Wicket Logray",1
"LetTheWookieWin",0,1,142479,BH,"zzBossk Jango Dengar Boba zZam",1
"LetTheWookieWin",0,1,78749,Phoenix,"Hera Zeb G8, Chopper G9, Ezra G9, Kanan G8",1
"LetTheWookieWin",1,0,124891,QGJ,"zQGJ Aayla zJKA zGK zAhsoka",1
"LetTheWookieWin",1,0,106937,EP (Counter, Rebel),"zzEP Krennic DT Range Trooper, Starck",1
"LetTheWookieWin",0,1,110208,Geonosians Omicron,"zzGBA Sun Fac, Geo Soldier, Geo Spy, Poggle",0
"LetTheWookieWin",0,1,90269,DR,"DR G8, zHK-47 zBSF Sith Marauder, Sith Assassin G1",0
"LetTheWookieWin",1,1,68866,NS,"MT G6, AV Daka G7, Zombie Spirit G7",0
"LetTheWookieWin",1,1,75256,Carth,"Carth Onasi, Mission G7, Zaalbar G7, Juhani Canderous",0
"LetTheWookieWin",,,111267,Bad Batch,"zHunter zEcho Omega 6* G6, zTech zWrecker",0
"LetTheWookieWin",,,100846,Mando,"zzThe Mandalorian (Beskar Armor), zDash Rendar, Nest G7, IG-11 G9, Kuiil G9",0
"LetTheWookieWin",1,0,36032,Jawas,"Nebit G1, Jawa Engineer G1, Jawa Scavenger G1, Jawa G1, Dathcha G1",0
"Whitezilla",,,186459,JMK,"zzzzzzJMK zAhsoka zzzCAT zzzzGAS zGK",1
"Whitezilla",,,182017,LV,"zzzzzzLord Vader, zzThrawn zzzMaul zRG zzzVader",1
"Whitezilla",1,1,129712,NS,"zzMT zzAV zDaka Zombie Spirit",1
"Whitezilla",1,0,152589,CLS,"zzzCLS zHan zzChewbacca zzC-3PO zChewpio",1
"Whitezilla",0,1,141388,DRMalak,"zzzDR zzHK-47 zBSF zzMalak Sith Empire Trooper",1
"Whitezilla",,,138580,Grievous Omicron,"zzGG zB2 zB1 zMagnaGuard zDroideka",1
"Whitezilla",,,530651,Negotiator,"Negotiator HT Anakin's Eta-2, Umbaran SF, Ahsoka's SF, BTL-B Y-wing, Clone Sergeant's ARC-170, Plo's SF",1
"Whitezilla",,,145422,JKL,"zzJKL zzzJKR zzHYoda zzOld Ben, Aayla",1
"Whitezilla",,,454104,HansMF,"Home One, Han's MF, Rebel Y-wing, Bistan's U-wing, Phantom Ghost Cassian's U-wing, Wedge X-wing",1
"Whitezilla",1,1,112492,JTR,"zzzJTR zzR2-D2 zzBB-8 RH Finn G9, RH Poe G9",1
"Whitezilla",1,0,151554,Traya,"zzTraya zzDN zSion zDooku zzEP",1
"Whitezilla",1,0,112659,Troopers,"zVeers zzPiett zzGideon zDark Trooper, Range Trooper",1
"Whitezilla",,,97519,Mon Mothma,"zzMon Mothma, Wedge zCara Dune, Chirrut Hoth Rebel Scout",1
"Whitezilla",1,1,93857,Ewoks,"zChirpa Elder zPaploo zWicket zLogray",1
"Whitezilla",1,0,149615,ShaakClones,"zzShaak Ti, zRex zEcho (501st), zzFives zARC Trooper",1
"Whitezilla",1,1,100134,Carth,"zCarth Onasi, zMission zZaalbar zVandor Chewbacca, zCanderous",1
"Whitezilla",0,1,142568,BH,"zzBossk zzJango zDengar zBoba zZam",1
"Whitezilla",0,1,104109,Phoenix,"zHera zZeb zSabine zEzra zKanan",1
"Whitezilla",0,1,99196,FO,"zzKRU zKylo zHux zPhasma FOO",1
"Whitezilla",,,129999,Bad Batch,"zHunter zEcho zzOmega zTech zWrecker",1
"Whitezilla",1,0,124227,zMaul,"zDarth Maul, zSidious Sith Assassin, zSavage Sith Marauder",1
"Whitezilla",1,0,115581,Jawas,"Nebit Jawa Engineer, Jawa Scavenger, Jawa Dathcha",1
"Whitezilla",1,0,20268,NestSolo (Counter),"zNest",1
"Whitezilla",,,76973,Admiral Raddus,"Admiral Raddus 5* G9, Cassian G9, zzJyn Baze G9, Bistan G7",0
"Whitezilla",,,280804,Malevolence,"Malevolence Hyena Bomber 4*, Vulture Droid 4*, Sun Fac SF, Soldier SF, Spy SF",0
"Whitezilla",0,1,95440,Geonosians Omicron,"zzGBA Sun Fac, Geo Soldier, Geo Spy, Poggle",0
"Whitezilla",,,462508,Executrix,"Executrix Tie Adv, Emperor's Shuttle, TIE Reaper 4*, Imperial TIE Fighter, Gauntlet Starfighter, FOSF TIE Fighter 5*, FO TIE Fighter",0
"Whitezilla",,,94145,Iden Troopers,"Iden Versio 5* G8, zStormtrooper Snowtrooper Magma zDT",0
"EthanDB123",,,119510,Phasma,"zPhasma zFOTP FOSFTP FOST Kylo",1
"EthanDB123",1,1,152469,SL Kylo,"zzzzzzSL Kylo, zSith Trooper, zHux zzKRU Thrawn",1
"EthanDB123",0,1,108710,padme,"zzPadme zGK JKA zAhsoka zC-3PO",1
"EthanDB123",1,0,97780,CLS,"zzCLS zHan zChewbacca zR2-D2 G9, Chewpio",1
"EthanDB123",,,331259,HansMF,"Home One, Han's MF, HT Ghost Phantom Biggs X-wing, Cassian's U-wing, Wedge X-wing",1
"EthanDB123",1,0,98089,Traya,"zzTraya DN Sion G9, zEP Sith Empire Trooper G9",1
"EthanDB123",0,1,117044,Grievous,"zzGG zB2 zDroideka MagnaGuard IG-88",1
"EthanDB123",1,1,115557,Revan Offense,"zzzJKR zzGMY zBS zJolee Ezra",1
"EthanDB123",1,1,82705,Ewoks,"zChirpa Elder Paploo Wicket Logray",1
"EthanDB123",0,1,123766,BH,"zzBossk Jango Dengar Cad zBoba",1
"EthanDB123",1,0,19719,NestSolo (Counter),"Nest",1
"EthanDB123",0,1,91232,Geonosians Omicron,"zGBA Sun Fac, Geo Soldier, Geo Spy, Poggle",0
"EthanDB123",0,1,80383,DRMalak,"DR HK-47 BSF zMalak 5* Sith Marauder 5* G8",0
"EthanDB123",1,0,78317,Troopers,"zVeers 6* zPiett Gideon 4* G8, Dark Trooper 6* G9, Range Trooper 4* G7",0
"EthanDB123",1,1,86355,GAS,"GAS 6* zRex Echo (501st), zFives G9, ARC Trooper",0
"EthanDB123",1,1,50051,NS_Alt,"MT 6* G7, AV Talia G5, Daka G7, Spirit G6",0
"EthanDB123",1,1,83058,Carth,"zCarth Onasi, Mission Zaalbar Juhani Canderous G7",0
"Sherman8erx",1,1,162436,SL Kylo,"zzzzzzSL Kylo, zSith Trooper, zHux zzKRU zThrawn",1
"Sherman8erx",1,1,168272,GL Rey,"zzzzzzRey zzzJTR zzBB-8 zRH Poe, zRH Finn",1
"Sherman8erx",1,0,142721,CLS,"zzzCLS zHan zzChewbacca zzC-3PO zChewpio",1
"Sherman8erx",0,1,121494,DRMalak,"zzzDR zzHK-47 zBSF zzMalak Sith Empire Trooper",1
"Sherman8erx",,,121655,Grievous Omicron,"zzGG zB2 zB1 zMagnaGuard zDroideka",1
"Sherman8erx",0,1,114550,padme,"zzPadme zGK zJKA zAhsoka zBarriss",1
"Sherman8erx",1,1,108493,NS_Alt,"zzMT zzAV Talia zDaka Zombie",1
"Sherman8erx",0,1,112490,Geonosians Omicron,"zzGBA Sun Fac, Geo Soldier, Geo Spy, Poggle",1
"Sherman8erx",,,402930,HansMF,"Home One, Han's MF, Rebel Y-wing 6*, Bistan's U-wing, Phantom Ghost Cassian's U-wing, Biggs X-wing",1
"Sherman8erx",,,459168,Negotiator,"Negotiator HT Anakin's Eta-2, Umbaran SF, Ahsoka's SF, Clone Sergeant's ARC-170, Plo's SF, Rex's ARC-170",1
"Sherman8erx",1,0,118344,Traya,"zzTraya zDN zSion zDooku zzEP",1
"Sherman8erx",,,115343,Disintegration,"Aurra zGreef zBoba zzBossk The Mandalorian",1
"Sherman8erx",1,1,127957,GAS,"zzzzGAS zRex zEcho (501st), zzFives zARC Trooper",1
"Sherman8erx",1,1,133909,Revan Offense,"zzzJKR zGMY zBS zJolee zHYoda",1
"Sherman8erx",1,1,92211,Ewoks,"zChirpa Elder Paploo zWicket Logray",1
"Sherman8erx",1,1,102258,Carth,"zCarth Onasi, zMission zZaalbar Juhani zCanderous",1
"Sherman8erx",1,0,109862,Troopers,"zVeers zStarck DT Snowtrooper zzPiett",1
"Sherman8erx",0,1,79229,Phoenix,"zHera G8, Zeb G8, Sabine G8, zEzra zKanan G8",1
"Sherman8erx",1,0,84324,Jawas,"Nebit Jawa Engineer, Jawa Scavenger, Jawa Dathcha",1
"Sherman8erx",1,0,15925,NestSolo (Counter),"Nest",1
"Sherman8erx",,,123338,Phasma,"zPhasma zFOTP FOSFTP zFOST zKylo",0
"Sherman8erx",,,442767,Executrix,"Executrix Tie Adv, Emperor's Shuttle 4*, TIE Reaper 6*, Imperial TIE Fighter, Gauntlet Starfighter, FOSF TIE Fighter, FO TIE Fighter",0
"Sherman8erx",,,87889,Mon Mothma,"zzMon Mothma 5* G9, Wedge Cara Dune, Biggs Lando",0
"Sherman8erx",0,1,120576,BH,"zJango zDengar Greedo zZam zIG-88",0
