Player,Offense,Defense,GP,Name,Squad,Viable
"Enterthez",,,405471,HansMF,"Home One, Han's MF, Rebel Y-wing, Bistan's U-wing, Phantom Ghost Cassian's U-wing, Wedge X-wing",1
"Enterthez",,,466416,Negotiator,"Negotiator HT Anakin's Eta-2, Umbaran SF, Ahsoka's SF, Clone Sergeant's ARC-170, Plo's SF, Rex's ARC-170",1
"Enterthez",0,1,125497,Grievous,"zzGG zB2 zB1 zMagnaGuard zNute",1
"Enterthez",,,111593,Mon Mothma,"zzMon Mothma, zK-2SO Wedge Biggs Lando",1
"Enterthez",0,1,149655,BH,"zzBossk zDengar zIG-88 zBoba zzJango",1
"Enterthez",1,1,96804,Carth,"zCarth Onasi, zMission zZaalbar zJuhani zCanderous",1
"Enterthez",1,1,137901,zEP,"zzEP zzzVader zTarkin TFP zzMara Jade, The Emperor's Hand",1
"Enterthez",0,1,100695,FO,"zzKRU zKylo zHux FOO FOST",1
"Enterthez",0,1,86673,Phoenix,"zHera zEzra zKanan zZeb G8, Sabine G8",1
"Enterthez",1,0,115720,QGJ,"QGJ Aayla zJKA zzOld Ben, zAhsoka",1
"Enterthez",,,127068,SEE,"zzzzzzSEE zBSF Malak 5* G1, zzDR zDooku",0
"Enterthez",0,1,85487,Geonosians Omicron,"zzGBA Sun Fac G9, Geo Soldier, Geo Spy, Poggle",0
"Enterthez",1,1,84213,NS,"zzMT zAV zDaka Zombie G5, Spirit G9",0
"Enterthez",,,422484,Executrix,"Executrix Tie Adv, Emperor's Shuttle, TIE Reaper 3*, Imperial TIE Fighter, Gauntlet Starfighter, FOSF TIE Fighter, FO TIE Fighter",0
"Enterthez",1,1,83707,Ewoks,"Chirpa 6* G7, Elder zPaploo zWicket zLogray",0
"Enterthez",1,0,88108,ShaakClones,"zzShaak Ti, Rex Echo (501st) G9, Fives Clone Sergeant",0
"Enterthez",1,0,106483,Troopers,"zVeers zStarck Snowtrooper G7, zzPiett Stormtrooper G8",0
"Enterthez",1,0,9394,SionSolo (Counter),"Sion G1",0
"Nick",,,180355,JMK,"zzzzzzJMK zAhsoka zzzCAT zzzzGAS zGK",1
"Nick",,,124889,Phasma,"zPhasma zFOTP FOSFTP zFOST zKylo",1
"Nick",1,1,165202,SL Kylo,"zzzzzzSL Kylo, zSith Trooper, zHux zzKRU zThrawn",1
"Nick",1,1,106051,NS,"zzMT zzAV zDaka Zombie Spirit",1
"Nick",,,585981,Executor,"Executor HT RC Xanadu Blood, Slave I, IG-2000 Imperial TIE Fighter, Tie Adv",1
"Nick",1,0,144313,CLS,"zzzCLS zHan zzChewbacca zzC-3PO zChewpio",1
"Nick",,,138298,JKL,"zzJKL zzJKR zzHYoda zOld Ben, Aayla",1
"Nick",0,1,127667,Grievous,"zzGG zB2 zB1 zMagnaGuard zNute",1
"Nick",1,1,112046,JTR,"zzzJTR Scav Rey, BB-8 G8, zzR2-D2 Finn G9",1
"Nick",1,0,127356,Traya,"zzTraya zzDN zSion zDooku zzEP",1
"Nick",1,1,93771,Ewoks,"zChirpa Elder zPaploo zWicket zLogray",1
"Nick",1,0,142610,ShaakClones,"zzShaak Ti, zRex zEcho (501st), zzFives zARC Trooper",1
"Nick",0,1,149787,BH,"zzBossk zDengar zIG-88 zBoba zzJango",1
"Nick",1,1,92058,Carth,"zCarth Onasi, Mission Zaalbar zJuhani Canderous",1
"Nick",0,1,71065,Phoenix,"Hera G9, Ezra Kanan G8, Zeb G8, Sabine G8",1
"Nick",,,147605,SEE,"zzzzzzSEE zBSF zMalak 5* DR zzVader",0
"Nick",0,1,95597,Geonosians Omicron,"zzGBA Sun Fac, Geo Soldier, Geo Spy, Poggle",0
"Nick",,,402062,HansMF,"Home One, Han's MF, Biggs X-wing, Bistan's U-wing 6*, Phantom Ghost Cassian's U-wing, Wedge X-wing",0
"Nick",,,109036,Mon Mothma,"zzMon Mothma, Wedge Cara Dune G9, Biggs Lando",0
"Nick",1,0,122593,Troopers,"zVeers zStarck zzPiett zDT zIden Versio 6*",0
"Nick",1,1,54001,Rogue1,"Jyn 6* G8, Chirrut 6* G8, Baze 6* G8, K-2SO G8, Cassian G8",0
"Nick",1,0,63111,Jawas,"Nebit G8, Jawa Engineer G8, Jawa Scavenger G7, Jawa 6* G8, Dathcha G7",0
"Tau Beta",,,167578,JMK,"zzzzzzJMK zAhsoka zzzCAT zJKA zGK",1
"Tau Beta",,,123480,Phasma,"zPhasma zFOTP FOSFTP zFOST zKylo",1
"Tau Beta",1,1,165066,SL Kylo,"zzzzzzSL Kylo, zSith Trooper, zHux zzKRU zzThrawn",1
"Tau Beta",,,174975,SEE,"zzzzzzSEE zBSF zzMalak zzzDR zzzVader",1
"Tau Beta",,,166924,Jabba,"zzzzzzJabba zBoushh (Leia Organa), zSkiff Guard (Lando Calrissian), zKrrsantan zBoba",1
"Tau Beta",1,1,104484,NS,"zzMT zzAV Daka Zombie Spirit",1
"Tau Beta",,,584655,Executor,"Executor HT RC Xanadu Blood, Slave I, IG-2000 Imperial TIE Fighter, Tie Adv",1
"Tau Beta",1,0,145935,CLS,"zzzCLS zHan zzChewbacca zzC-3PO zChewpio",1
"Tau Beta",,,309175,Malevolence,"Malevolence Hyena Bomber, Vulture Droid, Sun Fac SF, Soldier SF, Spy SF",1
"Tau Beta",,,133127,JKL,"zzJKL zzzJKR zzHYoda zzOld Ben, Aayla",1
"Tau Beta",,,460374,HansMF,"Home One, Han's MF, Rebel Y-wing, Bistan's U-wing, Phantom Ghost Cassian's U-wing, Wedge X-wing",1
"Tau Beta",0,1,125535,Grievous,"zzGG zB2 zB1 zMagnaGuard zNute",1
"Tau Beta",1,0,124688,Traya,"zzTraya zzDN zSion zzEP Sith Empire Trooper",1
"Tau Beta",1,1,109139,JTR,"zzzJTR zScav Rey, zBB-8 zzR2-D2 zFinn",1
"Tau Beta",,,94996,Mon Mothma,"zzMon Mothma, Wedge Scarif Bistan Chirrut",1
"Tau Beta",1,1,90271,Ewoks,"zChirpa Elder Paploo Wicket zLogray",1
"Tau Beta",1,0,110062,ShaakClones,"zzShaak Ti, Rex Echo (501st), zFives Clone Sergeant",1
"Tau Beta",1,1,96530,Carth,"zCarth Onasi, Mission zZaalbar zJuhani zCanderous",1
"Tau Beta",0,1,143578,BH,"zzBossk zDengar Greedo Fennec Shand, zzJango",1
"Tau Beta",1,0,113478,Troopers,"zVeers zStarck Dark Trooper, zzPiett DT",1
"Tau Beta",1,0,128085,zMaul,"zDarth Maul, zSidious zDooku Sith Marauder, zNest",1
"Tau Beta",0,1,95098,Phoenix,"zHera zEzra zKanan zZeb G8, zSabine",1
"Tau Beta",1,0,80708,Jawas,"Nebit G8, Jawa Engineer, Jawa Scavenger, Jawa Dathcha G9",1
"Tau Beta",,,458117,Negotiator,"Negotiator BTL-B Y-wing 5*, Anakin's Eta-2, Rex's ARC-170, Umbaran SF, Ahsoka's SF, Plo's SF, Clone Sergeant's ARC-170",0
"Tau Beta",0,1,97445,Geonosians Omicron,"zzGBA Sun Fac, Geo Soldier, Geo Spy, Poggle",0
"Tau Beta",,,85130,Bad Batch,"zHunter Echo Omega G9, zTech Wrecker",0
"Pro Bono",,,178354,JMK,"zzzzzzJMK zJKA zzGMY zzShaak Ti, zGK",1
"Pro Bono",,,168223,LV,"zzzzzzLord Vader, zzThrawn zzzVader zRG zTarkin",1
"Pro Bono",,,123886,Phasma,"zPhasma zFOTP FOSFTP zFOST zKylo",1
"Pro Bono",,,183481,JMLS,"zzzJKR zzJKL zzzzzzJMLS zWat Tambor, zzzzGAS",1
"Pro Bono",1,0,153825,CLS,"zzzCLS zHan zzChewbacca zzC-3PO zChewpio",1
"Pro Bono",0,1,123412,DRMalak,"zzzDR zzHK-47 zBSF zzMalak Sith Empire Trooper G9",1
"Pro Bono",,,490359,Negotiator,"Negotiator HT Anakin's Eta-2, Umbaran SF, Ahsoka's SF, BTL-B Y-wing, Clone Sergeant's ARC-170, Plo's SF",1
"Pro Bono",1,1,106618,NS_Alt,"zzMT zzAV zDaka Talia Zombie",1
"Pro Bono",0,1,99037,Geonosians Omicron,"zzGBA Sun Fac, Geo Soldier, Geo Spy, Poggle",1
"Pro Bono",,,455942,HansMF,"Home One, Han's MF, Rebel Y-wing, Bistan's U-wing, Phantom Ghost Cassian's U-wing, Wedge X-wing",1
"Pro Bono",0,1,139185,Grievous,"zzGG zB2 zB1 zMagnaGuard zNute",1
"Pro Bono",1,1,128417,JTR,"zzzJTR zScav Rey, zBB-8 zzR2-D2 zFinn",1
"Pro Bono",,,105603,Mon Mothma,"zzMon Mothma, Wedge Chirrut zCara Dune, Biggs",1
"Pro Bono",1,1,95614,Ewoks,"zChirpa Elder zPaploo zWicket zLogray",1
"Pro Bono",0,1,139248,BH,"zzBossk zZam zDengar zBoba zJango",1
"Pro Bono",1,1,98691,Carth,"zCarth Onasi, zMission zZaalbar zJuhani zCanderous",1
"Pro Bono",1,0,133284,501st,"zRex zARC Trooper, zEcho (501st), zzFives zAhsoka",1
"Pro Bono",0,1,88965,Phoenix,"zHera Chopper zEzra zKanan G8, zZeb",1
"Pro Bono",1,0,121102,EP (Counter, Rebel),"zzEP zKrennic DT zzWampa zStarck",1
"Pro Bono",1,0,59979,QiraNest,"Qira Nest G9, zzHYoda",1
"Pro Bono",1,0,13128,SionSolo (Counter),"Sion G8",1
"Pro Bono",,,84499,Admiral Raddus,"Admiral Raddus 3* G8, zCassian zzJyn zK-2SO Bistan",0
"Pro Bono",,,280499,Malevolence,"Malevolence Hyena Bomber 4*, Vulture Droid 3*, Sun Fac SF, Soldier SF, Spy SF",0
"Pro Bono",,,451751,Executrix,"Executrix Tie Adv, Emperor's Shuttle 4*, TIE Reaper 4*, Imperial TIE Fighter, Gauntlet Starfighter, FOSF TIE Fighter, FO TIE Fighter",0
"Pro Bono",,,111525,Bad Batch,"zHunter zEcho Omega 5* G8, zTech zWrecker",0
"Pro Bono",1,0,68583,Jawas,"Nebit G7, Jawa Engineer G8, Jawa Scavenger G8, Jawa G7, Dathcha G9",0
"Rick Sher Wood",,,182097,JMK,"zzzzzzJMK zAhsoka zzzCAT zzzzGAS zGK",1
"Rick Sher Wood",,,156137,Jabba,"zzzzzzJabba zBoushh (Leia Organa), zSkiff Guard (Lando Calrissian), zKrrsantan zBoba",1
"Rick Sher Wood",,,143004,SK,"zzEP zzMara Jade, The Emperor's Hand, zzStarkiller zzOld Ben, zVisas",1
"Rick Sher Wood",1,0,154234,CLS,"zzzCLS zHan zzChewbacca zzC-3PO zChewpio",1
"Rick Sher Wood",0,1,120306,DRMalak,"zzzDR zzHK-47 zBSF zzMalak Sith Assassin G8",1
"Rick Sher Wood",1,1,110171,NestSisters,"zzAV zzMT zDaka Zombie zNest",1
"Rick Sher Wood",,,494990,Negotiator,"Negotiator HT Anakin's Eta-2, Umbaran SF, Ahsoka's SF, BTL-B Y-wing, Clone Sergeant's ARC-170, Plo's SF",1
"Rick Sher Wood",,,430271,HansMF,"Home One, Han's MF, Rebel Y-wing, Bistan's U-wing, Phantom Biggs X-wing, Cassian's U-wing, Wedge X-wing",1
"Rick Sher Wood",1,1,119442,JTR,"zzzJTR zzR2-D2 zzBB-8 RH Finn G8, RH Poe G9",1
"Rick Sher Wood",0,1,139152,Grievous,"zzGG zB2 zB1 zMagnaGuard zNute",1
"Rick Sher Wood",1,0,141656,Traya,"zzTraya zzDN zSion zDooku zzThrawn",1
"Rick Sher Wood",,,112218,Mon Mothma,"zzMon Mothma, Wedge Chirrut Biggs Lando",1
"Rick Sher Wood",1,1,146816,Revan Offense,"zzzJKR zzGMY zzHYoda zJolee zJKA",1
"Rick Sher Wood",1,1,91816,Ewoks,"zChirpa Elder Paploo Wicket zLogray",1
"Rick Sher Wood",1,0,142161,ShaakClones,"zzShaak Ti, zRex zEcho (501st), zzFives zARC Trooper",1
"Rick Sher Wood",1,1,90274,Carth,"zCarth Onasi, zMission zZaalbar zVandor Chewbacca G9, Canderous G8",1
"Rick Sher Wood",0,1,150822,BH,"zzBossk zZam zDengar zFennec Shand, zzJango",1
"Rick Sher Wood",0,1,103987,FO,"zzKRU zKylo zHux FOO FOE",1
"Rick Sher Wood",0,1,76061,Phoenix,"Hera G8, zEzra Kanan G8, Zeb G8, Sabine G8",1
"Rick Sher Wood",1,0,78830,Jawas,"Nebit G8, Jawa Engineer G8, Jawa Scavenger G9, Jawa Dathcha",1
"Rick Sher Wood",,,172267,LV,"zzzzzzLord Vader, zzPiett zzzVader zRG zzTarkin",0
"Rick Sher Wood",,,71946,Admiral Raddus,"Admiral Raddus G8, Cassian G9, Jyn G8, Baze G8, Bistan G8",0
"Rick Sher Wood",,,148049,JMLS,"zBS zzzzzzJMLS zWat Tambor, zzJKL Barriss G8",0
"Rick Sher Wood",,,321002,Malevolence,"Malevolence Hyena Bomber 5*, Vulture Droid, Sun Fac SF, Soldier SF, Spy SF",0
"Rick Sher Wood",0,1,110833,Geonosians Omicron,"zzGBA Sun Fac, Geo Soldier, Geo Spy, Poggle",0
"Rick Sher Wood",,,467236,Executrix,"Executrix Tie Adv, Emperor's Shuttle 5*, TIE Reaper, Imperial TIE Fighter, Gauntlet Starfighter, FOSF TIE Fighter, FO TIE Fighter",0
"Rick Sher Wood",1,0,95761,Troopers,"zVeers zStarck zzGideon Dark Trooper G9, Iden Versio G9",0
"Rick Sher Wood",,,110191,Bad Batch,"zHunter zEcho Omega 5* G3, zTech zWrecker",0
"Waldo",,,125760,Phasma,"zPhasma zFOTP FOSFTP zFOST zKylo",1
"Waldo",1,1,176638,SL Kylo,"zzzzzzSL Kylo, zSith Trooper, zHux zzKRU zzThrawn",1
"Waldo",1,0,145185,CLS,"zzzCLS zHan zzChewbacca zzC-3PO zChewpio",1
"Waldo",0,1,140369,DRMalak,"zzzDR zzHK-47 zBSF zzMalak Sith Empire Trooper",1
"Waldo",0,1,116307,padme,"zzPadme zGK zJKA zAhsoka CW Chewbacca",1
"Waldo",,,453520,Negotiator,"Negotiator BTL-B Y-wing, Anakin's Eta-2, Rex's ARC-170, Umbaran SF, Ahsoka's SF, Plo's SF, Clone Sergeant's ARC-170",1
"Waldo",1,1,102411,NS_Alt,"zzMT zzAV zDaka Talia Zombie",1
"Waldo",,,459237,HansMF,"Home One, Han's MF, Rebel Y-wing, Bistan's U-wing, Phantom Ghost Cassian's U-wing, Wedge X-wing",1
"Waldo",1,1,125621,JTR,"zzzJTR Scav Rey, zzBB-8 zzR2-D2 RT",1
"Waldo",0,1,113209,Grievous,"zGG zB2 zDroideka zMagnaGuard zIG-88",1
"Waldo",,,120230,Mon Mothma,"zzMon Mothma, Wedge Bistan zCassian Biggs",1
"Waldo",1,1,122593,Revan Offense,"zzzJKR zGMY BS zJolee zzHYoda",1
"Waldo",1,0,129313,ShaakClones,"zzShaak Ti, zRex zEcho (501st), zzFives zARC Trooper",1
"Waldo",1,1,84402,Ewoks,"zChirpa Elder Paploo Scout Logray",1
"Waldo",0,1,102439,BH,"zzBossk Zam G9, zGreedo zBoba Cad",1
"Waldo",1,1,103614,zEP,"zzEP zzzVader Tarkin G9, TFP G9, DN G8",1
"Waldo",0,1,89054,Phoenix,"zHera Chopper zKanan zZeb G8, Sabine",1
"Waldo",0,1,92923,Geonosians Omicron,"zzGBA Sun Fac, Geo Soldier, Geo Spy, Poggle",0
"Waldo",1,1,88588,Carth,"zCarth Onasi, zMission zZaalbar zJuhani Canderous G7",0
"Waldo",1,0,47681,Troopers,"Veers G6, Starck G5, Gideon 5* G4, Snowtrooper G7, Magma G4",0
"Waldo",1,0,63761,Jawas,"Nebit G8, Jawa Engineer G7, Jawa Scavenger G8, Jawa G9, Dathcha G9",0
"Waldo",1,0,11586,SionSolo (Counter),"Sion G7",0
"Waldo",1,0,6672,NestSolo (Counter),"Nest G1",0
"Tharius Dawnbreaker",,,127149,Phasma,"zPhasma zFOTP FOSFTP zFOST zKylo",1
"Tharius Dawnbreaker",1,1,158138,SL Kylo,"zzzzzzSL Kylo, zSith Trooper, zHux zzKRU zThrawn",1
"Tharius Dawnbreaker",,,139884,SK,"zzEP zzMara Jade, The Emperor's Hand, zzStarkiller zOld Ben, zVisas",1
"Tharius Dawnbreaker",,,557799,Executor,"Executor HT RC Xanadu Blood, Slave I, IG-2000 Imperial TIE Fighter, Tie Adv",1
"Tharius Dawnbreaker",0,1,141257,padme,"zzPadme zGK zJKA zAhsoka zzzCAT",1
"Tharius Dawnbreaker",,,177781,JMLS,"zzzJKR zzJKL zzzzzzJMLS zWat Tambor, zzzzGAS",1
"Tharius Dawnbreaker",1,0,159465,CLS,"zzzCLS zHan zzChewbacca zzC-3PO zChewpio",1
"Tharius Dawnbreaker",0,1,132959,DRMalak,"zzzDR zzHK-47 zBSF zzMalak Sith Empire Trooper",1
"Tharius Dawnbreaker",1,1,106147,NS_Alt,"zzMT zzAV zDaka Talia Zombie",1
"Tharius Dawnbreaker",,,445472,HansMF,"Home One, Han's MF, Rebel Y-wing, Bistan's U-wing, Phantom Biggs X-wing, Cassian's U-wing, Wedge X-wing",1
"Tharius Dawnbreaker",1,1,130307,JTR,"zzzJTR Scav Rey, zzBB-8 zzR2-D2 zFinn",1
"Tharius Dawnbreaker",0,1,113260,Grievous,"zzGG zB2 zB1 zDroideka zDooku",1
"Tharius Dawnbreaker",1,0,112283,Troopers,"zVeers zzPiett zGideon zDark Trooper, Range Trooper",1
"Tharius Dawnbreaker",,,104032,Mon Mothma,"zzMon Mothma, Pao Wedge Bistan Biggs",1
"Tharius Dawnbreaker",1,1,87843,Ewoks,"zChirpa Elder Paploo zWicket zLogray",1
"Tharius Dawnbreaker",1,0,134509,ShaakClones,"zzShaak Ti, zRex zEcho (501st), zzFives zARC Trooper",1
"Tharius Dawnbreaker",0,1,128714,BH,"zzBossk zZam Dengar IG-88 Boba",1
"Tharius Dawnbreaker",1,1,94556,Carth,"zCarth Onasi, Mission Zaalbar Juhani Canderous",1
"Tharius Dawnbreaker",0,1,74481,Phoenix,"Hera Ezra Kanan G8, Zeb G8, Sabine G8",1
"Tharius Dawnbreaker",1,1,93736,Rogue1,"zJyn Chirrut Baze K-2SO G9, zCassian",1
"Tharius Dawnbreaker",1,0,65283,Jawas,"Nebit G8, Jawa Engineer G9, Jawa Scavenger G8, Jawa G9, Dathcha G9",1
"Tharius Dawnbreaker",1,0,20071,SionSolo (Counter),"zSion",1
"Tharius Dawnbreaker",,,456730,Negotiator,"Negotiator BTL-B Y-wing 4*, Anakin's Eta-2, Rex's ARC-170, Umbaran SF, Ahsoka's SF, Plo's SF, Clone Sergeant's ARC-170",0
"Tharius Dawnbreaker",,,257560,Malevolence,"Malevolence Hyena Bomber 4*, Vulture Droid 3*, Sun Fac SF, Soldier SF, Spy SF",0
"Tharius Dawnbreaker",0,1,94341,Geonosians Omicron,"zzGBA Sun Fac, Geo Soldier, Geo Spy, Poggle",0
"Tharius Dawnbreaker",,,73544,Iden Troopers,"zIden Versio 5*, Shoretrooper G9, Snowtrooper G8, Magma G9, DT",0
"Tharius Dawnbreaker",0,1,83631,BH,"zJango Greedo G9, Greef G8, Cad The Mandalorian",0
"Tharius Dawnbreaker",,,97585,Mando,"zzThe Mandalorian (Beskar Armor), zDash Rendar, Nest G7, IG-11 G9, Kuiil G9",0
"Tharius Dawnbreaker",,,55394,Bad Batch,"Hunter 5* G9, Echo 4* G8, Omega G8, Tech 4* G8, zWrecker 5* G8",0
"Pvaulter175",,,175828,JMK,"zzzzzzJMK zAhsoka zzzCAT zzzzGAS zGK",1
"Pvaulter175",,,411653,Profundity,"Profundity 5* Han's MF, Outrider Rebel Y-wing, Cassian's U-wing, Biggs X-wing",1
"Pvaulter175",,,565335,Executor,"Executor 6* HT RC Xanadu Blood, Slave I, IG-2000 Imperial TIE Fighter, Tie Adv",1
"Pvaulter175",,,164749,JMLS,"zBS zzzzzzJMLS zWat Tambor, zzJKL zJolee",1
"Pvaulter175",1,0,146262,CLS,"zzCLS zHan zzChewbacca zC-3PO zChewpio",1
"Pvaulter175",0,1,126147,DRMalak,"zzzDR HK-47 zBSF zzMalak Sith Empire Trooper",1
"Pvaulter175",,,491176,Negotiator,"Negotiator BTL-B Y-wing, Anakin's Eta-2, Rex's ARC-170, Umbaran SF, Ahsoka's SF, Plo's SF, Clone Sergeant's ARC-170",1
"Pvaulter175",,,308320,Malevolence,"Malevolence Hyena Bomber, Vulture Droid, Sun Fac SF, Soldier SF, Spy SF",1
"Pvaulter175",1,0,105378,Traya,"zzTraya zDN Sion G8, zzEP zThrawn",1
"Pvaulter175",0,1,119795,Grievous,"zzGG zB2 zDroideka MagnaGuard IG-88",1
"Pvaulter175",,,127493,Disintegration,"zAurra zGreef zBoba zzBossk zThe Mandalorian",1
"Pvaulter175",,,110153,Mon Mothma,"zzMon Mothma, Wedge Bistan Baze Biggs",1
"Pvaulter175",1,1,74685,Ewoks,"zChirpa G9, Elder Paploo G9, Wicket G9, Logray G9",1
"Pvaulter175",1,0,139363,ShaakClones,"zzShaak Ti, zRex zEcho (501st), zzFives zARC Trooper",1
"Pvaulter175",1,1,89904,Carth,"zCarth Onasi, zMission zZaalbar zVandor Chewbacca, Canderous",1
"Pvaulter175",1,0,113342,Troopers,"zVeers Starck zGideon Dark Trooper, zzPiett",1
"Pvaulter175",0,1,74285,Phoenix,"Hera Ezra G8, Kanan G8, Zeb G8, Sabine G8",1
"Pvaulter175",1,0,63726,Jawas,"Nebit Jawa Engineer G9, Jawa Scavenger G8, Jawa G8, Dathcha G8",1
"Pvaulter175",1,0,14794,NestSolo (Counter),"Nest G9",1
"Pvaulter175",,,73517,Phasma,"Phasma G9, FOTP G9, FOO G8, KRU zKylo",0
"Pvaulter175",,,122994,Admiral Raddus,"zzAdmiral Raddus, Cassian zJyn K-2SO G9, Chirrut",0
"Pvaulter175",0,1,90668,Geonosians Omicron,"zGBA Sun Fac, Geo Soldier, Geo Spy, Poggle",0
"Pvaulter175",1,1,101251,JTR,"JTR Scav Rey, BB-8 G8, zR2-D2 RT",0
"Pvaulter175",1,1,68502,NS,"MT G8, AV Daka G9, Zombie G8, Spirit G8",0
"Pvaulter175",,,65670,Iden Troopers,"zIden Versio G8, Stormtrooper G8, Snowtrooper G8, Magma G6, DT",0
"Pvaulter175",0,1,123981,BH,"Jango zZam Dengar zFennec Shand, Cad",0
"Kozisms formerly owen",,,186556,JMK,"zzzzzzJMK zAhsoka zzzCAT zzzzGAS zGK",1
"Kozisms formerly owen",1,1,166143,SL Kylo,"zzzzzzSL Kylo, zSith Trooper, zHux zzKRU zzThrawn",1
"Kozisms formerly owen",,,580319,Executor,"Executor HT RC Xanadu Blood, Slave I, IG-2000 Imperial TIE Fighter, Tie Adv",1
"Kozisms formerly owen",0,1,124733,DRMalak,"zzzDR zzHK-47 zBSF zzMalak Sith Empire Trooper",1
"Kozisms formerly owen",1,1,113730,NestSisters,"zzAV zzMT zDaka Zombie zNest",1
"Kozisms formerly owen",,,517146,Negotiator,"Negotiator BTL-B Y-wing, Anakin's Eta-2, Rex's ARC-170, Umbaran SF, Ahsoka's SF, Plo's SF, Clone Sergeant's ARC-170",1
"Kozisms formerly owen",,,314999,Malevolence,"Malevolence Hyena Bomber, Vulture Droid, Sun Fac SF, Soldier SF, Spy SF",1
"Kozisms formerly owen",,,405103,HansMF,"Home One, Han's MF, Rebel Y-wing, Ghost Phantom Biggs X-wing, Cassian's U-wing, Wedge X-wing",1
"Kozisms formerly owen",0,1,138786,Grievous,"zzGG zB2 zB1 zMagnaGuard zNute",1
"Kozisms formerly owen",1,1,111323,JTR,"zzzJTR Scav Rey, zzBB-8 zzR2-D2 Finn",1
"Kozisms formerly owen",1,0,137675,Traya,"zzTraya zDN zSion zDooku zzEP",1
"Kozisms formerly owen",1,1,145453,Revan Offense,"zzzJKR zzGMY zzHYoda zJolee zJKA",1
"Kozisms formerly owen",1,0,128683,CLS,"zzzCLS zHan zzChewbacca zLeia zzC-3PO",1
"Kozisms formerly owen",1,1,97509,Ewoks,"zChirpa Elder zPaploo zWicket zLogray",1
"Kozisms formerly owen",1,0,146560,ShaakClones,"zzShaak Ti, zRex zEcho (501st), zzFives zARC Trooper",1
"Kozisms formerly owen",0,1,150836,BH,"zzBossk zDengar zIG-88 zBoba zzJango",1
"Kozisms formerly owen",1,1,102789,Carth,"zCarth Onasi, zMission zZaalbar zJuhani zCanderous",1
"Kozisms formerly owen",0,1,98491,Phoenix,"zHera zEzra zKanan Zeb zSabine",1
"Kozisms formerly owen",,,122707,Phasma,"zPhasma zFOTP FOSFTP zFOST zKylo",0
"Kozisms formerly owen",0,1,100894,Geonosians Omicron,"zzGBA Sun Fac, Geo Soldier, Geo Spy, Poggle",0
"Kozisms formerly owen",1,0,85371,Troopers,"Veers G7, Starck G8, zzPiett Shoretrooper Stormtrooper G8",0
"Kozisms formerly owen",1,0,67881,Wiggs,"Wedge Biggs G8, Fulcrum Chirrut G7, Baze G7",0
"Kozisms formerly owen",1,0,71724,Jawas,"Nebit G8, Jawa Engineer G9, Jawa Scavenger G8, Jawa G7, Dathcha",0
"Dawnbreaker",,,123489,Phasma,"zPhasma zFOTP FOSFTP zFOST zKylo",1
"Dawnbreaker",1,1,164664,SL Kylo,"zzzzzzSL Kylo, zSith Trooper, zHux zzKRU zzThrawn",1
"Dawnbreaker",,,558939,Executor,"Executor 6* HT RC Xanadu Blood, Slave I, IG-2000 Imperial TIE Fighter, Tie Adv",1
"Dawnbreaker",0,1,143434,padme,"zzPadme zGK zJKA zAhsoka zzzCAT",1
"Dawnbreaker",1,0,149969,CLS,"zzzCLS zHan zzChewbacca zzC-3PO zChewpio",1
"Dawnbreaker",1,1,101597,NS_Alt,"zzMT zAV zDaka Talia Zombie",1
"Dawnbreaker",0,1,117469,Grievous-Wat,"zzGG zB2 zB1 MagnaGuard zWat Tambor",1
"Dawnbreaker",1,1,109719,JTR,"zzzJTR Scav Rey, zzBB-8 zzR2-D2 zFinn",1
"Dawnbreaker",1,1,150569,GAS,"zzzzGAS zRex zEcho (501st), zzFives zARC Trooper",1
"Dawnbreaker",1,1,118275,Revan Offense,"zzzJKR zGMY BS zJolee HYoda",1
"Dawnbreaker",1,1,86595,Ewoks,"zChirpa Elder Paploo zWicket Logray",1
"Dawnbreaker",0,1,143420,BH,"zzBossk Dengar zIG-88 zBoba zJango",1
"Dawnbreaker",1,1,69624,Carth,"zCarth Onasi, Mission G8, Zaalbar G8, Juhani G9, Canderous G8",1
"Dawnbreaker",1,1,129359,zEP,"zzEP zzzVader Tarkin G9, TFP zBSF",1
"Dawnbreaker",1,0,109721,Troopers,"zVeers zStarck zDark Trooper, zzPiett DT",1
"Dawnbreaker",0,1,80722,Phoenix,"Hera Chopper Ezra Kanan G8, Zeb",1
"Dawnbreaker",,,95167,Admiral Raddus,"zAdmiral Raddus 4* G8, zCassian zzJyn K-2SO G6, Bistan",0
"Dawnbreaker",,,479963,Negotiator,"Negotiator BTL-B Y-wing 2*, Anakin's Eta-2, Rex's ARC-170, Umbaran SF, Ahsoka's SF, Plo's SF, Clone Sergeant's ARC-170",0
"Dawnbreaker",,,263761,Malevolence,"Malevolence Hyena Bomber 4*, Vulture Droid 3*, Sun Fac SF, Soldier SF, Spy SF",0
"Dawnbreaker",0,1,93129,Geonosians Omicron,"zzGBA Sun Fac, Geo Soldier, Geo Spy, Poggle",0
"Dawnbreaker",,,394781,HansMF,"Home One, Han's MF, Rebel Y-wing 5*, Bistan's U-wing 5*, Phantom Ghost Cassian's U-wing, Wedge X-wing",0
"Dawnbreaker",1,0,65276,Traya,"zTraya G9, DN 5* G7, Sion G7, Dooku G8, Sith Empire Trooper G8",0
"Dawnbreaker",,,87418,Mon Mothma,"zzMon Mothma, Wedge G8, zKyle Katarn, Cara Dune G9, Biggs G8",0
"Ryzilio",,,123652,Phasma,"zPhasma zFOTP FOSFTP zFOST zKylo",1
"Ryzilio",1,1,155032,SL Kylo,"zzzzzzSL Kylo, zSith Trooper, zHux zzKRU zThrawn",1
"Ryzilio",1,1,168450,GL Rey,"zzzzzzRey zzzJTR zzBB-8 zHoldo zRH Finn",1
"Ryzilio",0,1,133761,DRMalak,"zzzDR zzHK-47 zBSF zzMalak Sith Empire Trooper",1
"Ryzilio",0,1,123355,padme,"zzPadme zGK zJKA zAhsoka zzC-3PO",1
"Ryzilio",,,416352,Negotiator,"Negotiator HT Anakin's Eta-2, Umbaran SF, Ahsoka's SF, Clone Sergeant's ARC-170, Jedi Consular's Starfighter, Plo's SF",1
"Ryzilio",,,467646,Raddus,"Raddus Sun Fac SF, Rey's Millennium Falcon, Poe Dameron's X-wing, Resistance X-wing, Biggs X-wing, Wedge X-wing, Phantom Ghost",1
"Ryzilio",1,1,120366,Revan Offense,"zzzJKR zGMY BS zJolee Ezra",1
"Ryzilio",1,1,83587,Ewoks,"zChirpa Elder Paploo Wicket zLogray",1
"Ryzilio",1,0,135669,ShaakClones,"zzShaak Ti, zRex zEcho (501st), zzFives zARC Trooper",1
"Ryzilio",0,1,106988,BH,"zzBossk zDengar zBoba zzGreef Cad",1
"Ryzilio",1,1,89116,Carth,"zCarth Onasi, Mission Zaalbar Juhani Canderous",1
"Ryzilio",1,0,86666,CLS,"zzCLS zHan Leia Old Ben, Chewbacca",1
"Ryzilio",1,1,110918,zEP,"zzEP zzzVader Tarkin zDooku TFP",1
"Ryzilio",0,1,78084,Phoenix,"Hera Chopper Kanan Zeb Sabine G8",1
"Ryzilio",,,76361,Grievous Omicron,"GG G9, B2 B1 MagnaGuard G9, Droideka",0
"Ryzilio",0,1,91379,Geonosians Omicron,"zzGBA Sun Fac, Geo Soldier, Geo Spy, Poggle",0
"Ryzilio",1,0,57617,Troopers,"Veers Piett G8, Gideon 4* G9, Dark Trooper 5* G7, Range Trooper 5* G2",0
"Ryzilio",0,1,77416,BH,"Jango G7, Embo 5* G7, Greedo G9, IG-88 zzThe Mandalorian",0
