Player,Offense,Defense,GP,Name,Squad,Viable
"Sherman8erx",1,0,142721,CLS,"zzzCLS zHan zzChewbacca zzC-3PO zChewpio",1
"Sherman8erx",0,1,121494,DRMalak,"zzzDR zzHK-47 zBSF zzMalak Sith Empire Trooper",1
"Sherman8erx",,,121655,Grievous Omicron,"zzGG zB2 zB1 zMagnaGuard zDroideka",1
"Sherman8erx",0,1,114550,padme,"zzPadme zGK zJKA zAhsoka zBarriss",1
"Sherman8erx",1,1,108493,NS_Alt,"zzMT zzAV zDaka Talia Zombie",1
"Sherman8erx",0,1,112490,Geonosians Omicron,"zzGBA Sun Fac, Geo Soldier, Geo Spy, Poggle",1
"Sherman8erx",,,402930,HansMF,"Home One, Han's MF, Rebel Y-wing 6*, Bistan's U-wing, Phantom Ghost Cassian's U-wing, Biggs X-wing",1
"Sherman8erx",,,459168,Negotiator,"Negotiator HT Anakin's Eta-2, Umbaran SF, Ahsoka's SF, Clone Sergeant's ARC-170, Plo's SF, Rex's ARC-170",1
"Sherman8erx",1,0,118344,Traya,"zzTraya zDN zSion zDooku zzEP",1
"Sherman8erx",,,115343,Disintegration,"Aurra zGreef zBoba zzBossk The Mandalorian",1
"Sherman8erx",1,1,127957,GAS,"zzzzGAS zRex zEcho (501st), zzFives zARC Trooper",1
"Sherman8erx",1,1,133909,Revan Offense,"zzzJKR zGMY zBS zJolee zHYoda",1
"Sherman8erx",1,1,92211,Ewoks,"zChirpa Elder Paploo zWicket Logray",1
"Sherman8erx",1,1,102258,Carth,"zCarth Onasi, zMission zZaalbar Juhani zCanderous",1
"Sherman8erx",1,0,109862,Troopers,"zVeers zStarck Snowtrooper zzPiett DT",1
"Sherman8erx",0,1,79229,Phoenix,"zHera G8, zEzra zKanan G8, Zeb G8, Sabine G8",1
"Sherman8erx",1,0,84324,Jawas,"Nebit Jawa Engineer, Jawa Scavenger, Jawa Dathcha",1
"Sherman8erx",1,0,15925,NestSolo (Counter),"Nest",1
"Sherman8erx",,,123338,Phasma,"zPhasma zFOTP FOSFTP zFOST zKylo",0
"Sherman8erx",,,436448,Executrix,"Executrix Tie Adv, Emperor's Shuttle 4*, TIE Reaper 6*, Imperial TIE Fighter, Gauntlet Starfighter, FOSF TIE Fighter, FO TIE Fighter",0
"Sherman8erx",,,87889,Mon Mothma,"zzMon Mothma 5* G9, Wedge Cara Dune, Biggs Lando",0
"Sherman8erx",0,1,120366,BH,"zJango zZam zDengar Greedo zIG-88",0
"DarthKevin",,,181490,JMK,"zzzzzzJMK zAhsoka zzzCAT zzzzGAS zGK",1
"DarthKevin",1,1,162907,SL Kylo,"zzzzzzSL Kylo, zSith Trooper, zHux zzKRU zThrawn",1
"DarthKevin",,,559285,Executor,"Executor 5* HT RC Xanadu Blood, Slave I, IG-2000 Imperial TIE Fighter, Tie Adv",1
"DarthKevin",1,0,146098,CLS,"zzzCLS zHan zzChewbacca zzC-3PO zChewpio",1
"DarthKevin",0,1,120882,DRMalak,"zzzDR zHK-47 zBSF zzMalak Sith Empire Trooper G8",1
"DarthKevin",1,1,101758,NestSisters,"zzAV zzMT Daka Zombie zNest",1
"DarthKevin",,,493484,Negotiator,"Negotiator BTL-B Y-wing, Anakin's Eta-2, Rex's ARC-170, Umbaran SF, Ahsoka's SF, Plo's SF, Clone Sergeant's ARC-170",1
"DarthKevin",,,140962,JKL,"zzJKL zzzJKR zzHYoda zOld Ben, Aayla",1
"DarthKevin",,,409262,HansMF,"Home One, Han's MF, Rebel Y-wing, Bistan's U-wing, Phantom Biggs X-wing, Cassian's U-wing, Wedge X-wing",1
"DarthKevin",0,1,131039,Grievous-Wat,"zzGG zB2 zB1 zMagnaGuard zWat Tambor",1
"DarthKevin",1,1,120082,JTR,"zJTR Scav Rey, zzBB-8 zzR2-D2 RT",1
"DarthKevin",1,0,117876,Traya,"zzTraya zDN zSion zDooku zzEP",1
"DarthKevin",,,101318,Mon Mothma,"zzMon Mothma, zPao Wedge Cara Dune, Hoth Rebel Scout",1
"DarthKevin",1,0,135354,Troopers,"zVeers zzPiett zGideon zDark Trooper, Range Trooper",1
"DarthKevin",1,1,80231,Ewoks,"zChirpa G9, Elder Paploo Wicket Logray G9",1
"DarthKevin",1,0,144473,ShaakClones,"zzShaak Ti, zRex zEcho (501st), zzFives zARC Trooper",1
"DarthKevin",0,1,141858,BH,"zzBossk Dengar zIG-88 zBoba Jango",1
"DarthKevin",0,1,65806,Phoenix,"Hera G8, Chopper G8, Ezra Kanan G8, Zeb G8",1
"DarthKevin",1,1,76996,Rogue1,"Jyn Chirrut Baze K-2SO G9, Cassian",1
"DarthKevin",,,91274,Bad Batch,"zHunter zEcho zOmega Tech zWrecker",1
"DarthKevin",1,0,69381,Jawas,"Nebit Jawa Engineer G9, Jawa Scavenger G8, Jawa G9, Dathcha G8",1
"DarthKevin",,,123159,Phasma,"zPhasma zFOTP FOSFTP zFOST zKylo",0
"DarthKevin",0,1,93033,Geonosians Omicron,"zzGBA Sun Fac, Geo Soldier, Geo Spy, Poggle",0
"DarthKevin",1,1,86664,Carth,"zCarth Onasi, zMission Zaalbar Juhani G7, zCanderous",0
"DarthKevin",,,75589,Iden Troopers,"zIden Versio, Shoretrooper Snowtrooper Magma G7, DT",0
"Fosachi Walker",1,1,115121,NS,"zzMT zzAV zDaka Zombie Spirit",1
"Fosachi Walker",0,1,144091,padme,"zzPadme zGK zJKA zAhsoka zzC-3PO",1
"Fosachi Walker",0,1,127211,DRMalak,"zzzDR zzHK-47 zBSF zzMalak Sith Empire Trooper",1
"Fosachi Walker",,,402208,HansMF,"Home One, Han's MF, Rebel Y-wing, Bistan's U-wing, Phantom Ghost Cassian's U-wing, Wedge X-wing",1
"Fosachi Walker",,,499792,Negotiator,"Negotiator HT Anakin's Eta-2, Umbaran SF, Ahsoka's SF, Clone Sergeant's ARC-170, Plo's SF, Rex's ARC-170",1
"Fosachi Walker",0,1,116846,Grievous,"zzGG zB2 zB1 zMagnaGuard zNute",1
"Fosachi Walker",1,0,125454,Traya,"zzTraya zzDN zSion zzEP zzThrawn",1
"Fosachi Walker",1,1,114019,JTR,"zzzJTR zScav Rey, zzBB-8 zzR2-D2 zFinn",1
"Fosachi Walker",1,1,135021,GAS,"zzzzGAS zRex zEcho (501st), zzFives zARC Trooper",1
"Fosachi Walker",1,1,143813,Revan Offense,"zzzJKR zzGMY zBS zJolee zzHYoda",1
"Fosachi Walker",1,1,100051,Ewoks,"zChirpa Elder zPaploo zWicket zLogray",1
"Fosachi Walker",0,1,113366,BH,"zzBossk Dengar G8, zBoba zzJango zzThe Mandalorian",1
"Fosachi Walker",1,1,99456,Carth,"zCarth Onasi, zMission zZaalbar zJuhani zCanderous",1
"Fosachi Walker",1,0,123066,CLS,"zzzCLS zHan zLeia zFulcrum zzChewbacca",1
"Fosachi Walker",0,1,88357,Phoenix,"zHera zEzra Kanan Zeb G8, zSabine",1
"Fosachi Walker",1,0,97937,zMaul,"zDarth Maul, zDooku zSidious Sith Assassin, zSavage",1
"Fosachi Walker",1,0,80617,Jawas,"Nebit G9, Jawa Engineer, Jawa Scavenger, Jawa Dathcha",1
"Fosachi Walker",1,0,18625,NestSolo (Counter),"zNest",1
"Fosachi Walker",,,83638,Phasma,"zPhasma G9, zFOTP FOSFTP G7, zFOST G9, zKylo",0
"Fosachi Walker",0,1,93169,Geonosians Omicron,"zzGBA Sun Fac, Geo Soldier, Geo Spy, Poggle",0
"Fosachi Walker",,,380742,Executrix,"Executrix Tie Adv, Emperor's Shuttle 4*, TIE Reaper 5*, Imperial TIE Fighter, Gauntlet Starfighter 6*, FOSF TIE Fighter, FO TIE Fighter",0
"Fosachi Walker",,,88038,Mon Mothma,"Mon Mothma 5* G6, Wedge zKyle Katarn, Biggs Lando",0
"Fosachi Walker",1,0,87081,Troopers,"zVeers zStarck Snowtrooper G8, zzPiett Stormtrooper G8",0
"Fosachi Walker",,,55996,Bad Batch,"Hunter 6* G9, Echo 2* G5, Omega G9, Tech 4* G9, Wrecker 6* G8",0
"Troan Ziroc",1,1,163374,SL Kylo,"zzzzzzSL Kylo, zSith Trooper, zHux zzKRU zzThrawn",1
"Troan Ziroc",,,179666,JMLS,"zzzJKR zzJKL zzzzzzJMLS zzHYoda zzzzGAS",1
"Troan Ziroc",1,0,154907,CLS,"zzzCLS zHan zzChewbacca zzC-3PO zChewpio",1
"Troan Ziroc",0,1,118763,padme,"zzPadme zGK zJKA zAhsoka zBarriss",1
"Troan Ziroc",0,1,109540,DRMalak,"zzzDR zzHK-47 zBSF zzMalak Sith Empire Trooper G8",1
"Troan Ziroc",,,440367,Negotiator,"Negotiator HT Anakin's Eta-2, Umbaran SF, Ahsoka's SF, BTL-B Y-wing, Clone Sergeant's ARC-170, Plo's SF",1
"Troan Ziroc",,,276128,Malevolence,"Malevolence 5* Hyena Bomber, Vulture Droid, Sun Fac SF, Soldier SF, Spy SF",1
"Troan Ziroc",,,455925,HansMF,"Home One, Han's MF, Rebel Y-wing, Bistan's U-wing, Phantom Ghost Cassian's U-wing, Wedge X-wing",1
"Troan Ziroc",0,1,110924,Grievous,"zzGG zB2 zB1 zMagnaGuard zNute",1
"Troan Ziroc",1,1,123025,JTR,"zzzJTR Scav Rey, zzBB-8 zzR2-D2 Finn",1
"Troan Ziroc",1,0,116185,Traya,"zzTraya zDN zSion zDooku zzEP",1
"Troan Ziroc",,,438609,Executrix,"Executrix Tie Adv, Emperor's Shuttle, TIE Reaper, Imperial TIE Fighter, Gauntlet Starfighter, FOSF TIE Fighter, FO TIE Fighter",1
"Troan Ziroc",,,109397,Mon Mothma,"zzMon Mothma, Wedge Bistan zCara Dune, Biggs",1
"Troan Ziroc",,,124734,Disintegration,"zzAurra Greef G8, zBoba zzBossk zzThe Mandalorian",1
"Troan Ziroc",1,0,121005,ShaakClones,"zzShaak Ti, zRex zEcho (501st), zzFives zARC Trooper",1
"Troan Ziroc",1,1,100433,Carth,"zCarth Onasi, zMission zZaalbar zJuhani zCanderous",1
"Troan Ziroc",0,1,130136,BH,"zzJango zDengar zGreedo zFennec Shand, zBoushh (Leia Organa)",1
"Troan Ziroc",0,1,94129,Phoenix,"zHera zEzra zKanan zZeb G9, zSabine",1
"Troan Ziroc",1,0,19638,NestSolo (Counter),"zNest",1
"Troan Ziroc",,,121777,Phasma,"zPhasma zFOTP FOSFTP zFOST zKylo",0
"Troan Ziroc",,,84277,Admiral Raddus,"Admiral Raddus, Cassian Jyn K-2SO Chirrut G7",0
"Troan Ziroc",0,1,95221,Geonosians Omicron,"zzGBA Sun Fac, Geo Soldier, Geo Spy, Poggle",0
"Troan Ziroc",1,1,80607,NS,"MT zzAV Daka G9, Zombie G7, Spirit G3",0
"Troan Ziroc",1,0,82423,Troopers,"Veers zzPiett Gideon Dark Trooper G7, Range Trooper",0
"Troan Ziroc",1,1,87195,Ewoks,"Chirpa Elder Paploo G9, zWicket zLogray",0
"Troan Ziroc",,,72168,Iden Troopers,"Iden Versio G8, Shoretrooper Snowtrooper G8, Magma G8, DT",0
"Troan Ziroc",,,92598,Bad Batch,"zHunter zEcho G9, zzOmega zTech zWrecker G9",0
"Troan Ziroc",1,0,61193,Jawas,"Nebit G6, Jawa Engineer 6* G1, Jawa Scavenger G7, Jawa Dathcha G9",0
"Gorgatron",,,186129,JMK,"zzzzzzJMK zAhsoka zzzCAT zzzzGAS zGK",1
"Gorgatron",,,176116,LV,"zzzzzzLord Vader, zzPiett zzzVader zRG zTarkin",1
"Gorgatron",,,127654,Phasma,"zPhasma zFOTP FOSFTP zFOST zKylo",1
"Gorgatron",,,143409,Admiral Raddus,"zzAdmiral Raddus, zCassian zJyn zK-2SO Bistan",1
"Gorgatron",,,446407,Profundity,"Profundity Han's MF, Outrider Rebel Y-wing, Cassian's U-wing, Ghost",1
"Gorgatron",1,1,167278,SL Kylo,"zzzzzzSL Kylo, zSith Trooper, zHux zzKRU zThrawn",1
"Gorgatron",,,169905,SEE,"zzzzzzSEE zBSF zzMalak zzzDR zDooku",1
"Gorgatron",0,1,104942,Qira,"Qira zL3-37 zVandor Chewbacca, zMission zZaalbar",1
"Gorgatron",1,1,168712,GL Rey,"zzzzzzRey zzzJTR zzR2-D2 zRH Poe, zRH Finn",1
"Gorgatron",,,143347,SK,"zzEP zzMara Jade, The Emperor's Hand, zzStarkiller zzOld Ben, Visas",1
"Gorgatron",1,1,129833,NS,"zzMT zzAV zDaka Zombie Spirit",1
"Gorgatron",,,607431,Executor,"Executor HT RC Xanadu Blood, Slave I, IG-2000 Imperial TIE Fighter, Tie Adv",1
"Gorgatron",,,163471,JMLS,"zBS zzzzzzJMLS zWat Tambor, zzJKL zJolee",1
"Gorgatron",1,0,153164,CLS,"zzzCLS zHan zzChewbacca zzC-3PO zChewpio",1
"Gorgatron",,,131927,Grievous Omicron,"zzGG zB2 zB1 zMagnaGuard zDroideka",1
"Gorgatron",,,524486,Negotiator,"Negotiator BTL-B Y-wing, Anakin's Eta-2, Rex's ARC-170, Umbaran SF, Ahsoka's SF, Plo's SF, Clone Sergeant's ARC-170",1
"Gorgatron",,,320475,Malevolence,"Malevolence Hyena Bomber, Vulture Droid, Sun Fac SF, Soldier SF, Spy SF",1
"Gorgatron",0,1,105744,Geonosians Omicron,"zzGBA Sun Fac, Geo Soldier, Geo Spy, Poggle",1
"Gorgatron",,,118168,Mon Mothma,"zzMon Mothma, zPao Wedge zCara Dune, Hoth Rebel Scout",1
"Gorgatron",,,141057,Disintegration,"zAurra zzGreef zBoba zzBossk zThe Mandalorian",1
"Gorgatron",1,1,110844,Ewoks,"zChirpa Elder zPaploo zWicket zLogray",1
"Gorgatron",1,0,152546,ShaakClones,"zzShaak Ti, zRex zEcho (501st), zzFives zARC Trooper",1
"Gorgatron",0,1,149054,BH,"zzJango zZam zDengar zFennec Shand, Cad",1
"Gorgatron",1,0,130157,Troopers,"zVeers zStarck zzGideon zDark Trooper, zIden Versio",1
"Gorgatron",0,1,87242,Phoenix,"Hera Ezra Kanan G8, Zeb Sabine",1
"Gorgatron",,,125351,Bad Batch,"zHunter zEcho zzOmega zTech zWrecker",1
"Gorgatron",,,136515,Mando,"zzThe Mandalorian (Beskar Armor), zDash Rendar, zNest zIG-11 zKuiil",1
"Gorgatron",1,0,79082,Jawas,"Nebit Jawa Engineer, Jawa Scavenger, Jawa G9, Dathcha G8",1
"Gorgatron",1,0,21369,SionSolo (Counter),"zSion",1
"Gorgatron",1,0,123192,zMaul,"Darth Maul, zDN zSidious zSavage Sith Marauder",0
"EthanDB123",1,1,152379,SL Kylo,"zzzzzzSL Kylo, zSith Trooper, zHux zzKRU Thrawn",1
"EthanDB123",0,1,108269,padme,"zzPadme zGK JKA zAhsoka zC-3PO",1
"EthanDB123",1,0,96811,CLS,"zzCLS zHan zChewbacca zR2-D2 G9, Chewpio",1
"EthanDB123",,,319317,HansMF,"Home One, Han's MF, HT Ghost Phantom Biggs X-wing, Cassian's U-wing, Wedge X-wing",1
"EthanDB123",1,0,97402,Traya,"zzTraya DN Sion G9, zEP Sith Empire Trooper G9",1
"EthanDB123",0,1,113470,Grievous,"zzGG zB2 zDroideka MagnaGuard IG-88",1
"EthanDB123",1,1,113151,Revan Offense,"zzzJKR zzGMY BS zJolee Ezra",1
"EthanDB123",1,1,82705,Ewoks,"zChirpa Elder Paploo Wicket Logray",1
"EthanDB123",0,1,112680,BH,"zBossk Dengar zBoba Jango Cad",1
"EthanDB123",1,0,19719,NestSolo (Counter),"Nest",1
"EthanDB123",,,119510,Phasma,"zPhasma zFOTP FOSFTP FOST Kylo",0
"EthanDB123",0,1,91699,Geonosians Omicron,"zGBA Sun Fac, Geo Soldier, Geo Spy, Poggle",0
"EthanDB123",1,0,65155,Troopers,"zVeers 5* zPiett Gideon 4* G8, Dark Trooper 6* G9, Range Trooper 4* G7",0
"EthanDB123",1,1,73276,GAS,"GAS 5* Rex Echo (501st) G9, Fives G9, ARC Trooper G8",0
"EthanDB123",1,1,83058,Carth,"zCarth Onasi, Mission Zaalbar Juhani Canderous G7",0
"Busan Kaz",,,176381,JMK,"zzzzzzJMK zJKA zGMY zzShaak Ti, zGK",1
"Busan Kaz",,,172741,LV,"zzzzzzLord Vader, zzPiett zzzVader zRG zTarkin",1
"Busan Kaz",,,122769,Phasma,"zPhasma zFOTP FOSFTP zFOST zKylo",1
"Busan Kaz",1,1,165994,SL Kylo,"zzzzzzSL Kylo, zSith Trooper, zHux zzKRU zThrawn",1
"Busan Kaz",,,169539,SEE,"zzzzzzSEE zBSF zzMalak zzzDR zDooku",1
"Busan Kaz",,,141071,SK,"zzEP zzMara Jade, The Emperor's Hand, zzStarkiller zzOld Ben, zVisas",1
"Busan Kaz",1,1,107848,NS,"zzMT zzAV zDaka Zombie Spirit",1
"Busan Kaz",,,558971,Executor,"Executor 5* HT RC Xanadu Blood, Slave I, IG-2000 Imperial TIE Fighter, Tie Adv",1
"Busan Kaz",,,182476,JMLS,"zzzJKR zzJKL zzzzzzJMLS zWat Tambor, zzzzGAS",1
"Busan Kaz",1,0,152199,CLS,"zzzCLS zHan zzChewbacca zzC-3PO zChewpio",1
"Busan Kaz",,,515249,Negotiator,"Negotiator BTL-B Y-wing, Anakin's Eta-2, Rex's ARC-170, Umbaran SF, Ahsoka's SF, Plo's SF, Clone Sergeant's ARC-170",1
"Busan Kaz",,,455677,HansMF,"Home One, Han's MF, Rebel Y-wing, Bistan's U-wing, Phantom Biggs X-wing, Cassian's U-wing, Wedge X-wing",1
"Busan Kaz",1,1,137265,JTR,"zzzJTR zzR2-D2 zzBB-8 zRH Finn, zRH Poe",1
"Busan Kaz",0,1,135319,Grievous,"zzGG zB2 zB1 zMagnaGuard zNute",1
"Busan Kaz",1,0,103491,Traya,"zzTraya zDN zSion Sith Empire Trooper, zNest",1
"Busan Kaz",,,104236,Mon Mothma,"zzMon Mothma, Wedge Scarif zCara Dune, Biggs",1
"Busan Kaz",,,134582,Disintegration,"zzAurra zzGreef zBoba zzBossk zThe Mandalorian",1
"Busan Kaz",1,1,84985,Ewoks,"zChirpa Elder zPaploo zWicket zLogray",1
"Busan Kaz",1,1,94761,Carth,"zCarth Onasi, zMission zZaalbar Juhani Canderous",1
"Busan Kaz",1,0,147638,501st,"zRex zARC Trooper, zEcho (501st), zzFives zAhsoka",1
"Busan Kaz",1,0,107849,Troopers,"zVeers zStarck zzGideon DT zIden Versio",1
"Busan Kaz",0,1,79526,Phoenix,"Hera zEzra Kanan G8, Zeb G8, zSabine G9",1
"Busan Kaz",1,1,83217,Rogue1,"zJyn Chirrut G8, Baze G8, K-2SO G8, Cassian",1
"Busan Kaz",,,128340,Bad Batch,"zHunter zEcho zzOmega zTech zWrecker",1
"Busan Kaz",,,300005,Malevolence,"Malevolence Hyena Bomber 5*, Vulture Droid 6*, Sun Fac SF, Soldier SF, Spy SF",0
"Busan Kaz",0,1,94369,Geonosians Omicron,"zzGBA Sun Fac, Geo Soldier, Geo Spy, Poggle",0
"Busan Kaz",0,1,141014,BH,"zJango zZam zEmbo zDengar zIG-88",0
"Busan Kaz",1,0,54871,Jawas,"Nebit G8, Jawa Engineer G8, Jawa Scavenger G7, Jawa Dathcha",0
"shausrath",,,123631,Phasma,"zPhasma zFOTP FOSFTP zFOST zKylo",1
"shausrath",1,1,167106,SL Kylo,"zzzzzzSL Kylo, zSith Trooper, zHux zzKRU zzThrawn",1
"shausrath",,,421737,Negotiator,"Negotiator 5* BTL-B Y-wing, Anakin's Eta-2, Rex's ARC-170, Umbaran SF, Ahsoka's SF, Plo's SF, Clone Sergeant's ARC-170",1
"shausrath",0,1,95668,Geonosians Omicron,"zzGBA Sun Fac, Geo Soldier, Geo Spy, Poggle",1
"shausrath",,,304248,HansMF,"Home One, Han's MF 5*, Rebel Y-wing, Bistan's U-wing, Phantom Ghost Cassian's U-wing, Biggs X-wing",1
"shausrath",1,1,108964,JTR,"zzzJTR R2-D2 zzBB-8 RH Finn, RH Poe",1
"shausrath",1,1,95549,Ewoks,"zChirpa Elder zPaploo zWicket zLogray",1
"shausrath",1,0,134359,ShaakClones,"zzShaak Ti, zRex zEcho (501st), zzFives zARC Trooper",1
"shausrath",0,1,93573,BH,"zzBossk Boba G9, Greef Cad The Mandalorian",1
"shausrath",1,1,135753,zEP,"zzEP zzzVader zzTarkin zKrennic TFP",1
"shausrath",0,1,76520,Phoenix,"Hera Chopper Ezra Kanan G8, Zeb G8",1
"shausrath",1,0,14320,SionSolo (Counter),"Sion G9",1
"shausrath",0,1,101431,padme,"Padme G7, zGK zJKA zAhsoka C-3PO",0
"shausrath",0,1,86549,Grievous,"GG B2 G8, zDooku T3-M4 L3-37",0
"shausrath",1,1,65699,NS,"MT G8, zAV Daka Zombie G8, Spirit G8",0
"shausrath",1,1,71112,Revan Offense,"JKR G7, GMY G9, BS Jolee HYoda G7",0
"shausrath",1,0,100318,Troopers,"zVeers zStarck Dark Trooper 6* G7, zzPiett Iden Versio G8",0
"shausrath",1,0,56000,Wiggs,"Wedge G8, Biggs G9, Han Fulcrum G5, Leia G5",0
"DaveSkywalker",,,178692,JMK,"zzzzzzJMK zAhsoka zzzCAT zzzzGAS zGK",1
"DaveSkywalker",1,0,146008,CLS,"zzzCLS zHan zzChewbacca zzC-3PO zChewpio",1
"DaveSkywalker",,,132188,Grievous Omicron,"zzGG zB2 zB1 zMagnaGuard zDroideka",1
"DaveSkywalker",0,1,112061,Geonosians Omicron,"zzGBA Sun Fac, Geo Soldier, Geo Spy, Poggle",1
"DaveSkywalker",,,134890,JKL,"zzJKL zzzJKR HYoda Old Ben, Aayla",1
"DaveSkywalker",,,363318,HansMF,"Home One, Han's MF, Rebel Y-wing, Bistan's U-wing, Phantom Biggs X-wing, Cassian's U-wing, Wedge X-wing",1
"DaveSkywalker",,,526015,Negotiator,"Negotiator HT Anakin's Eta-2, Umbaran SF, Ahsoka's SF, Clone Sergeant's ARC-170, Plo's SF, Rex's ARC-170",1
"DaveSkywalker",1,1,119749,JTR,"zzzJTR Scav Rey, zBB-8 zzR2-D2 zFinn",1
"DaveSkywalker",,,102544,Mon Mothma,"zzMon Mothma, Pao Wedge Cara Dune, Biggs",1
"DaveSkywalker",1,0,140125,ShaakClones,"zzShaak Ti, zRex zEcho (501st), zzFives zARC Trooper",1
"DaveSkywalker",0,1,121356,BH,"zzBossk Dengar G9, zBoba Jango Cad",1
"DaveSkywalker",1,1,90910,Carth,"Carth Onasi, Mission Zaalbar Juhani Canderous",1
"DaveSkywalker",1,1,87511,Ewoks,"zChirpa Elder zPaploo Teebo Scout",1
"DaveSkywalker",1,1,123831,zEP,"zzEP zzzVader Tarkin TFP G9, BSF",1
"DaveSkywalker",0,1,68075,Phoenix,"Hera G8, Chopper G8, Ezra Kanan G8, Zeb G8",1
"DaveSkywalker",,,61296,Phasma,"Phasma G7, FOTP G9, FOO G8, KRU G8, Kylo G7",0
"DaveSkywalker",1,1,66764,NS,"MT G7, zzAV Daka G3, Zombie G8, Spirit G2",0
"DaveSkywalker",1,0,84575,Troopers,"zVeers zStarck Piett 6* Magma G6, Stormtrooper G7",0
"DaveSkywalker",1,0,116848,zMaul,"Darth Maul, Dooku zDR Sidious Sith Marauder",0
"Easy E",1,0,144080,CLS,"zzzCLS zHan zzChewbacca zzC-3PO zChewpio",1
"Easy E",0,1,123434,DRMalak,"zzzDR zzHK-47 zBSF zzMalak Sith Empire Trooper",1
"Easy E",0,1,135083,padme,"zzPadme zGK zJKA zAhsoka zBarriss",1
"Easy E",,,486253,Negotiator,"Negotiator BTL-B Y-wing, Anakin's Eta-2, Rex's ARC-170, Umbaran SF, Ahsoka's SF, Plo's SF, Clone Sergeant's ARC-170",1
"Easy E",,,436418,HansMF,"Home One, Han's MF, Rebel Y-wing, Bistan's U-wing, Phantom Ghost Cassian's U-wing, Wedge X-wing",1
"Easy E",1,1,145259,JTR,"zzzJTR zzR2-D2 zzBB-8 zRH Finn, zRH Poe",1
"Easy E",0,1,113131,Grievous,"zzGG zB2 zB1 zMagnaGuard zNute",1
"Easy E",1,0,113458,Traya,"zzTraya zzDN G9, zSion zzEP zzThrawn",1
"Easy E",,,402078,Executrix,"Executrix Tie Adv, Emperor's Shuttle, TIE Reaper, Imperial TIE Fighter, Gauntlet Starfighter, FOSF TIE Fighter, FO TIE Fighter",1
"Easy E",,,106266,Disintegration,"Aurra G9, Greef zBoba zzBossk zzThe Mandalorian",1
"Easy E",1,1,139872,GAS,"zzzzGAS zRex zEcho (501st), zzFives zARC Trooper",1
"Easy E",1,1,139386,Revan Offense,"zzzJKR zzGMY zBS zJolee zzHYoda",1
"Easy E",1,1,98762,Ewoks,"zChirpa Elder zPaploo zWicket zLogray",1
"Easy E",1,1,109995,Carth,"zCarth Onasi, zMission zZaalbar zJuhani zCanderous",1
"Easy E",0,1,111761,BH,"zzJango zZam zDengar zGreedo zNest",1
"Easy E",0,1,95383,FO,"zzKRU zKylo zHux FOO FOE G8",1
"Easy E",0,1,92779,Phoenix,"zHera zEzra zKanan Zeb G9, zSabine",1
"Easy E",1,1,81620,Rogue1,"zzJyn Chirrut G9, Baze G9, K-2SO G9, Bistan G9",1
"Easy E",,,279399,Malevolence,"Malevolence Hyena Bomber 4*, Vulture Droid, Sun Fac SF, Soldier SF, Spy SF",0
"Easy E",0,1,95334,Geonosians Omicron,"zzGBA Sun Fac, Geo Soldier, Geo Spy, Poggle",0
"Easy E",1,1,94442,NS,"zzMT zzAV zDaka Zombie G9, Spirit G9",0
"Easy E",1,0,77638,Troopers,"Veers G9, zzPiett Gideon G9, Dark Trooper G7, Range Trooper 6* G8",0
"Easy E",,,86144,Mon Mothma,"Mon Mothma, Wedge Cara Dune G9, Biggs G9, Lando",0
"Easy E",,,72014,Iden Troopers,"zIden Versio G5, Shoretrooper G9, Snowtrooper G5, Magma G7, zDT",0
"Easy E",,,85586,Bad Batch,"zHunter Echo G8, zzOmega zTech G9, Wrecker G9",0
"Easy E",1,0,70255,Jawas,"Nebit Jawa Engineer G9, Jawa Scavenger G7, Jawa G7, Dathcha G7",0
"AndyJediDude",,,123475,Phasma,"zPhasma zFOTP FOSFTP zFOST zKylo",1
"AndyJediDude",1,1,165258,SL Kylo,"zzzzzzSL Kylo, zSith Trooper, zHux zzKRU zzThrawn",1
"AndyJediDude",1,1,169223,GL Rey,"zzzzzzRey zGK zzzJTR zRH Poe, zRH Finn",1
"AndyJediDude",,,164918,Jabba,"zzzzzzJabba zBoushh (Leia Organa), zSkiff Guard (Lando Calrissian), Krrsantan zBoba",1
"AndyJediDude",,,558496,Executor,"Executor 5* HT RC Xanadu Blood, Slave I, IG-2000 Imperial TIE Fighter, Tie Adv",1
"AndyJediDude",,,171766,JMLS,"zzzJKR zzJKL zzzzzzJMLS zWat Tambor, zzzzGAS",1
"AndyJediDude",1,0,152680,CLS,"zzzCLS zHan zzChewbacca zzC-3PO zChewpio",1
"AndyJediDude",0,1,140568,DRMalak,"zzzDR zzHK-47 zBSF zzMalak Sith Empire Trooper",1
"AndyJediDude",,,485505,Negotiator,"Negotiator BTL-B Y-wing, Anakin's Eta-2, Rex's ARC-170, Umbaran SF, Ahsoka's SF, Plo's SF, Clone Sergeant's ARC-170",1
"AndyJediDude",,,309069,Malevolence,"Malevolence Hyena Bomber, Vulture Droid, Sun Fac SF, Soldier SF, Spy SF",1
"AndyJediDude",1,1,106355,NS_Alt,"zzMT zzAV zDaka Talia Zombie",1
"AndyJediDude",,,486885,HansMF,"Home One, Han's MF, Rebel Y-wing, Bistan's U-wing, Phantom Ghost Cassian's U-wing, Wedge X-wing",1
"AndyJediDude",0,1,127339,Grievous,"zzGG zB2 zB1 zMagnaGuard zNute",1
"AndyJediDude",1,0,126976,Traya,"zzTraya DN zSion zDooku zzEP",1
"AndyJediDude",,,103571,Mon Mothma,"zzMon Mothma, Pao Bistan zCara Dune, Hoth Rebel Scout",1
"AndyJediDude",1,0,136923,Troopers,"zVeers zzPiett zzGideon zDark Trooper, Range Trooper",1
"AndyJediDude",1,1,87555,Ewoks,"zChirpa Elder Paploo Wicket Logray",1
"AndyJediDude",1,0,138863,ShaakClones,"zzShaak Ti, zRex zEcho (501st), zzFives zARC Trooper",1
"AndyJediDude",1,1,103677,Carth,"zCarth Onasi, zMission zZaalbar zJuhani zCanderous",1
"AndyJediDude",0,1,150423,BH,"zzBossk zDengar zFennec Shand, zzAurra zzJango",1
"AndyJediDude",0,1,91450,Phoenix,"zHera Ezra Kanan Zeb Sabine G8",1
"AndyJediDude",0,1,138897,BS,"zBS zzGMY zJolee zzOld Ben, zzHYoda",1
"AndyJediDude",1,0,16207,NestSolo (Counter),"Nest",1
"AndyJediDude",,,127587,Admiral Raddus,"zzAdmiral Raddus, zCassian zzJyn K-2SO Chirrut G7",0
"AndyJediDude",0,1,98446,Geonosians Omicron,"zzGBA Sun Fac, Geo Soldier, Geo Spy, Poggle",0
"AndyJediDude",,,79119,Iden Troopers,"zIden Versio, Shoretrooper G8, Snowtrooper Magma G9, DT",0
"AndyJediDude",,,75323,Bad Batch,"Hunter G9, Echo G9, zOmega G9, Tech G9, Wrecker G8",0
"Ahhhchhoooo",,,405668,Profundity,"Profundity 5* Han's MF, Outrider Rebel Y-wing, Cassian's U-wing, Ghost",1
"Ahhhchhoooo",1,1,168888,GL Rey,"zzzzzzRey zGK zzzJTR zRH Poe, zRH Finn",1
"Ahhhchhoooo",,,163285,Jabba,"zzzzzzJabba zBoushh (Leia Organa), zSkiff Guard (Lando Calrissian), zKrrsantan Boba",1
"Ahhhchhoooo",,,517901,Executor,"Executor 6* HT RC Xanadu Blood, Slave I, IG-2000 Imperial TIE Fighter, Tie Adv",1
"Ahhhchhoooo",,,175040,JMLS,"zzzJKR zzJKL zzzzzzJMLS HYoda zzzzGAS",1
"Ahhhchhoooo",1,0,149030,CLS,"zzzCLS zHan zChewbacca zC-3PO zChewpio",1
"Ahhhchhoooo",0,1,137250,DRMalak,"zzzDR zHK-47 zBSF zzMalak Sith Marauder",1
"Ahhhchhoooo",,,281191,Malevolence,"Malevolence Hyena Bomber, Vulture Droid, Sun Fac SF, Soldier SF, Spy SF",1
"Ahhhchhoooo",0,1,114044,Grievous,"zzGG zB2 zB1 MagnaGuard IG-88",1
"Ahhhchhoooo",1,0,134845,Troopers,"zVeers zzPiett zGideon zDark Trooper, Range Trooper",1
"Ahhhchhoooo",,,107771,Mon Mothma,"zzMon Mothma, Wedge Bistan zCara Dune, Biggs",1
"Ahhhchhoooo",1,1,83376,Ewoks,"zChirpa Elder Paploo zWicket zLogray G9",1
"Ahhhchhoooo",1,0,133016,ShaakClones,"zShaak Ti, zRex zEcho (501st), zzFives zARC Trooper",1
"Ahhhchhoooo",0,1,129472,BH,"zBossk Dengar Greedo Fennec Shand, Aurra",1
"Ahhhchhoooo",1,1,104649,zEP,"zEP G8, zzzVader Tarkin G8, TFP zMara Jade, The Emperor's Hand 6*",1
"Ahhhchhoooo",0,1,75002,Phoenix,"Hera Chopper G8, Ezra G8, Kanan G8, Zeb G8",1
"Ahhhchhoooo",0,1,116856,BS,"zBS zGMY zJolee Old Ben, zJKA",1
"Ahhhchhoooo",,,66440,Phasma,"Phasma G7, FOTP G8, FOO G8, KRU Kylo G9",0
"Ahhhchhoooo",,,430289,Negotiator,"Negotiator BTL-B Y-wing, Anakin's Eta-2, Rex's ARC-170, Umbaran SF, Ahsoka's SF, Plo's SF, Clone Sergeant's ARC-170",0
"Ahhhchhoooo",0,1,91984,Geonosians Omicron,"zzGBA Sun Fac, Geo Soldier, Geo Spy, Poggle",0
"Ahhhchhoooo",,,83080,Nute-OR,"Nute Dooku Jango G8, zZaalbar zMission",0
"FrostyTacos",0,1,129157,padme,"zzPadme zGK zJKA zAhsoka zzC-3PO",1
"FrostyTacos",1,1,106925,NestSisters,"zzAV zMT Daka Zombie zNest",1
"FrostyTacos",1,0,139039,Traya,"zzTraya zDN zSion zzEP zThrawn",1
"FrostyTacos",0,1,114728,Grievous,"zzGG zB2 MagnaGuard Dooku L3-37",1
"FrostyTacos",1,1,74248,Ewoks,"zChirpa Elder Paploo Wicket Logray",1
"FrostyTacos",0,1,112869,BH,"zzBossk Dengar Greedo IG-88 Boba",1
"FrostyTacos",1,0,110253,Troopers,"zVeers zStarck Snowtrooper zzPiett Stormtrooper",1
"FrostyTacos",0,1,104366,FO,"zzKRU zKylo FOO Phasma G9, FOE",1
"FrostyTacos",0,1,58192,Phoenix,"Hera G8, Chopper G8, Ezra G8, Kanan G8, Zeb G8",1
"FrostyTacos",,,80902,Admiral Raddus,"zzAdmiral Raddus 3*, Cassian Jyn 6* K-2SO Chirrut G7",0
"FrostyTacos",,,375771,Negotiator,"Negotiator HT Anakin's Eta-2 5*, Umbaran SF 6*, Ahsoka's SF, BTL-B Y-wing 3*, Clone Sergeant's ARC-170 5*, Plo's SF",0
"FrostyTacos",1,0,101805,CLS,"zzCLS zHan zChewbacca R2-D2 G8, Chewpio 5* G7",0
"FrostyTacos",0,1,61494,Geonosians Omicron,"zGBA 5* G6, Sun Fac G8, Geo Soldier, Geo Spy G8, Poggle G8",0
"FrostyTacos",,,268273,HansMF,"Home One, Han's MF, Rebel Y-wing 4*, Bistan's U-wing 4*, Phantom 6* Ghost 6* Cassian's U-wing 6*, Wedge X-wing",0
"FrostyTacos",,,333386,Executrix,"Executrix Tie Adv, Emperor's Shuttle 4*, TIE Reaper 3*, Imperial TIE Fighter, Gauntlet Starfighter 6*, FOSF TIE Fighter, FO TIE Fighter",0
"FrostyTacos",1,0,97581,ShaakClones,"zzShaak Ti 5*, zRex Echo (501st), zzFives zARC Trooper 5* G9",0
"FrostyTacos",0,1,91921,BH,"zJango Zam G9, zFennec Shand 4*, zGreef zThe Mandalorian",0
"FrostyTacos",,,68523,Bad Batch,"zHunter 5* zEcho 4* G9, Omega 5* G9, zTech 5* zWrecker 4* G9",0
"Whitezilla",,,186459,JMK,"zzzzzzJMK zAhsoka zzzCAT zzzzGAS zGK",1
"Whitezilla",,,179435,LV,"zzzzzzLord Vader, zzThrawn zzzVader zRG zzTarkin",1
