Player,Offense,Defense,GP,Name,Squad,Viable
"Tharius Dawnbreaker",,,109647,Mon Mothma,"zzMon Mothma, Bistan Wedge Pao Biggs",1
"Tharius Dawnbreaker",,,106199,Disintegration,"Aurra Greef G8, Boba zzBossk The Mandalorian",1
"Tharius Dawnbreaker",1,1,88193,Ewoks,"zChirpa Elder Paploo zWicket zLogray",1
"Tharius Dawnbreaker",1,0,134739,ShaakClones,"zzShaak Ti, zRex zEcho (501st), zzFives zARC Trooper",1
"Tharius Dawnbreaker",1,1,102278,Carth,"zCarth Onasi, zMission zZaalbar Juhani zCanderous",1
"Tharius Dawnbreaker",0,1,82311,Phoenix,"Hera Zeb G8, Sabine Ezra Kanan G8",1
"Tharius Dawnbreaker",1,1,102480,Rogue1,"zJyn Chirrut Baze zCassian K-2SO G9",1
"Tharius Dawnbreaker",1,0,75126,Jawas,"Nebit G9, Jawa Engineer G9, Jawa Scavenger, Jawa Dathcha",1
"Tharius Dawnbreaker",,,457033,Negotiator,"Negotiator BTL-B Y-wing 4*, Anakin's Eta-2, Rex's ARC-170, Umbaran SF, Ahsoka's SF, Plo's SF, Clone Sergeant's ARC-170",0
"Tharius Dawnbreaker",,,266853,Malevolence,"Malevolence Hyena Bomber 4*, Vulture Droid 5*, Sun Fac SF, Soldier SF, Spy SF",0
"Tharius Dawnbreaker",0,1,94174,Geonosians Omicron,"zzGBA Sun Fac, Geo Soldier, Geo Spy, Poggle",0
"Tharius Dawnbreaker",,,76948,Iden Troopers,"zIden Versio, Shoretrooper G9, Snowtrooper G8, Magma G9, DT",0
"Tharius Dawnbreaker",0,1,109549,BH,"zJango Dengar Cad Greedo IG-88",0
"Tharius Dawnbreaker",,,56938,Bad Batch,"Hunter 5* G9, Echo 4* G8, Omega G9, Tech 4* G8, zWrecker 5* G8",0
"YodaRoy",,,177588,JMK,"zzzzzzJMK zAhsoka zzzCAT zzzzGAS zGK",1
"YodaRoy",,,176604,LV,"zzzzzzLord Vader, zPiett zzzMaul zRG zzVader",1
"YodaRoy",,,379326,Profundity,"Profundity 5* Han's MF, Outrider Rebel Y-wing, Cassian's U-wing, Ghost",1
"YodaRoy",1,1,105499,NS,"zzMT zAV zDaka Zombie Spirit",1
"YodaRoy",,,544575,Executor,"Executor 6* HT RC Xanadu Blood, Slave I, IG-2000 Imperial TIE Fighter, Tie Adv",1
"YodaRoy",0,1,136661,DRMalak,"zzzDR zzHK-47 zBSF zzMalak Sith Empire Trooper",1
"YodaRoy",,,119240,Grievous Omicron,"zzGG zB2 zB1 MagnaGuard zDroideka",1
"YodaRoy",,,504735,Negotiator,"Negotiator BTL-B Y-wing, Anakin's Eta-2, Rex's ARC-170, Umbaran SF, Ahsoka's SF, Plo's SF, Clone Sergeant's ARC-170",1
"YodaRoy",,,341775,Malevolence,"Malevolence Hyena Bomber, Vulture Droid, Sun Fac SF, Soldier SF, Spy SF",1
"YodaRoy",0,1,107605,Geonosians Omicron,"zGBA Sun Fac, Geo Soldier, Geo Spy, Poggle",1
"YodaRoy",,,144296,Nute-Wat,"zNute zDooku zWat Tambor, Jango zNest",1
"YodaRoy",,,105156,Mon Mothma,"Mon Mothma, Bistan Cara Dune, Cassian Hoth Rebel Scout",1
"YodaRoy",1,0,117774,CLS,"zzCLS zHan zzChewbacca zThrawn C-3PO",1
"YodaRoy",1,1,131649,Revan Offense,"zzzJKR zGMY BS zJolee zJKA",1
"YodaRoy",1,1,77909,Ewoks,"zChirpa Elder Paploo Wicket Logray",1
"YodaRoy",1,0,151302,ShaakClones,"zzShaak Ti, zRex zEcho (501st), zzFives zARC Trooper",1
"YodaRoy",0,1,142118,BH,"zzBossk Dengar Cad Boba zZam",1
"YodaRoy",1,1,84947,Carth,"zCarth Onasi, zMission Zaalbar Juhani G8, Canderous",1
"YodaRoy",1,0,86534,Troopers,"zVeers Starck Range Trooper, Snowtrooper Dark Trooper",1
"YodaRoy",0,1,75934,Phoenix,"Hera Zeb G8, Chopper G8, Ezra Kanan G8",1
"YodaRoy",,,115926,Bad Batch,"zHunter zEcho Omega G9, zTech zWrecker",0
"YodaRoy",1,0,88005,EP (Counter, Rebel),"zzEP Shoretrooper 6* Krennic G7, DT 6* zzWampa",0
"Frankie",,,175864,JMK,"zzzzzzJMK zAhsoka zzzCAT zzzzGAS zGK",1
"Frankie",,,123345,Phasma,"zPhasma zFOTP FOSFTP zFOST zKylo",1
"Frankie",1,1,165161,SL Kylo,"zzzzzzSL Kylo, zSith Trooper, zHux zzKRU zzThrawn",1
"Frankie",,,171582,SEE,"zzzzzzSEE zBSF zzMalak zzzDR zzzVader",1
"Frankie",1,1,168531,GL Rey,"zzzzzzRey zzzJTR zzBB-8 zRH Poe, zRH Finn",1
"Frankie",0,1,94931,Qira,"zQira L3-37 zVandor Chewbacca, zMission zZaalbar",1
"Frankie",1,1,104903,NS,"zzMT zzAV zDaka Zombie Spirit",1
"Frankie",,,558735,Executor,"Executor 5* HT RC Xanadu Blood, Slave I, IG-2000 Imperial TIE Fighter, Tie Adv",1
"Frankie",1,0,142919,CLS,"zzzCLS zHan zzChewbacca zC-3PO zChewpio",1
"Frankie",,,505310,Negotiator,"Negotiator BTL-B Y-wing, Anakin's Eta-2, Rex's ARC-170, Umbaran SF, Ahsoka's SF, Plo's SF, Clone Sergeant's ARC-170",1
"Frankie",,,307825,Malevolence,"Malevolence Hyena Bomber, Vulture Droid, Sun Fac SF, Soldier SF, Spy SF",1
"Frankie",,,143293,JKL,"zzJKL zzzJKR zzHYoda zzOld Ben, Aayla",1
"Frankie",,,461525,HansMF,"Home One, Han's MF, Rebel Y-wing, Bistan's U-wing, Phantom Ghost Cassian's U-wing, Wedge X-wing",1
"Frankie",0,1,130485,Grievous,"zzGG zB2 zB1 zMagnaGuard zNute",1
"Frankie",1,0,114757,Traya,"zzTraya zDN zSion zzEP Sith Empire Trooper",1
"Frankie",1,0,125879,Troopers,"zVeers zzPiett zzGideon zDark Trooper, Range Trooper",1
"Frankie",,,113441,Mon Mothma,"zzMon Mothma, Bistan Wedge zCara Dune, Biggs",1
"Frankie",,,127250,Disintegration,"Aurra zzGreef zBoba zzBossk zzThe Mandalorian",1
"Frankie",1,1,84806,Ewoks,"zChirpa Elder zPaploo Wicket Logray",1
"Frankie",1,0,145849,ShaakClones,"zzShaak Ti, zRex zEcho (501st), zzFives zARC Trooper",1
"Frankie",0,1,127022,BH,"zzJango Dengar Cad Greedo zIG-88",1
"Frankie",1,0,127767,zMaul,"zDarth Maul, zSidious zDooku Sith Marauder, zNest",1
"Frankie",0,1,82347,Phoenix,"Hera Zeb G9, Chopper Ezra Kanan G8",1
"Frankie",1,1,103167,Rogue1,"Jyn Chirrut G8, Baze zCassian K-2SO",1
"Frankie",0,1,97153,Geonosians Omicron,"zzGBA Sun Fac, Geo Soldier, Geo Spy, Poggle",0
"Frankie",,,84305,Iden Troopers,"zIden Versio, Shoretrooper Snowtrooper Magma G8, DT",0
"FrostyTacos",0,1,129157,padme,"zzPadme zGK zJKA zAhsoka zzC-3PO",1
"FrostyTacos",1,1,106925,NestSisters,"zzAV zMT Daka Zombie zNest",1
"FrostyTacos",1,0,139039,Traya,"zzTraya zDN zSion zzEP zThrawn",1
"FrostyTacos",0,1,114728,Grievous,"zzGG zB2 MagnaGuard Dooku L3-37",1
"FrostyTacos",1,1,74248,Ewoks,"zChirpa Elder Paploo Wicket Logray",1
"FrostyTacos",0,1,112869,BH,"zzBossk Dengar Greedo Boba IG-88",1
"FrostyTacos",1,0,111183,Troopers,"zVeers zStarck Magma Stormtrooper zzPiett",1
"FrostyTacos",0,1,104366,FO,"zzKRU zKylo Phasma G9, FOE FOO",1
"FrostyTacos",1,0,101611,Wampa (Counter),"zRex zWampa Krennic HYoda Jyn",1
"FrostyTacos",0,1,58192,Phoenix,"Hera G8, Zeb G8, Chopper G8, Ezra G8, Kanan G8",1
"FrostyTacos",,,375771,Negotiator,"Negotiator HT Anakin's Eta-2 5*, Umbaran SF 6*, Ahsoka's SF, BTL-B Y-wing 3*, Clone Sergeant's ARC-170 5*, Plo's SF",0
"FrostyTacos",1,0,101534,CLS,"zzCLS zHan zChewbacca R2-D2 G8, Chewpio 5* G7",0
"FrostyTacos",0,1,61494,Geonosians Omicron,"zGBA 5* G6, Sun Fac G8, Geo Soldier, Geo Spy G8, Poggle G8",0
"FrostyTacos",,,271754,HansMF,"Home One, Han's MF, Rebel Y-wing 4*, Bistan's U-wing 4*, Phantom 6* Ghost 6* Cassian's U-wing 6*, Wedge X-wing",0
"FrostyTacos",,,336246,Executrix,"Executrix Tie Adv, Emperor's Shuttle 4*, TIE Reaper 3*, Imperial TIE Fighter, Gauntlet Starfighter 6*, FOSF TIE Fighter, FO TIE Fighter",0
"FrostyTacos",0,1,91921,BH,"zJango zFennec Shand 4*, zGreef zThe Mandalorian, Zam G9",0
"FrostyTacos",,,69066,Bad Batch,"zHunter 5* zEcho 4* G9, Omega 5* G9, zTech 5* zWrecker 4* G9",0
"MasterMiller",,,176093,JMK,"zzzzzzJMK zAhsoka zzzCAT zzzzGAS zGK",1
"MasterMiller",1,1,159798,SL Kylo,"zzzzzzSL Kylo, zSith Trooper, zHux zzKRU zThrawn",1
"MasterMiller",,,159745,JMLS,"zBS zzzzzzJMLS zWat Tambor, zzJKL zJolee",1
"MasterMiller",1,0,146150,CLS,"zzzCLS zHan zzChewbacca zzC-3PO zChewpio",1
"MasterMiller",0,1,116363,DRMalak,"zzzDR HK-47 zBSF zzMalak Sith Empire Trooper",1
"MasterMiller",,,509871,Negotiator,"Negotiator HT Anakin's Eta-2, Umbaran SF, Ahsoka's SF, BTL-B Y-wing, Clone Sergeant's ARC-170, Plo's SF",1
"MasterMiller",,,301778,Malevolence,"Malevolence Hyena Bomber, Vulture Droid, Sun Fac SF, Soldier SF, Spy SF",1
"MasterMiller",,,468209,HansMF,"Home One, Han's MF, Rebel Y-wing, Bistan's U-wing, Phantom Biggs X-wing, Cassian's U-wing, Wedge X-wing",1
"MasterMiller",0,1,124235,Grievous,"zzGG zB2 zB1 MagnaGuard zNute",1
"MasterMiller",,,105629,Mon Mothma,"zzMon Mothma, Bistan zCara Dune, Pao Scarif",1
"MasterMiller",1,0,106351,Traya,"zzTraya DN Sion Dooku zEP",1
"MasterMiller",1,0,141133,ShaakClones,"zzShaak Ti, zRex Echo (501st), zzFives zARC Trooper",1
"MasterMiller",1,1,84677,Ewoks,"zChirpa Elder Paploo Scout zWicket",1
"MasterMiller",0,1,123126,BH,"zzBossk zJango Cad zBoba zZam",1
"MasterMiller",,,87841,Iden Troopers,"zIden Versio, Shoretrooper Snowtrooper Magma DT",1
"MasterMiller",0,1,77229,Phoenix,"Hera Zeb G9, Sabine G8, Ezra Kanan G8",1
"MasterMiller",1,1,96835,Rogue1,"zJyn Chirrut G8, Baze G8, zCassian K-2SO",1
"MasterMiller",1,0,75239,Jawas,"Nebit G8, Jawa Engineer, Jawa Scavenger, Jawa G9, Dathcha",1
"MasterMiller",,,117656,Phasma,"Phasma FOTP FOSFTP zFOST zKylo",0
"MasterMiller",0,1,90030,Geonosians Omicron,"zGBA Sun Fac, Geo Soldier, Geo Spy, Poggle",0
"MasterMiller",1,1,107958,JTR,"JTR Scav Rey, BB-8 zzR2-D2 Finn",0
"MasterMiller",1,0,53727,Troopers,"Veers G8, Piett 4* G8, Gideon 4* G9, Dark Trooper 5* G8, Range Trooper 5* G7",0
"MasterMiller",1,1,63450,NS,"MT G8, AV Daka G8, Zombie G7, Spirit G8",0
"MasterMiller",1,1,83698,Carth,"zCarth Onasi, zMission Zaalbar Juhani G7, Canderous",0
"MasterMiller",,,81191,Mando,"The Mandalorian (Beskar Armor) G8, zDash Rendar, Nest G7, IG-11 G7, Kuiil G9",0
"MasterMiller",,,76011,Bad Batch,"zHunter G9, Echo Omega G8, Tech G9, Wrecker G9",0
"Waldo",,,125760,Phasma,"zPhasma zFOTP FOSFTP zFOST zKylo",1
"Waldo",1,1,176638,SL Kylo,"zzzzzzSL Kylo, zSith Trooper, zHux zzKRU zzThrawn",1
"Waldo",1,0,145185,CLS,"zzzCLS zHan zzChewbacca zzC-3PO zChewpio",1
"Waldo",0,1,140369,DRMalak,"zzzDR zzHK-47 zBSF zzMalak Sith Empire Trooper",1
"Waldo",0,1,116307,padme,"zzPadme zGK zJKA zAhsoka CW Chewbacca",1
"Waldo",,,453520,Negotiator,"Negotiator BTL-B Y-wing, Anakin's Eta-2, Rex's ARC-170, Umbaran SF, Ahsoka's SF, Plo's SF, Clone Sergeant's ARC-170",1
"Waldo",1,1,102411,NS_Alt,"zzMT zzAV Talia zDaka Zombie",1
"Waldo",,,469181,HansMF,"Home One, Han's MF, Rebel Y-wing, Bistan's U-wing, Phantom Ghost Cassian's U-wing, Wedge X-wing",1
"Waldo",1,1,125621,JTR,"zzzJTR Scav Rey, zzBB-8 zzR2-D2 RT",1
"Waldo",0,1,113209,Grievous,"zGG zB2 zDroideka zMagnaGuard zIG-88",1
"Waldo",,,107411,Mon Mothma,"zzMon Mothma, Bistan Wedge Biggs Scarif",1
"Waldo",1,1,122593,Revan Offense,"zzzJKR zGMY BS zJolee zzHYoda",1
"Waldo",1,0,129313,ShaakClones,"zzShaak Ti, zRex zEcho (501st), zzFives zARC Trooper",1
"Waldo",1,1,84402,Ewoks,"zChirpa Elder Paploo Scout Logray",1
"Waldo",0,1,102439,BH,"zzBossk Cad zGreedo zBoba Zam G9",1
"Waldo",1,1,103614,zEP,"zzEP zzzVader Tarkin G9, TFP G9, DN G8",1
"Waldo",0,1,90118,Phoenix,"zHera zZeb G8, Sabine Chopper zKanan",1
"Waldo",,,116589,Admiral Raddus,"zzAdmiral Raddus, zCassian zJyn K-2SO Chirrut G2",0
"Waldo",0,1,92923,Geonosians Omicron,"zzGBA Sun Fac, Geo Soldier, Geo Spy, Poggle",0
"Waldo",1,1,88588,Carth,"zCarth Onasi, zMission zZaalbar zJuhani Canderous G7",0
"Waldo",1,0,47681,Troopers,"Veers G6, Starck G5, Magma G4, Gideon 5* G4, Snowtrooper G7",0
"Waldo",0,1,47907,BH,"Jango G2, Dengar G3, Greef G2, zThe Mandalorian G8, Nest G1",0
"Waldo",1,0,66921,Jawas,"Nebit G9, Jawa Engineer G7, Jawa Scavenger G8, Jawa G9, Dathcha G9",0
"Waldo",1,0,11586,SionSolo (Counter),"Sion G7",0
"White Devil",,,189263,JMK,"zzzzzzJMK zAhsoka zzzCAT zzzzGAS zGK",1
"White Devil",,,185034,LV,"zzzzzzLord Vader, zzPiett zzzMaul zRG zzzVader",1
"White Devil",,,188837,SEE,"zzzzzzSEE zBSF zzMalak zzzDR zDooku",1
"White Devil",,,595937,Executor,"Executor HT RC Xanadu Blood, Slave I, IG-2000 Imperial TIE Fighter, Tie Adv",1
"White Devil",1,0,140243,CLS,"zzzCLS zHan zzChewbacca zzC-3PO Chewpio",1
"White Devil",,,134887,Grievous Omicron,"zzGG zB2 zB1 zMagnaGuard zDroideka",1
"White Devil",1,1,118840,NS_Alt,"zzMT zzAV Talia zDaka Zombie",1
"White Devil",0,1,113850,Geonosians Omicron,"zzGBA Sun Fac, Geo Soldier, Geo Spy, Poggle",1
"White Devil",,,144252,JKL,"zzJKL zzzJKR zzHYoda zOld Ben, Aayla",1
"White Devil",,,412596,HansMF,"Home One, Han's MF, Rebel Y-wing, Ghost Phantom Biggs X-wing, Cassian's U-wing, Wedge X-wing",1
"White Devil",1,1,93862,Ewoks,"zChirpa Elder zPaploo Wicket Logray",1
"White Devil",0,1,149781,BH,"zzBossk zzJango Dengar zBoba Zam",1
"White Devil",1,1,92152,Carth,"Carth Onasi, zMission zZaalbar zJuhani zCanderous",1
"White Devil",1,0,134857,Clones,"Cody zRex zEcho (501st), zzFives zARC Trooper",1
"White Devil",0,1,78945,Phoenix,"zHera Zeb G8, Sabine G8, zEzra Kanan G8",1
"White Devil",1,0,115994,EP (Counter, Rebel),"zzEP Shoretrooper G8, Krennic zzWampa zStarck",1
"White Devil",1,0,18388,SionSolo (Counter),"Sion",1
"White Devil",1,0,15511,NestSolo (Counter),"Nest",1
"White Devil",,,67817,Phasma,"Phasma FOTP FOSFTP G8, FOST 5* G8, Kylo G9",0
"White Devil",,,61431,Admiral Raddus,"Admiral Raddus 5*, Cassian G9, Jyn G8, K-2SO G8, Bistan G7",0
"White Devil",,,493921,Negotiator,"Negotiator BTL-B Y-wing, Anakin's Eta-2, Rex's ARC-170 6*, Umbaran SF, Ahsoka's SF, Plo's SF, Clone Sergeant's ARC-170",0
"White Devil",,,330994,Malevolence,"Malevolence Hyena Bomber 6*, Vulture Droid, Sun Fac SF, Soldier SF, Spy SF",0
"White Devil",1,1,89309,JTR,"JTR Scav Rey G8, BB-8 G9, zzR2-D2 Finn G8",0
"White Devil",,,87192,Mon Mothma,"Mon Mothma G9, Wedge zCara Dune G8, Biggs Lando",0
"White Devil",1,0,90223,Thragma (Counter),"zzThrawn Magma G7, DT 6* G8, zTarkin Stormtrooper G8",0
"White Devil",,,112211,Bad Batch,"Hunter zEcho Omega 5* G9, zTech zWrecker",0
"White Devil",1,0,122585,zMaul,"Darth Maul, zDN zSidious Sith Empire Trooper, Sith Marauder",0
"White Devil",1,0,66414,Jawas,"Nebit G7, Jawa Engineer, Jawa Scavenger G9, Jawa Dathcha G9",0
"TheyCallMeMrB",0,1,140415,padme,"zzPadme zGK zJKA zAhsoka zzC-3PO",1
"TheyCallMeMrB",0,1,139799,Geonosians Omicron,"zzGBA Sun Fac, Geo Soldier, Geo Spy, Poggle",1
"TheyCallMeMrB",,,398305,Negotiator,"Negotiator HT Anakin's Eta-2, Umbaran SF, Ahsoka's SF, Clone Sergeant's ARC-170, Jedi Consular's Starfighter, Plo's SF",1
"TheyCallMeMrB",,,331928,HansMF,"Home One, Han's MF, Biggs X-wing, Bistan's U-wing, Phantom Ghost Cassian's U-wing, Wedge X-wing",1
"TheyCallMeMrB",0,1,99749,DR,"zzzDR zzHK-47 zBSF Sith Marauder G9, Thrawn G8",1
"TheyCallMeMrB",0,1,130585,Grievous,"zzGG zB2 zB1 zDroideka zIG-88",1
"TheyCallMeMrB",1,1,109679,Ewoks,"zChirpa Elder zPaploo zWicket zLogray",1
"TheyCallMeMrB",0,1,134471,BH,"zzBossk zDengar Cad Greef zBoba",1
"TheyCallMeMrB",1,1,104955,Carth,"zCarth Onasi, zMission zZaalbar zJuhani zCanderous",1
"TheyCallMeMrB",1,1,135732,zEP,"zzEP zzzVader Tarkin TFP zzMara Jade, The Emperor's Hand",1
"TheyCallMeMrB",0,1,112912,FO,"zzKRU zKylo Phasma FOE FOO",1
"TheyCallMeMrB",0,1,101337,Phoenix,"zHera Zeb Chopper zEzra Kanan",1
"TheyCallMeMrB",1,0,79938,Jawas,"Nebit Jawa Engineer, Jawa Scavenger, Jawa G9, Dathcha",1
"TheyCallMeMrB",,,73140,Nute-Wat,"Nute G3, Dooku Wat Tambor G8, zzJango Nest G7",0
"TheyCallMeMrB",1,1,50306,NS,"MT G8, AV G9, Daka G2, Zombie G2, Spirit G4",0
"TheyCallMeMrB",1,1,100022,Revan Offense,"zzzJKR GMY G7, zBS zJolee HYoda G7",0
"TheyCallMeMrB",1,0,38470,ShaakClones,"Shaak Ti G1, Rex G1, Echo (501st) G1, Fives G1, Clone Sergeant G9",0
"TheyCallMeMrB",1,0,91784,CLS,"zzzCLS zHan Wedge Biggs G6, Chewbacca",0
"TheyCallMeMrB",1,0,76855,Troopers,"Veers G7, Starck G7, Gideon G7, Snowtrooper G7, zzPiett",0
"Giran Ozzel",,,122961,Phasma,"zPhasma zFOTP FOSFTP zFOST zKylo",1
"Giran Ozzel",1,1,162582,SL Kylo,"zzzzzzSL Kylo, zSith Trooper, zHux zzKRU zThrawn",1
"Giran Ozzel",,,169742,SEE,"zzzzzzSEE zBSF zzMalak zzzDR zzVader",1
"Giran Ozzel",1,0,145425,CLS,"zzzCLS zHan zzChewbacca zzC-3PO zChewpio",1
"Giran Ozzel",0,1,93018,Geonosians Omicron,"zzGBA Sun Fac, Geo Soldier, Geo Spy, Poggle",1
"Giran Ozzel",,,394348,HansMF,"Home One, Han's MF, HT Ghost Phantom Biggs X-wing, Cassian's U-wing, Wedge X-wing",1
"Giran Ozzel",1,1,104473,JTR,"zzzJTR Scav Rey, BB-8 zzR2-D2 Finn G9",1
"Giran Ozzel",1,1,119358,Revan,"zzzJKR zBS GMY G9, zJolee zGK",1
"Giran Ozzel",1,1,92780,Ewoks,"zChirpa Elder zPaploo zWicket zLogray",1
"Giran Ozzel",0,1,137470,BH,"zzBossk zDengar Cad zBoba zIG-88",1
"Giran Ozzel",1,1,87662,Carth,"zCarth Onasi, Mission Zaalbar Juhani Canderous",1
"Giran Ozzel",0,1,74984,Phoenix,"Hera G8, zZeb G9, Chopper zEzra G9, Kanan G9",1
"Giran Ozzel",1,0,116806,EP (Counter, Rebel),"zzEP Krennic zzWampa Stormtrooper G9, zStarck",1
"Giran Ozzel",,,57061,Grievous Omicron,"GG G9, B2 G9, B1 4* G4, MagnaGuard G7, Droideka",0
"Giran Ozzel",,,84376,Nute-Wat,"Nute G8, zDooku zWat Tambor, Jango Nest 6* G3",0
"Giran Ozzel",,,92980,Mon Mothma,"Mon Mothma G9, Wedge zCara Dune, Biggs Lando",0
"Giran Ozzel",1,1,57903,NS_Alt,"AV Talia G6, Daka G7, Zombie G7, Spirit G3",0
"Giran Ozzel",1,0,63591,ShaakClones,"Shaak Ti 5* G7, Rex Echo (501st) G7, Fives G9, ARC Trooper G8",0
"Giran Ozzel",1,0,12585,SionSolo (Counter),"Sion G7",0
"The Hawk 28",0,1,132690,padme,"zzPadme zGK zJKA zAhsoka zzC-3PO",1
"The Hawk 28",0,1,120353,DR,"zzzDR zzHK-47 zBSF Sith Assassin G8, zzThrawn",1
"The Hawk 28",,,420278,HansMF,"Home One, Han's MF, HT Bistan's U-wing, Phantom Ghost Cassian's U-wing, Wedge X-wing",1
"The Hawk 28",0,1,122793,Grievous,"zzGG zB2 zDroideka zMagnaGuard zzT3-M4",1
"The Hawk 28",1,0,104956,Traya,"zzTraya DN G9, zSion zDooku zzEP",1
"The Hawk 28",1,1,137793,Revan Offense,"zzzJKR zzGMY zBS zJolee zzHYoda",1
"The Hawk 28",1,1,97040,Ewoks,"zChirpa Elder zPaploo zWicket zLogray",1
"The Hawk 28",1,0,104495,ShaakClones,"zzShaak Ti, Rex Echo (501st), zzFives zARC Trooper G8",1
"The Hawk 28",1,1,126650,Carth,"zCarth Onasi, zMission zZaalbar zJuhani zCanderous",1
"The Hawk 28",0,1,129566,BH,"zzBossk Dengar G9, zzThe Mandalorian, zBoba zzEmbo",1
"The Hawk 28",0,1,100789,BH,"zzJango Cad zGreedo Greef G9, IG-88",1
"The Hawk 28",0,1,95947,FO,"zzKRU zKylo FOTP FOE FOO",1
"The Hawk 28",0,1,86661,Phoenix,"zHera Zeb G8, zSabine zEzra Kanan G9",1
"The Hawk 28",1,1,67545,Rogue1,"Jyn G8, Chirrut G9, Baze G8, Cassian G8, K-2SO G8",1
"The Hawk 28",1,0,71501,Jawas,"Nebit Jawa Engineer, Jawa Scavenger G8, Jawa Dathcha G9",1
"The Hawk 28",,,426481,Negotiator,"Negotiator 6* BTL-B Y-wing 5*, Anakin's Eta-2, Rex's ARC-170, Umbaran SF, Ahsoka's SF, Plo's SF, Clone Sergeant's ARC-170",0
"The Hawk 28",1,0,100068,CLS,"zzzCLS Han zzChewbacca R2-D2 G9, Chewpio 5* G8",0
"The Hawk 28",,,252372,Malevolence,"Malevolence 6* Hyena Bomber 4*, Vulture Droid 5*, Sun Fac SF, Soldier SF, Spy SF",0
"The Hawk 28",0,1,89773,Geonosians Omicron,"zzGBA Sun Fac G9, Geo Soldier, Geo Spy, Poggle",0
"The Hawk 28",1,1,94810,NS,"zzMT G9, zzAV zDaka Zombie Spirit G9",0
"The Hawk 28",,,369023,Executrix,"Executrix Tie Adv, Emperor's Shuttle, TIE Reaper 4*, Imperial TIE Fighter, Gauntlet Starfighter, FOSF TIE Fighter, FO TIE Fighter",0
"The Hawk 28",1,0,59352,Troopers,"Veers G9, Piett 5* G7, Gideon G9, Dark Trooper 5* G8, Range Trooper 6* G7",0
"The Hawk 28",,,94570,Mon Mothma,"Mon Mothma 5* G8, Wedge zKyle Katarn, Lando Hoth Rebel Scout",0
"The Hawk 28",,,69815,Iden Troopers,"Iden Versio 4* G9, zStormtrooper Snowtrooper Magma G8, DT G8",0
"The Hawk 28",1,0,77979,zMaul,"zDarth Maul, Sidious Sith Empire Trooper G7, Sith Marauder G8, Nest G7",0
"The Hawk 28",,,64933,Bad Batch,"Hunter 6* G9, Echo 6* G9, Omega G9, Tech 6* G9, Wrecker G8",0
"Dawnstriker",,,408650,Profundity,"Profundity 6* Han's MF, Outrider Rebel Y-wing, Cassian's U-wing, Biggs X-wing",1
"Dawnstriker",1,1,171322,GL Rey,"zzzzzzRey zzzJTR zzR2-D2 zHoldo zRH Finn",1
"Dawnstriker",1,0,146364,CLS,"zzzCLS zHan zzChewbacca zzC-3PO zChewpio",1
"Dawnstriker",,,117299,Grievous Omicron,"zzGG zB2 zB1 zMagnaGuard zDroideka",1
"Dawnstriker",0,1,120256,padme,"zzPadme zGK zJKA zAhsoka CW Chewbacca G8",1
"Dawnstriker",,,339636,Malevolence,"Malevolence Hyena Bomber, Vulture Droid, Sun Fac SF, Soldier SF, Spy SF",1
"Dawnstriker",0,1,110687,Geonosians Omicron,"zzGBA Sun Fac, Geo Soldier, Geo Spy, Poggle",1
"Dawnstriker",0,1,114427,DR,"zzzDR zzHK-47 zBSF Sith Empire Trooper, zThrawn",1
"Dawnstriker",,,487422,Negotiator,"Negotiator HT Anakin's Eta-2, Umbaran SF, Ahsoka's SF, Clone Sergeant's ARC-170, Plo's SF, Rex's ARC-170",1
"Dawnstriker",,,124587,Mon Mothma,"zzMon Mothma, Bistan Wedge Biggs zCassian",1
"Dawnstriker",1,1,147242,Revan Offense,"zzzJKR zzGMY zBS zJolee zzHYoda",1
"Dawnstriker",1,1,95726,Ewoks,"zChirpa Elder zPaploo zWicket zLogray",1
"Dawnstriker",1,0,142062,ShaakClones,"zzShaak Ti, zRex zEcho (501st), zzFives zARC Trooper",1
"Dawnstriker",1,1,95337,Carth,"zCarth Onasi, zMission zZaalbar zJuhani zCanderous",1
"Dawnstriker",0,1,101498,BH,"zzBossk Jango Cad zBoba Zam G9",1
"Dawnstriker",1,1,97454,zEP,"zzEP zzzVader Tarkin TFP G9, DN G8",1
"Dawnstriker",0,1,81224,FO,"zzKRU Kylo G8, FOTP G8, FOO G8, FOST G8",1
"Dawnstriker",0,1,79116,Phoenix,"Hera Zeb G8, Chopper Ezra G8, Kanan G8",1
"Dawnstriker",1,0,79825,Jawas,"Nebit Jawa Engineer, Jawa Scavenger, Jawa Dathcha",1
"Dawnstriker",1,1,71188,NS,"zzMT G8, zzAV Daka G7, Zombie G4, Spirit G1",0
"Dawnstriker",1,0,69047,Troopers,"Veers Starck G7, Magma G9, Stormtrooper Snowtrooper G8",0
"Dawnstriker",1,1,104026,Rogue1,"zzJyn Chirrut G9, Baze 6* G6, K-2SO G9, zzAdmiral Raddus",0
"Dawnstriker",1,0,7867,SionSolo (Counter),"Sion G1",0
"Raiders",,,186277,JMK,"zzzzzzJMK zAhsoka zzzCAT zzzzGAS zGK",1
"Raiders",,,183363,LV,"zzzzzzLord Vader, zzPiett zzzMaul zRG zzzVader",1
"Raiders",,,123211,Phasma,"zPhasma zFOTP FOSFTP zFOST zKylo",1
"Raiders",1,1,168828,SL Kylo,"zzzzzzSL Kylo, zSith Trooper, zHux zzKRU zzThrawn",1
"Raiders",,,173886,SEE,"zzzzzzSEE zBSF zzMalak zzzDR zDooku",1
"Raiders",1,1,128865,NS,"zzMT zzAV zDaka Zombie Spirit",1
"Raiders",,,586118,Executor,"Executor 5* HT RC Xanadu Blood, Slave I, IG-2000 Imperial TIE Fighter, Tie Adv",1
"Raiders",,,163487,JMLS,"zBS zzzzzzJMLS zWat Tambor, zzJKL zJolee",1
"Raiders",1,0,147599,CLS,"zzzCLS zHan zzChewbacca zzC-3PO zChewpio",1
"Raiders",,,498602,Negotiator,"Negotiator BTL-B Y-wing, Anakin's Eta-2, Rex's ARC-170, Umbaran SF, Ahsoka's SF, Plo's SF, Clone Sergeant's ARC-170",1
"Raiders",,,315215,Malevolence,"Malevolence Hyena Bomber, Vulture Droid, Sun Fac SF, Soldier SF, Spy SF",1
"Raiders",0,1,139869,Grievous,"zzGG zB2 zB1 zMagnaGuard zNute",1
"Raiders",1,0,139821,Traya,"zzTraya zzDN zSion zzEP Sith Empire Trooper",1
"Raiders",1,1,134126,JTR,"zzzJTR zScav Rey, zzBB-8 zzR2-D2 RT",1
"Raiders",,,111353,Mon Mothma,"zzMon Mothma, Wedge zPao Biggs Lando",1
"Raiders",1,1,98779,Ewoks,"zChirpa Elder zPaploo zWicket zLogray",1
"Raiders",1,0,153885,ShaakClones,"zzShaak Ti, zRex zEcho (501st), zzFives zARC Trooper",1
"Raiders",0,1,159655,BH,"zzBossk zzJango zDengar zBoba zZam",1
"Raiders",1,1,102435,Carth,"zCarth Onasi, zMission zZaalbar zJuhani zCanderous",1
"Raiders",1,0,128643,Troopers,"zVeers zStarck zDT zzGideon zDark Trooper",1
"Raiders",0,1,77721,Phoenix,"Hera Zeb Sabine G9, Ezra Kanan G8",1
"Raiders",1,0,83525,Jawas,"Nebit Jawa Engineer, Jawa Scavenger, Jawa Dathcha",1
"Raiders",1,0,73577,QiraNest,"zQira zNest zzHYoda",1
"Raiders",0,1,103391,Geonosians Omicron,"zzGBA Sun Fac, Geo Soldier, Geo Spy, Poggle",0
"Raiders",,,399520,HansMF,"Home One, Han's MF, Rebel Y-wing 6*, Bistan's U-wing, Phantom Biggs X-wing, Cassian's U-wing, Wedge X-wing",0
"Raiders",,,120849,Bad Batch,"zHunter zEcho zzOmega G9, zTech zWrecker",0
"Obi Bells",,,124262,Phasma,"zPhasma zFOTP FOSFTP zFOST zKylo",1
"Obi Bells",1,1,166620,SL Kylo,"zzzzzzSL Kylo, zSith Trooper, zHux zzKRU zzThrawn",1
"Obi Bells",,,172805,SEE,"zzzzzzSEE zBSF zzMalak zzzDR zzzVader",1
"Obi Bells",1,1,169191,GL Rey,"zzzzzzRey zGK zzzJTR zRH Poe, zRH Finn",1
"Obi Bells",,,563173,Executor,"Executor 5* HT RC Xanadu Blood, Slave I, IG-2000 Imperial TIE Fighter, Tie Adv",1
"Obi Bells",,,182639,JMLS,"zzzJKR zzJKL zzzzzzJMLS zWat Tambor, zzzzGAS",1
"Obi Bells",1,0,144837,CLS,"zzzCLS zHan zzChewbacca zzC-3PO zChewpio",1
"Obi Bells",1,1,110908,NestSisters,"zzAV zzMT zDaka Zombie zNest",1
"Obi Bells",,,485959,Negotiator,"Negotiator BTL-B Y-wing 6*, Anakin's Eta-2, Rex's ARC-170, Umbaran SF, Ahsoka's SF, Plo's SF, Clone Sergeant's ARC-170",1
"Obi Bells",,,317107,Malevolence,"Malevolence Hyena Bomber, Vulture Droid, Sun Fac SF, Soldier SF, Spy SF",1
"Obi Bells",1,0,117243,Traya,"zzTraya zDN zSion zzEP Sith Empire Trooper",1
"Obi Bells",0,1,134521,Grievous,"zzGG zB2 zDroideka zMagnaGuard zDooku",1
"Obi Bells",1,0,122296,Troopers,"zVeers zzPiett zzGideon zDark Trooper, Range Trooper",1
"Obi Bells",,,124703,Disintegration,"zzAurra Greef G9, zBoba zzBossk zzThe Mandalorian",1
"Obi Bells",,,108311,Mon Mothma,"zzMon Mothma, Wedge Cara Dune, Biggs Lando",1
"Obi Bells",1,1,86109,Ewoks,"zChirpa Elder Paploo Wicket Logray",1
"Obi Bells",1,0,122635,ShaakClones,"zzShaak Ti, zRex zEcho (501st), zzFives zARC Trooper",1
"Obi Bells",1,1,94270,Carth,"zCarth Onasi, zMission zZaalbar zJuhani Canderous",1
"Obi Bells",0,1,130018,BH,"zzJango zDengar Cad Zam zIG-88",1
"Obi Bells",,,88307,Iden Troopers,"zIden Versio, Shoretrooper G9, Snowtrooper Magma zDT",1
"Obi Bells",0,1,82360,Phoenix,"zHera Zeb G8, Sabine G8, zEzra Kanan",1
"Obi Bells",0,1,141921,BS,"zBS zzGMY zJolee zzOld Ben, zzHYoda",1
"Obi Bells",1,0,80300,Jawas,"Nebit Jawa Engineer G9, Jawa Scavenger, Jawa G9, Dathcha",1
"Obi Bells",0,1,100839,Geonosians Omicron,"zzGBA Sun Fac, Geo Soldier, Geo Spy, Poggle",0
"Obi Bells",,,388103,HansMF,"Home One, Han's MF, Rebel Y-wing, Bistan's U-wing, Phantom Biggs X-wing, Cassian's U-wing, Wedge X-wing",0
"Obi Bells",,,81576,Bad Batch,"zHunter Echo Omega 6* G9, zTech G9, zWrecker G9",0
"Obi Bells",1,1,63142,Rogue1,"Jyn G1, Chirrut G8, Baze G5, Bistan G7, Pao G8",0
"DaveSkywalker",,,178725,JMK,"zzzzzzJMK zAhsoka zzzCAT zzzzGAS zGK",1
"DaveSkywalker",,,149208,SEE,"zzzzzzSEE BSF zzMalak zDR zzzVader",1
"DaveSkywalker",1,0,146008,CLS,"zzzCLS zHan zzChewbacca zzC-3PO zChewpio",1
"DaveSkywalker",,,132188,Grievous Omicron,"zzGG zB2 zB1 zMagnaGuard zDroideka",1
"DaveSkywalker",0,1,112061,Geonosians Omicron,"zzGBA Sun Fac, Geo Soldier, Geo Spy, Poggle",1
"DaveSkywalker",,,134975,JKL,"zzJKL zzzJKR HYoda Old Ben, Aayla",1
"DaveSkywalker",,,365114,HansMF,"Home One, Han's MF, Rebel Y-wing, Bistan's U-wing, Phantom Biggs X-wing, Cassian's U-wing, Wedge X-wing",1
"DaveSkywalker",,,526015,Negotiator,"Negotiator HT Anakin's Eta-2, Umbaran SF, Ahsoka's SF, Clone Sergeant's ARC-170, Plo's SF, Rex's ARC-170",1
