Player,Offense,Defense,GP,Name,Squad,Viable
"PapaBear",1,0,77566,Troopers,"Veers Starck G9, Piett 6* Snowtrooper Dark Trooper",0
"PapaBear",1,0,63471,Thragma (Counter),"Thrawn Magma G7, DT 6* G8, Stormtrooper G9, Shoretrooper G9",0
"PapaBear",1,1,57456,Rogue1,"Jyn G8, Chirrut G8, Baze 6* G8, Scarif G8, K-2SO G9",0
"Mol Rammal",,,179865,JMK,"zzzzzzJMK zAhsoka zzzCAT zzzzGAS zGK",1
"Mol Rammal",,,168207,SEE,"zzzzzzSEE zBSF zzMalak zzzDR zzzVader",1
"Mol Rammal",1,1,169187,GL Rey,"zzzzzzRey zzzJTR zzR2-D2 zHoldo zRH Finn",1
"Mol Rammal",,,581924,Executor,"Executor HT RC Xanadu Blood, Slave I, IG-2000 Imperial TIE Fighter, Tie Adv",1
"Mol Rammal",1,0,143147,CLS,"zzzCLS zHan zzChewbacca zzC-3PO zChewpio",1
"Mol Rammal",1,1,107122,NestSisters,"zzAV zzMT zDaka Zombie zNest",1
"Mol Rammal",,,514424,Negotiator,"Negotiator BTL-B Y-wing, Anakin's Eta-2, Rex's ARC-170, Umbaran SF, Ahsoka's SF, Plo's SF, Clone Sergeant's ARC-170",1
"Mol Rammal",,,140906,JKL,"zzJKL zzzJKR zzHYoda zOld Ben, Aayla",1
"Mol Rammal",,,463497,HansMF,"Home One, Han's MF, Rebel Y-wing, Bistan's U-wing, Phantom Ghost Cassian's U-wing, Wedge X-wing",1
"Mol Rammal",1,0,121073,Traya,"zzTraya zDN zSion Sith Empire Trooper, zThrawn",1
"Mol Rammal",0,1,132376,Grievous-Wat,"zzGG zB2 zB1 zMagnaGuard zWat Tambor",1
"Mol Rammal",,,115676,Mon Mothma,"zzMon Mothma, Pao Bistan Wedge zCara Dune",1
"Mol Rammal",1,1,87541,Ewoks,"zChirpa Elder Paploo zWicket Logray",1
"Mol Rammal",1,0,149453,ShaakClones,"zzShaak Ti, zRex zEcho (501st), zzFives zARC Trooper",1
"Mol Rammal",0,1,149454,BH,"zzBossk zIG-88 zBoba zzJango zDengar",1
"Mol Rammal",1,1,91288,Carth,"zCarth Onasi, zMission Zaalbar Juhani Canderous",1
"Mol Rammal",1,0,132322,Troopers,"zVeers zStarck zzPiett Shoretrooper zGideon",1
"Mol Rammal",0,1,83991,Phoenix,"Hera Sabine G8, Ezra Kanan zZeb G8",1
"Mol Rammal",1,1,105205,Rogue1,"zJyn Chirrut Baze K-2SO G8, zCassian",1
"Mol Rammal",,,130551,Bad Batch,"zHunter zEcho zzOmega zTech zWrecker",1
"Mol Rammal",1,0,123498,zMaul,"zDarth Maul, zDooku zSidious Savage Sith Marauder",1
"Mol Rammal",1,0,118219,EP (Counter, Rebel),"zzEP Krennic zDT zzWampa Range Trooper G9",1
"Mol Rammal",1,0,94549,Jawas,"Nebit Jawa Engineer, Jawa Scavenger, Jawa Dathcha",1
"Mol Rammal",,,65043,Phasma,"Phasma G8, FOTP G8, FOSFTP G3, FOST G8, zKylo",0
"Mol Rammal",,,291457,Malevolence,"Malevolence Hyena Bomber 4*, Vulture Droid 6*, Sun Fac SF, Soldier SF, Spy SF",0
"Mol Rammal",0,1,95011,Geonosians Omicron,"zzGBA Sun Fac, Geo Soldier, Geo Spy, Poggle",0
"Nomagio",,,539984,Executor,"Executor 5* HT RC Xanadu Blood, Slave I, IG-2000 Imperial TIE Fighter, Tie Adv",1
"Nomagio",0,1,144377,padme,"zzPadme zGK zJKA zAhsoka zzzCAT",1
"Nomagio",,,183570,JMLS,"zzzJKR zzJKL zzzzzzJMLS zWat Tambor, zzzzGAS",1
"Nomagio",1,0,145148,CLS,"zzzCLS zHan zzChewbacca zzC-3PO zChewpio",1
"Nomagio",0,1,124691,DRMalak,"zzzDR zzHK-47 zBSF zzMalak Sith Empire Trooper G8",1
"Nomagio",,,456823,Negotiator,"Negotiator BTL-B Y-wing, Anakin's Eta-2, Rex's ARC-170, Umbaran SF, Ahsoka's SF, Plo's SF, Clone Sergeant's ARC-170",1
"Nomagio",,,422402,HansMF,"Home One, Han's MF, Rebel Y-wing, Bistan's U-wing, Phantom Biggs X-wing, Cassian's U-wing, Wedge X-wing",1
"Nomagio",1,1,107247,JTR,"zzzJTR zzR2-D2 BB-8 G9, RH Finn G8, RH Poe G8",1
"Nomagio",0,1,132196,Grievous,"zzGG zB2 zB1 zMagnaGuard zNute",1
"Nomagio",1,0,116497,Traya,"zzTraya zzDN zSion zDooku zThrawn",1
"Nomagio",1,0,120618,Troopers,"zVeers zzPiett zGideon zDark Trooper, Range Trooper",1
"Nomagio",,,117461,Disintegration,"Aurra Greef G8, zBoba zzBossk zzThe Mandalorian",1
"Nomagio",,,112449,Mon Mothma,"zzMon Mothma, Biggs Wedge Lando zCassian",1
"Nomagio",1,1,103091,Ewoks,"zChirpa Elder zPaploo zWicket zLogray",1
"Nomagio",1,0,139928,ShaakClones,"zzShaak Ti, zRex zEcho (501st), zzFives zARC Trooper",1
"Nomagio",1,1,93380,Carth,"zCarth Onasi, zMission zZaalbar Juhani zCanderous",1
"Nomagio",1,1,128079,zEP,"zzEP zzzVader Tarkin TFP zzMara Jade, The Emperor's Hand",1
"Nomagio",0,1,95429,FO,"zzKRU Kylo G9, FOO FOE G8, FOST G9",1
"Nomagio",,,86099,Iden Troopers,"zIden Versio, zStormtrooper Snowtrooper Magma DT",1
"Nomagio",0,1,77400,Phoenix,"Hera Ezra Kanan Chopper Zeb",1
"Nomagio",0,1,126916,BS,"zBS zGMY zJolee Old Ben, zzHYoda",1
"Nomagio",,,320175,Malevolence,"Malevolence Hyena Bomber 6*, Vulture Droid, Sun Fac SF, Soldier SF, Spy SF",0
"Nomagio",0,1,101670,Geonosians Omicron,"zzGBA Sun Fac, Geo Soldier, Geo Spy, Poggle",0
"Nomagio",1,1,72999,NS,"MT G8, zzAV Daka G9, Zombie G8, Spirit G7",0
"Nomagio",0,1,126960,BH,"zJango zIG-88 Embo Cad zDengar",0
"Nomagio",,,109025,Bad Batch,"zHunter zEcho zzOmega G9, zTech zWrecker",0
"Nomagio",1,1,70424,Rogue1,"Jyn Chirrut G8, Baze G7, Bistan G8, K-2SO G8",0
"Nomagio",,,81547,Mando,"The Mandalorian (Beskar Armor) G8, zDash Rendar, Nest G7, IG-11 G8, Kuiil G9",0
"Nomagio",1,0,66054,Jawas,"Nebit G7, Jawa Engineer G9, Jawa Scavenger G7, Jawa G9, Dathcha G8",0
"Icyshadowz26",,,176001,JMK,"zzzzzzJMK zJKA zGMY zzShaak Ti, zGK",1
"Icyshadowz26",,,173944,SEE,"zzzzzzSEE zBSF zzMalak zzzDR zzzVader",1
"Icyshadowz26",,,129632,Grievous Omicron,"zzGG zB2 zB1 zMagnaGuard zDroideka",1
"Icyshadowz26",,,487508,Negotiator,"Negotiator HT Anakin's Eta-2, Umbaran SF, Ahsoka's SF, Clone Sergeant's ARC-170, Plo's SF, Rex's ARC-170",1
"Icyshadowz26",,,354268,HansMF,"Home One, Han's MF, Biggs X-wing, Bistan's U-wing, Phantom Ghost Cassian's U-wing, Wedge X-wing",1
"Icyshadowz26",,,127373,Nute-Wat,"zNute zDooku zWat Tambor, zzJango zNest G9",1
"Icyshadowz26",,,115947,Disintegration,"Aurra zzGreef zBoba zzBossk zThe Mandalorian",1
"Icyshadowz26",1,1,122499,GAS,"zzzzGAS zRex zEcho (501st), zzFives zARC Trooper",1
"Icyshadowz26",1,0,158632,CLS,"zzzCLS zHan zzChewbacca zzThrawn zzC-3PO",1
"Icyshadowz26",1,1,87067,Ewoks,"zChirpa Elder zPaploo Wicket zLogray G9",1
"Icyshadowz26",1,1,95549,Carth,"zCarth Onasi, zMission zZaalbar zJuhani Canderous",1
"Icyshadowz26",1,0,114594,Troopers,"zVeers zStarck zzPiett DT zzGideon",1
"Icyshadowz26",0,1,67457,Phoenix,"Hera G8, Ezra Kanan G8, Chopper G9, Zeb G8",1
"Icyshadowz26",1,1,51603,Rogue1,"Jyn G8, Chirrut G8, Baze G8, K-2SO G8, Cassian G8",1
"Icyshadowz26",1,0,102950,EP (Counter, Rebel),"zzEP Shoretrooper G8, Krennic zzWampa Stormtrooper G8",1
"Icyshadowz26",,,68184,Phasma,"Phasma FOTP FOSFTP G7, FOST 5* G8, zKylo",0
"Icyshadowz26",,,279832,Malevolence,"Malevolence Hyena Bomber 4*, Vulture Droid 5*, Sun Fac SF, Soldier SF, Spy SF",0
"Icyshadowz26",,,121598,JKL,"zzJKL zzzJKR zHYoda zOld Ben, Aayla",0
"Icyshadowz26",0,1,92390,Geonosians Omicron,"zzGBA Sun Fac, Geo Soldier, Geo Spy, Poggle",0
"Icyshadowz26",1,1,78655,NS,"zMT G8, zzAV zDaka G9, Zombie Spirit G8",0
"Icyshadowz26",1,1,64656,JTR,"JTR G1, zScav Rey, BB-8 G8, R2-D2 G9, Finn G9",0
"Icyshadowz26",,,70482,Bad Batch,"zHunter 6* zEcho 6* Omega 5* G8, zTech 6* zWrecker 5* G9",0
"Icyshadowz26",1,0,65680,Jawas,"Nebit G7, Jawa Engineer G7, Jawa Scavenger G7, Jawa Dathcha G7",0
"Gorgonzoloff",,,173904,LV,"zzzzzzLord Vader, zzThrawn zzzVader zRG zzTarkin",1
"Gorgonzoloff",,,169864,SEE,"zzzzzzSEE zBSF zzMalak zzzDR zDooku",1
"Gorgonzoloff",1,0,141022,CLS,"zzzCLS zHan zzChewbacca zzC-3PO zChewpio",1
"Gorgonzoloff",0,1,133677,padme,"zzPadme zGK zJKA zAhsoka zBarriss",1
"Gorgonzoloff",,,468903,Negotiator,"Negotiator HT Anakin's Eta-2, Umbaran SF, Ahsoka's SF, BTL-B Y-wing, Clone Sergeant's ARC-170, Plo's SF",1
"Gorgonzoloff",,,342015,Malevolence,"Malevolence Hyena Bomber, Vulture Droid, Sun Fac SF, Soldier SF, Spy SF",1
"Gorgonzoloff",,,467192,HansMF,"Home One, Han's MF, Rebel Y-wing, Bistan's U-wing, Phantom Ghost Cassian's U-wing, Wedge X-wing",1
"Gorgonzoloff",1,1,105193,JTR,"zzzJTR zzR2-D2 zzBB-8 zRH Finn G9, zRH Poe G8",1
"Gorgonzoloff",0,1,140887,Grievous,"zzGG zB2 zB1 zMagnaGuard zNute",1
"Gorgonzoloff",1,0,134638,Traya,"zzTraya zzDN zSion zzEP Sith Empire Trooper",1
"Gorgonzoloff",,,119320,Mon Mothma,"zzMon Mothma, zPao Bistan Scarif zCara Dune",1
"Gorgonzoloff",1,0,127845,Troopers,"zVeers zzPiett zzGideon zDark Trooper, Range Trooper",1
"Gorgonzoloff",,,499820,Executrix,"Executrix Tie Adv, Emperor's Shuttle, TIE Reaper, Imperial TIE Fighter, Gauntlet Starfighter, FOSF TIE Fighter, FO TIE Fighter",1
"Gorgonzoloff",1,1,152766,GAS,"zzzzGAS zRex zEcho (501st), zzFives zARC Trooper",1
"Gorgonzoloff",1,1,129442,Revan Offense,"zzzJKR zzGMY zBS zJolee zHYoda",1
"Gorgonzoloff",1,1,98152,Ewoks,"zChirpa Elder zPaploo zWicket zLogray",1
"Gorgonzoloff",1,1,100696,Carth,"zCarth Onasi, zMission zZaalbar zVandor Chewbacca, Canderous",1
"Gorgonzoloff",0,1,141335,BH,"zzBossk zZam zzEmbo zBoba zDengar",1
"Gorgonzoloff",0,1,110575,BH,"zzJango zGreedo zzGreef zzThe Mandalorian, Cad",1
"Gorgonzoloff",,,117359,Iden Troopers,"zIden Versio, zStormtrooper Snowtrooper Magma zDT",1
"Gorgonzoloff",0,1,83948,Phoenix,"Hera Sabine G8, zEzra Kanan G8, Zeb G8",1
"Gorgonzoloff",0,1,86419,FO,"zzKRU zKylo Phasma FOO FOST G9",1
"Gorgonzoloff",1,1,112809,Rogue1,"zzJyn Chirrut Baze G8, zK-2SO zCassian",1
"Gorgonzoloff",,,132077,Bad Batch,"zHunter zEcho zzOmega zTech zWrecker",1
"Gorgonzoloff",1,0,20898,NestSolo (Counter),"zNest",1
"Gorgonzoloff",1,1,92815,NS,"zzMT zzAV zDaka Zombie G9, Spirit G6",0
"Gorgonzoloff",0,1,118267,Geonosians Omicron,"zzGBA Sun Fac, Geo Soldier, Geo Spy, Poggle",0
"Gorgonzoloff",1,0,106399,zMaul,"Darth Maul, zSidious Sith Assassin, Savage Sith Marauder",0
"Gorgonzoloff",1,0,65167,Jawas,"Nebit Jawa Engineer, Jawa Scavenger G7, Jawa G9, Dathcha",0
"Dakeyras",0,1,134599,DRMalak,"zzzDR zzHK-47 zBSF zzMalak Sith Empire Trooper",1
"Dakeyras",0,1,123805,padme,"zzPadme zGK JKA zAhsoka zzC-3PO",1
"Dakeyras",,,443443,Negotiator,"Negotiator HT Anakin's Eta-2, Umbaran SF, Ahsoka's SF, BTL-B Y-wing 6*, Clone Sergeant's ARC-170, Plo's SF",1
"Dakeyras",,,376650,HansMF,"Home One, Han's MF, Rebel Y-wing, Bistan's U-wing, Phantom Ghost Cassian's U-wing, Wedge X-wing",1
"Dakeyras",0,1,131975,Grievous-Wat,"zzGG zB2 zB1 zMagnaGuard zWat Tambor",1
"Dakeyras",1,1,103517,JTR,"zzzJTR Scav Rey, zBB-8 zzR2-D2 Finn",1
"Dakeyras",,,401929,Executrix,"Executrix Tie Adv, Emperor's Shuttle, TIE Reaper, Imperial TIE Fighter, Gauntlet Starfighter, FOSF TIE Fighter, FO TIE Fighter",1
"Dakeyras",1,1,136163,GAS,"zzzzGAS zRex zEcho (501st), zzFives zARC Trooper",1
"Dakeyras",1,1,130802,Revan Offense,"zzzJKR zGMY BS zJolee zzHYoda",1
"Dakeyras",1,1,95085,Ewoks,"zChirpa Elder zPaploo zWicket zLogray",1
"Dakeyras",0,1,128074,BH,"zzBossk zBoba zzJango Cad Dengar",1
"Dakeyras",1,1,106854,zEP,"zzEP zzzVader Tarkin DT TFP",1
"Dakeyras",1,0,92999,Troopers,"zVeers zStarck Snowtrooper Shoretrooper Range Trooper",1
"Dakeyras",1,0,116947,CLS,"zzzCLS zHan Wedge Biggs zzChewbacca",1
"Dakeyras",0,1,93509,FO,"zzKRU zKylo zHux FOO FOST G9",1
"Dakeyras",0,1,75837,Phoenix,"Hera zSabine G8, Ezra Kanan G9, Zeb G9",1
"Dakeyras",1,0,98183,zMaul,"zDarth Maul, zDooku zSidious zSavage Sith Marauder",1
"Dakeyras",1,0,80862,Jawas,"Nebit Jawa Engineer, Jawa Scavenger, Jawa Dathcha",1
"Dakeyras",0,1,95371,Geonosians Omicron,"zzGBA Sun Fac, Geo Soldier, Geo Spy, Poggle",0
"Dakeyras",,,236515,Malevolence,"Malevolence 5* Hyena Bomber 4*, Vulture Droid 3*, Sun Fac SF, Soldier SF, Spy SF",0
"Dakeyras",1,1,92010,NS_Alt,"zzMT G9, zzAV Zombie zDaka Talia G7",0
"Dakeyras",,,85227,Mon Mothma,"Mon Mothma G7, zKyle Katarn, Lando zCara Dune G8, Cassian",0
"Dakeyras",1,1,83088,Carth,"zCarth Onasi, zMission Zaalbar G7, Juhani G8, zCanderous",0
"Dakeyras",1,1,64954,Rogue1,"Jyn G7, Chirrut G8, Baze G8, Pao G8, K-2SO G8",0
"Dakeyras",,,52693,Bad Batch,"Hunter G1, Echo Omega G1, Tech G3, Wrecker G8",0
"Dakeyras",1,0,7639,SionSolo (Counter),"Sion G2",0
"Sky Forcewalker",0,1,133447,DRMalak,"zzzDR zzHK-47 zBSF zzMalak Sith Empire Trooper",1
"Sky Forcewalker",0,1,138542,padme,"zzPadme zGK zJKA zAhsoka zzC-3PO",1
"Sky Forcewalker",1,1,103224,NestSisters,"zzAV zzMT zDaka Zombie zNest",1
"Sky Forcewalker",,,432545,Negotiator,"Negotiator HT Anakin's Eta-2, Umbaran SF, Ahsoka's SF, Clone Sergeant's ARC-170, Jedi Consular's Starfighter, Plo's SF",1
"Sky Forcewalker",0,1,122800,Grievous,"zzGG zB2 zB1 zMagnaGuard zNute",1
"Sky Forcewalker",1,0,126427,Traya,"zzTraya zzDN zSion zDooku zzThrawn",1
"Sky Forcewalker",1,1,107486,JTR,"zzzJTR Scav Rey, zzBB-8 zzR2-D2 Finn",1
"Sky Forcewalker",1,1,151189,GAS,"zzzzGAS zRex zEcho (501st), zzFives zARC Trooper",1
"Sky Forcewalker",1,1,128725,Revan Offense,"zzzJKR zzGMY zBS zJolee zEzra",1
"Sky Forcewalker",1,1,100116,Carth,"zCarth Onasi, zMission zZaalbar zJuhani zCanderous",1
"Sky Forcewalker",0,1,121373,BH,"zzBossk zIG-88 zBoba zzJango Cad",1
"Sky Forcewalker",1,0,117566,CLS,"zzzCLS zHan Wedge Biggs zzChewbacca",1
"Sky Forcewalker",0,1,93570,FO,"zzKRU zKylo Phasma FOE FOTP",1
"Sky Forcewalker",,,125915,Bad Batch,"zHunter zEcho zzOmega zTech zWrecker",1
"Sky Forcewalker",0,1,82233,Geonosians Omicron,"zzGBA Sun Fac G9, Geo Soldier, Geo Spy, Poggle",0
"Sky Forcewalker",,,323199,HansMF,"Home One, Han's MF 5*, Biggs X-wing, Bistan's U-wing 4*, Phantom Ghost Cassian's U-wing 5*, Wedge X-wing",0
"Sky Forcewalker",0,1,68276,Phoenix,"Hera G9, Sabine G7, Kanan G9, Chopper Zeb",0
"Guihori",,,123172,Phasma,"zPhasma zFOTP FOSFTP zFOST zKylo",1
"Guihori",1,1,165151,SL Kylo,"zzzzzzSL Kylo, zSith Trooper, zHux zzKRU zzThrawn",1
"Guihori",,,177047,SEE,"zzzzzzSEE zBSF zzMalak zzzDR zzzVader",1
"Guihori",,,569210,Executor,"Executor 5* HT RC Xanadu Blood, Slave I, IG-2000 Imperial TIE Fighter, Tie Adv",1
"Guihori",0,1,144640,padme,"zzPadme zGK zJKA zAhsoka zzzCAT",1
"Guihori",,,176340,JMLS,"zzzJKR zzJKL zzzzzzJMLS zWat Tambor, zzzzGAS",1
"Guihori",1,0,149285,CLS,"zzzCLS zHan zzChewbacca zzC-3PO zChewpio",1
"Guihori",1,1,117796,NestSisters,"zzAV zzMT zDaka Zombie zNest",1
"Guihori",,,115429,Grievous Omicron,"zzGG zB2 zB1 zMagnaGuard zDroideka",1
"Guihori",,,489933,Negotiator,"Negotiator BTL-B Y-wing, Anakin's Eta-2, Rex's ARC-170, Umbaran SF, Ahsoka's SF, Plo's SF, Clone Sergeant's ARC-170",1
"Guihori",,,301037,Malevolence,"Malevolence Hyena Bomber, Vulture Droid, Sun Fac SF, Soldier SF, Spy SF",1
"Guihori",,,456637,HansMF,"Home One, Han's MF, Rebel Y-wing, Bistan's U-wing, Phantom Biggs X-wing, Cassian's U-wing, Wedge X-wing",1
"Guihori",1,1,137443,JTR,"zzzJTR zScav Rey, zzBB-8 zzR2-D2 zFinn",1
"Guihori",1,0,139065,Traya,"zzTraya zzDN zSion zDooku zzEP",1
"Guihori",1,0,131820,Troopers,"zVeers zzPiett zzGideon zDark Trooper, Range Trooper",1
"Guihori",,,107443,Mon Mothma,"zzMon Mothma, zPao Bistan Hoth Rebel Scout, Wedge",1
"Guihori",1,1,86133,Ewoks,"zChirpa Elder Paploo G8, zWicket zLogray",1
"Guihori",1,0,145046,ShaakClones,"zzShaak Ti, zRex zEcho (501st), zzFives zARC Trooper",1
"Guihori",0,1,138674,BH,"zzBossk zIG-88 zBoba Cad Dengar",1
"Guihori",1,1,91882,Carth,"zCarth Onasi, zMission zZaalbar zJuhani zCanderous",1
"Guihori",0,1,101706,BH,"zzJango G9, zGreedo zFennec Shand, zzGreef G8, zThe Mandalorian G9",1
"Guihori",0,1,77042,Phoenix,"zHera Sabine Ezra G8, Kanan G8, Zeb G8",1
"Guihori",0,1,124719,BS,"zBS zzGMY zJolee zzOld Ben, zzHYoda",1
"Guihori",1,0,70807,Jawas,"Nebit G8, Jawa Engineer G9, Jawa Scavenger G8, Jawa Dathcha G9",1
"Guihori",,,93253,Admiral Raddus,"zzAdmiral Raddus 6*, zCassian zJyn K-2SO G8, Chirrut G8",0
"Guihori",0,1,104712,Geonosians Omicron,"zzGBA Sun Fac, Geo Soldier, Geo Spy, Poggle",0
"Guihori",,,88126,Iden Troopers,"zIden Versio, Shoretrooper Snowtrooper Magma G8, DT",0
"Guihori",,,97198,Bad Batch,"zHunter zEcho zzOmega G9, zTech zWrecker",0
"Tiberius",,,123423,Phasma,"zPhasma zFOTP FOSFTP zFOST zKylo",1
"Tiberius",1,1,160530,SL Kylo,"zzzzzzSL Kylo, zSith Trooper, zHux zzKRU zzThrawn",1
"Tiberius",,,180242,JMLS,"zzzJKR zzJKL zzzzzzJMLS zWat Tambor, zzzzGAS",1
"Tiberius",1,0,145733,CLS,"zzzCLS zHan zzChewbacca zzC-3PO zChewpio",1
"Tiberius",0,1,120626,padme,"zzPadme zGK zJKA zAhsoka CW Chewbacca G9",1
"Tiberius",0,1,96372,Geonosians Omicron,"zzGBA Sun Fac, Geo Soldier, Geo Spy, Poggle",1
"Tiberius",,,505562,Negotiator,"Negotiator HT Anakin's Eta-2, Umbaran SF, Ahsoka's SF, Clone Sergeant's ARC-170, Plo's SF, Rex's ARC-170",1
"Tiberius",,,412192,HansMF,"Home One, Han's MF, Rebel Y-wing, Ghost Phantom Biggs X-wing, Cassian's U-wing, Wedge X-wing",1
"Tiberius",0,1,119521,Grievous,"zzGG zB2 zB1 zMagnaGuard zNute",1
"Tiberius",1,1,116557,JTR,"zzzJTR zScav Rey, BB-8 G8, zzR2-D2 Finn G8",1
"Tiberius",,,103831,Mon Mothma,"Mon Mothma, Biggs Wedge Lando Cara Dune",1
"Tiberius",1,1,95552,Ewoks,"zChirpa Elder zPaploo zWicket zLogray",1
"Tiberius",1,0,148044,ShaakClones,"zzShaak Ti, zRex zEcho (501st), zzFives zARC Trooper",1
"Tiberius",0,1,130761,BH,"zzBossk zBoba zBoba Fett, Scion of Jango, zzJango zDengar",1
"Tiberius",1,1,116140,zEP,"zzEP zzzVader zTarkin TFP G8, zzTraya G9",1
"Tiberius",0,1,76116,Phoenix,"zHera Sabine G8, Ezra G8, zKanan G8, Zeb G8",1
"Tiberius",0,1,135621,BS,"zBS zzGMY zJolee zzOld Ben, zzHYoda",1
"Tiberius",1,0,15456,SionSolo (Counter),"Sion G9",1
"Tiberius",,,303676,Malevolence,"Malevolence Hyena Bomber, Vulture Droid 5*, Sun Fac SF, Soldier SF, Spy SF",0
"Tiberius",1,1,77279,NS,"MT G8, zAV Daka G9, Zombie G8, Spirit",0
"Tiberius",,,389435,Executrix,"Executrix Tie Adv, Emperor's Shuttle 4*, TIE Reaper 4*, Imperial TIE Fighter, Gauntlet Starfighter 6*, FOSF TIE Fighter, FO TIE Fighter",0
"Tiberius",1,1,58462,Carth,"Carth Onasi G7, Mission G7, Zaalbar G8, Juhani 3* G6, Canderous 4*",0
"Tiberius",1,0,69663,zMaul,"Darth Maul G8, Sidious G9, zDooku Sith Empire Trooper 6* G6, Nest G7",0
"Tiberius",,,58192,Iden Troopers,"Iden Versio 4* G8, Stormtrooper G8, Snowtrooper G8, Magma G6, DT G9",0
"Tiberius",1,0,59883,Troopers,"Veers G9, Starck G7, Piett 6* G7, Shoretrooper G8, Gideon 5* G6",0
"Tiberius",1,1,60281,Rogue1,"Jyn G8, Chirrut 6* G8, Baze G8, K-2SO G8, Cassian G8",0
"Demetree",,,167925,JMK,"zzzzzzJMK zAhsoka zzzCAT zJKA zGK",1
"Demetree",1,1,161210,SL Kylo,"zzzzzzSL Kylo, Sith Trooper, zHux zzKRU zzThrawn",1
"Demetree",,,161604,SEE,"zzzzzzSEE zBSF zzMalak zzzDR zzzVader",1
"Demetree",1,1,167459,GL Rey,"zzzzzzRey zzzJTR zzBB-8 zRH Poe, zRH Finn",1
"Demetree",1,1,115318,NS,"zzMT zzAV zDaka Zombie Spirit",1
"Demetree",,,578903,Executor,"Executor HT RC Xanadu Blood, Slave I, IG-2000 Imperial TIE Fighter, Tie Adv",1
"Demetree",,,170101,JMLS,"zzzJKR zzJKL zzzzzzJMLS zWat Tambor, zzzzGAS",1
"Demetree",1,0,146250,CLS,"zzzCLS zHan zzChewbacca zzC-3PO zChewpio",1
"Demetree",,,502118,Negotiator,"Negotiator BTL-B Y-wing, Anakin's Eta-2, Rex's ARC-170, Umbaran SF, Ahsoka's SF, Plo's SF, Clone Sergeant's ARC-170",1
"Demetree",,,420504,HansMF,"Home One, Han's MF, Rebel Y-wing, Bistan's U-wing, Phantom Biggs X-wing, Cassian's U-wing, Wedge X-wing",1
"Demetree",0,1,122314,Grievous,"zzGG zB2 zB1 zMagnaGuard zNute",1
"Demetree",1,0,113373,Traya,"zzTraya zDN zSion zzEP Sith Empire Trooper",1
"Demetree",,,97880,Mon Mothma,"zzMon Mothma, Pao Hoth Rebel Scout, Wedge Cara Dune",1
"Demetree",1,0,118405,Troopers,"zVeers zzPiett zzGideon zDark Trooper, Range Trooper",1
"Demetree",,,118463,Disintegration,"Aurra Greef zBoba zzBossk zThe Mandalorian",1
"Demetree",1,1,85295,Ewoks,"zChirpa Elder Paploo zWicket Logray",1
"Demetree",1,0,137701,ShaakClones,"zzShaak Ti, zRex zEcho (501st), zzFives zARC Trooper",1
"Demetree",1,1,93571,Carth,"zCarth Onasi, zMission zZaalbar Juhani Canderous",1
"Demetree",0,1,128569,BH,"zzJango Zam zIG-88 Cad zDengar",1
"Demetree",0,1,76032,Phoenix,"Hera Sabine Ezra Kanan G9, Zeb G8",1
"Demetree",1,1,76291,Rogue1,"Jyn Chirrut Baze G8, K-2SO G8, Cassian G8",1
"Demetree",1,0,126830,zMaul,"zDarth Maul, zDooku zSidious zSavage Sith Marauder",1
"Demetree",0,1,137661,BS,"zBS zzGMY zJolee zzOld Ben, zzHYoda",1
"Demetree",1,0,80254,Jawas,"Nebit G9, Jawa Engineer, Jawa Scavenger G9, Jawa Dathcha",1
"Demetree",,,118902,Phasma,"zPhasma FOTP FOSFTP FOST zKylo",0
"Demetree",,,310547,Malevolence,"Malevolence Hyena Bomber 5*, Vulture Droid 4*, Sun Fac SF, Soldier SF, Spy SF",0
"Demetree",0,1,109333,Geonosians Omicron,"zzGBA Sun Fac, Geo Soldier, Geo Spy, Poggle",0
"Demetree",,,77795,Mando,"zzThe Mandalorian (Beskar Armor), Dash Rendar 4* G3, Nest G7, IG-11 Kuiil",0
"Biuejed",,,119771,Phasma,"zPhasma FOTP FOSFTP zFOST zKylo",1
"Biuejed",1,1,165667,SL Kylo,"zzzzzzSL Kylo, zSith Trooper, zHux zzKRU zzThrawn",1
"Biuejed",,,180531,JMLS,"zzzJKR zzJKL zzzzzzJMLS zWat Tambor, zzzzGAS",1
"Biuejed",1,0,145966,CLS,"zzzCLS zHan zzChewbacca zzC-3PO zChewpio",1
"Biuejed",0,1,110109,DRMalak,"zzzDR zHK-47 zBSF zzMalak Sith Empire Trooper",1
"Biuejed",,,469428,Negotiator,"Negotiator HT Anakin's Eta-2, Umbaran SF, Ahsoka's SF, Clone Sergeant's ARC-170, Plo's SF, Rex's ARC-170",1
"Biuejed",,,379571,HansMF,"Home One, Han's MF, Rebel Y-wing, Ghost Phantom Biggs X-wing, Cassian's U-wing, Wedge X-wing",1
"Biuejed",0,1,115485,Grievous,"zzGG zB2 zDroideka MagnaGuard Dooku",1
"Biuejed",1,1,117949,JTR,"zzzJTR Scav Rey, zzBB-8 G9, zzR2-D2 Finn",1
"Biuejed",1,1,82404,Ewoks,"zChirpa Elder Paploo Wicket Logray",1
"Biuejed",1,0,138845,ShaakClones,"zzShaak Ti, zRex zEcho (501st), zzFives zARC Trooper",1
"Biuejed",0,1,99254,BH,"zBossk zBoba Jango Cad Dengar G9",1
"Biuejed",1,1,88157,Carth,"Carth Onasi, zMission Zaalbar Juhani Canderous",1
"Biuejed",1,1,110800,zEP,"zzEP zzzVader Tarkin TFP G8, zzTraya",1
"Biuejed",0,1,70792,Phoenix,"Hera G9, Ezra Kanan G8, Chopper Zeb G8",1
"Biuejed",1,0,121773,QGJ,"zQGJ Aayla zJKA zGK zAhsoka",1
"Biuejed",1,0,17400,SionSolo (Counter),"Sion",1
"Biuejed",0,1,92691,Geonosians Omicron,"zzGBA Sun Fac, Geo Soldier, Geo Spy, Poggle",0
"Biuejed",1,1,52039,NS,"MT 5* G8, AV Daka G8, Zombie G2, Spirit G8",0
"Biuejed",,,101941,Mon Mothma,"zzMon Mothma, Biggs Wedge Lando Chirrut G8",0
"Biuejed",,,51212,Iden Troopers,"Iden Versio G1, Stormtrooper G8, Snowtrooper G8, Magma G4, DT",0
"Biuejed",0,1,131712,BS,"BS zzGMY zJolee zzOld Ben, zzHYoda",0
"Biuejed",1,0,9906,NestSolo (Counter),"Nest 4* G9",0
"Darthspartan",,,178009,JMK,"zzzzzzJMK zJKA zzGMY zzShaak Ti, zGK",1
"Darthspartan",,,166972,SEE,"zzzzzzSEE zBSF zzMalak zzzDR zzzVader",1
"Darthspartan",,,311804,HansMF,"Home One, Han's MF, Rebel Y-wing 6*, Bistan's U-wing, Phantom Ghost Cassian's U-wing, Wedge X-wing",1
"Darthspartan",,,524572,Negotiator,"Negotiator HT Anakin's Eta-2, Umbaran SF, Ahsoka's SF, Clone Sergeant's ARC-170, Plo's SF, Rex's ARC-170",1
"Darthspartan",0,1,123788,Grievous,"zzGG zB2 zB1 zMagnaGuard zNute",1
"Darthspartan",1,1,148207,GAS,"zzzzGAS zRex zEcho (501st), zzFives zARC Trooper",1
"Darthspartan",1,0,119047,CLS,"zzzCLS zHan zzChewbacca zThrawn zzC-3PO",1
"Darthspartan",1,1,84643,Ewoks,"zChirpa Elder Paploo Scout zLogray",1
"Darthspartan",1,1,88142,Carth,"zCarth Onasi, zMission zZaalbar Juhani Canderous",1
"Darthspartan",0,1,59984,Phoenix,"Hera G8, Ezra G8, Kanan G8, Chopper Zeb G8",1
"Darthspartan",1,0,132478,zMaul,"zDarth Maul, zDooku zSidious zSavage Sith Marauder",1
"Darthspartan",1,0,106331,EP (Counter, Rebel),"zzEP Krennic DT zzWampa G9, Starck",1
"Darthspartan",,,66414,Phasma,"Phasma G7, zFOTP G8, FOSFTP FOST 3* G9, zKylo",0
"Darthspartan",,,248774,Malevolence,"Malevolence Hyena Bomber 4*, Vulture Droid 3*, Sun Fac SF, Soldier SF, Spy SF",0
"Darthspartan",0,1,82324,Geonosians Omicron,"zzGBA Sun Fac G9, Geo Soldier, Geo Spy, Poggle",0
"Darthspartan",1,1,66489,NS,"MT G8, zzAV Daka Zombie G7, Spirit G8",0
"Darthspartan",1,0,84878,Troopers,"zVeers zzPiett Gideon 4* G6, zDark Trooper 5* G9, Range Trooper 3* G8",0
"Darthspartan",1,0,57927,Traya,"zzTraya DN 5* G8, Sion 6* G9, Sith Empire Trooper 5* G8, zNest 5* G7",0
"Darthspartan",,,67469,Mon Mothma,"zzMon Mothma 5* G8, Biggs Wedge Lando Cara Dune G8",0
"Darthspartan",0,1,122799,BH,"zzBossk 6* Boba zJango Cad Dengar",0
"Shazam",,,123249,Phasma,"zPhasma zFOTP FOSFTP zFOST zKylo",1
"Shazam",1,1,148322,SL Kylo,"zzzzzzSL Kylo, zSith Trooper, zHux zzKRU Thrawn G8",1
"Shazam",,,557754,Executor,"Executor HT RC Xanadu Blood, Slave I, IG-2000 Imperial TIE Fighter, Tie Adv",1
"Shazam",0,1,123731,DRMalak,"zzzDR zzHK-47 zBSF zzMalak Sith Empire Trooper",1
"Shazam",0,1,130419,padme,"zzPadme zGK zJKA zAhsoka zC-3PO",1
"Shazam",,,126765,Grievous Omicron,"zzGG zB2 zB1 MagnaGuard zDroideka",1
"Shazam",,,431061,Negotiator,"Negotiator BTL-B Y-wing, Anakin's Eta-2, Rex's ARC-170, Umbaran SF, Ahsoka's SF, Plo's SF, Clone Sergeant's ARC-170",1
"Shazam",,,310439,Malevolence,"Malevolence Hyena Bomber, Vulture Droid, Sun Fac SF, Soldier SF, Spy SF",1
"Shazam",1,0,126965,Troopers,"zVeers zzPiett zzGideon zDark Trooper, Range Trooper",1
"Shazam",1,1,154626,GAS,"zzzzGAS zRex zEcho (501st), zzFives zARC Trooper",1
"Shazam",1,1,102952,Revan Offense,"zzzJKR zGMY BS zJolee HYoda G8",1
"Shazam",1,1,78416,Ewoks,"zChirpa G9, Elder Paploo Wicket G9, zLogray",1
"Shazam",0,1,138525,BH,"zzBossk zZam IG-88 zBoba Dengar",1
"Shazam",1,1,89587,Carth,"zCarth Onasi, zMission zZaalbar Juhani G9, Canderous",1
"Shazam",1,1,129943,zEP,"zzEP zzzVader Tarkin DT TFP",1
"Shazam",0,1,74811,Phoenix,"Hera G8, zEzra zKanan G9, Chopper G9, Zeb G8",1
"Shazam",1,0,18517,NestSolo (Counter),"zNest",1
"Shazam",1,0,86529,CLS,"zCLS G8, zHan zChewbacca G9, zzR2-D2 Chewpio G6",0
"Shazam",0,1,102326,Geonosians Omicron,"zzGBA Sun Fac, Geo Soldier, Geo Spy, Poggle",0
"Shazam",,,305373,HansMF,"Home One, Han's MF, Rebel Y-wing, Bistan's U-wing, Phantom Ghost Cassian's U-wing, Wedge X-wing",0
"Shazam",1,1,74121,NS,"MT G8, AV Daka G9, Zombie Spirit G8",0
"Shazam",,,76088,Mon Mothma,"zzMon Mothma G8, Jyn G8, zCara Dune, Chirrut G8, Baze G8",0
"Shazam",0,1,95045,BH,"Jango G9, zzGreef G8, zEmbo zzThe Mandalorian G8, Cad",0
"Shazam",,,108128,Bad Batch,"zHunter zEcho zOmega G9, zTech zWrecker",0
"Shazam",1,0,12622,SionSolo (Counter),"Sion G7",0
"IlMamadore",0,1,131797,padme,"zzPadme GK JKA zAhsoka zC-3PO",1
"IlMamadore",,,122734,Grievous Omicron,"zzGG zB2 zB1 MagnaGuard zDroideka",1
"IlMamadore",,,328425,HansMF,"Home One, Han's MF 5*, Rebel Y-wing 6*, Bistan's U-wing, Phantom Ghost Cassian's U-wing, Wedge X-wing",1
"IlMamadore",,,439072,Negotiator,"Negotiator HT Anakin's Eta-2, Umbaran SF, Ahsoka's SF, Clone Sergeant's ARC-170, Plo's SF, Rex's ARC-170",1
