Player,Ally Code,Starting Gear Needed,Progress,Current Gear Needed,Team
Ben,462878161,42,4,38,EP: EP G12 Mara Jade, The Emperor's Hand G11 4* Vader G12 Thrawn G9 Shoretrooper G8 5*
JediMasterKenobi,151953838,0,0,0,JMK: JMK CAT GK GAS Ahsoka
JediMasterKenobi,151953838,0,0,0,JMLS: JMLS JKL JKR GMY HYoda
JediMasterKenobi,151953838,0,0,0,EP: EP Mara Jade, The Emperor's Hand Vader Thrawn Malak
JediMasterKenobi,151953838,0,0,0,CLS: CLS C-3PO Han Chewbacca Chewpio
JediMasterKenobi,151953838,16,1,15,Troopers: Veers R3 Piett Dark Trooper R4 Range Trooper G8 6* Gideon R3
Kwagmyer,873997293,41,8,33,EP: EP G12 Mara Jade, The Emperor's Hand G12 Vader G12 Thrawn G12 RG G9 5*
Skippykgt,269875868,18,8,10,CLS: CLS R3 C-3PO Han Chewbacca R3 Chewpio G12
Skippykgt,269875868,33,0,33,EP: EP G11 Mara Jade, The Emperor's Hand G9 5* Vader Thrawn G11 RG G8
Berosin,281831893,50,2,48,EP: EP G9 Mara Jade, The Emperor's Hand G8 5* Vader G11 6* Thrawn G8 6* RG G6
