Player,Offense,Defense,GP,Name,Squad,Viable
"Papadapalous",,,412018,HansMF,"Home One, Han's MF, Biggs X-wing, Bistan's U-wing, Phantom Ghost Cassian's U-wing, Wedge X-wing",1
"Papadapalous",0,1,105797,Geonosians,"zzGBA Sun Fac, Geo Soldier, Geo Spy, Poggle",1
"Papadapalous",0,1,133152,Grievous,"zzGG zB2 zB1 MagnaGuard zNute",1
"Papadapalous",1,0,124784,Traya,"zzTraya zDN zSion Sith Empire Trooper, zThrawn",1
"Papadapalous",1,1,149507,Revan Offense,"zzzJKR zzGMY zzHYoda zJolee zJKA",1
"Papadapalous",1,1,88324,Ewoks,"zChirpa Elder Paploo Wicket zLogray",1
"Papadapalous",1,0,147002,ShaakClones,"zzShaak Ti, zRex zEcho (501st), zzFives zARC Trooper",1
"Papadapalous",1,1,98317,Carth,"zCarth Onasi, zMission zZaalbar Juhani Canderous",1
"Papadapalous",0,1,146473,BH,"zzBossk Fennec Shand, zDengar zZam zJango",1
"Papadapalous",1,0,127736,Troopers,"zVeers zStarck zDark Trooper, zzGideon Range Trooper",1
"Papadapalous",0,1,98656,FO,"zzKRU zKylo FOE zHux FOO",1
"Papadapalous",,,97312,Iden Troopers,"zIden Versio, zStormtrooper Snowtrooper Magma DT",1
"Papadapalous",0,1,87529,Phoenix,"Hera zSabine zEzra Zeb G8, Kanan",1
"Papadapalous",,,131821,Bad Batch,"zHunter zEcho zzOmega zTech zWrecker",1
"Papadapalous",1,0,129578,EP (Counter, Rebel),"zzEP Shoretrooper Krennic zzWampa zNest",1
"Papadapalous",1,0,77457,Jawas,"Nebit G8, Jawa Engineer G8, Jawa Scavenger G8, Jawa Dathcha G9",1
"Papadapalous",,,96341,Admiral Raddus,"zzAdmiral Raddus, zCassian Jyn Baze G8, Bistan G9",0
"Papadapalous",,,80828,Mon Mothma,"Mon Mothma G9, Wedge K-2SO G8, Lando Kyle Katarn G9",0
"Andhur P'hul",,,170753,JMK,"zzzzzzJMK zAhsoka zzzCAT zzzzGAS zGK",1
"Andhur P'hul",1,1,161001,GL Rey,"zzzzzzRey zzzJTR zzBB-8 zRH Poe, zRH Finn",1
"Andhur P'hul",1,1,105629,NS,"zzMT zzAV zDaka Zombie Spirit",1
"Andhur P'hul",,,578173,Executor,"Executor HT RC Xanadu Blood, Slave I, IG-2000 Imperial TIE Fighter, Tie Adv",1
"Andhur P'hul",1,0,145512,CLS,"zzzCLS zHan zzChewbacca zzC-3PO zChewpio",1
"Andhur P'hul",0,1,131891,DRMalak,"zzzDR zzHK-47 zBSF zzMalak Sith Empire Trooper",1
"Andhur P'hul",,,508599,Negotiator,"Negotiator BTL-B Y-wing, Anakin's Eta-2, Rex's ARC-170, Umbaran SF, Ahsoka's SF, Plo's SF, Clone Sergeant's ARC-170",1
"Andhur P'hul",,,318001,Malevolence,"Malevolence Hyena Bomber, Vulture Droid, Sun Fac SF, Soldier SF, Spy SF",1
"Andhur P'hul",,,142373,JKL,"zzJKL zzzJKR zzHYoda zzOld Ben, Aayla",1
"Andhur P'hul",0,1,101489,Geonosians,"zzGBA Sun Fac, Geo Soldier, Geo Spy, Poggle",1
"Andhur P'hul",0,1,131799,Grievous,"zzGG zB2 zB1 zMagnaGuard zNute",1
"Andhur P'hul",,,104378,Mon Mothma,"zzMon Mothma, Cara Dune, Wedge Biggs Chirrut",1
"Andhur P'hul",1,0,151178,ShaakClones,"zzShaak Ti, zRex zEcho (501st), zzFives zARC Trooper",1
"Andhur P'hul",1,1,85735,Ewoks,"zChirpa Elder Paploo Scout Logray",1
"Andhur P'hul",0,1,153069,BH,"zzBossk zBoba zDengar zZam zzJango",1
"Andhur P'hul",1,1,86791,Carth,"zCarth Onasi, Mission Zaalbar G9, zJuhani Canderous",1
"Andhur P'hul",1,1,133299,zEP,"zzEP zzzVader Tarkin TFP zzTraya",1
"Andhur P'hul",1,0,135192,Troopers,"zVeers zStarck zDark Trooper, zzPiett Range Trooper",1
"Andhur P'hul",0,1,78037,Phoenix,"Hera Sabine G8, Ezra Zeb G9, Kanan",1
"Andhur P'hul",0,1,86142,FO,"zKRU zKylo FOTP FOO FOST G9",1
"Andhur P'hul",,,131779,Bad Batch,"zHunter zEcho zzOmega zTech zWrecker",1
"Andhur P'hul",1,0,94810,Jawas,"Nebit Jawa Engineer, Jawa Scavenger, Jawa Dathcha",1
"Andhur P'hul",1,0,20632,SionSolo (Counter),"zSion",1
"Andhur P'hul",1,0,18858,NestSolo (Counter),"zNest",1
"Andhur P'hul",,,386164,HansMF,"Home One, Han's MF, Rebel Y-wing, Bistan's U-wing, Phantom Biggs X-wing, Cassian's U-wing, Wedge X-wing",0
"Andhur P'hul",,,51173,Iden Troopers,"Iden Versio, Stormtrooper G9, Snowtrooper G7, Magma G3, DT G4",0
"SWfan114",,,171101,JMK,"zzzzzzJMK zJKA zzGMY zzShaak Ti, zGK",1
"SWfan114",,,156855,SEE,"zzzzzzSEE zBSF zzMalak zzzDR zzzVader",1
"SWfan114",1,1,95395,NS,"zMT zAV Daka Zombie Spirit",1
"SWfan114",,,560868,Executor,"Executor 5* HT RC Xanadu Blood, Slave I, IG-2000 Imperial TIE Fighter, Tie Adv",1
"SWfan114",,,173363,JMLS,"zzzJKR zzJKL zzzzzzJMLS zWat Tambor, zzzzGAS",1
"SWfan114",1,0,146371,CLS,"zzzCLS zHan zzChewbacca zzC-3PO zChewpio",1
"SWfan114",,,499980,Negotiator,"Negotiator BTL-B Y-wing 6*, Anakin's Eta-2, Rex's ARC-170, Umbaran SF, Ahsoka's SF, Plo's SF, Clone Sergeant's ARC-170",1
"SWfan114",,,424242,HansMF,"Home One, Han's MF, Rebel Y-wing, Bistan's U-wing, Phantom Biggs X-wing, Cassian's U-wing, Wedge X-wing",1
"SWfan114",0,1,99722,Geonosians,"zzGBA Sun Fac, Geo Soldier, Geo Spy, Poggle",1
"SWfan114",0,1,127317,Grievous,"zzGG zB2 zB1 zMagnaGuard zNute",1
"SWfan114",1,1,113369,JTR,"zzzJTR Scav Rey, BB-8 G9, zzR2-D2 Finn G9",1
"SWfan114",,,108623,Mon Mothma,"zzMon Mothma, Cara Dune, Wedge Biggs Lando",1
"SWfan114",1,1,89140,Ewoks,"zChirpa Elder Paploo zWicket Logray",1
"SWfan114",0,1,147890,BH,"zzBossk zIG-88 zBoba zDengar zJango",1
"SWfan114",1,1,91282,Carth,"zCarth Onasi, zMission Zaalbar Juhani Canderous",1
"SWfan114",1,0,130339,501st,"zRex zARC Trooper, zEcho (501st), zzFives zAhsoka",1
"SWfan114",1,0,134985,Troopers,"zVeers zStarck zGideon zzPiett Range Trooper",1
"SWfan114",0,1,82960,Phoenix,"Hera Sabine Ezra Zeb Kanan",1
"SWfan114",0,1,89911,FO,"zKRU zKylo FOO FOSFTP G9, zFOST",1
"SWfan114",,,130551,Bad Batch,"zHunter zEcho zzOmega zTech zWrecker",1
"SWfan114",1,0,113815,EP (Counter, Rebel),"zzEP Shoretrooper G9, Krennic DT zzWampa",1
"SWfan114",1,0,62351,QiraNest,"Qira Nest zzHYoda",1
"SWfan114",1,0,22741,SionSolo (Counter),"zSion",1
"SWfan114",1,1,62459,Rogue1,"Jyn G7, Chirrut G8, Baze 5* G2, K-2SO G8, Cassian G8",0
"SWfan114",1,0,128235,zMaul,"Darth Maul, zDooku zDN zSidious Sith Marauder",0
"DarkCoitus",,,173421,JMK,"zzzzzzJMK zAhsoka zzzCAT zzzzGAS zGK",1
"DarkCoitus",,,120436,Phasma,"zPhasma FOTP FOSFTP zFOST zKylo",1
"DarkCoitus",1,1,157516,SL Kylo,"zzzzzzSL Kylo, zSith Trooper, zHux zzKRU zzThrawn",1
"DarkCoitus",,,169173,SEE,"zzzzzzSEE zBSF zzMalak zzzDR zzzVader",1
"DarkCoitus",,,153563,Jabba,"zzzzzzJabba Boushh (Leia Organa), Skiff Guard (Lando Calrissian), Krrsantan zBoba",1
"DarkCoitus",,,148970,SK,"zzEP zzMara Jade, The Emperor's Hand, zzStarkiller zzOld Ben, zVisas",1
"DarkCoitus",,,593983,Executor,"Executor HT RC Xanadu Blood, Slave I, IG-2000 Imperial TIE Fighter, Tie Adv",1
"DarkCoitus",1,0,153159,CLS,"zzzCLS zHan zzChewbacca zzC-3PO zChewpio",1
"DarkCoitus",1,1,117819,NestSisters,"zzAV zzMT zDaka Zombie zNest",1
"DarkCoitus",,,515377,Negotiator,"Negotiator BTL-B Y-wing, Anakin's Eta-2, Rex's ARC-170, Umbaran SF, Ahsoka's SF, Plo's SF, Clone Sergeant's ARC-170",1
"DarkCoitus",,,332614,Malevolence,"Malevolence Hyena Bomber, Vulture Droid, Sun Fac SF, Soldier SF, Spy SF",1
"DarkCoitus",,,422417,HansMF,"Home One, Han's MF, Rebel Y-wing, Bistan's U-wing, Phantom Biggs X-wing, Cassian's U-wing, Wedge X-wing",1
"DarkCoitus",0,1,108716,Geonosians,"zzGBA Sun Fac, Geo Soldier, Geo Spy, Poggle",1
"DarkCoitus",0,1,130399,Grievous,"zzGG zB2 zB1 zMagnaGuard zNute",1
"DarkCoitus",1,1,131106,JTR,"zzzJTR Scav Rey, zzBB-8 zzR2-D2 Finn",1
"DarkCoitus",1,0,135149,Troopers,"zVeers zzPiett zGideon zDark Trooper, Range Trooper",1
"DarkCoitus",,,102197,Mon Mothma,"zzMon Mothma, Wedge Biggs Pao Chirrut",1
"DarkCoitus",1,1,151744,Revan Offense,"zzzJKR zzGMY zzHYoda zJolee zJKA",1
"DarkCoitus",1,1,85418,Ewoks,"zChirpa Elder Paploo Wicket Logray",1
"DarkCoitus",1,0,152233,ShaakClones,"zzShaak Ti, zRex zEcho (501st), zzFives zARC Trooper",1
"DarkCoitus",1,1,95804,Carth,"Carth Onasi, zMission zZaalbar zJuhani zCanderous",1
"DarkCoitus",0,1,148639,BH,"zzBossk zFennec Shand, zDengar zGreedo zzJango",1
"DarkCoitus",0,1,79976,Phoenix,"Hera Sabine G8, zEzra Zeb G8, Kanan",1
"DarkCoitus",1,0,24351,SionSolo (Counter),"zSion",1
"DarkCoitus",,,142315,JMLS,"zBS zzzzzzJMLS zWat Tambor, zzJKL zBarriss G8",0
"DarkCoitus",1,0,124594,zMaul,"Darth Maul, zDooku zSidious zSavage Sith Marauder",0
"DarkCoitus",,,75047,Bad Batch,"zHunter G9, zEcho 5* Omega G6, zTech 6* G9, zWrecker G8",0
"DarkCoitus",1,0,71825,Jawas,"Nebit G7, Jawa Engineer G8, Jawa Scavenger G9, Jawa Dathcha G8",0
"Valldi",,,113393,Phasma,"zPhasma FOE FOO zzKRU zKylo",1
"Valldi",1,1,160879,GL Rey,"zzzzzzRey zzzJTR zzR2-D2 zHoldo zRH Finn",1
"Valldi",1,0,145443,CLS,"zzzCLS zHan zzChewbacca zzC-3PO zChewpio",1
"Valldi",0,1,137694,DRMalak,"zzzDR zzHK-47 zBSF zzMalak Sith Empire Trooper",1
"Valldi",0,1,123178,padme,"zzPadme zGK zJKA zAhsoka CW Chewbacca G9",1
"Valldi",1,1,106144,NS_Alt,"zzMT zzAV Talia zDaka Zombie",1
"Valldi",,,449700,Negotiator,"Negotiator HT Anakin's Eta-2, Umbaran SF, Ahsoka's SF, BTL-B Y-wing, Jedi Consular's Starfighter, Plo's SF",1
"Valldi",,,410238,HansMF,"Home One, Han's MF, Rebel Y-wing, Ghost Phantom Biggs X-wing, Cassian's U-wing, Wedge X-wing",1
"Valldi",0,1,93406,Geonosians,"zzGBA Sun Fac, Geo Soldier, Geo Spy, Poggle",1
"Valldi",0,1,131564,Grievous,"zzGG zB2 zB1 zDroideka zMagnaGuard",1
"Valldi",1,0,103285,Traya,"zzTraya zDN G9, zSion zzEP zThrawn",1
"Valldi",,,105936,Mon Mothma,"zzMon Mothma, Wedge Biggs Chirrut Baze",1
"Valldi",1,1,143263,GAS,"zzzzGAS zRex zEcho (501st), zzFives zARC Trooper",1
"Valldi",1,1,128847,Revan Offense,"zzzJKR zGMY BS zJolee zzHYoda",1
"Valldi",1,1,94307,Ewoks,"zChirpa Elder zPaploo Teebo zWicket",1
"Valldi",1,1,99821,Carth,"zCarth Onasi, zMission zZaalbar zJuhani zCanderous",1
"Valldi",0,1,102447,BH,"zzBossk zBoba Cad Dengar zGreedo",1
"Valldi",0,1,78849,Phoenix,"Hera Sabine Ezra Zeb Kanan",1
"Valldi",1,0,59410,Troopers,"Veers 6* G7, Starck G5, Snowtrooper G7, DT G9, Shoretrooper 6* G7",0
"The Dude",,,169583,JMK,"zzzzzzJMK zJKA zzGMY zzShaak Ti, zGK",1
"The Dude",,,96931,Phasma,"zPhasma G9, FOE FOO zzKRU zKylo",1
"The Dude",,,156029,SEE,"zzzzzzSEE zBSF zzMalak zzzDR zDooku",1
"The Dude",1,1,162007,GL Rey,"zzzzzzRey zzzJTR zzBB-8 zHoldo zRH Finn",1
"The Dude",,,176878,JMLS,"zzzJKR zzJKL zzzzzzJMLS zWat Tambor, zzzzGAS",1
"The Dude",1,0,146367,CLS,"zzzCLS zHan zzChewbacca zzC-3PO zChewpio",1
"The Dude",,,503039,Negotiator,"Negotiator HT Anakin's Eta-2, Umbaran SF, Ahsoka's SF, BTL-B Y-wing 6*, Clone Sergeant's ARC-170, Plo's SF",1
"The Dude",1,1,111698,NS_Alt,"zzMT zzAV Talia zDaka Zombie",1
"The Dude",,,422375,HansMF,"Home One, Han's MF, Rebel Y-wing 6*, Bistan's U-wing, Phantom Biggs X-wing, Cassian's U-wing, Wedge X-wing",1
"The Dude",0,1,101650,Geonosians,"zzGBA Sun Fac, Geo Soldier, Geo Spy, Poggle",1
"The Dude",0,1,140068,Grievous,"zzGG zB2 zB1 zMagnaGuard zNute",1
"The Dude",1,0,123364,Traya,"zzTraya zzDN zSion Sith Empire Trooper, zzThrawn",1
"The Dude",1,0,129023,Troopers,"zVeers zzPiett zzGideon zDark Trooper, Range Trooper",1
"The Dude",,,120440,Disintegration,"Aurra zzGreef G9, zBoba zzBossk zzThe Mandalorian G8",1
"The Dude",,,114095,Mon Mothma,"zzMon Mothma, zCara Dune, Wedge Biggs Lando",1
"The Dude",1,1,98959,Ewoks,"zChirpa Elder zPaploo zWicket zLogray",1
"The Dude",1,1,88914,Carth,"Carth Onasi, Mission Zaalbar Juhani Canderous",1
"The Dude",1,1,140750,zEP,"zzEP zzzVader Tarkin Krennic TFP",1
"The Dude",1,0,141822,501st,"zRex zARC Trooper, zEcho (501st), zzFives zAhsoka",1
"The Dude",0,1,83221,Phoenix,"zHera G9, zSabine G8, Ezra Zeb G9, zKanan G9",1
"The Dude",,,127302,Bad Batch,"zHunter zEcho zzOmega zTech zWrecker",1
"The Dude",1,0,76400,Jawas,"Nebit G9, Jawa Engineer G9, Jawa Scavenger, Jawa Dathcha G8",1
"The Dude",,,68652,Admiral Raddus,"Admiral Raddus 3* G8, Cassian G8, Jyn G8, K-2SO G9, Chirrut G9",0
"The Dude",,,72667,Iden Troopers,"Iden Versio 4* G7, Shoretrooper Snowtrooper Magma G9, DT",0
"The Dude",0,1,139609,BH,"zJango Cad zDengar zZam zEmbo",0
"The Dude",,,70381,Mando,"The Mandalorian (Beskar Armor) G8, Dash Rendar 5* G8, Nest G7, IG-11 G8, zKuiil G9",0
"Will Shakespeare",,,173852,JMK,"zzzzzzJMK zAhsoka zzzCAT zzzzGAS zGK",1
"Will Shakespeare",,,142947,SK,"zzEP zzMara Jade, The Emperor's Hand, zzStarkiller zJuhani zVisas",1
"Will Shakespeare",,,451925,Profundity,"Profundity Han's MF, Outrider Rebel Y-wing, Cassian's U-wing, Ghost",1
"Will Shakespeare",,,165357,SEE,"zzzzzzSEE zBSF zzMalak zzzDR zDooku",1
"Will Shakespeare",,,158609,Jabba,"zzzzzzJabba zBoushh (Leia Organa), zSkiff Guard (Lando Calrissian), zKrrsantan zBoba",1
"Will Shakespeare",,,586403,Executor,"Executor HT RC Xanadu Blood, Slave I, IG-2000 Imperial TIE Fighter, Tie Adv",1
"Will Shakespeare",1,0,162659,CLS,"zzzCLS zHan zzChewbacca zzC-3PO zChewpio",1
"Will Shakespeare",1,1,106644,NestSisters,"zzAV zzMT zDaka Zombie zNest",1
"Will Shakespeare",,,508511,Negotiator,"Negotiator BTL-B Y-wing, Anakin's Eta-2, Rex's ARC-170, Umbaran SF, Ahsoka's SF, Plo's SF, Clone Sergeant's ARC-170",1
"Will Shakespeare",,,309220,Malevolence,"Malevolence Hyena Bomber, Vulture Droid, Sun Fac SF, Soldier SF, Spy SF",1
"Will Shakespeare",,,146688,JKL,"zzJKL zzzJKR zzHYoda zzOld Ben, Aayla",1
"Will Shakespeare",1,1,119613,JTR,"zzzJTR zzR2-D2 zzBB-8 RH Finn G8, RH Poe G9",1
"Will Shakespeare",0,1,94538,Geonosians,"zzGBA Sun Fac, Geo Soldier, Geo Spy, Poggle",1
"Will Shakespeare",0,1,129921,Grievous,"zzGG zB2 zB1 zMagnaGuard zNute",1
"Will Shakespeare",1,0,109745,Traya,"zzTraya zDN zSion Sith Empire Trooper, zzThrawn",1
"Will Shakespeare",1,0,121697,Troopers,"zVeers zzPiett zzGideon zDark Trooper, Range Trooper",1
"Will Shakespeare",,,108102,Mon Mothma,"zzMon Mothma, zCara Dune, Wedge Bistan Scarif",1
"Will Shakespeare",1,1,96781,Ewoks,"zChirpa Elder zPaploo zWicket zLogray",1
"Will Shakespeare",1,0,145224,ShaakClones,"zzShaak Ti, zRex zEcho (501st), zzFives zARC Trooper",1
"Will Shakespeare",0,1,148610,BH,"zzBossk zFennec Shand, zDengar zzJango zAurra",1
"Will Shakespeare",0,1,89841,FO,"zzKRU zKylo FOE FOO FOST G8",1
"Will Shakespeare",0,1,105403,Phoenix,"zHera zSabine zEzra zZeb zKanan",1
"Will Shakespeare",1,1,112627,Rogue1,"zzJyn Chirrut Baze G9, zK-2SO zCassian",1
"Will Shakespeare",,,130662,Bad Batch,"zHunter zEcho zzOmega zTech zWrecker",1
"Will Shakespeare",,,84396,Iden Troopers,"zIden Versio, Shoretrooper Snowtrooper Magma G7, DT",0
"Will Shakespeare",1,0,71335,Jawas,"Nebit G8, Jawa Engineer G7, Jawa Scavenger G8, Jawa Dathcha G8",0
"Jastarter",,,175272,JMLS,"zzzJKR zzJKL zzzzzzJMLS zWat Tambor, zzzzGAS",1
"Jastarter",1,0,149668,CLS,"zzzCLS zHan zzChewbacca zzC-3PO zChewpio",1
"Jastarter",0,1,135207,DRMalak,"zzzDR zzHK-47 zBSF zzMalak Sith Empire Trooper",1
"Jastarter",1,1,115661,NestSisters,"zzAV zzMT zDaka Zombie zNest",1
"Jastarter",0,1,125401,padme,"zzPadme zGK zJKA zAhsoka zBarriss",1
"Jastarter",,,474791,Negotiator,"Negotiator HT Anakin's Eta-2, Umbaran SF, Ahsoka's SF, BTL-B Y-wing, Clone Sergeant's ARC-170, Plo's SF",1
"Jastarter",,,430808,HansMF,"Home One, Han's MF, Rebel Y-wing, Bistan's U-wing, Phantom Biggs X-wing, Cassian's U-wing, Wedge X-wing",1
"Jastarter",1,1,146245,JTR,"zzzJTR zzR2-D2 zzBB-8 zRH Finn, zRH Poe",1
"Jastarter",0,1,95014,Geonosians,"zzGBA Sun Fac, Geo Soldier, Geo Spy, Poggle",1
"Jastarter",0,1,126899,Grievous,"zzGG zB2 zB1 zMagnaGuard zNute",1
"Jastarter",1,0,125242,Traya,"zzTraya zzDN zSion zzEP zzThrawn",1
"Jastarter",,,117492,Mon Mothma,"zzMon Mothma, Wedge zzJyn Biggs Lando",1
"Jastarter",1,1,88373,Ewoks,"zChirpa Elder Paploo zWicket Logray G9",1
"Jastarter",1,0,136817,ShaakClones,"zzShaak Ti, zRex zEcho (501st), zzFives zARC Trooper",1
"Jastarter",0,1,139686,BH,"zzBossk zIG-88 zBoba zDengar zzEmbo",1
"Jastarter",1,1,95889,Carth,"zCarth Onasi, zMission zZaalbar zJuhani Canderous",1
"Jastarter",0,1,96891,FO,"zzKRU zKylo FOE G8, zHux FOO G8",1
"Jastarter",0,1,86959,Phoenix,"zHera Chopper G9, zEzra zZeb G9, Kanan",1
"Jastarter",,,100814,Bad Batch,"zHunter zEcho zzOmega zTech zWrecker",1
"Jastarter",0,1,142623,BS,"zBS zzGMY zJolee zzOld Ben, zzHYoda",1
"Jastarter",1,0,78827,Jawas,"Nebit Jawa Engineer, Jawa Scavenger, Jawa Dathcha G8",1
"Jastarter",1,0,85768,Troopers,"zVeers zzPiett Gideon G8, Dark Trooper 5* G3, Range Trooper 6* G2",0
"Jastarter",,,423103,Executrix,"Executrix Tie Adv, Emperor's Shuttle 6*, TIE Reaper 4*, Imperial TIE Fighter, Gauntlet Starfighter, FOSF TIE Fighter, FO TIE Fighter",0
"Jastarter",,,68041,Iden Troopers,"zIden Versio 5* G8, Stormtrooper Snowtrooper G8, Magma G9, DT G7",0
"Jastarter",0,1,98710,BH,"zJango zzThe Mandalorian, Cad Greef G8, zGreedo",0
"Jastarter",1,0,88452,zMaul,"Darth Maul, zDooku zSidious Savage Sith Marauder",0
"Marka Ragnos",1,1,132456,NS,"zzMT zzAV zDaka Zombie Spirit",1
"Marka Ragnos",0,1,155226,DRMalak,"zzzDR zzHK-47 zBSF zzMalak Sith Empire Trooper",1
"Marka Ragnos",1,0,141251,CLS,"zzzCLS zHan zzChewbacca zzC-3PO zChewpio",1
"Marka Ragnos",0,1,133111,padme,"zzPadme zGK zJKA zAhsoka zBarriss",1
"Marka Ragnos",,,491555,Negotiator,"Negotiator HT Anakin's Eta-2, Umbaran SF, Ahsoka's SF, BTL-B Y-wing, Clone Sergeant's ARC-170, Plo's SF",1
"Marka Ragnos",,,452151,HansMF,"Home One, Han's MF, Rebel Y-wing, Bistan's U-wing, Phantom Ghost Cassian's U-wing, Wedge X-wing",1
"Marka Ragnos",1,1,125965,JTR,"zzzJTR zzR2-D2 zzBB-8 zRH Finn G8, zRH Poe G9",1
"Marka Ragnos",0,1,123856,Geonosians,"zzGBA Sun Fac, Geo Soldier, Geo Spy, Poggle",1
"Marka Ragnos",0,1,139570,Grievous,"zzGG zB2 zB1 zMagnaGuard zNute",1
"Marka Ragnos",1,0,147759,Traya,"zzTraya zzDN zSion zDooku zzThrawn",1
"Marka Ragnos",,,133799,Disintegration,"zzAurra G9, zzGreef zBoba zzBossk zzThe Mandalorian",1
"Marka Ragnos",,,106493,Mon Mothma,"zzMon Mothma, zCara Dune, Wedge Biggs Lando",1
"Marka Ragnos",1,1,156091,GAS,"zzzzGAS zRex zEcho (501st), zzFives zARC Trooper",1
"Marka Ragnos",1,1,150880,Revan Offense,"zzzJKR zzGMY zBS zJolee zzHYoda",1
"Marka Ragnos",1,1,97219,Ewoks,"zChirpa Elder zPaploo zWicket zLogray",1
"Marka Ragnos",1,1,103576,Carth,"zCarth Onasi, zMission zZaalbar zJuhani zCanderous",1
"Marka Ragnos",1,1,138575,zEP,"zzEP zzzVader zzTarkin zKrennic TFP G8",1
"Marka Ragnos",0,1,132323,BH,"zzJango Cad zDengar zZam zzEmbo",1
"Marka Ragnos",1,0,110813,Troopers,"zVeers zStarck zDT zzPiett zStormtrooper",1
"Marka Ragnos",0,1,112966,FO,"zzKRU zKylo FOE zHux FOO",1
"Marka Ragnos",0,1,96980,Phoenix,"zHera zSabine zEzra zZeb zKanan",1
"Marka Ragnos",1,1,86695,Rogue1,"zzJyn Chirrut G8, Baze G8, zK-2SO zCassian G8",1
"Marka Ragnos",,,129807,Bad Batch,"zHunter zEcho zzOmega zTech zWrecker",1
"Marka Ragnos",1,0,121560,zMaul,"zDarth Maul, zSidious Sith Assassin, zSavage Sith Marauder",1
"Marka Ragnos",1,0,18162,NestSolo (Counter),"zNest",1
"Marka Ragnos",,,320750,Malevolence,"Malevolence Hyena Bomber 5*, Vulture Droid 4*, Sun Fac SF, Soldier SF, Spy SF",0
"Marka Ragnos",,,456674,Executrix,"Executrix Tie Adv, Emperor's Shuttle, TIE Reaper 6*, Imperial TIE Fighter, Gauntlet Starfighter, FOSF TIE Fighter, FO TIE Fighter",0
"Marka Ragnos",1,0,68516,Jawas,"Nebit G8, Jawa Engineer G7, Jawa Scavenger G7, Jawa G9, Dathcha G8",0
"TheMonikon",,,125366,Phasma,"zPhasma zFOTP FOSFTP zFOST zKylo",1
"TheMonikon",1,1,161890,SL Kylo,"zzzzzzSL Kylo, zSith Trooper, zHux zzKRU zzThrawn",1
"TheMonikon",1,1,163355,GL Rey,"zzzzzzRey zzzJTR zzBB-8 zRH Poe, zRH Finn",1
"TheMonikon",1,0,131484,CLS,"zzzCLS zHan zzChewbacca zzC-3PO zChewpio",1
"TheMonikon",0,1,135671,DRMalak,"zzzDR zzHK-47 zBSF zzMalak Sith Empire Trooper",1
"TheMonikon",0,1,128919,padme,"zzPadme zGK zJKA zAhsoka zBarriss",1
"TheMonikon",1,1,114588,NestSisters,"zzAV zzMT zDaka Zombie zNest",1
"TheMonikon",,,432078,HansMF,"Home One, Han's MF, Rebel Y-wing, Bistan's U-wing, Phantom Ghost Cassian's U-wing, Wedge X-wing",1
"TheMonikon",,,475851,Negotiator,"Negotiator HT Anakin's Eta-2, Umbaran SF, Ahsoka's SF, Clone Sergeant's ARC-170, Plo's SF, Rex's ARC-170",1
"TheMonikon",0,1,109178,Geonosians,"zzGBA Sun Fac, Geo Soldier, Geo Spy, Poggle",1
"TheMonikon",0,1,114866,Grievous,"zzGG zB2 zB1 zMagnaGuard zNute",1
"TheMonikon",1,0,131511,Traya,"zzTraya zzDN zSion zDooku zzEP",1
"TheMonikon",1,1,122336,GAS,"zzzzGAS zRex zEcho (501st), zzFives zARC Trooper",1
"TheMonikon",1,1,138385,Revan Offense,"zzzJKR zzGMY zBS zJolee zzHYoda",1
"TheMonikon",1,1,97223,Ewoks,"zChirpa Elder zPaploo zWicket zLogray",1
"TheMonikon",0,1,119601,BH,"zzBossk zzThe Mandalorian, zBoba zDengar zzJango",1
"TheMonikon",1,1,90664,Carth,"zCarth Onasi, Mission G8, zZaalbar zJuhani zCanderous",1
"TheMonikon",0,1,106055,Phoenix,"zHera zSabine zEzra zZeb zKanan",1
"TheMonikon",,,110121,Bad Batch,"zHunter zEcho zzOmega zTech zWrecker",1
"TheMonikon",1,0,92519,zMaul,"zDarth Maul, zSidious Sith Assassin, zSavage Sith Marauder",1
"TheMonikon",1,0,85096,Jawas,"Nebit Jawa Engineer, Jawa Scavenger, Jawa Dathcha",1
"TheMonikon",,,69454,Admiral Raddus,"Admiral Raddus 4* G7, Cassian G8, Jyn G8, K-2SO Chirrut G8",0
"TheMonikon",1,0,84256,Troopers,"zVeers zzPiett Gideon 6* G9, zDark Trooper, Range Trooper G7",0
"TheMonikon",,,450587,Executrix,"Executrix Tie Adv, Emperor's Shuttle, TIE Reaper 4*, Imperial TIE Fighter, Gauntlet Starfighter, FOSF TIE Fighter, FO TIE Fighter",0
"TheMonikon",,,92390,Mon Mothma,"zzMon Mothma G9, zCara Dune, Wedge Biggs Lando",0
"TheMonikon",,,73092,Iden Troopers,"zIden Versio 6* G8, Stormtrooper G8, Snowtrooper G8, Magma zDT G8",0
"Thux Kra",,,566451,Executor,"Executor HT RC Xanadu Blood, Slave I, IG-2000 Imperial TIE Fighter, Tie Adv",1
"Thux Kra",,,170016,JMLS,"zzzJKR zzJKL zzzzzzJMLS zWat Tambor, zzzzGAS",1
"Thux Kra",1,0,146927,CLS,"zzzCLS zHan zzChewbacca zzC-3PO zChewpio",1
"Thux Kra",0,1,138345,DRMalak,"zzzDR zzHK-47 zBSF zzMalak Sith Empire Trooper",1
"Thux Kra",0,1,129263,padme,"zzPadme zGK zJKA zAhsoka CW Chewbacca",1
"Thux Kra",,,483057,Negotiator,"Negotiator BTL-B Y-wing 6*, Anakin's Eta-2, Rex's ARC-170, Umbaran SF, Ahsoka's SF, Plo's SF, Clone Sergeant's ARC-170",1
"Thux Kra",,,432694,HansMF,"Home One, Han's MF, Rebel Y-wing 6*, Ghost Phantom Biggs X-wing, Cassian's U-wing, Wedge X-wing",1
"Thux Kra",0,1,96375,Geonosians,"zzGBA Sun Fac, Geo Soldier, Geo Spy, Poggle",1
"Thux Kra",1,1,117248,JTR,"zzzJTR zScav Rey, BB-8 G9, zzR2-D2 zFinn",1
"Thux Kra",1,1,96571,Ewoks,"zChirpa Elder zPaploo zWicket zLogray",1
"Thux Kra",1,0,150480,ShaakClones,"zzShaak Ti, zRex zEcho (501st), zzFives zARC Trooper",1
"Thux Kra",0,1,140133,BH,"zzBossk zzThe Mandalorian, zIG-88 zBoba zDengar",1
"Thux Kra",1,1,99756,Carth,"zCarth Onasi, zMission zZaalbar zJuhani zCanderous",1
"Thux Kra",1,1,129560,zEP,"zzEP zzzVader Tarkin TFP zzTraya",1
"Thux Kra",1,0,110993,Troopers,"zVeers zStarck Snowtrooper zzPiett zStormtrooper",1
"Thux Kra",0,1,96850,Phoenix,"zHera zSabine zEzra Zeb zKanan",1
"Thux Kra",,,109917,Bad Batch,"zHunter zEcho zzOmega zTech zWrecker",1
"Thux Kra",0,1,142397,BS,"zBS zzGMY zJolee zzOld Ben, zzHYoda",1
"Thux Kra",,,60960,Phasma,"Phasma G6, FOTP FOSFTP G7, FOST 2* G4, zKylo G9",0
"Thux Kra",0,1,108064,Grievous,"GG G5, zB2 zB1 zMagnaGuard zNute",0
"Thux Kra",,,108122,Mon Mothma,"zzMon Mothma, Cara Dune G9, Wedge Biggs Lando",0
"Thux Kra",0,1,93398,BH,"zJango G7, Cad zzEmbo 6* Greef zGreedo",0
"Thux Kra",1,0,10281,SionSolo (Counter),"Sion 6*",0
"Alex Avery",1,1,163889,GL Rey,"zzzzzzRey zzzJTR zzBB-8 zHoldo zRH Finn",1
"Alex Avery",1,1,99463,NS,"zzMT zzAV zDaka Zombie Spirit",1
"Alex Avery",,,164229,JMLS,"zzzJKR zzJKL zzzzzzJMLS zWat Tambor, zzzzGAS",1
"Alex Avery",1,0,145047,CLS,"zzCLS zHan zzChewbacca zzC-3PO zChewpio",1
"Alex Avery",0,1,144241,DRMalak,"zzzDR zzHK-47 zBSF zzMalak Sith Empire Trooper",1
"Alex Avery",,,446284,Negotiator,"Negotiator HT Anakin's Eta-2, Umbaran SF, Ahsoka's SF, BTL-B Y-wing, Clone Sergeant's ARC-170, Plo's SF",1
"Alex Avery",,,318155,Malevolence,"Malevolence Hyena Bomber, Vulture Droid, Sun Fac SF, Soldier SF, Spy SF",1
"Alex Avery",,,456578,HansMF,"Home One, Han's MF, Rebel Y-wing, Bistan's U-wing, Phantom Biggs X-wing, Cassian's U-wing, Wedge X-wing",1
"Alex Avery",0,1,104900,Geonosians,"zzGBA Sun Fac, Geo Soldier, Geo Spy, Poggle",1
"Alex Avery",0,1,120716,Grievous,"zzGG zB2 zB1 zMagnaGuard zNute",1
"Alex Avery",1,0,106340,Traya,"zzTraya zDN zSion zzEP zThrawn",1
"Alex Avery",,,108078,Mon Mothma,"zzMon Mothma, zCara Dune, Hoth Rebel Scout, zPao Bistan",1
"Alex Avery",1,0,101060,Troopers,"zVeers zzPiett zGideon zDark Trooper, Range Trooper",1
"Alex Avery",,,97485,Disintegration,"Aurra zGreef G9, Boba zzBossk zzThe Mandalorian G8",1
"Alex Avery",1,1,80765,Ewoks,"zChirpa Elder Paploo Wicket Logray",1
"Alex Avery",1,0,104823,ShaakClones,"zzShaak Ti, zRex zEcho (501st), zzFives zARC Trooper",1
"Alex Avery",1,1,91128,Carth,"zCarth Onasi, zMission zZaalbar Juhani zCanderous",1
"Alex Avery",0,1,88490,FO,"zzKRU zKylo FOE zSith Trooper, FOO",1
"Alex Avery",0,1,84942,Phoenix,"Hera Chopper zEzra Zeb G8, Kanan G8",1
"Alex Avery",0,1,119392,BS,"zBS zGMY zJolee zGK zzHYoda",1
"Alex Avery",1,0,18612,NestSolo (Counter),"zNest",1
"Alex Avery",,,111804,Admiral Raddus,"Admiral Raddus, Cassian Jyn K-2SO G8, Chirrut",0
"Alex Avery",,,78020,Iden Troopers,"zIden Versio, Shoretrooper Snowtrooper Magma DT G7",0
"Alex Avery",0,1,100626,BH,"zJango zFennec Shand, Dengar G9, zGreedo Krrsantan",0
"Alex Avery",,,87569,Bad Batch,"zHunter G9, zEcho zzOmega G9, zTech zWrecker",0
"Leo the lion",,,169884,JMK,"zzzzzzJMK zAhsoka zzzCAT zzzzGAS zGK",1
"Leo the lion",,,122804,Phasma,"zPhasma zFOTP FOSFTP FOST zKylo",1
"Leo the lion",1,1,152071,SL Kylo,"zzzzzzSL Kylo, zSith Trooper, zHux zzKRU zzThrawn",1
"Leo the lion",1,1,162083,GL Rey,"zzzzzzRey zzzJTR zzBB-8 zRH Poe, zRH Finn",1
"Leo the lion",1,1,111180,NS,"zzMT zzAV zDaka Zombie Spirit",1
"Leo the lion",,,592034,Executor,"Executor HT RC Xanadu Blood, Slave I, IG-2000 Imperial TIE Fighter, Tie Adv",1
"Leo the lion",,,153738,JMLS,"zBS zzzzzzJMLS zWat Tambor, zzJKL zJolee",1
"Leo the lion",1,0,143299,CLS,"zzzCLS zHan zzChewbacca zzC-3PO Chewpio",1
"Leo the lion",0,1,136972,DRMalak,"zzzDR zzHK-47 zBSF zzMalak Sith Empire Trooper",1
"Leo the lion",,,528288,Negotiator,"Negotiator BTL-B Y-wing, Anakin's Eta-2, Rex's ARC-170, Umbaran SF, Ahsoka's SF, Plo's SF, Clone Sergeant's ARC-170",1
"Leo the lion",,,339553,Malevolence,"Malevolence Hyena Bomber, Vulture Droid, Sun Fac SF, Soldier SF, Spy SF",1
"Leo the lion",,,468997,HansMF,"Home One, Han's MF, Rebel Y-wing, Bistan's U-wing, Phantom Ghost Cassian's U-wing, Wedge X-wing",1
