Player,Offense,Defense,GP,Name,Squad,Viable
"Leo the lion",0,1,113670,Geonosians,"zzGBA Sun Fac, Geo Soldier, Geo Spy, Poggle",1
"Leo the lion",0,1,129989,Grievous,"zzGG zB2 zB1 zMagnaGuard zNute",1
"Leo the lion",1,0,126910,Traya,"zzTraya zDN zSion zDooku zzEP",1
"Leo the lion",,,103128,Mon Mothma,"zzMon Mothma, Cara Dune, Wedge Biggs Scarif",1
"Leo the lion",,,122780,Disintegration,"zzAurra Greef zBoba zzBossk The Mandalorian G8",1
"Leo the lion",1,1,90404,Ewoks,"zChirpa Elder zPaploo Wicket Logray G9",1
"Leo the lion",1,0,144144,ShaakClones,"zzShaak Ti, zRex zEcho (501st), zzFives zARC Trooper",1
"Leo the lion",1,1,92643,Carth,"Carth Onasi, zMission zZaalbar Juhani Canderous",1
"Leo the lion",1,0,116607,Troopers,"zVeers Starck zGideon DT zzPiett",1
"Leo the lion",0,1,90546,Phoenix,"Hera Sabine zEzra Zeb G8, Kanan",1
"Leo the lion",1,1,88180,Rogue1,"zJyn Chirrut G8, Baze G8, K-2SO Cassian",1
"Leo the lion",1,0,77007,Jawas,"Nebit G8, Jawa Engineer, Jawa Scavenger G9, Jawa Dathcha",1
"Leo the lion",1,0,62069,QiraNest,"Qira Nest zzHYoda",1
"Leo the lion",0,1,127991,BH,"zJango IG-88 Cad Dengar zZam",0
"Leo the lion",,,85800,Bad Batch,"Hunter Echo zOmega Tech Wrecker G9",0
"CptBlackBush",,,174044,JMK,"zzzzzzJMK zAhsoka zzzCAT zzzzGAS zGK",1
"CptBlackBush",,,123318,Phasma,"zPhasma zFOTP FOSFTP zFOST zKylo",1
"CptBlackBush",1,1,157122,SL Kylo,"zzzzzzSL Kylo, zSith Trooper, zHux zzKRU zzThrawn",1
"CptBlackBush",,,149207,SEE,"zzzzzzSEE zBSF zzMalak zzzDR zzzVader",1
"CptBlackBush",1,0,146395,CLS,"zzzCLS zHan zzChewbacca zzC-3PO zChewpio",1
"CptBlackBush",,,505656,Negotiator,"Negotiator BTL-B Y-wing, Anakin's Eta-2, Rex's ARC-170, Umbaran SF, Ahsoka's SF, Plo's SF, Clone Sergeant's ARC-170",1
"CptBlackBush",,,340403,Malevolence,"Malevolence Hyena Bomber, Vulture Droid, Sun Fac SF, Soldier SF, Spy SF",1
"CptBlackBush",,,141961,JKL,"zzJKL zzzJKR zzHYoda zzOld Ben, Aayla",1
"CptBlackBush",1,1,101228,NS_Alt,"zzMT zzAV Talia zDaka Zombie",1
"CptBlackBush",,,444010,HansMF,"Home One, Han's MF, Rebel Y-wing, Bistan's U-wing, Phantom Ghost Cassian's U-wing, Wedge X-wing",1
"CptBlackBush",1,1,135749,JTR,"zzzJTR zzR2-D2 zzBB-8 zRH Finn, zRH Poe",1
"CptBlackBush",0,1,113861,Geonosians,"zzGBA Sun Fac, Geo Soldier, Geo Spy, Poggle",1
"CptBlackBush",0,1,130026,Grievous,"zzGG zB2 zB1 zMagnaGuard zNute",1
"CptBlackBush",1,0,133562,Traya,"zzTraya zzDN zSion zzEP Sith Empire Trooper",1
"CptBlackBush",,,119139,Mon Mothma,"zzMon Mothma, Wedge Biggs Hoth Rebel Scout, zPao",1
"CptBlackBush",,,464610,Executrix,"Executrix Tie Adv, Emperor's Shuttle, TIE Reaper, Imperial TIE Fighter, Gauntlet Starfighter, FOSF TIE Fighter, FO TIE Fighter",1
"CptBlackBush",1,1,94358,Ewoks,"zChirpa Elder zPaploo zWicket zLogray",1
"CptBlackBush",1,0,152674,ShaakClones,"zzShaak Ti, zRex zEcho (501st), zzFives zARC Trooper",1
"CptBlackBush",0,1,149139,BH,"zzBossk zIG-88 zBoba zDengar zzJango",1
"CptBlackBush",1,1,98883,Carth,"zCarth Onasi, zMission zZaalbar zJuhani zCanderous",1
"CptBlackBush",1,0,126526,Troopers,"zVeers zStarck zDark Trooper, zzGideon zzPiett",1
"CptBlackBush",0,1,98749,Phoenix,"zHera zSabine zEzra zZeb zKanan",1
"CptBlackBush",1,1,98811,Rogue1,"zzJyn Chirrut Baze zK-2SO zCassian",1
"CptBlackBush",1,0,125562,zMaul,"zDarth Maul, zDooku zSidious zSavage Sith Marauder",1
"CptBlackBush",,,47769,Bad Batch,"Hunter G1, zEcho G4, zzOmega G6, Tech G1, Wrecker G1",0
"CptBlackBush",1,0,43381,Jawas,"Nebit G2, Jawa Engineer G1, Jawa Scavenger G7, Jawa G1, Dathcha G7",0
"CptBlackBush",1,0,6630,NestSolo (Counter),"Nest G1",0
"Jaycop",,,122521,Phasma,"zPhasma zFOTP FOSFTP zFOST zKylo",1
"Jaycop",1,1,154791,SL Kylo,"zzzzzzSL Kylo, zSith Trooper, zHux zzKRU zzThrawn",1
"Jaycop",1,0,146290,CLS,"zzzCLS zHan zzChewbacca zzC-3PO zChewpio",1
"Jaycop",1,1,100697,NS_Alt,"zzMT zzAV Talia zDaka Zombie",1
"Jaycop",,,390025,HansMF,"Home One, Han's MF, Rebel Y-wing, Bistan's U-wing, Phantom Ghost Cassian's U-wing, Wedge X-wing",1
"Jaycop",,,476917,Negotiator,"Negotiator HT Anakin's Eta-2, Umbaran SF, Ahsoka's SF, Clone Sergeant's ARC-170, Plo's SF, Rex's ARC-170",1
"Jaycop",0,1,92661,Geonosians,"zzGBA Sun Fac, Geo Soldier, Geo Spy, Poggle",1
"Jaycop",0,1,130857,Grievous-Wat,"zzGG zB2 zB1 zMagnaGuard zWat Tambor",1
"Jaycop",1,1,114701,JTR,"zzzJTR Scav Rey, zBB-8 zzR2-D2 zFinn",1
"Jaycop",1,1,134135,Revan,"zzzJKR BS zzGMY zJolee zGK",1
"Jaycop",1,1,88574,Ewoks,"zChirpa Elder Paploo Wicket Logray",1
"Jaycop",0,1,122281,BH,"zzBossk Boba Cad Dengar zJango",1
"Jaycop",1,1,94702,Carth,"Carth Onasi, zMission zZaalbar Juhani Canderous G8",1
"Jaycop",1,1,129941,zEP,"zzEP zzzVader Tarkin TFP zBSF",1
"Jaycop",0,1,76454,Phoenix,"Hera Sabine G8, Ezra Zeb G8, Kanan",1
"Jaycop",1,0,115933,Wampa (Counter),"zRex zzWampa DT G9, zzHYoda FOO",1
"Jaycop",1,0,116844,QGJ,"QGJ Aayla zJKA zzOld Ben, zAhsoka",1
"Jaycop",,,58084,Admiral Raddus,"Admiral Raddus 3* G7, Cassian G9, Jyn G7, K-2SO G6, Bistan G5",0
"Jaycop",,,284800,Malevolence,"Malevolence Hyena Bomber 5*, Vulture Droid 3*, Sun Fac SF, Soldier SF, Spy SF",0
"Jaycop",1,0,76382,Traya,"zzTraya DN G3, Sion G3, zDooku Nest G7",0
"Jaycop",,,399287,Executrix,"Executrix Tie Adv, Emperor's Shuttle 4*, TIE Reaper 3*, Imperial TIE Fighter, Gauntlet Starfighter, FOSF TIE Fighter, FO TIE Fighter",0
"Jaycop",,,97343,Mon Mothma,"zzMon Mothma, Cara Dune G8, Wedge Biggs Lando",0
"Jaycop",1,0,83514,Troopers,"zVeers zStarck Snowtrooper Piett G9, zStormtrooper",0
"Jaycop",1,0,62579,Jawas,"Nebit G8, Jawa Engineer G8, Jawa Scavenger G7, Jawa G8, Dathcha G9",0
"Alias Nome",,,143671,Admiral Raddus,"zzAdmiral Raddus, zCassian zzJyn Scarif Bistan",1
"Alias Nome",,,156608,Jabba,"zzzzzzJabba zBoushh (Leia Organa), zSkiff Guard (Lando Calrissian), zKrrsantan zBoba",1
"Alias Nome",,,174552,JMLS,"zzzJKR zzJKL zzzzzzJMLS zWat Tambor, zzzzGAS",1
"Alias Nome",1,0,162999,CLS,"zzzCLS zHan zzChewbacca zzC-3PO zChewpio",1
"Alias Nome",0,1,127637,padme,"zzPadme zGK zJKA zAhsoka zBarriss",1
"Alias Nome",1,1,107558,NestSisters,"zzAV zzMT zDaka Zombie zNest",1
"Alias Nome",,,549540,HansMF,"Home One, Han's MF, Rebel Y-wing, Bistan's U-wing, Phantom Ghost Cassian's U-wing, Wedge X-wing",1
"Alias Nome",0,1,118094,Geonosians,"zzGBA Sun Fac, Geo Soldier, Geo Spy, Poggle",1
"Alias Nome",0,1,120902,Grievous,"zzGG zB2 zB1 zMagnaGuard zNute",1
"Alias Nome",1,0,118999,Traya,"zzTraya DN Sion G8, zzEP zzThrawn",1
"Alias Nome",1,1,152125,JTR,"zzzJTR zScav Rey, zzBB-8 zzR2-D2 zFinn",1
"Alias Nome",,,117867,Mon Mothma,"zzMon Mothma, zCara Dune, Wedge Hoth Rebel Scout, zPao",1
"Alias Nome",,,446574,Executrix,"Executrix Tie Adv, Emperor's Shuttle, TIE Reaper, Imperial TIE Fighter, Gauntlet Starfighter, FOSF TIE Fighter, FO TIE Fighter",1
"Alias Nome",1,1,96259,Ewoks,"zChirpa Elder zPaploo zWicket zLogray",1
"Alias Nome",1,0,135916,ShaakClones,"zzShaak Ti, zRex zEcho (501st), zzFives zARC Trooper",1
"Alias Nome",0,1,139966,BH,"zzBossk zFennec Shand, zDengar zGreedo zzAurra",1
"Alias Nome",0,1,103083,BH,"zzJango The Mandalorian G9, zIG-88 Cad zzEmbo",1
"Alias Nome",0,1,96190,FO,"zzKRU zKylo FOE FOO FOST G8",1
"Alias Nome",1,0,93908,Troopers,"zVeers zStarck zDT Range Trooper, Shoretrooper",1
"Alias Nome",0,1,105324,Phoenix,"zHera zSabine zEzra zZeb zKanan",1
"Alias Nome",0,1,142690,BS,"zBS zzGMY zJolee zzOld Ben, zzHYoda",1
"Alias Nome",1,0,77728,Jawas,"Nebit G8, Jawa Engineer G9, Jawa Scavenger G8, Jawa Dathcha G9",1
"Alias Nome",0,1,65383,Qira,"Qira G8, L3-37 G8, Vandor Chewbacca 5* G8, Mission G8, Zaalbar G8",0
"Harry",,,175873,JMK,"zzzzzzJMK zAhsoka zzzCAT zzzzGAS zGK",1
"Harry",,,170784,SEE,"zzzzzzSEE zBSF zzMalak zzzDR zzzVader",1
"Harry",1,0,143337,CLS,"zzzCLS zHan zzChewbacca zzC-3PO zChewpio",1
"Harry",,,134843,JKL,"zzJKL zzzJKR zzHYoda Old Ben, zEzra",1
"Harry",,,515779,HansMF,"Home One, Han's MF, Rebel Y-wing, Bistan's U-wing, Phantom Ghost Cassian's U-wing, Wedge X-wing",1
"Harry",,,552812,Negotiator,"Negotiator HT Anakin's Eta-2, Umbaran SF, Ahsoka's SF, Clone Sergeant's ARC-170, Plo's SF, Rex's ARC-170",1
"Harry",0,1,112708,Geonosians,"zzGBA Sun Fac, Geo Soldier, Geo Spy, Poggle",1
"Harry",0,1,126226,Grievous,"zzGG zB2 zB1 zMagnaGuard zNute",1
"Harry",1,0,107449,Traya,"zzTraya zDN zSion Sith Empire Trooper G8, zzThrawn",1
"Harry",1,1,118708,JTR,"zzzJTR zScav Rey, zzBB-8 zzR2-D2 Finn",1
"Harry",,,103856,Mon Mothma,"zzMon Mothma, zCara Dune, Hoth Rebel Scout, Bistan Scarif",1
"Harry",1,1,100864,Ewoks,"zChirpa Elder zPaploo zWicket zLogray",1
"Harry",1,0,155678,ShaakClones,"zzShaak Ti, zRex zEcho (501st), zzFives zARC Trooper",1
"Harry",0,1,146553,BH,"zzBossk zIG-88 zBoba zDengar zJango",1
"Harry",1,1,100335,Carth,"zCarth Onasi, zMission zZaalbar zJuhani zCanderous",1
"Harry",1,0,122362,Troopers,"zVeers zStarck zGideon zDT zzPiett",1
"Harry",1,0,131381,zMaul,"zDarth Maul, zSidious zDooku Sith Marauder, zNest",1
"Harry",0,1,118008,Phoenix,"zHera Chopper zSabine zZeb zKanan",1
"Harry",1,1,115641,Rogue1,"zzJyn Chirrut Baze zK-2SO zCassian",1
"Harry",1,0,114111,EP (Counter, Rebel),"zzEP Shoretrooper zKrennic zzWampa Stormtrooper G8",1
"Harry",1,0,105701,Jawas,"Nebit Jawa Engineer, Jawa Scavenger, Jawa Dathcha",1
"Harry",,,78329,Phasma,"zPhasma FOTP FOSFTP G8, FOST Kylo",0
"Harry",,,323657,Malevolence,"Malevolence Hyena Bomber 6*, Vulture Droid 5*, Sun Fac SF, Soldier SF, Spy SF",0
"Harry",1,1,73260,NS,"MT G8, AV Daka G7, Zombie Spirit G6",0
"Harry",,,463506,Executrix,"Executrix Tie Adv, Emperor's Shuttle, TIE Reaper 6*, Imperial TIE Fighter, Gauntlet Starfighter, FOSF TIE Fighter, FO TIE Fighter",0
"Harry",,,72754,Bad Batch,"zHunter 5* G9, zEcho 4* G9, zzOmega 5* G9, zTech 5* G9, zWrecker G8",0
"Hima Glowbin",,,157419,SEE,"zzzzzzSEE zBSF zzMalak zzzDR zzzVader",1
"Hima Glowbin",1,1,162052,GL Rey,"zzzzzzRey zzzJTR zzBB-8 zRH Poe, zRH Finn",1
"Hima Glowbin",,,160999,JMLS,"zzzJKR zzJKL zzzzzzJMLS zWat Tambor, zzzzGAS",1
"Hima Glowbin",1,0,144891,CLS,"zzzCLS zHan zzChewbacca zzC-3PO zChewpio",1
"Hima Glowbin",0,1,125138,padme,"zzPadme zGK zJKA zAhsoka CW Chewbacca G9",1
"Hima Glowbin",,,486522,Negotiator,"Negotiator HT Anakin's Eta-2, Umbaran SF, Ahsoka's SF, BTL-B Y-wing, Clone Sergeant's ARC-170, Plo's SF",1
"Hima Glowbin",,,292629,Malevolence,"Malevolence Hyena Bomber, Vulture Droid, Sun Fac SF, Soldier SF, Spy SF",1
"Hima Glowbin",1,1,116713,NS_Alt,"zzMT zzAV Talia zDaka Zombie",1
"Hima Glowbin",,,442793,HansMF,"Home One, Han's MF, Rebel Y-wing, Bistan's U-wing, Phantom Ghost Cassian's U-wing, Wedge X-wing",1
"Hima Glowbin",0,1,101953,Geonosians,"zzGBA Sun Fac, Geo Soldier, Geo Spy, Poggle",1
"Hima Glowbin",0,1,116508,Grievous,"zzGG zB2 zB1 zMagnaGuard zNute",1
"Hima Glowbin",1,0,105407,Traya,"zzTraya DN zSion Sith Empire Trooper G8, zzThrawn",1
"Hima Glowbin",,,104411,Mon Mothma,"zzMon Mothma, Cara Dune, Wedge Biggs Chirrut",1
"Hima Glowbin",,,114288,Disintegration,"Aurra zGreef G8, zBoba zzBossk zThe Mandalorian G8",1
"Hima Glowbin",1,1,96311,Ewoks,"zChirpa Elder zPaploo zWicket zLogray",1
"Hima Glowbin",1,0,137786,ShaakClones,"zzShaak Ti, zRex zEcho (501st), zzFives zARC Trooper",1
"Hima Glowbin",1,1,95265,Carth,"zCarth Onasi, zMission zZaalbar Juhani Canderous",1
"Hima Glowbin",1,0,117410,Troopers,"zVeers zStarck DT zzPiett Shoretrooper",1
"Hima Glowbin",0,1,94820,FO,"zzKRU zKylo FOE FOO FOST G9",1
"Hima Glowbin",0,1,83479,Phoenix,"Hera Sabine G8, Ezra zZeb Kanan",1
"Hima Glowbin",,,131530,Bad Batch,"zHunter zEcho zzOmega zTech zWrecker",1
"Hima Glowbin",0,1,135737,BS,"zBS zzGMY zJolee zOld Ben, zzHYoda",1
"Hima Glowbin",1,0,116799,EP (Counter, Rebel),"zzEP Krennic zzWampa Nest Range Trooper",1
"Hima Glowbin",,,91774,Admiral Raddus,"zzAdmiral Raddus 6*, zCassian zJyn K-2SO Bistan G9",0
"Hima Glowbin",,,444683,Executrix,"Executrix Tie Adv, Emperor's Shuttle 6*, TIE Reaper 5*, Imperial TIE Fighter, Gauntlet Starfighter, FOSF TIE Fighter, FO TIE Fighter",0
"Hima Glowbin",0,1,113258,BH,"Jango zIG-88 Dengar zEmbo Greedo",0
"Hima Glowbin",1,0,118720,zMaul,"Darth Maul, zDooku Sidious Savage Sith Marauder",0
"Hima Glowbin",1,0,45084,Jawas,"Nebit G6, Jawa Engineer G2, Jawa Scavenger G6, Jawa G5, Dathcha G6",0
"Baxterboz",,,171220,JMK,"zzzzzzJMK zAhsoka zzzCAT zzzzGAS zGK",1
"Baxterboz",,,117683,Phasma,"zPhasma zFOTP zSith Trooper, zzKRU zKylo",1
"Baxterboz",0,1,100234,Qira,"zQira zL3-37 zVandor Chewbacca, zMission zZaalbar",1
"Baxterboz",1,1,121726,NS,"zzMT zzAV zDaka Zombie Spirit",1
"Baxterboz",,,586074,Executor,"Executor 6* HT RC Xanadu Blood, Slave I, IG-2000 Imperial TIE Fighter, Tie Adv",1
"Baxterboz",,,160325,JMLS,"zBS zzzzzzJMLS zWat Tambor, zzJKL zJolee",1
"Baxterboz",1,0,161497,CLS,"zzzCLS zHan zzChewbacca zzC-3PO zChewpio",1
"Baxterboz",0,1,151454,DRMalak,"zzzDR zzHK-47 zBSF zzMalak Sith Empire Trooper",1
"Baxterboz",,,501442,Negotiator,"Negotiator BTL-B Y-wing, Anakin's Eta-2, Rex's ARC-170, Umbaran SF, Ahsoka's SF, Plo's SF, Clone Sergeant's ARC-170",1
"Baxterboz",,,336275,Malevolence,"Malevolence Hyena Bomber, Vulture Droid, Sun Fac SF, Soldier SF, Spy SF",1
"Baxterboz",,,463865,HansMF,"Home One, Han's MF, Rebel Y-wing, Bistan's U-wing, Phantom Ghost Cassian's U-wing, Wedge X-wing",1
"Baxterboz",1,1,130725,JTR,"zzzJTR zzR2-D2 zzBB-8 zRH Finn, zRH Poe",1
"Baxterboz",0,1,107500,Geonosians,"zzGBA Sun Fac, Geo Soldier, Geo Spy, Poggle",1
"Baxterboz",0,1,134930,Grievous,"zzGG zB2 zB1 zMagnaGuard zNute",1
"Baxterboz",1,0,140177,Traya,"zzTraya zzDN zSion zzEP zzThrawn",1
"Baxterboz",1,0,127373,Troopers,"zVeers zzPiett zzGideon zDark Trooper, Range Trooper",1
"Baxterboz",,,143651,Disintegration,"zzAurra zzGreef zBoba zzBossk zzThe Mandalorian",1
"Baxterboz",,,108975,Mon Mothma,"zzMon Mothma, zCara Dune, Wedge Biggs Baze",1
"Baxterboz",1,1,97519,Ewoks,"zChirpa Elder zPaploo zWicket zLogray",1
"Baxterboz",1,0,149446,ShaakClones,"zzShaak Ti, zRex zEcho (501st), zzFives zARC Trooper",1
"Baxterboz",0,1,134841,BH,"zzJango zIG-88 Cad zDengar zNest",1
"Baxterboz",0,1,92917,Phoenix,"zHera zSabine zEzra zZeb G9, zKanan G9",1
"Baxterboz",,,129622,Bad Batch,"zHunter zEcho zzOmega zTech zWrecker",1
"Baxterboz",1,0,100573,zMaul,"zDarth Maul, zDooku zSidious zSavage Sith Marauder",1
"Baxterboz",1,0,76987,Jawas,"Nebit Jawa Engineer, Jawa Scavenger G9, Jawa Dathcha G9",1
"Baxterboz",,,79943,Iden Troopers,"zIden Versio, Shoretrooper Snowtrooper G8, Magma G7, zDT",0
"DarthDarth",,,123683,Phasma,"zPhasma zFOTP FOSFTP zFOST zKylo",1
"DarthDarth",1,1,160227,SL Kylo,"zzzzzzSL Kylo, zSith Trooper, zHux zzKRU zzThrawn",1
"DarthDarth",,,175839,SEE,"zzzzzzSEE zBSF zzMalak zzzDR zzzVader",1
"DarthDarth",1,1,121452,NS,"zzMT zzAV zDaka Zombie Spirit",1
"DarthDarth",1,0,139898,CLS,"zzzCLS zHan zzChewbacca zzC-3PO zChewpio",1
"DarthDarth",0,1,133366,padme,"zzPadme zGK zJKA zAhsoka zBarriss",1
"DarthDarth",,,504685,Negotiator,"Negotiator HT Anakin's Eta-2, Umbaran SF, Ahsoka's SF, BTL-B Y-wing, Clone Sergeant's ARC-170, Plo's SF",1
"DarthDarth",,,348771,Malevolence,"Malevolence Hyena Bomber, Vulture Droid, Sun Fac SF, Soldier SF, Spy SF",1
"DarthDarth",,,440223,HansMF,"Home One, Han's MF, Rebel Y-wing, Bistan's U-wing, Phantom Ghost Cassian's U-wing, Wedge X-wing",1
"DarthDarth",0,1,123852,Geonosians,"zzGBA Sun Fac, Geo Soldier, Geo Spy, Poggle",1
"DarthDarth",1,1,120010,JTR,"zzzJTR zzR2-D2 zzBB-8 zRH Finn, zRH Poe",1
"DarthDarth",0,1,136534,Grievous,"zzGG zB2 zB1 zMagnaGuard zNute",1
"DarthDarth",1,0,140382,Traya,"zzTraya zDN zSion zzEP Sith Empire Trooper",1
"DarthDarth",,,504456,Executrix,"Executrix Tie Adv, Emperor's Shuttle, TIE Reaper, Imperial TIE Fighter, Gauntlet Starfighter, FOSF TIE Fighter, FO TIE Fighter",1
"DarthDarth",1,1,146422,GAS,"zzzzGAS zRex zEcho (501st), zzFives zARC Trooper",1
"DarthDarth",1,1,139468,Revan Offense,"zzzJKR zzGMY zBS zJolee zzHYoda",1
"DarthDarth",1,1,105501,Ewoks,"zChirpa Elder zPaploo zWicket zLogray",1
"DarthDarth",0,1,144322,BH,"zzBossk zzThe Mandalorian, zBoba zDengar zzJango",1
"DarthDarth",1,1,101702,Carth,"zCarth Onasi, zMission zZaalbar zJuhani zCanderous",1
"DarthDarth",1,0,126149,Troopers,"zVeers zStarck zDark Trooper, zzGideon zzPiett",1
"DarthDarth",1,0,130085,zMaul,"zDarth Maul, zSidious zDooku Sith Marauder, zNest",1
"DarthDarth",0,1,97387,Phoenix,"zHera zSabine zEzra zZeb zKanan G9",1
"DarthDarth",1,0,78352,Jawas,"Nebit Jawa Engineer, Jawa Scavenger, Jawa Dathcha",1
"DarthDarth",,,97621,Mon Mothma,"zzMon Mothma, Wedge Biggs Lando Hoth Rebel Scout",0
"DarthDarth",,,81130,Iden Troopers,"zIden Versio 5* G8, zStormtrooper Snowtrooper Magma G9, zDT",0
"DarthDarth",1,1,69361,Rogue1,"Jyn G8, Chirrut G8, Baze G5, K-2SO G9, Cassian",0
"DarthDarth",,,84507,Bad Batch,"zHunter G9, zEcho 5* G9, zzOmega G9, zTech G9, zWrecker G9",0
"MrsBlueprints",1,0,151487,CLS,"zzzCLS zHan zzChewbacca zzC-3PO zChewpio",1
"MrsBlueprints",1,1,105207,NestSisters,"zzAV zzMT zDaka Zombie zNest",1
"MrsBlueprints",0,1,143924,DRMalak,"zzzDR zzHK-47 zBSF zzMalak Sith Marauder",1
"MrsBlueprints",,,507938,Negotiator,"Negotiator HT Anakin's Eta-2, Umbaran SF, Ahsoka's SF, Clone Sergeant's ARC-170, Plo's SF, Rex's ARC-170",1
"MrsBlueprints",1,1,137952,JTR,"zzzJTR zzR2-D2 zzBB-8 zRH Finn, zRH Poe",1
"MrsBlueprints",0,1,111028,Geonosians,"zzGBA Sun Fac, Geo Soldier, Geo Spy, Poggle",1
"MrsBlueprints",0,1,103570,Grievous,"zzGG zB2 zDroideka zMagnaGuard zT3-M4",1
"MrsBlueprints",1,1,157584,Revan,"zzzJKR zBS zzGMY zJolee zGK",1
"MrsBlueprints",1,1,97994,Ewoks,"zChirpa Elder zPaploo zWicket zLogray",1
"MrsBlueprints",1,0,128860,ShaakClones,"zzShaak Ti, zRex zEcho (501st), zzFives ARC Trooper G8",1
"MrsBlueprints",0,1,128208,BH,"zzBossk zzThe Mandalorian, zBoba Dengar G9, zzJango",1
"MrsBlueprints",1,1,93279,Carth,"zCarth Onasi, Mission Zaalbar zJuhani Canderous",1
"MrsBlueprints",1,1,113256,zEP,"zzEP zzzVader zTarkin TFP G9, zzDN",1
"MrsBlueprints",0,1,101237,FO,"zzKRU zKylo FOE FOTP G9, FOO",1
"MrsBlueprints",0,1,85645,Phoenix,"zHera Chopper Ezra G9, Zeb G9, zKanan",1
"MrsBlueprints",,,278390,Malevolence,"Malevolence Hyena Bomber 4*, Vulture Droid 3*, Sun Fac SF, Soldier SF, Spy SF",0
"MrsBlueprints",,,346680,HansMF,"Home One, Han's MF, Biggs X-wing, Bistan's U-wing 4*, Phantom Ghost Cassian's U-wing, Wedge X-wing",0
"MrsBlueprints",,,72468,Mon Mothma,"Mon Mothma 4* G7, zCara Dune 6*, Wedge G7, Lando zKyle Katarn G4",0
"MrsBlueprints",1,0,63705,Troopers,"Veers G7, Starck G6, Magma G8, DT G8, Stormtrooper G7",0
"MrsBlueprints",,,65300,Bad Batch,"Hunter 6* Echo 5* G9, Omega 6* G9, zTech 6* G9, Wrecker 5* G8",0
"MrsBlueprints",1,0,98291,QGJ,"QGJ G8, Aayla G3, zJKA Old Ben, zAhsoka",0
"MrsBlueprints",1,0,17995,SionSolo (Counter),"zSion 6*",0
"Ivar Hardun",,,182798,LV,"zzzzzzLord Vader, zzPiett zzzMaul zRG zzzVader",1
"Ivar Hardun",,,175421,SEE,"zzzzzzSEE zBSF zzMalak zzzDR zDooku",1
"Ivar Hardun",,,580449,Executor,"Executor HT RC Xanadu Blood, Slave I, IG-2000 Imperial TIE Fighter, Tie Adv",1
"Ivar Hardun",0,1,142409,padme,"zzPadme zGK zJKA zAhsoka zzC-3PO",1
"Ivar Hardun",,,427664,Negotiator,"Negotiator BTL-B Y-wing, Anakin's Eta-2, Rex's ARC-170, Umbaran SF, Ahsoka's SF, Plo's SF, Clone Sergeant's ARC-170",1
"Ivar Hardun",,,299408,Malevolence,"Malevolence Hyena Bomber, Vulture Droid, Sun Fac SF, Soldier SF, Spy SF",1
"Ivar Hardun",,,322951,HansMF,"Home One, Han's MF, Rebel Y-wing, Bistan's U-wing, Phantom Ghost Cassian's U-wing, Wedge X-wing",1
"Ivar Hardun",1,0,150120,Traya,"zzTraya zzDN zSion Sith Empire Trooper, zzThrawn",1
"Ivar Hardun",0,1,128077,Grievous,"zzGG zB2 zB1 zMagnaGuard zNute",1
"Ivar Hardun",1,1,115252,Revan Offense,"zzzJKR zzGMY zBS zJolee zzHYoda",1
"Ivar Hardun",1,1,81928,Ewoks,"zChirpa Elder Paploo zWicket Logray",1
"Ivar Hardun",0,1,148223,BH,"zzBossk zBoba zDengar zZam zKrrsantan",1
"Ivar Hardun",1,1,97667,Carth,"zCarth Onasi, zMission Zaalbar Juhani zCanderous",1
"Ivar Hardun",0,1,69280,Phoenix,"Hera G8, Chopper G9, Ezra G8, Zeb G8, Kanan G8",1
"Ivar Hardun",1,1,58594,Rogue1,"Jyn G8, Chirrut G8, Baze G8, K-2SO G8, Cassian G8",1
"Ivar Hardun",1,0,108013,EP (Counter, Rebel),"zzEP Shoretrooper G8, Krennic DT G8, zzWampa",1
"Ivar Hardun",1,0,15942,NestSolo (Counter),"zNest G8",1
"Ivar Hardun",,,61981,Phasma,"Phasma G8, FOTP G9, FOSFTP G6, FOST G8, Kylo G8",0
"Ivar Hardun",1,0,95718,CLS,"zzzCLS zHan zzChewbacca R2-D2 G8, Chewpio 6* G8",0
"Ivar Hardun",0,1,82958,Geonosians,"zzGBA G8, Sun Fac, Geo Soldier G8, Geo Spy, Poggle G8",0
"Ivar Hardun",1,1,79098,NS,"zMT G8, zzAV Daka G8, Zombie G7, Spirit G8",0
"Ivar Hardun",1,1,146895,GAS,"zzzzGAS zRex zEcho (501st), zzFives G9, zARC Trooper",0
"Ivar Hardun",,,74865,Mon Mothma,"Mon Mothma 5* G6, Cara Dune G7, Wedge G8, Lando Kyle Katarn",0
"Ivar Hardun",1,0,88707,Troopers,"Veers Starck Snowtrooper G8, zzGideon Stormtrooper G8",0
"Ivar Hardun",0,1,113737,BH,"Jango G9, zIG-88 Cad zEmbo zGreedo",0
"Ivar Hardun",,,117188,Bad Batch,"zHunter zEcho zOmega G6, zTech zWrecker",0
"Hoyt Nitrum",,,175322,JMK,"zzzzzzJMK zJKA zzGMY zzShaak Ti, zGK",1
"Hoyt Nitrum",,,169225,SEE,"zzzzzzSEE zBSF zzMalak zzzDR zzzVader",1
"Hoyt Nitrum",,,177725,JMLS,"zzzJKR zzJKL zzzzzzJMLS zWat Tambor, zzzzGAS",1
"Hoyt Nitrum",1,0,145516,CLS,"zzzCLS zHan zzChewbacca zzC-3PO zChewpio",1
"Hoyt Nitrum",1,1,108864,NestSisters,"zzAV zzMT zDaka Zombie zNest",1
"Hoyt Nitrum",,,497822,Negotiator,"Negotiator HT Anakin's Eta-2, Umbaran SF, Ahsoka's SF, BTL-B Y-wing, Clone Sergeant's ARC-170, Plo's SF",1
"Hoyt Nitrum",,,409057,HansMF,"Home One, Han's MF, Rebel Y-wing, Bistan's U-wing, Phantom Biggs X-wing, Cassian's U-wing, Wedge X-wing",1
"Hoyt Nitrum",1,1,122043,JTR,"zzzJTR zzR2-D2 zzBB-8 zRH Finn, RH Poe G9",1
"Hoyt Nitrum",0,1,127189,Grievous,"zzGG zB2 zB1 zMagnaGuard zNute",1
"Hoyt Nitrum",1,0,114608,Traya,"zzTraya zzDN zSion Sith Empire Trooper, zzThrawn",1
"Hoyt Nitrum",,,129458,Disintegration,"Aurra zzGreef zBoba zzBossk zzThe Mandalorian",1
"Hoyt Nitrum",1,1,92920,Ewoks,"zChirpa Elder zPaploo zWicket Logray",1
"Hoyt Nitrum",1,1,98415,Carth,"zCarth Onasi, zMission zZaalbar zJuhani Canderous",1
"Hoyt Nitrum",0,1,132746,BH,"zzJango zIG-88 Cad zDengar zKrrsantan",1
"Hoyt Nitrum",1,0,112164,501st,"zRex zARC Trooper, zEcho (501st), zzFives zAhsoka",1
"Hoyt Nitrum",1,0,121639,Troopers,"zVeers zStarck zDark Trooper, zzPiett zStormtrooper",1
"Hoyt Nitrum",0,1,87692,FO,"zzKRU zKylo FOE FOO FOST G8",1
"Hoyt Nitrum",0,1,75822,Phoenix,"Hera Sabine G8, Ezra Zeb G9, Kanan G9",1
"Hoyt Nitrum",1,1,70383,Rogue1,"Jyn G8, Chirrut G8, Baze G8, K-2SO G9, Cassian G9",1
"Hoyt Nitrum",,,112971,Bad Batch,"zHunter zEcho zzOmega zTech zWrecker",1
"Hoyt Nitrum",1,0,126547,zMaul,"zDarth Maul, zDooku zSidious zSavage Sith Marauder",1
"Hoyt Nitrum",1,0,117657,EP (Counter, Rebel),"zzEP Shoretrooper G8, zKrennic zDT zzWampa",1
"Hoyt Nitrum",1,0,74587,Jawas,"Nebit G9, Jawa Engineer, Jawa Scavenger, Jawa G8, Dathcha",1
"Hoyt Nitrum",,,286251,Malevolence,"Malevolence Hyena Bomber 5*, Vulture Droid, Sun Fac SF, Soldier SF, Spy SF",0
"Hoyt Nitrum",0,1,84701,Geonosians,"zzGBA Sun Fac G8, Geo Soldier, Geo Spy, Poggle",0
"Hoyt Nitrum",,,453615,Executrix,"Executrix Tie Adv, Emperor's Shuttle, TIE Reaper 5*, Imperial TIE Fighter, Gauntlet Starfighter, FOSF TIE Fighter, FO TIE Fighter",0
"Hoyt Nitrum",,,119623,Mon Mothma,"zzMon Mothma, Wedge Biggs Lando zKyle Katarn",0
"Darthraki",,,122563,Phasma,"zPhasma zFOTP FOSFTP zFOST zKylo",1
"Darthraki",1,1,148823,SL Kylo,"zzzzzzSL Kylo, zSith Trooper, zHux zzKRU zThrawn",1
"Darthraki",1,0,137355,CLS,"zzzCLS zHan zChewbacca zC-3PO zChewpio",1
"Darthraki",0,1,124397,DRMalak,"zzzDR zHK-47 zBSF zzMalak Sith Empire Trooper",1
"Darthraki",0,1,138462,padme,"zzPadme zGK zJKA zAhsoka zBarriss",1
"Darthraki",,,516510,Negotiator,"Negotiator HT Anakin's Eta-2, Umbaran SF, Ahsoka's SF, Clone Sergeant's ARC-170, Plo's SF, Rex's ARC-170",1
"Darthraki",,,383453,HansMF,"Home One, Han's MF, Biggs X-wing, Bistan's U-wing, Phantom Ghost Cassian's U-wing, Wedge X-wing",1
"Darthraki",0,1,100825,Geonosians,"zGBA Sun Fac, Geo Soldier, Geo Spy, Poggle",1
"Darthraki",0,1,119948,Grievous,"zzGG zB2 zB1 zMagnaGuard zNute",1
"Darthraki",1,1,103008,JTR,"zzJTR Scav Rey, zzBB-8 zzR2-D2 Finn",1
"Darthraki",1,0,125848,Traya,"zzTraya zzDN zSion zzEP zNest",1
"Darthraki",1,1,146378,GAS,"zzzzGAS zRex zEcho (501st), zzFives zARC Trooper",1
"Darthraki",1,1,131209,Revan Offense,"zzzJKR zGMY zBS zJolee zHYoda",1
"Darthraki",1,1,76049,Ewoks,"zChirpa G9, Elder Paploo G9, Wicket Logray G9",1
"Darthraki",0,1,137495,BH,"zzBossk zIG-88 zBoba zDengar zzJango",1
"Darthraki",1,0,116441,Troopers,"zVeers zStarck Snowtrooper zDark Trooper, zzPiett",1
"Darthraki",0,1,83449,Phoenix,"Hera Sabine G8, zEzra Zeb zKanan",1
"Darthraki",1,1,81344,Rogue1,"Jyn Chirrut Baze K-2SO Cassian",1
"Darthraki",1,0,101933,zMaul,"zDarth Maul, zDooku Sidious zSavage Sith Marauder",1
"Darthraki",1,0,74154,Jawas,"Nebit Jawa Engineer, Jawa Scavenger, Jawa Dathcha G9",1
"Darthraki",0,1,74286,Qira,"Qira 4* G9, L3-37 5* zVandor Chewbacca 3* G8, zMission zZaalbar",0
"Darthraki",,,293067,Malevolence,"Malevolence Hyena Bomber 5*, Vulture Droid 3*, Sun Fac SF, Soldier SF, Spy SF",0
"Darthraki",1,1,95307,NS,"zzMT zzAV zDaka Zombie Spirit G9",0
"Darthraki",,,90379,Mon Mothma,"zzMon Mothma 6*, zCara Dune, Wedge Hoth Rebel Scout, zPao",0
"Ozzy",,,120353,Phasma,"zPhasma zFOTP FOSFTP zFOST zKylo",1
"Ozzy",1,1,150794,SL Kylo,"zzzzzzSL Kylo, zSith Trooper, zHux zzKRU zzThrawn",1
"Ozzy",1,1,169441,GL Rey,"zzzzzzRey zzzJTR zzBB-8 zRH Poe, zRH Finn",1
"Ozzy",0,1,139402,DRMalak,"zzzDR zzHK-47 zBSF zzMalak Sith Empire Trooper",1
"Ozzy",1,0,137701,CLS,"zzzCLS zHan zzChewbacca zzC-3PO zChewpio",1
"Ozzy",1,1,111197,NestSisters,"zzAV zzMT zDaka Zombie zNest",1
"Ozzy",0,1,118197,padme,"zzPadme zGK zJKA zAhsoka CW Chewbacca G8",1
"Ozzy",,,298246,Malevolence,"Malevolence Hyena Bomber, Vulture Droid, Sun Fac SF, Soldier SF, Spy SF",1
"Ozzy",,,409897,HansMF,"Home One, Han's MF, Rebel Y-wing, Bistan's U-wing, Phantom Ghost Cassian's U-wing, Wedge X-wing",1
"Ozzy",,,450955,Negotiator,"Negotiator HT Anakin's Eta-2, Umbaran SF, Ahsoka's SF, Clone Sergeant's ARC-170, Plo's SF, Rex's ARC-170",1
"Ozzy",0,1,92765,Geonosians,"zzGBA Sun Fac, Geo Soldier, Geo Spy, Poggle",1
