Player,Offense,Defense,GP,Name,Squad,Viable
"Darthraki",,,122563,Phasma,"zPhasma zFOTP FOSFTP zFOST zKylo",1
"Darthraki",1,1,149275,SL Kylo,"zzzzzzSL Kylo, zSith Trooper, zHux zzKRU zThrawn",1
"Darthraki",1,0,137286,CLS,"zzzCLS zHan zChewbacca zC-3PO zChewpio",1
"Darthraki",0,1,124719,DRMalak,"zzzDR zHK-47 zBSF zzMalak Sith Empire Trooper",1
"Darthraki",0,1,138462,padme,"zzPadme zGK zJKA zAhsoka zBarriss",1
"Darthraki",,,516601,Negotiator,"Negotiator HT Anakin's Eta-2, Umbaran SF, Ahsoka's SF, Clone Sergeant's ARC-170, Plo's SF, Rex's ARC-170",1
"Darthraki",0,1,101073,Geonosians,"zGBA Sun Fac, Geo Soldier, Geo Spy, Poggle",1
"Darthraki",0,1,119948,Grievous,"zzGG zB2 zB1 zMagnaGuard zNute",1
"Darthraki",1,1,103008,JTR,"zzJTR Scav Rey, zzBB-8 zzR2-D2 Finn",1
"Darthraki",1,0,124798,Traya,"zzTraya zzDN zSion zzEP zNest",1
"Darthraki",1,1,146402,GAS,"zzzzGAS zRex zEcho (501st), zzFives zARC Trooper",1
"Darthraki",1,1,130978,Revan Offense,"zzzJKR zGMY zBS zJolee zHYoda",1
"Darthraki",1,1,76049,Ewoks,"zChirpa G9, Elder Paploo G9, Wicket Logray G9",1
"Darthraki",0,1,131914,BH,"zzBossk zIG-88 zzJango Dengar zBoba",1
"Darthraki",1,0,116247,Troopers,"zVeers zStarck zDark Trooper, zzPiett Snowtrooper",1
"Darthraki",0,1,79836,Phoenix,"Hera zKanan G9, Sabine G8, Zeb G9, zEzra",1
"Darthraki",1,1,80292,Rogue1,"Jyn Chirrut Baze Cassian K-2SO G9",1
"Darthraki",1,0,102070,zMaul,"zDarth Maul, zDooku Sidious zSavage Sith Marauder",1
"Darthraki",1,0,74696,Jawas,"Nebit Jawa Engineer, Jawa Scavenger, Jawa Dathcha G9",1
"Darthraki",,,293067,Malevolence,"Malevolence Hyena Bomber 5*, Vulture Droid 3*, Sun Fac SF, Soldier SF, Spy SF",0
"Darthraki",1,1,95186,NS,"zzMT zzAV zDaka Zombie Spirit G8",0
"Darthraki",,,373598,HansMF,"Home One, Han's MF, Rebel Y-wing 5*, Bistan's U-wing 6*, Phantom Ghost Cassian's U-wing, Biggs X-wing",0
"Darthraki",,,87718,Mon Mothma,"zzMon Mothma 5*, zCara Dune, Hoth Rebel Scout, Wedge zPao",0
"Darthraki",1,1,86649,Carth,"zCarth Onasi, zMission zZaalbar zVandor Chewbacca 3* G5, zCanderous",0
"Caleb",,,127306,Phasma,"zPhasma zFOTP FOSFTP zFOST zKylo",1
"Caleb",1,1,162338,SL Kylo,"zzzzzzSL Kylo, zSith Trooper, zHux zzKRU zzThrawn",1
"Caleb",,,144919,SEE,"zzzzzzSEE zBSF zzMalak G8, zzzDR zzzVader",1
"Caleb",,,154588,JMLS,"zBS zzzzzzJMLS zzHYoda zzJKL zJolee",1
"Caleb",1,0,146549,CLS,"zzzCLS zHan zzChewbacca zzC-3PO zChewpio",1
"Caleb",0,1,118416,padme,"zzPadme zGK zJKA zAhsoka CW Chewbacca G9",1
"Caleb",,,407361,HansMF,"Home One, Han's MF, Rebel Y-wing 6*, Bistan's U-wing, Phantom Ghost Cassian's U-wing, Wedge X-wing",1
"Caleb",,,462816,Negotiator,"Negotiator HT Anakin's Eta-2, Umbaran SF, Ahsoka's SF, Clone Sergeant's ARC-170, Plo's SF, Rex's ARC-170",1
"Caleb",0,1,99053,Geonosians,"zzGBA Sun Fac, Geo Soldier, Geo Spy, Poggle",1
"Caleb",0,1,111004,Grievous,"zzGG zB2 zB1 zDroideka MagnaGuard",1
"Caleb",,,103357,Mon Mothma,"Mon Mothma, Cara Dune, Lando Wedge Biggs",1
"Caleb",1,1,107667,GAS,"zzzzGAS zRex zEcho (501st), zzFives zARC Trooper G9",1
"Caleb",1,1,78986,Ewoks,"zChirpa Elder Paploo Wicket Logray",1
"Caleb",0,1,102353,BH,"zzBossk zDengar G9, Cad zZam zBoba",1
"Caleb",1,1,92905,Carth,"zCarth Onasi, zMission zZaalbar zJuhani zCanderous",1
"Caleb",0,1,87377,BH,"zzJango G9, IG-88 zzThe Mandalorian G8, Greedo Greef G8",1
"Caleb",0,1,90300,Phoenix,"zHera zKanan zSabine zZeb zEzra",1
"Caleb",1,1,68148,Rogue1,"Jyn G8, Chirrut G8, Baze G8, Cassian G8, K-2SO G8",1
"Caleb",1,0,127664,zMaul,"zDarth Maul, zDooku zSidious zSavage Sith Marauder",1
"Caleb",1,0,118530,EP (Counter, Rebel),"zzEP zKrennic Wampa Stormtrooper G9, zStarck",1
"Caleb",1,0,19530,SionSolo (Counter),"zSion",1
"Caleb",,,260912,Malevolence,"Malevolence Hyena Bomber 4*, Vulture Droid 3*, Sun Fac SF, Soldier SF, Spy SF",0
"Caleb",1,1,141022,JTR,"zJTR zzR2-D2 zBB-8 zRH Finn, RH Poe",0
"Caleb",1,1,64927,NS,"MT G7, zzAV Daka G9, Zombie G1, Spirit G1",0
"Caleb",,,430730,Executrix,"Executrix Tie Adv, Emperor's Shuttle 6*, TIE Reaper 4*, Imperial TIE Fighter, Gauntlet Starfighter, FOSF TIE Fighter, FO TIE Fighter",0
"Caleb",,,62106,Mando,"zThe Mandalorian (Beskar Armor) G7, Dash Rendar 4* G7, Nest 6* G2, IG-11 G9, Kuiil G9",0
"Caleb",,,38317,Bad Batch,"Hunter G1, Echo G1, Omega G1, Tech G1, Wrecker G1",0
"Caleb",1,0,53591,Jawas,"Nebit G6, Jawa Engineer G5, Jawa Scavenger G6, Jawa G7, Dathcha G6",0
"Delmon Enz",,,168582,JMK,"zzzzzzJMK zJKA zGMY zzShaak Ti, zGK",1
"Delmon Enz",,,118319,Phasma,"zPhasma FOTP FOSFTP FOST zKylo",1
"Delmon Enz",1,1,153200,SL Kylo,"zzzzzzSL Kylo, zSith Trooper, zHux zzKRU zThrawn",1
"Delmon Enz",,,157628,SEE,"zzzzzzSEE zBSF zzMalak zzzDR zDooku",1
"Delmon Enz",1,1,116591,NS,"zzMT zzAV zDaka Zombie Spirit",1
"Delmon Enz",,,175007,JMLS,"zzzJKR zzJKL zzzzzzJMLS zWat Tambor, zzzzGAS",1
"Delmon Enz",1,0,145586,CLS,"zzzCLS zHan zzChewbacca zzC-3PO zChewpio",1
"Delmon Enz",,,495686,Negotiator,"Negotiator BTL-B Y-wing, Anakin's Eta-2, Rex's ARC-170, Umbaran SF, Ahsoka's SF, Plo's SF, Clone Sergeant's ARC-170",1
"Delmon Enz",,,423900,HansMF,"Home One, Han's MF, Rebel Y-wing, Bistan's U-wing, Phantom Biggs X-wing, Cassian's U-wing, Wedge X-wing",1
"Delmon Enz",0,1,99880,Geonosians,"zzGBA Sun Fac, Geo Soldier, Geo Spy, Poggle",1
"Delmon Enz",0,1,132185,Grievous,"zzGG zB2 zB1 MagnaGuard zNute",1
"Delmon Enz",1,0,116073,Traya,"zzTraya DN zSion zzEP Sith Empire Trooper",1
"Delmon Enz",1,1,120874,JTR,"zzJTR Scav Rey, zBB-8 zzR2-D2 Finn",1
"Delmon Enz",,,106155,Mon Mothma,"zzMon Mothma, Cara Dune, Wedge Chirrut Biggs",1
"Delmon Enz",1,1,85085,Ewoks,"zChirpa Elder Paploo Wicket Logray",1
"Delmon Enz",0,1,121082,BH,"zzBossk Jango Dengar G9, zZam Boba",1
"Delmon Enz",1,1,89701,Carth,"zCarth Onasi, Mission zZaalbar Juhani G8, Canderous",1
"Delmon Enz",1,0,137950,501st,"zRex zARC Trooper, zEcho (501st), zzFives zAhsoka",1
"Delmon Enz",1,0,118045,Troopers,"zVeers Starck zzPiett zGideon Range Trooper",1
"Delmon Enz",0,1,80941,Phoenix,"Hera Kanan Sabine Zeb Ezra",1
"Delmon Enz",,,131975,Bad Batch,"zHunter zEcho zzOmega zTech zWrecker",1
"Delmon Enz",1,0,81704,Jawas,"Nebit Jawa Engineer, Jawa Scavenger, Jawa Dathcha",1
"Delmon Enz",1,0,61018,QiraNest,"Qira Nest zzHYoda",1
"Delmon Enz",,,299686,Malevolence,"Malevolence Hyena Bomber, Vulture Droid 3*, Sun Fac SF, Soldier SF, Spy SF",0
"Delmon Enz",,,460796,Executrix,"Executrix Tie Adv, Emperor's Shuttle 5*, TIE Reaper 5*, Imperial TIE Fighter, Gauntlet Starfighter, FOSF TIE Fighter, FO TIE Fighter",0
"Will Shakespeare",,,173852,JMK,"zzzzzzJMK zAhsoka zzzCAT zzzzGAS zGK",1
"Will Shakespeare",,,142947,SK,"zzEP zzMara Jade, The Emperor's Hand, zzStarkiller zJuhani zVisas",1
"Will Shakespeare",,,451212,Profundity,"Profundity Han's MF, Outrider Rebel Y-wing, Cassian's U-wing, Ghost",1
"Will Shakespeare",,,168268,SEE,"zzzzzzSEE zBSF zzMalak zzzDR zzzVader",1
"Will Shakespeare",,,147162,Jabba,"zzzJabba zBoushh (Leia Organa), zSkiff Guard (Lando Calrissian), Krrsantan zBoba",1
"Will Shakespeare",,,586403,Executor,"Executor HT RC Xanadu Blood, Slave I, IG-2000 Imperial TIE Fighter, Tie Adv",1
"Will Shakespeare",1,0,162659,CLS,"zzzCLS zHan zzChewbacca zzC-3PO zChewpio",1
"Will Shakespeare",1,1,106644,NestSisters,"zzAV zzMT zDaka Zombie zNest",1
"Will Shakespeare",,,508511,Negotiator,"Negotiator BTL-B Y-wing, Anakin's Eta-2, Rex's ARC-170, Umbaran SF, Ahsoka's SF, Plo's SF, Clone Sergeant's ARC-170",1
"Will Shakespeare",,,309220,Malevolence,"Malevolence Hyena Bomber, Vulture Droid, Sun Fac SF, Soldier SF, Spy SF",1
"Will Shakespeare",,,146688,JKL,"zzJKL zzzJKR zzHYoda zzOld Ben, Aayla",1
"Will Shakespeare",1,1,119613,JTR,"zzzJTR zzR2-D2 zzBB-8 RH Finn G8, RH Poe G9",1
"Will Shakespeare",0,1,94538,Geonosians,"zzGBA Sun Fac, Geo Soldier, Geo Spy, Poggle",1
"Will Shakespeare",0,1,129921,Grievous,"zzGG zB2 zB1 zMagnaGuard zNute",1
"Will Shakespeare",1,0,109745,Traya,"zzTraya zDN zSion Sith Empire Trooper, zzThrawn",1
"Will Shakespeare",1,0,121697,Troopers,"zVeers zzPiett zzGideon zDark Trooper, Range Trooper",1
"Will Shakespeare",,,114509,Mon Mothma,"zzMon Mothma, zCara Dune, Wedge Bistan Biggs",1
"Will Shakespeare",1,1,96781,Ewoks,"zChirpa Elder zPaploo zWicket zLogray",1
"Will Shakespeare",1,0,139470,ShaakClones,"zzShaak Ti, zRex zEcho (501st), zzFives zARC Trooper",1
"Will Shakespeare",0,1,148610,BH,"zzBossk zAurra zzJango zDengar zFennec Shand",1
"Will Shakespeare",0,1,89841,FO,"zzKRU zKylo FOE FOO FOST G8",1
"Will Shakespeare",0,1,105403,Phoenix,"zHera zKanan zSabine zZeb zEzra",1
"Will Shakespeare",1,1,111835,Rogue1,"zzJyn Chirrut Baze G9, zCassian zK-2SO",1
"Will Shakespeare",,,114645,Bad Batch,"zHunter zEcho zzOmega zTech zWrecker",1
"Will Shakespeare",,,83988,Iden Troopers,"zIden Versio, Shoretrooper Snowtrooper Magma G7, DT",0
"Will Shakespeare",1,0,71335,Jawas,"Nebit G8, Jawa Engineer G7, Jawa Scavenger G8, Jawa Dathcha G8",0
"Baxterboz",,,171220,JMK,"zzzzzzJMK zAhsoka zzzCAT zzzzGAS zGK",1
"Baxterboz",,,116117,Phasma,"zPhasma FOE zSith Trooper, zzKRU zKylo",1
"Baxterboz",0,1,100234,Qira,"zQira zL3-37 zVandor Chewbacca, zMission zZaalbar",1
"Baxterboz",1,1,121726,NS,"zzMT zzAV zDaka Zombie Spirit",1
"Baxterboz",,,580215,Executor,"Executor 5* HT RC Xanadu Blood, Slave I, IG-2000 Imperial TIE Fighter, Tie Adv",1
"Baxterboz",,,160325,JMLS,"zBS zzzzzzJMLS zWat Tambor, zzJKL zJolee",1
"Baxterboz",1,0,161217,CLS,"zzzCLS zHan zzChewbacca zzC-3PO zChewpio",1
"Baxterboz",0,1,151454,DRMalak,"zzzDR zzHK-47 zBSF zzMalak Sith Empire Trooper",1
"Baxterboz",,,501442,Negotiator,"Negotiator BTL-B Y-wing, Anakin's Eta-2, Rex's ARC-170, Umbaran SF, Ahsoka's SF, Plo's SF, Clone Sergeant's ARC-170",1
"Baxterboz",,,336275,Malevolence,"Malevolence Hyena Bomber, Vulture Droid, Sun Fac SF, Soldier SF, Spy SF",1
"Baxterboz",,,463620,HansMF,"Home One, Han's MF, Rebel Y-wing, Bistan's U-wing, Phantom Ghost Cassian's U-wing, Wedge X-wing",1
"Baxterboz",1,1,130725,JTR,"zzzJTR zzR2-D2 zzBB-8 zRH Finn, zRH Poe",1
"Baxterboz",0,1,107500,Geonosians,"zzGBA Sun Fac, Geo Soldier, Geo Spy, Poggle",1
"Baxterboz",0,1,134840,Grievous,"zzGG zB2 zB1 zMagnaGuard zNute",1
"Baxterboz",1,0,137771,Traya,"zzTraya zDN zSion zzEP zzThrawn",1
"Baxterboz",1,0,127373,Troopers,"zVeers zzPiett zzGideon zDark Trooper, Range Trooper",1
"Baxterboz",,,143651,Disintegration,"zzAurra zzGreef zBoba zzBossk zzThe Mandalorian",1
"Baxterboz",,,108975,Mon Mothma,"zzMon Mothma, zCara Dune, Wedge Baze Biggs",1
"Baxterboz",1,1,97519,Ewoks,"zChirpa Elder zPaploo zWicket zLogray",1
"Baxterboz",1,0,149446,ShaakClones,"zzShaak Ti, zRex zEcho (501st), zzFives zARC Trooper",1
"Baxterboz",0,1,134841,BH,"zzJango zIG-88 zDengar Cad zNest",1
"Baxterboz",0,1,92917,Phoenix,"zHera zKanan G9, zSabine zZeb G9, zEzra",1
"Baxterboz",,,113991,Bad Batch,"zHunter zEcho zzOmega zTech zWrecker",1
"Baxterboz",1,0,93471,zMaul,"zDarth Maul, zDooku Sidious zSavage Sith Marauder",1
"Baxterboz",1,0,76987,Jawas,"Nebit Jawa Engineer, Jawa Scavenger G9, Jawa Dathcha G9",1
"Baxterboz",,,77141,Iden Troopers,"zIden Versio, Shoretrooper Snowtrooper G8, Magma G7, zDT G9",0
"JakeBum",,,174619,JMK,"zzzzzzJMK zAhsoka zzzCAT zzzzGAS zGK",1
"JakeBum",,,122982,Phasma,"zPhasma zFOTP FOSFTP zFOST zKylo",1
"JakeBum",1,1,143301,SL Kylo,"zzzzzzSL Kylo, zSith Trooper, zHux zzKRU Thrawn G9",1
"JakeBum",1,1,100023,NS,"zzMT zzAV zDaka Zombie Spirit",1
"JakeBum",,,576348,Executor,"Executor 5* HT RC Xanadu Blood, Slave I, IG-2000 Imperial TIE Fighter, Tie Adv",1
"JakeBum",0,1,135493,DRMalak,"zzzDR zHK-47 zBSF zzMalak Sith Empire Trooper",1
"JakeBum",,,507903,Negotiator,"Negotiator BTL-B Y-wing, Anakin's Eta-2, Rex's ARC-170, Umbaran SF, Ahsoka's SF, Plo's SF, Clone Sergeant's ARC-170",1
"JakeBum",,,322931,Malevolence,"Malevolence Hyena Bomber, Vulture Droid, Sun Fac SF, Soldier SF, Spy SF",1
"JakeBum",,,144536,JKL,"zzJKL zzzJKR zzHYoda zzOld Ben, Aayla",1
"JakeBum",,,423839,HansMF,"Home One, Han's MF, Rebel Y-wing, Bistan's U-wing, Phantom Ghost Cassian's U-wing, Biggs X-wing",1
"JakeBum",1,1,139937,JTR,"zzzJTR zzR2-D2 zzBB-8 zRH Finn, zRH Poe",1
"JakeBum",0,1,106474,Geonosians,"zzGBA Sun Fac, Geo Soldier, Geo Spy, Poggle",1
"JakeBum",0,1,128326,Grievous,"zzGG zB2 zB1 MagnaGuard zNute",1
"JakeBum",1,0,116380,Traya,"zzTraya zDN zSion zDooku zzEP",1
"JakeBum",,,112877,Mon Mothma,"zzMon Mothma, zCara Dune, Lando zCassian Biggs",1
"JakeBum",1,1,82098,Ewoks,"zChirpa Elder Paploo Wicket Logray",1
"JakeBum",1,0,151576,ShaakClones,"zzShaak Ti, zRex zEcho (501st), zzFives zARC Trooper",1
"JakeBum",0,1,146103,BH,"zzBossk zJango Dengar Cad zBoba",1
"JakeBum",1,1,96396,Carth,"zCarth Onasi, zMission zZaalbar Juhani zCanderous",1
"JakeBum",,,88335,Iden Troopers,"zIden Versio, Shoretrooper Snowtrooper Magma DT",1
"JakeBum",0,1,92591,Phoenix,"zHera Kanan Sabine Zeb zEzra",1
"JakeBum",1,0,19254,NestSolo (Counter),"zNest",1
"JakeBum",1,0,129245,CLS,"zzzCLS zHan zzChewbacca zzC-3PO zChewpio",0
"JakeBum",1,0,89395,Troopers,"Veers G9, zzPiett Gideon G9, zDark Trooper G7, Range Trooper G7",0
"JakeBum",1,1,73695,Rogue1,"zJyn Chirrut G6, Baze G6, Bistan G9, K-2SO G9",0
"JakeBum",,,88238,Bad Batch,"zHunter G9, zEcho zzOmega G9, zTech G9, zWrecker G9",0
"JakeBum",1,0,52516,Jawas,"Nebit G6, Jawa Engineer G4, Jawa Scavenger G4, Jawa 6* G4, Dathcha G6",0
"Jaycop",,,122521,Phasma,"zPhasma zFOTP FOSFTP zFOST zKylo",1
"Jaycop",1,1,154566,SL Kylo,"zzzzzzSL Kylo, zSith Trooper, zHux zzKRU zzThrawn",1
"Jaycop",1,0,143331,CLS,"zzzCLS zHan zzChewbacca zzC-3PO zChewpio",1
"Jaycop",1,1,100697,NS_Alt,"zzMT zzAV Zombie Talia zDaka",1
"Jaycop",,,389357,HansMF,"Home One, Han's MF, Rebel Y-wing, Bistan's U-wing, Phantom Ghost Cassian's U-wing, Wedge X-wing",1
"Jaycop",,,476917,Negotiator,"Negotiator HT Anakin's Eta-2, Umbaran SF, Ahsoka's SF, Clone Sergeant's ARC-170, Plo's SF, Rex's ARC-170",1
"Jaycop",0,1,92661,Geonosians,"zzGBA Sun Fac, Geo Soldier, Geo Spy, Poggle",1
"Jaycop",0,1,130632,Grievous-Wat,"zzGG zB2 zB1 zMagnaGuard zWat Tambor",1
"Jaycop",1,1,112477,JTR,"zzzJTR Scav Rey, zBB-8 zzR2-D2 zFinn",1
"Jaycop",1,1,134135,Revan,"zzzJKR BS zzGMY zJolee zGK",1
"Jaycop",1,1,88574,Ewoks,"zChirpa Elder Paploo Wicket Logray",1
"Jaycop",0,1,122281,BH,"zzBossk zJango Dengar Cad Boba",1
"Jaycop",1,1,94702,Carth,"Carth Onasi, zMission zZaalbar Juhani Canderous G8",1
"Jaycop",1,1,129941,zEP,"zzEP zzzVader Tarkin TFP zBSF",1
"Jaycop",0,1,76454,Phoenix,"Hera Kanan Sabine G8, Zeb G8, Ezra",1
"Jaycop",1,0,114869,Wampa (Counter),"zRex zzWampa DT G9, zzHYoda FOO",1
"Jaycop",1,0,116844,QGJ,"QGJ Aayla zJKA zzOld Ben, zAhsoka",1
"Jaycop",,,57836,Admiral Raddus,"Admiral Raddus 3* G7, Cassian G9, Jyn G7, K-2SO G6, Bistan G5",0
"Jaycop",,,284800,Malevolence,"Malevolence Hyena Bomber 5*, Vulture Droid 3*, Sun Fac SF, Soldier SF, Spy SF",0
"Jaycop",1,0,76382,Traya,"zzTraya DN G3, Sion G3, zDooku Nest G7",0
"Jaycop",,,398960,Executrix,"Executrix Tie Adv, Emperor's Shuttle 4*, TIE Reaper 3*, Imperial TIE Fighter, Gauntlet Starfighter, FOSF TIE Fighter, FO TIE Fighter",0
"Jaycop",,,86121,Mon Mothma,"zzMon Mothma 5*, Cara Dune G8, Lando Wedge Kyle Katarn G9",0
"Jaycop",1,0,83514,Troopers,"zVeers zStarck Piett G9, Snowtrooper zStormtrooper",0
"Jaycop",1,0,62579,Jawas,"Nebit G8, Jawa Engineer G8, Jawa Scavenger G7, Jawa G8, Dathcha G9",0
"Raminar",,,584801,Executor,"Executor 5* HT RC Xanadu Blood, Slave I, IG-2000 Tie Adv, TIE Reaper",1
"Raminar",1,0,144990,CLS,"zzzCLS zHan zzChewbacca zzC-3PO zChewpio",1
"Raminar",0,1,124806,DRMalak,"zzzDR zzHK-47 zBSF zzMalak Sith Empire Trooper",1
"Raminar",0,1,118353,padme,"zzPadme zGK zJKA zAhsoka CW Chewbacca G8",1
"Raminar",,,463661,Negotiator,"Negotiator BTL-B Y-wing, Anakin's Eta-2, Rex's ARC-170, Umbaran SF, Ahsoka's SF, Plo's SF, Clone Sergeant's ARC-170",1
"Raminar",1,1,98122,NS_Alt,"zzMT zAV Zombie Talia zDaka",1
"Raminar",,,473870,HansMF,"Home One, Han's MF, Biggs X-wing, Bistan's U-wing, Phantom Ghost Cassian's U-wing, Wedge X-wing",1
"Raminar",0,1,93645,Geonosians,"zzGBA Sun Fac, Geo Soldier, Geo Spy, Poggle",1
"Raminar",0,1,123594,Grievous,"zzGG zB2 zB1 zMagnaGuard zNute",1
"Raminar",1,0,120512,Traya,"zzTraya zzDN zSion zzEP zThrawn",1
"Raminar",1,1,102463,JTR,"zzJTR Scav Rey, zBB-8 zzR2-D2 RT",1
"Raminar",1,0,129413,Troopers,"zVeers zzPiett zzGideon zDark Trooper, Range Trooper",1
"Raminar",,,135640,Disintegration,"zzAurra zzGreef zBoba zzBossk zzThe Mandalorian G9",1
"Raminar",1,1,135589,GAS,"zzzzGAS zRex zEcho (501st), zzFives zARC Trooper",1
"Raminar",1,1,136527,Revan Offense,"zzzJKR zzGMY zBS zJolee zzHYoda",1
"Raminar",1,1,90449,Ewoks,"zChirpa Elder zPaploo zWicket zLogray",1
"Raminar",1,1,92058,Carth,"zCarth Onasi, Mission Zaalbar Juhani zCanderous",1
"Raminar",0,1,134850,BH,"zzJango zDengar zBoushh (Leia Organa), zGreedo zKrrsantan",1
"Raminar",0,1,102099,Phoenix,"zHera zKanan zSabine zZeb zEzra",1
"Raminar",0,1,101165,FO,"zzKRU zKylo FOE Phasma zFOTP",1
"Raminar",1,1,110020,Rogue1,"zzJyn Chirrut Baze zCassian zK-2SO",1
"Raminar",1,0,80008,Jawas,"Nebit Jawa Engineer, Jawa Scavenger G9, Jawa Dathcha",1
"Raminar",1,0,15559,NestSolo (Counter),"Nest",1
"Raminar",,,83798,Mon Mothma,"Mon Mothma G9, Wedge Scarif Bistan Biggs",0
"Six",,,166418,SEE,"zzzzzzSEE zBSF zzMalak zzzDR zzzVader",1
"Six",1,1,96743,NS,"zzMT zzAV zDaka Zombie Spirit",1
"Six",,,556061,Executor,"Executor HT RC Xanadu Blood, Slave I, IG-2000 Imperial TIE Fighter, Tie Adv",1
"Six",0,1,136991,padme,"zzPadme zGK zJKA zAhsoka zzCAT",1
"Six",1,0,129357,CLS,"zzCLS zHan zChewbacca zC-3PO zChewpio",1
"Six",,,408876,Negotiator,"Negotiator BTL-B Y-wing, Anakin's Eta-2, Rex's ARC-170, Umbaran SF, Ahsoka's SF, Plo's SF, Clone Sergeant's ARC-170",1
"Six",,,396026,HansMF,"Home One, Han's MF, Rebel Y-wing, Bistan's U-wing, Phantom Ghost Cassian's U-wing, Biggs X-wing",1
"Six",0,1,98585,Geonosians,"zGBA Sun Fac, Geo Soldier, Geo Spy, Poggle",1
"Six",1,1,97422,JTR,"zJTR zzR2-D2 zBB-8 zRH Finn G9, zRH Poe G9",1
"Six",1,0,129299,Traya,"zzTraya DN zSion Sith Empire Trooper, zThrawn",1
"Six",0,1,119749,Grievous,"zzGG zB2 zB1 MagnaGuard zNute",1
"Six",1,1,141908,GAS,"zzzzGAS zRex Echo (501st), zzFives zARC Trooper",1
"Six",1,1,121409,Revan Offense,"zzzJKR zGMY zBS zJolee zHYoda",1
"Six",1,1,79478,Ewoks,"zChirpa G9, Elder Paploo zWicket Logray G9",1
"Six",1,1,91519,Carth,"zCarth Onasi, zMission zZaalbar zVandor Chewbacca, Canderous",1
"Six",0,1,132855,BH,"zBossk IG-88 zzJango Dengar Boba",1
"Six",0,1,79557,FO,"zKRU Kylo zHux FOE G9, FOO G9",1
"Six",0,1,73586,Phoenix,"Hera G9, Kanan G9, Sabine G9, Zeb G9, Ezra",1
"Six",1,1,76000,Rogue1,"Jyn Chirrut G9, Baze G9, Cassian G9, K-2SO G9",1
"Six",1,0,104291,EP (Counter, Rebel),"zEP Shoretrooper G9, Krennic DT G9, zWampa",1
"Six",1,0,23883,NestSolo (Counter),"zNest",1
"Six",,,93599,Mon Mothma,"zMon Mothma, Lando Scarif Kyle Katarn, Biggs",0
"Six",1,0,114657,Troopers,"zVeers zStarck zDark Trooper, zzPiett Iden Versio G9",0
"Crusader5454",,,170061,JMK,"zzzzzzJMK zAhsoka zzzCAT zzzzGAS zGK",1
"Crusader5454",,,565642,Executor,"Executor 5* HT RC Xanadu Blood, Slave I, IG-2000 Gauntlet Starfighter, Tie Adv",1
"Crusader5454",,,521587,Negotiator,"Negotiator BTL-B Y-wing, Anakin's Eta-2, Rex's ARC-170, Umbaran SF, Ahsoka's SF, Plo's SF, Clone Sergeant's ARC-170",1
"Crusader5454",1,1,101156,NS_Alt,"zzMT zzAV Zombie Talia zDaka",1
"Crusader5454",,,346018,HansMF,"Home One, Han's MF, Biggs X-wing, Bistan's U-wing, Phantom Ghost Cassian's U-wing, Wedge X-wing",1
"Crusader5454",0,1,99589,Geonosians,"zzGBA Sun Fac, Geo Soldier, Geo Spy, Poggle",1
"Crusader5454",0,1,133070,Grievous,"zzGG zB2 zB1 zMagnaGuard zNute",1
"Crusader5454",1,0,127212,Traya,"zzTraya zDN zSion Sith Empire Trooper, zzThrawn",1
"Crusader5454",1,0,118487,CLS,"zzzCLS zHan zChewbacca zR2-D2 zzC-3PO",1
"Crusader5454",1,0,142758,Troopers,"zVeers zzPiett zzGideon zDark Trooper, Range Trooper",1
"Crusader5454",1,1,140748,Revan Offense,"zzzJKR zGMY zzHYoda zJolee zJKA",1
"Crusader5454",1,0,155602,ShaakClones,"zzShaak Ti, zRex zEcho (501st), zzFives zARC Trooper",1
"Crusader5454",1,1,87523,Ewoks,"zChirpa Elder zPaploo Scout Logray",1
"Crusader5454",0,1,146019,BH,"zzBossk zJango Dengar zZam Boba",1
"Crusader5454",1,1,145209,zEP,"zzEP zzzVader zTarkin TFP zzMara Jade, The Emperor's Hand",1
"Crusader5454",,,104397,Iden Troopers,"zIden Versio, Shoretrooper Snowtrooper Magma G9, zDT",1
"Crusader5454",0,1,70084,Phoenix,"Hera G8, Kanan G8, Chopper G9, Zeb G8, Ezra G8",1
"Crusader5454",,,132068,Bad Batch,"zHunter zEcho zzOmega zTech zWrecker",1
"Crusader5454",1,0,137774,zMaul,"zDarth Maul, zBSF zDooku zSidious Sith Marauder",1
"Crusader5454",1,0,75392,Jawas,"Nebit G8, Jawa Engineer G9, Jawa Scavenger, Jawa G9, Dathcha",1
"Crusader5454",,,75221,Phasma,"Phasma G8, FOE FOSFTP G9, zKRU G9, Kylo",0
"Crusader5454",,,296616,Malevolence,"Malevolence Hyena Bomber 4*, Vulture Droid 6*, Sun Fac SF, Soldier SF, Spy SF",0
"Crusader5454",,,79793,Mando,"zzThe Mandalorian (Beskar Armor), Dash Rendar 4* G5, zNest G7, zIG-11 G8, Kuiil G8",0
"The Dude",,,169534,JMK,"zzzzzzJMK zJKA zzGMY zzShaak Ti, zGK",1
"The Dude",,,96931,Phasma,"zPhasma G9, FOE FOO zzKRU zKylo",1
"The Dude",,,156029,SEE,"zzzzzzSEE zBSF zzMalak zzzDR zDooku",1
"The Dude",1,1,161957,GL Rey,"zzzzzzRey zzzJTR zzBB-8 zRH Poe, zRH Finn",1
"The Dude",,,176878,JMLS,"zzzJKR zzJKL zzzzzzJMLS zWat Tambor, zzzzGAS",1
"The Dude",1,0,146367,CLS,"zzzCLS zHan zzChewbacca zzC-3PO zChewpio",1
"The Dude",1,1,104942,NS_Alt,"zzMT zzAV Zombie Talia zDaka",1
"The Dude",,,422375,HansMF,"Home One, Han's MF, Rebel Y-wing 6*, Bistan's U-wing, Phantom Biggs X-wing, Cassian's U-wing, Wedge X-wing",1
"The Dude",,,525264,Negotiator,"Negotiator HT Anakin's Eta-2, Umbaran SF, Ahsoka's SF, Clone Sergeant's ARC-170, Plo's SF, Rex's ARC-170",1
"The Dude",0,1,101650,Geonosians,"zzGBA Sun Fac, Geo Soldier, Geo Spy, Poggle",1
"The Dude",0,1,140068,Grievous,"zzGG zB2 zB1 zMagnaGuard zNute",1
"The Dude",1,0,122719,Traya,"zzTraya zzDN zSion Sith Empire Trooper, zzThrawn",1
"The Dude",1,0,129023,Troopers,"zVeers zzPiett zzGideon zDark Trooper, Range Trooper",1
"The Dude",,,120440,Disintegration,"Aurra zzGreef G9, zBoba zzBossk zzThe Mandalorian G8",1
"The Dude",,,113267,Mon Mothma,"zzMon Mothma, zCara Dune, Lando Wedge Biggs",1
"The Dude",1,1,98959,Ewoks,"zChirpa Elder zPaploo zWicket zLogray",1
"The Dude",1,1,88914,Carth,"Carth Onasi, Mission Zaalbar Juhani Canderous",1
"The Dude",1,1,138852,zEP,"zzEP zzzVader Tarkin Krennic TFP",1
"The Dude",1,0,141723,501st,"zRex zARC Trooper, zEcho (501st), zzFives zAhsoka",1
"The Dude",0,1,83221,Phoenix,"zHera G9, zKanan G9, zSabine G8, Zeb G9, Ezra",1
"The Dude",1,0,75917,Jawas,"Nebit G9, Jawa Engineer G9, Jawa Scavenger, Jawa Dathcha G8",1
"The Dude",,,68531,Admiral Raddus,"Admiral Raddus 3* G8, Cassian G8, Jyn G8, K-2SO G9, Chirrut G8",0
"The Dude",,,72667,Iden Troopers,"Iden Versio 4* G7, Shoretrooper Snowtrooper Magma G9, DT",0
"The Dude",0,1,137413,BH,"zJango IG-88 zDengar Cad zZam",0
"The Dude",,,118270,Bad Batch,"zHunter zEcho zzOmega G9, zTech zWrecker",0
"The Dude",,,69874,Mando,"The Mandalorian (Beskar Armor) G8, Dash Rendar 4* G8, Nest G7, IG-11 G8, zKuiil G9",0
"Papadapalous",,,174883,JMK,"zzzzzzJMK zAhsoka zzzCAT zzzzGAS zGK",1
"Papadapalous",,,173008,LV,"zzzzzzLord Vader, zzPiett zzzVader zRG zNinth Sister",1
"Papadapalous",,,163223,SEE,"zzzzzzSEE zBSF zzMalak zzzDR zDooku",1
"Papadapalous",1,1,101374,NS,"zzMT zzAV zDaka Zombie Spirit",1
"Papadapalous",,,577423,Executor,"Executor HT RC Xanadu Blood, Slave I, IG-2000 Imperial TIE Fighter, Tie Adv",1
"Papadapalous",1,0,151441,CLS,"zzzCLS zHan zzChewbacca zzC-3PO zChewpio",1
"Papadapalous",,,506295,Negotiator,"Negotiator BTL-B Y-wing, Anakin's Eta-2, Rex's ARC-170, Umbaran SF, Ahsoka's SF, Plo's SF, Clone Sergeant's ARC-170",1
"Papadapalous",,,323283,Malevolence,"Malevolence Hyena Bomber, Vulture Droid, Sun Fac SF, Soldier SF, Spy SF",1
"Papadapalous",,,408019,HansMF,"Home One, Han's MF, Biggs X-wing, Bistan's U-wing, Phantom Ghost Cassian's U-wing, Wedge X-wing",1
"Papadapalous",0,1,105797,Geonosians,"zzGBA Sun Fac, Geo Soldier, Geo Spy, Poggle",1
"Papadapalous",0,1,133152,Grievous,"zzGG zB2 zB1 MagnaGuard zNute",1
"Papadapalous",1,0,124784,Traya,"zzTraya zDN zSion Sith Empire Trooper, zThrawn",1
"Papadapalous",,,133137,Disintegration,"Aurra zGreef zBoba zzBossk zzThe Mandalorian",1
"Papadapalous",1,1,149507,Revan Offense,"zzzJKR zzGMY zzHYoda zJolee zJKA",1
"Papadapalous",1,1,88324,Ewoks,"zChirpa Elder Paploo Wicket zLogray",1
"Papadapalous",1,0,147002,ShaakClones,"zzShaak Ti, zRex zEcho (501st), zzFives zARC Trooper",1
"Papadapalous",1,1,98317,Carth,"zCarth Onasi, zMission zZaalbar Juhani Canderous",1
"Papadapalous",1,0,127736,Troopers,"zVeers zStarck zDark Trooper, zzGideon Range Trooper",1
"Papadapalous",0,1,98656,FO,"zzKRU zKylo zHux FOE FOO",1
"Papadapalous",,,96718,Iden Troopers,"zIden Versio, zStormtrooper Snowtrooper Magma DT",1
"Papadapalous",0,1,87529,Phoenix,"Hera Kanan zSabine Zeb G8, zEzra",1
"Papadapalous",,,131821,Bad Batch,"zHunter zEcho zzOmega zTech zWrecker",1
"Papadapalous",1,0,128667,EP (Counter, Rebel),"zzEP Shoretrooper Krennic zzWampa zNest",1
"Papadapalous",1,0,77457,Jawas,"Nebit G8, Jawa Engineer G8, Jawa Scavenger G8, Jawa Dathcha G9",1
"Papadapalous",,,81427,Admiral Raddus,"zAdmiral Raddus 6*, zCassian Jyn Baze G8, Chirrut 6* G8",0
"Papadapalous",,,80828,Mon Mothma,"Mon Mothma G9, Lando Wedge K-2SO G8, Kyle Katarn G9",0
"Papadapalous",0,1,145351,BH,"zJango zDengar zZam Fennec Shand, zGreedo",0
"SWfan114",,,171035,JMK,"zzzzzzJMK zJKA zzGMY zzShaak Ti, zGK",1
"SWfan114",,,156855,SEE,"zzzzzzSEE zBSF zzMalak zzzDR zzzVader",1
"SWfan114",1,1,95372,NS,"zMT zAV Daka Zombie Spirit",1
"SWfan114",,,560868,Executor,"Executor 5* HT RC Xanadu Blood, Slave I, IG-2000 Imperial TIE Fighter, Tie Adv",1
"SWfan114",,,173363,JMLS,"zzzJKR zzJKL zzzzzzJMLS zWat Tambor, zzzzGAS",1
"SWfan114",1,0,146371,CLS,"zzzCLS zHan zzChewbacca zzC-3PO zChewpio",1
"SWfan114",,,499980,Negotiator,"Negotiator BTL-B Y-wing 6*, Anakin's Eta-2, Rex's ARC-170, Umbaran SF, Ahsoka's SF, Plo's SF, Clone Sergeant's ARC-170",1
