Player,Offense,Defense,GP,Name,Squad,Viable
"Tad",,,166594,JMK,"zzzzzzJMK zJKA zzGMY zzShaak Ti, zGK",1
"Tad",1,1,160690,GL Rey,"zzzzzzRey zzzJTR zzBB-8 zHoldo zRH Finn",1
"Tad",1,1,106224,NS,"zzMT zzAV zDaka Zombie Spirit",1
"Tad",,,172884,JMLS,"zzzJKR zzJKL zzzzzzJMLS zWat Tambor, zzzzGAS",1
"Tad",1,0,150175,CLS,"zzzCLS zHan zzChewbacca zzC-3PO zChewpio",1
"Tad",0,1,124681,DRMalak,"zzzDR zzHK-47 zBSF zzMalak Sith Empire Trooper G9",1
"Tad",,,487397,Negotiator,"Negotiator HT Anakin's Eta-2, Umbaran SF, Ahsoka's SF, BTL-B Y-wing, Clone Sergeant's ARC-170, Plo's SF",1
"Tad",,,310187,Malevolence,"Malevolence Hyena Bomber, Vulture Droid, Sun Fac SF, Soldier SF, Spy SF",1
"Tad",,,425043,HansMF,"Home One, Han's MF, Rebel Y-wing, Bistan's U-wing, Phantom Biggs X-wing, Cassian's U-wing, Wedge X-wing",1
"Tad",0,1,94531,Geonosians,"zzGBA Sun Fac, Geo Soldier, Geo Spy, Poggle",1
"Tad",0,1,132236,Grievous,"zzGG zB2 zB1 zMagnaGuard zNute",1
"Tad",1,0,97388,Traya,"zzTraya DN Sion G9, zDooku Thrawn",1
"Tad",,,428263,Executrix,"Executrix Tie Adv, Emperor's Shuttle, TIE Reaper, Imperial TIE Fighter, Gauntlet Starfighter, FOSF TIE Fighter, FO TIE Fighter",1
"Tad",,,104235,Mon Mothma,"zzMon Mothma, Wedge Biggs Chirrut Baze",1
"Tad",1,1,93114,Ewoks,"zChirpa Elder zPaploo zWicket zLogray",1
"Tad",0,1,135158,BH,"zzBossk zBoba Cad zDengar zzJango",1
"Tad",1,1,98439,Carth,"zCarth Onasi, zMission zZaalbar Juhani zCanderous",1
"Tad",1,1,118233,zEP,"zzEP zzzVader zzTarkin zIPD TFP",1
"Tad",1,0,119172,501st,"zRex zARC Trooper, zEcho (501st), zzFives zAhsoka",1
"Tad",0,1,93907,FO,"zzKRU zKylo FOE FOO FOST",1
"Tad",1,0,107345,Troopers,"zVeers zStarck zDark Trooper, zzGideon zzPiett",1
"Tad",0,1,76603,Phoenix,"Hera Sabine G8, zEzra Zeb G9, Kanan G8",1
"Tad",,,111579,Bad Batch,"zHunter zEcho zzOmega zTech zWrecker",1
"Tad",1,0,92970,QiraNest,"Qira zNest Vandor Chewbacca, L3-37 G8, zzHYoda",1
"Tad",1,0,77061,Jawas,"Nebit G8, Jawa Engineer, Jawa Scavenger G9, Jawa Dathcha",1
"Tad",,,72049,Admiral Raddus,"Admiral Raddus 5* G9, Cassian Jyn K-2SO G9, Bistan G8",0
"Tad",,,67113,Iden Troopers,"Iden Versio G8, Shoretrooper Snowtrooper G8, Magma G8, DT G7",0
"Crazaig",,,123557,Phasma,"zPhasma zFOTP FOSFTP zFOST zKylo",1
"Crazaig",1,1,161192,SL Kylo,"zzzzzzSL Kylo, zSith Trooper, zHux zzKRU zzThrawn",1
"Crazaig",,,170137,SEE,"zzzzzzSEE zBSF zzMalak zzzDR zzzVader",1
"Crazaig",1,1,164289,GL Rey,"zzzzzzRey zzzJTR zzBB-8 zHoldo zRH Finn",1
"Crazaig",1,1,109365,NS,"zzMT zzAV zDaka Zombie Spirit",1
"Crazaig",,,173239,JMLS,"zzzJKR zzJKL zzzzzzJMLS zWat Tambor, zzzzGAS",1
"Crazaig",1,0,153684,CLS,"zzzCLS zHan zzChewbacca zzC-3PO zChewpio",1
"Crazaig",0,1,124249,padme,"zzPadme zGK zJKA zAhsoka CW Chewbacca G8",1
"Crazaig",,,477097,Negotiator,"Negotiator HT Anakin's Eta-2, Umbaran SF, Ahsoka's SF, BTL-B Y-wing, Clone Sergeant's ARC-170, Plo's SF",1
"Crazaig",,,441802,HansMF,"Home One, Han's MF, Rebel Y-wing, Bistan's U-wing, Phantom Ghost Cassian's U-wing, Wedge X-wing",1
"Crazaig",0,1,105204,Geonosians,"zzGBA Sun Fac, Geo Soldier, Geo Spy, Poggle",1
"Crazaig",0,1,118570,Grievous,"zzGG zB2 zB1 zMagnaGuard zNute",1
"Crazaig",1,0,128517,Traya,"zzTraya zDN zSion zzEP Sith Empire Trooper",1
"Crazaig",,,120790,Disintegration,"zAurra zzGreef zBoba zzBossk zzThe Mandalorian G8",1
"Crazaig",,,113387,Mon Mothma,"zzMon Mothma, zCara Dune, Wedge Biggs Lando",1
"Crazaig",1,1,97345,Ewoks,"zChirpa Elder zPaploo zWicket zLogray",1
"Crazaig",1,0,138207,ShaakClones,"zzShaak Ti, zRex zEcho (501st), zzFives zARC Trooper",1
"Crazaig",1,1,99493,Carth,"zCarth Onasi, zMission zZaalbar zJuhani zCanderous",1
"Crazaig",1,0,111587,Troopers,"zVeers zStarck Magma zDT zzPiett",1
"Crazaig",1,0,126978,zMaul,"zDarth Maul, zSidious zDooku Sith Marauder, zNest",1
"Crazaig",0,1,91543,Phoenix,"zHera zSabine G8, zEzra zZeb G8, zKanan",1
"Crazaig",0,1,128401,BS,"zBS zzGMY zJolee zzOld Ben, zzHYoda",1
"Crazaig",1,0,73723,Jawas,"Nebit G8, Jawa Engineer G9, Jawa Scavenger G8, Jawa Dathcha G8",1
"Crazaig",,,71187,Admiral Raddus,"Admiral Raddus 5* G4, zCassian G9, Jyn G8, zK-2SO G9, Chirrut G8",0
"Crazaig",,,293358,Malevolence,"Malevolence Hyena Bomber, Vulture Droid 4*, Sun Fac SF, Soldier SF, Spy SF",0
"Crazaig",,,475427,Executrix,"Executrix Tie Adv, Emperor's Shuttle 5*, TIE Reaper, Imperial TIE Fighter, Gauntlet Starfighter, FOSF TIE Fighter, FO TIE Fighter",0
"Crazaig",0,1,103919,BH,"zJango zIG-88 Cad zDengar zGreedo",0
"Crazaig",,,50345,Bad Batch,"Hunter 6* G5, Echo 6* G4, Omega G6, Tech 6* G4, Wrecker G5",0
"Obi Bonz Kenobie",,,170577,JMK,"zzzzzzJMK zAhsoka zzzCAT zzzzGAS zGK",1
"Obi Bonz Kenobie",,,138089,Phasma,"zPhasma zFOTP FOSFTP zFOST zKylo",1
"Obi Bonz Kenobie",1,1,151517,SL Kylo,"zzzzzzSL Kylo, zSith Trooper, zHux zzKRU Thrawn G9",1
"Obi Bonz Kenobie",,,169818,Jabba,"zzzzzzJabba zBoushh (Leia Organa), zSkiff Guard (Lando Calrissian), zKrrsantan zBoba",1
"Obi Bonz Kenobie",1,1,102010,NS,"zzMT zzAV zDaka Zombie Spirit",1
"Obi Bonz Kenobie",,,556672,Executor,"Executor 5* HT RC Xanadu Blood, Slave I, IG-2000 Imperial TIE Fighter, Tie Adv",1
"Obi Bonz Kenobie",1,0,152669,CLS,"zzzCLS zHan zzChewbacca zzC-3PO zChewpio",1
"Obi Bonz Kenobie",0,1,127031,DRMalak,"zzzDR zHK-47 zBSF zzMalak Sith Assassin",1
"Obi Bonz Kenobie",,,148558,JKL,"zzJKL zzzJKR zzHYoda zzOld Ben, zBarriss",1
"Obi Bonz Kenobie",,,432365,HansMF,"Home One, Han's MF, Rebel Y-wing 6*, Bistan's U-wing, Phantom Ghost Cassian's U-wing, Wedge X-wing",1
"Obi Bonz Kenobie",0,1,114590,Geonosians,"zzGBA Sun Fac, Geo Soldier, Geo Spy, Poggle",1
"Obi Bonz Kenobie",0,1,137031,Grievous,"zzGG zB2 zB1 zMagnaGuard zNute",1
"Obi Bonz Kenobie",,,115546,Mon Mothma,"zzMon Mothma, Wedge zzJyn Biggs Lando",1
"Obi Bonz Kenobie",1,1,91578,Ewoks,"zChirpa Elder Paploo zWicket zLogray",1
"Obi Bonz Kenobie",1,0,140478,ShaakClones,"zzShaak Ti, zRex zEcho (501st), zzFives zARC Trooper",1
"Obi Bonz Kenobie",1,1,92998,Carth,"zCarth Onasi, zMission zZaalbar zJuhani Canderous",1
"Obi Bonz Kenobie",0,1,150345,BH,"zzBossk zFennec Shand, zDengar zGreedo zzJango",1
"Obi Bonz Kenobie",0,1,89035,Phoenix,"zHera zSabine zEzra zZeb G8, zKanan",1
"Obi Bonz Kenobie",1,0,116561,EP (Counter, Rebel),"zzEP Shoretrooper G8, zDT zzWampa zStormtrooper",1
"Obi Bonz Kenobie",1,0,86835,Jawas,"Nebit Jawa Engineer, Jawa Scavenger, Jawa Dathcha",1
"Obi Bonz Kenobie",1,0,18594,NestSolo (Counter),"zNest",1
"Obi Bonz Kenobie",1,0,12195,SionSolo (Counter),"Sion G8",1
"Obi Bonz Kenobie",,,494629,Negotiator,"Negotiator BTL-B Y-wing 5*, Anakin's Eta-2, Rex's ARC-170, Umbaran SF, Ahsoka's SF, Plo's SF, Clone Sergeant's ARC-170",0
"Obi Bonz Kenobie",1,1,103610,JTR,"JTR zScav Rey G8, BB-8 G8, zzR2-D2 zFinn G8",0
"Obi Bonz Kenobie",1,0,111143,Troopers,"zVeers zzPiett zzGideon zDark Trooper, Range Trooper 6* G6",0
"Obi Bonz Kenobie",,,108925,Bad Batch,"zHunter zEcho zzOmega zTech zWrecker G8",0
"Cruzman",,,172078,SEE,"zzzzzzSEE zBSF zzMalak zzzDR zzzVader",1
"Cruzman",0,1,147918,padme,"zzPadme zGK zJKA zAhsoka zzzCAT",1
"Cruzman",,,180989,JMLS,"zzzJKR zzJKL zzzzzzJMLS zWat Tambor, zzzzGAS",1
"Cruzman",1,0,148040,CLS,"zzzCLS zHan zzChewbacca zzC-3PO zChewpio",1
"Cruzman",1,1,106392,NS_Alt,"zzMT zzAV Talia zDaka Zombie",1
"Cruzman",,,380608,HansMF,"Home One, Han's MF, Rebel Y-wing 6*, Bistan's U-wing, Phantom Ghost Cassian's U-wing, Wedge X-wing",1
"Cruzman",,,525982,Negotiator,"Negotiator HT Anakin's Eta-2, Umbaran SF, Ahsoka's SF, Clone Sergeant's ARC-170, Plo's SF, Rex's ARC-170",1
"Cruzman",0,1,125720,Grievous,"zzGG zB2 zB1 zMagnaGuard zNute",1
"Cruzman",1,0,122602,Traya,"zzTraya zzDN zSion Sith Empire Trooper, zzThrawn",1
"Cruzman",1,1,132157,JTR,"zzzJTR zScav Rey, zzBB-8 zzR2-D2 zFinn",1
"Cruzman",1,1,86927,Ewoks,"zChirpa Elder Paploo Wicket Logray",1
"Cruzman",1,0,139617,ShaakClones,"zzShaak Ti, zRex zEcho (501st), zzFives zARC Trooper",1
"Cruzman",0,1,126673,BH,"zzBossk zBoba zDengar zGreedo zzJango",1
"Cruzman",1,1,91329,Carth,"zCarth Onasi, zMission Zaalbar Juhani Canderous",1
"Cruzman",0,1,87217,Phoenix,"zHera Sabine G8, zEzra Zeb G8, zKanan",1
"Cruzman",1,0,130419,zMaul,"zDarth Maul, zDooku zSidious zSavage Sith Marauder",1
"Cruzman",0,1,139813,BS,"zBS zzGMY zJolee zzOld Ben, zzHYoda",1
"Cruzman",,,86144,Phasma,"zPhasma FOTP 6* G7, FOO zzKRU zKylo",0
"Cruzman",0,1,75336,Geonosians,"zzGBA 4* G7, Sun Fac G8, Geo Soldier G9, Geo Spy G9, Poggle",0
"Cruzman",,,105370,Mon Mothma,"zzMon Mothma, Cara Dune 6* G9, Wedge Biggs Lando",0
"Cruzman",1,0,95209,Troopers,"Veers Starck Snowtrooper G8, Magma G4, zzPiett",0
"Cruzman",,,86782,Bad Batch,"zHunter zEcho zzOmega G9, zTech 6* G8, zWrecker 6* G8",0
"Hashslingingslasher",,,164002,JMK,"zzzzzzJMK zJKA zGMY zzShaak Ti, zGK",1
"Hashslingingslasher",1,1,157117,SL Kylo,"zzzzzzSL Kylo, zSith Trooper, zHux zzKRU zzThrawn",1
"Hashslingingslasher",,,171497,SEE,"zzzzzzSEE zBSF zzMalak zzzDR zzzVader",1
"Hashslingingslasher",1,1,156960,GL Rey,"zzzzzzRey zzzJTR zBB-8 zRH Poe, zRH Finn",1
"Hashslingingslasher",1,1,101864,NS,"zzMT zzAV zDaka Zombie Spirit",1
"Hashslingingslasher",1,0,125962,CLS,"zzzCLS zHan zzChewbacca zzC-3PO Chewpio",1
"Hashslingingslasher",,,380160,HansMF,"Home One, Han's MF, Rebel Y-wing, Bistan's U-wing, Phantom Ghost Cassian's U-wing, Wedge X-wing",1
"Hashslingingslasher",,,512738,Negotiator,"Negotiator HT Anakin's Eta-2, Umbaran SF, Ahsoka's SF, Clone Sergeant's ARC-170, Plo's SF, Rex's ARC-170",1
"Hashslingingslasher",0,1,94094,Geonosians,"zzGBA Sun Fac, Geo Soldier, Geo Spy, Poggle",1
"Hashslingingslasher",0,1,121305,Grievous,"zzGG zB2 zB1 MagnaGuard zNute",1
"Hashslingingslasher",1,0,114046,Traya,"zzTraya zDN zSion zzEP Sith Empire Trooper",1
"Hashslingingslasher",1,1,128843,GAS,"zzzzGAS zRex zEcho (501st), zzFives zARC Trooper",1
"Hashslingingslasher",1,1,87609,Ewoks,"zChirpa Elder Paploo zWicket Logray",1
"Hashslingingslasher",0,1,126360,BH,"zzBossk Boba Cad Dengar zJango",1
"Hashslingingslasher",1,1,89710,Carth,"Carth Onasi, zMission zZaalbar Juhani Canderous",1
"Hashslingingslasher",0,1,77145,Phoenix,"Hera Sabine G9, Ezra Zeb Kanan",1
"Hashslingingslasher",1,0,14182,NestSolo (Counter),"Nest G9",1
"Hashslingingslasher",,,118448,Phasma,"Phasma zFOTP FOSFTP FOST zKylo",0
"Hashslingingslasher",,,121713,JKL,"zzJKL zzzJKR zHYoda zOld Ben, Aayla",0
"Hashslingingslasher",1,0,98256,Troopers,"Veers zzPiett zGideon 4* G9, zDark Trooper, Range Trooper",0
"Hashslingingslasher",,,72962,Mon Mothma,"Mon Mothma 5* G8, Wedge Jyn G8, Lando Chirrut G8",0
"Hashslingingslasher",,,60113,Iden Troopers,"Iden Versio 3* G6, Stormtrooper Snowtrooper G8, Magma G7, DT G8",0
"Hashslingingslasher",,,57155,Bad Batch,"zHunter G8, Echo 5* G7, Omega 5* G7, zTech G7, Wrecker 4* G9",0
"Hashslingingslasher",1,0,57686,Jawas,"Nebit G6, Jawa Engineer G6, Jawa Scavenger G7, Jawa G6, Dathcha G6",0
"gucci mane",,,170787,JMK,"zzzzzzJMK zAhsoka zzzCAT zzzzGAS zGK",1
"gucci mane",,,116961,Phasma,"zPhasma zFOTP FOSFTP zFOST zKylo",1
"gucci mane",,,164768,SEE,"zzzzzzSEE zBSF zzMalak zzzDR zzzVader",1
"gucci mane",,,520794,Negotiator,"Negotiator HT Anakin's Eta-2, Umbaran SF, Ahsoka's SF, BTL-B Y-wing, Clone Sergeant's ARC-170, Plo's SF",1
"gucci mane",,,374301,HansMF,"Home One, Han's MF, Biggs X-wing, Bistan's U-wing, Phantom Ghost Cassian's U-wing, Wedge X-wing",1
"gucci mane",0,1,111265,Geonosians,"zzGBA Sun Fac, Geo Soldier, Geo Spy, Poggle",1
"gucci mane",0,1,127545,Grievous,"zzGG zB2 zB1 zMagnaGuard zNute",1
"gucci mane",1,0,116814,Traya,"zzTraya zzDN zSion Sith Empire Trooper G8, zThrawn",1
"gucci mane",1,0,125994,CLS,"zzzCLS zHan zzChewbacca R2-D2 zzC-3PO",1
"gucci mane",,,127295,Disintegration,"Aurra zzGreef zBoba zzBossk zzThe Mandalorian",1
"gucci mane",1,1,145134,Revan Offense,"zzzJKR zGMY zzHYoda zJolee zJKA",1
"gucci mane",1,1,93368,Ewoks,"zChirpa Elder zPaploo Wicket G8, Logray G9",1
"gucci mane",1,0,144540,ShaakClones,"zzShaak Ti, zRex zEcho (501st), zzFives zARC Trooper",1
"gucci mane",0,1,128647,BH,"zzJango zIG-88 Cad zDengar Zam",1
"gucci mane",1,0,117463,Troopers,"zVeers zStarck zDT zzPiett Stormtrooper",1
"gucci mane",0,1,82518,Phoenix,"Hera G8, Chopper G8, zEzra zZeb zKanan",1
"gucci mane",1,0,14595,NestSolo (Counter),"Nest G9",1
"gucci mane",1,1,96827,NS,"zMT zzAV zDaka Zombie Spirit G8",0
"gucci mane",,,76505,Mon Mothma,"Mon Mothma 5* G8, Jyn Lando Kyle Katarn G9, Cassian G9",0
"gucci mane",1,1,83372,Carth,"zCarth Onasi, Mission G8, zZaalbar zJuhani Canderous G7",0
"gucci mane",,,75472,Bad Batch,"Hunter G9, Echo Omega G9, Tech G9, Wrecker",0
"gucci mane",1,0,65803,Wiggs,"Wedge G8, Biggs G8, Leia G8, Chirrut G7, Baze G7",0
"gucci mane",1,0,62044,Jawas,"Nebit G7, Jawa Engineer G7, Jawa Scavenger G8, Jawa G9, Dathcha G7",0
"Crusader5454",,,170061,JMK,"zzzzzzJMK zAhsoka zzzCAT zzzzGAS zGK",1
"Crusader5454",,,565642,Executor,"Executor 5* HT RC Xanadu Blood, Slave I, IG-2000 Gauntlet Starfighter, Tie Adv",1
"Crusader5454",,,521587,Negotiator,"Negotiator BTL-B Y-wing, Anakin's Eta-2, Rex's ARC-170, Umbaran SF, Ahsoka's SF, Plo's SF, Clone Sergeant's ARC-170",1
"Crusader5454",1,1,101156,NS_Alt,"zzMT zzAV Talia zDaka Zombie",1
"Crusader5454",,,346018,HansMF,"Home One, Han's MF, Biggs X-wing, Bistan's U-wing, Phantom Ghost Cassian's U-wing, Wedge X-wing",1
"Crusader5454",0,1,99589,Geonosians,"zzGBA Sun Fac, Geo Soldier, Geo Spy, Poggle",1
"Crusader5454",0,1,136415,Grievous,"zzGG zB2 zB1 zMagnaGuard zNute",1
"Crusader5454",1,0,127212,Traya,"zzTraya zDN zSion Sith Empire Trooper, zzThrawn",1
"Crusader5454",1,0,118487,CLS,"zzzCLS zHan zChewbacca zR2-D2 zzC-3PO",1
"Crusader5454",1,0,142758,Troopers,"zVeers zzPiett zzGideon zDark Trooper, Range Trooper",1
"Crusader5454",1,1,140748,Revan Offense,"zzzJKR zGMY zzHYoda zJolee zJKA",1
"Crusader5454",1,0,155602,ShaakClones,"zzShaak Ti, zRex zEcho (501st), zzFives zARC Trooper",1
"Crusader5454",1,1,87523,Ewoks,"zChirpa Elder zPaploo Scout Logray",1
"Crusader5454",0,1,146019,BH,"zzBossk Boba Dengar zZam zJango",1
"Crusader5454",1,1,145209,zEP,"zzEP zzzVader zTarkin TFP zzMara Jade, The Emperor's Hand",1
"Crusader5454",,,104397,Iden Troopers,"zIden Versio, Shoretrooper Snowtrooper Magma G9, zDT",1
"Crusader5454",0,1,70084,Phoenix,"Hera G8, Chopper G9, Ezra G8, Zeb G8, Kanan G8",1
"Crusader5454",,,132068,Bad Batch,"zHunter zEcho zzOmega zTech zWrecker",1
"Crusader5454",1,0,137774,zMaul,"zDarth Maul, zBSF zDooku zSidious Sith Marauder",1
"Crusader5454",1,0,75392,Jawas,"Nebit G8, Jawa Engineer G9, Jawa Scavenger, Jawa G9, Dathcha",1
"Crusader5454",,,75221,Phasma,"Phasma G8, FOE FOSFTP G9, zKRU G9, Kylo",0
"Crusader5454",,,296616,Malevolence,"Malevolence Hyena Bomber 4*, Vulture Droid 6*, Sun Fac SF, Soldier SF, Spy SF",0
"Crusader5454",,,79793,Mando,"zzThe Mandalorian (Beskar Armor), Dash Rendar 4* G5, zNest G7, zIG-11 G8, Kuiil G8",0
"Delmon Enz",,,168582,JMK,"zzzzzzJMK zJKA zGMY zzShaak Ti, zGK",1
"Delmon Enz",,,118319,Phasma,"zPhasma FOTP FOSFTP FOST zKylo",1
"Delmon Enz",1,1,153200,SL Kylo,"zzzzzzSL Kylo, zSith Trooper, zHux zzKRU zThrawn",1
"Delmon Enz",,,157628,SEE,"zzzzzzSEE zBSF zzMalak zzzDR zDooku",1
"Delmon Enz",1,1,116591,NS,"zzMT zzAV zDaka Zombie Spirit",1
"Delmon Enz",,,175007,JMLS,"zzzJKR zzJKL zzzzzzJMLS zWat Tambor, zzzzGAS",1
"Delmon Enz",1,0,145586,CLS,"zzzCLS zHan zzChewbacca zzC-3PO zChewpio",1
"Delmon Enz",,,495686,Negotiator,"Negotiator BTL-B Y-wing, Anakin's Eta-2, Rex's ARC-170, Umbaran SF, Ahsoka's SF, Plo's SF, Clone Sergeant's ARC-170",1
"Delmon Enz",,,433421,HansMF,"Home One, Han's MF, Rebel Y-wing, Bistan's U-wing, Phantom Biggs X-wing, Cassian's U-wing, Wedge X-wing",1
"Delmon Enz",0,1,99880,Geonosians,"zzGBA Sun Fac, Geo Soldier, Geo Spy, Poggle",1
"Delmon Enz",0,1,133020,Grievous,"zzGG zB2 zB1 MagnaGuard zNute",1
"Delmon Enz",1,0,116073,Traya,"zzTraya DN zSion zzEP Sith Empire Trooper",1
"Delmon Enz",1,1,120874,JTR,"zzJTR Scav Rey, zBB-8 zzR2-D2 Finn",1
"Delmon Enz",,,106155,Mon Mothma,"zzMon Mothma, Cara Dune, Wedge Biggs Chirrut",1
"Delmon Enz",1,1,85085,Ewoks,"zChirpa Elder Paploo Wicket Logray",1
"Delmon Enz",0,1,121082,BH,"zzBossk Boba Dengar G9, zZam Jango",1
"Delmon Enz",1,1,89701,Carth,"zCarth Onasi, Mission zZaalbar Juhani G8, Canderous",1
"Delmon Enz",1,0,137950,501st,"zRex zARC Trooper, zEcho (501st), zzFives zAhsoka",1
"Delmon Enz",1,0,118045,Troopers,"zVeers Starck zGideon zzPiett Range Trooper",1
"Delmon Enz",0,1,80941,Phoenix,"Hera Sabine Ezra Zeb Kanan",1
"Delmon Enz",,,131975,Bad Batch,"zHunter zEcho zzOmega zTech zWrecker",1
"Delmon Enz",1,0,81704,Jawas,"Nebit Jawa Engineer, Jawa Scavenger, Jawa Dathcha",1
"Delmon Enz",1,0,61018,QiraNest,"Qira Nest zzHYoda",1
"Delmon Enz",,,81802,Admiral Raddus,"zzAdmiral Raddus 4* G9, Cassian zJyn Baze Bistan G8",0
"Delmon Enz",,,299686,Malevolence,"Malevolence Hyena Bomber, Vulture Droid 3*, Sun Fac SF, Soldier SF, Spy SF",0
"Delmon Enz",,,460796,Executrix,"Executrix Tie Adv, Emperor's Shuttle 5*, TIE Reaper 5*, Imperial TIE Fighter, Gauntlet Starfighter, FOSF TIE Fighter, FO TIE Fighter",0
"Bobby0350",,,124915,Phasma,"zPhasma zFOTP FOSFTP zFOST zKylo",1
"Bobby0350",1,1,148853,SL Kylo,"zzzzzzSL Kylo, zSith Trooper, zHux zzKRU zzThrawn",1
"Bobby0350",0,1,144475,padme,"zzPadme zGK zJKA zAhsoka zzC-3PO",1
"Bobby0350",0,1,99603,DR,"zzzDR HK-47 zBSF Sith Empire Trooper, Sith Assassin G8",1
"Bobby0350",,,380532,HansMF,"Home One, Han's MF, Rebel Y-wing, Bistan's U-wing, Phantom Ghost Cassian's U-wing, Wedge X-wing",1
"Bobby0350",,,505316,Negotiator,"Negotiator HT Anakin's Eta-2, Umbaran SF, Ahsoka's SF, Clone Sergeant's ARC-170, Plo's SF, Rex's ARC-170",1
"Bobby0350",0,1,106451,Geonosians,"zzGBA Sun Fac, Geo Soldier, Geo Spy, Poggle",1
"Bobby0350",0,1,138106,Grievous-Wat,"zzGG zB2 zB1 zMagnaGuard zWat Tambor",1
"Bobby0350",1,1,133383,GAS,"zzzzGAS zRex zEcho (501st), zzFives zARC Trooper",1
"Bobby0350",1,1,129589,Revan Offense,"zzzJKR zzGMY zBS zJolee HYoda",1
"Bobby0350",1,1,99415,Ewoks,"zChirpa Elder zPaploo zWicket zLogray",1
"Bobby0350",0,1,133530,BH,"zzBossk IG-88 zBoba Cad Dengar",1
"Bobby0350",1,1,100079,Carth,"zCarth Onasi, zMission zZaalbar Juhani Canderous",1
"Bobby0350",1,1,125705,zEP,"zzEP zzzVader Tarkin TFP zSion G9",1
"Bobby0350",0,1,92925,BH,"zzJango zzThe Mandalorian, Embo G8, Greef Greedo G8",1
"Bobby0350",0,1,80409,Phoenix,"Hera Sabine G8, zEzra Zeb Kanan",1
"Bobby0350",1,0,16650,NestSolo (Counter),"Nest",1
"Bobby0350",,,62075,Admiral Raddus,"Admiral Raddus 3* G8, Cassian G8, Jyn G8, Baze G7, Bistan G7",0
"Bobby0350",1,0,111625,CLS,"zzzCLS Han zzChewbacca R2-D2 Chewpio 6* G9",0
"Bobby0350",1,1,90754,NS,"zzMT zzAV zDaka Zombie G8, Spirit G7",0
"Bobby0350",,,296506,Malevolence,"Malevolence Hyena Bomber 5*, Vulture Droid 3*, Sun Fac SF, Soldier SF, Spy SF",0
"Bobby0350",,,431712,Executrix,"Executrix Tie Adv, Emperor's Shuttle 4*, TIE Reaper 5*, Imperial TIE Fighter, Gauntlet Starfighter, FOSF TIE Fighter, FO TIE Fighter",0
"Bobby0350",1,0,84989,Troopers,"Veers Piett Gideon G8, Dark Trooper 6* G7, Range Trooper",0
"Bobby0350",,,78138,Mon Mothma,"Mon Mothma 6* G8, zCara Dune G8, Wedge G8, Lando Kyle Katarn G9",0
"Bobby0350",,,56548,Iden Troopers,"Iden Versio 4* G9, Shoretrooper G7, Snowtrooper G7, Magma G6, DT G8",0
"Bobby0350",1,0,84329,zMaul,"Darth Maul, Dooku Sidious zSavage Sith Marauder",0
"Bobby0350",,,62948,Bad Batch,"Hunter 6* Echo Omega G8, Tech 5* G9, Wrecker 5* G7",0
"Bobby0350",1,0,67394,Jawas,"Nebit G7, Jawa Engineer G9, Jawa Scavenger G9, Jawa G9, Dathcha G8",0
"DarthDado",,,164156,JMK,"zzzzzzJMK zJKA zGMY zzShaak Ti, zGK",1
"DarthDado",,,123467,Phasma,"zPhasma zFOTP FOSFTP zFOST zKylo",1
"DarthDado",1,1,147558,SL Kylo,"zzzzzzSL Kylo, zSith Trooper, zHux zzKRU zThrawn",1
"DarthDado",,,173218,JMLS,"zzzJKR zzJKL zzzzzzJMLS zWat Tambor, zzzzGAS",1
"DarthDado",1,0,144110,CLS,"zzzCLS zHan zzChewbacca zzC-3PO zChewpio",1
"DarthDado",,,479097,Negotiator,"Negotiator HT Anakin's Eta-2, Umbaran SF, Ahsoka's SF, BTL-B Y-wing, Clone Sergeant's ARC-170, Plo's SF",1
"DarthDado",,,307837,Malevolence,"Malevolence Hyena Bomber, Vulture Droid, Sun Fac SF, Soldier SF, Spy SF",1
"DarthDado",0,1,93036,Geonosians,"zzGBA Sun Fac, Geo Soldier, Geo Spy, Poggle",1
"DarthDado",0,1,126985,Grievous,"zzGG zB2 zB1 MagnaGuard zNute",1
"DarthDado",1,1,115602,JTR,"zzzJTR Scav Rey G9, zBB-8 zzR2-D2 Finn G9",1
"DarthDado",1,0,116517,Traya,"zzTraya zDN Sion zzEP zNest",1
"DarthDado",,,106498,Mon Mothma,"zzMon Mothma, zCara Dune, Wedge Hoth Rebel Scout, zPao",1
"DarthDado",1,0,102407,Troopers,"zVeers zzPiett zGideon zDark Trooper, Range Trooper",1
"DarthDado",1,1,83264,Ewoks,"zChirpa G9, Elder Paploo zWicket Logray",1
"DarthDado",0,1,126067,BH,"zzBossk zBoba Cad zDengar zJango",1
"DarthDado",1,0,114956,501st,"zRex zARC Trooper, zEcho (501st), zzFives zAhsoka",1
"DarthDado",1,1,81276,NS,"MT G7, zzAV Daka G7, Zombie Spirit G7",0
"DarthDado",1,1,81252,Carth,"Carth Onasi, Mission zZaalbar Juhani G7, Canderous",0
"DarthDado",,,79008,Iden Troopers,"zIden Versio G9, Shoretrooper Snowtrooper Magma G7, DT",0
"DarthDado",0,1,63322,Phoenix,"Hera G8, Chopper G7, Ezra Zeb G8, Kanan G8",0
"DarthDado",,,76095,Bad Batch,"zHunter G8, zEcho G8, Omega G7, zTech G8, zWrecker G8",0
"JasTarter Too",,,175491,JMLS,"zzzJKR zzJKL zzzzzzJMLS zWat Tambor, zzzzGAS",1
"JasTarter Too",1,0,151169,CLS,"zzzCLS zHan zzChewbacca zzC-3PO zChewpio",1
"JasTarter Too",0,1,133325,DRMalak,"zzzDR zzHK-47 zBSF zzMalak Sith Empire Trooper",1
"JasTarter Too",1,1,115050,NestSisters,"zzAV zzMT zDaka Zombie zNest",1
"JasTarter Too",0,1,130986,padme,"zzPadme zGK zJKA zAhsoka zBarriss",1
"JasTarter Too",,,481475,Negotiator,"Negotiator HT Anakin's Eta-2, Umbaran SF, Ahsoka's SF, BTL-B Y-wing, Clone Sergeant's ARC-170, Plo's SF",1
"JasTarter Too",,,429500,HansMF,"Home One, Han's MF, Rebel Y-wing, Bistan's U-wing, Phantom Biggs X-wing, Cassian's U-wing, Wedge X-wing",1
"JasTarter Too",1,1,140529,JTR,"zzzJTR zzR2-D2 zzBB-8 zRH Finn, zRH Poe",1
"JasTarter Too",0,1,95173,Geonosians,"zzGBA Sun Fac, Geo Soldier, Geo Spy, Poggle",1
"JasTarter Too",0,1,129727,Grievous,"zzGG zB2 zB1 zMagnaGuard zNute",1
"JasTarter Too",1,0,115729,Traya,"zzTraya zDN zSion zzEP zzThrawn",1
"JasTarter Too",,,117204,Mon Mothma,"zzMon Mothma, Wedge zzJyn Biggs Lando",1
"JasTarter Too",1,1,84448,Ewoks,"zChirpa Elder Paploo Wicket Logray G9",1
"JasTarter Too",1,0,134961,ShaakClones,"zzShaak Ti, zRex zEcho (501st), zzFives zARC Trooper",1
"JasTarter Too",0,1,140424,BH,"zzBossk zIG-88 zBoba zDengar zzJango",1
"JasTarter Too",1,1,100243,Carth,"zCarth Onasi, zMission zZaalbar zJuhani zCanderous",1
"JasTarter Too",0,1,93482,FO,"zzKRU zKylo FOE G9, zHux FOO G9",1
"JasTarter Too",0,1,83792,Phoenix,"zHera Chopper G9, zEzra Zeb G9, Kanan G9",1
"JasTarter Too",0,1,134557,BS,"zBS zzGMY zJolee zzOld Ben, zzHYoda",1
"JasTarter Too",1,0,73354,Jawas,"Nebit G8, Jawa Engineer, Jawa Scavenger G9, Jawa G9, Dathcha G9",1
"JasTarter Too",,,428287,Executrix,"Executrix Tie Adv, Emperor's Shuttle, TIE Reaper 4*, Imperial TIE Fighter, Gauntlet Starfighter, FOSF TIE Fighter, FO TIE Fighter",0
"JasTarter Too",1,0,85073,Troopers,"zVeers G9, zzPiett zGideon G9, Dark Trooper 5* G1, Range Trooper 6* G2",0
"JasTarter Too",,,63329,Iden Troopers,"Iden Versio 6* G1, zStormtrooper G9, Snowtrooper G8, Magma DT G4",0
"JasTarter Too",,,92794,Bad Batch,"zHunter zEcho G8, zzOmega zTech G9, zWrecker G9",0
"Bato Kido",,,168398,JMK,"zzzzzzJMK zJKA zzGMY zzShaak Ti, zGK",1
"Bato Kido",1,0,142313,CLS,"zzzCLS zHan zzChewbacca zzC-3PO zChewpio",1
"Bato Kido",0,1,115127,DRMalak,"zzzDR zzHK-47 zBSF zzMalak Sith Empire Trooper G8",1
"Bato Kido",,,466439,Negotiator,"Negotiator HT Anakin's Eta-2, Umbaran SF, Ahsoka's SF, BTL-B Y-wing, Clone Sergeant's ARC-170, Plo's SF",1
"Bato Kido",,,395770,HansMF,"Home One, Han's MF, Rebel Y-wing, Bistan's U-wing, Phantom Ghost Cassian's U-wing, Wedge X-wing",1
"Bato Kido",0,1,94552,Geonosians,"zzGBA Sun Fac, Geo Soldier, Geo Spy, Poggle",1
"Bato Kido",0,1,131556,Grievous,"zzGG zB2 zB1 zMagnaGuard zNute",1
"Bato Kido",1,0,108780,Traya,"zzTraya zzDN Sion zzEP zzThrawn",1
"Bato Kido",1,1,112401,JTR,"zzzJTR zScav Rey, zzBB-8 G9, zzR2-D2 zFinn",1
"Bato Kido",,,103855,Disintegration,"Aurra Greef G8, zBoba zzBossk zzThe Mandalorian G9",1
"Bato Kido",1,1,119303,GAS,"zzzzGAS zRex zEcho (501st), zzFives zARC Trooper",1
"Bato Kido",1,1,94742,Ewoks,"zChirpa Elder zPaploo zWicket zLogray",1
"Bato Kido",1,1,99813,Carth,"zCarth Onasi, zMission zZaalbar zJuhani zCanderous",1
"Bato Kido",0,1,118320,BH,"zzJango IG-88 Cad zDengar zGreedo",1
"Bato Kido",1,0,92386,zMaul,"zDarth Maul, Sidious zDooku Sith Marauder, zNest",1
"Bato Kido",0,1,101978,FO,"zzKRU zKylo zHux FOO Phasma",1
"Bato Kido",0,1,80477,Phoenix,"zHera G9, Chopper G9, zSabine G8, zZeb G9, zKanan G8",1
"Bato Kido",1,1,82323,Rogue1,"Jyn Chirrut Baze K-2SO G9, Bistan",1
"Bato Kido",,,135273,JKL,"zzJKL zzzJKR zzHYoda zzOld Ben, Aayla",0
"Bato Kido",1,1,82700,NS,"MT G8, zzAV zDaka Zombie G8, Spirit G7",0
"Bato Kido",1,0,79234,Troopers,"zVeers Starck G7, Snowtrooper G8, zzPiett Stormtrooper G7",0
"Bato Kido",1,0,71076,Wiggs,"Wedge Biggs Fulcrum G5, Ezra G7, zLeia",0
"Bato Kido",1,0,67407,Jawas,"Nebit G7, Jawa Engineer G9, Jawa Scavenger G7, Jawa Dathcha G7",0
"Papadapalous",,,174982,JMK,"zzzzzzJMK zAhsoka zzzCAT zzzzGAS zGK",1
"Papadapalous",,,172947,LV,"zzzzzzLord Vader, zzPiett zzzVader zRG zNinth Sister",1
"Papadapalous",,,163240,SEE,"zzzzzzSEE zBSF zzMalak zzzDR zDooku",1
"Papadapalous",,,156367,Jabba,"zzzzzzJabba zBoushh (Leia Organa), zSkiff Guard (Lando Calrissian), zKrrsantan zBoba",1
"Papadapalous",1,1,101374,NS,"zzMT zzAV zDaka Zombie Spirit",1
"Papadapalous",,,577462,Executor,"Executor HT RC Xanadu Blood, Slave I, IG-2000 Imperial TIE Fighter, Tie Adv",1
"Papadapalous",1,0,151441,CLS,"zzzCLS zHan zzChewbacca zzC-3PO zChewpio",1
"Papadapalous",,,506295,Negotiator,"Negotiator BTL-B Y-wing, Anakin's Eta-2, Rex's ARC-170, Umbaran SF, Ahsoka's SF, Plo's SF, Clone Sergeant's ARC-170",1
"Papadapalous",,,323283,Malevolence,"Malevolence Hyena Bomber, Vulture Droid, Sun Fac SF, Soldier SF, Spy SF",1
