Player,Offense,Defense,GP,Name,Squad,Viable
"DarkCoitus",,,148923,SK,"zzEP zzMara Jade, The Emperor's Hand, zzStarkiller zzOld Ben, zVisas",1
"DarkCoitus",,,593983,Executor,"Executor HT RC Xanadu Blood, Slave I, IG-2000 Imperial TIE Fighter, Tie Adv",1
"DarkCoitus",1,0,153159,CLS,"zzzCLS zHan zzChewbacca zzC-3PO zChewpio",1
"DarkCoitus",1,1,117819,NestSisters,"zzAV zzMT zDaka Zombie zNest",1
"DarkCoitus",,,515377,Negotiator,"Negotiator BTL-B Y-wing, Anakin's Eta-2, Rex's ARC-170, Umbaran SF, Ahsoka's SF, Plo's SF, Clone Sergeant's ARC-170",1
"DarkCoitus",,,332614,Malevolence,"Malevolence Hyena Bomber, Vulture Droid, Sun Fac SF, Soldier SF, Spy SF",1
"DarkCoitus",,,422417,HansMF,"Home One, Han's MF, Rebel Y-wing, Bistan's U-wing, Phantom Biggs X-wing, Cassian's U-wing, Wedge X-wing",1
"DarkCoitus",0,1,108716,Geonosians,"zzGBA Sun Fac, Geo Soldier, Geo Spy, Poggle",1
"DarkCoitus",0,1,130399,Grievous,"zzGG zB2 zB1 zMagnaGuard zNute",1
"DarkCoitus",1,1,131106,JTR,"zzzJTR Scav Rey, zzBB-8 zzR2-D2 Finn",1
"DarkCoitus",1,0,135149,Troopers,"zVeers zzPiett zGideon zDark Trooper, Range Trooper",1
"DarkCoitus",,,133247,Disintegration,"Aurra zzGreef zBoba zzBossk zThe Mandalorian",1
"DarkCoitus",,,102173,Mon Mothma,"zzMon Mothma, Wedge Pao Chirrut Biggs",1
"DarkCoitus",1,1,151744,Revan Offense,"zzzJKR zzGMY zzHYoda zJolee zJKA",1
"DarkCoitus",1,1,85418,Ewoks,"zChirpa Elder Paploo Wicket Logray",1
"DarkCoitus",1,0,152233,ShaakClones,"zzShaak Ti, zRex zEcho (501st), zzFives zARC Trooper",1
"DarkCoitus",1,1,95804,Carth,"Carth Onasi, zMission zZaalbar zJuhani zCanderous",1
"DarkCoitus",0,1,144997,BH,"zzJango zDengar Cad zFennec Shand, zGreedo",1
"DarkCoitus",0,1,79976,Phoenix,"Hera Kanan Sabine G8, Zeb G8, zEzra",1
"DarkCoitus",1,0,24351,SionSolo (Counter),"zSion",1
"DarkCoitus",,,142315,JMLS,"zBS zzzzzzJMLS zWat Tambor, zzJKL zBarriss G8",0
"DarkCoitus",1,0,124594,zMaul,"Darth Maul, zDooku zSidious zSavage Sith Marauder",0
"DarkCoitus",,,61513,Bad Batch,"zHunter 6* G9, zEcho 5* G8, Omega 5* G4, zTech 6* G8, zWrecker 6* G8",0
"DarkCoitus",1,0,71825,Jawas,"Nebit G7, Jawa Engineer G8, Jawa Scavenger G9, Jawa Dathcha G8",0
"tallon karrde",,,161748,JMK,"zzzzzzJMK zAhsoka zzzCAT zzzzGAS zGK",1
"tallon karrde",,,562106,Executor,"Executor HT RC Xanadu Blood, Slave I, IG-2000 Imperial TIE Fighter, Tie Adv",1
"tallon karrde",1,0,141659,CLS,"zzzCLS zHan zChewbacca zzC-3PO Chewpio",1
"tallon karrde",,,489114,Negotiator,"Negotiator BTL-B Y-wing, Anakin's Eta-2, Rex's ARC-170, Umbaran SF, Ahsoka's SF, Plo's SF, Clone Sergeant's ARC-170",1
"tallon karrde",,,305760,Malevolence,"Malevolence Hyena Bomber, Vulture Droid, Sun Fac SF, Soldier SF, Spy SF",1
"tallon karrde",,,132913,JKL,"zzJKL zzzJKR zHYoda Old Ben, Aayla",1
"tallon karrde",,,454092,HansMF,"Home One, Han's MF, Rebel Y-wing, Bistan's U-wing, Phantom Ghost Cassian's U-wing, Wedge X-wing",1
"tallon karrde",0,1,94492,Geonosians,"zzGBA Sun Fac, Geo Soldier, Geo Spy, Poggle",1
"tallon karrde",0,1,134137,Grievous-Wat,"zzGG zB2 zB1 MagnaGuard zWat Tambor",1
"tallon karrde",1,0,110664,Traya,"zzTraya DN Sion G9, zzEP zThrawn",1
"tallon karrde",1,1,107877,JTR,"zJTR Scav Rey, BB-8 G9, zzR2-D2 Finn G9",1
"tallon karrde",,,107494,Mon Mothma,"zzMon Mothma, zCara Dune, Scarif zPao Bistan",1
"tallon karrde",1,1,82550,Ewoks,"zChirpa Elder Paploo Wicket Logray",1
"tallon karrde",1,0,148697,ShaakClones,"zzShaak Ti, zRex zEcho (501st), zzFives ARC Trooper",1
"tallon karrde",0,1,142447,BH,"zzBossk zJango Dengar Cad zBoba",1
"tallon karrde",1,1,91482,Carth,"zCarth Onasi, zMission Zaalbar Juhani Canderous",1
"tallon karrde",1,0,135820,Troopers,"zVeers zStarck zDark Trooper, zPiett zGideon",1
"tallon karrde",0,1,90614,Phoenix,"zHera Kanan Sabine Zeb G8, Ezra",1
"tallon karrde",1,1,100234,Rogue1,"zJyn Chirrut Baze G9, Cassian K-2SO G9",1
"tallon karrde",,,89304,Bad Batch,"Hunter Echo Omega Tech Wrecker",1
"tallon karrde",1,0,13536,NestSolo (Counter),"Nest G8",1
"tallon karrde",,,55497,Phasma,"Phasma G8, FOTP FOSFTP G1, FOST G1, Kylo G9",0
"tallon karrde",1,1,83262,NS,"zMT zAV zDaka G9, Zombie Spirit G1",0
"tallon karrde",0,1,112390,DRMalak,"zzDR HK-47 zBSF zMalak Sith Marauder",0
"MrsBlueprints",1,0,151487,CLS,"zzzCLS zHan zzChewbacca zzC-3PO zChewpio",1
"MrsBlueprints",1,1,105207,NestSisters,"zzAV zzMT zDaka Zombie zNest",1
"MrsBlueprints",0,1,142026,DRMalak,"zzzDR zzHK-47 zBSF zzMalak Sith Marauder",1
"MrsBlueprints",,,507938,Negotiator,"Negotiator HT Anakin's Eta-2, Umbaran SF, Ahsoka's SF, Clone Sergeant's ARC-170, Plo's SF, Rex's ARC-170",1
"MrsBlueprints",1,1,137952,JTR,"zzzJTR zzR2-D2 zzBB-8 zRH Finn, zRH Poe",1
"MrsBlueprints",0,1,111028,Geonosians,"zzGBA Sun Fac, Geo Soldier, Geo Spy, Poggle",1
"MrsBlueprints",0,1,92357,Grievous,"zzGG zB2 G9, zDroideka MagnaGuard G8, zT3-M4",1
"MrsBlueprints",1,1,155291,Revan,"zzzJKR zBS zzGMY zJolee zGK",1
"MrsBlueprints",1,1,97994,Ewoks,"zChirpa Elder zPaploo zWicket zLogray",1
"MrsBlueprints",1,0,128860,ShaakClones,"zzShaak Ti, zRex zEcho (501st), zzFives ARC Trooper G8",1
"MrsBlueprints",0,1,128208,BH,"zzBossk zzJango Dengar G9, zzThe Mandalorian, zBoba",1
"MrsBlueprints",1,1,93279,Carth,"zCarth Onasi, Mission Zaalbar zJuhani Canderous",1
"MrsBlueprints",1,1,113046,zEP,"zzEP zzzVader zTarkin TFP G9, zzDN",1
"MrsBlueprints",0,1,101237,FO,"zzKRU zKylo FOE FOTP G9, FOO",1
"MrsBlueprints",0,1,85645,Phoenix,"zHera zKanan Chopper Zeb G9, Ezra G9",1
"MrsBlueprints",,,278180,Malevolence,"Malevolence Hyena Bomber 4*, Vulture Droid 3*, Sun Fac SF, Soldier SF, Spy SF",0
"MrsBlueprints",,,344593,HansMF,"Home One, Han's MF, Biggs X-wing, Bistan's U-wing 4*, Phantom Ghost Cassian's U-wing, Wedge X-wing",0
"MrsBlueprints",,,72468,Mon Mothma,"Mon Mothma 4* G7, zCara Dune 6*, Lando Wedge G7, zKyle Katarn G4",0
"MrsBlueprints",1,0,63705,Troopers,"Veers G7, Starck G6, Magma G8, Stormtrooper G7, DT G8",0
"MrsBlueprints",,,64959,Bad Batch,"Hunter 6* Echo 5* G9, Omega 6* G9, zTech 6* G9, Wrecker 5* G8",0
"MrsBlueprints",1,0,98291,QGJ,"QGJ G8, Aayla G3, zJKA Old Ben, zAhsoka",0
"MrsBlueprints",1,0,17995,SionSolo (Counter),"zSion 6*",0
"Ivar Hardun",,,182798,LV,"zzzzzzLord Vader, zzPiett zzzMaul zRG zzzVader",1
"Ivar Hardun",,,175421,SEE,"zzzzzzSEE zBSF zzMalak zzzDR zDooku",1
"Ivar Hardun",,,580449,Executor,"Executor HT RC Xanadu Blood, Slave I, IG-2000 Imperial TIE Fighter, Tie Adv",1
"Ivar Hardun",0,1,139694,padme,"zzPadme zGK zJKA zAhsoka zzC-3PO",1
"Ivar Hardun",,,427664,Negotiator,"Negotiator BTL-B Y-wing, Anakin's Eta-2, Rex's ARC-170, Umbaran SF, Ahsoka's SF, Plo's SF, Clone Sergeant's ARC-170",1
"Ivar Hardun",,,299408,Malevolence,"Malevolence Hyena Bomber, Vulture Droid, Sun Fac SF, Soldier SF, Spy SF",1
"Ivar Hardun",,,320200,HansMF,"Home One, Han's MF, Rebel Y-wing, Bistan's U-wing, Phantom Ghost Cassian's U-wing, Wedge X-wing",1
"Ivar Hardun",1,0,150120,Traya,"zzTraya zzDN zSion Sith Empire Trooper, zzThrawn",1
"Ivar Hardun",0,1,128077,Grievous,"zzGG zB2 zB1 zMagnaGuard zNute",1
"Ivar Hardun",1,1,112117,Revan Offense,"zzzJKR zzGMY zBS zJolee zzHYoda",1
"Ivar Hardun",1,1,81928,Ewoks,"zChirpa Elder Paploo zWicket Logray",1
"Ivar Hardun",0,1,148223,BH,"zzBossk zDengar zZam zBoba zKrrsantan",1
"Ivar Hardun",1,1,97667,Carth,"zCarth Onasi, zMission Zaalbar Juhani zCanderous",1
"Ivar Hardun",0,1,69280,Phoenix,"Hera G8, Kanan G8, Chopper G9, Zeb G8, Ezra G8",1
"Ivar Hardun",1,1,58594,Rogue1,"Jyn G8, Chirrut G8, Baze G8, Cassian G8, K-2SO G8",1
"Ivar Hardun",1,0,108013,EP (Counter, Rebel),"zzEP Shoretrooper G8, Krennic DT G8, zzWampa",1
"Ivar Hardun",1,0,15942,NestSolo (Counter),"zNest G8",1
"Ivar Hardun",,,61981,Phasma,"Phasma G8, FOTP G9, FOSFTP G6, FOST G8, Kylo G8",0
"Ivar Hardun",1,0,93966,CLS,"zzzCLS zHan zzChewbacca R2-D2 G8, Chewpio 6* G8",0
"Ivar Hardun",0,1,82958,Geonosians,"zzGBA G8, Sun Fac, Geo Soldier G8, Geo Spy, Poggle G8",0
"Ivar Hardun",1,1,79098,NS,"zMT G8, zzAV Daka G8, Zombie G7, Spirit G8",0
"Ivar Hardun",1,1,146895,GAS,"zzzzGAS zRex zEcho (501st), zzFives G9, zARC Trooper",0
"Ivar Hardun",,,74469,Mon Mothma,"Mon Mothma 5* G6, Cara Dune G7, Lando Wedge G8, Kyle Katarn",0
"Ivar Hardun",1,0,88707,Troopers,"Veers Starck zzGideon Snowtrooper G8, Stormtrooper G8",0
"Ivar Hardun",0,1,113737,BH,"Jango G9, zIG-88 Cad zEmbo zGreedo",0
"Ivar Hardun",,,117188,Bad Batch,"zHunter zEcho zOmega G6, zTech zWrecker",0
"gucci mane",,,170404,JMK,"zzzzzzJMK zAhsoka zzzCAT zzzzGAS zGK",1
"gucci mane",,,115215,Phasma,"zPhasma zFOTP FOSFTP zFOST zKylo",1
"gucci mane",,,164768,SEE,"zzzzzzSEE zBSF zzMalak zzzDR zzzVader",1
"gucci mane",,,520794,Negotiator,"Negotiator HT Anakin's Eta-2, Umbaran SF, Ahsoka's SF, BTL-B Y-wing, Clone Sergeant's ARC-170, Plo's SF",1
"gucci mane",,,374191,HansMF,"Home One, Han's MF, Biggs X-wing, Bistan's U-wing, Phantom Ghost Cassian's U-wing, Wedge X-wing",1
"gucci mane",0,1,111265,Geonosians,"zzGBA Sun Fac, Geo Soldier, Geo Spy, Poggle",1
"gucci mane",0,1,127545,Grievous,"zzGG zB2 zB1 zMagnaGuard zNute",1
"gucci mane",1,0,115764,Traya,"zzTraya zzDN zSion Sith Empire Trooper G8, zThrawn",1
"gucci mane",,,125753,Disintegration,"Aurra zzGreef zBoba zzBossk zzThe Mandalorian",1
"gucci mane",1,1,145134,Revan Offense,"zzzJKR zGMY zzHYoda zJolee zJKA",1
"gucci mane",1,1,93225,Ewoks,"zChirpa Elder zPaploo Wicket G8, Logray G9",1
"gucci mane",1,0,144540,ShaakClones,"zzShaak Ti, zRex zEcho (501st), zzFives zARC Trooper",1
"gucci mane",0,1,128647,BH,"zzJango zIG-88 zDengar Cad Zam",1
"gucci mane",0,1,82396,Phoenix,"Hera G8, zKanan Chopper G8, zZeb zEzra",1
"gucci mane",1,0,125681,EP (Counter, Rebel),"zzEP Krennic zDT zzWampa zStarck",1
"gucci mane",1,0,14595,NestSolo (Counter),"Nest G9",1
"gucci mane",1,0,119682,CLS,"zzzCLS zHan zzChewbacca zzC-3PO Chewpio 6* G8",0
"gucci mane",1,1,96827,NS,"zMT zzAV zDaka Zombie Spirit G8",0
"gucci mane",1,1,67576,JTR,"JTR G8, R2-D2 G8, zBB-8 G9, RH Finn 4* G4, RH Poe G9",0
"gucci mane",1,0,96561,Troopers,"zVeers zzPiett zGideon G9, Dark Trooper 6* G9, Range Trooper 5* G7",0
"gucci mane",,,76505,Mon Mothma,"Mon Mothma 5* G8, Lando Jyn Cassian G9, Kyle Katarn G9",0
"gucci mane",1,1,83372,Carth,"zCarth Onasi, Mission G8, zZaalbar zJuhani Canderous G7",0
"gucci mane",,,75472,Bad Batch,"Hunter G9, Echo Omega G9, Tech G9, Wrecker",0
"gucci mane",1,0,65803,Wiggs,"Wedge G8, Biggs G8, Leia G8, Chirrut G7, Baze G7",0
"gucci mane",1,0,62044,Jawas,"Nebit G7, Jawa Engineer G7, Jawa Scavenger G8, Jawa G9, Dathcha G7",0
"Bato Kido",,,168398,JMK,"zzzzzzJMK zJKA zzGMY zzShaak Ti, zGK",1
"Bato Kido",1,0,135557,CLS,"zzzCLS zHan zzChewbacca zzC-3PO zChewpio",1
"Bato Kido",0,1,115127,DRMalak,"zzzDR zzHK-47 zBSF zzMalak Sith Empire Trooper G8",1
"Bato Kido",,,466439,Negotiator,"Negotiator HT Anakin's Eta-2, Umbaran SF, Ahsoka's SF, BTL-B Y-wing, Clone Sergeant's ARC-170, Plo's SF",1
"Bato Kido",,,386650,HansMF,"Home One, Han's MF, Rebel Y-wing, Bistan's U-wing, Phantom Ghost Cassian's U-wing, Wedge X-wing",1
"Bato Kido",0,1,94552,Geonosians,"zzGBA Sun Fac, Geo Soldier, Geo Spy, Poggle",1
"Bato Kido",0,1,131556,Grievous,"zzGG zB2 zB1 zMagnaGuard zNute",1
"Bato Kido",1,0,108780,Traya,"zzTraya zzDN Sion zzEP zzThrawn",1
"Bato Kido",1,1,112401,JTR,"zzzJTR zScav Rey, zzBB-8 G9, zzR2-D2 zFinn",1
"Bato Kido",,,103855,Disintegration,"Aurra Greef G8, zBoba zzBossk zzThe Mandalorian G9",1
"Bato Kido",1,1,118334,GAS,"zzzzGAS zRex zEcho (501st), zzFives zARC Trooper",1
"Bato Kido",1,1,94742,Ewoks,"zChirpa Elder zPaploo zWicket zLogray",1
"Bato Kido",1,1,99813,Carth,"zCarth Onasi, zMission zZaalbar zJuhani zCanderous",1
"Bato Kido",0,1,117270,BH,"zzJango IG-88 zDengar Cad zGreedo",1
"Bato Kido",1,0,92386,zMaul,"zDarth Maul, Sidious zDooku Sith Marauder, zNest",1
"Bato Kido",0,1,101345,FO,"zzKRU zKylo zHux Phasma FOO",1
"Bato Kido",0,1,80477,Phoenix,"zHera G9, zKanan G8, Chopper G9, zSabine G8, zZeb G9",1
"Bato Kido",1,1,82323,Rogue1,"Jyn Chirrut Baze Bistan K-2SO G9",1
"Bato Kido",,,135204,JKL,"zzJKL zzzJKR zzHYoda zzOld Ben, Aayla",0
"Bato Kido",1,1,82700,NS,"MT G8, zzAV zDaka Zombie G8, Spirit G7",0
"Bato Kido",1,0,79234,Troopers,"zVeers Starck G7, zzPiett Snowtrooper G8, Stormtrooper G7",0
"Bato Kido",1,0,71076,Wiggs,"Wedge Biggs Fulcrum G5, Ezra G7, zLeia",0
"Bato Kido",1,0,67197,Jawas,"Nebit G7, Jawa Engineer G9, Jawa Scavenger G7, Jawa Dathcha G7",0
"Crocodile Dundee",,,100205,Phasma,"zPhasma zFOTP FOE zzKRU zKylo",1
"Crocodile Dundee",0,1,149048,DRMalak,"zzzDR zzHK-47 zBSF zzMalak Sith Empire Trooper",1
"Crocodile Dundee",1,0,135451,CLS,"zzzCLS zHan zzChewbacca zzC-3PO zChewpio",1
"Crocodile Dundee",0,1,129483,padme,"zzPadme zGK zJKA zAhsoka zBarriss G8",1
"Crocodile Dundee",,,140045,JKL,"zzJKL zzzJKR zzHYoda zzOld Ben, Aayla",1
"Crocodile Dundee",,,440499,HansMF,"Home One, Han's MF, Rebel Y-wing 6*, Bistan's U-wing, Phantom Ghost Cassian's U-wing, Biggs X-wing",1
"Crocodile Dundee",,,542877,Negotiator,"Negotiator HT Anakin's Eta-2, Umbaran SF, Ahsoka's SF, Clone Sergeant's ARC-170, Plo's SF, Rex's ARC-170",1
"Crocodile Dundee",0,1,123046,Geonosians,"zzGBA Sun Fac, Geo Soldier, Geo Spy, Poggle",1
"Crocodile Dundee",0,1,133748,Grievous,"zzGG zB2 zB1 zMagnaGuard zNute",1
"Crocodile Dundee",1,0,118162,Traya,"zzTraya zzDN zSion zzEP zzThrawn",1
"Crocodile Dundee",1,1,110762,JTR,"zzzJTR zScav Rey, zzBB-8 zzR2-D2 zFinn",1
"Crocodile Dundee",1,1,140328,GAS,"zzzzGAS zRex zEcho (501st), zzFives zARC Trooper",1
"Crocodile Dundee",,,101506,Mon Mothma,"zzMon Mothma, Lando Wedge Chirrut Biggs",1
"Crocodile Dundee",1,1,93830,Ewoks,"zChirpa Elder zPaploo zWicket zLogray",1
"Crocodile Dundee",0,1,139874,BH,"zzBossk zzJango zDengar Cad zBoba",1
"Crocodile Dundee",1,1,99200,Carth,"zCarth Onasi, zMission zZaalbar zJuhani zCanderous",1
"Crocodile Dundee",1,0,131334,Troopers,"zVeers zStarck zzPiett zzGideon Shoretrooper",1
"Crocodile Dundee",0,1,100594,Phoenix,"zHera zKanan zSabine zZeb zEzra",1
"Crocodile Dundee",1,0,68743,Jawas,"Nebit G8, Jawa Engineer G9, Jawa Scavenger G8, Jawa G9, Dathcha G8",1
"Crocodile Dundee",,,69698,Admiral Raddus,"Admiral Raddus 3* G7, Cassian G8, zzJyn K-2SO G8, Bistan G5",0
"Crocodile Dundee",1,1,96344,NS,"zzMT zzAV zDaka Zombie Spirit G7",0
"Crocodile Dundee",,,333488,Malevolence,"Malevolence Hyena Bomber, Vulture Droid 4*, Sun Fac SF, Soldier SF, Spy SF",0
"Crocodile Dundee",1,0,97244,zMaul,"Darth Maul, zSidious zDooku Sith Marauder, Nest G7",0
"Crocodile Dundee",,,65353,Iden Troopers,"Iden Versio 5* G8, Stormtrooper G9, Snowtrooper G9, Magma G9, DT G7",0
"Crocodile Dundee",,,42871,Bad Batch,"Hunter 5* G6, Echo 4* G8, Omega 5* G6, Tech 5* G5, Wrecker 5* G4",0
"Hoyt Nitrum",,,175322,JMK,"zzzzzzJMK zJKA zzGMY zzShaak Ti, zGK",1
"Hoyt Nitrum",,,169258,SEE,"zzzzzzSEE zBSF zzMalak zzzDR zzzVader",1
"Hoyt Nitrum",,,177725,JMLS,"zzzJKR zzJKL zzzzzzJMLS zWat Tambor, zzzzGAS",1
"Hoyt Nitrum",1,0,145516,CLS,"zzzCLS zHan zzChewbacca zzC-3PO zChewpio",1
"Hoyt Nitrum",1,1,108864,NestSisters,"zzAV zzMT zDaka Zombie zNest",1
"Hoyt Nitrum",,,497822,Negotiator,"Negotiator HT Anakin's Eta-2, Umbaran SF, Ahsoka's SF, BTL-B Y-wing, Clone Sergeant's ARC-170, Plo's SF",1
"Hoyt Nitrum",,,409057,HansMF,"Home One, Han's MF, Rebel Y-wing, Bistan's U-wing, Phantom Biggs X-wing, Cassian's U-wing, Wedge X-wing",1
"Hoyt Nitrum",1,1,122043,JTR,"zzzJTR zzR2-D2 zzBB-8 zRH Finn, RH Poe G9",1
"Hoyt Nitrum",0,1,127189,Grievous,"zzGG zB2 zB1 zMagnaGuard zNute",1
"Hoyt Nitrum",1,0,114398,Traya,"zzTraya zzDN zSion Sith Empire Trooper, zzThrawn",1
"Hoyt Nitrum",,,129458,Disintegration,"Aurra zzGreef zBoba zzBossk zzThe Mandalorian",1
"Hoyt Nitrum",1,1,92920,Ewoks,"zChirpa Elder zPaploo zWicket Logray",1
"Hoyt Nitrum",1,1,98415,Carth,"zCarth Onasi, zMission zZaalbar zJuhani Canderous",1
"Hoyt Nitrum",0,1,132746,BH,"zzJango zIG-88 zDengar Cad zKrrsantan",1
"Hoyt Nitrum",1,0,111633,501st,"zRex zARC Trooper, zEcho (501st), zzFives zAhsoka",1
"Hoyt Nitrum",1,0,121639,Troopers,"zVeers zStarck zDark Trooper, zzPiett zStormtrooper",1
"Hoyt Nitrum",0,1,87692,FO,"zzKRU zKylo FOE FOO FOST G8",1
"Hoyt Nitrum",0,1,75822,Phoenix,"Hera Kanan G9, Sabine G8, Zeb G9, Ezra",1
"Hoyt Nitrum",1,1,70383,Rogue1,"Jyn G8, Chirrut G8, Baze G8, Cassian G9, K-2SO G9",1
"Hoyt Nitrum",1,0,126547,zMaul,"zDarth Maul, zDooku zSidious zSavage Sith Marauder",1
"Hoyt Nitrum",1,0,117657,EP (Counter, Rebel),"zzEP Shoretrooper G8, zKrennic zDT zzWampa",1
"Hoyt Nitrum",1,0,74587,Jawas,"Nebit G9, Jawa Engineer, Jawa Scavenger, Jawa G8, Dathcha",1
"Hoyt Nitrum",,,277779,Malevolence,"Malevolence Hyena Bomber 4*, Vulture Droid, Sun Fac SF, Soldier SF, Spy SF",0
"Hoyt Nitrum",0,1,84701,Geonosians,"zzGBA Sun Fac G8, Geo Soldier, Geo Spy, Poggle",0
"Hoyt Nitrum",,,453615,Executrix,"Executrix Tie Adv, Emperor's Shuttle, TIE Reaper 5*, Imperial TIE Fighter, Gauntlet Starfighter, FOSF TIE Fighter, FO TIE Fighter",0
"Hoyt Nitrum",,,119623,Mon Mothma,"zzMon Mothma, Lando Wedge zKyle Katarn, Biggs",0
"Hoyt Nitrum",,,106000,Bad Batch,"zHunter zEcho zzOmega zTech zWrecker G9",0
"JasTarter Too",,,175409,JMLS,"zzzJKR zzJKL zzzzzzJMLS zWat Tambor, zzzzGAS",1
"JasTarter Too",1,0,151169,CLS,"zzzCLS zHan zzChewbacca zzC-3PO zChewpio",1
"JasTarter Too",0,1,133325,DRMalak,"zzzDR zzHK-47 zBSF zzMalak Sith Empire Trooper",1
"JasTarter Too",1,1,115050,NestSisters,"zzAV zzMT zDaka Zombie zNest",1
"JasTarter Too",0,1,130776,padme,"zzPadme zGK zJKA zAhsoka zBarriss",1
"JasTarter Too",,,481475,Negotiator,"Negotiator HT Anakin's Eta-2, Umbaran SF, Ahsoka's SF, BTL-B Y-wing, Clone Sergeant's ARC-170, Plo's SF",1
"JasTarter Too",,,429500,HansMF,"Home One, Han's MF, Rebel Y-wing, Bistan's U-wing, Phantom Biggs X-wing, Cassian's U-wing, Wedge X-wing",1
"JasTarter Too",1,1,140529,JTR,"zzzJTR zzR2-D2 zzBB-8 zRH Finn, zRH Poe",1
"JasTarter Too",0,1,95173,Geonosians,"zzGBA Sun Fac, Geo Soldier, Geo Spy, Poggle",1
"JasTarter Too",0,1,129727,Grievous,"zzGG zB2 zB1 zMagnaGuard zNute",1
"JasTarter Too",1,0,115552,Traya,"zzTraya zDN zSion zzEP zzThrawn",1
"JasTarter Too",,,117204,Mon Mothma,"zzMon Mothma, Lando Wedge zzJyn Biggs",1
"JasTarter Too",1,1,84448,Ewoks,"zChirpa Elder Paploo Wicket Logray G9",1
"JasTarter Too",1,0,134961,ShaakClones,"zzShaak Ti, zRex zEcho (501st), zzFives zARC Trooper",1
"JasTarter Too",0,1,140424,BH,"zzBossk zIG-88 zzJango zDengar zBoba",1
"JasTarter Too",1,1,100243,Carth,"zCarth Onasi, zMission zZaalbar zJuhani zCanderous",1
"JasTarter Too",0,1,93482,FO,"zzKRU zKylo zHux FOE G9, FOO G9",1
"JasTarter Too",0,1,83396,Phoenix,"zHera Kanan G9, Chopper G9, Zeb G9, zEzra",1
"JasTarter Too",0,1,134557,BS,"zBS zzGMY zJolee zzOld Ben, zzHYoda",1
"JasTarter Too",1,0,73354,Jawas,"Nebit G8, Jawa Engineer, Jawa Scavenger G9, Jawa G9, Dathcha G9",1
"JasTarter Too",,,428287,Executrix,"Executrix Tie Adv, Emperor's Shuttle, TIE Reaper 4*, Imperial TIE Fighter, Gauntlet Starfighter, FOSF TIE Fighter, FO TIE Fighter",0
"JasTarter Too",1,0,85073,Troopers,"zVeers G9, zzPiett zGideon G9, Dark Trooper 5* G1, Range Trooper 6* G2",0
"JasTarter Too",,,62189,Iden Troopers,"Iden Versio 5* G1, zStormtrooper G9, Snowtrooper G8, Magma DT G4",0
"JasTarter Too",,,91450,Bad Batch,"zHunter zEcho G8, zzOmega zTech G9, zWrecker G9",0
"Obi Bonz Kenobie",,,170396,JMK,"zzzzzzJMK zAhsoka zzzCAT zzzzGAS zGK",1
"Obi Bonz Kenobie",,,138089,Phasma,"zPhasma zFOTP FOSFTP zFOST zKylo",1
"Obi Bonz Kenobie",1,1,151517,SL Kylo,"zzzzzzSL Kylo, zSith Trooper, zHux zzKRU Thrawn G9",1
"Obi Bonz Kenobie",,,169818,Jabba,"zzzzzzJabba zBoushh (Leia Organa), zSkiff Guard (Lando Calrissian), zKrrsantan zBoba",1
"Obi Bonz Kenobie",1,1,102010,NS,"zzMT zzAV zDaka Zombie Spirit",1
"Obi Bonz Kenobie",,,556672,Executor,"Executor 5* HT RC Xanadu Blood, Slave I, IG-2000 Imperial TIE Fighter, Tie Adv",1
"Obi Bonz Kenobie",1,0,151605,CLS,"zzzCLS zHan zzChewbacca zzC-3PO zChewpio",1
"Obi Bonz Kenobie",0,1,127031,DRMalak,"zzzDR zHK-47 zBSF zzMalak Sith Assassin",1
"Obi Bonz Kenobie",,,148558,JKL,"zzJKL zzzJKR zzHYoda zzOld Ben, zBarriss",1
"Obi Bonz Kenobie",,,430160,HansMF,"Home One, Han's MF, Rebel Y-wing 6*, Bistan's U-wing, Phantom Ghost Cassian's U-wing, Wedge X-wing",1
"Obi Bonz Kenobie",0,1,114590,Geonosians,"zzGBA Sun Fac, Geo Soldier, Geo Spy, Poggle",1
"Obi Bonz Kenobie",0,1,137031,Grievous,"zzGG zB2 zB1 zMagnaGuard zNute",1
"Obi Bonz Kenobie",,,114754,Mon Mothma,"zzMon Mothma, Lando Wedge zzJyn Biggs",1
"Obi Bonz Kenobie",1,1,91578,Ewoks,"zChirpa Elder Paploo zWicket zLogray",1
"Obi Bonz Kenobie",1,0,140478,ShaakClones,"zzShaak Ti, zRex zEcho (501st), zzFives zARC Trooper",1
"Obi Bonz Kenobie",1,1,92998,Carth,"zCarth Onasi, zMission zZaalbar zJuhani Canderous",1
"Obi Bonz Kenobie",0,1,150345,BH,"zzBossk zzJango zDengar zFennec Shand, zGreedo",1
"Obi Bonz Kenobie",0,1,88639,Phoenix,"zHera zKanan zSabine zZeb G8, zEzra",1
"Obi Bonz Kenobie",1,0,116561,EP (Counter, Rebel),"zzEP Shoretrooper G8, zDT zzWampa zStormtrooper",1
"Obi Bonz Kenobie",1,0,86835,Jawas,"Nebit Jawa Engineer, Jawa Scavenger, Jawa Dathcha",1
"Obi Bonz Kenobie",1,0,18594,NestSolo (Counter),"zNest",1
"Obi Bonz Kenobie",1,0,12195,SionSolo (Counter),"Sion G8",1
"Obi Bonz Kenobie",,,494629,Negotiator,"Negotiator BTL-B Y-wing 5*, Anakin's Eta-2, Rex's ARC-170, Umbaran SF, Ahsoka's SF, Plo's SF, Clone Sergeant's ARC-170",0
"Obi Bonz Kenobie",1,1,103610,JTR,"JTR zScav Rey G8, BB-8 G8, zzR2-D2 zFinn G8",0
"Obi Bonz Kenobie",1,0,111143,Troopers,"zVeers zzPiett zzGideon zDark Trooper, Range Trooper 6* G6",0
"Obi Bonz Kenobie",,,74087,Bad Batch,"zHunter 6* zEcho 5* G6, zzOmega 6* G9, zTech 5* G7, zWrecker 6* G8",0
"Hashslingingslasher",1,1,157117,SL Kylo,"zzzzzzSL Kylo, zSith Trooper, zHux zzKRU zzThrawn",1
"Hashslingingslasher",,,171497,SEE,"zzzzzzSEE zBSF zzMalak zzzDR zzzVader",1
"Hashslingingslasher",1,1,159447,GL Rey,"zzzzzzRey zGK zzzJTR zRH Poe, zRH Finn",1
"Hashslingingslasher",1,1,101864,NS,"zzMT zzAV zDaka Zombie Spirit",1
"Hashslingingslasher",1,0,125962,CLS,"zzzCLS zHan zzChewbacca zzC-3PO Chewpio",1
"Hashslingingslasher",,,380117,HansMF,"Home One, Han's MF, Rebel Y-wing, Bistan's U-wing, Phantom Ghost Cassian's U-wing, Wedge X-wing",1
"Hashslingingslasher",,,512738,Negotiator,"Negotiator HT Anakin's Eta-2, Umbaran SF, Ahsoka's SF, Clone Sergeant's ARC-170, Plo's SF, Rex's ARC-170",1
"Hashslingingslasher",0,1,94070,Geonosians,"zzGBA Sun Fac, Geo Soldier, Geo Spy, Poggle",1
"Hashslingingslasher",0,1,121305,Grievous,"zzGG zB2 zB1 MagnaGuard zNute",1
"Hashslingingslasher",1,0,114046,Traya,"zzTraya zDN zSion zzEP Sith Empire Trooper",1
"Hashslingingslasher",1,1,128843,GAS,"zzzzGAS zRex zEcho (501st), zzFives zARC Trooper",1
"Hashslingingslasher",1,1,135865,Revan Offense,"zzzJKR zGMY zHYoda zJolee zJKA",1
"Hashslingingslasher",1,1,87609,Ewoks,"zChirpa Elder Paploo zWicket Logray",1
"Hashslingingslasher",0,1,126360,BH,"zzBossk zJango Dengar Cad Boba",1
"Hashslingingslasher",1,1,89710,Carth,"Carth Onasi, zMission zZaalbar Juhani Canderous",1
"Hashslingingslasher",0,1,77098,Phoenix,"Hera Kanan Sabine G9, Zeb Ezra",1
"Hashslingingslasher",1,0,14136,NestSolo (Counter),"Nest G9",1
"Hashslingingslasher",,,118448,Phasma,"Phasma zFOTP FOSFTP FOST zKylo",0
"Hashslingingslasher",1,0,98256,Troopers,"Veers zzPiett zGideon 4* G9, zDark Trooper, Range Trooper",0
"Hashslingingslasher",,,72962,Mon Mothma,"Mon Mothma 5* G8, Lando Wedge Chirrut G8, Jyn G8",0
"Hashslingingslasher",,,60113,Iden Troopers,"Iden Versio 3* G6, Stormtrooper Snowtrooper G8, Magma G7, DT G8",0
"Hashslingingslasher",,,57380,Bad Batch,"zHunter G8, Echo 5* G7, Omega 5* G7, zTech G7, Wrecker 4* G9",0
"Hashslingingslasher",1,0,57640,Jawas,"Nebit G6, Jawa Engineer G6, Jawa Scavenger G7, Jawa G6, Dathcha G6",0
"Crazaig",,,123557,Phasma,"zPhasma zFOTP FOSFTP zFOST zKylo",1
"Crazaig",1,1,161192,SL Kylo,"zzzzzzSL Kylo, zSith Trooper, zHux zzKRU zzThrawn",1
"Crazaig",,,170137,SEE,"zzzzzzSEE zBSF zzMalak zzzDR zzzVader",1
"Crazaig",1,1,164289,GL Rey,"zzzzzzRey zzzJTR zzBB-8 zHoldo zRH Finn",1
"Crazaig",1,1,109365,NS,"zzMT zzAV zDaka Zombie Spirit",1
"Crazaig",,,171341,JMLS,"zzzJKR zzJKL zzzzzzJMLS zWat Tambor, zzzzGAS",1
"Crazaig",1,0,150236,CLS,"zzzCLS zHan zzChewbacca zzC-3PO zChewpio",1
"Crazaig",0,1,124249,padme,"zzPadme zGK zJKA zAhsoka CW Chewbacca G8",1
"Crazaig",,,477097,Negotiator,"Negotiator HT Anakin's Eta-2, Umbaran SF, Ahsoka's SF, BTL-B Y-wing, Clone Sergeant's ARC-170, Plo's SF",1
"Crazaig",,,441802,HansMF,"Home One, Han's MF, Rebel Y-wing, Bistan's U-wing, Phantom Ghost Cassian's U-wing, Wedge X-wing",1
"Crazaig",0,1,105204,Geonosians,"zzGBA Sun Fac, Geo Soldier, Geo Spy, Poggle",1
"Crazaig",0,1,118570,Grievous,"zzGG zB2 zB1 zMagnaGuard zNute",1
"Crazaig",1,0,128517,Traya,"zzTraya zDN zSion zzEP Sith Empire Trooper",1
"Crazaig",,,115816,Disintegration,"zAurra zzGreef zBoba zzBossk zzThe Mandalorian G8",1
"Crazaig",,,113387,Mon Mothma,"zzMon Mothma, zCara Dune, Lando Wedge Biggs",1
"Crazaig",1,1,97345,Ewoks,"zChirpa Elder zPaploo zWicket zLogray",1
"Crazaig",1,0,138207,ShaakClones,"zzShaak Ti, zRex zEcho (501st), zzFives zARC Trooper",1
"Crazaig",1,1,99493,Carth,"zCarth Onasi, zMission zZaalbar zJuhani zCanderous",1
"Crazaig",1,0,111587,Troopers,"zVeers zStarck zzPiett Magma zDT",1
"Crazaig",1,0,126978,zMaul,"zDarth Maul, zSidious zDooku Sith Marauder, zNest",1
"Crazaig",0,1,91543,Phoenix,"zHera zKanan zSabine G8, zZeb G8, zEzra",1
"Crazaig",0,1,128401,BS,"zBS zzGMY zJolee zzOld Ben, zzHYoda",1
"Crazaig",1,0,72895,Jawas,"Nebit G8, Jawa Engineer G9, Jawa Scavenger G8, Jawa Dathcha G8",1
"Crazaig",,,70515,Admiral Raddus,"Admiral Raddus 5* G3, zCassian G9, Jyn G8, zK-2SO G9, Chirrut G8",0
"Crazaig",,,293358,Malevolence,"Malevolence Hyena Bomber, Vulture Droid 4*, Sun Fac SF, Soldier SF, Spy SF",0
"Crazaig",,,475427,Executrix,"Executrix Tie Adv, Emperor's Shuttle 5*, TIE Reaper, Imperial TIE Fighter, Gauntlet Starfighter, FOSF TIE Fighter, FO TIE Fighter",0
"Crazaig",0,1,103919,BH,"zJango zIG-88 zDengar Cad zGreedo",0
"Crazaig",,,50345,Bad Batch,"Hunter 6* G5, Echo 6* G4, Omega G6, Tech 6* G4, Wrecker G5",0
"Harry",,,175873,JMK,"zzzzzzJMK zAhsoka zzzCAT zzzzGAS zGK",1
"Harry",,,170919,SEE,"zzzzzzSEE zBSF zzMalak zzzDR zzzVader",1
