Player,Offense,Defense,GP,Name,Squad,Viable
"Marren",0,1,104049,Geonosians,"zGBA Sun Fac, Geo Soldier, Geo Spy, Poggle",1
"Marren",0,1,128047,Grievous,"zzGG zB2 zB1 zDroideka MagnaGuard",1
"Marren",1,1,84663,Ewoks,"zChirpa Elder Paploo Wicket Logray",1
"Marren",0,1,117357,BH,"zBossk Boba Dengar G9, zJango zGreef",1
"Marren",1,1,86357,Carth,"Carth Onasi, Mission Zaalbar Juhani Canderous",1
"Marren",1,1,118669,zEP,"zzEP zzzVader Tarkin TFP zMara Jade, The Emperor's Hand",1
"Marren",1,0,142831,501st,"zRex zARC Trooper, zEcho (501st), zzFives zAhsoka",1
"Marren",1,0,97137,Wiggs,"Wedge Biggs Fulcrum Ezra zLeia",1
"Marren",,,79499,Phasma,"Phasma G8, FOTP G9, FOO G8, zKRU Kylo G9",0
"Marren",,,301219,Malevolence,"Malevolence 5* Hyena Bomber 6*, Vulture Droid 6*, Sun Fac SF, Soldier SF, Spy SF",0
"Marren",1,1,111715,JTR,"JTR Scav Rey, BB-8 zR2-D2 Finn",0
"Marren",1,0,97593,Troopers,"zVeers zPiett 5* Gideon Dark Trooper, Range Trooper 5*",0
"Marren",,,86768,Mon Mothma,"Mon Mothma, Kyle Katarn, Lando Bistan G8, Scarif G7",0
"Marren",0,1,127888,BS,"BS zGMY zJolee zGK zHYoda",0
"Kaladin690",0,1,118332,padme,"zzPadme zGK zJKA zAhsoka C-3PO G9",1
"Kaladin690",1,0,117023,CLS,"zzzCLS zHan zChewbacca R2-D2 G8, zChewpio",1
"Kaladin690",0,1,90298,Geonosians,"zGBA Sun Fac, Geo Soldier, Geo Spy, Poggle",1
"Kaladin690",1,1,75739,Ewoks,"zChirpa Elder Paploo Wicket Logray",1
"Kaladin690",0,1,112926,BH,"zzBossk Boba Dengar IG-88 Greef",1
"Kaladin690",0,1,58467,Phoenix,"Hera G8, Chopper G8, Kanan G8, Zeb G8, Ezra",1
"Kaladin690",,,32609,Phasma,"Phasma 5* G8, FOE 5* G8, FOO 5* G8, KRU 5* G8, Kylo 5* G8",0
"Kaladin690",,,390191,Negotiator,"Negotiator 5* HT Anakin's Eta-2, Umbaran SF, Ahsoka's SF, BTL-B Y-wing 6*, Clone Sergeant's ARC-170 5*, Plo's SF",0
"Kaladin690",1,1,44846,NS_Alt,"MT 6* G8, AV G8, Daka 6* G8, Spirit G8, Talia G8",0
"Kaladin690",1,0,59834,ShaakClones,"Shaak Ti G9, Rex G8, Echo (501st) G8, Fives G9, Clone Sergeant G8",0
"Kaladin690",1,1,87157,zEP,"EP zzVader Tarkin G8, TFP zMara Jade, The Emperor's Hand 5* G8",0
"Kaladin690",1,0,43828,Wiggs,"Wedge 5* G8, Biggs G8, Leia G8, Chirrut 5* G8, Baze 6* G8",0
"Harry TBE",1,1,149275,SL Kylo,"zzzzzzSL Kylo, zSith Trooper, zHux zzKRU zThrawn",1
"Harry TBE",1,0,112853,CLS,"zzzCLS zHan zzChewbacca zzR2-D2 zChewpio",1
"Harry TBE",0,1,101128,Geonosians,"zzGBA Sun Fac, Geo Soldier, Geo Spy, Poggle",1
"Harry TBE",,,346526,HansMF,"Home One, Han's MF, HT Ghost Phantom Biggs X-wing, Cassian's U-wing, Wedge X-wing",1
"Harry TBE",1,0,112829,Traya,"zzTraya zDN zSion zBSF zzEP",1
"Harry TBE",1,1,115174,Revan,"zzzJKR zBS zGMY zJolee zGK",1
"Harry TBE",0,1,98305,BH,"zBossk Boba Dengar zJango Cad",1
"Harry TBE",1,1,84123,Carth,"Carth Onasi G9, zMission Zaalbar zJuhani Canderous",1
"Harry TBE",1,0,107524,Troopers,"zVeers zStarck zzPiett zDark Trooper, DT",1
"Harry TBE",0,1,73314,Phoenix,"Hera G9, Chopper G9, Kanan G9, Zeb G8, Ezra",1
"Harry TBE",,,123086,Phasma,"zPhasma zFOTP FOSFTP zFOST zKylo",0
"Harry TBE",1,1,52551,NS_Alt,"MT G8, AV G9, Daka G8, Spirit G8, Talia G8",0
"Harry TBE",1,0,77156,ShaakClones,"zzShaak Ti G9, Rex Echo (501st) G8, Fives Clone Sergeant G9",0
"Harry TBE",1,1,42263,Rogue1,"Jyn 6* G8, Chirrut 5* G8, Baze 6* G8, Cassian G8, K-2SO G8",0
"Algech Algolgomel",0,1,117788,padme,"zzPadme zGK zJKA zAhsoka zC-3PO",1
"Algech Algolgomel",0,1,92782,Geonosians,"zzGBA Sun Fac, Geo Soldier, Geo Spy, Poggle",1
"Algech Algolgomel",0,1,119650,Grievous,"zzGG zB2 zB1 zMagnaGuard zNute",1
"Algech Algolgomel",1,1,129053,Ewoks,"zChirpa Elder zPaploo zWicket zLogray",1
"Algech Algolgomel",1,0,116355,ShaakClones,"zzShaak Ti, zRex zEcho (501st), zzFives zARC Trooper",1
"Algech Algolgomel",0,1,104670,BH,"zzBossk zBoba Dengar zJango zIG-88",1
"Algech Algolgomel",0,1,91368,FO,"zKRU zKylo zFOST FOTP FOO",1
"Algech Algolgomel",0,1,69392,Phoenix,"Hera G8, Chopper G9, Kanan G8, Zeb G8, Ezra",1
"Algech Algolgomel",1,1,98600,NS,"zzMT zzAV zDaka Zombie 6* Spirit",0
"Algech Algolgomel",1,0,105679,CLS,"zzCLS zHan zzChewbacca zzR2-D2 Chewpio 3* G8",0
"Algech Algolgomel",,,303449,Malevolence,"Malevolence Hyena Bomber 6*, Vulture Droid, Sun Fac SF, Soldier SF, Spy SF",0
"Algech Algolgomel",1,0,94429,Traya,"zzTraya DN 5* zSion 5* zzEP zThrawn",0
"Algech Algolgomel",1,0,48396,Troopers,"Veers 5* Starck 6* G6, Range Trooper 4* G8, Snowtrooper G8, DT 6* G8",0
"Algech Algolgomel",1,1,37291,Rogue1,"Jyn 5* G8, Chirrut 5* G8, Baze 5* G8, Cassian G8, K-2SO 5* G8",0
"Algech Algolgomel",1,0,12646,NestSolo (Counter),"Nest 4*",0
"SniperLord",0,1,138190,padme,"zzPadme zGK zJKA zAhsoka zC-3PO",1
"SniperLord",1,0,115351,CLS,"zzzCLS zHan zzChewbacca zzR2-D2 zChewpio",1
"SniperLord",,,452821,Negotiator,"Negotiator HT Anakin's Eta-2, Umbaran SF, Ahsoka's SF, BTL-B Y-wing, Clone Sergeant's ARC-170, Plo's SF",1
"SniperLord",,,364040,HansMF,"Home One, Han's MF, Rebel Y-wing, Bistan's U-wing, Phantom Ghost Cassian's U-wing, Wedge X-wing",1
"SniperLord",0,1,101092,Geonosians,"zzGBA Sun Fac, Geo Soldier, Geo Spy, Poggle",1
"SniperLord",0,1,125770,Grievous,"zzGG zB2 zB1 zDroideka MagnaGuard",1
"SniperLord",1,0,116888,Troopers,"zVeers zzPiett zzGideon Dark Trooper, Range Trooper",1
"SniperLord",,,374223,Executrix,"Executrix Tie Adv, Emperor's Shuttle, TIE Reaper, Imperial TIE Fighter, Gauntlet Starfighter, FOSF TIE Fighter, FO TIE Fighter",1
"SniperLord",1,1,138278,GAS,"zzzzGAS zRex zEcho (501st), zzFives zARC Trooper",1
"SniperLord",1,1,84896,Ewoks,"zChirpa Elder Paploo Wicket Logray",1
"SniperLord",1,1,102258,Revan Offense,"zzzJKR zGMY BS zJolee zEzra",1
"SniperLord",0,1,134028,BH,"zzBossk zBoba Dengar IG-88 Cad",1
"SniperLord",1,1,83868,Carth,"Carth Onasi, zMission zZaalbar Juhani Canderous",1
"SniperLord",1,1,125304,zEP,"zzEP zzzVader Tarkin TFP zBSF",1
"SniperLord",0,1,82502,Phoenix,"zHera Sabine G8, Chopper zKanan zZeb G8",1
"SniperLord",1,1,74698,Rogue1,"Jyn Chirrut G9, Baze G9, Cassian G9, K-2SO G9",1
"SniperLord",,,60585,Phasma,"zPhasma G8, FOTP G9, FOSFTP G6, FOST G8, Kylo G8",0
"SniperLord",,,87137,Nute-Wat,"Nute zDooku zWat Tambor, Jango Nest G6",0
"SniperLord",1,1,52533,NS,"MT G7, AV Daka G9, Zombie G7, Spirit G5",0
"SniperLord",1,0,73072,Thragma (Counter),"Thrawn Magma G7, DT Stormtrooper G9, Shoretrooper",0
"SniperLord",1,0,56290,Jawas,"Nebit G8, Jawa Engineer G7, Jawa Scavenger G7, Jawa G7, Dathcha G7",0
"SniperLord",1,0,7216,SionSolo (Counter),"Sion G7",0
"MINI ASplendidJedi",,,122784,Phasma,"zPhasma zFOTP FOSFTP zFOST zKylo",1
"MINI ASplendidJedi",0,1,133867,DRMalak,"zzzDR zzHK-47 zBSF zzMalak Sith Empire Trooper",1
"MINI ASplendidJedi",0,1,113438,padme,"zzPadme G9, zGK zJKA zAhsoka zzC-3PO",1
"MINI ASplendidJedi",0,1,121981,Geonosians,"zzGBA Sun Fac, Geo Soldier, Geo Spy, Poggle",1
"MINI ASplendidJedi",0,1,123881,Grievous,"zzGG zB2 zB1 zDroideka zMagnaGuard",1
"MINI ASplendidJedi",,,126313,Disintegration,"zzAurra zGreef Boba G9, zzBossk zThe Mandalorian",1
"MINI ASplendidJedi",1,1,88676,Ewoks,"zChirpa Elder Paploo Wicket Logray",1
"MINI ASplendidJedi",1,1,99091,Revan Offense,"zzzJKR zGMY BS zJolee Ezra",1
"MINI ASplendidJedi",1,1,87355,Carth,"Carth Onasi, Mission Zaalbar Juhani G9, zCanderous",1
"MINI ASplendidJedi",1,1,138801,SL Kylo,"zzzzzzSL Kylo, zSith Trooper, zHux zzKRU Thrawn G7",0
"MINI ASplendidJedi",1,0,84873,CLS,"zzzCLS G8, zHan G7, zzChewbacca G9, R2-D2 G9, zChewpio G7",0
"MINI ASplendidJedi",,,331058,Malevolence,"Malevolence Hyena Bomber, Vulture Droid 6*, Sun Fac SF, Soldier SF, Spy SF",0
"MINI ASplendidJedi",,,199632,HansMF,"Home One, Han's MF 6*, Rebel Y-wing 6*, Bistan's U-wing 4*, Phantom Ghost Cassian's U-wing, Biggs X-wing",0
"MINI ASplendidJedi",1,0,89104,ShaakClones,"zzShaak Ti G8, zRex zEcho (501st) G5, zFives zARC Trooper G8",0
"MINI ASplendidJedi",0,1,58074,Phoenix,"Hera G8, Sabine G4, Chopper G8, Kanan G8, Zeb G8",0
"Noooob",1,1,98777,Revan Offense,"zzJKR GMY BS Jolee G8, JKA",1
"Noooob",1,1,64849,Ewoks,"zChirpa G9, Elder G8, Paploo G9, Teebo G8, Scout G8",1
"Noooob",1,1,119337,zEP,"zEP zzzVader zTarkin Krennic TFP",1
"Noooob",0,1,70315,Phoenix,"Hera G8, Chopper G8, Kanan G9, Zeb G8, zEzra",1
"Noooob",,,55062,Phasma,"Phasma G8, FOE G8, FOO G8, KRU G8, Kylo G8",0
"Noooob",1,1,55249,JTR,"JTR G7, Scav Rey G8, BB-8 G8, R2-D2 G6, Finn G8",0
"Noooob",,,73443,Nute-OR,"Nute G8, zDooku Jango G8, Zaalbar G7, Mission G7",0
"Noooob",1,1,42878,NS_Alt,"MT 5* G8, AV G8, Daka G8, Spirit 5* Talia 5* G8",0
"Noooob",0,1,58846,BH,"Bossk 6* G6, Greedo G8, Boba G9, IG-88 G8, Cad G8",0
"Noooob",1,0,45083,501st,"Rex G8, Clone Sergeant 5* G8, Echo (501st) 5* G8, Fives G8, Ahsoka G8",0
"Noooob",1,0,96034,Troopers,"Veers Starck Magma G9, Stormtrooper zzPiett",0
"Noooob",1,0,50748,Wiggs,"Wedge 5* G8, Biggs 5* G8, CLS G8, C-3PO G7, Leia G8",0
"Noooob",1,1,34247,Rogue1,"Jyn 5* G8, Chirrut 5* G8, Baze 5* G8, Cassian 5* G8, K-2SO 5* G8",0
"Good E2 Shoes",,,123498,Phasma,"zPhasma zFOTP FOSFTP zFOST zKylo",1
"Good E2 Shoes",0,1,103977,padme,"zzPadme GK JKA zAhsoka zzC-3PO",1
"Good E2 Shoes",0,1,95416,Geonosians,"zzGBA Sun Fac, Geo Soldier, Geo Spy, Poggle",1
"Good E2 Shoes",,,337193,HansMF,"Home One, Han's MF, HT Ghost Phantom Biggs X-wing, Cassian's U-wing, Wedge X-wing",1
"Good E2 Shoes",0,1,101146,Grievous,"zzGG zB2 zB1 zDroideka zMagnaGuard",1
"Good E2 Shoes",1,1,104226,JTR,"zzzJTR Scav Rey, zzBB-8 zzR2-D2 Finn G9",1
"Good E2 Shoes",1,1,104415,Revan Offense,"zzzJKR GMY zBS zJolee zHYoda G8",1
"Good E2 Shoes",1,1,93905,Ewoks,"zChirpa Elder zPaploo Teebo zWicket",1
"Good E2 Shoes",1,1,92139,Carth,"zCarth Onasi, Mission Zaalbar zJuhani Canderous",1
"Good E2 Shoes",0,1,106415,BH,"zzBossk zBoba zzJango IG-88 Cad",1
"Good E2 Shoes",1,1,125635,zEP,"zzEP zzzVader Tarkin G9, zSith Trooper, zBSF",1
"Good E2 Shoes",0,1,74378,Phoenix,"Hera G9, Chopper G9, zKanan Zeb G9, Ezra",1
"Good E2 Shoes",1,0,17313,NestSolo (Counter),"zNest G9",1
"Good E2 Shoes",1,0,101782,CLS,"zzzCLS zHan Leia G9, Old Ben G9, zzChewbacca",0
"Good E2 Shoes",1,0,60595,Jawas,"Nebit G7, Jawa Engineer G7, Jawa Scavenger G7, Jawa G7, Dathcha G7",0
"Dark Baszko",0,1,143561,padme,"zzPadme zGK zJKA zAhsoka zzC-3PO",1
"Dark Baszko",1,0,99257,CLS,"zzCLS zHan zChewbacca R2-D2 Chewpio",1
"Dark Baszko",,,485105,Negotiator,"Negotiator HT Anakin's Eta-2, Umbaran SF, Ahsoka's SF, BTL-B Y-wing, Plo's SF, Rex's ARC-170",1
"Dark Baszko",,,85672,Disintegration,"Aurra Greef Boba G8, zBossk The Mandalorian G8",1
"Dark Baszko",1,1,119395,GAS,"zzzzGAS zRex zEcho (501st), zzFives ARC Trooper",1
"Dark Baszko",1,1,83032,Ewoks,"zChirpa Elder Paploo Wicket Logray",1
"Dark Baszko",0,1,70653,Phoenix,"Hera G9, Chopper G8, Kanan G9, Zeb G8, Ezra",1
"Dark Baszko",0,1,71818,Geonosians,"zGBA Sun Fac G8, Geo Soldier, Geo Spy G8, Poggle G8",0
"Dark Baszko",0,1,115433,Grievous,"zGG zB2 zB1 zMagnaGuard Nute G9",0
"Dark Baszko",0,1,85168,DR,"zzDR G9, HK-47 zBSF Sith Empire Trooper 4* G7, Thrawn",0
"Dark Baszko",0,1,84759,BH,"Jango zZam Embo IG-88 6* Cad G7",0
"Dan",,,122906,Phasma,"zPhasma zFOTP FOSFTP zFOST zKylo",1
"Dan",1,1,144581,SL Kylo,"zzzzzzSL Kylo, zSith Trooper, zHux zzKRU Thrawn",1
"Dan",1,0,137609,CLS,"zzzCLS zHan zzChewbacca zzC-3PO zChewpio",1
"Dan",0,1,109006,padme,"zzPadme zGK zJKA zAhsoka CW Chewbacca G8",1
"Dan",,,415125,Negotiator,"Negotiator BTL-B Y-wing 6*, Anakin's Eta-2, Rex's ARC-170, Umbaran SF, Ahsoka's SF, Plo's SF, Clone Sergeant's ARC-170",1
"Dan",,,361426,HansMF,"Home One, Han's MF, Rebel Y-wing, Bistan's U-wing, Phantom Ghost Cassian's U-wing, Wedge X-wing",1
"Dan",0,1,96988,Geonosians,"zzGBA Sun Fac, Geo Soldier, Geo Spy, Poggle",1
"Dan",1,1,106330,JTR,"zzzJTR Scav Rey, zzBB-8 zzR2-D2 zFinn",1
"Dan",1,1,139217,GAS,"zzzzGAS zRex zEcho (501st), zzFives zARC Trooper",1
"Dan",1,1,110307,Revan Offense,"zzzJKR GMY zBS zJolee zzHYoda",1
"Dan",1,1,110091,Ewoks,"zChirpa Elder zPaploo zWicket zLogray",1
"Dan",0,1,107288,BH,"zzBossk zZam zBoba zJango Cad",1
"Dan",1,1,113196,zEP,"zzEP zzzVader Tarkin TFP G9, zzTraya",1
"Dan",0,1,69296,Phoenix,"Hera Sabine G8, Kanan G8, Zeb Ezra",1
"Dan",1,0,14614,SionSolo (Counter),"Sion G9",1
"Dan",0,1,100802,Grievous,"zGG zB2 zB1 MagnaGuard zNute",0
"Dan",1,1,70077,NS,"MT G9, zAV Daka G7, Zombie G5, Spirit G7",0
"Dan",1,0,80348,Troopers,"zVeers zPiett G9, Gideon Dark Trooper G9, Range Trooper G8",0
"Dan",,,87897,Mon Mothma,"zzMon Mothma, Wedge Lando Hoth Rebel Scout G8, Biggs",0
"ISB Coøkie",,,152496,SEE,"zzzzzzSEE BSF zzMalak zzzDR zzVader",1
"ISB Coøkie",0,1,132192,padme,"zzPadme zGK zJKA zAhsoka zC-3PO",1
"ISB Coøkie",,,287253,Malevolence,"Malevolence 5* Hyena Bomber, Vulture Droid, Sun Fac SF, Soldier SF, Spy SF",1
"ISB Coøkie",,,431617,Negotiator,"Negotiator HT Anakin's Eta-2, Umbaran SF, Ahsoka's SF, BTL-B Y-wing, Plo's SF, Rex's ARC-170",1
"ISB Coøkie",0,1,102916,Geonosians,"zGBA Sun Fac, Geo Soldier, Geo Spy, Poggle",1
"ISB Coøkie",0,1,110842,Grievous,"zzGG zB2 zB1 zDroideka MagnaGuard",1
"ISB Coøkie",1,0,102773,Troopers,"zVeers zzPiett Gideon Dark Trooper, Range Trooper",1
"ISB Coøkie",1,1,118833,GAS,"zzzzGAS zRex Echo (501st), zzFives ARC Trooper",1
"ISB Coøkie",1,1,105510,Revan Offense,"zzzJKR zzGMY zBS zJolee Ezra",1
"ISB Coøkie",1,1,80808,Ewoks,"zChirpa Elder Paploo Wicket Logray",1
"ISB Coøkie",1,1,85159,Carth,"zCarth Onasi, zMission Zaalbar Juhani G8, zCanderous",1
"ISB Coøkie",0,1,87388,BH,"zBossk Boba Jango The Mandalorian, Greef",1
"ISB Coøkie",0,1,99664,FO,"zzKRU zKylo zHux FOE FOO",1
"ISB Coøkie",1,0,94959,EP (Counter, Rebel),"zEP Shoretrooper G8, Krennic DT G8, Starck",1
"ISB Coøkie",1,0,85118,CLS,"zzCLS zHan zChewbacca R2-D2 G8, Chewpio G8",0
"ISB Coøkie",,,258863,HansMF,"Home One, Han's MF, Rebel Y-wing 5*, Ghost Phantom Biggs X-wing, Cassian's U-wing, Wedge X-wing",0
"ISB Coøkie",1,1,79942,NS,"zMT G9, zAV zDaka G9, Zombie Spirit G8",0
"ISB Coøkie",1,0,88065,Traya,"zTraya G7, DN G8, Sion G6, Dooku zThrawn",0
"ISB Coøkie",0,1,57589,Phoenix,"Hera G8, Sabine 5* G8, Chopper G9, Kanan G8, Zeb G8",0
"ISB Coøkie",1,1,50612,Rogue1,"Jyn 5* G8, Chirrut 5* G8, Baze G8, Cassian G8, K-2SO G8",0
"ISB Coøkie",,,65552,Bad Batch,"zHunter G8, Echo G8, Omega 5* G2, Tech G8, zWrecker G8",0
"Shart69",0,1,106441,DRMalak,"zzDR HK-47 zBSF zzMalak Sith Empire Trooper",1
"Shart69",0,1,111152,padme,"zzPadme zGK zJKA zAhsoka zC-3PO",1
"Shart69",1,0,105296,CLS,"zzzCLS zHan zzChewbacca R2-D2 G8, zChewpio",1
"Shart69",0,1,95865,Geonosians,"zzGBA Sun Fac, Geo Soldier, Geo Spy, Poggle",1
"Shart69",0,1,109328,Grievous,"zzGG zB2 zB1 MagnaGuard zNute",1
"Shart69",1,1,130314,GAS,"zzzzGAS zRex zEcho (501st), zzFives ARC Trooper",1
"Shart69",1,1,96226,Revan Offense,"zzzJKR GMY BS zJolee Ezra G8",1
"Shart69",1,1,78779,Ewoks,"zChirpa G9, Elder Paploo Wicket Logray",1
"Shart69",1,1,81910,Carth,"zCarth Onasi, zMission zZaalbar Juhani G8, Canderous",1
"Shart69",0,1,77653,BH,"zBossk Boba G9, Jango The Mandalorian G8, Greef G9",1
"Shart69",0,1,105875,FO,"zzKRU zKylo zHux 6* FOE FOO",1
"Shart69",1,1,88933,zEP,"EP zzVader Tarkin G7, Dooku zSith Trooper 6*",0
"Zenithier",,,175907,JMK,"zzzzzzJMK zAhsoka zzzCAT zzzzGAS zGK",1
"Zenithier",,,123041,Phasma,"zPhasma zFOTP FOSFTP zFOST zKylo",1
"Zenithier",,,139291,SK,"zzEP zzMara Jade, The Emperor's Hand, zzStarkiller zJuhani zVisas",1
"Zenithier",1,1,166546,SL Kylo,"zzzzzzSL Kylo, zSith Trooper, zHux zzKRU zzThrawn",1
"Zenithier",,,164783,SEE,"zzzzzzSEE zBSF zzMalak zzzDR zzzVader",1
"Zenithier",1,0,143125,CLS,"zzzCLS zHan zzChewbacca zC-3PO zChewpio",1
"Zenithier",,,155286,JMLS,"zzzzzzJMLS zzJKL zzHYoda zzOld Ben, zEzra",1
"Zenithier",1,1,102014,NestSisters,"zzAV zzMT zDaka Zombie zNest",1
"Zenithier",,,522417,Negotiator,"Negotiator HT Anakin's Eta-2, Umbaran SF, Ahsoka's SF, BTL-B Y-wing, Clone Sergeant's ARC-170, Plo's SF",1
"Zenithier",,,330504,Malevolence,"Malevolence Hyena Bomber, Vulture Droid, Sun Fac SF, Soldier SF, Spy SF",1
"Zenithier",,,416835,HansMF,"Home One, Han's MF, Rebel Y-wing, Bistan's U-wing, Phantom Biggs X-wing, Cassian's U-wing, Wedge X-wing",1
"Zenithier",0,1,107314,Geonosians,"zzGBA Sun Fac, Geo Soldier, Geo Spy, Poggle",1
"Zenithier",0,1,122471,Grievous,"zzGG zB2 zB1 MagnaGuard zNute",1
"Zenithier",1,0,113984,Traya,"zzTraya zDN zSion zDooku Sith Empire Trooper",1
"Zenithier",1,1,126452,JTR,"zzzJTR Scav Rey, zBB-8 zzR2-D2 Finn",1
"Zenithier",,,106637,Mon Mothma,"zzMon Mothma, Wedge zCara Dune, Hoth Rebel Scout, zPao",1
"Zenithier",,,125237,Disintegration,"Aurra zzGreef zBoba zzBossk zThe Mandalorian",1
"Zenithier",1,1,140395,Revan Offense,"zzzJKR zGMY zBS zJolee zJKA",1
"Zenithier",1,1,76062,Ewoks,"zChirpa G9, Elder Paploo zWicket Logray",1
"Zenithier",1,0,141509,ShaakClones,"zzShaak Ti, zRex zEcho (501st), zzFives zARC Trooper",1
"Zenithier",1,1,89380,Carth,"zCarth Onasi, zMission zZaalbar zVandor Chewbacca, Canderous G8",1
"Zenithier",1,0,110694,Troopers,"zVeers zStarck Stormtrooper zzPiett DT",1
"Zenithier",0,1,76219,Phoenix,"zHera Sabine G8, Chopper G8, zKanan G8, zZeb G8",1
"Zenithier",1,1,77743,Rogue1,"Jyn Chirrut Baze Cassian K-2SO G9",1
"Zenithier",0,1,122043,BH,"zJango Zam Dengar IG-88 Cad",0
"Zenithier",,,76824,Bad Batch,"zHunter G9, zEcho Omega G8, zTech G9, zWrecker G9",0
"Zenithier",1,0,56365,Jawas,"Nebit G7, Jawa Engineer G9, Jawa Scavenger G7, Jawa G7, Dathcha G7",0
"lnquisitor Maze",,,120691,Phasma,"zPhasma FOE FOSFTP zzKRU zKylo",1
"lnquisitor Maze",,,284701,HansMF,"Home One, Han's MF, Rebel Y-wing, Bistan's U-wing, Phantom Ghost Cassian's U-wing, Wedge X-wing",1
"lnquisitor Maze",,,388925,Negotiator,"Negotiator HT Anakin's Eta-2, Umbaran SF, Ahsoka's SF, Clone Sergeant's ARC-170, Plo's SF, Rex's ARC-170",1
"lnquisitor Maze",0,1,105714,Geonosians,"zzGBA Sun Fac, Geo Soldier, Geo Spy, Poggle",1
"lnquisitor Maze",1,0,124773,Troopers,"zVeers zzPiett zGideon zDark Trooper, Range Trooper",1
"lnquisitor Maze",1,1,97061,Revan,"zzzJKR G9, BS G9, zGMY zJolee zGK",1
"lnquisitor Maze",1,0,129128,ShaakClones,"zzShaak Ti, Rex Echo (501st), zzFives zARC Trooper",1
"lnquisitor Maze",0,1,95714,BH,"zBossk zZam Boba Dengar G9, Cad",1
"lnquisitor Maze",1,1,113151,zEP,"zzEP zzzVader Tarkin TFP G8, zSith Trooper",1
"lnquisitor Maze",0,1,70584,Phoenix,"Hera G9, Chopper G9, zKanan G8, Zeb G8, Ezra G8",1
"lnquisitor Maze",1,0,11394,NestSolo (Counter),"Nest G8",1
"lnquisitor Maze",,,266424,Malevolence,"Malevolence 5* Hyena Bomber 4*, Vulture Droid 6*, Sun Fac SF, Soldier SF, Spy SF",0
"lnquisitor Maze",1,1,74627,NS,"MT G9, AV Daka Zombie Spirit G9",0
"lnquisitor Maze",0,1,71236,Grievous,"GG G9, B2 G6, MagnaGuard zDooku IG-88",0
"lnquisitor Maze",,,61307,Mon Mothma,"Mon Mothma 6* G8, Wedge G8, Hoth Rebel Scout G9, Biggs G8, K-2SO G8",0
"lnquisitor Maze",1,1,63418,Ewoks,"Chirpa G8, Elder Paploo G9, Wicket Logray",0
"lnquisitor Maze",1,1,48952,Rogue1,"Jyn G8, Chirrut G8, Baze 6* G8, Cassian G8, Scarif G6",0
"lnquisitor Maze",,,41978,Bad Batch,"Hunter 5* G8, Echo 4* G8, Omega G8, Tech 4* G8, Wrecker 6* G9",0
"lnquisitor Maze",1,0,70305,QGJ,"zQGJ G8, Aayla G5, JKA Old Ben G9, Ahsoka",0
"2Crunchy",0,1,87532,Geonosians,"zGBA Sun Fac, Geo Soldier, Geo Spy, Poggle",1
"2Crunchy",0,1,94843,BH,"zBossk zZam Boba G9, The Mandalorian, zGreef",1
"2Crunchy",0,1,134533,FO,"zzKRU zKylo zFOST zHux FOE",1
"2Crunchy",1,0,15966,SionSolo (Counter),"Sion",1
"2Crunchy",1,0,84715,CLS,"CLS zHan zChewbacca R2-D2 G8, Chewpio",0
"2Crunchy",1,1,90186,Revan,"zzzJKR BS GMY G6, zJolee GK",0
"2Crunchy",1,1,104483,zEP,"EP zVader Tarkin G8, zSith Trooper, zTraya",0
"2Crunchy",0,1,52323,Phoenix,"Hera G8, Chopper G7, Kanan G8, Zeb G8, Ezra G8",0
"IKEA",0,1,122220,padme,"zzPadme zGK zJKA zAhsoka zzC-3PO",1
"IKEA",0,1,107475,DRMalak,"zzzDR HK-47 BSF zzMalak Thrawn",1
"IKEA",0,1,86411,Geonosians,"zGBA Sun Fac, Geo Soldier, Geo Spy, Poggle",1
"IKEA",0,1,99500,Grievous,"zzGG zB2 zB1 Droideka MagnaGuard",1
"IKEA",1,1,107859,Revan Offense,"zzzJKR zGMY BS zJolee Ezra",1
"IKEA",1,1,85448,Ewoks,"zChirpa Elder zPaploo zWicket Logray G9",1
"IKEA",1,1,82301,Carth,"zCarth Onasi, Mission Zaalbar Juhani G9, Canderous",1
"IKEA",0,1,88119,BH,"zBossk Boba Jango The Mandalorian, Greef",1
"IKEA",1,0,96836,CLS,"zCLS zHan zChewbacca R2-D2 G8, Chewpio",0
"IKEA",,,222668,Malevolence,"Malevolence 6* Hyena Bomber 4*, Vulture Droid 3*, Sun Fac SF, Soldier SF, Spy SF",0
"IKEA",1,0,49039,Troopers,"Veers Piett 6* G5, Gideon 4* G7, Dark Trooper 5* G9, Range Trooper 6* G8",0
"IKEA",1,0,60406,ShaakClones,"zzShaak Ti G9, Rex G6, Echo (501st) G2, Fives ARC Trooper G2",0
"Ronin Khael",1,1,147023,SL Kylo,"zzzzzzSL Kylo, zSith Trooper, zHux zzKRU zThrawn",1
"Ronin Khael",0,1,102522,padme,"zzPadme zGK JKA Ahsoka zC-3PO",1
"Ronin Khael",,,292613,Malevolence,"Malevolence 6* Hyena Bomber, Vulture Droid, Sun Fac SF, Soldier SF, Spy SF",1
"Ronin Khael",0,1,100480,Geonosians,"zzGBA Sun Fac, Geo Soldier, Geo Spy, Poggle",1
"Ronin Khael",1,1,102750,Revan Offense,"zzzJKR zGMY BS zJolee Ezra",1
"Ronin Khael",1,1,91269,Ewoks,"zChirpa Elder zPaploo Scout zWicket",1
"Ronin Khael",0,1,121121,BH,"zzBossk zBoba Dengar Jango IG-88",1
"Ronin Khael",1,1,125453,zEP,"zzEP zzzVader Tarkin TFP zBSF",1
"Ronin Khael",,,122863,Phasma,"zPhasma zFOTP FOSFTP zFOST zKylo",0
"Ronin Khael",1,0,88499,CLS,"zzCLS zHan Chewbacca R2-D2 G8, Chewpio G8",0
"Ronin Khael",0,1,60876,Grievous,"zzGG B2 G7, B1 G2, MagnaGuard G7, Nute G4",0
"Ronin Khael",1,1,46782,NS_Alt,"AV G9, Daka G3, Zombie 6* G7, Spirit G3, Talia G5",0
"Ronin Khael",1,1,84458,Carth,"Carth Onasi, zMission Zaalbar Juhani G7, Canderous",0
"Ronin Khael",1,0,64580,ShaakClones,"Shaak Ti, Rex G8, Echo (501st) G7, Fives G9, Clone Sergeant G2",0
"Ronin Khael",,,69745,Mando,"The Mandalorian (Beskar Armor) G8, Dash Rendar G9, Nest G7, IG-11 G9, Kuiil G8",0
"BlackKobra77",,,121463,Phasma,"zPhasma zFOTP FOSFTP zFOST zKylo",1
"BlackKobra77",,,344115,HansMF,"Home One, Han's MF, HT Bistan's U-wing, Phantom Ghost Cassian's U-wing, Wedge X-wing",1
"BlackKobra77",0,1,90051,Geonosians,"zGBA Sun Fac, Geo Soldier, Geo Spy, Poggle",1
"BlackKobra77",0,1,98847,BH,"zzBossk Boba Dengar G9, Jango IG-88",1
"BlackKobra77",1,1,122179,zEP,"zEP zzzVader Tarkin TFP zSith Trooper",1
"BlackKobra77",0,1,71906,Phoenix,"Hera Chopper G9, Kanan G9, Zeb G9, Ezra G9",1
"BlackKobra77",1,0,20028,SionSolo (Counter),"zSion",1
"BlackKobra77",1,0,78069,CLS,"CLS Han Chewbacca R2-D2 G8, Chewpio 5*",0
"BlackKobra77",1,0,77615,Troopers,"zVeers zPiett G9, Gideon Dark Trooper G9, Range Trooper 6* G9",0
"BlackKobra77",1,1,46921,NS,"MT 6* G8, AV 6* G8, Daka G9, Zombie 5* G8, Spirit 6* G8",0
"BlackKobra77",1,0,57553,501st,"Rex G8, Clone Sergeant G8, Echo (501st) G8, Fives G8, Ahsoka",0
"BlackKobra77",,,65036,Iden Troopers,"zIden Versio 3*, Shoretrooper G8, Snowtrooper G8, Magma G8, DT G8",0
"BlackKobra77",1,1,47431,Rogue1,"Jyn G8, Chirrut 5* G8, Baze 5* G8, Cassian G8, K-2SO G8",0
"BlackKobra77",0,1,74322,BS,"BS 5* zGMY Jolee 4* G8, GK G8, JKA",0
"MrEMustard",,,569116,Executor,"Executor HT RC Xanadu Blood, Slave I, IG-2000 Imperial TIE Fighter, Tie Adv",1
"MrEMustard",1,0,124184,CLS,"zzzCLS zHan zChewbacca C-3PO zChewpio",1
"MrEMustard",,,357879,HansMF,"Home One, Han's MF, Rebel Y-wing, Ghost Phantom Biggs X-wing, Cassian's U-wing, Wedge X-wing",1
"MrEMustard",0,1,87991,Geonosians,"zGBA Sun Fac, Geo Soldier, Geo Spy, Poggle",1
"MrEMustard",1,0,86292,Traya,"zzTraya DN Sion G9, zEP Thrawn",1
"MrEMustard",,,111966,Disintegration,"Aurra zGreef Boba zzBossk The Mandalorian",1
"MrEMustard",1,1,113226,Revan Offense,"zzzJKR GMY BS zJolee HYoda",1
"MrEMustard",1,1,74415,Ewoks,"zChirpa G9, Elder Paploo Wicket Logray G9",1
"MrEMustard",0,1,67611,Phoenix,"Hera G8, Chopper G8, Kanan G9, Zeb G8, Ezra",1
"MrEMustard",1,1,53684,Rogue1,"Jyn G8, Chirrut G8, Baze G8, Cassian G8, K-2SO G8",1
"MrEMustard",1,0,14187,NestSolo (Counter),"Nest G9",1
"MrEMustard",,,49296,Phasma,"Phasma G8, FOTP G7, FOO G8, KRU G8, Kylo 5* G8",0
"MrEMustard",0,1,61508,padme,"Padme G7, GK G7, JKA Ahsoka G9, CW Chewbacca G6",0
"MrEMustard",,,263751,Negotiator,"Negotiator 6* BTL-B Y-wing 5*, Anakin's Eta-2, Rex's ARC-170 5*, Umbaran SF, Ahsoka's SF, Plo's SF, Clone Sergeant's ARC-170",0
"MrEMustard",1,0,101353,Troopers,"zVeers zzPiett Gideon 4* G7, zDark Trooper, Range Trooper",0
"MrEMustard",,,59628,Nute-OR,"Nute G7, Dooku G8, Jango Zaalbar G7, Mission G8",0
"MrEMustard",,,81629,Mon Mothma,"zMon Mothma 6* G8, Wedge Cara Dune G9, Lando Biggs",0
"MrEMustard",1,1,53644,NS_Alt,"MT G8, AV G8, Daka G8, Spirit G8, Talia G8",0
"MrEMustard",1,0,53507,Clones,"Cody G8, Rex G8, Echo (501st) G8, Fives G8, Clone Sergeant G8",0
"MrEMustard",,,52881,Iden Troopers,"Iden Versio 4* G7, Shoretrooper G8, Snowtrooper G8, Magma G7, DT G8",0
"Soojalembene",,,160719,SEE,"zzzzzzSEE zBSF zzMalak zzzDR zzzVader",1
"Soojalembene",0,1,131086,padme,"zzPadme zGK zJKA zAhsoka zzC-3PO",1
"Soojalembene",1,0,113727,CLS,"zzzCLS zHan zzChewbacca R2-D2 G9, zChewpio",1
"Soojalembene",,,444126,Negotiator,"Negotiator HT Anakin's Eta-2, Umbaran SF, Ahsoka's SF, BTL-B Y-wing, Plo's SF, Rex's ARC-170",1
"Soojalembene",0,1,93491,Geonosians,"zzGBA Sun Fac, Geo Soldier, Geo Spy, Poggle",1
"Soojalembene",1,0,112380,Troopers,"zVeers zzPiett zGideon zDark Trooper, Range Trooper",1
"Soojalembene",1,1,112271,Revan Offense,"zzzJKR zGMY BS zJolee zHYoda",1
"Soojalembene",1,1,83316,Ewoks,"zChirpa Elder Paploo Wicket Logray",1
"Soojalembene",0,1,92117,BH,"zzBossk Aurra Boba Dengar Jango",1
"Soojalembene",0,1,66558,Phoenix,"Hera G9, Chopper G8, Kanan G8, Zeb G8, Ezra",1
"Soojalembene",1,1,82073,Carth,"Carth Onasi, zMission zZaalbar Juhani G7, Canderous",0
"LordSliepy81",,,123525,Phasma,"zPhasma zFOTP FOSFTP zFOST zKylo",1
"LordSliepy81",1,1,152417,SL Kylo,"zzzzzzSL Kylo, zSith Trooper, zHux zzKRU zThrawn",1
"LordSliepy81",1,0,107527,CLS,"zzzCLS zHan zChewbacca R2-D2 Chewpio",1
"LordSliepy81",,,303573,HansMF,"Home One, Han's MF 5*, Rebel Y-wing, Bistan's U-wing, Phantom Ghost Cassian's U-wing, Biggs X-wing",1
"LordSliepy81",0,1,117159,Geonosians,"zzGBA Sun Fac, Geo Soldier, Geo Spy, Poggle",1
"LordSliepy81",0,1,95239,Grievous,"zzGG B2 zB1 Droideka G9, MagnaGuard G9",1
"LordSliepy81",1,1,74444,Ewoks,"zChirpa G9, Elder Paploo Wicket Logray",1
