Player,Offense,Defense,GP,Name,Squad,Viable
"LordSliepy81",1,0,114538,ShaakClones,"zzShaak Ti, Rex Echo (501st), zzFives zARC Trooper",1
"LordSliepy81",0,1,99968,BH,"zzBossk Boba Dengar G9, Jango The Mandalorian",1
"LordSliepy81",1,1,102860,zEP,"zEP zzVader Tarkin TFP G8, Sion G8",1
"LordSliepy81",0,1,75494,Phoenix,"Hera Chopper Kanan G8, zZeb G8, Ezra",1
"LordSliepy81",1,0,19468,NestSolo (Counter),"zNest",1
"LordSliepy81",0,1,126020,padme,"zzPadme zGK zJKA zAhsoka C-3PO 6*",0
"LordSliepy81",,,341152,Malevolence,"Malevolence Hyena Bomber, Vulture Droid 6*, Sun Fac SF, Soldier SF, Spy SF",0
"LordSliepy81",1,1,57855,NS,"MT 6* G8, AV Daka G8, Zombie G8, Spirit G8",0
"LordSliepy81",1,0,63957,Troopers,"Veers Starck G9, Snowtrooper G8, Iden Versio G8, Piett 6* G8",0
"LordSliepy81",1,1,61681,Rogue1,"Jyn G8, Chirrut G8, Baze 5* G8, Cassian G8, K-2SO G8",0
"LordSliepy81",0,1,93648,BS,"BS zGMY zJolee Old Ben G9, HYoda",0
"liam3265",,,130011,Phasma,"zPhasma zFOTP zSith Trooper, zzKRU zKylo",1
"liam3265",0,1,92132,Geonosians,"zzGBA Sun Fac, Geo Soldier, Geo Spy, Poggle",1
"liam3265",0,1,84188,BH,"zBossk zBoba Dengar G9, Jango IG-88 G8",1
"liam3265",0,1,62498,Phoenix,"Hera Chopper G9, Kanan G9, Zeb G9, Ezra G9",1
"liam3265",1,0,81621,CLS,"zzCLS zHan Chewbacca zC-3PO 6* G9, Chewpio 5*",0
"liam3265",1,1,67720,Ewoks,"zChirpa 6* G9, Elder Paploo G9, Wicket 6* G9, Logray",0
"liam3265",1,0,6153,SionSolo (Counter),"Sion G4",0
"tanjo",,,136415,Phasma,"zPhasma FOE zSith Trooper, zzKRU zKylo",1
"tanjo",1,1,97149,NS,"zzMT zzAV Daka Zombie Spirit",1
"tanjo",0,1,138184,DRMalak,"zzzDR zzHK-47 zBSF zzMalak Sith Empire Trooper",1
"tanjo",0,1,108698,padme,"zzPadme zGK zJKA zAhsoka zzC-3PO",1
"tanjo",1,0,113525,Traya,"zzTraya DN zSion zzEP zThrawn",1
"tanjo",1,1,98967,JTR,"zJTR Scav Rey, zBB-8 zzR2-D2 RT",1
"tanjo",1,1,105334,Revan Offense,"zzzJKR zGMY BS zJolee HYoda",1
"tanjo",1,1,81906,Ewoks,"zChirpa Elder Paploo Scout Logray",1
"tanjo",0,1,100402,BH,"zzBossk Greedo zBoba Dengar zJango",1
"tanjo",1,1,89056,Carth,"zCarth Onasi, zMission zZaalbar Juhani Canderous",1
"tanjo",1,0,98031,Wiggs,"Wedge G9, Biggs zzCLS zHan zzChewbacca",1
"tanjo",0,1,67325,Phoenix,"Hera G8, Chopper G8, Kanan G8, Zeb G8, Ezra",1
"tanjo",,,311175,HansMF,"Home One, Han's MF 5*, HT Bistan's U-wing, Phantom Ghost Cassian's U-wing, Biggs X-wing",0
"tanjo",1,0,69920,ShaakClones,"Shaak Ti, Rex Echo (501st) G8, Fives G9, ARC Trooper G8",0
"tanjo",1,1,46392,Rogue1,"Jyn 5* G8, Chirrut G8, Baze 5* G8, Cassian G8, K-2SO G8",0
"Redaxfive",0,1,118758,DRMalak,"zzzDR zHK-47 zBSF zzMalak Sith Empire Trooper G8",1
"Redaxfive",0,1,122148,padme,"zzPadme zGK zJKA zAhsoka zC-3PO",1
"Redaxfive",1,0,96916,CLS,"zzCLS zHan zChewbacca R2-D2 G8, Chewpio",1
"Redaxfive",,,425687,Negotiator,"Negotiator HT Anakin's Eta-2, Umbaran SF, Ahsoka's SF, BTL-B Y-wing, Clone Sergeant's ARC-170, Plo's SF",1
"Redaxfive",0,1,85381,Geonosians,"zGBA G9, Sun Fac, Geo Soldier, Geo Spy, Poggle",1
"Redaxfive",0,1,116029,Grievous,"zzGG zB2 zB1 zDroideka MagnaGuard",1
"Redaxfive",,,92960,Nute-OR,"zNute zDooku Jango zZaalbar Mission",1
"Redaxfive",1,1,122155,Revan Offense,"zzzJKR zGMY BS zJolee HYoda",1
"Redaxfive",1,1,78676,Ewoks,"zChirpa G9, Elder Paploo Wicket Logray",1
"Redaxfive",0,1,96125,BH,"zBossk Boba Dengar G8, zThe Mandalorian, zGreef",1
"Redaxfive",1,1,91887,zEP,"zEP zzzVader Tarkin G9, TFP G9, zzTraya G9",1
"Redaxfive",0,1,68725,Phoenix,"Hera G8, Chopper G9, Kanan G9, Zeb G8, Ezra",1
"Redaxfive",1,0,17259,SionSolo (Counter),"zSion G9",1
"Redaxfive",,,62839,Phasma,"Phasma G7, FOTP 6* G8, FOO KRU Kylo G8",0
"Redaxfive",,,241185,Malevolence,"Malevolence 5* Hyena Bomber 4*, Vulture Droid 4*, Sun Fac SF, Soldier SF, Spy SF",0
"Redaxfive",1,1,108105,GAS,"zzzzGAS zRex zEcho (501st) G8, zzFives zARC Trooper G8",0
"Redaxfive",,,55610,Mon Mothma,"zMon Mothma G7, Kyle Katarn G8, Cara Dune G7, Biggs G8, Pao G7",0
"Redaxfive",1,0,48688,Troopers,"Veers G6, Starck G7, zPiett G7, Dark Trooper G7, Gideon G6",0
"GunnyThePunisher",,,126051,Phasma,"zPhasma zFOTP FOSFTP FOST zKylo",1
"GunnyThePunisher",1,1,148475,SL Kylo,"zzzzzzSL Kylo, zSith Trooper, zHux zzKRU Thrawn",1
"GunnyThePunisher",1,0,140984,CLS,"zzzCLS zHan zzChewbacca zC-3PO Chewpio",1
"GunnyThePunisher",,,414421,HansMF,"Home One, Han's MF, Rebel Y-wing 6*, Bistan's U-wing, Phantom Biggs X-wing, Cassian's U-wing, Wedge X-wing",1
"GunnyThePunisher",0,1,98470,Geonosians,"zzGBA Sun Fac, Geo Soldier, Geo Spy, Poggle",1
"GunnyThePunisher",,,111341,Mon Mothma,"zzMon Mothma, Wedge zCassian Lando Biggs",1
"GunnyThePunisher",1,1,104315,Revan,"zzzJKR zBS GMY zJolee GK G8",1
"GunnyThePunisher",1,1,85212,Ewoks,"zChirpa Elder zPaploo Wicket Logray G9",1
"GunnyThePunisher",0,1,101212,BH,"zzBossk zZam Boba Dengar G9, Cad",1
"GunnyThePunisher",1,1,89225,Carth,"zCarth Onasi, Mission Zaalbar Juhani Canderous",1
"GunnyThePunisher",1,1,112350,zEP,"zEP zzzVader Tarkin TFP G8, zBSF",1
"GunnyThePunisher",1,0,111802,Wampa (Counter),"Rex zzWampa zzHYoda Jyn FOO",1
"GunnyThePunisher",0,1,71753,Phoenix,"Hera G9, Chopper Kanan G9, Zeb G8, Ezra",1
"GunnyThePunisher",1,0,14140,SionSolo (Counter),"Sion G9",1
"GunnyThePunisher",1,1,78602,NS,"zMT G9, AV zDaka Zombie Spirit G8",0
"GunnyThePunisher",1,1,103855,JTR,"zJTR Scav Rey, BB-8 G8, zR2-D2 Finn G9",0
"GunnyThePunisher",0,1,71056,Grievous,"GG G9, B2 G8, Droideka G8, Dooku IG-88",0
"GunnyThePunisher",1,0,65292,Troopers,"Veers G9, Starck G7, zIden Versio 3* G8, zGideon 5* G9, DT G8",0
"GunnyThePunisher",0,1,70844,BH,"zJango G9, Greedo G8, The Mandalorian G7, zGreef G9, Nest 6* G9",0
"Caseyyy",0,1,129082,padme,"zzPadme zGK zJKA zAhsoka C-3PO",1
"Caseyyy",0,1,97139,Geonosians,"zzGBA Sun Fac, Geo Soldier, Geo Spy, Poggle",1
"Caseyyy",0,1,126802,Grievous,"zzGG zB2 zB1 MagnaGuard zNute",1
"Caseyyy",1,1,141052,GAS,"zzzzGAS zRex zEcho (501st), zzFives zARC Trooper",1
"Caseyyy",1,1,114466,Revan Offense,"zzzJKR zzGMY zBS zJolee HYoda",1
"Caseyyy",1,1,82544,Ewoks,"zChirpa G9, Elder Paploo zWicket Logray G9",1
"Caseyyy",0,1,113561,BH,"zzBossk Boba Dengar IG-88 zGreef",1
"Caseyyy",1,1,123434,zEP,"zzEP zzVader Tarkin Krennic TFP",1
"Caseyyy",1,0,116418,Troopers,"zVeers zStarck zzPiett zDark Trooper, zGideon",1
"Caseyyy",0,1,67646,Phoenix,"Hera G8, Chopper G8, Kanan G8, Zeb G8, Ezra G9",1
"Caseyyy",1,0,125427,zMaul,"zDarth Maul, zDooku zSidious zSavage Sith Marauder",1
"Caseyyy",1,0,15541,NestSolo (Counter),"zNest G9",1
"Caseyyy",,,50278,Phasma,"Phasma G7, FOTP 5* G8, FOSFTP G7, FOST 2* G7, Kylo 5* G8",0
"Caseyyy",1,0,101076,CLS,"zzzCLS zHan zzChewbacca R2-D2 G9, zChewpio 6*",0
"Caseyyy",,,277514,HansMF,"Home One, Han's MF 6*, Rebel Y-wing 5*, Bistan's U-wing 5*, Phantom Ghost Cassian's U-wing 5*, Biggs X-wing",0
"Caseyyy",,,480368,Negotiator,"Negotiator 6* HT 6* Anakin's Eta-2, Umbaran SF, Ahsoka's SF, Clone Sergeant's ARC-170, Plo's SF, Rex's ARC-170",0
"Caseyyy",1,0,100005,Traya,"zzTraya zDN zSion 5* BSF 5* zThrawn",0
"Caseyyy",,,341876,Executrix,"Executrix Tie Adv, Emperor's Shuttle 4*, TIE Reaper 4*, Imperial TIE Fighter, Gauntlet Starfighter 4*, FOSF TIE Fighter 6*, FO TIE Fighter",0
"Caseyyy",,,52535,Mon Mothma,"Mon Mothma 5* G7, Wedge 5* G7, Cara Dune G8, Scarif G7, Biggs G8",0
"Caseyyy",1,1,61996,Carth,"Carth Onasi G9, Mission G8, Zaalbar G8, Juhani 5* G8, Canderous G8",0
"Caseyyy",,,62451,Iden Troopers,"zIden Versio 3* G8, Stormtrooper G9, Snowtrooper G9, Magma G6, DT 6*",0
"Caseyyy",0,1,92459,BH,"Jango Greedo G8, zZam zThe Mandalorian, Cad",0
"Caseyyy",,,59419,Bad Batch,"zHunter 5* G8, zEcho 4* G8, Omega G8, Tech 5* G8, Wrecker 4* G8",0
"MINI Jaboe",,,164455,JMK,"zzzzzzJMK zJKA zGMY zzShaak Ti, zGK",1
"MINI Jaboe",1,0,125142,CLS,"zzzCLS zHan zzChewbacca zC-3PO zChewpio",1
"MINI Jaboe",0,1,113228,DRMalak,"zzzDR HK-47 zBSF zzMalak Sith Empire Trooper G8",1
"MINI Jaboe",,,503139,Negotiator,"Negotiator HT Anakin's Eta-2, Umbaran SF, Ahsoka's SF, Clone Sergeant's ARC-170, Plo's SF, Rex's ARC-170",1
"MINI Jaboe",,,326321,HansMF,"Home One, Han's MF, Rebel Y-wing 6*, Ghost Phantom Biggs X-wing, Cassian's U-wing, Wedge X-wing",1
"MINI Jaboe",0,1,96937,Geonosians,"zzGBA Sun Fac, Geo Soldier, Geo Spy, Poggle",1
"MINI Jaboe",0,1,129931,Grievous-Wat,"zzGG zB2 zB1 MagnaGuard zWat Tambor",1
"MINI Jaboe",1,1,118647,GAS,"zzzzGAS zRex zEcho (501st), zzFives zARC Trooper",1
"MINI Jaboe",1,1,79829,Ewoks,"zChirpa Elder Paploo Wicket Logray G9",1
"MINI Jaboe",0,1,141168,BH,"zzBossk zBoba Dengar zJango zIG-88",1
"MINI Jaboe",1,1,81680,Carth,"Carth Onasi, zMission zZaalbar Juhani Canderous G8",1
"MINI Jaboe",1,1,113506,zEP,"zEP zzzVader Tarkin G8, TFP zzTraya",1
"MINI Jaboe",0,1,68744,Phoenix,"Hera G8, Chopper G9, Kanan G8, Zeb G8, Ezra",1
"MINI Jaboe",,,55301,Phasma,"Phasma G8, FOE 5* G9, FOO G8, zKRU G8, Kylo G8",0
"MINI Jaboe",1,1,64953,JTR,"JTR G8, Scav Rey, BB-8 G8, R2-D2 Finn G8",0
"MINI Jaboe",1,0,72003,Troopers,"Veers zzPiett Gideon 3* G9, Dark Trooper 5* G7, Range Trooper 4* G7",0
"MINI Jaboe",1,1,60205,NS_Alt,"MT G8, zAV Daka G8, Spirit G8, Talia G8",0
"MINI Jaboe",,,62662,Mon Mothma,"Mon Mothma G1, Wedge G8, Jyn G8, Cara Dune G8, Lando",0
"MINI Jaboe",1,0,11056,SionSolo (Counter),"Sion 5* G9",0
"Jamesss",1,1,88468,NS,"zMT zAV zDaka Zombie Spirit",1
"Jamesss",0,1,130754,padme,"zzPadme zGK zJKA zAhsoka zzC-3PO",1
"Jamesss",,,479325,Negotiator,"Negotiator BTL-B Y-wing, Anakin's Eta-2, Rex's ARC-170, Umbaran SF, Ahsoka's SF, Plo's SF, Clone Sergeant's ARC-170",1
"Jamesss",0,1,100966,Geonosians,"zzGBA Sun Fac, Geo Soldier, Geo Spy, Poggle",1
"Jamesss",0,1,127552,Grievous,"zzGG zB2 zB1 zMagnaGuard zNute",1
"Jamesss",1,0,96317,Traya,"zzTraya zDN zSion zDooku Sith Empire Trooper",1
"Jamesss",1,1,142322,GAS,"zzzzGAS zRex zEcho (501st), zzFives zARC Trooper",1
"Jamesss",1,1,103558,Revan Offense,"zzzJKR zGMY BS zJolee zzHYoda",1
"Jamesss",1,1,83886,Ewoks,"zChirpa Elder Paploo Wicket Logray",1
"Jamesss",0,1,100495,BH,"zzBossk zEmbo Boba Dengar zJango",1
"Jamesss",0,1,67763,Phoenix,"Hera G8, zSabine Kanan G9, Zeb G8, Ezra G8",1
"Jamesss",1,1,62561,Carth,"Carth Onasi 5* G8, Mission G8, Zaalbar G8, Juhani 3* G7, zCanderous",0
"Jamesss",1,1,44894,zEP,"EP G6, Vader G7, Tarkin G8, TFP G7, BSF 6* G9",0
"FriedRedMonkey",1,0,143722,CLS,"zzzCLS zHan zChewbacca zC-3PO zChewpio",1
"FriedRedMonkey",0,1,133251,padme,"zzPadme zGK zJKA zAhsoka zBarriss",1
"FriedRedMonkey",0,1,120556,DRMalak,"zzzDR zHK-47 zBSF zzMalak Sith Empire Trooper",1
"FriedRedMonkey",,,343244,Malevolence,"Malevolence Hyena Bomber, Vulture Droid, Sun Fac SF, Soldier SF, Spy SF",1
"FriedRedMonkey",,,511935,Negotiator,"Negotiator HT Anakin's Eta-2, Umbaran SF, Ahsoka's SF, BTL-B Y-wing, Plo's SF, Rex's ARC-170",1
"FriedRedMonkey",,,391530,HansMF,"Home One, Han's MF, Rebel Y-wing, Bistan's U-wing, Phantom Ghost Cassian's U-wing, Biggs X-wing",1
"FriedRedMonkey",0,1,110072,Geonosians,"zzGBA Sun Fac, Geo Soldier, Geo Spy, Poggle",1
"FriedRedMonkey",0,1,123553,Grievous,"zzGG zB2 zB1 MagnaGuard zNute",1
"FriedRedMonkey",1,1,143815,GAS,"zzzzGAS zRex zEcho (501st), zzFives zARC Trooper",1
"FriedRedMonkey",1,1,130551,Revan Offense,"zzzJKR zGMY zBS zJolee zzHYoda",1
"FriedRedMonkey",0,1,131668,BH,"zzBossk Boba Dengar IG-88 Cad",1
"FriedRedMonkey",1,0,107802,Troopers,"zVeers zStarck zIden Versio, zPiett zDark Trooper",1
"FriedRedMonkey",0,1,68671,Phoenix,"Hera G8, Chopper G8, Kanan G8, Zeb G8, Ezra G8",1
"FriedRedMonkey",1,0,105521,EP (Counter, Rebel),"zzEP DT G9, zzWampa zNest Range Trooper G9",1
"FriedRedMonkey",,,68343,Phasma,"Phasma G8, FOTP FOSFTP G7, FOST G8, Kylo G8",0
"FriedRedMonkey",1,1,97403,NS,"zzMT zAV zDaka Zombie Spirit G9",0
"FriedRedMonkey",1,1,82848,Carth,"Carth Onasi, Mission Zaalbar Juhani G7, Canderous",0
"Veskasa Stargazer",1,0,149090,CLS,"zzzCLS zHan zzChewbacca zzC-3PO zChewpio",1
"Veskasa Stargazer",,,364564,HansMF,"Home One, Han's MF, HT Bistan's U-wing, Phantom Biggs X-wing, Cassian's U-wing, Wedge X-wing",1
"Veskasa Stargazer",0,1,102041,Geonosians,"zzGBA Sun Fac, Geo Soldier, Geo Spy, Poggle",1
"Veskasa Stargazer",1,1,87817,Ewoks,"zChirpa Elder Paploo Wicket zLogray",1
"Veskasa Stargazer",0,1,96002,BH,"zzBossk Boba Dengar G9, Jango Cad",1
"Veskasa Stargazer",1,1,108767,zEP,"zzEP zzzVader Tarkin Traya G8, zMara Jade, The Emperor's Hand",1
"Veskasa Stargazer",0,1,68783,Phoenix,"Hera G9, Chopper Kanan G8, Zeb G9, Ezra",1
"Veskasa Stargazer",1,1,82906,JTR,"JTR Scav Rey, BB-8 G9, zR2-D2 Finn",0
"Veskasa Stargazer",,,85133,Mon Mothma,"Mon Mothma, Wedge Cara Dune G9, Lando Biggs",0
"Veskasa Stargazer",1,0,76006,Wampa (Counter),"Rex G5, zWampa zHYoda Jyn G6, FOO G9",0
"Veskasa Stargazer",0,1,56350,BS,"BS G7, GMY G7, zOld Ben, GK G8, Ahsoka G8",0
"J3d1 Wampa",,,123762,Phasma,"zPhasma zFOTP FOSFTP zFOST zKylo",1
"J3d1 Wampa",1,1,142878,SL Kylo,"zzzzzzSL Kylo, zSith Trooper, zHux zzKRU Thrawn G8",1
"J3d1 Wampa",1,0,136862,CLS,"zzzCLS zHan zChewbacca zC-3PO zChewpio",1
"J3d1 Wampa",,,380950,HansMF,"Home One, Han's MF, Rebel Y-wing, Bistan's U-wing, Phantom Ghost Cassian's U-wing, Biggs X-wing",1
"J3d1 Wampa",0,1,99370,Geonosians,"zGBA Sun Fac, Geo Soldier, Geo Spy, Poggle",1
"J3d1 Wampa",,,97313,Disintegration,"zAurra zGreef Boba zBossk The Mandalorian G8",1
"J3d1 Wampa",1,1,127179,Revan,"zzzJKR BS zGMY zJolee zGK",1
"J3d1 Wampa",1,1,76177,Ewoks,"zChirpa Elder Paploo Wicket Logray G9",1
"J3d1 Wampa",1,1,114363,zEP,"zEP zzVader Tarkin TFP G8, zzTraya",1
"J3d1 Wampa",0,1,66072,Phoenix,"Hera G8, Chopper G8, Kanan G8, Zeb G8, Ezra",1
"J3d1 Wampa",1,0,15175,SionSolo (Counter),"Sion G9",1
"J3d1 Wampa",,,287982,Malevolence,"Malevolence 6* Hyena Bomber 6*, Vulture Droid 6*, Sun Fac SF, Soldier SF, Spy SF",0
"J3d1 Wampa",1,0,86777,Troopers,"zVeers zzPiett Gideon G9, Dark Trooper 5* G9, Range Trooper G8",0
"J3d1 Wampa",1,1,52299,NS,"MT G7, AV G7, Daka G8, Zombie Spirit G7",0
"J3d1 Wampa",1,1,56075,Carth,"Carth Onasi, Mission G5, Zaalbar G5, zJuhani 5* Canderous",0
"J3d1 Wampa",1,0,62870,501st,"Rex G7, Clone Sergeant G6, Echo (501st) G7, zFives G7, zAhsoka",0
"J3d1 Wampa",,,56243,Iden Troopers,"zIden Versio G8, Shoretrooper 5* G7, Snowtrooper G7, Magma G7, DT 5* G7",0
"J3d1 Wampa",0,1,76633,BH,"Jango G8, zZam Dengar G9, IG-88 Cad",0
"J3d1 Wampa",,,61676,Mando,"The Mandalorian (Beskar Armor), Dash Rendar 3* G5, Nest G7, IG-11 G9, Kuiil",0
