Player,Offense,Defense,GP,Name,Squad,Viable
"tanjo",0,1,112463,padme,"zzPadme zGK zJKA zAhsoka zzC-3PO",1
"tanjo",1,1,98967,JTR,"zJTR Scav Rey, zBB-8 zzR2-D2 RT",1
"tanjo",1,0,110544,Traya,"zzTraya DN zSion Dooku zzEP",1
"tanjo",1,1,105334,Revan Offense,"zzzJKR zGMY BS zJolee HYoda",1
"tanjo",1,1,81092,Ewoks,"zChirpa Elder Paploo Scout Logray",1
"tanjo",0,1,100355,BH,"zzBossk Greedo zBoba zJango Dengar",1
"tanjo",1,1,89056,Carth,"zCarth Onasi, zMission zZaalbar Juhani Canderous",1
"tanjo",1,0,98031,Wiggs,"Wedge G9, Biggs zzCLS zHan zzChewbacca",1
"tanjo",0,1,67078,Phoenix,"Hera G8, Zeb G8, Ezra Chopper G8, Kanan G8",1
"tanjo",,,72621,Grievous Omicron,"GG G8, B2 zB1 MagnaGuard Droideka G8",0
"tanjo",0,1,93524,Geonosians Omicron,"zzGBA Sun Fac, Geo Soldier, Geo Spy, Poggle",0
"tanjo",,,310953,HansMF,"Home One, Han's MF 5*, HT Bistan's U-wing, Phantom Ghost Cassian's U-wing, Biggs X-wing",0
"tanjo",1,0,74252,ShaakClones,"Shaak Ti, Rex Echo (501st) G8, Fives ARC Trooper G8",0
"tanjo",1,1,46392,Rogue1,"Jyn 5* G8, Chirrut G8, Baze 5* G8, Cassian G8, K-2SO G8",0
"JustDoc",0,1,113236,padme,"zzPadme zGK zJKA zAhsoka C-3PO",1
"JustDoc",1,1,94861,Revan Offense,"zzzJKR GMY BS Jolee Ezra",1
"JustDoc",1,1,77413,Ewoks,"zChirpa Elder Paploo G9, Wicket Logray G9",1
"JustDoc",0,1,80522,BH,"zBossk Boba G9, Jango Greef G8, The Mandalorian G8",1
"JustDoc",,,69308,Grievous Omicron,"GG G8, B2 B1 MagnaGuard Droideka",0
"JustDoc",,,359399,Negotiator,"Negotiator 5* HT Anakin's Eta-2, Umbaran SF, Ahsoka's SF, BTL-B Y-wing 5*, Clone Sergeant's ARC-170, Plo's SF",0
"JustDoc",1,0,87580,CLS,"zCLS zHan zChewbacca R2-D2 G7, Chewpio G9",0
"JustDoc",0,1,89419,Geonosians Omicron,"zGBA Sun Fac, Geo Soldier, Geo Spy, Poggle",0
"JustDoc",1,0,77839,Traya,"zTraya 6* DN 6* G9, Sion 5* G9, zBSF EP",0
"JustDoc",1,1,81428,Carth,"zCarth Onasi, zMission Zaalbar Juhani G7, Canderous",0
"JustDoc",1,0,75903,ShaakClones,"Shaak Ti G9, Rex Echo (501st), Fives ARC Trooper G9",0
"IKEA",0,1,122220,padme,"zzPadme zGK zJKA zAhsoka zzC-3PO",1
"IKEA",0,1,108385,DRMalak,"zzzDR HK-47 BSF zzMalak Thrawn",1
"IKEA",0,1,112834,Grievous,"zzGG zB2 zB1 zDroideka IG-88",1
"IKEA",1,1,113177,GAS,"zzzzGAS zRex zEcho (501st), zzFives ARC Trooper",1
"IKEA",1,1,108489,Revan Offense,"zzzJKR zGMY BS zJolee Ezra",1
"IKEA",1,1,85223,Ewoks,"zChirpa Elder zPaploo zWicket Logray G9",1
"IKEA",1,1,82301,Carth,"zCarth Onasi, Mission Zaalbar Juhani G9, Canderous",1
"IKEA",0,1,89060,BH,"zBossk Boba Cad Jango The Mandalorian",1
"IKEA",1,0,96836,CLS,"zCLS zHan zChewbacca R2-D2 G8, Chewpio",0
"IKEA",,,249477,Malevolence,"Malevolence Hyena Bomber 4*, Vulture Droid 3*, Sun Fac SF, Soldier SF, Spy SF",0
"IKEA",0,1,86411,Geonosians Omicron,"zGBA Sun Fac, Geo Soldier, Geo Spy, Poggle",0
"IKEA",1,0,58913,Troopers,"Veers Piett G8, Gideon 6* G7, Dark Trooper G9, Range Trooper G8",0
"IKEA",1,1,83344,zEP,"EP zzzVader Tarkin G9, Traya Mara Jade, The Emperor's Hand G3",0
"IKEA",1,0,6630,SionSolo (Counter),"Sion G1",0
"Marren",,,180204,JMLS,"zzzJKR zzJKL zzzzzzJMLS zWat Tambor, zzzzGAS",1
"Marren",1,0,141275,CLS,"zzzCLS zHan zChewbacca zC-3PO zChewpio",1
"Marren",0,1,137524,DRMalak,"zzzDR zHK-47 zBSF zzMalak Sith Empire Trooper",1
"Marren",,,128047,Grievous Omicron,"zzGG zB2 zB1 MagnaGuard zDroideka",1
"Marren",,,480948,Negotiator,"Negotiator HT Anakin's Eta-2, Umbaran SF, Ahsoka's SF, BTL-B Y-wing, Clone Sergeant's ARC-170, Plo's SF",1
"Marren",,,314331,Malevolence,"Malevolence 6* Hyena Bomber, Vulture Droid, Sun Fac SF, Soldier SF, Spy SF",1
"Marren",1,0,129107,Troopers,"zVeers zzPiett zGideon zDark Trooper, Range Trooper",1
"Marren",,,105151,Mon Mothma,"Mon Mothma, Cara Dune, Biggs Lando Wedge",1
"Marren",1,1,84663,Ewoks,"zChirpa Elder Paploo Wicket Logray",1
"Marren",1,0,144361,ShaakClones,"zzShaak Ti, zRex zEcho (501st), zzFives zARC Trooper",1
"Marren",0,1,133034,BH,"zzBossk IG-88 Boba zJango Dengar",1
"Marren",1,1,86357,Carth,"Carth Onasi, Mission Zaalbar Juhani Canderous",1
"Marren",1,1,125848,zEP,"zzEP zzzVader Tarkin TFP zMara Jade, The Emperor's Hand",1
"Marren",0,1,69124,Phoenix,"Hera G8, Zeb G8, Ezra Chopper G9, Kanan G8",1
"Marren",,,79499,Phasma,"Phasma G8, FOTP G9, FOO G8, zKRU Kylo G9",0
"Marren",0,1,104049,Geonosians Omicron,"zGBA Sun Fac, Geo Soldier, Geo Spy, Poggle",0
"Marren",1,0,102685,Traya,"zzTraya DN zSion 6* Dooku G8, zThrawn",0
"Marren",1,1,111715,JTR,"JTR Scav Rey, BB-8 zR2-D2 Finn",0
"Marren",0,1,127888,BS,"BS zGMY zJolee zGK zHYoda",0
"DeathTheHorseman",0,1,127176,padme,"zzPadme zGK zJKA zAhsoka zC-3PO",1
"DeathTheHorseman",1,1,83999,Ewoks,"zChirpa Elder Paploo Wicket zLogray",1
"DeathTheHorseman",1,1,128676,zEP,"zzEP zzVader Tarkin Sith Trooper, zzMara Jade, The Emperor's Hand",1
"DeathTheHorseman",0,1,105585,Phoenix,"Hera Zeb zSabine zEzra Kanan",1
"DeathTheHorseman",1,0,19482,NestSolo (Counter),"zNest",1
"DeathTheHorseman",,,91159,Phasma,"Phasma FOTP FOSFTP FOST zKylo",0
"DeathTheHorseman",,,116385,Grievous Omicron,"GG zB2 zB1 MagnaGuard zDroideka",0
"DeathTheHorseman",1,0,59441,CLS,"CLS G8, Han G8, Chewbacca 5* G9, R2-D2 G9, Chewpio 4* G8",0
"DeathTheHorseman",0,1,91510,Geonosians Omicron,"zzGBA Sun Fac, Geo Soldier, Geo Spy, Poggle",0
"DeathTheHorseman",1,1,61198,NS,"MT G8, AV Daka 5* G9, Zombie 6* Spirit 5* G8",0
"DeathTheHorseman",1,1,78915,GAS,"zzGAS 5* Rex G9, Echo (501st) G8, zFives ARC Trooper",0
"DeathTheHorseman",0,1,86303,BH,"zzBossk 5* zZam G9, Boba Krrsantan G8, Greef",0
"DeathTheHorseman",0,1,59250,BH,"Jango 6* G7, Fennec Shand 4* G9, IG-88 G8, Boushh (Leia Organa) 3* G8, The Mandalorian G8",0
"DeathTheHorseman",,,52527,Bad Batch,"Hunter 5* G8, Echo 4* G9, Omega 5* G8, Tech 5* G8, zWrecker 5* G8",0
"DeathTheHorseman",1,0,39469,Wiggs,"Wedge 5* G8, Biggs 5* G8, Leia G8, Chirrut 5* G8, Baze 5* G8",0
"DeathTheHorseman",1,0,82474,ThrawnTroopers,"zThrawn Range Trooper 5*, DT G9, Shoretrooper 6* G9, Stormtrooper G9",0
"DeathTheHorseman",0,1,91045,BS,"zBS GMY zJolee 5* G9, Old Ben G9, zHYoda 6*",0
"lnquisitor Maze",,,122900,Phasma,"zPhasma zFOTP FOSFTP zFOST zKylo",1
"lnquisitor Maze",,,371392,Negotiator,"Negotiator BTL-B Y-wing 6*, Anakin's Eta-2, Rex's ARC-170, Umbaran SF, Ahsoka's SF, Plo's SF, Clone Sergeant's ARC-170",1
"lnquisitor Maze",,,295919,HansMF,"Home One, Han's MF, Rebel Y-wing, Bistan's U-wing, Phantom Ghost Cassian's U-wing, Wedge X-wing",1
"lnquisitor Maze",1,0,124773,Troopers,"zVeers zzPiett zGideon zDark Trooper, Range Trooper",1
"lnquisitor Maze",1,1,105277,Revan,"zzzJKR BS zGMY zJolee zGK",1
"lnquisitor Maze",1,0,129128,ShaakClones,"zzShaak Ti, Rex Echo (501st), zzFives zARC Trooper",1
"lnquisitor Maze",0,1,107014,BH,"zBossk zZam Boba Dengar zzThe Mandalorian",1
"lnquisitor Maze",1,1,129275,zEP,"zzEP zzzVader Tarkin TFP zSith Trooper",1
"lnquisitor Maze",0,1,70584,Phoenix,"Hera G9, Zeb G8, Ezra G8, Chopper G9, zKanan G8",1
"lnquisitor Maze",1,0,13926,NestSolo (Counter),"Nest",1
"lnquisitor Maze",1,0,72990,CLS,"CLS Han Chewbacca R2-D2 Chewpio G7",0
"lnquisitor Maze",,,52424,Grievous Omicron,"GG B2 G6, B1 G6, MagnaGuard Droideka G7",0
"lnquisitor Maze",0,1,105714,Geonosians Omicron,"zzGBA Sun Fac, Geo Soldier, Geo Spy, Poggle",0
"lnquisitor Maze",,,274596,Malevolence,"Malevolence 6* Hyena Bomber 4*, Vulture Droid 6*, Sun Fac SF, Soldier SF, Spy SF",0
"lnquisitor Maze",1,1,74627,NS,"MT G9, AV Daka Zombie Spirit G9",0
"lnquisitor Maze",,,77589,Nute-OR,"Nute G8, zDooku Jango Zaalbar G8, Mission G8",0
"lnquisitor Maze",,,68072,Mon Mothma,"Mon Mothma G8, Hoth Rebel Scout G9, Cara Dune, Biggs G8, Wedge G8",0
"lnquisitor Maze",1,1,69646,Ewoks,"Chirpa Elder Paploo G9, Wicket Logray",0
"lnquisitor Maze",1,1,52461,Rogue1,"Jyn G8, Chirrut G8, Baze 6* G8, Cassian G8, K-2SO G8",0
"lnquisitor Maze",,,44480,Bad Batch,"Hunter 5* G8, Echo 4* G8, Omega G8, Tech 5* G8, Wrecker G9",0
"lnquisitor Maze",1,0,73680,QGJ,"zQGJ G8, Aayla G5, zJKA Old Ben G9, Ahsoka",0
"Thawk",,,622689,Executor,"Executor HT RC Xanadu Blood, Slave I, IG-2000 Imperial TIE Fighter, Tie Adv",1
"Thawk",0,1,135379,padme,"zzPadme zGK zJKA zAhsoka zzC-3PO",1
"Thawk",1,1,101599,NS_Alt,"zzMT zzAV Talia Zombie Daka",1
"Thawk",,,400315,HansMF,"Home One, Han's MF, Biggs X-wing, Bistan's U-wing, Phantom Ghost Cassian's U-wing, Wedge X-wing",1
"Thawk",0,1,126299,Grievous,"zzGG G9, zB2 zB1 zMagnaGuard zIG-88",1
"Thawk",1,1,97273,JTR,"zzzJTR Scav Rey, BB-8 G9, zzR2-D2 zFinn G9",1
"Thawk",1,1,144443,Revan Offense,"zzzJKR zGMY zzHYoda zJolee zEzra",1
"Thawk",1,1,89754,Ewoks,"zChirpa Elder zPaploo zWicket Logray G8",1
"Thawk",1,0,107368,ShaakClones,"zzShaak Ti, zRex zEcho (501st), zzFives zARC Trooper",1
"Thawk",0,1,145767,BH,"zzBossk zBoba Cad zDengar zzThe Mandalorian",1
"Thawk",1,1,142509,zEP,"zzEP zzzVader zzTarkin zKrennic TFP",1
"Thawk",1,0,112606,Wiggs,"Wedge G9, Biggs zzzCLS zHan zzChewbacca",1
"Thawk",0,1,79439,Phoenix,"zHera G8, Zeb G9, zSabine Chopper Kanan G9",1
"Thawk",1,0,128033,zMaul,"zDarth Maul, zDooku zSidious zSavage Sith Marauder",1
"Thawk",,,73898,Phasma,"Phasma zFOTP FOSFTP G9, FOST 3* G9, zKylo G9",0
"Thawk",,,428205,Negotiator,"Negotiator BTL-B Y-wing 3*, Anakin's Eta-2, Rex's ARC-170, Umbaran SF, Ahsoka's SF, Plo's SF, Clone Sergeant's ARC-170",0
"Thawk",0,1,108712,Geonosians Omicron,"zzGBA Sun Fac, Geo Soldier, Geo Spy, Poggle",0
"Thawk",,,272913,Malevolence,"Malevolence 5* Hyena Bomber 4*, Vulture Droid 3*, Sun Fac SF, Soldier SF, Spy SF",0
"Thawk",1,0,80526,Traya,"Traya G9, DN G8, Sion 5* G7, Sith Assassin G7, zzThrawn",0
"Thawk",1,0,97137,Troopers,"zVeers zzPiett zzGideon G9, Dark Trooper 5* G7, Range Trooper 5* G7",0
"Thawk",,,79714,Mon Mothma,"Mon Mothma 4* G6, zCara Dune, zJyn G8, Lando zK-2SO G9",0
"Thawk",1,1,50004,Carth,"Carth Onasi 4* G3, Mission G8, Zaalbar G8, Juhani 3* G5, Canderous 5* G7",0
"Thawk",,,72236,Iden Troopers,"Iden Versio 3* G8, Stormtrooper G9, Snowtrooper G8, Magma G8, zDT",0
"Thawk",1,0,64447,Jawas,"Nebit G8, Jawa Engineer G7, Jawa Scavenger G7, Jawa 6* G9, Dathcha G8",0
"FriedRedMonkey",,,107762,Phasma,"zPhasma zFOTP zSith Trooper, zzKRU zKylo",1
"FriedRedMonkey",,,592236,Executor,"Executor HT RC Xanadu Blood, Slave I, IG-2000 Imperial TIE Fighter, Tie Adv",1
"FriedRedMonkey",0,1,144371,padme,"zzPadme zGK zJKA zAhsoka zzzCAT",1
"FriedRedMonkey",1,0,143756,CLS,"zzzCLS zHan zChewbacca zC-3PO zChewpio",1
"FriedRedMonkey",0,1,131389,DRMalak,"zzzDR zHK-47 zBSF zzMalak Sith Empire Trooper",1
"FriedRedMonkey",,,343591,Malevolence,"Malevolence Hyena Bomber, Vulture Droid, Sun Fac SF, Soldier SF, Spy SF",1
"FriedRedMonkey",0,1,110177,Geonosians Omicron,"zzGBA Sun Fac, Geo Soldier, Geo Spy, Poggle",1
"FriedRedMonkey",,,414250,HansMF,"Home One, Han's MF, Rebel Y-wing, Bistan's U-wing, Phantom Ghost Cassian's U-wing, Biggs X-wing",1
"FriedRedMonkey",0,1,123674,Grievous,"zzGG zB2 zB1 MagnaGuard zNute",1
"FriedRedMonkey",1,1,143832,GAS,"zzzzGAS zRex zEcho (501st), zzFives zARC Trooper",1
"FriedRedMonkey",1,1,136847,Revan Offense,"zzzJKR zGMY zBS zJolee zzHYoda",1
"FriedRedMonkey",0,1,138964,BH,"zzBossk IG-88 Boba Cad zDengar",1
"FriedRedMonkey",1,1,118254,zEP,"zzEP zzzVader Tarkin TFP zzMara Jade, The Emperor's Hand",1
"FriedRedMonkey",1,0,108443,Troopers,"zVeers zStarck zPiett zDark Trooper, zIden Versio",1
"FriedRedMonkey",0,1,68671,Phoenix,"Hera G8, Zeb G8, Ezra G8, Chopper G8, Kanan G8",1
"FriedRedMonkey",1,0,24685,NestSolo (Counter),"zNest",1
"FriedRedMonkey",1,1,98408,NS,"zzMT zAV zDaka Zombie Spirit G9",0
"FriedRedMonkey",,,456739,Negotiator,"Negotiator BTL-B Y-wing, Anakin's Eta-2, Rex's ARC-170, Umbaran SF, Ahsoka's SF, Plo's SF, Clone Sergeant's ARC-170",0
"FriedRedMonkey",1,1,82848,Carth,"Carth Onasi, Mission Zaalbar Juhani G7, Canderous",0
"FriedRedMonkey",0,1,93172,BH,"Jango zZam Greedo G7, zGreef zThe Mandalorian",0
"BlackKobra77",,,121622,Phasma,"zPhasma zFOTP FOSFTP zFOST zKylo",1
"BlackKobra77",1,1,152338,SL Kylo,"zzzzzzSL Kylo, zSith Trooper, zHux zzKRU Thrawn",1
"BlackKobra77",,,366731,HansMF,"Home One, Han's MF, HT Bistan's U-wing, Phantom Ghost Cassian's U-wing, Wedge X-wing",1
"BlackKobra77",1,0,101038,Traya,"zzTraya DN zSion Dooku G8, zEP",1
"BlackKobra77",0,1,108636,BH,"zzBossk Boba Jango Dengar The Mandalorian",1
"BlackKobra77",0,1,72018,Phoenix,"Hera Zeb G9, Ezra G9, Chopper G9, Kanan G9",1
"BlackKobra77",0,1,96526,padme,"zPadme zGK JKA Ahsoka CW Chewbacca G8",0
"BlackKobra77",1,0,108870,CLS,"zzCLS zHan zChewbacca R2-D2 Chewpio 6*",0
"BlackKobra77",0,1,90051,Geonosians Omicron,"zGBA Sun Fac, Geo Soldier, Geo Spy, Poggle",0
"BlackKobra77",1,0,83928,Troopers,"zVeers zPiett Gideon Dark Trooper, Range Trooper G9",0
"BlackKobra77",1,1,58248,NS,"MT G9, AV G8, Daka Zombie 6* G8, Spirit G8",0
"BlackKobra77",1,1,71098,Ewoks,"Chirpa 5* Elder Paploo Wicket 6* Logray",0
"BlackKobra77",1,0,65928,ShaakClones,"Shaak Ti G7, Rex G8, Echo (501st) G9, Fives Clone Sergeant G9",0
"BlackKobra77",,,66713,Iden Troopers,"zIden Versio 5*, Shoretrooper G8, Snowtrooper G9, Magma G8, DT G8",0
"BlackKobra77",1,1,48571,Rogue1,"Jyn G8, Chirrut 5* G8, Baze 6* G8, Cassian G8, K-2SO G8",0
"Trebbih",,,532279,Executor,"Executor 5* HT RC Xanadu Blood, Slave I, IG-2000 Imperial TIE Fighter, Tie Adv",1
"Trebbih",1,0,135390,CLS,"zzzCLS zHan zChewbacca C-3PO Chewpio",1
"Trebbih",0,1,107843,Grievous,"zzGG zB2 zB1 MagnaGuard IG-88",1
"Trebbih",,,109106,Disintegration,"Aurra zGreef Boba zzBossk The Mandalorian G8",1
"Trebbih",1,1,71667,Ewoks,"zChirpa G8, Elder Paploo G9, Wicket Logray G9",1
"Trebbih",,,32609,Phasma,"Phasma 5* G8, FOE 5* G8, FOO 5* G8, KRU 5* G8, Kylo 5* G8",0
"Trebbih",0,1,90012,Geonosians Omicron,"zGBA Sun Fac, Geo Soldier, Geo Spy, Poggle",0
"Trebbih",,,257980,Malevolence,"Malevolence 5* Hyena Bomber 4*, Vulture Droid 6*, Sun Fac SF, Soldier SF, Spy SF",0
"Trebbih",,,267704,HansMF,"Home One 6*, Han's MF, Rebel Y-wing, Ghost 5* Phantom 5* Biggs X-wing, Cassian's U-wing, Wedge X-wing",0
"Trebbih",1,0,86100,Troopers,"zVeers G9, zPiett Gideon G9, Dark Trooper G9, Range Trooper 5* G9",0
"Trebbih",1,1,38098,NS_Alt,"MT 6* G8, AV 5* G8, Talia G8, Spirit 5* G8, Daka 5* G8",0
"Trebbih",1,1,100899,zEP,"zEP zzVader Tarkin TFP Mara Jade, The Emperor's Hand 4* G9",0
"Trebbih",1,0,39431,501st,"Rex 5* G8, Clone Sergeant G8, Echo (501st) 5* G8, Fives 5* G8, Ahsoka G8",0
"Trebbih",1,0,49291,Wiggs,"Wedge G8, Biggs G8, Leia G8, Chirrut 5* G8, Baze 5* G8",0
"Trebbih",0,1,32885,Phoenix,"Hera 5* G8, Zeb 5* G8, Ezra 5* G8, Chopper 5* G8, Kanan 5* G8",0
"Qef Tser",1,1,143963,SL Kylo,"zzzzSL Kylo, zSith Trooper, zHux zzKRU Thrawn",1
"Qef Tser",0,1,93173,padme,"zzPadme G9, GK JKA Ahsoka C-3PO",1
"Qef Tser",,,256693,Malevolence,"Malevolence 6* Hyena Bomber, Vulture Droid, Sun Fac SF, Soldier SF, Spy SF",1
"Qef Tser",1,1,100304,Revan Offense,"zzzJKR zGMY BS zJolee zHYoda",1
"Qef Tser",1,1,69058,Ewoks,"zChirpa G9, Elder G9, Paploo G9, Wicket G9, Logray G9",1
"Qef Tser",0,1,126629,BH,"zzBossk IG-88 zZam Boba Dengar",1
"Qef Tser",1,1,113873,zEP,"zEP zzVader Tarkin TFP Sion G8",1
"Qef Tser",1,0,18997,NestSolo (Counter),"zNest",1
"Qef Tser",,,121892,Phasma,"zPhasma zFOTP FOSFTP zFOST zKylo",0
"Qef Tser",,,461170,Executor,"Executor 5* HT RC Xanadu Blood, Slave I, IG-2000 Imperial TIE Bomber, Tie Adv",0
"Qef Tser",,,86363,Grievous Omicron,"zGG zB2 zB1 MagnaGuard G9, Droideka G8",0
"Qef Tser",0,1,87300,Geonosians Omicron,"zGBA Sun Fac, Geo Soldier, Geo Spy, Poggle",0
"Qef Tser",1,0,75908,Troopers,"zVeers G8, zzPiett Gideon G8, Dark Trooper 5* G7, Range Trooper 6* G6",0
"Qef Tser",1,0,75065,ShaakClones,"zShaak Ti, Rex Echo (501st) G9, zFives ARC Trooper G7",0
"Qef Tser",0,1,60856,Phoenix,"Hera G8, Zeb G7, Ezra G8, Chopper G8, Kanan G7",0
"shinykneecaps",0,1,107770,padme,"zzPadme zGK JKA Ahsoka zC-3PO",1
"shinykneecaps",,,374372,Negotiator,"Negotiator 6* HT Anakin's Eta-2, Umbaran SF, Ahsoka's SF, Clone Sergeant's ARC-170, Plo's SF, Rex's ARC-170",1
"shinykneecaps",,,306405,HansMF,"Home One, Han's MF 6*, Biggs X-wing, Bistan's U-wing, Phantom Ghost Cassian's U-wing, Wedge X-wing",1
"shinykneecaps",1,1,74229,Ewoks,"zChirpa G9, Elder Paploo G9, Wicket G9, Logray G9",1
"shinykneecaps",0,1,96304,BH,"zzBossk IG-88 G9, Boba Jango zGreef G9",1
"shinykneecaps",1,1,127600,zEP,"zzEP zzzVader Tarkin Krennic TFP",1
"shinykneecaps",1,0,109076,Troopers,"zVeers Starck zzPiett Dark Trooper, zIden Versio",1
"shinykneecaps",1,0,98015,CLS,"zzzCLS zHan Wedge Biggs zChewbacca",1
"shinykneecaps",0,1,66513,Phoenix,"Hera G8, Zeb G8, Ezra G9, Chopper G9, Kanan G8",1
"shinykneecaps",1,0,89418,ThrawnTroopers,"zThrawn Range Trooper G9, DT Shoretrooper Snowtrooper",1
"shinykneecaps",,,72174,Phasma,"Phasma G7, FOTP FOO G8, zKRU Kylo G8",0
"shinykneecaps",,,58340,Grievous Omicron,"GG G8, B2 G8, B1 6* G8, MagnaGuard G8, Droideka G7",0
"shinykneecaps",0,1,90008,Geonosians Omicron,"zzGBA Sun Fac, Geo Soldier, Geo Spy, Poggle",0
"shinykneecaps",1,1,47864,NS_Alt,"AV G8, Talia G6, Zombie G5, Spirit 6* G6, Daka G9",0
"shinykneecaps",1,0,72412,ShaakClones,"Shaak Ti G8, Rex Echo (501st) G8, Fives Clone Sergeant G8",0
"shinykneecaps",1,0,11662,SionSolo (Counter),"Sion 5* G9",0
"Redaxfive",0,1,118880,DRMalak,"zzzDR zHK-47 zBSF zzMalak Sith Empire Trooper G8",1
"Redaxfive",0,1,127803,padme,"zzPadme zGK zJKA zAhsoka zC-3PO",1
"Redaxfive",,,119618,Grievous Omicron,"zzGG zB2 zB1 MagnaGuard zDroideka",1
"Redaxfive",1,0,101416,CLS,"zzCLS zHan zChewbacca R2-D2 G8, zChewpio",1
"Redaxfive",,,449656,Negotiator,"Negotiator HT Anakin's Eta-2, Umbaran SF, Ahsoka's SF, BTL-B Y-wing, Clone Sergeant's ARC-170, Plo's SF",1
"Redaxfive",1,0,96126,Traya,"zzTraya DN zSion zEP zThrawn G8",1
"Redaxfive",,,102725,Disintegration,"Aurra zGreef Boba zzBossk zThe Mandalorian",1
"Redaxfive",,,96515,Nute-OR,"zNute zDooku Jango zZaalbar Mission",1
"Redaxfive",1,1,112290,GAS,"zzzzGAS zRex zEcho (501st), zzFives zARC Trooper G8",1
"Redaxfive",1,1,122761,Revan Offense,"zzzJKR zGMY BS zJolee HYoda",1
"Redaxfive",1,1,78676,Ewoks,"zChirpa G9, Elder Paploo Wicket Logray",1
"Redaxfive",0,1,68725,Phoenix,"Hera G8, Zeb G8, Ezra Chopper G9, Kanan G9",1
"Redaxfive",,,64598,Phasma,"Phasma G7, FOTP 6* G8, FOO KRU Kylo G8",0
"Redaxfive",,,299659,Malevolence,"Malevolence Hyena Bomber 6*, Vulture Droid 6*, Sun Fac SF, Soldier SF, Spy SF",0
"Redaxfive",0,1,88988,Geonosians Omicron,"zGBA Sun Fac, Geo Soldier, Geo Spy, Poggle",0
"Redaxfive",,,247981,HansMF,"Home One, Han's MF, Rebel Y-wing, Bistan's U-wing 3*, Phantom Ghost Cassian's U-wing, Biggs X-wing",0
"Redaxfive",,,63810,Mon Mothma,"zMon Mothma G8, Cara Dune G7, Biggs G8, Kyle Katarn G9, Pao G8",0
"Redaxfive",1,0,57804,Troopers,"Veers G9, Starck G7, Gideon G7, zPiett G8, Dark Trooper G7",0
"Redaxfive",1,0,8014,NestSolo (Counter),"Nest 6* G8",0
"Jamesss",1,1,91445,NS,"zzMT zAV zDaka Zombie Spirit",1
"Jamesss",0,1,130799,padme,"zzPadme zGK zJKA zAhsoka zzC-3PO",1
"Jamesss",,,479733,Negotiator,"Negotiator BTL-B Y-wing, Anakin's Eta-2, Rex's ARC-170, Umbaran SF, Ahsoka's SF, Plo's SF, Clone Sergeant's ARC-170",1
"Jamesss",,,280249,Malevolence,"Malevolence 5* Hyena Bomber, Vulture Droid, Sun Fac SF, Soldier SF, Spy SF",1
"Jamesss",0,1,93139,DR,"zzzDR HK-47 zBSF Sith Marauder, Sith Empire Trooper",1
"Jamesss",0,1,127552,Grievous,"zzGG zB2 zB1 zMagnaGuard zNute",1
"Jamesss",1,0,97559,Traya,"zzTraya zDN zSion zDooku Thrawn G9",1
"Jamesss",1,1,142849,GAS,"zzzzGAS zRex zEcho (501st), zzFives zARC Trooper",1
"Jamesss",1,1,104001,Revan Offense,"zzzJKR zGMY BS zJolee zzHYoda",1
"Jamesss",1,1,83886,Ewoks,"zChirpa Elder Paploo Wicket Logray",1
"Jamesss",0,1,100720,BH,"zzBossk Boba Cad zJango Dengar",1
"Jamesss",1,1,84761,Carth,"zCarth Onasi, zMission G8, zZaalbar G8, Juhani zCanderous",1
"Jamesss",0,1,67763,Phoenix,"Hera G8, Zeb G8, zSabine Ezra G8, Kanan G9",1
"Jamesss",0,1,100966,Geonosians Omicron,"zzGBA Sun Fac, Geo Soldier, Geo Spy, Poggle",0
"Kanon reloaded",,,186064,JMK,"zzzzzzJMK zAhsoka zzzCAT zzzzGAS zGK",1
"Kanon reloaded",,,178784,LV,"zzzzzzLord Vader, zzPiett zzzVader zRG zzTarkin",1
"Kanon reloaded",,,122379,Phasma,"zPhasma zFOTP FOSFTP zFOST zKylo",1
"Kanon reloaded",,,147848,SK,"zzEP zzMara Jade, The Emperor's Hand, zzStarkiller zJuhani zVisas",1
"Kanon reloaded",1,1,164072,SL Kylo,"zzzzzzSL Kylo, zSith Trooper, zHux zzKRU zzThrawn",1
"Kanon reloaded",,,173778,SEE,"zzzzzzSEE zBSF zzMalak zzzDR zDooku",1
"Kanon reloaded",1,1,132594,NS,"zzMT zzAV zDaka Zombie Spirit",1
"Kanon reloaded",,,593000,Executor,"Executor HT RC Xanadu Blood, Slave I, IG-2000 Imperial TIE Fighter, Tie Adv",1
"Kanon reloaded",,,167936,JMLS,"zBS zzzzzzJMLS zWat Tambor, zzJKL zJolee",1
"Kanon reloaded",1,0,153850,CLS,"zzzCLS zHan zzChewbacca zzC-3PO zChewpio",1
"Kanon reloaded",,,526769,Negotiator,"Negotiator BTL-B Y-wing, Anakin's Eta-2, Rex's ARC-170, Umbaran SF, Ahsoka's SF, Plo's SF, Clone Sergeant's ARC-170",1
"Kanon reloaded",,,340902,Malevolence,"Malevolence Hyena Bomber, Vulture Droid, Sun Fac SF, Soldier SF, Spy SF",1
"Kanon reloaded",,,450821,HansMF,"Home One, Han's MF, Rebel Y-wing, Bistan's U-wing, Phantom Ghost Cassian's U-wing, Wedge X-wing",1
"Kanon reloaded",1,1,140939,JTR,"zzzJTR zzR2-D2 zzBB-8 RH Finn, RH Poe",1
"Kanon reloaded",0,1,138302,Grievous,"zzGG zB2 zB1 zMagnaGuard zNute",1
"Kanon reloaded",1,0,124490,Traya,"zzTraya zzDN zSion Sith Empire Trooper, zNest",1
"Kanon reloaded",,,114000,Mon Mothma,"zzMon Mothma, Hoth Rebel Scout, Scarif zCara Dune, zPao",1
"Kanon reloaded",1,1,90932,Ewoks,"zChirpa Elder zPaploo zWicket Logray G9",1
"Kanon reloaded",1,0,155614,ShaakClones,"zzShaak Ti, zRex zEcho (501st), zzFives zARC Trooper",1
"Kanon reloaded",0,1,152982,BH,"zzBossk zZam zBoba zzJango zDengar",1
"Kanon reloaded",1,0,128007,Troopers,"zVeers zStarck zzGideon Range Trooper, zDark Trooper",1
"Kanon reloaded",0,1,89901,Phoenix,"zHera zZeb Sabine zEzra zKanan",1
"Kanon reloaded",1,1,83332,Rogue1,"zJyn Chirrut Baze Cassian K-2SO G8",1
"Kanon reloaded",,,125245,Bad Batch,"zHunter zEcho zzOmega zTech zWrecker",1
"Kanon reloaded",1,0,73979,Jawas,"Nebit G8, Jawa Engineer G9, Jawa Scavenger G8, Jawa Dathcha G8",1
"Kanon reloaded",0,1,117331,Geonosians Omicron,"zzGBA Sun Fac, Geo Soldier, Geo Spy, Poggle",0
"Kanon reloaded",,,74004,Iden Troopers,"zIden Versio 4* G8, Shoretrooper Snowtrooper Magma G7, DT",0
"Veltto",1,1,115919,Revan,"zzJKR BS zGMY zJolee GK",1
"Veltto",1,0,93189,ShaakClones,"zzShaak Ti G9, zRex Echo (501st), zFives ARC Trooper",1
"Veltto",0,1,93886,BH,"zBossk Boba Jango Dengar G9, The Mandalorian",1
"Veltto",1,1,99619,zEP,"zEP zVader Tarkin BSF Traya G8",1
"Veltto",0,1,91772,FO,"zKRU Kylo FOO FOST zFOTP",1
"Veltto",0,1,70281,Phoenix,"Hera G9, Zeb G8, Ezra Chopper G8, Kanan G8",1
"Veltto",1,0,18624,NestSolo (Counter),"zNest",1
"Veltto",1,0,12327,SionSolo (Counter),"Sion G8",1
"Veltto",1,0,114123,CLS,"zzCLS zHan zChewbacca zR2-D2 zChewpio",0
"Veltto",0,1,99518,Geonosians Omicron,"zzGBA Sun Fac, Geo Soldier, Geo Spy, Poggle",0
"Veltto",1,0,80784,Troopers,"Veers zPiett Gideon Dark Trooper G9, Range Trooper",0
"Veltto",1,1,71451,Carth,"Carth Onasi, Mission G8, Zaalbar G8, Juhani 6* Canderous",0
"Zenithier",,,185524,JMK,"zzzzzzJMK zAhsoka zzzCAT zzzzGAS zGK",1
"Zenithier",,,123041,Phasma,"zPhasma zFOTP FOSFTP zFOST zKylo",1
"Zenithier",,,139189,SK,"zzEP zzMara Jade, The Emperor's Hand, zzStarkiller zJuhani zVisas",1
"Zenithier",1,1,174046,SL Kylo,"zzzzzzSL Kylo, zSith Trooper, zHux zzKRU zzThrawn",1
"Zenithier",,,175551,SEE,"zzzzzzSEE zBSF zzMalak zzzDR zzzVader",1
"Zenithier",0,1,96132,Qira,"zQira L3-37 zVandor Chewbacca, zMission zZaalbar",1
"Zenithier",1,0,143125,CLS,"zzzCLS zHan zzChewbacca zC-3PO zChewpio",1
"Zenithier",,,162712,JMLS,"zzzzzzJMLS zzJKL zzHYoda zzOld Ben, zEzra",1
"Zenithier",1,1,103669,NestSisters,"zzAV zzMT zDaka Zombie zNest",1
"Zenithier",,,529611,Negotiator,"Negotiator HT Anakin's Eta-2, Umbaran SF, Ahsoka's SF, BTL-B Y-wing, Clone Sergeant's ARC-170, Plo's SF",1
"Zenithier",,,331115,Malevolence,"Malevolence Hyena Bomber, Vulture Droid, Sun Fac SF, Soldier SF, Spy SF",1
"Zenithier",,,416592,HansMF,"Home One, Han's MF, Rebel Y-wing, Bistan's U-wing, Phantom Biggs X-wing, Cassian's U-wing, Wedge X-wing",1
"Zenithier",0,1,130503,Grievous,"zzGG zB2 zB1 MagnaGuard zNute",1
"Zenithier",1,0,119448,Traya,"zzTraya zDN zSion zDooku Sith Empire Trooper",1
"Zenithier",1,1,126180,JTR,"zzzJTR Scav Rey, zBB-8 zzR2-D2 Finn",1
"Zenithier",,,106637,Mon Mothma,"zzMon Mothma, Hoth Rebel Scout, zCara Dune, Wedge zPao",1
"Zenithier",,,131455,Disintegration,"Aurra zzGreef zBoba zzBossk zThe Mandalorian",1
"Zenithier",1,1,140395,Revan Offense,"zzzJKR zGMY zBS zJolee zJKA",1
"Zenithier",1,1,76062,Ewoks,"zChirpa G9, Elder Paploo zWicket Logray",1
"Zenithier",1,0,141533,ShaakClones,"zzShaak Ti, zRex zEcho (501st), zzFives zARC Trooper",1
"Zenithier",1,0,115913,Troopers,"zVeers zStarck zzPiett zDark Trooper, Stormtrooper",1
"Zenithier",0,1,75677,Phoenix,"zHera zZeb G8, Sabine G8, Chopper G8, zKanan G8",1
"Zenithier",1,1,77743,Rogue1,"Jyn Chirrut Baze Cassian K-2SO G9",1
"Zenithier",0,1,107585,Geonosians Omicron,"zzGBA Sun Fac, Geo Soldier, Geo Spy, Poggle",0
"Zenithier",,,68856,Iden Troopers,"zIden Versio 6* G8, Shoretrooper Snowtrooper G9, Magma G8, DT",0
"Zenithier",0,1,122509,BH,"zJango IG-88 Zam Cad Dengar",0
"Zenithier",,,97910,Bad Batch,"zHunter zEcho Omega G8, zTech zWrecker",0
"Zenithier",1,0,56365,Jawas,"Nebit G7, Jawa Engineer G9, Jawa Scavenger G7, Jawa G7, Dathcha G7",0
"Good E2 Shoes",,,123834,Phasma,"zPhasma zFOTP FOSFTP zFOST zKylo",1
"Good E2 Shoes",1,1,154863,SL Kylo,"zzzzzzSL Kylo, zSith Trooper, zHux zzKRU zThrawn",1
"Good E2 Shoes",0,1,107112,padme,"zzPadme GK JKA zAhsoka zzC-3PO",1
"Good E2 Shoes",,,364801,HansMF,"Home One, Han's MF, HT Ghost Phantom Biggs X-wing, Cassian's U-wing, Wedge X-wing",1
"Good E2 Shoes",0,1,103517,Grievous,"zzGG zB2 zB1 zDroideka zDooku",1
"Good E2 Shoes",1,1,104801,JTR,"zzzJTR Scav Rey, zzBB-8 zzR2-D2 Finn",1
"Good E2 Shoes",1,1,114768,Revan Offense,"zzzJKR GMY zBS zJolee zHYoda",1
"Good E2 Shoes",1,1,93905,Ewoks,"zChirpa Elder zPaploo Teebo zWicket",1
"Good E2 Shoes",1,1,92547,Carth,"zCarth Onasi, Mission Zaalbar zJuhani Canderous",1
"Good E2 Shoes",0,1,106460,BH,"zzBossk IG-88 zBoba Cad zzJango",1
