Player,Offense,Defense,GP,Name,Squad,Viable
"Good E2 Shoes",1,1,118154,zEP,"zzEP zzzVader Tarkin G9, zBSF DN",1
"Good E2 Shoes",0,1,74378,Phoenix,"Hera G9, Zeb G9, Ezra Chopper G9, zKanan",1
"Good E2 Shoes",1,0,17598,NestSolo (Counter),"zNest",1
"Good E2 Shoes",1,0,13492,SionSolo (Counter),"Sion G9",1
"Good E2 Shoes",0,1,95593,Geonosians Omicron,"zzGBA Sun Fac, Geo Soldier, Geo Spy, Poggle",0
"Good E2 Shoes",1,0,82651,ShaakClones,"Shaak Ti G9, zRex Echo (501st), Fives G9, Clone Sergeant G9",0
"Good E2 Shoes",1,0,98813,Wiggs,"Wedge G9, Biggs G2, zzzCLS zHan zzChewbacca",0
"Good E2 Shoes",1,0,60595,Jawas,"Nebit G7, Jawa Engineer G7, Jawa Scavenger G7, Jawa G7, Dathcha G7",0
"ISB Coøkie",,,122771,Phasma,"zPhasma zFOTP FOSFTP zFOST zKylo",1
"ISB Coøkie",1,1,154313,SL Kylo,"zzzzzzSL Kylo, zSith Trooper, zHux zzKRU zThrawn",1
"ISB Coøkie",,,165622,SEE,"zzzzzzSEE zBSF zzMalak zzzDR zzzVader",1
"ISB Coøkie",0,1,132192,padme,"zzPadme zGK zJKA zAhsoka zC-3PO",1
"ISB Coøkie",,,295879,Malevolence,"Malevolence 6* Hyena Bomber, Vulture Droid, Sun Fac SF, Soldier SF, Spy SF",1
"ISB Coøkie",0,1,102916,Geonosians Omicron,"zGBA Sun Fac, Geo Soldier, Geo Spy, Poggle",1
"ISB Coøkie",,,443004,Negotiator,"Negotiator HT Anakin's Eta-2, Umbaran SF, Ahsoka's SF, BTL-B Y-wing, Plo's SF, Rex's ARC-170",1
"ISB Coøkie",0,1,116554,Grievous,"zzGG zB2 zB1 MagnaGuard Dooku",1
"ISB Coøkie",1,0,105269,Troopers,"zVeers zzPiett Gideon zDark Trooper, Range Trooper",1
"ISB Coøkie",1,1,121643,GAS,"zzzzGAS zRex Echo (501st), zzFives ARC Trooper",1
"ISB Coøkie",1,1,105860,Revan Offense,"zzzJKR zzGMY zBS zJolee Ezra",1
"ISB Coøkie",1,1,80808,Ewoks,"zChirpa Elder Paploo Wicket Logray",1
"ISB Coøkie",1,1,85369,Carth,"zCarth Onasi, zMission Zaalbar Juhani G8, zCanderous",1
"ISB Coøkie",0,1,88018,BH,"zBossk Boba Jango Greef The Mandalorian",1
"ISB Coøkie",1,0,99894,EP (Counter, Rebel),"zzEP Shoretrooper G8, Krennic DT G8, zStarck",1
"ISB Coøkie",1,0,85538,CLS,"zzCLS zHan zChewbacca R2-D2 G8, Chewpio G8",0
"ISB Coøkie",,,259889,HansMF,"Home One, Han's MF, Rebel Y-wing 5*, Ghost Phantom Biggs X-wing, Cassian's U-wing, Wedge X-wing",0
"ISB Coøkie",1,1,79942,NS,"zMT G9, zAV zDaka G9, Zombie Spirit G8",0
"ISB Coøkie",1,0,53902,Traya,"zTraya DN G8, Sion G6, Sith Assassin G5, Sith Empire Trooper 5* G7",0
"ISB Coøkie",0,1,57589,Phoenix,"Hera G8, Zeb G8, Sabine 5* G8, Chopper G9, Kanan G8",0
"ISB Coøkie",1,1,51752,Rogue1,"Jyn 6* G8, Chirrut 5* G8, Baze G8, Cassian G8, K-2SO G8",0
"ISB Coøkie",,,66692,Bad Batch,"zHunter G8, Echo G8, Omega 6* G2, Tech G8, zWrecker G8",0
"CaptainDragonborn",,,492341,Executor,"Executor HT RC Xanadu Blood, Slave I, IG-2000 Imperial TIE Fighter, Tie Adv",1
"CaptainDragonborn",1,0,119040,CLS,"zzCLS zHan zChewbacca C-3PO Chewpio",1
"CaptainDragonborn",1,1,79889,Ewoks,"zChirpa Elder Paploo Scout G9, zWicket",1
"CaptainDragonborn",0,1,122186,BH,"zBossk IG-88 Boba Jango Dengar",1
"CaptainDragonborn",1,1,81600,Carth,"Carth Onasi, zMission Zaalbar Juhani Canderous G8",1
"CaptainDragonborn",0,1,65319,Phoenix,"Hera Zeb G8, Ezra G9, Chopper Kanan G8",1
"CaptainDragonborn",0,1,83261,padme,"zPadme GK JKA Ahsoka Fives",1
"CaptainDragonborn",,,48266,Phasma,"Phasma G8, FOE 5* G8, FOO G8, KRU G8, Kylo G8",0
"CaptainDragonborn",0,1,86387,Geonosians Omicron,"zGBA Sun Fac, Geo Soldier, Geo Spy, Poggle",0
"CaptainDragonborn",0,1,84425,DR,"zDR HK-47 zBSF Sith Empire Trooper G8, Thrawn G8",0
"CaptainDragonborn",1,1,41088,NS_Alt,"MT 5* G8, AV G8, Talia 5* G8, Spirit 5* G8, Daka G9",0
"CaptainDragonborn",1,1,94956,zEP,"EP zzVader Tarkin G8, DT TFP",0
"CaptainDragonborn",1,0,71160,Troopers,"Veers 6* Starck G9, Gideon G8, zPiett Range Trooper 5* G9",0
"CaptainDragonborn",1,0,51800,Rex (Counter),"Rex zWampa 6* G9, Chirrut 5* G8, Baze 5* G8, R2-D2 G8",0
"Sidrial",,,178706,SEE,"zzzzzzSEE zBSF zzMalak zzzDR zzVader",1
"Sidrial",1,1,97703,NS,"zMT zAV zDaka Zombie Spirit",1
"Sidrial",1,0,125785,CLS,"zzzCLS zHan zChewbacca C-3PO zChewpio",1
"Sidrial",,,116399,Grievous Omicron,"zzGG zB2 zB1 MagnaGuard zDroideka",1
"Sidrial",,,311593,Malevolence,"Malevolence Hyena Bomber, Vulture Droid, Sun Fac SF, Soldier SF, Spy SF",1
"Sidrial",0,1,104448,Geonosians Omicron,"zzGBA Sun Fac, Geo Soldier, Geo Spy, Poggle",1
"Sidrial",,,494778,Negotiator,"Negotiator HT Anakin's Eta-2, Umbaran SF, Ahsoka's SF, Clone Sergeant's ARC-170, Plo's SF, Rex's ARC-170",1
"Sidrial",1,0,107152,Traya,"zzTraya DN zSion Sith Empire Trooper, zThrawn",1
"Sidrial",1,0,118389,Troopers,"zVeers zzPiett Gideon Dark Trooper, Range Trooper",1
"Sidrial",1,1,132271,GAS,"zzzzGAS zRex zEcho (501st), zzFives ARC Trooper",1
"Sidrial",1,1,122872,Revan,"zzzJKR BS zGMY zJolee zGK",1
"Sidrial",1,1,82326,Ewoks,"zChirpa Elder Paploo Wicket Logray",1
"Sidrial",0,1,137117,BH,"zzBossk IG-88 zZam zBoba zDengar",1
"Sidrial",0,1,69780,Phoenix,"Hera G8, Zeb G8, Ezra G8, Chopper Kanan G8",1
"Sidrial",1,0,107044,QGJ,"zQGJ Aayla zJKA zHYoda zAhsoka",1
"Sidrial",1,0,116316,EP (Counter, Rebel),"zzEP Shoretrooper Krennic DT zWampa",1
"Sidrial",1,0,24688,NestSolo (Counter),"zNest",1
"Sidrial",,,41446,Phasma,"Phasma 6* G7, FOTP 6* G6, FOSFTP 6* G6, FOST 6* G8, Kylo 6* G8",0
"Sidrial",,,51198,Admiral Raddus,"Admiral Raddus 3* G8, Cassian G9, Jyn 6* G7, Baze 5* G7, Bistan G8",0
"Sidrial",,,337359,HansMF,"Home One, Han's MF, Rebel Y-wing 6*, Bistan's U-wing 6*, Phantom Ghost Cassian's U-wing 6*, Wedge X-wing",0
"Sidrial",,,82515,Mon Mothma,"zMon Mothma 6* G9, Cara Dune, Biggs Wedge zPao",0
"Sidrial",,,101328,Nute-OR,"Nute zDooku Jango zZaalbar zMission",0
"Sidrial",1,0,46921,Jawas,"Nebit 6* G8, Jawa Engineer 6* G8, Jawa Scavenger 6* G8, Jawa 6* G8, Dathcha 6* G8",0
"SniperLord",,,532388,Executor,"Executor 5* HT RC Xanadu Blood, Slave I, IG-2000 Imperial TIE Fighter, Tie Adv",1
"SniperLord",0,1,138112,padme,"zzPadme zGK zJKA zAhsoka zC-3PO",1
"SniperLord",,,125770,Grievous Omicron,"zzGG zB2 zB1 MagnaGuard zDroideka",1
"SniperLord",1,0,117433,CLS,"zzzCLS zHan zzChewbacca zzR2-D2 zChewpio",1
"SniperLord",,,466999,Negotiator,"Negotiator BTL-B Y-wing, Anakin's Eta-2, Rex's ARC-170, Umbaran SF, Ahsoka's SF, Plo's SF, Clone Sergeant's ARC-170",1
"SniperLord",0,1,101092,Geonosians Omicron,"zzGBA Sun Fac, Geo Soldier, Geo Spy, Poggle",1
"SniperLord",,,364531,HansMF,"Home One, Han's MF, Rebel Y-wing, Bistan's U-wing, Phantom Ghost Cassian's U-wing, Wedge X-wing",1
"SniperLord",0,1,97138,DR,"zzzDR zzHK-47 zBSF Sith Marauder G8, Thrawn",1
"SniperLord",1,0,116888,Troopers,"zVeers zzPiett zzGideon Dark Trooper, Range Trooper",1
"SniperLord",1,1,139082,GAS,"zzzzGAS zRex zEcho (501st), zzFives zARC Trooper",1
"SniperLord",1,1,115829,Revan Offense,"zzzJKR zGMY BS zJolee zEzra",1
"SniperLord",1,1,84896,Ewoks,"zChirpa Elder Paploo Wicket Logray",1
"SniperLord",0,1,139343,BH,"zzBossk IG-88 zBoba Jango Dengar",1
"SniperLord",1,1,93204,Carth,"zCarth Onasi, zMission zZaalbar Juhani zCanderous",1
"SniperLord",1,1,120256,zEP,"zzEP zzzVader Tarkin DT TFP",1
"SniperLord",0,1,82502,Phoenix,"zHera zZeb G8, Sabine G8, Chopper zKanan",1
"SniperLord",1,1,74698,Rogue1,"Jyn Chirrut G9, Baze G9, Cassian G9, K-2SO G9",1
"SniperLord",,,60585,Phasma,"zPhasma G8, FOTP G9, FOSFTP G6, FOST G8, Kylo G8",0
"SniperLord",,,248993,Malevolence,"Malevolence 6* Hyena Bomber 5*, Vulture Droid, Sun Fac SF, Soldier SF, Spy SF",0
"SniperLord",1,0,62486,Traya,"Traya G1, DN G9, Sion G7, zDooku Sith Assassin G6",0
"SniperLord",,,70235,Mon Mothma,"Mon Mothma G1, Cara Dune, Biggs Lando Wedge",0
"SniperLord",1,1,57437,NS,"MT G7, AV Daka G9, Zombie G7, Spirit G5",0
"SniperLord",,,63000,Mando,"The Mandalorian (Beskar Armor), Dash Rendar G5, Nest G6, IG-11 G9, Kuiil",0
"SniperLord",,,33150,Bad Batch,"Hunter G1, Echo G1, Omega G1, Tech G1, Wrecker G1",0
"SniperLord",1,0,56290,Jawas,"Nebit G8, Jawa Engineer G7, Jawa Scavenger G7, Jawa G7, Dathcha G7",0
"DarthBrosaur",1,1,147109,SL Kylo,"zzzzzzSL Kylo, zSith Trooper, zHux zzKRU Thrawn",1
"DarthBrosaur",0,1,95052,DRMalak,"zzzDR HK-47 BSF zzMalak Sith Empire Trooper G8",1
"DarthBrosaur",,,327145,HansMF,"Home One, Han's MF, HT Bistan's U-wing, Phantom Ghost Cassian's U-wing, Biggs X-wing",1
"DarthBrosaur",0,1,95213,Grievous,"zzGG B2 zB1 G9, Droideka zDooku",1
"DarthBrosaur",,,94245,Disintegration,"Aurra G9, zzGreef Boba zzBossk zThe Mandalorian",1
"DarthBrosaur",1,1,104546,Revan,"zzzJKR BS zGMY zJolee GK",1
"DarthBrosaur",1,1,80916,Ewoks,"zChirpa G8, Elder zPaploo zWicket Logray G9",1
"DarthBrosaur",1,1,89894,Carth,"zCarth Onasi, zMission Zaalbar Juhani zCanderous",1
"DarthBrosaur",1,1,110409,zEP,"zzEP zzzVader Tarkin TFP G9, zSion",1
"DarthBrosaur",1,0,99938,Wampa (Counter),"Rex zWampa zHYoda G9, zzJyn FOO",1
"DarthBrosaur",0,1,64847,Phoenix,"Hera G8, Zeb G8, Ezra G8, Chopper Kanan G8",1
"DarthBrosaur",1,0,13774,NestSolo (Counter),"Nest G9",1
"DarthBrosaur",,,113816,Phasma,"zPhasma FOTP FOSFTP FOST Kylo",0
"DarthBrosaur",1,1,87376,NS,"zMT G9, zAV Daka Zombie Spirit",0
"DarthBrosaur",,,233510,Negotiator,"Negotiator BTL-B Y-wing 3*, Anakin's Eta-2 4*, Rex's ARC-170, Umbaran SF, Ahsoka's SF, Plo's SF, Clone Sergeant's ARC-170",0
"DarthBrosaur",1,0,92848,CLS,"zzCLS zHan Chewbacca G9, zzR2-D2 G9, Chewpio 6* G8",0
"DarthBrosaur",0,1,95448,Geonosians Omicron,"zzGBA Sun Fac, Geo Soldier, Geo Spy, Poggle",0
"DarthBrosaur",,,216650,Malevolence,"Malevolence 5* Hyena Bomber 4*, Vulture Droid 3*, Sun Fac SF, Soldier SF, Spy SF",0
"DarthBrosaur",,,93312,Mon Mothma,"zzMon Mothma G9, Hoth Rebel Scout, zCara Dune, Biggs zKyle Katarn",0
"DarthBrosaur",1,0,77555,Troopers,"Veers G8, Piett G8, zzGideon Dark Trooper 6*, Range Trooper",0
"DarthBrosaur",,,61789,Iden Troopers,"zIden Versio 3* G8, Shoretrooper G9, Snowtrooper G8, Magma G7, DT G7",0
"DarthBrosaur",0,1,74944,BH,"Jango IG-88 G9, Zam G9, Cad Dengar G9",0
"DarthBrosaur",,,52393,Bad Batch,"zHunter 5* G9, Echo 4* G8, Omega 5* G8, Tech 5* G8, zWrecker 4* G8",0
"Da Beetle",0,1,125739,padme,"zzPadme zGK zJKA zAhsoka zzC-3PO",1
"Da Beetle",0,1,101801,DRMalak,"zzDR HK-47 BSF zzMalak Sith Empire Trooper G9",1
"Da Beetle",1,1,109771,Revan Offense,"zzzJKR zGMY BS zJolee Ezra",1
"Da Beetle",1,1,81471,Ewoks,"zChirpa Elder Paploo Wicket Logray",1
"Da Beetle",1,0,121940,ShaakClones,"zzShaak Ti, zRex zEcho (501st), zzFives zARC Trooper",1
"Da Beetle",1,1,91224,Carth,"zCarth Onasi, zMission zZaalbar Juhani Canderous",1
"Da Beetle",0,1,96833,BH,"zzBossk Boba Jango zGreef The Mandalorian",1
"Da Beetle",1,1,96253,zEP,"zzEP zzzVader Tarkin G9, Dooku G9, zTraya",1
"Da Beetle",,,99857,Grievous Omicron,"GG zB2 zB1 MagnaGuard zDroideka",0
"Da Beetle",,,404947,Negotiator,"Negotiator BTL-B Y-wing, Anakin's Eta-2, Rex's ARC-170 6*, Umbaran SF, Ahsoka's SF, Plo's SF, Clone Sergeant's ARC-170",0
"Da Beetle",1,0,78768,CLS,"zCLS zHan G8, Chewbacca G9, R2-D2 G9, Chewpio G8",0
"Da Beetle",0,1,90302,Geonosians Omicron,"zGBA Sun Fac, Geo Soldier, Geo Spy, Poggle",0
"Da Beetle",,,37157,Mon Mothma,"Mon Mothma 4* G7, Cara Dune 5* G9, Kyle Katarn G5, Hoth Rebel Soldier G6, Pao G6",0
"Da Beetle",1,0,44177,Troopers,"Veers 4* G6, Starck G8, zPiett 4* G8, Dark Trooper G7, Snowtrooper G6",0
"Bischmarck",0,1,101770,DRMalak,"zzzDR HK-47 BSF zzMalak Sith Empire Trooper G8",1
"Bischmarck",0,1,111891,padme,"zzPadme zGK zJKA zAhsoka C-3PO",1
"Bischmarck",,,401284,Negotiator,"Negotiator HT Anakin's Eta-2, Umbaran SF, Ahsoka's SF, BTL-B Y-wing, Clone Sergeant's ARC-170, Plo's SF",1
"Bischmarck",0,1,119152,Grievous-Wat,"zzGG zB2 zB1 MagnaGuard zWat Tambor",1
"Bischmarck",1,0,81552,Traya,"zzTraya DN Sion zEP Nest",1
"Bischmarck",1,1,109286,GAS,"zzzzGAS zRex Echo (501st), zFives ARC Trooper",1
"Bischmarck",1,1,68222,Ewoks,"zChirpa G9, Elder Paploo Wicket Logray",1
"Bischmarck",0,1,86393,BH,"zBossk zZam Boba G9, Cad Jango",1
"Bischmarck",,,71103,Admiral Raddus,"Admiral Raddus G8, Cassian Jyn K-2SO Bistan",0
"Bischmarck",1,0,94179,CLS,"zzCLS zHan zChewbacca R2-D2 G8, Chewpio",0
"Bischmarck",0,1,89216,Geonosians Omicron,"zGBA Sun Fac, Geo Soldier, Geo Spy, Poggle",0
"Bischmarck",,,258213,Malevolence,"Malevolence 6* Hyena Bomber 6*, Vulture Droid 6*, Sun Fac SF, Soldier SF, Spy SF",0
"Bischmarck",1,0,64392,Troopers,"Veers G8, zPiett G9, Gideon G9, Dark Trooper, Range Trooper G7",0
"Bischmarck",,,68504,Mon Mothma,"zzMon Mothma G8, Hoth Rebel Scout G8, Scarif Kyle Katarn, Pao G8",0
"Bischmarck",1,1,78358,Carth,"Carth Onasi, zMission zZaalbar Juhani G7, Canderous",0
"MINI ASplendidJedi",,,122718,Phasma,"zPhasma zFOTP FOSFTP zFOST zKylo",1
"MINI ASplendidJedi",1,1,147129,SL Kylo,"zzzzzzSL Kylo, zSith Trooper, zHux zzKRU Thrawn G8",1
"MINI ASplendidJedi",0,1,133797,DRMalak,"zzzDR zzHK-47 zBSF zzMalak Sith Empire Trooper",1
"MINI ASplendidJedi",0,1,137794,padme,"zzPadme zGK zJKA zAhsoka zzC-3PO",1
"MINI ASplendidJedi",,,130918,Grievous Omicron,"zzGG zB2 zB1 zMagnaGuard zDroideka",1
"MINI ASplendidJedi",,,335681,Malevolence,"Malevolence Hyena Bomber, Vulture Droid, Sun Fac SF, Soldier SF, Spy SF",1
"MINI ASplendidJedi",0,1,121981,Geonosians Omicron,"zzGBA Sun Fac, Geo Soldier, Geo Spy, Poggle",1
"MINI ASplendidJedi",,,236318,HansMF,"Home One, Han's MF 6*, Rebel Y-wing, Ghost Phantom Biggs X-wing, Cassian's U-wing, Wedge X-wing",1
"MINI ASplendidJedi",,,463990,Negotiator,"Negotiator 5* HT Anakin's Eta-2, Umbaran SF, Ahsoka's SF, Clone Sergeant's ARC-170, Plo's SF, Rex's ARC-170",1
"MINI ASplendidJedi",,,126313,Disintegration,"zzAurra zGreef Boba G9, zzBossk zThe Mandalorian",1
"MINI ASplendidJedi",1,1,88282,Ewoks,"zChirpa Elder Paploo Wicket Logray",1
"MINI ASplendidJedi",1,1,99020,Revan Offense,"zzzJKR zGMY BS zJolee Ezra",1
"MINI ASplendidJedi",1,0,115102,ShaakClones,"zzShaak Ti, zRex zEcho (501st), zzFives zARC Trooper",1
"MINI ASplendidJedi",1,1,87239,Carth,"Carth Onasi, Mission Zaalbar Juhani G9, zCanderous",1
"MINI ASplendidJedi",1,0,96797,CLS,"zzzCLS zHan zzChewbacca R2-D2 G9, zChewpio",0
"MINI ASplendidJedi",1,1,84248,zEP,"zzEP zzVader G8, Tarkin G8, Dooku G1, Traya G6",0
"MINI ASplendidJedi",0,1,57803,Phoenix,"Hera G8, Zeb G8, Sabine G4, Chopper G8, Kanan G8",0
"Gutzag",1,0,128498,CLS,"zzCLS zHan zChewbacca C-3PO Chewpio",1
"Gutzag",1,1,81684,Ewoks,"zChirpa Elder Paploo Wicket Logray",1
"Gutzag",0,1,104893,BH,"zzBossk IG-88 Boba Jango Dengar",1
"Gutzag",1,0,84108,501st,"Rex ARC Trooper, Echo (501st), zFives zAhsoka",1
"Gutzag",0,1,65599,Phoenix,"Hera G8, Zeb G8, Ezra G9, Chopper G8, Kanan G9",1
"Gutzag",1,0,93782,EP (Counter, Rebel),"EP zzWampa zNest Stormtrooper Starck",1
"Gutzag",,,258611,Malevolence,"Malevolence 5* Hyena Bomber 6*, Vulture Droid, Sun Fac SF, Soldier SF, Spy SF",0
"Gutzag",0,1,98511,Geonosians Omicron,"zzGBA Sun Fac, Geo Soldier, Geo Spy, Poggle",0
"Gutzag",,,275854,HansMF,"Home One 6*, Han's MF 5*, HT Ghost Phantom Biggs X-wing, Cassian's U-wing 4*, Wedge X-wing",0
"Gutzag",1,1,94121,Revan,"zJKR BS GMY zJolee zGK",0
"Gutzag",1,1,51844,NS_Alt,"AV G9, Talia 6* Zombie 6* G8, Spirit 5* G7, Daka",0
"Harry TBE",1,1,156791,SL Kylo,"zzzzzzSL Kylo, zSith Trooper, zHux zzKRU zThrawn",1
"Harry TBE",0,1,109604,DRMalak,"zzzDR zHK-47 zBSF zzMalak 6* Sith Empire Trooper",1
"Harry TBE",1,0,112869,CLS,"zzzCLS zHan zzChewbacca zzR2-D2 zChewpio",1
"Harry TBE",,,401735,Negotiator,"Negotiator 6* HT Anakin's Eta-2, Umbaran SF, Ahsoka's SF, BTL-B Y-wing, Clone Sergeant's ARC-170, Plo's SF",1
"Harry TBE",1,0,116473,Traya,"zzTraya zzDN zSion Dooku zzEP",1
"Harry TBE",1,1,115174,Revan,"zzzJKR zBS zGMY zJolee zGK",1
"Harry TBE",0,1,98305,BH,"zBossk Boba Cad zJango Dengar",1
"Harry TBE",1,1,87708,Carth,"Carth Onasi G9, zMission Zaalbar zJuhani zCanderous",1
"Harry TBE",1,0,111319,Troopers,"zVeers zStarck zzPiett zDark Trooper, DT",1
"Harry TBE",0,1,73314,Phoenix,"Hera G9, Zeb G8, Ezra Chopper G9, Kanan G9",1
"Harry TBE",,,123086,Phasma,"zPhasma zFOTP FOSFTP zFOST zKylo",0
"Harry TBE",0,1,101128,Geonosians Omicron,"zzGBA Sun Fac, Geo Soldier, Geo Spy, Poggle",0
"Harry TBE",,,299291,HansMF,"Home One, Han's MF, Biggs X-wing, Bistan's U-wing 4*, Phantom Ghost Cassian's U-wing, Wedge X-wing",0
"Harry TBE",,,408290,Executrix,"Executrix Tie Adv, Emperor's Shuttle, TIE Reaper 3*, Imperial TIE Fighter, Gauntlet Starfighter, FOSF TIE Fighter, FO TIE Fighter",0
"Harry TBE",1,1,52551,NS_Alt,"MT G8, AV G9, Talia G8, Spirit G8, Daka G8",0
"Harry TBE",1,0,81680,ShaakClones,"zzShaak Ti G9, Rex Echo (501st) G8, Fives Clone Sergeant",0
"Harry TBE",1,1,42263,Rogue1,"Jyn 6* G8, Chirrut 5* G8, Baze 6* G8, Cassian G8, K-2SO G8",0
"liam3265",,,122307,Phasma,"zPhasma zFOTP FOSFTP zFOST zKylo",1
"liam3265",1,1,76646,Ewoks,"zChirpa Elder Paploo Wicket Logray",1
"liam3265",0,1,88109,BH,"zBossk zBoba Jango Dengar G9, The Mandalorian G9",1
"liam3265",0,1,62449,Phoenix,"Hera Zeb G9, Ezra G9, Chopper G9, Kanan G9",1
"liam3265",1,0,93079,CLS,"zzCLS zHan Chewbacca zC-3PO Chewpio 6*",0
"liam3265",0,1,92726,Geonosians Omicron,"zzGBA Sun Fac, Geo Soldier, Geo Spy, Poggle",0
"liam3265",1,0,62728,Troopers,"zVeers zPiett 6* G9, Gideon 5* G8, Dark Trooper 5* G9, Range Trooper 5*",0
"liam3265",1,1,95459,Revan,"zJKR BS zGMY zJolee GK",0
"liam3265",1,1,108253,zEP,"zEP zzzVader Tarkin zSith Trooper, BSF 4* G8",0
"liam3265",1,0,6153,SionSolo (Counter),"Sion G4",0
"Dan",,,122906,Phasma,"zPhasma zFOTP FOSFTP zFOST zKylo",1
"Dan",1,1,152048,SL Kylo,"zzzzzzSL Kylo, zSith Trooper, zHux zzKRU Thrawn",1
"Dan",,,165497,JMLS,"zzzJKR zzJKL zzzzzzJMLS zzHYoda zzzzGAS",1
"Dan",1,0,143225,CLS,"zzzCLS zHan zzChewbacca zzC-3PO zChewpio",1
"Dan",0,1,110461,padme,"zzPadme zGK zJKA zAhsoka CW Chewbacca G8",1
"Dan",,,419313,Negotiator,"Negotiator BTL-B Y-wing, Anakin's Eta-2, Rex's ARC-170, Umbaran SF, Ahsoka's SF, Plo's SF, Clone Sergeant's ARC-170",1
"Dan",,,383165,HansMF,"Home One, Han's MF, Rebel Y-wing, Bistan's U-wing, Phantom Biggs X-wing, Cassian's U-wing, Wedge X-wing",1
"Dan",0,1,105517,Grievous,"zzGG zB2 zB1 MagnaGuard zNute",1
"Dan",1,1,123831,JTR,"zzzJTR Scav Rey, zzBB-8 zzR2-D2 zFinn",1
"Dan",1,1,110091,Ewoks,"zChirpa Elder zPaploo zWicket zLogray",1
"Dan",1,0,128448,ShaakClones,"zzShaak Ti, zRex zEcho (501st), zzFives zARC Trooper",1
"Dan",0,1,109255,BH,"zzBossk zZam zBoba zJango Dengar",1
"Dan",1,1,120382,zEP,"zzEP zzzVader Tarkin TFP zzTraya",1
"Dan",0,1,69296,Phoenix,"Hera Zeb Sabine G8, Ezra Kanan G8",1
"Dan",1,0,17038,SionSolo (Counter),"Sion",1
"Dan",0,1,96988,Geonosians Omicron,"zzGBA Sun Fac, Geo Soldier, Geo Spy, Poggle",0
"Dan",1,1,80358,NS,"MT G9, zAV zDaka Zombie G8, Spirit G8",0
"Dan",1,0,85378,Troopers,"zVeers zzPiett Gideon Dark Trooper G9, Range Trooper G8",0
"Dan",,,109272,Mon Mothma,"zzMon Mothma, zCara Dune 6*, Biggs Lando Wedge",0
"tobster",,,128263,Phasma,"zPhasma zFOTP FOSFTP zFOST zKylo",1
"tobster",1,1,154555,SL Kylo,"zzzzzzSL Kylo, zSith Trooper, zHux zzKRU zThrawn",1
"tobster",0,1,103889,BH,"zzBossk IG-88 G9, Boba Cad zJango",1
"tobster",0,1,75754,Phoenix,"Hera Zeb G8, zEzra Chopper zKanan G8",1
"tobster",0,1,90801,padme,"zzPadme G8, zGK JKA G9, Ahsoka G9, zzFives G8",1
"tobster",,,48309,Admiral Raddus,"zAdmiral Raddus 3* G6, Cassian G8, Jyn 6* G8, K-2SO G8, Chirrut 5* G8",0
"tobster",,,73052,Grievous Omicron,"zzGG B2 G5, zB1 6* G7, MagnaGuard Droideka G9",0
"tobster",0,1,93353,Geonosians Omicron,"zzGBA Sun Fac, Geo Soldier, Geo Spy, Poggle",0
"tobster",,,216726,HansMF,"Home One 6*, Han's MF 6*, Biggs X-wing, Bistan's U-wing 3*, Phantom Ghost Cassian's U-wing, Wedge X-wing",0
"tobster",1,1,59382,NS,"MT G9, AV Daka G8, Zombie G9, Spirit G8",0
"tobster",,,44522,Mon Mothma,"Mon Mothma 4* G9, Hoth Rebel Scout G8, Biggs G8, Baze 6* G8, Wedge 6* G8",0
"tobster",1,1,87942,zEP,"zzEP zzzVader Tarkin G9, Dooku 6* G8, TFP G8",0
"tobster",0,1,94471,BS,"BS zGMY Aayla G9, Old Ben G9, zzHYoda",0
"tobster",1,0,8284,NestSolo (Counter),"Nest 4* G6",0
