Player,Offense,Defense,GP,Name,Squad,Viable
"OldManDan",1,0,62934,Traya,"Traya G8, DN 5* G7, zSion G7, zDooku Thrawn G8",0
"OldManDan",0,1,58209,Grievous,"GG G9, B2 G7, MagnaGuard G9, T3-M4 G7, L3-37 6* G8",0
"OldManDan",,,285812,Executrix,"Executrix Tie Adv, Emperor's Shuttle 6*, TIE Reaper 4*, Imperial TIE Fighter, Gauntlet Starfighter, FOSF TIE Fighter, FO TIE Fighter",0
"OldManDan",1,1,99955,Revan Offense,"zJKR zzGMY BS zJolee HYoda G6",0
"OldManDan",1,0,65598,ShaakClones,"Shaak Ti G8, Rex Echo (501st) G8, Fives Clone Sergeant G8",0
"OldManDan",1,0,68099,Wiggs,"Wedge G8, Biggs G8, CLS Han G8, Leia G8",0
"OldManDan",1,0,59120,Troopers,"Veers G9, Starck G7, Magma G8, Piett Stormtrooper G9",0
"OldManDan",0,1,68827,BH,"Jango Zam G8, Cad G7, Greedo G8, Greef G7",0
"Jbird",0,1,107545,DRMalak,"zzzDR HK-47 zBSF zzMalak Sith Empire Trooper G8",1
"Jbird",0,1,111233,padme,"zzPadme zGK JKA zAhsoka zzC-3PO",1
"Jbird",,,358908,Negotiator,"Negotiator HT Anakin's Eta-2, Umbaran SF, Ahsoka's SF, Clone Sergeant's ARC-170, Jedi Consular's Starfighter, Plo's SF",1
"Jbird",,,98319,Nute-OR,"zNute zDooku Jango zZaalbar zMission",1
"Jbird",1,1,119893,Revan Offense,"zzzJKR zzGMY zBS zJolee Ezra",1
"Jbird",1,1,90048,Ewoks,"zChirpa Elder zPaploo zWicket zLogray",1
"Jbird",0,1,108076,BH,"zzBossk IG-88 zBoba zGreedo zDengar",1
"Jbird",1,1,112719,zEP,"zzEP zzzVader Tarkin TFP zzTraya",1
"Jbird",0,1,90012,Phoenix,"zHera Kanan Zeb Sabine Chopper",1
"Jbird",1,0,16932,SionSolo (Counter),"Sion",1
"Jbird",,,84820,Phasma,"Phasma FOE FOO KRU Kylo",0
"Jbird",,,313262,HansMF,"Home One, Han's MF, Biggs X-wing, Bistan's U-wing, Phantom Ghost Cassian's U-wing, Wedge X-wing",0
"Jbird",0,1,86325,Geonosians,"zzGBA Sun Fac G8, Geo Soldier, Geo Spy, Poggle",0
"Jbird",1,1,73293,JTR,"JTR G7, Scav Rey, BB-8 G9, R2-D2 G9, Finn",0
"Jbird",0,1,86345,Grievous,"zGG zB2 MagnaGuard T3-M4 L3-37 G8",0
"Jbird",1,1,61242,NS,"MT G8, AV Daka G8, Zombie G4, Spirit G6",0
"Jbird",1,0,66249,ShaakClones,"zzShaak Ti, Rex G6, Echo (501st) G6, Fives Clone Sergeant G6",0
"Jbird",1,0,97611,CLS,"zzzCLS Han Leia G9, Old Ben, Chewbacca",0
"Jbird",1,0,49046,Troopers,"Veers G8, Starck G8, Gideon G2, Range Trooper 6*, Stormtrooper G7",0
"Jbird",1,0,35563,Jawas,"Nebit G4, Jawa Engineer G5, Jawa Scavenger G7, Jawa G4, Dathcha G4",0
