Player,Offense,Defense,GP,Name,Squad,Viable
"Styckeey Battle",0,1,107213,DRMalak,"zzzDR HK-47 zBSF zzMalak Sith Assassin G8",1
"Styckeey Battle",1,1,103609,Revan,"zzzJKR BS GMY zJolee GK G8",1
"Styckeey Battle",1,1,92209,Ewoks,"zChirpa Elder zPaploo zWicket Logray",1
"Styckeey Battle",0,1,98077,BH,"zBossk Cad Dengar G8, zBoba Zam",1
"Styckeey Battle",1,1,97366,Carth,"zCarth Onasi, zMission zZaalbar zJuhani Canderous",1
"Styckeey Battle",1,1,104795,zEP,"zzEP zzVader Tarkin G8, TFP G8, zSith Trooper",1
"Styckeey Battle",0,1,68256,Phoenix,"Hera G8, Zeb G8, Chopper G8, Ezra G9, Kanan G8",1
"Styckeey Battle",1,0,13864,SionSolo (Counter),"Sion G9",1
"Styckeey Battle",,,75863,Grievous Omicron,"GG B2 G8, zB1 G8, MagnaGuard G8, zDroideka G9",0
"Styckeey Battle",1,0,62065,CLS,"CLS G8, Han G9, Chewbacca G9, R2-D2 G8, Chewpio 4* G8",0
"Styckeey Battle",0,1,79106,Geonosians Omicron,"zzGBA Sun Fac G7, Geo Soldier, Geo Spy G8, Poggle G9",0
"Styckeey Battle",,,269946,HansMF,"Home One, Han's MF 5*, Rebel Y-wing 5*, Bistan's U-wing 5*, Phantom 6* Biggs X-wing, Cassian's U-wing, Wedge X-wing",0
"Styckeey Battle",1,1,60182,NS,"MT G8, AV Daka G8, Zombie 6* G9, Spirit G8",0
"Styckeey Battle",,,73158,Mon Mothma,"zMon Mothma 5* G9, Jyn G8, Kyle Katarn, K-2SO G9, Biggs",0
"Styckeey Battle",1,0,55093,ShaakClones,"Shaak Ti 6* G6, Rex G8, Echo (501st) G8, Fives G9, Clone Sergeant G8",0
"Styckeey Battle",1,0,50412,Thragma (Counter),"Thrawn 6* G7, Magma G7, DT 6* G8, Stormtrooper G8, Shoretrooper G8",0
"Styckeey Battle",0,1,78718,BH,"Jango zGreef The Mandalorian G8, Greedo G9, IG-88 G8",0
"Styckeey Battle",1,0,64723,QGJ,"QGJ G8, Aayla G8, JKA G8, Old Ben G9, Ahsoka G8",0
"DarthKrillin",0,1,113817,DRMalak,"zzzDR zzHK-47 zBSF zzMalak Sith Empire Trooper",1
"DarthKrillin",1,0,128631,Traya,"zzTraya zzDN zSion zzEP zzThrawn",1
"DarthKrillin",1,1,134864,Revan,"zzzJKR zBS zzGMY zJolee zGK",1
"DarthKrillin",1,1,100616,Carth,"zCarth Onasi, zMission zZaalbar Juhani zCanderous",1
"DarthKrillin",0,1,82071,BH,"zzJango Dengar G8, Boba Greedo G9, IG-88 G8",1
"DarthKrillin",0,1,74462,Phoenix,"Hera Zeb G8, Chopper G9, Ezra Kanan",1
"DarthKrillin",0,1,90719,Geonosians Omicron,"zzGBA Sun Fac, Geo Soldier, Geo Spy, Poggle",0
"DarthKrillin",0,1,82373,Grievous,"GG B2 MagnaGuard G8, zDooku T3-M4 G7",0
"DarthKrillin",1,0,62908,ShaakClones,"Shaak Ti G8, Rex G8, Echo (501st) G6, Fives Clone Sergeant G5",0
"Animus313",1,1,101376,zEP,"zzEP zzVader Tarkin TFP G8, zMara Jade, The Emperor's Hand",1
"Animus313",0,1,75844,FO,"zKRU Kylo FOO G9, FOE G9, Phasma",1
"Animus313",0,1,62686,Phoenix,"Hera Zeb G8, Chopper G8, Ezra G8, Kanan G8",1
"Animus313",0,1,91425,BS,"zBS zGMY JKA GK Ahsoka G9",1
"Animus313",1,0,64487,Jawas,"Nebit G9, Jawa Engineer G9, Jawa Scavenger, Jawa Dathcha",1
"Animus313",,,48874,Grievous Omicron,"GG G8, B2 G9, B1 3* G8, MagnaGuard 6* G9, Droideka 4* G9",0
"Animus313",0,1,86352,Geonosians Omicron,"zzGBA Sun Fac G9, Geo Soldier G9, Geo Spy G9, Poggle",0
"Animus313",1,1,69858,JTR,"JTR G8, Scav Rey, BB-8 G9, R2-D2 G9, Finn G9",0
"Animus313",1,1,56291,Ewoks,"Chirpa G9, Elder Paploo G9, Teebo Logray 5* G7",0
"Animus313",1,0,71886,Clones,"zCody G9, Rex Echo (501st) G8, zFives ARC Trooper G8",0
"Animus313",,,63561,Iden Troopers,"Iden Versio 3* G8, Stormtrooper Snowtrooper G8, Magma DT",0
"Animus313",1,0,61952,Wiggs,"Wedge G8, Biggs G6, zCLS Han G9, Chewbacca G9",0
"Animus313",0,1,103091,BH,"Jango Cad Boba zThe Mandalorian, Zam",0
"Gomer332",0,1,92942,Geonosians Omicron,"zzGBA Sun Fac, Geo Soldier, Geo Spy, Poggle",1
"Gomer332",0,1,78169,Grievous,"zGG B2 G8, Droideka G8, MagnaGuard G8, zDooku",1
"Gomer332",1,1,105795,Revan Offense,"zzzJKR GMY zBS zJolee JKA",1
"Gomer332",1,1,88421,Ewoks,"zChirpa Elder Paploo Teebo Wicket",1
"Gomer332",1,1,89936,Carth,"Carth Onasi, zMission zZaalbar Juhani Canderous",1
"Gomer332",0,1,93210,BH,"zBossk Cad Boba Greef Greedo",1
"Gomer332",1,1,119599,zEP,"zzEP zzzVader zTarkin DT TFP",1
"Gomer332",0,1,72519,FO,"zKRU Kylo G8, FOO G8, FOE Phasma G8",1
"Gomer332",1,0,82906,Wiggs,"Wedge G9, Biggs zCLS Ezra G9, Leia G9",1
"Gomer332",1,0,17551,SionSolo (Counter),"Sion",1
"Gomer332",,,275342,HansMF,"Home One, Han's MF 6*, Biggs X-wing, Bistan's U-wing, Phantom Ghost Cassian's U-wing, Wedge X-wing",0
"Gomer332",0,1,94205,DR,"DR HK-47 BSF Sith Assassin G8, zzThrawn",0
"Gomer332",1,1,64483,JTR,"JTR G7, Scav Rey G8, BB-8 G8, R2-D2 Finn G8",0
"Gomer332",1,1,47508,NS,"MT 6* G8, AV G9, Daka G9, Zombie G6, Spirit 5* G8",0
"Gomer332",1,0,63388,ShaakClones,"Shaak Ti 6* G8, Rex G8, Echo (501st) G8, Fives G9, Clone Sergeant",0
"Gomer332",1,0,79481,Troopers,"Veers Starck G9, zIden Versio, Dark Trooper G9, Shoretrooper",0
"Gomer332",0,1,71987,Phoenix,"Hera Sabine 5* G8, Zeb G9, Chopper Kanan G9",0
"Gomer332",1,1,44334,Rogue1,"Jyn G8, Chirrut 5* G8, Baze 5* G8, Cassian G8, K-2SO G8",0
"Gomer332",1,0,42989,Jawas,"Nebit G7, Jawa Engineer G8, Jawa Scavenger G7, Jawa G8, Dathcha G8",0
"Colts2ndF2P",1,0,110074,CLS,"zzzCLS zHan zChewbacca C-3PO zChewpio",1
"Colts2ndF2P",0,1,100668,DRMalak,"zzDR zHK-47 BSF zzMalak 6* Thrawn",1
"Colts2ndF2P",1,1,101745,Revan Offense,"zzzJKR GMY BS zJolee JKA",1
"Colts2ndF2P",1,1,80533,Ewoks,"zChirpa Elder Paploo Wicket Logray",1
"Colts2ndF2P",0,1,88946,BH,"zBossk Boba Jango zGreef zThe Mandalorian",1
"Colts2ndF2P",0,1,63921,Phoenix,"Hera G9, Zeb G8, Chopper G9, Ezra Kanan G8",1
"Colts2ndF2P",1,0,75264,EP (Counter, Rebel),"zzEP Shoretrooper Range Trooper G9, Stormtrooper G9, Starck G9",1
"Colts2ndF2P",0,1,75687,Geonosians Omicron,"zGBA Sun Fac, Geo Soldier, Geo Spy, Poggle",0
"Colts2ndF2P",1,1,68005,Carth,"Carth Onasi, Mission G7, zZaalbar zJuhani Canderous G7",0
"PeezieF83",0,1,120329,DRMalak,"zzzDR HK-47 zBSF zzMalak Thrawn G9",1
"PeezieF83",1,1,86627,JTR,"zzzJTR Scav Rey, BB-8 G9, R2-D2 G8, zFinn G9",1
"PeezieF83",1,1,137530,Revan,"zzzJKR zBS zzGMY zJolee zGK",1
"PeezieF83",1,1,101862,zEP,"zzEP zzzVader Tarkin G9, TFP G9, Traya G9",1
"PeezieF83",0,1,92759,Phoenix,"Hera G9, Zeb Chopper zEzra zKanan",1
"PeezieF83",,,79400,Phasma,"Phasma G8, FOE FOO KRU Kylo",0
"PeezieF83",0,1,91518,Geonosians Omicron,"zzGBA Sun Fac, Geo Soldier, Geo Spy, Poggle",0
"PeezieF83",1,1,65187,NS,"MT G8, AV Daka G9, Zombie Spirit G8",0
"PeezieF83",1,1,86806,Carth,"Carth Onasi, zMission zZaalbar Juhani Canderous G7",0
"PeezieF83",1,0,82742,501st,"Rex G9, Clone Sergeant, Echo (501st) G9, Fives G9, zAhsoka",0
"PeezieF83",1,0,56190,Wiggs,"Wedge 5* G8, Biggs G8, CLS G8, Fulcrum G8, Leia",0
"PeezieF83",1,1,44539,Rogue1,"Jyn 5* G8, Chirrut 5* G8, Baze 5* G8, Cassian 6* K-2SO 5* G8",0
"Djsenior",0,1,141278,padme,"zzPadme zGK zJKA zAhsoka zzC-3PO",1
"Djsenior",1,1,140594,Revan Offense,"zzzJKR zzGMY BS zJolee zzHYoda",1
"Djsenior",1,1,88869,Ewoks,"zChirpa Elder Paploo zWicket zLogray",1
"Djsenior",0,1,71128,Phoenix,"Hera G8, Zeb G8, Chopper Ezra G8, Kanan G8",1
"Djsenior",,,62761,Phasma,"Phasma G7, FOTP G8, FOSFTP G7, FOST 2* G7, zKylo",0
"Djsenior",1,0,129719,CLS,"zzzCLS zHan zzChewbacca zzR2-D2 zChewpio 5*",0
"Djsenior",0,1,87709,Geonosians Omicron,"zzGBA G8, Sun Fac, Geo Soldier, Geo Spy, Poggle",0
"Djsenior",,,372281,Negotiator,"Negotiator 5* HT Anakin's Eta-2 4*, Umbaran SF 6*, Ahsoka's SF, Clone Sergeant's ARC-170, Jedi Consular's Starfighter, Plo's SF",0
"Djsenior",1,0,79292,Traya,"zTraya G9, DN 4* Sion 5* EP zThrawn G9",0
"Djsenior",0,1,49027,Grievous,"GG G8, B2 5* G4, IG-88 G7, IPD 6* G5, T3-M4 G7",0
"Djsenior",1,1,51924,NS,"MT 5* G7, AV Daka G8, Zombie 6* G7, Spirit 6* G7",0
"Djsenior",0,1,107100,BH,"zzBossk Dengar G7, zBoba zzJango The Mandalorian 5*",0
"Djsenior",1,0,60585,ShaakClones,"Shaak Ti 4* G8, Rex G8, Echo (501st) G6, Fives G8, Clone Sergeant G9",0
"Tyundi",0,1,130661,padme,"zzPadme zGK zJKA zAhsoka zzC-3PO",1
"Tyundi",1,0,104458,CLS,"zzzCLS zHan zzChewbacca R2-D2 G9, zChewpio",1
"Tyundi",0,1,102085,Grievous,"zzGG zB2 zB1 zDroideka Dooku",1
"Tyundi",1,1,121825,GAS,"zzzzGAS zRex zEcho (501st), zzFives zARC Trooper",1
"Tyundi",1,1,120903,Revan Offense,"zzzJKR zzGMY zBS zJolee zzHYoda",1
"Tyundi",1,1,87411,Ewoks,"zChirpa Elder Paploo Wicket zLogray",1
"Tyundi",1,1,97087,zEP,"zEP zzVader Tarkin TFP BSF",1
"Tyundi",0,1,66947,Phoenix,"Hera G9, Zeb G8, Chopper G8, Ezra Kanan G8",1
"Tyundi",,,54944,Phasma,"Phasma G7, FOE G8, FOO G6, KRU G8, Kylo G8",0
"Tyundi",0,1,96354,Geonosians Omicron,"zzGBA Sun Fac, Geo Soldier, Geo Spy, Poggle",0
"Tyundi",1,1,79383,NS,"MT G8, zzAV Daka G8, Zombie Spirit G9",0
"Tyundi",1,1,70244,Carth,"Carth Onasi, Mission G7, Zaalbar G7, Juhani Canderous",0
"Tyundi",0,1,86620,BH,"Bossk Dengar G9, Boba Jango Greef",0
"Tyundi",1,0,55032,Wiggs,"Wedge G9, Biggs Leia G8, Chirrut 3* G6, Baze 5* G6",0
"AnakinSky",1,1,119299,Revan Offense,"zzzJKR GMY zBS Jolee zJKA",1
"AnakinSky",,,77622,Nute-OR,"Nute Dooku Jango Zaalbar G6, Mission",0
"AnakinSky",1,0,65930,501st,"Rex ARC Trooper G7, Echo (501st) 6* G8, Fives G9, Ahsoka",0
"Special D",0,1,57061,Phoenix,"Hera G8, Zeb G8, Chopper G7, Ezra G9, Kanan G8",0
"Special D",0,1,111534,BH,"zJango Cad 6* G8, Boba zzGreef zThe Mandalorian",0
"Latch",0,1,91285,padme,"zPadme G9, GK G8, zJKA zAhsoka zCW Chewbacca",1
"Latch",,,324171,HansMF,"Home One, Han's MF 6*, Rebel Y-wing, Bistan's U-wing, Phantom Ghost Cassian's U-wing, Wedge X-wing",1
"Latch",,,362730,Negotiator,"Negotiator 5* HT Anakin's Eta-2, Umbaran SF, Ahsoka's SF, Clone Sergeant's ARC-170, Plo's SF, Rex's ARC-170",1
"Latch",1,1,118839,JTR,"zzzJTR zzR2-D2 zzBB-8 RH Finn G8, RH Poe G9",1
"Latch",,,359232,Executrix,"Executrix Tie Adv, Emperor's Shuttle, TIE Reaper, Imperial TIE Fighter, Gauntlet Starfighter, FOSF TIE Fighter, FO TIE Fighter",1
"Latch",1,1,120267,Revan Offense,"zzzJKR zzGMY zBS Jolee G8, zzHYoda",1
"Latch",1,1,98647,Ewoks,"zChirpa Elder zPaploo zWicket zLogray",1
"Latch",0,1,118227,BH,"zzBossk Dengar G8, zBoba zzJango zzThe Mandalorian",1
"Latch",1,1,89450,Carth,"zCarth Onasi, Mission G8, Zaalbar G8, zJuhani zCanderous",1
"Latch",1,1,135942,zEP,"zzEP zzzVader zzTarkin zBSF zzTraya",1
"Latch",0,1,82182,Phoenix,"Hera G8, Sabine G8, Chopper zEzra zKanan G8",1
"Latch",0,1,87191,FO,"zzKRU zKylo FOTP FOST G8, Phasma G8",1
"Latch",,,59730,Admiral Raddus,"Admiral Raddus 3* G7, Cassian G7, zJyn G8, K-2SO G7, Bistan G8",0
"Latch",1,0,88754,CLS,"zzzCLS zHan Chewbacca G8, C-3PO 6* G8, Chewpio G5",0
"Latch",,,231782,Malevolence,"Malevolence 5* Hyena Bomber 4*, Vulture Droid 3*, Sun Fac SF, Soldier SF, Spy SF",0
"Latch",0,1,78614,Geonosians Omicron,"GBA G9, Sun Fac G7, Geo Soldier, Geo Spy, Poggle",0
"Latch",1,1,90244,NS,"MT G8, zzAV zDaka Zombie G8, Spirit",0
"Latch",0,1,86895,Grievous,"zzGG B2 G5, Droideka G8, zDooku IG-88",0
"Latch",,,62963,Mon Mothma,"Mon Mothma 5* G7, Chirrut G8, Lando G9, Wedge G8, Cara Dune",0
"Latch",1,0,71353,Clones,"Cody G7, zRex Echo (501st) G7, Fives G8, Clone Sergeant",0
"Latch",1,0,62971,Troopers,"Veers G9, Starck G8, Stormtrooper G8, Snowtrooper Magma G7",0
"Latch",1,0,11956,SionSolo (Counter),"Sion G7",0
"Brandino",1,1,72325,Carth,"Carth Onasi, Mission G8, Zaalbar G8, Juhani Canderous",1
"Brandino",1,0,94527,501st,"zRex ARC Trooper, Echo (501st), zzFives Ahsoka",1
"Brandino",0,1,58170,Phoenix,"Hera Zeb G8, Chopper G8, Ezra G8, Kanan G8",1
"Brandino",,,36514,Phasma,"Phasma 6* G8, FOE 5* G8, FOO 5* G8, KRU 6* G8, Kylo 6* G8",0
"Brandino",0,1,47315,Geonosians Omicron,"GBA G9, Sun Fac G7, Geo Soldier G9, Geo Spy G8, Poggle G7",0
"Brandino",0,1,75632,DR,"zDR HK-47 zBSF Sith Empire Trooper 5* G8, Thrawn 6* G8",0
"Brandino",1,1,76748,Revan Offense,"zJKR G9, GMY BS zJolee JKA G8",0
"Brandino",1,1,33161,NS_Alt,"MT 5* G8, AV 5* G8, Daka 5* G8, Spirit 5* G8, Talia 5* G8",0
"Brandino",1,1,55100,zEP,"EP G9, Vader Tarkin G8, Sion 4* G9, DN 5* G8",0
"Brandino",1,0,37329,Wiggs,"Wedge 5* G8, Biggs 5* G8, Leia G8, Chirrut 5* G8, Baze 5* G8",0
"Schmidt Happens",0,1,107207,DRMalak,"zzzDR zHK-47 zBSF zMalak Sith Assassin",1
"Schmidt Happens",1,1,92735,JTR,"zJTR Scav Rey, BB-8 zR2-D2 zFinn",1
"Schmidt Happens",1,1,113532,Revan,"zzzJKR BS zzGMY zJolee GK",1
"Schmidt Happens",1,1,103593,Carth,"zCarth Onasi, zMission zZaalbar zJuhani zCanderous",1
"Schmidt Happens",0,1,102817,BH,"zzBossk Boba Jango zGreef zThe Mandalorian",1
"Schmidt Happens",1,1,103006,zEP,"zzEP zzVader zTarkin TFP G9, zTraya",1
"Schmidt Happens",0,1,99937,FO,"zzKRU Kylo FOO FOE zHux",1
"Schmidt Happens",0,1,87010,Phoenix,"zHera zSabine Zeb G9, Ezra Kanan",1
"Schmidt Happens",1,0,20224,SionSolo (Counter),"zSion",1
"Schmidt Happens",0,1,94486,Geonosians Omicron,"zzGBA Sun Fac, Geo Soldier, Geo Spy, Poggle",0
"Schmidt Happens",1,0,77538,Wiggs,"Wedge G7, Biggs G7, zzCLS Han Chewbacca G9",0
"Dark One",,,131591,Phasma,"zPhasma FOE zSith Trooper, zzKRU zKylo",1
"Dark One",0,1,138079,DRMalak,"zzzDR zzHK-47 zBSF zzMalak Sith Empire Trooper",1
"Dark One",0,1,113611,padme,"zzPadme zGK zJKA zAhsoka zzC-3PO",1
"Dark One",1,1,100459,NS_Alt,"zzMT zzAV Zombie zDaka Talia",1
"Dark One",1,0,116574,Traya,"zzTraya zzDN zSion zzEP zThrawn",1
"Dark One",1,1,127553,JTR,"zzzJTR zScav Rey, zzBB-8 zzR2-D2 RT",1
"Dark One",1,1,130291,Revan Offense,"zzzJKR zGMY zBS zJolee zHYoda",1
"Dark One",1,1,90827,Ewoks,"zChirpa Elder zPaploo zWicket Logray",1
"Dark One",1,0,110736,ShaakClones,"zzShaak Ti, zRex Echo (501st), zzFives zARC Trooper",1
"Dark One",1,1,95422,Carth,"zCarth Onasi, Mission zZaalbar zJuhani zCanderous",1
"Dark One",0,1,101339,Phoenix,"zHera zSabine zZeb zEzra zKanan",1
"Dark One",1,0,99593,Wiggs,"Wedge Biggs zzzCLS zHan zFulcrum",1
"Dark One",1,0,107062,zMaul,"zDarth Maul, zDooku zSidious Sith Assassin, zSavage",1
"Dark One",1,1,87751,Rogue1,"Jyn Chirrut Baze Cassian zK-2SO",1
"Dark One",1,0,81465,Jawas,"Nebit Jawa Engineer, Jawa Scavenger, Jawa Dathcha",1
"Dark One",,,56972,Grievous Omicron,"GG B2 G8, B1 4* G8, MagnaGuard G7, Droideka 4* G8",0
"Dark One",0,1,87609,Geonosians Omicron,"zzGBA Sun Fac, Geo Soldier, Geo Spy G8, Poggle",0
"Dark One",,,363970,Negotiator,"Negotiator 5* HT 5* Anakin's Eta-2 5*, Umbaran SF, Ahsoka's SF, Clone Sergeant's ARC-170, Plo's SF, Rex's ARC-170",0
"Dark One",,,410653,Executrix,"Executrix Tie Adv, Emperor's Shuttle 4*, TIE Reaper 5*, Imperial TIE Fighter, Gauntlet Starfighter, FOSF TIE Fighter, FO TIE Fighter",0
"Dark One",1,0,87214,Troopers,"zVeers Starck DT Magma G9, Shoretrooper",0
"Dark One",0,1,79229,BH,"Jango 6* G7, Cad Dengar G9, zBoba Greedo",0
"Dark One",,,39185,Bad Batch,"Hunter 3* G8, Echo 3* G8, Omega 3* G8, Tech 3* G5, Wrecker 3* G6",0
"Dark One",1,0,7543,NestSolo (Counter),"Nest 3* G8",0
"BigJill",1,1,139963,SL Kylo,"zzzzzzSL Kylo, zSith Trooper, zHux zzKRU Thrawn G9",1
"BigJill",1,1,88644,Carth,"Carth Onasi, zMission Zaalbar Juhani Canderous",1
"BigJill",0,1,100217,BH,"zzBossk Cad zBoba Greef zThe Mandalorian",1
"BigJill",1,1,93954,zEP,"zzEP Vader Tarkin TFP G9, BSF",1
"BigJill",0,1,72367,Phoenix,"Hera Zeb G9, Chopper G9, Ezra Kanan G9",1
"BigJill",,,124407,Phasma,"zPhasma zFOTP FOSFTP zFOST zKylo",0
"BigJill",1,1,71635,JTR,"JTR Scav Rey, BB-8 G8, R2-D2 G9, Finn G9",0
"BigJill",1,1,80006,Revan,"zzzJKR BS GMY G4, zJolee GK G3",0
"BigJill",1,0,87440,CLS,"zzzCLS Han Leia Old Ben G9, Chewbacca G9",0
"ridingred",0,1,120553,DRMalak,"zzzDR zzHK-47 zBSF zzMalak Thrawn G8",1
"ridingred",1,1,148787,Revan,"zzzJKR zBS zzGMY zJolee zGK",1
"ridingred",1,1,104617,Carth,"Carth Onasi, zMission zZaalbar Juhani Canderous",1
"ridingred",0,1,93440,BH,"zzBossk Cad Boba Greedo Zam G8",1
"ridingred",0,1,91638,Phoenix,"Hera Sabine G9, Zeb zEzra Kanan",1
"ridingred",,,59664,Phasma,"Phasma G9, FOTP 5* G6, FOSFTP 4* G7, FOST 3* G9, zKylo",0
"ridingred",0,1,95368,Geonosians Omicron,"zzGBA Sun Fac, Geo Soldier, Geo Spy, Poggle",0
"ridingred",1,0,77643,Traya,"Traya 6* G2, DN 5* G8, Sion 2* G6, zDooku zzEP",0
"ridingred",1,1,57263,NS,"MT 5* G8, AV G9, Daka G9, Zombie 5* G7, Spirit G8",0
"Appo",0,1,90268,DR,"zzDR HK-47 BSF Sith Marauder G8, Sith Empire Trooper",1
"Appo",1,1,98399,Revan Offense,"zzJKR GMY BS zJolee JKA",1
"Appo",0,1,82809,BH,"zBossk Boba Jango Greef G8, The Mandalorian G8",1
"Appo",0,1,62969,Phoenix,"Hera G8, Zeb G8, Chopper G9, Ezra G9, Kanan G9",1
"Appo",1,0,90760,CLS,"zCLS zHan zChewbacca R2-D2 G7, Chewpio",0
"Appo",,,57114,Grievous Omicron,"GG G8, B2 6* G8, B1 3* G8, MagnaGuard G8, Droideka G8",0
"Appo",1,1,77373,Carth,"zCarth Onasi, zMission zZaalbar Juhani G7, Canderous",0
"Appo",1,0,65823,ShaakClones,"Shaak Ti 5* G8, Rex Echo (501st) G8, Fives ARC Trooper 6* G8",0
"Appo",1,1,70279,zEP,"EP G9, zzVader Tarkin G8, TFP G8, Mara Jade, The Emperor's Hand 4* G8",0
"Appo",0,1,56826,FO,"KRU 6* Kylo 6* G8, Sith Trooper 4* G8, FOTP Hux 4*",0
"Jbird",0,1,107545,DRMalak,"zzzDR HK-47 zBSF zzMalak Sith Empire Trooper G8",1
"Jbird",0,1,112163,padme,"zzPadme zGK JKA zAhsoka zzC-3PO",1
"Jbird",,,359110,Negotiator,"Negotiator HT Anakin's Eta-2, Umbaran SF, Ahsoka's SF, Clone Sergeant's ARC-170, Jedi Consular's Starfighter, Plo's SF",1
"Jbird",,,98319,Nute-OR,"zNute zDooku Jango zZaalbar zMission",1
"Jbird",1,1,119893,Revan Offense,"zzzJKR zzGMY zBS zJolee Ezra",1
"Jbird",1,1,90048,Ewoks,"zChirpa Elder zPaploo zWicket zLogray",1
"Jbird",0,1,108076,BH,"zzBossk zDengar zBoba zGreedo IG-88",1
"Jbird",1,1,112719,zEP,"zzEP zzzVader Tarkin TFP zzTraya",1
"Jbird",0,1,90012,Phoenix,"zHera Sabine Zeb Chopper Kanan",1
"Jbird",1,0,16932,SionSolo (Counter),"Sion",1
"Jbird",,,84820,Phasma,"Phasma FOE FOO KRU Kylo",0
"Jbird",,,73520,Grievous Omicron,"zGG zB2 B1 G5, MagnaGuard Droideka G4",0
"Jbird",0,1,86325,Geonosians Omicron,"zzGBA Sun Fac G8, Geo Soldier, Geo Spy, Poggle",0
"Jbird",,,313262,HansMF,"Home One, Han's MF, Biggs X-wing, Bistan's U-wing, Phantom Ghost Cassian's U-wing, Wedge X-wing",0
"Jbird",1,1,73293,JTR,"JTR G7, Scav Rey, BB-8 G9, R2-D2 G9, Finn",0
"Jbird",1,1,61242,NS,"MT G8, AV Daka G8, Zombie G4, Spirit G6",0
"Jbird",1,0,66447,ShaakClones,"zzShaak Ti, Rex G6, Echo (501st) G6, Fives Clone Sergeant G6",0
"Jbird",1,0,97611,CLS,"zzzCLS Han Leia G9, Old Ben, Chewbacca",0
"Jbird",1,0,49046,Troopers,"Veers G8, Starck G8, Stormtrooper G7, Gideon G2, Range Trooper 6*",0
"Jbird",1,0,35563,Jawas,"Nebit G4, Jawa Engineer G5, Jawa Scavenger G7, Jawa G4, Dathcha G4",0
"Pineapplepower",0,1,66140,BS,"BS G9, GMY Jolee G7, Old Ben G9, JKA",0
"SanitaryFruitloops",0,1,64764,Phoenix,"Hera Zeb G8, Chopper G8, Ezra G9, Kanan",1
"SanitaryFruitloops",1,0,107426,CLS,"zzzCLS zHan zzChewbacca R2-D2 G6, zChewpio",0
"SanitaryFruitloops",0,1,96272,Geonosians Omicron,"zzGBA Sun Fac, Geo Soldier, Geo Spy, Poggle",0
"SanitaryFruitloops",0,1,83669,BH,"zzBossk Cad G7, Boba Jango zGreef",0
"SanitaryFruitloops",1,1,52300,Ewoks,"Chirpa 6* Elder 5* Paploo 5* Wicket 4* Logray 5*",0
"Jordan Halaren",1,0,139275,CLS,"zzzCLS zHan zzChewbacca zC-3PO zChewpio",1
"Jordan Halaren",1,1,90189,JTR,"zJTR Scav Rey, BB-8 zzR2-D2 Finn",1
"Jordan Halaren",1,1,128613,Revan,"zzzJKR zBS zzGMY zJolee GK",1
"Jordan Halaren",1,1,87585,Ewoks,"zChirpa Elder zPaploo Teebo G9, Scout",1
"Jordan Halaren",0,1,100233,BH,"zBossk Boba zGreedo zZam IG-88",1
"Jordan Halaren",1,0,81169,501st,"Rex ARC Trooper, Echo (501st), zFives Ahsoka",1
"Jordan Halaren",0,1,75036,FO,"zKRU Kylo FOO G8, FOE Phasma G8",1
"Jordan Halaren",0,1,73574,Phoenix,"Hera G9, Zeb G8, Chopper G8, zEzra Kanan G8",1
"Jordan Halaren",,,361700,HansMF,"Home One, Han's MF, Rebel Y-wing 4*, Bistan's U-wing 4*, Phantom 5* Biggs X-wing, Cassian's U-wing, Wedge X-wing",0
"Jordan Halaren",1,1,70754,NS,"MT 5* G8, zzAV Daka G9, Zombie 6* Spirit G8",0
"Jordan Halaren",,,72859,Nute-OR,"zNute zDooku Jango 6* G7, Zaalbar G7, Mission G8",0
"Jordan Halaren",,,83507,Mon Mothma,"Mon Mothma 6* G9, Lando Wedge Bistan G7, Biggs",0
"Jordan Halaren",1,1,82182,zEP,"zEP zzzVader Tarkin G8, Sion 3* G7, DN 5* G8",0
"Jordan Halaren",1,0,49551,Troopers,"Veers 6* Starck G1, Stormtrooper G8, Snowtrooper G8, Magma G8",0
"Jordan Halaren",1,1,51395,Rogue1,"Jyn 6* G8, Chirrut 5* G9, Baze 5* G8, Cassian G9, K-2SO G8",0
"Jordan Halaren",1,0,7999,NestSolo (Counter),"Nest 3* G7",0
"凯 天行者",1,1,143390,SL Kylo,"zzzzzzSL Kylo, zSith Trooper, zHux zzKRU Thrawn G8",1
"凯 天行者",0,1,128073,padme,"zzPadme zGK zJKA zAhsoka zzC-3PO",1
"凯 天行者",,,434209,Negotiator,"Negotiator HT Anakin's Eta-2, Umbaran SF, Ahsoka's SF, Clone Sergeant's ARC-170, Plo's SF, Rex's ARC-170",1
"凯 天行者",1,1,135061,GAS,"zzzzGAS zRex zEcho (501st), zzFives zARC Trooper",1
"凯 天行者",1,1,84012,Ewoks,"zChirpa Elder Paploo Wicket Logray",1
"凯 天行者",1,1,98286,Revan Offense,"zzzJKR zGMY BS zJolee Ezra G8",1
"凯 天行者",1,1,88425,Carth,"Carth Onasi, zMission zZaalbar Juhani Canderous",1
"凯 天行者",0,1,85070,BH,"zJango Bossk Boba G9, Greef G8, The Mandalorian G8",1
"凯 天行者",,,115506,Phasma,"Phasma FOTP FOSFTP zFOST Kylo",0
"凯 天行者",,,101654,Grievous Omicron,"GG zB2 zB1 MagnaGuard zDroideka",0
"凯 天行者",1,0,78705,CLS,"CLS Han G8, Chewbacca G9, R2-D2 G8, Chewpio G7",0
"凯 天行者",1,0,95899,Traya,"Traya G7, zDN Sion G7, zBSF zEP",0
"HDS15",0,1,90402,padme,"zzPadme GK JKA Ahsoka CW Chewbacca",1
"HDS15",,,317100,HansMF,"Home One, Han's MF 5*, Biggs X-wing, Bistan's U-wing, Phantom Ghost Cassian's U-wing, Wedge X-wing",1
"HDS15",1,1,109427,JTR,"zzzJTR zScav Rey, BB-8 R2-D2 zFinn",1
"HDS15",0,1,84647,Grievous,"zzGG zB2 B1 G8, MagnaGuard G8, Dooku",1
"HDS15",1,1,137450,Revan Offense,"zzzJKR zzGMY zBS zJolee HYoda",1
"HDS15",0,1,114542,BH,"zzBossk Cad Dengar G9, zBoba zGreedo",1
"HDS15",1,1,92751,Carth,"zCarth Onasi, Mission Zaalbar Juhani Canderous",1
"HDS15",1,1,132142,zEP,"zzEP zzVader zzTarkin TFP zSith Trooper",1
"HDS15",0,1,141107,FO,"zzKRU zKylo zFOST FOE zHux",1
"HDS15",0,1,81368,Phoenix,"Hera Zeb Chopper Ezra Kanan",1
"HDS15",1,0,13249,SionSolo (Counter),"Sion G8",1
"HDS15",0,1,102017,Geonosians Omicron,"zzGBA Sun Fac, Geo Soldier, Geo Spy, Poggle",0
"HDS15",,,335904,Negotiator,"Negotiator 5* HT Anakin's Eta-2 4*, Umbaran SF, Ahsoka's SF, Clone Sergeant's ARC-170, Jedi Consular's Starfighter, Plo's SF",0
"HDS15",1,1,74061,NS,"zMT 5* G8, zzAV Daka Zombie 6* G7, Spirit G8",0
"HDS15",0,1,101859,DR,"zDR zzHK-47 zBSF Sith Assassin G7, zzThrawn",0
"HDS15",1,0,40529,Troopers,"Veers G9, Piett 4* G6, Gideon 3* G5, Dark Trooper 3* G6, Range Trooper 4* G6",0
"HDS15",,,73424,Mon Mothma,"zMon Mothma 5* G8, Cassian Jyn G8, Chirrut K-2SO",0
"HDS15",1,1,87036,Ewoks,"zChirpa Elder G6, Paploo Teebo zLogray",0
"HDS15",1,0,73807,ShaakClones,"zShaak Ti G9, Rex G8, Echo (501st), Fives Clone Sergeant G8",0
"HDS15",1,0,73646,Wiggs,"Wedge G8, Biggs G8, zCLS Chewbacca G9, Leia",0
"HDS15",,,50758,Iden Troopers,"Iden Versio 2* G6, Stormtrooper G8, Snowtrooper G8, Magma G6, DT 5* G8",0
"HDS15",1,0,52528,zMaul,"Darth Maul, Sidious G8, Sith Empire Trooper G6, Sith Marauder 5* G6, Nest 3* G6",0
"HDS15",0,1,71560,BH,"Jango G9, Boushh (Leia Organa) 4* G6, The Mandalorian 4* G8, zZam IG-88",0
"HDS15",,,37675,Bad Batch,"Hunter 4* G7, Echo 3* G7, Omega 5* G6, Tech 4* G8, Wrecker 4* G6",0
"HDS15",1,0,63916,Jawas,"Nebit Jawa Engineer G8, Jawa Scavenger G8, Jawa 6* G8, Dathcha G9",0
"Nick Steele",0,1,105348,padme,"zzPadme GK JKA zAhsoka C-3PO",1
"Nick Steele",1,1,108064,Revan Offense,"zzzJKR GMY BS zJolee zEzra",1
"Nick Steele",1,1,95611,Ewoks,"zChirpa Elder zPaploo zWicket zLogray",1
"Nick Steele",1,1,88612,Carth,"Carth Onasi, zMission zZaalbar Juhani Canderous",1
"Nick Steele",0,1,90993,BH,"zBossk Dengar G9, Boba Jango zThe Mandalorian",1
"Nick Steele",0,1,90469,FO,"zzKRU Kylo G9, FOO FOST FOE",1
"Nick Steele",1,0,83135,CLS,"CLS zHan Chewbacca R2-D2 Chewpio",0
"Nick Steele",,,53470,Grievous Omicron,"GG G7, B2 G9, B1 G9, MagnaGuard G9, Droideka G9",0
"Nick Steele",0,1,91843,DRMalak,"DR HK-47 BSF zMalak Sith Empire Trooper",0
"Nick Steele",0,1,80293,Geonosians Omicron,"GBA Sun Fac, Geo Soldier, Geo Spy, Poggle",0
"Nick Steele",,,297295,Negotiator,"Negotiator 5* HT 6* Anakin's Eta-2, Umbaran SF, Ahsoka's SF, Clone Sergeant's ARC-170, Plo's SF, Rex's ARC-170",0
"Nick Steele",1,0,75456,Traya,"zTraya DN 6* Sion 6* EP G9, Thrawn G9",0
"Nick Steele",1,0,65080,Troopers,"Veers G8, zPiett G8, Gideon G8, Dark Trooper G8, Range Trooper 6* G7",0
"Nick Steele",1,0,83168,ShaakClones,"Shaak Ti, Rex Echo (501st), Fives ARC Trooper",0
"Nick Steele",0,1,66976,Phoenix,"Hera Sabine G9, Zeb G7, Chopper Kanan",0
"Nick Steele",1,0,63732,Jawas,"Nebit G8, Jawa Engineer G7, Jawa Scavenger, Jawa G8, Dathcha G6",0
"Chris Anderson 05051982",0,1,89554,padme,"zzPadme zGK JKA Ahsoka C-3PO G9",1
"Chris Anderson 05051982",0,1,124404,DR,"zzzDR zzHK-47 zBSF Sith Empire Trooper, Thrawn",1
"Chris Anderson 05051982",,,390858,HansMF,"Home One, Han's MF, HT Bistan's U-wing, Phantom Ghost Cassian's U-wing, Biggs X-wing",1
"Chris Anderson 05051982",1,1,92797,JTR,"zJTR Scav Rey, BB-8 G9, R2-D2 G8, zFinn",1
"Chris Anderson 05051982",1,1,149117,Revan Offense,"zzzJKR zzGMY zBS zJolee zEzra",1
"Chris Anderson 05051982",1,1,100003,Ewoks,"zChirpa Elder zPaploo Wicket zLogray",1
"Chris Anderson 05051982",0,1,114736,BH,"zzBossk zDengar Boba Jango Zam",1
"Chris Anderson 05051982",1,1,109465,Carth,"zCarth Onasi, zMission zZaalbar zJuhani Canderous",1
"Chris Anderson 05051982",1,1,136108,zEP,"zzEP zzzVader zzTarkin TFP zzMara Jade, The Emperor's Hand",1
"Chris Anderson 05051982",0,1,94637,FO,"zzKRU zKylo FOO G8, FOE G8, zHux",1
"Chris Anderson 05051982",0,1,103916,Phoenix,"zHera Sabine G8, zZeb Chopper zKanan",1
"Chris Anderson 05051982",1,0,15112,SionSolo (Counter),"Sion G9",1
"Chris Anderson 05051982",,,71034,Grievous Omicron,"GG G9, B2 G9, B1 MagnaGuard G8, Droideka G7",0
"Chris Anderson 05051982",0,1,85603,Geonosians Omicron,"zzGBA Sun Fac G8, Geo Soldier, Geo Spy G9, Poggle",0
"Chris Anderson 05051982",,,353683,Executrix,"Executrix Tie Adv, Emperor's Shuttle 4*, TIE Reaper 3*, Imperial TIE Fighter, Gauntlet Starfighter, FOSF TIE Fighter, FO TIE Fighter",0
"Chris Anderson 05051982",1,1,50883,NS,"MT G4, AV G8, Daka G7, Zombie G2, Spirit G8",0
"Chris Anderson 05051982",1,0,85130,ShaakClones,"zzShaak Ti, Rex G9, zEcho (501st) G8, zFives G9, ARC Trooper G8",0
