Player,Offense,Defense,GP,Name,Squad,Viable
"Sharper",1,1,42485,Rogue1,"Jyn 5* G8, Chirrut G8, Baze 6* G8, Cassian 5* G8, K-2SO G8",0
"Sharper",1,0,92621,zMaul,"Darth Maul, DN Sidious zSavage Sith Marauder",0
"Sharper",1,0,88458,QGJ,"zQGJ Aayla G8, zJKA Old Ben G9, zAhsoka",0
"SharpChaos",1,1,149804,SL Kylo,"zzzzzzSL Kylo, zSith Trooper, zHux zzKRU zzThrawn",1
"SharpChaos",1,1,160902,GL Rey,"zzzzzzRey zGK zzzJTR zRH Poe, zRH Finn",1
"SharpChaos",0,1,117877,DRMalak,"zzzDR zzHK-47 zBSF zzMalak Sith Empire Trooper",1
"SharpChaos",1,1,110950,NestSisters,"zzAV zzMT zDaka Zombie zNest",1
"SharpChaos",,,313907,Malevolence,"Malevolence Hyena Bomber, Vulture Droid, Sun Fac SF, Soldier SF, Spy SF",1
"SharpChaos",,,530791,Negotiator,"Negotiator HT Anakin's Eta-2, Umbaran SF, Ahsoka's SF, Clone Sergeant's ARC-170, Plo's SF, Rex's ARC-170",1
"SharpChaos",,,422471,HansMF,"Home One, Han's MF, Biggs X-wing, Bistan's U-wing, Phantom Ghost Cassian's U-wing, Wedge X-wing",1
"SharpChaos",0,1,96720,Geonosians,"zzGBA Sun Fac, Geo Soldier, Geo Spy, Poggle",1
"SharpChaos",0,1,122459,Grievous,"zzGG zB2 zB1 zMagnaGuard zNute",1
"SharpChaos",1,0,128573,CLS,"zzzCLS zHan zzChewbacca zzR2-D2 zzC-3PO",1
"SharpChaos",1,0,121618,Traya,"zzTraya zzDN zSion zDooku zzEP",1
"SharpChaos",,,452726,Executrix,"Executrix Tie Adv, Emperor's Shuttle, TIE Reaper, Imperial TIE Fighter, Gauntlet Starfighter, FOSF TIE Fighter, FO TIE Fighter",1
"SharpChaos",1,1,143260,GAS,"zzzzGAS zRex zEcho (501st), zzFives zARC Trooper",1
"SharpChaos",1,1,141435,Revan Offense,"zzzJKR zzGMY zzHYoda zJolee zJKA",1
"SharpChaos",1,1,88251,Carth,"zCarth Onasi, zMission zZaalbar Juhani G8, Canderous",1
"SharpChaos",0,1,119235,BH,"zzBossk Cad zJango zBoba Greedo",1
"SharpChaos",1,0,89759,Troopers,"zVeers zStarck Shoretrooper Snowtrooper DT",1
"SharpChaos",0,1,74100,Phoenix,"Hera G8, Kanan G8, Zeb G8, Sabine Ezra",1
"SharpChaos",1,0,72416,Jawas,"Nebit G9, Jawa Engineer G9, Jawa Scavenger G8, Jawa G9, Dathcha",1
"SharpChaos",,,122505,Phasma,"zPhasma zFOTP FOSFTP zFOST zKylo",0
"SharpChaos",,,78299,Mon Mothma,"Mon Mothma 4* G7, Scarif Bistan Hoth Rebel Scout, Chirrut",0
"SharpChaos",1,1,73373,Ewoks,"Chirpa G9, Elder Paploo G7, Teebo Logray G9",0
"Nick Steele",0,1,105348,padme,"zzPadme GK JKA zAhsoka C-3PO",1
"Nick Steele",0,1,80293,Geonosians,"GBA Sun Fac, Geo Soldier, Geo Spy, Poggle",1
"Nick Steele",1,1,106302,Revan Offense,"zzzJKR GMY BS zJolee zEzra",1
"Nick Steele",1,1,95611,Ewoks,"zChirpa Elder zPaploo zWicket zLogray",1
"Nick Steele",1,1,88612,Carth,"Carth Onasi, zMission zZaalbar Juhani Canderous",1
"Nick Steele",0,1,90993,BH,"zBossk zThe Mandalorian, Jango Boba Dengar G9",1
"Nick Steele",0,1,90469,FO,"zzKRU Kylo G9, FOST FOO FOE",1
"Nick Steele",1,0,83135,CLS,"CLS zHan Chewbacca R2-D2 Chewpio",0
"Nick Steele",0,1,91843,DRMalak,"DR HK-47 BSF zMalak Sith Empire Trooper",0
"Nick Steele",,,267116,Negotiator,"Negotiator 5* HT 5* Anakin's Eta-2, Umbaran SF, Ahsoka's SF, Clone Sergeant's ARC-170, Jedi Consular's Starfighter, Plo's SF",0
"Nick Steele",0,1,53470,Grievous,"GG G7, B2 G9, B1 G9, Droideka G9, MagnaGuard G9",0
"Nick Steele",1,0,73741,Traya,"zTraya DN 6* Sion 5* EP G9, Thrawn G9",0
"Nick Steele",1,0,63085,Troopers,"Veers G8, zPiett G8, Gideon G8, Dark Trooper 6* G8, Range Trooper 6* G7",0
"Nick Steele",1,0,83168,ShaakClones,"Shaak Ti, Rex Echo (501st), Fives ARC Trooper",0
"Nick Steele",0,1,66976,Phoenix,"Hera Kanan Zeb G7, Sabine G9, Chopper",0
"Nick Steele",1,0,63732,Jawas,"Nebit G8, Jawa Engineer G7, Jawa Scavenger, Jawa G8, Dathcha G6",0
"Gomer332",0,1,92336,Geonosians,"zzGBA Sun Fac, Geo Soldier, Geo Spy, Poggle",1
"Gomer332",1,1,104757,Revan Offense,"zzzJKR GMY zBS zJolee JKA",1
"Gomer332",1,1,83735,Ewoks,"zChirpa Elder Paploo Teebo G9, Wicket",1
"Gomer332",1,1,85721,Carth,"Carth Onasi, Mission zZaalbar Juhani Canderous",1
"Gomer332",0,1,93210,BH,"zBossk Cad Boba Greedo Greef",1
"Gomer332",1,1,119599,zEP,"zzEP zzzVader zTarkin DT TFP",1
"Gomer332",0,1,71635,FO,"zKRU Kylo G8, FOO G8, FOE Phasma G8",1
"Gomer332",1,0,82906,Wiggs,"Wedge G9, Biggs zCLS Ezra G9, Leia G9",1
"Gomer332",1,0,16582,SionSolo (Counter),"Sion",1
"Gomer332",,,275220,HansMF,"Home One, Han's MF 6*, Biggs X-wing, Bistan's U-wing, Phantom Ghost Cassian's U-wing, Wedge X-wing",0
"Gomer332",0,1,92351,DR,"DR HK-47 BSF Sith Assassin G8, zzThrawn",0
"Gomer332",1,1,64483,JTR,"JTR G7, Scav Rey G8, BB-8 G8, R2-D2 Finn G8",0
"Gomer332",0,1,76637,Grievous,"zGG B2 G8, MagnaGuard G8, zDooku T3-M4 G8",0
"Gomer332",1,1,46376,NS,"MT 6* G8, AV G8, Daka G9, Zombie G6, Spirit 5* G8",0
"Gomer332",1,0,57859,ShaakClones,"Shaak Ti 6* G7, Rex G8, Echo (501st) G8, Fives G8, Clone Sergeant",0
"Gomer332",1,0,78828,Troopers,"Veers Starck G9, Shoretrooper Dark Trooper G9, zIden Versio",0
"Gomer332",0,1,71987,Phoenix,"Hera Kanan G9, Zeb G9, Sabine 5* G8, Chopper",0
"Gomer332",1,1,44334,Rogue1,"Jyn G8, Chirrut 5* G8, Baze 5* G8, Cassian G8, K-2SO G8",0
"Gomer332",1,0,42989,Jawas,"Nebit G7, Jawa Engineer G8, Jawa Scavenger G7, Jawa G8, Dathcha G8",0
"BUSTYOAZZ99",1,1,164320,GL Rey,"zzzzzzRey zGK zzzJTR zRH Poe, zRH Finn",1
"BUSTYOAZZ99",1,1,104229,NS,"zzMT zzAV zDaka Zombie Spirit",1
"BUSTYOAZZ99",0,1,156653,DRMalak,"zzzDR zzHK-47 zBSF zzMalak Sith Assassin",1
"BUSTYOAZZ99",,,504757,Negotiator,"Negotiator HT Anakin's Eta-2, Umbaran SF, Ahsoka's SF, Clone Sergeant's ARC-170, Plo's SF, Rex's ARC-170",1
"BUSTYOAZZ99",0,1,94678,Geonosians,"zzGBA Sun Fac, Geo Soldier, Geo Spy, Poggle",1
"BUSTYOAZZ99",0,1,111405,Grievous,"zzGG zB2 zB1 zMagnaGuard zNute",1
"BUSTYOAZZ99",,,498601,Raddus,"Raddus 5* Sun Fac SF, Rey's Millennium Falcon, Poe Dameron's X-wing, Resistance X-wing, Biggs X-wing, Wedge X-wing, Phantom Ghost",1
"BUSTYOAZZ99",1,1,155416,GAS,"zzzzGAS zRex zEcho (501st), zzFives zARC Trooper",1
"BUSTYOAZZ99",1,1,150113,Revan Offense,"zzzJKR zGMY zBS zJolee zHYoda",1
"BUSTYOAZZ99",1,1,91089,Ewoks,"zChirpa Elder zPaploo G9, zWicket zLogray G9",1
"BUSTYOAZZ99",0,1,116412,BH,"zzBossk zJango zBoba zGreedo zDengar",1
"BUSTYOAZZ99",1,1,96647,Carth,"Carth Onasi, zMission zZaalbar zJuhani zCanderous",1
"BUSTYOAZZ99",1,1,120878,zEP,"zzEP zzzVader Tarkin TFP zzTraya",1
"BUSTYOAZZ99",0,1,90460,Phoenix,"zHera zKanan G9, Zeb G8, zSabine zEzra",1
"BUSTYOAZZ99",1,0,116929,Wiggs,"Wedge Biggs zzzCLS zHan zzC-3PO",1
"BUSTYOAZZ99",1,0,110271,zMaul,"zDarth Maul, zDooku zzDN zSavage Sith Marauder",1
"BUSTYOAZZ99",1,0,83501,Jawas,"Nebit Jawa Engineer, Jawa Scavenger, Jawa Dathcha",1
"BUSTYOAZZ99",,,74551,Phasma,"Phasma FOTP FOSFTP G6, FOST G8, zKylo",0
"BUSTYOAZZ99",,,67485,Mon Mothma,"Mon Mothma 5* G6, Jyn Lando Cassian K-2SO G9",0
"BUSTYOAZZ99",1,0,65798,Troopers,"Veers Starck G7, Snowtrooper G8, Magma DT 6* G8",0
"BUSTYOAZZ99",1,0,95854,QGJ,"zQGJ Aayla G8, zJKA zOld Ben, zAhsoka",0
"BUSTYOAZZ99",1,0,6007,SionSolo (Counter),"Sion 5* G7",0
"Appo",0,1,90268,DR,"zzDR HK-47 BSF Sith Marauder G8, Sith Empire Trooper",1
"Appo",1,1,96426,Revan Offense,"zzJKR GMY BS zJolee JKA",1
"Appo",0,1,82809,BH,"zBossk The Mandalorian G8, Jango Boba Greef G8",1
"Appo",0,1,63241,Phoenix,"Hera G8, Kanan G9, Zeb G8, Ezra G9, Chopper G9",1
"Appo",1,0,90760,CLS,"zCLS zHan zChewbacca R2-D2 G7, Chewpio",0
"Appo",0,1,57277,Grievous,"GG G8, B2 6* G8, Droideka G8, MagnaGuard G8, Dooku 6* G8",0
"Appo",1,1,77373,Carth,"zCarth Onasi, zMission zZaalbar Juhani G7, Canderous",0
"Appo",1,0,65823,ShaakClones,"Shaak Ti 5* G8, Rex Echo (501st) G8, Fives ARC Trooper 6* G8",0
"Appo",1,1,70279,zEP,"EP G9, zzVader Tarkin G8, TFP G8, Mara Jade, The Emperor's Hand 4* G8",0
"Appo",0,1,56826,FO,"KRU 6* Kylo 6* G8, FOTP Hux 4* Sith Trooper 4* G8",0
"Animus313",0,1,86352,Geonosians,"zzGBA Sun Fac G9, Geo Soldier G9, Geo Spy G9, Poggle",1
"Animus313",1,1,100949,zEP,"zzEP zzVader Tarkin G9, TFP G8, zMara Jade, The Emperor's Hand",1
"Animus313",0,1,75844,FO,"zKRU Kylo FOO G9, FOE G9, Phasma",1
"Animus313",0,1,62686,Phoenix,"Hera Kanan G8, Zeb G8, Ezra G8, Chopper G8",1
"Animus313",0,1,91425,BS,"zBS zGMY JKA GK Ahsoka G9",1
"Animus313",1,0,64487,Jawas,"Nebit G9, Jawa Engineer G9, Jawa Scavenger, Jawa Dathcha",1
"Animus313",0,1,51182,Grievous,"GG G8, B2 G9, B1 3* G8, MagnaGuard 6* G9, Nute G7",0
"Animus313",1,1,56291,Ewoks,"Chirpa G9, Elder Paploo G9, Teebo Logray 5* G7",0
"Animus313",1,0,71886,Clones,"zCody G9, Rex Echo (501st) G8, zFives ARC Trooper G8",0
"Animus313",,,63561,Iden Troopers,"Iden Versio 3* G8, Stormtrooper Snowtrooper G8, Magma DT",0
"Animus313",1,0,61952,Wiggs,"Wedge G8, Biggs G6, zCLS Han G9, Chewbacca G9",0
"Animus313",0,1,103091,BH,"Jango zThe Mandalorian, Zam Cad Boba",0
"Djsenior",0,1,141311,padme,"zzPadme zGK zJKA zAhsoka zzC-3PO",1
"Djsenior",1,1,136536,Revan Offense,"zzzJKR zzGMY BS zJolee zzHYoda",1
"Djsenior",1,1,88869,Ewoks,"zChirpa Elder Paploo zWicket zLogray",1
"Djsenior",0,1,71128,Phoenix,"Hera G8, Kanan G8, Zeb G8, Ezra G8, Chopper",1
"Djsenior",,,62396,Phasma,"Phasma G7, FOTP G8, FOSFTP G7, FOST 2* G6, zKylo",0
"Djsenior",1,0,129719,CLS,"zzzCLS zHan zzChewbacca zzR2-D2 zChewpio 5*",0
"Djsenior",,,367791,Negotiator,"Negotiator 5* HT Anakin's Eta-2 4*, Umbaran SF 6*, Ahsoka's SF, Clone Sergeant's ARC-170, Jedi Consular's Starfighter, Plo's SF",0
"Djsenior",0,1,87709,Geonosians,"zzGBA G8, Sun Fac, Geo Soldier, Geo Spy, Poggle",0
"Djsenior",1,0,79292,Traya,"zTraya G9, DN 4* Sion 5* EP zThrawn G9",0
"Djsenior",0,1,48167,Grievous,"GG G8, B2 5* G4, B1 3* G7, IG-88 G7, T3-M4 G7",0
"Djsenior",1,1,51924,NS,"MT 5* G7, AV Daka G8, Zombie 6* G7, Spirit 6* G7",0
"Djsenior",0,1,106648,BH,"zzBossk Cad G7, zzJango zBoba Dengar G7",0
"Djsenior",1,0,58590,ShaakClones,"Shaak Ti 4* G8, Rex G8, Echo (501st) G6, Fives G8, Clone Sergeant 6* G9",0
"PeezieF83",0,1,120329,DRMalak,"zzzDR HK-47 zBSF zzMalak Thrawn G9",1
"PeezieF83",0,1,91518,Geonosians,"zzGBA Sun Fac, Geo Soldier, Geo Spy, Poggle",1
"PeezieF83",1,1,86627,JTR,"zzzJTR Scav Rey, BB-8 G9, R2-D2 G8, zFinn G9",1
"PeezieF83",1,1,137530,Revan,"zzzJKR zBS zzGMY zJolee zGK",1
"PeezieF83",1,1,101862,zEP,"zzEP zzzVader Tarkin G9, TFP G9, Traya G9",1
"PeezieF83",0,1,92759,Phoenix,"Hera G9, zKanan Zeb zEzra Chopper",1
"PeezieF83",,,78140,Phasma,"Phasma G8, FOE FOO KRU Kylo",0
"PeezieF83",1,1,65187,NS,"MT G8, AV Daka G9, Zombie Spirit G8",0
"PeezieF83",1,1,86806,Carth,"Carth Onasi, zMission zZaalbar Juhani Canderous G7",0
"PeezieF83",1,0,82742,501st,"Rex G9, Clone Sergeant, Echo (501st) G9, Fives G9, zAhsoka",0
"PeezieF83",1,0,56190,Wiggs,"Wedge 5* G8, Biggs G8, CLS G8, Fulcrum G8, Leia",0
"PeezieF83",1,1,44539,Rogue1,"Jyn 5* G8, Chirrut 5* G8, Baze 5* G8, Cassian 6* K-2SO 5* G8",0
"Ronju Terds",0,1,135204,DRMalak,"zzzDR zzHK-47 zBSF zzMalak Sith Empire Trooper",1
"Ronju Terds",1,0,137040,CLS,"zzzCLS zHan zzChewbacca zzC-3PO zChewpio",1
"Ronju Terds",,,374698,HansMF,"Home One, Han's MF, Rebel Y-wing 6*, Bistan's U-wing, Phantom Ghost Cassian's U-wing, Wedge X-wing",1
"Ronju Terds",0,1,100183,Geonosians,"zzGBA Sun Fac, Geo Soldier, Geo Spy, Poggle",1
"Ronju Terds",0,1,107717,Grievous,"zzGG zB2 zB1 zMagnaGuard zNute",1
"Ronju Terds",1,1,97097,JTR,"zJTR Scav Rey, BB-8 G9, zzR2-D2 zFinn G9",1
"Ronju Terds",,,107288,Disintegration,"Aurra zGreef zBoba zBossk zThe Mandalorian",1
"Ronju Terds",1,1,137912,Revan,"zzzJKR BS zGMY zJolee zGK",1
"Ronju Terds",1,1,109507,Ewoks,"zChirpa Elder Paploo zWicket zLogray",1
"Ronju Terds",1,1,107378,Carth,"Carth Onasi, zMission zZaalbar zJuhani Canderous",1
"Ronju Terds",0,1,85051,Phoenix,"zHera Kanan G8, Zeb G8, Sabine zEzra",1
"Ronju Terds",0,1,73165,FO,"zKRU Kylo G8, FOO G8, FOE G9, Phasma G8",1
"Ronju Terds",1,1,73579,Rogue1,"Jyn Chirrut G8, Baze G9, Cassian G8, K-2SO G9",1
"Ronju Terds",1,0,98836,QGJ,"QGJ Aayla G9, zJKA Old Ben, zAhsoka",1
"Ronju Terds",1,0,75879,EP (Counter, Rebel),"EP Shoretrooper G8, Krennic G8, DT Nest G9",1
"Ronju Terds",1,0,21097,SionSolo (Counter),"zSion",1
"Ronju Terds",1,1,83484,NS,"MT G8, zzAV Daka Zombie Spirit G8",0
"Ronju Terds",,,310841,Executrix,"Executrix Tie Adv, Emperor's Shuttle, TIE Reaper 4*, Imperial TIE Fighter, Gauntlet Starfighter, FOSF TIE Fighter, FO TIE Fighter",0
"Ronju Terds",1,0,86134,ShaakClones,"zzShaak Ti, Rex Echo (501st) G8, Fives G9, Clone Sergeant G9",0
"Ronju Terds",1,0,62525,Troopers,"Veers Starck G7, Snowtrooper G8, Magma G7, Stormtrooper G8",0
"Ronju Terds",0,1,96197,BH,"Jango zZam Cad IG-88 G8, Dengar",0
"Ronju Terds",1,0,63397,Jawas,"Nebit G7, Jawa Engineer G9, Jawa Scavenger G7, Jawa G7, Dathcha G8",0
"SUMPTER THE HUT",0,1,105824,BH,"zzBossk The Mandalorian, Cad zzJango Boba",1
"SUMPTER THE HUT",1,1,114048,zEP,"zzEP zzVader Tarkin Krennic Traya G9",1
"SUMPTER THE HUT",0,1,71672,Phoenix,"Hera G9, Kanan G8, Zeb G8, zEzra Chopper G8",1
"SUMPTER THE HUT",0,1,97423,BS,"zBS zGMY Jolee GK JKA",1
"SUMPTER THE HUT",,,52128,Phasma,"Phasma G9, FOTP FOSFTP G7, FOST 5* G8, Kylo G8",0
"SUMPTER THE HUT",1,0,75661,CLS,"zCLS Han Chewbacca R2-D2 G8, Chewpio G8",0
"SUMPTER THE HUT",0,1,71256,Geonosians,"GBA 6* G9, Sun Fac G8, Geo Soldier, Geo Spy G8, Poggle",0
"SUMPTER THE HUT",1,1,40799,NS_Alt,"MT 5* G8, AV Daka 5* G8, Talia 5* G8, Spirit 5* G8",0
"SUMPTER THE HUT",1,1,46894,Ewoks,"Chirpa G8, Elder Paploo G7, Wicket 5* G8, Logray 6* G9",0
"SUMPTER THE HUT",1,0,88221,Troopers,"zVeers Starck Gideon Dark Trooper G9, zPiett",0
"SUMPTER THE HUT",1,0,53050,501st,"Rex G8, Clone Sergeant 5* G8, Echo (501st) G9, Fives G8, Ahsoka",0
"SUMPTER THE HUT",1,0,39797,Wiggs,"Wedge 5* G8, Biggs 5* G8, Leia G9, Chirrut 5* G8, Baze 5* G8",0
"Tyundi",0,1,130661,padme,"zzPadme zGK zJKA zAhsoka zzC-3PO",1
"Tyundi",1,0,104458,CLS,"zzzCLS zHan zzChewbacca R2-D2 G9, zChewpio",1
"Tyundi",0,1,96354,Geonosians,"zzGBA Sun Fac, Geo Soldier, Geo Spy, Poggle",1
"Tyundi",0,1,102685,Grievous,"zzGG zB2 zB1 zDroideka MagnaGuard",1
"Tyundi",1,1,121195,GAS,"zzzzGAS zRex zEcho (501st), zzFives zARC Trooper",1
"Tyundi",1,1,120903,Revan Offense,"zzzJKR zzGMY zBS zJolee zzHYoda",1
"Tyundi",1,1,87411,Ewoks,"zChirpa Elder Paploo Wicket zLogray",1
"Tyundi",1,1,97087,zEP,"zEP zzVader Tarkin TFP BSF",1
"Tyundi",0,1,66947,Phoenix,"Hera G9, Kanan G8, Zeb G8, Ezra Chopper G8",1
"Tyundi",,,54944,Phasma,"Phasma G7, FOE G8, FOO G6, KRU G8, Kylo G8",0
"Tyundi",1,1,79608,NS,"MT G8, zzAV Daka G8, Zombie Spirit G9",0
"Tyundi",,,69038,Nute-OR,"Nute G8, Dooku Jango Zaalbar G7, Mission G7",0
"Tyundi",0,1,74303,BH,"Bossk Cad G5, Boba Dengar G9, Greef",0
"Tyundi",1,0,55032,Wiggs,"Wedge G9, Biggs Leia G8, Chirrut 3* G6, Baze 5* G6",0
"SanitaryFruitloops",0,1,94357,Geonosians,"zzGBA Sun Fac, Geo Soldier, Geo Spy, Poggle",1
"SanitaryFruitloops",0,1,64764,Phoenix,"Hera Kanan Zeb G8, Ezra G9, Chopper G8",1
"SanitaryFruitloops",1,0,106885,CLS,"zzzCLS zHan zzChewbacca R2-D2 G6, zChewpio",0
"SanitaryFruitloops",0,1,83017,BH,"zzBossk Cad G7, Jango Boba zGreef",0
"SanitaryFruitloops",1,1,52241,Ewoks,"Chirpa 6* Elder 4* Paploo 4* Wicket 4* Logray 5*",0
"RBS",0,1,111197,padme,"zzPadme zGK zJKA zAhsoka C-3PO",1
"RBS",0,1,110425,DR,"zzzDR zzHK-47 zBSF Sith Marauder, Sith Empire Trooper",1
"RBS",,,301558,HansMF,"Home One, Han's MF, HT Bistan's U-wing, Phantom Ghost Cassian's U-wing, Wedge X-wing",1
"RBS",0,1,78654,Geonosians,"zGBA Sun Fac G9, Geo Soldier, Geo Spy G9, Poggle G9",1
"RBS",1,1,118076,Revan Offense,"zzzJKR zzGMY zBS zJolee Ezra",1
"RBS",1,1,91031,Ewoks,"zChirpa Elder zPaploo zWicket Logray G9",1
"RBS",1,1,98889,Carth,"zCarth Onasi, zMission zZaalbar Juhani Canderous",1
"RBS",0,1,100283,BH,"zBossk The Mandalorian, Cad zJango zBoba",1
"RBS",1,1,113253,zEP,"zzEP zzzVader Tarkin Sion G9, zzMara Jade, The Emperor's Hand",1
"RBS",0,1,72271,Phoenix,"Hera Kanan G8, Zeb G8, Sabine G8, Chopper G9",1
"RBS",1,0,70172,Jawas,"Nebit G8, Jawa Engineer, Jawa Scavenger G9, Jawa G8, Dathcha G9",1
"RBS",,,79515,Phasma,"Phasma FOTP G9, zSith Trooper G8, zzKRU G9, Kylo G8",0
"RBS",1,0,87948,CLS,"zzzCLS Han G8, Chewbacca R2-D2 G9, zChewpio G8",0
"RBS",,,202150,Malevolence,"Malevolence 5* Hyena Bomber 5*, Vulture Droid 4*, Sun Fac SF, Soldier SF, Spy SF",0
"RBS",1,1,78303,NS,"zMT G9, AV Daka G9, Zombie Spirit",0
"RBS",,,256537,Executrix,"Executrix Tie Adv, Emperor's Shuttle 4*, TIE Reaper 3*, Imperial TIE Fighter, Gauntlet Starfighter, FOSF TIE Fighter 4*, FO TIE Fighter",0
"RBS",,,85055,Mon Mothma,"Mon Mothma G8, zKyle Katarn, zCara Dune, Pao G6, Chirrut G9",0
"RBS",1,0,75990,ShaakClones,"zShaak Ti G9, Rex Echo (501st) G9, Fives G9, ARC Trooper G9",0
"Brandino",1,1,75248,Carth,"Carth Onasi, Mission G8, Zaalbar G8, Juhani Canderous",1
"Brandino",1,0,94527,501st,"zRex ARC Trooper, Echo (501st), zzFives Ahsoka",1
"Brandino",0,1,56398,Phoenix,"Hera Kanan G8, Zeb G8, Ezra G8, Chopper G8",1
"Brandino",,,36514,Phasma,"Phasma 6* G8, FOE 5* G8, FOO 5* G8, KRU 6* G8, Kylo 6* G8",0
"Brandino",0,1,47315,Geonosians,"GBA G9, Sun Fac G7, Geo Soldier G9, Geo Spy G8, Poggle G7",0
"Brandino",1,1,73613,Revan Offense,"zJKR G8, GMY BS Jolee JKA G8",0
"Brandino",1,1,33161,NS_Alt,"MT 5* G8, AV 5* G8, Daka 5* G8, Talia 5* G8, Spirit 5* G8",0
"Brandino",1,1,68210,zEP,"EP G9, Vader Tarkin G8, zBSF Sion 4* G9",0
"Brandino",1,0,34405,Wiggs,"Wedge 5* G8, Biggs 5* G8, Leia 6* G8, Chirrut 5* G8, Baze 5* G8",0
"Styckeey Battle",,,129677,Phasma,"zPhasma FOE FOSFTP zzKRU zKylo",1
"Styckeey Battle",0,1,107003,DRMalak,"zzzDR HK-47 zBSF zzMalak Sith Assassin G8",1
"Styckeey Battle",1,1,103609,Revan,"zzzJKR BS GMY zJolee GK G8",1
"Styckeey Battle",1,1,90040,Ewoks,"zChirpa Elder zPaploo zWicket Logray",1
"Styckeey Battle",1,1,97366,Carth,"zCarth Onasi, zMission zZaalbar zJuhani Canderous",1
"Styckeey Battle",0,1,96842,BH,"zBossk Zam Jango zBoba Dengar G8",1
"Styckeey Battle",1,1,104261,zEP,"zzEP zzVader Tarkin G8, TFP G8, zSith Trooper",1
"Styckeey Battle",0,1,68256,Phoenix,"Hera G8, Kanan G8, Zeb G8, Ezra G9, Chopper G8",1
"Styckeey Battle",1,0,13864,SionSolo (Counter),"Sion G9",1
"Styckeey Battle",1,0,59825,CLS,"CLS G8, Han G9, Chewbacca 6* G9, R2-D2 G8, Chewpio 4* G8",0
"Styckeey Battle",,,264978,HansMF,"Home One, Han's MF 5*, Rebel Y-wing 5*, Bistan's U-wing 5*, Phantom 6* Biggs X-wing, Cassian's U-wing, Wedge X-wing",0
"Styckeey Battle",0,1,79106,Geonosians,"zzGBA Sun Fac G7, Geo Soldier, Geo Spy G8, Poggle G9",0
"Styckeey Battle",0,1,73314,Grievous,"GG B2 G8, B1 G8, zDroideka G9, MagnaGuard G8",0
"Styckeey Battle",1,1,60182,NS,"MT G8, AV Daka G8, Zombie 6* G9, Spirit G8",0
"Styckeey Battle",,,73158,Mon Mothma,"zMon Mothma 5* G9, Jyn G8, Biggs Kyle Katarn, K-2SO G9",0
"Styckeey Battle",1,0,55093,ShaakClones,"Shaak Ti 6* G6, Rex G8, Echo (501st) G8, Fives G9, Clone Sergeant G8",0
"Styckeey Battle",1,0,50412,Thragma (Counter),"Thrawn 6* G7, Magma G7, DT 6* G8, Stormtrooper G8, Shoretrooper G8",0
"Styckeey Battle",1,0,64723,QGJ,"QGJ G8, Aayla G8, JKA G8, Old Ben G9, Ahsoka G8",0
"DarthQuasar",0,1,105220,DRMalak,"zzzDR HK-47 zBSF zzMalak Sith Empire Trooper",1
"DarthQuasar",1,1,101932,Revan,"zzzJKR BS GMY zJolee zGK",1
"DarthQuasar",1,1,89244,Carth,"Carth Onasi, Mission zZaalbar Juhani zCanderous",1
"DarthQuasar",1,1,96949,zEP,"zzEP zzzVader Tarkin TFP G8, Sion G9",1
"DarthQuasar",0,1,58128,Phoenix,"Hera G8, Kanan G8, Zeb G8, Ezra G9, Chopper G8",1
"DarthQuasar",,,75963,Phasma,"zPhasma G8, Sith Trooper 6*, FOO G8, KRU Kylo G9",0
"DarthQuasar",1,1,52336,NS_Alt,"MT 6* G8, AV Daka G9, Talia 6* G8, Spirit 6* G8",0
"DarthQuasar",1,1,66532,Ewoks,"Chirpa G8, Elder Paploo G9, Teebo G9, Scout",0
"DarthQuasar",1,0,68053,ShaakClones,"Shaak Ti 6* G8, Rex G8, Echo (501st) G9, Fives Clone Sergeant",0
"DarthQuasar",1,0,66860,Wiggs,"Wedge G9, Biggs CLS G8, Han G7, Leia G8",0
"DarthQuasar",1,0,41729,Thragma (Counter),"Thrawn 5* G7, Magma G7, DT 5* G8, Stormtrooper G8, Shoretrooper 5* G8",0
"DarthQuasar",1,1,40270,Rogue1,"Jyn 5* G8, Chirrut 5* G8, Baze 5* G8, Cassian G8, K-2SO G8",0
"ridingred",0,1,120553,DRMalak,"zzzDR zzHK-47 zBSF zzMalak Thrawn G8",1
"ridingred",0,1,95368,Geonosians,"zzGBA Sun Fac, Geo Soldier, Geo Spy, Poggle",1
"ridingred",1,1,148787,Revan,"zzzJKR zBS zzGMY zJolee zGK",1
"ridingred",1,1,104617,Carth,"Carth Onasi, zMission zZaalbar Juhani Canderous",1
"ridingred",0,1,93440,BH,"zzBossk Zam G8, Cad Boba Greedo",1
"ridingred",0,1,91638,Phoenix,"Hera Kanan Zeb Sabine G9, zEzra",1
"ridingred",,,74767,Phasma,"Phasma G7, FOE 2* G9, FOO 5* KRU zKylo",0
"ridingred",1,0,77643,Traya,"Traya 6* G2, DN 5* G8, Sion 2* G6, zDooku zzEP",0
"ridingred",1,1,57263,NS,"MT 5* G8, AV G9, Daka G9, Zombie 5* G7, Spirit G8",0
"Nema Ghyron",0,1,130793,DRMalak,"zzzDR zzHK-47 zBSF zzMalak Sith Empire Trooper",1
"Nema Ghyron",0,1,93436,Geonosians,"zzGBA Sun Fac, Geo Soldier, Geo Spy, Poggle",1
"Nema Ghyron",1,1,112313,Revan,"zzzJKR BS GMY G9, zJolee zGK",1
"Nema Ghyron",1,1,96163,Ewoks,"zChirpa Elder zPaploo Teebo zLogray",1
"Nema Ghyron",0,1,107193,BH,"zzBossk zJango Boba Dengar zEmbo",1
"Nema Ghyron",1,1,99660,Carth,"zCarth Onasi, zMission zZaalbar zJuhani zCanderous",1
"Nema Ghyron",1,1,133045,zEP,"zzEP zzzVader Tarkin zzDN zzMara Jade, The Emperor's Hand",1
"Nema Ghyron",0,1,89826,Phoenix,"Hera Kanan zZeb Ezra Chopper",1
"Nema Ghyron",1,0,117846,CLS,"zzzCLS zHan zzChewbacca zzR2-D2 zzC-3PO 6*",0
"Nema Ghyron",1,0,52512,Troopers,"Veers 6* G9, Piett 4* G6, Gideon G9, Dark Trooper 5* G7, Range Trooper 5* G4",0
"Nema Ghyron",1,1,55666,NS_Alt,"AV G9, Daka G8, Talia G7, Spirit G8, Zombie G4",0
"Nema Ghyron",1,0,64455,zMaul,"Darth Maul G8, Sidious G9, Dooku G9, Sith Marauder 3* G9, Nest G7",0
"Nema Ghyron",1,0,49325,501st,"Rex G7, Clone Sergeant G5, Echo (501st) G1, Fives G3, Ahsoka G8",0
"Colts2ndF2P",1,0,110074,CLS,"zzzCLS zHan zChewbacca C-3PO zChewpio",1
"Colts2ndF2P",0,1,97708,DRMalak,"zzDR zHK-47 BSF zzMalak 6* Thrawn",1
"Colts2ndF2P",0,1,75687,Geonosians,"zGBA Sun Fac, Geo Soldier, Geo Spy, Poggle",1
"Colts2ndF2P",1,1,80533,Ewoks,"zChirpa Elder Paploo Wicket Logray",1
"Colts2ndF2P",0,1,88946,BH,"zBossk zThe Mandalorian, Jango Boba zGreef",1
"Colts2ndF2P",0,1,63921,Phoenix,"Hera G9, Kanan G8, Zeb G8, Ezra Chopper G9",1
"Colts2ndF2P",1,0,74076,EP (Counter, Rebel),"zzEP Shoretrooper Range Trooper G9, Stormtrooper G9, Starck G9",1
"Colts2ndF2P",1,1,86932,Revan,"zJKR BS GMY zJolee GK 6* G7",0
"Colts2ndF2P",1,1,68005,Carth,"Carth Onasi, Mission G7, zZaalbar zJuhani Canderous G7",0
"Whale",,,123015,Phasma,"zPhasma zFOTP FOSFTP zFOST zKylo",1
"Whale",1,0,141754,CLS,"zzzCLS zHan zzChewbacca zzC-3PO zChewpio",1
"Whale",,,344440,Negotiator,"Negotiator HT Anakin's Eta-2, Umbaran SF, Ahsoka's SF, Clone Sergeant's ARC-170, Plo's SF, Rex's ARC-170",1
"Whale",0,1,99557,Geonosians,"zzGBA Sun Fac, Geo Soldier, Geo Spy, Poggle",1
"Whale",1,1,79151,Ewoks,"zChirpa Elder Paploo Wicket Logray",1
"Whale",0,1,95301,BH,"zzBossk Jango IG-88 Boba Dengar G9",1
"Whale",0,1,65883,Phoenix,"Hera G8, Kanan G8, Zeb G8, Ezra Chopper G8",1
"Whale",0,1,108522,padme,"zzPadme zGK zJKA zAhsoka zFives G9",1
"Whale",1,1,136130,SL Kylo,"zzzzzzSL Kylo, zSith Trooper, zHux zzKRU Thrawn G7",0
"Whale",0,1,80308,Grievous,"GG G1, zB2 zB1 MagnaGuard Nute G1",0
"Whale",1,1,54972,NS,"MT G7, zAV Daka G6, Zombie 6* G2, Spirit 6* G2",0
"Whale",1,0,63709,Troopers,"zVeers G4, zPiett zGideon G6, Dark Trooper G1, Range Trooper G2",0
"Whale",1,1,93155,zEP,"zzEP zzzVader Tarkin G7, BSF G6, Sion G6",0
"Extrememills",1,1,87125,Ewoks,"zChirpa Elder Paploo zWicket Logray G9",1
"Extrememills",0,1,88840,BH,"zBossk Zam G9, Jango Boba Dengar",1
"Extrememills",0,1,82943,FO,"zzKRU Kylo FOO G9, FOE Phasma G8",1
"Extrememills",0,1,70216,Phoenix,"Hera G9, Kanan G8, Zeb G8, Ezra Chopper",1
"Extrememills",0,1,76804,Geonosians,"zGBA Sun Fac G8, Geo Soldier, Geo Spy G9, Poggle",0
"Extrememills",,,253014,HansMF,"Home One 6*, Han's MF 5*, HT Ghost Phantom Biggs X-wing, Cassian's U-wing, Wedge X-wing",0
"Extrememills",1,0,54064,CLS,"CLS G8, Han G7, Chewbacca 5* G9, R2-D2 G8, C-3PO",0
"Extrememills",1,1,53045,Revan Offense,"JKR G8, GMY G5, BS Jolee G8, JKA 5* G8",0
"Extrememills",1,1,41173,NS_Alt,"MT 5* G8, AV G8, Daka G8, Talia 5* G8, Spirit 6* G8",0
"Extrememills",1,0,93021,ShaakClones,"zzShaak Ti, Rex zEcho (501st), zFives Clone Sergeant 5* G8",0
"Extrememills",1,1,74142,zEP,"zEP Vader Tarkin Dooku 6* G9, TFP G8",0
"Extrememills",1,0,43022,Troopers,"Veers 5* G9, Starck G6, Snowtrooper G8, DT 5* G8, Stormtrooper G8",0
"Extrememills",1,1,39983,Rogue1,"Jyn 5* G8, Chirrut 5* G8, Baze 5* G8, Cassian G8, K-2SO G8",0
"Rogue55",0,1,105974,FO,"zzKRU zKylo zFOST zHux FOE G9",1
"Rogue55",1,1,76430,Revan Offense,"zJKR GMY G9, BS Jolee G8, Ezra",0
"DropYaDead",0,1,86445,Geonosians,"zGBA Sun Fac, Geo Soldier, Geo Spy, Poggle",1
"DropYaDead",0,1,64161,Phoenix,"Hera Kanan Zeb G8, Ezra Chopper",1
"DropYaDead",,,43164,Phasma,"Phasma G8, FOE 6* G8, FOO 5* G8, KRU G8, Kylo G8",0
"DropYaDead",1,1,60821,Revan,"JKR G8, BS GMY G8, Jolee G7, GK 6* G8",0
"DropYaDead",1,1,33161,NS_Alt,"MT 5* G8, AV 5* G8, Daka 5* G8, Talia 5* G8, Spirit 5* G8",0
"DropYaDead",1,1,39437,Ewoks,"Chirpa 6* G9, Elder 6* G7, Paploo 5* G7, Wicket 2* G7, Logray 4* G7",0
"DropYaDead",1,1,63418,zEP,"zEP zVader Tarkin G8, Dooku 5* G8, DN 5* G8",0
"DropYaDead",1,0,43715,501st,"Rex G8, Clone Sergeant 6* G8, Echo (501st) 5* G8, Fives G8, Ahsoka G8",0
"DropYaDead",,,104135,Bad Batch,"zHunter zEcho zOmega G9, zTech zWrecker",0
"DropYaDead",1,0,42605,Wiggs,"Wedge 5* G8, Biggs G8, Leia G9, Chirrut 5* G8, Baze 5* G8",0
"OldManDan",,,276479,HansMF,"Home One, Han's MF, Rebel Y-wing, Bistan's U-wing, Phantom Ghost Cassian's U-wing, Wedge X-wing",1
"OldManDan",0,1,94540,Geonosians,"zzGBA Sun Fac, Geo Soldier, Geo Spy, Poggle",1
"OldManDan",1,1,88899,Ewoks,"zChirpa Elder zPaploo zWicket zLogray",1
"OldManDan",0,1,113744,BH,"zzBossk The Mandalorian, IG-88 zBoba Dengar",1
"OldManDan",1,1,99997,Carth,"zCarth Onasi, zMission zZaalbar zJuhani zCanderous",1
"OldManDan",1,1,108955,zEP,"zzEP zzzVader Tarkin G9, TFP zBSF",1
"OldManDan",0,1,78668,Phoenix,"Hera G8, zKanan Zeb G8, zEzra Chopper G9",1
"OldManDan",,,54843,Phasma,"Phasma G8, FOTP G8, FOSFTP G7, FOST 5* G9, zKylo G9",0
"OldManDan",0,1,68129,padme,"Padme G8, GK G9, zJKA Ahsoka G9, CW Chewbacca G8",0
"OldManDan",1,1,79333,JTR,"JTR G7, Scav Rey, BB-8 G9, zzR2-D2 zFinn",0
