Player,Offense,Defense,GP,Name,Squad,Viable
"ChiefPheonix1",,,124056,Phasma,"zPhasma zFOTP FOSFTP zFOST zKylo",1
"ChiefPheonix1",,,351204,Negotiator,"Negotiator 5* HT Anakin's Eta-2, Umbaran SF, Ahsoka's SF, Clone Sergeant's ARC-170, Plo's SF, Rex's ARC-170",1
"ChiefPheonix1",0,1,101927,Geonosians,"zzGBA Sun Fac, Geo Soldier, Geo Spy, Poggle",1
"ChiefPheonix1",,,91503,Mon Mothma,"zMon Mothma, Hoth Rebel Scout, zCara Dune, Pao Chirrut",1
"ChiefPheonix1",1,1,77927,Carth,"zCarth Onasi, Mission G9, Zaalbar G9, Juhani zCanderous",1
"ChiefPheonix1",0,1,109202,BH,"zzBossk zzThe Mandalorian, Cad zBoba zzGreef",1
"ChiefPheonix1",1,1,123480,zEP,"zzEP zzzVader zzTarkin TFP zSith Trooper",1
"ChiefPheonix1",0,1,79454,Phoenix,"zHera G8, zKanan G8, zZeb G8, Sabine G8, zEzra",1
"ChiefPheonix1",,,234390,HansMF,"Home One, Han's MF, Biggs X-wing, Bistan's U-wing, Phantom Ghost Cassian's U-wing, Wedge X-wing",0
"ChiefPheonix1",,,414649,Executrix,"Executrix Tie Adv, Emperor's Shuttle 4*, TIE Reaper 5*, Imperial TIE Fighter, Gauntlet Starfighter, FOSF TIE Fighter, FO TIE Fighter",0
"ChiefPheonix1",1,0,150292,ShaakClones,"zShaak Ti, zRex zEcho (501st), zzFives zARC Trooper",0
"ChiefPheonix1",1,0,91445,Troopers,"zVeers zStarck zGideon zzPiett 6* Range Trooper",0
"ChiefPheonix1",1,0,72264,QGJ,"zQGJ Aayla G9, JKA 5* G1, zzOld Ben, Ahsoka G1",0
"Dark One",,,131591,Phasma,"zPhasma FOE zSith Trooper, zzKRU zKylo",1
"Dark One",0,1,138079,DRMalak,"zzzDR zzHK-47 zBSF zzMalak Sith Empire Trooper",1
"Dark One",0,1,113611,padme,"zzPadme zGK zJKA zAhsoka zzC-3PO",1
"Dark One",1,1,100459,NS_Alt,"zzMT zzAV zDaka Talia Zombie",1
"Dark One",1,0,116574,Traya,"zzTraya zzDN zSion zzEP zThrawn",1
"Dark One",1,1,127553,JTR,"zzzJTR zScav Rey, zzBB-8 zzR2-D2 RT",1
"Dark One",1,1,130291,Revan Offense,"zzzJKR zGMY zBS zJolee zHYoda",1
"Dark One",1,1,90827,Ewoks,"zChirpa Elder zPaploo zWicket Logray",1
"Dark One",1,0,110736,ShaakClones,"zzShaak Ti, zRex Echo (501st), zzFives zARC Trooper",1
"Dark One",1,1,95422,Carth,"zCarth Onasi, Mission zZaalbar zJuhani zCanderous",1
"Dark One",0,1,101339,Phoenix,"zHera zKanan zZeb zSabine zEzra",1
"Dark One",1,0,99593,Wiggs,"Wedge Biggs zzzCLS zHan zFulcrum",1
"Dark One",1,0,107062,zMaul,"zDarth Maul, zDooku zSidious Sith Assassin, zSavage",1
"Dark One",1,1,87751,Rogue1,"Jyn Chirrut Baze Cassian zK-2SO",1
"Dark One",1,0,81465,Jawas,"Nebit Jawa Engineer, Jawa Scavenger, Jawa Dathcha",1
"Dark One",,,363970,Negotiator,"Negotiator 5* HT 5* Anakin's Eta-2 5*, Umbaran SF, Ahsoka's SF, Clone Sergeant's ARC-170, Plo's SF, Rex's ARC-170",0
"Dark One",0,1,87609,Geonosians,"zzGBA Sun Fac, Geo Soldier, Geo Spy G8, Poggle",0
"Dark One",0,1,66898,Grievous,"GG B2 G8, B1 4* G8, MagnaGuard G7, Nute",0
"Dark One",,,410653,Executrix,"Executrix Tie Adv, Emperor's Shuttle 4*, TIE Reaper 5*, Imperial TIE Fighter, Gauntlet Starfighter, FOSF TIE Fighter, FO TIE Fighter",0
"Dark One",1,0,87214,Troopers,"zVeers Starck Shoretrooper Magma G9, DT",0
"Dark One",0,1,79229,BH,"Jango 6* G7, Cad zBoba Greedo Dengar G9",0
"Dark One",,,39185,Bad Batch,"Hunter 3* G8, Echo 3* G8, Omega 3* G8, Tech 3* G5, Wrecker 3* G6",0
"Dark One",1,0,7543,NestSolo (Counter),"Nest 3* G8",0
"Latch",0,1,91285,padme,"zPadme G9, GK G8, zJKA zAhsoka zCW Chewbacca",1
"Latch",,,324171,HansMF,"Home One, Han's MF 6*, Rebel Y-wing, Bistan's U-wing, Phantom Ghost Cassian's U-wing, Wedge X-wing",1
"Latch",,,362730,Negotiator,"Negotiator 5* HT Anakin's Eta-2, Umbaran SF, Ahsoka's SF, Clone Sergeant's ARC-170, Plo's SF, Rex's ARC-170",1
"Latch",1,1,118839,JTR,"zzzJTR zzR2-D2 zzBB-8 RH Finn G8, RH Poe G9",1
"Latch",,,359232,Executrix,"Executrix Tie Adv, Emperor's Shuttle, TIE Reaper, Imperial TIE Fighter, Gauntlet Starfighter, FOSF TIE Fighter, FO TIE Fighter",1
"Latch",1,1,120267,Revan Offense,"zzzJKR zzGMY zBS Jolee G8, zzHYoda",1
"Latch",1,1,98647,Ewoks,"zChirpa Elder zPaploo zWicket zLogray",1
"Latch",0,1,118227,BH,"zzBossk zzThe Mandalorian, zzJango zBoba Dengar G8",1
"Latch",1,1,89450,Carth,"zCarth Onasi, Mission G8, Zaalbar G8, zJuhani zCanderous",1
"Latch",1,1,135942,zEP,"zzEP zzzVader zzTarkin zBSF zzTraya",1
"Latch",0,1,82182,Phoenix,"Hera G8, zKanan G8, Sabine G8, zEzra Chopper",1
"Latch",0,1,87191,FO,"zzKRU zKylo FOTP FOST G8, Phasma G8",1
"Latch",,,59730,Admiral Raddus,"Admiral Raddus 3* G7, Cassian G7, zJyn G8, K-2SO G7, Bistan G8",0
"Latch",1,0,88754,CLS,"zzzCLS zHan Chewbacca G8, C-3PO 6* G8, Chewpio G5",0
"Latch",,,231782,Malevolence,"Malevolence 5* Hyena Bomber 4*, Vulture Droid 3*, Sun Fac SF, Soldier SF, Spy SF",0
"Latch",1,1,90244,NS,"MT G8, zzAV zDaka Zombie G8, Spirit",0
"Latch",0,1,78614,Geonosians,"GBA G9, Sun Fac G7, Geo Soldier, Geo Spy, Poggle",0
"Latch",0,1,86895,Grievous,"zzGG B2 G5, Droideka G8, zDooku IG-88",0
"Latch",,,62963,Mon Mothma,"Mon Mothma 5* G7, Wedge G8, Lando G9, Cara Dune, Chirrut G8",0
"Latch",1,0,71353,Clones,"Cody G7, zRex Echo (501st) G7, Fives G8, Clone Sergeant",0
"Latch",1,0,62971,Troopers,"Veers G9, Starck G8, Snowtrooper Magma G7, Stormtrooper G8",0
"Latch",1,0,11956,SionSolo (Counter),"Sion G7",0
"Colts1stF2P",1,0,110412,CLS,"zzzCLS zHan zChewbacca C-3PO zChewpio",1
"Colts1stF2P",1,1,92220,Revan Offense,"zzJKR GMY BS Jolee JKA",1
"Colts1stF2P",1,1,80929,Ewoks,"zChirpa Elder Paploo Wicket Logray",1
"Colts1stF2P",0,1,82370,BH,"zBossk The Mandalorian, Jango Boba Dengar G9",1
"Colts1stF2P",0,1,61140,Phoenix,"Hera G8, Kanan G8, Zeb G8, Sabine G9, Ezra G9",1
"Colts1stF2P",0,1,73894,Geonosians,"zGBA Sun Fac, Geo Soldier, Geo Spy, Poggle",0
"Colts1stF2P",1,0,73550,Troopers,"zVeers G8, zPiett Gideon Dark Trooper G9, Range Trooper G8",0
"Colts1stF2P",1,1,67778,Carth,"Carth Onasi, Mission G6, zZaalbar zJuhani Canderous G7",0
"Colts1stF2P",1,1,88708,zEP,"zEP zVader Tarkin BSF Mara Jade, The Emperor's Hand",0
"Colts1stF2P",,,107594,Bad Batch,"zHunter zEcho Omega 4* zTech zWrecker",0
"HDS15",0,1,90402,padme,"zzPadme GK JKA Ahsoka CW Chewbacca",1
"HDS15",,,317100,HansMF,"Home One, Han's MF 5*, Biggs X-wing, Bistan's U-wing, Phantom Ghost Cassian's U-wing, Wedge X-wing",1
"HDS15",0,1,102017,Geonosians,"zzGBA Sun Fac, Geo Soldier, Geo Spy, Poggle",1
"HDS15",1,1,109427,JTR,"zzzJTR zScav Rey, BB-8 R2-D2 zFinn",1
"HDS15",0,1,84449,Grievous,"zzGG zB2 B1 G8, MagnaGuard G8, Dooku",1
"HDS15",1,1,137450,Revan Offense,"zzzJKR zzGMY zBS zJolee HYoda",1
"HDS15",0,1,114542,BH,"zzBossk Cad zBoba zGreedo Dengar G9",1
"HDS15",1,1,92751,Carth,"zCarth Onasi, Mission Zaalbar Juhani Canderous",1
"HDS15",1,1,132142,zEP,"zzEP zzVader zzTarkin TFP zSith Trooper",1
"HDS15",0,1,141107,FO,"zzKRU zKylo zFOST zHux FOE",1
"HDS15",0,1,81368,Phoenix,"Hera Kanan Zeb Ezra Chopper",1
"HDS15",1,0,13249,SionSolo (Counter),"Sion G8",1
"HDS15",,,329805,Negotiator,"Negotiator 5* HT 6* Anakin's Eta-2 4*, Umbaran SF, Ahsoka's SF, Clone Sergeant's ARC-170, Jedi Consular's Starfighter, Plo's SF",0
"HDS15",1,1,74061,NS,"zMT 5* G8, zzAV Daka Zombie 6* G7, Spirit G8",0
"HDS15",0,1,99453,DR,"DR zzHK-47 zBSF Sith Assassin G7, zzThrawn",0
"HDS15",,,73214,Mon Mothma,"zMon Mothma 5* G8, Jyn G8, Cassian K-2SO Chirrut",0
"HDS15",1,1,86804,Ewoks,"zChirpa Elder G6, Paploo Teebo zLogray",0
"HDS15",1,0,73807,ShaakClones,"zShaak Ti G9, Rex G8, Echo (501st), Fives Clone Sergeant G8",0
"HDS15",1,0,73646,Wiggs,"Wedge G8, Biggs G8, zCLS Chewbacca G9, Leia",0
"HDS15",1,0,59529,Troopers,"Veers G9, Starck G7, Snowtrooper G8, Magma G6, Stormtrooper G8",0
"HDS15",1,0,52528,zMaul,"Darth Maul, Sidious G8, Sith Empire Trooper G6, Sith Marauder 5* G6, Nest 3* G6",0
"HDS15",0,1,70670,BH,"Jango G8, The Mandalorian 4* G8, zZam IG-88 Boushh (Leia Organa) 4* G6",0
"HDS15",,,37675,Bad Batch,"Hunter 4* G7, Echo 3* G7, Omega 5* G6, Tech 4* G8, Wrecker 4* G6",0
"HDS15",1,0,63916,Jawas,"Nebit Jawa Engineer G8, Jawa Scavenger G8, Jawa 6* G8, Dathcha G9",0
"KyTheGuy",0,1,84664,Geonosians,"zGBA Sun Fac, Geo Soldier, Geo Spy, Poggle",1
"KyTheGuy",1,1,81943,Ewoks,"zChirpa Elder Paploo Wicket Logray",1
"KyTheGuy",0,1,65022,Phoenix,"Hera Kanan G8, Zeb G8, Ezra G9, Chopper G9",1
"KyTheGuy",0,1,71204,FO,"zKRU Kylo 6* G7, FOTP G8, Hux 6* Sith Trooper 6*",0
"DarthKrillin",0,1,110372,DRMalak,"zzzDR zzHK-47 zBSF zzMalak Sith Assassin G9",1
"DarthKrillin",0,1,90719,Geonosians,"zzGBA Sun Fac, Geo Soldier, Geo Spy, Poggle",1
"DarthKrillin",1,0,114670,Traya,"zzTraya zzDN zSion Sith Empire Trooper G8, zzThrawn",1
"DarthKrillin",1,1,134864,Revan,"zzzJKR zBS zzGMY zJolee zGK",1
"DarthKrillin",1,1,100616,Carth,"zCarth Onasi, zMission zZaalbar Juhani zCanderous",1
"DarthKrillin",1,1,116230,zEP,"zzEP zzzVader zzTarkin TFP G8, zzMara Jade, The Emperor's Hand",1
"DarthKrillin",0,1,82071,BH,"zzJango IG-88 G8, Boba Greedo G9, Dengar G8",1
"DarthKrillin",0,1,74462,Phoenix,"Hera Kanan Zeb G8, Ezra Chopper G9",1
"DarthKrillin",0,1,82373,Grievous,"GG B2 MagnaGuard G8, zDooku T3-M4 G7",0
"DarthKrillin",1,0,60913,ShaakClones,"Shaak Ti 6* G8, Rex G8, Echo (501st) G6, Fives Clone Sergeant G5",0
"AnakinSky",1,1,119299,Revan Offense,"zzzJKR GMY zBS Jolee zJKA",1
"AnakinSky",,,76794,Nute-OR,"Nute Dooku Jango Zaalbar G6, Mission",0
"AnakinSky",1,0,65930,501st,"Rex ARC Trooper G7, Echo (501st) 6* G8, Fives G9, Ahsoka",0
"Mikki and her Ry Ry",0,1,143016,DRMalak,"zzzDR zzHK-47 zBSF zzMalak Sith Assassin",1
"Mikki and her Ry Ry",0,1,91264,Geonosians,"zzGBA Sun Fac, Geo Soldier, Geo Spy, Poggle",1
"Mikki and her Ry Ry",1,1,109917,Revan Offense,"zzzJKR GMY zBS zJolee JKA",1
"Mikki and her Ry Ry",1,1,87827,Ewoks,"zChirpa Elder zPaploo Scout zWicket",1
"Mikki and her Ry Ry",1,1,102312,Carth,"zCarth Onasi, zMission zZaalbar zJuhani zCanderous",1
"Mikki and her Ry Ry",0,1,101236,BH,"zzBossk zThe Mandalorian, zJango Boba Greef",1
"Mikki and her Ry Ry",1,1,95906,zEP,"zzEP zzVader Tarkin G9, TFP G8, zzMara Jade, The Emperor's Hand",1
"Mikki and her Ry Ry",0,1,76289,Phoenix,"Hera Kanan G8, Zeb G8, Ezra Chopper",1
"Mikki and her Ry Ry",1,0,20026,SionSolo (Counter),"zSion",1
"Mikki and her Ry Ry",,,66737,Phasma,"Phasma G8, FOE FOO G8, KRU G8, Kylo G9",0
"Mikki and her Ry Ry",1,0,69936,CLS,"CLS G8, Han G7, Chewbacca G7, zzR2-D2 Chewpio 4* G7",0
"Mikki and her Ry Ry",1,1,64020,NS_Alt,"MT G8, AV G8, Daka G9, Talia G9, Spirit G8",0
"Mikki and her Ry Ry",1,0,63649,501st,"Rex G8, Clone Sergeant G8, Echo (501st) G8, Fives G8, Ahsoka",0
"Mikki and her Ry Ry",1,1,43539,Rogue1,"Jyn 5* G8, Chirrut 5* G8, Baze 6* G8, Cassian G8, K-2SO G8",0
"asguardian",0,1,92122,padme,"zzPadme G9, GK G8, JKA zAhsoka zBarriss",1
"asguardian",1,1,109082,Revan Offense,"zzzJKR zGMY zBS zJolee Ezra G9",1
"asguardian",1,1,94058,Carth,"zCarth Onasi, zMission zZaalbar zJuhani Canderous",1
"asguardian",0,1,113830,BH,"zBossk G9, zzThe Mandalorian, zZam zJango zBoba",1
"asguardian",1,1,102506,zEP,"zzEP zzVader Tarkin G8, TFP G8, zMara Jade, The Emperor's Hand",1
"asguardian",0,1,78543,FO,"zzKRU Kylo G8, FOST G8, FOO G8, Phasma G8",1
"asguardian",0,1,92866,DRMalak,"zzzDR HK-47 zBSF zMalak 5* G8, Thrawn 6* G8",0
"asguardian",0,1,82170,Geonosians,"zzGBA Sun Fac G7, Geo Soldier, Geo Spy, Poggle G8",0
"asguardian",1,1,88852,JTR,"zJTR Scav Rey G8, zBB-8 zR2-D2 Finn G9",0
"asguardian",1,1,55078,NS_Alt,"MT G8, AV G9, Daka G8, Talia G8, Spirit G8",0
"asguardian",,,77056,Iden Troopers,"zIden Versio, Stormtrooper Snowtrooper G8, Magma G7, DT",0
"asguardian",1,0,103166,CLS,"zzzCLS zHan Leia G8, Old Ben G9, zChewbacca",0
"asguardian",1,0,45701,Clones,"Cody G8, Rex G8, Echo (501st) 5* G8, Fives G8, Clone Sergeant G8",0
"asguardian",0,1,60597,Phoenix,"Hera G8, Kanan G8, Zeb G8, Sabine 6* G8, Chopper G8",0
"asguardian",1,1,37988,Rogue1,"Jyn 5* G8, Chirrut 5* G8, Baze 6* G8, Cassian G8, K-2SO 5* G8",0
"Mol Eliza",1,1,106184,Revan Offense,"zzzJKR zGMY zBS zJolee Ezra G8",1
"Mol Eliza",1,1,96799,Carth,"zCarth Onasi, zMission zZaalbar zJuhani Canderous",1
"Mol Eliza",,,47907,Phasma,"Phasma G8, FOE 6* FOO 6* G8, KRU 6* G8, Kylo 6* G8",0
"Mol Eliza",1,1,48314,NS_Alt,"MT 5* G8, AV G8, Daka G9, Talia 6* G8, Spirit 6* G8",0
"Mol Eliza",1,1,94408,zEP,"EP zzVader Tarkin G8, zBSF DN",0
"Mol Eliza",0,1,67545,BH,"Bossk 4* The Mandalorian 6* G8, Cad G8, IG-88 G9, Boba",0
"Mol Eliza",1,0,46841,501st,"Rex G8, Clone Sergeant G8, Echo (501st) 6* G8, Fives G8, Ahsoka G8",0
"Mol Eliza",1,0,70112,Wiggs,"Wedge 5* G8, Biggs G8, zzCLS Han G9, Leia",0
"Mol Eliza",0,1,49165,Phoenix,"Hera G8, Kanan G8, Zeb G8, Sabine 5* G8, Chopper G8",0
"Mol Eliza",1,1,40177,Rogue1,"Jyn 5* G8, Chirrut 5* G8, Baze 5* G8, K-2SO G8, Bodhi Rook G5",0
"Chris Anderson 05051982",0,1,89013,padme,"zzPadme zGK JKA Ahsoka C-3PO G8",1
"Chris Anderson 05051982",0,1,124404,DR,"zzzDR zzHK-47 zBSF Sith Empire Trooper, Thrawn",1
"Chris Anderson 05051982",,,388561,HansMF,"Home One, Han's MF, HT Bistan's U-wing, Phantom Ghost Cassian's U-wing, Biggs X-wing",1
"Chris Anderson 05051982",1,1,149117,Revan Offense,"zzzJKR zzGMY zBS zJolee zEzra",1
"Chris Anderson 05051982",1,1,100003,Ewoks,"zChirpa Elder zPaploo Wicket zLogray",1
"Chris Anderson 05051982",0,1,114736,BH,"zzBossk Zam Jango Boba zDengar",1
"Chris Anderson 05051982",1,1,109465,Carth,"zCarth Onasi, zMission zZaalbar zJuhani Canderous",1
"Chris Anderson 05051982",1,1,136108,zEP,"zzEP zzzVader zzTarkin TFP zzMara Jade, The Emperor's Hand",1
"Chris Anderson 05051982",0,1,94637,FO,"zzKRU zKylo zHux FOO G8, FOE G8",1
"Chris Anderson 05051982",0,1,103916,Phoenix,"zHera zKanan zZeb Sabine G8, Chopper",1
"Chris Anderson 05051982",1,0,68064,IG88,"IG-88 G9, GG G9, BB-8 G8, T3-M4 G8, L3-37 G8",1
"Chris Anderson 05051982",1,0,15112,SionSolo (Counter),"Sion G9",1
"Chris Anderson 05051982",0,1,85603,Geonosians,"zzGBA Sun Fac G8, Geo Soldier, Geo Spy G9, Poggle",0
"Chris Anderson 05051982",,,353683,Executrix,"Executrix Tie Adv, Emperor's Shuttle 4*, TIE Reaper 3*, Imperial TIE Fighter, Gauntlet Starfighter, FOSF TIE Fighter, FO TIE Fighter",0
"Chris Anderson 05051982",1,1,50883,NS,"MT G4, AV G8, Daka G7, Zombie G2, Spirit G8",0
"Chris Anderson 05051982",1,0,85130,ShaakClones,"zzShaak Ti, Rex G9, zEcho (501st) G8, zFives G9, ARC Trooper G8",0
"Chris Anderson 05051982",1,0,72739,Troopers,"Veers Starck G7, Gideon G9, zDark Trooper, Snowtrooper G7",0
"Chris Anderson 05051982",1,0,64022,Wiggs,"Wedge G7, Biggs G8, CLS G8, Han G8, Leia G8",0
"Chris Anderson 05051982",1,0,59759,Jawas,"Nebit G8, Jawa Engineer G9, Jawa Scavenger G7, Jawa G7, Dathcha G8",0
"凯 天行者",1,1,143390,SL Kylo,"zzzzzzSL Kylo, zSith Trooper, zHux zzKRU Thrawn G8",1
"凯 天行者",0,1,128073,padme,"zzPadme zGK zJKA zAhsoka zzC-3PO",1
"凯 天行者",,,434209,Negotiator,"Negotiator HT Anakin's Eta-2, Umbaran SF, Ahsoka's SF, Clone Sergeant's ARC-170, Plo's SF, Rex's ARC-170",1
"凯 天行者",1,1,131203,GAS,"zzzzGAS zRex zEcho (501st), zzFives zARC Trooper",1
"凯 天行者",1,1,84012,Ewoks,"zChirpa Elder Paploo Wicket Logray",1
"凯 天行者",1,1,97446,Revan Offense,"zzzJKR zGMY BS zJolee Ezra G8",1
"凯 天行者",1,1,88425,Carth,"Carth Onasi, zMission zZaalbar Juhani Canderous",1
"凯 天行者",0,1,85070,BH,"zJango The Mandalorian G8, Bossk Boba G9, Greef G8",1
"凯 天行者",,,115506,Phasma,"Phasma FOTP FOSFTP zFOST Kylo",0
"凯 天行者",1,0,78705,CLS,"CLS Han G8, Chewbacca G9, R2-D2 G8, Chewpio G7",0
"凯 天行者",0,1,96386,Grievous,"GG zB2 zB1 MagnaGuard Nute G9",0
"凯 天行者",1,0,88960,Traya,"Traya G7, DN G7, Sion G7, zBSF zEP",0
"Dart tds",0,1,93426,Geonosians,"zzGBA Sun Fac, Geo Soldier, Geo Spy, Poggle",1
"Dart tds",0,1,125710,FO,"zzKRU zKylo zFOST zHux FOE",1
"Dart tds",1,1,51688,NS_Alt,"MT 5* G8, AV Daka G8, Talia G8, Spirit 6* G8",0
"Dart tds",1,1,86122,zEP,"zEP zzzVader Tarkin TFP DN G8",0
"Dart tds",1,0,57923,501st,"Rex G8, Clone Sergeant G9, Echo (501st) G8, Fives G8, Ahsoka",0
"Dart tds",1,0,59288,Wiggs,"Wedge G8, Biggs G8, Han G6, Ezra Leia G8",0
"Dart tds",1,0,44141,Troopers,"Veers 5* G8, Starck G7, Snowtrooper G8, DT 5* G8, Stormtrooper G8",0
"Dart tds",1,1,42466,Rogue1,"Jyn 6* G8, Chirrut 6* G8, Baze 5* G8, Cassian G8, K-2SO G8",0
"Dart tds",0,1,56130,Phoenix,"Hera 5* Kanan G8, Zeb G8, Sabine 5* G8, Chopper G8",0
"Dart tds",0,1,77271,BS,"BS 6* zGMY Old Ben G9, GK 6* G8, JKA",0
"Dart tds",1,0,12684,SionSolo (Counter),"Sion 5*",0
"Gorkken",0,1,94792,Geonosians,"zzGBA Sun Fac, Geo Soldier, Geo Spy, Poggle",1
"Gorkken",,,273928,HansMF,"Home One, Han's MF 5*, HT 6* Ghost Phantom Biggs X-wing, Cassian's U-wing, Wedge X-wing",1
"Gorkken",,,95116,Disintegration,"Aurra Greef zBoba Bossk The Mandalorian",1
"Gorkken",1,1,106054,zEP,"zzEP zzzVader Tarkin TFP G9, BSF",1
"Gorkken",0,1,73240,Phoenix,"Hera Kanan G8, Zeb G9, Ezra Chopper G8",1
"Gorkken",,,46208,Phasma,"Phasma G8, FOE 5* G8, FOO G8, KRU G8, Kylo G8",0
"Gorkken",1,0,90863,CLS,"zzzCLS Han Chewbacca 6* G7, R2-D2 G8, zChewpio",0
"Gorkken",1,1,81956,NS,"zzMT AV Daka Zombie Spirit 6* G9",0
"Gorkken",0,1,76249,Grievous,"zzGG B2 G8, MagnaGuard G7, zDooku IG-88 G9",0
"Gorkken",1,0,54079,501st,"Rex G8, Clone Sergeant G8, Echo (501st) G8, Fives G8, Ahsoka G9",0
"Gorkken",1,1,44665,Rogue1,"Jyn 5* G8, Chirrut G8, Baze 6* G8, Cassian G8, K-2SO G8",0
"Gorkken",0,1,73718,BH,"Jango Zam G7, Cad Greedo G9, Dengar G7",0
"Schmidt Happens",0,1,107207,DRMalak,"zzzDR zHK-47 zBSF zMalak Sith Assassin",1
"Schmidt Happens",0,1,93856,Geonosians,"zzGBA Sun Fac, Geo Soldier, Geo Spy, Poggle",1
"Schmidt Happens",1,1,92537,JTR,"zJTR Scav Rey, BB-8 zR2-D2 zFinn",1
"Schmidt Happens",1,1,113532,Revan,"zzzJKR BS zzGMY zJolee GK",1
"Schmidt Happens",1,1,103593,Carth,"zCarth Onasi, zMission zZaalbar zJuhani zCanderous",1
"Schmidt Happens",0,1,102817,BH,"zzBossk zThe Mandalorian, Jango Boba zGreef",1
"Schmidt Happens",1,1,102796,zEP,"zzEP zzVader zTarkin TFP G9, zTraya",1
"Schmidt Happens",0,1,98223,FO,"zzKRU Kylo zHux FOO FOE",1
"Schmidt Happens",0,1,87010,Phoenix,"zHera Kanan Zeb G9, zSabine Ezra",1
"Schmidt Happens",1,0,20224,SionSolo (Counter),"zSion",1
"Schmidt Happens",1,0,75132,Wiggs,"Wedge G7, Biggs G7, zCLS Han Chewbacca G9",0
"DarthxVader",0,1,107777,FO,"zzKRU zKylo FOST zHux FOE",1
"DarthxVader",0,1,77022,Phoenix,"Hera Kanan G9, Zeb G9, Ezra Chopper",1
"DarthxVader",1,1,80565,zEP,"EP zzzVader Tarkin G9, zSith Trooper, Mara Jade, The Emperor's Hand 4* G8",0
"Alucard",0,1,93567,Geonosians,"zzGBA Sun Fac, Geo Soldier, Geo Spy, Poggle",1
"Alucard",1,1,92570,zEP,"zzEP zzzVader Tarkin DT G8, TFP G8",1
"Alucard",1,0,73841,Wiggs,"Wedge Biggs CLS G9, Han G9, Leia G9",1
"Alucard",0,1,73949,Phoenix,"Hera Kanan Zeb Ezra G8, Chopper G9",1
"Alucard",,,57179,Phasma,"Phasma G8, FOTP G8, FOSFTP 6* G7, FOST 5* G8, zKylo",0
"Alucard",0,1,65617,padme,"Padme G8, GK 6* G6, JKA 5* G8, Ahsoka G8, CW Chewbacca",0
"Alucard",1,1,72180,NS,"MT G9, AV Daka G9, Zombie Spirit G8",0
"Alucard",0,1,75906,Grievous,"GG G8, B2 6* G7, Dooku zIG-88 L3-37 G8",0
"Alucard",1,1,73332,Ewoks,"zChirpa Elder Paploo G7, Teebo Scout G9",0
"Alucard",1,0,62276,Troopers,"Veers 5* G9, Starck 4* G7, zGideon G8, Dark Trooper, zStormtrooper G9",0
"Alucard",1,0,58295,Clones,"Cody G8, Rex G8, Echo (501st) 6* G9, Fives G9, Clone Sergeant",0
"Alucard",1,1,53890,Rogue1,"Jyn 5* G8, Chirrut G8, Baze 6* G9, Cassian G8, K-2SO G8",0
"Terdz 2",,,329614,HansMF,"Home One, Han's MF 5*, Biggs X-wing, Bistan's U-wing, Phantom Ghost Cassian's U-wing, Wedge X-wing",1
"Terdz 2",0,1,124294,Geonosians,"zzGBA Sun Fac, Geo Soldier, Geo Spy, Poggle",1
"Terdz 2",0,1,126488,Grievous,"zzGG zB2 zB1 zMagnaGuard zNute",1
"Terdz 2",,,114469,Disintegration,"Aurra zzGreef zBoba zzBossk zzThe Mandalorian",1
"Terdz 2",1,0,133137,ShaakClones,"zzShaak Ti, zRex zEcho (501st), zzFives zARC Trooper",1
"Terdz 2",1,1,101025,Carth,"zCarth Onasi, zMission zZaalbar zJuhani zCanderous",1
"Terdz 2",1,1,100803,zEP,"zzEP zzzVader Tarkin G8, TFP G9, zBSF",1
"Terdz 2",0,1,81533,FO,"zzKRU zKylo G9, zFOST FOO G8, FOE G9",1
"Terdz 2",0,1,98763,Phoenix,"zHera zKanan zZeb zSabine zEzra",1
"Terdz 2",0,1,96754,padme,"zzPadme zGK zJKA Ahsoka G8, Barriss G8",0
"Terdz 2",1,1,80006,NS,"zMT zAV Daka G8, Zombie Spirit G8",0
"Terdz 2",1,1,75883,JTR,"JTR G7, Scav Rey, BB-8 G9, R2-D2 G9, zFinn",0
"Terdz 2",1,0,63581,Wiggs,"Wedge G8, Biggs G8, CLS G8, Chewbacca G9, Leia G9",0
"Terdz 2",1,0,69656,Troopers,"Veers Starck G7, Dark Trooper 6* G9, DT G8, Stormtrooper G8",0
"Terdz 2",0,1,85286,BH,"Jango Zam G9, IG-88 G9, Greedo G8, zDengar",0
"Terdz 2",1,1,74104,Rogue1,"Jyn Chirrut Baze 6* G8, Cassian G9, K-2SO G9",0
"Puke Clodhopper",1,0,151427,CLS,"zzzCLS zHan zzChewbacca zzC-3PO zChewpio",1
"Puke Clodhopper",0,1,137349,DRMalak,"zzzDR zzHK-47 zBSF zzMalak Sith Assassin G9",1
"Puke Clodhopper",0,1,119918,padme,"zzPadme zGK zJKA zAhsoka CW Chewbacca G8",1
"Puke Clodhopper",1,1,101178,NS_Alt,"zzMT zzAV zDaka Talia Zombie",1
"Puke Clodhopper",,,430148,HansMF,"Home One, Han's MF, Rebel Y-wing, Bistan's U-wing, Phantom Biggs X-wing, Cassian's U-wing, Wedge X-wing",1
"Puke Clodhopper",,,442021,Negotiator,"Negotiator HT Anakin's Eta-2, Umbaran SF, Ahsoka's SF, Clone Sergeant's ARC-170, Plo's SF, Rex's ARC-170",1
"Puke Clodhopper",0,1,102172,Grievous,"zzGG zB2 zB1 zMagnaGuard zNute",1
"Puke Clodhopper",1,0,132192,Traya,"zzTraya zzDN zSion zzEP zzThrawn",1
"Puke Clodhopper",1,1,127842,JTR,"zzzJTR zScav Rey, zzBB-8 zzR2-D2 Finn",1
"Puke Clodhopper",,,384867,Executrix,"Executrix Tie Adv, Emperor's Shuttle, TIE Reaper, Imperial TIE Fighter, Gauntlet Starfighter, FOSF TIE Fighter, FO TIE Fighter",1
"Puke Clodhopper",,,115186,Mon Mothma,"zzMon Mothma, Wedge Biggs Lando zCara Dune",1
"Puke Clodhopper",1,1,134424,Revan Offense,"zzzJKR zzGMY zBS zJolee zzHYoda",1
"Puke Clodhopper",1,1,97094,Ewoks,"zChirpa Elder zPaploo zWicket zLogray",1
"Puke Clodhopper",0,1,123890,BH,"zzBossk zzThe Mandalorian, zBoba Dengar G8, zzEmbo",1
"Puke Clodhopper",1,1,95571,Carth,"zCarth Onasi, zMission zZaalbar Juhani zCanderous",1
"Puke Clodhopper",0,1,100246,BH,"zzJango Cad zFennec Shand G8, zIG-88 zzGreef",1
"Puke Clodhopper",0,1,74013,Phoenix,"zHera Kanan G8, Zeb G8, Sabine G8, Ezra G8",1
"Puke Clodhopper",1,1,85126,Rogue1,"zzJyn Chirrut G8, Baze G8, zCassian K-2SO G9",1
"Puke Clodhopper",,,66416,Phasma,"Phasma FOTP G9, FOSFTP G9, FOST 5* G8, Kylo G9",0
"Puke Clodhopper",0,1,65792,Geonosians,"GBA G7, Sun Fac G8, Geo Soldier G9, Geo Spy G8, Poggle G9",0
"Puke Clodhopper",1,0,100044,ShaakClones,"zzShaak Ti, zRex Echo (501st) G9, zzFives Clone Sergeant",0
"Puke Clodhopper",1,0,73455,zMaul,"zDarth Maul, Sidious G9, zDooku Sith Empire Trooper G2, Nest G5",0
"Puke Clodhopper",1,0,60278,Troopers,"Veers G8, Starck G1, Shoretrooper G8, DT G8, Stormtrooper G8",0
"Puke Clodhopper",1,0,50516,Jawas,"Nebit G8, Jawa Engineer G1, Jawa Scavenger G7, Jawa 6* G8, Dathcha G7",0
"Jordan Halaren",1,1,87682,JTR,"zJTR G9, Scav Rey, BB-8 zzR2-D2 Finn",1
"Jordan Halaren",1,1,128613,Revan,"zzzJKR zBS zzGMY zJolee GK",1
"Jordan Halaren",1,0,121613,CLS,"zzzCLS zHan zzChewbacca Leia zC-3PO",1
"Jordan Halaren",1,1,87585,Ewoks,"zChirpa Elder zPaploo Teebo G9, Scout",1
"Jordan Halaren",0,1,100570,BH,"zBossk zZam IG-88 Boba zGreedo",1
"Jordan Halaren",1,0,79308,501st,"Rex ARC Trooper G8, Echo (501st), zFives Ahsoka",1
"Jordan Halaren",0,1,75036,FO,"zKRU Kylo FOO G8, FOE Phasma G8",1
"Jordan Halaren",0,1,73574,Phoenix,"Hera G9, Kanan G8, Zeb G8, zEzra Chopper G8",1
"Jordan Halaren",,,355505,HansMF,"Home One, Han's MF, HT Bistan's U-wing 3*, Phantom 5* Biggs X-wing, Cassian's U-wing, Wedge X-wing",0
"Jordan Halaren",1,1,70754,NS,"MT 5* G8, zzAV Daka G9, Zombie 6* Spirit G8",0
"Jordan Halaren",,,72859,Nute-OR,"zNute zDooku Jango 6* G7, Zaalbar G7, Mission G8",0
"Jordan Halaren",1,1,82182,zEP,"zEP zzzVader Tarkin G8, Sion 3* G7, DN 5* G8",0
"Jordan Halaren",1,0,49019,Thragma (Counter),"Thrawn G8, Magma G8, DT 5* G8, Stormtrooper G8, Shoretrooper 5* G8",0
"Jordan Halaren",1,1,51395,Rogue1,"Jyn 6* G8, Chirrut 5* G9, Baze 5* G8, Cassian G9, K-2SO G8",0
"Jordan Halaren",1,0,7999,NestSolo (Counter),"Nest 3* G7",0
"Sonny",0,1,117368,DR,"zzzDR zHK-47 zBSF Sith Empire Trooper, Sith Assassin",1
"Sonny",0,1,84031,Geonosians,"zGBA Sun Fac G9, Geo Soldier, Geo Spy, Poggle",1
"Sonny",1,0,96981,ShaakClones,"zShaak Ti, Rex zEcho (501st), zFives ARC Trooper",1
"Sonny",0,1,101192,BH,"zBossk The Mandalorian, Fennec Shand, zBoba Greef",1
"Sonny",0,1,77200,Grievous,"GG G9, B2 G9, MagnaGuard G8, Dooku T3-M4",0
"Sonny",1,1,77582,Carth,"zCarth Onasi, Mission G8, Zaalbar 5* G8, Juhani Canderous",0
"Sonny",1,1,82595,zEP,"EP G9, zVader Tarkin DT TFP G9",0
"Sonny",1,0,72926,Wiggs,"Wedge G7, Biggs G6, CLS Han Chewbacca",0
"Sonny",1,0,65485,Troopers,"Veers 5* G8, Starck G7, Shoretrooper 6* zIden Versio 6*, Stormtrooper",0
"Sonny",0,1,63656,BH,"Jango G9, Zam G9, Cad G7, IG-88 G8, Nest 6* G6",0
"Sonny",0,1,62005,Phoenix,"Hera G7, Kanan G8, Zeb G7, Ezra G8, Chopper G7",0
"Sonny",0,1,94008,BS,"BS GMY zJKA GK zAhsoka",0
"Special D",0,1,57061,Phoenix,"Hera G8, Kanan G8, Zeb G8, Ezra G9, Chopper G7",0
"Special D",0,1,108855,BH,"zJango zThe Mandalorian, Cad 6* G8, Boba zzGreef",0
"Sharper",0,1,104488,DR,"zzzDR HK-47 zBSF Sith Empire Trooper, Thrawn",1
"Sharper",0,1,90844,Geonosians,"zzGBA Sun Fac, Geo Soldier, Geo Spy, Poggle",1
"Sharper",1,1,141053,Revan,"zzzJKR zBS zzGMY zJolee zGK",1
"Sharper",1,1,82343,Carth,"Carth Onasi, Mission G9, Zaalbar Juhani Canderous",1
"Sharper",0,1,94815,BH,"zzBossk Cad Jango Boba G9, Greef",1
"Sharper",1,1,108576,zEP,"zzEP zzzVader Tarkin TFP G8, zMara Jade, The Emperor's Hand",1
"Sharper",0,1,80902,Phoenix,"Hera Kanan Zeb Ezra Chopper",1
"Sharper",,,69271,Phasma,"Phasma G8, FOE FOO KRU G8, Kylo G8",0
"Sharper",,,263854,HansMF,"Home One, Han's MF 5*, HT 5* Ghost Phantom Biggs X-wing 6*, Cassian's U-wing, Wedge X-wing 6*",0
"Sharper",0,1,64214,Grievous,"GG G9, B2 5* G8, MagnaGuard G8, IG-88 T3-M4",0
"Sharper",1,1,46689,NS_Alt,"MT 6* G8, AV G8, Daka G9, Talia 6* G8, Spirit 6* G8",0
"Sharper",1,0,75614,ShaakClones,"Shaak Ti, Rex Echo (501st) G8, Fives G9, ARC Trooper G8",0
"Sharper",1,1,81586,Ewoks,"Chirpa Elder Paploo Teebo Scout",0
"Sharper",1,0,62597,Wiggs,"Wedge 6* G8, Biggs G8, CLS Fulcrum G9, Leia G8",0
"Sharper",1,0,70498,Troopers,"Veers Starck Gideon 5* Dark Trooper 5* G9, Snowtrooper G9",0
