Player,Offense,Defense,GP,Name,Squad,Viable
"Edd Vadah",,,57171,Phasma,"Phasma G8, FOTP FOSFTP FOST 4* Kylo G7",0
"Edd Vadah",1,0,61794,Troopers,"Veers Piett 5* G9, Gideon G9, Dark Trooper 6*, Range Trooper 5*",0
"Itzcoatl",0,1,35772,BS,"BS 5* G8, GMY 5* G8, Ahsoka 6* G8, Old Ben 6* G7, Ezra G7",0
"Peachy",,,32609,Phasma,"Phasma 5* G8, FOE 5* G8, FOO 5* G8, KRU 5* G8, Kylo 5* G8",0
"Peachy",1,1,33161,NS_Alt,"MT 5* G8, AV 5* G8, Daka 5* G8, Spirit 5* G8, Talia 5* G8",0
"Peachy",1,1,42718,zEP,"EP Vader 5* G8, Tarkin 5* G8, Dooku 5* G8, DN 5* G8",0
"Peachy",1,0,37277,501st,"Rex 5* G8, Clone Sergeant 5* G8, Echo (501st) 5* G8, Fives 5* G8, Ahsoka G9",0
"Peachy",1,0,37172,Wiggs,"Wedge 5* G8, Biggs 5* G8, Leia G9, Chirrut 5* G8, Baze 5* G8",0
"Peachy",0,1,36343,Phoenix,"Hera 5* G8, Sabine 5* G8, Ezra 6* G9, Kanan 6* G8, Zeb 5* G8",0
"PolarBear",0,1,83955,Geonosians,"GBA Sun Fac, Geo Soldier, Geo Spy, Poggle",1
"PolarBear",1,0,132267,Troopers,"zVeers zzPiett zzGideon zDark Trooper, Range Trooper",1
"PolarBear",,,97174,Iden Troopers,"zIden Versio, zStormtrooper Snowtrooper Magma zDT",1
"PolarBear",,,32609,Phasma,"Phasma 5* G8, FOE 5* G8, FOO 5* G8, KRU 5* G8, Kylo 5* G8",0
"PolarBear",,,48482,Admiral Raddus,"Admiral Raddus 3* G8, Cassian G9, Jyn 6* G8, K-2SO G8, Chirrut 5* G8",0
"PolarBear",1,0,76178,CLS,"CLS Han Chewbacca G9, R2-D2 Chewpio 5* G9",0
"PolarBear",,,213274,HansMF,"Home One 6*, Han's MF 6*, Rebel Y-wing 5*, Bistan's U-wing 6*, Phantom 6* Biggs X-wing, Cassian's U-wing, Wedge X-wing",0
"PolarBear",,,59000,Nute-OR,"Nute G8, Dooku 5* G8, zJango Zaalbar 5* Mission 5* G8",0
"PolarBear",,,67307,Mon Mothma,"zMon Mothma 5* G9, Kyle Katarn G9, Cara Dune, Pao G9, Hoth Rebel Scout G9",0
"PolarBear",1,1,40160,NS_Alt,"MT 5* G8, AV G8, Daka G9, Spirit 5* G8, Talia 5* G8",0
"PolarBear",0,1,88933,BH,"Bossk The Mandalorian, Greef Boba IG-88",0
"PolarBear",1,0,53227,501st,"Rex G8, Clone Sergeant G8, Echo (501st) G8, Fives G9, Ahsoka G8",0
"PolarBear",1,0,63960,Wiggs,"Wedge G8, Biggs G8, zFulcrum Ezra 5* G8, Leia G9",0
"PolarBear",0,1,40644,Phoenix,"Hera 5* G8, Sabine 5* G8, Kanan G8, Zeb G8, Chopper 6* G8",0
"PolarBear",0,1,65580,BS,"BS 6* GMY G8, zJolee 5* Old Ben G9, JKA G8",0
"DarthShade",0,1,46938,Geonosians,"GBA 4* G8, Sun Fac G8, Geo Soldier G9, Geo Spy G9, Poggle G7",0
"DarthShade",1,1,76192,zEP,"EP zVader Tarkin DT G8, TFP",0
"DarthShade",0,1,77614,BS,"BS GMY JKA Old Ben G9, Ahsoka",0
"The World Champ",0,1,93882,BH,"zzBossk Boba Cad G8, IG-88 Jango",1
"The World Champ",0,1,67061,Phoenix,"Hera G9, Ezra Kanan G8, Zeb G8, Chopper G8",1
"The World Champ",,,50203,Phasma,"Phasma G8, FOE G8, FOO G8, KRU G8, Kylo G8",0
"The World Champ",0,1,65976,Geonosians,"GBA G8, Sun Fac G7, Geo Soldier G8, Geo Spy G8, Poggle G8",0
"The World Champ",1,1,33161,NS_Alt,"MT 5* G8, AV 5* G8, Daka 5* G8, Spirit 5* G8, Talia 5* G8",0
"The World Champ",1,1,83869,zEP,"zEP zVader Tarkin TFP 6* G8, Mara Jade, The Emperor's Hand",0
"The World Champ",1,0,46144,501st,"Rex G8, Clone Sergeant 5* G8, Echo (501st) G8, Fives G8, Ahsoka G8",0
"The World Champ",1,0,58739,Wiggs,"Wedge 5* G8, Biggs 5* G8, CLS Chewbacca 6* G9, Leia",0
"The World Champ",1,1,33713,Rogue1,"Jyn 5* G8, Chirrut 5* G8, Baze 5* G8, Cassian 5* G8, K-2SO 5* G8",0
"Chaotik",0,1,77555,Phoenix,"Hera zSabine Kanan Zeb G8, Chopper G8",1
"Chaotik",1,1,67607,zEP,"EP Vader G8, Tarkin G9, Dooku 6* G8, zMara Jade, The Emperor's Hand",0
"Chaotik",1,0,54292,501st,"Rex G7, Clone Sergeant G8, Echo (501st) G7, Fives Ahsoka G8",0
"RichmalTheReborn",0,1,67808,Phoenix,"Hera Ezra Kanan Zeb Chopper",1
"allidrA",,,172277,JMK,"zzzzzzJMK zAhsoka zzzCAT zzzzGAS zGK",1
"allidrA",,,170130,SEE,"zzzzzzSEE zBSF zzMalak zzzDR zzzVader",1
"allidrA",,,574816,Executor,"Executor HT RC Xanadu Blood, Slave I, IG-2000 Imperial TIE Fighter, Tie Adv",1
"allidrA",1,0,146235,CLS,"zzzCLS zHan zzChewbacca zC-3PO zChewpio",1
"allidrA",,,519282,Negotiator,"Negotiator BTL-B Y-wing, Anakin's Eta-2, Rex's ARC-170, Umbaran SF, Ahsoka's SF, Plo's SF, Clone Sergeant's ARC-170",1
"allidrA",,,340654,Malevolence,"Malevolence Hyena Bomber, Vulture Droid, Sun Fac SF, Soldier SF, Spy SF",1
"allidrA",,,141532,JKL,"zzJKL zzzJKR zzHYoda zzOld Ben, Aayla",1
"allidrA",,,413105,HansMF,"Home One, Han's MF, Rebel Y-wing, Ghost Phantom Biggs X-wing, Cassian's U-wing, Wedge X-wing",1
"allidrA",0,1,117630,Geonosians,"zzGBA Sun Fac, Geo Soldier, Geo Spy, Poggle",1
"allidrA",0,1,135131,Grievous,"zzGG zB2 zB1 zMagnaGuard zNute",1
"allidrA",1,0,133310,Traya,"zzTraya zDN zSion Sith Empire Trooper, zzThrawn",1
"allidrA",1,0,142176,Troopers,"zVeers zzPiett zzGideon zDark Trooper, Range Trooper",1
"allidrA",1,0,146576,ShaakClones,"zzShaak Ti, zRex zEcho (501st), zzFives zARC Trooper",1
"allidrA",1,1,87675,Ewoks,"zChirpa Elder zPaploo Scout zLogray",1
"allidrA",0,1,148104,BH,"zzBossk zBoba zDengar zZam zJango",1
"allidrA",,,115189,Iden Troopers,"zIden Versio, zStormtrooper Snowtrooper Magma DT",1
"allidrA",0,1,101485,FO,"zzKRU zKylo zFOST FOO FOE",1
"allidrA",1,0,109592,Wiggs,"Wedge Biggs zFulcrum zEzra zLeia",1
"allidrA",1,0,134196,zMaul,"zDarth Maul, zDooku zSidious zSavage Sith Marauder",1
"allidrA",1,0,130859,EP (Counter, Rebel),"zzEP Shoretrooper Krennic zzWampa zStarck",1
"allidrA",1,0,13930,NestSolo (Counter),"Nest G8",1
"allidrA",1,1,97640,NS_Alt,"zzMT zzAV zDaka Talia G8, Zombie",0
"allidrA",,,94650,Mon Mothma,"zzMon Mothma G9, K-2SO G7, zKyle Katarn, Lando Jyn G8",0
"allidrA",1,1,86466,Carth,"zCarth Onasi, zMission zZaalbar Juhani G7, Canderous",0
"Captainblinx",,,173564,JMK,"zzzzzzJMK zAhsoka zzzCAT zJKA zGK",1
"Captainblinx",,,177953,SEE,"zzzzzzSEE zBSF zzMalak zzzDR zzzVader",1
"Captainblinx",,,552991,Executor,"Executor 6* HT RC Xanadu Blood, Slave I, IG-2000 Imperial TIE Fighter, Tie Adv",1
"Captainblinx",,,177756,JMLS,"zzzJKR zzJKL zzzzzzJMLS zWat Tambor, zzzzGAS",1
"Captainblinx",1,0,145423,CLS,"zzzCLS zHan zzChewbacca zzC-3PO zChewpio",1
"Captainblinx",,,384382,HansMF,"Home One, Han's MF, Rebel Y-wing 6*, Ghost Phantom Biggs X-wing, Cassian's U-wing, Wedge X-wing",1
"Captainblinx",0,1,99472,Geonosians,"zzGBA Sun Fac, Geo Soldier, Geo Spy, Poggle",1
"Captainblinx",0,1,118223,Grievous,"zzGG zB2 zB1 zDroideka MagnaGuard",1
"Captainblinx",,,107303,Mon Mothma,"zzMon Mothma, Wedge Cara Dune, Lando Biggs",1
"Captainblinx",1,1,85746,Ewoks,"zChirpa Elder zPaploo G9, zWicket zLogray",1
"Captainblinx",1,0,136654,ShaakClones,"zzShaak Ti, zRex zEcho (501st), zzFives zARC Trooper",1
"Captainblinx",0,1,137263,BH,"zzBossk zBoba Dengar IG-88 Jango",1
"Captainblinx",1,0,110158,Troopers,"zVeers Starck zzPiett DT Gideon",1
"Captainblinx",0,1,69119,Phoenix,"Hera G8, Ezra Kanan G8, Zeb G8, Chopper G9",1
"Captainblinx",0,1,140410,BS,"zBS zGMY zJolee zOld Ben, zzHYoda",1
"Captainblinx",1,0,107073,EP (Counter, Rebel),"zEP Shoretrooper G8, Krennic zzWampa zNest",1
"Captainblinx",,,66365,Phasma,"Phasma G8, FOE G9, FOO KRU G8, Kylo G9",0
"Captainblinx",,,468717,Negotiator,"Negotiator BTL-B Y-wing 4*, Anakin's Eta-2, Rex's ARC-170 4*, Umbaran SF, Ahsoka's SF, Plo's SF, Clone Sergeant's ARC-170",0
"Captainblinx",,,286842,Malevolence,"Malevolence Hyena Bomber 4*, Vulture Droid 5*, Sun Fac SF, Soldier SF, Spy SF",0
"Captainblinx",1,1,68189,NS,"MT G8, zAV Daka Zombie 6* G8, Spirit G8",0
"Captainblinx",1,0,85629,Traya,"zTraya G9, DN G8, Sion 6* G9, Sith Empire Trooper, Thrawn",0
"Captainblinx",1,1,97671,JTR,"JTR Scav Rey, BB-8 G7, zR2-D2 Finn G8",0
"Captainblinx",1,1,82847,Carth,"zCarth Onasi, Mission zZaalbar Juhani Canderous G7",0
"Captainblinx",1,1,48900,Rogue1,"Jyn 6* G8, Chirrut 5* G8, Baze 6* G8, Cassian G8, K-2SO G8",0
"Captainblinx",,,71205,Bad Batch,"zHunter Echo 5* G9, Omega 5* G8, Tech zWrecker G8",0
"Captainblinx",1,0,53885,Jawas,"Nebit G5, Jawa Engineer G5, Jawa Scavenger G5, Jawa G5, Dathcha G5",0
"Grant1913",0,1,63842,Phoenix,"Hera Ezra Kanan G9, Zeb G8, Chopper G8",1
"Grant1913",,,68383,Phasma,"Phasma G7, zFOTP FOSFTP G9, KRU Kylo G9",0
"Grant1913",0,1,71044,BH,"Bossk 5* The Mandalorian G8, Greef Boba G8, Jango 5* G9",0
"Oberon Calad",1,1,95648,Revan Offense,"zzJKR zGMY BS Jolee JKA",1
"Oberon Calad",0,1,68543,Phoenix,"Hera Sabine G8, Ezra G9, Kanan G8, Zeb G8",1
"Oberon Calad",1,0,91152,Wiggs,"Wedge Biggs zCLS zFulcrum zLeia",1
"Oberon Calad",,,67542,Phasma,"Phasma FOTP G9, FOO KRU G8, Kylo G9",0
"Oberon Calad",,,292374,HansMF,"Home One 6*, Han's MF 5*, HT Bistan's U-wing 4*, Phantom 6* Biggs X-wing, Cassian's U-wing 5*, Wedge X-wing",0
"Oberon Calad",0,1,73164,Geonosians,"GBA Sun Fac G8, Geo Soldier, Geo Spy G8, Poggle",0
"Oberon Calad",1,1,39793,NS_Alt,"MT 5* G8, AV 5* G9, Daka G8, Spirit 5* G8, Talia 6* G8",0
"Oberon Calad",1,1,100979,zEP,"zEP zVader Tarkin G9, zDT TFP",0
"Oberon Calad",0,1,78079,BH,"Bossk 5* Boba Cad G8, IG-88 G9, Jango 6*",0
"Oberon Calad",1,0,60244,501st,"Rex Clone Sergeant G8, Echo (501st) 5* G8, Fives Ahsoka",0
"Oberon Calad",1,1,86475,Rogue1,"zzJyn Chirrut Baze 6* zCassian K-2SO G9",0
"Oberon Calad",1,0,52336,Jawas,"Nebit G7, Jawa Engineer 5* G8, Jawa Scavenger G7, Jawa 6* G9, Dathcha G8",0
"Nitz",,,176673,JMK,"zzzzzzJMK zAhsoka zzzCAT zzzMace zGK",1
"Nitz",,,124790,Phasma,"zPhasma zFOTP FOSFTP zFOST zKylo",1
"Nitz",1,1,161757,SL Kylo,"zzzzzzSL Kylo, zSith Trooper, zHux zzKRU zzThrawn",1
"Nitz",1,1,136701,NS,"zzMT zzAV zDaka Zombie Spirit",1
"Nitz",,,178534,JMLS,"zzzJKR zzJKL zzzzzzJMLS zWat Tambor, zzzzGAS",1
"Nitz",1,0,151322,CLS,"zzzCLS zHan zzChewbacca zzC-3PO zChewpio",1
"Nitz",0,1,120551,DRMalak,"zzzDR zHK-47 zBSF zzMalak Sith Assassin G8",1
"Nitz",,,528729,Negotiator,"Negotiator HT Anakin's Eta-2, Umbaran SF, Ahsoka's SF, BTL-B Y-wing 6*, Clone Sergeant's ARC-170, Plo's SF",1
"Nitz",,,372157,Malevolence,"Malevolence Hyena Bomber, Vulture Droid, Sun Fac SF, Soldier SF, Spy SF",1
"Nitz",,,426150,HansMF,"Home One, Han's MF, Rebel Y-wing, Bistan's U-wing, Phantom Biggs X-wing, Cassian's U-wing, Wedge X-wing",1
"Nitz",0,1,133803,Geonosians,"zzGBA Sun Fac, Geo Soldier, Geo Spy, Poggle",1
"Nitz",0,1,127925,Grievous,"zzGG zB2 zB1 MagnaGuard zNute",1
"Nitz",1,1,126509,JTR,"zzzJTR Scav Rey, zzBB-8 zzR2-D2 Finn G8",1
"Nitz",1,0,125717,Traya,"zzTraya zDN zSion zzEP zNest",1
"Nitz",,,111082,Mon Mothma,"zzMon Mothma, Wedge zCara Dune, Lando Biggs",1
"Nitz",1,1,82728,Ewoks,"zChirpa G9, Elder Paploo Wicket G8, zLogray",1
"Nitz",1,0,154958,ShaakClones,"zzShaak Ti, zRex zEcho (501st), zzFives zARC Trooper",1
"Nitz",0,1,150670,BH,"zzBossk zBoba Cad zDengar zzJango",1
"Nitz",1,1,85803,Carth,"zCarth Onasi, Mission G8, zZaalbar zJuhani Canderous G8",1
"Nitz",1,0,119427,Troopers,"zVeers zStarck zDark Trooper, zzPiett zGideon",1
"Nitz",0,1,97767,Phoenix,"zHera G8, zSabine zEzra zKanan zZeb G8",1
"Nitz",1,0,112313,zMaul,"zDarth Maul, zDooku zSidious zSavage Sith Marauder",1
"Nitz",0,1,149771,BS,"zBS zzGMY zJolee zzOld Ben, zzHYoda",1
"Nitz",1,0,72688,Jawas,"Nebit G8, Jawa Engineer, Jawa Scavenger, Jawa G9, Dathcha G9",1
"Nitz",,,65384,Admiral Raddus,"zzAdmiral Raddus 4* G8, Cassian G7, Jyn G7, K-2SO G8, Bistan G8",0
"Nitz",,,68233,Iden Troopers,"zIden Versio 3* G8, Shoretrooper G9, Snowtrooper Magma G8, DT G8",0
"Nitz",,,87261,Bad Batch,"zHunter G9, zEcho 6* zzOmega G8, zTech zWrecker G9",0
"HahalolXD",0,1,49158,Phoenix,"Hera G7, Ezra G7, Kanan G7, Zeb 6* G7, Chopper G7",0
"Force Horse",,,57253,Phasma,"Phasma G7, FOTP 5* G9, FOSFTP G9, KRU G9, Kylo G9",0
"Force Horse",1,0,41970,Troopers,"Veers 5* G8, Piett 5* G8, Gideon G7, Dark Trooper 5* G9, Range Trooper 5* G8",0
"Analyst",,,32609,Phasma,"Phasma 5* G8, FOE 5* G8, FOO 5* G8, KRU 5* G8, Kylo 5* G8",0
"Analyst",0,1,62913,Geonosians,"zGBA Sun Fac G8, Geo Soldier, Geo Spy G8, Poggle G9",0
"Analyst",1,1,33161,NS_Alt,"MT 5* G8, AV 5* G8, Daka 5* G8, Spirit 5* G8, Talia 5* G8",0
"Analyst",1,1,60621,zEP,"EP 5* zVader Tarkin Dooku 5* G8, TFP 6* G8",0
"Analyst",0,1,76486,BH,"Bossk 6* Boba Cad G9, Dengar 4* IG-88",0
"Analyst",1,0,36296,501st,"Rex 5* G8, Clone Sergeant 5* G8, Echo (501st) 5* G8, Fives 5* G8, Ahsoka G8",0
"Analyst",0,1,55761,Phoenix,"Hera G9, Ezra 6* G8, Kanan G8, Zeb G8, Chopper G8",0
"Analyst",1,0,33161,Wiggs,"Wedge 5* G8, Biggs 5* G8, Leia 5* G8, Chirrut 5* G8, Baze 5* G8",0
"Sans",,,36473,Phasma,"Phasma 5* G8, FOE 5* G8, FOO 5* G8, KRU 5* G8, Kylo G9",0
"Sans",0,1,64829,Grievous,"GG B2 G9, B1 2* Droideka 6* G9, Dooku 6* G9",0
"Sans",1,1,34301,NS_Alt,"MT 5* G8, AV 5* G8, Daka 5* G8, Spirit 5* G8, Talia 6* G8",0
"Sans",1,1,83482,zEP,"zzEP zzVader Tarkin Sion 5* G9, DN 5*",0
"Sans",1,0,73911,501st,"Rex ARC Trooper, Echo (501st), Fives Ahsoka G8",0
"Sans",1,0,73181,Wiggs,"Wedge 5* G8, Biggs 5* G8, zzzCLS Fulcrum Leia G9",0
"Sans",1,1,33713,Rogue1,"Jyn 5* G8, Chirrut 5* G8, Baze 5* G8, Cassian 5* G8, K-2SO 5* G8",0
"Sans",0,1,33814,Phoenix,"Hera 5* G8, Ezra 5* G8, Kanan 5* G8, Zeb 5* G8, Chopper 5* G8",0
"Nitz'd",0,1,141716,padme,"zzPadme zGK zJKA zAhsoka zC-3PO",1
"Nitz'd",,,464429,Negotiator,"Negotiator HT Anakin's Eta-2, Umbaran SF, Ahsoka's SF, Clone Sergeant's ARC-170, Jedi Consular's Starfighter, Plo's SF",1
"Nitz'd",0,1,107528,Geonosians,"zzGBA Sun Fac, Geo Soldier, Geo Spy, Poggle",1
"Nitz'd",0,1,110129,Grievous,"zzGG zB2 zB1 Droideka MagnaGuard",1
"Nitz'd",1,1,147124,GAS,"zzzzGAS zRex zEcho (501st), zzFives zARC Trooper",1
"Nitz'd",1,1,106391,Revan Offense,"zzzJKR zGMY zHYoda zJolee Ezra",1
"Nitz'd",1,1,83346,Ewoks,"zChirpa Elder Paploo Wicket Logray",1
"Nitz'd",0,1,102762,BH,"zzBossk The Mandalorian, Boba Zam Jango",1
"Nitz'd",1,1,112103,zEP,"zzEP zzzVader Tarkin zTraya G9, zMara Jade, The Emperor's Hand 6*",1
"Nitz'd",0,1,67376,Phoenix,"Hera G8, Sabine G8, Kanan G8, Zeb G8, Chopper",1
"Nitz'd",,,67935,Phasma,"Phasma G8, FOE FOSFTP G7, KRU Kylo G9",0
"Nitz'd",1,0,81536,CLS,"zCLS Han Chewbacca R2-D2 zChewpio 4* G8",0
"Nitz'd",1,1,93584,NS_Alt,"zMT G9, Acolyte Daka zAV Zombie",0
"Nitz'd",1,0,83610,Troopers,"zVeers Starck G8, zDark Trooper, zPiett 5* G8, zGideon",0
"Nitz'd",1,0,8620,SionSolo (Counter),"Sion 3* G7",0
"Chiss Ascendancy",0,1,44224,Phoenix,"Hera G8, Ezra G7, Kanan G7, Zeb G7, Chopper G6",0
"Sylph",0,1,64799,Phoenix,"Hera G9, Ezra G9, Kanan G9, Zeb G9, Chopper G9",1
"Babynotgood",,,33328,Phasma,"Phasma 5* G8, FOE 5* G8, FOO 5* G8, KRU 5* G8, Kylo 5* G8",0
"Babynotgood",1,1,33161,NS_Alt,"MT 5* G8, AV 5* G8, Daka 5* G8, Spirit 5* G8, Talia 5* G8",0
"Babynotgood",0,1,41443,BH,"Bossk 3* Greedo 5* G8, Boba 5* G8, Cad 5* G8, IG-88 5* G8",0
"Babynotgood",1,0,36626,501st,"Rex 5* G8, Clone Sergeant 5* G8, Echo (501st) 5* G8, Fives 5* G8, Ahsoka 6*",0
"Babynotgood",1,0,33161,Wiggs,"Wedge 5* G8, Biggs 5* G8, Leia 5* G8, Chirrut 5* G8, Baze 5* G8",0
"Babynotgood",0,1,32885,Phoenix,"Hera 5* G8, Sabine 5* G8, Ezra 5* G8, Zeb 5* G8, Chopper 5* G8",0
"Zamp",0,1,59389,Phoenix,"Hera G9, Ezra G9, Kanan G9, Zeb G9, Chopper G9",1
"Zamp",1,0,54032,Troopers,"Veers 6* G9, Piett 5* G9, Gideon G9, Dark Trooper 6* G9, Range Trooper 6* G9",0
"lolxd",0,1,80749,Geonosians,"zGBA Sun Fac, Geo Soldier, Geo Spy, Poggle",1
"lolxd",0,1,62446,Phoenix,"Hera Ezra Kanan G9, Zeb G8, Chopper G9",1
"lolxd",0,1,64912,BS,"BS 5* GMY G9, JKA Old Ben G9, Ahsoka G8",0
"HostileHunter",0,1,73338,Phoenix,"Hera Ezra Kanan G9, Zeb Chopper",1
"HostileHunter",,,76458,Phasma,"Phasma FOE G9, FOO KRU Kylo G9",0
"HostileHunter",1,1,35030,NS_Alt,"MT 5* G8, AV 5* G8, Daka 6* G9, Spirit 5* G8, Talia 5* G8",0
"HostileHunter",1,1,65680,zEP,"EP zVader Tarkin TFP G8, DN 5* G8",0
"HostileHunter",1,0,36751,501st,"Rex 5* G8, Clone Sergeant 5* G8, Echo (501st) 5* G8, Fives 5* G8, Ahsoka G8",0
"HostileHunter",1,0,39772,Wiggs,"Wedge 5* G8, Biggs 5* G8, Leia G9, Chirrut 5* G8, Baze 5* G8",0
"Fallen",0,1,116357,DRMalak,"zzzDR HK-47 zBSF zzMalak Sith Empire Trooper",1
"Fallen",1,1,98699,Revan Offense,"zzJKR GMY BS Jolee JKA",1
"Fallen",1,1,85159,Carth,"Carth Onasi, Mission Zaalbar Juhani Canderous",1
"Fallen",1,0,78155,CLS,"zzzCLS Han Chewbacca 6* G9, R2-D2 G7, C-3PO 6* G8",0
"Fallen",0,1,61049,Grievous,"GG B2 G7, Dooku G7, IG-88 G8, T3-M4 G7",0
"Fallen",1,0,78508,ShaakClones,"Shaak Ti 5* G9, Rex Echo (501st), zzFives Clone Sergeant G8",0
"Fallen",1,0,62338,Wiggs,"Wedge G8, Biggs G8, Fulcrum G9, Ezra G7, Leia G7",0
"Fallen",0,1,47498,Phoenix,"Hera G8, Sabine 4* G7, Kanan G7, Zeb G7, Chopper G7",0
"Fallen",1,0,62413,Jawas,"Nebit Jawa Engineer G8, Jawa Scavenger G7, Jawa G9, Dathcha",0
"VoidedSouls24",1,0,95280,Troopers,"zVeers zzPiett Gideon zDark Trooper, Range Trooper",1
"VoidedSouls24",1,1,95514,Revan,"zzJKR BS GMY zJolee GK",1
"VoidedSouls24",1,0,88491,ShaakClones,"zShaak Ti 6* G9, Rex Echo (501st), zFives zARC Trooper",1
"VoidedSouls24",,,77436,Iden Troopers,"zIden Versio, Stormtrooper G9, Snowtrooper G9, Magma DT",1
"VoidedSouls24",0,1,72793,Phoenix,"Hera G9, Sabine zEzra G9, Kanan G9, Zeb G8",1
"VoidedSouls24",0,1,85243,FO,"zKRU zKylo zSith Trooper G9, zHux FOST G9",1
"VoidedSouls24",1,0,108203,CLS,"zzzCLS zHan zzChewbacca R2-D2 G7, zChewpio",0
"VoidedSouls24",0,1,66383,Geonosians,"GBA Sun Fac G8, Geo Soldier, Geo Spy G9, Poggle",0
"VoidedSouls24",0,1,39237,Grievous,"GG 4* G9, B2 6* G8, B1 5* G7, MagnaGuard G7, Nute 6* G6",0
"VoidedSouls24",,,80250,Disintegration,"Aurra 6* G9, Greef Boba Bossk zThe Mandalorian",0
"VoidedSouls24",,,65407,Mon Mothma,"zMon Mothma 5* G9, Kyle Katarn G9, zCara Dune 5*, Pao G9, Hoth Rebel Scout",0
"VoidedSouls24",,,75575,Bad Batch,"zHunter Echo G9, Omega 6* G8, zTech zWrecker G9",0
"znub",,,133055,Phasma,"zPhasma zFOTP FOE zzKRU zKylo",1
"znub",0,1,89199,Geonosians,"zGBA Sun Fac, Geo Soldier, Geo Spy, Poggle",1
"znub",0,1,99225,BH,"zBossk zThe Mandalorian, zBoba Cad Jango",1
"znub",0,1,66031,padme,"Padme G8, GK G8, JKA 6* G9, Ahsoka C-3PO 5* G7",0
"znub",1,0,85171,CLS,"zzCLS zHan zChewbacca R2-D2 G6, Chewpio 5* G7",0
"znub",1,0,69447,Traya,"zTraya 6* G9, DN 4* G8, Sion 5* G8, BSF 4* G8, zEP",0
"znub",1,1,76132,Ewoks,"zChirpa Elder zPaploo Teebo G9, Logray 5* G8",0
"znub",1,0,76892,Clones,"Cody G7, Rex Echo (501st) G9, zFives Clone Sergeant G8",0
"znub",1,0,58886,Troopers,"zVeers G7, Starck G6, zPiett 5* G7, Stormtrooper G7, zIden Versio 4* G8",0
"znub",,,61962,Bad Batch,"zHunter 5* Echo 4* G9, Omega 5* G7, Tech 5* zWrecker 5* G9",0
"znub",1,0,34419,ThrawnTroopers,"Thrawn 5* G6, Range Trooper 5* G6, DT 5* G7, Shoretrooper 6* G7, Snowtrooper G6",0
"znub",0,1,50740,Phoenix,"Hera G7, Ezra G7, Kanan G7, Zeb G7, Chopper G8",0
"Belrosa",0,1,50522,Phoenix,"Hera G8, Ezra G8, Kanan G8, Zeb G8, Chopper G8",0
"Mini Noah Boat",0,1,90148,Geonosians,"zGBA Sun Fac, Geo Soldier, Geo Spy, Poggle",1
"Mini Noah Boat",1,1,90770,Revan Offense,"zzJKR GMY BS G9, zJolee JKA",1
"Mini Noah Boat",0,1,66533,Phoenix,"Hera G9, Ezra Kanan G8, Zeb G8, Chopper G8",1
"Mini Noah Boat",0,1,56363,BH,"Jango Greedo 5* G7, Boba Zam G7, IG-88 G8",0
"Kenn Skirata",,,570511,Executor,"Executor HT RC Xanadu Blood, Slave I, IG-2000 Imperial TIE Fighter, Tie Adv",1
"Kenn Skirata",0,1,82026,Geonosians,"GBA Sun Fac, Geo Soldier, Geo Spy, Poggle",1
"Kenn Skirata",0,1,148870,BH,"zzBossk zzGreef zBoba Dengar zzJango",1
"Kenn Skirata",1,1,130031,zEP,"zzEP zzzVader Tarkin TFP BSF",1
"Kenn Skirata",0,1,66295,Phoenix,"Hera G8, Sabine Ezra G8, Kanan G8, Zeb G8",1
"Kenn Skirata",0,1,116151,padme,"zzPadme zGK JKA zAhsoka Fives",1
"Kenn Skirata",,,38879,Phasma,"Phasma G8, FOE 5* G8, FOO G8, KRU 5* G8, Kylo 5* G8",0
"Kenn Skirata",1,0,64857,CLS,"zCLS Han G8, Chewbacca G7, R2-D2 G8, Chewpio G8",0
"Kenn Skirata",,,244468,HansMF,"Home One, Han's MF, Biggs X-wing, Bistan's U-wing 5*, Phantom Ghost Cassian's U-wing, Wedge X-wing",0
"Kenn Skirata",1,1,46548,NS_Alt,"MT 6* G8, AV G8, Daka G8, Spirit G8, Talia 6* G8",0
"Kenn Skirata",1,1,69413,Carth,"Carth Onasi, Mission 5* G7, Zaalbar 5* G9, Juhani Canderous",0
"Kenn Skirata",1,0,83826,Troopers,"Veers 6* Starck G6, zzPiett DT G9, Iden Versio",0
"Kenn Skirata",1,1,50473,Rogue1,"Jyn G8, Chirrut 6* G8, Baze 6* G8, Cassian G8, K-2SO G8",0
"Alecblake123",,,185034,JMK,"zzzzzzJMK zAhsoka zzzCAT zzzzGAS zGK",1
"Alecblake123",,,170372,LV,"zzzzzzLord Vader, zzPiett zzzMaul zRG zzzVader",1
"Alecblake123",,,123076,Phasma,"zPhasma zFOTP FOSFTP zFOST zKylo",1
"Alecblake123",1,1,156897,SL Kylo,"zzzzzzSL Kylo, zSith Trooper, zHux zzKRU zzThrawn",1
"Alecblake123",,,163059,SEE,"zzzzzzSEE zBSF zzMalak zzzDR zDooku",1
"Alecblake123",1,1,161539,GL Rey,"zzzzzzRey zzzJTR zzBB-8 zRH Poe, zRH Finn",1
"Alecblake123",1,1,112091,NS,"zzMT zzAV zDaka Zombie Spirit",1
"Alecblake123",,,593240,Executor,"Executor HT RC Xanadu Blood, Slave I, IG-2000 Tie Adv, TIE Reaper",1
"Alecblake123",,,159576,JMLS,"zBS zzzzzzJMLS zWat Tambor, zzJKL zJolee",1
"Alecblake123",1,0,153471,CLS,"zzzCLS zHan zzChewbacca zzC-3PO zChewpio",1
"Alecblake123",,,524156,Negotiator,"Negotiator BTL-B Y-wing, Anakin's Eta-2, Rex's ARC-170, Umbaran SF, Ahsoka's SF, Plo's SF, Clone Sergeant's ARC-170",1
"Alecblake123",,,307524,Malevolence,"Malevolence Hyena Bomber, Vulture Droid, Sun Fac SF, Soldier SF, Spy SF",1
"Alecblake123",,,475145,HansMF,"Home One, Han's MF, Rebel Y-wing, Bistan's U-wing, Phantom Biggs X-wing, Cassian's U-wing, Wedge X-wing",1
"Alecblake123",0,1,93072,Geonosians,"zzGBA Sun Fac, Geo Soldier, Geo Spy, Poggle",1
"Alecblake123",0,1,140854,Grievous,"zzGG zB2 zB1 zMagnaGuard zNute",1
"Alecblake123",1,0,130413,Traya,"zzTraya zzDN zSion zzEP Sith Empire Trooper",1
"Alecblake123",,,108551,Mon Mothma,"zzMon Mothma, zCara Dune, Bistan zPao Hoth Rebel Scout",1
"Alecblake123",,,141584,Disintegration,"Aurra zzGreef zBoba zzBossk zzThe Mandalorian",1
"Alecblake123",1,1,86112,Ewoks,"zChirpa Elder Paploo G9, zWicket Logray G9",1
"Alecblake123",1,0,155216,ShaakClones,"zzShaak Ti, zRex zEcho (501st), zzFives zARC Trooper",1
"Alecblake123",1,1,92937,Carth,"zCarth Onasi, zMission zZaalbar zVandor Chewbacca G9, Canderous",1
"Alecblake123",0,1,151240,BH,"zzJango zDengar zZam zBoba Fett, Scion of Jango, zFennec Shand",1
"Alecblake123",1,0,124131,Troopers,"zVeers zStarck zDark Trooper, Shoretrooper zzGideon",1
"Alecblake123",0,1,85501,Phoenix,"Hera Sabine G8, zEzra Kanan G8, Zeb G8",1
"Alecblake123",1,1,111639,Rogue1,"zzJyn Chirrut Baze zCassian K-2SO G9",1
"Alecblake123",1,0,76282,Jawas,"Nebit G8, Jawa Engineer G9, Jawa Scavenger G8, Jawa Dathcha",1
"Alecblake123",1,0,68279,QiraNest,"zQira zNest zzHYoda",1
"Alecblake123",,,80504,Iden Troopers,"zIden Versio, Stormtrooper G8, Snowtrooper Magma G8, DT",0
"Alecblake123",,,117202,Bad Batch,"zHunter zEcho Omega G9, zTech zWrecker",0
"SlomoH2O jr",0,1,60403,Phoenix,"Hera G9, Ezra Kanan G8, Zeb G8, Chopper",1
"SlomoH2O jr",,,42247,Phasma,"Phasma G8, FOE 5* FOO 6* G8, FOST 5* G9, Kylo 5* G8",0
"SlomoH2O jr",1,1,33161,NS_Alt,"MT 5* G8, AV 5* G8, Daka 5* G8, Spirit 5* G8, Talia 5* G8",0
"SlomoH2O jr",1,1,65145,zEP,"EP zVader Tarkin 5* G8, DT 5* G9, zDN 5* G9",0
"SlomoH2O jr",1,0,33912,501st,"Rex 5* G8, Clone Sergeant 5* G8, Echo (501st) 5* G8, Fives 5* G8, Ahsoka 5* G8",0
"SlomoH2O jr",1,0,36511,Wiggs,"Wedge 5* G8, Biggs G8, Leia 5* G8, Chirrut 5* G8, Baze 5* G8",0
"TheRedNihba",0,1,47035,Phoenix,"Hera G8, Ezra G8, Kanan G8, Zeb G8, Chopper G8",0
"AvGPuD",0,1,55912,Phoenix,"Hera G9, Ezra G9, Kanan G9, Zeb G8, Chopper G9",1
"AvGPuD",0,1,55086,BS,"BS 6* G9, GMY G9, JKA G9, Old Ben G9, Ahsoka G7",0
"lnquisitor Saldag",0,1,54931,Phoenix,"Hera G8, Ezra G9, Kanan G8, Zeb G8, Chopper G8",0
"Hondo",0,1,70975,Phoenix,"Hera G9, Ezra G9, Kanan G9, Zeb G9, Chopper",1
"Hondo",0,1,71976,BS,"BS G9, GMY zJolee G9, Old Ben G9, JKA G9",0
"Ethan Owens",0,1,66234,Phoenix,"Hera G9, Ezra G9, Kanan G9, Zeb G8, Chopper G8",1
"Ethan Owens",0,1,89053,BS,"zBS GMY Jolee G8, Old Ben G8, zJKA",1
"Ethan Owens",,,65324,Phasma,"Phasma G9, FOTP G9, FOO KRU Kylo",0
"Ethan Owens",1,1,39770,NS_Alt,"MT 5* G8, AV Daka 5* G8, Spirit 5* G8, Talia 5* G8",0
"Ethan Owens",1,1,57980,zEP,"EP G8, zzzVader Tarkin G8, DT 5* G8, DN 5* G8",0
"Ethan Owens",1,0,51582,501st,"Rex G8, Clone Sergeant 5* G8, Echo (501st) 5* G8, Fives G9, Ahsoka",0
"Ethan Owens",1,0,52252,Wiggs,"Wedge 5* G8, Biggs 5* G8, CLS Fulcrum G8, Leia G8",0
"Ethan Owens",1,1,39528,Rogue1,"Jyn 6* G8, Chirrut G8, Baze 5* G8, Cassian 5* G8, K-2SO 5* G8",0
"Gonzaleez12",0,1,64867,Phoenix,"Hera G9, Ezra G9, Kanan G8, Zeb G8, Chopper G9",1
"Gonzaleez12",,,39881,Phasma,"Phasma 5* G8, FOE 5* G8, FOO 5* G8, KRU G9, Kylo 5* G8",0
"Gonzaleez12",1,1,33170,NS_Alt,"MT 5* G8, AV 5* G8, Daka 5* G8, Spirit 5* G8, Talia 5* G8",0
"Gonzaleez12",1,1,60473,zEP,"EP G8, zVader G9, Tarkin Dooku 5* G8, DN 5* G8",0
"Gonzaleez12",0,1,44626,BH,"Bossk 4* G8, Greedo 5* G8, Boba G8, Cad 5* G8, IG-88 5* G8",0
"Gonzaleez12",1,0,33170,501st,"Rex 5* G8, Clone Sergeant 5* G8, Echo (501st) 5* G8, Fives 5* G8, Ahsoka 5* G8",0
"Gonzaleez12",1,0,34817,Wiggs,"Wedge 5* G8, Biggs 5* G8, Leia 6* G8, Chirrut 5* G8, Baze 5* G8",0
