Player,Offense,Defense,GP,Name,Squad,Viable
"jorke",,,293259,Malevolence,"Malevolence Hyena Bomber 5*, Vulture Droid, Sun Fac SF, Soldier SF, Spy SF",0
"jorke",0,1,96181,Geonosians Omicron,"zzGBA Sun Fac, Geo Soldier, Geo Spy, Poggle",0
"jorke",,,421862,Executrix,"Executrix Tie Adv, Emperor's Shuttle 6*, TIE Reaper 6*, Imperial TIE Fighter, Gauntlet Starfighter, FOSF TIE Fighter, FO TIE Fighter",0
"jorke",0,1,91407,BH,"zJango Cad IG-88 Dengar Zam",0
"jorke",0,1,120852,BS,"BS zzGMY zJolee zzOld Ben, zzHYoda",0
"Noble Ruler",,,123260,Phasma,"zPhasma zFOTP FOSFTP zFOST zKylo",1
"Noble Ruler",1,1,157804,SL Kylo,"zzzzzzSL Kylo, zSith Trooper, zHux zzKRU zThrawn",1
"Noble Ruler",,,155264,JMLS,"zBS zzzzzzJMLS HYoda zzJKL zJolee",1
"Noble Ruler",1,0,142153,CLS,"zzzCLS zHan zzChewbacca zC-3PO zChewpio",1
"Noble Ruler",0,1,116471,padme,"zzPadme zGK JKA zAhsoka CW Chewbacca G8",1
"Noble Ruler",,,375846,HansMF,"Home One, Han's MF, Rebel Y-wing 6*, Bistan's U-wing, Phantom Biggs X-wing, Cassian's U-wing, Wedge X-wing",1
"Noble Ruler",,,459364,Negotiator,"Negotiator HT Anakin's Eta-2, Umbaran SF, Ahsoka's SF, Clone Sergeant's ARC-170, Plo's SF, Rex's ARC-170",1
"Noble Ruler",,,109134,Mon Mothma,"zzMon Mothma, Wedge Biggs Cara Dune, Lando",1
"Noble Ruler",1,1,103803,Ewoks,"zChirpa Elder zPaploo zWicket zLogray",1
"Noble Ruler",1,0,138329,ShaakClones,"zzShaak Ti, Rex zEcho (501st), zzFives zARC Trooper",1
"Noble Ruler",0,1,108110,BH,"zzBossk Cad zzThe Mandalorian, zBoba Dengar",1
"Noble Ruler",1,1,97762,Carth,"zCarth Onasi, zMission zZaalbar Juhani zCanderous",1
"Noble Ruler",1,1,119400,zEP,"zzEP zzzVader Tarkin TFP G9, zzMara Jade, The Emperor's Hand",1
"Noble Ruler",0,1,63125,Phoenix,"Hera G8, Kanan G8, Ezra G8, Sabine G8, Zeb G8",1
"Noble Ruler",1,1,60266,Rogue1,"Jyn G8, Chirrut G8, Baze G8, K-2SO G8, Cassian G9",1
"Noble Ruler",1,0,13510,SionSolo (Counter),"Sion G9",1
"Noble Ruler",,,109833,Grievous Omicron,"GG zB2 zB1 zMagnaGuard zDroideka",0
"Noble Ruler",0,1,109608,Geonosians Omicron,"zzGBA Sun Fac, Geo Soldier, Geo Spy, Poggle",0
"Noble Ruler",0,1,104212,DRMalak,"zzzDR zzHK-47 zBSF zMalak G8, Sith Empire Trooper 6*",0
"Noble Ruler",1,1,96221,JTR,"JTR zR2-D2 BB-8 G9, RH Finn 6* G8, RH Poe G9",0
"Noble Ruler",1,1,82314,NS,"MT G9, zzAV Daka Zombie G8, Spirit G9",0
"Noble Ruler",,,75766,Nute-Wat,"Nute G8, zDooku Wat Tambor G9, Jango G9, Nest G7",0
"Noble Ruler",1,0,55594,Troopers,"Veers Piett G8, Gideon G6, Dark Trooper 6* G7, Range Trooper 6* G8",0
"Noble Ruler",,,52944,Iden Troopers,"Iden Versio 4* G8, Stormtrooper G8, Snowtrooper G9, Magma G7, DT G9",0
"Noble Ruler",,,70712,Bad Batch,"Hunter G9, Echo G8, Omega G9, Tech G9, Wrecker G8",0
"Noble Ruler",1,0,57745,Jawas,"Nebit G8, Jawa Engineer G7, Jawa Scavenger G7, Jawa 6* G7, Dathcha G9",0
"dok",,,180536,JMK,"zzzzzzJMK zAhsoka zzzCAT zzzzGAS zGK",1
"dok",,,177234,LV,"zzzzzzLord Vader, zzPiett zzzVader zRG Tarkin",1
"dok",,,123076,Phasma,"zPhasma zFOTP FOSFTP zFOST zKylo",1
"dok",,,136963,SK,"zzEP zzMara Jade, The Emperor's Hand, zzStarkiller zJuhani zVisas",1
"dok",,,436931,Profundity,"Profundity Han's MF, Outrider Rebel Y-wing, Cassian's U-wing, Ghost",1
"dok",1,1,167448,SL Kylo,"zzzzzzSL Kylo, zSith Trooper, zHux zzKRU zzThrawn",1
"dok",,,168091,SEE,"zzzzzzSEE zBSF zzMalak zzzDR zDooku",1
"dok",1,1,168429,GL Rey,"zzzzzzRey zzzJTR zzR2-D2 zRH Poe, zRH Finn",1
"dok",,,167285,Jabba,"zzzzzzJabba zBoushh (Leia Organa), zSkiff Guard (Lando Calrissian), zKrrsantan zBoba",1
"dok",,,627852,Executor,"Executor HT RC Xanadu Blood, Slave I, IG-2000 Tie Adv, TIE Reaper",1
"dok",,,162716,JMLS,"zBS zzzzzzJMLS zWat Tambor, zzJKL zJolee",1
"dok",1,0,153283,CLS,"zzzCLS zHan zzChewbacca zzC-3PO zChewpio",1
"dok",1,1,112943,NestSisters,"zzAV zzMT zDaka Zombie zNest",1
"dok",,,508592,Negotiator,"Negotiator BTL-B Y-wing, Anakin's Eta-2, Rex's ARC-170, Umbaran SF, Ahsoka's SF, Plo's SF, Clone Sergeant's ARC-170",1
"dok",,,308804,Malevolence,"Malevolence Hyena Bomber, Vulture Droid, Sun Fac SF, Soldier SF, Spy SF",1
"dok",0,1,135152,Grievous,"zzGG zB2 zB1 zMagnaGuard zNute",1
"dok",1,0,102096,Traya,"zzTraya zzDN zSion Sith Assassin G8, Sith Empire Trooper",1
"dok",,,110827,Mon Mothma,"zzMon Mothma, Bistan Wedge Pao zCara Dune",1
"dok",1,1,87141,Ewoks,"zChirpa Elder zPaploo zWicket Logray",1
"dok",1,0,148818,ShaakClones,"zzShaak Ti, zRex zEcho (501st), zzFives zARC Trooper",1
"dok",0,1,151053,BH,"zzBossk zzJango Cad zDengar zZam",1
"dok",1,0,106693,Troopers,"zVeers zStarck zIden Versio, DT Shoretrooper",1
"dok",0,1,90918,Phoenix,"Hera Kanan zEzra zSabine Zeb G8",1
"dok",1,1,114171,Rogue1,"zzJyn Chirrut Baze K-2SO zCassian",1
"dok",1,0,80831,Jawas,"Nebit G8, Jawa Engineer G9, Jawa Scavenger G9, Jawa Dathcha",1
"dok",0,1,89780,Qira,"Qira zL3-37 Vandor Chewbacca G7, zMission zZaalbar",0
"dok",0,1,94180,Geonosians Omicron,"zzGBA Sun Fac, Geo Soldier, Geo Spy, Poggle",0
"dok",,,121587,Bad Batch,"zHunter zEcho zzOmega G9, zTech zWrecker",0
"JayChan",,,174552,JMK,"zzzzzJMK zAhsoka zzzCAT zzzGAS zGK",1
"JayChan",1,1,152521,SL Kylo,"zzzzSL Kylo, zSith Trooper, zHux zzKRU Thrawn",1
"JayChan",,,565326,Executor,"Executor 5* HT RC Xanadu Blood, Slave I, IG-2000 Imperial TIE Fighter, Tie Adv",1
"JayChan",1,0,157647,CLS,"zzzCLS zHan zzChewbacca zzC-3PO zChewpio",1
"JayChan",0,1,123761,DRMalak,"zzzDR HK-47 zBSF zzMalak Sith Empire Trooper",1
"JayChan",,,484418,Negotiator,"Negotiator BTL-B Y-wing, Anakin's Eta-2, Rex's ARC-170, Umbaran SF, Ahsoka's SF, Plo's SF, Clone Sergeant's ARC-170",1
"JayChan",,,308276,Malevolence,"Malevolence Hyena Bomber, Vulture Droid, Sun Fac SF, Soldier SF, Spy SF",1
"JayChan",,,138791,JKL,"zzJKL zzzJKR zHYoda zOld Ben, Aayla",1
"JayChan",,,452300,HansMF,"Home One, Han's MF, Rebel Y-wing, Bistan's U-wing, Phantom Biggs X-wing, Cassian's U-wing, Wedge X-wing",1
"JayChan",0,1,122356,Grievous,"zzGG zB2 zB1 MagnaGuard zNute",1
"JayChan",1,0,119334,Traya,"zzTraya DN Sion zDooku zzEP",1
"JayChan",1,0,113713,Troopers,"zVeers zzPiett zGideon Dark Trooper, Range Trooper",1
"JayChan",,,106999,Mon Mothma,"zzMon Mothma, Bistan Wedge Biggs Scarif",1
"JayChan",1,1,80524,Ewoks,"zChirpa G9, Elder Paploo Wicket Logray G9",1
"JayChan",1,0,125282,ShaakClones,"zzShaak Ti, Rex Echo (501st), zzFives Clone Sergeant",1
"JayChan",0,1,145571,BH,"zzBossk zzJango Cad zBoba Dengar",1
"JayChan",0,1,76805,Phoenix,"Hera G8, Kanan G9, zEzra Sabine G8, Zeb G8",1
"JayChan",1,0,26014,NestSolo (Counter),"zNest",1
"JayChan",,,134653,Phasma,"zPhasma zFOTP FOSFTP zFOST zKylo",0
"JayChan",0,1,88144,Geonosians Omicron,"zGBA Sun Fac, Geo Soldier, Geo Spy, Poggle",0
"JayChan",1,1,99654,NS,"zzMT G8, zAV zDaka Zombie Spirit G9",0
"JayChan",1,1,89097,JTR,"JTR Scav Rey G9, zBB-8 R2-D2 Finn G9",0
"JayChan",1,1,86009,Carth,"zCarth Onasi, Mission zZaalbar zVandor Chewbacca 4*, Canderous",0
"Bobans",,,177191,LV,"zzzzzzLord Vader, zzPiett zzzVader zRG zzTarkin",1
"Bobans",,,123407,Phasma,"zPhasma zFOTP FOSFTP zFOST zKylo",1
"Bobans",1,1,164370,SL Kylo,"zzzzzzSL Kylo, zSith Trooper, zHux zzKRU zzThrawn",1
"Bobans",,,173393,SEE,"zzzzzzSEE zBSF zzMalak zzzDR zDooku",1
"Bobans",1,1,168809,GL Rey,"zzzzzzRey zzzJTR zzBB-8 zRH Poe, zRH Finn",1
"Bobans",1,1,106050,NS,"zzMT zzAV zDaka Zombie Spirit",1
"Bobans",,,180034,JMLS,"zzzJKR zzJKL zzzzzzJMLS zWat Tambor, zzzzGAS",1
"Bobans",1,0,143226,CLS,"zzzCLS zHan zzChewbacca zzC-3PO zChewpio",1
"Bobans",0,1,140356,padme,"zzPadme zGK zJKA zAhsoka zBarriss",1
"Bobans",,,506263,Negotiator,"Negotiator HT Anakin's Eta-2, Umbaran SF, Ahsoka's SF, BTL-B Y-wing, Clone Sergeant's ARC-170, Plo's SF",1
"Bobans",,,308278,Malevolence,"Malevolence Hyena Bomber, Vulture Droid, Sun Fac SF, Soldier SF, Spy SF",1
"Bobans",,,424446,HansMF,"Home One, Han's MF, Rebel Y-wing, Bistan's U-wing, Phantom Biggs X-wing, Cassian's U-wing, Wedge X-wing",1
"Bobans",0,1,129996,Grievous,"zzGG zB2 zB1 zMagnaGuard zNute",1
"Bobans",1,0,117127,Traya,"zzTraya zDN zSion zzEP Sith Empire Trooper",1
"Bobans",,,112003,Mon Mothma,"zzMon Mothma, Wedge Pao Biggs zCara Dune",1
"Bobans",1,1,83129,Ewoks,"zChirpa Elder Paploo Wicket Logray",1
"Bobans",1,0,151559,ShaakClones,"zzShaak Ti, zRex zEcho (501st), zzFives zARC Trooper",1
"Bobans",0,1,149484,BH,"zzBossk zzEmbo zBoba zDengar zZam",1
"Bobans",1,1,95309,Carth,"zCarth Onasi, zMission zZaalbar Juhani Canderous",1
"Bobans",0,1,126932,BH,"zzJango zzGreef Cad zzThe Mandalorian, zIG-88",1
"Bobans",1,0,108396,Troopers,"zVeers zStarck zIden Versio, zDT Shoretrooper",1
"Bobans",0,1,84411,Phoenix,"zHera G8, Kanan G8, zEzra zSabine Zeb G8",1
"Bobans",,,126846,Bad Batch,"zHunter zEcho zzOmega zTech zWrecker",1
"Bobans",1,0,117197,zMaul,"zDarth Maul, zSidious Sith Assassin, zSavage Sith Marauder",1
"Bobans",0,1,131453,BS,"zBS zzGMY zJolee zzOld Ben, zzHYoda",1
"Bobans",1,0,19848,NestSolo (Counter),"zNest",1
"Bobans",0,1,101802,Geonosians Omicron,"zzGBA Sun Fac, Geo Soldier, Geo Spy, Poggle",0
"Bobans",,,508988,Executrix,"Executrix Tie Adv, Emperor's Shuttle 6*, TIE Reaper, Imperial TIE Fighter, Gauntlet Starfighter, FOSF TIE Fighter, FO TIE Fighter",0
"Bobans",1,1,74823,Rogue1,"zzJyn G9, Chirrut Baze G5, Bistan G7, Scarif G8",0
"Bobans",1,0,37698,Jawas,"Nebit G1, Jawa Engineer G1, Jawa Scavenger G6, Jawa G6, Dathcha G6",0
"Djape15mp",,,179794,JMK,"zzzzzzJMK zAhsoka zzzCAT zzzzGAS zGK",1
"Djape15mp",,,123265,Phasma,"zPhasma zFOTP FOSFTP zFOST zKylo",1
"Djape15mp",,,143442,Admiral Raddus,"zzAdmiral Raddus, zCassian zJyn zK-2SO Bistan",1
"Djape15mp",,,442129,Profundity,"Profundity Han's MF, Outrider Rebel Y-wing, Cassian's U-wing, Biggs X-wing",1
"Djape15mp",1,1,165842,SL Kylo,"zzzzzzSL Kylo, zSith Trooper, zHux zzKRU zzThrawn",1
"Djape15mp",,,177358,SEE,"zzzzzzSEE zBSF zzMalak zzzDR zzzVader",1
"Djape15mp",,,170042,Jabba,"zzzzzzJabba zBoushh (Leia Organa), zSkiff Guard (Lando Calrissian), zKrrsantan zBoba",1
"Djape15mp",,,146456,SK,"zzEP zzMara Jade, The Emperor's Hand, zzStarkiller zzOld Ben, zVisas",1
"Djape15mp",,,590347,Executor,"Executor HT RC Xanadu Blood, Slave I, IG-2000 Imperial TIE Fighter, Tie Adv",1
"Djape15mp",,,166813,JMLS,"zBS zzzzzzJMLS zWat Tambor, zzJKL zJolee",1
"Djape15mp",1,0,153632,CLS,"zzzCLS zHan zzChewbacca zzC-3PO zChewpio",1
"Djape15mp",1,1,128600,NestSisters,"zzAV zzMT zDaka Zombie zNest",1
"Djape15mp",,,126505,Grievous Omicron,"zzGG zB2 zB1 MagnaGuard zDroideka",1
"Djape15mp",,,524190,Negotiator,"Negotiator BTL-B Y-wing, Anakin's Eta-2, Rex's ARC-170, Umbaran SF, Ahsoka's SF, Plo's SF, Clone Sergeant's ARC-170",1
"Djape15mp",,,313093,Malevolence,"Malevolence Hyena Bomber, Vulture Droid, Sun Fac SF, Soldier SF, Spy SF",1
"Djape15mp",1,0,134329,Traya,"zzTraya zzDN zSion zDooku Sith Empire Trooper",1
"Djape15mp",1,1,115279,JTR,"zzzJTR Scav Rey, BB-8 G9, zzR2-D2 zFinn G8",1
"Djape15mp",,,110097,Mon Mothma,"zzMon Mothma, zPao Hoth Rebel Scout, Biggs zCara Dune",1
"Djape15mp",1,0,131672,Troopers,"zVeers zzPiett zGideon zDark Trooper, Range Trooper",1
"Djape15mp",1,1,83589,Ewoks,"zChirpa Elder Paploo Wicket Logray",1
"Djape15mp",1,0,147983,ShaakClones,"zzShaak Ti, zRex zEcho (501st), zzFives zARC Trooper",1
"Djape15mp",1,1,91690,Carth,"zCarth Onasi, Mission Zaalbar Juhani zCanderous",1
"Djape15mp",0,1,146341,BH,"zzBossk zzJango zFennec Shand, Greedo zDengar",1
"Djape15mp",,,102513,Iden Troopers,"zIden Versio, Shoretrooper Snowtrooper Magma DT",1
"Djape15mp",0,1,86857,Phoenix,"Hera Chopper Kanan G8, zEzra Zeb G8",1
"Djape15mp",1,0,126118,zMaul,"zDarth Maul, zSidious Sith Assassin, zSavage Sith Marauder",1
"Djape15mp",0,1,95395,Geonosians Omicron,"zzGBA Sun Fac, Geo Soldier, Geo Spy, Poggle",0
"Deexon",,,178401,JMK,"zzzzzzJMK zJKA zzGMY zzShaak Ti, zGK",1
"Deexon",,,120957,Phasma,"zPhasma FOTP FOSFTP zFOST zKylo",1
"Deexon",1,1,167318,SL Kylo,"zzzzzzSL Kylo, zSith Trooper, zHux zzKRU zzThrawn",1
"Deexon",,,174673,SEE,"zzzzzzSEE zBSF zzMalak zzzDR zzzVader",1
"Deexon",,,571749,Executor,"Executor 5* HT RC Xanadu Blood, Slave I, IG-2000 Imperial TIE Fighter, Tie Adv",1
"Deexon",,,181735,JMLS,"zzzJKR zzJKL zzzzzzJMLS zWat Tambor, zzzzGAS",1
"Deexon",1,0,153887,CLS,"zzzCLS zHan zzChewbacca zzC-3PO zChewpio",1
"Deexon",,,511167,Negotiator,"Negotiator BTL-B Y-wing, Anakin's Eta-2, Rex's ARC-170, Umbaran SF, Ahsoka's SF, Plo's SF, Clone Sergeant's ARC-170",1
"Deexon",,,461041,HansMF,"Home One, Han's MF, Rebel Y-wing, Bistan's U-wing, Phantom Biggs X-wing, Cassian's U-wing, Wedge X-wing",1
"Deexon",1,1,100550,NS_Alt,"zzMT Acolyte zDaka zzAV Zombie",1
"Deexon",0,1,131857,Grievous,"zzGG zB2 zB1 zMagnaGuard zNute",1
"Deexon",1,0,117324,Traya,"zzTraya zDN zSion zzEP Sith Empire Trooper",1
"Deexon",1,1,134211,JTR,"zzzJTR zScav Rey, zzBB-8 zzR2-D2 RT",1
"Deexon",,,112250,Mon Mothma,"zzMon Mothma, Bistan Wedge Biggs Cara Dune",1
"Deexon",,,128894,Disintegration,"Aurra Greef zBoba zzBossk zzThe Mandalorian",1
"Deexon",1,1,88894,Ewoks,"zChirpa Elder Paploo Wicket zLogray",1
"Deexon",1,1,90747,Carth,"zCarth Onasi, zMission zZaalbar zJuhani Canderous G8",1
"Deexon",0,1,141734,BH,"zzJango zGreedo zIG-88 zDengar Krrsantan",1
"Deexon",1,0,139717,501st,"zRex zARC Trooper, zEcho (501st), zzFives zAhsoka",1
"Deexon",1,0,116432,Troopers,"zVeers zStarck Range Trooper, DT zzPiett",1
"Deexon",1,0,127098,zMaul,"zDarth Maul, zSidious zDooku Sith Marauder, Nest",1
"Deexon",0,1,80434,Phoenix,"Hera Kanan G8, Ezra Sabine G8, Zeb G8",1
"Deexon",,,125818,Admiral Raddus,"zzAdmiral Raddus, zCassian zzJyn K-2SO G8, Chirrut G8",0
"Deexon",,,293516,Malevolence,"Malevolence Hyena Bomber 6*, Vulture Droid 4*, Sun Fac SF, Soldier SF, Spy SF",0
"Deexon",0,1,99561,Geonosians Omicron,"zzGBA Sun Fac, Geo Soldier, Geo Spy, Poggle",0
"Deexon",,,97570,Bad Batch,"Hunter Echo Omega G9, Tech Wrecker",0
"Deexon",1,0,73276,Jawas,"Nebit G8, Jawa Engineer G7, Jawa Scavenger G7, Jawa Dathcha G8",0
"Baća",,,179071,JMK,"zzzzzzJMK zAhsoka zzzCAT zzzzGAS zGK",1
"Baća",,,165313,LV,"zzzzzzLord Vader, zzPiett zzzVader zRG zTarkin",1
"Baća",,,169887,SEE,"zzzzzzSEE zBSF zzMalak zzzDR zDooku",1
"Baća",,,569370,Executor,"Executor 5* HT RC Xanadu Blood, Slave I, IG-2000 Imperial TIE Fighter, Tie Adv",1
"Baća",1,0,145068,CLS,"zzzCLS zHan zzChewbacca zzC-3PO zChewpio",1
"Baća",1,1,105400,NestSisters,"zzAV zzMT zDaka Zombie zNest",1
"Baća",,,512414,Negotiator,"Negotiator BTL-B Y-wing, Anakin's Eta-2, Rex's ARC-170, Umbaran SF, Ahsoka's SF, Plo's SF, Clone Sergeant's ARC-170",1
"Baća",,,323402,Malevolence,"Malevolence Hyena Bomber, Vulture Droid, Sun Fac SF, Soldier SF, Spy SF",1
"Baća",,,141480,JKL,"zzJKL zzzJKR zzHYoda zzOld Ben, Aayla",1
"Baća",,,439959,HansMF,"Home One, Han's MF, Rebel Y-wing, Bistan's U-wing, Phantom Ghost Cassian's U-wing, Wedge X-wing",1
"Baća",1,1,119415,JTR,"zzzJTR zzR2-D2 zzBB-8 RH Finn G8, RH Poe G9",1
"Baća",0,1,140164,Grievous,"zzGG zB2 zB1 zMagnaGuard zNute",1
"Baća",1,0,118102,Traya,"zzTraya zzDN zSion Sith Empire Trooper G9, zThrawn",1
"Baća",,,126988,Disintegration,"zAurra zzGreef zBoba zzBossk zzThe Mandalorian",1
"Baća",,,104799,Mon Mothma,"zzMon Mothma, Baze Wedge Biggs Chirrut",1
"Baća",1,1,94687,Ewoks,"zChirpa Elder zPaploo zWicket zLogray",1
"Baća",1,0,150071,ShaakClones,"zzShaak Ti, zRex zEcho (501st), zzFives zARC Trooper",1
"Baća",0,1,144186,BH,"zzJango zEmbo zIG-88 zDengar zZam",1
"Baća",1,0,109085,Troopers,"zVeers zStarck zStormtrooper zzGideon zDark Trooper",1
"Baća",0,1,97106,FO,"zzKRU zKylo FOE FOO zHux",1
"Baća",0,1,80946,Phoenix,"zHera zKanan G8, Ezra G8, Sabine G8, zZeb G8",1
"Baća",1,0,111756,EP (Counter, Rebel),"zzEP Shoretrooper G8, zKrennic DT G8, zzWampa",1
"Baća",1,0,88567,Jawas,"Nebit Jawa Engineer, Jawa Scavenger, Jawa Dathcha",1
"Baća",,,94046,Admiral Raddus,"zzAdmiral Raddus, zCassian zzJyn K-2SO G9, Bistan G9",0
"Baća",0,1,91843,Qira,"zQira L3-37 G8, zVandor Chewbacca, zMission zZaalbar",0
"Baća",0,1,103313,Geonosians Omicron,"zzGBA Sun Fac, Geo Soldier, Geo Spy, Poggle",0
"Baća",,,121952,Bad Batch,"zHunter zEcho zzOmega G9, zTech zWrecker",0
"DANE",,,185721,JMK,"zzzzzzJMK zAhsoka zzzCAT zzzzGAS zGK",1
"DANE",,,120434,Phasma,"zPhasma FOTP FOSFTP zFOST zKylo",1
"DANE",1,1,166893,SL Kylo,"zzzzzzSL Kylo, zSith Trooper, zHux zzKRU zzThrawn",1
"DANE",,,173614,SEE,"zzzzzzSEE zBSF zzMalak zzzDR zDooku",1
"DANE",1,1,168494,GL Rey,"zzzzzzRey zzzJTR zzBB-8 zRH Poe, zRH Finn",1
"DANE",,,147300,SK,"zzEP zzMara Jade, The Emperor's Hand, zzStarkiller zzOld Ben, zVisas",1
"DANE",,,577408,Executor,"Executor 6* HT RC Xanadu Blood, Slave I, IG-2000 Tie Adv, TIE Reaper",1
"DANE",1,0,143568,CLS,"zzzCLS zHan zzChewbacca zC-3PO zChewpio",1
"DANE",1,1,109232,NestSisters,"zzAV zzMT zDaka Zombie zNest",1
"DANE",,,525015,Negotiator,"Negotiator BTL-B Y-wing, Anakin's Eta-2, Rex's ARC-170, Umbaran SF, Ahsoka's SF, Plo's SF, Clone Sergeant's ARC-170",1
"DANE",,,316384,Malevolence,"Malevolence Hyena Bomber, Vulture Droid, Sun Fac SF, Soldier SF, Spy SF",1
"DANE",,,442816,HansMF,"Home One, Han's MF, Rebel Y-wing, Bistan's U-wing, Phantom Biggs X-wing, Cassian's U-wing, Wedge X-wing",1
"DANE",0,1,134032,Grievous,"zzGG zB2 zB1 MagnaGuard zNute",1
"DANE",1,0,96152,Traya,"zzTraya zDN zSion Sith Assassin G8, Sith Empire Trooper",1
"DANE",,,106924,Mon Mothma,"zzMon Mothma, Wedge Biggs Chirrut Scarif",1
"DANE",,,125732,Disintegration,"Aurra zzGreef zBoba zzBossk zzThe Mandalorian",1
"DANE",1,1,143994,Revan Offense,"zzzJKR zGMY zzHYoda zJolee zJKA",1
"DANE",1,1,88205,Ewoks,"zChirpa Elder zPaploo zWicket Logray G9",1
"DANE",1,0,155585,ShaakClones,"zzShaak Ti, zRex zEcho (501st), zzFives zARC Trooper",1
"DANE",1,1,92530,Carth,"zCarth Onasi, zMission zZaalbar Juhani Canderous",1
"DANE",0,1,143249,BH,"zzJango zEmbo zIG-88 zDengar zZam",1
"DANE",1,0,118835,Troopers,"zVeers zStarck zDT zzPiett Shoretrooper",1
"DANE",0,1,74409,Phoenix,"Hera Kanan G9, Ezra Sabine Zeb G8",1
"DANE",,,125264,Bad Batch,"zHunter zEcho zzOmega zTech zWrecker",1
"DANE",,,144111,LV,"zzzzzzLord Vader, zzDarth Malgus G8, zzzMaul zRG zzzVader",0
"DANE",,,90813,Admiral Raddus,"zzAdmiral Raddus G9, Cassian G9, zJyn Baze Bistan",0
"DANE",,,150779,JMLS,"zBS zzzzzzJMLS zWat Tambor, zzJKL Barriss",0
"DANE",0,1,100910,Geonosians Omicron,"zzGBA Sun Fac, Geo Soldier, Geo Spy, Poggle",0
"DANE",1,0,72081,Jawas,"Nebit G7, Jawa Engineer G9, Jawa Scavenger G8, Jawa G9, Dathcha",0
"gaara",,,175897,JMK,"zzzzzzJMK zJKA zGMY zzShaak Ti, zGK",1
"gaara",1,1,160721,SL Kylo,"zzzzzzSL Kylo, zSith Trooper, zHux zzKRU Thrawn",1
"gaara",,,170584,SEE,"zzzzzzSEE zBSF zzMalak zzzDR zzzVader",1
"gaara",1,1,168132,GL Rey,"zzzzzzRey zzzJTR zzR2-D2 zRH Poe, zRH Finn",1
"gaara",1,1,111647,NS,"zzMT zzAV zDaka Zombie Spirit",1
"gaara",,,183619,JMLS,"zzzJKR zzJKL zzzzzzJMLS zWat Tambor, zzzzGAS",1
"gaara",1,0,146249,CLS,"zzzCLS zHan zzChewbacca zzC-3PO zChewpio",1
"gaara",,,508736,Negotiator,"Negotiator HT Anakin's Eta-2, Umbaran SF, Ahsoka's SF, BTL-B Y-wing, Clone Sergeant's ARC-170, Plo's SF",1
"gaara",0,1,130612,Grievous,"zzGG zB2 zB1 MagnaGuard zNute",1
"gaara",1,0,114320,Traya,"zzTraya DN zSion zzEP Sith Empire Trooper",1
"gaara",1,0,118800,Troopers,"zVeers zzPiett zzGideon zDark Trooper, Range Trooper",1
"gaara",,,112978,Mon Mothma,"zzMon Mothma, Wedge Biggs zCara Dune, Lando",1
"gaara",1,1,82281,Ewoks,"zChirpa Elder Paploo Wicket Logray",1
"gaara",0,1,141492,BH,"zzBossk zJango zBoba zDengar zZam",1
"gaara",1,0,139513,501st,"zRex zARC Trooper, zEcho (501st), zzFives zAhsoka",1
"gaara",0,1,73544,Phoenix,"Hera Chopper Kanan G8, Ezra Zeb G8",1
"gaara",,,114470,Mando,"zzThe Mandalorian (Beskar Armor), zDash Rendar, zNest zIG-11 zKuiil",1
"gaara",,,117292,Phasma,"Phasma FOTP FOSFTP zFOST zKylo",0
"gaara",0,1,83540,Qira,"Qira L3-37 5* Vandor Chewbacca 5*, zMission zZaalbar",0
"gaara",,,351060,HansMF,"Home One, Han's MF, Rebel Y-wing, Bistan's U-wing, Phantom Biggs X-wing, Cassian's U-wing, Wedge X-wing",0
"gaara",,,122098,Bad Batch,"zHunter zEcho zzOmega G9, zTech zWrecker",0
"lukasarts2011",,,178541,JMK,"zzzzzzJMK zAhsoka zzzCAT zzzzGAS zGK",1
"lukasarts2011",,,178594,LV,"zzzzzzLord Vader, zzPiett zzzVader zRG zNinth Sister",1
"lukasarts2011",,,123247,Phasma,"zPhasma zFOTP FOSFTP zFOST zKylo",1
"lukasarts2011",1,1,165113,SL Kylo,"zzzzzzSL Kylo, zSith Trooper, zHux zzKRU zThrawn",1
"lukasarts2011",,,168194,SEE,"zzzzzzSEE zBSF zzMalak zzzDR zDooku",1
"lukasarts2011",1,1,168451,GL Rey,"zzzzzzRey zzJTR zzR2-D2 zRH Poe, zRH Finn",1
"lukasarts2011",0,1,93220,Qira,"Qira zL3-37 Vandor Chewbacca, zMission zZaalbar",1
"lukasarts2011",1,1,116686,NS,"zzMT zzAV zDaka Zombie Spirit",1
"lukasarts2011",,,578081,Executor,"Executor HT RC Xanadu Blood, Slave I, IG-2000 Imperial TIE Fighter, Tie Adv",1
"lukasarts2011",,,158779,JMLS,"zBS zzzzzzJMLS zWat Tambor, zzJKL zJolee",1
"lukasarts2011",1,0,143192,CLS,"zzzCLS zHan zzChewbacca zC-3PO zChewpio",1
"lukasarts2011",,,512139,Negotiator,"Negotiator BTL-B Y-wing, Anakin's Eta-2, Rex's ARC-170, Umbaran SF, Ahsoka's SF, Plo's SF, Clone Sergeant's ARC-170",1
"lukasarts2011",,,309108,Malevolence,"Malevolence Hyena Bomber, Vulture Droid, Sun Fac SF, Soldier SF, Spy SF",1
"lukasarts2011",,,462708,HansMF,"Home One, Han's MF, Rebel Y-wing, Bistan's U-wing, Phantom Biggs X-wing, Cassian's U-wing, Wedge X-wing",1
"lukasarts2011",0,1,134136,Grievous,"zzGG zB2 zB1 MagnaGuard zNute",1
"lukasarts2011",1,0,118893,Traya,"zzTraya zDN zSion zzEP Sith Empire Trooper",1
"lukasarts2011",,,117339,Mon Mothma,"zzMon Mothma, Bistan zPao Hoth Rebel Scout, zCara Dune",1
"lukasarts2011",,,127426,Disintegration,"Aurra zzGreef zBoba zBossk zThe Mandalorian",1
"lukasarts2011",1,1,87567,Ewoks,"zChirpa Elder zPaploo zWicket Logray G9",1
"lukasarts2011",1,0,152269,ShaakClones,"zzShaak Ti, zRex zEcho (501st), zzFives zARC Trooper",1
"lukasarts2011",0,1,136894,BH,"zzJango Cad IG-88 Dengar zZam",1
"lukasarts2011",1,0,121981,Troopers,"zVeers zStarck Magma zzGideon zDark Trooper",1
"lukasarts2011",0,1,82348,Phoenix,"Hera Kanan G8, zEzra Sabine G8, Zeb G8",1
"lukasarts2011",1,0,76352,Jawas,"Nebit G8, Jawa Engineer G9, Jawa Scavenger G9, Jawa Dathcha",1
"lukasarts2011",1,0,18858,NestSolo (Counter),"zNest",1
"lukasarts2011",,,119654,Admiral Raddus,"zzAdmiral Raddus, zCassian zJyn K-2SO Chirrut G8",0
"lukasarts2011",0,1,93967,Geonosians Omicron,"zzGBA Sun Fac, Geo Soldier, Geo Spy, Poggle",0
"lukasarts2011",,,117931,Bad Batch,"zHunter zEcho Omega G9, zTech zWrecker",0
"Jekka",,,181816,JMK,"zzzzzzJMK zAhsoka zzzCAT zzzzGAS zGK",1
"Jekka",,,174981,LV,"zzzzzzLord Vader, zzPiett zzzVader RG zNinth Sister",1
"Jekka",1,1,162191,SL Kylo,"zzzzzzSL Kylo, zSith Trooper, zHux zzKRU zThrawn",1
"Jekka",,,171740,SEE,"zzzzzzSEE zBSF zzMalak zzzDR zDooku",1
"Jekka",1,1,171683,GL Rey,"zzzzzzRey zzzJTR zzBB-8 zRH Poe, zRH Finn",1
"Jekka",,,141479,SK,"zzEP zzMara Jade, The Emperor's Hand, zzStarkiller zzOld Ben, zVisas",1
"Jekka",0,1,92953,Qira,"Qira L3-37 zVandor Chewbacca, zMission zZaalbar",1
"Jekka",1,1,105172,NS,"zzMT zzAV Daka Zombie Spirit",1
"Jekka",,,580876,Executor,"Executor HT RC Xanadu Blood, Slave I, IG-2000 Imperial TIE Fighter, Tie Adv",1
"Jekka",,,159306,JMLS,"zBS zzzzzzJMLS zWat Tambor, zzJKL zJolee",1
"Jekka",1,0,140651,CLS,"zzzCLS zHan zzChewbacca zC-3PO zChewpio",1
"Jekka",,,503694,Negotiator,"Negotiator BTL-B Y-wing, Anakin's Eta-2, Rex's ARC-170, Umbaran SF, Ahsoka's SF, Plo's SF, Clone Sergeant's ARC-170",1
"Jekka",,,319085,Malevolence,"Malevolence Hyena Bomber, Vulture Droid, Sun Fac SF, Soldier SF, Spy SF",1
"Jekka",,,424222,HansMF,"Home One, Han's MF, Rebel Y-wing, Bistan's U-wing, Phantom Biggs X-wing, Cassian's U-wing, Wedge X-wing",1
"Jekka",0,1,133079,Grievous,"zzGG zB2 zB1 MagnaGuard zNute",1
"Jekka",1,0,110095,Traya,"zzTraya zDN zSion Sith Empire Trooper, zNest",1
"Jekka",,,103698,Mon Mothma,"zzMon Mothma, zPao Hoth Rebel Scout, zCara Dune, Scarif",1
"Jekka",1,0,149059,ShaakClones,"zzShaak Ti, zRex zEcho (501st), zzFives zARC Trooper",1
"Jekka",1,1,82388,Ewoks,"zChirpa Elder Paploo Scout Logray",1
"Jekka",0,1,150792,BH,"zzBossk zJango zBoba zDengar zZam",1
"Jekka",1,0,95763,Troopers,"zVeers Starck Range Trooper, DT Dark Trooper",1
"Jekka",0,1,75167,Phoenix,"Hera G9, Kanan G8, zEzra Sabine G9, Zeb G8",1
"Jekka",1,1,83347,Rogue1,"Jyn Chirrut Baze K-2SO G8, Cassian",1
"Jekka",,,122451,Bad Batch,"zHunter zEcho zzOmega zTech Wrecker",1
"Jekka",1,0,72859,Jawas,"Nebit G9, Jawa Engineer G9, Jawa Scavenger G9, Jawa Dathcha",1
"Jekka",,,123117,Phasma,"zPhasma zFOTP FOSFTP zFOST zKylo",0
"Jekka",0,1,102446,Geonosians Omicron,"zzGBA Sun Fac, Geo Soldier, Geo Spy, Poggle",0
"nebojsa",,,181044,JMK,"zzzzzzJMK zJKA zzGMY zzShaak Ti, zGK",1
"nebojsa",,,175214,LV,"zzzzzzLord Vader, zzPiett zzzVader zRG zzTarkin",1
"nebojsa",1,1,164371,SL Kylo,"zzzzzzSL Kylo, zSith Trooper, zHux zzKRU zzThrawn",1
"nebojsa",,,178064,SEE,"zzzzzzSEE zBSF zzMalak zzzDR zDooku",1
"nebojsa",1,1,114344,NS,"zzMT zzAV zDaka Zombie Spirit",1
"nebojsa",,,571227,Executor,"Executor 5* HT RC Xanadu Blood, Slave I, IG-2000 Tie Adv, TIE Reaper",1
"nebojsa",,,183615,JMLS,"zzzJKR zzJKL zzzzzzJMLS zWat Tambor, zzzzGAS",1
"nebojsa",1,0,146358,CLS,"zzzCLS zHan zzChewbacca zzC-3PO zChewpio",1
"nebojsa",,,513788,Negotiator,"Negotiator BTL-B Y-wing, Anakin's Eta-2, Rex's ARC-170, Umbaran SF, Ahsoka's SF, Plo's SF, Clone Sergeant's ARC-170",1
"nebojsa",,,427811,HansMF,"Home One, Han's MF, Rebel Y-wing, Bistan's U-wing, Phantom Ghost Cassian's U-wing, Wedge X-wing",1
"nebojsa",0,1,134450,Grievous,"zzGG zB2 zB1 zMagnaGuard zNute",1
"nebojsa",1,0,133345,Traya,"zzTraya zDN zSion zzEP Sith Empire Trooper",1
"nebojsa",1,1,122671,JTR,"zzzJTR Scav Rey, zzBB-8 zzR2-D2 Finn G8",1
"nebojsa",,,106209,Mon Mothma,"zzMon Mothma, Bistan Wedge Biggs zCara Dune",1
"nebojsa",1,1,83969,Ewoks,"zChirpa Elder zPaploo Scout Logray G9",1
"nebojsa",0,1,151399,BH,"zzBossk zJango zBoba zDengar zZam",1
"nebojsa",1,1,100418,Carth,"zCarth Onasi, zMission zZaalbar zJuhani zCanderous",1
"nebojsa",1,0,143362,501st,"zRex zARC Trooper, zEcho (501st), zzFives zAhsoka",1
"nebojsa",1,0,111118,Troopers,"zVeers zStarck zStormtrooper DT Shoretrooper",1
"nebojsa",,,120135,Phasma,"Phasma zFOTP FOSFTP zFOST zKylo",0
