Player,Offense,Defense,GP,Name,Squad,Viable
"nebojsa",,,107253,Admiral Raddus,"zzAdmiral Raddus, zCassian zzJyn K-2SO G7, Chirrut G8",0
"nebojsa",,,293933,Malevolence,"Malevolence Hyena Bomber 5*, Vulture Droid 5*, Sun Fac SF, Soldier SF, Spy SF",0
"nebojsa",0,1,92406,Geonosians Omicron,"zzGBA Sun Fac, Geo Soldier, Geo Spy, Poggle",0
"nebojsa",0,1,81288,Phoenix,"zHera Chopper G7, Kanan G8, Ezra Zeb G8",0
"sandels",,,181101,JMK,"zzzzzJMK zAhsoka zzzCAT zzzzGAS zGK",1
"sandels",,,136913,Admiral Raddus,"zzAdmiral Raddus, Cassian Jyn Scarif Bistan",1
"sandels",,,184247,SEE,"zzzzzzSEE zBSF zzMalak zzzDR zzVader",1
"sandels",,,607381,Executor,"Executor HT RC Xanadu Blood, Slave I, IG-2000 Imperial TIE Fighter, Tie Adv",1
"sandels",1,0,154487,CLS,"zzzCLS zHan zzChewbacca zC-3PO zChewpio",1
"sandels",,,509490,Negotiator,"Negotiator BTL-B Y-wing, Anakin's Eta-2, Rex's ARC-170, Umbaran SF, Ahsoka's SF, Plo's SF, Clone Sergeant's ARC-170",1
"sandels",,,347380,Malevolence,"Malevolence Hyena Bomber, Vulture Droid, Sun Fac SF, Soldier SF, Spy SF",1
"sandels",0,1,110495,Geonosians Omicron,"zzGBA Sun Fac, Geo Soldier, Geo Spy, Poggle",1
"sandels",,,136272,JKL,"zJKL zzzJKR zHYoda Old Ben, Aayla",1
"sandels",,,499652,HansMF,"Home One, Han's MF, Rebel Y-wing, Bistan's U-wing, Phantom Biggs X-wing, Cassian's U-wing, Wedge X-wing",1
"sandels",0,1,130459,Grievous-Wat,"zzGG zB2 zB1 MagnaGuard zWat Tambor",1
"sandels",,,134256,Disintegration,"Aurra zGreef Boba zzBossk zThe Mandalorian",1
"sandels",,,113401,Mon Mothma,"zzMon Mothma, K-2SO Wedge Biggs Lando",1
"sandels",1,1,84419,Ewoks,"zChirpa Elder Paploo Wicket Logray",1
"sandels",1,0,140670,ShaakClones,"zzShaak Ti, zRex Echo (501st), zzFives zARC Trooper",1
"sandels",1,1,92597,Carth,"Carth Onasi, Mission Zaalbar Juhani Canderous",1
"sandels",1,0,132016,zMaul,"zDarth Maul, zSidious Dooku Sith Empire Trooper, zNest",1
"sandels",1,0,129375,Troopers,"zVeers Starck zIden Versio, zzPiett Dark Trooper",1
"sandels",0,1,75908,Phoenix,"Hera Kanan G8, Ezra G9, Sabine G8, Zeb G8",1
"sandels",1,0,89675,ThrawnTroopers,"zzThrawn Range Trooper, DT G9, Shoretrooper Gideon G9",1
"sandels",1,0,11443,SionSolo (Counter),"Sion G8",1
"sandels",,,61097,Phasma,"Phasma G8, FOE G9, FOO G8, KRU G8, Kylo G8",0
"sandels",1,1,74456,NS,"MT G8, AV Daka Zombie Spirit G8",0
"sandels",1,1,92569,JTR,"JTR Scav Rey G8, BB-8 G9, R2-D2 Finn G8",0
"sandels",0,1,128284,BH,"zJango Cad IG-88 Dengar zZam",0
"sandels",,,69885,Bad Batch,"Hunter G9, Echo Omega G8, Tech G9, Wrecker G8",0
"Gøłubøwski",,,181872,JMK,"zzzzzzJMK zAhsoka zzzCAT zzzzGAS zGK",1
"Gøłubøwski",,,143630,Admiral Raddus,"zzAdmiral Raddus, zCassian zJyn zK-2SO Bistan",1
"Gøłubøwski",,,141831,SK,"zzEP zzMara Jade, The Emperor's Hand, zzStarkiller zJuhani zVisas",1
"Gøłubøwski",,,467449,Profundity,"Profundity Han's MF, Outrider Rebel Y-wing, Cassian's U-wing, Ghost",1
"Gøłubøwski",1,1,167046,SL Kylo,"zzzzzzSL Kylo, zSith Trooper, zHux zzKRU Thrawn",1
"Gøłubøwski",0,1,122123,Qira,"zQira zL3-37 zVandor Chewbacca, zMission zZaalbar",1
"Gøłubøwski",,,175124,Jabba,"zzzzzzJabba zBoushh (Leia Organa), zSkiff Guard (Lando Calrissian), Krrsantan zBoba",1
"Gøłubøwski",1,1,107296,NS,"zzMT zzAV zDaka Zombie Spirit",1
"Gøłubøwski",,,637308,Executor,"Executor HT RC Xanadu Blood, Slave I, IG-2000 Gauntlet Starfighter, Tie Adv",1
"Gøłubøwski",,,161344,JMLS,"zBS zzzzzzJMLS zWat Tambor, zzJKL zJolee",1
"Gøłubøwski",1,0,153103,CLS,"zzzCLS zHan zzChewbacca zzC-3PO zChewpio",1
"Gøłubøwski",0,1,120924,DRMalak,"zzzDR HK-47 zBSF zzMalak Sith Assassin",1
"Gøłubøwski",,,512098,Negotiator,"Negotiator BTL-B Y-wing, Anakin's Eta-2, Rex's ARC-170, Umbaran SF, Ahsoka's SF, Plo's SF, Clone Sergeant's ARC-170",1
"Gøłubøwski",,,316041,Malevolence,"Malevolence Hyena Bomber, Vulture Droid, Sun Fac SF, Soldier SF, Spy SF",1
"Gøłubøwski",1,1,120365,JTR,"zzzJTR zzR2-D2 zzBB-8 RH Finn G9, RH Poe G9",1
"Gøłubøwski",0,1,124434,Grievous,"zzGG zB2 zB1 zMagnaGuard zNute",1
"Gøłubøwski",,,119010,Mon Mothma,"zzMon Mothma, zPao Hoth Rebel Scout, Biggs zCara Dune",1
"Gøłubøwski",1,1,92956,Ewoks,"zChirpa Elder zPaploo zWicket zLogray",1
"Gøłubøwski",1,0,150315,ShaakClones,"zzShaak Ti, zRex zEcho (501st), zzFives zARC Trooper",1
"Gøłubøwski",0,1,159507,BH,"zzBossk zzJango Cad zDengar zBoba Fett, Scion of Jango",1
"Gøłubøwski",1,0,117357,Troopers,"zVeers zStarck zIden Versio, zzPiett zDark Trooper",1
"Gøłubøwski",0,1,138487,Phoenix,"zHera zKanan zEzra zSabine zZeb",1
"Gøłubøwski",1,0,91374,Jawas,"Nebit Jawa Engineer, Jawa Scavenger, Jawa Dathcha",1
"Gøłubøwski",1,0,19207,NestSolo (Counter),"zNest",1
"Gøłubøwski",1,0,15219,SionSolo (Counter),"Sion G9",1
"Gøłubøwski",,,123312,Phasma,"zPhasma zFOTP FOSFTP zFOST zKylo",0
"Gøłubøwski",0,1,97142,Geonosians Omicron,"zzGBA Sun Fac, Geo Soldier, Geo Spy, Poggle",0
"Gøłubøwski",1,0,103477,zMaul,"Darth Maul, zDooku Sidious Sith Empire Trooper, Sith Marauder",0
"Gøłubøwski",,,93268,Bad Batch,"zHunter zEcho zzOmega G8, zTech zWrecker G9",0
"0wuchur0",,,122957,Phasma,"zPhasma zFOTP FOSFTP zFOST zKylo",1
"0wuchur0",1,1,164754,SL Kylo,"zzzzzzSL Kylo, zSith Trooper, zHux zzKRU zzThrawn",1
"0wuchur0",,,173328,SEE,"zzzzzzSEE zBSF zzMalak zzzDR zzzVader",1
"0wuchur0",1,1,168965,GL Rey,"zzzzzzRey zzzJTR zzBB-8 zRH Poe, zRH Finn",1
"0wuchur0",1,0,134082,CLS,"zzzCLS zHan zzChewbacca zzC-3PO zChewpio",1
"0wuchur0",,,418909,Negotiator,"Negotiator HT Anakin's Eta-2, Umbaran SF, Ahsoka's SF, Clone Sergeant's ARC-170, Jedi Consular's Starfighter, Plo's SF",1
"0wuchur0",,,372000,HansMF,"Home One, Han's MF, Rebel Y-wing, Ghost Phantom Biggs X-wing, Cassian's U-wing, Wedge X-wing",1
"0wuchur0",1,0,121703,Traya,"zzTraya zDN zSion zzEP Sith Empire Trooper",1
"0wuchur0",0,1,127390,Grievous-Wat,"zzGG zB2 zB1 zMagnaGuard zWat Tambor",1
"0wuchur0",,,104701,Mon Mothma,"zzMon Mothma, Bistan Wedge zCara Dune, Lando",1
"0wuchur0",1,1,126984,Revan,"zzzJKR zBS zzGMY zJolee zGK",1
"0wuchur0",1,1,87059,Ewoks,"zChirpa Elder Paploo zWicket Logray",1
"0wuchur0",0,1,113716,BH,"zzBossk zzJango Cad zBoba Dengar",1
"0wuchur0",1,1,96926,Carth,"zCarth Onasi, zMission zZaalbar zJuhani zCanderous",1
"0wuchur0",1,0,125423,Troopers,"zVeers zStarck zStormtrooper zzPiett zzGideon",1
"0wuchur0",0,1,76677,Phoenix,"Hera Kanan zEzra Sabine G8, Zeb G8",1
"0wuchur0",1,0,128168,QGJ,"zQGJ Aayla zJKA zzOld Ben, zAhsoka",1
"0wuchur0",1,1,93865,NS,"zzMT zzAV zDaka Zombie Spirit G8",0
"0wuchur0",0,1,92337,Geonosians Omicron,"zzGBA Sun Fac, Geo Soldier, Geo Spy, Poggle",0
"0wuchur0",1,0,115301,zMaul,"zDarth Maul, zSidious zDooku Sith Marauder, Nest G1",0
"0wuchur0",1,0,102033,Wampa (Counter),"zRex zzWampa Krennic Jyn G7, FOO",0
"0wuchur0",,,82778,Bad Batch,"zHunter 6* G9, zEcho 5* G9, zzOmega G9, zTech G9, zWrecker G8",0
"Ruske",,,185205,JMK,"zzzzzzJMK zAhsoka zzzCAT zzzzGAS zGK",1
"Ruske",,,123070,Phasma,"zPhasma zFOTP FOSFTP zFOST zKylo",1
"Ruske",,,143624,Admiral Raddus,"zzAdmiral Raddus, zCassian zJyn zK-2SO Bistan",1
"Ruske",,,440470,Profundity,"Profundity Han's MF, Outrider Rebel Y-wing, Cassian's U-wing, Biggs X-wing",1
"Ruske",1,1,167602,SL Kylo,"zzzzzzSL Kylo, zSith Trooper, zHux zzKRU zzThrawn",1
"Ruske",,,186590,SEE,"zzzzzzSEE zBSF zzMalak zzzDR zzzVader",1
"Ruske",1,1,171276,GL Rey,"zzzzzzRey zzzJTR zzBB-8 zRH Poe, zRH Finn",1
"Ruske",,,167138,Jabba,"zzzzzzJabba zBoushh (Leia Organa), zSkiff Guard (Lando Calrissian), zKrrsantan zBoba",1
"Ruske",,,145159,SK,"zzEP zzMara Jade, The Emperor's Hand, zzStarkiller Old Ben, zVisas",1
"Ruske",,,592237,Executor,"Executor HT RC Xanadu Blood, Slave I, IG-2000 Imperial TIE Fighter, Tie Adv",1
"Ruske",,,170265,JMLS,"zBS zzzzzzJMLS zWat Tambor, zzJKL zJolee",1
"Ruske",1,0,161224,CLS,"zzzCLS zHan zzChewbacca zzC-3PO zChewpio",1
"Ruske",1,1,124326,NestSisters,"zzAV zzMT zDaka Zombie zNest",1
"Ruske",,,522902,Negotiator,"Negotiator BTL-B Y-wing, Anakin's Eta-2, Rex's ARC-170, Umbaran SF, Ahsoka's SF, Plo's SF, Clone Sergeant's ARC-170",1
"Ruske",,,321557,Malevolence,"Malevolence Hyena Bomber, Vulture Droid, Sun Fac SF, Soldier SF, Spy SF",1
"Ruske",0,1,133709,Grievous,"zzGG zB2 zB1 MagnaGuard zNute",1
"Ruske",1,0,132291,Traya,"zzTraya zDN zSion zDooku Sith Empire Trooper",1
"Ruske",,,125049,Mon Mothma,"zzMon Mothma, Wedge zPao Hoth Rebel Scout, zCara Dune",1
"Ruske",1,0,134997,Troopers,"zVeers zzPiett zGideon zDark Trooper, Range Trooper",1
"Ruske",1,1,76367,Ewoks,"zChirpa G8, Elder Paploo G9, Wicket G8, Logray G9",1
"Ruske",1,0,143475,ShaakClones,"zzShaak Ti, zRex zEcho (501st), zzFives zARC Trooper",1
"Ruske",1,1,106963,Carth,"zCarth Onasi, Mission Zaalbar zVandor Chewbacca, zCanderous",1
"Ruske",0,1,142651,BH,"zzBossk zJango Cad zFennec Shand, Dengar",1
"Ruske",0,1,81831,Phoenix,"Hera Chopper Kanan G8, Ezra Zeb G8",1
"Ruske",0,1,105368,Geonosians Omicron,"zzGBA Sun Fac, Geo Soldier, Geo Spy, Poggle",0
"Mr51ngh007",,,178140,JMK,"zzzzzzJMK zJKA zGMY zzShaak Ti, zGK",1
"Mr51ngh007",,,178257,SEE,"zzzzzzSEE zBSF zzMalak zzzDR zzzVader",1
"Mr51ngh007",1,0,137266,CLS,"zzzCLS zHan zzChewbacca zzC-3PO zChewpio",1
"Mr51ngh007",1,1,97599,NestSisters,"zzAV zMT Daka Zombie zNest",1
"Mr51ngh007",,,490985,Negotiator,"Negotiator HT Anakin's Eta-2, Umbaran SF, Ahsoka's SF, BTL-B Y-wing 6*, Clone Sergeant's ARC-170, Plo's SF",1
"Mr51ngh007",,,397231,HansMF,"Home One, Han's MF, Rebel Y-wing 6*, Bistan's U-wing, Phantom Biggs X-wing, Cassian's U-wing, Wedge X-wing",1
"Mr51ngh007",1,0,125979,Traya,"zzTraya zDN zSion Sith Empire Trooper, zzThrawn",1
"Mr51ngh007",0,1,120473,Grievous,"zzGG zB2 zB1 zMagnaGuard zNute",1
"Mr51ngh007",1,1,94944,JTR,"zJTR Scav Rey, zBB-8 zR2-D2 Finn",1
"Mr51ngh007",,,117742,Disintegration,"Aurra zGreef zBoba zzBossk The Mandalorian",1
"Mr51ngh007",1,1,127379,GAS,"zzzzGAS zRex zEcho (501st), zzFives zARC Trooper",1
"Mr51ngh007",1,1,98166,Ewoks,"zChirpa Elder zPaploo Teebo Logray G9",1
"Mr51ngh007",1,1,96988,Carth,"zCarth Onasi, zMission zZaalbar zVandor Chewbacca, zCanderous",1
"Mr51ngh007",0,1,130649,BH,"zJango Cad zFennec Shand, zIG-88 Dengar",1
"Mr51ngh007",1,0,125431,Troopers,"zVeers Starck zzPiett zGideon zDark Trooper",1
"Mr51ngh007",,,80168,Iden Troopers,"zIden Versio, Shoretrooper Snowtrooper G9, Magma G9, DT",1
"Mr51ngh007",0,1,87870,FO,"zzKRU Kylo FOST G9, FOO zHux 5*",1
"Mr51ngh007",0,1,75928,Phoenix,"Hera G9, Kanan G8, Ezra Sabine Zeb G8",1
"Mr51ngh007",,,71557,Admiral Raddus,"zAdmiral Raddus 5* G8, Cassian G9, Jyn G8, K-2SO G9, Chirrut G8",0
"Mr51ngh007",,,120838,SK,"zzEP zzMara Jade, The Emperor's Hand, zzStarkiller Old Ben, Visas",0
"Mr51ngh007",,,300178,Malevolence,"Malevolence Hyena Bomber 6*, Vulture Droid, Sun Fac SF, Soldier SF, Spy SF",0
"Mr51ngh007",0,1,93097,Geonosians Omicron,"zzGBA Sun Fac, Geo Soldier, Geo Spy, Poggle",0
"Mr51ngh007",,,430506,Executrix,"Executrix Tie Adv, Emperor's Shuttle 4*, TIE Reaper 6*, Imperial TIE Fighter, Gauntlet Starfighter, FOSF TIE Fighter 5*, FO TIE Fighter",0
"Mr51ngh007",,,108224,Mon Mothma,"zzMon Mothma, Wedge Biggs Lando zKyle Katarn",0
"Mr51ngh007",1,0,114702,zMaul,"Darth Maul, Dooku zSidious Sith Assassin, zSavage",0
"Mr51ngh007",,,94451,Bad Batch,"zHunter zEcho zzOmega G9, zTech zWrecker",0
"Mr51ngh007",1,0,63353,Jawas,"Nebit G7, Jawa Engineer 5* G7, Jawa Scavenger G8, Jawa G9, Dathcha G7",0
"Wanja",1,1,170816,GL Rey,"zzzzzzRey zGK zzzJTR zHoldo zRH Finn",1
"Wanja",,,182623,JMLS,"zzzJKR zzJKL zzzzzzJMLS zWat Tambor, zzzzGAS",1
"Wanja",1,1,127810,NestSisters,"zzAV zzMT zDaka Zombie zNest",1
"Wanja",1,0,148430,CLS,"zzzCLS zHan zzChewbacca zzC-3PO zChewpio",1
"Wanja",0,1,136665,DRMalak,"zzzDR zzHK-47 zBSF zzMalak Sith Empire Trooper",1
"Wanja",,,503744,Negotiator,"Negotiator HT Anakin's Eta-2, Umbaran SF, Ahsoka's SF, BTL-B Y-wing, Clone Sergeant's ARC-170, Plo's SF",1
"Wanja",,,447684,HansMF,"Home One, Han's MF, Rebel Y-wing, Bistan's U-wing, Phantom Biggs X-wing, Cassian's U-wing, Wedge X-wing",1
"Wanja",0,1,128177,Grievous,"zzGG zB2 zB1 zMagnaGuard zNute",1
"Wanja",1,0,139489,Traya,"zzTraya zzDN zSion zzEP zzThrawn",1
"Wanja",1,0,134071,Troopers,"zVeers zzPiett zzGideon zDark Trooper, Range Trooper",1
"Wanja",,,110169,Mon Mothma,"zzMon Mothma, Wedge Biggs zCara Dune, Chirrut",1
"Wanja",1,0,141010,ShaakClones,"zzShaak Ti, zRex zEcho (501st), zzFives zARC Trooper",1
"Wanja",1,1,81712,Ewoks,"zChirpa Elder Paploo Scout Logray",1
"Wanja",0,1,153845,BH,"zzBossk zzJango zBoba zDengar Boba Fett, Scion of Jango",1
"Wanja",1,1,87826,Carth,"zCarth Onasi, Mission G8, Zaalbar Juhani zCanderous",1
"Wanja",,,114057,Iden Troopers,"zIden Versio, zStormtrooper Snowtrooper Magma zDT",1
"Wanja",0,1,95302,FO,"zzKRU zKylo FOE FOO zHux 6*",1
"Wanja",0,1,98276,Phoenix,"Hera zKanan zEzra zSabine Zeb",1
"Wanja",,,119327,Bad Batch,"zHunter zEcho zzOmega zTech zWrecker",1
"Wanja",0,1,146045,BS,"zBS zzGMY zJolee zzOld Ben, zzHYoda",1
"Wanja",0,1,98486,Geonosians Omicron,"zzGBA Sun Fac, Geo Soldier, Geo Spy, Poggle",0
"Wanja",,,409053,Executrix,"Executrix Tie Adv, Emperor's Shuttle 4*, TIE Reaper, Imperial TIE Fighter, Gauntlet Starfighter, FOSF TIE Fighter, FO TIE Fighter",0
"Wanja",1,0,57433,Jawas,"Nebit G8, Jawa Engineer G7, Jawa Scavenger G8, Jawa G9, Dathcha G9",0
"Urke",,,180657,JMK,"zzzzzzJMK zAhsoka zzzCAT zzzzGAS zGK",1
"Urke",,,123546,Phasma,"zPhasma zFOTP FOSFTP zFOST zKylo",1
"Urke",1,1,169008,SL Kylo,"zzzzzzSL Kylo, zSith Trooper, zHux zzKRU zThrawn",1
"Urke",1,1,168632,GL Rey,"zzzzzzRey zzzJTR zzR2-D2 zRH Poe, zRH Finn",1
"Urke",,,165504,Jabba,"zzzzzzJabba zBoushh (Leia Organa), zSkiff Guard (Lando Calrissian), Krrsantan zBoba",1
"Urke",1,0,151217,CLS,"zzzCLS zHan zzChewbacca zzC-3PO zChewpio",1
"Urke",0,1,132129,DRMalak,"zzzDR zzHK-47 zBSF zzMalak Sith Empire Trooper G8",1
"Urke",1,1,108888,NestSisters,"zzAV zzMT zDaka Zombie zNest",1
"Urke",,,504642,Negotiator,"Negotiator HT Anakin's Eta-2, Umbaran SF, Ahsoka's SF, BTL-B Y-wing, Clone Sergeant's ARC-170, Plo's SF",1
"Urke",,,144908,JKL,"zzJKL zzzJKR zzHYoda zzOld Ben, Aayla",1
"Urke",,,442786,HansMF,"Home One, Han's MF, Rebel Y-wing, Bistan's U-wing, Phantom Biggs X-wing, Cassian's U-wing, Wedge X-wing",1
"Urke",0,1,127814,Grievous,"zzGG zB2 zB1 zMagnaGuard zNute",1
"Urke",,,103593,Mon Mothma,"zzMon Mothma, zPao Hoth Rebel Scout, zCara Dune, Scarif",1
"Urke",1,0,125622,Traya,"zzTraya zDN zSion zDooku zzEP",1
"Urke",1,1,79190,Ewoks,"zChirpa Elder Paploo G9, Wicket G9, Logray",1
"Urke",1,0,144083,ShaakClones,"zzShaak Ti, zRex zEcho (501st), zzFives zARC Trooper",1
"Urke",1,1,94463,Carth,"zCarth Onasi, zMission zZaalbar Juhani zCanderous",1
"Urke",0,1,146161,BH,"zzBossk zJango zFennec Shand, zAurra zDengar",1
"Urke",1,0,117886,Troopers,"zVeers Starck zzPiett zGideon zDark Trooper",1
"Urke",0,1,79905,Phoenix,"Hera G8, zKanan zEzra Sabine G8, Zeb G8",1
"Urke",,,129108,Bad Batch,"zHunter zEcho zzOmega zTech zWrecker",1
"Urke",,,296760,Malevolence,"Malevolence Hyena Bomber 4*, Vulture Droid, Sun Fac SF, Soldier SF, Spy SF",0
"Urke",0,1,95321,Geonosians Omicron,"zzGBA Sun Fac, Geo Soldier, Geo Spy, Poggle",0
"Urke",,,446601,Executrix,"Executrix Tie Adv, Emperor's Shuttle 4*, TIE Reaper, Imperial TIE Fighter, Gauntlet Starfighter, FOSF TIE Fighter, FO TIE Fighter",0
"Urke",,,73612,Iden Troopers,"Iden Versio G8, Shoretrooper Snowtrooper Magma G7, DT",0
"Urke",1,1,72272,Rogue1,"Jyn Chirrut G9, Baze G6, K-2SO G8, Cassian",0
"Urke",1,0,73362,Jawas,"Nebit G8, Jawa Engineer G9, Jawa Scavenger G7, Jawa Dathcha",0
"Yakface",,,178816,JMK,"zzzzzzJMK zAhsoka zzzCAT zzzzGAS zGK",1
"Yakface",,,167220,Jabba,"zzzzzzJabba zBoushh (Leia Organa), zSkiff Guard (Lando Calrissian), zKrrsantan zBoba",1
"Yakface",,,604022,Executor,"Executor HT RC Xanadu Blood, Slave I, IG-2000 Imperial TIE Fighter, Tie Adv",1
"Yakface",1,0,152080,CLS,"zzzCLS zHan zzChewbacca zzC-3PO zChewpio",1
"Yakface",0,1,112585,DRMalak,"zzzDR HK-47 zBSF zzMalak Sith Empire Trooper",1
"Yakface",,,482477,Negotiator,"Negotiator BTL-B Y-wing, Anakin's Eta-2, Rex's ARC-170, Umbaran SF, Ahsoka's SF, Plo's SF, Clone Sergeant's ARC-170",1
"Yakface",,,315265,Malevolence,"Malevolence Hyena Bomber, Vulture Droid, Sun Fac SF, Soldier SF, Spy SF",1
"Yakface",,,137415,JKL,"zzJKL zzzJKR zHYoda zOld Ben, Aayla",1
"Yakface",,,393833,HansMF,"Home One, Han's MF, Rebel Y-wing, Ghost Phantom Biggs X-wing, Cassian's U-wing, Wedge X-wing",1
"Yakface",0,1,125443,Grievous,"zzGG zB2 zB1 zMagnaGuard zNute",1
"Yakface",1,0,112292,Traya,"zzTraya DN Sion zzEP Thrawn",1
"Yakface",1,0,117610,Troopers,"zVeers zzPiett zGideon zDark Trooper, Range Trooper",1
"Yakface",1,1,76308,Ewoks,"zChirpa Elder Paploo Wicket Logray",1
"Yakface",1,0,138761,ShaakClones,"zzShaak Ti, zRex zEcho (501st), zzFives zARC Trooper",1
"Yakface",1,1,83668,Carth,"zCarth Onasi, zMission Zaalbar Juhani G8, Canderous",1
"Yakface",0,1,143249,BH,"zzBossk zzJango Cad Fennec Shand, Dengar",1
"Yakface",0,1,74381,FO,"zKRU Kylo G8, FOE FOO G8, Sith Trooper G8",1
"Yakface",0,1,68527,Phoenix,"Hera G8, Chopper G8, Kanan G8, Ezra Zeb G8",1
"Yakface",1,0,18763,NestSolo (Counter),"zNest",1
"Yakface",,,42177,Admiral Raddus,"Admiral Raddus 6* G6, Cassian G5, Jyn 6* G4, K-2SO G4, Bistan G1",0
"Yakface",0,1,98289,Geonosians Omicron,"zzGBA Sun Fac, Geo Soldier, Geo Spy, Poggle",0
"Yakface",1,1,75263,NS,"MT zAV Daka Zombie G8, Spirit G3",0
"Yakface",1,1,99786,JTR,"JTR Scav Rey G8, BB-8 zR2-D2 Finn G8",0
"Yakface",,,106870,Mon Mothma,"zzMon Mothma, Wedge Biggs Cara Dune G9, Lando",0
"Yakface",1,0,84305,zMaul,"Darth Maul, zDooku Sidious Savage Sith Marauder",0
"dart vejder",,,181150,JMK,"zzzzzzJMK zJKA zzGMY zzShaak Ti, zGK",1
"dart vejder",,,180544,LV,"zzzzzzLord Vader, zzPiett zzzVader zRG zNinth Sister",1
"dart vejder",,,121221,Phasma,"zPhasma zFOTP FOSFTP zFOST zKylo",1
"dart vejder",1,1,166320,SL Kylo,"zzzzzzSL Kylo, zSith Trooper, zHux zzKRU zzThrawn",1
"dart vejder",,,159695,SEE,"zzzzzzSEE zBSF zzMalak zzzDR zDooku",1
"dart vejder",1,1,150230,GL Rey,"zzzzzzRey zzzJTR zzBB-8 zHoldo RH Finn",1
"dart vejder",,,570609,Executor,"Executor 6* HT RC Xanadu Blood, Slave I, IG-2000 Imperial TIE Fighter, Tie Adv",1
"dart vejder",,,179617,JMLS,"zzzJKR zzJKL zzzzzzJMLS zWat Tambor, zzzzGAS",1
"dart vejder",1,0,141671,CLS,"zzzCLS zHan zzChewbacca zzC-3PO zChewpio",1
"dart vejder",1,1,104534,NestSisters,"zzAV zzMT zDaka Zombie zNest",1
"dart vejder",,,517732,Negotiator,"Negotiator BTL-B Y-wing, Anakin's Eta-2, Rex's ARC-170, Umbaran SF, Ahsoka's SF, Plo's SF, Clone Sergeant's ARC-170",1
"dart vejder",,,462805,HansMF,"Home One, Han's MF, Rebel Y-wing, Bistan's U-wing, Phantom Ghost Cassian's U-wing, Wedge X-wing",1
"dart vejder",0,1,134007,Grievous,"zzGG zB2 zB1 zMagnaGuard zNute",1
"dart vejder",1,0,113140,Traya,"zzTraya zDN zSion zzEP Sith Empire Trooper",1
"dart vejder",,,122577,Mon Mothma,"zzMon Mothma, Bistan Wedge Biggs zCassian",1
"dart vejder",1,1,91618,Ewoks,"zChirpa Elder Paploo Wicket Logray",1
"dart vejder",0,1,152898,BH,"zzBossk zzJango zBoba zDengar zZam",1
"dart vejder",1,1,92241,Carth,"zCarth Onasi, zMission zZaalbar Juhani Canderous",1
"dart vejder",1,0,146555,501st,"zRex zARC Trooper, zEcho (501st), zzFives zAhsoka",1
"dart vejder",1,0,98255,Troopers,"zVeers zStarck Range Trooper, DT Shoretrooper",1
"dart vejder",0,1,89474,Phoenix,"zHera Chopper G9, Kanan G9, zEzra Zeb G8",1
"dart vejder",,,123106,Bad Batch,"zHunter zEcho zzOmega zTech zWrecker",1
"dart vejder",1,0,73432,Jawas,"Nebit G8, Jawa Engineer G9, Jawa Scavenger G8, Jawa Dathcha G9",1
"dart vejder",,,303871,Malevolence,"Malevolence Hyena Bomber, Vulture Droid, Sun Fac SF, Soldier SF, Spy SF",0
"dart vejder",0,1,91656,Geonosians Omicron,"zzGBA Sun Fac, Geo Soldier, Geo Spy, Poggle",0
"spyalter",,,185733,JMK,"zzzzzzJMK zAhsoka zzzCAT zzzzGAS zGK",1
"spyalter",,,123303,Phasma,"zPhasma zFOTP FOSFTP zFOST zKylo",1
"spyalter",1,1,167693,SL Kylo,"zzzzzzSL Kylo, zSith Trooper, zHux zzKRU zzThrawn",1
"spyalter",,,183306,SEE,"zzzzzzSEE zBSF zzMalak zzzDR zzzVader",1
"spyalter",,,163683,Jabba,"zzzzzzJabba zBoushh (Leia Organa), zSkiff Guard (Lando Calrissian), zKrrsantan zBoba",1
"spyalter",,,141376,SK,"zzEP zzMara Jade, The Emperor's Hand, zzStarkiller zzOld Ben, zVisas",1
"spyalter",0,1,100182,Qira,"zQira zL3-37 zVandor Chewbacca, zMission zZaalbar",1
"spyalter",1,1,113430,NS,"zzMT zzAV zDaka Zombie Spirit",1
"spyalter",,,603885,Executor,"Executor HT RC Xanadu Blood, Slave I, IG-2000 Tie Adv, TIE Reaper",1
"spyalter",,,165972,JMLS,"zBS zzzzzzJMLS zWat Tambor, zzJKL zJolee",1
"spyalter",1,0,155773,CLS,"zzzCLS zHan zzChewbacca zzC-3PO zChewpio",1
"spyalter",,,525097,Negotiator,"Negotiator BTL-B Y-wing, Anakin's Eta-2, Rex's ARC-170, Umbaran SF, Ahsoka's SF, Plo's SF, Clone Sergeant's ARC-170",1
"spyalter",,,312487,Malevolence,"Malevolence Hyena Bomber, Vulture Droid, Sun Fac SF, Soldier SF, Spy SF",1
"spyalter",,,480875,HansMF,"Home One, Han's MF, Rebel Y-wing, Bistan's U-wing, Phantom Ghost Cassian's U-wing, Wedge X-wing",1
"spyalter",1,1,123576,JTR,"zzzJTR zzR2-D2 zzBB-8 RH Finn G8, RH Poe G9",1
"spyalter",0,1,131586,Grievous,"zzGG zB2 zB1 zMagnaGuard zNute",1
"spyalter",1,0,130694,Traya,"zzTraya zzDN zSion zDooku Sith Empire Trooper",1
"spyalter",,,105006,Mon Mothma,"zzMon Mothma, Wedge Pao zCara Dune, Scarif",1
"spyalter",1,0,128995,Troopers,"zVeers zzPiett zzGideon zDark Trooper, Range Trooper",1
"spyalter",1,1,93271,Ewoks,"zChirpa Elder zPaploo zWicket zLogray",1
"spyalter",1,0,145899,ShaakClones,"zzShaak Ti, zRex zEcho (501st), zzFives zARC Trooper",1
"spyalter",0,1,150382,BH,"zzBossk zzJango zFennec Shand, zDengar Boba Fett, Scion of Jango",1
"spyalter",,,97153,Iden Troopers,"zIden Versio, zStormtrooper Snowtrooper Magma zDT",1
"spyalter",0,1,98600,Phoenix,"zHera zKanan G8, zEzra zSabine zZeb G9",1
"spyalter",1,1,101489,Rogue1,"zzJyn Chirrut Baze zK-2SO zCassian",1
"spyalter",1,0,121072,zMaul,"zDarth Maul, zSidious Sith Assassin, zSavage Sith Marauder",1
"spyalter",,,119942,Mando,"zzThe Mandalorian (Beskar Armor), zDash Rendar, zNest zIG-11 zKuiil",1
"spyalter",1,0,89231,Jawas,"Nebit Jawa Engineer, Jawa Scavenger, Jawa Dathcha",1
"spyalter",0,1,99744,Geonosians Omicron,"zzGBA Sun Fac, Geo Soldier, Geo Spy, Poggle",0
"spyalter",,,87719,Bad Batch,"zHunter G9, zEcho G9, zzOmega G9, zTech G9, zWrecker G8",0
"Sarith LeKit",,,178474,JMK,"zzzzzzJMK zAhsoka zzzCAT zzzzGAS zGK",1
"Sarith LeKit",,,175755,LV,"zzzzzzLord Vader, zzPiett zzzVader zRG zNinth Sister",1
"Sarith LeKit",,,162977,SEE,"zzzzzzSEE zBSF zzMalak zzzDR zDooku",1
"Sarith LeKit",1,1,166363,GL Rey,"zzzzzzRey zzJTR zzR2-D2 zRH Poe, zRH Finn",1
"Sarith LeKit",,,142210,SK,"zzEP zzMara Jade, The Emperor's Hand, zzStarkiller zzOld Ben, Visas",1
"Sarith LeKit",,,572582,Executor,"Executor HT RC Xanadu Blood, Slave I, IG-2000 Imperial TIE Fighter, Tie Adv",1
"Sarith LeKit",1,0,146198,CLS,"zzzCLS zHan zzChewbacca zzC-3PO zChewpio",1
"Sarith LeKit",,,513388,Negotiator,"Negotiator BTL-B Y-wing, Anakin's Eta-2, Rex's ARC-170, Umbaran SF, Ahsoka's SF, Plo's SF, Clone Sergeant's ARC-170",1
"Sarith LeKit",1,1,101882,NS_Alt,"zzMT zzAV Talia zDaka Zombie",1
"Sarith LeKit",,,413025,HansMF,"Home One, Han's MF, Rebel Y-wing 6*, Bistan's U-wing, Phantom Biggs X-wing, Cassian's U-wing, Wedge X-wing",1
"Sarith LeKit",0,1,130696,Grievous,"zzGG zB2 zB1 MagnaGuard zNute",1
"Sarith LeKit",1,0,107348,Traya,"zzTraya zDN zSion Sith Empire Trooper, zThrawn",1
"Sarith LeKit",,,109908,Mon Mothma,"zzMon Mothma, Wedge Biggs Lando Cassian",1
"Sarith LeKit",1,1,150084,Revan Offense,"zzzJKR zzGMY zzHYoda zJolee zJKA",1
"Sarith LeKit",1,1,89155,Ewoks,"zChirpa Elder Paploo zWicket Logray",1
"Sarith LeKit",1,0,152046,ShaakClones,"zzShaak Ti, zRex zEcho (501st), zzFives zARC Trooper",1
"Sarith LeKit",1,1,94483,Carth,"zCarth Onasi, zMission zZaalbar zVandor Chewbacca, Canderous",1
"Sarith LeKit",0,1,151913,BH,"zzBossk zzJango zBoba Dengar zZam",1
"Sarith LeKit",1,0,94649,Troopers,"zVeers zStarck Range Trooper, Stormtrooper Magma",1
"Sarith LeKit",0,1,90061,FO,"zzKRU Kylo G9, FOE G9, FOO zHux",1
"Sarith LeKit",0,1,71119,Phoenix,"Hera G8, Chopper G8, Kanan G8, zEzra Zeb G8",1
"Sarith LeKit",1,0,15381,NestSolo (Counter),"Nest",1
"Sarith LeKit",,,150155,JMLS,"zBS zzzzzzJMLS zWat Tambor, zzJKL zBarriss",0
"Sarith LeKit",0,1,93156,Geonosians Omicron,"zzGBA Sun Fac, Geo Soldier, Geo Spy, Poggle",0
"Sarith LeKit",,,123458,Bad Batch,"zHunter zEcho zzOmega G9, zTech zWrecker",0
"breezy",,,183024,JMK,"zzzzzzJMK zAhsoka zzzCAT zzzzGAS zGK",1
"breezy",,,123249,Phasma,"zPhasma zFOTP FOSFTP zFOST zKylo",1
"breezy",,,427410,Profundity,"Profundity Han's MF, Outrider Rebel Y-wing, Cassian's U-wing, Biggs X-wing",1
"breezy",1,1,164555,SL Kylo,"zzzzzzSL Kylo, zSith Trooper, zHux zzKRU zThrawn",1
"breezy",,,175731,SEE,"zzzzzzSEE zBSF zzMalak zzzDR zzzVader",1
"breezy",,,143956,SK,"zzEP zzMara Jade, The Emperor's Hand, zzStarkiller zzOld Ben, zVisas",1
"breezy",,,589318,Executor,"Executor HT RC Xanadu Blood, Slave I, IG-2000 Imperial TIE Fighter, Tie Adv",1
"breezy",1,0,152362,CLS,"zzzCLS zHan zzChewbacca zzC-3PO zChewpio",1
"breezy",,,527011,Negotiator,"Negotiator BTL-B Y-wing, Anakin's Eta-2, Rex's ARC-170, Umbaran SF, Ahsoka's SF, Plo's SF, Clone Sergeant's ARC-170",1
"breezy",,,317436,Malevolence,"Malevolence Hyena Bomber, Vulture Droid, Sun Fac SF, Soldier SF, Spy SF",1
"breezy",1,1,114572,NS_Alt,"zzAV Spirit Talia zDaka Zombie",1
"breezy",0,1,122580,Grievous,"zzGG zB2 zB1 MagnaGuard zNute",1
"breezy",1,0,109243,Traya,"zzTraya zDN zSion zDooku Sith Empire Trooper",1
"breezy",1,1,125087,JTR,"zzzJTR Scav Rey, zzBB-8 zzR2-D2 Finn",1
"breezy",,,120346,Mon Mothma,"zzMon Mothma, Bistan zPao Hoth Rebel Scout, zCara Dune",1
"breezy",,,133101,Disintegration,"zAurra zzGreef zBoba zzBossk zThe Mandalorian",1
"breezy",1,1,154101,Revan Offense,"zzzJKR zGMY zzHYoda zJolee zJKA",1
"breezy",1,0,147770,ShaakClones,"zzShaak Ti, zRex zEcho (501st), zzFives zARC Trooper",1
"breezy",1,1,83858,Ewoks,"zChirpa Elder Paploo Scout Logray",1
"breezy",1,1,104103,Carth,"zCarth Onasi, zMission zZaalbar zJuhani zCanderous",1
