Player,Offense,Defense,GP,Name,Squad,Viable
"Mini LilaBear",,,181653,JMK,"zzzzzzJMK zAhsoka zzzCAT zzzzGAS zGK",1
"Mini LilaBear",,,151676,Admiral Raddus,"zzAdmiral Raddus, zCassian zJyn zK-2SO Bistan",1
"Mini LilaBear",,,431755,Profundity,"Profundity 5* Han's MF, Outrider Rebel Y-wing, Cassian's U-wing, Biggs X-wing",1
"Mini LilaBear",,,177614,Jabba,"zzzzzzJabba zBoushh (Leia Organa), zSkiff Guard (Lando Calrissian), zKrrsantan zBoba",1
"Mini LilaBear",,,577547,Executor,"Executor HT RC Xanadu Blood, Slave I, IG-2000 Imperial TIE Fighter, Tie Adv",1
"Mini LilaBear",,,166053,JMLS,"zBS zzzzzzJMLS zWat Tambor, zzJKL zJolee",1
"Mini LilaBear",1,0,156881,CLS,"zzzCLS zHan zzChewbacca zC-3PO zChewpio",1
"Mini LilaBear",0,1,136114,DRMalak,"zzzDR HK-47 zBSF zzMalak Sith Empire Trooper",1
"Mini LilaBear",,,509040,Negotiator,"Negotiator BTL-B Y-wing, Anakin's Eta-2, Rex's ARC-170, Umbaran SF, Ahsoka's SF, Plo's SF, Clone Sergeant's ARC-170",1
"Mini LilaBear",,,322175,Malevolence,"Malevolence Hyena Bomber, Vulture Droid, Sun Fac SF, Soldier SF, Spy SF",1
"Mini LilaBear",0,1,130647,Grievous,"zzGG zB2 zDroideka MagnaGuard IG-88",1
"Mini LilaBear",,,119118,Mon Mothma,"zzMon Mothma, Wedge Biggs Lando Scarif",1
"Mini LilaBear",1,1,79896,Ewoks,"zChirpa Elder Paploo Wicket Logray",1
"Mini LilaBear",1,0,143770,ShaakClones,"zzShaak Ti, zRex Echo (501st), zzFives zARC Trooper",1
"Mini LilaBear",0,1,143898,BH,"zzBossk zEmbo zFennec Shand, zAurra Dengar",1
"Mini LilaBear",1,1,133632,zEP,"zzEP zzzVader Tarkin TFP zMara Jade, The Emperor's Hand",1
"Mini LilaBear",1,0,131887,Troopers,"zVeers zStarck zzPiett zGideon zDark Trooper",1
"Mini LilaBear",0,1,77682,Phoenix,"Hera Kanan G8, Ezra Sabine G8, Zeb G8",1
"Mini LilaBear",1,0,18132,SionSolo (Counter),"Sion",1
"Mini LilaBear",,,46184,Phasma,"Phasma G8, FOTP 3* G8, FOSFTP 5* G6, FOST 5* G8, Kylo G8",0
"Mini LilaBear",0,1,98143,Geonosians Omicron,"zGBA Sun Fac, Geo Soldier, Geo Spy, Poggle",0
"Mini LilaBear",1,1,97860,JTR,"JTR Scav Rey, BB-8 G9, R2-D2 Finn G8",0
"Mini LilaBear",,,94424,Nute-OR,"Nute G9, Dooku Jango Zaalbar zMission",0
"Mini LilaBear",1,1,66127,NS,"MT G8, AV Daka G9, Zombie G9, Spirit G8",0
"Mini LilaBear",,,96011,Mando,"zThe Mandalorian (Beskar Armor), zDash Rendar, Nest G7, IG-11 G9, Kuiil G9",0
"Mini LilaBear",1,0,66775,ThrawnTroopers,"Thrawn Range Trooper 5* G6, DT G8, Shoretrooper G8, Stormtrooper G8",0
"spyhunter",,,130421,Phasma,"zPhasma zFOTP FOSFTP zFOST zKylo",1
"spyhunter",,,419788,Profundity,"Profundity 5* Han's MF, Outrider Rebel Y-wing, Cassian's U-wing, Biggs X-wing",1
"spyhunter",1,1,165606,SL Kylo,"zzzzzzSL Kylo, zSith Trooper, zHux zzKRU zThrawn",1
"spyhunter",1,1,135783,NS,"zzMT zzAV zDaka Zombie Spirit",1
"spyhunter",,,593841,Executor,"Executor 5* HT RC Xanadu Blood, Slave I, IG-2000 Imperial TIE Fighter, Tie Adv",1
"spyhunter",,,185956,JMLS,"zzzJKR zzJKL zzzzzzJMLS zHYoda zzzzGAS",1
"spyhunter",1,0,154692,CLS,"zzCLS zHan zzChewbacca zzC-3PO zChewpio",1
"spyhunter",0,1,113899,padme,"zzPadme zGK zJKA zAhsoka CW Chewbacca G8",1
"spyhunter",1,0,104804,Traya,"zzTraya DN zSion zEP Sith Empire Trooper G9",1
"spyhunter",1,1,120218,JTR,"zzJTR Scav Rey, zBB-8 zzR2-D2 Finn",1
"spyhunter",,,113614,Mon Mothma,"Mon Mothma, Bistan Wedge Pao Biggs",1
"spyhunter",1,1,83398,Ewoks,"zChirpa Elder zPaploo Wicket Logray",1
"spyhunter",1,0,130161,ShaakClones,"zzShaak Ti, zRex Echo (501st), zFives ARC Trooper",1
"spyhunter",0,1,143667,BH,"zBossk Cad zIG-88 zBoba Dengar",1
"spyhunter",1,1,83035,Carth,"zCarth Onasi, Mission Zaalbar Juhani G8, Canderous",1
"spyhunter",0,1,79921,Phoenix,"Hera Chopper G9, Kanan G8, Ezra Zeb G8",1
"spyhunter",1,0,14022,NestSolo (Counter),"Nest G9",1
"spyhunter",,,118670,Admiral Raddus,"zzAdmiral Raddus, zCassian zJyn K-2SO Chirrut 5* G8",0
"spyhunter",,,108198,Grievous Omicron,"zGG zB2 zB1 MagnaGuard zDroideka",0
"spyhunter",0,1,110348,DRMalak,"zDR HK-47 zBSF zzMalak Sith Marauder",0
"spyhunter",0,1,93331,Geonosians Omicron,"zzGBA Sun Fac, Geo Soldier, Geo Spy, Poggle",0
"spyhunter",1,0,99860,Troopers,"Veers Starck Stormtrooper Snowtrooper zzPiett",0
"spyhunter",0,1,81026,BH,"Jango Greef G8, The Mandalorian, Greedo Zam G9",0
"spyhunter",1,0,53812,Jawas,"Nebit G5, Jawa Engineer G5, Jawa Scavenger G6, Jawa Dathcha G7",0
"Arquangle Maqulas",,,170014,JMK,"zzzzzzJMK zAhsoka zzzCAT zJKA zGK",1
"Arquangle Maqulas",,,122947,Phasma,"zPhasma zFOTP FOSFTP zFOST zKylo",1
"Arquangle Maqulas",,,139871,Admiral Raddus,"zzAdmiral Raddus, zCassian zJyn zK-2SO Bistan",1
"Arquangle Maqulas",1,1,164717,SL Kylo,"zzzzzzSL Kylo, zSith Trooper, zHux zzKRU zThrawn",1
"Arquangle Maqulas",,,171097,SEE,"zzzzzzSEE zBSF zzMalak zzzDR zzzVader",1
"Arquangle Maqulas",1,1,105505,NS,"zzMT zzAV zDaka Zombie Spirit",1
"Arquangle Maqulas",,,562342,Executor,"Executor 5* HT RC Xanadu Blood, Slave I, IG-2000 Imperial TIE Fighter, Tie Adv",1
"Arquangle Maqulas",,,180725,JMLS,"zzzJKR zzJKL zzzzzzJMLS zWat Tambor, zzzzGAS",1
"Arquangle Maqulas",1,0,151338,CLS,"zzzCLS zHan zzChewbacca zzC-3PO zChewpio",1
"Arquangle Maqulas",,,519939,Negotiator,"Negotiator BTL-B Y-wing, Anakin's Eta-2, Rex's ARC-170, Umbaran SF, Ahsoka's SF, Plo's SF, Clone Sergeant's ARC-170",1
"Arquangle Maqulas",,,325116,Malevolence,"Malevolence Hyena Bomber, Vulture Droid, Sun Fac SF, Soldier SF, Spy SF",1
"Arquangle Maqulas",,,491566,HansMF,"Home One, Han's MF, Rebel Y-wing, Bistan's U-wing, Phantom Ghost Cassian's U-wing, Wedge X-wing",1
"Arquangle Maqulas",1,1,117989,JTR,"zzzJTR zzR2-D2 BB-8 G9, zRH Finn, RH Poe G9",1
"Arquangle Maqulas",0,1,127806,Grievous,"zzGG zB2 zB1 zMagnaGuard zNute",1
"Arquangle Maqulas",1,0,119497,Traya,"zzTraya zDN zSion zzEP Sith Empire Trooper",1
"Arquangle Maqulas",1,1,90053,Ewoks,"zChirpa Elder Paploo Wicket zLogray",1
"Arquangle Maqulas",1,0,150437,ShaakClones,"zzShaak Ti, zRex zEcho (501st), zzFives zARC Trooper",1
"Arquangle Maqulas",0,1,152973,BH,"zzBossk zzJango zFennec Shand, zBoba zDengar",1
"Arquangle Maqulas",1,1,98303,Carth,"zCarth Onasi, zMission zZaalbar zJuhani zCanderous",1
"Arquangle Maqulas",1,0,122867,Troopers,"zVeers zStarck zIden Versio, zzPiett zGideon",1
"Arquangle Maqulas",0,1,95280,Phoenix,"zHera zKanan zEzra Sabine Zeb G8",1
"Arquangle Maqulas",0,1,136595,BS,"zBS zGMY zJolee zzOld Ben, zzHYoda",1
"Arquangle Maqulas",1,0,73286,Jawas,"Nebit G8, Jawa Engineer G9, Jawa Scavenger G8, Jawa Dathcha G8",1
"Arquangle Maqulas",1,0,21931,NestSolo (Counter),"zNest",1
"Arquangle Maqulas",0,1,103988,Geonosians Omicron,"zzGBA Sun Fac, Geo Soldier, Geo Spy, Poggle",0
"Arquangle Maqulas",,,119168,Mon Mothma,"zzMon Mothma, Wedge Biggs Lando zKyle Katarn",0
"Arquangle Maqulas",1,0,121087,zMaul,"Darth Maul, zDooku zSidious Sith Assassin, Sith Marauder",0
"Arquangle Maqulas",,,72529,Bad Batch,"Hunter G9, Echo G9, Omega G8, Tech G9, Wrecker G8",0
"EricTheodoreCartman",,,183821,JMK,"zzzzzzJMK zAhsoka zzzCAT zzzzGAS zGK",1
"EricTheodoreCartman",,,177053,SEE,"zzzzzzSEE zBSF zzMalak zzzDR zzVader",1
"EricTheodoreCartman",,,582000,Executor,"Executor HT RC Xanadu Blood, Slave I, IG-2000 Imperial TIE Fighter, Tie Adv",1
"EricTheodoreCartman",1,0,149471,CLS,"zzzCLS zHan zzChewbacca zC-3PO zChewpio",1
"EricTheodoreCartman",,,119749,Grievous Omicron,"zzGG zB2 zB1 MagnaGuard zDroideka",1
"EricTheodoreCartman",,,503468,Negotiator,"Negotiator BTL-B Y-wing, Anakin's Eta-2, Rex's ARC-170, Umbaran SF, Ahsoka's SF, Plo's SF, Clone Sergeant's ARC-170",1
"EricTheodoreCartman",,,307087,Malevolence,"Malevolence Hyena Bomber, Vulture Droid, Sun Fac SF, Soldier SF, Spy SF",1
"EricTheodoreCartman",,,118170,Nute-Wat,"zNute Dooku zWat Tambor, zJango Nest G9",1
"EricTheodoreCartman",,,117822,Disintegration,"Aurra Greef G8, Boba zzBossk The Mandalorian G8",1
"EricTheodoreCartman",1,1,141863,Revan Offense,"zzzJKR zGMY zHYoda zJolee zJKA",1
"EricTheodoreCartman",1,1,79285,Ewoks,"zChirpa Elder Paploo G9, Wicket Logray G9",1
"EricTheodoreCartman",1,0,141787,ShaakClones,"zzShaak Ti, zRex zEcho (501st), zzFives zARC Trooper",1
"EricTheodoreCartman",1,0,142172,Troopers,"zVeers zStarck zzPiett Gideon zDark Trooper",1
"EricTheodoreCartman",0,1,67086,Phoenix,"Hera G8, Chopper G9, Kanan G8, Ezra Zeb G8",1
"EricTheodoreCartman",,,50584,Phasma,"Phasma G7, FOTP G7, FOO G8, KRU G9, Kylo G7",0
"EricTheodoreCartman",0,1,92731,Geonosians Omicron,"zzGBA Sun Fac, Geo Soldier, Geo Spy, Poggle",0
"EricTheodoreCartman",,,306938,HansMF,"Home One, Han's MF, Rebel Y-wing, Bistan's U-wing, Phantom Ghost Cassian's U-wing, Wedge X-wing",0
"EricTheodoreCartman",1,0,68000,Traya,"Traya G6, DN G3, Sion G5, Sith Empire Trooper G8, Thrawn",0
"EricTheodoreCartman",1,1,82564,Carth,"Carth Onasi, zMission zZaalbar Juhani G7, zCanderous",0
"EricTheodoreCartman",1,0,108641,EP (Counter, Rebel),"zEP Krennic zzWampa Range Trooper G7, Stormtrooper G8",0
"Mileta",,,187751,JMK,"zzzzzzJMK zAhsoka zzzCAT zzzzGAS zGK",1
"Mileta",,,182969,SEE,"zzzzzzSEE zBSF zzMalak zzzDR zzzVader",1
"Mileta",1,1,172036,GL Rey,"zzzzzzRey zzzJTR zzBB-8 zHoldo zRH Finn",1
"Mileta",,,145219,SK,"zzEP zzMara Jade, The Emperor's Hand, zzStarkiller zzOld Ben, zVisas",1
"Mileta",1,1,107684,NS,"zzMT zzAV zDaka Zombie Spirit",1
"Mileta",1,0,146940,CLS,"zzzCLS zHan zzChewbacca zzC-3PO zChewpio",1
"Mileta",,,528672,Negotiator,"Negotiator HT Anakin's Eta-2, Umbaran SF, Ahsoka's SF, BTL-B Y-wing, Clone Sergeant's ARC-170, Plo's SF",1
"Mileta",,,313160,Malevolence,"Malevolence Hyena Bomber, Vulture Droid, Sun Fac SF, Soldier SF, Spy SF",1
"Mileta",,,388334,HansMF,"Home One, Han's MF, Rebel Y-wing, Bistan's U-wing, Phantom Biggs X-wing, Cassian's U-wing, Wedge X-wing",1
"Mileta",0,1,123808,Grievous,"zzGG zB2 zB1 zMagnaGuard zNute",1
"Mileta",1,0,122575,Traya,"zzTraya zDN zSion Sith Empire Trooper, zzThrawn",1
"Mileta",,,114871,Mon Mothma,"zzMon Mothma, Wedge Biggs zCara Dune, Lando",1
"Mileta",1,1,144420,Revan Offense,"zzzJKR zGMY zHYoda zJolee zJKA",1
"Mileta",1,1,85100,Ewoks,"zChirpa Elder zPaploo Wicket Logray",1
"Mileta",1,0,149379,ShaakClones,"zzShaak Ti, zRex zEcho (501st), zzFives zARC Trooper",1
"Mileta",0,1,147375,BH,"zzBossk zzJango zIG-88 zBoba zDengar",1
"Mileta",1,1,98299,Carth,"zCarth Onasi, Mission zZaalbar zJuhani zCanderous",1
"Mileta",1,0,128910,Troopers,"zVeers zStarck Range Trooper, zzPiett zzGideon",1
"Mileta",,,83290,Iden Troopers,"zIden Versio, Shoretrooper G9, Snowtrooper Magma DT",1
"Mileta",0,1,75757,Phoenix,"Hera G9, Kanan G8, Ezra Sabine Zeb G9",1
"Mileta",0,1,96847,FO,"zzKRU zKylo FOTP FOO zHux",1
"Mileta",,,118499,Mando,"zzThe Mandalorian (Beskar Armor), zDash Rendar, zNest zIG-11 zKuiil",1
"Mileta",,,154695,JMLS,"zBS zzzzzzJMLS zWat Tambor, zzJKL zBarriss",0
"Mileta",0,1,96948,Geonosians Omicron,"zzGBA Sun Fac, Geo Soldier, Geo Spy, Poggle",0
"Mileta",,,432038,Executrix,"Executrix Tie Adv, Emperor's Shuttle 5*, TIE Reaper 4*, Imperial TIE Fighter, Gauntlet Starfighter, FOSF TIE Fighter, FO TIE Fighter",0
"Mileta",1,0,122067,zMaul,"Darth Maul, zDooku zSidious Sith Assassin, Sith Marauder",0
"Mileta",,,80350,Bad Batch,"zHunter G9, zEcho G9, zzOmega G9, zTech G9, zWrecker G8",0
"Mileta",1,0,60394,Jawas,"Nebit G8, Jawa Engineer 4* G8, Jawa Scavenger G9, Jawa G9, Dathcha G9",0
"Gelbatron",,,175794,JMK,"zzzzzzJMK zJKA zGMY zzShaak Ti, zGK",1
"Gelbatron",,,177375,LV,"zzzzzzLord Vader, zzPiett zzzVader zRG zzTarkin",1
"Gelbatron",,,123076,Phasma,"zPhasma zFOTP FOSFTP zFOST zKylo",1
"Gelbatron",1,1,165242,SL Kylo,"zzzzzzSL Kylo, zSith Trooper, zHux zzKRU zzThrawn",1
"Gelbatron",,,159686,SEE,"zzzzzzSEE zBSF zzMalak zzzDR zDooku",1
"Gelbatron",0,1,102273,Qira,"zQira L3-37 zVandor Chewbacca, zMission zZaalbar",1
"Gelbatron",1,1,168587,GL Rey,"zzzzzzRey zzzJTR zzBB-8 zRH Poe, zRH Finn",1
"Gelbatron",,,167070,Jabba,"zzzzzzJabba zBoushh (Leia Organa), zSkiff Guard (Lando Calrissian), zKrrsantan zBoba",1
"Gelbatron",,,144041,SK,"zzEP zzMara Jade, The Emperor's Hand, zzStarkiller zzOld Ben, zVisas",1
"Gelbatron",1,1,112326,NS,"zzMT zzAV zDaka Zombie Spirit",1
"Gelbatron",,,600681,Executor,"Executor HT RC Xanadu Blood, Slave I, IG-2000 Tie Adv, TIE Reaper",1
"Gelbatron",,,180176,JMLS,"zzzJKR zzJKL zzzzzzJMLS zWat Tambor, zzzzGAS",1
"Gelbatron",1,0,151319,CLS,"zzzCLS zHan zzChewbacca zzC-3PO zChewpio",1
"Gelbatron",,,510200,Negotiator,"Negotiator BTL-B Y-wing, Anakin's Eta-2, Rex's ARC-170, Umbaran SF, Ahsoka's SF, Plo's SF, Clone Sergeant's ARC-170",1
"Gelbatron",,,333846,Malevolence,"Malevolence Hyena Bomber, Vulture Droid, Sun Fac SF, Soldier SF, Spy SF",1
"Gelbatron",,,504501,HansMF,"Home One, Han's MF, Rebel Y-wing, Bistan's U-wing, Phantom Ghost Cassian's U-wing, Wedge X-wing",1
"Gelbatron",0,1,136540,Grievous,"zzGG zB2 zB1 zMagnaGuard zNute",1
"Gelbatron",1,0,118112,Traya,"zzTraya zDN zSion Sith Assassin, Sith Empire Trooper",1
"Gelbatron",,,119328,Mon Mothma,"zzMon Mothma, Bistan zPao Hoth Rebel Scout, zCara Dune",1
"Gelbatron",1,1,98978,Ewoks,"zChirpa Elder zPaploo Wicket Logray",1
"Gelbatron",0,1,151676,BH,"zzBossk zzJango zFennec Shand, zDengar zZam",1
"Gelbatron",1,0,142501,501st,"zRex zARC Trooper, zEcho (501st), zzFives zAhsoka",1
"Gelbatron",1,0,122690,Troopers,"zVeers zStarck zIden Versio, zzGideon zDark Trooper",1
"Gelbatron",0,1,104771,Phoenix,"zHera zKanan zEzra zSabine zZeb",1
"Gelbatron",1,1,115317,Rogue1,"zzJyn Chirrut Baze zK-2SO zCassian",1
"Gelbatron",1,0,73694,Jawas,"Nebit G8, Jawa Engineer G8, Jawa Scavenger G8, Jawa Dathcha G8",1
"Gelbatron",1,0,20568,NestSolo (Counter),"zNest",1
"Gelbatron",0,1,112474,Geonosians Omicron,"zzGBA Sun Fac, Geo Soldier, Geo Spy, Poggle",0
"Gelbatron",,,122505,Bad Batch,"zHunter zEcho zzOmega G9, zTech zWrecker",0
"Kolibri",,,183489,JMK,"zzzzzzJMK zAhsoka zzzCAT zzzzGAS zGK",1
"Kolibri",,,183289,LV,"zzzzzzLord Vader, zzPiett zzzMaul zRG zzzVader",1
"Kolibri",,,143713,Admiral Raddus,"zzAdmiral Raddus, zCassian zJyn zK-2SO Bistan",1
"Kolibri",,,443142,Profundity,"Profundity Han's MF, Outrider Rebel Y-wing, Cassian's U-wing, Ghost",1
"Kolibri",1,1,163039,SL Kylo,"zzzzzzSL Kylo, zSith Trooper, zHux zzKRU zThrawn",1
"Kolibri",,,173470,SEE,"zzzzzzSEE zBSF zzMalak zzzDR zDooku",1
"Kolibri",0,1,113662,Qira,"zQira L3-37 zVandor Chewbacca, zMission Zaalbar",1
"Kolibri",1,1,170284,GL Rey,"zzzzzzRey zzzJTR zzBB-8 zRH Poe, zRH Finn",1
"Kolibri",,,146884,SK,"zzEP zzMara Jade, The Emperor's Hand, zzStarkiller zzOld Ben, Visas",1
"Kolibri",,,163967,Jabba,"zzzzzzJabba zBoushh (Leia Organa), zSkiff Guard (Lando Calrissian), Krrsantan zBoba",1
"Kolibri",1,1,127438,NS,"zzMT zzAV zDaka Zombie Spirit",1
"Kolibri",,,616583,Executor,"Executor HT RC Xanadu Blood, Slave I, IG-2000 Tie Adv, TIE Reaper",1
"Kolibri",,,167932,JMLS,"zBS zzzzzzJMLS zWat Tambor, zzJKL zBarriss",1
"Kolibri",1,0,154531,CLS,"zzzCLS zHan zzChewbacca zC-3PO zChewpio",1
"Kolibri",,,518414,Negotiator,"Negotiator BTL-B Y-wing, Anakin's Eta-2, Rex's ARC-170, Umbaran SF, Ahsoka's SF, Plo's SF, Clone Sergeant's ARC-170",1
"Kolibri",,,311367,Malevolence,"Malevolence Hyena Bomber, Vulture Droid, Sun Fac SF, Soldier SF, Spy SF",1
"Kolibri",0,1,136789,Grievous,"zzGG zB2 zB1 MagnaGuard zNute",1
"Kolibri",1,0,132402,Traya,"zzTraya zzDN zSion Sith Empire Trooper, zNest",1
"Kolibri",,,132493,Mon Mothma,"zzMon Mothma, zPao Hoth Rebel Scout, zCara Dune, Scarif",1
"Kolibri",1,1,155850,Revan Offense,"zzzJKR zzGMY zzHYoda zJolee zJKA",1
"Kolibri",1,1,80687,Ewoks,"zChirpa Elder Paploo Wicket Logray",1
"Kolibri",1,0,151419,ShaakClones,"zzShaak Ti, zRex zEcho (501st), zzFives zARC Trooper",1
"Kolibri",0,1,152407,BH,"zzBossk zzJango Dengar zZam zBoba Fett, Scion of Jango",1
"Kolibri",1,0,136910,Troopers,"zVeers zStarck zIden Versio, zzGideon zDark Trooper",1
"Kolibri",0,1,96757,Phoenix,"Hera Kanan Ezra zSabine Zeb G8",1
"Kolibri",,,132690,Bad Batch,"zHunter zEcho zzOmega zTech zWrecker",1
"Kolibri",1,0,104445,Wiggs,"Wedge Biggs zFulcrum Chirrut Baze",1
"Kolibri",1,0,123825,zMaul,"zDarth Maul, zSidious Sith Assassin, zSavage Sith Marauder",1
"Kolibri",1,0,83085,Jawas,"Nebit Jawa Engineer, Jawa Scavenger, Jawa Dathcha",1
"Kolibri",,,127335,Phasma,"zPhasma zFOTP FOSFTP zFOST zKylo",0
"Kolibri",0,1,100643,Geonosians Omicron,"zzGBA Sun Fac, Geo Soldier, Geo Spy, Poggle",0
"Zipmiler",,,179096,JMK,"zzzzzzJMK zAhsoka zzzCAT zzzzGAS zGK",1
"Zipmiler",,,162026,SEE,"zzzzzzSEE zBSF zzMalak zzzDR zzzVader",1
"Zipmiler",,,174178,Jabba,"zzzzzzJabba zBoushh (Leia Organa), zSkiff Guard (Lando Calrissian), zKrrsantan zBoba",1
"Zipmiler",,,578161,Executor,"Executor HT RC Xanadu Blood, Slave I, IG-2000 Imperial TIE Fighter, Tie Adv",1
"Zipmiler",1,0,148066,CLS,"zzzCLS zHan zChewbacca zzC-3PO zChewpio",1
"Zipmiler",,,507505,Negotiator,"Negotiator BTL-B Y-wing 6*, Anakin's Eta-2, Rex's ARC-170, Umbaran SF, Ahsoka's SF, Plo's SF, Clone Sergeant's ARC-170",1
"Zipmiler",,,327986,Malevolence,"Malevolence Hyena Bomber, Vulture Droid, Sun Fac SF, Soldier SF, Spy SF",1
"Zipmiler",,,130164,JKL,"zzJKL zzzJKR zHYoda Old Ben, Aayla",1
"Zipmiler",,,396204,HansMF,"Home One, Han's MF, Rebel Y-wing, Ghost Phantom Biggs X-wing, Cassian's U-wing, Wedge X-wing",1
"Zipmiler",1,0,100873,Traya,"zzTraya DN Sion Sith Empire Trooper G9, Thrawn",1
"Zipmiler",0,1,130839,Grievous-Wat,"zzGG zB2 zB1 zMagnaGuard zWat Tambor",1
"Zipmiler",1,1,78617,Ewoks,"zChirpa Elder Paploo Wicket Logray",1
"Zipmiler",1,0,153852,ShaakClones,"zzShaak Ti, zRex zEcho (501st), zzFives zARC Trooper",1
"Zipmiler",1,1,82454,Carth,"zCarth Onasi, zMission Zaalbar Juhani G8, Canderous",1
"Zipmiler",0,1,137185,BH,"zzBossk Jango Fennec Shand, zGreedo Dengar",1
"Zipmiler",1,0,121371,Troopers,"zVeers zStarck Range Trooper, zzPiett zGideon",1
"Zipmiler",0,1,67013,Phoenix,"Hera G8, Chopper G8, Kanan G8, Ezra Zeb G8",1
"Zipmiler",,,71387,Phasma,"Phasma G7, FOTP FOE G9, zKRU Kylo G8",0
"Zipmiler",0,1,102121,Geonosians Omicron,"zzGBA Sun Fac, Geo Soldier, Geo Spy, Poggle",0
"Zipmiler",1,1,101021,JTR,"JTR Scav Rey G8, BB-8 G8, zzR2-D2 Finn G9",0
"Zipmiler",,,98209,Mon Mothma,"Mon Mothma, K-2SO G8, Wedge Biggs Lando",0
"Zipmiler",1,0,115017,zMaul,"Darth Maul, zSidious zDooku Sith Marauder, Nest G7",0
"Wuchur",,,169973,JMK,"zzzzzzJMK zAhsoka zzzCAT zJKA zGK",1
"Wuchur",,,123256,Phasma,"zPhasma zFOTP FOSFTP zFOST zKylo",1
"Wuchur",1,1,162343,SL Kylo,"zzzzzzSL Kylo, zSith Trooper, zHux zzKRU zThrawn",1
"Wuchur",,,164526,SEE,"zzzzzzSEE zBSF zzMalak zzzDR zzzVader",1
"Wuchur",,,163798,Jabba,"zzzzzzJabba zBoushh (Leia Organa), zSkiff Guard (Lando Calrissian), Krrsantan zBoba",1
"Wuchur",1,1,103093,NS,"zzMT zzAV zDaka Zombie Spirit",1
"Wuchur",,,569236,Executor,"Executor 5* HT RC Xanadu Blood, Slave I, IG-2000 Imperial TIE Fighter, Tie Adv",1
"Wuchur",,,177664,JMLS,"zzzJKR zzJKL zzzzzzJMLS zWat Tambor, zzzzGAS",1
"Wuchur",1,0,153895,CLS,"zzzCLS zHan zzChewbacca zzC-3PO zChewpio",1
"Wuchur",,,415242,HansMF,"Home One, Han's MF, Rebel Y-wing, Bistan's U-wing, Phantom Biggs X-wing, Cassian's U-wing, Wedge X-wing",1
"Wuchur",1,1,141422,JTR,"zzzJTR zzR2-D2 zzBB-8 zRH Finn, zRH Poe",1
"Wuchur",0,1,122564,Grievous,"zzGG zB2 zB1 zMagnaGuard zNute",1
"Wuchur",1,0,103199,Traya,"zzTraya zDN Sion G9, zzEP Sith Empire Trooper G8",1
"Wuchur",,,123206,Mon Mothma,"zzMon Mothma, Baze Wedge zCara Dune, Chirrut",1
"Wuchur",1,1,83137,Ewoks,"zChirpa Elder Paploo Wicket Logray",1
"Wuchur",1,0,115734,ShaakClones,"zzShaak Ti, zRex zEcho (501st), zzFives zARC Trooper",1
"Wuchur",1,1,101398,Carth,"zCarth Onasi, zMission zZaalbar zJuhani zCanderous",1
"Wuchur",0,1,151011,BH,"zzBossk zzJango zFennec Shand, zDengar zBoba Fett, Scion of Jango",1
"Wuchur",1,0,125396,Troopers,"zVeers zStarck Range Trooper, zzPiett zzGideon",1
"Wuchur",1,0,127489,zMaul,"zDarth Maul, zSidious zDooku Sith Marauder, zNest",1
"Wuchur",0,1,69868,Phoenix,"Hera G8, Chopper G9, Kanan G8, Ezra Zeb G8",1
"Wuchur",0,1,130717,BS,"zBS zGMY zJolee zzOld Ben, zzHYoda",1
"Wuchur",,,469519,Negotiator,"Negotiator BTL-B Y-wing 5*, Anakin's Eta-2, Rex's ARC-170 6*, Umbaran SF, Ahsoka's SF, Plo's SF, Clone Sergeant's ARC-170",0
"Wuchur",,,274476,Malevolence,"Malevolence Hyena Bomber 4*, Vulture Droid 6*, Sun Fac SF, Soldier SF, Spy SF",0
"Wuchur",0,1,84587,Geonosians Omicron,"zzGBA Sun Fac G8, Geo Soldier, Geo Spy, Poggle",0
"Stardust",,,177380,JMK,"zzzzzzJMK zAhsoka zzzCAT zzzzGAS zGK",1
"Stardust",,,171921,LV,"zzzzzzLord Vader, zzPiett zzzVader zRG zTarkin",1
"Stardust",,,122730,Phasma,"zPhasma zFOTP FOSFTP zFOST zKylo",1
"Stardust",,,453991,Profundity,"Profundity Han's MF, Outrider Rebel Y-wing, Cassian's U-wing, Ghost",1
"Stardust",1,1,164658,SL Kylo,"zzzzzzSL Kylo, zSith Trooper, zHux zzKRU zzThrawn",1
"Stardust",,,163906,SEE,"zzzzzzSEE zBSF zzMalak zzzDR zDooku",1
"Stardust",1,1,170308,GL Rey,"zzzzzzRey zzzJTR zzBB-8 zRH Poe, zRH Finn",1
"Stardust",,,587227,Executor,"Executor HT RC Xanadu Blood, Slave I, IG-2000 Imperial TIE Fighter, Tie Adv",1
"Stardust",,,157880,JMLS,"zBS zzzzzzJMLS zWat Tambor, zzJKL zJolee",1
"Stardust",1,0,151220,CLS,"zzzCLS zHan zzChewbacca zzC-3PO zChewpio",1
"Stardust",1,1,112301,NestSisters,"zzAV zzMT zDaka Zombie zNest",1
"Stardust",,,522936,Negotiator,"Negotiator BTL-B Y-wing, Anakin's Eta-2, Rex's ARC-170, Umbaran SF, Ahsoka's SF, Plo's SF, Clone Sergeant's ARC-170",1
"Stardust",0,1,145468,Grievous,"zzGG zB2 zB1 zMagnaGuard zNute",1
"Stardust",1,0,128258,Traya,"zzTraya zzDN zSion zzEP Sith Empire Trooper",1
"Stardust",,,109595,Mon Mothma,"zzMon Mothma, Bistan zPao zCara Dune, Scarif",1
"Stardust",,,137639,Disintegration,"zzAurra zzGreef zBoba zzBossk zzThe Mandalorian",1
"Stardust",1,1,92423,Ewoks,"zChirpa Elder zPaploo zWicket Logray",1
"Stardust",1,0,154501,ShaakClones,"zzShaak Ti, zRex zEcho (501st), zzFives zARC Trooper",1
"Stardust",1,1,99645,Carth,"zCarth Onasi, zMission zZaalbar zJuhani zCanderous",1
"Stardust",0,1,149861,BH,"zzJango zzEmbo zFennec Shand, Dengar zZam",1
"Stardust",1,0,103896,Troopers,"zVeers zStarck DT Shoretrooper zzGideon",1
"Stardust",0,1,111039,Phoenix,"zHera zKanan zEzra zSabine zZeb",1
"Stardust",1,1,114645,Rogue1,"zzJyn Chirrut Baze K-2SO zCassian",1
"Stardust",,,130410,Bad Batch,"zHunter zEcho zzOmega zTech zWrecker",1
"Stardust",1,0,114230,zMaul,"zDarth Maul, zSidious Sith Assassin, Savage Sith Marauder",1
"Stardust",,,301081,Malevolence,"Malevolence Hyena Bomber 6*, Vulture Droid 6*, Sun Fac SF, Soldier SF, Spy SF",0
"Stardust",0,1,97356,Geonosians Omicron,"zzGBA Sun Fac, Geo Soldier, Geo Spy, Poggle",0
"Stardust",1,0,73041,Jawas,"Nebit G8, Jawa Engineer, Jawa Scavenger G7, Jawa Dathcha",0
"Crni Djordje",,,177994,JMK,"zzzzzzJMK zAhsoka zzzCAT zzzzGAS zGK",1
"Crni Djordje",,,123334,Phasma,"zPhasma zFOTP FOSFTP zFOST zKylo",1
"Crni Djordje",,,416161,Profundity,"Profundity 5* Han's MF, Outrider Rebel Y-wing, Cassian's U-wing, Ghost",1
"Crni Djordje",1,1,168020,SL Kylo,"zzzzzzSL Kylo, zSith Trooper, zHux zzKRU zzThrawn",1
"Crni Djordje",,,170888,SEE,"zzzzzzSEE zBSF zzMalak zzzDR zzzVader",1
"Crni Djordje",1,1,119024,NS,"zzMT zzAV zDaka Zombie Spirit",1
"Crni Djordje",,,590672,Executor,"Executor HT RC Xanadu Blood, Slave I, IG-2000 Imperial TIE Fighter, Tie Adv",1
"Crni Djordje",,,151724,JMLS,"zBS zzzzzzJMLS zWat Tambor, zzJKL zJolee",1
"Crni Djordje",1,0,144103,CLS,"zzzCLS zHan zzChewbacca zzC-3PO zChewpio",1
"Crni Djordje",,,520401,Negotiator,"Negotiator BTL-B Y-wing, Anakin's Eta-2, Rex's ARC-170, Umbaran SF, Ahsoka's SF, Plo's SF, Clone Sergeant's ARC-170",1
"Crni Djordje",,,324671,Malevolence,"Malevolence Hyena Bomber, Vulture Droid, Sun Fac SF, Soldier SF, Spy SF",1
"Crni Djordje",0,1,128025,Grievous,"zzGG zB2 zB1 zMagnaGuard zNute",1
"Crni Djordje",1,0,116977,Traya,"zzTraya zDN zSion zzEP Sith Empire Trooper G8",1
"Crni Djordje",1,1,123685,JTR,"zzzJTR Scav Rey, zzBB-8 zzR2-D2 RT",1
"Crni Djordje",,,109268,Mon Mothma,"zzMon Mothma, Bistan Wedge zCara Dune, Scarif",1
"Crni Djordje",1,0,145707,ShaakClones,"zzShaak Ti, zRex zEcho (501st), zzFives zARC Trooper",1
"Crni Djordje",1,1,84846,Ewoks,"zChirpa Elder Paploo Scout Logray",1
"Crni Djordje",0,1,147686,BH,"zzBossk zJango zIG-88 zBoba zDengar",1
"Crni Djordje",1,1,95127,Carth,"zCarth Onasi, zMission zZaalbar Juhani Canderous",1
"Crni Djordje",1,0,120527,Troopers,"zVeers zStarck Snowtrooper zzPiett zzGideon",1
"Crni Djordje",0,1,87747,Phoenix,"Hera Kanan G8, Ezra Sabine Zeb",1
"Crni Djordje",1,0,81332,Jawas,"Nebit Jawa Engineer, Jawa Scavenger, Jawa Dathcha",1
"Crni Djordje",1,0,68606,QiraNest,"Qira zNest zzHYoda",1
"Crni Djordje",,,128353,Admiral Raddus,"zzAdmiral Raddus, zCassian zJyn zK-2SO Chirrut G8",0
"Crni Djordje",0,1,106563,Geonosians Omicron,"zzGBA Sun Fac, Geo Soldier, Geo Spy, Poggle",0
"Crni Djordje",1,0,121327,zMaul,"Darth Maul, zDooku zSidious Savage Sith Marauder",0
"jorke",0,1,97102,Qira,"zQira L3-37 zVandor Chewbacca, zMission zZaalbar",1
"jorke",,,158865,JMLS,"zzzJKR zzJKL zzzzzzJMLS zWat Tambor, zzzzGAS",1
"jorke",1,0,145466,CLS,"zzzCLS zHan zzChewbacca zzC-3PO zChewpio",1
"jorke",0,1,120744,DRMalak,"zzzDR zzHK-47 zBSF zzMalak Sith Empire Trooper",1
"jorke",0,1,134591,padme,"zzPadme zGK zJKA zAhsoka zBarriss",1
"jorke",1,1,109975,NestSisters,"zzAV zMT zDaka Zombie zNest",1
"jorke",,,415424,HansMF,"Home One, Han's MF, Rebel Y-wing 6*, Bistan's U-wing, Phantom Biggs X-wing, Cassian's U-wing, Wedge X-wing",1
"jorke",,,507374,Negotiator,"Negotiator HT Anakin's Eta-2, Umbaran SF, Ahsoka's SF, Clone Sergeant's ARC-170, Plo's SF, Rex's ARC-170",1
"jorke",0,1,122128,Grievous,"zzGG zB2 zB1 MagnaGuard zNute",1
"jorke",1,0,124502,Traya,"zzTraya zDN zSion zzEP zzThrawn",1
"jorke",1,1,122283,JTR,"zzzJTR Scav Rey, zBB-8 zzR2-D2 RT",1
"jorke",,,102044,Mon Mothma,"zzMon Mothma, Wedge Biggs Chirrut Scarif",1
"jorke",,,91596,Disintegration,"Aurra Greef G8, zBoba zzBossk The Mandalorian G8",1
"jorke",1,1,80449,Ewoks,"zChirpa G9, Elder Paploo Wicket Logray",1
"jorke",1,0,136826,ShaakClones,"zzShaak Ti, zRex zEcho (501st), zzFives zARC Trooper",1
"jorke",0,1,119070,FO,"zzKRU zKylo FOE zFOST zHux",1
"jorke",1,0,84777,Troopers,"zVeers Starck Range Trooper, DT Shoretrooper",1
"jorke",0,1,73435,Phoenix,"Hera G9, Kanan G8, Ezra Sabine Zeb G8",1
"jorke",1,0,71596,Jawas,"Nebit G9, Jawa Engineer G9, Jawa Scavenger, Jawa G9, Dathcha",1
