Player,Offense,Defense,GP,Name,Squad,Viable
"BluntSkull",1,0,104724,Troopers,"zVeers zzPiett zGideon zDark Trooper, Range Trooper",1
"BluntSkull",1,1,82029,Ewoks,"zChirpa Elder Paploo Wicket Logray",1
"BluntSkull",1,0,118407,ShaakClones,"zzShaak Ti, zRex Echo (501st), zzFives ARC Trooper",1
"BluntSkull",0,1,73628,Phoenix,"Hera Ezra Zeb G9, Chopper Kanan G9",1
"BluntSkull",,,53029,Phasma,"Phasma G7, FOE G7, FOO G9, KRU Kylo G7",0
"BluntSkull",,,43745,Admiral Raddus,"Admiral Raddus 3* G8, Cassian G8, Jyn 6* G8, K-2SO G8, Bistan G8",0
"BluntSkull",0,1,79055,padme,"Padme GK G8, JKA 6* Ahsoka C-3PO",0
"BluntSkull",0,1,101098,Geonosians Omicron,"zzGBA Sun Fac, Geo Soldier, Geo Spy, Poggle",0
"BluntSkull",,,51060,Nute-OR,"Nute G7, Dooku Jango G7, Zaalbar G7, Mission G7",0
"BluntSkull",1,1,57211,zEP,"EP G9, Vader G9, Tarkin G6, TFP G6, BSF",0
"BluntSkull",0,1,51066,BH,"Bossk G9, Dengar G6, Greef 6* G6, Boba G8, Cad G7",0
"Belisarius",,,132623,Phasma,"zPhasma FOE FOO zzKRU zKylo",1
"Belisarius",,,333091,HansMF,"Home One, Han's MF, HT Ghost Phantom Biggs X-wing, Cassian's U-wing, Wedge X-wing",1
"Belisarius",1,1,81986,Ewoks,"zChirpa Elder Paploo G9, Wicket Logray",1
"Belisarius",0,1,95319,BH,"zBossk Dengar G9, zThe Mandalorian, Boba Cad",1
"Belisarius",1,1,111700,zEP,"zzEP zzVader Tarkin TFP G9, zBSF",1
"Belisarius",0,1,80707,Phoenix,"Hera zEzra Zeb G8, Chopper Kanan G8",1
"Belisarius",0,1,87762,padme,"zPadme zGK G9, zJKA Ahsoka Fives G8",1
"Belisarius",,,237404,Negotiator,"Negotiator BTL-B Y-wing 3*, Anakin's Eta-2, Rex's ARC-170, Umbaran SF, Ahsoka's SF, Plo's SF, Clone Sergeant's ARC-170",0
"Belisarius",1,0,93995,CLS,"zzzCLS zHan Chewbacca R2-D2 G8, Chewpio",0
"Belisarius",0,1,93672,Geonosians Omicron,"zGBA Sun Fac, Geo Soldier, Geo Spy, Poggle",0
"Belisarius",1,0,54921,Traya,"zTraya DN 6* G8, Sion G7, Dooku G8, Thrawn G8",0
"Belisarius",1,0,88174,Troopers,"Veers zPiett zGideon Dark Trooper, Range Trooper G9",0
"Belisarius",0,1,47376,Grievous,"GG G9, B2 G7, MagnaGuard G7, IG-88 G9, T3-M4 G7",0
"Belisarius",1,1,56292,NS_Alt,"MT G9, AV G8, Talia G9, Spirit G8, Daka",0
"Belisarius",1,1,98055,Revan Offense,"zJKR zGMY BS Jolee HYoda",0
"Belisarius",1,1,65396,Carth,"Carth Onasi, Mission G8, Zaalbar G7, Juhani 6* G9, Canderous",0
"Belisarius",1,1,47079,Rogue1,"Jyn 6* G8, Chirrut G8, Baze 6* G8, K-2SO G8, Cassian G9",0
"Belisarius",1,0,34075,Jawas,"Nebit G6, Jawa Engineer G6, Jawa Scavenger G7, Jawa G6, Dathcha G7",0
"Ah Loi",1,0,133591,CLS,"zzzCLS zHan zzChewbacca zC-3PO zChewpio",1
"Ah Loi",0,1,142790,padme,"zzPadme zGK zJKA zAhsoka zBarriss",1
"Ah Loi",,,537823,Negotiator,"Negotiator 6* HT Anakin's Eta-2, Umbaran SF, Ahsoka's SF, Clone Sergeant's ARC-170, Plo's SF, Rex's ARC-170",1
"Ah Loi",0,1,126806,Grievous,"zzGG zB2 zB1 zDroideka Dooku",1
"Ah Loi",1,1,159211,GAS,"zzzzGAS zRex zEcho (501st), zzFives zARC Trooper",1
"Ah Loi",1,1,76489,Ewoks,"zChirpa G9, Elder Paploo Wicket G9, Logray G9",1
"Ah Loi",1,1,101340,zEP,"zEP zzVader Tarkin G8, zSith Trooper, zTraya",1
"Ah Loi",0,1,94049,Geonosians Omicron,"zGBA Sun Fac, Geo Soldier, Geo Spy, Poggle",0
"Ah Loi",0,1,111562,BH,"zzBossk Boba zJango Cad Greedo G7",0
"Ah Loi",1,0,74946,Troopers,"zVeers Starck G9, Snowtrooper DT 6* Range Trooper 6* G9",0
"Ah Loi",0,1,64482,Phoenix,"Hera G8, Ezra G9, Zeb G7, Chopper G8, Kanan G8",0
"Ah Loi",0,1,88864,BS,"BS 5* G7, zGMY zJolee Old Ben G9, HYoda 5*",0
"Wolffe Pack",,,178516,JMK,"zzzzzzJMK zAhsoka zzzCAT zzzzGAS zGK",1
"Wolffe Pack",,,125130,Phasma,"zPhasma zFOTP FOSFTP zFOST zKylo",1
"Wolffe Pack",,,135424,SK,"zzEP zzMara Jade, The Emperor's Hand, zzStarkiller zJuhani zVisas",1
"Wolffe Pack",1,1,162220,SL Kylo,"zzzzzzSL Kylo, zSith Trooper, zHux zzKRU zThrawn",1
"Wolffe Pack",,,148075,SEE,"zzzzzzSEE zBSF zzMalak zzzDR zzzVader",1
"Wolffe Pack",1,1,105726,NS,"zMT zzAV zDaka Zombie Spirit",1
"Wolffe Pack",,,570482,Executor,"Executor HT RC Xanadu Blood, Slave I, IG-2000 Imperial TIE Fighter, Tie Adv",1
"Wolffe Pack",1,0,142984,CLS,"zzzCLS zHan zzChewbacca zC-3PO zChewpio",1
"Wolffe Pack",,,519435,Negotiator,"Negotiator BTL-B Y-wing, Anakin's Eta-2, Rex's ARC-170, Umbaran SF, Ahsoka's SF, Plo's SF, Clone Sergeant's ARC-170",1
"Wolffe Pack",,,304747,Malevolence,"Malevolence Hyena Bomber, Vulture Droid, Sun Fac SF, Soldier SF, Spy SF",1
"Wolffe Pack",0,1,93585,Geonosians Omicron,"zzGBA Sun Fac, Geo Soldier, Geo Spy, Poggle",1
"Wolffe Pack",,,136749,JKL,"zJKL zzzJKR zHYoda zOld Ben, Aayla",1
"Wolffe Pack",,,406429,HansMF,"Home One, Han's MF, Rebel Y-wing, Ghost Phantom Biggs X-wing, Cassian's U-wing, Wedge X-wing",1
"Wolffe Pack",0,1,122066,Grievous,"zzGG zB2 zB1 MagnaGuard zNute",1
"Wolffe Pack",1,0,107253,Traya,"zzTraya DN zSion zDooku Sith Empire Trooper",1
"Wolffe Pack",1,1,118562,JTR,"zzJTR Scav Rey, zBB-8 zzR2-D2 Finn",1
"Wolffe Pack",,,102495,Mon Mothma,"zzMon Mothma, Baze Wedge Chirrut Biggs",1
"Wolffe Pack",1,0,152385,ShaakClones,"zzShaak Ti, zRex zEcho (501st), zzFives zARC Trooper",1
"Wolffe Pack",1,1,76076,Ewoks,"zChirpa G9, Elder Paploo Scout Logray G9",1
"Wolffe Pack",0,1,146670,BH,"zzBossk Dengar zIG-88 zBoba zzJango",1
"Wolffe Pack",1,0,124077,Troopers,"zVeers zStarck zzPiett zDark Trooper, Range Trooper",1
"Wolffe Pack",0,1,68004,Phoenix,"Hera G8, Ezra Zeb G8, Sabine G8, Kanan G8",1
"Wolffe Pack",,,124298,Bad Batch,"zHunter zEcho zOmega zTech zWrecker",1
"Wolffe Pack",1,0,16405,NestSolo (Counter),"Nest",1
"Wolffe Pack",1,0,66033,Jawas,"Nebit Jawa Engineer, Jawa Scavenger G8, Jawa G8, Dathcha G8",0
"Delmon",,,118005,Phasma,"zPhasma zFOTP FOSFTP FOST zKylo",1
"Delmon",0,1,89212,Geonosians Omicron,"zGBA Sun Fac, Geo Soldier, Geo Spy, Poggle",1
"Delmon",1,0,91067,Troopers,"zVeers zzPiett Gideon zDark Trooper, Range Trooper",1
"Delmon",1,1,92586,Revan,"zzJKR BS GMY zJolee GK",1
"Delmon",1,1,84663,Ewoks,"zChirpa G9, Elder Paploo zWicket zLogray",1
"Delmon",0,1,82635,BH,"zBossk Greef G9, Boba Jango Cad",1
"Delmon",0,1,67101,Phoenix,"Hera G9, Ezra Zeb G8, Chopper G9, Kanan G8",1
"Delmon",1,0,88012,CLS,"zCLS zHan zChewbacca G9, C-3PO zChewpio G9",0
"Delmon",,,66282,Mon Mothma,"zMon Mothma 6* G9, Bistan G7, Pao G9, Kyle Katarn G9, Hoth Rebel Scout G9",0
"Delmon",1,1,99829,zEP,"EP zzVader Tarkin G9, zSith Trooper, zTraya 6* G7",0
"Delmon",1,0,10911,SionSolo (Counter),"Sion G6",0
"jack0",1,1,78479,Ewoks,"zChirpa Elder Paploo Scout Logray",1
"jack0",1,1,128919,zEP,"zzEP zzzVader zTarkin zKrennic Sion G9",1
"jack0",0,1,99629,Phoenix,"zHera zEzra Zeb Sabine Kanan",1
"jack0",,,73401,Phasma,"Phasma FOE FOO KRU G8, Kylo G8",0
"jack0",0,1,73990,Geonosians Omicron,"GBA 5* Sun Fac G8, Geo Soldier, Geo Spy, Poggle",0
"jack0",,,71146,Nute-OR,"Nute zDooku Jango G7, Zaalbar 3* G7, Mission 2* G7",0
"jack0",1,1,68527,NS_Alt,"zAV Talia Spirit G5, Daka G9, Zombie",0
"jack0",,,42910,Mon Mothma,"Mon Mothma 4* G8, Lando G6, Wedge G7, Biggs G8, Hoth Rebel Scout G7",0
"jack0",1,0,58632,ShaakClones,"Shaak Ti 4* G8, Rex Echo (501st) G9, Fives Clone Sergeant G5",0
"jack0",0,1,79583,BH,"Bossk 4* G8, IG-88 G8, Boba Cad Greedo",0
"jack0",1,0,94702,Troopers,"Veers Starck zPiett Stormtrooper Gideon G9",0
"jack0",0,1,79219,BS,"BS 4* G8, GMY G7, zJKA GK 6* G9, Ahsoka",0
"toaster1241",,,171265,SEE,"zzzzzzSEE zBSF zzMalak zzzDR zzVader",1
"toaster1241",,,526671,Executor,"Executor 6* HT RC Xanadu Blood, Slave I, IG-2000 Imperial TIE Fighter, Tie Adv",1
"toaster1241",0,1,131212,padme,"zzPadme zGK zJKA zAhsoka zzC-3PO",1
"toaster1241",,,439489,Negotiator,"Negotiator 6* BTL-B Y-wing 6*, Anakin's Eta-2, Rex's ARC-170, Umbaran SF, Ahsoka's SF, Plo's SF, Clone Sergeant's ARC-170",1
"toaster1241",,,383679,HansMF,"Home One, Han's MF, Rebel Y-wing 6*, Bistan's U-wing, Phantom Ghost Cassian's U-wing, Wedge X-wing",1
"toaster1241",1,1,146266,GAS,"zzzzGAS zRex zEcho (501st), zzFives zARC Trooper",1
"toaster1241",1,1,135616,Revan Offense,"zzzJKR zGMY zzHYoda zJolee zEzra",1
"toaster1241",1,1,80835,Ewoks,"zChirpa Elder Paploo Wicket Logray G9",1
"toaster1241",0,1,130464,BH,"zzBossk Dengar IG-88 zThe Mandalorian, zBoba",1
"toaster1241",1,0,115911,Troopers,"zVeers zStarck zzPiett Stormtrooper zDark Trooper",1
"toaster1241",0,1,79586,Phoenix,"Hera Zeb Chopper Sabine G8, zKanan",1
"toaster1241",1,1,75291,Rogue1,"Jyn G9, Chirrut G8, Baze G8, K-2SO G9, zCassian",1
"toaster1241",1,0,107356,EP (Counter, Rebel),"zzEP Krennic zzWampa Nest G9, Range Trooper G9",1
"toaster1241",,,53293,Phasma,"Phasma G8, FOTP G6, FOSFTP G6, FOST 5* G8, Kylo G8",0
"toaster1241",,,106324,Grievous Omicron,"zGG zB2 zB1 zMagnaGuard zDroideka",0
"toaster1241",1,0,109157,CLS,"zzzCLS zHan zzChewbacca R2-D2 G9, zChewpio",0
"toaster1241",0,1,95380,Geonosians Omicron,"zzGBA Sun Fac, Geo Soldier, Geo Spy, Poggle",0
"toaster1241",1,0,102455,Traya,"zzTraya DN zSion 5* Sith Empire Trooper, zThrawn",0
"toaster1241",1,1,72612,NS,"MT G8, zAV Daka G9, Zombie G8, Spirit G8",0
"toaster1241",,,90548,Nute-OR,"Nute Dooku Jango G7, zZaalbar zMission",0
"toaster1241",,,77177,Mon Mothma,"Mon Mothma 5* G9, Lando Bodhi Rook G8, Wedge zCara Dune",0
"toaster1241",,,59914,Iden Troopers,"zIden Versio 3*, Shoretrooper 6* G8, Snowtrooper G8, Magma G9, DT 6* G9",0
"toaster1241",,,76365,Bad Batch,"Hunter G9, zEcho Omega G8, zTech G9, zWrecker G7",0
"Jed",0,1,76121,Phoenix,"Hera Ezra Zeb G8, Sabine G9, Kanan",1
"Jed",,,71387,Phasma,"Phasma G8, FOE G9, FOO G9, KRU Kylo G8",0
"Jed",0,1,72744,padme,"Padme G8, GK G7, JKA G8, Ahsoka C-3PO",0
"Jed",0,1,85557,Grievous,"GG B2 G9, Droideka MagnaGuard Dooku",0
"Jed",1,1,69107,JTR,"JTR G6, Scav Rey, BB-8 G9, R2-D2 Finn G9",0
"Jed",1,1,96086,Ewoks,"Chirpa Elder Paploo Wicket Logray",0
"Jed",0,1,98463,BH,"Bossk Dengar The Mandalorian, Boba Jango",0
"Jed",1,1,86748,zEP,"EP zVader Tarkin DN G7, Mara Jade, The Emperor's Hand",0
"Jed",1,0,67546,Wiggs,"Wedge G8, Biggs G6, CLS Chewbacca G9, Leia",0
"Jed",1,0,36997,Clones,"Cody G6, Rex G6, Echo (501st) G6, Fives G7, Clone Sergeant G6",0
"HendoSon",0,1,73363,Phoenix,"Hera Ezra Zeb Chopper G9, Kanan G8",1
"HendoSon",,,48081,Phasma,"Phasma G8, FOTP G8, FOE 5* G9, KRU 6* G8, Kylo G8",0
"HendoSon",0,1,89248,Geonosians Omicron,"zGBA Sun Fac, Geo Soldier, Geo Spy, Poggle",0
"HendoSon",1,1,104727,NS,"MT zAV zDaka Zombie Spirit 6*",0
"HendoSon",,,222482,HansMF,"Home One 6*, Han's MF 6*, HT Ghost 6* Phantom 5* Biggs X-wing 6*, Cassian's U-wing, Wedge X-wing 5*",0
"HendoSon",1,1,91755,zEP,"EP zzzVader Tarkin DT G8, DN 5* G9",0
"HendoSon",0,1,78613,BH,"Bossk Boba Jango Cad G8, Greedo 6* G8",0
"HendoSon",1,0,65131,501st,"Rex Clone Sergeant G8, Echo (501st) 6* G8, Fives G9, Ahsoka",0
"HendoSon",1,0,69213,Troopers,"Veers Starck G5, zIden Versio, Snowtrooper Magma G8",0
"HendoSon",1,0,42585,Wiggs,"Wedge 5* G8, Biggs G8, Leia G8, Chirrut 5* G8, Baze 5* G8",0
"Kristian45",1,0,138155,CLS,"zzzCLS zHan zChewbacca zzC-3PO Chewpio",1
"Kristian45",,,107000,Disintegration,"zAurra Greef Boba zzBossk zThe Mandalorian",1
"Kristian45",1,1,83067,Ewoks,"zChirpa Elder Paploo zWicket Logray",1
"Kristian45",1,1,94005,zEP,"zzEP zzVader Tarkin DT TFP G8",1
"Kristian45",0,1,68105,Phoenix,"Hera G9, Ezra G9, Zeb G8, Chopper G8, Kanan G8",1
"Kristian45",,,98976,Grievous Omicron,"zGG B2 zB1 MagnaGuard Droideka",0
"Kristian45",0,1,86087,Geonosians Omicron,"GBA Sun Fac, Geo Soldier, Geo Spy, Poggle",0
"Kristian45",1,1,72239,Revan,"JKR G8, BS GMY Jolee G9, GK G8",0
"Kristian45",0,1,76922,BH,"Jango Dengar G9, IG-88 G9, zZam Cad G9",0
"Iluvatar",1,0,113349,CLS,"zzCLS zHan zChewbacca zC-3PO zChewpio",1
"Iluvatar",0,1,92690,Geonosians Omicron,"zzGBA Sun Fac, Geo Soldier, Geo Spy, Poggle",1
"Iluvatar",,,385953,HansMF,"Home One, Han's MF, HT Ghost Phantom Biggs X-wing, Cassian's U-wing, Wedge X-wing",1
"Iluvatar",1,1,94941,Ewoks,"zChirpa Elder zPaploo zWicket zLogray",1
"Iluvatar",1,1,111405,zEP,"zEP zzVader Tarkin Dooku TFP",1
"Iluvatar",0,1,72621,Phoenix,"Hera Ezra G9, Zeb G8, Chopper G9, Kanan G9",1
"Iluvatar",0,1,84873,BS,"zBS GMY Jolee G9, GK G8, Ahsoka",1
"Iluvatar",1,0,104818,IG88,"IG-88 zWampa Cassian G9, zBoba Kylo G8",1
"Iluvatar",,,70993,Mon Mothma,"Mon Mothma 4* G8, Lando Wedge Jyn Biggs",0
"Iluvatar",0,1,110168,BH,"Bossk Dengar The Mandalorian, Jango Cad",0
"Iluvatar",1,0,99735,Troopers,"zVeers Starck G9, zzPiett Dark Trooper, Gideon G9",0
"creen",0,1,87885,FO,"zKRU Kylo FOST FOE FOO",1
"creen",0,1,66403,Phoenix,"Hera G9, Ezra Zeb G8, Chopper G9, Kanan",1
"creen",0,1,80080,Geonosians Omicron,"zGBA Sun Fac G9, Geo Soldier, Geo Spy, Poggle",0
"creen",1,1,37586,NS_Alt,"MT 5* G8, AV 6* G8, Talia 5* G8, Spirit 5* G8, Daka G8",0
"creen",1,1,81980,zEP,"EP zzVader Tarkin Dooku 6* G9, Sith Trooper 5*",0
"creen",0,1,65842,BH,"Bossk 4* IG-88 G8, The Mandalorian 4* G8, Boba G9, Cad G8",0
"creen",1,0,36418,501st,"Rex 5* G8, Clone Sergeant 5* G8, Echo (501st) 5* G8, Fives 5* G8, Ahsoka G8",0
"creen",1,0,39018,Troopers,"Veers 5* Starck G7, Stormtrooper 5* G8, DT 5* G8, Shoretrooper 5*",0
"creen",1,0,56169,Wiggs,"Wedge Biggs Leia Chirrut 5* G8, Baze 5* G8",0
"spyinglyfe",,,134492,Phasma,"zPhasma FOE zSith Trooper, zzKRU zKylo",1
"spyinglyfe",0,1,88903,Geonosians Omicron,"zGBA Sun Fac, Geo Soldier, Geo Spy, Poggle",1
"spyinglyfe",0,1,80094,BH,"zzBossk IG-88 G8, Boba Jango G9, Cad",1
"spyinglyfe",1,0,87308,501st,"zRex ARC Trooper, Echo (501st), zFives Ahsoka",1
"spyinglyfe",0,1,66528,Phoenix,"Hera G9, Ezra Zeb G8, Chopper G8, Kanan G8",1
"spyinglyfe",,,246043,HansMF,"Home One 6*, Han's MF 5*, HT Ghost Phantom Biggs X-wing, Cassian's U-wing, Wedge X-wing 5*",0
"spyinglyfe",1,0,56911,Traya,"Traya 6* G7, DN 5* G8, Sion G7, zEP Thrawn G8",0
"spyinglyfe",1,1,54937,NS,"MT 5* G9, AV Daka G9, Zombie 6* G8, Spirit G8",0
"spyinglyfe",1,1,43780,Ewoks,"Chirpa 5* G8, Elder G8, Paploo G8, Wicket 5* G8, Logray G8",0
"spyinglyfe",1,0,46848,Wiggs,"Wedge 5* G8, Biggs G8, CLS G6, Han G7, Leia G9",0
"spyinglyfe",1,1,41666,Rogue1,"Jyn 6* G8, Chirrut G8, Baze 5* G8, K-2SO G8, Cassian 5* G8",0
"spyinglyfe",0,1,60403,BS,"BS 5* GMY Jolee 3* GK 6* G6, JKA 5* G9",0
"Thehighground420",0,1,114286,DRMalak,"zzzDR HK-47 zBSF zzMalak Sith Empire Trooper",1
"Thehighground420",,,86573,Disintegration,"Aurra Greef Boba zBossk The Mandalorian",1
"Thehighground420",1,1,111147,Revan,"zzzJKR BS GMY zJolee zGK",1
"Thehighground420",,,81544,Grievous Omicron,"GG B2 G9, zB1 G9, MagnaGuard Droideka",0
"Thehighground420",0,1,81156,Geonosians Omicron,"zGBA Sun Fac G9, Geo Soldier, Geo Spy, Poggle",0
"Thehighground420",,,256610,HansMF,"Home One, Han's MF 5*, HT 6* Ghost Phantom Biggs X-wing, Cassian's U-wing, Wedge X-wing",0
"Thehighground420",1,0,77458,Troopers,"zVeers zPiett G9, Gideon G9, Dark Trooper, Range Trooper G8",0
"Thehighground420",1,0,72954,Traya,"Traya 6* DN Sion 5* G9, zDooku 6* EP",0
"Thehighground420",1,1,67673,Carth,"Carth Onasi, Mission G5, Zaalbar Juhani G6, zCanderous",0
"Thehighground420",1,0,84847,CLS,"zCLS Han Leia Old Ben G9, Chewbacca",0
"Thehighground420",0,1,62823,BH,"Jango Dengar G7, IG-88 G7, zZam Cad G8",0
"Thehighground420",0,1,40675,Phoenix,"Hera 5* G8, Ezra 5* G7, Zeb G8, Chopper G7, Kanan G8",0
"xXDarth YetiXx",,,124835,Phasma,"zPhasma zFOTP FOSFTP zFOST zKylo",1
"xXDarth YetiXx",1,1,144097,SL Kylo,"zzzzzSL Kylo, zSith Trooper, zHux zzKRU Thrawn G8",1
"xXDarth YetiXx",0,1,110973,padme,"zzPadme zGK JKA zAhsoka C-3PO",1
"xXDarth YetiXx",0,1,111749,Grievous,"zzGG zB2 zB1 MagnaGuard Dooku",1
"xXDarth YetiXx",1,1,81078,JTR,"zJTR Scav Rey G8, BB-8 R2-D2 Finn",1
"xXDarth YetiXx",1,1,68341,Ewoks,"zChirpa G9, Elder Paploo G9, Wicket Logray G9",1
"xXDarth YetiXx",0,1,81484,BH,"zBossk IG-88 G9, Boba Jango Cad G9",1
"xXDarth YetiXx",1,1,106170,zEP,"zEP zzVader Tarkin DT TFP G9",1
"xXDarth YetiXx",0,1,61119,Phoenix,"Hera G8, Ezra G9, Zeb G8, Chopper G8, Kanan G8",1
"xXDarth YetiXx",1,0,13522,SionSolo (Counter),"Sion G9",1
"xXDarth YetiXx",,,50214,Admiral Raddus,"Admiral Raddus 3* G8, Cassian G9, Jyn 5* G8, Baze 6* G8, Chirrut G8",0
"xXDarth YetiXx",0,1,89033,Geonosians Omicron,"zGBA Sun Fac, Geo Soldier, Geo Spy, Poggle",0
"xXDarth YetiXx",,,235188,HansMF,"Home One, Han's MF 5*, Biggs X-wing, Bistan's U-wing, Phantom 6* Ghost Cassian's U-wing, Wedge X-wing",0
"xXDarth YetiXx",1,1,63447,NS,"MT G8, AV Daka Zombie 5* G8, Spirit G8",0
"xXDarth YetiXx",1,1,99705,GAS,"zGAS Rex Echo (501st), zFives ARC Trooper",0
"xXDarth YetiXx",1,0,64253,Wiggs,"Wedge G8, Biggs G8, CLS Han Leia G8",0
"xXDarth YetiXx",1,0,75654,Troopers,"Veers Starck G9, zPiett G8, zIden Versio 6*, Snowtrooper G9",0
"dicksharpe",,,123782,Phasma,"zPhasma zFOTP FOSFTP zFOST zKylo",1
"dicksharpe",1,0,121431,CLS,"zzCLS zHan zChewbacca C-3PO Chewpio",1
"dicksharpe",0,1,93887,Geonosians Omicron,"zzGBA Sun Fac, Geo Soldier, Geo Spy, Poggle",1
"dicksharpe",,,358536,HansMF,"Home One, Han's MF, HT Ghost Phantom Biggs X-wing, Cassian's U-wing, Wedge X-wing",1
"dicksharpe",1,0,102160,Traya,"zzTraya DN Sion G9, zDooku zEP",1
"dicksharpe",,,108883,Disintegration,"Aurra Greef Boba zzBossk The Mandalorian",1
"dicksharpe",1,1,80758,Ewoks,"zChirpa G9, Elder Paploo Wicket Logray",1
"dicksharpe",0,1,68800,Phoenix,"Hera G9, Ezra G9, Zeb G8, Chopper G9, Kanan G8",1
"dicksharpe",1,0,19021,NestSolo (Counter),"zNest",1
"dicksharpe",,,52621,Admiral Raddus,"Admiral Raddus 3* G8, Cassian G8, Jyn G8, K-2SO G8, Chirrut G8",0
"dicksharpe",1,1,143073,SL Kylo,"zzzzzSL Kylo, zSith Trooper, zHux zzKRU Thrawn G7",0
"dicksharpe",1,0,96713,Troopers,"zVeers zzPiett Gideon G9, Dark Trooper G9, Range Trooper G9",0
"dicksharpe",1,1,66311,NS,"MT G8, AV Daka Zombie 6* G8, Spirit G8",0
"dicksharpe",,,352677,Executrix,"Executrix Tie Adv, Emperor's Shuttle 4*, TIE Reaper 3*, Imperial TIE Fighter, Gauntlet Starfighter, FOSF TIE Fighter, FO TIE Fighter",0
"dicksharpe",1,0,65635,ShaakClones,"Shaak Ti G8, Rex Echo (501st) G8, Fives G8, Clone Sergeant G8",0
"dicksharpe",0,1,99129,BH,"Jango Dengar IG-88 zZam Cad",0
"dicksharpe",0,1,73513,BS,"zBS GMY Jolee 6* G9, GK G7, Ahsoka G8",0
"jex222",1,1,89791,JTR,"zJTR Scav Rey, zBB-8 R2-D2 Finn",1
"jex222",1,1,116207,Revan,"zzzJKR zBS zGMY zJolee zGK",1
"jex222",1,1,85813,Ewoks,"zChirpa Elder Paploo Scout zLogray",1
"jex222",0,1,92777,BH,"zBossk Dengar Boba Cad Greedo",1
"jex222",1,1,108352,zEP,"zEP zVader Tarkin zSith Trooper, zBSF",1
"jex222",0,1,127053,FO,"zzKRU Kylo FOST zHux FOE",1
"jex222",0,1,66556,Phoenix,"Hera G8, Ezra Zeb G8, Chopper G8, Kanan G8",1
"jex222",1,0,14266,SionSolo (Counter),"Sion G9",1
"jex222",1,0,82443,CLS,"zCLS zHan Chewbacca zC-3PO G8, Chewpio 2* G8",0
"jex222",0,1,84331,Geonosians Omicron,"zzGBA Sun Fac G9, Geo Soldier, Geo Spy, Poggle",0
"jex222",1,1,71450,NestSisters,"zzAV zMT Daka G9, Zombie 5* G8, Nest 3* G8",0
"jex222",0,1,73677,Grievous,"GG B2 G9, Droideka G8, MagnaGuard G8, Dooku",0
"jex222",1,0,51198,Troopers,"zVeers G9, Piett 2* G7, Gideon 3* G8, Dark Trooper 4* G7, Range Trooper 5* G6",0
"jex222",1,1,68425,Carth,"Carth Onasi, Mission Zaalbar G7, Juhani G9, Canderous G7",0
"jex222",1,0,61361,501st,"Rex G8, ARC Trooper 4* G7, Echo (501st) G7, Fives G9, Ahsoka G8",0
"jex222",,,46157,Iden Troopers,"Iden Versio 4* G7, Stormtrooper G6, Snowtrooper G7, Magma G8, DT 4* G7",0
"jex222",1,0,65977,Wiggs,"Wedge Biggs G8, Leia G9, Chirrut G9, Baze 4* G9",0
"Sankster10",0,1,104999,Grievous,"zzGG zB2 zB1 MagnaGuard zNute",1
"Sankster10",1,1,128463,Revan,"zzzJKR zBS zzGMY zJolee zGK",1
"Sankster10",1,1,83552,Ewoks,"zChirpa Elder Paploo Scout Logray",1
"Sankster10",1,1,104175,zEP,"zzEP zzzVader Tarkin zSith Trooper, zMara Jade, The Emperor's Hand 5*",1
"Sankster10",0,1,70766,Phoenix,"Hera G9, Ezra Zeb G8, Chopper G9, Kanan G9",1
"Sankster10",,,300406,Negotiator,"Negotiator 5* HT 4* Anakin's Eta-2, Umbaran SF 5*, Ahsoka's SF, BTL-B Y-wing, Clone Sergeant's ARC-170 5*, Plo's SF",0
"Sankster10",0,1,96154,Geonosians Omicron,"zzGBA Sun Fac, Geo Soldier, Geo Spy, Poggle",0
"Sankster10",,,93721,Mon Mothma,"zzMon Mothma, Baze zPao Chirrut Hoth Rebel Scout",0
"Sankster10",1,0,86041,CLS,"zzCLS zHan Chewbacca 5* R2-D2 G9, zC-3PO 6* G9",0
"Sankster10",1,0,54424,Troopers,"Veers G7, Starck 6* G8, Stormtrooper G8, Snowtrooper G7, Gideon",0
"Sankster10",1,0,78068,IG88,"IG-88 G6, zWampa Cassian G9, zBoba Kylo",0
"Sankster10",1,0,6660,SionSolo (Counter),"Sion 6* G3",0
"Killer",1,1,127605,Revan,"zzzJKR BS zGMY zJolee G9, zGK",1
"Killer",1,0,84354,501st,"Rex Clone Sergeant, Echo (501st), zFives Ahsoka",1
"Killer",0,1,63180,Phoenix,"Hera G9, Ezra G9, Zeb G8, Chopper G9, Kanan G8",1
"Killer",0,1,81797,Grievous,"zGG B2 G9, MagnaGuard Dooku IG-88 G8",0
"Killer",1,1,52988,Carth,"Carth Onasi G9, Mission G6, Zaalbar G7, Juhani G9, Canderous G8",0
"Killer",1,1,85878,zEP,"EP zzVader Tarkin zBSF Traya 5* G8",0
"Killer",0,1,89781,BH,"Jango Dengar G9, The Mandalorian, Boba Cad",0
"Killer",1,0,69610,CLS,"CLS G8, Han Leia G8, Old Ben G9, Chewbacca G9",0
"tobster",1,0,128654,CLS,"zzzCLS zHan zzChewbacca zC-3PO zChewpio",1
"tobster",0,1,93445,Geonosians Omicron,"zzGBA Sun Fac, Geo Soldier, Geo Spy, Poggle",1
"tobster",1,0,134780,Troopers,"zVeers zzPiett zGideon zDark Trooper, Range Trooper",1
"tobster",1,1,79318,Ewoks,"zChirpa Elder Paploo Wicket Logray",1
"tobster",0,1,98467,BH,"zzBossk IG-88 The Mandalorian, zBoba zJango",1
"tobster",1,1,80221,zEP,"zzEP G8, zzVader Tarkin BSF 5* G5, zzMara Jade, The Emperor's Hand 3*",0
"Ta152",1,1,137566,JTR,"zzJTR zR2-D2 zzBB-8 zRH Finn, zRH Poe",1
"Ta152",1,1,76493,Ewoks,"zChirpa Elder Paploo Wicket Logray",1
"Ta152",0,1,90737,FO,"zzKRU Kylo zHux 5* FOE FOO",1
"Ta152",1,0,98085,CLS,"zzCLS zHan zChewbacca C-3PO Chewpio",0
"Ta152",0,1,87735,Geonosians Omicron,"zGBA Sun Fac, Geo Soldier, Geo Spy, Poggle",0
"Ta152",1,0,87497,Troopers,"zVeers zPiett Gideon G9, Dark Trooper, Range Trooper",0
"Ta152",,,341163,Raddus,"Raddus 5* Sun Fac SF 5*, Rey's Millennium Falcon, Poe Dameron's X-wing, Resistance X-wing, Biggs X-wing, Wedge X-wing, Phantom 5* Ghost 5*",0
"Ta152",1,1,88317,zEP,"zEP zzVader Tarkin Traya Mara Jade, The Emperor's Hand 4*",0
"Ta152",0,1,84325,BH,"zBossk The Mandalorian G8, Boba Zam Jango",0
"beanboi",0,1,88667,Geonosians Omicron,"zzGBA Sun Fac, Geo Soldier, Geo Spy, Poggle",1
"beanboi",1,0,92763,501st,"zRex zARC Trooper, Echo (501st), zFives Ahsoka",1
"beanboi",,,84644,Iden Troopers,"zIden Versio, zStormtrooper Snowtrooper Magma G9, DT",1
"beanboi",0,1,61113,Phoenix,"Hera G8, Ezra Zeb G8, Chopper G9, Kanan G8",1
"beanboi",0,1,43662,Grievous,"GG 5* G9, B2 G9, B1 2* G9, MagnaGuard G8, IG-88 G7",0
"beanboi",1,0,75903,Troopers,"Veers Piett 4* G9, zGideon Dark Trooper 6*, Range Trooper",0
"beanboi",,,42352,Mon Mothma,"Mon Mothma 4* G8, Pao G8, Kyle Katarn 5* G9, Wedge 6* G8, Biggs G7",0
"beanboi",1,1,84543,zEP,"EP zVader Tarkin TFP Mara Jade, The Emperor's Hand 4*",0
"beanboi",,,81292,Bad Batch,"zHunter 5* zEcho 5* zOmega 5* zTech 6* zWrecker 6*",0
"beanboi",1,0,45957,Jawas,"Nebit G8, Jawa Engineer 6* G9, Jawa Scavenger, Jawa 4* G9, Dathcha G8",0
