Player,Offense,Defense,GP,Name,Squad,Viable
"JSchill",0,1,61067,Phoenix,"Hera G8, Zeb G8, Kanan G8, Chopper G8, Ezra",1
"JSchill",1,0,76826,CLS,"zCLS Han Chewbacca R2-D2 G8, Chewpio 4* G8",0
"JSchill",1,1,97549,Revan,"zJKR BS zGMY zJolee GK",0
"JSchill",1,1,66855,Carth,"Carth Onasi, Mission Zaalbar Juhani G7, Canderous 6*",0
"VikingKoala",1,0,91385,CLS,"zzzCLS zHan Chewbacca R2-D2 G9, Chewpio",1
"VikingKoala",,,100833,Disintegration,"Aurra Greef Boba zzBossk The Mandalorian",1
"VikingKoala",1,1,83864,Ewoks,"zChirpa Elder Paploo Wicket Logray",1
"VikingKoala",1,0,95565,501st,"zRex ARC Trooper, Echo (501st), Fives zAhsoka",1
"VikingKoala",1,1,86345,zEP,"zEP zzVader Tarkin G9, Dooku TFP G8",1
"VikingKoala",0,1,63936,Phoenix,"Hera G9, Zeb G8, Kanan G9, Chopper G9, Ezra G9",1
"VikingKoala",1,1,59811,Rogue1,"Jyn G8, Chirrut G8, Baze G8, K-2SO G8, Cassian G8",1
"VikingKoala",,,47871,Phasma,"Phasma G8, FOE 5* G8, FOO G8, KRU G8, Kylo G8",0
"VikingKoala",,,78758,Grievous Omicron,"GG B2 B1 6* MagnaGuard Droideka 6*",0
"VikingKoala",0,1,88039,Geonosians Omicron,"zGBA Sun Fac, Geo Soldier, Geo Spy, Poggle",0
"VikingKoala",,,244769,HansMF,"Home One, Han's MF 5*, Biggs X-wing, Bistan's U-wing 6*, Phantom Ghost Cassian's U-wing, Wedge X-wing",0
"VikingKoala",1,1,54016,NS_Alt,"MT G8, AV Spirit G8, Talia 6* G8, Daka G8",0
"VikingKoala",1,0,87258,Troopers,"Veers Starck Range Trooper, Gideon zPiett",0
"VikingKoala",0,1,68330,BH,"Jango G9, Dengar G8, IG-88 G8, Greedo G8, zZam",0
"VikingKoala",0,1,113677,BS,"BS zGMY zJolee zGK zJKA",0
"ElJediDasCouvesJr",1,1,99222,Revan,"zzJKR BS zGMY zJolee GK",1
"ElJediDasCouvesJr",0,1,84368,BH,"zBossk Boba Dengar G9, Greef G8, Jango",1
"ElJediDasCouvesJr",0,1,101311,FO,"zzKRU zKylo FOO FOE zHux 6*",1
"ElJediDasCouvesJr",1,0,9595,SionSolo (Counter),"Sion G8",1
"ElJediDasCouvesJr",1,0,85458,CLS,"zzzCLS zHan Chewbacca R2-D2 G7, Chewpio 3* G8",0
"ElJediDasCouvesJr",0,1,67919,Geonosians Omicron,"zGBA 6* Sun Fac G9, Geo Soldier 6* G9, Geo Spy, Poggle",0
"ElJediDasCouvesJr",1,0,41811,Troopers,"Veers 5* Piett 4* G9, Gideon 5* G7, Dark Trooper 4* G9, Range Trooper 4* G8",0
"ElJediDasCouvesJr",1,1,57101,Carth,"Carth Onasi, Mission G8, Zaalbar G8, Juhani G9, Canderous 5* G9",0
"ElJediDasCouvesJr",1,1,92632,zEP,"zEP zVader Tarkin G8, Sith Trooper 6*, BSF",0
"ElJediDasCouvesJr",0,1,57697,Phoenix,"Hera G8, Zeb G8, Kanan G8, Chopper G8, Ezra G9",0
"Tomb",,,83576,Disintegration,"Aurra Greef G9, Boba zBossk The Mandalorian G8",1
"Tomb",1,1,85926,Revan,"zzzJKR BS GMY Jolee G8, GK",1
"Tomb",0,1,68954,Phoenix,"Hera G8, Zeb G8, Kanan G8, Chopper G8, Ezra",1
"Tomb",1,0,89290,CLS,"zzCLS zHan Chewbacca 6* G9, R2-D2 G9, Chewpio",0
"Tomb",0,1,88923,Geonosians Omicron,"zGBA Sun Fac, Geo Soldier, Geo Spy, Poggle",0
"Tomb",1,1,65376,Ewoks,"Chirpa Elder Paploo Teebo G8, Logray 6* G9",0
"Tomb",1,1,83614,zEP,"EP G9, zzzVader Tarkin G9, zTraya 5* zMara Jade, The Emperor's Hand 6*",0
"Tomb",1,0,76189,Troopers,"Veers zStarck Dark Trooper, Gideon G9, zPiett G9",0
"Elon Muscle",,,504731,Executor,"Executor 5* HT RC Xanadu Blood, Slave I, IG-2000 Imperial TIE Fighter, Tie Adv",1
"Elon Muscle",0,1,88338,padme,"zzPadme GK JKA Ahsoka C-3PO",1
"Elon Muscle",1,1,81092,Ewoks,"zChirpa Elder Paploo Wicket Logray",1
"Elon Muscle",1,1,82364,Revan Offense,"zzzJKR GMY BS G9, Jolee Ezra G8",1
"Elon Muscle",0,1,123962,BH,"zzBossk Boba Dengar IG-88 Jango",1
"Elon Muscle",1,0,112484,CLS,"zzCLS zHan zzChewbacca R2-D2 Chewpio",0
"Elon Muscle",0,1,88439,Geonosians Omicron,"zGBA Sun Fac, Geo Soldier, Geo Spy, Poggle",0
"Elon Muscle",1,0,90203,Troopers,"zVeers zzPiett Gideon 4* G9, Dark Trooper G9, Range Trooper 6* G9",0
"Elon Muscle",1,1,89009,zEP,"EP G8, zzVader Tarkin G7, TFP Traya 6*",0
"Jed",0,1,76121,Phoenix,"Hera Zeb G8, Sabine G9, Kanan Ezra",1
"Jed",,,71530,Phasma,"Phasma G8, FOE G9, FOO G9, KRU Kylo G8",0
"Jed",0,1,73277,padme,"Padme G8, GK G8, JKA G8, Ahsoka C-3PO",0
"Jed",0,1,85557,Grievous,"GG B2 G9, Droideka MagnaGuard Dooku",0
"Jed",1,1,69107,JTR,"JTR G6, Scav Rey, BB-8 G9, R2-D2 Finn G9",0
"Jed",1,1,96086,Ewoks,"Chirpa Elder Paploo Wicket Logray",0
"Jed",1,1,39457,Carth,"Carth Onasi 5* G8, Mission 3* G7, Zaalbar 3* G8, Juhani 2* G7, Canderous G7",0
"Jed",0,1,98444,BH,"Bossk Boba Dengar The Mandalorian, Jango",0
"Jed",1,1,86748,zEP,"EP zVader Tarkin DN G7, Mara Jade, The Emperor's Hand",0
"Jed",1,0,67546,Wiggs,"Wedge G8, Biggs G6, CLS Chewbacca G9, Leia",0
"Jed",1,0,36997,Clones,"Cody G6, Rex G6, Echo (501st) G6, Fives G7, Clone Sergeant G6",0
"spyinglyfe",,,121162,Phasma,"zPhasma zFOTP FOSFTP zFOST zKylo",1
"spyinglyfe",0,1,88903,Geonosians Omicron,"zGBA Sun Fac, Geo Soldier, Geo Spy, Poggle",1
"spyinglyfe",0,1,80094,BH,"zzBossk Cad Boba IG-88 G8, Jango G9",1
"spyinglyfe",1,0,87308,501st,"zRex ARC Trooper, Echo (501st), zFives Ahsoka",1
"spyinglyfe",0,1,66902,Phoenix,"Hera G9, Zeb G8, Kanan G8, Chopper G8, Ezra",1
"spyinglyfe",1,1,103703,zEP,"zEP zzzVader Tarkin Dooku zSith Trooper",1
"spyinglyfe",,,246380,HansMF,"Home One 6*, Han's MF 5*, HT Ghost Phantom Biggs X-wing, Cassian's U-wing, Wedge X-wing 5*",0
"spyinglyfe",1,1,56527,NS,"MT 6* G9, AV Daka G9, Zombie 6* G8, Spirit G8",0
"spyinglyfe",1,1,43780,Ewoks,"Chirpa 5* G8, Elder G8, Paploo G8, Wicket 5* G8, Logray G8",0
"spyinglyfe",1,0,46848,Wiggs,"Wedge 5* G8, Biggs G8, CLS G6, Han G7, Leia G9",0
"spyinglyfe",1,1,41666,Rogue1,"Jyn 6* G8, Chirrut G8, Baze 5* G8, K-2SO G8, Cassian 5* G8",0
"spyinglyfe",0,1,60688,BS,"BS 5* GMY Jolee 3* GK 6* G6, JKA 5* G9",0
"spyinglyfe",1,0,7887,SionSolo (Counter),"Sion G7",0
"Kichler10",0,1,100709,padme,"zzPadme GK zJKA Ahsoka C-3PO",1
"Kichler10",0,1,93421,Geonosians Omicron,"zzGBA Sun Fac, Geo Soldier, Geo Spy, Poggle",1
"Kichler10",1,1,108284,Revan Offense,"zzzJKR zGMY zBS Jolee Ezra",1
"Kichler10",1,1,99129,Ewoks,"zChirpa Elder zPaploo Teebo zWicket",1
"Kichler10",1,1,90410,Carth,"Carth Onasi, zMission Zaalbar zJuhani Canderous",1
"Kichler10",1,1,95584,zEP,"zzEP zzVader zTarkin Dooku TFP G9",1
"Kichler10",,,71442,Phasma,"Phasma G9, FOE 5* FOO zKRU Kylo G9",0
"Kichler10",1,1,76073,JTR,"JTR G8, Scav Rey, BB-8 G8, R2-D2 zFinn",0
"Kichler10",1,1,54788,NS_Alt,"MT G8, AV Spirit 6* G8, Talia G8, Daka G9",0
"Kichler10",1,0,59671,ShaakClones,"Shaak Ti 4* G8, Rex G8, Echo (501st) G8, Fives G9, Clone Sergeant",0
"Kichler10",1,0,65227,Wiggs,"Wedge G8, Biggs G8, Han Chewbacca G9, Leia G9",0
"Kichler10",1,0,57249,Troopers,"Veers G9, Starck G7, Dark Trooper, Snowtrooper G8, Stormtrooper G8",0
"Kichler10",0,1,71848,Phoenix,"Hera Zeb Sabine 5* G8, Kanan Chopper",0
"Kichler10",1,1,45398,Rogue1,"Jyn 6* G8, Chirrut G8, Baze 6* G8, K-2SO G8, Cassian G8",0
"creen",0,1,88322,FO,"zKRU Kylo FOO FOE FOST",1
"creen",0,1,66566,Phoenix,"Hera G9, Zeb G8, Kanan Chopper G9, Ezra",1
"creen",0,1,82402,Geonosians Omicron,"zGBA Sun Fac, Geo Soldier, Geo Spy, Poggle",0
"creen",1,1,37586,NS_Alt,"MT 5* G8, AV 6* G8, Spirit 5* G8, Talia 5* G8, Daka G8",0
"creen",1,1,82815,zEP,"EP zzVader Tarkin Dooku 6* G9, Sith Trooper 5*",0
"creen",0,1,69415,BH,"zBossk 4* Cad G8, Boba G9, The Mandalorian 4* G8, IG-88 G8",0
"creen",1,0,36418,501st,"Rex 5* G8, Clone Sergeant 5* G8, Echo (501st) 5* G8, Fives 5* G8, Ahsoka G8",0
"creen",1,0,39018,Troopers,"Veers 5* Starck G7, Shoretrooper 5* Stormtrooper 5* G8, DT 5* G8",0
"creen",1,0,56169,Wiggs,"Wedge Biggs Leia Chirrut 5* G8, Baze 5* G8",0
"Ta152",1,1,137566,JTR,"zzJTR zR2-D2 zzBB-8 zRH Finn, zRH Poe",1
"Ta152",1,1,76493,Ewoks,"zChirpa Elder Paploo Wicket Logray",1
"Ta152",0,1,90737,FO,"zzKRU Kylo FOO FOE zHux 5*",1
"Ta152",1,0,98118,CLS,"zzCLS zHan zChewbacca C-3PO Chewpio",0
"Ta152",0,1,87735,Geonosians Omicron,"zGBA Sun Fac, Geo Soldier, Geo Spy, Poggle",0
"Ta152",1,0,87497,Troopers,"zVeers zPiett Gideon G9, Dark Trooper, Range Trooper",0
"Ta152",,,345222,Raddus,"Raddus 5* Sun Fac SF 6*, Rey's Millennium Falcon, Poe Dameron's X-wing, Resistance X-wing, Biggs X-wing, Wedge X-wing, Phantom 5* Ghost 5*",0
"Ta152",1,1,88317,zEP,"zEP zzVader Tarkin Traya Mara Jade, The Emperor's Hand 4*",0
"Ta152",0,1,84325,BH,"zBossk Boba The Mandalorian G8, Jango Zam",0
"Bo Diddle",1,0,126918,CLS,"zzzCLS zHan zChewbacca zC-3PO Chewpio",1
"Bo Diddle",0,1,104868,DRMalak,"zzzDR HK-47 BSF zzMalak Sith Empire Trooper",1
"Bo Diddle",1,0,85139,Troopers,"zVeers zPiett Gideon Dark Trooper, Range Trooper",1
"Bo Diddle",1,1,112080,Revan,"zzJKR BS zGMY zJolee zGK",1
"Bo Diddle",1,1,80528,Ewoks,"zChirpa Elder Paploo Wicket Logray",1
"Bo Diddle",0,1,95766,BH,"zBossk Boba The Mandalorian, Greef Jango",1
"Bo Diddle",,,43154,Phasma,"Phasma G8, FOE 5* G8, FOO G8, KRU 6* G8, Kylo G8",0
"Bo Diddle",,,98939,Grievous Omicron,"zGG zB2 zB1 MagnaGuard Droideka",0
"Bo Diddle",0,1,87666,Geonosians Omicron,"zGBA Sun Fac, Geo Soldier, Geo Spy, Poggle",0
"Bo Diddle",,,253774,HansMF,"Home One, Han's MF, HT Ghost 6* Phantom 5* Biggs X-wing 5*, Cassian's U-wing 4*, Wedge X-wing 5*",0
"Bo Diddle",1,0,57265,Traya,"Traya 5* G9, DN 6* G8, Sion G6, Dooku 6* G8, zEP",0
"Bo Diddle",1,1,46699,NS_Alt,"MT 5* G8, AV Spirit 5* G8, Talia 5* G8, Daka G8",0
"Bo Diddle",1,1,81306,Carth,"Carth Onasi, zMission Zaalbar Juhani G7, Canderous",0
"Bo Diddle",1,0,70650,ShaakClones,"zShaak Ti, Rex G8, Echo (501st) G8, zFives G9, ARC Trooper 5* G8",0
"Bo Diddle",0,1,42290,Phoenix,"Hera 5* G8, Zeb G8, Sabine 5* G8, Kanan G8, Chopper G8",0
"Bo Diddle",1,0,39854,Wiggs,"Wedge 5* G8, Biggs 5* G8, Leia G9, Chirrut 5* G8, Baze 6* G8",0
"GeneralZab",1,1,94401,Revan,"zzzJKR BS GMY Jolee GK",1
"GeneralZab",0,1,61513,Phoenix,"Hera Zeb G8, Kanan G8, Chopper G8, Ezra",1
"GeneralZab",1,0,98989,CLS,"zzCLS zHan zChewbacca R2-D2 G9, Chewpio",0
"GeneralZab",0,1,63231,Geonosians Omicron,"GBA 4* G9, Sun Fac, Geo Soldier, Geo Spy, Poggle G4",0
"GeneralZab",1,0,58448,Troopers,"Veers 6* zPiett 4* G9, Gideon G9, Dark Trooper G9, Range Trooper 3* G9",0
"GeneralZab",,,62026,Nute-OR,"Nute G9, Dooku G9, Jango Zaalbar G8, Mission G7",0
"GeneralZab",0,1,83447,BH,"Bossk Boba The Mandalorian, IG-88 Greef",0
"GeneralZab",1,1,94580,zEP,"zEP zzVader Tarkin G8, zBSF Mara Jade, The Emperor's Hand 5*",0
"Sankster10",0,1,104999,Grievous,"zzGG zB2 zB1 MagnaGuard zNute",1
"Sankster10",1,1,128463,Revan,"zzzJKR zBS zzGMY zJolee zGK",1
"Sankster10",1,1,83552,Ewoks,"zChirpa Elder Paploo Scout Logray",1
"Sankster10",1,1,104175,zEP,"zzEP zzzVader Tarkin zSith Trooper, zMara Jade, The Emperor's Hand 5*",1
"Sankster10",0,1,70766,Phoenix,"Hera G9, Zeb G8, Kanan G9, Chopper G9, Ezra",1
"Sankster10",,,302372,Negotiator,"Negotiator 5* HT 4* Anakin's Eta-2, Umbaran SF 5*, Ahsoka's SF, BTL-B Y-wing, Clone Sergeant's ARC-170 5*, Plo's SF",0
"Sankster10",0,1,96154,Geonosians Omicron,"zzGBA Sun Fac, Geo Soldier, Geo Spy, Poggle",0
"Sankster10",,,93721,Mon Mothma,"zzMon Mothma, Baze Hoth Rebel Scout, Chirrut zPao",0
"Sankster10",1,0,86041,CLS,"zzCLS zHan Chewbacca 5* R2-D2 G9, zC-3PO 6* G9",0
"Sankster10",1,0,54424,Troopers,"Veers G7, Starck 6* G8, Snowtrooper G7, Gideon Stormtrooper G8",0
"Sankster10",1,0,79586,IG88,"IG-88 G6, zWampa Cassian G9, zBoba Kylo",0
"Sankster10",1,0,6660,SionSolo (Counter),"Sion 6* G3",0
"BluntSkull",0,1,101098,Geonosians Omicron,"zzGBA Sun Fac, Geo Soldier, Geo Spy, Poggle",1
"BluntSkull",1,0,105085,Troopers,"zVeers zzPiett zGideon zDark Trooper, Range Trooper",1
"BluntSkull",1,1,81822,Ewoks,"zChirpa Elder Paploo Wicket Logray",1
"BluntSkull",1,0,118407,ShaakClones,"zzShaak Ti, zRex Echo (501st), zzFives ARC Trooper",1
"BluntSkull",0,1,73628,Phoenix,"Hera Zeb G9, Kanan G9, Chopper Ezra",1
"BluntSkull",,,53029,Phasma,"Phasma G7, FOE G7, FOO G9, KRU Kylo G7",0
"BluntSkull",,,44497,Admiral Raddus,"Admiral Raddus 3* G8, Cassian G8, Jyn 6* G8, K-2SO G8, Bistan G8",0
"BluntSkull",0,1,79993,padme,"Padme GK G8, JKA 6* Ahsoka C-3PO",0
"BluntSkull",,,53676,Grievous Omicron,"GG 5* G7, B2 G8, B1 G9, MagnaGuard G8, Droideka 5*",0
"BluntSkull",,,51060,Nute-OR,"Nute G7, Dooku Jango G7, Zaalbar G7, Mission G7",0
"BluntSkull",1,1,59112,zEP,"EP G9, Vader G9, Tarkin G6, BSF Mara Jade, The Emperor's Hand 6* G7",0
"BluntSkull",0,1,53063,BH,"Bossk Cad G7, Boba G8, Dengar G6, Greef 6* G6",0
"Delmon",,,119069,Phasma,"zPhasma zFOTP FOSFTP FOST zKylo",1
"Delmon",0,1,89212,Geonosians Omicron,"zGBA Sun Fac, Geo Soldier, Geo Spy, Poggle",1
"Delmon",1,0,91067,Troopers,"zVeers zzPiett Gideon zDark Trooper, Range Trooper",1
"Delmon",1,1,92586,Revan,"zzJKR BS GMY zJolee GK",1
"Delmon",1,1,84663,Ewoks,"zChirpa G9, Elder Paploo zWicket zLogray",1
"Delmon",0,1,82635,BH,"zBossk Cad Boba Greef G9, Jango",1
"Delmon",0,1,67101,Phoenix,"Hera G9, Zeb G8, Kanan G8, Chopper G9, Ezra",1
"Delmon",1,0,88582,CLS,"zCLS zHan zChewbacca G9, C-3PO zChewpio G9",0
"Delmon",,,66282,Mon Mothma,"zMon Mothma 6* G9, Hoth Rebel Scout G9, Bistan G7, Kyle Katarn G9, Pao G9",0
"Delmon",1,1,99829,zEP,"EP zzVader Tarkin G9, zSith Trooper, zTraya 6* G7",0
"Delmon",1,0,10911,SionSolo (Counter),"Sion G6",0
"jack0",1,1,78479,Ewoks,"zChirpa Elder Paploo Scout Logray",1
"jack0",1,1,128919,zEP,"zzEP zzzVader zTarkin zKrennic Sion G9",1
"jack0",0,1,99629,Phoenix,"zHera Zeb Sabine Kanan zEzra",1
"jack0",0,1,96749,padme,"zzPadme G9, GK G9, zJKA Ahsoka Fives",1
"jack0",,,73401,Phasma,"Phasma FOE FOO KRU G8, Kylo G8",0
"jack0",0,1,73990,Geonosians Omicron,"GBA 5* Sun Fac G8, Geo Soldier, Geo Spy, Poggle",0
"jack0",,,71614,Nute-OR,"Nute zDooku Jango G8, Zaalbar 3* G7, Mission 2* G7",0
"jack0",1,1,68725,NS_Alt,"zAV Zombie Spirit G5, Talia Daka G9",0
"jack0",,,43968,Mon Mothma,"Mon Mothma 4* G8, Lando G6, Wedge G7, Hoth Rebel Scout G7, Biggs G8",0
"jack0",0,1,79583,BH,"Bossk 4* G8, Cad Boba IG-88 G8, Greedo",0
"jack0",1,0,94748,Troopers,"Veers Starck Gideon G9, Stormtrooper zPiett",0
"Kelattt",0,1,98725,padme,"zzPadme GK JKA zAhsoka C-3PO",1
"Kelattt",,,92292,Disintegration,"Aurra zGreef Boba Bossk The Mandalorian G8",1
"Kelattt",1,1,111245,Revan Offense,"zzzJKR zGMY BS zJolee HYoda",1
"Kelattt",1,1,77498,Ewoks,"zChirpa Elder Paploo Wicket Logray",1
"Kelattt",0,1,70044,Phoenix,"Hera G8, Zeb G8, Kanan G8, Chopper Ezra G8",1
"Kelattt",0,1,86225,Geonosians Omicron,"GBA Sun Fac, Geo Soldier, Geo Spy, Poggle",0
"Kelattt",0,1,94686,DRMalak,"zDR HK-47 BSF zzMalak 6* Sith Empire Trooper G7",0
"Kelattt",1,1,77092,Carth,"Carth Onasi, Mission Zaalbar Juhani G7, Canderous",0
"Kelattt",1,1,95435,zEP,"zzEP zzVader Tarkin G6, DT zTraya 6*",0
"Kelattt",1,0,58040,CLS,"CLS G9, Han G7, Leia G8, Old Ben G9, Chewbacca G8",0
"TacopMark",,,118833,Phasma,"zPhasma zFOTP FOSFTP FOST Kylo",1
"TacopMark",,,311573,HansMF,"Home One, Han's MF, HT Ghost Phantom Biggs X-wing, Cassian's U-wing, Wedge X-wing",1
"TacopMark",1,0,91691,Troopers,"zVeers zPiett Gideon Dark Trooper, Range Trooper",1
"TacopMark",,,86386,Disintegration,"Aurra Greef G9, Boba Bossk The Mandalorian",1
"TacopMark",1,1,98625,Revan,"zzJKR BS zGMY zJolee GK G9",1
"TacopMark",1,1,88890,Ewoks,"zChirpa Elder Paploo Wicket zLogray",1
"TacopMark",1,1,75494,Carth,"zCarth Onasi, Mission G8, Zaalbar Juhani Canderous G8",1
"TacopMark",1,1,107148,zEP,"zEP zVader Tarkin TFP G9, zSith Trooper",1
"TacopMark",0,1,76695,Phoenix,"Hera Zeb G8, Kanan G8, Chopper Ezra",1
"TacopMark",,,49014,Admiral Raddus,"Admiral Raddus 4* G8, Cassian G9, Jyn G8, K-2SO G8, Chirrut G8",0
"TacopMark",1,0,92718,CLS,"zzzCLS zHan Chewbacca 6* R2-D2 Chewpio",0
"TacopMark",0,1,94063,Geonosians Omicron,"zzGBA Sun Fac, Geo Soldier, Geo Spy, Poggle",0
"TacopMark",,,52492,Grievous Omicron,"zGG B2 G7, B1 6* G7, MagnaGuard G7, Droideka G8",0
"TacopMark",1,1,55577,NS_Alt,"MT G8, AV G8, Spirit G8, Talia G8, Daka G9",0
"TacopMark",1,0,66503,501st,"Rex Clone Sergeant G8, Echo (501st) G8, Fives G8, zAhsoka",0
"TacopMark",0,1,75845,BH,"Jango G9, Cad G9, Dengar G9, Greedo G9, zZam G8",0
"TacopMark",1,0,44905,Jawas,"Nebit G7, Jawa Engineer G7, Jawa Scavenger G8, Jawa G9, Dathcha G7",0
"DarthEf2Pee",0,1,93471,Geonosians Omicron,"zzGBA Sun Fac, Geo Soldier, Geo Spy, Poggle",1
"DarthEf2Pee",,,57547,Phasma,"Phasma G7, FOTP FOSFTP G6, FOST Kylo G9",0
"DarthEf2Pee",1,1,84475,zEP,"EP G9, zzzVader Tarkin G9, Sith Trooper, Mara Jade, The Emperor's Hand 5* G8",0
"DarthEf2Pee",0,1,51695,BH,"Bossk 6* Boba G8, The Mandalorian 5* G8, Greef 5* G8, Jango G8",0
"DarthEf2Pee",0,1,54341,Phoenix,"Hera G8, Zeb G8, Kanan G8, Chopper G7, Ezra G8",0
"DarthEf2Pee",0,1,53381,BS,"BS 4* G8, GMY G7, JKA G8, Old Ben G8, Ahsoka G8",0
"tobster",1,0,129718,CLS,"zzzCLS zHan zzChewbacca zC-3PO zChewpio",1
"tobster",0,1,93445,Geonosians Omicron,"zzGBA Sun Fac, Geo Soldier, Geo Spy, Poggle",1
"tobster",1,0,134780,Troopers,"zVeers zzPiett zGideon zDark Trooper, Range Trooper",1
"tobster",1,1,79318,Ewoks,"zChirpa Elder Paploo Wicket Logray",1
"tobster",0,1,98467,BH,"zzBossk zBoba The Mandalorian, IG-88 zJango",1
"tobster",1,1,84860,zEP,"zzEP G8, zzVader Tarkin BSF 5* G5, zzMara Jade, The Emperor's Hand 3*",0
"jex222",1,1,89791,JTR,"zJTR Scav Rey, zBB-8 R2-D2 Finn",1
"jex222",1,1,116240,Revan,"zzzJKR zBS zGMY zJolee zGK",1
"jex222",1,1,85588,Ewoks,"zChirpa Elder Paploo Scout zLogray",1
"jex222",0,1,92777,BH,"zBossk Cad Boba Dengar Greedo",1
"jex222",1,1,108562,zEP,"zEP zVader Tarkin zSith Trooper, zBSF",1
"jex222",0,1,127705,FO,"zzKRU Kylo FOO FOE zHux",1
"jex222",0,1,66353,Phoenix,"Hera G8, Zeb G8, Kanan G8, Chopper G8, Ezra",1
"jex222",1,0,14266,SionSolo (Counter),"Sion G9",1
"jex222",1,0,85544,CLS,"zCLS zHan Chewbacca zC-3PO G9, Chewpio 3* G9",0
"jex222",0,1,85190,Geonosians Omicron,"zzGBA Sun Fac G9, Geo Soldier, Geo Spy, Poggle",0
"jex222",1,1,71450,NestSisters,"zzAV zMT Daka G9, Zombie 5* G8, Nest 3* G8",0
"jex222",0,1,73677,Grievous,"GG B2 G9, Droideka G8, MagnaGuard G8, Dooku",0
"jex222",1,0,51198,Troopers,"zVeers G9, Piett 2* G7, Gideon 3* G8, Dark Trooper 4* G7, Range Trooper 5* G6",0
"jex222",1,1,69368,Carth,"Carth Onasi, Mission Zaalbar G7, Juhani G9, Canderous G7",0
"jex222",1,0,61361,501st,"Rex G8, ARC Trooper 4* G7, Echo (501st) G7, Fives G9, Ahsoka G8",0
"jex222",,,46157,Iden Troopers,"Iden Versio 4* G7, Stormtrooper G6, Snowtrooper G7, Magma G8, DT 4* G7",0
"jex222",1,0,65977,Wiggs,"Wedge Biggs G8, Leia G9, Chirrut G9, Baze 4* G9",0
"Ah Loi",1,0,133591,CLS,"zzzCLS zHan zzChewbacca zC-3PO zChewpio",1
"Ah Loi",0,1,142790,padme,"zzPadme zGK zJKA zAhsoka zBarriss",1
"Ah Loi",,,537823,Negotiator,"Negotiator 6* HT Anakin's Eta-2, Umbaran SF, Ahsoka's SF, Clone Sergeant's ARC-170, Plo's SF, Rex's ARC-170",1
"Ah Loi",0,1,126806,Grievous,"zzGG zB2 zB1 zDroideka Dooku",1
"Ah Loi",1,1,159227,GAS,"zzzzGAS zRex zEcho (501st), zzFives zARC Trooper",1
"Ah Loi",1,1,76489,Ewoks,"zChirpa G9, Elder Paploo Wicket G9, Logray G9",1
"Ah Loi",1,1,103746,zEP,"zEP zzVader Tarkin G8, zSith Trooper, zzTraya",1
"Ah Loi",0,1,94025,Geonosians Omicron,"zGBA Sun Fac, Geo Soldier, Geo Spy, Poggle",0
"Ah Loi",0,1,111562,BH,"zzBossk Cad Boba Greedo G7, zJango",0
"Ah Loi",1,0,74946,Troopers,"zVeers Starck G9, Range Trooper 6* G9, Snowtrooper DT 6*",0
"Ah Loi",0,1,64482,Phoenix,"Hera G8, Zeb G7, Kanan G8, Chopper G8, Ezra G9",0
"Ah Loi",0,1,89740,BS,"BS 5* G7, zGMY zJolee Old Ben G9, HYoda 5*",0
"e4embo",1,1,110167,Revan,"zzzJKR BS GMY zJolee GK",1
"e4embo",1,1,75791,Carth,"Carth Onasi, Mission G9, Zaalbar Juhani Canderous",1
"e4embo",0,1,60806,Phoenix,"Hera G9, Zeb G8, Kanan G9, Chopper G9, Ezra",1
"e4embo",1,0,15900,NestSolo (Counter),"Nest",1
"e4embo",1,0,105764,CLS,"zzCLS zHan zChewbacca R2-D2 zChewpio",0
"e4embo",0,1,87251,Geonosians Omicron,"zGBA Sun Fac, Geo Soldier, Geo Spy, Poggle",0
"e4embo",0,1,85568,DR,"zDR HK-47 zBSF Sith Marauder 4* G8, Thrawn",0
"e4embo",,,91140,Disintegration,"Aurra 4* zGreef Boba Bossk The Mandalorian",0
"e4embo",1,0,57178,Troopers,"Veers 5* Piett Gideon G9, Dark Trooper G9, Range Trooper 3* G9",0
"e4embo",1,0,76487,ShaakClones,"Shaak Ti G9, Rex Echo (501st), Fives ARC Trooper 5*",0
"e4embo",1,1,100494,zEP,"zEP zzVader Tarkin zTraya 6* Mara Jade, The Emperor's Hand",0
"e4embo",,,55394,Bad Batch,"zHunter 5* G9, Echo 4* G9, Omega 4* G9, Tech 5* G9, Wrecker 5* G9",0
"e4embo",1,0,13671,SionSolo (Counter),"Sion 5*",0
"Thehighground420",0,1,117235,DRMalak,"zzzDR HK-47 zBSF zzMalak Sith Empire Trooper",1
"Thehighground420",,,86573,Disintegration,"Aurra Greef Boba zBossk The Mandalorian",1
"Thehighground420",1,1,111147,Revan,"zzzJKR BS GMY zJolee zGK",1
"Thehighground420",,,81544,Grievous Omicron,"GG B2 G9, zB1 G9, MagnaGuard Droideka",0
"Thehighground420",0,1,81133,Geonosians Omicron,"zGBA Sun Fac G9, Geo Soldier, Geo Spy, Poggle",0
"Thehighground420",,,256610,HansMF,"Home One, Han's MF 5*, HT 6* Ghost Phantom Biggs X-wing, Cassian's U-wing, Wedge X-wing",0
"Thehighground420",1,0,78952,Troopers,"zVeers zPiett Gideon G9, Dark Trooper, Range Trooper G8",0
"Thehighground420",1,0,74949,Traya,"Traya 6* DN Sion 5* G9, zDooku EP",0
"Thehighground420",1,1,67673,Carth,"Carth Onasi, Mission G5, Zaalbar Juhani G6, zCanderous",0
"Thehighground420",1,0,84847,CLS,"zCLS Han Leia Old Ben G9, Chewbacca",0
"Thehighground420",0,1,62823,BH,"Jango Cad G8, Dengar G7, IG-88 G7, zZam",0
"Thehighground420",0,1,40675,Phoenix,"Hera 5* G8, Zeb G8, Kanan G8, Chopper G7, Ezra 5* G7",0
"Iluvatar",1,0,113349,CLS,"zzCLS zHan zChewbacca zC-3PO zChewpio",1
"Iluvatar",0,1,92690,Geonosians Omicron,"zzGBA Sun Fac, Geo Soldier, Geo Spy, Poggle",1
"Iluvatar",,,387898,HansMF,"Home One, Han's MF, HT Ghost Phantom Biggs X-wing, Cassian's U-wing, Wedge X-wing",1
"Iluvatar",1,1,94941,Ewoks,"zChirpa Elder zPaploo zWicket zLogray",1
"Iluvatar",1,1,111405,zEP,"zEP zzVader Tarkin Dooku TFP",1
"Iluvatar",0,1,72621,Phoenix,"Hera Zeb G8, Kanan G9, Chopper G9, Ezra G9",1
"Iluvatar",0,1,84873,BS,"zBS GMY Jolee G9, GK G8, Ahsoka",1
"Iluvatar",1,0,104818,IG88,"IG-88 zWampa Cassian G9, zBoba Kylo G8",1
"Iluvatar",,,72160,Mon Mothma,"Mon Mothma 4* G8, Lando Wedge Jyn Biggs",0
"Iluvatar",0,1,110168,BH,"Bossk Cad Dengar The Mandalorian, Jango",0
"Iluvatar",1,0,99735,Troopers,"zVeers Starck G9, Dark Trooper, Gideon G9, zzPiett",0
"dicksharpe",,,123782,Phasma,"zPhasma zFOTP FOSFTP zFOST zKylo",1
"dicksharpe",1,0,124146,CLS,"zzCLS zHan zChewbacca C-3PO Chewpio",1
"dicksharpe",0,1,93887,Geonosians Omicron,"zzGBA Sun Fac, Geo Soldier, Geo Spy, Poggle",1
"dicksharpe",,,358536,HansMF,"Home One, Han's MF, HT Ghost Phantom Biggs X-wing, Cassian's U-wing, Wedge X-wing",1
"dicksharpe",1,0,103174,Traya,"zzTraya DN Sion G9, zDooku zEP",1
"dicksharpe",,,108883,Disintegration,"Aurra Greef Boba zzBossk The Mandalorian",1
"dicksharpe",1,1,80758,Ewoks,"zChirpa G9, Elder Paploo Wicket Logray",1
"dicksharpe",0,1,68800,Phoenix,"Hera G9, Zeb G8, Kanan G8, Chopper G9, Ezra G9",1
"dicksharpe",1,0,19021,NestSolo (Counter),"zNest",1
"dicksharpe",,,52621,Admiral Raddus,"Admiral Raddus 3* G8, Cassian G8, Jyn G8, K-2SO G8, Chirrut G8",0
"dicksharpe",1,1,143073,SL Kylo,"zzzzzSL Kylo, zSith Trooper, zHux zzKRU Thrawn G7",0
"dicksharpe",1,0,96713,Troopers,"zVeers zzPiett Gideon G9, Dark Trooper G9, Range Trooper G9",0
"dicksharpe",1,1,66554,NS,"MT G8, AV Daka Zombie 6* G8, Spirit G8",0
"dicksharpe",,,352677,Executrix,"Executrix Tie Adv, Emperor's Shuttle 4*, TIE Reaper 3*, Imperial TIE Fighter, Gauntlet Starfighter, FOSF TIE Fighter, FO TIE Fighter",0
"dicksharpe",1,0,65635,ShaakClones,"Shaak Ti G8, Rex Echo (501st) G8, Fives G8, Clone Sergeant G8",0
"dicksharpe",0,1,99129,BH,"Jango Cad Dengar IG-88 zZam",0
"dicksharpe",0,1,73513,BS,"zBS GMY Jolee 6* G9, GK G7, Ahsoka G8",0
