Player,Offense,Defense,GP,Name,Squad,Viable
"Kristian45",0,1,86087,Geonosians,"GBA Sun Fac, Geo Soldier, Geo Spy, Poggle",1
"Kristian45",,,107000,Disintegration,"zAurra Greef Boba zzBossk zThe Mandalorian",1
"Kristian45",1,1,83292,Ewoks,"zChirpa Elder Paploo zWicket Logray",1
"Kristian45",1,1,94005,zEP,"zzEP zzVader Tarkin DT TFP G8",1
"Kristian45",0,1,68105,Phoenix,"Hera G9, Ezra G9, Chopper G8, Kanan G8, Zeb G8",1
"Kristian45",1,0,125075,CLS,"zzCLS zHan zChewbacca zzC-3PO Chewpio",0
"Kristian45",0,1,50593,Grievous,"GG G9, B2 6* G7, B1 5* G8, MagnaGuard T3-M4 G7",0
"Kristian45",1,1,72239,Revan,"JKR G8, BS GMY Jolee G9, GK G8",0
"ThEeSSs",0,1,91770,Geonosians,"zzGBA Sun Fac, Geo Soldier, Geo Spy, Poggle",1
"ThEeSSs",1,0,78737,Wiggs,"Wedge Biggs CLS Han Ezra",1
"ThEeSSs",1,1,82521,Rogue1,"Jyn Chirrut Baze Cassian G9, K-2SO",1
"ThEeSSs",,,68032,Phasma,"Phasma G9, FOE G9, FOO G9, KRU Kylo G9",0
"ThEeSSs",1,1,80108,NS,"MT AV Daka Zombie Spirit G9",0
"ThEeSSs",1,1,89075,zEP,"EP zVader Tarkin DT 6* G9, DN",0
"ThEeSSs",1,0,60871,501st,"Rex G8, Clone Sergeant G8, Echo (501st) G8, Fives G8, Ahsoka",0
"ThEeSSs",1,0,59363,Troopers,"Veers 6* G8, Starck G9, Snowtrooper G9, Iden Versio 6*, Shoretrooper 6* G9",0
"ThEeSSs",0,1,63836,Phoenix,"Hera Chopper Kanan G9, Sabine 5* G8, Zeb G8",0
"ThEeSSs",0,1,86947,BS,"BS GMY Old Ben G9, zGK 6* zJKA",0
"Ferran Jubei",0,1,84694,Geonosians,"zGBA Sun Fac, Geo Soldier, Geo Spy, Poggle",1
"Ferran Jubei",1,1,113328,Revan,"zzJKR zBS zGMY zJolee zGK",1
"Ferran Jubei",0,1,90452,BH,"zzBossk Cad G8, Jango Greedo G8, Boba",1
"Ferran Jubei",1,1,84841,zEP,"zEP zVader Tarkin G9, Dooku G8, TFP G9",1
"Ferran Jubei",0,1,65867,Phoenix,"Hera G9, Ezra G9, Chopper G9, Kanan G8, Zeb G8",1
"Ferran Jubei",1,1,78988,Rogue1,"Jyn Chirrut Baze Cassian K-2SO G8",1
"Ferran Jubei",,,57132,Phasma,"Phasma G8, FOE 6* FOO G8, KRU G8, Kylo G8",0
"Ferran Jubei",1,0,80223,CLS,"zCLS Han Chewbacca 6* G9, R2-D2 Chewpio",0
"Ferran Jubei",,,309212,HansMF,"Home One, Han's MF 5*, HT 5* Ghost Phantom Biggs X-wing, Cassian's U-wing, Wedge X-wing",0
"Ferran Jubei",1,0,61576,Troopers,"Veers G9, zPiett Gideon G9, Dark Trooper 5* G8, Range Trooper 5* G8",0
"Ferran Jubei",1,1,58178,NS_Alt,"MT AV G8, Spirit 6* G8, Daka Talia 6* G8",0
"Ferran Jubei",1,0,74836,ShaakClones,"Shaak Ti G9, Rex Echo (501st), Fives Clone Sergeant G8",0
"Ferran Jubei",1,1,55833,Carth,"Carth Onasi 5*, Mission G7, Zaalbar G8, Juhani 4* G9, Canderous 5*",0
"Ferran Jubei",1,0,48266,Thragma (Counter),"Thrawn Magma G6, DT 5* G8, Stormtrooper G8, Shoretrooper 5* G8",0
"Encheng",0,1,111633,padme,"zzPadme zGK zJKA zAhsoka zC-3PO",1
"Encheng",0,1,87833,Geonosians,"zGBA Sun Fac, Geo Soldier, Geo Spy, Poggle",1
"Encheng",1,1,93413,JTR,"zJTR Scav Rey G8, zBB-8 zzR2-D2 zFinn",1
"Encheng",1,1,71664,Ewoks,"zChirpa G9, Elder Paploo G9, Wicket G9, Logray G9",1
"Encheng",0,1,82953,BH,"zBossk Dengar G8, Cad G9, Jango G8, Boba",1
"Encheng",1,0,92880,Wiggs,"Wedge Biggs zCLS zHan zChewbacca",1
"Encheng",0,1,62009,Phoenix,"Hera G8, Ezra Chopper G8, Kanan G8, Zeb G8",1
"Encheng",,,55136,Phasma,"Phasma G8, FOTP G9, FOO G8, KRU Kylo 5* G8",0
"Encheng",1,1,83152,NS,"zzMT zAV Daka Zombie Spirit 5* G8",0
"Encheng",,,296769,HansMF,"Home One, Han's MF 5*, HT Ghost 6* Phantom 6* Biggs X-wing, Cassian's U-wing, Wedge X-wing",0
"Encheng",1,1,91877,zEP,"zEP zzVader zTarkin TFP DN 6* G8",0
"Encheng",1,0,55323,Clones,"Cody 5* G8, Rex Echo (501st) 6* G8, Fives Clone Sergeant G8",0
"Encheng",1,1,42562,Rogue1,"Jyn 6* G8, Chirrut 6* G8, Baze 5* G8, Cassian G8, K-2SO G8",0
"Encheng",1,0,38600,Jawas,"Nebit 5* G7, Jawa Engineer 5* G8, Jawa Scavenger G8, Jawa 6* G8, Dathcha G7",0
"xXDarth YetiXx",,,123553,Phasma,"zPhasma zFOTP FOSFTP zFOST zKylo",1
"xXDarth YetiXx",1,1,137662,SL Kylo,"zzzzzSL Kylo, zSith Trooper, zHux zzKRU Thrawn G8",1
"xXDarth YetiXx",0,1,101067,padme,"zzPadme GK JKA zAhsoka C-3PO",1
"xXDarth YetiXx",0,1,88689,Geonosians,"zGBA Sun Fac, Geo Soldier, Geo Spy, Poggle",1
"xXDarth YetiXx",1,1,76303,JTR,"zJTR Scav Rey G8, BB-8 R2-D2 G8, Finn",1
"xXDarth YetiXx",1,1,68341,Ewoks,"zChirpa G9, Elder Paploo G9, Wicket Logray G9",1
"xXDarth YetiXx",1,1,103612,zEP,"zEP zVader Tarkin DT TFP G9",1
"xXDarth YetiXx",0,1,61119,Phoenix,"Hera G8, Ezra G9, Chopper G8, Kanan G8, Zeb G8",1
"xXDarth YetiXx",1,0,13522,SionSolo (Counter),"Sion G9",1
"xXDarth YetiXx",,,46093,Admiral Raddus,"Admiral Raddus 3* G8, Cassian 5* G8, Jyn 5* G8, Baze 6* G8, Chirrut G8",0
"xXDarth YetiXx",,,252007,HansMF,"Home One, Han's MF 5*, HT Ghost 6* Phantom 6* Biggs X-wing, Cassian's U-wing, Wedge X-wing",0
"xXDarth YetiXx",0,1,103224,Grievous,"zGG zB2 zB1 MagnaGuard Nute",0
"xXDarth YetiXx",1,1,60728,NS,"MT 6* G8, AV Daka Zombie 5* G8, Spirit G8",0
"xXDarth YetiXx",1,0,83704,ShaakClones,"Shaak Ti G9, Rex Echo (501st), Fives ARC Trooper",0
"xXDarth YetiXx",0,1,73827,BH,"Bossk Cad G8, Jango G9, Greedo G8, Boba G9",0
"xXDarth YetiXx",1,0,62680,Wiggs,"Wedge G8, Biggs G8, CLS G9, Han Leia G8",0
"xXDarth YetiXx",1,0,71666,Troopers,"Veers Starck G9, Snowtrooper G8, zPiett 6* G8, zIden Versio 5*",0
"KingLo",0,1,92954,Geonosians,"zzGBA Sun Fac, Geo Soldier, Geo Spy, Poggle",1
"KingLo",1,1,86714,Ewoks,"zChirpa Elder Paploo Wicket Logray",1
"KingLo",0,1,104658,BH,"zBossk Dengar Cad zIG-88 zBoba",1
"KingLo",1,1,83629,Carth,"zCarth Onasi, Mission Zaalbar G9, Juhani Canderous",1
"KingLo",0,1,72544,Phoenix,"zHera Ezra Chopper Kanan G9, Zeb G9",1
"KingLo",,,51565,Phasma,"Phasma G8, FOTP G9, FOSFTP G7, FOST 5* G8, Kylo G8",0
"KingLo",0,1,75016,Grievous,"GG G8, B2 MagnaGuard G9, zDooku T3-M4 G8",0
"KingLo",1,1,51824,NS,"MT G8, AV G8, Daka G9, Zombie 6* G8, Spirit 6* G8",0
"KingLo",1,1,70687,Revan,"zJKR BS GMY G8, Jolee GK G6",0
"KingLo",1,0,63630,ShaakClones,"Shaak Ti 6*, Rex Echo (501st) G8, Fives G9, ARC Trooper",0
"KingLo",1,1,102875,zEP,"zEP zzzVader zTarkin zBSF DN 6* G8",0
"KingLo",1,0,56893,Wiggs,"Wedge G8, Biggs G8, Han G8, Chewbacca G9, Leia G8",0
"KingLo",1,0,46049,Troopers,"Veers 5* G8, Starck G9, DT 5* G8, Snowtrooper G8, Stormtrooper G8",0
"KingLo",1,1,42263,Rogue1,"Jyn 5* G8, Chirrut 6* G8, Baze 6* G8, Cassian G8, K-2SO G8",0
"Smurf24",0,1,129476,padme,"zzPadme zGK JKA zAhsoka zC-3PO",1
"Smurf24",,,377418,Negotiator,"Negotiator 5* HT Anakin's Eta-2, Umbaran SF, Ahsoka's SF, Clone Sergeant's ARC-170, Plo's SF, Rex's ARC-170",1
"Smurf24",0,1,92078,Geonosians,"zzGBA Sun Fac, Geo Soldier, Geo Spy, Poggle",1
"Smurf24",0,1,96611,Grievous,"zGG zB2 zB1 Droideka MagnaGuard",1
"Smurf24",1,1,118609,Revan Offense,"zzzJKR zzGMY zBS zJolee zEzra",1
"Smurf24",1,1,87988,Ewoks,"zChirpa Elder Paploo Wicket Logray",1
"Smurf24",1,0,104648,ShaakClones,"zzShaak Ti, zRex zEcho (501st), zzFives zARC Trooper",1
"Smurf24",1,1,84840,Carth,"zCarth Onasi, Mission Zaalbar Juhani Canderous",1
"Smurf24",,,73789,Phasma,"Phasma G8, FOE G9, FOO KRU Kylo G9",0
"Smurf24",,,238729,HansMF,"Home One, Han's MF 5*, Biggs X-wing, Bistan's U-wing 6*, Phantom Ghost Cassian's U-wing, Wedge X-wing",0
"Smurf24",1,1,68447,JTR,"JTR G7, Scav Rey G9, BB-8 G9, R2-D2 Finn G9",0
"Smurf24",1,1,61815,NS_Alt,"MT G8, zAV Spirit 6* G8, Daka G9, Talia 5* G8",0
"Smurf24",1,1,96722,zEP,"EP zzVader Tarkin G8, TFP G9, zBSF",0
"Smurf24",0,1,71267,BH,"Bossk 3* G8, Dengar G8, Cad G9, Jango Boba",0
"Smurf24",1,0,68506,Wiggs,"Wedge G8, Biggs G8, zCLS G8, zHan Leia",0
"Smurf24",0,1,62247,Phoenix,"Hera G9, Chopper G9, Kanan G9, Sabine 5* G8, Zeb G8",0
"Smurf24",1,1,47640,Rogue1,"Jyn 5* G8, Chirrut G8, Baze 5* G8, Cassian G8, K-2SO G8",0
"Wolffe Pack",,,171049,JMK,"zzzzzzJMK zAhsoka zzzCAT zzzzGAS zGK",1
"Wolffe Pack",,,125130,Phasma,"zPhasma zFOTP FOSFTP zFOST zKylo",1
"Wolffe Pack",,,135202,SK,"zzEP zzMara Jade, The Emperor's Hand, zzStarkiller zJuhani zVisas",1
"Wolffe Pack",1,1,154753,SL Kylo,"zzzzzzSL Kylo, zSith Trooper, zHux zzKRU zThrawn",1
"Wolffe Pack",1,1,106092,NS,"zMT zzAV zDaka Zombie Spirit",1
"Wolffe Pack",,,570482,Executor,"Executor HT RC Xanadu Blood, Slave I, IG-2000 Imperial TIE Fighter, Tie Adv",1
"Wolffe Pack",1,0,142984,CLS,"zzzCLS zHan zzChewbacca zC-3PO zChewpio",1
"Wolffe Pack",0,1,112936,DRMalak,"zzzDR zHK-47 zBSF zzMalak Sith Empire Trooper",1
"Wolffe Pack",,,519435,Negotiator,"Negotiator BTL-B Y-wing, Anakin's Eta-2, Rex's ARC-170, Umbaran SF, Ahsoka's SF, Plo's SF, Clone Sergeant's ARC-170",1
"Wolffe Pack",,,304693,Malevolence,"Malevolence Hyena Bomber, Vulture Droid, Sun Fac SF, Soldier SF, Spy SF",1
"Wolffe Pack",,,136749,JKL,"zJKL zzzJKR zHYoda zOld Ben, Aayla",1
"Wolffe Pack",,,406429,HansMF,"Home One, Han's MF, Rebel Y-wing, Ghost Phantom Biggs X-wing, Cassian's U-wing, Wedge X-wing",1
"Wolffe Pack",0,1,93561,Geonosians,"zzGBA Sun Fac, Geo Soldier, Geo Spy, Poggle",1
"Wolffe Pack",0,1,122066,Grievous,"zzGG zB2 zB1 MagnaGuard zNute",1
"Wolffe Pack",1,1,118562,JTR,"zzJTR Scav Rey, zBB-8 zzR2-D2 Finn",1
"Wolffe Pack",1,0,104181,Traya,"zzTraya DN zSion zDooku Nest",1
"Wolffe Pack",,,102495,Mon Mothma,"zzMon Mothma, Baze Wedge Chirrut Biggs",1
"Wolffe Pack",1,0,152385,ShaakClones,"zzShaak Ti, zRex zEcho (501st), zzFives zARC Trooper",1
"Wolffe Pack",1,1,76076,Ewoks,"zChirpa G9, Elder Paploo Scout Logray G9",1
"Wolffe Pack",0,1,146670,BH,"zzBossk Dengar zzJango zIG-88 zBoba",1
"Wolffe Pack",1,0,124077,Troopers,"zVeers zStarck zzPiett zDark Trooper, Range Trooper",1
"Wolffe Pack",0,1,68004,Phoenix,"Hera G8, Ezra Kanan G8, Sabine G8, Zeb G8",1
"Wolffe Pack",,,124298,Bad Batch,"zHunter zEcho zOmega zTech zWrecker",1
"Wolffe Pack",1,0,66033,Jawas,"Nebit Jawa Engineer, Jawa Scavenger G8, Jawa G8, Dathcha G8",0
"Kichler10",0,1,100499,padme,"zzPadme GK zJKA Ahsoka C-3PO",1
"Kichler10",0,1,93421,Geonosians,"zzGBA Sun Fac, Geo Soldier, Geo Spy, Poggle",1
"Kichler10",1,1,101246,Revan Offense,"zzzJKR zGMY zBS Jolee Ezra",1
"Kichler10",1,1,99129,Ewoks,"zChirpa Elder zPaploo Teebo zWicket",1
"Kichler10",1,1,94102,zEP,"zzEP zzVader zTarkin Dooku TFP G9",1
"Kichler10",,,68562,Phasma,"Phasma G9, FOE 5* FOO KRU Kylo G9",0
"Kichler10",1,1,74138,JTR,"JTR G8, Scav Rey, BB-8 G8, R2-D2 zFinn",0
"Kichler10",1,1,50302,NS_Alt,"MT 6* G8, AV Spirit 6* G8, Daka G9, Talia 6* G8",0
"Kichler10",1,0,57051,Troopers,"Veers G9, Starck G7, Snowtrooper G8, Stormtrooper G8, Dark Trooper",0
"Kichler10",1,0,61878,Clones,"Cody Rex G8, Echo (501st) G8, Fives G9, Clone Sergeant G9",0
"Kichler10",1,0,55486,Wiggs,"Wedge G8, Biggs G8, CLS G8, Han G7, Leia G9",0
"Kichler10",0,1,71650,Phoenix,"Hera Chopper Kanan Sabine 5* G8, Zeb",0
"Kichler10",1,1,43403,Rogue1,"Jyn 6* G8, Chirrut 6* G8, Baze 6* G8, Cassian G8, K-2SO G8",0
"TacopMark",,,127929,Phasma,"zPhasma FOE FOO zKRU Kylo",1
"TacopMark",0,1,91369,Geonosians,"zGBA Sun Fac, Geo Soldier, Geo Spy, Poggle",1
"TacopMark",,,304981,HansMF,"Home One, Han's MF, HT Ghost Phantom Biggs X-wing, Cassian's U-wing, Wedge X-wing",1
"TacopMark",1,1,97598,Revan,"zzJKR BS zGMY zJolee GK G8",1
"TacopMark",1,1,103101,zEP,"zEP zVader Tarkin TFP G9, zBSF",1
"TacopMark",0,1,76695,Phoenix,"Hera Ezra Chopper Kanan G8, Zeb G8",1
"TacopMark",,,46502,Admiral Raddus,"Admiral Raddus 3* G8, Cassian G9, Jyn 6* G8, K-2SO G8, Chirrut G8",0
"TacopMark",1,0,84108,CLS,"zzzCLS zHan Chewbacca 5* G9, R2-D2 Chewpio 6*",0
"TacopMark",1,0,86933,Troopers,"zVeers zPiett Gideon Dark Trooper, Range Trooper G9",0
"TacopMark",0,1,53690,Grievous,"zGG G8, B2 6* G7, Dooku G8, IG-88 G8, T3-M4 G8",0
"TacopMark",1,1,55013,NS_Alt,"MT G8, AV G8, Spirit G8, Daka G9, Talia G8",0
"TacopMark",1,1,80679,Ewoks,"zChirpa Elder Paploo Wicket 5* Logray",0
"TacopMark",1,1,72613,Carth,"zCarth Onasi, Mission G8, Zaalbar G7, Juhani Canderous G8",0
"TacopMark",0,1,82006,BH,"Bossk Dengar G9, Jango G9, Greedo G9, Boba",0
"TacopMark",1,0,63685,501st,"Rex Clone Sergeant G8, Echo (501st) G8, Fives G8, Ahsoka",0
"PolarBear",0,1,82545,Geonosians,"GBA Sun Fac, Geo Soldier, Geo Spy G9, Poggle",1
"PolarBear",1,0,130867,Troopers,"zVeers zzPiett zzGideon zDark Trooper, Range Trooper",1
"PolarBear",,,91992,Iden Troopers,"zIden Versio, zStormtrooper Snowtrooper Magma zDT",1
"PolarBear",,,32609,Phasma,"Phasma 5* G8, FOE 5* G8, FOO 5* G8, KRU 5* G8, Kylo 5* G8",0
"PolarBear",,,48482,Admiral Raddus,"Admiral Raddus 3* G8, Cassian G9, Jyn 6* G8, K-2SO G8, Chirrut 5* G8",0
"PolarBear",1,0,76067,CLS,"CLS Han Chewbacca G9, R2-D2 Chewpio 5* G9",0
"PolarBear",,,208785,HansMF,"Home One 6*, Han's MF 6*, Rebel Y-wing 5*, Bistan's U-wing 6*, Phantom 6* Biggs X-wing, Cassian's U-wing, Wedge X-wing",0
"PolarBear",,,58102,Nute-OR,"Nute G8, Dooku 5* G8, zJango Zaalbar 4* Mission 4* G8",0
"PolarBear",,,67307,Mon Mothma,"zMon Mothma 5* G9, Kyle Katarn G9, Cara Dune, Hoth Rebel Scout G9, Pao G9",0
"PolarBear",1,1,40160,NS_Alt,"MT 5* G8, AV G8, Spirit 5* G8, Daka G9, Talia 5* G8",0
"PolarBear",0,1,88933,BH,"Bossk The Mandalorian, IG-88 Boba Greef",0
"PolarBear",1,0,53227,501st,"Rex G8, Clone Sergeant G8, Echo (501st) G8, Fives G9, Ahsoka G8",0
"PolarBear",1,0,61941,Wiggs,"Wedge 6* G8, Biggs G8, zFulcrum Ezra 5* G8, Leia G9",0
"PolarBear",0,1,40644,Phoenix,"Hera 5* G8, Chopper 6* G8, Kanan G8, Sabine 5* G8, Zeb G8",0
"PolarBear",0,1,61317,BS,"BS 5* GMY G8, Jolee 4* Old Ben G9, JKA G8",0
"BallistaShan",1,0,134617,CLS,"zzzCLS zHan zChewbacca C-3PO Chewpio",1
"BallistaShan",0,1,89169,Geonosians,"zGBA Sun Fac, Geo Soldier, Geo Spy, Poggle",1
"BallistaShan",1,1,76264,Ewoks,"zChirpa G9, Elder Paploo Wicket G9, Logray",1
"BallistaShan",1,1,88968,zEP,"zEP zVader Tarkin DT TFP G9",1
"BallistaShan",1,0,64334,Troopers,"zVeers 6* zPiett 6* G8, Gideon G8, Dark Trooper 5* G7, Range Trooper 6*",0
"BallistaShan",0,1,96661,BH,"zBossk zThe Mandalorian, Jango Boba zGreef",0
"BallistaShan",0,1,84891,BS,"BS G9, GMY JKA GK Ahsoka",0
"BallistaShan",1,0,13968,NestSolo (Counter),"Nest 6*",0
"Delmon",,,125336,Phasma,"zPhasma zFOTP FOO zzKRU zKylo",1
"Delmon",0,1,88816,Geonosians,"zGBA Sun Fac, Geo Soldier, Geo Spy, Poggle",1
"Delmon",1,1,81109,Ewoks,"zChirpa G9, Elder Paploo zWicket G9, zLogray G8",1
"Delmon",0,1,82635,BH,"zBossk Cad Jango Boba Greef G9",1
"Delmon",0,1,67101,Phoenix,"Hera G9, Ezra Chopper G9, Kanan G8, Zeb G8",1
"Delmon",0,1,79778,padme,"zPadme G9, GK JKA zAhsoka C-3PO 6* G7",0
"Delmon",1,0,80942,CLS,"zCLS G9, zHan G9, zChewbacca G9, zR2-D2 G8, zChewpio 6* G9",0
"Delmon",1,0,86315,Troopers,"zVeers zPiett Gideon zDark Trooper, Range Trooper",0
"Delmon",,,62937,Mon Mothma,"zMon Mothma 5* G9, Kyle Katarn 6* G9, Bistan G7, Hoth Rebel Scout G9, Pao G9",0
"Delmon",1,1,91786,zEP,"EP zzVader Tarkin G9, zSith Trooper, Sion G4",0
"GeneralZab",0,1,61513,Phoenix,"Hera Ezra Chopper G8, Kanan G8, Zeb G8",1
"GeneralZab",1,0,95356,CLS,"zCLS zHan zChewbacca R2-D2 G9, Chewpio",0
"GeneralZab",1,0,57034,Troopers,"Veers 6* zPiett 4* G9, Gideon G9, Dark Trooper G9, Range Trooper 3* G9",0
"GeneralZab",,,62026,Nute-OR,"Nute G9, Dooku G9, Jango Zaalbar G8, Mission G7",0
"GeneralZab",1,1,87400,Revan,"zJKR BS GMY Jolee G8, GK",0
"GeneralZab",0,1,72395,BH,"Bossk The Mandalorian, Zam G8, Boba Greef G9",0
"GeneralZab",1,1,91319,zEP,"zEP zzVader Tarkin G8, zBSF Mara Jade, The Emperor's Hand 4*",0
"SitOnMySith",0,1,102636,padme,"zzPadme zGK JKA zAhsoka C-3PO",1
"SitOnMySith",,,298376,HansMF,"Home One, Han's MF, HT Ghost Phantom Biggs X-wing, Cassian's U-wing, Wedge X-wing",1
"SitOnMySith",0,1,110396,Grievous,"zzGG zB2 zB1 zDroideka MagnaGuard",1
"SitOnMySith",1,1,93548,Revan Offense,"zzJKR GMY BS zJolee Ezra G9",1
"SitOnMySith",1,1,83767,Carth,"zCarth Onasi, zMission zZaalbar Juhani G8, zCanderous",1
"SitOnMySith",1,1,87173,zEP,"zEP zVader Tarkin G8, TFP G8, BSF",1
"SitOnMySith",1,0,18087,SionSolo (Counter),"Sion",1
"SitOnMySith",1,0,15930,NestSolo (Counter),"Nest",1
"SitOnMySith",,,47268,Phasma,"Phasma G8, FOE 5* G8, FOO G8, KRU G8, Kylo 5* G8",0
"SitOnMySith",1,0,83101,CLS,"CLS Han Chewbacca R2-D2 G7, Chewpio",0
"SitOnMySith",0,1,75093,Geonosians,"GBA Sun Fac G8, Geo Soldier, Geo Spy, Poggle G9",0
"SitOnMySith",1,1,94888,GAS,"zGAS Rex Echo (501st), Fives ARC Trooper",0
"SitOnMySith",,,70577,Mon Mothma,"Mon Mothma G8, Cassian G8, Kyle Katarn, Cara Dune G8, K-2SO G8",0
"SitOnMySith",1,1,49264,NS_Alt,"MT G8, AV Spirit 5* G8, Daka G8, Talia 5* G8",0
"SitOnMySith",1,1,67417,Ewoks,"Chirpa Elder Paploo Wicket Logray",0
"SitOnMySith",0,1,83512,BH,"Bossk Dengar G9, Cad IG-88 Boba",0
"SitOnMySith",1,0,49672,Troopers,"Veers G8, Starck G6, DT G8, Snowtrooper G8, Iden Versio G8",0
"SitOnMySith",0,1,60587,Phoenix,"Hera G8, Chopper G8, Kanan G9, Sabine 5* G8, Zeb G8",0
"SitOnMySith",1,0,52913,Wiggs,"Wedge G8, Biggs G8, Leia G8, Chirrut 5* G8, Baze G8",0
"SitOnMySith",1,0,87618,zMaul,"Darth Maul G8, DN DR zSavage Sith Marauder",0
"TheHighGround",0,1,93363,Geonosians,"zzGBA Sun Fac, Geo Soldier, Geo Spy, Poggle",1
"TheHighGround",0,1,100645,Grievous,"zzGG zB2 zB1 zMagnaGuard zNute",1
"TheHighGround",1,1,104173,Ewoks,"zChirpa Elder zPaploo zWicket zLogray",1
"TheHighGround",1,0,75269,Troopers,"zVeers zStarck G9, zzPiett 6* Iden Versio, Range Trooper 6*",0
"Classy Squirrel",0,1,88085,Geonosians,"GBA Sun Fac, Geo Soldier, Geo Spy, Poggle",1
"Classy Squirrel",1,1,78354,JTR,"JTR Scav Rey, BB-8 G9, R2-D2 G9, Finn",0
"Classy Squirrel",1,0,89361,Wiggs,"Wedge G8, Biggs G7, CLS zHan zChewbacca",0
"Classy Squirrel",0,1,71589,FO,"KRU G9, Kylo G9, Phasma G9, FOO G9, FOSFTP G9",0
"Classy Squirrel",1,0,65275,Jawas,"Nebit Jawa Engineer G7, Jawa Scavenger G7, Jawa G7, Dathcha G9",0
"Jed",0,1,74739,Phoenix,"Hera Ezra Kanan G9, Sabine G9, Zeb G8",1
"Jed",,,67377,Phasma,"Phasma G8, FOE G8, FOO G8, KRU G8, Kylo G7",0
"Jed",0,1,51712,padme,"Padme G7, GK G7, JKA G7, Ahsoka G8, C-3PO 5* G9",0
"Jed",0,1,84900,Grievous,"GG B2 G9, Droideka MagnaGuard Dooku",0
"Jed",1,1,68787,JTR,"JTR G6, Scav Rey, BB-8 G9, R2-D2 Finn G9",0
"Jed",1,1,88387,Ewoks,"Chirpa Elder Paploo Wicket Logray",0
"Jed",0,1,88171,BH,"Bossk Dengar G8, The Mandalorian, Jango Boba",0
"Jed",1,1,85256,zEP,"EP zVader Tarkin DN G7, Mara Jade, The Emperor's Hand",0
"Jed",1,0,57095,Wiggs,"Wedge G6, Biggs G6, CLS G8, Han G8, Leia",0
"Jed",1,0,36618,Clones,"Cody G6, Rex G6, Echo (501st) G6, Fives G7, Clone Sergeant G6",0
"Xnalanx",1,0,97949,CLS,"zzCLS zHan Chewbacca R2-D2 Chewpio",1
"Xnalanx",0,1,90278,Geonosians,"zGBA Sun Fac, Geo Soldier, Geo Spy, Poggle",1
"Xnalanx",1,1,104420,Revan,"zzzJKR BS GMY zJolee GK",1
"Xnalanx",0,1,91066,BH,"zzBossk Dengar Cad IG-88 Boba",1
"Xnalanx",1,1,66583,Carth,"Carth Onasi, Mission G8, Zaalbar G9, Juhani G7, Canderous",0
"Xnalanx",1,1,94926,zEP,"zEP zVader Tarkin BSF Mara Jade, The Emperor's Hand 5*",0
"Xnalanx",1,0,59976,Troopers,"Veers 6* G9, Starck G9, Gideon G8, Piett 6* G8, Dark Trooper 6* G8",0
"Thehighground420",0,1,113742,DRMalak,"zzzDR HK-47 zBSF zzMalak Sith Empire Trooper",1
"Thehighground420",,,86573,Disintegration,"Aurra Greef Boba zBossk The Mandalorian",1
"Thehighground420",1,1,105497,Revan,"zzzJKR BS GMY zJolee GK",1
"Thehighground420",0,1,73478,Geonosians,"zGBA 5* Sun Fac G8, Geo Soldier, Geo Spy, Poggle",0
"Thehighground420",,,252742,HansMF,"Home One, Han's MF 5*, HT 5* Ghost Phantom Biggs X-wing, Cassian's U-wing, Wedge X-wing",0
"Thehighground420",1,0,76819,Troopers,"zVeers zPiett G9, Gideon G9, Dark Trooper, Range Trooper G8",0
"Thehighground420",1,1,67673,Carth,"Carth Onasi, Mission G5, Zaalbar Juhani G6, zCanderous",0
"Thehighground420",1,1,80274,zEP,"EP zzVader Tarkin G6, Traya 5* DN",0
"Thehighground420",1,0,82441,CLS,"CLS Han Leia Old Ben G9, Chewbacca",0
"Thehighground420",0,1,62823,BH,"Jango Dengar G7, Cad G8, zZam IG-88 G7",0
"Thehighground420",0,1,40675,Phoenix,"Hera 5* G8, Ezra 5* G7, Chopper G7, Kanan G8, Zeb G8",0
"Thehighground420",1,0,10449,SionSolo (Counter),"Sion 5* G9",0
"Bo Diddle",1,0,124101,CLS,"zzzCLS zHan zChewbacca C-3PO Chewpio",1
"Bo Diddle",0,1,106497,DRMalak,"zzzDR HK-47 BSF zzMalak Sith Empire Trooper",1
"Bo Diddle",0,1,87666,Geonosians,"zGBA Sun Fac, Geo Soldier, Geo Spy, Poggle",1
"Bo Diddle",1,1,103263,Revan,"zzJKR BS GMY zJolee zGK",1
"Bo Diddle",1,1,81340,Ewoks,"zChirpa Elder Paploo Wicket Logray",1
"Bo Diddle",0,1,91068,BH,"zBossk The Mandalorian, Jango Boba Greef",1
"Bo Diddle",,,38879,Phasma,"Phasma 5* G8, FOE 5* G8, FOO G8, KRU 5* G8, Kylo G8",0
"Bo Diddle",0,1,86256,Grievous,"zGG zB2 zB1 G9, Droideka G9, MagnaGuard G9",0
"Bo Diddle",1,0,81960,Troopers,"zVeers zPiett Gideon Dark Trooper, Range Trooper G9",0
"Bo Diddle",1,1,39431,NS_Alt,"MT 5* G8, AV G8, Spirit 5* G8, Daka G8, Talia 5* G8",0
"Bo Diddle",1,1,82613,Carth,"Carth Onasi, zMission Zaalbar Juhani G7, Canderous",0
"Bo Diddle",1,0,58857,ShaakClones,"Shaak Ti G8, Rex G8, Echo (501st) G8, Fives G8, ARC Trooper 5* G8",0
"Bo Diddle",1,1,82086,zEP,"zEP zzVader Tarkin G8, TFP G8, Mara Jade, The Emperor's Hand",0
"Bo Diddle",0,1,42290,Phoenix,"Hera 5* G8, Chopper G8, Kanan G8, Sabine 5* G8, Zeb G8",0
"Bo Diddle",1,0,39854,Wiggs,"Wedge 5* G8, Biggs 5* G8, Leia G9, Chirrut 5* G8, Baze 6* G8",0
"e4embo",0,1,87201,Geonosians,"zGBA Sun Fac, Geo Soldier, Geo Spy, Poggle",1
"e4embo",1,1,104873,Revan,"zzzJKR BS GMY zJolee GK",1
"e4embo",1,0,97892,CLS,"zCLS zHan zChewbacca R2-D2 zChewpio",0
"e4embo",,,86999,Disintegration,"Aurra 4* zGreef Boba Bossk The Mandalorian",0
"e4embo",1,0,69849,Traya,"Traya 5* DN 3* Sion 3* EP Thrawn 6*",0
"e4embo",1,0,59194,Troopers,"Veers 5* Piett Gideon G9, Dark Trooper G9, Range Trooper 3* G9",0
"e4embo",1,0,76007,ShaakClones,"Shaak Ti G9, Rex Echo (501st), Fives ARC Trooper 5*",0
"e4embo",1,1,53521,Carth,"Carth Onasi 5*, Mission G7, Zaalbar G9, Juhani 5* G9, Canderous 5*",0
"e4embo",,,53763,Bad Batch,"zHunter 5* G9, Echo 4* G9, Omega 4* G9, Tech 5* G9, Wrecker 5* G9",0
"e4embo",0,1,42869,Phoenix,"Hera 6* G9, Ezra 6* G8, Chopper 6* G8, Kanan 6* G8, Zeb 6* G8",0
"e4embo",1,0,13905,NestSolo (Counter),"Nest 6*",0
"Elon Muscle",0,1,88439,Geonosians,"zGBA Sun Fac, Geo Soldier, Geo Spy, Poggle",1
"Elon Muscle",1,1,78873,Revan,"zzzJKR BS G9, GMY Jolee GK G8",1
"Elon Muscle",0,1,119586,BH,"zBossk Dengar Jango IG-88 Boba",1
"Elon Muscle",1,0,111501,CLS,"zzCLS zHan zzChewbacca R2-D2 Chewpio",0
"Elon Muscle",1,1,70983,Ewoks,"Chirpa 6* Elder Paploo Wicket Logray",0
"Elon Muscle",1,1,73977,zEP,"EP G8, zzVader Tarkin G7, Dooku 5* G8, TFP G9",0
"Ajunta Kal",0,1,88902,Geonosians,"zGBA Sun Fac, Geo Soldier, Geo Spy, Poggle",1
"Ajunta Kal",1,1,102696,zEP,"zEP zVader Tarkin TFP G8, zSith Trooper",1
"Ajunta Kal",0,1,132542,FO,"zzKRU zKylo FOE FOO zHux",1
"Ajunta Kal",0,1,58203,Phoenix,"Hera G9, Ezra G8, Chopper G9, Kanan G8, Zeb G8",1
"Ajunta Kal",1,1,39431,NS_Alt,"MT 5* G8, AV G8, Spirit 5* G8, Daka 5* G8, Talia G8",0
"Ajunta Kal",0,1,77719,BH,"Bossk Cad IG-88 Greedo 5* G8, Boba",0
"Ajunta Kal",1,0,48836,501st,"Rex G8, Clone Sergeant G8, Echo (501st) G8, Fives G8, Ahsoka G8",0
"Ajunta Kal",1,1,36848,Rogue1,"Jyn 5* G8, Chirrut 5* G8, Baze 5* G8, Cassian G8, K-2SO 5* G8",0
"Studkiller21",0,1,78952,BH,"zBossk The Mandalorian G8, Jango Boba Greef G8",1
"Studkiller21",0,1,109439,FO,"zzKRU zKylo FOE zHux FOST",1
"Studkiller21",0,1,67592,Phoenix,"Hera G9, Ezra Chopper G9, Kanan G8, Zeb G8",1
"Studkiller21",0,1,80728,Geonosians,"zGBA Sun Fac G8, Geo Soldier, Geo Spy, Poggle",0
"Studkiller21",1,1,86659,zEP,"zEP zzVader Tarkin Sith Trooper, Mara Jade, The Emperor's Hand 4* G9",0
"Studkiller21",0,1,64242,BS,"BS GMY JKA G9, Old Ben G7, Ahsoka G8",0
"BluntSkull",0,1,100864,Geonosians,"zzGBA Sun Fac, Geo Soldier, Geo Spy, Poggle",1
"BluntSkull",1,0,103132,Troopers,"zVeers zzPiett zGideon zDark Trooper, Range Trooper",1
"BluntSkull",1,0,108941,ShaakClones,"zShaak Ti, zRex Echo (501st), zzFives ARC Trooper",1
"BluntSkull",0,1,69904,Phoenix,"Hera Ezra Chopper G8, Kanan G9, Zeb G8",1
"BluntSkull",,,52006,Phasma,"Phasma G7, FOE G7, FOO G8, KRU Kylo G7",0
"BluntSkull",0,1,57369,padme,"Padme G8, GK G8, JKA 5* Ahsoka Barriss 6* G7",0
"BluntSkull",,,47766,Nute-OR,"Nute G5, Dooku Jango G7, Zaalbar G7, Mission G7",0
"BluntSkull",1,1,52463,Ewoks,"Chirpa G8, Elder Paploo G7, Wicket 5* G8, Logray G8",0
"DarthTalon",1,1,160586,GL Rey,"zzzzzzRey zzzJTR zzR2-D2 zHoldo zRH Finn",1
"DarthTalon",1,1,102296,NS,"zzMT zzAV zDaka Zombie Spirit",1
"DarthTalon",,,157285,JMLS,"zBS zzzzzzJMLS zzHYoda zzJKL zJolee",1
"DarthTalon",1,0,147187,CLS,"zzzCLS zHan zzChewbacca zzC-3PO zChewpio",1
"DarthTalon",0,1,123289,padme,"zzPadme zGK zJKA zAhsoka zBarriss",1
"DarthTalon",,,465455,Negotiator,"Negotiator BTL-B Y-wing, Anakin's Eta-2, Rex's ARC-170, Umbaran SF, Ahsoka's SF, Plo's SF, Clone Sergeant's ARC-170",1
"DarthTalon",0,1,106558,DR,"zzzDR zzHK-47 zBSF Sith Empire Trooper, Sith Assassin G8",1
"DarthTalon",,,300223,Malevolence,"Malevolence Hyena Bomber, Vulture Droid, Sun Fac SF, Soldier SF, Spy SF",1
"DarthTalon",,,461533,HansMF,"Home One, Han's MF, Rebel Y-wing, Bistan's U-wing, Phantom Ghost Cassian's U-wing, Wedge X-wing",1
"DarthTalon",0,1,99677,Geonosians,"zzGBA Sun Fac, Geo Soldier, Geo Spy, Poggle",1
"DarthTalon",0,1,110296,Grievous,"zzGG zB2 zB1 zMagnaGuard zNute",1
"DarthTalon",1,0,126981,Traya,"zzTraya zDN zSion zzEP zzThrawn",1
"DarthTalon",,,101405,Mon Mothma,"zzMon Mothma, Wedge zCara Dune, Scarif Pao",1
"DarthTalon",,,447806,Executrix,"Executrix Tie Adv, Emperor's Shuttle, TIE Reaper, Imperial TIE Fighter, Gauntlet Starfighter, FOSF TIE Fighter, FO TIE Fighter",1
"DarthTalon",1,1,96080,Ewoks,"zChirpa Elder zPaploo zWicket zLogray",1
"DarthTalon",1,0,152023,ShaakClones,"zzShaak Ti, zRex zEcho (501st), zzFives zARC Trooper",1
"DarthTalon",0,1,136994,BH,"zzBossk Dengar zzJango zIG-88 zBoba",1
"DarthTalon",1,1,99634,Carth,"zCarth Onasi, zMission zZaalbar zJuhani zCanderous",1
"DarthTalon",1,0,112856,Troopers,"zVeers zStarck DT zzPiett Shoretrooper",1
"DarthTalon",1,0,127629,zMaul,"zDarth Maul, zSidious zDooku Sith Marauder, zNest",1
"DarthTalon",0,1,97694,FO,"zzKRU zKylo FOE FOO zHux",1
"DarthTalon",0,1,94325,Phoenix,"Hera zEzra zKanan Sabine Zeb",1
"DarthTalon",1,1,96744,Rogue1,"zJyn Chirrut Baze zCassian zK-2SO",1
"DarthTalon",1,0,67369,Jawas,"Nebit G9, Jawa Engineer, Jawa Scavenger G8, Jawa Dathcha",1
"DarthTalon",,,77291,Bad Batch,"zHunter zEcho G8, zzOmega G9, Tech G9, Wrecker G8",0
"jack0",1,1,71948,Ewoks,"zChirpa G9, Elder Paploo G9, Scout Logray",1
