Player,Offense,Defense,GP,Name,Squad,Viable
"Bo Diddle",1,0,126507,CLS,"zzzCLS zHan zChewbacca zC-3PO Chewpio",1
"Bo Diddle",0,1,106497,DRMalak,"zzzDR HK-47 BSF zzMalak Sith Empire Trooper",1
"Bo Diddle",1,0,83364,Troopers,"zVeers zPiett Gideon Dark Trooper, Range Trooper",1
"Bo Diddle",1,1,106809,Revan,"zzJKR BS zGMY zJolee zGK",1
"Bo Diddle",1,1,81387,Ewoks,"zChirpa Elder Paploo Wicket Logray",1
"Bo Diddle",0,1,96019,BH,"zBossk Boba Greef Jango The Mandalorian",1
"Bo Diddle",,,43154,Phasma,"Phasma G8, FOE 5* G8, FOO G8, KRU 6* G8, Kylo G8",0
"Bo Diddle",,,98519,Grievous Omicron,"zGG zB2 zB1 MagnaGuard Droideka",0
"Bo Diddle",0,1,87666,Geonosians Omicron,"zGBA Sun Fac, Geo Soldier, Geo Spy, Poggle",0
"Bo Diddle",,,254788,HansMF,"Home One, Han's MF, HT Ghost 6* Phantom 5* Biggs X-wing 5*, Cassian's U-wing 4*, Wedge X-wing 5*",0
"Bo Diddle",1,0,56473,Traya,"Traya 5* G9, DN 6* G8, Sion G6, Dooku 6* G8, zEP",0
"Bo Diddle",1,1,46501,NS_Alt,"MT 5* G8, AV Spirit 5* G8, Daka G8, Talia 5* G8",0
"Bo Diddle",1,1,82660,Carth,"Carth Onasi, zMission Zaalbar Juhani G7, Canderous",0
"Bo Diddle",1,0,69984,ShaakClones,"zShaak Ti, Rex G8, Echo (501st) G8, zFives G9, ARC Trooper 5* G8",0
"Bo Diddle",0,1,42290,Phoenix,"Hera 5* G8, Ezra 5* G8, Zeb G8, Chopper G8, Kanan G8",0
"Bo Diddle",1,0,39854,Wiggs,"Wedge 5* G8, Biggs 5* G8, Leia G9, Chirrut 5* G8, Baze 6* G8",0
"BluntSkull",1,0,104724,Troopers,"zVeers zzPiett zGideon zDark Trooper, Range Trooper",1
"BluntSkull",1,1,79813,Ewoks,"zChirpa Elder Paploo G9, Wicket Logray",1
"BluntSkull",1,0,118407,ShaakClones,"zzShaak Ti, zRex Echo (501st), zzFives ARC Trooper",1
"BluntSkull",0,1,73485,Phoenix,"Hera Ezra Zeb G9, Chopper Kanan G9",1
"BluntSkull",,,52744,Phasma,"Phasma G7, FOE G7, FOO G9, KRU Kylo G7",0
"BluntSkull",,,43745,Admiral Raddus,"Admiral Raddus 3* G8, Cassian G8, Jyn 6* G8, K-2SO G8, Bistan G8",0
"BluntSkull",0,1,71403,padme,"Padme GK G8, JKA 6* Ahsoka C-3PO 6*",0
"BluntSkull",0,1,100888,Geonosians Omicron,"zzGBA Sun Fac, Geo Soldier, Geo Spy, Poggle",0
"BluntSkull",,,51060,Nute-OR,"Nute G7, Dooku Jango G7, Zaalbar G7, Mission G7",0
"BluntSkull",1,1,57163,zEP,"EP G9, Vader G9, Tarkin G6, TFP G6, BSF",0
"BluntSkull",0,1,51066,BH,"Bossk G9, Dengar G6, Boba G8, Greef 6* G6, Cad G7",0
"dicksharpe",,,123782,Phasma,"zPhasma zFOTP FOSFTP zFOST zKylo",1
"dicksharpe",1,0,121159,CLS,"zzCLS zHan zChewbacca C-3PO Chewpio",1
"dicksharpe",0,1,93887,Geonosians Omicron,"zzGBA Sun Fac, Geo Soldier, Geo Spy, Poggle",1
"dicksharpe",,,358403,HansMF,"Home One, Han's MF, HT Ghost Phantom Biggs X-wing, Cassian's U-wing, Wedge X-wing",1
"dicksharpe",,,108883,Disintegration,"Aurra Greef Boba zzBossk The Mandalorian",1
"dicksharpe",1,1,80782,Ewoks,"zChirpa G9, Elder Paploo Wicket Logray",1
"dicksharpe",1,1,124352,zEP,"zEP zVader Tarkin TFP zSith Trooper",1
"dicksharpe",0,1,68800,Phoenix,"Hera G9, Ezra G9, Zeb G8, Chopper G9, Kanan G8",1
"dicksharpe",1,0,19021,NestSolo (Counter),"zNest",1
"dicksharpe",1,0,13912,SionSolo (Counter),"Sion G9",1
"dicksharpe",,,52621,Admiral Raddus,"Admiral Raddus 3* G8, Cassian G8, Jyn G8, K-2SO G8, Chirrut G8",0
"dicksharpe",1,0,96496,Troopers,"zVeers zzPiett Gideon G9, Dark Trooper G9, Range Trooper G9",0
"dicksharpe",1,1,66287,NS,"MT G8, AV Daka Zombie 6* G8, Spirit G8",0
"dicksharpe",,,352677,Executrix,"Executrix Tie Adv, Emperor's Shuttle 4*, TIE Reaper 3*, Imperial TIE Fighter, Gauntlet Starfighter, FOSF TIE Fighter, FO TIE Fighter",0
"dicksharpe",,,69387,Nute-OR,"Nute zDooku Jango Zaalbar 6* G8, Mission 6* G7",0
"dicksharpe",1,0,65635,ShaakClones,"Shaak Ti G8, Rex Echo (501st) G8, Fives G8, Clone Sergeant G8",0
"dicksharpe",0,1,73513,BS,"zBS GMY Jolee 6* G9, GK G7, Ahsoka G8",0
"dicksharpe",1,0,71778,IG88,"IG-88 zGG BB-8 G8, T3-M4 6* G8, L3-37 G8",0
"DarthEf2Pee",0,1,93471,Geonosians Omicron,"zzGBA Sun Fac, Geo Soldier, Geo Spy, Poggle",1
"DarthEf2Pee",,,57547,Phasma,"Phasma G7, FOTP FOSFTP G6, FOST Kylo G9",0
"DarthEf2Pee",1,1,87105,zEP,"EP G9, zzzVader Tarkin G9, Dooku 6* G9, Sith Trooper",0
"DarthEf2Pee",0,1,54341,Phoenix,"Hera G8, Ezra G8, Zeb G8, Chopper G7, Kanan G8",0
"DarthEf2Pee",0,1,53381,BS,"BS 4* G8, GMY G7, JKA G8, Old Ben G8, Ahsoka G8",0
"Yeti no kles",,,554338,Executor,"Executor 5* HT RC Xanadu Blood, Slave I, IG-2000 Imperial TIE Fighter, Tie Adv",1
"Yeti no kles",1,0,140662,CLS,"zzzCLS zHan zChewbacca zC-3PO zChewpio",1
"Yeti no kles",,,355530,HansMF,"Home One, Han's MF, Rebel Y-wing, Ghost Phantom Biggs X-wing, Cassian's U-wing, Wedge X-wing",1
"Yeti no kles",1,0,89456,Traya,"zzTraya DN Sion Sith Empire Trooper, Thrawn",1
"Yeti no kles",1,0,116013,Troopers,"zVeers zzPiett zGideon Dark Trooper, Range Trooper",1
"Yeti no kles",,,115656,Disintegration,"Aurra zGreef zBoba zzBossk zThe Mandalorian",1
"Yeti no kles",1,1,72280,Ewoks,"zChirpa G9, Elder Paploo G9, Wicket Logray G9",1
"Yeti no kles",1,1,111632,zEP,"zEP zzzVader Tarkin Dooku TFP",1
"Yeti no kles",0,1,61335,Phoenix,"Hera G8, Ezra G8, Zeb G8, Chopper Kanan G8",1
"Yeti no kles",,,61047,Phasma,"Phasma G8, FOTP G8, FOO G8, KRU Kylo G8",0
"Yeti no kles",,,46937,Admiral Raddus,"Admiral Raddus 3* G8, Cassian G9, Jyn 5* G8, Baze 6* G8, Chirrut 5* G8",0
"Yeti no kles",0,1,87184,Geonosians Omicron,"zGBA Sun Fac, Geo Soldier, Geo Spy, Poggle",0
"Yeti no kles",1,1,69901,JTR,"JTR G8, Scav Rey G8, BB-8 G9, zR2-D2 Finn G8",0
"Yeti no kles",1,1,63564,NS,"MT G8, AV G9, Daka Zombie 6* Spirit G9",0
"Yeti no kles",,,77458,Mon Mothma,"zMon Mothma G9, Wedge Cara Dune, Lando Biggs",0
"Yeti no kles",1,0,68200,ShaakClones,"Shaak Ti G8, Rex Echo (501st), Fives G8, Clone Sergeant G8",0
"Yeti no kles",0,1,108563,BH,"Jango Dengar zZam IG-88 Cad",0
"Yeti no kles",0,1,96956,BS,"BS 6* zGMY zHYoda GK JKA",0
"SitOnMySith",,,114150,Grievous Omicron,"zzGG zB2 zB1 MagnaGuard zDroideka",1
"SitOnMySith",0,1,102636,padme,"zzPadme zGK JKA zAhsoka C-3PO",1
"SitOnMySith",,,310311,HansMF,"Home One, Han's MF, HT Ghost Phantom Biggs X-wing, Cassian's U-wing, Wedge X-wing",1
"SitOnMySith",1,1,93299,Revan Offense,"zzJKR GMY BS zJolee Ezra G9",1
"SitOnMySith",1,1,83858,Carth,"zCarth Onasi, zMission zZaalbar Juhani G8, zCanderous",1
"SitOnMySith",1,1,92823,zEP,"zEP zVader Tarkin G8, TFP BSF",1
"SitOnMySith",1,0,18063,SionSolo (Counter),"Sion",1
"SitOnMySith",1,0,15930,NestSolo (Counter),"Nest",1
"SitOnMySith",,,57541,Phasma,"Phasma G8, FOE 6* G8, FOO G8, KRU G8, Kylo G8",0
"SitOnMySith",1,0,93922,CLS,"zCLS Han Chewbacca R2-D2 G8, Chewpio",0
"SitOnMySith",0,1,78861,Geonosians Omicron,"GBA Sun Fac, Geo Soldier, Geo Spy, Poggle",0
"SitOnMySith",1,1,70520,NS,"MT AV Daka Zombie 6* Spirit 5* G8",0
"SitOnMySith",1,1,104587,GAS,"zGAS Rex Echo (501st), zzFives ARC Trooper",0
"SitOnMySith",,,74021,Mon Mothma,"Mon Mothma G8, Cara Dune G8, K-2SO G8, Kyle Katarn, Cassian G8",0
"SitOnMySith",1,1,67417,Ewoks,"Chirpa Elder Paploo Wicket Logray",0
"SitOnMySith",0,1,90458,BH,"Bossk Dengar Boba IG-88 Cad",0
"SitOnMySith",1,0,77179,Troopers,"zVeers Starck G7, Iden Versio G8, Dark Trooper G9, zPiett",0
"SitOnMySith",0,1,61400,Phoenix,"Hera G8, Zeb G8, Chopper G8, Sabine 5* G8, Kanan G9",0
"SitOnMySith",1,0,50833,Wiggs,"Wedge G8, Biggs G8, Leia G8, Chirrut 5* G8, Baze G8",0
"SitOnMySith",1,0,88875,zMaul,"Darth Maul G8, DN DR zSavage Sith Marauder",0
"SitOnMySith",1,0,57564,ThrawnTroopers,"Thrawn G9, Range Trooper G7, DT G8, Shoretrooper G8, Stormtrooper G8",0
"Kelattt",0,1,98527,padme,"zzPadme GK JKA zAhsoka C-3PO",1
"Kelattt",,,92292,Disintegration,"Aurra zGreef Boba Bossk The Mandalorian G8",1
"Kelattt",1,1,111245,Revan Offense,"zzzJKR zGMY BS zJolee HYoda",1
"Kelattt",1,1,77498,Ewoks,"zChirpa Elder Paploo Wicket Logray",1
"Kelattt",0,1,70044,Phoenix,"Hera G8, Ezra G8, Zeb G8, Chopper Kanan G8",1
"Kelattt",0,1,86027,Geonosians Omicron,"GBA Sun Fac, Geo Soldier, Geo Spy, Poggle",0
"Kelattt",0,1,94240,DRMalak,"zDR HK-47 BSF zzMalak 6* Sith Empire Trooper G7",0
"Kelattt",1,1,77092,Carth,"Carth Onasi, Mission Zaalbar Juhani G7, Canderous",0
"Kelattt",1,1,94209,zEP,"zzEP zzVader Tarkin G6, DT Mara Jade, The Emperor's Hand",0
"Kelattt",1,0,58040,CLS,"CLS G9, Han G7, Leia G8, Old Ben G9, Chewbacca G8",0
"HendoSon",0,1,73363,Phoenix,"Hera Ezra Zeb Chopper G9, Kanan G8",1
"HendoSon",,,48379,Phasma,"Phasma G8, FOTP G8, FOE 5* G9, KRU 6* G8, Kylo G8",0
"HendoSon",0,1,82482,Geonosians Omicron,"zGBA Sun Fac G9, Geo Soldier G9, Geo Spy, Poggle",0
"HendoSon",1,1,104727,NS,"MT zAV zDaka Zombie Spirit 6*",0
"HendoSon",,,222009,HansMF,"Home One 6*, Han's MF 6*, HT Ghost 6* Phantom 5* Biggs X-wing 6*, Cassian's U-wing, Wedge X-wing 5*",0
"HendoSon",1,1,90555,zEP,"EP zzzVader Tarkin DT G8, DN 5* G9",0
"HendoSon",0,1,78007,BH,"Bossk Boba Cad G8, Jango Greedo 6* G8",0
"HendoSon",1,0,65131,501st,"Rex Clone Sergeant G8, Echo (501st) 6* G8, Fives G9, Ahsoka",0
"HendoSon",1,0,65358,Troopers,"Veers Starck G5, Iden Versio, Shoretrooper G8, Snowtrooper",0
"HendoSon",1,0,42585,Wiggs,"Wedge 5* G8, Biggs G8, Leia G8, Chirrut 5* G8, Baze 5* G8",0
"Ta152",1,1,137566,JTR,"zzJTR zR2-D2 zzBB-8 zRH Finn, zRH Poe",1
"Ta152",1,1,76493,Ewoks,"zChirpa Elder Paploo Wicket Logray",1
"Ta152",0,1,90737,FO,"zzKRU Kylo FOE FOO zHux 5*",1
"Ta152",1,0,98085,CLS,"zzCLS zHan zChewbacca C-3PO Chewpio",0
"Ta152",0,1,87735,Geonosians Omicron,"zGBA Sun Fac, Geo Soldier, Geo Spy, Poggle",0
"Ta152",1,0,87497,Troopers,"zVeers zPiett Gideon G9, Dark Trooper, Range Trooper",0
"Ta152",,,339150,Raddus,"Raddus 5* Sun Fac SF 5*, Rey's Millennium Falcon, Poe Dameron's X-wing, Resistance X-wing, Biggs X-wing, Wedge X-wing, Phantom 5* Ghost 5*",0
"Ta152",1,1,86322,zEP,"zEP zzVader Tarkin Traya 6* Mara Jade, The Emperor's Hand 4*",0
"Ta152",0,1,84325,BH,"zBossk Zam Boba Jango The Mandalorian G8",0
"jack0",1,1,77698,Ewoks,"zChirpa Elder Paploo G9, Scout Logray",1
"jack0",1,1,128919,zEP,"zzEP zzzVader zTarkin zKrennic Sion G9",1
"jack0",0,1,98670,Phoenix,"zHera zEzra Zeb Sabine G9, Kanan",1
"jack0",,,73401,Phasma,"Phasma FOE FOO KRU G8, Kylo G8",0
"jack0",0,1,73990,Geonosians Omicron,"GBA 5* Sun Fac G8, Geo Soldier, Geo Spy, Poggle",0
"jack0",,,71146,Nute-OR,"Nute zDooku Jango G7, Zaalbar 3* G7, Mission 2* G7",0
"jack0",1,1,68527,NS_Alt,"zAV Spirit G5, Zombie Daka G9, Talia",0
"jack0",,,42049,Mon Mothma,"Mon Mothma 4* G8, Wedge G7, Hoth Rebel Scout G5, Lando G6, Biggs G7",0
"jack0",1,0,58104,ShaakClones,"Shaak Ti 4* G8, Rex Echo (501st) G8, Fives Clone Sergeant G5",0
"jack0",0,1,79583,BH,"Bossk 4* G8, Boba IG-88 G8, Cad Greedo",0
"jack0",1,0,94702,Troopers,"Veers Starck Gideon G9, zPiett Stormtrooper",0
"jack0",0,1,76235,BS,"BS 4* G8, GMY G7, zJKA GK 6* G9, Ahsoka",0
"Belisarius",,,132623,Phasma,"zPhasma FOE FOO zzKRU zKylo",1
"Belisarius",,,328666,HansMF,"Home One, Han's MF, HT Ghost Phantom Biggs X-wing, Cassian's U-wing, Wedge X-wing",1
"Belisarius",1,1,81520,Ewoks,"zChirpa Elder Paploo G9, Wicket Logray",1
"Belisarius",0,1,95319,BH,"zBossk Dengar G9, Boba Cad zThe Mandalorian",1
"Belisarius",1,1,111676,zEP,"zzEP zzVader Tarkin TFP G9, zBSF",1
"Belisarius",0,1,80707,Phoenix,"Hera zEzra Zeb G8, Chopper Kanan G8",1
"Belisarius",0,1,87762,padme,"zPadme zGK G9, zJKA Ahsoka Fives G8",1
"Belisarius",1,0,92709,CLS,"zzzCLS zHan Chewbacca R2-D2 G8, Chewpio",0
"Belisarius",0,1,93672,Geonosians Omicron,"zGBA Sun Fac, Geo Soldier, Geo Spy, Poggle",0
"Belisarius",1,0,52361,Traya,"zTraya G9, DN 6* G8, Sion G7, Dooku G8, Thrawn G8",0
"Belisarius",1,0,88174,Troopers,"Veers zPiett zGideon Dark Trooper, Range Trooper G9",0
"Belisarius",0,1,47156,Grievous,"GG G9, B2 G7, Droideka G7, IG-88 G8, T3-M4 G7",0
"Belisarius",1,1,56292,NS_Alt,"MT G9, AV G8, Spirit G8, Daka Talia G9",0
"Belisarius",1,1,96850,Revan Offense,"zJKR zGMY BS Jolee G9, HYoda",0
"Belisarius",1,1,64988,Carth,"Carth Onasi, Mission G8, Zaalbar G7, Juhani 6* G9, Canderous",0
"Belisarius",1,1,47079,Rogue1,"Jyn 6* G8, Chirrut G8, Baze 6* G8, K-2SO G8, Cassian G9",0
"VikingKoala",1,0,91385,CLS,"zzzCLS zHan Chewbacca R2-D2 G9, Chewpio",1
"VikingKoala",,,100833,Disintegration,"Aurra Greef Boba zzBossk The Mandalorian",1
"VikingKoala",1,1,80184,Ewoks,"zChirpa Elder Paploo Wicket Logray",1
"VikingKoala",1,0,95565,501st,"zRex ARC Trooper, Echo (501st), Fives zAhsoka",1
"VikingKoala",1,1,86345,zEP,"zEP zzVader Tarkin G9, Dooku TFP G8",1
"VikingKoala",0,1,63936,Phoenix,"Hera G9, Ezra G9, Zeb G8, Chopper G9, Kanan G9",1
"VikingKoala",1,1,59811,Rogue1,"Jyn G8, Chirrut G8, Baze G8, K-2SO G8, Cassian G8",1
"VikingKoala",,,47871,Phasma,"Phasma G8, FOE 5* G8, FOO G8, KRU G8, Kylo G8",0
"VikingKoala",,,78548,Grievous Omicron,"GG B2 B1 6* MagnaGuard Droideka 6*",0
"VikingKoala",0,1,88039,Geonosians Omicron,"zGBA Sun Fac, Geo Soldier, Geo Spy, Poggle",0
"VikingKoala",,,243932,HansMF,"Home One, Han's MF 5*, Biggs X-wing, Bistan's U-wing 5*, Phantom Ghost Cassian's U-wing, Wedge X-wing",0
"VikingKoala",1,1,54016,NS_Alt,"MT G8, AV Spirit G8, Daka G8, Talia 6* G8",0
"VikingKoala",1,0,87258,Troopers,"Veers Starck Gideon zPiett Range Trooper",0
"VikingKoala",0,1,68330,BH,"Jango G9, Dengar G8, zZam IG-88 G8, Greedo G8",0
"VikingKoala",0,1,109820,BS,"BS zGMY zJolee 6* zGK zJKA",0
"tobster",1,0,124954,CLS,"zzzCLS zHan zzChewbacca zC-3PO zChewpio",1
"tobster",0,1,93421,Geonosians Omicron,"zzGBA Sun Fac, Geo Soldier, Geo Spy, Poggle",1
"tobster",1,0,134690,Troopers,"zVeers zzPiett zGideon zDark Trooper, Range Trooper",1
"tobster",1,1,76923,Ewoks,"zChirpa Elder Paploo Wicket Logray",1
"tobster",0,1,98467,BH,"zzBossk zBoba IG-88 zJango The Mandalorian",1
"tobster",1,1,80011,zEP,"zzEP G8, zzVader Tarkin BSF 5* G5, zzMara Jade, The Emperor's Hand 3*",0
"Ferran Jubei",,,327725,HansMF,"Home One, Han's MF 5*, HT 6* Ghost Phantom Biggs X-wing, Cassian's U-wing, Wedge X-wing",1
"Ferran Jubei",1,1,118255,Revan,"zzJKR zBS zGMY zJolee zGK",1
"Ferran Jubei",1,1,86483,Carth,"Carth Onasi, Mission Zaalbar Juhani Canderous",1
"Ferran Jubei",0,1,96664,BH,"zzBossk Boba Greef Jango The Mandalorian",1
"Ferran Jubei",1,1,99781,zEP,"zzEP zVader Tarkin G9, TFP G9, zBSF",1
"Ferran Jubei",0,1,65867,Phoenix,"Hera G9, Ezra G9, Zeb G8, Chopper G9, Kanan G8",1
"Ferran Jubei",1,1,79758,Rogue1,"Jyn Chirrut Baze K-2SO G8, Cassian",1
"Ferran Jubei",,,57878,Phasma,"Phasma G8, FOE 6* FOO G8, KRU G8, Kylo G8",0
"Ferran Jubei",1,0,88935,CLS,"zCLS zHan Chewbacca R2-D2 Chewpio",0
"Ferran Jubei",0,1,86383,Geonosians Omicron,"zGBA Sun Fac, Geo Soldier, Geo Spy, Poggle",0
"Ferran Jubei",1,1,56630,NS,"MT AV G8, Daka Zombie 6* G8, Spirit 6* G8",0
"Ferran Jubei",1,0,65622,Troopers,"Veers G9, zPiett Gideon G9, Dark Trooper 5* G9, Range Trooper 6* G8",0
"Ferran Jubei",1,0,74836,ShaakClones,"Shaak Ti G9, Rex Echo (501st), Fives Clone Sergeant G8",0
"Ferran Jubei",1,1,48028,Ewoks,"Chirpa 4* G9, Elder G8, Paploo 5* G9, Wicket 4* G8, Logray 5* G9",0
"Ferran Jubei",1,0,48618,Thragma (Counter),"Thrawn Magma G6, DT 5* G8, Stormtrooper G8, Shoretrooper 5* G8",0
"beanboi",0,1,88667,Geonosians Omicron,"zzGBA Sun Fac, Geo Soldier, Geo Spy, Poggle",1
"beanboi",1,0,92763,501st,"zRex zARC Trooper, Echo (501st), zFives Ahsoka",1
"beanboi",,,84644,Iden Troopers,"zIden Versio, zStormtrooper Snowtrooper Magma G9, DT",1
"beanboi",0,1,60869,Phoenix,"Hera G8, Ezra Zeb G8, Chopper G9, Kanan G8",1
"beanboi",1,0,74184,Troopers,"Veers Piett 4* G9, zGideon Dark Trooper 6*, Range Trooper",0
"beanboi",,,42352,Mon Mothma,"Mon Mothma 4* G8, Wedge 6* G8, Pao G8, Biggs G7, Kyle Katarn 5* G9",0
"beanboi",1,1,83874,zEP,"EP zVader Tarkin TFP Mara Jade, The Emperor's Hand 4*",0
"beanboi",,,80152,Bad Batch,"zHunter 5* zEcho 5* zOmega 5* zTech 5* zWrecker 6*",0
"beanboi",1,0,45957,Jawas,"Nebit G8, Jawa Engineer 6* G9, Jawa Scavenger, Jawa 4* G9, Dathcha G8",0
"e4embo",1,1,106993,Revan,"zzzJKR BS GMY zJolee GK",1
"e4embo",0,1,60558,Phoenix,"Hera G9, Ezra Zeb G8, Chopper G9, Kanan G9",1
"e4embo",1,0,15900,NestSolo (Counter),"Nest",1
"e4embo",1,0,105587,CLS,"zzCLS zHan zChewbacca R2-D2 zChewpio",0
"e4embo",0,1,87251,Geonosians Omicron,"zGBA Sun Fac, Geo Soldier, Geo Spy, Poggle",0
"e4embo",1,0,85121,Traya,"zTraya 6* DN 6* Sion 5* zEP Thrawn",0
"e4embo",,,90606,Disintegration,"Aurra 4* zGreef Boba Bossk The Mandalorian",0
"e4embo",1,0,58667,Troopers,"Veers 5* Piett Gideon G9, Dark Trooper G9, Range Trooper 3* G9",0
"e4embo",1,1,70382,Carth,"Carth Onasi, Mission G7, Zaalbar Juhani Canderous",0
"e4embo",1,0,76330,ShaakClones,"Shaak Ti G9, Rex Echo (501st), Fives ARC Trooper 5*",0
"e4embo",,,54949,Bad Batch,"zHunter 5* G9, Echo 4* G9, Omega 4* G9, Tech 5* G9, Wrecker 5* G9",0
"xXDarth YetiXx",,,124835,Phasma,"zPhasma zFOTP FOSFTP zFOST zKylo",1
"xXDarth YetiXx",1,1,145179,SL Kylo,"zzzzzSL Kylo, zSith Trooper, zHux zzKRU Thrawn G8",1
"xXDarth YetiXx",0,1,110930,padme,"zzPadme zGK JKA zAhsoka C-3PO",1
"xXDarth YetiXx",0,1,111726,Grievous,"zzGG zB2 zB1 MagnaGuard Dooku",1
"xXDarth YetiXx",1,1,81573,JTR,"zJTR Scav Rey G8, BB-8 R2-D2 Finn",1
"xXDarth YetiXx",1,1,68341,Ewoks,"zChirpa G9, Elder Paploo G9, Wicket Logray G9",1
"xXDarth YetiXx",0,1,81461,BH,"zBossk Boba IG-88 G9, Cad G9, Jango",1
"xXDarth YetiXx",1,1,106170,zEP,"zEP zzVader Tarkin DT TFP G9",1
"xXDarth YetiXx",0,1,61119,Phoenix,"Hera G8, Ezra G9, Zeb G8, Chopper G8, Kanan G8",1
"xXDarth YetiXx",1,0,13522,SionSolo (Counter),"Sion G9",1
"xXDarth YetiXx",,,49884,Admiral Raddus,"Admiral Raddus 3* G8, Cassian G9, Jyn 5* G8, Baze 6* G8, Chirrut G8",0
"xXDarth YetiXx",0,1,89033,Geonosians Omicron,"zGBA Sun Fac, Geo Soldier, Geo Spy, Poggle",0
"xXDarth YetiXx",,,233489,HansMF,"Home One, Han's MF 5*, Biggs X-wing, Bistan's U-wing, Phantom 6* Ghost Cassian's U-wing, Wedge X-wing",0
"xXDarth YetiXx",1,1,63447,NS,"MT G8, AV Daka Zombie 5* G8, Spirit G8",0
"xXDarth YetiXx",1,1,97709,GAS,"GAS G9, Rex Echo (501st), zFives ARC Trooper",0
"xXDarth YetiXx",1,0,64075,Wiggs,"Wedge G8, Biggs G8, CLS Han Leia G8",0
"xXDarth YetiXx",1,0,75631,Troopers,"Veers Starck G9, zIden Versio 6*, zPiett G8, Snowtrooper G9",0
"Kristian45",1,0,138155,CLS,"zzzCLS zHan zChewbacca zzC-3PO Chewpio",1
"Kristian45",,,107000,Disintegration,"zAurra Greef Boba zzBossk zThe Mandalorian",1
"Kristian45",1,1,83292,Ewoks,"zChirpa Elder Paploo zWicket Logray",1
"Kristian45",1,1,94005,zEP,"zzEP zzVader Tarkin DT TFP G8",1
"Kristian45",0,1,68105,Phoenix,"Hera G9, Ezra G9, Zeb G8, Chopper G8, Kanan G8",1
"Kristian45",,,94842,Grievous Omicron,"zGG B2 zB1 MagnaGuard Droideka",0
"Kristian45",0,1,86087,Geonosians Omicron,"GBA Sun Fac, Geo Soldier, Geo Spy, Poggle",0
"Kristian45",1,1,72239,Revan,"JKR G8, BS GMY Jolee G9, GK G8",0
"Kristian45",0,1,76922,BH,"Jango Dengar G9, zZam IG-88 G9, Cad G9",0
"ThEeSSs",1,0,82605,Wiggs,"Wedge Biggs CLS Han Ezra",1
"ThEeSSs",0,1,111720,padme,"zzPadme zGK zJKA zAhsoka Fives G8",1
"ThEeSSs",1,1,82806,Rogue1,"Jyn Chirrut Baze K-2SO Cassian",1
"ThEeSSs",,,68209,Phasma,"Phasma G9, FOE G9, FOO G9, KRU Kylo G9",0
"ThEeSSs",0,1,94856,Geonosians Omicron,"zzGBA Sun Fac, Geo Soldier, Geo Spy, Poggle",0
"ThEeSSs",1,1,85728,NS,"MT AV Daka Zombie Spirit",0
"ThEeSSs",1,0,95109,Traya,"zzTraya 6* zDN Sion 5* zDooku Thrawn",0
"ThEeSSs",1,1,85774,zEP,"EP zVader Tarkin DT TFP 5* G8",0
"ThEeSSs",1,0,78241,Troopers,"Veers 6* G8, Starck zIden Versio, Shoretrooper Snowtrooper",0
"ThEeSSs",0,1,63836,Phoenix,"Hera Zeb G8, Chopper Sabine 5* G8, Kanan G9",0
"DarthWampa",1,1,108600,Revan,"zzzJKR zBS zGMY zJolee zGK",1
"DarthWampa",0,1,131654,FO,"zzKRU zKylo FOE FOO zHux",1
"DarthWampa",0,1,74989,Phoenix,"Hera Ezra Zeb G8, Chopper Kanan",1
"DarthWampa",0,1,77268,Geonosians Omicron,"GBA 6* Sun Fac, Geo Soldier 6*, Geo Spy, Poggle",0
"DarthWampa",1,0,100925,Traya,"zzTraya 6* zDN 3* zSion 6* zzEP Thrawn",0
"DarthWampa",0,1,61193,Grievous,"GG 5* G8, B2 G9, MagnaGuard G7, Dooku 6* G9, T3-M4",0
"DarthWampa",0,1,62893,BH,"Bossk 2* Dengar G7, Boba Cad Jango G3",0
"Thehighground420",0,1,114286,DRMalak,"zzzDR HK-47 zBSF zzMalak Sith Empire Trooper",1
"Thehighground420",,,86573,Disintegration,"Aurra Greef Boba zBossk The Mandalorian",1
"Thehighground420",1,1,111147,Revan,"zzzJKR BS GMY zJolee zGK",1
"Thehighground420",,,79251,Grievous Omicron,"GG B2 6* G9, zB1 G9, MagnaGuard Droideka",0
"Thehighground420",0,1,81156,Geonosians Omicron,"zGBA Sun Fac G9, Geo Soldier, Geo Spy, Poggle",0
"Thehighground420",,,256610,HansMF,"Home One, Han's MF 5*, HT 6* Ghost Phantom Biggs X-wing, Cassian's U-wing, Wedge X-wing",0
"Thehighground420",1,0,76864,Troopers,"zVeers zPiett G9, Gideon G9, Dark Trooper, Range Trooper G8",0
"Thehighground420",1,0,72954,Traya,"Traya 6* DN Sion 5* G9, zDooku 6* EP",0
"Thehighground420",1,1,67673,Carth,"Carth Onasi, Mission G5, Zaalbar Juhani G6, zCanderous",0
"Thehighground420",1,0,84847,CLS,"zCLS Han Leia Old Ben G9, Chewbacca",0
"Thehighground420",0,1,62823,BH,"Jango Dengar G7, zZam IG-88 G7, Cad G8",0
"Thehighground420",0,1,40675,Phoenix,"Hera 5* G8, Ezra 5* G7, Zeb G8, Chopper G7, Kanan G8",0
"JSchill",1,1,149030,SL Kylo,"zzzzzzSL Kylo, zSith Trooper, zHux zzKRU Thrawn",1
"JSchill",0,1,90859,BH,"zBossk Dengar Boba Cad G9, zJango",1
"JSchill",1,1,111852,zEP,"zzEP zzzVader Tarkin G9, zBSF Sion",1
"JSchill",0,1,61067,Phoenix,"Hera G8, Ezra Zeb G8, Chopper G8, Kanan G8",1
"JSchill",,,119922,Phasma,"Phasma zFOTP FOSFTP zFOST zKylo",0
"JSchill",1,0,76472,CLS,"zCLS Han Chewbacca R2-D2 G8, Chewpio 4* G8",0
"JSchill",1,1,97351,Revan,"zJKR BS zGMY zJolee GK",0
"JSchill",1,1,64860,Carth,"Carth Onasi 6*, Mission Zaalbar Juhani G7, Canderous 6*",0
"creen",0,1,87840,FO,"zKRU Kylo FOE FOO FOST",1
"creen",0,1,66403,Phoenix,"Hera G9, Ezra Zeb G8, Chopper G9, Kanan",1
"creen",0,1,71140,Geonosians Omicron,"GBA Sun Fac G9, Geo Soldier G9, Geo Spy, Poggle",0
"creen",1,1,37586,NS_Alt,"MT 5* G8, AV 6* G8, Spirit 5* G8, Daka G8, Talia 5* G8",0
"creen",1,1,81428,zEP,"EP zzVader Tarkin Dooku 6* G9, Sith Trooper 4*",0
"creen",0,1,64815,BH,"Bossk 4* G9, Boba G9, IG-88 G8, Cad G8, The Mandalorian 4* G8",0
"creen",1,0,36418,501st,"Rex 5* G8, Clone Sergeant 5* G8, Echo (501st) 5* G8, Fives 5* G8, Ahsoka G8",0
"creen",1,0,39018,Troopers,"Veers 5* Starck G7, Shoretrooper 5* Stormtrooper 5* G8, DT 5* G8",0
"creen",1,0,56169,Wiggs,"Wedge Biggs Leia Chirrut 5* G8, Baze 5* G8",0
"Tomb",1,1,83184,Revan,"zzJKR BS GMY Jolee G8, GK",1
"Tomb",0,1,89543,BH,"zBossk Zam G9, Boba Aurra Jango",1
"Tomb",0,1,68954,Phoenix,"Hera G8, Ezra Zeb G8, Chopper G8, Kanan G8",1
"Tomb",1,0,89290,CLS,"zzCLS zHan Chewbacca 6* G9, R2-D2 G9, Chewpio",0
"Tomb",0,1,85780,Geonosians Omicron,"zGBA Sun Fac, Geo Soldier, Geo Spy, Poggle",0
"Tomb",1,1,82474,zEP,"EP G9, zzzVader Tarkin G9, zTraya 5* zMara Jade, The Emperor's Hand 5*",0
"Tomb",1,0,76189,Troopers,"Veers zStarck Gideon G9, Dark Trooper, zPiett G9",0
"ThePatience",,,564320,Executor,"Executor 5* HT RC Xanadu Blood, Slave I, IG-2000 Imperial TIE Fighter, Tie Adv",1
"ThePatience",1,0,127405,CLS,"zzCLS zHan zChewbacca R2-D2 zChewpio",1
"ThePatience",0,1,90229,Geonosians Omicron,"zGBA Sun Fac, Geo Soldier, Geo Spy, Poggle",1
"ThePatience",1,0,129390,Troopers,"zVeers zzPiett zGideon Dark Trooper, Range Trooper",1
"ThePatience",0,1,135967,BH,"zzBossk Dengar Boba IG-88 Cad",1
"ThePatience",1,1,135569,zEP,"zzEP zzVader Tarkin TFP zMara Jade, The Emperor's Hand",1
"ThePatience",1,0,121507,zMaul,"zDarth Maul, zSidious Dooku Sith Marauder, Nest",1
"ThePatience",0,1,62867,Phoenix,"Hera G8, Ezra G8, Zeb G8, Chopper G8, Kanan G8",1
"ThePatience",0,1,94324,BS,"zBS zGMY JKA GK G9, Ahsoka",1
"ThePatience",1,0,20493,SionSolo (Counter),"zSion",1
"ThePatience",,,36665,Admiral Raddus,"Admiral Raddus 3* G9, Cassian 3* G8, Jyn 4* G8, Baze 3* G8, Chirrut 4* G8",0
"ThePatience",1,1,66002,Ewoks,"zChirpa G9, Elder Paploo G9, Wicket 6* Logray G9",0
"ThePatience",,,69864,Iden Troopers,"Iden Versio, Shoretrooper Snowtrooper G9, Magma DT",0
"jex222",1,1,89791,JTR,"zJTR Scav Rey, zBB-8 R2-D2 Finn",1
"jex222",1,1,116207,Revan,"zzzJKR zBS zGMY zJolee zGK",1
"jex222",1,1,85813,Ewoks,"zChirpa Elder Paploo Scout zLogray",1
"jex222",0,1,92777,BH,"zBossk Dengar Boba Cad Greedo",1
"jex222",1,1,108352,zEP,"zEP zVader Tarkin zSith Trooper, zBSF",1
"jex222",0,1,126795,FO,"zzKRU Kylo FOE FOO zHux",1
"jex222",0,1,66556,Phoenix,"Hera G8, Ezra Zeb G8, Chopper G8, Kanan G8",1
"jex222",1,0,14266,SionSolo (Counter),"Sion G9",1
"jex222",1,0,81678,CLS,"zCLS zHan Chewbacca zC-3PO G8, Chewpio 2* G8",0
"jex222",0,1,84331,Geonosians Omicron,"zzGBA Sun Fac G9, Geo Soldier, Geo Spy, Poggle",0
"jex222",1,1,71450,NestSisters,"zzAV zMT Daka G9, Zombie 5* G8, Nest 3* G8",0
"jex222",0,1,73880,Grievous,"GG B2 G9, Droideka G8, MagnaGuard G8, Dooku",0
"jex222",1,0,51198,Troopers,"zVeers G9, Piett 2* G7, Gideon 3* G8, Dark Trooper 4* G7, Range Trooper 5* G6",0
"jex222",1,1,68425,Carth,"Carth Onasi, Mission Zaalbar G7, Juhani G9, Canderous G7",0
"jex222",1,0,61112,501st,"Rex G8, ARC Trooper 4* G7, Echo (501st) G7, Fives G9, Ahsoka G8",0
"jex222",,,46157,Iden Troopers,"Iden Versio 4* G7, Stormtrooper G6, Snowtrooper G7, Magma G8, DT 4* G7",0
"jex222",1,0,66249,Wiggs,"Wedge Biggs G8, Leia G9, Chirrut G9, Baze 4* G9",0
"DarthWilli",0,1,119126,DRMalak,"zzzDR HK-47 zBSF zzMalak Sith Empire Trooper G8",1
"DarthWilli",,,296706,HansMF,"Home One, Han's MF 6*, HT Ghost Phantom Biggs X-wing, Cassian's U-wing, Wedge X-wing",1
"DarthWilli",1,1,95874,Revan,"zzJKR BS GMY zJolee GK G8",1
"DarthWilli",0,1,80172,BH,"zBossk Boba G9, Greef G8, Cad G8, Jango",1
"DarthWilli",1,1,105203,zEP,"zEP zzzVader Tarkin G8, TFP G8, zSith Trooper",1
"DarthWilli",0,1,67593,Phoenix,"Hera G8, Ezra Zeb G8, Chopper G8, Kanan G8",1
"DarthWilli",1,0,13147,SionSolo (Counter),"Sion G9",1
"DarthWilli",,,106197,Phasma,"Phasma FOTP FOSFTP FOST Kylo",0
"DarthWilli",,,52874,Admiral Raddus,"Admiral Raddus 3*, Cassian G9, Jyn G8, Baze 6* G9, Chirrut G8",0
"DarthWilli",1,0,76421,CLS,"zzCLS Han zChewbacca G9, R2-D2 G7, Chewpio 4* G8",0
"DarthWilli",0,1,90557,Geonosians Omicron,"zGBA Sun Fac, Geo Soldier, Geo Spy, Poggle",0
"DarthWilli",1,1,51236,NS,"MT G8, AV G8, Daka G8, Zombie 5* G8, Spirit G8",0
"DarthWilli",1,1,74387,Ewoks,"Chirpa Elder Paploo G9, Wicket Logray",0
"DarthWilli",1,1,84190,Carth,"Carth Onasi, zMission zZaalbar Juhani G7, Canderous",0
