Player,Offense,Defense,GP,Name,Squad,Viable
"DarthWilli",1,0,54018,ShaakClones,"Shaak Ti G8, Rex G8, Echo (501st) G8, Fives G8, Clone Sergeant G8",0
"DarthWilli",,,56092,Iden Troopers,"zIden Versio 6*, Stormtrooper G9, Snowtrooper G8, Magma G6, DT 6* G8",0
"Kichler10",0,1,100709,padme,"zzPadme GK zJKA Ahsoka C-3PO",1
"Kichler10",0,1,93421,Geonosians Omicron,"zzGBA Sun Fac, Geo Soldier, Geo Spy, Poggle",1
"Kichler10",1,1,108284,Revan Offense,"zzzJKR zGMY zBS Jolee Ezra",1
"Kichler10",1,1,99129,Ewoks,"zChirpa Elder zPaploo Teebo zWicket",1
"Kichler10",1,1,95374,zEP,"zzEP zzVader zTarkin Dooku TFP G9",1
"Kichler10",,,71442,Phasma,"Phasma G9, FOE 5* FOO zKRU Kylo G9",0
"Kichler10",1,1,76073,JTR,"JTR G8, Scav Rey, BB-8 G8, R2-D2 zFinn",0
"Kichler10",1,1,54788,NS_Alt,"MT G8, AV Spirit 6* G8, Daka G9, Talia G8",0
"Kichler10",1,1,88019,Carth,"Carth Onasi, zMission Zaalbar zJuhani 6* Canderous",0
"Kichler10",1,0,59671,ShaakClones,"Shaak Ti 4* G8, Rex G8, Echo (501st) G8, Fives G9, Clone Sergeant",0
"Kichler10",1,0,65227,Wiggs,"Wedge G8, Biggs G8, Han Chewbacca G9, Leia G9",0
"Kichler10",1,0,57249,Troopers,"Veers G9, Starck G7, Dark Trooper, Stormtrooper G8, Snowtrooper G8",0
"Kichler10",0,1,71848,Phoenix,"Hera Zeb Chopper Sabine 5* G8, Kanan",0
"Kichler10",1,1,45398,Rogue1,"Jyn 6* G8, Chirrut G8, Baze 6* G8, K-2SO G8, Cassian G8",0
"GeneralZab",1,1,94401,Revan,"zzzJKR BS GMY Jolee GK",1
"GeneralZab",0,1,61513,Phoenix,"Hera Ezra Zeb G8, Chopper G8, Kanan G8",1
"GeneralZab",1,0,98989,CLS,"zzCLS zHan zChewbacca R2-D2 G9, Chewpio",0
"GeneralZab",0,1,63231,Geonosians Omicron,"GBA 4* G9, Sun Fac, Geo Soldier, Geo Spy, Poggle G4",0
"GeneralZab",1,0,57176,Troopers,"Veers 6* zPiett 4* G9, Gideon G9, Dark Trooper G9, Range Trooper 3* G9",0
"GeneralZab",,,62026,Nute-OR,"Nute G9, Dooku G9, Jango Zaalbar G8, Mission G7",0
"GeneralZab",0,1,80963,BH,"Bossk Boba IG-88 Greef The Mandalorian",0
"GeneralZab",1,1,93875,zEP,"zEP zzVader Tarkin G8, zBSF Mara Jade, The Emperor's Hand 4*",0
"Toby18",1,0,117571,ShaakClones,"zzShaak Ti, Rex zEcho (501st), zFives ARC Trooper",1
"Toby18",0,1,126900,BH,"zBossk Dengar zBoba IG-88 Cad",1
"Toby18",1,0,107495,Troopers,"zVeers Starck zDark Trooper, zzPiett Range Trooper",1
"Toby18",0,1,71321,Phoenix,"Hera G8, Ezra G9, Zeb G8, Chopper G9, Kanan",1
"Toby18",1,0,85160,CLS,"zCLS Han G9, Chewbacca R2-D2 G8, zChewpio 6*",0
"Toby18",0,1,93202,Geonosians Omicron,"zzGBA Sun Fac, Geo Soldier, Geo Spy, Poggle",0
"Toby18",1,0,82433,Traya,"zzTraya DN 6* Sion 6* Dooku EP G8",0
"Toby18",1,1,73966,Ewoks,"zChirpa 4* Elder Paploo Wicket 5* Logray",0
"Toby18",,,53130,Iden Troopers,"zIden Versio 4* G8, Stormtrooper G8, Snowtrooper G9, Magma G8, DT 3* G7",0
"toaster1241",,,171265,SEE,"zzzzzzSEE zBSF zzMalak zzzDR zzVader",1
"toaster1241",,,518435,Executor,"Executor 6* HT RC Xanadu Blood, Slave I, IG-2000 Imperial TIE Fighter, Tie Adv",1
"toaster1241",0,1,131171,padme,"zzPadme zGK zJKA zAhsoka zzC-3PO",1
"toaster1241",,,439407,Negotiator,"Negotiator 6* BTL-B Y-wing 6*, Anakin's Eta-2, Rex's ARC-170, Umbaran SF, Ahsoka's SF, Plo's SF, Clone Sergeant's ARC-170",1
"toaster1241",,,383679,HansMF,"Home One, Han's MF, Rebel Y-wing 6*, Bistan's U-wing, Phantom Ghost Cassian's U-wing, Wedge X-wing",1
"toaster1241",1,1,146250,GAS,"zzzzGAS zRex zEcho (501st), zzFives zARC Trooper",1
"toaster1241",1,1,135499,Revan Offense,"zzzJKR zGMY zzHYoda zJolee zEzra",1
"toaster1241",1,1,80835,Ewoks,"zChirpa Elder Paploo Wicket Logray G9",1
"toaster1241",0,1,130464,BH,"zzBossk Dengar zBoba IG-88 zThe Mandalorian",1
"toaster1241",1,0,115911,Troopers,"zVeers zStarck zDark Trooper, zzPiett Stormtrooper",1
"toaster1241",0,1,79586,Phoenix,"Hera Zeb Chopper Sabine G8, zKanan",1
"toaster1241",1,1,75291,Rogue1,"Jyn G9, Chirrut G8, Baze G8, K-2SO G9, zCassian",1
"toaster1241",1,0,107356,EP (Counter, Rebel),"zzEP Krennic zzWampa Nest G9, Range Trooper G9",1
"toaster1241",,,53293,Phasma,"Phasma G8, FOTP G6, FOSFTP G6, FOST 5* G8, Kylo G8",0
"toaster1241",,,106324,Grievous Omicron,"zGG zB2 zB1 zMagnaGuard zDroideka",0
"toaster1241",1,0,108059,CLS,"zzzCLS zHan zzChewbacca R2-D2 G9, zChewpio G8",0
"toaster1241",0,1,95380,Geonosians Omicron,"zzGBA Sun Fac, Geo Soldier, Geo Spy, Poggle",0
"toaster1241",1,0,97229,Traya,"zzTraya DN Sion 5* G9, Sith Empire Trooper, zThrawn",0
"toaster1241",1,1,72612,NS,"MT G8, zAV Daka G9, Zombie G8, Spirit G8",0
"toaster1241",,,90548,Nute-OR,"Nute Dooku Jango G7, zZaalbar zMission",0
"toaster1241",,,77177,Mon Mothma,"Mon Mothma 5* G9, Wedge zCara Dune, Bodhi Rook G8, Lando",0
"toaster1241",,,59914,Iden Troopers,"zIden Versio 3*, Shoretrooper 6* G8, Snowtrooper G8, Magma G9, DT 6* G9",0
"toaster1241",,,76365,Bad Batch,"Hunter G9, zEcho Omega G8, zTech G9, zWrecker G7",0
"Smurf24",0,1,129476,padme,"zzPadme zGK JKA zAhsoka zC-3PO",1
"Smurf24",0,1,92078,Geonosians Omicron,"zzGBA Sun Fac, Geo Soldier, Geo Spy, Poggle",1
"Smurf24",,,389297,Negotiator,"Negotiator 5* HT Anakin's Eta-2, Umbaran SF, Ahsoka's SF, Clone Sergeant's ARC-170, Plo's SF, Rex's ARC-170",1
"Smurf24",0,1,107381,Grievous,"zGG zB2 zB1 MagnaGuard Dooku",1
"Smurf24",1,1,118609,Revan Offense,"zzzJKR zzGMY zBS zJolee zEzra",1
"Smurf24",1,1,87988,Ewoks,"zChirpa Elder Paploo Wicket Logray",1
"Smurf24",1,0,104648,ShaakClones,"zzShaak Ti, zRex zEcho (501st), zzFives zARC Trooper",1
"Smurf24",1,1,84840,Carth,"zCarth Onasi, Mission Zaalbar Juhani Canderous",1
"Smurf24",1,1,100401,zEP,"zEP zzVader Tarkin G8, TFP G9, zBSF",1
"Smurf24",,,73773,Phasma,"Phasma FOTP FOSFTP FOST 6* G8, Kylo",0
"Smurf24",,,238729,HansMF,"Home One, Han's MF 5*, Biggs X-wing, Bistan's U-wing 6*, Phantom Ghost Cassian's U-wing, Wedge X-wing",0
"Smurf24",1,1,68447,JTR,"JTR G7, Scav Rey G9, BB-8 G9, R2-D2 Finn G9",0
"Smurf24",1,1,62746,NS_Alt,"MT G8, zAV Spirit 6* G8, Daka G9, Talia 5* G8",0
"Smurf24",0,1,81316,BH,"Bossk 5* Dengar G8, Boba Cad Jango",0
"Smurf24",1,0,68506,Wiggs,"Wedge G8, Biggs G8, zCLS G8, zHan Leia",0
"Smurf24",0,1,62247,Phoenix,"Hera G9, Zeb G8, Chopper G9, Sabine 5* G8, Kanan G9",0
"Smurf24",1,1,47640,Rogue1,"Jyn 5* G8, Chirrut G8, Baze 5* G8, K-2SO G8, Cassian G8",0
"ElJediDasCouvesJr",0,1,84368,BH,"zBossk Dengar G9, Boba Greef G8, Jango",1
"ElJediDasCouvesJr",0,1,96855,FO,"zKRU zKylo FOE FOO zHux 5*",1
"ElJediDasCouvesJr",1,0,9595,SionSolo (Counter),"Sion G8",1
"ElJediDasCouvesJr",1,0,85458,CLS,"zzzCLS zHan Chewbacca R2-D2 G7, Chewpio 3* G8",0
"ElJediDasCouvesJr",0,1,67919,Geonosians Omicron,"zGBA 6* Sun Fac G9, Geo Soldier 6* G9, Geo Spy, Poggle",0
"ElJediDasCouvesJr",1,0,41811,Troopers,"Veers 5* Piett 4* G9, Gideon 5* G7, Dark Trooper 4* G9, Range Trooper 4* G8",0
"ElJediDasCouvesJr",1,1,96816,Revan,"zJKR BS zGMY zJolee GK",0
"ElJediDasCouvesJr",1,1,89777,zEP,"zEP zVader Tarkin G8, Sith Trooper 6*, BSF",0
"ElJediDasCouvesJr",0,1,57697,Phoenix,"Hera G8, Ezra G9, Zeb G8, Chopper G8, Kanan G8",0
"Sankster10",0,1,105340,Grievous,"zzGG zB2 zB1 MagnaGuard zNute",1
"Sankster10",1,1,128463,Revan,"zzzJKR zBS zzGMY zJolee zGK",1
"Sankster10",1,1,83552,Ewoks,"zChirpa Elder Paploo Scout Logray",1
"Sankster10",1,1,104175,zEP,"zzEP zzzVader Tarkin zSith Trooper, zMara Jade, The Emperor's Hand 5*",1
"Sankster10",0,1,70766,Phoenix,"Hera G9, Ezra Zeb G8, Chopper G9, Kanan G9",1
"Sankster10",,,299222,Negotiator,"Negotiator 5* HT 4* Anakin's Eta-2, Umbaran SF 4*, Ahsoka's SF, BTL-B Y-wing, Clone Sergeant's ARC-170 5*, Plo's SF",0
"Sankster10",0,1,96154,Geonosians Omicron,"zzGBA Sun Fac, Geo Soldier, Geo Spy, Poggle",0
"Sankster10",,,93721,Mon Mothma,"zzMon Mothma, Hoth Rebel Scout, zPao Chirrut Baze",0
"Sankster10",1,0,85312,CLS,"zzCLS zHan Chewbacca 5* R2-D2 G9, zC-3PO 6* G8",0
"Sankster10",1,0,54424,Troopers,"Veers G7, Starck 6* G8, Gideon Stormtrooper G8, Snowtrooper G7",0
"Sankster10",1,0,78069,IG88,"IG-88 G6, zWampa Cassian G9, zBoba Kylo",0
"Sankster10",1,0,6660,SionSolo (Counter),"Sion 6* G3",0
"Jed",0,1,75720,Phoenix,"Hera Ezra Zeb G8, Sabine G9, Kanan",1
"Jed",,,71008,Phasma,"Phasma G8, FOE G9, FOO G9, KRU Kylo G8",0
"Jed",0,1,71591,padme,"Padme G8, GK G7, JKA G8, Ahsoka C-3PO",0
"Jed",0,1,85557,Grievous,"GG B2 G9, Droideka MagnaGuard Dooku",0
"Jed",1,1,69107,JTR,"JTR G6, Scav Rey, BB-8 G9, R2-D2 Finn G9",0
"Jed",1,1,96086,Ewoks,"Chirpa Elder Paploo Wicket Logray",0
"Jed",0,1,98577,BH,"Bossk Dengar Boba Jango The Mandalorian",0
"Jed",1,1,86340,zEP,"EP zVader Tarkin DN G7, Mara Jade, The Emperor's Hand",0
"Jed",1,0,64862,Wiggs,"Wedge G7, Biggs G6, CLS Chewbacca G9, Leia",0
"Jed",1,0,36997,Clones,"Cody G6, Rex G6, Echo (501st) G6, Fives G7, Clone Sergeant G6",0
"Iluvatar",1,0,104691,CLS,"zzCLS zHan zChewbacca R2-D2 zChewpio",1
"Iluvatar",0,1,92690,Geonosians Omicron,"zzGBA Sun Fac, Geo Soldier, Geo Spy, Poggle",1
"Iluvatar",,,384078,HansMF,"Home One, Han's MF, HT Ghost Phantom Biggs X-wing, Cassian's U-wing, Wedge X-wing",1
"Iluvatar",1,1,92769,Ewoks,"zChirpa Elder zPaploo Teebo zLogray",1
"Iluvatar",1,1,111405,zEP,"zEP zzVader Tarkin Dooku TFP",1
"Iluvatar",0,1,72621,Phoenix,"Hera Ezra G9, Zeb G8, Chopper G9, Kanan G9",1
"Iluvatar",0,1,84873,BS,"zBS GMY Jolee G9, GK G8, Ahsoka",1
"Iluvatar",1,0,104818,IG88,"IG-88 zWampa Cassian G9, zBoba Kylo G8",1
"Iluvatar",,,70420,Mon Mothma,"Mon Mothma 4* G8, Wedge Jyn Lando Biggs",0
"Iluvatar",0,1,110168,BH,"Bossk Dengar Cad Jango The Mandalorian",0
"Iluvatar",1,0,99735,Troopers,"zVeers Starck G9, Gideon G9, Dark Trooper, zzPiett",0
"Delmon",,,116109,Phasma,"zPhasma zFOTP FOSFTP FOST zKylo",1
"Delmon",0,1,89212,Geonosians Omicron,"zGBA Sun Fac, Geo Soldier, Geo Spy, Poggle",1
"Delmon",1,0,90869,Troopers,"zVeers zzPiett Gideon zDark Trooper, Range Trooper",1
"Delmon",1,1,92190,Revan,"zzJKR BS GMY zJolee GK",1
"Delmon",1,1,84663,Ewoks,"zChirpa G9, Elder Paploo zWicket zLogray",1
"Delmon",0,1,82635,BH,"zBossk Boba Greef G9, Cad Jango",1
"Delmon",0,1,67101,Phoenix,"Hera G9, Ezra Zeb G8, Chopper G9, Kanan G8",1
"Delmon",1,0,88012,CLS,"zCLS zHan zChewbacca G9, C-3PO zChewpio G9",0
"Delmon",,,66282,Mon Mothma,"zMon Mothma 6* G9, Hoth Rebel Scout G9, Pao G9, Bistan G7, Kyle Katarn G9",0
"Delmon",1,1,99829,zEP,"EP zzVader Tarkin G9, zSith Trooper, zTraya 6* G7",0
"Delmon",1,0,10911,SionSolo (Counter),"Sion G6",0
"Killer",1,1,123962,Revan,"zzzJKR BS zGMY zJolee G9, zGK",1
"Killer",0,1,63633,Phoenix,"Hera G9, Ezra G9, Zeb G8, Chopper G9, Kanan G8",1
"Killer",1,0,78982,QGJ,"zQGJ Aayla JKA Old Ben G9, Ahsoka",1
"Killer",0,1,81911,Grievous,"zGG B2 G9, MagnaGuard Dooku IG-88 G8",0
"Killer",1,0,69796,ShaakClones,"Shaak Ti 5* G9, Rex G9, Echo (501st) G9, Fives Clone Sergeant",0
"Killer",1,1,52988,Carth,"Carth Onasi G9, Mission G6, Zaalbar G7, Juhani G9, Canderous G8",0
"Killer",1,1,82833,zEP,"EP zVader Tarkin zBSF Traya 5* G8",0
"Killer",0,1,89757,BH,"Jango Dengar G9, Boba Cad The Mandalorian",0
"Indrid Cold",0,1,93842,Geonosians Omicron,"zzGBA Sun Fac, Geo Soldier, Geo Spy, Poggle",1
"Indrid Cold",0,1,120454,BH,"zzBossk zBoba zzGreef zJango zThe Mandalorian",1
"Indrid Cold",1,1,120889,zEP,"zzEP zzzVader zTarkin TFP DN G9",1
"Indrid Cold",0,1,88532,FO,"zKRU Kylo FOE Phasma FOO",1
"Indrid Cold",0,1,85717,Phoenix,"Hera Ezra Zeb Chopper Kanan",1
"Indrid Cold",,,287432,HansMF,"Home One 6*, Han's MF 5*, HT 5* Ghost Phantom Biggs X-wing, Cassian's U-wing 4*, Wedge X-wing",0
"Indrid Cold",1,1,55418,NS_Alt,"MT 6* G8, AV G8, Spirit 6* G8, Daka Talia 6*",0
"Indrid Cold",1,0,63737,501st,"Rex G8, Clone Sergeant G9, Echo (501st) G8, Fives G9, Ahsoka",0
"Indrid Cold",1,0,59740,Troopers,"Veers 6* G8, Starck G7, Gideon Stormtrooper G8, Snowtrooper G8",0
"Indrid Cold",1,0,52517,Wiggs,"Wedge 5* G8, Biggs G8, CLS G8, Han Leia G8",0
"Indrid Cold",1,1,36848,Rogue1,"Jyn 5* G8, Chirrut 5* G8, Baze 5* G8, K-2SO G8, Cassian 5* G8",0
"Indrid Cold",0,1,65875,BS,"BS 6* G9, GMY Jolee 5* G8, GK 6* G9, JKA G9",0
"Indrid Cold",1,0,9018,SionSolo (Counter),"Sion 2* G9",0
"Wolffe Pack",,,178516,JMK,"zzzzzzJMK zAhsoka zzzCAT zzzzGAS zGK",1
"Wolffe Pack",,,125130,Phasma,"zPhasma zFOTP FOSFTP zFOST zKylo",1
"Wolffe Pack",,,135424,SK,"zzEP zzMara Jade, The Emperor's Hand, zzStarkiller zJuhani zVisas",1
"Wolffe Pack",1,1,162220,SL Kylo,"zzzzzzSL Kylo, zSith Trooper, zHux zzKRU zThrawn",1
"Wolffe Pack",1,1,106092,NS,"zMT zzAV zDaka Zombie Spirit",1
"Wolffe Pack",,,570482,Executor,"Executor HT RC Xanadu Blood, Slave I, IG-2000 Imperial TIE Fighter, Tie Adv",1
"Wolffe Pack",1,0,142984,CLS,"zzzCLS zHan zzChewbacca zC-3PO zChewpio",1
"Wolffe Pack",0,1,112936,DRMalak,"zzzDR zHK-47 zBSF zzMalak Sith Empire Trooper",1
"Wolffe Pack",,,519435,Negotiator,"Negotiator BTL-B Y-wing, Anakin's Eta-2, Rex's ARC-170, Umbaran SF, Ahsoka's SF, Plo's SF, Clone Sergeant's ARC-170",1
"Wolffe Pack",,,304693,Malevolence,"Malevolence Hyena Bomber, Vulture Droid, Sun Fac SF, Soldier SF, Spy SF",1
"Wolffe Pack",0,1,93561,Geonosians Omicron,"zzGBA Sun Fac, Geo Soldier, Geo Spy, Poggle",1
"Wolffe Pack",,,136749,JKL,"zJKL zzzJKR zHYoda zOld Ben, Aayla",1
"Wolffe Pack",,,406429,HansMF,"Home One, Han's MF, Rebel Y-wing, Ghost Phantom Biggs X-wing, Cassian's U-wing, Wedge X-wing",1
"Wolffe Pack",0,1,122066,Grievous,"zzGG zB2 zB1 MagnaGuard zNute",1
"Wolffe Pack",1,1,118562,JTR,"zzJTR Scav Rey, zBB-8 zzR2-D2 Finn",1
"Wolffe Pack",1,0,104181,Traya,"zzTraya DN zSion zDooku Nest",1
"Wolffe Pack",,,102495,Mon Mothma,"zzMon Mothma, Wedge Chirrut Baze Biggs",1
"Wolffe Pack",1,0,152385,ShaakClones,"zzShaak Ti, zRex zEcho (501st), zzFives zARC Trooper",1
"Wolffe Pack",1,1,76076,Ewoks,"zChirpa G9, Elder Paploo Scout Logray G9",1
"Wolffe Pack",0,1,146670,BH,"zzBossk Dengar zBoba zIG-88 zzJango",1
"Wolffe Pack",1,0,124077,Troopers,"zVeers zStarck zDark Trooper, zzPiett Range Trooper",1
"Wolffe Pack",0,1,68004,Phoenix,"Hera G8, Ezra Zeb G8, Sabine G8, Kanan G8",1
"Wolffe Pack",,,124298,Bad Batch,"zHunter zEcho zOmega zTech zWrecker",1
"Wolffe Pack",1,0,66033,Jawas,"Nebit Jawa Engineer, Jawa Scavenger G8, Jawa G8, Dathcha G8",0
"spyinglyfe",,,134679,Phasma,"zPhasma zFOTP zSith Trooper, zzKRU zKylo",1
"spyinglyfe",0,1,80094,BH,"zzBossk Boba IG-88 G8, Cad Jango G9",1
"spyinglyfe",1,0,83970,501st,"Rex ARC Trooper, Echo (501st), zFives Ahsoka",1
"spyinglyfe",0,1,66528,Phoenix,"Hera G9, Ezra Zeb G8, Chopper G8, Kanan G8",1
"spyinglyfe",0,1,88903,Geonosians Omicron,"zGBA Sun Fac, Geo Soldier, Geo Spy, Poggle",0
"spyinglyfe",,,240602,HansMF,"Home One 6*, Han's MF 5*, HT Ghost Phantom Biggs X-wing, Cassian's U-wing, Wedge X-wing 5*",0
"spyinglyfe",1,0,55464,Traya,"Traya 6* G7, DN 5* G8, Sion G7, zEP Thrawn G8",0
"spyinglyfe",1,1,53590,NS,"MT 5* G9, AV Daka G9, Zombie 6* G8, Spirit G8",0
"spyinglyfe",1,1,43247,Ewoks,"Chirpa 5* G8, Elder G8, Paploo G8, Wicket 5* G8, Logray G8",0
"spyinglyfe",1,0,45131,Wiggs,"Wedge 5* G8, Biggs G8, CLS G6, Han G6, Leia G9",0
"spyinglyfe",1,1,41666,Rogue1,"Jyn 6* G8, Chirrut G8, Baze 5* G8, K-2SO G8, Cassian 5* G8",0
"spyinglyfe",0,1,60318,BS,"BS 5* GMY Jolee 3* GK 6* G6, JKA 5* G9",0
"TacopMark",,,118701,Phasma,"zPhasma zFOTP FOSFTP FOST Kylo",1
"TacopMark",,,309009,HansMF,"Home One, Han's MF, HT Ghost Phantom Biggs X-wing, Cassian's U-wing, Wedge X-wing",1
"TacopMark",1,0,91691,Troopers,"zVeers zPiett Gideon Dark Trooper, Range Trooper",1
"TacopMark",,,85391,Disintegration,"Aurra Greef G9, Boba Bossk The Mandalorian",1
"TacopMark",1,1,97910,Revan,"zzJKR BS zGMY zJolee GK G8",1
"TacopMark",1,1,85878,Ewoks,"zChirpa Elder Paploo Wicket Logray",1
"TacopMark",1,1,73900,Carth,"zCarth Onasi, Mission G8, Zaalbar G8, Juhani Canderous G8",1
"TacopMark",1,1,107148,zEP,"zEP zVader Tarkin TFP G9, zSith Trooper",1
"TacopMark",0,1,76695,Phoenix,"Hera Ezra Zeb G8, Chopper Kanan G8",1
"TacopMark",,,47019,Admiral Raddus,"Admiral Raddus 4* G8, Cassian G9, Jyn 6* G8, K-2SO G8, Chirrut G8",0
"TacopMark",1,0,89433,CLS,"zzzCLS zHan Chewbacca 6* G9, R2-D2 Chewpio",0
"TacopMark",0,1,93820,Geonosians Omicron,"zzGBA Sun Fac, Geo Soldier, Geo Spy, Poggle",0
"TacopMark",,,51952,Grievous Omicron,"zGG G9, B2 G7, B1 6* G7, MagnaGuard G7, Droideka G8",0
"TacopMark",1,1,55577,NS_Alt,"MT G8, AV G8, Spirit G8, Daka G9, Talia G8",0
"TacopMark",1,0,66503,501st,"Rex Clone Sergeant G8, Echo (501st) G8, Fives G8, zAhsoka",0
"TacopMark",0,1,75702,BH,"Jango G9, Dengar G9, zZam G8, Cad G9, Greedo G9",0
"TacopMark",1,0,40675,Jawas,"Nebit G7, Jawa Engineer G7, Jawa Scavenger G8, Jawa G6, Dathcha G7",0
"Elon Muscle",0,1,88140,padme,"zzPadme GK JKA Ahsoka C-3PO",1
"Elon Muscle",1,1,81092,Ewoks,"zChirpa Elder Paploo Wicket Logray",1
"Elon Muscle",1,1,82364,Revan Offense,"zzzJKR GMY BS G9, Jolee Ezra G8",1
"Elon Muscle",0,1,123962,BH,"zzBossk Dengar Boba IG-88 Jango",1
"Elon Muscle",,,499053,Executor,"Executor 4* HT RC Xanadu Blood, Slave I, IG-2000 Imperial TIE Fighter, Tie Adv",0
"Elon Muscle",1,0,112484,CLS,"zzCLS zHan zzChewbacca R2-D2 Chewpio",0
"Elon Muscle",0,1,88439,Geonosians Omicron,"zGBA Sun Fac, Geo Soldier, Geo Spy, Poggle",0
"Elon Muscle",1,0,89063,Troopers,"zVeers zzPiett Gideon 4* G9, Dark Trooper G9, Range Trooper 5* G9",0
"Elon Muscle",1,1,89009,zEP,"EP G8, zzVader Tarkin G7, TFP Traya 6*",0
"Raven3199",,,134940,Phasma,"zPhasma FOE zSith Trooper, zzKRU zKylo",1
"Raven3199",1,1,98406,zEP,"zzEP zzzVader Tarkin zDooku G9, TFP G8",1
"Raven3199",0,1,71020,Phoenix,"Hera Ezra G9, Zeb G9, Chopper Kanan G9",1
"Raven3199",0,1,91444,Geonosians Omicron,"zzGBA Sun Fac, Geo Soldier, Geo Spy, Poggle",0
"Raven3199",,,237041,HansMF,"Home One 6*, Han's MF 5*, HT 6* Ghost 5* Phantom 5* Biggs X-wing 6*, Cassian's U-wing 5*, Wedge X-wing 5*",0
"Raven3199",1,1,53639,NS_Alt,"MT 6* G8, AV Spirit G8, Daka G9, Talia 6* G8",0
"Raven3199",0,1,93718,BH,"zzBossk 6* Dengar G9, zBoba IG-88 Cad",0
"Raven3199",1,0,49538,501st,"Rex 6* G8, Clone Sergeant G8, Echo (501st) 6* G9, Fives G8, Ahsoka G8",0
"Raven3199",1,0,53088,Wiggs,"Wedge 5* G8, Biggs G9, CLS G8, Han G8, Leia G8",0
"Raven3199",1,1,40187,Rogue1,"Jyn 5* G8, Chirrut 5* G8, Baze 6* G8, K-2SO 6* G8, Cassian G8",0
"Raven3199",0,1,56652,BS,"BS 5* GMY Jolee 2* G8, GK G9, JKA 5* G8",0
"TheHighGround",0,1,103230,Grievous,"zzGG zB2 zB1 zMagnaGuard zNute",1
"TheHighGround",1,1,111733,Ewoks,"zChirpa Elder zPaploo zWicket zLogray",1
"TheHighGround",0,1,93783,Geonosians Omicron,"zzGBA Sun Fac, Geo Soldier, Geo Spy, Poggle",0
"TheHighGround",1,0,80130,Troopers,"zVeers zStarck Iden Versio, zzPiett Range Trooper",0
"BallistaShan",1,0,139339,CLS,"zzzCLS zHan zChewbacca C-3PO zChewpio",1
"BallistaShan",0,1,89379,Geonosians Omicron,"zGBA Sun Fac, Geo Soldier, Geo Spy, Poggle",1
"BallistaShan",1,1,76109,Ewoks,"zChirpa G9, Elder Paploo Wicket G9, Logray",1
"BallistaShan",0,1,108444,BH,"zzBossk Dengar Boba zGreef zThe Mandalorian",1
"BallistaShan",1,1,95158,zEP,"zEP zzVader Tarkin DT TFP",1
"BallistaShan",1,0,89422,Troopers,"zVeers Starck zIden Versio, zPiett Stormtrooper",1
"BallistaShan",1,0,16195,NestSolo (Counter),"Nest",1
"BallistaShan",0,1,89555,BS,"BS GMY JKA GK Ahsoka",0
"Ah Loi",1,0,133591,CLS,"zzzCLS zHan zzChewbacca zC-3PO zChewpio",1
"Ah Loi",0,1,142790,padme,"zzPadme zGK zJKA zAhsoka zBarriss",1
"Ah Loi",,,537823,Negotiator,"Negotiator 6* HT Anakin's Eta-2, Umbaran SF, Ahsoka's SF, Clone Sergeant's ARC-170, Plo's SF, Rex's ARC-170",1
"Ah Loi",0,1,126806,Grievous,"zzGG zB2 zB1 zDroideka Dooku",1
"Ah Loi",1,1,159211,GAS,"zzzzGAS zRex zEcho (501st), zzFives zARC Trooper",1
"Ah Loi",1,1,76443,Ewoks,"zChirpa G9, Elder Paploo Wicket G9, Logray G9",1
"Ah Loi",1,1,98559,zEP,"zEP zzVader Tarkin G8, zSith Trooper, Traya",1
"Ah Loi",0,1,94049,Geonosians Omicron,"zGBA Sun Fac, Geo Soldier, Geo Spy, Poggle",0
"Ah Loi",0,1,111562,BH,"zzBossk Boba Cad zJango Greedo G7",0
"Ah Loi",1,0,74946,Troopers,"zVeers Starck G9, Range Trooper 6* G9, DT 6* Snowtrooper",0
"Ah Loi",0,1,64258,Phoenix,"Hera G8, Ezra G9, Zeb G7, Chopper G8, Kanan G8",0
"Ah Loi",0,1,88294,BS,"BS 5* G7, zGMY zJolee Old Ben G9, HYoda 5*",0
"Xnalanx",1,0,98794,CLS,"zzCLS zHan Chewbacca R2-D2 Chewpio",1
"Xnalanx",0,1,90884,Geonosians Omicron,"zGBA Sun Fac, Geo Soldier, Geo Spy, Poggle",1
"Xnalanx",1,1,107789,Revan,"zzzJKR BS zGMY zJolee GK",1
"Xnalanx",0,1,91396,BH,"zzBossk Dengar Boba IG-88 Cad",1
"Xnalanx",1,1,100804,zEP,"zEP zVader Tarkin BSF zMara Jade, The Emperor's Hand 6*",1
"Xnalanx",1,0,15039,NestSolo (Counter),"Nest",1
"Xnalanx",1,1,81168,Carth,"Carth Onasi, Mission Zaalbar Juhani G7, Canderous",0
"Xnalanx",1,1,59849,Ewoks,"Chirpa 5* G9, Elder Paploo 6* G9, Wicket 4* Logray G9",0
"Xnalanx",1,0,68895,Troopers,"zVeers Starck G9, Gideon G9, Dark Trooper 6* G9, Piett 6* G9",0
"SUMPTER THE HUT",0,1,106034,BH,"zzBossk Boba Cad zzJango The Mandalorian",1
"SUMPTER THE HUT",1,1,113638,zEP,"zzEP zzVader Tarkin Krennic TFP G8",1
"SUMPTER THE HUT",0,1,71672,Phoenix,"Hera G9, zEzra Zeb G8, Chopper G8, Kanan G8",1
"SUMPTER THE HUT",0,1,97423,BS,"zBS zGMY Jolee GK JKA",1
"SUMPTER THE HUT",,,58229,Phasma,"Phasma G9, FOTP FOSFTP G7, FOST 5* G8, Kylo G9",0
"SUMPTER THE HUT",1,0,75859,CLS,"zCLS Han Chewbacca R2-D2 G8, Chewpio G8",0
"SUMPTER THE HUT",0,1,72268,Geonosians Omicron,"GBA 6* Sun Fac G8, Geo Soldier, Geo Spy G8, Poggle",0
"SUMPTER THE HUT",1,1,40799,NS_Alt,"MT 5* G8, AV Spirit 5* G8, Daka 5* G8, Talia 5* G8",0
"SUMPTER THE HUT",1,1,66369,Ewoks,"Chirpa G9, Elder Paploo G7, Wicket 6* G8, Logray",0
"SUMPTER THE HUT",1,0,94422,Troopers,"zVeers Starck Gideon Dark Trooper G9, zzPiett",0
"SUMPTER THE HUT",1,0,53050,501st,"Rex G8, Clone Sergeant 5* G8, Echo (501st) G9, Fives G8, Ahsoka",0
"SUMPTER THE HUT",1,0,39797,Wiggs,"Wedge 5* G8, Biggs 5* G8, Leia G9, Chirrut 5* G8, Baze 5* G8",0
"Classy Squirrel",1,1,88154,Ewoks,"zChirpa Elder Paploo Teebo Scout",1
"Classy Squirrel",1,0,79572,Jawas,"Nebit Jawa Engineer, Jawa Scavenger, Jawa Dathcha",1
"Classy Squirrel",0,1,88085,Geonosians Omicron,"GBA Sun Fac, Geo Soldier, Geo Spy, Poggle",0
"Classy Squirrel",1,1,82275,JTR,"JTR Scav Rey, BB-8 G9, R2-D2 Finn",0
"Classy Squirrel",1,0,107740,CLS,"zzzCLS zHan Wedge Biggs G7, zChewbacca",0
"Classy Squirrel",0,1,71589,FO,"KRU G9, Kylo G9, Phasma G9, FOO G9, FOSFTP G9",0
