Player,Offense,Defense,GP,Name,Squad,Viable
"jack0",1,1,120459,zEP,"zzEP zzzVader zTarkin zKrennic Sion G8",1
"jack0",0,1,97305,Phoenix,"zHera zEzra Kanan Sabine G9, Zeb",1
"jack0",,,57316,Phasma,"Phasma G8, FOE G7, FOO G8, KRU G7, Kylo G8",0
"jack0",0,1,69450,Geonosians,"GBA 5* Sun Fac G7, Geo Soldier, Geo Spy G9, Poggle",0
"jack0",,,66681,Nute-OR,"Nute G9, zDooku Jango G7, Zaalbar 3* G7, Mission 2* G7",0
"jack0",1,1,61441,NS_Alt,"AV G8, Spirit G5, Daka G9, Zombie Talia",0
"jack0",,,41466,Mon Mothma,"Mon Mothma 4* G8, Wedge G7, Lando G6, Hoth Rebel Scout G5, Biggs G7",0
"jack0",1,0,54222,ShaakClones,"Shaak Ti 4* G7, Rex Echo (501st) G8, Fives Clone Sergeant G5",0
"jack0",0,1,63388,BH,"Bossk 4* G5, Cad G9, IG-88 G8, Greedo G9, Boba",0
"jack0",1,0,84998,Troopers,"Veers Starck Gideon G7, zPiett Stormtrooper",0
"jack0",0,1,72940,BS,"BS 4* G8, GMY G7, zJKA GK 6* G8, Ahsoka",0
"Kelattt",0,1,81910,Geonosians,"GBA Sun Fac, Geo Soldier, Geo Spy, Poggle",1
"Kelattt",,,89873,Disintegration,"Aurra zGreef Boba Bossk The Mandalorian G8",1
"Kelattt",1,1,114299,Revan,"zzzJKR BS zGMY zJolee GK",1
"Kelattt",0,1,62816,Phoenix,"Hera G8, Ezra G8, Chopper G8, Kanan G8, Zeb G8",1
"Kelattt",0,1,82989,DRMalak,"DR HK-47 BSF zMalak 5* G9, Sith Assassin G7",0
"Kelattt",1,1,76017,Carth,"Carth Onasi, Mission Zaalbar Juhani G7, Canderous",0
"Kelattt",1,1,62353,Ewoks,"Chirpa G9, Elder Paploo G9, Teebo G6, Logray 6* G9",0
"Kelattt",1,1,87636,zEP,"zzEP zzVader Tarkin G6, DT G8, Mara Jade, The Emperor's Hand",0
"JSchill",0,1,85230,BH,"zBossk Dengar Cad G8, zJango Boba",1
"JSchill",1,1,109491,zEP,"zzEP zzzVader Tarkin G9, zSith Trooper, Sion",1
"JSchill",0,1,130865,FO,"zzKRU zKylo FOE zHux zFOST",1
"JSchill",0,1,60492,Phoenix,"Hera G8, Ezra Chopper G8, Kanan G8, Zeb G8",1
"JSchill",1,0,72927,CLS,"zCLS Han Chewbacca G9, R2-D2 G8, Chewpio 4* G8",0
"JSchill",1,1,83962,Revan,"zJKR BS zGMY zJolee GK G7",0
"NuclearCC",,,490265,Executor,"Executor 5* HT RC Xanadu Blood, Slave I, IG-2000 Imperial TIE Fighter, Tie Adv",1
"NuclearCC",1,1,88601,NS_Alt,"zMT zAV zDaka Zombie Talia",1
"NuclearCC",0,1,86256,Geonosians,"zGBA Sun Fac, Geo Soldier, Geo Spy, Poggle",1
"NuclearCC",1,1,105587,Revan Offense,"zzJKR GMY BS zJolee JKA",1
"NuclearCC",1,1,75972,Ewoks,"zChirpa Elder Paploo G9, Wicket G9, Logray G8",1
"NuclearCC",0,1,123421,BH,"zBossk Dengar Jango IG-88 Boba",1
"NuclearCC",1,1,117589,zEP,"zEP zzzVader Tarkin TFP DN",1
"NuclearCC",0,1,62990,Phoenix,"Hera G8, Ezra G9, Chopper G8, Kanan G8, Zeb G8",1
"NuclearCC",1,0,13414,NestSolo (Counter),"Nest G9",1
"NuclearCC",1,0,10522,SionSolo (Counter),"Sion G8",1
"NuclearCC",,,77095,Phasma,"Phasma G9, zFOTP FOSFTP FOST G9, Kylo G9",0
"NuclearCC",,,48725,Admiral Raddus,"Admiral Raddus 3* G9, Cassian G8, Jyn 6* G8, K-2SO G8, Bistan G6",0
"NuclearCC",1,0,98759,CLS,"zzCLS zHan zChewbacca G9, C-3PO G9, zChewpio",0
"NuclearCC",0,1,105522,DRMalak,"DR HK-47 zBSF zzMalak Thrawn G8",0
"NuclearCC",,,279099,HansMF,"Home One, Han's MF, Rebel Y-wing 5*, Bistan's U-wing 6*, Phantom Ghost Cassian's U-wing, Biggs X-wing",0
"NuclearCC",1,1,44214,JTR,"JTR G7, Scav Rey G8, BB-8 G6, R2-D2 G6, Finn G8",0
"NuclearCC",1,0,90003,Troopers,"Veers zzPiett Gideon G8, Dark Trooper, Range Trooper G7",0
"NuclearCC",1,1,73196,Carth,"Carth Onasi, Mission zZaalbar Juhani G7, Canderous",0
"NuclearCC",1,0,63010,ShaakClones,"Shaak Ti G7, Rex Echo (501st) G8, Fives G9, Clone Sergeant G8",0
"NuclearCC",1,0,46564,Wiggs,"Wedge 5* G8, Biggs G8, Leia G9, Chirrut 5* G8, Baze 6* G8",0
"Kenobi4242",1,0,92094,CLS,"zzCLS zHan zzChewbacca 6* R2-D2 G9, Chewpio",0
"Kenobi4242",1,0,79473,Troopers,"Veers zPiett G9, Gideon G9, Dark Trooper G9, Range Trooper",0
"Kenobi4242",0,1,82857,BH,"Bossk The Mandalorian 6*, Jango Boba Greef 6*",0
"Kenobi4242",0,1,76534,BS,"BS GMY JKA GK 6* Ahsoka",0
"Toby18",0,1,93169,Geonosians,"zzGBA Sun Fac, Geo Soldier, Geo Spy, Poggle",1
"Toby18",0,1,114230,BH,"zBossk Dengar Cad IG-88 zBoba",1
"Toby18",1,0,104699,501st,"Rex ARC Trooper, zEcho (501st), zFives Ahsoka",1
"Toby18",1,0,97162,Troopers,"zVeers Starck zzPiett zDark Trooper, Range Trooper",1
"Toby18",0,1,71321,Phoenix,"Hera G8, Ezra G9, Chopper G9, Kanan Zeb G8",1
"Toby18",1,0,81125,CLS,"zCLS Han G9, Chewbacca R2-D2 G8, zChewpio 4*",0
"Toby18",1,0,65157,Traya,"zTraya 6* DN 4* Sion 4* G9, Dooku G8, EP G8",0
"Toby18",1,1,68329,Ewoks,"zChirpa 4* Elder Paploo 6* Wicket 4* Logray 5*",0
"Toby18",,,51528,Iden Troopers,"zIden Versio 4* G8, Stormtrooper G7, Snowtrooper G9, Magma G8, DT 3* G7",0
"DarthWilli",0,1,119110,DRMalak,"zzzDR HK-47 zBSF zzMalak Sith Empire Trooper G8",1
"DarthWilli",0,1,78408,Geonosians,"zGBA 6* Sun Fac G9, Geo Soldier, Geo Spy G9, Poggle",1
"DarthWilli",1,1,95874,Revan,"zzJKR BS GMY zJolee GK G8",1
"DarthWilli",0,1,79197,BH,"zBossk Cad G8, Jango Boba G8, Greef G8",1
"DarthWilli",0,1,67593,Phoenix,"Hera G8, Ezra Chopper G8, Kanan G8, Zeb G8",1
"DarthWilli",,,87771,Phasma,"Phasma FOTP FOSFTP FOST Kylo",0
"DarthWilli",,,49739,Admiral Raddus,"Admiral Raddus 3*, Cassian G9, Jyn G8, Baze 6* G9, Chirrut 5* G8",0
"DarthWilli",1,0,68223,CLS,"zzCLS Han G9, Chewbacca G9, R2-D2 G7, Chewpio 4* G8",0
"DarthWilli",,,231774,HansMF,"Home One, Han's MF 5*, Rebel Y-wing 4*, Bistan's U-wing 4*, Phantom Ghost Cassian's U-wing, Biggs X-wing",0
"DarthWilli",1,0,66616,Traya,"Traya 5* G8, DN 6* G9, Sion G7, EP Thrawn G9",0
"DarthWilli",1,1,44825,NS,"MT 6* G8, AV G8, Daka G8, Zombie 5* G8, Spirit G8",0
"DarthWilli",1,1,69085,Ewoks,"Chirpa G9, Elder Paploo G9, Wicket G8, Logray G9",0
"DarthWilli",1,1,84190,Carth,"Carth Onasi, zMission zZaalbar Juhani G7, Canderous",0
"DarthWilli",1,0,54018,ShaakClones,"Shaak Ti G8, Rex G8, Echo (501st) G8, Fives G8, Clone Sergeant G8",0
"DarthWilli",,,52589,Iden Troopers,"zIden Versio 4* G9, Stormtrooper G9, Snowtrooper G8, Magma G6, DT 6* G8",0
"dicksharpe",,,122941,Phasma,"zPhasma zFOTP FOSFTP zFOST zKylo",1
"dicksharpe",0,1,92450,Geonosians,"zzGBA Sun Fac, Geo Soldier, Geo Spy, Poggle",1
"dicksharpe",,,341675,HansMF,"Home One, Han's MF, HT Ghost Phantom Biggs X-wing, Cassian's U-wing, Wedge X-wing",1
"dicksharpe",,,96579,Disintegration,"Aurra Greef G8, Boba zzBossk The Mandalorian G9",1
"dicksharpe",1,1,80851,Ewoks,"zChirpa G9, Elder Paploo Wicket Logray",1
"dicksharpe",1,1,118589,zEP,"zEP zVader Tarkin TFP zSith Trooper",1
"dicksharpe",0,1,68800,Phoenix,"Hera G9, Ezra G9, Chopper G9, Kanan G8, Zeb G8",1
"dicksharpe",1,0,19021,NestSolo (Counter),"zNest",1
"dicksharpe",1,0,13912,SionSolo (Counter),"Sion G9",1
"dicksharpe",,,42311,Admiral Raddus,"Admiral Raddus 3* G8, Cassian 5* G8, Jyn 6* G8, Baze 6* G8, Chirrut 6* G8",0
"dicksharpe",1,0,115165,CLS,"zzCLS zHan zChewbacca C-3PO Chewpio",0
"dicksharpe",1,0,89956,Troopers,"zVeers zPiett Gideon G8, Dark Trooper G9, Range Trooper G9",0
"dicksharpe",1,1,63689,NS,"MT G8, AV Daka Zombie 5* G8, Spirit G8",0
"dicksharpe",1,0,65653,ShaakClones,"Shaak Ti G8, Rex Echo (501st) G8, Fives G8, Clone Sergeant G8",0
"dicksharpe",0,1,89019,BH,"Jango Dengar Cad G8, zZam IG-88",0
"dicksharpe",0,1,64089,BS,"BS 6* GMY JKA 5* G8, GK G7, Ahsoka G8",0
"ThePatience",0,1,90399,Geonosians,"zGBA Sun Fac, Geo Soldier, Geo Spy, Poggle",1
"ThePatience",1,0,121905,Troopers,"zVeers zPiett zGideon Dark Trooper, Range Trooper",1
"ThePatience",0,1,131165,BH,"zBossk Dengar Cad IG-88 Boba",1
"ThePatience",1,1,131002,zEP,"zzEP zzVader Tarkin TFP zMara Jade, The Emperor's Hand",1
"ThePatience",1,0,122303,zMaul,"zDarth Maul, zSidious Dooku Sith Marauder, Nest",1
"ThePatience",0,1,62733,Phoenix,"Hera G8, Ezra G8, Chopper G8, Kanan G8, Zeb G8",1
"ThePatience",0,1,92081,BS,"zBS zGMY JKA Old Ben G9, Ahsoka",1
"ThePatience",1,0,20562,SionSolo (Counter),"zSion",1
"ThePatience",,,535043,Executor,"Executor 4* HT RC Xanadu Blood 6*, Slave I, IG-2000 Imperial TIE Fighter, Tie Adv",0
"ThePatience",1,0,86707,CLS,"zCLS zHan Chewbacca R2-D2 Chewpio",0
"ThePatience",,,69494,Iden Troopers,"Iden Versio, Shoretrooper Snowtrooper G9, Magma DT",0
"beanboi",0,1,86651,Geonosians,"zzGBA Sun Fac, Geo Soldier, Geo Spy, Poggle",1
"beanboi",1,0,87843,501st,"zRex zARC Trooper, Echo (501st), Fives Ahsoka",1
"beanboi",,,79835,Iden Troopers,"zIden Versio 5*, zStormtrooper Snowtrooper Magma G9, DT",1
"beanboi",1,0,72458,Troopers,"Veers Piett 3* G9, zGideon Dark Trooper 6*, Range Trooper",0
"beanboi",,,39974,Mon Mothma,"Mon Mothma 4* G8, Wedge 6* G8, Kyle Katarn 5* G9, K-2SO G6, Biggs G7",0
"beanboi",1,1,71463,zEP,"EP 6* Vader Tarkin TFP Mara Jade, The Emperor's Hand 3* G9",0
"beanboi",0,1,57725,Phoenix,"Hera G8, Ezra G8, Chopper G9, Kanan G8, Zeb G8",0
"beanboi",,,75190,Bad Batch,"zHunter 5* zEcho 4* zOmega 4* zTech 5* Wrecker 6*",0
"Yeti no kles",,,548631,Executor,"Executor 5* HT RC Xanadu Blood, Slave I, IG-2000 Imperial TIE Fighter, Tie Adv",1
"Yeti no kles",1,0,137987,CLS,"zzzCLS zHan zChewbacca C-3PO zChewpio",1
"Yeti no kles",0,1,86919,Geonosians,"zGBA Sun Fac, Geo Soldier, Geo Spy, Poggle",1
"Yeti no kles",1,0,115773,Troopers,"zVeers zzPiett zGideon Dark Trooper, Range Trooper",1
"Yeti no kles",1,1,72217,Ewoks,"zChirpa G9, Elder Paploo G9, Wicket Logray G9",1
"Yeti no kles",0,1,134979,BH,"zzBossk Dengar Cad IG-88 zBoba",1
"Yeti no kles",1,1,117555,zEP,"zEP zzVader Tarkin TFP zzTraya",1
"Yeti no kles",0,1,61311,Phoenix,"Hera G8, Ezra G8, Chopper Kanan G8, Zeb G8",1
"Yeti no kles",,,60322,Phasma,"Phasma G8, FOTP G8, FOO G8, KRU Kylo G8",0
"Yeti no kles",,,41736,Admiral Raddus,"Admiral Raddus 3* G8, Cassian 5* G8, Jyn 5* G8, Baze 6* G8, Chirrut 5* G8",0
"Yeti no kles",,,319754,HansMF,"Home One, Han's MF, Rebel Y-wing, Bistan's U-wing, Phantom 6* Biggs X-wing, Cassian's U-wing, Wedge X-wing",0
"Yeti no kles",1,1,58035,NS,"MT G8, AV 5* G8, Daka Zombie 5* Spirit G9",0
"Yeti no kles",,,79888,Mon Mothma,"zMon Mothma G9, Wedge Kyle Katarn, Cara Dune, Biggs",0
"Yeti no kles",1,0,68112,ShaakClones,"Shaak Ti G8, Rex Echo (501st), Fives G8, Clone Sergeant G8",0
"Yeti no kles",0,1,86346,BH,"Jango zThe Mandalorian, zZam zGreef Boushh (Leia Organa) 4* G9",0
"Yeti no kles",0,1,94767,BS,"BS 5* zGMY zHYoda GK JKA",0
"Yeti no kles",1,0,13521,SionSolo (Counter),"Sion 5*",0
"Tomb",0,1,78839,Geonosians,"zGBA Sun Fac, Geo Soldier, Geo Spy, Poggle",1
"Tomb",1,1,83184,Revan,"zzJKR BS GMY Jolee G8, GK",1
"Tomb",1,0,83959,CLS,"zzCLS Han Chewbacca 6* G9, R2-D2 G9, Chewpio",0
"Tomb",0,1,78093,BH,"zBossk The Mandalorian 6* G8, Zam G8, Jango Boba",0
"Tomb",1,1,80068,zEP,"EP G9, zzVader Tarkin G9, zTraya 5* zMara Jade, The Emperor's Hand 5*",0
"Tomb",1,0,76189,Troopers,"Veers zStarck Gideon G9, zPiett G9, Dark Trooper",0
"Tomb",0,1,52835,Phoenix,"Hera G8, Ezra G7, Chopper G7, Kanan G7, Zeb G7",0
"spyinglyfe",0,1,87410,Geonosians,"zGBA Sun Fac, Geo Soldier, Geo Spy, Poggle",1
"spyinglyfe",0,1,74161,BH,"zzBossk Cad G8, Jango G9, IG-88 G8, Boba",1
"spyinglyfe",0,1,128755,FO,"zzKRU zKylo FOE zHux zFOST",1
"spyinglyfe",0,1,66039,Phoenix,"Hera G9, Ezra Chopper G8, Kanan G8, Zeb G8",1
"spyinglyfe",,,235980,HansMF,"Home One 6*, Han's MF 5*, HT Ghost Phantom Biggs X-wing, Cassian's U-wing, Wedge X-wing 5*",0
"spyinglyfe",1,1,48570,NS,"MT 5* G9, AV G8, Daka G9, Zombie 5* G8, Spirit G8",0
"spyinglyfe",1,0,63135,ShaakClones,"Shaak Ti 4* G8, Rex Echo (501st) G8, Fives G9, ARC Trooper",0
"spyinglyfe",1,1,94105,zEP,"zEP zzzVader Tarkin Dooku 6* G8, zSith Trooper",0
"spyinglyfe",1,1,39494,Rogue1,"Jyn 6* G8, Chirrut 6* G8, Baze 5* G8, Cassian 5* G8, K-2SO G8",0
"spyinglyfe",0,1,63063,BS,"BS 5* GMY Jolee 3* GK 6* G6, Ahsoka",0
"Ta152",1,1,129003,JTR,"zzJTR zR2-D2 zzBB-8 zRH Finn, RH Poe",1
"Ta152",0,1,86898,Geonosians,"zGBA Sun Fac, Geo Soldier, Geo Spy, Poggle",1
"Ta152",1,1,76494,Ewoks,"zChirpa Elder Paploo Wicket Logray",1
"Ta152",0,1,88679,FO,"zzKRU Kylo FOE FOO zHux 5*",1
"Ta152",1,0,91751,CLS,"zzCLS zHan zChewbacca 6* C-3PO Chewpio 5*",0
"Ta152",1,0,84020,Troopers,"zVeers zPiett Gideon G9, Dark Trooper, Range Trooper",0
"Ta152",,,299219,Raddus,"Raddus 4* Sun Fac SF 5*, Rey's Millennium Falcon, Poe Dameron's X-wing, Resistance X-wing, Biggs X-wing, Wedge X-wing, Phantom 4* Ghost 4*",0
"Ta152",1,1,82704,zEP,"zEP zzVader Tarkin Traya 6* G9, Mara Jade, The Emperor's Hand 4*",0
"Ta152",0,1,81666,BH,"Bossk The Mandalorian G8, Zam Jango Boba",0
"Indrid Cold",0,1,92525,Geonosians,"zzGBA Sun Fac, Geo Soldier, Geo Spy, Poggle",1
"Indrid Cold",0,1,82668,BH,"zBossk Cad G8, zJango Greedo G8, Boba",1
"Indrid Cold",1,1,116276,zEP,"zzEP zzzVader zTarkin Dooku G8, TFP",1
"Indrid Cold",0,1,85321,Phoenix,"Hera Ezra Chopper Kanan Zeb",1
"Indrid Cold",,,76623,Phasma,"Phasma G9, FOE FOO KRU Kylo G9",0
"Indrid Cold",1,1,51811,NS_Alt,"MT 5* G8, AV G8, Spirit 6* G8, Daka G9, Talia 5*",0
"Indrid Cold",1,0,60247,501st,"Rex G8, Clone Sergeant G8, Echo (501st) G8, Fives G9, Ahsoka",0
"Indrid Cold",1,0,58767,Troopers,"Veers 6* G8, Starck G5, Gideon Snowtrooper G8, Stormtrooper G8",0
"Indrid Cold",1,0,43950,Wiggs,"Wedge 5* G8, Biggs G8, Leia G8, Chirrut 5* G8, Baze 5* G8",0
"Indrid Cold",0,1,53633,BS,"BS 5* G8, GMY G9, Old Ben G9, GK 6* G8, JKA 5* G8",0
"Iluvatar",0,1,92480,Geonosians,"zzGBA Sun Fac, Geo Soldier, Geo Spy, Poggle",1
"Iluvatar",,,327458,HansMF,"Home One, Han's MF, HT Ghost Phantom Biggs X-wing, Cassian's U-wing, Wedge X-wing",1
"Iluvatar",1,1,89649,Ewoks,"zChirpa Elder zPaploo Teebo Scout",1
"Iluvatar",1,1,111162,zEP,"zEP zzVader Tarkin Dooku TFP",1
"Iluvatar",0,1,72479,Phoenix,"Hera Ezra G9, Chopper G9, Kanan G9, Zeb G8",1
"Iluvatar",0,1,87225,BS,"zBS GMY JKA GK G8, Ahsoka",1
"Iluvatar",,,68685,Phasma,"Phasma G7, FOE G7, FOSFTP G9, KRU Kylo G8",0
"Iluvatar",1,0,82288,CLS,"CLS Han Chewbacca R2-D2 Chewpio 6*",0
"Iluvatar",0,1,126588,BH,"Bossk Dengar Cad IG-88 zBoba",0
"Iluvatar",1,0,94838,Troopers,"Veers Starck G9, Gideon G9, zzPiett Dark Trooper",0
"ElJediDasCouvesJr",0,1,84368,BH,"zBossk Dengar G9, Jango Boba Greef G8",1
"ElJediDasCouvesJr",1,0,85458,CLS,"zzzCLS zHan Chewbacca R2-D2 G7, Chewpio 3* G8",0
"ElJediDasCouvesJr",0,1,67919,Geonosians,"zGBA 6* Sun Fac G9, Geo Soldier 6* G9, Geo Spy, Poggle",0
"ElJediDasCouvesJr",1,0,41811,Troopers,"Veers 5* Piett 4* G9, Gideon 5* G7, Dark Trooper 4* G9, Range Trooper 4* G8",0
"ElJediDasCouvesJr",1,1,93928,Revan,"zJKR BS zGMY zJolee GK 6*",0
"ElJediDasCouvesJr",1,1,86007,zEP,"zEP zVader Tarkin G8, BSF 6* Traya 5*",0
"ElJediDasCouvesJr",0,1,57697,Phoenix,"Hera G8, Ezra G9, Chopper G8, Kanan G8, Zeb G8",0
"ElJediDasCouvesJr",1,0,6925,SionSolo (Counter),"Sion 6* G7",0
"Raven3199",,,127906,Phasma,"zPhasma zSith Trooper, FOSFTP zzKRU zKylo",1
"Raven3199",0,1,91031,Geonosians,"zzGBA Sun Fac, Geo Soldier, Geo Spy, Poggle",1
"Raven3199",0,1,71020,Phoenix,"Hera Ezra G9, Chopper Kanan G9, Zeb G9",1
"Raven3199",1,1,45356,NS_Alt,"MT 6* G8, AV G8, Spirit G8, Daka G9, Talia 5* G8",0
"Raven3199",1,1,93564,zEP,"zzEP zzzVader Tarkin TFP G8, BSF 5*",0
"Raven3199",0,1,93718,BH,"zzBossk 6* Dengar G9, Cad IG-88 zBoba",0
"Raven3199",1,0,44897,501st,"Rex 6* G8, Clone Sergeant 5* G8, Echo (501st) 5* G8, Fives G8, Ahsoka G8",0
"Raven3199",1,0,50293,Wiggs,"Wedge 5* G8, Biggs G9, CLS G8, Han G8, Leia G8",0
"Raven3199",1,1,37884,Rogue1,"Jyn 5* G8, Chirrut 5* G8, Baze 5* G8, Cassian G8, K-2SO 5* G8",0
"Raven3199",0,1,48624,BS,"BS 5* G9, GMY G6, Old Ben G9, GK 6* G8, JKA 5* G8",0
"tobster1241",,,161670,SEE,"zzzzzzSEE zBSF zzMalak zzzDR zzVader",1
"tobster1241",,,517907,Executor,"Executor 6* HT RC Xanadu Blood, Slave I, IG-2000 Imperial TIE Fighter, Tie Adv",1
"tobster1241",0,1,131147,padme,"zzPadme zGK zJKA zAhsoka zzC-3PO",1
"tobster1241",,,361514,HansMF,"Home One, Han's MF, Rebel Y-wing 6*, Bistan's U-wing, Phantom Ghost Cassian's U-wing, Wedge X-wing",1
"tobster1241",0,1,95380,Geonosians,"zzGBA Sun Fac, Geo Soldier, Geo Spy, Poggle",1
"tobster1241",1,1,142162,GAS,"zzzzGAS zRex zEcho (501st), zzFives zARC Trooper",1
"tobster1241",1,1,135568,Revan Offense,"zzzJKR zGMY zzHYoda zJolee zEzra",1
"tobster1241",1,1,80835,Ewoks,"zChirpa Elder Paploo Wicket Logray G9",1
"tobster1241",0,1,130283,BH,"zzBossk Dengar zThe Mandalorian, IG-88 zBoba",1
"tobster1241",1,0,116599,Troopers,"zVeers zStarck zzPiett Stormtrooper zDark Trooper",1
"tobster1241",0,1,75526,Phoenix,"Hera Chopper zKanan Sabine G8, Zeb",1
"tobster1241",1,1,75720,Rogue1,"Jyn G9, Chirrut G8, Baze G8, zCassian K-2SO G9",1
"tobster1241",1,0,107163,EP (Counter, Rebel),"zzEP Krennic zzWampa Nest G9, Range Trooper G9",1
"tobster1241",,,53019,Phasma,"Phasma G8, FOTP G6, FOSFTP G6, FOST 5* G8, Kylo G8",0
"tobster1241",,,416818,Negotiator,"Negotiator 6* BTL-B Y-wing 5*, Anakin's Eta-2, Rex's ARC-170, Umbaran SF, Ahsoka's SF, Plo's SF, Clone Sergeant's ARC-170",0
"tobster1241",1,0,107444,CLS,"zzzCLS zHan zzChewbacca R2-D2 G8, zChewpio G8",0
"tobster1241",1,0,96098,Traya,"zzTraya DN Sion 5* G9, Sith Empire Trooper, zThrawn",0
"tobster1241",0,1,104561,Grievous,"zGG zB2 zB1 zMagnaGuard Nute",0
"tobster1241",1,1,72606,NS,"MT G8, zAV Daka G9, Zombie G8, Spirit G8",0
"tobster1241",,,68663,Mon Mothma,"Mon Mothma 5* G9, Wedge G9, Bodhi Rook G8, Lando zCara Dune",0
"tobster1241",1,1,83761,Carth,"zCarth Onasi, zMission zZaalbar zJuhani Canderous G7",0
"tobster1241",,,59979,Iden Troopers,"zIden Versio 3*, Shoretrooper 6* G8, Snowtrooper G8, Magma G9, DT 6* G9",0
"tobster1241",0,1,66658,BH,"Jango G7, Cad G9, Zam G2, Greedo G9, zGreef",0
"tobster1241",1,0,117741,zMaul,"Darth Maul, Dooku zSidious Sith Assassin, Sith Marauder",0
"tobster1241",,,76731,Bad Batch,"Hunter G9, zEcho Omega G8, zTech G9, zWrecker G7",0
"DarthWampa",1,1,108600,Revan,"zzzJKR zBS zGMY zJolee zGK",1
"DarthWampa",0,1,130103,FO,"zzKRU zKylo FOE FOO zHux",1
"DarthWampa",0,1,74989,Phoenix,"Hera Ezra Chopper Kanan Zeb G8",1
"DarthWampa",0,1,64477,Geonosians,"GBA 5* Sun Fac G8, Geo Soldier 6*, Geo Spy, Poggle",0
"DarthWampa",1,0,96514,Traya,"zzTraya 5* zDN 3* zSion 5* zzEP Thrawn",0
"DarthWampa",0,1,59198,Grievous,"GG 5* G8, B2 G9, MagnaGuard 6* G7, Dooku 6* G9, T3-M4",0
"Deansod",0,1,124804,FO,"zzKRU zKylo FOE zHux zFOST",1
"Deansod",0,1,63569,Phoenix,"Hera G9, Ezra G9, Chopper G9, Kanan G8, Zeb G8",1
"Deansod",1,1,109967,zEP,"zzEP zVader Tarkin G9, zDooku zSith Trooper",1
"Deansod",0,1,74722,Geonosians,"zzGBA 4* Sun Fac G8, Geo Soldier, Geo Spy 5* G9, Poggle",0
"Deansod",1,1,38350,NS_Alt,"MT 5* G8, AV G8, Spirit 5* G8, Daka 5* G8, Talia 5* G8",0
"Deansod",0,1,47718,BH,"Bossk 2* G9, Cad G8, IG-88 5* G8, Greedo G8, Boba G8",0
"Deansod",1,0,37958,501st,"Rex 5* G8, Clone Sergeant 5* G8, Echo (501st) 5* G8, Fives 5* G8, Ahsoka G9",0
"Deansod",1,0,37124,Wiggs,"Wedge 5* G8, Biggs G8, Leia 5* G8, Chirrut 5* G8, Baze 5* G8",0
"tobster",1,0,115952,CLS,"zzzCLS zHan zzChewbacca zC-3PO zChewpio",1
"tobster",0,1,92800,Geonosians,"zzGBA Sun Fac, Geo Soldier, Geo Spy, Poggle",1
"tobster",1,0,128718,Troopers,"zVeers zzPiett zGideon zDark Trooper, Range Trooper",1
"tobster",1,1,78205,Ewoks,"zChirpa Elder Paploo Wicket Logray",1
"tobster",0,1,98514,BH,"zzBossk The Mandalorian, zJango IG-88 zBoba",1
"VikingKoala",0,1,86641,Geonosians,"zGBA Sun Fac, Geo Soldier, Geo Spy, Poggle",1
"VikingKoala",,,95019,Disintegration,"Aurra Greef Boba zzBossk The Mandalorian",1
"VikingKoala",1,1,76178,Ewoks,"zChirpa Elder Paploo Wicket Logray",1
"VikingKoala",1,0,92348,501st,"zRex ARC Trooper, Echo (501st), Fives zAhsoka",1
"VikingKoala",0,1,63936,Phoenix,"Hera G9, Ezra G9, Chopper G9, Kanan G9, Zeb G8",1
"VikingKoala",1,1,56902,Rogue1,"Jyn G8, Chirrut G8, Baze G8, Cassian G8, K-2SO G8",1
"VikingKoala",1,0,77881,EP (Counter, Rebel),"zEP Shoretrooper Range Trooper, Stormtrooper G8, Starck",1
"VikingKoala",,,47871,Phasma,"Phasma G8, FOE 5* G8, FOO G8, KRU G8, Kylo G8",0
"VikingKoala",1,0,83807,CLS,"zzCLS zHan Chewbacca 6* G9, R2-D2 G9, Chewpio",0
"VikingKoala",,,231506,HansMF,"Home One 6*, Han's MF 5*, Biggs X-wing, Bistan's U-wing 4*, Phantom Ghost Cassian's U-wing, Wedge X-wing",0
"VikingKoala",0,1,49809,Grievous,"GG 6* G8, B2 G8, B1 3* G8, MagnaGuard 6* G8, Nute G8",0
"VikingKoala",1,1,45586,NS_Alt,"MT 6* G8, AV G8, Spirit G8, Daka G8, Talia 5* G8",0
"VikingKoala",0,1,68330,BH,"Jango G9, Dengar G8, Cad G8, zZam Greedo G8",0
"VikingKoala",0,1,104040,BS,"BS G9, zGMY Old Ben G9, zGK zJKA",0
