Player,Offense,Defense,GP,Name,Squad,Viable
"Dakaf Fyrewalker",1,1,135206,NS,"zzMT AV zDaka Zombie Spirit",0
"Dakaf Fyrewalker",1,0,133606,zMaul,"Darth Maul, zSidious Sith Assassin, zSavage Sith Marauder",0
"CC 5576",,,128530,Phasma,"zPhasma zFOTP FOSFTP zFOST zKylo",1
"CC 5576",1,1,166746,SL Kylo,"zzzzzzSL Kylo, zSith Trooper, zHux zzKRU zzThrawn",1
"CC 5576",,,445436,Negotiator,"Negotiator HT Anakin's Eta-2, Umbaran SF, Ahsoka's SF, BTL-B Y-wing, Clone Sergeant's ARC-170, Plo's SF",1
"CC 5576",0,1,122700,Geonosians Omicron,"zzGBA Sun Fac, Geo Soldier, Geo Spy, Poggle",1
"CC 5576",1,0,138301,Traya,"zzTraya zzDN zSion zDooku zzEP",1
"CC 5576",1,0,136047,Troopers,"zVeers zzPiett zzGideon zDark Trooper, Range Trooper",1
"CC 5576",0,1,121581,BH,"zzBossk zzJango zDengar zBoba zzGreef",1
"CC 5576",,,90744,Iden Troopers,"zIden Versio, Shoretrooper Snowtrooper Magma zDT",1
"CC 5576",0,1,84606,Phoenix,"zHera zKanan Zeb G8, Sabine G8, Ezra",1
"CC 5576",0,1,123452,padme,"zzPadme zGK zJKA zAhsoka Fives G1",0
"CC 5576",,,318619,Malevolence,"Malevolence Hyena Bomber 6*, Vulture Droid 6*, Sun Fac SF, Soldier SF, Spy SF",0
"CC 5576",,,480864,Executrix,"Executrix Tie Adv, Emperor's Shuttle, TIE Reaper 6*, Imperial TIE Fighter, Gauntlet Starfighter, FOSF TIE Fighter, FO TIE Fighter",0
"CC 5576",1,0,87643,Wampa (Counter),"Rex G1, zzWampa zKrennic Jyn G1, FOO",0
"Vaders Wrath",,,183880,JMK,"zzzzzzJMK zAhsoka zzzCAT zzzzGAS zGK",1
"Vaders Wrath",,,184099,LV,"zzzzzzLord Vader, zzPiett zzzMaul zRG zzzVader",1
"Vaders Wrath",,,134340,Admiral Raddus,"zzAdmiral Raddus, Cassian Jyn K-2SO Bistan",1
"Vaders Wrath",,,423119,Profundity,"Profundity 6* Han's MF, Outrider Rebel Y-wing, Cassian's U-wing, Biggs X-wing",1
"Vaders Wrath",1,1,166729,SL Kylo,"zzzzzzSL Kylo, zSith Trooper, zHux zzKRU zThrawn",1
"Vaders Wrath",,,181415,SEE,"zzzzzzSEE zBSF zzMalak zzzDR zDooku",1
"Vaders Wrath",1,1,168549,GL Rey,"zzzzzzRey zzJTR zzR2-D2 zRH Poe, zRH Finn",1
"Vaders Wrath",,,160945,Jabba,"zzzzzzJabba zBoushh (Leia Organa), zSkiff Guard (Lando Calrissian), Krrsantan Boba",1
"Vaders Wrath",,,144568,SK,"zzEP zzMara Jade, The Emperor's Hand, zzStarkiller zzOld Ben, Visas",1
"Vaders Wrath",0,1,95770,Qira,"Qira L3-37 zVandor Chewbacca, zMission zZaalbar",1
"Vaders Wrath",1,1,106784,NS,"zzMT zzAV zDaka Zombie Spirit",1
"Vaders Wrath",,,606189,Executor,"Executor HT RC Xanadu Blood, Slave I, IG-2000 Imperial TIE Fighter, Tie Adv",1
"Vaders Wrath",,,162507,JMLS,"zBS zzzzzzJMLS zWat Tambor, zzJKL zBarriss",1
"Vaders Wrath",1,0,154753,CLS,"zzzCLS zHan zzChewbacca zC-3PO zChewpio",1
"Vaders Wrath",,,514404,Negotiator,"Negotiator BTL-B Y-wing, Anakin's Eta-2, Rex's ARC-170, Umbaran SF, Ahsoka's SF, Plo's SF, Clone Sergeant's ARC-170",1
"Vaders Wrath",,,319435,Malevolence,"Malevolence Hyena Bomber, Vulture Droid, Sun Fac SF, Soldier SF, Spy SF",1
"Vaders Wrath",0,1,135992,Grievous,"zzGG zB2 zB1 MagnaGuard zNute",1
"Vaders Wrath",1,0,116980,Traya,"zzTraya DN zSion Sith Empire Trooper, zNest",1
"Vaders Wrath",,,106622,Mon Mothma,"zzMon Mothma, zCara Dune, Wedge zPao Hoth Rebel Scout",1
"Vaders Wrath",1,1,146037,Revan Offense,"zzzJKR zzGMY zzHYoda zJolee zJKA",1
"Vaders Wrath",1,1,85382,Ewoks,"zChirpa Elder Paploo Wicket Logray",1
"Vaders Wrath",1,0,151341,ShaakClones,"zzShaak Ti, zRex zEcho (501st), zzFives zARC Trooper",1
"Vaders Wrath",0,1,149498,BH,"zzBossk zJango zFennec Shand, Dengar zZam",1
"Vaders Wrath",1,0,118879,Troopers,"zVeers Starck zzGideon zDark Trooper, zStormtrooper",1
"Vaders Wrath",,,89865,Iden Troopers,"zIden Versio, Shoretrooper Snowtrooper Magma DT",1
"Vaders Wrath",0,1,82579,Phoenix,"Hera Kanan G8, Zeb G8, Sabine G8, Ezra",1
"Vaders Wrath",,,126063,Bad Batch,"zHunter zEcho zzOmega zTech zWrecker",1
"Vaders Wrath",,,120760,Phasma,"Phasma zFOTP FOSFTP zFOST zKylo",0
"Vaders Wrath",0,1,103369,Geonosians Omicron,"zzGBA Sun Fac, Geo Soldier, Geo Spy, Poggle",0
"Vaders Wrath",1,0,77816,Jawas,"Nebit G7, Jawa Engineer G9, Jawa Scavenger G8, Jawa Dathcha G9",0
"Nall1986",,,181881,JMK,"zzzzzzJMK zAhsoka zzzCAT zzzzGAS zGK",1
"Nall1986",,,123322,Phasma,"zPhasma zFOTP FOSFTP zFOST zKylo",1
"Nall1986",1,1,166816,SL Kylo,"zzzzzzSL Kylo, zSith Trooper, zHux zzKRU zThrawn",1
"Nall1986",1,1,171005,GL Rey,"zzzzzzRey zzzJTR zzBB-8 zHoldo zRH Finn",1
"Nall1986",1,1,101556,NS,"zzMT zzAV zDaka Zombie Spirit",1
"Nall1986",,,589218,Executor,"Executor 6* HT RC Xanadu Blood, Slave I, IG-2000 Imperial TIE Fighter, Tie Adv",1
"Nall1986",1,0,143205,CLS,"zzzCLS zHan zzChewbacca zC-3PO zChewpio",1
"Nall1986",0,1,149566,DRMalak,"zzzDR zzHK-47 zBSF zzMalak Sith Empire Trooper",1
"Nall1986",,,124498,Grievous Omicron,"zzGG zB2 zB1 zMagnaGuard zDroideka",1
"Nall1986",,,161664,JMLS,"zzzzzzJMLS zzJKL zzHYoda zOld Ben, zEzra",1
"Nall1986",,,515547,Negotiator,"Negotiator BTL-B Y-wing, Anakin's Eta-2, Rex's ARC-170, Umbaran SF, Ahsoka's SF, Plo's SF, Clone Sergeant's ARC-170",1
"Nall1986",,,313379,Malevolence,"Malevolence Hyena Bomber, Vulture Droid, Sun Fac SF, Soldier SF, Spy SF",1
"Nall1986",,,455160,HansMF,"Home One, Han's MF, Rebel Y-wing, Bistan's U-wing, Phantom Ghost Cassian's U-wing, Wedge X-wing",1
"Nall1986",,,120072,Mon Mothma,"zzMon Mothma, zCara Dune, zPao Hoth Rebel Scout, Scarif",1
"Nall1986",1,0,130951,Traya,"zzTraya zDN zSion zDooku zzEP",1
"Nall1986",1,0,141998,Troopers,"zVeers zzPiett zzGideon zDark Trooper, Range Trooper",1
"Nall1986",1,1,142968,Revan Offense,"zzzJKR zGMY zBS zJolee zJKA",1
"Nall1986",1,1,85283,Ewoks,"zChirpa Elder Paploo Wicket Logray",1
"Nall1986",1,0,151237,ShaakClones,"zzShaak Ti, zRex zEcho (501st), zzFives zARC Trooper",1
"Nall1986",0,1,153961,BH,"zzBossk zzJango zDengar zZam zBoba",1
"Nall1986",1,1,96605,Carth,"zCarth Onasi, zMission zZaalbar Juhani zCanderous",1
"Nall1986",0,1,80937,Phoenix,"Hera Kanan Chopper Zeb Sabine G8",1
"Nall1986",,,131106,Bad Batch,"zHunter zEcho zzOmega zTech zWrecker",1
"Nall1986",1,0,62113,Jawas,"Nebit G8, Jawa Engineer G8, Jawa Scavenger G8, Jawa G8, Dathcha G8",1
"Nall1986",1,0,19428,NestSolo (Counter),"zNest",1
"Nall1986",,,169054,LV,"zzzzzzLord Vader, zzDarth Malgus, zzzVader zRG Tarkin",0
"Nall1986",,,93674,Admiral Raddus,"zzAdmiral Raddus 6*, zCassian zJyn K-2SO Bistan",0
"Nall1986",0,1,102511,Geonosians Omicron,"zzGBA Sun Fac, Geo Soldier, Geo Spy, Poggle",0
"Nall1986",1,0,92560,Wiggs,"Wedge Biggs Leia Chirrut Baze G7",0
"LilBåby Том",0,1,120909,padme,"zzPadme zGK zJKA zAhsoka C-3PO",1
"LilBåby Том",,,270604,Malevolence,"Malevolence 5* Hyena Bomber, Vulture Droid, Sun Fac SF, Soldier SF, Spy SF",1
"LilBåby Том",1,1,154289,GAS,"zzzzGAS zRex zEcho (501st), zzFives zARC Trooper",1
"LilBåby Том",1,1,108992,Revan Offense,"zzzJKR zGMY BS zJolee zzHYoda",1
"LilBåby Том",1,1,66305,Ewoks,"zChirpa G8, Elder Paploo G9, Wicket G9, Logray G9",1
"LilBåby Том",1,1,109356,zEP,"zEP zzzVader Tarkin TFP zBSF",1
"LilBåby Том",0,1,59501,Phoenix,"Hera G8, Kanan G8, Chopper G8, Zeb G8, Ezra G8",1
"LilBåby Том",,,106795,Grievous Omicron,"zzGG zB2 zB1 MagnaGuard zDroideka",0
"LilBåby Том",0,1,91472,Geonosians Omicron,"zGBA Sun Fac, Geo Soldier, Geo Spy, Poggle",0
"MINI Flash Wayne",,,177153,SEE,"zzzzzzSEE zBSF zzMalak zzzDR zzzVader",1
"MINI Flash Wayne",1,1,93802,NS,"zzMT zzAV zDaka Zombie Spirit",1
"MINI Flash Wayne",0,1,143036,padme,"zzPadme zGK zJKA zAhsoka zBarriss",1
"MINI Flash Wayne",,,120802,Grievous Omicron,"zzGG zB2 zB1 zMagnaGuard zDroideka",1
"MINI Flash Wayne",,,477459,Negotiator,"Negotiator HT Anakin's Eta-2, Umbaran SF, Ahsoka's SF, Clone Sergeant's ARC-170, Plo's SF, Rex's ARC-170",1
"MINI Flash Wayne",,,326952,HansMF,"Home One, Han's MF, Biggs X-wing, Bistan's U-wing, Phantom Ghost Cassian's U-wing, Wedge X-wing",1
"MINI Flash Wayne",1,0,110714,Traya,"zzTraya DN zSion Sith Empire Trooper, zThrawn",1
"MINI Flash Wayne",1,1,83290,JTR,"zJTR Scav Rey G9, zBB-8 R2-D2 G9, Finn",1
"MINI Flash Wayne",1,1,120093,GAS,"zzzzGAS zRex zEcho (501st), zFives ARC Trooper",1
"MINI Flash Wayne",1,1,106810,Revan Offense,"zzzJKR zGMY zBS zJolee Ezra",1
"MINI Flash Wayne",1,1,78797,Ewoks,"zChirpa G9, Elder Paploo Wicket Logray",1
"MINI Flash Wayne",0,1,132638,BH,"zzBossk Dengar Cad zIG-88 zBoba",1
"MINI Flash Wayne",1,1,85152,Carth,"zCarth Onasi, zMission zZaalbar Juhani G8, Canderous",1
"MINI Flash Wayne",1,0,138473,Troopers,"zVeers zStarck zDark Trooper, Shoretrooper zzPiett",1
"MINI Flash Wayne",1,0,125985,zMaul,"zDarth Maul, zSidious zDooku Sith Marauder, zNest",1
"MINI Flash Wayne",0,1,73353,Phoenix,"Hera zKanan Chopper Zeb G8, Sabine G8",1
"MINI Flash Wayne",0,1,81868,FO,"zKRU zKylo FOO Phasma G8, FOTP",1
"MINI Flash Wayne",1,0,104062,EP (Counter, Rebel),"zzEP zKrennic zDT Range Trooper, Stormtrooper G8",1
"MINI Flash Wayne",1,0,108781,CLS,"zzzCLS zHan zzChewbacca zC-3PO Chewpio 4*",0
"MINI Flash Wayne",0,1,109114,Geonosians Omicron,"zzGBA Sun Fac, Geo Soldier, Geo Spy, Poggle",0
"MINI Flash Wayne",0,1,82903,BH,"Jango G9, The Mandalorian, Greedo zZam G9, Greef",0
"Jacke Aiche",,,578513,Executor,"Executor 5* HT RC Xanadu Blood, Slave I, IG-2000 Imperial TIE Fighter, Tie Adv",1
"Jacke Aiche",0,1,137958,padme,"zzPadme zGK zJKA zAhsoka zzzCAT",1
"Jacke Aiche",1,0,150061,CLS,"zzzCLS zHan zzChewbacca zzC-3PO zChewpio",1
"Jacke Aiche",,,416265,Negotiator,"Negotiator BTL-B Y-wing 6*, Anakin's Eta-2, Rex's ARC-170, Umbaran SF, Ahsoka's SF, Plo's SF, Clone Sergeant's ARC-170",1
"Jacke Aiche",0,1,145891,DR,"zzzDR zHK-47 zBSF Sith Marauder, Sith Empire Trooper",1
"Jacke Aiche",,,366476,HansMF,"Home One, Han's MF, Biggs X-wing, Bistan's U-wing, Phantom Ghost Cassian's U-wing, Wedge X-wing",1
"Jacke Aiche",0,1,107112,Grievous-Wat,"zzGG B2 G9, zB1 zMagnaGuard zWat Tambor 6*",1
"Jacke Aiche",1,0,149501,Troopers,"zVeers zzPiett zGideon zDark Trooper, Range Trooper",1
"Jacke Aiche",1,1,136446,Revan Offense,"zzzJKR zzGMY BS zJolee zzHYoda",1
"Jacke Aiche",1,1,84995,Ewoks,"zChirpa Elder zPaploo zWicket Logray",1
"Jacke Aiche",0,1,141212,BH,"zBossk Jango Dengar Boba zGreef",1
"Jacke Aiche",1,1,74786,Carth,"Carth Onasi, Mission G8, Zaalbar G9, Juhani G9, Canderous",1
"Jacke Aiche",1,1,134726,zEP,"zzEP zzzVader zTarkin TFP zMara Jade, The Emperor's Hand",1
"Jacke Aiche",0,1,70865,Phoenix,"Hera G9, Kanan G9, Zeb G8, Sabine G8, Ezra",1
"Jacke Aiche",,,145190,Bad Batch,"zHunter zEcho zzOmega zTech zWrecker",1
"Jacke Aiche",,,45694,Phasma,"Phasma G8, FOE 5* G9, FOO G8, KRU 6* G8, Kylo G8",0
"Jacke Aiche",,,311794,Malevolence,"Malevolence Hyena Bomber 5*, Vulture Droid, Sun Fac SF, Soldier SF, Spy SF",0
"Jacke Aiche",0,1,98382,Geonosians Omicron,"zzGBA Sun Fac, Geo Soldier, Geo Spy, Poggle",0
"Jacke Aiche",1,1,54317,NS_Alt,"MT G8, AV G9, Daka G8, Talia G8, Spirit G8",0
"Jacke Aiche",1,0,93590,ShaakClones,"zzShaak Ti, Rex Echo (501st) G8, Fives G8, Clone Sergeant",0
"Jacke Aiche",,,71953,Iden Troopers,"zIden Versio, Stormtrooper Snowtrooper G9, Magma G9, DT G8",0
"Jacke Aiche",1,1,63688,Rogue1,"Jyn G8, Chirrut 6* G8, Baze G8, K-2SO G8, Cassian G9",0
"Jacke Aiche",1,0,125640,zMaul,"Darth Maul, zDooku zDN zSidious zSavage",0
"Jacke Aiche",,,87568,Mando,"zzThe Mandalorian (Beskar Armor), Dash Rendar G9, Nest G7, IG-11 G7, Kuiil",0
"Ocin",,,123067,Phasma,"zPhasma zFOTP FOSFTP zFOST zKylo",1
"Ocin",1,1,156140,SL Kylo,"zzzzzzSL Kylo, zSith Trooper, zHux zzKRU zThrawn",1
"Ocin",,,535234,Executor,"Executor 5* HT RC Xanadu Blood, Slave I, IG-2000 Imperial TIE Fighter, Tie Adv",1
"Ocin",0,1,124174,padme,"zzPadme zGK JKA zAhsoka zC-3PO",1
"Ocin",0,1,118217,Grievous,"zzGG zB2 zB1 zDroideka zDooku",1
"Ocin",1,1,142762,GAS,"zzzzGAS zRex Echo (501st), zzFives ARC Trooper",1
"Ocin",1,1,88072,Revan Offense,"zzzJKR G9, GMY BS G9, Jolee HYoda G8",1
"Ocin",1,1,78452,Ewoks,"zChirpa Elder Paploo Wicket Logray",1
"Ocin",0,1,129420,BH,"zzBossk Dengar IG-88 zZam Boba",1
"Ocin",1,1,125021,zEP,"zEP zzzVader Tarkin TFP zTraya",1
"Ocin",0,1,67251,Phoenix,"Hera G9, Kanan G9, Chopper G9, Zeb G9, Ezra G9",1
"Ocin",1,0,14203,NestSolo (Counter),"Nest G9",1
"Ocin",,,356647,Negotiator,"Negotiator 5* BTL-B Y-wing, Anakin's Eta-2, Rex's ARC-170, Umbaran SF, Ahsoka's SF, Plo's SF, Clone Sergeant's ARC-170 5*",0
"Ocin",1,0,91220,CLS,"zzCLS zHan zChewbacca R2-D2 G8, Chewpio G8",0
"Ocin",0,1,96773,Geonosians Omicron,"zzGBA Sun Fac, Geo Soldier, Geo Spy, Poggle",0
"Ocin",1,0,98397,Troopers,"zVeers zzPiett Gideon Dark Trooper G9, Range Trooper G7",0
"Ocin",1,1,62128,Carth,"Carth Onasi, Mission G5, Zaalbar G5, Juhani Canderous",0
"Ocin",0,1,89118,BH,"Jango The Mandalorian, Cad zGreef Embo",0
"Ocin",1,0,7329,SionSolo (Counter),"Sion G7",0
"XavierSpud's Demonslayer",,,176049,JMK,"zzzzzzJMK zAhsoka zzzCAT zzzzGAS zGK",1
"XavierSpud's Demonslayer",,,103341,Phasma,"zPhasma zFOTP FOO zzKRU zKylo",1
"XavierSpud's Demonslayer",,,171932,SEE,"zzzzzzSEE zBSF zzMalak zzzDR zzzVader",1
"XavierSpud's Demonslayer",1,1,168416,GL Rey,"zzzzzzRey zzzJTR zzR2-D2 zRH Poe, zRH Finn",1
"XavierSpud's Demonslayer",1,1,114311,NS,"zzMT zzAV zDaka Zombie Spirit",1
"XavierSpud's Demonslayer",,,564362,Executor,"Executor 5* HT RC Xanadu Blood, Slave I, IG-2000 Imperial TIE Fighter, Tie Adv",1
"XavierSpud's Demonslayer",1,0,143755,CLS,"zzzCLS zHan zzChewbacca zzC-3PO zChewpio",1
"XavierSpud's Demonslayer",,,502037,Negotiator,"Negotiator BTL-B Y-wing, Anakin's Eta-2, Rex's ARC-170, Umbaran SF, Ahsoka's SF, Plo's SF, Clone Sergeant's ARC-170",1
"XavierSpud's Demonslayer",,,309842,Malevolence,"Malevolence Hyena Bomber, Vulture Droid, Sun Fac SF, Soldier SF, Spy SF",1
"XavierSpud's Demonslayer",,,136894,JKL,"zzJKL zzzJKR zzHYoda zOld Ben, Aayla",1
"XavierSpud's Demonslayer",,,441045,HansMF,"Home One, Han's MF, Rebel Y-wing, Bistan's U-wing, Phantom Ghost Cassian's U-wing, Biggs X-wing",1
"XavierSpud's Demonslayer",0,1,124928,Grievous,"zzGG zB2 zB1 MagnaGuard zNute",1
"XavierSpud's Demonslayer",1,0,118144,Traya,"zzTraya zzDN zSion Sith Empire Trooper, zzThrawn",1
"XavierSpud's Demonslayer",,,109736,Mon Mothma,"zzMon Mothma, zCara Dune, Wedge Biggs zPao",1
"XavierSpud's Demonslayer",1,1,76738,Ewoks,"zChirpa Elder Paploo Wicket Logray",1
"XavierSpud's Demonslayer",1,0,131539,ShaakClones,"zzShaak Ti, zRex zEcho (501st), zzFives zARC Trooper",1
"XavierSpud's Demonslayer",0,1,149070,BH,"zzBossk zzJango zDengar zIG-88 zBoba",1
"XavierSpud's Demonslayer",1,1,100769,Carth,"Carth Onasi, zMission Zaalbar zJuhani zCanderous",1
"XavierSpud's Demonslayer",1,0,121957,Troopers,"zVeers zStarck zDark Trooper, Shoretrooper zzPiett",1
"XavierSpud's Demonslayer",1,0,129896,zMaul,"zDarth Maul, zSidious zDooku Sith Marauder, zNest",1
"XavierSpud's Demonslayer",0,1,85637,Phoenix,"Hera Kanan Zeb G8, Sabine zEzra",1
"XavierSpud's Demonslayer",1,1,91346,Rogue1,"Jyn Chirrut Baze K-2SO zCassian",1
"XavierSpud's Demonslayer",1,0,116060,EP (Counter, Rebel),"zzEP Krennic DT zzWampa Range Trooper",1
"XavierSpud's Demonslayer",0,1,99715,Geonosians Omicron,"zzGBA Sun Fac, Geo Soldier, Geo Spy, Poggle",0
"XavierSpud's Demonslayer",,,76064,Bad Batch,"zHunter 5* zEcho 3* zzOmega 6* G9, zTech 4* zWrecker 6* G8",0
"XavierSpud's Demonslayer",1,0,61171,Jawas,"Nebit G8, Jawa Engineer 6* G9, Jawa Scavenger G8, Jawa G9, Dathcha G9",0
"KageSkywalker",,,176617,JMK,"zzzzzzJMK zJKA zzGMY zzShaak Ti, zGK",1
"KageSkywalker",1,0,141622,CLS,"zzzCLS zHan zzChewbacca zzC-3PO zChewpio",1
"KageSkywalker",0,1,105252,DRMalak,"zzzDR zzHK-47 zBSF zzMalak 6* Sith Empire Trooper G9",1
"KageSkywalker",0,1,101643,Geonosians Omicron,"zzGBA Sun Fac, Geo Soldier, Geo Spy, Poggle",1
"KageSkywalker",0,1,138262,Grievous-Wat,"zzGG zB2 zB1 zMagnaGuard zWat Tambor",1
"KageSkywalker",1,1,153488,GAS,"zzzzGAS zRex zEcho (501st), zzFives zARC Trooper",1
"KageSkywalker",1,1,89718,Ewoks,"zChirpa Elder zPaploo Teebo Scout",1
"KageSkywalker",1,1,89058,Carth,"Carth Onasi, zMission Zaalbar Juhani Canderous",1
"KageSkywalker",0,1,131607,BH,"zzBossk zJango Cad zBoba Embo",1
"KageSkywalker",1,1,110090,zEP,"zzEP zzzVader Tarkin TFP G9, zSion",1
"KageSkywalker",0,1,90823,Phoenix,"Hera zKanan Chopper Zeb zEzra",1
"KageSkywalker",,,130348,Bad Batch,"zHunter zEcho zzOmega zTech zWrecker",1
"KageSkywalker",1,0,85679,Jawas,"Nebit Jawa Engineer, Jawa Scavenger, Jawa Dathcha",1
"KageSkywalker",,,48279,Phasma,"Phasma G8, FOE 5* G9, FOO G8, KRU 5* G8, Kylo G8",0
"KageSkywalker",,,485868,Negotiator,"Negotiator HT 5* Anakin's Eta-2, Umbaran SF, Ahsoka's SF, BTL-B Y-wing 5*, Clone Sergeant's ARC-170, Plo's SF",0
"KageSkywalker",,,313688,HansMF,"Home One, Han's MF 5*, Biggs X-wing, Bistan's U-wing 4*, Phantom Ghost Cassian's U-wing, Wedge X-wing",0
"KageSkywalker",1,1,66937,NS,"MT G8, AV Daka G9, Zombie G8, Spirit G8",0
"KageSkywalker",1,0,50307,Troopers,"Veers G8, Starck G5, DT G8, Snowtrooper G8, Shoretrooper G8",0
"KageSkywalker",1,1,60836,Rogue1,"Jyn G8, Chirrut G8, Baze 6* G8, K-2SO G8, Cassian G9",0
"KageSkywalker",1,0,7872,NestSolo (Counter),"Nest G6",0
"Bizurker",1,1,157216,SL Kylo,"zzzzzzSL Kylo, zSith Trooper, zHux zzKRU Thrawn",1
"Bizurker",1,1,126607,NS,"zzMT zAV zDaka Zombie Spirit",1
"Bizurker",,,569492,Executor,"Executor HT RC Xanadu Blood, Slave I, IG-2000 Imperial TIE Fighter, Tie Adv",1
"Bizurker",0,1,142135,padme,"zzPadme zGK zJKA zAhsoka zzzCAT",1
"Bizurker",,,172975,JMLS,"zzzJKR zzJKL zzzzzzJMLS zWat Tambor, zzzzGAS",1
"Bizurker",1,0,145638,CLS,"zzzCLS zHan zzChewbacca zzC-3PO zChewpio",1
"Bizurker",0,1,142068,DRMalak,"zzzDR zzHK-47 zBSF zzMalak Sith Empire Trooper",1
"Bizurker",,,477438,Negotiator,"Negotiator BTL-B Y-wing, Anakin's Eta-2, Rex's ARC-170, Umbaran SF, Ahsoka's SF, Plo's SF, Clone Sergeant's ARC-170",1
"Bizurker",,,391801,HansMF,"Home One, Han's MF, Rebel Y-wing, Ghost Phantom Biggs X-wing, Cassian's U-wing, Wedge X-wing",1
"Bizurker",0,1,124198,Grievous,"zzGG zB2 zB1 MagnaGuard zNute",1
"Bizurker",1,1,118166,JTR,"zzzJTR Scav Rey G8, zzBB-8 zR2-D2 Finn",1
"Bizurker",,,114923,Mon Mothma,"zzMon Mothma, Wedge Biggs Hoth Rebel Scout, Lando",1
"Bizurker",1,1,85473,Ewoks,"zChirpa Elder Paploo Wicket Logray",1
"Bizurker",1,0,142494,ShaakClones,"zzShaak Ti, zRex zEcho (501st), zzFives zARC Trooper",1
"Bizurker",0,1,140071,BH,"zzBossk zJango Dengar IG-88 Boba",1
"Bizurker",1,1,85426,Carth,"zCarth Onasi, Mission Zaalbar Juhani G8, Canderous",1
"Bizurker",1,1,147552,zEP,"zzEP zzzVader zTarkin TFP zzMara Jade, The Emperor's Hand",1
"Bizurker",1,0,134682,Troopers,"zVeers zStarck zDark Trooper, Range Trooper, zzPiett",1
"Bizurker",0,1,71726,Phoenix,"Hera G8, Kanan G9, Zeb G9, Sabine G8, Ezra",1
"Bizurker",1,1,68561,Rogue1,"Jyn G8, Chirrut G8, Baze G8, K-2SO G8, Cassian G8",1
"Bizurker",0,1,136368,BS,"zBS zGMY zJolee Old Ben, zHYoda",1
"Bizurker",1,0,24688,NestSolo (Counter),"zNest",1
"Bizurker",1,0,15193,SionSolo (Counter),"Sion G9",1
"Bizurker",,,110053,Phasma,"Phasma FOTP FOSFTP zFOST Kylo",0
"Bizurker",,,327519,Malevolence,"Malevolence Hyena Bomber 5*, Vulture Droid 5*, Sun Fac SF, Soldier SF, Spy SF",0
"Bizurker",0,1,117357,Geonosians Omicron,"zzGBA Sun Fac, Geo Soldier, Geo Spy, Poggle",0
"Bizurker",,,86156,Bad Batch,"zHunter G9, zEcho G9, zzOmega G8, zTech G9, zWrecker G8",0
"Bizurker",1,0,36254,Jawas,"Nebit G1, Jawa Engineer G1, Jawa Scavenger G1, Jawa G1, Dathcha G1",0
"Greg",1,1,156359,SL Kylo,"zzzzzzSL Kylo, zSith Trooper, zHux zzKRU Thrawn",1
"Greg",,,297044,HansMF,"Home One, Han's MF, HT Ghost Phantom Biggs X-wing, Cassian's U-wing, Wedge X-wing",1
"Greg",1,0,113658,Traya,"zzTraya DN Sion G9, zDooku zEP",1
"Greg",1,1,108712,Revan,"zzzJKR BS GMY Jolee GK",1
"Greg",0,1,102790,BH,"zBossk Jango The Mandalorian, zZam Boba",1
"Greg",1,0,108916,Troopers,"zVeers Starck DT zIden Versio, zPiett",1
"Greg",,,115385,Phasma,"Phasma zFOTP FOSFTP FOST Kylo",0
"Greg",0,1,119949,DRMalak,"zzzDR HK-47 zBSF zzMalak Sith Marauder 5*",0
"Greg",1,0,88343,CLS,"zzzCLS Han Chewbacca R2-D2 G7, Chewpio",0
"Greg",0,1,84732,Geonosians Omicron,"zGBA Sun Fac G8, Geo Soldier, Geo Spy, Poggle",0
"Greg",0,1,66483,Grievous,"GG B2 G9, Droideka G8, IG-88 G6, T3-M4 G7",0
"Greg",1,1,85186,Carth,"zCarth Onasi, zMission zZaalbar Juhani G7, Canderous",0
"Greg",1,0,73499,ShaakClones,"Shaak Ti G8, Rex Echo (501st) G8, Fives G9, ARC Trooper G8",0
"Greg",0,1,69713,Phoenix,"Hera Kanan G8, Chopper G7, Zeb G8, Ezra G9",0
"Greg",,,84688,Bad Batch,"zHunter zEcho Omega G9, Tech zWrecker G8",0
"Levka Fae",0,1,147333,padme,"zzPadme zGK zJKA zAhsoka zzC-3PO",1
"Levka Fae",1,1,87185,JTR,"zJTR G8, zScav Rey, BB-8 G9, zzR2-D2 G9, zFinn G9",1
"Levka Fae",1,1,127351,Revan Offense,"zzzJKR zzGMY zBS zJolee HYoda G9",1
"Levka Fae",1,1,86427,Ewoks,"zChirpa Elder Paploo Wicket zLogray",1
"Levka Fae",1,1,84651,Carth,"zCarth Onasi, Mission G8, zZaalbar G9, Juhani Canderous",1
"Levka Fae",0,1,108629,BH,"zzBossk zJango zzThe Mandalorian, Cad zBoba",1
"Levka Fae",0,1,83322,Phoenix,"zHera Kanan G9, Zeb G9, zSabine Ezra G8",1
"Levka Fae",,,72671,Phasma,"Phasma G8, FOTP G9, FOE KRU G9, Kylo G8",0
"Levka Fae",,,102988,Grievous Omicron,"GG G9, zB2 zB1 zMagnaGuard zDroideka",0
"Levka Fae",,,402965,Negotiator,"Negotiator 5* BTL-B Y-wing 2*, Anakin's Eta-2, Rex's ARC-170, Umbaran SF, Ahsoka's SF, Plo's SF, Clone Sergeant's ARC-170",0
"Levka Fae",1,1,88230,NS,"zzMT zzAV Daka G8, Zombie Spirit G8",0
"Levka Fae",0,1,99310,Geonosians Omicron,"zzGBA Sun Fac, Geo Soldier, Geo Spy, Poggle",0
"Levka Fae",,,291000,HansMF,"Home One, Han's MF 5*, Rebel Y-wing 4*, Bistan's U-wing, Phantom Ghost Cassian's U-wing, Biggs X-wing",0
"Levka Fae",0,1,93195,DR,"zzzDR G9, zzHK-47 zBSF Sith Marauder 5* G8, Thrawn",0
"Levka Fae",1,0,60382,Traya,"Traya DN 6* G8, Sion 4* G8, Dooku 6* G6, EP G8",0
"Levka Fae",1,1,70535,GAS,"zzzzGAS 5* Rex G7, Echo (501st) G5, Fives ARC Trooper G6",0
"Levka Fae",1,0,63703,Wiggs,"Wedge G5, Biggs G7, Han G7, zFulcrum Leia G9",0
"Levka Fae",,,39962,Bad Batch,"Hunter 5* G8, Echo 4* G5, Omega 5* G6, Tech 5* G8, Wrecker 5* G7",0
"AndySkywalker",,,181883,JMK,"zzzzzzJMK zAhsoka zzzCAT zzzzGAS zGK",1
"AndySkywalker",,,177764,LV,"zzzzzzLord Vader, zzPiett zzzVader zRG zzThrawn",1
"AndySkywalker",,,176835,SEE,"zzzzzzSEE zBSF zzMalak zzzDR zDooku",1
"AndySkywalker",1,1,103111,NS,"zzMT zzAV zDaka Zombie Spirit",1
"AndySkywalker",,,563366,Executor,"Executor 5* HT RC Xanadu Blood, Slave I, IG-2000 Imperial TIE Fighter, Tie Adv",1
"AndySkywalker",,,159414,JMLS,"zBS zzzzzzJMLS zWat Tambor, zzJKL zJolee",1
"AndySkywalker",1,0,142650,CLS,"zzzCLS zHan zzChewbacca zC-3PO zChewpio",1
"AndySkywalker",,,129130,Grievous Omicron,"zzGG zB2 zB1 zMagnaGuard zDroideka",1
"AndySkywalker",,,405154,HansMF,"Home One, Han's MF, Rebel Y-wing 6*, Bistan's U-wing, Phantom Biggs X-wing, Cassian's U-wing, Wedge X-wing",1
"AndySkywalker",1,0,131822,Traya,"zzTraya zzDN zSion zzEP Sith Empire Trooper",1
"AndySkywalker",1,1,115134,JTR,"zzzJTR zScav Rey, BB-8 G9, R2-D2 Finn",1
"AndySkywalker",1,1,83573,Ewoks,"zChirpa Elder Paploo Wicket Logray G9",1
"AndySkywalker",1,0,151563,ShaakClones,"zzShaak Ti, zRex zEcho (501st), zzFives zARC Trooper",1
"AndySkywalker",0,1,153435,BH,"zzBossk zzJango zDengar zZam zBoba",1
"AndySkywalker",1,1,93924,Carth,"zCarth Onasi, Mission zZaalbar Juhani zCanderous",1
"AndySkywalker",1,0,126177,Troopers,"zVeers zStarck zzGideon DT Range Trooper",1
"AndySkywalker",0,1,78983,Phoenix,"Hera G9, Kanan G8, Zeb G8, zSabine Ezra",1
"AndySkywalker",1,1,69421,Rogue1,"Jyn G8, Chirrut G8, Baze G8, K-2SO G8, Cassian G9",1
"AndySkywalker",1,0,88475,Jawas,"Nebit Jawa Engineer, Jawa Scavenger, Jawa Dathcha",1
"AndySkywalker",1,0,64678,QiraNest,"Qira zNest zzHYoda",1
"AndySkywalker",,,76776,Phasma,"Phasma G9, FOTP FOO KRU G8, Kylo",0
"AndySkywalker",,,485957,Negotiator,"Negotiator BTL-B Y-wing, Anakin's Eta-2, Rex's ARC-170, Umbaran SF, Ahsoka's SF, Plo's SF, Clone Sergeant's ARC-170",0
"AndySkywalker",0,1,102442,Geonosians Omicron,"zzGBA Sun Fac, Geo Soldier, Geo Spy, Poggle",0
"AndySkywalker",,,116095,Mon Mothma,"zzMon Mothma, Kyle Katarn, Wedge Biggs Lando",0
"AndySkywalker",,,117590,Bad Batch,"zHunter zEcho Omega G9, zTech zWrecker",0
"Hotdog",,,116541,Phasma,"zPhasma zFOTP FOSFTP FOST zKylo",1
"Hotdog",1,1,161936,SL Kylo,"zzzzzzSL Kylo, zSith Trooper, zHux zzKRU zThrawn",1
"Hotdog",1,1,111287,zEP,"zzEP zzzVader Tarkin Krennic TFP G8",1
"Hotdog",0,1,74704,Phoenix,"Hera Kanan Chopper Zeb Ezra",1
"Hotdog",0,1,76439,padme,"Padme G9, GK G8, JKA Ahsoka Fives 6* G8",0
"Hotdog",1,0,53026,CLS,"CLS G8, Han G9, Chewbacca 5* G6, R2-D2 G9, Chewpio 5* G7",0
"Hotdog",0,1,121937,Geonosians Omicron,"zzGBA Sun Fac, Geo Soldier, Geo Spy, Poggle",0
"Hotdog",,,254036,HansMF,"Home One, Han's MF, Biggs X-wing, Bistan's U-wing, Phantom Ghost Cassian's U-wing, Wedge X-wing",0
"Hotdog",1,0,91742,Troopers,"zVeers zzPiett Gideon 6* G9, zDark Trooper, Range Trooper 5* G9",0
"Hotdog",,,76921,Nute-OR,"Nute G9, Dooku Jango Zaalbar G9, Mission G8",0
"Hotdog",1,1,45332,NS_Alt,"MT 5* G8, AV Daka 6* G8, Talia 5* G8, Spirit 5* G8",0
"Hotdog",1,1,56559,Ewoks,"Chirpa 4* G8, Elder G8, Paploo 6* G8, Teebo G8, Logray G9",0
"Hotdog",0,1,83221,BH,"Bossk The Mandalorian, Cad IG-88 Boba",0
"Hotdog",1,1,45204,Rogue1,"Jyn 6* G8, Chirrut 5* G8, Baze 5* G8, K-2SO G8, Cassian G8",0
"MINI DarthSmit",,,174435,JMK,"zzzzzzJMK zJKA zzGMY zzShaak Ti, zGK",1
"MINI DarthSmit",,,177117,SEE,"zzzzzzSEE zBSF zzMalak zzzDR zzzVader",1
"MINI DarthSmit",,,561970,Executor,"Executor HT RC Xanadu Blood, Slave I, IG-2000 Imperial TIE Fighter, Tie Adv",1
"MINI DarthSmit",1,0,137536,CLS,"zzzCLS zHan zzChewbacca C-3PO zChewpio",1
"MINI DarthSmit",,,125146,Grievous Omicron,"zzGG zB2 zB1 zMagnaGuard zDroideka",1
"MINI DarthSmit",1,0,112582,Troopers,"zVeers zzPiett Gideon zDark Trooper, Range Trooper",1
"MINI DarthSmit",1,1,135641,GAS,"zzzzGAS zRex zEcho (501st), zzFives zARC Trooper",1
"MINI DarthSmit",1,1,76256,Ewoks,"zChirpa G9, Elder Paploo Wicket G9, Logray G8",1
"MINI DarthSmit",0,1,132880,BH,"zzBossk Jango Dengar Cad Boba",1
"MINI DarthSmit",1,0,123662,zMaul,"zDarth Maul, zSidious zDooku Sith Empire Trooper, zNest",1
"MINI DarthSmit",0,1,66732,Phoenix,"Hera G8, Kanan G8, Chopper G8, Zeb G8, Ezra",1
"MINI DarthSmit",1,0,112630,EP (Counter, Rebel),"zEP Krennic DT G8, zWampa zStarck",1
