Player,Offense,Defense,GP,Name,Squad,Viable
"MINI DarthSmit",,,456464,Negotiator,"Negotiator BTL-B Y-wing, Anakin's Eta-2, Rex's ARC-170, Umbaran SF, Ahsoka's SF, Plo's SF, Clone Sergeant's ARC-170 4*",0
"MINI DarthSmit",0,1,101235,Geonosians Omicron,"zGBA Sun Fac, Geo Soldier, Geo Spy, Poggle",0
"MINI DarthSmit",,,281219,Malevolence,"Malevolence Hyena Bomber 6*, Vulture Droid 5*, Sun Fac SF, Soldier SF, Spy SF",0
"MINI DarthSmit",,,276808,HansMF,"Home One, Han's MF, Rebel Y-wing, Bistan's U-wing 5*, Phantom Ghost Cassian's U-wing 6*, Biggs X-wing 1*",0
"MINI DarthSmit",1,1,55819,NS,"MT G7, AV Daka G8, Zombie G8, Spirit G7",0
"MINI DarthSmit",1,1,86097,Carth,"zCarth Onasi, zMission zZaalbar Juhani G7, Canderous",0
"MINI DarthSmit",1,0,79020,Thragma (Counter),"zThrawn Magma G7, Tarkin Stormtrooper G7, Shoretrooper 5* G8",0
"ChrisCarter",0,1,129254,padme,"zzPadme zGK zJKA zAhsoka zC-3PO",1
"ChrisCarter",,,112839,Grievous Omicron,"zzGG zB2 zB1 zMagnaGuard zDroideka",1
"ChrisCarter",,,413750,Negotiator,"Negotiator 5* HT Anakin's Eta-2, Umbaran SF, Ahsoka's SF, Clone Sergeant's ARC-170, Plo's SF, Rex's ARC-170",1
"ChrisCarter",1,0,146171,Traya,"zzTraya zzDN zSion zzEP zzThrawn",1
"ChrisCarter",1,1,90792,Ewoks,"zChirpa Elder Paploo Teebo zLogray",1
"ChrisCarter",0,1,114952,BH,"zzBossk zzThe Mandalorian, zZam Boba zzGreef",1
"ChrisCarter",1,0,118559,Troopers,"zVeers zStarck zzGideon Range Trooper, zzPiett",1
"ChrisCarter",0,1,87833,Phoenix,"Hera Kanan Chopper Zeb Ezra",1
"ChrisCarter",0,1,92909,FO,"zKRU zKylo FOE zPhasma FOTP",1
"ChrisCarter",1,0,136479,zMaul,"zDarth Maul, zDooku zSidious zSavage Sith Marauder",1
"ChrisCarter",,,307865,Malevolence,"Malevolence Hyena Bomber, Vulture Droid 6*, Sun Fac SF, Soldier SF, Spy SF",0
"ChrisCarter",0,1,104958,Geonosians Omicron,"zzGBA Sun Fac, Geo Soldier, Geo Spy, Poggle",0
"ChrisCarter",1,1,80788,NS_Alt,"zAV Daka Talia Zombie G9, Spirit G8",0
"ChrisCarter",1,0,75047,ShaakClones,"Shaak Ti G8, Rex Echo (501st) G9, Fives G9, Clone Sergeant G8",0
"ChrisCarter",0,1,74984,BH,"Jango G1, Dengar G7, Cad Greedo IG-88",0
"T boy 3",,,172029,JMK,"zzzzzzJMK zJKA zGMY zzShaak Ti, zGK",1
"T boy 3",,,167884,LV,"zzzzzzLord Vader, zzPiett zzzVader zRG Tarkin",1
"T boy 3",,,95852,Phasma,"zPhasma zFOTP FOSFTP zzKRU Kylo",1
"T boy 3",0,1,122963,DRMalak,"zzzDR zHK-47 zBSF zzMalak Sith Empire Trooper G8",1
"T boy 3",,,129161,Grievous Omicron,"zzGG zB2 zB1 zMagnaGuard zDroideka",1
"T boy 3",1,0,124482,CLS,"zzzCLS zHan zzChewbacca zzC-3PO zChewpio",1
"T boy 3",,,490713,Negotiator,"Negotiator HT Anakin's Eta-2, Umbaran SF, Ahsoka's SF, BTL-B Y-wing, Clone Sergeant's ARC-170, Plo's SF",1
"T boy 3",,,310120,Malevolence,"Malevolence Hyena Bomber, Vulture Droid, Sun Fac SF, Soldier SF, Spy SF",1
"T boy 3",0,1,95384,Geonosians Omicron,"zzGBA Sun Fac, Geo Soldier, Geo Spy, Poggle",1
"T boy 3",,,339516,HansMF,"Home One, Han's MF, Rebel Y-wing 6*, Bistan's U-wing, Phantom Biggs X-wing, Cassian's U-wing, Wedge X-wing",1
"T boy 3",1,0,127201,Traya,"zzTraya zzDN zSion zDooku zThrawn",1
"T boy 3",1,1,155661,GAS,"zzzzGAS zRex zEcho (501st), zzFives zARC Trooper",1
"T boy 3",1,1,78571,Ewoks,"zChirpa Elder Paploo zWicket Logray",1
"T boy 3",0,1,134846,BH,"zzBossk zzJango Dengar zZam zBoba",1
"T boy 3",1,1,83015,Carth,"zCarth Onasi, zMission zZaalbar Juhani G9, zCanderous",1
"T boy 3",1,0,102693,Troopers,"zVeers Starck zGideon zDark Trooper, Range Trooper",1
"T boy 3",0,1,66541,Phoenix,"Hera G9, Kanan G8, Chopper G9, Zeb G8, Ezra",1
"T boy 3",,,126034,Bad Batch,"zHunter zEcho zzOmega zTech zWrecker",1
"T boy 3",1,0,19893,NestSolo (Counter),"zNest",1
"T boy 3",1,1,81636,NS,"zMT AV Daka Zombie Spirit G9",0
"BringMeTheWookie",,,176442,JMK,"zzzzzzJMK zJKA zzGMY zzShaak Ti, GK",1
"BringMeTheWookie",1,1,170966,SL Kylo,"zzzzzzSL Kylo, zSith Trooper, zHux zzKRU zzThrawn",1
"BringMeTheWookie",,,498193,Negotiator,"Negotiator HT Anakin's Eta-2, Umbaran SF, Ahsoka's SF, BTL-B Y-wing, Clone Sergeant's ARC-170, Plo's SF",1
"BringMeTheWookie",0,1,121787,DR,"zzzDR HK-47 G9, zBSF Sith Marauder, Sith Empire Trooper",1
"BringMeTheWookie",0,1,132224,Grievous,"zzGG zB2 zB1 MagnaGuard zNute",1
"BringMeTheWookie",1,0,148390,Traya,"zzTraya zDN zSion zDooku zzEP",1
"BringMeTheWookie",1,1,153782,GAS,"zzzzGAS zRex zEcho (501st), zzFives zARC Trooper",1
"BringMeTheWookie",1,1,82464,Ewoks,"zChirpa Elder Paploo Scout zLogray G9",1
"BringMeTheWookie",0,1,125641,BH,"zzBossk zJango Dengar G8, Zam zBoba",1
"BringMeTheWookie",0,1,78712,Phoenix,"Hera zKanan G8, Chopper Zeb G8, Ezra",1
"BringMeTheWookie",1,0,19848,NestSolo (Counter),"zNest",1
"BringMeTheWookie",,,118614,Phasma,"zPhasma FOTP FOSFTP FOST zKylo",0
"BringMeTheWookie",0,1,92180,Geonosians Omicron,"zzGBA Sun Fac, Geo Soldier, Geo Spy, Poggle",0
"BringMeTheWookie",1,1,73059,NS,"MT G8, zAV Daka G9, Zombie G8, Spirit G8",0
"BringMeTheWookie",1,0,113394,CLS,"zzzCLS Han zChewbacca zzR2-D2 G9, zzC-3PO",0
"BringMeTheWookie",1,1,57345,Carth,"Carth Onasi G8, Mission 6* G6, Zaalbar 6* G7, Juhani G8, Canderous G7",0
"BringMeTheWookie",1,0,102685,Troopers,"Veers Starck zDT Stormtrooper zzPiett",0
"BringMeTheWookie",1,1,66724,Rogue1,"Jyn G9, Chirrut Baze 5* G8, zK-2SO Scarif G9",0
"Swagfrog4",1,0,137520,CLS,"zzzCLS zHan zChewbacca C-3PO zChewpio",1
"Swagfrog4",,,343887,HansMF,"Home One, Han's MF, Rebel Y-wing 6*, Bistan's U-wing, Phantom Biggs X-wing, Cassian's U-wing, Wedge X-wing",1
"Swagfrog4",0,1,103076,Grievous,"zzGG zB2 zDroideka MagnaGuard IG-88",1
"Swagfrog4",1,1,84548,Ewoks,"zChirpa Elder Paploo Scout zWicket",1
"Swagfrog4",0,1,88960,BH,"zBossk zJango Cad Boba G9, Greef",1
"Swagfrog4",0,1,68123,Phoenix,"Hera G8, Kanan G8, Chopper Zeb G8, Ezra",1
"Swagfrog4",,,57909,Phasma,"Phasma G8, FOE G9, FOO G8, KRU G8, Kylo G8",0
"Swagfrog4",,,48776,Admiral Raddus,"Admiral Raddus 3* G8, Cassian G8, Jyn 5* G8, K-2SO G8, Bistan G8",0
"Swagfrog4",,,137514,JMLS,"BS G8, zzzzzzJMLS HYoda zzJKL zJolee",0
"Swagfrog4",,,191592,Malevolence,"Malevolence 5* Hyena Bomber 4*, Vulture Droid 5*, Sun Fac SF 6*, Soldier SF, Spy SF",0
"Swagfrog4",0,1,47423,Geonosians Omicron,"GBA 4* G8, Sun Fac G7, Geo Soldier G7, Geo Spy G9, Poggle G7",0
"Swagfrog4",1,1,91148,JTR,"JTR Scav Rey G8, BB-8 G8, R2-D2 Finn G9",0
"Swagfrog4",1,0,62015,Troopers,"Veers G8, zPiett G8, Gideon G9, Dark Trooper, Range Trooper 5* G7",0
"Swagfrog4",1,1,51469,NS,"MT G8, AV Daka G8, Zombie 5* G8, Spirit 6* G8",0
"Swagfrog4",,,98956,Mon Mothma,"Mon Mothma, Wedge Biggs Pao G9, Lando",0
"Swagfrog4",1,0,69880,ShaakClones,"Shaak Ti, Rex Echo (501st) 5* G8, Fives Clone Sergeant",0
"Swagfrog4",1,1,72492,zEP,"EP G8, zzzVader Tarkin TFP G8, Mara Jade, The Emperor's Hand 4* G8",0
"Swagfrog4",1,0,10068,NestSolo (Counter),"Nest 6* G9",0
"Dereckgotstrong",0,1,128105,DRMalak,"zzzDR zzHK-47 zBSF zzMalak Sith Empire Trooper",1
"Dereckgotstrong",1,0,136469,CLS,"zzzCLS zHan zzChewbacca zzC-3PO zChewpio",1
"Dereckgotstrong",,,342548,HansMF,"Home One, Han's MF 6*, HT Ghost Phantom Biggs X-wing, Cassian's U-wing, Wedge X-wing",1
"Dereckgotstrong",,,97999,Nute-Wat,"zNute zB1 zB2 MagnaGuard zWat Tambor 5* G9",1
"Dereckgotstrong",1,1,123545,GAS,"zzzzGAS zRex zEcho (501st), zzFives zARC Trooper",1
"Dereckgotstrong",1,1,143694,Revan,"zzzJKR zBS zGMY zJolee zGK",1
"Dereckgotstrong",1,1,84052,Ewoks,"zChirpa Elder Paploo zWicket Logray G9",1
"Dereckgotstrong",0,1,105384,BH,"zzBossk zThe Mandalorian, Dengar G8, zBoba zGreef",1
"Dereckgotstrong",1,1,113837,zEP,"zzEP zzzVader zTarkin TFP zSion",1
"Dereckgotstrong",0,1,70563,Phoenix,"Hera G8, Kanan G8, Chopper G9, Zeb G8, Ezra",1
"Dereckgotstrong",,,63675,Phasma,"Phasma G8, FOE 6* G8, FOO G7, zKRU G8, Kylo G8",0
"Dereckgotstrong",0,1,92774,Geonosians Omicron,"zzGBA Sun Fac, Geo Soldier, Geo Spy, Poggle",0
"Dereckgotstrong",1,1,85097,Carth,"zCarth Onasi, zMission zZaalbar Juhani G7, Canderous",0
"Dereckgotstrong",0,1,64899,BH,"Jango G8, Cad G9, Greedo G8, IG-88 G7, Nest G7",0
"Nova51",,,122656,Phasma,"zPhasma zFOTP FOSFTP zFOST zKylo",1
"Nova51",1,1,166748,SL Kylo,"zzzzzzSL Kylo, zSith Trooper, zHux zzKRU zzThrawn",1
"Nova51",,,182019,SEE,"zzzzzzSEE zBSF zzMalak zzzDR zzzVader",1
"Nova51",1,0,143143,CLS,"zzzCLS zHan zzChewbacca zzC-3PO zChewpio",1
"Nova51",1,1,120206,NestSisters,"zzAV zzMT zDaka Zombie zNest",1
"Nova51",0,1,138108,padme,"zzPadme zGK zJKA zAhsoka zBarriss",1
"Nova51",,,484025,Negotiator,"Negotiator HT Anakin's Eta-2, Umbaran SF, Ahsoka's SF, BTL-B Y-wing, Clone Sergeant's ARC-170, Plo's SF",1
"Nova51",,,325866,Malevolence,"Malevolence Hyena Bomber, Vulture Droid, Sun Fac SF, Soldier SF, Spy SF",1
"Nova51",,,411636,HansMF,"Home One, Han's MF, Rebel Y-wing, Bistan's U-wing, Phantom Ghost Cassian's U-wing, Wedge X-wing",1
"Nova51",0,1,128383,Grievous,"zzGG zB2 zB1 zMagnaGuard zNute",1
"Nova51",1,0,122137,Traya,"zzTraya zDN zSion zzEP Sith Empire Trooper G8",1
"Nova51",1,0,133585,Troopers,"zVeers zzPiett zGideon zDark Trooper, Range Trooper",1
"Nova51",,,493458,Executrix,"Executrix Tie Adv, Emperor's Shuttle, TIE Reaper, Imperial TIE Fighter, Gauntlet Starfighter, FOSF TIE Fighter, FO TIE Fighter",1
"Nova51",,,130580,Disintegration,"zzAurra zzGreef zBoba zzBossk zzThe Mandalorian",1
"Nova51",1,1,140856,GAS,"zzzzGAS zRex zEcho (501st), zzFives zARC Trooper",1
"Nova51",1,1,143462,Revan Offense,"zzzJKR zzGMY zBS zJolee zzHYoda",1
"Nova51",1,1,76572,Ewoks,"zChirpa G9, Elder G9, zPaploo G9, Wicket G9, Logray G9",1
"Nova51",1,1,83706,Carth,"zCarth Onasi, zMission zZaalbar Juhani G8, zCanderous",1
"Nova51",0,1,123518,BH,"zzJango zDengar zIG-88 zZam zzEmbo",1
"Nova51",0,1,86790,Phoenix,"zHera G9, zKanan G9, zZeb G9, zSabine G9, zEzra",1
"Nova51",1,1,78543,Rogue1,"zzJyn G9, Chirrut G9, Baze G9, K-2SO G9, Cassian G9",1
"Nova51",1,0,70871,Jawas,"Nebit G8, Jawa Engineer G9, Jawa Scavenger G8, Jawa G9, Dathcha",1
"Nova51",0,1,109284,Geonosians Omicron,"zzGBA Sun Fac, Geo Soldier, Geo Spy, Poggle",0
"Nova51",,,97851,Mon Mothma,"zzMon Mothma, zKyle Katarn, Wedge G9, Biggs G9, Lando",0
"Nova51",,,79711,Iden Troopers,"zIden Versio, Shoretrooper Snowtrooper Magma G8, DT",0
"Nova51",,,92443,Bad Batch,"zHunter zEcho zzOmega G9, zTech zWrecker",0
"MrsCrow",,,121599,Phasma,"zPhasma zFOTP FOSFTP zFOST zKylo",1
"MrsCrow",1,1,146452,SL Kylo,"zzzzzzSL Kylo, Sith Trooper, zHux zzKRU Thrawn G8",1
"MrsCrow",0,1,73158,Phoenix,"Hera Kanan Chopper Zeb G8, Ezra G8",1
"MrsCrow",0,1,82181,BS,"zBS zGMY JKA Old Ben G8, Ahsoka",1
"MrsCrow",0,1,77448,Geonosians Omicron,"zzGBA 5* Sun Fac G8, Geo Soldier, Geo Spy G9, Poggle",0
"MrsCrow",1,1,44961,NS_Alt,"MT 6* G8, AV G8, Daka G9, Talia G8, Spirit 5* G8",0
"MrsCrow",1,1,61836,zEP,"EP Vader G8, Tarkin G8, Dooku 5* G8, TFP 6* G8",0
"MrsCrow",1,0,46871,Clones,"Cody 6* G8, Rex G8, Echo (501st) G8, Fives G8, Clone Sergeant G8",0
"MrsCrow",0,1,53175,BH,"Jango G6, Cad G8, Greedo G8, IG-88 6* G8, Boba G8",0
"MrsCrow",1,1,40020,Rogue1,"Jyn 5* G8, Chirrut 5* G8, Baze 5* G8, K-2SO G8, Cassian G8",0
"DragonMaster007",0,1,137505,padme,"zzPadme zGK zJKA zAhsoka zzC-3PO",1
"DragonMaster007",,,123468,Grievous Omicron,"zzGG zB2 zB1 zMagnaGuard zDroideka",1
"DragonMaster007",,,466641,Negotiator,"Negotiator BTL-B Y-wing, Anakin's Eta-2, Rex's ARC-170, Umbaran SF, Ahsoka's SF, Plo's SF, Clone Sergeant's ARC-170",1
"DragonMaster007",,,307940,HansMF,"Home One, Han's MF 5*, HT Ghost Phantom Biggs X-wing, Cassian's U-wing, Wedge X-wing",1
"DragonMaster007",1,0,129433,Traya,"zzTraya zDN zSion zDooku zThrawn",1
"DragonMaster007",1,1,156125,GAS,"zzzzGAS zRex zEcho (501st), zzFives zARC Trooper",1
"DragonMaster007",1,1,110519,Revan Offense,"zzzJKR zGMY BS zJolee HYoda",1
"DragonMaster007",1,1,82659,Ewoks,"zChirpa Elder Paploo Wicket Logray",1
"DragonMaster007",1,1,85519,Carth,"zCarth Onasi, Mission Zaalbar Juhani Canderous G8",1
"DragonMaster007",0,1,115485,BH,"zJango Dengar zZam Boba zEmbo",1
"DragonMaster007",0,1,69272,Phoenix,"Hera G8, Kanan G8, Zeb G8, Sabine G8, Ezra",1
"DragonMaster007",1,0,19869,NestSolo (Counter),"zNest",1
"DragonMaster007",,,155031,LV,"zzzzzzLord Vader, zzPiett 3* G9, zzzVader zRG Tarkin",0
"DragonMaster007",1,0,129907,CLS,"zzzCLS zHan zzChewbacca zzR2-D2 zChewpio 6*",0
"DragonMaster007",0,1,85663,Geonosians Omicron,"zGBA Sun Fac, Geo Soldier, Geo Spy, Poggle",0
"DragonMaster007",0,1,86781,BH,"Bossk 6* zThe Mandalorian, Aurra 5* Cad Greef",0
"DragonMaster007",1,0,61934,Troopers,"Veers 5* G9, Starck G7, Range Trooper 4*, zIden Versio 2* G8, Stormtrooper",0
"CT 5555",,,128526,Phasma,"zPhasma zFOTP FOSFTP zFOST zKylo",1
"CT 5555",1,1,165179,SL Kylo,"zzzzzzSL Kylo, zSith Trooper, zHux zzKRU zzThrawn",1
"CT 5555",,,444356,Negotiator,"Negotiator HT Anakin's Eta-2, Umbaran SF, Ahsoka's SF, BTL-B Y-wing, Clone Sergeant's ARC-170, Plo's SF",1
"CT 5555",0,1,122299,Geonosians Omicron,"zzGBA Sun Fac, Geo Soldier, Geo Spy, Poggle",1
"CT 5555",1,0,137350,Traya,"zzTraya zzDN zSion zDooku zzEP",1
"CT 5555",1,0,135587,Troopers,"zVeers zzPiett zzGideon zDark Trooper, Range Trooper",1
"CT 5555",0,1,121865,BH,"zzBossk zzJango zDengar zBoba zzGreef",1
"CT 5555",,,90869,Iden Troopers,"zIden Versio, Shoretrooper Snowtrooper Magma zDT",1
"CT 5555",0,1,78894,Phoenix,"Hera Kanan G9, Chopper Zeb G8, Ezra",1
"CT 5555",0,1,122655,padme,"zzPadme zGK zJKA zAhsoka Fives G1",0
"CT 5555",,,321097,Malevolence,"Malevolence Hyena Bomber 6*, Vulture Droid, Sun Fac SF, Soldier SF, Spy SF",0
"CT 5555",,,456363,Executrix,"Executrix Tie Adv, Emperor's Shuttle, TIE Reaper 4*, Imperial TIE Fighter, Gauntlet Starfighter, FOSF TIE Fighter, FO TIE Fighter",0
"CT 5555",1,0,87335,Wampa (Counter),"Rex G1, zzWampa zKrennic HYoda G1, FOO",0
"CT 5555",1,0,44470,Wiggs,"Wedge G1, Biggs G8, Han G1, Chewbacca G1, Leia G4",0
"Lex Naga",,,586225,Executor,"Executor HT RC Xanadu Blood, Slave I, IG-2000 Imperial TIE Fighter, Tie Adv",1
"Lex Naga",0,1,135713,padme,"zzPadme zGK zJKA zAhsoka zzzCAT",1
"Lex Naga",1,0,150523,CLS,"zzzCLS zHan zzChewbacca zC-3PO zChewpio",1
"Lex Naga",,,408457,Negotiator,"Negotiator BTL-B Y-wing 6*, Anakin's Eta-2, Rex's ARC-170, Umbaran SF, Ahsoka's SF, Plo's SF, Clone Sergeant's ARC-170",1
"Lex Naga",0,1,107217,DR,"zzzDR HK-47 G9, zBSF Sith Marauder, Sith Empire Trooper G8",1
"Lex Naga",,,376234,HansMF,"Home One, Han's MF, Rebel Y-wing, Ghost Phantom Biggs X-wing, Cassian's U-wing, Wedge X-wing",1
"Lex Naga",1,0,122975,Traya,"zzTraya zzDN Sion G8, zzEP zzThrawn",1
"Lex Naga",0,1,109689,Grievous-Wat,"zzGG zB2 zB1 MagnaGuard zWat Tambor",1
"Lex Naga",1,1,111463,JTR,"zzJTR Scav Rey, zBB-8 zR2-D2 Finn G9",1
"Lex Naga",,,102407,Mon Mothma,"zzMon Mothma, zCara Dune, Wedge Biggs Hoth Rebel Scout",1
"Lex Naga",,,124090,Disintegration,"Aurra zGreef G8, zBoba zzBossk The Mandalorian",1
"Lex Naga",1,1,75221,Ewoks,"zChirpa G9, Elder Paploo G9, Wicket Logray G9",1
"Lex Naga",1,0,129107,Troopers,"zVeers Starck zGideon zDark Trooper, zzPiett",1
"Lex Naga",0,1,93163,FO,"zzKRU zKylo FOO G8, zHux FOE",1
"Lex Naga",1,0,114786,Wampa (Counter),"zRex zzWampa Krennic Visas zHYoda",1
"Lex Naga",0,1,69114,Phoenix,"Hera G9, Kanan G8, Chopper G8, Zeb G8, Ezra",1
"Lex Naga",1,0,15666,NestSolo (Counter),"Nest",1
"Lex Naga",,,284266,Malevolence,"Malevolence Hyena Bomber 6*, Vulture Droid, Sun Fac SF, Soldier SF, Spy SF",0
"Lex Naga",0,1,93778,Geonosians Omicron,"zzGBA Sun Fac, Geo Soldier, Geo Spy, Poggle",0
"Lex Naga",,,71651,Iden Troopers,"zIden Versio, Shoretrooper G8, Snowtrooper G8, Magma G7, DT",0
"Lex Naga",0,1,126404,BH,"Jango zFennec Shand, zDengar Cad Greedo",0
"CT 7567",,,128569,Phasma,"zPhasma zFOTP FOSFTP zFOST zKylo",1
"CT 7567",1,1,165472,SL Kylo,"zzzzzzSL Kylo, zSith Trooper, zHux zzKRU zzThrawn",1
"CT 7567",,,444493,Negotiator,"Negotiator HT Anakin's Eta-2, Umbaran SF, Ahsoka's SF, BTL-B Y-wing, Clone Sergeant's ARC-170, Plo's SF",1
"CT 7567",0,1,122507,Geonosians Omicron,"zzGBA Sun Fac, Geo Soldier, Geo Spy, Poggle",1
"CT 7567",1,0,137422,Traya,"zzTraya zzDN zSion zDooku zzEP",1
"CT 7567",1,0,135819,Troopers,"zVeers zzPiett zzGideon zDark Trooper, Range Trooper",1
"CT 7567",0,1,121252,BH,"zzBossk zzJango zDengar zBoba zzGreef",1
"CT 7567",,,90711,Iden Troopers,"zIden Versio, Shoretrooper Snowtrooper Magma zDT",1
"CT 7567",0,1,78847,Phoenix,"Hera Kanan G9, Chopper Zeb G8, Ezra",1
"CT 7567",0,1,122864,padme,"zzPadme zGK zJKA zAhsoka Fives G1",0
"CT 7567",,,322240,Malevolence,"Malevolence Hyena Bomber 6*, Vulture Droid, Sun Fac SF, Soldier SF, Spy SF",0
"CT 7567",,,461913,Executrix,"Executrix Tie Adv, Emperor's Shuttle, TIE Reaper 4*, Imperial TIE Fighter, Gauntlet Starfighter, FOSF TIE Fighter, FO TIE Fighter",0
"CT 7567",1,0,87960,Wampa (Counter),"Rex G1, zzWampa zKrennic HYoda G1, FOO",0
"Willy",0,1,120794,padme,"zzPadme zGK zJKA zAhsoka zzC-3PO",1
"Willy",0,1,102320,DRMalak,"zzzDR zHK-47 G9, zBSF zzMalak 6* zThrawn G9",1
"Willy",,,476226,Negotiator,"Negotiator HT Anakin's Eta-2, Umbaran SF, Ahsoka's SF, Clone Sergeant's ARC-170, Plo's SF, Rex's ARC-170",1
"Willy",,,305081,HansMF,"Home One, Han's MF 6*, Biggs X-wing, Bistan's U-wing, Phantom Ghost Cassian's U-wing, Wedge X-wing",1
"Willy",0,1,118065,Grievous,"zGG zB2 zB1 zMagnaGuard zNute",1
"Willy",1,1,123994,Revan Offense,"zzzJKR zzGMY zBS zJolee HYoda",1
"Willy",1,1,93110,Ewoks,"zChirpa Elder zPaploo zWicket zLogray",1
"Willy",1,0,123206,ShaakClones,"zzShaak Ti, zRex zEcho (501st), zzFives zARC Trooper",1
"Willy",0,1,129864,BH,"zzBossk zzJango zDengar Cad zBoba",1
"Willy",1,1,90672,Carth,"zCarth Onasi, zMission zZaalbar zJuhani zCanderous",1
"Willy",0,1,70344,Phoenix,"Hera G9, Kanan G8, Chopper Zeb G8, Ezra G8",1
"Willy",,,67724,Phasma,"zPhasma G8, FOTP G7, FOSFTP G9, KRU G8, Kylo G9",0
"Willy",0,1,96776,Geonosians Omicron,"zzGBA Sun Fac, Geo Soldier, Geo Spy, Poggle",0
"Willy",1,1,61327,JTR,"JTR G6, Scav Rey G8, BB-8 G9, R2-D2 G9, Finn G9",0
"Willy",1,1,76261,NS_Alt,"MT G8, zAV zDaka G9, Talia G7, Zombie",0
"Willy",1,1,91375,zEP,"zEP zzzVader Tarkin TFP Mara Jade, The Emperor's Hand 6* G5",0
"Willy",1,0,88399,CLS,"CLS Han Leia Old Ben, zChewbacca",0
"Drew Rosario",0,1,69763,Phoenix,"zHera Kanan Chopper Zeb Ezra",1
"Drew Rosario",,,44753,Grievous Omicron,"GG 5* B2 6* G9, B1 4* G9, MagnaGuard G9, Droideka 5* G9",0
"J48W",,,566436,Executor,"Executor 5* HT RC Xanadu Blood, Slave I, IG-2000 Imperial TIE Fighter, Tie Adv",1
"J48W",0,1,142013,padme,"zzPadme zGK zJKA zAhsoka zzC-3PO",1
"J48W",0,1,115709,DRMalak,"zzDR zHK-47 zBSF zzMalak Sith Empire Trooper",1
"J48W",,,125742,Grievous Omicron,"zzGG zB2 zB1 zMagnaGuard zDroideka",1
"J48W",,,512392,Negotiator,"Negotiator BTL-B Y-wing, Anakin's Eta-2, Rex's ARC-170, Umbaran SF, Ahsoka's SF, Plo's SF, Clone Sergeant's ARC-170",1
"J48W",,,320158,Malevolence,"Malevolence Hyena Bomber, Vulture Droid, Sun Fac SF, Soldier SF, Spy SF",1
"J48W",0,1,97644,Geonosians Omicron,"zGBA Sun Fac, Geo Soldier, Geo Spy, Poggle",1
"J48W",,,330820,HansMF,"Home One, Han's MF, Rebel Y-wing, Ghost Phantom Biggs X-wing, Cassian's U-wing, Wedge X-wing",1
"J48W",1,1,138142,GAS,"zzzzGAS zRex zEcho (501st), zzFives zARC Trooper",1
"J48W",1,1,83698,Ewoks,"zChirpa Elder Paploo Wicket Logray",1
"J48W",0,1,143301,BH,"zzBossk zJango Dengar Cad zBoba",1
"J48W",1,1,90662,Carth,"zCarth Onasi, zMission zZaalbar Juhani G8, Canderous",1
"J48W",1,0,114446,Troopers,"zVeers zStarck Gideon zDark Trooper, zzPiett",1
"J48W",1,0,16404,NestSolo (Counter),"Nest",1
"J48W",,,78783,Phasma,"Phasma FOTP FOSFTP FOST 6* G8, Kylo",0
"J48W",1,0,107132,CLS,"zzzCLS zHan zzChewbacca R2-D2 G7, zChewpio",0
"J48W",1,1,78939,NS,"MT zAV Daka Zombie Spirit G2",0
"J48W",1,1,121391,Revan Offense,"zzzJKR zGMY zBS zJolee HYoda 5*",0
"J48W",1,1,104766,zEP,"EP zzVader Tarkin TFP Sith Trooper G8",0
"J48W",1,0,60652,Wiggs,"Wedge G8, Biggs Fulcrum G7, Ezra G7, Leia G8",0
"J48W",,,72806,Bad Batch,"Hunter G9, Echo G9, Omega G9, Tech G9, Wrecker G8",0
"Giran Kenor Twitchin",,,178882,JMK,"zzzzzzJMK zAhsoka zzzCAT zzzzGAS zGK",1
"Giran Kenor Twitchin",,,176997,SEE,"zzzzzzSEE zBSF zzMalak zzzDR zzzVader",1
"Giran Kenor Twitchin",,,586961,Executor,"Executor HT RC Xanadu Blood, Slave I, IG-2000 Imperial TIE Fighter, Tie Adv",1
"Giran Kenor Twitchin",,,127195,Grievous Omicron,"zzGG zB2 zB1 MagnaGuard zDroideka",1
"Giran Kenor Twitchin",,,512615,Negotiator,"Negotiator BTL-B Y-wing, Anakin's Eta-2, Rex's ARC-170, Umbaran SF, Ahsoka's SF, Plo's SF, Clone Sergeant's ARC-170",1
"Giran Kenor Twitchin",,,319489,Malevolence,"Malevolence Hyena Bomber, Vulture Droid, Sun Fac SF, Soldier SF, Spy SF",1
"Giran Kenor Twitchin",,,417838,HansMF,"Home One, Han's MF, Rebel Y-wing, Bistan's U-wing, Phantom Ghost Cassian's U-wing, Biggs X-wing",1
"Giran Kenor Twitchin",1,0,111326,Traya,"zzTraya DN zSion Sith Empire Trooper, zThrawn",1
"Giran Kenor Twitchin",1,0,131309,Troopers,"zVeers zzPiett zzGideon zDark Trooper, Range Trooper",1
"Giran Kenor Twitchin",,,111552,Mon Mothma,"Mon Mothma, Bistan Wedge zCassian Biggs",1
"Giran Kenor Twitchin",1,1,143181,Revan Offense,"zzzJKR zGMY zzHYoda zJolee zJKA",1
"Giran Kenor Twitchin",1,1,78052,Ewoks,"zChirpa G9, Elder Paploo Wicket Logray G9",1
"Giran Kenor Twitchin",1,0,140738,ShaakClones,"zzShaak Ti, zRex zEcho (501st), zzFives zARC Trooper",1
"Giran Kenor Twitchin",0,1,146488,BH,"zzBossk zzJango Dengar zIG-88 zBoba",1
"Giran Kenor Twitchin",0,1,76514,Phoenix,"Hera Kanan G8, Chopper G8, Zeb G8, Ezra G9",1
"Giran Kenor Twitchin",1,0,111023,EP (Counter, Rebel),"zzEP Shoretrooper Krennic DT G9, zzWampa",1
"Giran Kenor Twitchin",,,39197,Phasma,"Phasma G1, FOTP G1, FOSFTP G1, KRU G2, Kylo G1",0
"Giran Kenor Twitchin",1,0,74571,CLS,"CLS G6, zHan zzChewbacca R2-D2 G8, Chewpio G1",0
"Giran Kenor Twitchin",0,1,104771,Geonosians Omicron,"zzGBA Sun Fac, Geo Soldier, Geo Spy, Poggle",0
"Giran Kenor Twitchin",1,1,68946,NS,"MT G6, AV Daka G9, Zombie G8, Spirit G7",0
"Giran Kenor Twitchin",1,1,81726,Carth,"zCarth Onasi, Mission Zaalbar Juhani G7, Canderous",0
"Łord Thragg",,,172172,JMK,"zzzzzzJMK zAhsoka zzzCAT zzzzGAS zGK",1
"Łord Thragg",1,1,167812,SL Kylo,"zzzzzzSL Kylo, zSith Trooper, zHux zzKRU zThrawn",1
"Łord Thragg",,,587156,Executor,"Executor HT RC Xanadu Blood, Slave I, IG-2000 Imperial TIE Fighter, Tie Adv",1
"Łord Thragg",1,0,143676,CLS,"zzzCLS zHan zzChewbacca zzC-3PO zChewpio",1
"Łord Thragg",0,1,119573,DRMalak,"zzzDR zHK-47 zBSF zzMalak Sith Empire Trooper",1
"Łord Thragg",1,1,117500,NestSisters,"zzAV zzMT zDaka Zombie zNest",1
"Łord Thragg",,,498814,Negotiator,"Negotiator BTL-B Y-wing, Anakin's Eta-2, Rex's ARC-170, Umbaran SF, Ahsoka's SF, Plo's SF, Clone Sergeant's ARC-170",1
"Łord Thragg",,,327271,Malevolence,"Malevolence Hyena Bomber, Vulture Droid, Sun Fac SF, Soldier SF, Spy SF",1
"Łord Thragg",,,139873,JKL,"zzJKL zzzJKR zzHYoda zzOld Ben, Aayla",1
"Łord Thragg",,,420009,HansMF,"Home One, Han's MF, Rebel Y-wing, Bistan's U-wing, Phantom Biggs X-wing, Cassian's U-wing, Wedge X-wing",1
"Łord Thragg",0,1,122942,Grievous,"zzGG zB2 zB1 MagnaGuard zNute",1
"Łord Thragg",1,1,123558,JTR,"zzzJTR Scav Rey, zzBB-8 zzR2-D2 RT",1
"Łord Thragg",1,0,125009,Traya,"zzTraya zDN zSion zDooku zzEP",1
"Łord Thragg",1,0,137990,ShaakClones,"zzShaak Ti, zRex zEcho (501st), zzFives zARC Trooper",1
"Łord Thragg",0,1,149353,BH,"zzBossk zzJango zDengar zIG-88 zBoba",1
"Łord Thragg",1,1,85286,Ewoks,"zChirpa Elder Paploo Teebo G9, Scout",1
"Łord Thragg",1,1,83204,Carth,"Carth Onasi, Mission Zaalbar Juhani G8, Canderous",1
"Łord Thragg",0,1,71297,Phoenix,"Hera Kanan G8, Zeb G8, Sabine G8, Ezra",1
"Łord Thragg",,,120886,Phasma,"zPhasma FOTP FOSFTP zFOST zKylo",0
"Łord Thragg",0,1,107200,Geonosians Omicron,"zzGBA Sun Fac, Geo Soldier, Geo Spy, Poggle",0
"Łord Thragg",1,0,87548,Troopers,"zVeers zzPiett zGideon 4* G9, zDark Trooper 4* G9, Range Trooper 4* G7",0
"Łord Thragg",,,110766,Mon Mothma,"zzMon Mothma, zKyle Katarn, Wedge Biggs Lando",0
"Łord Thragg",1,1,69231,Rogue1,"Jyn G8, Chirrut G8, Baze 6* G8, zK-2SO G8, zCassian G9",0
"Łord Thragg",,,64444,Bad Batch,"zHunter 4* G9, zEcho 4* G9, Omega 4* G8, zTech 5* G9, zWrecker 4* G8",0
