Player,Offense,Defense,GP,Name,Squad,Viable
"Vaders Fist",0,1,133058,BH,"zzJango zDengar IG-88 zEmbo zNest",1
"Vaders Fist",0,1,99750,Phoenix,"zHera Zeb G9, zEzra zSabine Kanan",1
"Vaders Fist",1,1,104849,Rogue1,"zzJyn Chirrut Baze K-2SO G9, zCassian",1
"Vaders Fist",1,0,67738,Jawas,"Nebit G8, Jawa Engineer, Jawa Scavenger G9, Jawa G9, Dathcha",1
"Vaders Fist",,,82269,Iden Troopers,"zIden Versio 5*, Shoretrooper Snowtrooper Magma G7, DT",0
"Schmuckk007",,,123218,Phasma,"zPhasma zFOTP FOSFTP zFOST zKylo",1
"Schmuckk007",,,140522,SK,"zzEP zzMara Jade, The Emperor's Hand, zzStarkiller zJuhani zVisas",1
"Schmuckk007",1,1,156796,SL Kylo,"zzzzzzSL Kylo, zSith Trooper, zHux zzKRU zThrawn",1
"Schmuckk007",,,161030,SEE,"zzzzzzSEE zBSF zzMalak zzzDR zDooku",1
"Schmuckk007",0,1,98147,Qira,"zQira L3-37 zVandor Chewbacca, zMission zZaalbar",1
"Schmuckk007",1,1,105292,NS,"zzMT zzAV zDaka Zombie Spirit",1
"Schmuckk007",1,0,138519,CLS,"zzzCLS zHan zzChewbacca zC-3PO zChewpio",1
"Schmuckk007",0,1,121831,padme,"zzPadme zGK zJKA zAhsoka CW Chewbacca G8",1
"Schmuckk007",,,458732,Negotiator,"Negotiator BTL-B Y-wing, Anakin's Eta-2, Rex's ARC-170, Umbaran SF, Ahsoka's SF, Plo's SF, Clone Sergeant's ARC-170",1
"Schmuckk007",,,317424,Malevolence,"Malevolence Hyena Bomber, Vulture Droid, Sun Fac SF, Soldier SF, Spy SF",1
"Schmuckk007",,,445845,HansMF,"Home One, Han's MF, Rebel Y-wing, Bistan's U-wing, Phantom Ghost Cassian's U-wing, Biggs X-wing",1
"Schmuckk007",0,1,102493,Geonosians,"zzGBA Sun Fac, Geo Soldier, Geo Spy, Poggle",1
"Schmuckk007",0,1,128252,Grievous,"zzGG zB2 zB1 zMagnaGuard zNute",1
"Schmuckk007",1,0,110337,Traya,"zzTraya zDN zSion Sith Empire Trooper, zNest",1
"Schmuckk007",1,1,102725,JTR,"zzJTR zScav Rey, zzBB-8 zzR2-D2 Finn",1
"Schmuckk007",1,0,107997,Troopers,"zVeers zzPiett zGideon zDark Trooper, Range Trooper",1
"Schmuckk007",,,462898,Executrix,"Executrix Tie Adv, Emperor's Shuttle, TIE Reaper, Imperial TIE Fighter, Gauntlet Starfighter, FOSF TIE Fighter, FO TIE Fighter",1
"Schmuckk007",,,106315,Disintegration,"Aurra zzGreef zBoba zzBossk The Mandalorian G8",1
"Schmuckk007",1,1,145051,GAS,"zzzzGAS zRex zEcho (501st), zzFives zARC Trooper",1
"Schmuckk007",1,1,125497,Revan Offense,"zzzJKR zzGMY zzHYoda zJolee zEzra",1
"Schmuckk007",1,1,86102,Ewoks,"zChirpa Elder Paploo Wicket Logray",1
"Schmuckk007",0,1,113332,BH,"zzJango zFennec Shand, zZam Dengar zEmbo",1
"Schmuckk007",0,1,104581,Phoenix,"zHera zZeb Chopper zSabine zKanan",1
"Schmuckk007",1,1,88460,Rogue1,"zJyn Chirrut Baze K-2SO Cassian",1
"Schmuckk007",1,0,110943,zMaul,"zDarth Maul, zSidious Sith Assassin, Savage Sith Marauder",1
"Schmuckk007",1,0,65825,Jawas,"Nebit G8, Jawa Engineer, Jawa Scavenger G8, Jawa Dathcha G9",1
"Schmuckk007",,,95189,Mon Mothma,"zzMon Mothma G8, Biggs Lando zKyle Katarn, Cara Dune",0
"Schmuckk007",,,69166,Iden Troopers,"Iden Versio G7, Shoretrooper Snowtrooper Magma G9, DT",0
"Schmuckk007",,,68178,Bad Batch,"Hunter Echo Omega G7, Tech Wrecker",0
"Daddygamin2",,,182768,JMK,"zzzzzzJMK zAhsoka zzzCAT zzzzGAS zGK",1
"Daddygamin2",,,182866,LV,"zzzzzzLord Vader, zzPiett zzzMaul zRG zzzVader",1
"Daddygamin2",,,125817,Phasma,"zPhasma zFOTP FOSFTP zFOST zKylo",1
"Daddygamin2",,,433773,Profundity,"Profundity Han's MF, Outrider Rebel Y-wing, Cassian's U-wing, Ghost",1
"Daddygamin2",1,1,165173,SL Kylo,"zzzzzzSL Kylo, zSith Trooper, zHux zzKRU zzThrawn",1
"Daddygamin2",,,172185,SEE,"zzzzzzSEE zBSF zzMalak zzzDR zDooku",1
"Daddygamin2",1,1,166541,GL Rey,"zzzzzzRey zzzJTR zzBB-8 zRH Poe, zRH Finn",1
"Daddygamin2",,,158416,Jabba,"zzzzzzJabba zBoushh (Leia Organa), zSkiff Guard (Lando Calrissian), zKrrsantan zBoba",1
"Daddygamin2",0,1,97687,Qira,"Qira zL3-37 zVandor Chewbacca, zMission zZaalbar",1
"Daddygamin2",1,1,122801,NS,"zzMT zzAV zDaka Zombie Spirit",1
"Daddygamin2",,,622709,Executor,"Executor HT RC Xanadu Blood, Slave I, IG-2000 Tie Adv, TIE Reaper",1
"Daddygamin2",,,165688,JMLS,"zBS zzzzzzJMLS zWat Tambor, zzJKL zJolee",1
"Daddygamin2",1,0,157950,CLS,"zzzCLS zHan zzChewbacca zzC-3PO zChewpio",1
"Daddygamin2",,,530595,Negotiator,"Negotiator BTL-B Y-wing, Anakin's Eta-2, Rex's ARC-170, Umbaran SF, Ahsoka's SF, Plo's SF, Clone Sergeant's ARC-170",1
"Daddygamin2",,,336851,Malevolence,"Malevolence Hyena Bomber, Vulture Droid, Sun Fac SF, Soldier SF, Spy SF",1
"Daddygamin2",0,1,111979,Geonosians,"zzGBA Sun Fac, Geo Soldier, Geo Spy, Poggle",1
"Daddygamin2",0,1,136068,Grievous,"zzGG zB2 zB1 MagnaGuard zNute",1
"Daddygamin2",1,0,134968,Traya,"zzTraya zDN zSion zzEP Sith Empire Trooper",1
"Daddygamin2",,,111738,Mon Mothma,"zzMon Mothma, zPao Scarif Hoth Rebel Scout, zCara Dune",1
"Daddygamin2",1,1,86985,Ewoks,"zChirpa Elder Paploo Wicket Logray",1
"Daddygamin2",1,0,152103,ShaakClones,"zzShaak Ti, zRex zEcho (501st), zzFives zARC Trooper",1
"Daddygamin2",0,1,154709,BH,"zzBossk zFennec Shand, zZam zDengar zzJango",1
"Daddygamin2",1,0,125379,Troopers,"zVeers zStarck zDark Trooper, zStormtrooper zIden Versio",1
"Daddygamin2",0,1,93919,Phoenix,"zHera Zeb G8, zEzra zSabine Kanan G9",1
"Daddygamin2",1,1,103832,Rogue1,"zzJyn Chirrut G8, Baze G8, K-2SO G9, zCassian",1
"Daddygamin2",,,131179,Bad Batch,"zHunter zEcho zzOmega zTech zWrecker",1
"Daddygamin2",1,0,25887,NestSolo (Counter),"zNest",1
"Daddygamin2",1,0,74928,Jawas,"Nebit G8, Jawa Engineer G8, Jawa Scavenger G8, Jawa Dathcha G7",0
"Flyt",,,171762,JMK,"zzzzzzJMK zAhsoka zzzCAT zzzzGAS zGK",1
"Flyt",,,170294,SEE,"zzzzzzSEE zBSF zzMalak zzzDR zzzVader",1
"Flyt",,,560125,Executor,"Executor HT RC Xanadu Blood, Slave I, IG-2000 Imperial TIE Fighter, Tie Adv",1
"Flyt",1,0,144161,CLS,"zzzCLS zHan zzChewbacca zzC-3PO zChewpio",1
"Flyt",,,320673,Malevolence,"Malevolence Hyena Bomber, Vulture Droid, Sun Fac SF, Soldier SF, Spy SF",1
"Flyt",1,1,108936,NS_Alt,"zzMT zzAV Talia Zombie zDaka",1
"Flyt",,,135315,JKL,"zzJKL zzzJKR zHYoda Old Ben, Aayla",1
"Flyt",,,381940,HansMF,"Home One, Han's MF, Rebel Y-wing, Ghost Phantom Biggs X-wing, Cassian's U-wing, Wedge X-wing",1
"Flyt",0,1,102505,Geonosians,"zzGBA Sun Fac, Geo Soldier, Geo Spy, Poggle",1
"Flyt",0,1,130650,Grievous,"zzGG zB2 zB1 zMagnaGuard zNute",1
"Flyt",,,112269,Mon Mothma,"zzMon Mothma, zPao Hoth Rebel Scout, Wedge zCara Dune",1
"Flyt",1,1,74972,Ewoks,"zChirpa G9, Elder Paploo G9, Wicket Logray G9",1
"Flyt",1,0,142443,ShaakClones,"zzShaak Ti, zRex zEcho (501st), zzFives zARC Trooper",1
"Flyt",0,1,141960,BH,"zzBossk Cad Dengar zJango zBoba",1
"Flyt",1,1,80251,Carth,"zCarth Onasi, zMission zZaalbar Juhani G8, Canderous",1
"Flyt",1,0,119044,Troopers,"zVeers zStarck zDark Trooper, zzPiett DT",1
"Flyt",0,1,60806,Phoenix,"Hera G8, Zeb G8, Ezra G8, Sabine G8, Kanan G8",1
"Flyt",1,0,106906,Thragma (Counter),"zThrawn Magma Krennic Tarkin Stormtrooper",1
"Flyt",1,1,50717,Rogue1,"Jyn G8, Chirrut G8, Baze G8, K-2SO G8, Cassian G8",1
"Flyt",1,0,103909,EP (Counter, Rebel),"zzEP Shoretrooper G8, zzWampa Nest G9, Range Trooper",1
"Flyt",,,48218,Phasma,"Phasma G8, FOTP G2, FOSFTP G1, FOST 5* G8, Kylo G8",0
"Flyt",,,505636,Negotiator,"Negotiator BTL-B Y-wing 5*, Anakin's Eta-2, Rex's ARC-170, Umbaran SF, Ahsoka's SF, Plo's SF, Clone Sergeant's ARC-170",0
"Flyt",1,0,114800,Traya,"zzTraya DN zSion 5* zDooku Sith Empire Trooper",0
"Flyt",1,1,93133,JTR,"JTR Scav Rey G8, BB-8 G8, R2-D2 Finn G8",0
"Al Greaf",1,1,160973,GL Rey,"zzzzzzRey zzzJTR zzBB-8 zRH Poe, zRH Finn",1
"Al Greaf",,,570992,Executor,"Executor 5* HT RC Xanadu Blood, Slave I, IG-2000 Imperial TIE Fighter, Tie Adv",1
"Al Greaf",1,0,149436,CLS,"zzzCLS zHan zzChewbacca zzC-3PO zChewpio",1
"Al Greaf",,,378719,HansMF,"Home One, Han's MF, Rebel Y-wing, Ghost Phantom Biggs X-wing, Cassian's U-wing, Wedge X-wing",1
"Al Greaf",0,1,95610,Geonosians,"zGBA Sun Fac, Geo Soldier, Geo Spy, Poggle",1
"Al Greaf",0,1,107064,Grievous,"zzGG B2 zB1 zDroideka MagnaGuard",1
"Al Greaf",1,1,117869,Revan,"zzzJKR BS G8, zGMY zJolee zGK",1
"Al Greaf",1,1,90726,Ewoks,"zChirpa G9, Elder Paploo zWicket Logray",1
"Al Greaf",1,0,136046,ShaakClones,"zzShaak Ti, zRex zEcho (501st), zzFives zARC Trooper",1
"Al Greaf",0,1,137981,BH,"zzBossk Cad Dengar IG-88 zBoba",1
"Al Greaf",1,1,115969,zEP,"zEP zzzVader Tarkin TFP zBSF",1
"Al Greaf",0,1,62719,Phoenix,"Hera G8, Zeb G8, Ezra Chopper G8, Kanan G8",1
"Al Greaf",,,62465,Phasma,"Phasma G8, FOE G9, FOO KRU G8, Kylo G8",0
"Al Greaf",1,0,97230,Troopers,"zVeers zzPiett Gideon G8, Dark Trooper, Range Trooper G9",0
"Al Greaf",,,66162,Nute-OR,"Nute Dooku G8, Jango Zaalbar G8, Mission G7",0
"Al Greaf",1,1,62821,NS,"MT G8, AV G8, Daka G8, Zombie G8, Spirit G8",0
"Al Greaf",,,99870,Mon Mothma,"Mon Mothma, Wedge Biggs Lando Cara Dune G8",0
"Al Greaf",1,1,45149,Rogue1,"Jyn 5* G8, Chirrut 6* G8, Baze 6* G8, K-2SO G8, Cassian G8",0
"Anton360247",0,1,155787,padme,"zzPadme zGK zJKA zAhsoka zzC-3PO",1
"Anton360247",1,1,102554,NestSisters,"zzAV zzMT zDaka Zombie zNest",1
"Anton360247",,,523211,Negotiator,"Negotiator BTL-B Y-wing 6*, Anakin's Eta-2, Rex's ARC-170, Umbaran SF, Ahsoka's SF, Plo's SF, Clone Sergeant's ARC-170",1
"Anton360247",0,1,95467,DR,"zzzDR zzHK-47 zBSF Sith Empire Trooper G9, Sith Assassin G9",1
"Anton360247",,,314328,Malevolence,"Malevolence Hyena Bomber, Vulture Droid, Sun Fac SF, Soldier SF, Spy SF",1
"Anton360247",,,524352,HansMF,"Home One, Han's MF, Rebel Y-wing, Bistan's U-wing, Phantom Biggs X-wing, Cassian's U-wing, Wedge X-wing",1
"Anton360247",0,1,112588,Geonosians,"zzGBA Sun Fac, Geo Soldier, Geo Spy, Poggle",1
"Anton360247",0,1,104327,Grievous,"zzGG zB2 zB1 zMagnaGuard zNute",1
"Anton360247",1,0,139880,Traya,"zzTraya zzDN zSion zzEP zzThrawn",1
"Anton360247",,,492733,Executrix,"Executrix Tie Adv, Emperor's Shuttle, TIE Reaper, Imperial TIE Fighter, Gauntlet Starfighter, FOSF TIE Fighter, FO TIE Fighter",1
"Anton360247",1,1,119195,Revan Offense,"zzzJKR zzGMY zBS zJolee zEzra",1
"Anton360247",1,1,91916,Ewoks,"zChirpa Elder zPaploo zWicket zLogray",1
"Anton360247",1,0,150037,ShaakClones,"zzShaak Ti, zRex zEcho (501st), zzFives zARC Trooper",1
"Anton360247",0,1,114840,BH,"zzBossk zDengar zzJango zGreedo zBoba",1
"Anton360247",1,1,93163,Carth,"zCarth Onasi, zMission G8, zZaalbar G8, zJuhani zCanderous",1
"Anton360247",1,0,129343,Troopers,"zVeers zStarck zzPiett zDT zzGideon",1
"Anton360247",1,0,146873,CLS,"zzzCLS zHan Wedge Biggs zzChewbacca",1
"Anton360247",0,1,98863,Phoenix,"zHera zZeb Chopper zSabine zKanan",1
"Anton360247",0,1,93639,FO,"zzKRU zKylo FOO zFOST G8, zPhasma",1
"Anton360247",1,1,84373,Rogue1,"zzJyn G8, Chirrut Baze G9, K-2SO G9, zCassian",1
"Anton360247",1,0,72380,Jawas,"Nebit G8, Jawa Engineer, Jawa Scavenger G8, Jawa Dathcha G9",1
"Anton360247",,,100779,Mon Mothma,"zzMon Mothma G9, Bistan Scarif Hoth Rebel Scout, zCara Dune",0
"Curren",,,168706,JMK,"zzzzzzJMK zAhsoka zzzCAT zzzzGAS zGK",1
"Curren",,,127266,Phasma,"zPhasma zFOTP FOSFTP zFOST zKylo",1
"Curren",1,1,159791,SL Kylo,"zzzzzzSL Kylo, zSith Trooper, zHux zzKRU zThrawn",1
"Curren",0,1,91026,Qira,"Qira L3-37 zVandor Chewbacca, Mission Zaalbar",1
"Curren",1,1,108641,NS,"zzMT zzAV zDaka Zombie Spirit",1
"Curren",,,582643,Executor,"Executor 6* HT RC Xanadu Blood, Slave I, IG-2000 Imperial TIE Fighter, Tie Adv",1
"Curren",0,1,125035,DRMalak,"zzzDR HK-47 zBSF zzMalak Sith Empire Trooper",1
"Curren",1,0,127004,CLS,"zzzCLS zHan zzChewbacca zzC-3PO zChewpio",1
"Curren",,,507525,Negotiator,"Negotiator BTL-B Y-wing, Anakin's Eta-2, Rex's ARC-170, Umbaran SF, Ahsoka's SF, Plo's SF, Clone Sergeant's ARC-170",1
"Curren",,,307231,Malevolence,"Malevolence Hyena Bomber, Vulture Droid, Sun Fac SF, Soldier SF, Spy SF",1
"Curren",,,381324,HansMF,"Home One, Han's MF, Rebel Y-wing, Bistan's U-wing, Phantom Ghost Cassian's U-wing, Biggs X-wing",1
"Curren",0,1,92111,Geonosians,"zzGBA Sun Fac, Geo Soldier, Geo Spy, Poggle",1
"Curren",0,1,129874,Grievous,"zzGG zB2 zB1 zMagnaGuard zNute",1
"Curren",1,0,132198,Traya,"zzTraya DN zSion zDooku zzEP",1
"Curren",1,0,118597,Troopers,"zVeers zzPiett zGideon zDark Trooper, Range Trooper",1
"Curren",1,1,140098,Revan Offense,"zzzJKR zGMY zHYoda zJolee zJKA",1
"Curren",1,1,82792,Ewoks,"zChirpa Elder Paploo Wicket Logray",1
"Curren",1,0,138848,ShaakClones,"zzShaak Ti, zRex zEcho (501st), zzFives zARC Trooper",1
"Curren",0,1,152610,BH,"zzBossk zDengar zzJango zIG-88 zBoba",1
"Curren",,,88215,Iden Troopers,"zIden Versio, Shoretrooper Snowtrooper Magma DT",1
"Curren",0,1,69370,Phoenix,"Hera G8, Zeb G8, Ezra Sabine G8, Kanan G8",1
"Curren",1,1,70323,Rogue1,"Jyn G8, Chirrut G8, Baze G8, K-2SO G8, Cassian G9",1
"Curren",,,107071,Mando,"zzThe Mandalorian (Beskar Armor), zDash Rendar, zNest zIG-11 zKuiil",1
"Curren",,,86627,Mon Mothma,"Mon Mothma G8, Wedge Biggs Lando zCara Dune",0
"Curren",,,69969,Bad Batch,"Hunter G9, Echo G9, Omega 6* G8, Tech G9, Wrecker G8",0
"RP",,,166299,JMK,"zzzzzzJMK zAhsoka zzzCAT zzzzGAS zGK",1
"RP",,,115124,Phasma,"zPhasma zFOTP zSith Trooper, zzKRU zKylo",1
"RP",0,1,100250,Qira,"zQira zL3-37 zVandor Chewbacca, zMission zZaalbar",1
"RP",1,1,106154,NS,"zzMT zzAV zDaka Zombie Spirit",1
"RP",,,575538,Executor,"Executor 6* HT RC Xanadu Blood, Slave I, IG-2000 Imperial TIE Fighter, Tie Adv",1
"RP",,,153793,JMLS,"zBS zzzzzzJMLS zWat Tambor, zzJKL zJolee",1
"RP",1,0,147249,CLS,"zzzCLS zHan zzChewbacca zC-3PO zChewpio",1
"RP",0,1,134503,DRMalak,"zzzDR zzHK-47 zBSF zzMalak Sith Empire Trooper",1
"RP",,,507356,Negotiator,"Negotiator BTL-B Y-wing, Anakin's Eta-2, Rex's ARC-170, Umbaran SF, Ahsoka's SF, Plo's SF, Clone Sergeant's ARC-170",1
"RP",,,315832,Malevolence,"Malevolence Hyena Bomber, Vulture Droid, Sun Fac SF, Soldier SF, Spy SF",1
"RP",,,497575,HansMF,"Home One, Han's MF, Rebel Y-wing, Bistan's U-wing, Phantom Ghost Cassian's U-wing, Wedge X-wing",1
"RP",0,1,98789,Geonosians,"zzGBA Sun Fac, Geo Soldier, Geo Spy, Poggle",1
"RP",0,1,131138,Grievous,"zzGG zB2 zB1 zMagnaGuard zNute",1
"RP",1,0,126315,Traya,"zzTraya DN zSion zzEP zzThrawn",1
"RP",1,1,124396,JTR,"zzzJTR Scav Rey, zzBB-8 zzR2-D2 Finn",1
"RP",,,99923,Mon Mothma,"zzMon Mothma, zPao Scarif Hoth Rebel Scout, zCara Dune",1
"RP",1,0,117579,Troopers,"zVeers zzPiett zzGideon zDark Trooper, Range Trooper",1
"RP",,,131889,Disintegration,"Aurra zzGreef zBoba zzBossk zzThe Mandalorian",1
"RP",1,1,96259,Ewoks,"zChirpa Elder zPaploo zWicket zLogray",1
"RP",1,0,143479,ShaakClones,"zzShaak Ti, zRex zEcho (501st), zzFives zARC Trooper",1
"RP",0,1,143535,BH,"zzJango zFennec Shand, zDengar zIG-88 zGreedo",1
"RP",,,91191,Iden Troopers,"zIden Versio, zStormtrooper Snowtrooper Magma DT",1
"RP",0,1,101364,Phoenix,"zHera zZeb Ezra zSabine zKanan",1
"RP",1,1,111222,Rogue1,"zzJyn Chirrut Baze K-2SO zCassian",1
"RP",1,0,97439,zMaul,"zDarth Maul, zDooku zSidious Sith Assassin, zSavage",1
"RP",,,117859,Mando,"zzThe Mandalorian (Beskar Armor), zDash Rendar, zNest zIG-11 zKuiil",1
"RP",,,102928,Bad Batch,"zHunter zEcho zzOmega zTech zWrecker",1
"RP",1,0,70800,Jawas,"Nebit G8, Jawa Engineer G9, Jawa Scavenger G7, Jawa Dathcha G7",0
"Mordhelm",,,122879,Phasma,"zPhasma zFOTP FOSFTP zFOST zKylo",1
"Mordhelm",1,1,158158,SL Kylo,"zzzzzzSL Kylo, zSith Trooper, zHux zzKRU zzThrawn",1
"Mordhelm",,,155627,SEE,"zzzzzzSEE BSF zzMalak zzzDR zzzVader",1
"Mordhelm",,,563664,Executor,"Executor 5* HT RC Xanadu Blood, Slave I, IG-2000 Imperial TIE Fighter, Tie Adv",1
"Mordhelm",0,1,140873,padme,"zzPadme zGK zJKA zAhsoka zzzCAT",1
"Mordhelm",1,0,131637,CLS,"zzzCLS zHan zzChewbacca zzC-3PO zChewpio",1
"Mordhelm",,,485196,Negotiator,"Negotiator BTL-B Y-wing, Anakin's Eta-2, Rex's ARC-170, Umbaran SF, Ahsoka's SF, Plo's SF, Clone Sergeant's ARC-170",1
"Mordhelm",,,308731,Malevolence,"Malevolence Hyena Bomber, Vulture Droid, Sun Fac SF, Soldier SF, Spy SF",1
"Mordhelm",,,323303,HansMF,"Home One, Han's MF, Rebel Y-wing, Bistan's U-wing, Phantom Ghost Cassian's U-wing, Biggs X-wing",1
"Mordhelm",0,1,103361,Geonosians,"zzGBA Sun Fac, Geo Soldier, Geo Spy, Poggle",1
"Mordhelm",0,1,117972,Grievous-Wat,"zzGG zB2 zB1 MagnaGuard zWat Tambor",1
"Mordhelm",1,0,117420,Traya,"zzTraya DN G9, Sion G9, zDooku zzEP",1
"Mordhelm",1,1,148037,GAS,"zzzzGAS zRex zEcho (501st), zzFives zARC Trooper",1
"Mordhelm",1,1,126790,Revan Offense,"zzzJKR zGMY BS zJolee zHYoda",1
"Mordhelm",1,1,76609,Ewoks,"zChirpa G9, Elder Paploo Wicket Logray G9",1
"Mordhelm",0,1,135942,BH,"zzBossk Cad Dengar IG-88 zBoba",1
"Mordhelm",1,1,85325,Carth,"zCarth Onasi, Mission zZaalbar Juhani G8, Canderous",1
"Mordhelm",1,0,127682,Troopers,"zVeers zStarck zDark Trooper, zzPiett zIden Versio",1
"Mordhelm",0,1,68044,Phoenix,"Hera G8, Zeb G8, Ezra Sabine G8, Kanan G8",1
"Mordhelm",1,0,14209,NestSolo (Counter),"Nest G9",1
"Mordhelm",1,1,109814,NS,"zzMT zzAV zDaka Zombie Spirit",0
"Mordhelm",1,1,109079,JTR,"JTR Scav Rey, zzBB-8 zR2-D2 Finn G8",0
"Mordhelm",0,1,73619,BH,"Jango Boushh (Leia Organa) 4* G8, The Mandalorian, Greedo G8, Greef G8",0
"Mordhelm",1,0,40999,Jawas,"Nebit G4, Jawa Engineer G4, Jawa Scavenger G4, Jawa G4, Dathcha G4",0
"ClintonKilledEpstein",,,169070,JMK,"zzzzzzJMK zJKA zzGMY zzShaak Ti, zGK",1
"ClintonKilledEpstein",,,123354,Phasma,"zPhasma zFOTP FOSFTP zFOST zKylo",1
"ClintonKilledEpstein",1,1,160568,SL Kylo,"zzzzzzSL Kylo, zSith Trooper, zHux zzKRU zzThrawn",1
"ClintonKilledEpstein",,,162472,SEE,"zzzzzzSEE zBSF zzMalak zzzDR zzzVader",1
"ClintonKilledEpstein",,,555060,Executor,"Executor 5* HT RC Xanadu Blood, Slave I, IG-2000 Imperial TIE Fighter, Tie Adv",1
"ClintonKilledEpstein",,,169939,JMLS,"zzzJKR zzJKL zzzzzzJMLS zWat Tambor, zzzzGAS",1
"ClintonKilledEpstein",1,0,148585,CLS,"zzzCLS zHan zzChewbacca zzC-3PO zChewpio",1
"ClintonKilledEpstein",1,1,102033,NestSisters,"zzAV zzMT Daka Zombie zNest",1
"ClintonKilledEpstein",,,504137,Negotiator,"Negotiator BTL-B Y-wing, Anakin's Eta-2, Rex's ARC-170, Umbaran SF, Ahsoka's SF, Plo's SF, Clone Sergeant's ARC-170",1
"ClintonKilledEpstein",,,390289,HansMF,"Home One, Han's MF, Rebel Y-wing 6*, Bistan's U-wing, Phantom Biggs X-wing, Cassian's U-wing, Wedge X-wing",1
"ClintonKilledEpstein",0,1,93717,Geonosians,"zzGBA Sun Fac, Geo Soldier, Geo Spy, Poggle",1
"ClintonKilledEpstein",0,1,125455,Grievous,"zzGG zB2 zB1 MagnaGuard zNute",1
"ClintonKilledEpstein",1,0,131645,Traya,"zzTraya zzDN zSion zzEP Sith Empire Trooper",1
"ClintonKilledEpstein",1,1,116701,JTR,"zzzJTR Scav Rey, BB-8 zzR2-D2 Finn",1
"ClintonKilledEpstein",1,0,129713,Troopers,"zVeers zzPiett zGideon zDark Trooper, Range Trooper",1
"ClintonKilledEpstein",,,110624,Mon Mothma,"zzMon Mothma, Wedge Biggs Lando zCara Dune",1
"ClintonKilledEpstein",1,1,81360,Ewoks,"zChirpa Elder Paploo Wicket Logray",1
"ClintonKilledEpstein",0,1,139888,BH,"zzBossk Cad Dengar Jango zBoba",1
"ClintonKilledEpstein",1,1,97422,Carth,"zCarth Onasi, zMission zZaalbar zJuhani zCanderous",1
"ClintonKilledEpstein",1,0,141861,501st,"zRex zARC Trooper, zEcho (501st), zzFives zAhsoka",1
"ClintonKilledEpstein",0,1,81675,Phoenix,"Hera G9, Zeb Ezra zSabine zKanan",1
"ClintonKilledEpstein",1,1,66099,Rogue1,"Jyn G8, Chirrut G9, Baze G8, K-2SO G9, Cassian G8",1
"ClintonKilledEpstein",1,0,127101,zMaul,"zDarth Maul, zDooku zSidious zSavage Sith Marauder",1
"ClintonKilledEpstein",,,100418,Iden Troopers,"zIden Versio, Shoretrooper Snowtrooper Magma G6, zDT",0
"ClintonKilledEpstein",,,73005,Bad Batch,"zHunter zEcho Omega G1, Tech G1, zWrecker",0
"knaggs1120",,,125222,Phasma,"zPhasma zFOTP FOSFTP zFOST zKylo",1
"knaggs1120",1,1,143669,SL Kylo,"zzzzzzSL Kylo, zSith Trooper, zHux zzKRU Thrawn",1
"knaggs1120",0,1,129603,padme,"zzPadme zGK zJKA zAhsoka zzC-3PO",1
"knaggs1120",1,0,109635,CLS,"zzzCLS zHan zzChewbacca zzR2-D2 Chewpio",1
"knaggs1120",0,1,127939,DRMalak,"zzzDR zzHK-47 zBSF zzMalak Sith Marauder",1
"knaggs1120",,,327123,Malevolence,"Malevolence Hyena Bomber, Vulture Droid, Sun Fac SF, Soldier SF, Spy SF",1
"knaggs1120",1,1,92296,NS_Alt,"zzMT zAV Talia Zombie Daka",1
"knaggs1120",,,344129,HansMF,"Home One, Han's MF, Rebel Y-wing, Bistan's U-wing, Phantom Ghost Cassian's U-wing, Wedge X-wing",1
"knaggs1120",,,466875,Negotiator,"Negotiator HT Anakin's Eta-2, Umbaran SF, Ahsoka's SF, Clone Sergeant's ARC-170, Plo's SF, Rex's ARC-170",1
"knaggs1120",0,1,119127,Geonosians,"zzGBA Sun Fac, Geo Soldier, Geo Spy, Poggle",1
"knaggs1120",0,1,124355,Grievous,"zzGG zB2 zB1 zDroideka zMagnaGuard",1
"knaggs1120",1,1,121790,Revan Offense,"zzzJKR zGMY BS zJolee Ezra",1
"knaggs1120",1,1,93471,Ewoks,"zChirpa Elder Paploo zWicket Logray",1
"knaggs1120",1,0,134122,ShaakClones,"zzShaak Ti, zRex zEcho (501st), zzFives zARC Trooper",1
"knaggs1120",0,1,115050,BH,"zzBossk Dengar zIG-88 zEmbo Boba",1
"knaggs1120",1,1,85700,Carth,"Carth Onasi, zMission zZaalbar Juhani Canderous",1
"knaggs1120",1,1,113376,zEP,"zzEP zzzVader Tarkin zIPD TFP G8",1
"knaggs1120",0,1,83593,Phoenix,"Hera Zeb Chopper zSabine Kanan",1
"knaggs1120",1,1,60972,Rogue1,"Jyn G8, Chirrut G8, Baze G8, K-2SO G8, Cassian G8",1
"knaggs1120",1,0,86585,Jawas,"Nebit Jawa Engineer, Jawa Scavenger, Jawa Dathcha",1
"knaggs1120",1,0,17046,NestSolo (Counter),"Nest",1
"knaggs1120",,,392663,Executrix,"Executrix Tie Adv, Emperor's Shuttle, TIE Reaper 5*, Imperial TIE Fighter, Gauntlet Starfighter, FOSF TIE Fighter, FO TIE Fighter",0
"knaggs1120",1,0,62651,Traya,"Traya G1, DN G8, Sion G7, zDooku Sith Assassin G7",0
"knaggs1120",1,0,61640,Troopers,"Veers G9, Starck G8, Snowtrooper G8, Stormtrooper Magma G7",0
"knaggs1120",0,1,76649,BH,"Jango Cad The Mandalorian G9, Greedo G8, Greef G8",0
"Wasburn09",,,125101,Phasma,"zPhasma zFOTP FOSFTP zFOST zKylo",1
"Wasburn09",1,1,154850,SL Kylo,"zzzzzzSL Kylo, zSith Trooper, zHux zzKRU zThrawn",1
"Wasburn09",1,1,97033,NS,"zMT zzAV Daka Zombie Spirit",1
"Wasburn09",1,0,144877,CLS,"zzzCLS zHan zzChewbacca zzC-3PO zChewpio",1
"Wasburn09",0,1,143368,DRMalak,"zzzDR zzHK-47 zBSF zzMalak Sith Empire Trooper",1
"Wasburn09",0,1,132492,padme,"zzPadme zGK zJKA zAhsoka zBarriss",1
"Wasburn09",,,491540,Negotiator,"Negotiator HT Anakin's Eta-2, Umbaran SF, Ahsoka's SF, Clone Sergeant's ARC-170, Plo's SF, Rex's ARC-170",1
"Wasburn09",0,1,88415,Geonosians,"zzGBA Sun Fac, Geo Soldier, Geo Spy, Poggle",1
"Wasburn09",0,1,121316,Grievous,"zzGG zB2 zB1 zMagnaGuard zNute",1
"Wasburn09",1,1,102974,JTR,"zJTR Scav Rey, zBB-8 zzR2-D2 Finn",1
"Wasburn09",1,0,120310,Traya,"zzTraya zzDN zSion zzEP zNest",1
"Wasburn09",,,135802,Disintegration,"zzAurra zzGreef zBoba zzBossk zzThe Mandalorian",1
"Wasburn09",1,1,145229,GAS,"zzzzGAS zRex zEcho (501st), zzFives zARC Trooper",1
"Wasburn09",1,1,140153,Revan Offense,"zzzJKR zGMY zBS zJolee zzHYoda",1
"Wasburn09",1,1,96601,Ewoks,"zChirpa Elder zPaploo zWicket zLogray",1
"Wasburn09",1,1,95012,Carth,"zCarth Onasi, zMission zZaalbar zJuhani zCanderous",1
"Wasburn09",,,119731,Iden Troopers,"zIden Versio, zStormtrooper Snowtrooper Magma DT",1
"Wasburn09",0,1,81794,Phoenix,"Hera Zeb zEzra Chopper G9, Kanan",1
"Wasburn09",,,319466,HansMF,"Home One, Han's MF, Biggs X-wing, Bistan's U-wing 5*, Phantom Ghost Cassian's U-wing, Wedge X-wing",0
"Wasburn09",0,1,101743,BH,"Jango Cad zZam Dengar IG-88",0
"Ro'bi wan",,,180011,JMK,"zzzzzzJMK zAhsoka zzzCAT zzzzGAS zGK",1
"Ro'bi wan",,,126866,Phasma,"zPhasma zFOTP FOSFTP zFOST zKylo",1
"Ro'bi wan",,,167930,SEE,"zzzzzzSEE zBSF zzMalak zzzDR zzzVader",1
"Ro'bi wan",1,1,154749,SL Kylo,"zzzzzzSL Kylo, zSith Trooper, zHux zzKRU zzThrawn",1
"Ro'bi wan",1,1,161900,GL Rey,"zzzzzzRey zzzJTR zzBB-8 zRH Poe, zRH Finn",1
"Ro'bi wan",,,159794,JMLS,"zBS zzzzzzJMLS zWat Tambor, zzJKL zJolee",1
"Ro'bi wan",1,0,158261,CLS,"zzzCLS zHan zzChewbacca zzC-3PO zChewpio",1
"Ro'bi wan",1,1,123283,NestSisters,"zzAV zzMT zDaka Zombie zNest",1
"Ro'bi wan",,,530331,Negotiator,"Negotiator BTL-B Y-wing, Anakin's Eta-2, Rex's ARC-170, Umbaran SF, Ahsoka's SF, Plo's SF, Clone Sergeant's ARC-170",1
"Ro'bi wan",,,350878,Malevolence,"Malevolence Hyena Bomber, Vulture Droid, Sun Fac SF, Soldier SF, Spy SF",1
"Ro'bi wan",,,474410,HansMF,"Home One, Han's MF, Rebel Y-wing, Bistan's U-wing, Phantom Ghost Cassian's U-wing, Wedge X-wing",1
"Ro'bi wan",0,1,123202,Geonosians,"zzGBA Sun Fac, Geo Soldier, Geo Spy, Poggle",1
"Ro'bi wan",0,1,128145,Grievous,"zzGG zB2 zB1 zMagnaGuard zNute",1
"Ro'bi wan",1,0,130726,Traya,"zzTraya zzDN zSion zzEP Sith Empire Trooper",1
"Ro'bi wan",,,106630,Mon Mothma,"zzMon Mothma, Hoth Rebel Scout, Wedge Biggs Cara Dune",1
"Ro'bi wan",,,492243,Executrix,"Executrix Tie Adv, Emperor's Shuttle, TIE Reaper, Imperial TIE Fighter, Gauntlet Starfighter, FOSF TIE Fighter, FO TIE Fighter",1
"Ro'bi wan",,,117848,Disintegration,"zzAurra Greef zBoba zzBossk zzThe Mandalorian",1
"Ro'bi wan",1,1,96437,Ewoks,"zChirpa Elder zPaploo zWicket zLogray",1
"Ro'bi wan",1,0,152543,ShaakClones,"zzShaak Ti, zRex zEcho (501st), zzFives zARC Trooper",1
"Ro'bi wan",1,1,100749,Carth,"zCarth Onasi, zMission zZaalbar zJuhani zCanderous",1
"Ro'bi wan",0,1,122749,BH,"zzJango Cad zZam zDengar zzEmbo",1
"Ro'bi wan",1,0,112528,Troopers,"zVeers zStarck Snowtrooper zzPiett zDT",1
"Ro'bi wan",0,1,99047,Phoenix,"zHera zZeb zEzra zSabine zKanan",1
"Ro'bi wan",1,0,116870,zMaul,"zDarth Maul, zDooku zSidious Sith Assassin, zSavage",1
"Ro'bi wan",1,1,99924,Rogue1,"zzJyn Chirrut Baze zK-2SO zCassian",1
"Ro'bi wan",,,104104,Bad Batch,"zHunter zEcho zzOmega zTech zWrecker",1
"Ro'bi wan",1,0,76989,Jawas,"Nebit G8, Jawa Engineer, Jawa Scavenger, Jawa Dathcha",1
"ItsTurtleTime",,,173945,JMK,"zzzzzzJMK zAhsoka zzzCAT zzzzGAS zGK",1
"ItsTurtleTime",,,125343,Phasma,"zPhasma zFOTP FOSFTP zFOST zKylo",1
"ItsTurtleTime",,,431543,Profundity,"Profundity Han's MF, Outrider Rebel Y-wing, Cassian's U-wing, Ghost",1
"ItsTurtleTime",1,1,156179,SL Kylo,"zzzzzzSL Kylo, zSith Trooper, zHux zzKRU zzThrawn",1
"ItsTurtleTime",0,1,114327,Qira,"zQira zL3-37 zVandor Chewbacca, zMission zZaalbar",1
"ItsTurtleTime",1,1,113136,NS,"zzMT zzAV zDaka Zombie Spirit",1
"ItsTurtleTime",,,591281,Executor,"Executor HT RC Xanadu Blood, Slave I, IG-2000 Imperial TIE Fighter, Tie Adv",1
"ItsTurtleTime",,,155592,JMLS,"zBS zzzzzzJMLS zWat Tambor, zzJKL zJolee",1
"ItsTurtleTime",1,0,146156,CLS,"zzzCLS zHan zzChewbacca zzC-3PO zChewpio",1
"ItsTurtleTime",0,1,128865,DRMalak,"zzzDR zHK-47 zBSF zzMalak Sith Empire Trooper",1
