Player,Offense,Defense,GP,Name,Squad,Viable
"Bellanoche",0,1,95114,Geonosians,"zzGBA Sun Fac, Geo Soldier, Geo Spy, Poggle",1
"Bellanoche",0,1,129354,Grievous-Wat,"zzGG zB2 zB1 zMagnaGuard zWat Tambor",1
"Bellanoche",1,1,102543,JTR,"zzzJTR Scav Rey, zzBB-8 G9, zR2-D2 Finn G9",1
"Bellanoche",1,1,144301,Revan Offense,"zzzJKR zzGMY zBS zJolee zzHYoda",1
"Bellanoche",1,1,84776,Ewoks,"zChirpa Elder zPaploo G9, Wicket Logray G9",1
"Bellanoche",0,1,117879,BH,"zzBossk zDengar zBoba Cad zzJango",1
"Bellanoche",1,1,92297,Carth,"zCarth Onasi, zMission zZaalbar Juhani G8, zCanderous",1
"Bellanoche",1,0,129114,CLS,"zzzCLS zHan zLeia zOld Ben, zzChewbacca",1
"Bellanoche",0,1,85843,Phoenix,"zHera Ezra Zeb G8, zKanan Sabine G8",1
"Bellanoche",1,1,60682,Rogue1,"Jyn G8, Chirrut G8, Baze G8, Cassian G8, K-2SO G9",1
"Bellanoche",1,0,90948,EP (Counter, Rebel),"zEP Shoretrooper G8, DT G8, zzWampa zNest",1
"Bellanoche",,,58652,Phasma,"Phasma G8, FOTP G7, FOSFTP G7, FOST 6* G8, Kylo G8",0
"Bellanoche",0,1,104693,DRMalak,"zzzDR zzHK-47 G9, zBSF Malak G7, zThrawn G9",0
"Bellanoche",1,1,85065,NS,"MT G9, zzAV Daka Zombie G9, Spirit G9",0
"Bellanoche",1,0,65464,Traya,"Traya G7, DN 6* G8, Sion G7, zDooku Sith Assassin G5",0
"Bellanoche",,,81328,Mon Mothma,"Mon Mothma 6* G9, Lando Wedge Biggs zCara Dune",0
"Bellanoche",1,1,73562,GAS,"zzzGAS 5* G8, zRex Echo (501st), Fives G9, ARC Trooper 4* G5",0
"Bellanoche",1,0,67421,Troopers,"Veers G8, Starck G7, zzGideon Snowtrooper G8, Stormtrooper G8",0
"Bellanoche",,,47912,Bad Batch,"Hunter 5* G9, Echo 4* G8, Omega 5* G6, Tech 5* G8, Wrecker 4* G8",0
"Wicked",1,1,96990,NS_Alt,"zzMT zAV Talia zDaka Zombie",1
"Wicked",,,320201,HansMF,"Home One, Han's MF 5*, Biggs X-wing, Bistan's U-wing, Phantom Ghost Cassian's U-wing, Wedge X-wing",1
"Wicked",0,1,97455,Geonosians,"zzGBA Sun Fac, Geo Soldier, Geo Spy, Poggle",1
"Wicked",1,1,130549,Revan,"zzzJKR zBS zzGMY zJolee GK G8",1
"Wicked",1,1,111030,Ewoks,"zChirpa Elder zPaploo Teebo zWicket",1
"Wicked",1,1,99008,Carth,"zCarth Onasi, zMission zZaalbar zJuhani zCanderous",1
"Wicked",0,1,136416,BH,"zzBossk zGreedo zBoba Cad zzJango",1
"Wicked",1,1,123495,zEP,"zzEP zzzVader Tarkin TFP zBSF",1
"Wicked",1,0,113332,501st,"zRex ARC Trooper G8, zEcho (501st), zzFives zAhsoka",1
"Wicked",,,41264,Phasma,"Phasma G8, FOTP 5* G7, FOO G8, KRU 5* G8, Kylo 6* G8",0
"Wicked",1,0,108258,CLS,"zzCLS zHan zzChewbacca R2-D2 C-3PO G7",0
"Wicked",1,0,65067,Troopers,"Veers Starck G9, Shoretrooper Stormtrooper G9, DT",0
"Wicked",1,0,57614,Wiggs,"Wedge G8, Biggs G8, Fulcrum G1, Ezra G8, Leia G9",0
"Wicked",1,1,70711,Rogue1,"Jyn 5* G8, Chirrut Baze Cassian G8, K-2SO G8",0
"Wicked",0,1,60696,Phoenix,"Hera 5* G8, Chopper G8, Zeb G8, Kanan G8, Sabine G8",0
"Wicked",1,0,98694,zMaul,"Darth Maul G8, zDooku DN zzzDR zSidious",0
"Wicked",1,0,7071,NestSolo (Counter),"Nest 4* G6",0
"Darthpool",1,1,153977,SL Kylo,"zzzzzzSL Kylo, zSith Trooper, zHux zzKRU zThrawn",1
"Darthpool",0,1,118655,DRMalak,"zzzDR HK-47 zBSF zzMalak Sith Empire Trooper G8",1
"Darthpool",0,1,132913,padme,"zzPadme zGK zJKA zAhsoka zC-3PO",1
"Darthpool",1,1,96725,NestSisters,"zzAV zzMT zDaka Zombie zNest",1
"Darthpool",,,439117,Negotiator,"Negotiator HT Anakin's Eta-2, Umbaran SF, Ahsoka's SF, BTL-B Y-wing 6*, Clone Sergeant's ARC-170, Plo's SF",1
"Darthpool",0,1,86973,Geonosians,"zGBA Sun Fac, Geo Soldier, Geo Spy, Poggle",1
"Darthpool",1,1,94902,JTR,"zzzJTR Scav Rey, zBB-8 G9, zzR2-D2 RT",1
"Darthpool",1,0,115340,Traya,"zzTraya zDN zSion zDooku zzEP",1
"Darthpool",1,1,108407,Revan Offense,"zzzJKR zzGMY zBS zJolee zHYoda",1
"Darthpool",1,1,81710,Ewoks,"zChirpa G9, Elder zPaploo G9, zWicket G9, zLogray G8",1
"Darthpool",0,1,124019,BH,"zzBossk zThe Mandalorian, Dengar Boba zJango",1
"Darthpool",1,1,84821,Carth,"zCarth Onasi, zMission Zaalbar Juhani Canderous",1
"Darthpool",0,1,77618,Phoenix,"Hera G9, Ezra Chopper Zeb G9, zKanan G9",1
"Darthpool",,,120563,Phasma,"zPhasma FOTP FOSFTP zFOST zKylo",0
"Darthpool",0,1,86673,Grievous,"zGG G9, zB2 zB1 zDroideka G9, MagnaGuard G9",0
"Darthpool",1,0,69428,Troopers,"zVeers zPiett 6* G8, Gideon 6* G7, zDark Trooper 6*, Range Trooper 6* G8",0
"Darthpool",1,0,89597,ShaakClones,"zShaak Ti, Rex Echo (501st) G8, zzFives Clone Sergeant G8",0
"Darthpool",1,0,106361,CLS,"zzzCLS zHan Leia Old Ben G9, zzChewbacca",0
"Darthpool",1,1,58057,Rogue1,"Jyn G8, Chirrut G9, Baze 5* G9, Cassian G8, Pao G8",0
"Darthpool",1,0,61485,Jawas,"Nebit G8, Jawa Engineer 6* G8, Jawa Scavenger G8, Jawa 6* G8, Dathcha G9",0
"Jangboba",0,1,108895,DR,"zzzDR HK-47 zBSF Sith Empire Trooper, Sith Assassin",1
"Jangboba",1,0,126181,Traya,"zzTraya zDN zSion zDooku zzEP",1
"Jangboba",0,1,115182,BH,"zzBossk zAurra zBoba zIG-88 zzJango",1
"Jangboba",0,1,68036,Phoenix,"Hera Ezra Chopper Zeb G8, Kanan G8",1
"Jangboba",0,1,99358,BS,"zBS GMY zJolee GK zzHYoda",1
"Jangboba",,,60309,Phasma,"Phasma G8, FOTP G7, FOSFTP G8, FOST 5* G8, zKylo",0
"Jangboba",0,1,77318,Geonosians,"zGBA Sun Fac G8, Geo Soldier, Geo Spy G8, Poggle",0
"Jangboba",0,1,69503,Grievous,"zGG zB2 MagnaGuard G8, IPD G7, T3-M4 G7",0
"Jangboba",1,1,55656,NS,"MT 5* G8, AV G8, Daka Zombie G4, Spirit G8",0
"Jangboba",1,1,71591,Ewoks,"zChirpa 6* G8, Elder Paploo Wicket Logray",0
"Jangboba",1,1,67232,Carth,"Carth Onasi, Mission G5, Zaalbar G7, Juhani Canderous G8",0
"Jangboba",1,0,55928,501st,"Rex G8, Clone Sergeant G8, Echo (501st), Fives G8, Ahsoka",0
"Jangboba",1,0,70090,Wiggs,"Wedge G8, Biggs G8, CLS G8, Han Leia",0
"Jangboba",1,0,56331,Troopers,"Veers G9, Starck G6, Shoretrooper G8, Snowtrooper G8, Stormtrooper G8",0
"Jangboba",1,1,55447,Rogue1,"Jyn G8, Chirrut G8, Baze 5* G8, Cassian G8, K-2SO G9",0
"bdvil",,,125511,Phasma,"zPhasma zFOTP FOSFTP zFOST zKylo",1
"bdvil",1,1,160239,SL Kylo,"zzzzzzSL Kylo, zSith Trooper, zHux zzKRU zzThrawn",1
"bdvil",,,164933,SEE,"zzzzzzSEE zBSF zzMalak zzzDR zzzVader",1
"bdvil",1,0,144884,CLS,"zzzCLS zHan zzChewbacca zzC-3PO zChewpio",1
"bdvil",0,1,116166,padme,"zzPadme zGK zJKA zAhsoka CW Chewbacca G9",1
"bdvil",,,428154,HansMF,"Home One, Han's MF, Rebel Y-wing, Bistan's U-wing, Phantom Biggs X-wing, Cassian's U-wing, Wedge X-wing",1
"bdvil",,,433387,Negotiator,"Negotiator 5* HT Anakin's Eta-2, Umbaran SF, Ahsoka's SF, Clone Sergeant's ARC-170, Plo's SF, Rex's ARC-170",1
"bdvil",1,0,128894,Traya,"zzTraya zzDN zSion zzEP Sith Empire Trooper G8",1
"bdvil",1,1,127596,JTR,"zzzJTR zScav Rey, BB-8 zzR2-D2 zFinn",1
"bdvil",,,111376,Disintegration,"Aurra Greef zBoba zzBossk zzThe Mandalorian",1
"bdvil",,,116019,Mon Mothma,"zzMon Mothma, Lando zzJyn Wedge Biggs",1
"bdvil",1,1,135105,Revan Offense,"zzzJKR zzGMY zBS zJolee zzHYoda",1
"bdvil",1,1,85233,Ewoks,"zChirpa Elder Paploo G9, zWicket Logray G9",1
"bdvil",1,0,100233,ShaakClones,"zzShaak Ti, zRex zEcho (501st), zzFives ARC Trooper G8",1
"bdvil",1,1,94545,Carth,"zCarth Onasi, zMission zZaalbar Juhani G8, zCanderous",1
"bdvil",0,1,100374,BH,"zzJango zZam IG-88 Cad zNest",1
"bdvil",0,1,81082,Phoenix,"zHera zEzra Zeb G8, Kanan G8, Sabine G8",1
"bdvil",1,0,128709,zMaul,"zDarth Maul, zDooku zSidious zSavage Sith Marauder",1
"bdvil",1,0,75026,Jawas,"Nebit Jawa Engineer, Jawa Scavenger G8, Jawa G9, Dathcha",1
"bdvil",1,1,96963,NS,"zzMT zzAV zDaka Zombie G8, Spirit G9",0
"bdvil",,,253429,Malevolence,"Malevolence 5* Hyena Bomber 5*, Vulture Droid 6*, Sun Fac SF, Soldier SF, Spy SF",0
"bdvil",0,1,87570,Geonosians,"zzGBA Sun Fac G8, Geo Soldier, Geo Spy, Poggle",0
"bdvil",0,1,81305,Grievous,"zzGG B2 6* G8, zB1 Droideka G8, MagnaGuard G8",0
"bdvil",1,0,83657,Troopers,"zVeers zzPiett Gideon 5* G7, Dark Trooper 6* G8, Range Trooper 6* G6",0
"bdvil",,,463455,Executrix,"Executrix Tie Adv, Emperor's Shuttle, TIE Reaper 4*, Imperial TIE Fighter, Gauntlet Starfighter, FOSF TIE Fighter, FO TIE Fighter",0
"bdvil",,,64745,Iden Troopers,"Iden Versio G8, Shoretrooper G8, Snowtrooper G7, Magma G7, DT G8",0
"bdvil",,,52472,Bad Batch,"Hunter 6* G8, Echo 5* G7, Omega 5* G8, Tech 6* G8, Wrecker 5* G7",0
"Texas chef",,,123028,Phasma,"zPhasma zFOTP FOSFTP zFOST zKylo",1
"Texas chef",1,1,158852,SL Kylo,"zzzzzzSL Kylo, zSith Trooper, zHux zzKRU zzThrawn",1
"Texas chef",,,156523,SEE,"zzzzzzSEE zBSF zzMalak zzzDR zzzVader",1
"Texas chef",1,0,142082,CLS,"zzzCLS zHan zzChewbacca zzC-3PO zChewpio",1
"Texas chef",,,472216,Negotiator,"Negotiator BTL-B Y-wing, Anakin's Eta-2, Rex's ARC-170, Umbaran SF, Ahsoka's SF, Plo's SF, Clone Sergeant's ARC-170",1
"Texas chef",,,398730,HansMF,"Home One, Han's MF, Rebel Y-wing, Bistan's U-wing, Phantom Ghost Cassian's U-wing, Wedge X-wing",1
"Texas chef",0,1,98932,Geonosians,"zzGBA Sun Fac, Geo Soldier, Geo Spy, Poggle",1
"Texas chef",0,1,129315,Grievous,"zzGG zB2 zB1 zMagnaGuard zNute",1
"Texas chef",1,1,93065,JTR,"zJTR Scav Rey, zBB-8 zzR2-D2 Finn G9",1
"Texas chef",,,94857,Mon Mothma,"zzMon Mothma, Wedge Hoth Rebel Scout, Biggs zPao",1
"Texas chef",,,105179,Disintegration,"Aurra zGreef zBoba zBossk The Mandalorian",1
"Texas chef",1,1,135248,GAS,"zzzzGAS zRex zEcho (501st), zzFives zARC Trooper",1
"Texas chef",1,1,118552,Revan,"zzzJKR BS zGMY zJolee zGK",1
"Texas chef",1,1,87873,Ewoks,"zChirpa Elder Paploo zWicket Logray",1
"Texas chef",1,1,92331,Carth,"zCarth Onasi, zMission Zaalbar Juhani Canderous",1
"Texas chef",0,1,69572,Phoenix,"Hera G8, Ezra G8, Zeb G8, Kanan G8, Sabine G8",1
"Texas chef",1,1,71370,Rogue1,"Jyn G9, Chirrut G9, Baze G9, Cassian G8, K-2SO G8",1
"Texas chef",1,0,113901,EP (Counter, Rebel),"zzEP Shoretrooper G8, Krennic DT G8, zzWampa",1
"Texas chef",1,0,59360,QiraNest,"Qira zNest G9, zzHYoda",1
"Texas chef",1,0,18043,SionSolo (Counter),"zSion",1
"Texas chef",1,1,98840,NS,"zzMT zAV zDaka G9, Zombie Spirit G8",0
"Texas chef",,,312668,Malevolence,"Malevolence Hyena Bomber, Vulture Droid 5*, Sun Fac SF, Soldier SF, Spy SF",0
"Texas chef",1,0,101262,Troopers,"Veers zzPiett zzGideon Dark Trooper 6* G9, Range Trooper G9",0
"Texas chef",0,1,99049,BH,"Jango G9, zGreedo Dengar zBoushh (Leia Organa), zFennec Shand",0
"Texas chef",1,0,126410,zMaul,"Darth Maul, zDooku zSidious Sith Empire Trooper, Sith Marauder",0
"Texas chef",,,72857,Bad Batch,"zHunter 6* zEcho 6* G9, Omega 5* G9, zTech 6* G9, zWrecker 6* G8",0
"Texas chef",1,0,98034,QGJ,"QGJ G8, Aayla G7, zJKA zzOld Ben G9, zAhsoka",0
"Texas chef",1,0,74021,Jawas,"Nebit G8, Jawa Engineer G9, Jawa Scavenger G9, Jawa Dathcha G7",0
"Rune",0,1,136394,padme,"zzPadme zGK zJKA zAhsoka zzC-3PO",1
"Rune",,,405835,HansMF,"Home One, Han's MF, Rebel Y-wing, Bistan's U-wing, Phantom Ghost Cassian's U-wing, Wedge X-wing",1
"Rune",,,421675,Negotiator,"Negotiator HT Anakin's Eta-2, Umbaran SF, Ahsoka's SF, Clone Sergeant's ARC-170, Plo's SF, Rex's ARC-170",1
"Rune",0,1,118964,DR,"zzzDR zzHK-47 zBSF Sith Marauder, zzThrawn",1
"Rune",0,1,91354,Geonosians,"zzGBA 6* Sun Fac, Geo Soldier, Geo Spy, Poggle",1
"Rune",0,1,106080,Grievous,"zzGG B2 G9, B1 zDroideka zMagnaGuard",1
"Rune",1,1,89993,JTR,"zzzJTR G9, zScav Rey, BB-8 G8, R2-D2 G9, zFinn",1
"Rune",,,116288,Nute-OR,"zNute zDooku zzJango zZaalbar zMission",1
"Rune",1,1,143624,Revan Offense,"zzzJKR zzGMY zBS zJolee zzHYoda",1
"Rune",1,1,96080,Ewoks,"zChirpa Elder zPaploo zWicket zLogray",1
"Rune",1,1,110335,zEP,"zzEP zzzVader zzTarkin TFP G9, zzMara Jade, The Emperor's Hand 5*",1
"Rune",0,1,90377,Phoenix,"zHera zEzra Zeb G9, zKanan G9, zSabine",1
"Rune",1,1,87264,Rogue1,"zzJyn Chirrut G9, Baze G8, zCassian K-2SO G9",1
"Rune",1,0,15402,SionSolo (Counter),"Sion G9",1
"Rune",,,63892,Phasma,"Phasma G8, FOTP G8, FOSFTP G7, FOST G9, Kylo G7",0
"Rune",1,1,76420,NS,"MT G8, zzAV Daka Zombie G7, Spirit G7",0
"Rune",,,356476,Executrix,"Executrix Tie Adv, Emperor's Shuttle 4*, TIE Reaper 3*, Imperial TIE Fighter, Gauntlet Starfighter, FOSF TIE Fighter, FO TIE Fighter",0
"Rune",,,95240,Disintegration,"Aurra Greef G9, zBoba Bossk 5* G9, zzThe Mandalorian",0
"Rune",1,0,77160,Troopers,"Veers G9, zzPiett zzGideon G9, Dark Trooper 5* G7, Range Trooper 6* G7",0
"Rune",,,83770,Mon Mothma,"Mon Mothma 5* G7, Lando zKyle Katarn 5* G9, Wedge zCara Dune",0
"Rune",1,0,99101,ShaakClones,"zzShaak Ti, zRex Echo (501st) G9, Fives G9, zARC Trooper",0
"Rune",1,0,116847,CLS,"zzzCLS Han G7, Leia G9, zzOld Ben, zzChewbacca",0
"Rune",,,58119,Iden Troopers,"Iden Versio 3* G4, Stormtrooper G9, Snowtrooper G7, Magma G7, DT G7",0
"Rune",,,62970,Bad Batch,"Hunter 5* G9, Echo 5* G8, zzOmega Tech 5* G8, Wrecker 4* G6",0
"Rune",,,67153,Mando,"The Mandalorian (Beskar Armor) G8, Dash Rendar 4* G8, Nest 5* G7, zIG-11 G8, zKuiil G9",0
"Rune",1,0,62255,Jawas,"Nebit G8, Jawa Engineer G7, Jawa Scavenger G7, Jawa 6* G7, Dathcha G8",0
"SeriousB",,,174364,JMK,"zzzzzzJMK zAhsoka zzzCAT zzzzGAS zGK",1
"SeriousB",,,117655,Phasma,"zPhasma FOTP FOSFTP zFOST Kylo",1
"SeriousB",,,154062,SEE,"zzzzzzSEE zBSF zzMalak zzzDR zDooku",1
"SeriousB",,,526018,Executor,"Executor 5* HT RC Xanadu Blood, Slave I, IG-2000 Imperial TIE Fighter, Tie Adv",1
"SeriousB",1,0,152685,CLS,"zzzCLS zHan zzChewbacca zzC-3PO zChewpio",1
"SeriousB",,,512314,Negotiator,"Negotiator BTL-B Y-wing, Anakin's Eta-2, Rex's ARC-170, Umbaran SF, Ahsoka's SF, Plo's SF, Clone Sergeant's ARC-170",1
"SeriousB",,,138958,JKL,"zzJKL zzzJKR zHYoda Old Ben, Aayla",1
"SeriousB",,,399429,HansMF,"Home One, Han's MF, Rebel Y-wing, Bistan's U-wing, Phantom Biggs X-wing, Cassian's U-wing, Wedge X-wing",1
"SeriousB",0,1,102655,Geonosians,"zzGBA Sun Fac, Geo Soldier, Geo Spy, Poggle",1
"SeriousB",,,110520,Disintegration,"Aurra Greef G8, zBoba zBossk zThe Mandalorian",1
"SeriousB",1,1,78903,Ewoks,"zChirpa G9, Elder Paploo Wicket Logray",1
"SeriousB",1,0,149250,ShaakClones,"zzShaak Ti, zRex zEcho (501st), zzFives zARC Trooper",1
"SeriousB",1,1,87562,Carth,"zCarth Onasi, zMission zZaalbar Juhani Canderous G8",1
"SeriousB",1,1,141150,zEP,"zzEP zzzVader Tarkin TFP Sith Trooper",1
"SeriousB",0,1,129897,BH,"zJango Dengar Zam Embo Cad",1
"SeriousB",0,1,77391,Phoenix,"Hera zEzra Zeb G8, Kanan G8, Sabine G8",1
"SeriousB",1,1,65250,Rogue1,"Jyn G8, Chirrut G8, Baze G8, Cassian G8, K-2SO G8",1
"SeriousB",1,0,18231,SionSolo (Counter),"Sion",1
"SeriousB",1,0,16380,NestSolo (Counter),"Nest",1
"SeriousB",,,137540,LV,"zzzzzzLord Vader, Piett zzzMaul zRG Stormtrooper G9",0
"SeriousB",1,1,81392,NS,"zMT G9, zAV zDaka Zombie Spirit G8",0
"SeriousB",0,1,134017,Grievous,"zGG zB2 zB1 zMagnaGuard Nute",0
"SeriousB",1,1,100640,JTR,"JTR Scav Rey, BB-8 G8, zR2-D2 Finn G8",0
"SeriousB",,,115781,Mon Mothma,"zzMon Mothma, Lando Kyle Katarn, Wedge Biggs",0
"SeriousB",1,0,79279,Troopers,"Veers Starck Snowtrooper G8, Magma G7, DT G8",0
"SeriousB",,,106163,Bad Batch,"Hunter Echo Omega G9, Tech Wrecker",0
"BenStaWa",0,1,113217,DRMalak,"zzzDR zHK-47 zBSF zzMalak Sith Empire Trooper G8",1
"BenStaWa",0,1,127607,padme,"zzPadme zGK zJKA zAhsoka zzC-3PO",1
"BenStaWa",,,444142,Negotiator,"Negotiator BTL-B Y-wing, Anakin's Eta-2, Rex's ARC-170, Umbaran SF, Ahsoka's SF, Plo's SF, Clone Sergeant's ARC-170",1
"BenStaWa",0,1,127704,Grievous-Wat,"zzGG zB2 zB1 MagnaGuard zWat Tambor",1
"BenStaWa",,,98892,Nute-OR,"zNute Dooku zJango zZaalbar zMission",1
"BenStaWa",1,1,127384,GAS,"zzzzGAS zRex zEcho (501st), zzFives zARC Trooper",1
"BenStaWa",1,1,112967,Revan Offense,"zzzJKR GMY BS zJolee zHYoda G9",1
"BenStaWa",1,1,92918,Ewoks,"zChirpa Elder Paploo zWicket zLogray",1
"BenStaWa",0,1,92880,BH,"zBossk zThe Mandalorian, Boba zGreef Cad",1
"BenStaWa",1,1,83152,zEP,"zEP Vader Tarkin G8, zzTraya G9, Sion G9",1
"BenStaWa",0,1,74878,Phoenix,"Hera G9, Ezra G8, Chopper zZeb G8, Kanan G8",1
"BenStaWa",1,0,13582,NestSolo (Counter),"Nest G8",1
"BenStaWa",,,54840,Phasma,"Phasma G8, Sith Trooper G7, FOO G8, KRU G8, Kylo G8",0
"BenStaWa",1,0,61902,CLS,"CLS G8, Han G7, Chewbacca G7, R2-D2 G8, Chewpio G7",0
"BenStaWa",,,229180,Malevolence,"Malevolence Hyena Bomber, Vulture Droid 5*, Sun Fac SF, Soldier SF, Spy SF",0
"BenStaWa",,,231802,HansMF,"Home One, Han's MF, Rebel Y-wing 6*, Bistan's U-wing 3*, Phantom Ghost Cassian's U-wing 5*, Biggs X-wing 5*",0
"BenStaWa",0,1,66368,Geonosians,"GBA G9, Sun Fac G7, Geo Soldier G8, Geo Spy G7, Poggle G8",0
"BenStaWa",1,1,62219,NS,"MT G8, AV Daka G8, Zombie Spirit G8",0
"BenStaWa",1,0,64793,Troopers,"Veers G9, zPiett G8, Gideon G7, Dark Trooper G7, Range Trooper 5* G7",0
"BenStaWa",1,1,43118,Rogue1,"Jyn 5* G8, Chirrut 5* G8, Baze G8, Cassian G8, K-2SO G8",0
"noobhemingway",,,126480,Phasma,"zPhasma zFOTP zSith Trooper, zzKRU zKylo",1
"noobhemingway",0,1,130417,padme,"zzPadme zGK zJKA zAhsoka zzC-3PO",1
"noobhemingway",1,1,97541,NestSisters,"zzAV zMT zDaka Zombie zNest",1
"noobhemingway",0,1,95276,Geonosians,"zzGBA Sun Fac, Geo Soldier, Geo Spy, Poggle",1
"noobhemingway",1,0,96684,Traya,"zzTraya zDN zSion Sith Empire Trooper G9, zThrawn",1
"noobhemingway",0,1,118292,Grievous,"zzGG zB2 zB1 zDroideka MagnaGuard",1
"noobhemingway",1,1,105418,JTR,"zzJTR Scav Rey, zzBB-8 zzR2-D2 RT",1
"noobhemingway",1,1,102722,Revan Offense,"zzzJKR zGMY zBS zJolee Ezra G9",1
"noobhemingway",1,1,83051,Ewoks,"zChirpa Elder Paploo Wicket Logray",1
"noobhemingway",1,0,98084,ShaakClones,"zzShaak Ti, zRex zEcho (501st), zFives zARC Trooper",1
"noobhemingway",0,1,100661,BH,"zBossk Dengar zZam Boba zIG-88",1
"noobhemingway",1,1,109728,zEP,"zzEP zzzVader Tarkin TFP G9, zBSF",1
"noobhemingway",1,0,98546,Wiggs,"Wedge Biggs zCLS zHan zChewbacca",1
"noobhemingway",0,1,65003,Phoenix,"Hera G8, Chopper G9, Zeb G8, Kanan G8, Sabine G8",1
"noobhemingway",,,277518,Malevolence,"Malevolence 5* Hyena Bomber, Vulture Droid 6*, Sun Fac SF, Soldier SF, Spy SF",0
"noobhemingway",1,0,76699,Troopers,"zVeers zPiett G8, Gideon Dark Trooper 6* G7, Range Trooper G9",0
"noobhemingway",,,341772,Executrix,"Executrix Tie Adv, Emperor's Shuttle 4*, TIE Reaper, Imperial TIE Fighter, Gauntlet Starfighter, FOSF TIE Fighter 6*, FO TIE Fighter",0
"noobhemingway",,,81218,Nute-OR,"Nute zDooku Jango G9, Zaalbar G9, Mission",0
"noobhemingway",,,68904,Iden Troopers,"Iden Versio 6*, Shoretrooper G8, Snowtrooper G9, Magma G8, DT",0
"noobhemingway",1,1,55680,Rogue1,"Jyn 5* G7, Chirrut G8, Baze G8, Cassian G8, K-2SO G8",0
"Zack g",,,176683,JMK,"zzzzzzJMK zAhsoka zzzCAT zzzzGAS zGK",1
"Zack g",,,168530,SEE,"zzzzzzSEE zBSF zzMalak zzzDR zzzVader",1
"Zack g",1,1,161914,GL Rey,"zzzzzzRey zzzJTR zzR2-D2 zRH Poe, zRH Finn",1
"Zack g",,,575883,Executor,"Executor 5* HT RC Xanadu Blood, Slave I, IG-2000 Imperial TIE Fighter, Tie Adv",1
"Zack g",1,0,157644,CLS,"zzzCLS zHan zzChewbacca zzC-3PO zChewpio",1
"Zack g",1,1,105124,NestSisters,"zzAV zzMT Daka Zombie zNest",1
"Zack g",,,486778,Negotiator,"Negotiator BTL-B Y-wing, Anakin's Eta-2, Rex's ARC-170, Umbaran SF, Ahsoka's SF, Plo's SF, Clone Sergeant's ARC-170",1
"Zack g",,,312803,Malevolence,"Malevolence Hyena Bomber, Vulture Droid, Sun Fac SF, Soldier SF, Spy SF",1
"Zack g",,,141997,JKL,"zzJKL zzzJKR zHYoda zzOld Ben, Aayla",1
"Zack g",,,434846,HansMF,"Home One, Han's MF, Rebel Y-wing, Bistan's U-wing, Phantom Ghost Cassian's U-wing, Wedge X-wing",1
"Zack g",0,1,96833,Geonosians,"zzGBA Sun Fac, Geo Soldier, Geo Spy, Poggle",1
"Zack g",0,1,128407,Grievous,"zzGG zB2 zB1 zMagnaGuard zNute",1
"Zack g",1,0,98790,Traya,"zzTraya DN G8, zSion G8, Sith Empire Trooper G8, zzThrawn",1
"Zack g",,,134145,Disintegration,"Aurra zzGreef zBoba zzBossk zzThe Mandalorian",1
"Zack g",,,113130,Mon Mothma,"zzMon Mothma, Lando Wedge Biggs zCara Dune",1
"Zack g",1,1,90245,Ewoks,"zChirpa Elder Paploo zWicket Logray",1
"Zack g",1,0,117783,ShaakClones,"zzShaak Ti, zRex zEcho (501st), zzFives zARC Trooper",1
"Zack g",1,1,96337,Carth,"zCarth Onasi, zMission zZaalbar Juhani Canderous",1
"Zack g",0,1,137934,BH,"zzJango Krrsantan zDengar zIG-88 Cad",1
"Zack g",0,1,96578,FO,"zzKRU zKylo zHux FOO FOE",1
"Zack g",0,1,89877,Phoenix,"zHera zEzra Zeb zKanan Sabine G8",1
"Zack g",1,1,74303,Rogue1,"Jyn Chirrut G8, Baze G8, Cassian G9, K-2SO G9",1
"Zack g",1,0,126629,zMaul,"zDarth Maul, zDooku zSidious zSavage Sith Marauder",1
"Zack g",1,0,113435,EP (Counter, Rebel),"zzEP Shoretrooper G8, Krennic DT G9, zzWampa",1
"Zack g",1,0,108913,Troopers,"zVeers zzPiett zzGideon G9, zDark Trooper G9, Range Trooper G8",0
"Zack g",,,83955,Bad Batch,"zHunter G9, zEcho G8, zzOmega G8, zTech G9, zWrecker G8",0
"Zack g",1,0,71483,Jawas,"Nebit G8, Jawa Engineer G7, Jawa Scavenger G7, Jawa Dathcha G8",0
"Mol Chod",1,1,164740,GL Rey,"zzzzzzRey zzzJTR zzR2-D2 zRH Poe, zRH Finn",1
"Mol Chod",1,1,104250,NS,"zzMT zzAV zDaka Zombie Spirit",1
"Mol Chod",,,523903,Executor,"Executor 5* HT RC Xanadu Blood, Slave I, IG-2000 Imperial TIE Fighter, Tie Adv",1
"Mol Chod",0,1,146424,padme,"zzPadme zGK zJKA zAhsoka zzzCAT",1
"Mol Chod",,,168177,JMLS,"zzzJKR zzJKL zzzzzzJMLS zWat Tambor, zzzzGAS",1
"Mol Chod",1,0,147564,CLS,"zzzCLS zHan zzChewbacca zzC-3PO zChewpio",1
"Mol Chod",0,1,112618,DRMalak,"zzzDR HK-47 zBSF zzMalak Sith Empire Trooper G9",1
"Mol Chod",,,417916,HansMF,"Home One, Han's MF, Rebel Y-wing, Bistan's U-wing, Phantom Biggs X-wing, Cassian's U-wing, Wedge X-wing",1
"Mol Chod",0,1,118048,Geonosians,"zzGBA Sun Fac, Geo Soldier, Geo Spy, Poggle",1
"Mol Chod",0,1,120822,Grievous,"zGG zB2 zB1 zMagnaGuard zNute",1
"Mol Chod",,,113115,Disintegration,"Aurra Greef G9, zBoba zzBossk The Mandalorian",1
"Mol Chod",,,109523,Mon Mothma,"zMon Mothma, Lando Wedge Biggs zCara Dune",1
"Mol Chod",1,0,145282,ShaakClones,"zzShaak Ti, zRex zEcho (501st), zzFives zARC Trooper",1
"Mol Chod",1,1,99044,Carth,"zCarth Onasi, zMission zZaalbar Juhani zCanderous",1
"Mol Chod",0,1,71326,Phoenix,"Hera G9, Ezra Zeb G8, Kanan G8, Sabine G8",1
"Mol Chod",1,0,91517,Thragma (Counter),"zThrawn Magma G9, DT G9, zTarkin Shoretrooper G9",1
"Mol Chod",1,1,74297,Rogue1,"zJyn G8, Chirrut G8, Baze G9, Cassian G9, K-2SO G8",1
"Mol Chod",,,131515,Bad Batch,"zHunter zEcho zzOmega zTech zWrecker",1
"Mol Chod",1,0,93453,EP (Counter, Rebel),"zEP zzWampa Nest Range Trooper G9, Starck G9",1
"Mol Chod",1,0,115726,Jawas,"Nebit Jawa Engineer, Jawa Scavenger, Jawa Dathcha",1
"Mol Chod",1,0,13732,SionSolo (Counter),"Sion G8",1
"Mol Chod",,,139519,LV,"zzzzzzLord Vader, zzPiett Gideon G7, RG G9, zzzVader",0
"Mol Chod",,,72284,Phasma,"Phasma FOTP G8, FOSFTP G7, FOST G9, zKylo",0
"Mol Chod",,,299483,Malevolence,"Malevolence Hyena Bomber 4*, Vulture Droid, Sun Fac SF, Soldier SF, Spy SF",0
"Mol Chod",1,1,88992,Ewoks,"zChirpa Elder Paploo G7, zWicket zLogray",0
"Mol Chod",0,1,126552,BH,"Jango G9, zDengar zZam zIG-88 zEmbo",0
"Mol Chod",0,1,112326,BS,"BS GMY G9, zJolee zzOld Ben, zzHYoda",0
"Lightnfive",,,342223,Negotiator,"Negotiator HT Anakin's Eta-2, Umbaran SF, Ahsoka's SF, BTL-B Y-wing, Clone Sergeant's ARC-170, Plo's SF",1
"Lightnfive",,,303502,HansMF,"Home One, Han's MF, Biggs X-wing, Bistan's U-wing, Phantom Ghost Cassian's U-wing, Wedge X-wing",1
"Lightnfive",,,353359,Executrix,"Executrix Tie Adv, Emperor's Shuttle, TIE Reaper, Imperial TIE Fighter, Gauntlet Starfighter, FOSF TIE Fighter, FO TIE Fighter",1
"Lightnfive",1,1,147901,Revan,"zzzJKR zBS zzGMY zJolee zGK",1
"Lightnfive",1,1,110226,Carth,"Carth Onasi G8, zMission zZaalbar zJuhani Canderous",1
"Lightnfive",0,1,113937,BH,"zzBossk zzThe Mandalorian, zBoba zIG-88 Jango",1
"Lightnfive",1,1,124496,zEP,"zzEP zzzVader Tarkin G8, TFP G8, zzDN",1
"Lightnfive",0,1,75896,Phoenix,"Hera Ezra G9, Zeb G9, Kanan Sabine",1
"Lightnfive",1,1,69089,Rogue1,"Jyn G8, Chirrut G8, Baze G8, Cassian G8, zK-2SO",1
"Lightnfive",1,0,135131,zMaul,"zDarth Maul, zBSF zDooku zSidious zSavage",1
"Lightnfive",1,0,15655,SionSolo (Counter),"zSion G8",1
"Lightnfive",,,71549,Phasma,"Phasma G8, FOTP G8, FOSFTP G7, zFOST zKylo",0
"Lightnfive",1,0,85159,CLS,"zzzCLS zHan G7, Chewbacca G2, zzR2-D2 Chewpio G1",0
"Lightnfive",1,1,90792,NS,"zzMT G8, zzAV zDaka Zombie Spirit G8",0
"Lightnfive",0,1,74594,Geonosians,"GBA Sun Fac, Geo Soldier G8, Geo Spy G9, Poggle",0
"Lightnfive",0,1,73614,Grievous-Wat,"zzGG B2 G6, B1 G7, zMagnaGuard G9, Wat Tambor G5",0
"Lightnfive",1,1,98332,Ewoks,"zChirpa Elder Paploo G7, zWicket zLogray",0
"Lightnfive",1,0,68985,ShaakClones,"Shaak Ti G6, zRex Echo (501st) G8, Fives G9, Clone Sergeant G9",0
"Lightnfive",1,0,71826,Wiggs,"Wedge G8, Biggs G8, zFulcrum G8, C-3PO G6, zLeia",0
"Lightnfive",1,0,53752,Thragma (Counter),"Thrawn G6, Magma G7, DT G8, Krennic G7, Stormtrooper G8",0
"Lightnfive",,,68488,Mando,"The Mandalorian (Beskar Armor) G7, Dash Rendar G6, Nest G6, IG-11 zKuiil",0
"Lightnfive",,,54243,Bad Batch,"Hunter G7, Echo G6, Omega G8, Tech G6, Wrecker G5",0
"Lightnfive",1,0,98476,QGJ,"zQGJ Aayla G6, zJKA zzOld Ben, zAhsoka",0
"Lightnfive",1,0,64307,Jawas,"Nebit G8, Jawa Engineer G9, Jawa Scavenger G7, Jawa G8, Dathcha",0
"Xebe",0,1,110328,DRMalak,"zzzDR HK-47 zBSF zzMalak 6* Sith Assassin",1
"Xebe",0,1,106137,Geonosians,"zzGBA Sun Fac, Geo Soldier, Geo Spy, Poggle",1
"Xebe",1,0,100466,Troopers,"zVeers zzPiett zzGideon zDark Trooper, Range Trooper",1
"Xebe",1,1,117488,Revan,"zzzJKR zBS zzGMY zJolee zGK",1
"Xebe",1,1,89370,Carth,"Carth Onasi, zMission Zaalbar Juhani Canderous",1
"Xebe",1,0,95044,Wiggs,"Wedge Biggs zzzCLS zHan Ezra",1
"Xebe",0,1,74930,FO,"zzKRU Kylo G9, Phasma G8, FOO G9, zFOTP",1
"Xebe",,,312004,Negotiator,"Negotiator HT Anakin's Eta-2 6*, Umbaran SF, Ahsoka's SF, Clone Sergeant's ARC-170, Jedi Consular's Starfighter, Plo's SF",0
"Xebe",0,1,65108,Grievous,"zzGG G9, B2 G4, B1 G3, MagnaGuard G7, zNute G5",0
"Xebe",1,1,46388,NS_Alt,"AV G4, Talia G8, Spirit G3, Daka G7, Zombie 6* G5",0
"Xebe",1,1,69044,Ewoks,"zChirpa G7, Elder Paploo G7, zWicket Logray G8",0
"Xebe",1,1,87917,zEP,"EP zzzVader zzTarkin TFP Traya G2",0
"Xebe",0,1,93473,BH,"zBossk Greedo zBoba IG-88 Jango",0
"Xebe",1,0,57809,501st,"Rex G6, Clone Sergeant G8, Echo (501st) G6, Fives G9, zAhsoka",0
"Xebe",0,1,68732,Phoenix,"Hera Chopper Zeb G9, Kanan G9, Sabine 5* G7",0
"Cukorbors",,,123994,Phasma,"zPhasma zFOTP FOSFTP zFOST zKylo",1
"Cukorbors",1,1,156233,SL Kylo,"zzzzzzSL Kylo, zSith Trooper, zHux zzKRU zThrawn",1
"Cukorbors",,,166830,SEE,"zzzzzzSEE zBSF zzMalak zzzDR zzzVader",1
"Cukorbors",,,556162,Executor,"Executor 5* HT RC Xanadu Blood, Slave I, IG-2000 Imperial TIE Fighter, Tie Adv",1
"Cukorbors",0,1,139686,padme,"zzPadme zGK zJKA zAhsoka zzzCAT",1
