Player,Offense,Defense,GP,Name,Squad,Viable
"bdvil",,,253429,Malevolence,"Malevolence 5* Hyena Bomber 5*, Vulture Droid 6*, Sun Fac SF, Soldier SF, Spy SF",0
"bdvil",0,1,87570,Geonosians,"zzGBA Sun Fac G8, Geo Soldier, Geo Spy, Poggle",0
"bdvil",0,1,81305,Grievous,"zzGG B2 6* G8, zB1 Droideka G8, MagnaGuard G8",0
"bdvil",1,0,83657,Troopers,"zVeers zzPiett Gideon 5* G7, Dark Trooper 6* G8, Range Trooper 6* G6",0
"bdvil",,,463455,Executrix,"Executrix Tie Adv, Emperor's Shuttle, TIE Reaper 4*, Imperial TIE Fighter, Gauntlet Starfighter, FOSF TIE Fighter, FO TIE Fighter",0
"bdvil",,,62750,Iden Troopers,"Iden Versio 6* G8, Shoretrooper G8, Snowtrooper G7, Magma G7, DT G8",0
"bdvil",,,50825,Bad Batch,"Hunter 6* G8, Echo 4* G7, Omega 5* G8, Tech 5* G8, Wrecker 5* G7",0
"Chillin Oso",1,1,97982,NS,"zMT zAV zDaka Zombie Spirit",1
"Chillin Oso",,,161428,JMLS,"zzzJKR zzJKL zzzzzJMLS zHYoda zzzGAS",1
"Chillin Oso",1,0,144205,CLS,"zzCLS zHan zChewbacca zzC-3PO zChewpio",1
"Chillin Oso",0,1,125302,DRMalak,"zzzDR HK-47 zBSF zzMalak Sith Empire Trooper",1
"Chillin Oso",0,1,124778,padme,"zzPadme zGK zJKA zAhsoka zBarriss",1
"Chillin Oso",,,415935,HansMF,"Home One, Han's MF, Rebel Y-wing 6*, Bistan's U-wing, Phantom Biggs X-wing, Cassian's U-wing, Wedge X-wing",1
"Chillin Oso",0,1,108411,Geonosians,"zzGBA Sun Fac, Geo Soldier, Geo Spy, Poggle",1
"Chillin Oso",0,1,124406,Grievous,"zzGG zB2 zB1 zMagnaGuard zNute",1
"Chillin Oso",1,0,115704,Traya,"zzTraya zDN Sion zzEP Thrawn",1
"Chillin Oso",1,1,107562,JTR,"zzJTR Scav Rey, BB-8 zR2-D2 Finn G9",1
"Chillin Oso",,,107884,Mon Mothma,"zzMon Mothma, Lando Wedge Cara Dune, Biggs",1
"Chillin Oso",1,1,87473,Ewoks,"zChirpa Elder Paploo Wicket Logray",1
"Chillin Oso",1,0,121858,ShaakClones,"zzShaak Ti, zRex zEcho (501st), zzFives ARC Trooper",1
"Chillin Oso",0,1,119266,BH,"zzBossk Boba zJango Dengar Cad",1
"Chillin Oso",1,1,90664,Carth,"zCarth Onasi, zMission Zaalbar zJuhani Canderous G8",1
"Chillin Oso",0,1,106296,FO,"zKRU Kylo FOO FOE FOST",1
"Chillin Oso",1,0,106998,Troopers,"zVeers Starck Range Trooper, zzPiett zGideon",1
"Chillin Oso",0,1,76198,Phoenix,"Hera Kanan G8, Ezra Zeb G8, Sabine",1
"Chillin Oso",1,1,71052,Rogue1,"Jyn Chirrut G8, Baze G8, Cassian K-2SO G8",1
"Chillin Oso",1,0,71588,Jawas,"Nebit G9, Jawa Engineer, Jawa Scavenger, Jawa Dathcha",1
"Chillin Oso",1,0,16021,NestSolo (Counter),"Nest",1
"Chillin Oso",,,386408,Executrix,"Executrix Tie Adv, Emperor's Shuttle 5*, TIE Reaper 5*, Imperial TIE Fighter, Gauntlet Starfighter, FOSF TIE Fighter, FO TIE Fighter",0
"Chillin Oso",,,70771,Iden Troopers,"Iden Versio 5*, Shoretrooper Snowtrooper Magma G8, DT",0
"Chillin Oso",1,0,81411,zMaul,"Darth Maul, Dooku Sidious Savage Sith Marauder",0
"Chillin Oso",,,62372,Bad Batch,"Hunter 6* G9, Echo Omega 6* G8, Tech 5* G9, Wrecker G8",0
"Cukorbors",,,123994,Phasma,"zPhasma zFOTP FOSFTP zFOST zKylo",1
"Cukorbors",1,1,156233,SL Kylo,"zzzzzzSL Kylo, zSith Trooper, zHux zzKRU zThrawn",1
"Cukorbors",,,166830,SEE,"zzzzzzSEE zBSF zzMalak zzzDR zzzVader",1
"Cukorbors",0,1,139686,padme,"zzPadme zGK zJKA zAhsoka zzzCAT",1
"Cukorbors",1,0,146753,CLS,"zzzCLS zHan zzChewbacca zzC-3PO zChewpio",1
"Cukorbors",1,1,108478,NestSisters,"zzAV zzMT zDaka Zombie zNest",1
"Cukorbors",,,478700,Negotiator,"Negotiator HT Anakin's Eta-2, Umbaran SF, Ahsoka's SF, BTL-B Y-wing, Clone Sergeant's ARC-170, Plo's SF",1
"Cukorbors",,,301691,Malevolence,"Malevolence Hyena Bomber, Vulture Droid, Sun Fac SF, Soldier SF, Spy SF",1
"Cukorbors",,,141742,JKL,"zzJKL zzzJKR zzHYoda zzOld Ben, Aayla",1
"Cukorbors",,,436651,HansMF,"Home One, Han's MF, Rebel Y-wing, Bistan's U-wing, Phantom Ghost Cassian's U-wing, Wedge X-wing",1
"Cukorbors",1,1,118795,JTR,"zzzJTR zzR2-D2 zzBB-8 RH Finn G8, RH Poe G9",1
"Cukorbors",0,1,94666,Geonosians,"zzGBA Sun Fac, Geo Soldier, Geo Spy, Poggle",1
"Cukorbors",0,1,125207,Grievous,"zzGG zB2 zB1 zMagnaGuard zNute",1
"Cukorbors",1,0,122762,Traya,"zzTraya zzDN zSion zzEP Sith Empire Trooper",1
"Cukorbors",,,108875,Mon Mothma,"zzMon Mothma, Baze Wedge zCara Dune, Biggs",1
"Cukorbors",,,117827,Disintegration,"zAurra Greef G8, zBoba zzBossk zThe Mandalorian",1
"Cukorbors",1,1,80912,Ewoks,"zChirpa G9, Elder Paploo Wicket Logray G9",1
"Cukorbors",1,0,110595,ShaakClones,"zzShaak Ti, zRex zEcho (501st), zzFives zARC Trooper",1
"Cukorbors",1,1,96586,Carth,"zCarth Onasi, zMission zZaalbar Juhani zCanderous",1
"Cukorbors",0,1,131892,BH,"zzJango zIG-88 zZam zDengar zzEmbo",1
"Cukorbors",1,0,131914,Troopers,"zVeers zStarck zIden Versio, zzPiett zDark Trooper",1
"Cukorbors",0,1,92832,Phoenix,"zHera zKanan zEzra zZeb Sabine",1
"Cukorbors",1,0,132453,zMaul,"zDarth Maul, zDooku zSidious zSavage Sith Marauder",1
"Cukorbors",1,0,68955,Jawas,"Nebit G8, Jawa Engineer G9, Jawa Scavenger G8, Jawa G9, Dathcha G9",1
"Cukorbors",,,487338,Executrix,"Executrix Tie Adv, Emperor's Shuttle, TIE Reaper 6*, Imperial TIE Fighter, Gauntlet Starfighter, FOSF TIE Fighter, FO TIE Fighter",0
"Cukorbors",,,88974,Bad Batch,"zHunter G9, zEcho G9, zzOmega G9, zTech G9, zWrecker G9",0
"Veran",0,1,91913,DR,"zzDR HK-47 BSF Sith Empire Trooper G9, Thrawn",1
"Veran",1,1,131308,Revan,"zzzJKR zBS zzGMY zJolee zGK",1
"Veran",1,1,88455,Carth,"Carth Onasi, zMission Zaalbar Juhani Canderous",1
"Veran",1,1,81300,Ewoks,"zChirpa Elder Paploo Teebo Scout",1
"Veran",0,1,98920,BH,"zBossk The Mandalorian, Boba zJango zGreef",1
"Veran",0,1,73303,Phoenix,"Hera G9, Kanan G9, Ezra Zeb G8, Chopper G9",1
"Veran",1,1,111464,zEP,"zzEP zzzVader Tarkin Dooku DN",1
"Veran",,,73914,Phasma,"Phasma G8, FOE G9, FOO G8, zKRU Kylo G9",0
"Veran",0,1,51713,Geonosians,"GBA 5* G9, Sun Fac G7, Geo Soldier G8, Geo Spy G8, Poggle",0
"Veran",1,1,72181,JTR,"JTR G8, Scav Rey, BB-8 G9, R2-D2 Finn G9",0
"Veran",0,1,70649,Grievous,"GG G9, B2 MagnaGuard IG-88 G8, T3-M4 G7",0
"Veran",1,0,77661,501st,"Rex G9, ARC Trooper G8, Echo (501st) G8, Fives zAhsoka",0
"Veran",1,0,79909,Wiggs,"Wedge G7, Biggs G8, zCLS zHan zChewbacca G9",0
"Someone",,,117295,Phasma,"zPhasma zFOTP FOSFTP zzKRU zKylo",1
"Someone",1,0,160078,CLS,"zzzCLS zHan zzChewbacca zzC-3PO zChewpio",1
"Someone",0,1,151738,DRMalak,"zzzDR zzHK-47 zBSF zzMalak Sith Empire Trooper",1
"Someone",0,1,134439,padme,"zzPadme zGK zJKA zAhsoka CW Chewbacca G8",1
"Someone",,,360395,Malevolence,"Malevolence 6* Hyena Bomber, Vulture Droid, Sun Fac SF, Soldier SF, Spy SF",1
"Someone",1,1,122715,NS_Alt,"zzMT zzAV zDaka Talia Zombie",1
"Someone",,,454599,HansMF,"Home One, Han's MF, Rebel Y-wing, Bistan's U-wing, Phantom Biggs X-wing, Cassian's U-wing, Wedge X-wing",1
"Someone",1,1,122842,JTR,"zzzJTR zzR2-D2 zzBB-8 RH Finn G9, RH Poe",1
"Someone",0,1,132216,Geonosians,"zzGBA Sun Fac, Geo Soldier, Geo Spy, Poggle",1
"Someone",0,1,133484,Grievous,"zzGG zB2 zB1 zMagnaGuard zNute",1
"Someone",1,0,125958,Troopers,"zVeers zzPiett zzGideon zDark Trooper, Range Trooper",1
"Someone",,,487270,Executrix,"Executrix Tie Adv, Emperor's Shuttle, TIE Reaper, Imperial TIE Fighter, Gauntlet Starfighter, FOSF TIE Fighter, FO TIE Fighter",1
"Someone",,,128538,Disintegration,"Aurra zzGreef zBoba zzBossk zThe Mandalorian",1
"Someone",1,1,138998,GAS,"zzzzGAS zRex zEcho (501st), zzFives zARC Trooper",1
"Someone",1,1,132920,Revan Offense,"zzzJKR zGMY zBS zJolee Ezra",1
"Someone",1,1,113592,Ewoks,"zChirpa Elder zPaploo zWicket Logray G9",1
"Someone",1,1,89348,Carth,"zCarth Onasi, zMission Zaalbar G8, zJuhani Canderous G8",1
"Someone",1,1,143094,zEP,"zzEP zzzVader zTarkin TFP zzMara Jade, The Emperor's Hand",1
"Someone",0,1,125160,BH,"zzJango zIG-88 zFennec Shand, Dengar Greedo",1
"Someone",,,93463,Iden Troopers,"zIden Versio, Stormtrooper Snowtrooper G9, Magma zDT",1
"Someone",1,0,118268,zMaul,"zDarth Maul, zSidious zDooku Sith Marauder, Nest",1
"Someone",0,1,80256,Phoenix,"Hera Kanan G8, Zeb G8, Chopper Sabine",1
"Someone",1,1,83054,Rogue1,"Jyn Chirrut G8, Baze Cassian K-2SO",1
"Someone",1,0,81824,Jawas,"Nebit G8, Jawa Engineer, Jawa Scavenger, Jawa Dathcha",1
"Someone",1,0,21262,SionSolo (Counter),"zSion",1
"Someone",,,95647,Mon Mothma,"zzMon Mothma G9, Hoth Rebel Scout, Scarif zCara Dune, Biggs",0
"Someone",,,114101,Bad Batch,"zHunter zEcho zzOmega zTech zWrecker G9",0
"Renegade",1,0,134316,CLS,"zzzCLS zHan zzChewbacca zzC-3PO zChewpio",1
"Renegade",0,1,133776,DRMalak,"zzzDR zzHK-47 zBSF zzMalak Sith Empire Trooper",1
"Renegade",1,1,99864,NestSisters,"zzAV zMT zDaka Zombie zNest",1
"Renegade",,,456140,Negotiator,"Negotiator HT Anakin's Eta-2, Umbaran SF, Ahsoka's SF, BTL-B Y-wing, Clone Sergeant's ARC-170, Plo's SF",1
"Renegade",,,318715,Malevolence,"Malevolence Hyena Bomber, Vulture Droid, Sun Fac SF, Soldier SF, Spy SF",1
"Renegade",,,436533,HansMF,"Home One, Han's MF, Rebel Y-wing, Bistan's U-wing, Phantom Ghost Cassian's U-wing, Wedge X-wing",1
"Renegade",0,1,110720,Geonosians,"zzGBA Sun Fac, Geo Soldier, Geo Spy, Poggle",1
"Renegade",1,1,105474,JTR,"zzzJTR zzR2-D2 BB-8 zRH Finn, zRH Poe",1
"Renegade",0,1,118654,Grievous,"zzGG zB2 zB1 zMagnaGuard zNute",1
"Renegade",1,0,120671,Traya,"zzTraya zDN zSion zzEP zThrawn",1
"Renegade",,,112503,Disintegration,"Aurra zzGreef zBoba zzBossk zzThe Mandalorian",1
"Renegade",1,1,133583,Revan,"zzzJKR zBS zGMY zJolee zGK",1
"Renegade",1,1,96271,Ewoks,"zChirpa Elder zPaploo zWicket zLogray",1
"Renegade",1,0,112062,ShaakClones,"zzShaak Ti, zRex zEcho (501st), zzFives zARC Trooper",1
"Renegade",1,1,98368,Carth,"zCarth Onasi, zMission Zaalbar zJuhani zCanderous",1
"Renegade",0,1,98122,FO,"zzKRU Kylo zHux FOO FOE",1
"Renegade",0,1,94657,Phoenix,"zHera zKanan zEzra Zeb zSabine",1
"Renegade",1,1,100731,Rogue1,"zzJyn Chirrut Baze zCassian zK-2SO",1
"Renegade",1,0,89612,Jawas,"Nebit Jawa Engineer, Jawa Scavenger, Jawa Dathcha",1
"Renegade",,,399900,Executrix,"Executrix Tie Adv, Emperor's Shuttle, TIE Reaper 6*, Imperial TIE Fighter, Gauntlet Starfighter, FOSF TIE Fighter, FO TIE Fighter",0
"Renegade",1,0,67608,Troopers,"Veers Piett G7, Gideon Dark Trooper G9, Range Trooper G6",0
"Renegade",,,78978,Mon Mothma,"Mon Mothma G8, Lando Wedge Cara Dune, Biggs",0
"Renegade",,,79132,Iden Troopers,"zIden Versio, Shoretrooper Snowtrooper G8, Magma G8, zDT",0
"Renegade",0,1,91708,BH,"zJango zIG-88 Dengar Greedo G9, Cad",0
"Renegade",,,65209,Bad Batch,"Hunter G7, Echo G7, Omega G8, Tech G8, Wrecker G7",0
"Renegade",1,0,104412,QGJ,"QGJ Aayla G6, zJKA zzOld Ben, zAhsoka",0
"MINI kccoyote",0,1,104646,BH,"zBossk zThe Mandalorian, Boba Dengar Greedo",1
"MINI kccoyote",1,1,120542,zEP,"zzEP zzVader Tarkin TFP zMara Jade, The Emperor's Hand 5*",1
"MINI kccoyote",0,1,135306,FO,"zzKRU zKylo zHux FOE zFOST",1
"MINI kccoyote",1,0,107756,Troopers,"zVeers Starck DT zzPiett zDark Trooper",1
"MINI kccoyote",0,1,65128,Phoenix,"Hera G8, Kanan G8, Ezra G9, Zeb G8, Chopper G8",1
"MINI kccoyote",1,0,115232,zMaul,"Darth Maul, zSidious Dooku Sith Marauder, Nest G7",0
"MINI kccoyote",1,0,87632,CLS,"CLS zHan Leia G8, Old Ben G4, zzChewbacca",0
"Vilu Dascar",1,1,158527,GL Rey,"zzzzzzRey zzzJTR zBB-8 zHoldo zRH Finn",1
"Vilu Dascar",,,545264,Executor,"Executor 5* HT RC Xanadu Blood, Slave I, IG-2000 Imperial TIE Fighter, Tie Adv",1
"Vilu Dascar",0,1,114708,DRMalak,"zzzDR zHK-47 zBSF zzMalak Sith Empire Trooper",1
"Vilu Dascar",0,1,97653,padme,"zzPadme zGK JKA Ahsoka G8, zzC-3PO",1
"Vilu Dascar",,,333186,HansMF,"Home One, Han's MF, Rebel Y-wing 6*, Bistan's U-wing, Phantom Ghost Cassian's U-wing, Biggs X-wing",1
"Vilu Dascar",0,1,96490,Geonosians,"zzGBA Sun Fac, Geo Soldier, Geo Spy, Poggle",1
"Vilu Dascar",0,1,92310,Grievous,"zzGG B2 G8, zB1 zDroideka MagnaGuard",1
"Vilu Dascar",,,103641,Nute-Wat,"zNute zDooku zWat Tambor 6*, zzJango zNest G9",1
"Vilu Dascar",1,1,114474,Revan Offense,"zzzJKR zzGMY zBS zJolee zHYoda",1
"Vilu Dascar",1,1,91027,Ewoks,"zChirpa Elder Paploo zWicket zLogray",1
"Vilu Dascar",1,0,96807,ShaakClones,"zzShaak Ti, zRex zEcho (501st), zFives ARC Trooper",1
"Vilu Dascar",0,1,144068,BH,"zzBossk zIG-88 Krrsantan zBoba zDengar",1
"Vilu Dascar",1,1,88530,Carth,"zCarth Onasi, zMission zZaalbar Juhani Canderous G8",1
"Vilu Dascar",1,1,115926,zEP,"zzEP zzzVader zTarkin TFP zMara Jade, The Emperor's Hand 5*",1
"Vilu Dascar",1,0,110330,Troopers,"zVeers zStarck Range Trooper, zzPiett zGideon",1
"Vilu Dascar",1,0,99262,Jawas,"Nebit Jawa Engineer, Jawa Scavenger, Jawa Dathcha",1
"Vilu Dascar",1,0,20038,SionSolo (Counter),"zSion",1
"Vilu Dascar",,,64380,Phasma,"Phasma G8, FOTP G8, FOE 6* G8, zKRU Kylo G9",0
"Vilu Dascar",1,0,130718,CLS,"zzzCLS zHan zzChewbacca zzR2-D2 Chewpio G8",0
"Vilu Dascar",1,1,66167,NS_Alt,"MT G8, AV G9, Daka G9, Talia G8, Zombie",0
"Vilu Dascar",0,1,69621,Phoenix,"Hera G8, zKanan G8, Ezra Zeb G7, Chopper G7",0
"Ethan Geilvta",0,1,136829,DRMalak,"zzzDR zzHK-47 zBSF zzMalak Sith Assassin G9",1
"Ethan Geilvta",0,1,137116,padme,"zzPadme zGK zJKA zAhsoka zzC-3PO",1
"Ethan Geilvta",,,377612,HansMF,"Home One, Han's MF, Rebel Y-wing, Bistan's U-wing, Phantom Ghost Cassian's U-wing, Biggs X-wing",1
"Ethan Geilvta",,,496789,Negotiator,"Negotiator 6* HT Anakin's Eta-2, Umbaran SF, Ahsoka's SF, Clone Sergeant's ARC-170, Plo's SF, Rex's ARC-170",1
"Ethan Geilvta",1,1,108255,NS_Alt,"zzMT Acolyte zDaka zAV Zombie",1
"Ethan Geilvta",0,1,119641,Geonosians,"zzGBA Sun Fac, Geo Soldier, Geo Spy, Poggle",1
"Ethan Geilvta",1,0,102484,Traya,"zzTraya zDN zSion Sith Empire Trooper G8, Thrawn G9",1
"Ethan Geilvta",1,1,88493,JTR,"zzJTR Scav Rey, BB-8 G8, zR2-D2 Finn G9",1
"Ethan Geilvta",,,104356,Nute-Wat,"zNute zB1 zB2 zMagnaGuard zWat Tambor 6*",1
"Ethan Geilvta",1,1,135705,Revan Offense,"zzzJKR zGMY zBS zJolee zEzra",1
"Ethan Geilvta",1,1,92594,Ewoks,"zChirpa Elder zPaploo zWicket zLogray",1
"Ethan Geilvta",1,0,118226,ShaakClones,"zzShaak Ti, zRex zEcho (501st), zzFives Clone Sergeant",1
"Ethan Geilvta",0,1,124289,BH,"zzBossk The Mandalorian, zBoba zJango zDengar",1
"Ethan Geilvta",1,1,129017,zEP,"zzEP zzzVader Tarkin TFP G9, zzMara Jade, The Emperor's Hand",1
"Ethan Geilvta",0,1,133851,FO,"zzKRU zKylo zHux FOO FOE",1
"Ethan Geilvta",0,1,78311,Phoenix,"Hera Kanan G8, Zeb G8, Chopper Sabine",1
"Ethan Geilvta",1,0,69085,Jawas,"Nebit G8, Jawa Engineer G9, Jawa Scavenger G8, Jawa G9, Dathcha G9",1
"Ethan Geilvta",1,0,19602,NestSolo (Counter),"zNest",1
"Ethan Geilvta",,,416658,Executrix,"Executrix Tie Adv, Emperor's Shuttle, TIE Reaper 3*, Imperial TIE Fighter, Gauntlet Starfighter, FOSF TIE Fighter, FO TIE Fighter",0
"Ethan Geilvta",1,0,57727,Troopers,"Veers Piett G9, Gideon 5* G9, Dark Trooper 5* G7, Range Trooper 6* G3",0
"Ethan Geilvta",,,77037,Mon Mothma,"Mon Mothma 6* G8, Cassian G8, Chirrut G8, zCara Dune, Jyn",0
"Ethan Geilvta",1,1,92111,Carth,"zCarth Onasi, zMission zZaalbar Juhani G7, Canderous",0
"Ethan Geilvta",1,0,97626,Wiggs,"Wedge G7, Biggs G8, zzCLS zHan zzChewbacca",0
"Ethan Geilvta",,,62325,Iden Troopers,"zIden Versio 4* G8, Stormtrooper G8, Snowtrooper G9, Magma G8, DT 6* G7",0
"Ethan Geilvta",,,67761,Bad Batch,"Hunter 6* G9, Echo 5* G9, zOmega G9, Tech 6* G9, zWrecker 6* G7",0
"Wicked",1,1,96990,NS_Alt,"zzMT zAV zDaka Talia Zombie",1
"Wicked",,,320201,HansMF,"Home One, Han's MF 5*, Biggs X-wing, Bistan's U-wing, Phantom Ghost Cassian's U-wing, Wedge X-wing",1
"Wicked",0,1,97455,Geonosians,"zzGBA Sun Fac, Geo Soldier, Geo Spy, Poggle",1
"Wicked",1,1,130467,Revan,"zzzJKR zBS zzGMY zJolee GK G8",1
"Wicked",1,1,111030,Ewoks,"zChirpa Elder zPaploo Teebo zWicket",1
"Wicked",1,1,99008,Carth,"zCarth Onasi, zMission zZaalbar zJuhani zCanderous",1
"Wicked",0,1,136416,BH,"zzBossk zBoba zzJango zGreedo Cad",1
"Wicked",1,1,123495,zEP,"zzEP zzzVader Tarkin TFP zBSF",1
"Wicked",1,0,113332,501st,"zRex ARC Trooper G8, zEcho (501st), zzFives zAhsoka",1
"Wicked",,,41264,Phasma,"Phasma G8, FOTP 5* G7, FOO G8, KRU 5* G8, Kylo 6* G8",0
"Wicked",1,0,107276,CLS,"zzCLS zHan zzChewbacca R2-D2 C-3PO G7",0
"Wicked",1,0,65067,Troopers,"Veers Starck G9, Stormtrooper G9, Shoretrooper DT",0
"Wicked",1,0,57614,Wiggs,"Wedge G8, Biggs G8, Fulcrum G1, Ezra G8, Leia G9",0
"Wicked",1,1,70711,Rogue1,"Jyn 5* G8, Chirrut Baze Cassian G8, K-2SO G8",0
"Wicked",0,1,60696,Phoenix,"Hera 5* G8, Kanan G8, Zeb G8, Chopper G8, Sabine G8",0
"Wicked",1,0,98496,zMaul,"Darth Maul G8, zDooku DN zzzDR zSidious",0
"Wicked",1,0,7071,NestSolo (Counter),"Nest 4* G6",0
"NAS1016",,,102611,Phasma,"zPhasma FOTP FOE zzKRU zKylo",1
"NAS1016",,,164401,SEE,"zzzzzzSEE zBSF zzMalak zzzDR zzzVader",1
"NAS1016",1,1,119567,NestSisters,"zzAV zzMT zDaka Zombie zNest",1
"NAS1016",0,1,142981,padme,"zzPadme zGK zJKA zAhsoka zzC-3PO",1
"NAS1016",,,489815,Negotiator,"Negotiator 6* HT Anakin's Eta-2, Umbaran SF, Ahsoka's SF, Clone Sergeant's ARC-170, Plo's SF, Rex's ARC-170",1
"NAS1016",,,373427,HansMF,"Home One, Han's MF 6*, Biggs X-wing, Bistan's U-wing, Phantom Ghost Cassian's U-wing, Wedge X-wing",1
"NAS1016",0,1,107630,Geonosians,"zzGBA Sun Fac, Geo Soldier, Geo Spy, Poggle",1
"NAS1016",0,1,127117,Grievous,"zzGG zB2 zB1 zMagnaGuard zNute",1
"NAS1016",1,1,108688,JTR,"zzzJTR zScav Rey, BB-8 G9, zzR2-D2 Finn",1
"NAS1016",1,1,116801,GAS,"zzzzGAS zRex zEcho (501st), zzFives zARC Trooper",1
"NAS1016",1,1,141645,Revan Offense,"zzzJKR zzGMY zBS zJolee zzHYoda",1
"NAS1016",1,1,97235,Ewoks,"zChirpa Elder zPaploo zWicket zLogray",1
"NAS1016",0,1,145839,BH,"zzBossk zBoba zzJango zFennec Shand, zDengar",1
"NAS1016",1,1,110162,Carth,"zCarth Onasi, zMission zZaalbar zJuhani zCanderous",1
"NAS1016",1,0,111410,Troopers,"zVeers zStarck Shoretrooper zzPiett Snowtrooper",1
"NAS1016",0,1,78403,Phoenix,"Hera Kanan G9, zEzra Zeb G8, Chopper G8",1
"NAS1016",1,0,108966,Thragma (Counter),"zzThrawn Magma G9, zKrennic zzTarkin Stormtrooper G9",1
"NAS1016",1,0,124450,zMaul,"zDarth Maul, zDooku zSidious Sith Empire Trooper, Sith Marauder",1
"NAS1016",1,0,69506,Jawas,"Nebit G8, Jawa Engineer G8, Jawa Scavenger G8, Jawa G9, Dathcha G9",1
"NAS1016",1,0,88559,Traya,"Traya DN G9, Sion 5* G8, zzEP Sith Assassin G9",0
"NAS1016",,,76161,Mon Mothma,"Mon Mothma 5* G8, Lando K-2SO G9, Cara Dune, Jyn",0
"NAS1016",1,0,106343,Wiggs,"Wedge G8, Biggs G9, zzzCLS zHan zzChewbacca",0
"NAS1016",,,48029,Bad Batch,"Hunter 5* G7, Echo 4* G7, Omega 5* G6, Tech 5* G8, Wrecker 5* G7",0
"Vorok",1,1,144882,SL Kylo,"zzzzzzSL Kylo, zSith Trooper, zHux zzKRU zThrawn",1
"Vorok",1,0,137538,CLS,"zzzCLS Han zzChewbacca zzC-3PO Chewpio",1
"Vorok",0,1,152352,DRMalak,"zzzDR zzHK-47 zBSF zzMalak Sith Empire Trooper",1
"Vorok",,,480334,Negotiator,"Negotiator BTL-B Y-wing, Anakin's Eta-2, Rex's ARC-170, Umbaran SF, Ahsoka's SF, Plo's SF, Clone Sergeant's ARC-170",1
"Vorok",,,405775,HansMF,"Home One, Han's MF, Rebel Y-wing, Ghost Phantom Biggs X-wing, Cassian's U-wing, Wedge X-wing",1
"Vorok",0,1,117629,Geonosians,"zzGBA Sun Fac, Geo Soldier, Geo Spy, Poggle",1
"Vorok",0,1,146452,Grievous,"zzGG zB2 zB1 zDroideka zMagnaGuard",1
"Vorok",1,1,102509,JTR,"zzJTR Scav Rey, zBB-8 zzR2-D2 zFinn",1
"Vorok",,,96551,Nute-OR,"zNute G9, zDooku zJango zZaalbar zMission",1
"Vorok",1,1,156264,GAS,"zzzzGAS zRex zEcho (501st), zzFives zARC Trooper",1
"Vorok",,,107416,Mon Mothma,"zzMon Mothma, Chirrut Lando Wedge Biggs",1
"Vorok",1,1,127479,Revan,"zzzJKR zBS zGMY zJolee zGK",1
"Vorok",1,1,83687,Ewoks,"zChirpa Elder Paploo Wicket zLogray",1
"Vorok",0,1,96425,BH,"zzBossk Boba Dengar Greedo Cad",1
"Vorok",0,1,75019,Phoenix,"Hera Kanan G9, Ezra Zeb G8, Sabine",1
"Vorok",,,112312,Phasma,"Phasma zFOTP FOSFTP FOST zKylo",0
"Vorok",1,0,42302,Troopers,"Veers G4, Starck G1, Magma G6, Piett G1, Snowtrooper G8",0
"noobhemingway",,,121506,Phasma,"zPhasma zFOTP zSith Trooper, zzKRU zKylo",1
"noobhemingway",0,1,130417,padme,"zzPadme zGK zJKA zAhsoka zzC-3PO",1
"noobhemingway",1,1,97541,NestSisters,"zzAV zMT zDaka Zombie zNest",1
"noobhemingway",0,1,92405,Geonosians,"zGBA Sun Fac, Geo Soldier, Geo Spy, Poggle",1
"noobhemingway",1,0,95694,Traya,"zzTraya zDN zSion Sith Empire Trooper G9, zThrawn",1
"noobhemingway",0,1,118292,Grievous,"zzGG zB2 zB1 zDroideka MagnaGuard",1
"noobhemingway",1,1,105418,JTR,"zzJTR Scav Rey, zzBB-8 zzR2-D2 RT",1
"noobhemingway",1,1,102722,Revan Offense,"zzzJKR zGMY zBS zJolee Ezra G9",1
"noobhemingway",1,1,83051,Ewoks,"zChirpa Elder Paploo Wicket Logray",1
"noobhemingway",1,0,98084,ShaakClones,"zzShaak Ti, zRex zEcho (501st), zFives zARC Trooper",1
"noobhemingway",0,1,100661,BH,"zBossk zIG-88 zZam Boba Dengar",1
"noobhemingway",1,1,109728,zEP,"zzEP zzzVader Tarkin TFP G9, zBSF",1
"noobhemingway",1,0,98546,Wiggs,"Wedge Biggs zCLS zHan zChewbacca",1
"noobhemingway",0,1,65003,Phoenix,"Hera G8, Kanan G8, Zeb G8, Chopper G9, Sabine G8",1
"noobhemingway",,,276473,Malevolence,"Malevolence 5* Hyena Bomber, Vulture Droid 6*, Sun Fac SF, Soldier SF, Spy SF",0
"noobhemingway",1,0,76699,Troopers,"zVeers zPiett G8, Gideon Dark Trooper 6* G7, Range Trooper G9",0
"noobhemingway",,,339694,Executrix,"Executrix Tie Adv, Emperor's Shuttle 4*, TIE Reaper, Imperial TIE Fighter, Gauntlet Starfighter, FOSF TIE Fighter 6*, FO TIE Fighter",0
"noobhemingway",,,81218,Nute-OR,"Nute zDooku Jango G9, Zaalbar G9, Mission",0
"noobhemingway",,,68904,Iden Troopers,"Iden Versio 6*, Shoretrooper G8, Snowtrooper G9, Magma G8, DT",0
"noobhemingway",1,1,55680,Rogue1,"Jyn 5* G7, Chirrut G8, Baze G8, Cassian G8, K-2SO G8",0
"Enderz",0,1,138511,padme,"zzPadme zGK zJKA zAhsoka zzC-3PO",1
"Enderz",1,0,124475,CLS,"zzzCLS Han zzChewbacca zzR2-D2 zChewpio",1
"Enderz",0,1,107463,DR,"zzzDR zHK-47 zBSF Sith Empire Trooper G9, zThrawn",1
"Enderz",,,364236,HansMF,"Home One, Han's MF, Rebel Y-wing 6*, Bistan's U-wing, Phantom Biggs X-wing, Cassian's U-wing, Wedge X-wing",1
"Enderz",0,1,92446,Geonosians,"zzGBA Sun Fac, Geo Soldier, Geo Spy, Poggle",1
"Enderz",0,1,122453,Grievous,"zGG zB2 zB1 zMagnaGuard zNute",1
"Enderz",1,1,144580,GAS,"zzzzGAS zRex zEcho (501st), zFives zARC Trooper",1
"Enderz",1,1,126233,Revan Offense,"zzzJKR zzGMY zBS zJolee zzHYoda",1
"Enderz",1,1,96262,Ewoks,"zChirpa Elder zPaploo zWicket zLogray",1
"Enderz",0,1,128780,BH,"zzBossk zZam zBoba zDengar zzEmbo",1
"Enderz",1,1,94012,Carth,"zCarth Onasi, zMission zZaalbar zJuhani Canderous",1
"Enderz",0,1,83633,FO,"zzKRU Kylo G9, FOO FOE Phasma G9",1
"Enderz",0,1,71494,Phoenix,"Hera G9, Kanan G8, zEzra Zeb G9, Sabine G8",1
"Enderz",1,1,76173,Rogue1,"zJyn Chirrut Baze G8, Cassian K-2SO G9",1
"Enderz",1,0,84297,EP (Counter, Rebel),"EP Shoretrooper G9, Krennic G9, DT G9, zWampa",1
"Enderz",1,0,13723,SionSolo (Counter),"Sion G8",1
"Enderz",,,93911,LV,"zzzLord Vader, Piett 5* G8, zzzVader RG Stormtrooper G9",0
"Enderz",1,1,80017,NS,"zzMT zzAV Daka G9, Zombie Spirit 5* G8",0
"Enderz",,,86706,Mon Mothma,"Mon Mothma G9, Lando Wedge Cara Dune, Biggs",0
"Enderz",1,0,84486,zMaul,"Darth Maul G8, Sidious zDooku Sith Marauder, Nest G4",0
"Enderz",1,0,64321,Troopers,"Veers G9, Starck G7, Magma G9, Gideon 5* G8, Snowtrooper G8",0
"Enderz",0,1,91287,BH,"Jango zIG-88 Aurra G9, zGreedo Cad",0
"Enderz",1,0,58629,Jawas,"Nebit G7, Jawa Engineer G5, Jawa Scavenger G7, Jawa G9, Dathcha G8",0
"IceRoad Combine",,,164133,SEE,"zzzzzzSEE zBSF zzMalak zzzDR zzzVader",1
"IceRoad Combine",1,0,118255,CLS,"zzzCLS zHan zChewbacca C-3PO Chewpio",1
"IceRoad Combine",0,1,99511,Geonosians,"zzGBA Sun Fac, Geo Soldier, Geo Spy, Poggle",1
"IceRoad Combine",,,392050,Negotiator,"Negotiator HT Anakin's Eta-2, Umbaran SF, Ahsoka's SF, Clone Sergeant's ARC-170, Jedi Consular's Starfighter, Rex's ARC-170",1
"IceRoad Combine",1,1,98499,JTR,"zzJTR Scav Rey, zBB-8 zzR2-D2 Finn",1
"IceRoad Combine",1,1,119472,Revan,"zzzJKR BS zGMY zJolee zGK",1
"IceRoad Combine",1,1,80267,Ewoks,"zChirpa Elder zPaploo Wicket G9, Logray G8",1
"IceRoad Combine",1,0,101728,ShaakClones,"zShaak Ti G9, zRex Echo (501st), zFives ARC Trooper",1
"IceRoad Combine",0,1,104796,BH,"zzBossk IG-88 The Mandalorian, zBoba Dengar",1
"IceRoad Combine",1,0,115033,Troopers,"zVeers Starck Shoretrooper zzPiett zDark Trooper",1
"IceRoad Combine",1,1,89150,Rogue1,"zJyn Chirrut Baze Cassian Bistan G8",1
"IceRoad Combine",,,64343,Phasma,"Phasma G8, FOTP G9, FOO G8, FOST G8, zKylo",0
"IceRoad Combine",,,322209,HansMF,"Home One, Han's MF, Biggs X-wing, Bistan's U-wing, Phantom Ghost Cassian's U-wing, Wedge X-wing",0
"IceRoad Combine",0,1,73874,Grievous-Wat,"zGG B2 G9, B1 G9, MagnaGuard G4, zWat Tambor G9",0
"IceRoad Combine",,,100433,Mon Mothma,"zzMon Mothma, Lando Wedge zCara Dune, Biggs",0
"IceRoad Combine",,,98163,Nute-OR,"Nute G8, zDooku Jango zZaalbar zMission",0
"IceRoad Combine",1,0,103307,zMaul,"Darth Maul, zSidious Sith Empire Trooper, Sith Marauder, Nest G2",0
"IceRoad Combine",0,1,65924,Phoenix,"Hera Kanan G8, Ezra G8, Zeb G8, Chopper G7",0
"IceRoad Combine",1,0,98403,EP (Counter, Rebel),"zzEP Krennic DT 5* G3, zzWampa Range Trooper 6* G2",0
"Phee 11",,,102412,Phasma,"zPhasma FOTP FOE zzKRU zKylo",1
"Phee 11",,,165626,SEE,"zzzzzzSEE zBSF zzMalak zzzDR zzzVader",1
"Phee 11",,,167297,JMLS,"zzzJKR zzJKL zzzzzzJMLS zWat Tambor, zzzzGAS",1
"Phee 11",1,0,148898,CLS,"zzzCLS zHan zzChewbacca zzC-3PO zChewpio",1
"Phee 11",1,1,111846,NestSisters,"zzAV zzMT zDaka Zombie zNest",1
"Phee 11",0,1,124088,padme,"zzPadme zGK zJKA zAhsoka CW Chewbacca G8",1
"Phee 11",,,472930,Negotiator,"Negotiator HT Anakin's Eta-2, Umbaran SF, Ahsoka's SF, BTL-B Y-wing 6*, Clone Sergeant's ARC-170, Plo's SF",1
"Phee 11",,,416526,HansMF,"Home One, Han's MF, Rebel Y-wing, Bistan's U-wing, Phantom Biggs X-wing, Cassian's U-wing, Wedge X-wing",1
"Phee 11",1,1,122108,JTR,"zzzJTR zzR2-D2 zzBB-8 RH Finn G9, RH Poe G9",1
"Phee 11",0,1,100631,Geonosians,"zzGBA Sun Fac, Geo Soldier, Geo Spy, Poggle",1
"Phee 11",0,1,125220,Grievous,"zzGG zB2 zB1 zMagnaGuard zNute",1
"Phee 11",1,0,116115,Traya,"zzTraya zzDN zSion Sith Empire Trooper G9, zzThrawn",1
"Phee 11",,,103856,Mon Mothma,"zzMon Mothma, Baze Wedge Cara Dune, Biggs",1
"Phee 11",1,1,96910,Ewoks,"zChirpa Elder zPaploo zWicket zLogray",1
"Phee 11",1,0,129268,ShaakClones,"zzShaak Ti, zRex zEcho (501st), zzFives zARC Trooper",1
"Phee 11",0,1,132635,BH,"zzBossk zzThe Mandalorian, zBoba zDengar zzEmbo",1
"Phee 11",1,1,99531,Carth,"zCarth Onasi, zMission zZaalbar zJuhani zCanderous",1
"Phee 11",0,1,103958,BH,"zzJango Zam Greedo zGreef Cad",1
