Player,Offense,Defense,GP,Name,Squad,Viable
"O k a y",1,1,58769,NS,"MT 6* G8, AV Daka G8, Zombie 6* G8, Spirit 6* G7",0
"O k a y",0,1,83064,BH,"Jango IG-88 G8, Krrsantan 3* G7, Dengar G8, Cad",0
"O k a y",0,1,55750,Phoenix,"Hera G7, Kanan G7, Zeb G7, Chopper G8, Sabine 5* G7",0
"O k a y",1,0,48928,Jawas,"Nebit G7, Jawa Engineer G9, Jawa Scavenger G6, Jawa 5* G6, Dathcha G6",0
"Sheriffmack",0,1,133158,DRMalak,"zzzDR zzHK-47 zBSF zzMalak Sith Empire Trooper",1
"Sheriffmack",0,1,137555,padme,"zzPadme zGK zJKA zAhsoka zzC-3PO",1
"Sheriffmack",,,441434,Negotiator,"Negotiator BTL-B Y-wing, Anakin's Eta-2, Rex's ARC-170, Umbaran SF, Ahsoka's SF, Plo's SF, Clone Sergeant's ARC-170",1
"Sheriffmack",0,1,124217,Grievous,"zzGG zB2 zB1 MagnaGuard zNute",1
"Sheriffmack",1,1,134947,GAS,"zzzzGAS zRex zEcho (501st), zzFives zARC Trooper",1
"Sheriffmack",1,1,114937,Revan Offense,"zzzJKR zzGMY zBS zJolee HYoda G9",1
"Sheriffmack",1,1,95007,Ewoks,"zChirpa Elder zPaploo zWicket zLogray",1
"Sheriffmack",1,1,91016,Carth,"Carth Onasi, zMission Zaalbar Juhani Canderous",1
"Sheriffmack",1,1,112080,zEP,"zzEP zzzVader zTarkin TFP DN G9",1
"Sheriffmack",0,1,77062,Phoenix,"Hera G9, zKanan Ezra Zeb G8, Sabine G8",1
"Sheriffmack",,,61492,Phasma,"Phasma G7, FOTP G8, FOSFTP G7, FOST 5* G8, Kylo G9",0
"Sheriffmack",0,1,81963,Geonosians,"zzGBA Sun Fac G7, Geo Soldier G9, Geo Spy G8, Poggle",0
"Sheriffmack",1,1,68278,NS,"MT 4* G7, zzAV Daka G7, Zombie G7, Spirit G7",0
"Sheriffmack",1,0,45755,Troopers,"Veers G7, Piett 4* G5, Gideon 4* G7, Dark Trooper 5* G7, Range Trooper 5* G5",0
"Sheriffmack",,,73277,Mon Mothma,"Mon Mothma 5* G7, Cassian G9, Chirrut Scarif G8, zJyn G9",0
"Sheriffmack",0,1,103440,BH,"Bossk 5* zThe Mandalorian, zZam zBoba Dengar G8",0
"Sheriffmack",1,0,75714,zMaul,"Darth Maul G8, Sidious G8, zDooku Sith Marauder 6* G6, Nest 4* G5",0
"Sheriffmack",1,0,93330,Wiggs,"Wedge G8, Biggs G8, zzzCLS zHan Leia",0
"Sheriffmack",,,61027,Iden Troopers,"zIden Versio 4* G9, Stormtrooper G7, Snowtrooper G7, Magma G7, DT 6* G7",0
"Sheriffmack",0,1,78112,BH,"zJango 6* G9, IG-88 G9, Greedo G9, zEmbo 6* Cad G7",0
"Sheriffmack",,,117936,Bad Batch,"zHunter zEcho zOmega 6* G9, zTech zWrecker",0
"Sheriffmack",1,0,8959,SionSolo (Counter),"Sion 2* G7",0
"TheFoilGuy",1,1,145383,SL Kylo,"zzzzzzSL Kylo, zSith Trooper, zHux zzKRU Thrawn",1
"TheFoilGuy",0,1,131834,padme,"zzPadme zGK zJKA zAhsoka zzC-3PO",1
"TheFoilGuy",0,1,107556,DRMalak,"zzDR HK-47 zBSF zzMalak Sith Empire Trooper",1
"TheFoilGuy",,,434752,Negotiator,"Negotiator BTL-B Y-wing, Anakin's Eta-2, Rex's ARC-170, Umbaran SF, Ahsoka's SF, Plo's SF, Clone Sergeant's ARC-170",1
"TheFoilGuy",,,347344,HansMF,"Home One, Han's MF, Rebel Y-wing 6*, Bistan's U-wing, Phantom Ghost Cassian's U-wing, Biggs X-wing",1
"TheFoilGuy",0,1,97201,Geonosians,"zzGBA Sun Fac, Geo Soldier, Geo Spy, Poggle",1
"TheFoilGuy",1,1,85518,JTR,"zzJTR Scav Rey G9, BB-8 G9, R2-D2 zFinn G8",1
"TheFoilGuy",,,111436,Nute-Wat,"zNute zB1 zB2 zMagnaGuard zWat Tambor 6*",1
"TheFoilGuy",1,1,150891,GAS,"zzzzGAS zRex zEcho (501st), zzFives zARC Trooper",1
"TheFoilGuy",1,1,113440,Revan Offense,"zzzJKR zGMY BS zJolee zHYoda",1
"TheFoilGuy",1,1,81635,Ewoks,"zChirpa G9, Elder Paploo Wicket Logray",1
"TheFoilGuy",0,1,96832,BH,"zBossk Zam Boba Dengar G8, Embo",1
"TheFoilGuy",1,1,92575,Carth,"zCarth Onasi, zMission Zaalbar zJuhani Canderous",1
"TheFoilGuy",1,1,117903,zEP,"zzEP zzzVader Tarkin TFP G9, zzMara Jade, The Emperor's Hand",1
"TheFoilGuy",0,1,70939,Phoenix,"Hera G9, Kanan G8, Ezra Zeb G9, Sabine G8",1
"TheFoilGuy",1,1,72228,Rogue1,"Jyn Chirrut G8, Baze G8, Cassian G9, K-2SO G9",1
"TheFoilGuy",1,0,19848,NestSolo (Counter),"zNest",1
"TheFoilGuy",1,0,16942,SionSolo (Counter),"Sion",1
"TheFoilGuy",,,124255,Phasma,"zPhasma zFOTP FOSFTP zFOST zKylo",0
"TheFoilGuy",,,239097,Malevolence,"Malevolence 5* Hyena Bomber 4*, Vulture Droid 6*, Sun Fac SF, Soldier SF, Spy SF",0
"TheFoilGuy",1,1,82445,NS,"zMT G9, zzAV zDaka Zombie Spirit G8",0
"TheFoilGuy",1,0,68424,Troopers,"zVeers zPiett 5* Gideon 4* G8, Dark Trooper 5* G7, Range Trooper",0
"TheFoilGuy",,,93635,Mon Mothma,"zzMon Mothma G9, zKyle Katarn, Lando zCara Dune, Biggs",0
"TheFoilGuy",,,68648,Iden Troopers,"zIden Versio 3*, Stormtrooper G9, Snowtrooper Magma G8, DT G8",0
"TheFoilGuy",1,0,98576,CLS,"zzzCLS Han G8, Leia G8, Old Ben G9, zzChewbacca",0
"TheFoilGuy",0,1,78076,BH,"Jango IG-88 G8, The Mandalorian, Greedo G8, Greef",0
"TheFoilGuy",,,90504,Bad Batch,"zHunter zEcho zzOmega 5* G9, zTech zWrecker",0
"TheFoilGuy",1,0,60978,Jawas,"Nebit G8, Jawa Engineer G7, Jawa Scavenger G8, Jawa 5* G8, Dathcha G8",0
"Jangboba",0,1,108628,DR,"zzzDR HK-47 zBSF Sith Empire Trooper, Sith Assassin",1
"Jangboba",1,0,124195,Traya,"zzTraya zDN zSion zDooku zzEP",1
"Jangboba",0,1,115114,BH,"zzBossk zIG-88 zBoba zzJango zAurra",1
"Jangboba",0,1,67157,Phoenix,"Hera Kanan G8, Ezra G9, Zeb G8, Chopper",1
"Jangboba",0,1,96007,BS,"zBS G9, GMY zJolee GK zzHYoda",1
"Jangboba",,,60557,Phasma,"Phasma G8, FOTP G7, FOSFTP G8, FOST 5* G8, zKylo",0
"Jangboba",0,1,77566,Geonosians,"zGBA Sun Fac G8, Geo Soldier, Geo Spy G8, Poggle",0
"Jangboba",0,1,68699,Grievous,"zGG zB2 MagnaGuard G8, IPD G5, T3-M4 G7",0
"Jangboba",1,1,55656,NS,"MT 5* G8, AV G8, Daka Zombie G4, Spirit G8",0
"Jangboba",1,1,67232,Carth,"Carth Onasi, Mission G5, Zaalbar G7, Juhani Canderous G8",0
"Jangboba",1,0,55928,501st,"Rex G8, Clone Sergeant G8, Echo (501st), Fives G8, Ahsoka",0
"Jangboba",1,0,67882,Wiggs,"Wedge G8, Biggs G8, CLS G8, Han Leia",0
"Jangboba",1,0,52088,Troopers,"Veers G9, Starck G6, Magma G7, Stormtrooper G8, Shoretrooper G8",0
"Jangboba",1,1,55672,Rogue1,"Jyn G8, Chirrut G8, Baze 5* G8, Cassian G8, K-2SO G9",0
"Rune",0,1,136394,padme,"zzPadme zGK zJKA zAhsoka zzC-3PO",1
"Rune",,,405707,HansMF,"Home One, Han's MF, Rebel Y-wing, Bistan's U-wing, Phantom Ghost Cassian's U-wing, Wedge X-wing",1
"Rune",,,421675,Negotiator,"Negotiator HT Anakin's Eta-2, Umbaran SF, Ahsoka's SF, Clone Sergeant's ARC-170, Plo's SF, Rex's ARC-170",1
"Rune",0,1,118964,DR,"zzzDR zzHK-47 zBSF Sith Marauder, zzThrawn",1
"Rune",0,1,88787,Geonosians,"zzGBA 5* Sun Fac, Geo Soldier, Geo Spy, Poggle",1
"Rune",0,1,106080,Grievous,"zzGG B2 G9, B1 zDroideka zMagnaGuard",1
"Rune",1,1,89993,JTR,"zzzJTR G9, zScav Rey, BB-8 G8, R2-D2 G9, zFinn",1
"Rune",,,116288,Nute-OR,"zNute zDooku zzJango zZaalbar zMission",1
"Rune",1,1,143624,Revan Offense,"zzzJKR zzGMY zBS zJolee zzHYoda",1
"Rune",1,1,96080,Ewoks,"zChirpa Elder zPaploo zWicket zLogray",1
"Rune",1,1,113555,zEP,"zzEP zzzVader zzTarkin G8, TFP G9, zzDN",1
"Rune",0,1,90234,Phoenix,"zHera zKanan G9, zEzra Zeb G9, zSabine",1
"Rune",1,1,87264,Rogue1,"zzJyn Chirrut G9, Baze G8, zCassian K-2SO G9",1
"Rune",1,0,15402,SionSolo (Counter),"Sion G9",1
"Rune",,,63892,Phasma,"Phasma G8, FOTP G8, FOSFTP G7, FOST G9, Kylo G7",0
"Rune",1,1,76420,NS,"MT G8, zzAV Daka Zombie G7, Spirit G7",0
"Rune",,,353175,Executrix,"Executrix Tie Adv, Emperor's Shuttle 4*, TIE Reaper 3*, Imperial TIE Fighter, Gauntlet Starfighter, FOSF TIE Fighter, FO TIE Fighter",0
"Rune",,,94389,Disintegration,"Aurra G9, Greef G9, zBoba Bossk 5* G9, zzThe Mandalorian",0
"Rune",1,0,76838,Troopers,"Veers G9, zzPiett zzGideon G9, Dark Trooper 5* G7, Range Trooper 6* G7",0
"Rune",,,83294,Mon Mothma,"Mon Mothma 5* G7, Pao G8, Lando Wedge zCara Dune",0
"Rune",1,0,99101,ShaakClones,"zzShaak Ti, zRex Echo (501st) G9, Fives G9, zARC Trooper",0
"Rune",1,0,116847,CLS,"zzzCLS Han G7, Leia G9, zzOld Ben, zzChewbacca",0
"Rune",,,57976,Iden Troopers,"Iden Versio 3* G4, Stormtrooper G9, Snowtrooper G7, Magma G7, DT G7",0
"Rune",,,62970,Bad Batch,"Hunter 5* G9, Echo 5* G8, zzOmega Tech 5* G8, Wrecker 4* G6",0
"Rune",,,67153,Mando,"The Mandalorian (Beskar Armor) G8, Dash Rendar 4* G8, Nest 5* G7, zIG-11 G8, zKuiil G9",0
"Rune",1,0,62255,Jawas,"Nebit G8, Jawa Engineer G7, Jawa Scavenger G7, Jawa 6* G7, Dathcha G8",0
"Zack g",,,176683,JMK,"zzzzzzJMK zAhsoka zzzCAT zzzzGAS zGK",1
"Zack g",,,168530,SEE,"zzzzzzSEE zBSF zzMalak zzzDR zzzVader",1
"Zack g",1,1,161914,GL Rey,"zzzzzzRey zzzJTR zzR2-D2 zRH Poe, zRH Finn",1
"Zack g",,,575883,Executor,"Executor 5* HT RC Xanadu Blood, Slave I, IG-2000 Imperial TIE Fighter, Tie Adv",1
"Zack g",1,0,157644,CLS,"zzzCLS zHan zzChewbacca zzC-3PO zChewpio",1
"Zack g",1,1,105124,NestSisters,"zzAV zzMT Daka Zombie zNest",1
"Zack g",,,486778,Negotiator,"Negotiator BTL-B Y-wing, Anakin's Eta-2, Rex's ARC-170, Umbaran SF, Ahsoka's SF, Plo's SF, Clone Sergeant's ARC-170",1
"Zack g",,,312803,Malevolence,"Malevolence Hyena Bomber, Vulture Droid, Sun Fac SF, Soldier SF, Spy SF",1
"Zack g",,,141997,JKL,"zzJKL zzzJKR zHYoda zzOld Ben, Aayla",1
"Zack g",,,434846,HansMF,"Home One, Han's MF, Rebel Y-wing, Bistan's U-wing, Phantom Ghost Cassian's U-wing, Wedge X-wing",1
"Zack g",0,1,96833,Geonosians,"zzGBA Sun Fac, Geo Soldier, Geo Spy, Poggle",1
"Zack g",0,1,128407,Grievous,"zzGG zB2 zB1 zMagnaGuard zNute",1
"Zack g",1,0,97323,Traya,"zzTraya DN G8, zSion G8, Sith Empire Trooper G8, zzThrawn",1
"Zack g",,,134145,Disintegration,"Aurra zzGreef zBoba zzBossk zzThe Mandalorian",1
"Zack g",,,113130,Mon Mothma,"zzMon Mothma, Lando Wedge zCara Dune, Biggs",1
"Zack g",1,1,90245,Ewoks,"zChirpa Elder Paploo zWicket Logray",1
"Zack g",1,0,117783,ShaakClones,"zzShaak Ti, zRex zEcho (501st), zzFives zARC Trooper",1
"Zack g",1,1,96337,Carth,"zCarth Onasi, zMission zZaalbar Juhani Canderous",1
"Zack g",0,1,135885,BH,"zzJango zIG-88 Krrsantan zDengar Cad",1
"Zack g",0,1,96578,FO,"zzKRU zKylo zHux FOO FOE",1
"Zack g",0,1,89877,Phoenix,"zHera zKanan zEzra Zeb Sabine G8",1
"Zack g",1,1,74303,Rogue1,"Jyn Chirrut G8, Baze G8, Cassian G9, K-2SO G9",1
"Zack g",1,0,126629,zMaul,"zDarth Maul, zDooku zSidious zSavage Sith Marauder",1
"Zack g",1,0,113435,EP (Counter, Rebel),"zzEP Shoretrooper G8, Krennic DT G9, zzWampa",1
"Zack g",1,0,108913,Troopers,"zVeers zzPiett zzGideon G9, zDark Trooper G9, Range Trooper G8",0
"Zack g",,,83955,Bad Batch,"zHunter G9, zEcho G8, zzOmega G8, zTech G9, zWrecker G8",0
"Zack g",1,0,70647,Jawas,"Nebit G8, Jawa Engineer G7, Jawa Scavenger G7, Jawa Dathcha G8",0
"Tassk",1,1,111655,NS,"zzMT zzAV zDaka Zombie Spirit",1
"Tassk",1,0,138905,CLS,"zzzCLS zHan zzChewbacca zzC-3PO zChewpio",1
"Tassk",0,1,123884,padme,"zzPadme zGK zJKA zAhsoka zBarriss",1
"Tassk",,,412329,HansMF,"Home One, Han's MF, HT Bistan's U-wing, Phantom Ghost Cassian's U-wing, Wedge X-wing",1
"Tassk",0,1,111378,Geonosians,"zzGBA Sun Fac, Geo Soldier, Geo Spy, Poggle",1
"Tassk",0,1,103037,Grievous,"zzGG zB2 zDroideka MagnaGuard G8, zIG-88",1
"Tassk",1,0,103469,Traya,"zzTraya zzDN zSion zDooku EP",1
"Tassk",1,1,126504,Revan Offense,"zzzJKR zzGMY BS zJolee zzHYoda",1
"Tassk",1,1,108915,Ewoks,"zChirpa Elder zPaploo zWicket zLogray",1
"Tassk",0,1,116199,BH,"zBossk zBoba zJango zDengar zzGreef",1
"Tassk",0,1,75351,Phoenix,"Hera G9, zKanan G9, zEzra G9, Zeb G8, zSabine G8",1
"Tassk",1,0,102927,Rex (Counter),"Rex G9, zzWampa Chirrut G9, Baze G9, zzR2-D2",1
"Tassk",1,0,65471,Jawas,"Nebit G8, Jawa Engineer G8, Jawa Scavenger G8, Jawa G8, Dathcha G8",1
"Tassk",,,62627,Phasma,"zPhasma G8, FOTP G5, FOSFTP G4, FOST G8, zKylo G8",0
"Tassk",,,324769,Executrix,"Executrix Tie Adv, Emperor's Shuttle, TIE Reaper 6*, Imperial TIE Fighter, Gauntlet Starfighter, FOSF TIE Fighter, FO TIE Fighter",0
"Tassk",1,1,75681,Carth,"zCarth Onasi G9, zMission G8, Zaalbar G8, zJuhani 6* G9, Canderous",0
"Tassk",,,60464,Iden Troopers,"Iden Versio 4* G6, Shoretrooper G9, Snowtrooper G8, Magma G9, DT G7",0
"Tassk",1,0,65820,Troopers,"Veers G9, zStarck Stormtrooper G8, Range Trooper 6* G5, Gideon G7",0
"Tassk",1,0,14850,NestSolo (Counter),"zNest G7",0
"Dani Vao",1,1,161641,GL Rey,"zzzzzzRey zzzJTR zzBB-8 zHoldo zRH Finn",1
"Dani Vao",0,1,133804,DRMalak,"zzzDR zzHK-47 zBSF zzMalak Sith Assassin",1
"Dani Vao",0,1,135281,padme,"zzPadme zGK zJKA zAhsoka zzC-3PO",1
"Dani Vao",1,1,109466,NestSisters,"zzAV zzMT zDaka Zombie zNest",1
"Dani Vao",,,423337,HansMF,"Home One, Han's MF, Rebel Y-wing, Bistan's U-wing, Phantom Ghost Cassian's U-wing, Wedge X-wing",1
"Dani Vao",,,419263,Negotiator,"Negotiator HT Anakin's Eta-2, Umbaran SF, Ahsoka's SF, Clone Sergeant's ARC-170, Plo's SF, Rex's ARC-170",1
"Dani Vao",0,1,98670,Geonosians,"zzGBA Sun Fac, Geo Soldier, Geo Spy, Poggle",1
"Dani Vao",0,1,120005,Grievous,"zzGG zB2 zB1 zMagnaGuard zNute",1
"Dani Vao",1,0,119435,Traya,"zzTraya zzDN zSion zzEP zzThrawn",1
"Dani Vao",,,117411,Disintegration,"Aurra G9, zzGreef zBoba zzBossk zzThe Mandalorian",1
"Dani Vao",1,1,143120,Revan Offense,"zzzJKR zzGMY zBS zJolee zzHYoda",1
"Dani Vao",1,1,101266,Ewoks,"zChirpa Elder zPaploo zWicket G9, zLogray G9",1
"Dani Vao",1,1,114684,Carth,"zCarth Onasi, zMission zZaalbar zJuhani zCanderous",1
"Dani Vao",1,0,126522,CLS,"zzzCLS zHan Wedge Biggs zzChewbacca",1
"Dani Vao",0,1,93257,FO,"zzKRU zKylo FOO G8, FOE zPhasma",1
"Dani Vao",0,1,91856,Phoenix,"zHera zKanan zEzra zZeb G9, zSabine G8",1
"Dani Vao",,,87735,Mon Mothma,"zzMon Mothma 6* G9, Lando K-2SO G9, zCara Dune, Jyn G7",0
"Dani Vao",1,1,79076,GAS,"zzzzGAS 6* Rex Echo (501st) G5, Fives G8, ARC Trooper G6",0
"Dani Vao",0,1,97828,BH,"zzJango zIG-88 Zam G7, zGreedo Cad",0
"Dani Vao",1,0,69405,Troopers,"Veers G7, Starck G8, Magma G7, Stormtrooper G8, Snowtrooper",0
"Dani Vao",1,0,66718,Jawas,"Nebit G8, Jawa Engineer G5, Jawa Scavenger G7, Jawa G8, Dathcha G8",0
"BenStaWa",0,1,113068,DRMalak,"zzzDR zHK-47 zBSF zzMalak Sith Empire Trooper G8",1
"BenStaWa",0,1,127652,padme,"zzPadme zGK zJKA zAhsoka zzC-3PO",1
"BenStaWa",,,431633,Negotiator,"Negotiator BTL-B Y-wing, Anakin's Eta-2, Rex's ARC-170, Umbaran SF, Ahsoka's SF, Plo's SF, Clone Sergeant's ARC-170",1
"BenStaWa",0,1,122239,Grievous-Wat,"zzGG zB2 zB1 MagnaGuard zWat Tambor",1
"BenStaWa",,,98892,Nute-OR,"zNute Dooku zJango zZaalbar zMission",1
"BenStaWa",1,1,127384,GAS,"zzzzGAS zRex zEcho (501st), zzFives zARC Trooper",1
"BenStaWa",1,1,112967,Revan Offense,"zzzJKR GMY BS zJolee zHYoda G9",1
"BenStaWa",1,1,92918,Ewoks,"zChirpa Elder Paploo zWicket zLogray",1
"BenStaWa",0,1,86241,BH,"zBossk zThe Mandalorian, Boba zGreef Cad G8",1
"BenStaWa",1,1,83152,zEP,"zEP Vader Tarkin G8, zzTraya G9, Sion G9",1
"BenStaWa",0,1,74878,Phoenix,"Hera G9, Kanan G8, Ezra G8, zZeb G8, Chopper",1
"BenStaWa",1,0,13582,NestSolo (Counter),"Nest G8",1
"BenStaWa",,,54840,Phasma,"Phasma G8, Sith Trooper G7, FOO G8, KRU G8, Kylo G8",0
"BenStaWa",1,0,61902,CLS,"CLS G8, Han G7, Chewbacca G7, R2-D2 G8, Chewpio G7",0
"BenStaWa",,,229180,Malevolence,"Malevolence Hyena Bomber, Vulture Droid 5*, Sun Fac SF, Soldier SF, Spy SF",0
"BenStaWa",,,219987,HansMF,"Home One, Han's MF 5*, Rebel Y-wing 6*, Bistan's U-wing 3*, Phantom Ghost Cassian's U-wing 5*, Biggs X-wing 5*",0
"BenStaWa",0,1,66368,Geonosians,"GBA G9, Sun Fac G7, Geo Soldier G8, Geo Spy G7, Poggle G8",0
"BenStaWa",1,1,62219,NS,"MT G8, AV Daka G8, Zombie Spirit G8",0
"BenStaWa",1,0,62291,Troopers,"Veers G9, zPiett G8, Gideon G7, Dark Trooper 6* G7, Range Trooper 4* G7",0
"BenStaWa",1,1,43118,Rogue1,"Jyn 5* G8, Chirrut 5* G8, Baze G8, Cassian G8, K-2SO G8",0
"Darman Skirata",,,122791,Phasma,"zPhasma zFOTP FOSFTP zzKRU zKylo",1
"Darman Skirata",0,1,123019,padme,"zzPadme zGK zJKA zAhsoka zzC-3PO",1
"Darman Skirata",0,1,112442,DRMalak,"zzzDR zzHK-47 zBSF zzMalak Sith Empire Trooper",1
"Darman Skirata",,,316013,HansMF,"Home One, Han's MF 5*, Rebel Y-wing, Bistan's U-wing, Phantom Ghost Cassian's U-wing, Wedge X-wing",1
"Darman Skirata",,,442932,Negotiator,"Negotiator HT Anakin's Eta-2, Umbaran SF, Ahsoka's SF, Clone Sergeant's ARC-170, Plo's SF, Rex's ARC-170",1
"Darman Skirata",0,1,101080,Geonosians,"zzGBA Sun Fac, Geo Soldier, Geo Spy, Poggle",1
"Darman Skirata",0,1,116939,Grievous,"zzGG zB2 zB1 zDroideka zMagnaGuard",1
"Darman Skirata",1,1,119988,GAS,"zzzzGAS zRex zEcho (501st), zzFives zARC Trooper",1
"Darman Skirata",1,1,115390,Revan Offense,"zzzJKR zGMY zBS zJolee zzHYoda",1
"Darman Skirata",1,1,95217,Carth,"zCarth Onasi, zMission zZaalbar zJuhani zCanderous",1
"Darman Skirata",0,1,115415,BH,"zzBossk zIG-88 zBoba zJango zGreedo",1
"Darman Skirata",1,1,110634,zEP,"zzEP zzzVader zTarkin TFP G8, zzDN",1
"Darman Skirata",0,1,88060,Phoenix,"zHera zKanan Ezra G8, Chopper zSabine",1
"Darman Skirata",1,0,21397,SionSolo (Counter),"zSion",1
"Darman Skirata",1,0,18429,NestSolo (Counter),"zNest",1
"Darman Skirata",1,1,96377,NS_Alt,"zzMT zAV zDaka Talia Zombie",0
"Darman Skirata",1,1,77331,JTR,"JTR G8, zScav Rey, BB-8 G8, R2-D2 G8, zFinn G8",0
"Darman Skirata",1,0,89633,Wiggs,"Wedge G8, Biggs G8, zzzCLS Han G7, zLeia",0
"Darman Skirata",1,1,62940,Rogue1,"Jyn 6* G7, Chirrut Baze 6* G7, Cassian G8, Scarif G7",0
"Darman Skirata",1,0,52985,Jawas,"Nebit G8, Jawa Engineer 6* G6, Jawa Scavenger G7, Jawa 4* G6, Dathcha 5* G7",0
"Thraken The First",0,1,153813,DRMalak,"zzzDR HK-47 zBSF zzMalak Sith Empire Trooper",1
"Thraken The First",1,0,141237,CLS,"zzzCLS zHan zzChewbacca zC-3PO zChewpio",1
"Thraken The First",,,484652,Negotiator,"Negotiator 5* HT Anakin's Eta-2, Umbaran SF, Ahsoka's SF, Clone Sergeant's ARC-170, Plo's SF, Rex's ARC-170",1
"Thraken The First",0,1,100685,Geonosians,"zzGBA Sun Fac, Geo Soldier, Geo Spy, Poggle",1
"Thraken The First",0,1,121071,Grievous,"zGG zB2 zB1 zDroideka zMagnaGuard",1
"Thraken The First",1,1,158864,GAS,"zzzzGAS zRex zEcho (501st), zzFives zARC Trooper",1
"Thraken The First",1,1,130886,Revan,"zzzJKR zBS zGMY zJolee zGK",1
"Thraken The First",1,1,88998,Ewoks,"zChirpa Elder Paploo zWicket Logray",1
"Thraken The First",0,1,97121,BH,"zBossk Boba Jango Dengar G9, Cad",1
"Thraken The First",1,1,92729,Carth,"zCarth Onasi, zMission zZaalbar Juhani Canderous",1
"Thraken The First",1,1,127372,zEP,"zzEP zzzVader Tarkin TFP zzMara Jade, The Emperor's Hand",1
"Thraken The First",0,1,75297,Phoenix,"Hera G9, Kanan G9, Ezra Zeb G9, Sabine G8",1
"Thraken The First",1,0,73028,Jawas,"Nebit G9, Jawa Engineer, Jawa Scavenger G9, Jawa Dathcha G9",1
"Thraken The First",1,0,19848,NestSolo (Counter),"zNest",1
"Thraken The First",1,0,15219,SionSolo (Counter),"Sion G9",1
"Thraken The First",,,57900,Phasma,"Phasma G9, FOTP FOSFTP 5* G8, FOST 3* G7, Kylo 5* G8",0
"Thraken The First",1,1,87810,NS,"MT zAV Daka Zombie Spirit",0
"Thraken The First",,,397625,HansMF,"Home One, Han's MF, Rebel Y-wing 6*, Bistan's U-wing 5*, Phantom Biggs X-wing, Cassian's U-wing 5*, Wedge X-wing",0
"Thraken The First",1,1,106910,JTR,"zzJTR Scav Rey, BB-8 G9, R2-D2 Finn",0
"Thraken The First",1,0,57710,Troopers,"Veers G9, Piett 5* G6, Gideon Dark Trooper 5* G7, Range Trooper 5* G3",0
"Thraken The First",,,122395,Mon Mothma,"zzMon Mothma, zKyle Katarn, Lando Wedge Biggs",0
"Thraken The First",1,0,99547,QGJ,"QGJ 6* G8, Aayla 6* G5, zJKA zzHYoda zAhsoka",0
"Thraken The First",1,1,50501,Rogue1,"Jyn 6* G7, Chirrut 4* G6, Baze 5* G6, Bistan G5, Scarif G7",0
"Grandola Paca",,,297137,HansMF,"Home One, Han's MF 6*, Rebel Y-wing, Ghost Phantom Biggs X-wing, Cassian's U-wing, Wedge X-wing",1
"Grandola Paca",0,1,116995,Geonosians,"zzGBA Sun Fac, Geo Soldier, Geo Spy, Poggle",1
"Grandola Paca",1,1,97103,JTR,"zzzJTR Scav Rey, zBB-8 G9, zzR2-D2 Finn G9",1
"Grandola Paca",1,1,110895,Revan,"zzzJKR BS GMY zJolee zGK",1
"Grandola Paca",1,0,119744,CLS,"zzzCLS zHan zzChewbacca zLeia zzC-3PO",1
"Grandola Paca",1,1,99184,Carth,"zCarth Onasi, zMission zZaalbar zJuhani zCanderous",1
"Grandola Paca",0,1,98936,BH,"zzBossk zzThe Mandalorian, Zam G9, zBoba Cad G9",1
"Grandola Paca",1,1,112193,zEP,"zzEP zzzVader Tarkin G9, TFP zzMara Jade, The Emperor's Hand",1
"Grandola Paca",0,1,69652,Phoenix,"Hera G9, Kanan G8, Ezra G9, Zeb G9, Chopper G9",1
"Grandola Paca",1,0,12171,SionSolo (Counter),"Sion G8",1
"Grandola Paca",,,64864,Phasma,"Phasma G8, FOTP FOSFTP G1, FOST zKylo G7",0
"Grandola Paca",,,249695,Negotiator,"Negotiator 6* HT Anakin's Eta-2 3*, Umbaran SF 6*, Ahsoka's SF, BTL-B Y-wing 6*, Clone Sergeant's ARC-170, Plo's SF",0
"Grandola Paca",0,1,101042,DRMalak,"zzzDR zzHK-47 zBSF zzMalak G9, Thrawn G8",0
"Grandola Paca",0,1,50988,Grievous,"GG G5, B2 G2, Droideka G6, MagnaGuard G7, T3-M4",0
"Grandola Paca",1,1,43331,NS_Alt,"AV G7, Daka G6, Talia G5, Spirit G6, Zombie 6* G5",0
"Grandola Paca",1,0,56168,ShaakClones,"Shaak Ti G9, Rex G7, Echo (501st) G6, Fives G9, ARC Trooper G7",0
"Grandola Paca",,,65851,Bad Batch,"Hunter Echo G9, Omega G8, Tech G8, Wrecker G7",0
"Antisniper v2",0,1,123408,DRMalak,"zzzDR zzHK-47 zBSF zzMalak Sith Empire Trooper",1
"Antisniper v2",0,1,116123,padme,"zzPadme zGK zJKA zAhsoka zzC-3PO",1
"Antisniper v2",,,343635,HansMF,"Home One, Han's MF 5*, Rebel Y-wing, Bistan's U-wing, Phantom Ghost Cassian's U-wing, Biggs X-wing",1
"Antisniper v2",,,392975,Negotiator,"Negotiator HT Anakin's Eta-2, Umbaran SF, Ahsoka's SF, Clone Sergeant's ARC-170, Plo's SF, Rex's ARC-170",1
"Antisniper v2",0,1,108242,Geonosians,"zzGBA Sun Fac, Geo Soldier, Geo Spy, Poggle",1
"Antisniper v2",0,1,117726,Grievous,"zzGG zB2 zB1 zDroideka zMagnaGuard",1
"Antisniper v2",1,1,106455,Revan Offense,"zzzJKR GMY G8, zBS zJolee zzHYoda G8",1
"Antisniper v2",1,1,89666,Ewoks,"zChirpa Elder Paploo Wicket Logray",1
"Antisniper v2",0,1,115593,BH,"zzBossk zBoba zzJango Dengar zzGreef",1
"Antisniper v2",1,1,92580,Carth,"zCarth Onasi, Mission Zaalbar Juhani Canderous",1
"Antisniper v2",1,1,87743,zEP,"zzEP Vader G8, zTarkin TFP G8, zSith Trooper",1
"Antisniper v2",0,1,104562,FO,"zzKRU zKylo FOO FOE zFOST",1
"Antisniper v2",1,0,100463,Troopers,"zVeers zStarck Shoretrooper zzPiett zDark Trooper",1
"Antisniper v2",0,1,73840,Phoenix,"Hera Kanan Ezra Zeb Sabine G8",1
"Antisniper v2",1,0,80543,Clones,"zCody zRex Echo (501st), Fives Clone Sergeant",1
"Antisniper v2",1,0,93399,Wiggs,"Wedge Biggs zzzCLS zHan Leia",1
"Antisniper v2",1,1,73975,JTR,"JTR G2, zzR2-D2 zzBB-8 RH Finn 6* G7, RH Poe G5",0
"Antisniper v2",1,1,82213,NS,"zzMT G8, zzAV zDaka Zombie G8, Spirit G6",0
"Antisniper v2",1,0,64194,Traya,"Traya G5, DN G6, Sion G5, zDooku G9, Nest G5",0
"Antisniper v2",1,0,65156,Thragma (Counter),"Thrawn G3, Magma DT Krennic G4, Stormtrooper",0
"Antisniper v2",1,1,71650,Rogue1,"Jyn G7, Chirrut Baze Pao G7, Bodhi Rook G7",0
"SnakeEyes",,,123211,Phasma,"zPhasma zFOTP FOSFTP zFOST zKylo",1
"SnakeEyes",1,1,156614,SL Kylo,"zzzzzzSL Kylo, zSith Trooper, zHux zzKRU zzThrawn",1
"SnakeEyes",,,167015,JMLS,"zzzJKR zzJKL zzzzzzJMLS zHYoda zzzzGAS",1
"SnakeEyes",1,0,146692,CLS,"zzzCLS zHan zzChewbacca zzC-3PO zChewpio",1
"SnakeEyes",0,1,129138,DRMalak,"zzzDR zzHK-47 zBSF zzMalak Sith Empire Trooper",1
"SnakeEyes",,,461360,Negotiator,"Negotiator BTL-B Y-wing, Anakin's Eta-2, Rex's ARC-170, Umbaran SF, Ahsoka's SF, Plo's SF, Clone Sergeant's ARC-170",1
"SnakeEyes",,,402047,HansMF,"Home One, Han's MF, Rebel Y-wing, Bistan's U-wing, Phantom Biggs X-wing, Cassian's U-wing, Wedge X-wing",1
"SnakeEyes",0,1,93278,Geonosians,"zzGBA Sun Fac, Geo Soldier, Geo Spy, Poggle",1
"SnakeEyes",0,1,128114,Grievous,"zzGG zB2 zB1 zDroideka zMagnaGuard",1
"SnakeEyes",1,1,117757,JTR,"zzzJTR Scav Rey, zBB-8 G9, zzR2-D2 Finn",1
"SnakeEyes",1,0,105684,Troopers,"zVeers zzPiett zzGideon Dark Trooper, Range Trooper",1
"SnakeEyes",,,107123,Nute-OR,"zNute zDooku zzJango zZaalbar zMission",1
"SnakeEyes",1,1,80819,Ewoks,"zChirpa Elder Paploo Wicket Logray",1
"SnakeEyes",1,0,129570,ShaakClones,"zzShaak Ti, zRex zEcho (501st), zzFives zARC Trooper",1
"SnakeEyes",0,1,105785,BH,"zzBossk zIG-88 zzThe Mandalorian, Boba Dengar",1
"SnakeEyes",1,1,130050,zEP,"zzEP zzzVader zzTarkin TFP G9, zzMara Jade, The Emperor's Hand",1
"SnakeEyes",0,1,119629,BS,"zBS zGMY zJolee zGK zJKA",1
"SnakeEyes",1,0,15450,NestSolo (Counter),"Nest",1
"SnakeEyes",1,0,17163,SionSolo (Counter),"zSion G8",1
"SnakeEyes",1,1,93084,NS,"zzMT zzAV zDaka G9, Zombie Spirit",0
"SnakeEyes",,,269896,Malevolence,"Malevolence Hyena Bomber 4*, Vulture Droid 3*, Sun Fac SF, Soldier SF, Spy SF",0
"SnakeEyes",,,434746,Executrix,"Executrix Tie Adv, Emperor's Shuttle 4*, TIE Reaper 3*, Imperial TIE Fighter, Gauntlet Starfighter, FOSF TIE Fighter, FO TIE Fighter",0
"SnakeEyes",,,110750,Mon Mothma,"zzMon Mothma, Lando Wedge zK-2SO G9, Biggs",0
"SnakeEyes",0,1,75736,Phoenix,"Hera G8, Kanan zEzra Zeb G8, Chopper G7",0
"SnakeEyes",,,90726,Bad Batch,"zHunter zEcho zzOmega G9, zTech zWrecker G9",0
"SnakeEyes",1,1,57511,Rogue1,"Jyn G7, Chirrut G8, Baze 6* G7, Cassian G7, Bistan G3",0
"SnakeEyes",1,0,66115,Jawas,"Nebit G8, Jawa Engineer G7, Jawa Scavenger G8, Jawa G7, Dathcha G8",0
"bdvil",,,125511,Phasma,"zPhasma zFOTP FOSFTP zFOST zKylo",1
"bdvil",1,1,160239,SL Kylo,"zzzzzzSL Kylo, zSith Trooper, zHux zzKRU zzThrawn",1
"bdvil",,,164933,SEE,"zzzzzzSEE zBSF zzMalak zzzDR zzzVader",1
"bdvil",1,0,144884,CLS,"zzzCLS zHan zzChewbacca zzC-3PO zChewpio",1
"bdvil",0,1,116166,padme,"zzPadme zGK zJKA zAhsoka CW Chewbacca G9",1
"bdvil",,,428154,HansMF,"Home One, Han's MF, Rebel Y-wing, Bistan's U-wing, Phantom Biggs X-wing, Cassian's U-wing, Wedge X-wing",1
"bdvil",,,433387,Negotiator,"Negotiator 5* HT Anakin's Eta-2, Umbaran SF, Ahsoka's SF, Clone Sergeant's ARC-170, Plo's SF, Rex's ARC-170",1
"bdvil",1,0,126908,Traya,"zzTraya zzDN zSion zzEP Sith Empire Trooper G8",1
"bdvil",1,1,120879,JTR,"zzzJTR zScav Rey, BB-8 zzR2-D2 zFinn",1
"bdvil",,,111376,Disintegration,"Aurra Greef zBoba zzBossk zzThe Mandalorian",1
"bdvil",,,116019,Mon Mothma,"zzMon Mothma, Lando Wedge zzJyn Biggs",1
"bdvil",1,1,135105,Revan Offense,"zzzJKR zzGMY zBS zJolee zzHYoda",1
"bdvil",1,1,85233,Ewoks,"zChirpa Elder Paploo G9, zWicket Logray G9",1
"bdvil",1,0,100233,ShaakClones,"zzShaak Ti, zRex zEcho (501st), zzFives ARC Trooper G8",1
"bdvil",1,1,94545,Carth,"zCarth Onasi, zMission zZaalbar Juhani G8, zCanderous",1
"bdvil",0,1,100374,BH,"zzJango IG-88 zZam Cad zNest",1
"bdvil",0,1,81082,Phoenix,"zHera Kanan G8, zEzra Zeb G8, Sabine G8",1
"bdvil",1,0,128709,zMaul,"zDarth Maul, zDooku zSidious zSavage Sith Marauder",1
"bdvil",1,0,75026,Jawas,"Nebit Jawa Engineer, Jawa Scavenger G8, Jawa G9, Dathcha",1
"bdvil",1,1,96963,NS,"zzMT zzAV zDaka Zombie G8, Spirit G9",0
