Player,Offense,Defense,GP,Name,Squad,Viable
"Phee 11",1,0,106544,Troopers,"zVeers Starck DT zzPiett Dark Trooper",1
"Phee 11",0,1,81933,Phoenix,"zHera Kanan G9, zEzra Zeb Sabine G8",1
"Phee 11",1,0,128154,zMaul,"zDarth Maul, zDooku zSidious zSavage Sith Marauder",1
"Phee 11",0,1,141964,BS,"zBS zzGMY zJolee zzOld Ben, zzHYoda",1
"Phee 11",1,0,117927,EP (Counter, Rebel),"zzEP Shoretrooper G8, zKrennic zzWampa zStormtrooper",1
"Phee 11",1,0,84259,Jawas,"Nebit Jawa Engineer, Jawa Scavenger, Jawa Dathcha",1
"Phee 11",,,278513,Malevolence,"Malevolence Hyena Bomber 5*, Vulture Droid 3*, Sun Fac SF, Soldier SF, Spy SF",0
"Phee 11",,,419443,Executrix,"Executrix Tie Adv, Emperor's Shuttle, TIE Reaper 4*, Imperial TIE Fighter, Gauntlet Starfighter, FOSF TIE Fighter, FO TIE Fighter",0
"Phee 11",,,89916,Bad Batch,"zHunter zEcho Omega G9, zTech zWrecker G9",0
"Apex Force",1,0,148677,CLS,"zzzCLS zHan zzChewbacca zzC-3PO zChewpio",1
"Apex Force",,,501497,Negotiator,"Negotiator HT Anakin's Eta-2, Umbaran SF, Ahsoka's SF, BTL-B Y-wing, Clone Sergeant's ARC-170, Plo's SF",1
"Apex Force",0,1,112535,Geonosians,"zzGBA Sun Fac, Geo Soldier, Geo Spy, Poggle",1
"Apex Force",0,1,128792,Grievous,"zzGG zB2 zB1 zMagnaGuard zNute",1
"Apex Force",1,1,157610,GAS,"zzzzGAS zRex zEcho (501st), zzFives zARC Trooper",1
"Apex Force",1,1,138621,Revan,"zzzJKR BS zzGMY zJolee zGK",1
"Apex Force",1,1,87786,Ewoks,"zChirpa Elder zPaploo Wicket Logray G9",1
"Apex Force",0,1,127946,BH,"zzBossk zZam zBoba zJango Dengar G9",1
"Apex Force",1,1,104165,zEP,"zzEP zzzVader Tarkin TFP G9, Traya G9",1
"Apex Force",0,1,79815,Phoenix,"zHera zKanan G8, Ezra Zeb G8, Sabine G8",1
"Apex Force",1,1,66446,Rogue1,"Jyn G8, Chirrut G9, Baze G8, Cassian G8, K-2SO G8",1
"Apex Force",,,131955,Bad Batch,"zHunter zEcho zzOmega zTech zWrecker",1
"Apex Force",1,0,111041,QGJ,"zQGJ Aayla zJKA zHYoda zAhsoka",1
"Apex Force",1,0,13566,NestSolo (Counter),"Nest G9",1
"Apex Force",,,47596,Phasma,"Phasma G8, FOTP G7, FOSFTP G1, FOST 5* G8, Kylo G8",0
"Apex Force",1,1,98786,NS,"zMT zzAV zDaka Zombie Spirit G9",0
"Apex Force",,,308485,Malevolence,"Malevolence 6* Hyena Bomber 4*, Vulture Droid 5*, Sun Fac SF, Soldier SF, Spy SF",0
"Apex Force",,,300950,HansMF,"Home One, Han's MF 5*, Rebel Y-wing 4*, Bistan's U-wing 3*, Phantom Ghost Cassian's U-wing 4*, Biggs X-wing",0
"Apex Force",1,1,74626,JTR,"JTR G7, Scav Rey, BB-8 R2-D2 G8, Finn",0
"Apex Force",1,0,65207,Troopers,"Veers 6* Starck G7, Stormtrooper G8, DT G8, zzGideon 6* G9",0
"Wonkee",0,1,104437,padme,"zzPadme zGK zJKA zAhsoka zCW Chewbacca G9",1
"Wonkee",,,422942,Negotiator,"Negotiator HT Anakin's Eta-2, Umbaran SF, Ahsoka's SF, BTL-B Y-wing, Clone Sergeant's ARC-170, Plo's SF",1
"Wonkee",1,1,115883,NS_Alt,"zzMT zzAV zDaka Talia Zombie",1
"Wonkee",0,1,118686,DR,"zzzDR zzHK-47 zBSF Sith Empire Trooper G8, zzThrawn",1
"Wonkee",0,1,88109,Geonosians,"zzGBA Sun Fac G9, Geo Soldier, Geo Spy, Poggle",1
"Wonkee",1,1,114124,JTR,"zzzJTR zScav Rey, zzBB-8 zzR2-D2 zFinn",1
"Wonkee",1,0,105301,Traya,"zzTraya zzDN zSion G9, zDooku zzEP",1
"Wonkee",,,412020,Raddus,"Raddus Sun Fac SF, Rey's Millennium Falcon, Poe Dameron's X-wing, Resistance X-wing, Biggs X-wing, Wedge X-wing, Phantom Ghost",1
"Wonkee",,,140544,Disintegration,"zzAurra zzGreef zBoba zzBossk zzThe Mandalorian",1
"Wonkee",1,1,131711,Revan Offense,"zzzJKR zzGMY zBS zJolee zzHYoda",1
"Wonkee",1,1,93158,Ewoks,"zChirpa Elder zPaploo zWicket zLogray G9",1
"Wonkee",1,0,95317,ShaakClones,"zzShaak Ti G9, zRex zEcho (501st), zzFives ARC Trooper G8",1
"Wonkee",1,1,117774,Carth,"zCarth Onasi, zMission zZaalbar zJuhani zCanderous",1
"Wonkee",0,1,113368,BH,"zzJango zIG-88 zFennec Shand, zDengar zGreedo",1
"Wonkee",0,1,79661,FO,"zzKRU zKylo G9, FOO FOE G8, FOST G8",1
"Wonkee",0,1,88460,Phoenix,"zHera zKanan G9, zEzra Zeb G9, zSabine",1
"Wonkee",1,0,102445,Wiggs,"Wedge G9, Biggs zzzCLS zHan zzChewbacca",1
"Wonkee",1,0,13582,NestSolo (Counter),"Nest G8",1
"Wonkee",0,1,77397,Grievous,"zzGG B2 G7, B1 G7, MagnaGuard G7, zNute G9",0
"Wonkee",,,357865,Executrix,"Executrix Tie Adv, Emperor's Shuttle 5*, TIE Reaper 6*, Imperial TIE Fighter, Gauntlet Starfighter, FOSF TIE Fighter, FO TIE Fighter",0
"Wonkee",1,0,62536,Troopers,"Veers G7, Piett 4* G8, zzGideon Dark Trooper 5* G7, Range Trooper 5* G9",0
"Wonkee",,,72778,Mon Mothma,"Mon Mothma 5* G8, zKyle Katarn G9, Chirrut G9, Lando G9, zCara Dune",0
"Wonkee",,,60393,Iden Troopers,"Iden Versio 3* G8, Shoretrooper G8, Snowtrooper G8, Magma DT G7",0
"Wonkee",,,69604,Bad Batch,"Hunter 6* G9, Echo G8, zzOmega Tech 5* G9, Wrecker G8",0
"Wonkee",1,0,69141,Jawas,"Nebit G8, Jawa Engineer G7, Jawa Scavenger G7, Jawa Dathcha G9",0
"SeriousB",,,174364,JMK,"zzzzzzJMK zAhsoka zzzCAT zzzzGAS zGK",1
"SeriousB",,,117655,Phasma,"zPhasma FOTP FOSFTP zFOST Kylo",1
"SeriousB",,,154062,SEE,"zzzzzzSEE zBSF zzMalak zzzDR zDooku",1
"SeriousB",,,526018,Executor,"Executor 5* HT RC Xanadu Blood, Slave I, IG-2000 Imperial TIE Fighter, Tie Adv",1
"SeriousB",1,0,150788,CLS,"zzzCLS zHan zzChewbacca zzC-3PO zChewpio",1
"SeriousB",,,512314,Negotiator,"Negotiator BTL-B Y-wing, Anakin's Eta-2, Rex's ARC-170, Umbaran SF, Ahsoka's SF, Plo's SF, Clone Sergeant's ARC-170",1
"SeriousB",,,138958,JKL,"zzJKL zzzJKR zHYoda Old Ben, Aayla",1
"SeriousB",,,399429,HansMF,"Home One, Han's MF, Rebel Y-wing, Bistan's U-wing, Phantom Biggs X-wing, Cassian's U-wing, Wedge X-wing",1
"SeriousB",0,1,102655,Geonosians,"zzGBA Sun Fac, Geo Soldier, Geo Spy, Poggle",1
"SeriousB",,,108876,Disintegration,"Aurra Greef G8, zBoba zBossk zThe Mandalorian",1
"SeriousB",1,1,78903,Ewoks,"zChirpa G9, Elder Paploo Wicket Logray",1
"SeriousB",1,0,149250,ShaakClones,"zzShaak Ti, zRex zEcho (501st), zzFives zARC Trooper",1
"SeriousB",1,1,87562,Carth,"zCarth Onasi, zMission zZaalbar Juhani Canderous G8",1
"SeriousB",1,1,141150,zEP,"zzEP zzzVader Tarkin TFP Sith Trooper",1
"SeriousB",0,1,129897,BH,"zJango Zam Dengar Embo Cad",1
"SeriousB",0,1,77391,Phoenix,"Hera Kanan G8, zEzra Zeb G8, Sabine G8",1
"SeriousB",1,1,65250,Rogue1,"Jyn G8, Chirrut G8, Baze G8, Cassian G8, K-2SO G8",1
"SeriousB",1,0,18231,SionSolo (Counter),"Sion",1
"SeriousB",1,0,16380,NestSolo (Counter),"Nest",1
"SeriousB",,,135134,LV,"zzzzzzLord Vader, Piett zzMaul zRG Stormtrooper G9",0
"SeriousB",1,1,81392,NS,"zMT G9, zAV zDaka Zombie Spirit G8",0
"SeriousB",0,1,134017,Grievous,"zGG zB2 zB1 zMagnaGuard Nute",0
"SeriousB",1,1,100640,JTR,"JTR Scav Rey, BB-8 G8, zR2-D2 Finn G8",0
"SeriousB",,,115781,Mon Mothma,"zzMon Mothma, Kyle Katarn, Lando Wedge Biggs",0
"SeriousB",1,0,79279,Troopers,"Veers Starck Magma G7, DT G8, Snowtrooper G8",0
"SeriousB",,,106163,Bad Batch,"Hunter Echo Omega G9, Tech Wrecker",0
