Player,Offense,Defense,GP,Name,Squad,Viable
"Cukorbors",1,0,146753,CLS,"zzzCLS zHan zzChewbacca zzC-3PO zChewpio",1
"Cukorbors",1,1,108478,NestSisters,"zzAV zzMT zDaka Zombie zNest",1
"Cukorbors",,,459283,Negotiator,"Negotiator BTL-B Y-wing, Anakin's Eta-2, Rex's ARC-170, Umbaran SF, Ahsoka's SF, Plo's SF, Clone Sergeant's ARC-170",1
"Cukorbors",,,301691,Malevolence,"Malevolence Hyena Bomber, Vulture Droid, Sun Fac SF, Soldier SF, Spy SF",1
"Cukorbors",,,141742,JKL,"zzJKL zzzJKR zzHYoda zzOld Ben, Aayla",1
"Cukorbors",,,436651,HansMF,"Home One, Han's MF, Rebel Y-wing, Bistan's U-wing, Phantom Ghost Cassian's U-wing, Wedge X-wing",1
"Cukorbors",1,1,118795,JTR,"zzzJTR zzR2-D2 zzBB-8 RH Finn G8, RH Poe G9",1
"Cukorbors",0,1,94666,Geonosians,"zzGBA Sun Fac, Geo Soldier, Geo Spy, Poggle",1
"Cukorbors",0,1,125207,Grievous,"zzGG zB2 zB1 zMagnaGuard zNute",1
"Cukorbors",1,0,124748,Traya,"zzTraya zzDN zSion zzEP Sith Empire Trooper",1
"Cukorbors",,,108875,Mon Mothma,"zzMon Mothma, Baze Wedge Biggs zCara Dune",1
"Cukorbors",,,117827,Disintegration,"zAurra Greef G8, zBoba zzBossk zThe Mandalorian",1
"Cukorbors",1,1,80912,Ewoks,"zChirpa G9, Elder Paploo Wicket Logray G9",1
"Cukorbors",1,0,110595,ShaakClones,"zzShaak Ti, zRex zEcho (501st), zzFives zARC Trooper",1
"Cukorbors",1,1,96586,Carth,"zCarth Onasi, zMission zZaalbar Juhani zCanderous",1
"Cukorbors",0,1,131892,BH,"zzJango zDengar zZam zIG-88 zzEmbo",1
"Cukorbors",1,0,131914,Troopers,"zVeers zStarck zIden Versio, zzPiett zDark Trooper",1
"Cukorbors",0,1,92832,Phoenix,"zHera zEzra zZeb zKanan Sabine",1
"Cukorbors",1,0,132453,zMaul,"zDarth Maul, zDooku zSidious zSavage Sith Marauder",1
"Cukorbors",1,0,68955,Jawas,"Nebit G8, Jawa Engineer G9, Jawa Scavenger G8, Jawa G9, Dathcha G9",1
"Cukorbors",,,85374,Admiral Raddus,"Admiral Raddus G8, Cassian Jyn K-2SO Chirrut",0
"Cukorbors",,,88974,Bad Batch,"zHunter G9, zEcho G9, zzOmega G9, zTech G9, zWrecker G9",0
"Nico 1313",0,1,112323,DR,"zzzDR zzHK-47 zBSF Sith Marauder, Sith Empire Trooper",1
"Nico 1313",0,1,85238,Geonosians,"zGBA Sun Fac, Geo Soldier, Geo Spy, Poggle",1
"Nico 1313",1,1,116101,Revan,"zzzJKR BS zGMY zJolee GK",1
"Nico 1313",1,0,96556,ShaakClones,"zzShaak Ti, zRex Echo (501st), zzFives ARC Trooper",1
"Nico 1313",1,1,82832,zEP,"zEP zzzVader Tarkin DT G8, TFP G8",1
"Nico 1313",0,1,109365,FO,"zzKRU zKylo zHux 6* FOO FOE",1
"Nico 1313",0,1,73309,Phoenix,"Hera G8, zEzra Chopper G9, Zeb G8, Kanan G8",1
"Nico 1313",1,0,19848,NestSolo (Counter),"zNest",1
"Nico 1313",1,0,62196,CLS,"zCLS Han G8, Chewbacca 5* G6, R2-D2 G8, Chewpio 3* G7",0
"Nico 1313",,,328513,Negotiator,"Negotiator 5* HT 6* Anakin's Eta-2, Umbaran SF, Ahsoka's SF, Clone Sergeant's ARC-170, Jedi Consular's Starfighter, Plo's SF",0
"Nico 1313",0,1,60960,Grievous,"GG G9, B2 G8, B1 5* G8, MagnaGuard G5, Nute G9",0
"Nico 1313",1,1,58657,Ewoks,"Chirpa G8, Elder G8, Paploo G8, Teebo G8, Wicket 5* G8",0
"Nico 1313",1,1,68117,Carth,"Carth Onasi, Mission G7, Zaalbar G7, Juhani G8, Canderous",0
"Nico 1313",0,1,77875,BH,"Bossk 5* The Mandalorian G8, zBoba IG-88 G8, Jango",0
"Nico 1313",1,0,52116,Troopers,"Veers 6* G7, Starck G5, Gideon G8, Stormtrooper G7, Magma G7",0
"GeneralSsnow",1,1,124607,Revan,"zzJKR zBS zzGMY zJolee GK",1
"GeneralSsnow",1,1,91901,Carth,"zCarth Onasi, zMission zZaalbar Juhani Canderous",1
"GeneralSsnow",0,1,55757,Phoenix,"Hera G8, Ezra G8, Chopper G8, Zeb G8, Kanan G8",1
"GeneralSsnow",,,56985,Phasma,"Phasma G8, FOE G8, FOO G8, zKRU G8, Kylo G8",0
"GeneralSsnow",1,0,86385,CLS,"zCLS Han zChewbacca G9, zC-3PO Chewpio 4* G9",0
"GeneralSsnow",,,215011,HansMF,"Home One, Han's MF 5*, Rebel Y-wing 4*, Bistan's U-wing 4*, Phantom 6* Biggs X-wing, Cassian's U-wing 6*, Wedge X-wing",0
"GeneralSsnow",0,1,78587,Geonosians,"zGBA Sun Fac G8, Geo Soldier, Geo Spy, Poggle G9",0
"GeneralSsnow",0,1,82257,DRMalak,"zDR HK-47 BSF zMalak 5* Thrawn G9",0
"GeneralSsnow",0,1,69414,Grievous,"GG G7, B2 zB1 zMagnaGuard Nute G7",0
"GeneralSsnow",1,1,56466,JTR,"JTR G8, Scav Rey G8, BB-8 G9, R2-D2 G8, Finn G9",0
"GeneralSsnow",1,1,73319,NS,"zMT G9, AV Daka G9, Zombie Spirit G8",0
"GeneralSsnow",1,0,85935,Traya,"zTraya 5* zDN Sion 3* G9, zDooku EP",0
"GeneralSsnow",,,56411,Mon Mothma,"zMon Mothma 5* G8, Chirrut G8, K-2SO G8, Wedge G8, Cara Dune G8",0
"GeneralSsnow",1,0,68064,ShaakClones,"zShaak Ti G9, Rex G8, Echo (501st) G9, zFives G9, Clone Sergeant G8",0
"GeneralSsnow",1,1,64475,Ewoks,"Chirpa Elder Paploo G9, Teebo G9, Scout",0
"GeneralSsnow",0,1,72693,BH,"zBossk 5* G8, Greedo Boba G8, IG-88 Greef G9",0
"GeneralSsnow",,,44617,Iden Troopers,"Iden Versio 3* G7, Stormtrooper G9, Snowtrooper G8, Magma G6, DT 6* G8",0
"GeneralSsnow",0,1,49167,BH,"Jango 5* G8, The Mandalorian G8, Zam G8, Embo 5* G8, Cad G8",0
"sergio",0,1,113620,Geonosians,"zzGBA Sun Fac, Geo Soldier, Geo Spy, Poggle",1
"sergio",,,109982,Disintegration,"zAurra zzGreef zBoba zzBossk zzThe Mandalorian",1
"sergio",1,1,97263,Revan,"zzzJKR zBS GMY G8, zJolee zGK",1
"sergio",1,1,98950,Ewoks,"zChirpa Elder zPaploo zWicket zLogray",1
"sergio",1,1,98908,Carth,"zCarth Onasi, zMission zZaalbar zJuhani zCanderous",1
"sergio",1,1,106649,zEP,"zzEP zzzVader zzTarkin TFP G8, zBSF",1
"sergio",0,1,92449,BH,"zzJango zDengar zZam G9, IG-88 G9, Cad",1
"sergio",0,1,116126,Phoenix,"zHera zEzra zZeb zKanan Sabine",1
"sergio",1,0,12465,NestSolo (Counter),"Nest G8",1
"sergio",,,67791,Phasma,"Phasma G7, FOTP FOO G8, KRU Kylo G9",0
"sergio",,,252694,Negotiator,"Negotiator 6* BTL-B Y-wing 2*, Anakin's Eta-2 6*, Rex's ARC-170, Umbaran SF, Ahsoka's SF, Plo's SF, Clone Sergeant's ARC-170",0
"sergio",,,331880,HansMF,"Home One, Han's MF 5*, Rebel Y-wing 5*, Bistan's U-wing, Phantom Ghost Cassian's U-wing, Biggs X-wing",0
"sergio",1,1,68646,JTR,"JTR G5, zScav Rey, BB-8 G9, R2-D2 G8, zFinn",0
"sergio",0,1,62415,Grievous-Wat,"GG G9, B2 G7, B1 G8, MagnaGuard G8, Wat Tambor G9",0
"sergio",1,1,78164,NS,"zzMT G9, zAV Daka G8, Zombie G9, Spirit G7",0
"sergio",1,0,68961,CLS,"zCLS Han G7, Chewbacca G8, Leia G8, C-3PO G5",0
"sergio",1,0,56656,ShaakClones,"Shaak Ti G8, Rex G7, Echo (501st) G7, Fives G9, Clone Sergeant G8",0
"sergio",1,0,48279,Troopers,"Veers G7, Starck G5, Snowtrooper G8, Stormtrooper G7, Magma G7",0
"sergio",1,1,50379,Rogue1,"Jyn G7, Chirrut G7, Baze G5, K-2SO G8, Pao G7",0
"sergio",1,0,59776,QGJ,"QGJ G7, Aayla G5, JKA G9, HYoda Ahsoka",0
"sergio",1,0,53155,Jawas,"Nebit G8, Jawa Engineer G7, Jawa Scavenger G7, Jawa G7, Dathcha G7",0
"Vilu Dascar",1,1,158527,GL Rey,"zzzzzzRey zzzJTR zBB-8 zHoldo zRH Finn",1
"Vilu Dascar",,,545264,Executor,"Executor 5* HT RC Xanadu Blood, Slave I, IG-2000 Imperial TIE Fighter, Tie Adv",1
"Vilu Dascar",0,1,114708,DRMalak,"zzzDR zHK-47 zBSF zzMalak Sith Empire Trooper",1
"Vilu Dascar",0,1,97653,padme,"zzPadme zGK JKA Ahsoka G8, zzC-3PO",1
"Vilu Dascar",,,333186,HansMF,"Home One, Han's MF, Rebel Y-wing 6*, Bistan's U-wing, Phantom Ghost Cassian's U-wing, Biggs X-wing",1
"Vilu Dascar",0,1,96490,Geonosians,"zzGBA Sun Fac, Geo Soldier, Geo Spy, Poggle",1
"Vilu Dascar",0,1,92310,Grievous,"zzGG B2 G8, zB1 zDroideka MagnaGuard",1
"Vilu Dascar",,,103641,Nute-Wat,"zNute zDooku zWat Tambor 6*, zzJango zNest G9",1
"Vilu Dascar",1,1,114474,Revan Offense,"zzzJKR zzGMY zBS zJolee zHYoda",1
"Vilu Dascar",1,1,91027,Ewoks,"zChirpa Elder Paploo zWicket zLogray",1
"Vilu Dascar",1,0,96807,ShaakClones,"zzShaak Ti, zRex zEcho (501st), zFives ARC Trooper",1
"Vilu Dascar",0,1,146071,BH,"zzBossk Krrsantan zGreedo zDengar zBoba",1
"Vilu Dascar",1,1,88530,Carth,"zCarth Onasi, zMission zZaalbar Juhani Canderous G8",1
"Vilu Dascar",1,1,115926,zEP,"zzEP zzzVader zTarkin TFP zMara Jade, The Emperor's Hand 5*",1
"Vilu Dascar",1,0,110726,Troopers,"zVeers zStarck zGideon zzPiett Range Trooper",1
"Vilu Dascar",1,0,99262,Jawas,"Nebit Jawa Engineer, Jawa Scavenger, Jawa Dathcha",1
"Vilu Dascar",1,0,20038,SionSolo (Counter),"zSion",1
"Vilu Dascar",,,64380,Phasma,"Phasma G8, FOTP G8, FOE 6* G8, zKRU Kylo G9",0
"Vilu Dascar",1,0,130718,CLS,"zzzCLS zHan zzChewbacca zzR2-D2 Chewpio G8",0
"Vilu Dascar",1,1,66167,NS_Alt,"MT G8, AV G9, Talia G8, Daka G9, Zombie",0
"Vilu Dascar",0,1,69621,Phoenix,"Hera G8, Ezra Chopper G7, Zeb G7, zKanan G8",0
"Ethan Geilvta",0,1,136829,DRMalak,"zzzDR zzHK-47 zBSF zzMalak Sith Assassin G9",1
"Ethan Geilvta",0,1,137116,padme,"zzPadme zGK zJKA zAhsoka zzC-3PO",1
"Ethan Geilvta",,,377612,HansMF,"Home One, Han's MF, Rebel Y-wing, Bistan's U-wing, Phantom Ghost Cassian's U-wing, Biggs X-wing",1
"Ethan Geilvta",,,496789,Negotiator,"Negotiator 6* HT Anakin's Eta-2, Umbaran SF, Ahsoka's SF, Clone Sergeant's ARC-170, Plo's SF, Rex's ARC-170",1
"Ethan Geilvta",1,1,108255,NS_Alt,"zzMT Acolyte zDaka zAV Zombie",1
"Ethan Geilvta",0,1,119641,Geonosians,"zzGBA Sun Fac, Geo Soldier, Geo Spy, Poggle",1
"Ethan Geilvta",1,0,103486,Traya,"zzTraya zDN zSion Sith Empire Trooper G8, Thrawn G9",1
"Ethan Geilvta",1,1,88493,JTR,"zzJTR Scav Rey, BB-8 G8, zR2-D2 Finn G9",1
"Ethan Geilvta",,,104566,Nute-Wat,"zNute zB1 zB2 zMagnaGuard zWat Tambor 6*",1
"Ethan Geilvta",1,1,135705,Revan Offense,"zzzJKR zGMY zBS zJolee zEzra",1
"Ethan Geilvta",1,1,92594,Ewoks,"zChirpa Elder zPaploo zWicket zLogray",1
"Ethan Geilvta",1,0,118226,ShaakClones,"zzShaak Ti, zRex zEcho (501st), zzFives Clone Sergeant",1
"Ethan Geilvta",0,1,124289,BH,"zzBossk The Mandalorian, zDengar zBoba zJango",1
"Ethan Geilvta",1,1,129017,zEP,"zzEP zzzVader Tarkin TFP G9, zzMara Jade, The Emperor's Hand",1
"Ethan Geilvta",0,1,136047,FO,"zzKRU zKylo zHux FOE zFOST",1
"Ethan Geilvta",0,1,78311,Phoenix,"Hera Chopper Zeb G8, Kanan G8, Sabine",1
"Ethan Geilvta",1,0,69085,Jawas,"Nebit G8, Jawa Engineer G9, Jawa Scavenger G8, Jawa G9, Dathcha G9",1
"Ethan Geilvta",1,0,20010,NestSolo (Counter),"zNest",1
"Ethan Geilvta",,,76882,Admiral Raddus,"zzAdmiral Raddus 6* G8, Cassian G8, Jyn K-2SO G8, Chirrut G8",0
"Ethan Geilvta",,,416658,Executrix,"Executrix Tie Adv, Emperor's Shuttle, TIE Reaper 3*, Imperial TIE Fighter, Gauntlet Starfighter, FOSF TIE Fighter, FO TIE Fighter",0
"Ethan Geilvta",1,0,57727,Troopers,"Veers Piett G9, Gideon 5* G9, Dark Trooper 5* G7, Range Trooper 6* G3",0
"Ethan Geilvta",,,69322,Mon Mothma,"Mon Mothma 6* G8, Hoth Rebel Scout G8, Scarif G7, zCara Dune, Hoth Rebel Soldier G8",0
"Ethan Geilvta",1,1,92111,Carth,"zCarth Onasi, zMission zZaalbar Juhani G7, Canderous",0
"Ethan Geilvta",1,0,97626,Wiggs,"Wedge G7, Biggs G8, zzCLS zHan zzChewbacca",0
"Ethan Geilvta",,,62690,Iden Troopers,"zIden Versio 4* G8, Stormtrooper G8, Snowtrooper G9, Magma G8, DT 6* G7",0
"Ethan Geilvta",,,70337,Bad Batch,"Hunter 6* G9, Echo 5* G9, zOmega G9, Tech G9, zWrecker 6* G8",0
"Thraken The First",,,161443,JMLS,"zzzJKR zzJKL zzJMLS zzHYoda zzzzGAS",1
"Thraken The First",0,1,153530,DRMalak,"zzzDR HK-47 zBSF zzMalak Sith Empire Trooper",1
"Thraken The First",1,0,146183,CLS,"zzzCLS zHan zzChewbacca zC-3PO zChewpio",1
"Thraken The First",,,484604,Negotiator,"Negotiator 5* HT Anakin's Eta-2, Umbaran SF, Ahsoka's SF, Clone Sergeant's ARC-170, Plo's SF, Rex's ARC-170",1
"Thraken The First",0,1,100685,Geonosians,"zzGBA Sun Fac, Geo Soldier, Geo Spy, Poggle",1
"Thraken The First",0,1,121071,Grievous,"zGG zB2 zB1 zDroideka zMagnaGuard",1
"Thraken The First",1,1,88998,Ewoks,"zChirpa Elder Paploo zWicket Logray",1
"Thraken The First",1,0,148025,ShaakClones,"zzShaak Ti, zRex zEcho (501st), zzFives zARC Trooper",1
"Thraken The First",0,1,96897,BH,"zBossk Dengar G9, Boba Cad Jango",1
"Thraken The First",1,1,92715,Carth,"zCarth Onasi, zMission zZaalbar Juhani Canderous",1
"Thraken The First",1,1,127222,zEP,"zzEP zzzVader Tarkin TFP zzMara Jade, The Emperor's Hand",1
"Thraken The First",0,1,75297,Phoenix,"Hera G9, Ezra Zeb G9, Kanan G9, Sabine G8",1
"Thraken The First",0,1,126263,BS,"zBS zGMY zJolee zGK zAhsoka",1
"Thraken The First",1,0,73382,Jawas,"Nebit G9, Jawa Engineer, Jawa Scavenger G9, Jawa Dathcha G9",1
"Thraken The First",1,0,19893,NestSolo (Counter),"zNest",1
"Thraken The First",1,0,15219,SionSolo (Counter),"Sion G9",1
"Thraken The First",,,57900,Phasma,"Phasma G9, FOTP FOSFTP 5* G8, FOST 3* G7, Kylo 5* G8",0
"Thraken The First",1,1,88071,NS,"MT zAV Daka Zombie Spirit",0
"Thraken The First",,,397503,HansMF,"Home One, Han's MF, Rebel Y-wing 6*, Bistan's U-wing 5*, Phantom Biggs X-wing, Cassian's U-wing 5*, Wedge X-wing",0
"Thraken The First",1,1,107250,JTR,"zzJTR Scav Rey, BB-8 G9, R2-D2 Finn",0
"Thraken The First",1,0,58441,Troopers,"Veers G9, Piett 5* G7, Gideon Dark Trooper 5* G7, Range Trooper 5* G3",0
"Thraken The First",,,122739,Mon Mothma,"zzMon Mothma, Lando zKyle Katarn, Wedge Biggs",0
"Thraken The First",1,1,50501,Rogue1,"Jyn 6* G7, Chirrut 4* G6, Baze 5* G6, Bistan G5, Scarif G7",0
"Renegade",1,0,138416,CLS,"zzzCLS zHan zzChewbacca zzC-3PO zChewpio",1
"Renegade",0,1,133776,DRMalak,"zzzDR zzHK-47 zBSF zzMalak Sith Empire Trooper",1
"Renegade",1,1,103553,NestSisters,"zzAV zzMT zDaka Zombie zNest",1
"Renegade",,,456038,Negotiator,"Negotiator HT Anakin's Eta-2, Umbaran SF, Ahsoka's SF, BTL-B Y-wing, Clone Sergeant's ARC-170, Plo's SF",1
"Renegade",,,318715,Malevolence,"Malevolence Hyena Bomber, Vulture Droid, Sun Fac SF, Soldier SF, Spy SF",1
"Renegade",,,443548,HansMF,"Home One, Han's MF, Rebel Y-wing, Bistan's U-wing, Phantom Ghost Cassian's U-wing, Wedge X-wing",1
"Renegade",0,1,110720,Geonosians,"zzGBA Sun Fac, Geo Soldier, Geo Spy, Poggle",1
"Renegade",1,1,110817,JTR,"zzzJTR zzR2-D2 zzBB-8 zRH Finn, zRH Poe",1
"Renegade",0,1,118654,Grievous,"zzGG zB2 zB1 zMagnaGuard zNute",1
"Renegade",1,0,122657,Traya,"zzTraya zDN zSion zzEP zThrawn",1
"Renegade",,,112482,Disintegration,"Aurra zzGreef zBoba zzBossk zzThe Mandalorian",1
"Renegade",1,1,133854,Revan,"zzzJKR zBS zGMY zJolee zGK",1
"Renegade",1,1,96271,Ewoks,"zChirpa Elder zPaploo zWicket zLogray",1
"Renegade",1,0,112062,ShaakClones,"zzShaak Ti, zRex zEcho (501st), zzFives zARC Trooper",1
"Renegade",1,1,98368,Carth,"zCarth Onasi, zMission Zaalbar zJuhani zCanderous",1
"Renegade",0,1,98120,FO,"zzKRU Kylo zHux FOO FOE",1
"Renegade",0,1,94657,Phoenix,"zHera zEzra Zeb zKanan zSabine",1
"Renegade",1,1,100686,Rogue1,"zzJyn Chirrut Baze zCassian zK-2SO",1
"Renegade",1,0,89657,Jawas,"Nebit Jawa Engineer, Jawa Scavenger, Jawa Dathcha",1
"Renegade",,,399805,Executrix,"Executrix Tie Adv, Emperor's Shuttle, TIE Reaper 6*, Imperial TIE Fighter, Gauntlet Starfighter, FOSF TIE Fighter, FO TIE Fighter",0
"Renegade",1,0,71056,Troopers,"Veers Piett G7, Gideon Dark Trooper G9, Range Trooper",0
"Renegade",,,81475,Mon Mothma,"Mon Mothma G8, Lando Wedge Biggs Cara Dune",0
"Renegade",,,79132,Iden Troopers,"zIden Versio, Shoretrooper Snowtrooper G8, Magma G8, zDT",0
"Renegade",0,1,91978,BH,"zJango Greedo G9, Dengar zIG-88 Cad",0
"Renegade",,,65209,Bad Batch,"Hunter G7, Echo G7, Omega G8, Tech G8, Wrecker G7",0
"Renegade",1,0,104412,QGJ,"QGJ Aayla G6, zJKA zzOld Ben, zAhsoka",0
"O k a y",0,1,134625,padme,"zzPadme zGK zJKA zAhsoka zzC-3PO",1
"O k a y",0,1,121533,Grievous,"zzGG zB2 zB1 MagnaGuard zNute",1
"O k a y",1,1,121478,GAS,"zzzzGAS zRex Echo (501st), zzFives zARC Trooper",1
"O k a y",1,1,109225,Revan Offense,"zzzJKR zGMY BS zJolee Ezra G9",1
"O k a y",1,1,79584,Ewoks,"zChirpa Elder Paploo Scout Logray G9",1
"O k a y",1,1,88425,Carth,"zCarth Onasi, zMission zZaalbar Juhani G9, zCanderous",1
"O k a y",1,1,88051,zEP,"zEP zzVader Tarkin G8, TFP G8, zBSF",1
"O k a y",1,0,16726,NestSolo (Counter),"zNest G9",1
"O k a y",,,46280,Phasma,"Phasma G6, Sith Trooper 3* G8, FOSFTP G8, KRU 6* G8, Kylo 6* G6",0
"O k a y",,,459448,Negotiator,"Negotiator BTL-B Y-wing 4*, Anakin's Eta-2, Rex's ARC-170, Umbaran SF, Ahsoka's SF, Plo's SF, Clone Sergeant's ARC-170",0
"O k a y",1,0,82968,CLS,"zzCLS zHan zChewbacca R2-D2 G8, Chewpio 4* G8",0
"O k a y",,,265516,HansMF,"Home One, Han's MF 5*, Rebel Y-wing 4*, Bistan's U-wing 4*, Phantom Ghost Cassian's U-wing, Biggs X-wing",0
"O k a y",0,1,76881,Geonosians,"zGBA Sun Fac G9, Geo Soldier, Geo Spy G8, Poggle",0
"O k a y",,,67351,Disintegration,"Aurra 5* G8, Greef 6* G9, Boba zBossk 4* G9, The Mandalorian G8",0
"O k a y",1,0,76562,Traya,"zzTraya DN 5* G9, zSion 4* zDooku Thrawn 6* G8",0
"O k a y",1,0,54402,Troopers,"zVeers 5* G9, zPiett 5* G9, Gideon 4* G7, Dark Trooper 5* G9, Range Trooper 5* G8",0
"O k a y",,,80182,Mon Mothma,"zzMon Mothma 5*, Cassian G8, zKyle Katarn 4*, Hoth Rebel Scout, zPao",0
"O k a y",1,1,60764,NS,"MT 6* G8, AV Daka G8, Zombie G8, Spirit 6* G7",0
"O k a y",0,1,83064,BH,"Jango Krrsantan 3* G7, Dengar G8, IG-88 G8, Cad",0
"O k a y",0,1,59153,Phoenix,"Hera G8, Chopper G8, Zeb G8, Kanan G8, Sabine 5* G8",0
"O k a y",1,0,48928,Jawas,"Nebit G7, Jawa Engineer G9, Jawa Scavenger G6, Jawa 5* G6, Dathcha G6",0
"SnakeEyes",,,123211,Phasma,"zPhasma zFOTP FOSFTP zFOST zKylo",1
"SnakeEyes",1,1,156614,SL Kylo,"zzzzzzSL Kylo, zSith Trooper, zHux zzKRU zzThrawn",1
"SnakeEyes",,,167015,JMLS,"zzzJKR zzJKL zzzzzzJMLS zHYoda zzzzGAS",1
"SnakeEyes",1,0,146692,CLS,"zzzCLS zHan zzChewbacca zzC-3PO zChewpio",1
"SnakeEyes",0,1,129138,DRMalak,"zzzDR zzHK-47 zBSF zzMalak Sith Empire Trooper",1
"SnakeEyes",,,461360,Negotiator,"Negotiator BTL-B Y-wing, Anakin's Eta-2, Rex's ARC-170, Umbaran SF, Ahsoka's SF, Plo's SF, Clone Sergeant's ARC-170",1
"SnakeEyes",,,402047,HansMF,"Home One, Han's MF, Rebel Y-wing, Bistan's U-wing, Phantom Biggs X-wing, Cassian's U-wing, Wedge X-wing",1
"SnakeEyes",0,1,93278,Geonosians,"zzGBA Sun Fac, Geo Soldier, Geo Spy, Poggle",1
"SnakeEyes",0,1,128114,Grievous,"zzGG zB2 zB1 zDroideka zMagnaGuard",1
"SnakeEyes",1,1,117757,JTR,"zzzJTR Scav Rey, zBB-8 G9, zzR2-D2 Finn",1
"SnakeEyes",1,0,105684,Troopers,"zVeers zzPiett zzGideon Dark Trooper, Range Trooper",1
"SnakeEyes",,,107123,Nute-OR,"zNute zDooku zzJango zZaalbar zMission",1
"SnakeEyes",1,1,80819,Ewoks,"zChirpa Elder Paploo Wicket Logray",1
"SnakeEyes",1,0,129570,ShaakClones,"zzShaak Ti, zRex zEcho (501st), zzFives zARC Trooper",1
"SnakeEyes",0,1,105785,BH,"zzBossk zzThe Mandalorian, Dengar Boba zIG-88",1
"SnakeEyes",1,1,130680,zEP,"zzEP zzzVader zzTarkin TFP G9, zzMara Jade, The Emperor's Hand",1
"SnakeEyes",0,1,119629,BS,"zBS zGMY zJolee zGK zJKA",1
"SnakeEyes",1,0,15450,NestSolo (Counter),"Nest",1
"SnakeEyes",1,0,17163,SionSolo (Counter),"zSion G8",1
"SnakeEyes",1,1,93084,NS,"zzMT zzAV zDaka G9, Zombie Spirit",0
"SnakeEyes",,,270989,Malevolence,"Malevolence Hyena Bomber 4*, Vulture Droid 4*, Sun Fac SF, Soldier SF, Spy SF",0
"SnakeEyes",,,434746,Executrix,"Executrix Tie Adv, Emperor's Shuttle 4*, TIE Reaper 3*, Imperial TIE Fighter, Gauntlet Starfighter, FOSF TIE Fighter, FO TIE Fighter",0
"SnakeEyes",,,111239,Mon Mothma,"zzMon Mothma, Lando Kyle Katarn, Wedge Biggs",0
"SnakeEyes",,,60691,Iden Troopers,"Iden Versio 4* G8, Shoretrooper 6* G7, Snowtrooper Magma G4, zDT G7",0
"SnakeEyes",0,1,75736,Phoenix,"Hera G8, zEzra Chopper G7, Zeb G8, Kanan",0
"SnakeEyes",,,90726,Bad Batch,"zHunter zEcho zzOmega G9, zTech zWrecker G9",0
"SnakeEyes",1,1,65184,Rogue1,"Jyn G7, Chirrut G8, Baze 6* G7, Cassian G7, zK-2SO G9",0
"SnakeEyes",1,0,66115,Jawas,"Nebit G8, Jawa Engineer G7, Jawa Scavenger G8, Jawa G7, Dathcha G8",0
"Deathdealer",0,1,118704,padme,"zzPadme zGK JKA zAhsoka zzC-3PO",1
"Deathdealer",0,1,87549,Geonosians,"zzGBA Sun Fac, Geo Soldier, Geo Spy, Poggle",1
"Deathdealer",1,1,101227,Revan Offense,"zzJKR zGMY BS zJolee Ezra",1
"Deathdealer",1,1,94174,Ewoks,"zChirpa Elder zPaploo zWicket Logray",1
"Deathdealer",1,0,136995,ShaakClones,"zzShaak Ti, zRex zEcho (501st), zzFives zARC Trooper",1
"Deathdealer",0,1,119772,BH,"zzBossk zDengar zZam zBoba zJango",1
"Deathdealer",1,0,77712,Wiggs,"Wedge Biggs CLS Chewbacca G9, Leia",1
"Deathdealer",0,1,79248,Phoenix,"Hera Chopper zZeb zKanan Sabine G8",1
"Deathdealer",,,61515,Phasma,"Phasma G8, FOE 5* G9, FOO G8, KRU G8, Kylo G9",0
"Deathdealer",,,296188,HansMF,"Home One, Han's MF 5*, Biggs X-wing, Bistan's U-wing 3*, Phantom Ghost Cassian's U-wing, Wedge X-wing",0
"Deathdealer",0,1,100524,Grievous,"GG G9, zB2 zB1 zMagnaGuard Nute",0
"Deathdealer",1,1,71046,JTR,"JTR G8, Scav Rey, BB-8 G8, R2-D2 G8, Finn",0
"Deathdealer",1,1,67922,NS_Alt,"MT G8, AV Talia 6* G9, Spirit G8, Daka G9",0
"Deathdealer",1,1,96383,zEP,"zEP zzzVader Tarkin TFP G8, DN",0
"Deathdealer",1,0,61959,Troopers,"Veers 6* G9, Starck G8, Gideon G9, Snowtrooper G8, Stormtrooper G8",0
"Deathdealer",1,1,51294,Rogue1,"Jyn 5* G8, Chirrut G8, Baze 6* G8, Cassian G9, K-2SO G8",0
"Sheriffmack",0,1,133158,DRMalak,"zzzDR zzHK-47 zBSF zzMalak Sith Empire Trooper",1
"Sheriffmack",0,1,137555,padme,"zzPadme zGK zJKA zAhsoka zzC-3PO",1
"Sheriffmack",,,442379,Negotiator,"Negotiator BTL-B Y-wing, Anakin's Eta-2, Rex's ARC-170, Umbaran SF, Ahsoka's SF, Plo's SF, Clone Sergeant's ARC-170",1
"Sheriffmack",0,1,124217,Grievous,"zzGG zB2 zB1 MagnaGuard zNute",1
"Sheriffmack",1,1,136861,GAS,"zzzzGAS zRex zEcho (501st), zzFives zARC Trooper",1
"Sheriffmack",1,1,115080,Revan Offense,"zzzJKR zzGMY zBS zJolee HYoda G9",1
"Sheriffmack",1,1,95007,Ewoks,"zChirpa Elder zPaploo zWicket zLogray",1
"Sheriffmack",1,1,91016,Carth,"Carth Onasi, zMission Zaalbar Juhani Canderous",1
"Sheriffmack",1,1,112080,zEP,"zzEP zzzVader zTarkin TFP DN G9",1
"Sheriffmack",0,1,77239,Phoenix,"Hera G9, Ezra Zeb G8, zKanan Sabine G8",1
"Sheriffmack",,,61605,Phasma,"Phasma G7, FOTP G8, FOSFTP G7, FOST 5* G8, Kylo G9",0
"Sheriffmack",,,71869,Admiral Raddus,"Admiral Raddus 3* G7, Cassian G9, zJyn G9, Scarif G8, Chirrut",0
"Sheriffmack",0,1,82359,Geonosians,"zzGBA Sun Fac G7, Geo Soldier G9, Geo Spy G8, Poggle",0
"Sheriffmack",1,1,68503,NS,"MT 4* G7, zzAV Daka G7, Zombie G7, Spirit G7",0
"Sheriffmack",1,0,46820,Troopers,"Veers G7, Piett 4* G5, Gideon 4* G7, Dark Trooper 5* G7, Range Trooper 5* G5",0
"Sheriffmack",,,63429,Mon Mothma,"Mon Mothma 5* G7, K-2SO G7, Wedge G8, Biggs G8, Cara Dune 6*",0
"Sheriffmack",0,1,104421,BH,"Bossk 5* Dengar G8, zZam zBoba zEmbo",0
"Sheriffmack",1,0,75714,zMaul,"Darth Maul G8, Sidious G8, zDooku Sith Marauder 6* G6, Nest 4* G5",0
"Sheriffmack",,,61170,Iden Troopers,"zIden Versio 4* G9, Stormtrooper G7, Snowtrooper G7, Magma G7, DT 6* G7",0
"Sheriffmack",1,0,99901,CLS,"zzzCLS zHan Leia Old Ben, zChewbacca 6* G7",0
"Sheriffmack",0,1,82461,BH,"zJango 6* zThe Mandalorian, Greedo G9, IG-88 G9, Cad G7",0
"Sheriffmack",,,117936,Bad Batch,"zHunter zEcho zOmega 6* G9, zTech zWrecker",0
"Sheriffmack",1,0,9184,SionSolo (Counter),"Sion 3* G7",0
"Wonkee",0,1,104437,padme,"zzPadme zGK zJKA zAhsoka zCW Chewbacca G9",1
"Wonkee",,,422942,Negotiator,"Negotiator HT Anakin's Eta-2, Umbaran SF, Ahsoka's SF, BTL-B Y-wing, Clone Sergeant's ARC-170, Plo's SF",1
"Wonkee",1,1,115883,NS_Alt,"zzMT zzAV Talia zDaka Zombie",1
"Wonkee",0,1,118686,DR,"zzzDR zzHK-47 zBSF Sith Empire Trooper G8, zzThrawn",1
"Wonkee",0,1,88109,Geonosians,"zzGBA Sun Fac G9, Geo Soldier, Geo Spy, Poggle",1
"Wonkee",1,1,114124,JTR,"zzzJTR zScav Rey, zzBB-8 zzR2-D2 zFinn",1
"Wonkee",1,0,109167,Traya,"zzTraya zzDN zSion zDooku zzEP",1
"Wonkee",,,413595,Raddus,"Raddus Sun Fac SF, Rey's Millennium Falcon, Poe Dameron's X-wing, Resistance X-wing, Biggs X-wing, Wedge X-wing, Phantom Ghost",1
"Wonkee",,,140544,Disintegration,"zzAurra zzGreef zBoba zzBossk zzThe Mandalorian",1
"Wonkee",1,1,131711,Revan Offense,"zzzJKR zzGMY zBS zJolee zzHYoda",1
"Wonkee",1,1,93158,Ewoks,"zChirpa Elder zPaploo zWicket zLogray G9",1
"Wonkee",1,0,96046,ShaakClones,"zzShaak Ti G9, zRex zEcho (501st), zzFives ARC Trooper G9",1
"Wonkee",1,1,117774,Carth,"zCarth Onasi, zMission zZaalbar zJuhani zCanderous",1
"Wonkee",0,1,113368,BH,"zzJango zGreedo zDengar zIG-88 zFennec Shand",1
"Wonkee",0,1,79661,FO,"zzKRU zKylo G9, FOO FOE G8, FOST G8",1
"Wonkee",0,1,90076,Phoenix,"zHera zEzra Zeb G9, zKanan zSabine",1
"Wonkee",1,0,102445,Wiggs,"Wedge G9, Biggs zzzCLS zHan zzChewbacca",1
"Wonkee",1,0,13582,NestSolo (Counter),"Nest G8",1
"Wonkee",0,1,77397,Grievous,"zzGG B2 G7, B1 G7, MagnaGuard G7, zNute G9",0
"Wonkee",,,357865,Executrix,"Executrix Tie Adv, Emperor's Shuttle 5*, TIE Reaper 6*, Imperial TIE Fighter, Gauntlet Starfighter, FOSF TIE Fighter, FO TIE Fighter",0
"Wonkee",1,0,62536,Troopers,"Veers G7, Piett 4* G8, zzGideon Dark Trooper 5* G7, Range Trooper 5* G9",0
"Wonkee",,,72778,Mon Mothma,"Mon Mothma 5* G8, Lando G9, zKyle Katarn G9, Chirrut G9, zCara Dune",0
"Wonkee",,,60393,Iden Troopers,"Iden Versio 3* G8, Shoretrooper G8, Snowtrooper G8, Magma DT G7",0
"Wonkee",,,69604,Bad Batch,"Hunter 6* G9, Echo G8, zzOmega Tech 5* G9, Wrecker G8",0
"Wonkee",1,0,69141,Jawas,"Nebit G8, Jawa Engineer G7, Jawa Scavenger G7, Jawa Dathcha G9",0
"schumi",,,133009,Phasma,"zPhasma zFOTP FOSFTP zFOST zKylo",1
"schumi",1,1,169793,SL Kylo,"zzzzzzSL Kylo, zSith Trooper, zHux zzKRU zzThrawn",1
"schumi",,,174661,SEE,"zzzzzzSEE zBSF zzMalak zzzDR zzzVader",1
"schumi",0,1,137484,padme,"zzPadme zGK zJKA zAhsoka zzC-3PO",1
"schumi",,,306611,Malevolence,"Malevolence Hyena Bomber, Vulture Droid, Sun Fac SF, Soldier SF, Spy SF",1
"schumi",0,1,99070,Geonosians,"zzGBA Sun Fac, Geo Soldier, Geo Spy, Poggle",1
"schumi",,,406198,HansMF,"Home One, Han's MF 5*, HT Ghost Phantom Biggs X-wing, Cassian's U-wing, Wedge X-wing",1
"schumi",0,1,118220,Grievous,"zzGG zB2 zB1 zMagnaGuard zNute",1
"schumi",1,0,150024,Traya,"zzTraya zzDN zSion zzEP Sith Empire Trooper",1
"schumi",1,1,103410,JTR,"zzzJTR zScav Rey, zzBB-8 zzR2-D2 zFinn G9",1
"schumi",1,0,139260,Troopers,"zVeers zzPiett zzGideon zDark Trooper, Range Trooper",1
"schumi",1,1,141297,GAS,"zzzzGAS zRex zEcho (501st), zzFives zARC Trooper",1
"schumi",1,1,94895,Ewoks,"zChirpa Elder zPaploo zWicket zLogray",1
"schumi",1,1,96633,Carth,"zCarth Onasi, zMission zZaalbar zJuhani zCanderous",1
"schumi",0,1,116553,BH,"zzBossk zBoba zIG-88 Cad zzJango",1
"schumi",,,93511,Iden Troopers,"zIden Versio, Shoretrooper Snowtrooper Magma zDT",1
"schumi",1,0,99425,CLS,"zzzCLS Han Wedge Biggs zzChewbacca",1
"schumi",1,1,91586,Rogue1,"zzJyn Chirrut Baze zCassian zK-2SO G9",1
"schumi",1,0,128388,zMaul,"zDarth Maul, zDooku zSidious zSavage Sith Marauder",1
"schumi",1,0,16084,NestSolo (Counter),"zNest G9",1
"schumi",1,1,100178,NS,"zzMT zzAV zDaka Zombie Spirit G8",0
