Player,Offense,Defense,GP,Name,Squad,Viable
"Amaterasu",,,592136,Executor,"Executor HT RC Xanadu Blood, Slave I, IG-2000 Imperial TIE Fighter, Tie Adv",1
"Amaterasu",1,0,148772,CLS,"zzzCLS zHan zzChewbacca zzC-3PO zChewpio",1
"Amaterasu",,,120505,Grievous Omicron,"zzGG zB2 zB1 MagnaGuard zDroideka",1
"Amaterasu",,,494759,Negotiator,"Negotiator BTL-B Y-wing, Anakin's Eta-2, Rex's ARC-170, Umbaran SF, Ahsoka's SF, Plo's SF, Clone Sergeant's ARC-170",1
"Amaterasu",,,308503,Malevolence,"Malevolence Hyena Bomber, Vulture Droid, Sun Fac SF, Soldier SF, Spy SF",1
"Amaterasu",,,137607,JKL,"zzJKL zzzJKR zHYoda Old Ben, Aayla",1
"Amaterasu",,,396520,HansMF,"Home One, Han's MF, Rebel Y-wing, Bistan's U-wing, Phantom Biggs X-wing, Cassian's U-wing, Wedge X-wing",1
"Amaterasu",1,0,142036,Traya,"zzTraya zDN zSion zzEP zThrawn",1
"Amaterasu",,,119836,Disintegration,"Aurra zGreef zBoba zzBossk zThe Mandalorian",1
"Amaterasu",1,0,147267,ShaakClones,"zzShaak Ti, zRex zEcho (501st), zzFives zARC Trooper",1
"Amaterasu",1,1,82575,Ewoks,"zChirpa Elder Paploo Teebo G9, Scout",1
"Amaterasu",1,1,82196,Carth,"zCarth Onasi, zMission zZaalbar Juhani G8, Canderous",1
"Amaterasu",1,0,114106,Troopers,"zVeers zStarck zGideon zDark Trooper, Range Trooper",1
"Amaterasu",0,1,64655,Phoenix,"Hera G8, Kanan G8, Sabine G9, Zeb G8, Ezra G8",1
"Amaterasu",1,1,73294,Rogue1,"zJyn G8, Chirrut G8, Baze G8, K-2SO G9, zCassian G8",1
"Amaterasu",1,0,25875,NestSolo (Counter),"zNest",1
"Amaterasu",,,45774,Phasma,"Phasma G8, FOTP G1, FOSFTP G1, FOST 5* G8, Kylo G8",0
"Amaterasu",0,1,99391,Geonosians Omicron,"zzGBA Sun Fac, Geo Soldier, Geo Spy, Poggle",0
"Amaterasu",1,1,99021,JTR,"JTR Scav Rey G9, BB-8 G9, zR2-D2 Finn G9",0
"Amaterasu",1,1,71664,NS,"MT G8, zAV Daka G9, Zombie G8, Spirit G8",0
"Amaterasu",,,108986,Mon Mothma,"zzMon Mothma, zKyle Katarn, Biggs Wedge Lando",0
"Amaterasu",,,72791,Iden Troopers,"zIden Versio, Shoretrooper Snowtrooper G8, Magma G9, DT G8",0
"Amaterasu",0,1,136485,BH,"zJango zIG-88 Cad zZam Dengar",0
"Amaterasu",,,119642,Bad Batch,"zHunter zEcho zOmega G8, zTech zWrecker",0
"GeneralSkywalker",1,1,93025,Revan Offense,"zzzJKR GMY BS zJolee Ezra",1
"GeneralSkywalker",1,1,93480,Carth,"Carth Onasi, zMission zZaalbar zJuhani zCanderous",1
"GeneralSkywalker",1,1,101883,zEP,"zEP zVader Tarkin Sith Trooper, zBSF",1
"GeneralSkywalker",0,1,108666,FO,"zzKRU zKylo FOST zHux FOE",1
"GeneralSkywalker",0,1,89086,Geonosians Omicron,"zGBA Sun Fac, Geo Soldier, Geo Spy, Poggle",0
"GeneralSkywalker",1,1,40160,NS_Alt,"MT 5* G8, AV G8, Talia 5* G8, Daka G9, Spirit 5* G8",0
"GeneralSkywalker",0,1,68898,BH,"Bossk IG-88 G9, Boba Cad G8, Jango G9",0
"GeneralSkywalker",1,0,50416,501st,"Rex G8, Clone Sergeant G8, Echo (501st) G8, Fives G8, Ahsoka G8",0
"GeneralSkywalker",1,0,43096,Troopers,"Veers 6* G8, Starck G7, DT 5* G8, Stormtrooper G8, Snowtrooper G8",0
"GeneralSkywalker",0,1,59754,Phoenix,"Hera G9, Chopper zKanan G8, Sabine 5* G8, Zeb G8",0
"GeneralSkywalker",1,1,39983,Rogue1,"Jyn 5* G8, Chirrut 5* G8, Baze 5* G8, K-2SO G8, Cassian G8",0
"GeneralBraxer'sio",,,122666,Phasma,"zPhasma zFOTP FOSFTP zFOST zKylo",1
"GeneralBraxer'sio",1,1,92965,Revan,"zzJKR BS zGMY zJolee GK G8",1
"GeneralBraxer'sio",0,1,70579,Phoenix,"Hera Chopper Kanan G8, Zeb G9, zEzra",1
"GeneralBraxer'sio",1,0,54775,CLS,"CLS Han G9, Chewbacca 5* G8, R2-D2 G7, Chewpio 4* G7",0
"GeneralBraxer'sio",0,1,90355,Geonosians Omicron,"zGBA Sun Fac, Geo Soldier, Geo Spy, Poggle",0
"GeneralBraxer'sio",,,60725,Nute-OR,"Nute G6, Dooku Jango G9, Zaalbar G9, Mission G7",0
"GeneralBraxer'sio",1,1,107674,zEP,"EP zzzVader Tarkin G8, TFP Sith Trooper",0
"GeneralBraxer'sio",0,1,67804,BH,"Bossk 5* Boba Cad G8, Dengar G9, The Mandalorian 4* G8",0
"GeneralBraxer'sio",1,0,76733,Troopers,"zVeers 5* Starck Dark Trooper G9, Range Trooper 5*, zPiett 4*",0
"BenSwoloOnDBOL",,,119801,Phasma,"zPhasma zFOTP FOSFTP FOST zKylo",1
"BenSwoloOnDBOL",1,1,141186,SL Kylo,"zzzzzzSL Kylo, Sith Trooper, zHux zzKRU Thrawn G8",1
"BenSwoloOnDBOL",1,0,125114,CLS,"zzzCLS zHan zChewbacca C-3PO Chewpio",1
"BenSwoloOnDBOL",,,295685,HansMF,"Home One, Han's MF 5*, HT Ghost Phantom Biggs X-wing, Cassian's U-wing, Wedge X-wing",1
"BenSwoloOnDBOL",0,1,70781,Phoenix,"Hera Chopper G8, Kanan G8, Zeb G8, Ezra",1
"BenSwoloOnDBOL",0,1,87830,BS,"zBS GMY zJolee Old Ben G9, Ahsoka",1
"BenSwoloOnDBOL",0,1,91478,Geonosians Omicron,"zGBA Sun Fac, Geo Soldier, Geo Spy, Poggle",0
"BenSwoloOnDBOL",1,1,52524,NS,"MT G8, AV 6* G8, Daka 6* G9, Zombie 6* G8, Spirit 6* G9",0
"BenSwoloOnDBOL",1,1,77253,Ewoks,"Chirpa Elder Paploo Wicket Logray",0
"BenSwoloOnDBOL",1,0,69694,ShaakClones,"Shaak Ti 5* G8, Rex Echo (501st), Fives Clone Sergeant G9",0
"BenSwoloOnDBOL",1,1,95665,zEP,"zEP zzVader Tarkin zTraya Mara Jade, The Emperor's Hand 4* G9",0
"BenSwoloOnDBOL",0,1,78712,BH,"Bossk Boba Jango G9, The Mandalorian, Greef",0
"BenSwoloOnDBOL",1,0,62234,Troopers,"Veers 6* Starck G7, zIden Versio 2* G8, Stormtrooper G8, Snowtrooper",0
"BenSwoloOnDBOL",,,61731,Bad Batch,"zHunter 6* zEcho 5* Omega 4* G8, Tech 5* zWrecker 6* G9",0
"BenSwoloOnDBOL",1,0,46141,Wiggs,"Wedge 6* G8, Biggs G8, Leia G8, Chirrut 5* G8, Baze 6* G8",0
"Mitsuki",,,123419,Phasma,"zPhasma zFOTP FOSFTP zFOST zKylo",1
"Mitsuki",1,1,154743,SL Kylo,"zzzzzzSL Kylo, zSith Trooper, zHux zzKRU zThrawn",1
"Mitsuki",1,0,141492,CLS,"zzzCLS zHan zzChewbacca zzC-3PO zChewpio",1
"Mitsuki",0,1,103209,padme,"zzPadme zGK zJKA zAhsoka zBarriss",1
"Mitsuki",,,337065,HansMF,"Home One, Han's MF, HT Ghost Phantom Biggs X-wing, Cassian's U-wing, Wedge X-wing",1
"Mitsuki",1,1,86141,Ewoks,"zChirpa Elder Paploo Wicket zLogray",1
"Mitsuki",0,1,99883,BH,"zBossk Boba Cad Jango Greef",1
"Mitsuki",1,1,112067,zEP,"zzEP zzzVader Tarkin TFP G8, zzMara Jade, The Emperor's Hand",1
"Mitsuki",0,1,66325,Phoenix,"Hera G8, Chopper G8, Kanan G8, Zeb G8, Ezra G9",1
"Mitsuki",1,0,25615,NestSolo (Counter),"zNest",1
"Mitsuki",1,0,17949,SionSolo (Counter),"Sion",1
"Mitsuki",0,1,95794,Geonosians Omicron,"zzGBA Sun Fac, Geo Soldier, Geo Spy, Poggle",0
"Mitsuki",0,1,41358,Grievous,"GG G1, B2 G1, MagnaGuard G2, Dooku G6, IG-88 G1",0
"Mitsuki",,,62607,Mon Mothma,"Mon Mothma 5* G8, Pao G8, Biggs G8, Cara Dune, Hoth Rebel Scout G6",0
"Mitsuki",1,0,55459,ShaakClones,"Shaak Ti 4* G8, Rex G5, Echo (501st) G5, Fives ARC Trooper G5",0
"Megaroutte",0,1,96735,padme,"zPadme GK G8, JKA zAhsoka zC-3PO",1
"Megaroutte",1,1,79196,Ewoks,"zChirpa G9, Elder Paploo Wicket Logray",1
"Megaroutte",0,1,128727,BH,"zBossk IG-88 Boba Cad Dengar",1
"Megaroutte",0,1,65270,Phoenix,"Hera G9, Chopper G9, Kanan G9, Zeb G8, Ezra G9",1
"Megaroutte",,,73050,Phasma,"Phasma G8, FOTP G8, FOO zKRU Kylo G9",0
"Megaroutte",1,0,95720,CLS,"zzzCLS zHan zChewbacca R2-D2 zChewpio",0
"Megaroutte",0,1,93932,Geonosians Omicron,"zzGBA Sun Fac, Geo Soldier, Geo Spy, Poggle",0
"Megaroutte",,,296937,HansMF,"Home One 6*, Han's MF, HT Ghost Phantom Biggs X-wing, Cassian's U-wing, Wedge X-wing",0
"Megaroutte",1,0,68628,Traya,"Traya 6* G8, DN 5* G9, Sion 6* G8, zEP Thrawn",0
"Megaroutte",,,58093,Nute-OR,"Nute G8, Dooku G8, Jango Zaalbar G8, Mission G8",0
"Megaroutte",1,1,46763,NS_Alt,"MT 6* G8, AV G9, Talia 6* G8, Merrin 3* G8, Daka",0
"Megaroutte",1,1,83880,Revan Offense,"zJKR GMY BS zJolee HYoda 5*",0
"Megaroutte",1,0,56713,ShaakClones,"Shaak Ti G9, Rex G8, Echo (501st) G8, Fives G9, Clone Sergeant G8",0
"Megaroutte",1,0,98817,Troopers,"zVeers Starck Range Trooper G9, zzPiett Snowtrooper",0
"Megaroutte",1,0,48201,Wiggs,"Wedge G8, Biggs G8, Leia G8, Chirrut 5* G8, Baze 5* G8",0
"Blackwing",,,112903,Phasma,"zPhasma zFOTP FOSFTP zFOST zKylo",1
"Blackwing",0,1,92652,padme,"zzPadme G9, GK zJKA Ahsoka C-3PO",1
"Blackwing",,,97291,Disintegration,"zAurra zGreef Boba zBossk The Mandalorian",1
"Blackwing",1,1,88161,Ewoks,"zChirpa Elder Paploo Wicket Logray",1
"Blackwing",1,1,113147,zEP,"zzEP zzzVader Tarkin TFP zSith Trooper",1
"Blackwing",0,1,81023,Phoenix,"zHera Chopper Kanan Zeb Ezra",1
"Blackwing",1,0,15385,SionSolo (Counter),"Sion G9",1
"Blackwing",,,80607,Grievous Omicron,"GG B2 B1 6* MagnaGuard Droideka",0
"Blackwing",1,0,97411,CLS,"zzzCLS zHan zChewbacca R2-D2 G9, Chewpio",0
"Blackwing",0,1,90881,Geonosians Omicron,"zGBA Sun Fac, Geo Soldier, Geo Spy, Poggle",0
"Blackwing",,,299172,HansMF,"Home One, Han's MF 6*, HT 6* Bistan's U-wing 6*, Phantom Ghost Cassian's U-wing, Biggs X-wing",0
"Visigoth83",1,0,123486,CLS,"zzzCLS zHan zzChewbacca zC-3PO Chewpio",1
"Visigoth83",0,1,85069,padme,"zzPadme GK JKA Ahsoka zBarriss G8",1
"Visigoth83",,,358837,HansMF,"Home One, Han's MF 6*, Biggs X-wing, Bistan's U-wing, Phantom Ghost Cassian's U-wing, Wedge X-wing",1
"Visigoth83",1,0,90942,Troopers,"zVeers zPiett Gideon zDark Trooper, Range Trooper",1
"Visigoth83",1,1,102802,Revan Offense,"zzzJKR GMY zBS zJolee Ezra",1
"Visigoth83",1,1,90375,Ewoks,"zChirpa Elder Paploo Wicket zLogray",1
"Visigoth83",0,1,110406,BH,"zzBossk zBoba Dengar Embo The Mandalorian",1
"Visigoth83",0,1,79070,Phoenix,"Hera Chopper Kanan Sabine G8, zZeb",1
"Visigoth83",1,1,83809,Rogue1,"zJyn Chirrut G9, Baze K-2SO G9, Cassian",1
"Visigoth83",1,0,78498,EP (Counter, Rebel),"EP Shoretrooper G8, DT G8, zzWampa Starck",1
"Visigoth83",1,0,10255,SionSolo (Counter),"Sion G8",1
"Visigoth83",,,73407,Phasma,"Phasma FOTP FOSFTP FOST 5* G8, Kylo",0
"Visigoth83",0,1,99064,Geonosians Omicron,"zzGBA Sun Fac, Geo Soldier, Geo Spy, Poggle",0
"Visigoth83",0,1,98096,DR,"zzzDR G9, zHK-47 zBSF Sith Empire Trooper, Sith Assassin G8",0
"Visigoth83",0,1,65532,Grievous,"GG G8, B2 G8, MagnaGuard G9, IG-88 G9, T3-M4",0
"Visigoth83",,,75335,Nute-OR,"Nute Dooku G8, Jango Zaalbar G9, Mission G9",0
"Visigoth83",1,1,59617,NS,"MT G8, AV G8, Daka G9, Zombie G8, Spirit G8",0
"Visigoth83",1,0,66710,ShaakClones,"Shaak Ti G9, Rex G8, Echo (501st) G8, Fives G8, Clone Sergeant G8",0
"MINI SgtGingerbeard",,,123599,Phasma,"zPhasma zFOTP FOSFTP zFOST zKylo",1
"MINI SgtGingerbeard",1,1,163670,SL Kylo,"zzzzzzSL Kylo, zSith Trooper, zHux zzKRU Thrawn",1
"MINI SgtGingerbeard",,,154617,SEE,"zzzzzzSEE zBSF zzMalak zzzDR zzVader",1
"MINI SgtGingerbeard",,,553754,Executor,"Executor HT RC Xanadu Blood, Slave I, IG-2000 Imperial TIE Fighter, Tie Adv",1
"MINI SgtGingerbeard",1,0,138016,CLS,"zzzCLS zHan zChewbacca C-3PO zChewpio",1
"MINI SgtGingerbeard",1,0,105557,Traya,"zzTraya DN Sion zzEP Sith Empire Trooper",1
"MINI SgtGingerbeard",1,1,100808,Revan,"zzzJKR BS GMY zJolee GK",1
"MINI SgtGingerbeard",1,1,84841,Ewoks,"zChirpa Elder Paploo Wicket Logray",1
"MINI SgtGingerbeard",0,1,132320,BH,"zzBossk IG-88 Boba Cad Dengar",1
"MINI SgtGingerbeard",0,1,66916,Phoenix,"Hera G8, Chopper G8, Kanan G8, Zeb G8, Ezra",1
"MINI SgtGingerbeard",1,0,14884,NestSolo (Counter),"Nest G9",1
"MINI SgtGingerbeard",1,1,84551,NS,"zMT AV Daka Zombie Spirit",0
"MINI SgtGingerbeard",,,59760,Grievous Omicron,"GG G8, B2 G8, B1 G9, MagnaGuard G7, Droideka G8",0
"MINI SgtGingerbeard",0,1,101934,Geonosians Omicron,"zzGBA Sun Fac, Geo Soldier, Geo Spy, Poggle",0
"MINI SgtGingerbeard",,,281523,HansMF,"Home One, Han's MF, Rebel Y-wing, Bistan's U-wing, Phantom Ghost Cassian's U-wing, Biggs X-wing",0
"MINI SgtGingerbeard",1,0,105500,Troopers,"zVeers zzPiett Gideon G9, Dark Trooper G9, Range Trooper",0
"MINI SgtGingerbeard",1,1,86646,Carth,"zCarth Onasi, zMission zZaalbar Juhani G7, Canderous",0
"MINI SgtGingerbeard",1,0,55324,ShaakClones,"Shaak Ti G7, Rex G7, Echo (501st) G7, Fives G4, ARC Trooper G5",0
"MINI SgtGingerbeard",0,1,50300,BH,"Jango G3, Zam G4, Greedo G8, The Mandalorian G8, Greef G8",0
"TheMeanDean",,,123030,Phasma,"zPhasma zFOTP FOSFTP zFOST zKylo",1
"TheMeanDean",1,1,128127,SL Kylo,"zzzzzSL Kylo, zSith Trooper, zHux zzKRU Thrawn G8",1
"TheMeanDean",0,1,94859,padme,"zzPadme zGK JKA zAhsoka C-3PO G9",1
"TheMeanDean",1,1,88557,Ewoks,"zChirpa Elder Paploo zWicket Logray",1
"TheMeanDean",0,1,93087,BH,"zzBossk Boba Jango The Mandalorian, zGreef",1
"TheMeanDean",1,1,97077,zEP,"zEP zzVader Tarkin G8, TFP G8, zzTraya",1
"TheMeanDean",0,1,70743,Phoenix,"Hera G9, Chopper G9, Kanan G9, Zeb G9, Ezra G9",1
"TheMeanDean",1,0,18133,SionSolo (Counter),"Sion",1
"TheMeanDean",,,63489,Admiral Raddus,"zAdmiral Raddus 3* G9, Cassian G8, Jyn G8, K-2SO G8, Chirrut G8",0
"TheMeanDean",1,0,87849,CLS,"zCLS zHan zChewbacca G9, R2-D2 G7, zChewpio",0
"TheMeanDean",0,1,96143,Geonosians Omicron,"zzGBA Sun Fac, Geo Soldier, Geo Spy, Poggle",0
"TheMeanDean",,,262659,HansMF,"Home One 6*, Han's MF 5*, Biggs X-wing, Bistan's U-wing 5*, Phantom Ghost Cassian's U-wing, Wedge X-wing",0
"TheMeanDean",1,1,70784,NS,"MT G8, AV G9, Daka G9, Zombie Spirit G9",0
"TheMeanDean",0,1,50618,Grievous,"GG G3, B2 G5, Dooku 6* G8, IG-88 G8, T3-M4 G8",0
"TheMeanDean",1,0,63678,Troopers,"zVeers Piett 5* G8, Gideon 5* G7, Dark Trooper G9, Range Trooper 6*",0
"TheMeanDean",,,47017,Mon Mothma,"Mon Mothma 5* G8, Biggs G8, Wedge G8, Cara Dune 5* G8, Scarif G7",0
"TheMeanDean",1,0,59212,ShaakClones,"Shaak Ti 4* G7, Rex G8, Echo (501st) G8, Fives G8, ARC Trooper G7",0
"TheMeanDean",,,61748,Iden Troopers,"zIden Versio 4*, Stormtrooper G8, Snowtrooper G8, Magma G7, DT G8",0
"TheMeanDean",0,1,80060,BS,"BS GMY Jolee Old Ben G9, HYoda G8",0
"Yabba",,,120034,Phasma,"zPhasma zFOTP FOSFTP FOST zKylo",1
"Yabba",0,1,92049,BH,"zBossk IG-88 Boba Cad Jango",1
"Yabba",1,1,118629,zEP,"zEP zzVader Tarkin zSith Trooper, Sion G8",1
"Yabba",0,1,63994,Phoenix,"Hera G8, Chopper G8, Kanan G8, Zeb G8, Ezra G9",1
"Yabba",0,1,89978,Geonosians Omicron,"zGBA Sun Fac, Geo Soldier, Geo Spy, Poggle",0
"Yabba",,,271090,HansMF,"Home One 6*, Han's MF 5*, HT Ghost Phantom 6* Biggs X-wing, Cassian's U-wing, Wedge X-wing 5*",0
"Yabba",1,0,69814,Troopers,"zVeers zPiett 5* Gideon G9, Dark Trooper 4* G9, Range Trooper 4* G8",0
"Yabba",1,1,53930,NS_Alt,"MT 6* G8, AV 5* G8, Talia G8, Daka G9, Spirit G8",0
"Yabba",1,0,62844,501st,"Rex G8, Clone Sergeant G8, Echo (501st) G8, Fives G8, Ahsoka",0
"Yabba",1,0,60964,Wiggs,"Wedge 5* G8, Biggs Han G8, Chewbacca G9, Leia G8",0
"Yabba",1,1,41548,Rogue1,"Jyn 5* G8, Chirrut 5* G8, Baze 5* G8, K-2SO 5* G8, Cassian 5* G8",0
"Peu Trid",0,1,117853,padme,"zzPadme zGK zJKA zAhsoka C-3PO",1
"Peu Trid",0,1,97043,Geonosians Omicron,"zzGBA Sun Fac, Geo Soldier, Geo Spy, Poggle",1
"Peu Trid",1,1,94648,Ewoks,"zChirpa Elder zPaploo zWicket zLogray",1
"Peu Trid",0,1,119165,BH,"zzBossk zBoba zzJango zThe Mandalorian, zzGreef",1
"Peu Trid",1,1,112442,zEP,"zzEP zzVader Tarkin TFP G9, zzMara Jade, The Emperor's Hand",1
"Peu Trid",1,0,100713,CLS,"zzzCLS zHan Wedge Biggs zChewbacca",1
"Peu Trid",0,1,77487,Phoenix,"Hera Chopper Kanan Zeb Ezra",1
"Peu Trid",0,1,85814,FO,"zKRU zKylo FOSFTP G9, zFOTP FOO",1
"Peu Trid",1,0,77120,Troopers,"zVeers 5* zStarck Gideon G9, Stormtrooper G9, zzPiett 5*",0
"Peu Trid",,,79263,Bad Batch,"zHunter Echo Omega G9, Tech Wrecker",0
"Xander",1,0,140927,CLS,"zzzCLS zHan zzChewbacca C-3PO zChewpio",1
"Xander",0,1,93543,padme,"zzPadme GK JKA zAhsoka zBarriss G8",1
"Xander",0,1,101561,DRMalak,"zzzDR HK-47 zBSF zzMalak Sith Empire Trooper G8",1
"Xander",,,389475,HansMF,"Home One, Han's MF, Rebel Y-wing 6*, Ghost Phantom Biggs X-wing, Cassian's U-wing, Wedge X-wing",1
"Xander",1,1,99389,JTR,"zJTR Scav Rey, BB-8 G9, R2-D2 Finn G9",1
"Xander",1,1,123623,Revan Offense,"zzzJKR zGMY zBS zJolee zzHYoda",1
"Xander",1,1,86138,Ewoks,"zChirpa Elder Paploo zWicket Logray",1
"Xander",1,1,96345,Carth,"zCarth Onasi, zMission zZaalbar zJuhani Canderous",1
"Xander",0,1,91180,BH,"zzBossk IG-88 G9, Boba Jango Dengar G8",1
"Xander",1,1,111955,zEP,"zzEP zzzVader Tarkin G9, TFP G9, zzMara Jade, The Emperor's Hand",1
"Xander",0,1,70501,Phoenix,"Hera Kanan G9, Sabine G8, Zeb G9, zEzra",1
"Xander",1,0,66311,Jawas,"Nebit Jawa Engineer, Jawa Scavenger, Jawa Dathcha",1
"Xander",1,0,19911,NestSolo (Counter),"zNest",1
"Xander",,,59563,Phasma,"Phasma G8, FOE G8, FOO G8, KRU G8, Kylo G8",0
"Xander",0,1,92441,Geonosians Omicron,"zzGBA Sun Fac, Geo Soldier, Geo Spy, Poggle",0
"Xander",,,321034,Negotiator,"Negotiator 5* HT Anakin's Eta-2 6*, Umbaran SF, Ahsoka's SF, Clone Sergeant's ARC-170, Jedi Consular's Starfighter, Plo's SF",0
"Xander",1,0,48001,Troopers,"Veers G8, Piett 5* G8, Gideon 4* G6, Dark Trooper 5* G9, Range Trooper 5* G7",0
"Xander",,,117593,Mon Mothma,"zzMon Mothma, zKyle Katarn, Biggs Wedge Lando",0
"Xander",1,1,52874,NS_Alt,"MT G8, AV G8, Talia G8, Daka G8, Spirit G8",0
"Xander",1,0,75564,ShaakClones,"zzShaak Ti, Rex G8, Echo (501st) G8, Fives G8, Clone Sergeant G9",0
"Xander",1,1,56741,Rogue1,"Jyn G8, Chirrut G8, Baze 6* G8, K-2SO G8, Cassian G8",0
"Xander",,,33303,Bad Batch,"Hunter 5* G8, Echo 3* G8, Omega 4* G8, Tech 3* G8, Wrecker 3* G8",0
"Barraza",0,1,88813,padme,"zzPadme G8, GK JKA Ahsoka C-3PO",1
"Barraza",0,1,89871,Geonosians Omicron,"zGBA Sun Fac, Geo Soldier, Geo Spy, Poggle",1
"Barraza",1,1,100028,Revan Offense,"zzzJKR GMY BS zJolee Ezra",1
"Barraza",1,1,82773,Ewoks,"zChirpa Elder Paploo Wicket Logray G9",1
"Barraza",1,1,84630,Carth,"Carth Onasi, Mission Zaalbar Juhani G9, Canderous",1
"Barraza",0,1,98412,BH,"zBossk Boba Cad Jango The Mandalorian",1
"Barraza",1,1,112613,zEP,"zzEP zzVader Tarkin G9, Sith Trooper, zBSF",1
"Barraza",0,1,117896,FO,"zzKRU zKylo FOO zHux FOE",1
"Barraza",1,0,85440,CLS,"zCLS zHan zChewbacca R2-D2 G8, Chewpio 6* G8",0
"Barraza",,,257499,HansMF,"Home One, Han's MF, Rebel Y-wing 5*, Bistan's U-wing 5*, Phantom Ghost Cassian's U-wing, Wedge X-wing",0
"Barraza",1,1,74455,NS_Alt,"MT 6* AV Talia Daka Zombie 6*",0
"Barraza",1,0,6712,SionSolo (Counter),"Sion G6",0
"SleepyKiIIer666",,,122301,Phasma,"zPhasma zFOTP FOSFTP zFOST zKylo",1
"SleepyKiIIer666",1,1,141439,SL Kylo,"zzzzzzSL Kylo, zSith Trooper, zHux zzKRU Thrawn G8",1
"SleepyKiIIer666",1,0,109812,Traya,"zzTraya DN zSion zEP zNest",1
"SleepyKiIIer666",1,0,91433,Troopers,"zVeers zPiett Gideon zDark Trooper, Range Trooper",1
"SleepyKiIIer666",1,1,104580,Revan,"zzzJKR BS zGMY zJolee GK G8",1
"SleepyKiIIer666",0,1,106488,BH,"zzBossk Boba Jango zZam Greef",1
"SleepyKiIIer666",0,1,65040,Phoenix,"Hera G8, Chopper G8, Kanan G8, Zeb G8, Ezra",1
"SleepyKiIIer666",1,0,107054,CLS,"zzzCLS zHan zChewbacca R2-D2 G8, Chewpio",0
"SleepyKiIIer666",,,58428,Grievous Omicron,"zGG B2 6* G8, B1 4* G9, MagnaGuard G8, Droideka G7",0
"SleepyKiIIer666",0,1,89160,Geonosians Omicron,"zGBA Sun Fac, Geo Soldier, Geo Spy, Poggle",0
"SleepyKiIIer666",1,1,74154,Ewoks,"Chirpa Elder Paploo Wicket 5* Logray 5*",0
"SleepyKiIIer666",,,64431,Bad Batch,"zHunter 5* zEcho 5* Omega 4* G8, Tech 5* zWrecker 4* G8",0
"Poppa Nugget",1,0,126888,CLS,"zzCLS zHan zzChewbacca R2-D2 C-3PO",1
"Poppa Nugget",1,1,99136,Revan Offense,"zzzJKR GMY BS zJolee JKA",1
"Poppa Nugget",0,1,65946,FO,"zKRU zKylo G9, Phasma G8, FOO G8, FOE G9",1
"Poppa Nugget",0,1,88540,Geonosians Omicron,"zGBA Sun Fac, Geo Soldier, Geo Spy, Poggle",0
"Poppa Nugget",,,318433,HansMF,"Home One 6*, Han's MF 5*, Rebel Y-wing 6*, Ghost Phantom Biggs X-wing, Cassian's U-wing, Wedge X-wing",0
"Poppa Nugget",,,82224,Mon Mothma,"Mon Mothma 6* G8, Biggs Wedge Cara Dune, Lando",0
"Poppa Nugget",,,50682,Nute-OR,"Nute G8, Dooku 6* G8, Jango Zaalbar G7, Mission G7",0
"Poppa Nugget",1,1,36296,NS_Alt,"MT 5* G8, AV G8, Talia 5* G8, Daka 5* G8, Spirit 5* G8",0
"Poppa Nugget",1,1,74786,zEP,"EP zzVader Tarkin G8, TFP G8, DN 5* G8",0
"Poppa Nugget",0,1,81337,BH,"zBossk 6* Boba Dengar G8, The Mandalorian, Greef",0
"Poppa Nugget",1,0,51680,501st,"Rex G8, Clone Sergeant G8, Echo (501st) G8, Fives G8, Ahsoka G8",0
"Poppa Nugget",0,1,43430,Phoenix,"Hera 5* G8, Chopper G8, Kanan G8, Zeb G8, Ezra 6* G8",0
"Poppa Nugget",1,1,36848,Rogue1,"Jyn 5* G8, Chirrut 5* G8, Baze 5* G8, K-2SO 5* G8, Cassian G8",0
"Poppa Nugget",1,0,46968,Jawas,"Nebit G9, Jawa Engineer, Jawa Scavenger, Jawa 4* G9, Dathcha G9",0
"Hoshiyomi Gaming",0,1,105676,BH,"zBossk Boba Dengar The Mandalorian, zGreef",1
"Hoshiyomi Gaming",0,1,67202,Phoenix,"Hera G9, Chopper G8, Kanan G8, Zeb G8, Ezra G9",1
"Hoshiyomi Gaming",1,0,82528,CLS,"zCLS zHan Chewbacca R2-D2 G9, Chewpio 3* G8",0
"Hoshiyomi Gaming",0,1,90275,Geonosians Omicron,"zGBA Sun Fac, Geo Soldier, Geo Spy, Poggle",0
"Hoshiyomi Gaming",1,0,71869,Troopers,"zVeers 6* G9, zPiett Gideon G9, Dark Trooper G9, Range Trooper 5* G9",0
"Hoshiyomi Gaming",1,1,88231,zEP,"zEP zzzVader Tarkin G8, TFP Mara Jade, The Emperor's Hand 4* G9",0
"Hoshiyomi Gaming",0,1,70674,BS,"BS 4* G8, zGMY G9, JKA GK 5* G9, Ahsoka",0
"Galeforce",0,1,121344,padme,"zzPadme zGK zJKA zAhsoka zBarriss",1
"Galeforce",1,0,124682,ShaakClones,"zzShaak Ti, zRex zEcho (501st), zzFives zARC Trooper",1
"Galeforce",0,1,59604,Phoenix,"Hera G9, Chopper G8, Kanan G8, Zeb G8, Ezra",1
"Galeforce",,,42166,Phasma,"Phasma 5* G8, FOE 5* G8, FOO 5* G8, KRU 5* G8, zKylo G9",0
"Galeforce",0,1,90422,Geonosians Omicron,"zGBA Sun Fac, Geo Soldier, Geo Spy, Poggle",0
"Galeforce",1,0,86530,Traya,"zzTraya DN 5* Sion 5* zEP Thrawn",0
"Galeforce",0,1,61215,Grievous,"GG 6* B2 G8, MagnaGuard G7, IG-88 G9, T3-M4",0
"Galeforce",1,0,64028,Troopers,"zVeers 5* zPiett 5* Gideon 4* G9, Dark Trooper 5* G9, Range Trooper 3*",0
"Galeforce",1,1,41458,NS_Alt,"MT 5* G8, AV Talia 5* G8, Daka G8, Spirit 5* G8",0
"Galeforce",0,1,72355,BH,"Bossk 5* zBoba Cad G8, Jango G9, Greedo 5* G8",0
"Galeforce",1,1,51419,Rogue1,"Jyn 6* G8, Chirrut G8, Baze 5* G8, K-2SO G8, Cassian G8",0
"Mol Ace",0,1,93039,BH,"zBossk IG-88 zBoba Cad Greef",1
"Mol Ace",1,1,111861,zEP,"zEP zzVader Tarkin TFP G8, DN",1
"Mol Ace",1,0,109620,Troopers,"zVeers Starck Gideon zDark Trooper, zzPiett",1
"Mol Ace",1,0,105781,Wiggs,"Wedge Biggs zCLS zHan zChewbacca",1
"Mol Ace",0,1,65780,Phoenix,"Hera G9, Chopper G8, Kanan G8, Zeb G8, Ezra",1
"Mol Ace",,,49790,Phasma,"Phasma G8, FOE 5* G9, FOO G8, KRU G8, Kylo 5* G8",0
"Mol Ace",0,1,92399,Geonosians Omicron,"zzGBA Sun Fac, Geo Soldier, Geo Spy, Poggle",0
"Mol Ace",,,336827,HansMF,"Home One, Han's MF, Rebel Y-wing, Bistan's U-wing 4*, Phantom Biggs X-wing, Cassian's U-wing, Wedge X-wing",0
"Mol Ace",,,72381,Mon Mothma,"Mon Mothma G8, Kyle Katarn G9, Cassian Lando Jyn G8",0
"Mol Ace",1,1,46697,NS_Alt,"MT 6* G8, AV G8, Talia 6* G9, Daka G9, Spirit 6* G8",0
"Mol Ace",1,1,62903,Ewoks,"Chirpa G9, Elder Paploo 6* G9, Wicket 4* Logray G9",0
"Mol Ace",1,0,62087,501st,"Rex G8, Clone Sergeant G8, Echo (501st) 5* G8, Fives G8, zAhsoka",0
"Mol Ace",1,0,70729,Thragma (Counter),"Thrawn Magma G6, DT 6* Krennic 6* Stormtrooper G8",0
"Mol Ace",1,0,99750,zMaul,"Darth Maul, zDooku Sidious Savage Sith Marauder",0
"Mol Ace",0,1,86601,BS,"BS 5* G8, GMY Old Ben, GK G7, JKA",0
"nate",1,1,81531,zEP,"zEP Vader Tarkin G9, TFP G8, Sith Trooper",1
"nate",0,1,121523,FO,"zzKRU zKylo zFOST zHux FOE",1
"nate",0,1,93122,BS,"zBS zzGMY Ahsoka GK G8, Ezra G8",1
"nate",0,1,100842,Geonosians Omicron,"zzGBA Sun Fac, Geo Soldier, Geo Spy, Poggle",0
"nate",1,1,72694,JTR,"JTR Scav Rey G8, BB-8 G9, R2-D2 Finn G9",0
"nate",1,1,37841,NS_Alt,"MT 5* G8, AV 6* G8, Talia 6* G8, Daka 5* G8, Spirit 5* G8",0
"nate",0,1,77730,BH,"Bossk IG-88 G8, Boba Cad G9, Greedo G9",0
"nate",1,0,70540,Wiggs,"Wedge 5* G8, Biggs G8, zzzCLS Han Leia G8",0
"nate",1,0,53058,Clones,"Cody 5* G8, Rex G8, Echo (501st) G8, Fives G8, Clone Sergeant 6* G8",0
"nate",0,1,53681,Phoenix,"Hera 6* G9, Chopper G9, Kanan G8, Sabine 5* G8, Zeb G8",0
"nate",1,1,35142,Rogue1,"Jyn 5* G8, Chirrut 5* G8, Baze 5* G8, K-2SO 5* G8, Cassian 5* G8",0
"Obi Shinobi",0,1,109857,DRMalak,"zzzDR HK-47 zBSF zzMalak Sith Empire Trooper",1
"Obi Shinobi",1,1,102120,Revan,"zzzJKR BS GMY zJolee GK G8",1
"Obi Shinobi",0,1,119880,BH,"zzBossk IG-88 Boba Cad Dengar",1
"Obi Shinobi",0,1,60611,Phoenix,"Hera G8, Chopper G8, Kanan G8, Zeb G8, Ezra G8",1
"Obi Shinobi",,,32609,Phasma,"Phasma 5* G8, FOE 5* G8, FOO 5* G8, KRU 5* G8, Kylo 5* G8",0
"Obi Shinobi",1,0,71463,CLS,"CLS Han Chewbacca G9, R2-D2 G9, Chewpio 6* G8",0
"Obi Shinobi",0,1,90159,Geonosians Omicron,"zGBA Sun Fac, Geo Soldier, Geo Spy, Poggle",0
"Obi Shinobi",,,279580,HansMF,"Home One, Han's MF, HT Ghost Phantom Biggs X-wing 5*, Cassian's U-wing, Wedge X-wing 5*",0
"Obi Shinobi",,,66890,Nute-OR,"Nute G7, Dooku 6* G8, Jango Zaalbar Mission",0
"Obi Shinobi",1,1,36650,NS_Alt,"MT 5* G8, AV 5* G8, Talia 5* G8, Daka G8, Spirit 5* G8",0
"Obi Shinobi",1,1,65868,Ewoks,"zChirpa G9, Elder Paploo G9, Wicket 5* G9, Logray G9",0
"Obi Shinobi",1,0,37462,ShaakClones,"Shaak Ti G7, Rex 5* G8, Echo (501st) 5* G8, Fives G8, Clone Sergeant 5* G8",0
"Obi Shinobi",1,1,98540,zEP,"EP zzVader Tarkin TFP Mara Jade, The Emperor's Hand 4* G9",0
"Obi Shinobi",1,0,84518,Troopers,"zVeers Starck G9, zIden Versio 4*, Dark Trooper G9, zPiett",0
"Obi Shinobi",1,0,41213,Wiggs,"Wedge 5* G8, Biggs G8, Leia G8, Chirrut 5* G8, Baze 5* G8",0
"JadenRaven",,,94530,Phasma,"zPhasma G9, FOE FOO zzKRU zKylo",1
"JadenRaven",1,0,135222,CLS,"zzzCLS zHan zzChewbacca zzC-3PO zChewpio",1
"JadenRaven",0,1,111793,DRMalak,"zzzDR zHK-47 zBSF zzMalak Sith Empire Trooper",1
"JadenRaven",1,1,96856,NS_Alt,"zzMT Acolyte zDaka zAV Zombie",1
"JadenRaven",1,1,120861,JTR,"zzJTR Scav Rey, zzBB-8 zzR2-D2 zFinn",1
"JadenRaven",1,0,94804,Troopers,"zVeers zzPiett Gideon zDark Trooper, Range Trooper",1
"JadenRaven",,,99504,Mon Mothma,"zzMon Mothma, Baze Biggs Wedge Hoth Rebel Scout",1
"JadenRaven",1,1,102473,Revan,"zzzJKR zBS zGMY zJolee GK G8",1
"JadenRaven",1,1,81499,Ewoks,"zChirpa Elder Paploo G9, zWicket Logray G9",1
"JadenRaven",0,1,102127,BH,"zzBossk Boba Dengar Greedo zzGreef",1
"JadenRaven",1,1,92206,Carth,"zCarth Onasi, zMission zZaalbar Juhani Canderous",1
"JadenRaven",1,1,96617,zEP,"zEP zzzVader Tarkin TFP DN G8",1
"JadenRaven",0,1,71672,Phoenix,"Hera G9, Chopper Kanan G8, Zeb G8, Ezra",1
"JadenRaven",1,0,19800,NestSolo (Counter),"zNest",1
"JadenRaven",0,1,96330,Geonosians Omicron,"zzGBA Sun Fac, Geo Soldier, Geo Spy, Poggle",0
"JadenRaven",,,335697,HansMF,"Home One, Han's MF, Rebel Y-wing, Bistan's U-wing 5*, Phantom Biggs X-wing, Cassian's U-wing, Wedge X-wing",0
"JadenRaven",1,0,60233,Jawas,"Nebit G7, Jawa Engineer G7, Jawa Scavenger G7, Jawa G7, Dathcha G7",0
"JadenRaven",1,0,13086,SionSolo (Counter),"Sion G7",0
"Orca",,,125246,Phasma,"zPhasma zFOTP FOSFTP zFOST zKylo",1
