Player,Offense,Defense,GP,Name,Squad,Viable
"Orca",1,1,153942,SL Kylo,"zzzzzzSL Kylo, zSith Trooper, zHux zzKRU Thrawn",1
"Orca",,,525197,Executor,"Executor 5* HT RC Xanadu Blood, Slave I, IG-2000 Imperial TIE Fighter, Tie Adv",1
"Orca",0,1,129286,padme,"zzPadme zGK zJKA zAhsoka C-3PO",1
"Orca",,,132504,Grievous Omicron,"zzGG zB2 zB1 MagnaGuard zDroideka",1
"Orca",,,292982,Malevolence,"Malevolence 5* Hyena Bomber, Vulture Droid, Sun Fac SF, Soldier SF, Spy SF",1
"Orca",1,0,113358,Traya,"zzTraya DN Sion zBSF zzEP",1
"Orca",1,1,147820,GAS,"zzzzGAS zRex zEcho (501st), zzFives zARC Trooper",1
"Orca",0,1,127716,BH,"zzBossk IG-88 Boba Cad Dengar",1
"Orca",0,1,68553,Phoenix,"Hera G8, Chopper G8, Kanan G8, Zeb G8, Ezra",1
"Orca",,,53972,Admiral Raddus,"Admiral Raddus 3* G8, Cassian G8, Jyn 6* G8, K-2SO G8, Chirrut 5* G8",0
"Orca",1,0,84908,CLS,"CLS zHan zChewbacca R2-D2 G8, Chewpio",0
"Orca",0,1,93667,Geonosians Omicron,"zGBA Sun Fac, Geo Soldier, Geo Spy, Poggle",0
"Orca",,,270323,HansMF,"Home One, Han's MF, Rebel Y-wing 6*, Ghost Phantom Biggs X-wing, Cassian's U-wing, Wedge X-wing",0
"Orca",1,0,100218,Troopers,"zVeers zzPiett Gideon Dark Trooper, Range Trooper G9",0
"Orca",1,1,77856,Revan Offense,"JKR GMY BS Jolee HYoda 5* G8",0
"Orca",1,1,56481,NS_Alt,"MT G8, AV Talia G8, Daka G8, Spirit G8",0
"Orca",1,1,77752,Ewoks,"Chirpa Elder Paploo Wicket Logray",0
"Orca",1,1,64469,Carth,"Carth Onasi G9, Mission G8, Zaalbar G7, Juhani G7, Canderous",0
"Orca",,,73868,Iden Troopers,"zIden Versio G9, Stormtrooper Snowtrooper G9, Magma G8, DT",0
"Orca",0,1,83594,BH,"Jango zZam Greedo G8, The Mandalorian, Greef",0
"Pickle rick",,,116242,Phasma,"zPhasma zFOTP FOSFTP zFOST zKylo",1
"Pickle rick",0,1,93248,padme,"zzPadme GK JKA Ahsoka zC-3PO",1
"Pickle rick",0,1,100180,DRMalak,"zzDR HK-47 BSF zzMalak Sith Empire Trooper",1
"Pickle rick",1,0,103727,CLS,"zzzCLS zHan zzChewbacca R2-D2 zChewpio",1
"Pickle rick",,,100461,Disintegration,"zAurra zGreef Boba zBossk The Mandalorian",1
"Pickle rick",1,1,103305,Revan Offense,"zzzJKR zGMY BS zJolee Ezra G9",1
"Pickle rick",1,1,82336,Ewoks,"zChirpa Elder Paploo Wicket Logray",1
"Pickle rick",1,1,90566,Carth,"Carth Onasi, zMission Zaalbar Juhani Canderous",1
"Pickle rick",1,0,99027,Troopers,"zVeers zStarck zDark Trooper, Range Trooper, zzPiett",1
"Pickle rick",0,1,90599,Geonosians Omicron,"zGBA Sun Fac, Geo Soldier, Geo Spy, Poggle",0
"Pickle rick",1,0,59268,Clones,"Cody G7, Rex Echo (501st) 6* G6, Fives Clone Sergeant G7",0
"Pickle rick",0,1,60743,Phoenix,"Hera G9, Chopper G9, Kanan G9, Sabine 6* G5, Zeb G9",0
"Pickle rick",1,1,89194,zEP,"zEP zzVader Tarkin G7, Dooku G8, zTraya",0
"Shayna Vetacious",0,1,107050,padme,"zzPadme GK zJKA Ahsoka C-3PO",1
"Shayna Vetacious",1,0,102657,CLS,"zzzCLS zHan Chewbacca R2-D2 Chewpio",1
"Shayna Vetacious",,,275790,Malevolence,"Malevolence 6* Hyena Bomber, Vulture Droid, Sun Fac SF, Soldier SF, Spy SF",1
"Shayna Vetacious",0,1,101961,Geonosians Omicron,"zzGBA Sun Fac, Geo Soldier, Geo Spy, Poggle",1
"Shayna Vetacious",,,346666,HansMF,"Home One, Han's MF, Rebel Y-wing, Bistan's U-wing, Phantom Ghost Cassian's U-wing, Wedge X-wing",1
"Shayna Vetacious",1,0,114543,Troopers,"zVeers zPiett zGideon zDark Trooper, Range Trooper",1
"Shayna Vetacious",1,1,104540,Revan Offense,"zzJKR zGMY BS zJolee HYoda",1
"Shayna Vetacious",1,1,88530,Ewoks,"zChirpa Elder Paploo Wicket Logray",1
"Shayna Vetacious",1,0,95925,ShaakClones,"zzShaak Ti, Rex Echo (501st), zFives ARC Trooper",1
"Shayna Vetacious",0,1,93163,BH,"zBossk Boba Jango Dengar G9, Greef",1
"Shayna Vetacious",1,1,127846,zEP,"zzEP zzzVader Tarkin Krennic Traya",1
"Shayna Vetacious",0,1,73721,Phoenix,"Hera Kanan G9, Sabine G9, Zeb G9, Ezra G9",1
"Shayna Vetacious",1,0,127293,zMaul,"zDarth Maul, Dooku zSidious zSavage Sith Marauder",1
"Shayna Vetacious",1,1,82341,Carth,"Carth Onasi, Mission Zaalbar Juhani 4* Canderous",0
"Shayna Vetacious",1,0,9166,SionSolo (Counter),"Sion 2* G8",0
"Jak Frey",0,1,116598,DRMalak,"zzDR HK-47 zBSF zzMalak Sith Empire Trooper",1
"Jak Frey",0,1,82749,Grievous,"zGG B2 zB1 MagnaGuard Dooku",1
"Jak Frey",1,1,94316,Revan,"zzzJKR BS GMY zJolee GK G8",1
"Jak Frey",1,1,86393,Ewoks,"zChirpa Elder Paploo Wicket Logray",1
"Jak Frey",1,1,84242,Carth,"Carth Onasi, Mission zZaalbar Juhani G8, Canderous",1
"Jak Frey",0,1,67680,Phoenix,"Hera G8, Chopper G9, Kanan G8, Zeb G8, Ezra",1
"Jak Frey",1,0,101612,CLS,"zCLS zHan Chewbacca C-3PO Chewpio",0
"Jak Frey",0,1,96766,Geonosians Omicron,"zzGBA Sun Fac, Geo Soldier, Geo Spy, Poggle",0
"Jak Frey",0,1,88293,BH,"Bossk Boba Jango The Mandalorian, Greef",0
"Jak Frey",1,0,67889,Troopers,"Veers Starck G7, Gideon G9, Range Trooper G9, Piett",0
"theLeskiss",,,125832,Phasma,"zPhasma zFOTP FOSFTP zFOST zKylo",1
"theLeskiss",1,1,145161,SL Kylo,"zzzzzzSL Kylo, zSith Trooper, zHux zzKRU zzThrawn",1
"theLeskiss",1,0,125858,CLS,"zzzCLS zHan zzChewbacca zC-3PO zChewpio",1
"theLeskiss",,,100306,Disintegration,"Aurra Greef Boba zzBossk zThe Mandalorian",1
"theLeskiss",1,1,89164,Ewoks,"zChirpa Elder zPaploo zWicket zLogray",1
"theLeskiss",1,0,82459,ShaakClones,"zShaak Ti G9, Rex Echo (501st), Fives ARC Trooper G8",1
"theLeskiss",1,1,80791,Carth,"zCarth Onasi, Mission Zaalbar Juhani Canderous",1
"theLeskiss",1,1,109127,zEP,"zzEP zzzVader Tarkin TFP G9, BSF",1
"theLeskiss",0,1,65602,Phoenix,"Hera G9, Chopper Kanan Zeb G8, Ezra",1
"theLeskiss",0,1,91340,padme,"zzPadme zGK zJKA Ahsoka Barriss G8",0
"theLeskiss",0,1,93767,Geonosians Omicron,"zzGBA Sun Fac, Geo Soldier, Geo Spy, Poggle",0
"theLeskiss",1,0,60085,Traya,"Traya G8, DN G7, Sion G7, Dooku Sith Empire Trooper 5* G8",0
"theLeskiss",1,0,72731,Troopers,"Veers Piett G9, Gideon Dark Trooper G9, Range Trooper 6*",0
"DumbNugget",1,0,105162,CLS,"zzCLS zHan Chewbacca C-3PO Chewpio",1
"DumbNugget",1,1,98091,Revan,"zzJKR BS GMY zJolee GK",1
"DumbNugget",1,1,84029,Ewoks,"zChirpa Elder Paploo Wicket Logray",1
"DumbNugget",0,1,86706,BH,"zzBossk Boba Cad G9, Jango Zam G8",1
"DumbNugget",0,1,64848,Phoenix,"Hera G8, Chopper G8, Kanan G8, Zeb G8, Ezra",1
"DumbNugget",,,53877,Phasma,"Phasma G8, FOTP G8, FOSFTP G5, FOST 5* G8, Kylo G8",0
"DumbNugget",0,1,89062,Geonosians Omicron,"zGBA Sun Fac, Geo Soldier, Geo Spy, Poggle",0
"DumbNugget",,,254710,HansMF,"Home One, Han's MF 6*, Rebel Y-wing 5*, Ghost Phantom Biggs X-wing, Cassian's U-wing, Wedge X-wing",0
"DumbNugget",1,1,49097,NS,"MT 6* G8, AV G8, Daka 6* G8, Zombie 5* G8, Spirit 6* G8",0
"DumbNugget",1,1,78068,Carth,"Carth Onasi, Mission Zaalbar Juhani 6* Canderous 5*",0
"DumbNugget",1,0,47023,ShaakClones,"Shaak Ti G9, Rex G8, Echo (501st) 5* G8, Fives G8, Clone Sergeant 5* G8",0
"DumbNugget",1,1,97645,zEP,"EP zzzVader Tarkin TFP G8, BSF 6*",0
"DumbNugget",1,0,51047,Thragma (Counter),"Thrawn Magma G2, DT 6* G8, Stormtrooper G8, Shoretrooper 5* G8",0
"DumbNugget",1,0,45526,Wiggs,"Wedge G8, Biggs G8, Leia G9, Chirrut 5* G8, Baze 5* G8",0
"Coop",1,0,143639,CLS,"zzzCLS zHan zzChewbacca zC-3PO zChewpio",1
"Coop",0,1,96261,Geonosians Omicron,"zzGBA Sun Fac, Geo Soldier, Geo Spy, Poggle",1
"Coop",,,356699,Negotiator,"Negotiator 5* HT Anakin's Eta-2, Umbaran SF, Ahsoka's SF, Clone Sergeant's ARC-170, Plo's SF, Rex's ARC-170",1
"Coop",,,386663,HansMF,"Home One, Han's MF, Rebel Y-wing 6*, Ghost Phantom Biggs X-wing, Cassian's U-wing, Wedge X-wing",1
"Coop",,,102622,Mon Mothma,"Mon Mothma, Biggs Wedge Cara Dune, Lando",1
"Coop",1,1,109888,GAS,"zzzzGAS Rex Echo (501st), Fives zAhsoka",1
"Coop",1,1,110986,Revan,"zzzJKR BS GMY zJolee zGK",1
"Coop",1,1,87239,Ewoks,"zChirpa G9, Elder Paploo zWicket zLogray",1
"Coop",1,1,97027,Carth,"zCarth Onasi, zMission zZaalbar zJuhani zCanderous",1
"Coop",0,1,93091,BH,"zBossk Boba Jango The Mandalorian, Greef",1
"Coop",0,1,73602,Phoenix,"Hera G9, Chopper Kanan G9, Zeb G9, Ezra",1
"Coop",,,61944,Phasma,"Phasma G9, FOTP FOSFTP G9, FOST 4* G9, Kylo",0
"Coop",,,113148,Grievous Omicron,"GG zB2 zB1 zMagnaGuard zDroideka",0
"Coop",0,1,101251,DRMalak,"zzzDR zzHK-47 zBSF Malak G9, Thrawn G9",0
"Coop",1,1,101518,JTR,"JTR Scav Rey G9, BB-8 G8, zzR2-D2 Finn",0
"Coop",,,285134,Executrix,"Executrix Tie Adv, Emperor's Shuttle 6*, TIE Reaper 4*, Imperial TIE Fighter, Gauntlet Starfighter 6*, FOSF TIE Fighter, FO TIE Fighter",0
"Coop",1,0,65626,Traya,"Traya DN G7, Sion G1, Dooku G9, EP",0
"Coop",1,0,60846,Troopers,"Veers Starck G8, DT G7, Piett 6* G8, Snowtrooper G8",0
"Coop",1,0,47825,Jawas,"Nebit G7, Jawa Engineer G5, Jawa Scavenger G4, Jawa 6* G5, Dathcha G6",0
"Coop",1,0,9030,NestSolo (Counter),"Nest G7",0
"Szerahk",0,1,115840,DRMalak,"zzzDR HK-47 zBSF zzMalak Sith Empire Trooper",1
"Szerahk",1,0,132377,CLS,"zzzCLS zHan zzChewbacca zzC-3PO zChewpio",1
"Szerahk",,,336923,HansMF,"Home One, Han's MF, HT Ghost Phantom Biggs X-wing, Cassian's U-wing, Wedge X-wing",1
"Szerahk",1,1,120750,Revan,"zzzJKR zBS zGMY zJolee GK",1
"Szerahk",1,1,73018,Ewoks,"zChirpa G8, Elder Paploo G8, Wicket Logray",1
"Szerahk",0,1,98709,BH,"zBossk IG-88 Boba zzJango Dengar",1
"Szerahk",1,1,71235,Carth,"zCarth Onasi, Mission G8, zZaalbar Juhani G8, zCanderous",1
"Szerahk",0,1,73411,Phoenix,"Hera Chopper Kanan Zeb Ezra",1
"Szerahk",,,49715,Phasma,"Phasma G7, FOTP G5, FOO G8, KRU G8, Kylo G7",0
"Szerahk",0,1,99155,Geonosians Omicron,"zzGBA Sun Fac, Geo Soldier, Geo Spy, Poggle",0
"Szerahk",1,1,63691,JTR,"JTR G7, Scav Rey G8, BB-8 G8, R2-D2 Finn G9",0
"Szerahk",1,1,92151,zEP,"zzEP zzzVader Tarkin TFP G8, Sion 6* G7",0
