Player,Offense,Defense,GP,Name,Squad,Viable
"Coop",,,303694,Negotiator,"Negotiator 5* HT Anakin's Eta-2, Umbaran SF, Ahsoka's SF, BTL-B Y-wing 3*, Clone Sergeant's ARC-170, Plo's SF",0
"Coop",0,1,101053,DRMalak,"zzzDR zzHK-47 zBSF Malak G9, Thrawn G9",0
"Coop",0,1,104182,Grievous,"GG zB2 zB1 zMagnaGuard Nute G9",0
"Coop",1,1,89917,JTR,"JTR Scav Rey G9, BB-8 G8, R2-D2 Finn",0
"Coop",,,258766,Executrix,"Executrix Tie Adv, Emperor's Shuttle 6*, TIE Reaper 3*, Imperial TIE Fighter, Gauntlet Starfighter 5*, FOSF TIE Fighter 5*, FO TIE Fighter",0
"Coop",1,0,55621,Traya,"Traya G7, DN G5, Sion G1, Dooku G8, EP",0
"Coop",1,1,91177,GAS,"zzGAS G9, Rex Echo (501st) G9, Fives zAhsoka",0
"Coop",1,0,55162,Troopers,"Veers Starck G8, Snowtrooper G8, Piett 6* G5, Stormtrooper G8",0
"Coop",1,0,47825,Jawas,"Nebit G7, Jawa Engineer G5, Jawa Scavenger G4, Jawa 6* G5, Dathcha G6",0
"Coop",1,0,9030,NestSolo (Counter),"Nest G7",0
"Blackwing",,,112068,Phasma,"zPhasma zFOTP FOSFTP zFOST zKylo",1
"Blackwing",0,1,90813,padme,"zzPadme G9, GK zJKA Ahsoka C-3PO G8",1
"Blackwing",0,1,75232,Geonosians,"GBA Sun Fac G9, Geo Soldier, Geo Spy G9, Poggle",1
"Blackwing",1,1,88161,Ewoks,"zChirpa Elder Paploo Wicket Logray",1
"Blackwing",0,1,96631,BH,"zBossk The Mandalorian, Jango Boba zGreef",1
"Blackwing",1,1,110248,zEP,"zzEP zzzVader Tarkin zSith Trooper, Sion G9",1
"Blackwing",0,1,78346,Phoenix,"zHera Ezra Zeb Chopper Kanan",1
"Blackwing",1,0,90515,CLS,"zzzCLS Han Chewbacca R2-D2 G9, Chewpio",0
"Blackwing",,,255767,HansMF,"Home One, Han's MF 5*, HT 6* Bistan's U-wing 5*, Phantom Ghost Cassian's U-wing, Biggs X-wing",0
"Blackwing",0,1,86133,Grievous,"GG B2 G9, Droideka MagnaGuard zDooku",0
"Bills Mafia",1,0,95434,CLS,"zzCLS zHan Chewbacca R2-D2 Chewpio",1
"Bills Mafia",,,100516,Disintegration,"Aurra zzGreef Boba zzBossk The Mandalorian G9",1
"Bills Mafia",1,1,98865,Revan,"zzzJKR zBS GMY Jolee GK G9",1
"Bills Mafia",1,1,91721,Ewoks,"zChirpa Elder zPaploo zWicket zLogray",1
"Bills Mafia",1,1,93639,Carth,"zCarth Onasi, zMission zZaalbar Juhani Canderous",1
"Bills Mafia",,,39831,Phasma,"Phasma G8, FOTP G5, FOSFTP G1, FOST 5* G8, Kylo G8",0
"Bills Mafia",0,1,85473,Geonosians,"zzGBA Sun Fac G8, Geo Soldier, Geo Spy, Poggle",0
"Bills Mafia",,,253889,HansMF,"Home One, Han's MF 5*, HT Ghost Phantom 6* Biggs X-wing, Cassian's U-wing 6*, Wedge X-wing",0
"Bills Mafia",1,0,66932,Troopers,"Veers G9, Piett G9, Gideon Dark Trooper G9, Range Trooper G1",0
"Bills Mafia",1,1,44846,NS_Alt,"MT G8, AV G8, Daka G8, Talia 6* G8, Spirit 6* G8",0
"Bills Mafia",1,0,56110,ShaakClones,"Shaak Ti G8, Rex G8, Echo (501st) G8, Fives Clone Sergeant G8",0
"Bills Mafia",1,1,90573,zEP,"EP zzzVader Tarkin G8, zBSF DN G8",0
"Bills Mafia",1,0,44658,Wiggs,"Wedge 5* G8, Biggs 5* G8, Ezra 6* G8, C-3PO G8, Leia",0
"Bills Mafia",0,1,67460,BH,"Jango IG-88 G8, Zam G9, Cad G8, Greedo 6* G8",0
"Bills Mafia",0,1,43153,Phoenix,"Hera 5* G8, Zeb G8, Chopper G8, Sabine 5* G8, Kanan G8",0
"Bills Mafia",1,1,35993,Rogue1,"Jyn 6* G8, Chirrut 5* G8, Baze 6* G8, Cassian 5* G8, K-2SO 5* G8",0
"Visigoth83",0,1,91553,padme,"zzPadme G9, GK JKA Ahsoka zC-3PO",1
"Visigoth83",1,0,94201,CLS,"zzzCLS zHan Chewbacca R2-D2 G8, Chewpio",1
"Visigoth83",,,330607,HansMF,"Home One, Han's MF 5*, Biggs X-wing, Bistan's U-wing, Phantom Ghost Cassian's U-wing, Wedge X-wing",1
"Visigoth83",0,1,93128,Geonosians,"zzGBA Sun Fac, Geo Soldier, Geo Spy, Poggle",1
"Visigoth83",1,0,90942,Troopers,"zVeers zPiett Gideon zDark Trooper, Range Trooper",1
"Visigoth83",1,1,102802,Revan Offense,"zzzJKR GMY zBS zJolee Ezra",1
"Visigoth83",1,1,90375,Ewoks,"zChirpa Elder Paploo Wicket zLogray",1
"Visigoth83",0,1,111174,BH,"zzBossk The Mandalorian, Jango zBoba Dengar",1
"Visigoth83",0,1,76310,Phoenix,"Hera Zeb Chopper Sabine G8, Kanan",1
"Visigoth83",1,1,79957,Rogue1,"Jyn Chirrut G9, Baze Cassian K-2SO G9",1
"Visigoth83",1,0,75525,EP (Counter, Rebel),"EP DT G8, zWampa Stormtrooper G8, Starck",1
"Visigoth83",1,0,10255,SionSolo (Counter),"Sion G8",1
"Visigoth83",,,73407,Phasma,"Phasma FOTP FOSFTP FOST 5* G8, Kylo",0
"Visigoth83",0,1,96029,DR,"zzzDR G9, zHK-47 zBSF Sith Empire Trooper G8, Sith Assassin G8",0
"Visigoth83",1,1,55627,NS,"MT G8, AV G8, Daka G9, Zombie 6* G8, Spirit 6* G8",0
"Visigoth83",1,1,69650,Carth,"Carth Onasi, Mission G9, Zaalbar G9, Juhani G7, Canderous G8",0
"Visigoth83",1,0,65997,ShaakClones,"Shaak Ti G9, Rex G8, Echo (501st) G8, Fives G8, Clone Sergeant G8",0
"Galeforce",0,1,114248,padme,"zzPadme zGK zJKA zAhsoka zBarriss",1
"Galeforce",0,1,90099,Geonosians,"zGBA Sun Fac, Geo Soldier, Geo Spy, Poggle",1
"Galeforce",1,0,124454,ShaakClones,"zzShaak Ti, zRex zEcho (501st), zzFives zARC Trooper",1
"Galeforce",0,1,64199,Phoenix,"Hera G8, Ezra Zeb G8, Chopper G8, Kanan G8",1
"Galeforce",,,42166,Phasma,"Phasma 5* G8, FOE 5* G8, FOO 5* G8, KRU 5* G8, zKylo G9",0
"Galeforce",0,1,56911,Grievous,"GG 5* B2 G8, Dooku 5* G8, IG-88 G9, T3-M4",0
"Galeforce",1,0,82494,Traya,"zzTraya 6* DN 5* Sion 5* zEP Thrawn 6*",0
"Galeforce",1,1,39431,NS_Alt,"MT 5* G8, AV G8, Daka G8, Talia 5* G8, Spirit 5* G8",0
"Galeforce",0,1,71956,BH,"Bossk 5* Jango G9, zBoba Cad G8, Greedo 5* G8",0
"Galeforce",1,0,52357,Troopers,"Veers 5* Starck G8, Snowtrooper G8, Stormtrooper G8, Shoretrooper 5* G8",0
"Galeforce",1,1,51419,Rogue1,"Jyn 6* G8, Chirrut G8, Baze 5* G8, Cassian G8, K-2SO G8",0
"Barraza",0,1,86551,padme,"zzPadme G8, GK JKA Ahsoka C-3PO G9",1
"Barraza",0,1,88869,Geonosians,"zGBA Sun Fac, Geo Soldier, Geo Spy, Poggle",1
"Barraza",1,1,99912,Revan Offense,"zzzJKR GMY BS zJolee Ezra",1
"Barraza",1,1,82773,Ewoks,"zChirpa Elder Paploo Wicket Logray G9",1
"Barraza",1,1,84630,Carth,"Carth Onasi, Mission Zaalbar Juhani G9, Canderous",1
"Barraza",0,1,96814,BH,"zBossk The Mandalorian, Jango Boba Cad",1
"Barraza",0,1,97598,FO,"zzKRU Kylo zHux 6* FOE FOO",1
"Barraza",,,243901,HansMF,"Home One, Han's MF, Rebel Y-wing 5*, Bistan's U-wing 5*, Phantom Ghost Cassian's U-wing, Wedge X-wing",0
"Barraza",0,1,89258,DRMalak,"zzDR HK-47 zBSF Malak 6* G8, Thrawn G9",0
"Barraza",1,1,91387,zEP,"zzEP zzVader Tarkin G9, Dooku 6* G8, Sith Trooper 6* G8",0
"Barraza",1,0,82901,CLS,"zCLS zHan Leia G8, Old Ben G9, zChewbacca",0
"Barraza",1,0,6712,SionSolo (Counter),"Sion G6",0
"ΞL ΞS LΛ LΞGΞNDΛ",0,1,92232,BS,"zBS zGMY zJolee Old Ben G9, Ahsoka",1
"ΞL ΞS LΛ LΞGΞNDΛ",,,78202,Phasma,"zPhasma FOE FOO KRU Kylo G9",0
"ΞL ΞS LΛ LΞGΞNDΛ",0,1,56053,Geonosians,"GBA 5* G8, Sun Fac G7, Geo Soldier 4* G9, Geo Spy, Poggle",0
"ΞL ΞS LΛ LΞGΞNDΛ",1,1,36581,NS_Alt,"MT 5* G8, AV 6* G8, Daka 6* G8, Talia 6* G8, Spirit 5* G8",0
"ΞL ΞS LΛ LΞGΞNDΛ",1,1,73475,zEP,"EP Vader Tarkin G8, BSF 5* Mara Jade, The Emperor's Hand 5*",0
"ΞL ΞS LΛ LΞGΞNDΛ",0,1,53256,BH,"Bossk 4* G9, IG-88 6* G8, Jango 6* G9, Boba G8, Cad 6* G8",0
"ΞL ΞS LΛ LΞGΞNDΛ",1,0,65731,Clones,"Cody 6* G8, zRex Echo (501st), zFives G8, Clone Sergeant 6* G8",0
"ΞL ΞS LΛ LΞGΞNDΛ",1,0,50879,Wiggs,"Wedge 5* G8, Biggs G8, zHan G8, Ezra 5* G8, Leia G8",0
"ΞL ΞS LΛ LΞGΞNDΛ",0,1,50916,Phoenix,"Hera 5* G8, Zeb G8, Chopper G8, Sabine 5* G8, Kanan G8",0
"ΞL ΞS LΛ LΞGΞNDΛ",1,1,33713,Rogue1,"Jyn 5* G8, Chirrut 5* G8, Baze 5* G8, Cassian 5* G8, K-2SO 5* G8",0
