Player,Offense,Defense,GP,Name,Squad,Viable
"Forsaken",1,1,92242,Carth,"Carth Onasi, zMission zZaalbar Juhani Canderous",1
"Forsaken",1,1,96760,zEP,"zzEP zzVader Tarkin TFP G9, DN",1
"Forsaken",0,1,75994,Phoenix,"Hera G9, Ezra Zeb G9, Chopper Kanan G9",1
"Forsaken",1,0,12334,SionSolo (Counter),"Sion G8",1
"Forsaken",,,68566,Phasma,"Phasma G9, FOE FOO KRU G9, Kylo G8",0
"Forsaken",,,253556,HansMF,"Home One, Han's MF 5*, Rebel Y-wing 4*, Bistan's U-wing 5*, Phantom Ghost Cassian's U-wing, Wedge X-wing",0
"Forsaken",0,1,59220,Grievous,"GG 6* G7, B2 G8, MagnaGuard G8, IG-88 T3-M4 G9",0
"Forsaken",1,1,44762,NS_Alt,"MT G8, AV 6* Daka 6* G8, Talia 5* G8, Spirit 5* G8",0
"Forsaken",0,1,88680,BH,"Bossk The Mandalorian, Jango Boba Greedo",0
"Forsaken",1,0,66625,501st,"Rex Clone Sergeant, Echo (501st) G8, Fives G9, Ahsoka",0
"Forsaken",1,0,70196,Wiggs,"Wedge G9, Biggs 6* G8, zCLS Han Leia",0
"Forsaken",1,0,63804,Troopers,"Veers Starck G8, Snowtrooper Stormtrooper G9, Shoretrooper G9",0
"Forsaken",1,1,53620,Rogue1,"Jyn G8, Chirrut G8, Baze 6* G8, Cassian G8, K-2SO 6* G8",0
"Mitsuki",,,123419,Phasma,"zPhasma zFOTP FOSFTP zFOST zKylo",1
"Mitsuki",1,1,147276,SL Kylo,"zzzzzzSL Kylo, zSith Trooper, zHux zzKRU zThrawn",1
"Mitsuki",1,0,141492,CLS,"zzzCLS zHan zzChewbacca zzC-3PO zChewpio",1
"Mitsuki",0,1,95794,Geonosians,"zzGBA Sun Fac, Geo Soldier, Geo Spy, Poggle",1
"Mitsuki",1,1,86141,Ewoks,"zChirpa Elder Paploo Wicket zLogray",1
"Mitsuki",0,1,99289,BH,"zBossk Jango Boba Cad Greef",1
"Mitsuki",1,1,110617,zEP,"zzEP zzVader Tarkin Traya zzMara Jade, The Emperor's Hand 5*",1
"Mitsuki",0,1,66325,Phoenix,"Hera G8, Ezra G9, Zeb G8, Chopper G8, Kanan G8",1
"Mitsuki",0,1,97976,padme,"zzPadme zGK zJKA zAhsoka Fives",1
"Mitsuki",1,0,16407,SionSolo (Counter),"Sion",1
"Mitsuki",,,288800,Negotiator,"Negotiator 5* HT Anakin's Eta-2 3*, Umbaran SF, Ahsoka's SF, Clone Sergeant's ARC-170, Plo's SF, Rex's ARC-170",0
"Mitsuki",0,1,39363,Grievous,"GG G1, B2 G1, MagnaGuard G2, Dooku 6* G6, IG-88 G1",0
"Mitsuki",,,58205,Mon Mothma,"Mon Mothma 5* G8, Pao G8, Hoth Rebel Scout G5, Biggs G5, Cara Dune 6*",0
"Mitsuki",1,0,75404,Wampa (Counter),"Rex G4, zWampa HYoda Jyn G2, FOO",0
"Mitsuki",1,0,17608,NestSolo (Counter),"zNest 6*",0
"Xander",1,0,140927,CLS,"zzzCLS zHan zzChewbacca C-3PO zChewpio",1
"Xander",0,1,93543,padme,"zzPadme GK JKA zAhsoka zBarriss G8",1
"Xander",0,1,99686,DRMalak,"zzzDR HK-47 zBSF zzMalak Sith Empire Trooper G8",1
"Xander",,,389337,HansMF,"Home One, Han's MF, Rebel Y-wing 6*, Ghost Phantom Biggs X-wing, Cassian's U-wing, Wedge X-wing",1
"Xander",0,1,82567,Geonosians,"zGBA Sun Fac, Geo Soldier, Geo Spy, Poggle",1
"Xander",1,1,99389,JTR,"zJTR Scav Rey, BB-8 G9, R2-D2 Finn G9",1
"Xander",1,1,123311,Revan Offense,"zzzJKR zGMY zBS zJolee zzHYoda",1
"Xander",1,1,86138,Ewoks,"zChirpa Elder Paploo zWicket Logray",1
"Xander",0,1,91180,BH,"zzBossk IG-88 G9, Jango Boba Dengar G8",1
"Xander",1,1,88987,Carth,"zCarth Onasi, zMission zZaalbar Juhani G9, Canderous",1
"Xander",1,1,105801,zEP,"zzEP zzzVader Tarkin G9, TFP G9, zzMara Jade, The Emperor's Hand",1
"Xander",0,1,70348,Phoenix,"Hera zEzra Zeb G9, Sabine G8, Kanan G9",1
"Xander",1,0,66311,Jawas,"Nebit Jawa Engineer, Jawa Scavenger, Jawa Dathcha",1
"Xander",1,0,19911,NestSolo (Counter),"zNest",1
"Xander",,,59563,Phasma,"Phasma G8, FOE G8, FOO G8, KRU G8, Kylo G8",0
"Xander",,,321034,Negotiator,"Negotiator 5* HT Anakin's Eta-2 6*, Umbaran SF, Ahsoka's SF, Clone Sergeant's ARC-170, Jedi Consular's Starfighter, Plo's SF",0
"Xander",1,0,47766,Troopers,"Veers G8, Piett 4* G8, Gideon 4* G6, Dark Trooper 5* G9, Range Trooper 5* G7",0
"Xander",,,117593,Mon Mothma,"zzMon Mothma, zKyle Katarn, Biggs Wedge Lando",0
"Xander",1,1,52874,NS_Alt,"MT G8, AV G8, Daka G8, Talia G8, Spirit G8",0
"Xander",1,0,75564,ShaakClones,"zzShaak Ti, Rex G8, Echo (501st) G8, Fives G8, Clone Sergeant G9",0
"Xander",1,1,56741,Rogue1,"Jyn G8, Chirrut G8, Baze 6* G8, Cassian G8, K-2SO G8",0
"Xander",,,33303,Bad Batch,"Hunter 5* G8, Echo 3* G8, Omega 4* G8, Tech 3* G8, Wrecker 3* G8",0
"Mol Ace",0,1,91820,Geonosians,"zzGBA Sun Fac, Geo Soldier, Geo Spy, Poggle",1
"Mol Ace",0,1,92750,BH,"zBossk IG-88 zBoba Cad Greef",1
"Mol Ace",1,0,102057,Wiggs,"Wedge Biggs zCLS zHan Ezra",1
"Mol Ace",1,1,114073,zEP,"zEP zzVader Tarkin zDooku TFP G8",1
"Mol Ace",,,49154,Phasma,"Phasma G8, FOE 5* G9, FOO G8, KRU G8, Kylo 5* G8",0
"Mol Ace",,,336608,HansMF,"Home One, Han's MF, Rebel Y-wing 6*, Ghost Phantom Biggs X-wing, Cassian's U-wing, Wedge X-wing",0
"Mol Ace",,,69678,Mon Mothma,"Mon Mothma 6* G8, Kyle Katarn G8, Cassian Jyn G8, Lando",0
"Mol Ace",1,1,46758,NS_Alt,"MT 6* G8, AV G8, Daka G9, Talia 6* G9, Spirit 6* G8",0
"Mol Ace",1,0,61977,501st,"Rex G8, Clone Sergeant G8, Echo (501st) 5* G8, Fives G8, zAhsoka",0
"Mol Ace",1,0,70432,Troopers,"Veers Starck G9, Piett G8, Gideon G8, Stormtrooper G8",0
"Mol Ace",0,1,55070,Phoenix,"Hera G9, Zeb G8, Chopper G8, Sabine 5* G8, Kanan G8",0
"Mol Ace",0,1,77320,BS,"BS 5* G8, GMY Old Ben, GK 6* G6, JKA",0
"JadenRaven",,,94530,Phasma,"zPhasma G9, FOE FOO zzKRU zKylo",1
"JadenRaven",1,0,133173,CLS,"zzzCLS zHan zzChewbacca zzC-3PO zChewpio",1
"JadenRaven",0,1,107868,DRMalak,"zzzDR zHK-47 zBSF zzMalak 6* Sith Empire Trooper",1
"JadenRaven",0,1,96330,Geonosians,"zzGBA Sun Fac, Geo Soldier, Geo Spy, Poggle",1
"JadenRaven",1,1,96856,NS_Alt,"zzMT Acolyte zDaka zAV Zombie",1
"JadenRaven",1,1,109022,JTR,"zzJTR Scav Rey, zzBB-8 zzR2-D2 zFinn",1
"JadenRaven",1,0,91988,Troopers,"zVeers zzPiett Gideon zDark Trooper, Range Trooper",1
"JadenRaven",,,95919,Mon Mothma,"zzMon Mothma, Baze Hoth Rebel Scout, Biggs Chirrut",1
"JadenRaven",1,1,102473,Revan,"zzzJKR zBS zGMY zJolee GK G8",1
"JadenRaven",1,1,81499,Ewoks,"zChirpa Elder Paploo G9, zWicket Logray G9",1
"JadenRaven",1,1,92206,Carth,"zCarth Onasi, zMission zZaalbar Juhani Canderous",1
"JadenRaven",0,1,96919,BH,"zzBossk Boba Greedo Greef Dengar",1
"JadenRaven",1,1,96440,zEP,"zEP zzzVader Tarkin TFP DN G8",1
"JadenRaven",0,1,71920,Phoenix,"Hera G9, Ezra Zeb G8, Chopper Kanan G8",1
"JadenRaven",,,315082,HansMF,"Home One, Han's MF, Rebel Y-wing, Bistan's U-wing 4*, Phantom Biggs X-wing, Cassian's U-wing, Wedge X-wing",0
"JadenRaven",1,0,60233,Jawas,"Nebit G7, Jawa Engineer G7, Jawa Scavenger G7, Jawa G7, Dathcha G7",0
"JadenRaven",1,0,13086,SionSolo (Counter),"Sion G7",0
"JadenRaven",1,0,10884,NestSolo (Counter),"Nest G7",0
"Shayna Vetacious",1,0,102657,CLS,"zzzCLS zHan Chewbacca R2-D2 Chewpio",1
"Shayna Vetacious",,,271683,Malevolence,"Malevolence 5* Hyena Bomber, Vulture Droid, Sun Fac SF, Soldier SF, Spy SF",1
"Shayna Vetacious",0,1,101331,Geonosians,"zzGBA Sun Fac, Geo Soldier, Geo Spy, Poggle",1
"Shayna Vetacious",1,0,109703,Troopers,"zVeers zPiett zGideon Dark Trooper, Range Trooper",1
"Shayna Vetacious",1,1,103054,Revan,"zzJKR BS zGMY zJolee GK",1
"Shayna Vetacious",1,0,95715,ShaakClones,"zzShaak Ti, Rex Echo (501st), zFives ARC Trooper",1
"Shayna Vetacious",0,1,93163,BH,"zBossk Jango Boba Greef Dengar G9",1
"Shayna Vetacious",1,1,126347,zEP,"zzEP zzzVader Tarkin Krennic Traya G9",1
"Shayna Vetacious",0,1,73579,Phoenix,"Hera Ezra G9, Zeb G9, Sabine G9, Kanan G9",1
"Shayna Vetacious",1,0,123082,zMaul,"zDarth Maul, Dooku zSidious zSavage Sith Marauder",1
"Shayna Vetacious",,,318648,HansMF,"Home One, Han's MF 6*, Rebel Y-wing, Bistan's U-wing, Phantom Ghost Cassian's U-wing, Wedge X-wing",0
"Shayna Vetacious",1,1,80946,Ewoks,"Chirpa Elder Paploo Wicket 6* Logray",0
"Shayna Vetacious",1,1,55364,Carth,"Carth Onasi 2* G9, Mission G7, Zaalbar G7, Juhani 2* G7, Canderous G8",0
"Shayna Vetacious",1,0,7494,SionSolo (Counter),"Sion 2* G7",0
"Orca",,,125204,Phasma,"zPhasma zFOTP FOSFTP zFOST zKylo",1
"Orca",1,1,146459,SL Kylo,"zzzzzzSL Kylo, zSith Trooper, zHux zzKRU Thrawn",1
"Orca",0,1,129488,padme,"zzPadme zGK zJKA zAhsoka C-3PO",1
"Orca",,,293129,Malevolence,"Malevolence 5* Hyena Bomber, Vulture Droid, Sun Fac SF, Soldier SF, Spy SF",1
"Orca",0,1,93667,Geonosians,"zGBA Sun Fac, Geo Soldier, Geo Spy, Poggle",1
"Orca",0,1,119379,Grievous,"zzGG zB2 zB1 zDroideka MagnaGuard",1
"Orca",1,1,143504,GAS,"zzzzGAS zRex zEcho (501st), zzFives zARC Trooper",1
"Orca",0,1,128761,BH,"zzBossk IG-88 zZam Boba Dengar",1
"Orca",1,1,124138,zEP,"zzEP zzzVader Tarkin TFP zTraya",1
"Orca",0,1,68801,Phoenix,"Hera G8, Ezra Zeb G8, Chopper G8, Kanan G8",1
"Orca",1,0,14815,SionSolo (Counter),"Sion",1
"Orca",,,49429,Admiral Raddus,"Admiral Raddus 3* G8, Cassian G8, Jyn 5* G8, Baze 6* G8, Chirrut 5* G8",0
"Orca",,,496649,Executor,"Executor 4* HT RC Xanadu Blood, Slave I, IG-2000 Imperial TIE Fighter, Tie Adv",0
"Orca",1,0,85226,CLS,"CLS zHan zChewbacca R2-D2 G8, Chewpio",0
"Orca",,,263359,HansMF,"Home One, Han's MF, Rebel Y-wing 5*, Ghost Phantom Biggs X-wing, Cassian's U-wing, Wedge X-wing",0
"Orca",1,0,96632,Troopers,"zVeers zPiett Gideon G9, Dark Trooper, Range Trooper G9",0
"Orca",1,1,55027,NS_Alt,"MT G8, AV Daka 6* G8, Talia G8, Spirit G8",0
"Orca",1,1,79513,Ewoks,"Chirpa Elder Paploo Wicket Logray",0
"Orca",,,68935,Iden Troopers,"zIden Versio 6* G8, Stormtrooper G9, Snowtrooper G9, Magma G8, DT",0
"Orca",0,1,77561,BH,"Jango The Mandalorian, Fennec Shand 4* G8, Cad Greef",0
"MrTomChase24",,,122249,Phasma,"zPhasma zFOTP FOSFTP zFOST zKylo",1
"MrTomChase24",1,1,141256,SL Kylo,"zzzzzzSL Kylo, zSith Trooper, zHux zzKRU Thrawn",1
"MrTomChase24",1,0,105276,CLS,"zzzCLS zHan zChewbacca C-3PO Chewpio",1
"MrTomChase24",0,1,88507,Geonosians,"zGBA Sun Fac, Geo Soldier, Geo Spy, Poggle",1
"MrTomChase24",1,1,109089,Revan,"zzzJKR BS zGMY zJolee zGK",1
"MrTomChase24",1,1,87171,Ewoks,"zChirpa Elder Paploo Wicket Logray",1
"MrTomChase24",0,1,89539,BH,"zBossk The Mandalorian, Jango Boba Greef G9",1
"MrTomChase24",1,1,118064,zEP,"zEP zzVader Tarkin zBSF Sion G8",1
"MrTomChase24",0,1,62840,Phoenix,"Hera G8, Ezra Zeb G8, Chopper G8, Kanan G8",1
"MrTomChase24",,,207638,HansMF,"Home One 6*, Han's MF, Rebel Y-wing, Bistan's U-wing 4*, Phantom 5* Ghost Cassian's U-wing, Biggs X-wing",0
"MrTomChase24",1,0,77830,Troopers,"zVeers zPiett G8, Gideon G9, Dark Trooper, Range Trooper G9",0
"MrTomChase24",0,1,47645,Grievous,"GG G1, B2 G1, B1 G2, IG-88 G6, T3-M4",0
"MrTomChase24",1,0,65980,ShaakClones,"Shaak Ti G8, Rex G7, Echo (501st), Fives G9, ARC Trooper G8",0
"MrTomChase24",1,1,78510,Carth,"Carth Onasi, Mission G6, Zaalbar Juhani Canderous",0
"Desimo",,,95116,Phasma,"zPhasma FOE FOO zzKRU zKylo",1
"Desimo",0,1,91416,Geonosians,"zzGBA Sun Fac, Geo Soldier, Geo Spy, Poggle",1
"Desimo",1,1,102954,zEP,"zzEP zzzVader Tarkin Sith Trooper G9, zMara Jade, The Emperor's Hand",1
"Desimo",0,1,76571,Phoenix,"Hera Ezra Zeb G8, Chopper Kanan G8",1
"Desimo",1,1,76033,Revan,"zJKR BS GMY Jolee GK G7",0
"Desimo",1,0,52613,Wiggs,"Wedge G7, Biggs CLS G7, Han G5, Leia",0
"Desimo",0,1,50002,BH,"Jango 6* G7, The Mandalorian 6*, Boba G8, Cad G7, Dengar G7",0
"Chantelle Vetacious",,,178119,JMK,"zzzzzzJMK zAhsoka zzzCAT zzzzGAS zGK",1
"Chantelle Vetacious",,,123133,Phasma,"zPhasma zFOTP FOSFTP zFOST zKylo",1
"Chantelle Vetacious",1,1,159320,SL Kylo,"zzzzzzSL Kylo, zSith Trooper, zHux zzKRU zzThrawn",1
"Chantelle Vetacious",,,175568,SEE,"zzzzzzSEE zBSF zzMalak zzzDR zzzVader",1
"Chantelle Vetacious",0,1,88355,Qira,"Qira L3-37 zVandor Chewbacca, Mission Zaalbar",1
"Chantelle Vetacious",1,1,105433,NS,"zzMT zzAV zDaka Zombie Spirit",1
"Chantelle Vetacious",,,159446,JMLS,"zBS zzzzzzJMLS zWat Tambor, zzJKL zJolee",1
"Chantelle Vetacious",1,0,145862,CLS,"zzzCLS zHan zzChewbacca zzC-3PO zChewpio",1
"Chantelle Vetacious",,,512774,Negotiator,"Negotiator BTL-B Y-wing, Anakin's Eta-2, Rex's ARC-170, Umbaran SF, Ahsoka's SF, Plo's SF, Clone Sergeant's ARC-170",1
"Chantelle Vetacious",,,314782,Malevolence,"Malevolence Hyena Bomber, Vulture Droid, Sun Fac SF, Soldier SF, Spy SF",1
"Chantelle Vetacious",,,438258,HansMF,"Home One, Han's MF, Rebel Y-wing, Bistan's U-wing, Phantom Biggs X-wing, Cassian's U-wing, Wedge X-wing",1
"Chantelle Vetacious",1,1,131301,JTR,"zzzJTR zzR2-D2 zzBB-8 zRH Finn, zRH Poe",1
"Chantelle Vetacious",0,1,98693,Geonosians,"zzGBA Sun Fac, Geo Soldier, Geo Spy, Poggle",1
"Chantelle Vetacious",0,1,135299,Grievous,"zzGG zB2 zB1 zMagnaGuard zNute",1
"Chantelle Vetacious",1,0,134193,Traya,"zzTraya zzDN zSion zzEP Sith Empire Trooper",1
"Chantelle Vetacious",,,107088,Mon Mothma,"zzMon Mothma, zPao Hoth Rebel Scout, Wedge zCara Dune",1
"Chantelle Vetacious",,,488585,Executrix,"Executrix Tie Adv, Emperor's Shuttle, TIE Reaper, Imperial TIE Fighter, Gauntlet Starfighter, FOSF TIE Fighter, FO TIE Fighter",1
"Chantelle Vetacious",,,111254,Disintegration,"Aurra zzGreef G9, zBoba zzBossk zThe Mandalorian G8",1
"Chantelle Vetacious",1,1,89575,Ewoks,"zChirpa Elder Paploo Wicket Logray",1
"Chantelle Vetacious",1,0,144161,ShaakClones,"zzShaak Ti, zRex zEcho (501st), zzFives zARC Trooper",1
"Chantelle Vetacious",0,1,129735,BH,"zzJango zZam Cad zDengar zNest",1
"Chantelle Vetacious",1,0,122214,Troopers,"zVeers zStarck zzPiett zDark Trooper, zGideon",1
"Chantelle Vetacious",0,1,77633,Phoenix,"Hera Ezra Zeb Sabine G8, Kanan",1
"Chantelle Vetacious",1,1,97481,Rogue1,"zJyn Chirrut Baze zCassian zK-2SO",1
"Chantelle Vetacious",,,130945,Bad Batch,"zHunter zEcho zzOmega zTech zWrecker",1
"Chantelle Vetacious",1,0,129603,zMaul,"zDarth Maul, zDooku zSidious zSavage Sith Marauder",1
"Chantelle Vetacious",1,0,83294,Jawas,"Nebit Jawa Engineer, Jawa Scavenger, Jawa Dathcha",1
"Chantelle Vetacious",,,72240,Iden Troopers,"zIden Versio 5*, Stormtrooper G9, Snowtrooper G8, Magma G7, DT",0
"MINI Leskiss",1,0,103513,CLS,"zzzCLS zHan zzChewbacca R2-D2 Chewpio",1
"MINI Leskiss",0,1,93894,BH,"zzBossk The Mandalorian, zzJango Greef Aurra G9",1
"MINI Leskiss",0,1,65194,Geonosians,"GBA G9, Sun Fac G9, Geo Soldier G8, Geo Spy G8, Poggle",0
"MINI Leskiss",1,0,77463,Troopers,"Veers G9, Piett G9, zGideon Dark Trooper, Range Trooper G9",0
"MINI Leskiss",0,1,80412,BS,"BS GMY Jolee Old Ben G9, Ahsoka",0
"BenSwoloOnDBOL",,,120299,Phasma,"zPhasma zFOTP FOSFTP FOST zKylo",1
"BenSwoloOnDBOL",1,1,137478,SL Kylo,"zzzzzzSL Kylo, Sith Trooper, zHux zzKRU Thrawn G8",1
"BenSwoloOnDBOL",0,1,87964,Geonosians,"zGBA Sun Fac, Geo Soldier, Geo Spy, Poggle",1
"BenSwoloOnDBOL",0,1,70842,Phoenix,"Hera Ezra Zeb G8, Chopper G8, Kanan G8",1
"BenSwoloOnDBOL",0,1,88022,BS,"zBS GMY zJolee Old Ben G9, Ahsoka",1
"BenSwoloOnDBOL",,,200311,HansMF,"Home One 6*, Han's MF 5*, Biggs X-wing, Bistan's U-wing 5*, Phantom Ghost Cassian's U-wing 5*, Wedge X-wing",0
"BenSwoloOnDBOL",1,1,49141,NS,"MT G8, AV 6* G8, Daka 5* G9, Zombie 5* G8, Spirit 6* G9",0
"BenSwoloOnDBOL",1,0,66400,ShaakClones,"Shaak Ti 4* G8, Rex Echo (501st), Fives Clone Sergeant G9",0
"BenSwoloOnDBOL",1,1,88486,zEP,"zEP zzVader Tarkin Traya 6* G9, Mara Jade, The Emperor's Hand 4* G9",0
"BenSwoloOnDBOL",0,1,72100,BH,"Bossk 6* IG-88 G9, Jango G9, Boba Cad G8",0
"BenSwoloOnDBOL",1,0,65016,Wiggs,"Wedge 6* G8, Biggs G8, CLS Han Leia G8",0
"BenSwoloOnDBOL",1,0,61271,Troopers,"Veers 6* Starck G7, Snowtrooper Gideon 4* G9, zIden Versio 2* G8",0
"BenSwoloOnDBOL",,,64839,Bad Batch,"zHunter 6* zEcho 5* Omega 4* G8, Tech 5* zWrecker 6* G9",0
"BenSwoloOnDBOL",1,1,43814,Rogue1,"Jyn 6* G9, Chirrut 5* G8, Baze 6* G8, Cassian 5* K-2SO 6* G8",0
"Jotar0Kujoh",0,1,113299,DRMalak,"zzzDR zHK-47 zBSF zzMalak Sith Empire Trooper G8",1
"Jotar0Kujoh",0,1,107353,padme,"zzPadme zGK JKA zAhsoka zC-3PO",1
"Jotar0Kujoh",0,1,91798,Geonosians,"zGBA Sun Fac, Geo Soldier, Geo Spy, Poggle",1
"Jotar0Kujoh",1,1,108379,Revan Offense,"zzzJKR zGMY zBS zJolee Ezra",1
"Jotar0Kujoh",1,1,84694,Carth,"zCarth Onasi, zMission Zaalbar Juhani G9, Canderous",1
"Jotar0Kujoh",0,1,88097,BH,"zzBossk Jango Boba Greef G8, Dengar G9",1
"Jotar0Kujoh",0,1,80082,Grievous,"GG G9, B2 zB1 Droideka MagnaGuard G9",0
"Jotar0Kujoh",1,1,76173,Ewoks,"Chirpa Elder Paploo Wicket Logray",0
"Jotar0Kujoh",1,0,62828,ShaakClones,"zShaak Ti, Rex Echo (501st) 6* G7, Fives G9, Clone Sergeant G6",0
"Jotar0Kujoh",1,1,89858,zEP,"zzEP zzzVader Tarkin Dooku 6* G8, Mara Jade, The Emperor's Hand 4* G9",0
"Jotar0Kujoh",1,0,68752,CLS,"CLS G8, zHan G9, Leia G8, Old Ben G7, zChewbacca G9",0
"Jotar0Kujoh",0,1,60398,Phoenix,"Hera G8, Zeb G8, Chopper G9, Sabine 5* G7, Kanan G8",0
"Jotar0Kujoh",0,1,51096,FO,"KRU G8, Kylo G8, FOST 3* G7, Sith Trooper 4* G7, FOO G7",0
"Egghead",1,0,125657,CLS,"zzzCLS zHan zzChewbacca zC-3PO zChewpio",1
"Egghead",,,369123,HansMF,"Home One, Han's MF, Rebel Y-wing, Ghost Phantom Biggs X-wing, Cassian's U-wing, Wedge X-wing",1
"Egghead",0,1,93541,Geonosians,"zzGBA Sun Fac, Geo Soldier, Geo Spy, Poggle",1
"Egghead",1,1,109025,Revan,"zzzJKR zBS GMY zJolee zGK",1
"Egghead",1,1,84977,Ewoks,"zChirpa Elder Paploo Wicket Logray",1
"Egghead",0,1,105919,BH,"zzBossk zJango zBoba zGreef Dengar G8",1
"Egghead",1,1,76076,Carth,"Carth Onasi, Mission G9, Zaalbar G9, Juhani Canderous",1
"Egghead",1,1,94073,zEP,"zzEP zzzVader Tarkin G8, TFP G8, BSF",1
"Egghead",0,1,70580,Phoenix,"Hera Ezra G9, Zeb G8, Chopper G9, Kanan G8",1
"Egghead",1,0,20149,NestSolo (Counter),"zNest",1
"Egghead",1,0,15232,SionSolo (Counter),"Sion",1
"Egghead",,,55625,Phasma,"Phasma G8, FOE G8, FOO G8, KRU G8, Kylo G8",0
"Egghead",1,1,59640,NS,"MT G9, AV Daka G9, Zombie 5* Spirit G8",0
"Egghead",,,65405,Mon Mothma,"Mon Mothma 5* G8, Cassian Biggs Wedge G9, Chirrut G8",0
"Egghead",1,0,59648,501st,"Rex G8, Clone Sergeant G8, Echo (501st) G8, Fives G8, zAhsoka",0
"Egghead",1,0,64438,Troopers,"Veers G9, Starck G7, Snowtrooper G8, DT G8, zIden Versio 4*",0
"Zephyr",0,1,112394,padme,"zzPadme zGK JKA zAhsoka zC-3PO",1
"Zephyr",0,1,101165,DR,"zzzDR HK-47 zBSF Sith Marauder, Sith Empire Trooper",1
"Zephyr",0,1,103091,Geonosians,"zzGBA Sun Fac, Geo Soldier, Geo Spy, Poggle",1
"Zephyr",1,0,96189,Troopers,"zVeers zzPiett Gideon zDark Trooper, Range Trooper",1
"Zephyr",1,1,118569,Revan Offense,"zzzJKR zGMY BS zJolee Ezra",1
"Zephyr",1,1,83124,Ewoks,"zChirpa Elder Paploo Wicket Logray",1
"Zephyr",1,0,114802,ShaakClones,"zzShaak Ti, zRex zEcho (501st), zzFives zARC Trooper",1
"Zephyr",0,1,109430,BH,"zBossk Jango Boba Cad Dengar",1
"Zephyr",1,0,100514,CLS,"zzzCLS zHan Wedge Biggs zChewbacca",1
"Zephyr",1,0,18096,SionSolo (Counter),"zSion G9",1
"Zephyr",,,69755,Phasma,"Phasma G6, FOE Sith Trooper, KRU Kylo G9",0
"Zephyr",,,390456,Negotiator,"Negotiator 6* HT Anakin's Eta-2, Umbaran SF, Ahsoka's SF, BTL-B Y-wing 5*, Clone Sergeant's ARC-170 2*, Jedi Consular's Starfighter",0
"Zephyr",0,1,118024,Grievous,"GG zB2 zB1 zMagnaGuard zNute G9",0
"Zephyr",1,1,60418,Carth,"Carth Onasi G9, Mission G7, Zaalbar G8, Juhani G9, Canderous G9",0
"Zephyr",1,1,82041,zEP,"EP G7, Vader G8, Tarkin zzTraya zDN",0
"Zephyr",,,65606,Iden Troopers,"zIden Versio G8, Stormtrooper G9, Snowtrooper G6, Magma G8, DT G7",0
"GeneralSkywalker",0,1,76008,Geonosians,"zGBA G9, Sun Fac G9, Geo Soldier, Geo Spy, Poggle G9",1
"GeneralSkywalker",1,1,90301,Revan Offense,"zzzJKR GMY BS zJolee Ezra",1
"GeneralSkywalker",1,1,82573,Carth,"Carth Onasi, Mission Zaalbar zJuhani zCanderous",1
"GeneralSkywalker",0,1,93770,FO,"zKRU zKylo FOST zHux FOE",1
"GeneralSkywalker",0,1,85956,DR,"zzzDR HK-47 zBSF Sith Empire Trooper 4* G8, Thrawn G7",0
"GeneralSkywalker",1,1,40160,NS_Alt,"MT 5* G8, AV G8, Daka G9, Talia 5* G8, Spirit 5* G8",0
"GeneralSkywalker",1,1,82192,zEP,"zEP zVader Tarkin Sith Trooper 6*, Mara Jade, The Emperor's Hand 5* G8",0
"GeneralSkywalker",0,1,55833,BH,"Bossk 6* G8, IG-88 G9, Jango G7, Boba G9, Cad G8",0
"GeneralSkywalker",1,0,45286,501st,"Rex G8, Clone Sergeant 5* G8, Echo (501st) 6* G8, Fives G8, Ahsoka G8",0
"GeneralSkywalker",1,0,37966,Troopers,"Veers 5* G8, Starck G7, Snowtrooper 6* G8, DT 5* G8, Stormtrooper 6* G8",0
"GeneralSkywalker",0,1,59871,Phoenix,"Hera G9, Zeb G8, Chopper Sabine 5* G8, zKanan G8",0
"GeneralSkywalker",1,0,36296,Wiggs,"Wedge 5* G8, Biggs 5* G8, Leia G8, Chirrut 5* G8, Baze 5* G8",0
"Darkside Dad",,,551574,Executor,"Executor HT RC Xanadu Blood, Slave I, IG-2000 Imperial TIE Fighter, Tie Adv",1
"Darkside Dad",1,0,138169,CLS,"zzzCLS zHan zChewbacca zC-3PO zChewpio",1
"Darkside Dad",0,1,119572,DRMalak,"zzzDR HK-47 zBSF zzMalak Thrawn",1
"Darkside Dad",,,288505,Malevolence,"Malevolence Hyena Bomber, Vulture Droid, Sun Fac SF, Soldier SF, Spy SF",1
"Darkside Dad",0,1,91188,Geonosians,"zzGBA Sun Fac, Geo Soldier, Geo Spy, Poggle",1
"Darkside Dad",0,1,110984,Grievous,"zzGG zB2 zB1 MagnaGuard zNute",1
"Darkside Dad",,,129710,Disintegration,"Aurra zzGreef Boba zzBossk zzThe Mandalorian",1
"Darkside Dad",1,1,117900,Revan,"zzzJKR zBS zGMY zJolee GK",1
"Darkside Dad",1,1,75391,Ewoks,"zChirpa G9, Elder Paploo Wicket Logray G9",1
"Darkside Dad",1,1,85540,Carth,"zCarth Onasi, zMission zZaalbar Juhani G9, Canderous",1
"Darkside Dad",0,1,124331,BH,"zzJango IG-88 zZam Dengar zNest",1
"Darkside Dad",1,1,112079,zEP,"zzEP zzzVader Tarkin DT TFP",1
"Darkside Dad",0,1,68332,Phoenix,"Hera G8, Ezra Zeb G8, Chopper G9, Kanan G8",1
"Darkside Dad",1,0,10942,SionSolo (Counter),"Sion G8",1
"Darkside Dad",,,64848,Phasma,"Phasma G8, FOTP FOO G8, zKRU G9, Kylo G9",0
"Darkside Dad",1,1,101621,JTR,"JTR Scav Rey G9, BB-8 zR2-D2 Finn G8",0
"Darkside Dad",1,1,50051,NS,"MT 5* G7, AV G7, Daka G7, Zombie Spirit G7",0
"Darkside Dad",,,97659,Mon Mothma,"Mon Mothma, Biggs Wedge Cara Dune G9, Lando",0
"OnyXavier",0,1,115482,DRMalak,"zzzDR HK-47 zBSF zzMalak Sith Marauder",1
"OnyXavier",0,1,89854,Geonosians,"zGBA Sun Fac, Geo Soldier, Geo Spy, Poggle",1
"OnyXavier",1,1,102379,Revan,"zzzJKR BS zGMY zJolee GK G8",1
"OnyXavier",1,0,97617,CLS,"zzCLS zHan zChewbacca Thrawn C-3PO",1
"OnyXavier",1,1,77258,Ewoks,"zChirpa Elder Paploo G9, Wicket Logray G9",1
"OnyXavier",1,1,82459,Carth,"Carth Onasi, Mission Zaalbar Juhani G8, Canderous",1
"OnyXavier",0,1,83323,BH,"zBossk The Mandalorian, Jango Boba Dengar G8",1
"OnyXavier",1,1,94858,zEP,"zEP zzVader Tarkin TFP G8, zMara Jade, The Emperor's Hand",1
"OnyXavier",0,1,64806,Phoenix,"Hera G9, Ezra Zeb G8, Chopper G8, Kanan G8",1
"OnyXavier",,,65068,Phasma,"Phasma G9, FOE 6* FOO KRU Kylo 6* G9",0
"OnyXavier",,,270212,HansMF,"Home One 6*, Han's MF 6*, HT Ghost Phantom Biggs X-wing, Cassian's U-wing, Wedge X-wing",0
"OnyXavier",,,50896,Mon Mothma,"Mon Mothma 4* G8, Kyle Katarn 5*, Hoth Rebel Scout G8, Biggs G8, Cara Dune G8",0
"OnyXavier",1,1,36558,NS_Alt,"MT 5* G8, AV 5* G8, Daka G8, Talia 5* G8, Spirit 5* G8",0
"OnyXavier",1,0,47833,501st,"Rex G8, Clone Sergeant G8, Echo (501st) 5* G8, Fives G8, Ahsoka G8",0
"OnyXavier",,,69788,Mando,"The Mandalorian (Beskar Armor) G8, Dash Rendar, Nest 6* G9, IG-11 G8, Kuiil G8",0
"OnyXavier",1,1,34087,Rogue1,"Jyn 5* G8, Chirrut 5* G8, Baze 5* G8, Cassian 5* G8, K-2SO 5* G8",0
"OnyXavier",1,0,8077,SionSolo (Counter),"Sion G7",0
"Kate",,,120514,Phasma,"zPhasma zFOTP FOSFTP zFOST zKylo",1
"Kate",0,1,89759,Geonosians,"zGBA Sun Fac, Geo Soldier, Geo Spy, Poggle",1
"Kate",1,1,92874,Revan,"zzJKR BS GMY zJolee GK G9",1
"Kate",0,1,86639,BH,"zBossk The Mandalorian, Jango Boba Greef",1
"Kate",1,0,72924,501st,"Rex ARC Trooper, Echo (501st), Fives Ahsoka",1
"Kate",0,1,70670,Phoenix,"Hera G9, Ezra Zeb G9, Chopper G9, Kanan G8",1
"Kate",1,0,90470,CLS,"zCLS zHan Chewbacca R2-D2 Chewpio",0
"Kate",,,238900,HansMF,"Home One 6*, Han's MF 6*, Rebel Y-wing, Bistan's U-wing, Phantom Ghost Cassian's U-wing 6*, Wedge X-wing",0
"Kate",1,1,94674,zEP,"zEP zzVader Tarkin G7, zSith Trooper, Mara Jade, The Emperor's Hand",0
"Kate",1,0,72724,Troopers,"Veers Starck Piett 6* Dark Trooper 6* G9, Gideon G9",0
"WilsonJason",0,1,134167,DRMalak,"zzzDR HK-47 zBSF zzMalak Sith Empire Trooper",1
"WilsonJason",0,1,138730,padme,"zzPadme zGK zJKA zAhsoka zzC-3PO",1
"WilsonJason",1,0,118893,CLS,"zzzCLS zHan zzChewbacca R2-D2 Chewpio",1
"WilsonJason",,,358417,HansMF,"Home One, Han's MF, Rebel Y-wing 6*, Bistan's U-wing, Phantom Ghost Cassian's U-wing, Biggs X-wing",1
"WilsonJason",,,429835,Negotiator,"Negotiator 5* HT Anakin's Eta-2, Umbaran SF, Ahsoka's SF, Clone Sergeant's ARC-170, Plo's SF, Rex's ARC-170",1
"WilsonJason",0,1,91118,Geonosians,"zGBA Sun Fac, Geo Soldier, Geo Spy, Poggle",1
"WilsonJason",1,0,127925,Traya,"zzTraya DN zSion zzEP zThrawn",1
"WilsonJason",1,1,137529,Revan Offense,"zzzJKR zGMY zBS zJolee HYoda",1
"WilsonJason",1,1,75499,Ewoks,"zChirpa G9, Elder Paploo Wicket Logray",1
"WilsonJason",1,1,83484,Carth,"zCarth Onasi, zMission zZaalbar zJuhani Canderous G8",1
"WilsonJason",0,1,115447,BH,"zzBossk zIG-88 zJango zZam zBoba",1
"WilsonJason",0,1,103850,FO,"zzKRU Kylo zFOST zHux FOE G9",1
"WilsonJason",0,1,66326,Phoenix,"Hera G8, Ezra Zeb G8, Sabine G8, Kanan G8",1
"WilsonJason",1,0,15760,NestSolo (Counter),"Nest",1
"WilsonJason",1,1,89842,NS,"zMT zzAV Daka Zombie Spirit G9",0
"WilsonJason",0,1,71996,Grievous,"GG G9, B2 zB1 Droideka G8, MagnaGuard G8",0
"WilsonJason",,,333027,Executrix,"Executrix Tie Adv, Emperor's Shuttle 6*, TIE Reaper 6*, Imperial TIE Fighter, Gauntlet Starfighter 5*, FOSF TIE Fighter 6*, FO TIE Fighter",0
"WilsonJason",1,0,67742,Troopers,"Veers zPiett G9, Gideon 4* G8, Dark Trooper G9, Range Trooper G9",0
"WilsonJason",1,0,75000,ShaakClones,"Shaak Ti, Rex Echo (501st) G9, Fives G9, ARC Trooper G8",0
"WilsonJason",,,60119,Iden Troopers,"zIden Versio 5*, Shoretrooper G8, Snowtrooper G8, Magma G8, DT 5* G8",0
"WilsonJason",1,1,51783,Rogue1,"Jyn G8, Chirrut G8, Baze 6* G8, Cassian G8, K-2SO G8",0
"Coop",1,0,140816,CLS,"zzzCLS zHan zzChewbacca C-3PO zChewpio",1
"Coop",,,348621,HansMF,"Home One, Han's MF, Rebel Y-wing 6*, Ghost Phantom Biggs X-wing, Cassian's U-wing, Wedge X-wing",1
"Coop",0,1,96261,Geonosians,"zzGBA Sun Fac, Geo Soldier, Geo Spy, Poggle",1
"Coop",,,97916,Mon Mothma,"Mon Mothma, Biggs Wedge Cara Dune, Lando",1
"Coop",1,1,110986,Revan,"zzzJKR BS GMY zJolee zGK",1
"Coop",1,1,87239,Ewoks,"zChirpa G9, Elder Paploo zWicket zLogray",1
"Coop",1,1,97027,Carth,"zCarth Onasi, zMission zZaalbar zJuhani zCanderous",1
"Coop",0,1,89617,BH,"zBossk The Mandalorian, Jango Boba Greef",1
"Coop",0,1,68943,Phoenix,"Hera G9, Ezra Zeb G9, Chopper G9, Kanan G9",1
"Coop",,,57256,Phasma,"Phasma G8, FOTP G9, FOSFTP G6, FOST 4* G9, Kylo",0
